ISBN13,rating,review
9791186596210,10,지적유희라는게 뭔지를 보여주는 잡지어려운 부분도 있었지만 그것 또한 재미가 아닌가다음 주제는 문학이라는데 벌써 기대1년 구독을 가감없이 하게 해주는 잡지읽는 내가 뭔가 있어보이는건 덤서울리뷰오브북스 잡지도 잘 나왔으면 좋겠다
9791186596210,10,"진짜 읽을 만한 잡지가 오랜만에 나왔다. 르몽드 디플로마티크 오랜 구독자였다가 국내 필진(특히 이택광)이 너무 마음에 안들어서 구독 끊었는데, 이런 잡지를 내주다니, 대환영. 1차 독자북펀딩에 참여 못해 아쉬웠는데, 2차부터는 믿고 북펀딩참여. 정기구독도 신청했다. 내용&편집&필자 완벽."
9791186596210,10,완전 좋아요. 내용도 풍부하고 일러스트레이션도 너무 좋아서 아껴 읽고 있어요. 이 가을 지적 사색을 하고싶은 모든 분에게 강추입니다.
9791186596210,10,시중에 있는 예술잡지 중에서 가장 심도있는 것 같네요. 어려운 내용들이 소화할 수 있는 분량으로 담겨 있어 읽는데 부담스럽지 않았습니다. 세계 지성들의 생각을 한국어로 접할 수 있어서 즐거웠습니다. 다음에 나올 마니에르 드 부아르 vol.2도 기대가 됩니다!
9791186596210,10,르몽드 디프로마트크를 자주 구입해 보고 있었는데 마니에르는 소식을 너무 늦게 알게 되어서 독자 북펀딩에 참여하지 못한것이 너무 아쉽네요.그래도 책을 받고 보니 종이 질도 좋고 가독섣도 최상이고 무엇보다 내용이 정말 알차서 앞으로도 기대가 크게 되는 잡지 입니다.벌써부터 다음권을 기대중!
9772384367000,10,"커버 스토리가 ‘김애란‘이란 것만으로도 충분한 호라고 생각했는데, 안에 담긴 각 코너들이 또 한 번 구매를 확신하게 했어요. 새로운 이름들도 보이고 점점 더 보고 읽을거리가 많아지는 잡지라 읽는 재미가 커요."
9772384367000,10,"괴로워하던 시기에 김애란 책을 읽었다.많이 위로 받았고, 많이 괴로워했다.그의 얼굴과 글이 실린 이번 악스트는 조금 더 특별할 것 같다."
9791186596234,10,계간지 종류로는 제가 유일하게 구매하는 잡지가 바로 ˝마니에드 드 부아르˝ 입니다.월간지 역시 시사 교양 분야에서는 역시 ˝르몽드 디플로마티크˝를 매달 구매하고 있습니다.폭넗은 시간에 진보.좌파적인 잡지면서 절제된 구성에 품위있고 깊이있는 내용구성이 일품인 잡지입니다.
9791186596234,10,1호도 좋았는데 2호는 더 좋아요~ 읽으면서 작품 이미지도 감상할수 있으니 금상첨화네요. 세상은 넓고 탐구할 지적 세계의 깊이도 무한대같아요. 한번 읽고 또 읽고~ 자꾸 반복해서 읽다보면 또 다른 세계가 펼쳐질 것 같아요. 다음 호 기다립니다~
9791186596234,10,"1호보다 더 좋은 2호! 문학이 주제라 완전 즐겁게 읽고 있다. 책 받자마자 ‘페미니즘과 SF를 융합한 휴머니스트, 어슐러 르 귄‘ 꼭지부터 읽었다. 아, 너무 좋아. ˝셰익스피어는 진짜 존재했을까˝? 다 읽고 알려드리겠음! 나딘 고디머, 자크 루보 글도 기대된다. 이 고급진 잡지 저처럼 정기구독하세요"
9791186596234,10,오랫동안 기다렸던 책인데 마침 서점에 있어서 구매했어요. 알라딘에도 올라와있네요..?1호도 정독했었지만 2호에 실린 이미지들도 정말 너무 좋네요..오늘부터 날씨가 너무 추워지던데 집에서 따듯하게 잘 읽겠습니다.벌써 3호도 기대되네요ㅎㅎ
9791186596234,10,"기다렸던 마니에르ㅠㅠㅠ엉엉 드디어 나오네ㅠㅠ이미 구매했지만 괜히 반갑..ㅎㅎ 배송오기만 기다립니다ㅠㅠ 마니에르는 내용도 탄탄하고, 책장에 꽂아놓으면 멋스럽고 좋다"
9791186596234,10,"모처럼 만에 찾은 서점에서,  책갈피를 넘겨보면서 일순간 자유를 느낄수 있어 좋았다. 아는 작가는 반가웠고, 모르는 작가는 미지의 세계를 만난듯 호기심을 자아냈다. 문학의 세계에 발을 들이는 듯한 느낌이 들었다.  코로나로 답답했던 내면에 모처럼만에 햇살이 비치는 것 같았다."
9772384289005,10,"여러 나라의 추리소설을 읽다 보면 그 나라의 경찰 조직이 어떻게 구성되어 있는지 잘 몰라 아쉬웠는데, 이번 호수에 소사전 형태로 알기 쉽게 정리해주셔서 정말 좋았어요!"
9772384289005,10,재밌습니다.^^
9788937491436,10,‘동물‘글씨가 꿈틀꿈들 동물이 움직이는 것 같다. 검은 고양이의 굽은 등 같기도 하고. 하하하.
9788937491436,10,"항상 느끼는 거지만, 민음사에서 나오는 잡지들은 만듦새가 뛰어나다. 표지도, 그리고 내용도. 그저 손에 들고 있는 것만으로도 행복해진다."
9772005322005,8,신문판형으로 발매되는 마지막 르몽드호입니다.다음달 부터는 일반적인 잡지책의 형태로 판형이 변경됩니다.거기다 가격도 같이 변하네요ㅠㅠ.하지만 그럼에도 불구하고 전 구입을 계속하겠죠.국제적인 시각을 길러줄수 있고 나름 균형잡인 제가 보기에 거의 유일한 시사 잡지입니다.다음호를 기대중!
9772005322005,10,"우리 완전소중 르디가 아니라 알라딘 양탄자배송 좀 까야겠네요. 양탄자가 IS의 바추카포맞고 추락한듯. 소년 이등병 알라딘 사망했는지 3일째 소식이 없음. ˝잠들기전에˝ 배송원칙이 고이 영면하기전에 배송인지? 성일권 발행인님,그리고 인치용 선생님 파이팅입니다. 다음달이 벌써 기다려지네요."
9772384289005,10,"여러 나라의 추리소설을 읽다 보면 그 나라의 경찰 조직이 어떻게 구성되어 있는지 잘 몰라 아쉬웠는데, 이번 호수에 소사전 형태로 알기 쉽게 정리해주셔서 정말 좋았어요!"
9772384289005,10,재밌습니다.^^
9788934989011,8,평이합니다. 디자인(그래픽 일러스트)에도 좀 신경을 썼으면. 무슨 90년대 후반 잡지인줄.
9788934989011,10,모르는 분야까지 쉽게 이해할 수 있는 인문학다음호 기대중!!
9788934989011,8,"독특한편집과  심오한 질문에대한 다양한 관점 모두 맘에들지만,  프롤로그와 정여울작가의 은색바탕흰글자의 조합은  글이 잘보이지않아 눈에 피로도가상당히 높아서 좀 아쉽습니다"
9788934989011,4,내용은  좋지만   도대체  속 재질은  무슨생각으로  만들었는지 ㅠㅠㅠ  프롤로그와   정여울 작가의 은색 빤작이이는  도대체    책을  읽으라는건지   ..  뭔  심오한  철학적의미기  있는건지  당췌 알수가  없다.  다음엔  정말  보통  책  재질로  만들어주길...
9788934989011,8,김영사에서 새롭게 선보이는 ‘디지털시대 아날로그 지식교양잡지‘이다. 독특한 편집이다. 책을 읽던 중 또 뭐가 튀어나오려나 궁금하게 만든다. 창간호 주제는 질문중의 질문인 ˝나란 무엇인가?˝이다.
9788934989011,10,"나는 누구인가, 단순한 질문이지만 굉장히 깊은 고민이 필요한 철학적 질문이죠. 하지만 이 책은 깊은 고민을 반대로 가볍게 풀어서 무거운 질문의 짐을 덜고, 편히 사고할 수 있게 만들어줄 것 같다는 생각이 들어요."
9772733807003,10,오랜만에 처음부터 끝까지 완독했네요.
9772733807003,10,진짜 너무 좋은 문예지다. 처음부터 끝까지 빠뜨리기 싫은 좋은 글들의 향연이다. 특히 문지혁 작가의 글이 좋았다.
9772733807003,8,정명섭의 글을 제외한 모든 글의 밀도와 수준이 높다. 읽는 내내 즐거웠다.
9772733807003,8,픽션과 논픽션 그 중간지대의 글들도 모두 잘읽었습니다. 앞으로도 기대합니다.
9772733807003,10,"읽었던 이야기 중 가장 인상적이었던 것은역시 황정은 작가의 ‘기담‘이었다. 신혼부부가 낡은 빌라를 사면서 벌어지는 이야기다.내가 집에서 겪었던 감정들과 너무 비슷해서읽어내려가는 동안, 오랜만에 소설을 읽으면서맞아 나는 이런 이야기들을 좋아했어.이런 이야기를 하고 싶었어... 하며 반가웠다."
9772733807003,10,간결하고 시원한 편집이라 읽기 편한 문예지입니다. 기분에 따라 읽고싶은 단편을 읽어볼 수 있어 좋구요. 저는 남궁인 의사의 글이 좋았어요.
9772733807003,10,기대되는 잡지. 특히 논픽션에 대한 글이 다양하게 실렸으면 좋겠다.
9772733807003,10,아무리 생각해도 너무 좋은 기획입니다. 오래오래 잘 부탁드려요. 감사히 읽겠습니다.
9772733807003,8,기대됩니다
9772733807003,10,문예지가 새로 나왔네요!  어떤 내용이 담겨있을지 궁금해요
9772733807003,10,"각 섹션마다 디자인이 달라지고 글체, 여백, 크기가 달라져 여러 권의 책을 읽는 것 같은 착각을 하게 했다.에픽은 여러 장르들을 한 곳에 모아 놓은 종합선물세트 같은 느낌이다. 맛있는 걸 먼저 먹을지 나중에 먹을지 골라서 먹는 재미가 있듯이 에픽도 그런 재미가 있는 것 같다."
9772733807003,8,"논픽션, 픽션과 논픽션이 섞여있는 글, 1 1리뷰, 픽션, 만화까지 다양한 장르의 글들이 수록되어 있는 잡지라원하는 장르의글을 골라읽는 재미가 있습니다."
9788937490927,4,생각했던 것보다 책이 작아서 놀랐다.  시도는 좋은데 내용이 부실하다. 그리고 표지 좀 신경써주시면 안될까요? 인문잡지라 그런지 너무 인문스럽잖아용?
9788937490927,4,˝새로운 시대에 새로운 스타일의 인문 잡지˝라고 거창하게 얘기하기엔 아쉬운 글과 유기성.그래도 갈수록 나아지리라 믿는다.
9788937490927,8,이런 시도 자체는 괜찮으나 글마다 편차가 약간 있다. 개인적으로 어떤 글은 혐오집단의 변명을 담고 있는 것처럼 느껴져 읽으면서 불쾌함을 지울 수 없었다. 가장 좋았던 글은 <밀레니얼에게 가족이란>.
9788937490927,10,한손에 들고 읽기 좋은 사이즈와 무게에 젊은 저자들의 생각을 읽을 수 있어 좋았다. 20대도 많던데 모두 글을 잘 쓰시고 세대 문제에 대한 생각도 깊은 것 같다. 어렵게 무슨말인지도 이해 못하게 쓰는 논평보다 훨씬 낫다.
9788937490927,8,흥미롭고 인문사회적 시선이 가득담긴 세련된 주제들. 잡지라는 취지에 맞게 하루 한두편씩 가볍게 읽기 좋다. 정기구독으로 글을 받아봐도 괜찮겠다!
9788937490927,6,"시도는 좋으나 대부분의 글 함량은 기대 이하. 분량만의 문제는 아니고, 그저 청탁에서 그치는 게 아니라 좀더 편집 미 기획이 가미되어야 할 듯."
9788937490927,10,"사회학, 정치학, 문학, 철학 등 다양한 분야를 망라해 사회과학 전공자로서도 흥미롭게 읽었습니다. 현실 사회 문제를 바라보는 새로운 관점을 제시해줘서 유익했습니다."
9788937490927,8,최근 다양한 장르의 무크지 형식의 잡지들이 계속 창간되고 있다. 광고를 없애거나 관련분야로 최소화하고 전문성을 담보한 교양지의 출간은 항상 기대되고 반가운 일이다. '인문학의 가장 밑바닥에는 언어 사랑이 있다.'라는 철학입문서의 의견을 끌어왔노라고 출사표를 내건 인문잡지 한편 개시!
9788937490927,8,"시의성 있는 주제들을 놓치지 않고 알 수 있다는 장점과 그럼에도 불구하고 애초의 형식 때문에 오는 깊이의 아쉬움은 있다. 페미니즘 세대(박동수), 20대 남자 문제(이우창), <벌새> 독해(이나라), 기후위기(정혜선)에 대한 글들이 특히 괜찮았다."
9788937490927,10,정말 읽고 싶은 책입니다 제발 전자책으로도 발간해주세요 ㅠㅠ...
9788937490927,6,구매자 리뷰가 어떻게 한 개도 없누
9788937490927,10,"우리가 읽어야 할 인문교양잡지, 한편. 콤팩트한 사이즈, 그러나 내용은 알차게 꾸며졌다."
9788937490927,10,10대 딸아이와 같이 읽었습니다.세대를 아우르는 이슈를 가지고 다양한 목소리를 들을 수 있어서 좋았습니다.창간호의 주제가 앞으로의 방향성을 보여주는 것 같아 다음 호들도 기대됩니다.이런 인문잡지를 기다렸어요.
9788937490927,10,"연령적으로 또 연구주제, 방법론적으로 다양한 필진 구성을 하려고 애쓴 게 보이네요. 좋은 구성이고, 그래서 다양하면서도 수준있는 이야기들을 접할 수 있었습니다."
9788937490927,10,"컨셉도 좋지만 처음 지정한 테마가 아주 마음에 듭니다! 세대갈등이 심화된 지금, 민감한 주제지만 용감하게 다루어줘서 참 유익합니다! 정답을 떠나 생각거리를 던져준 ‘한편‘, 앞으로도 기대하겠습니다!"
9788937490927,10,"시대의 현상과 흐름이 담겨 있고, 재미와 유익 모두 잡았다. 이런건 정기구독!!"
9788937490927,10,"읽다 보니 ‘책보다 짧고 논문보다 쉽다‘는 카피가 와닿습니다. 더 딱딱한 글은 안 읽게 되고, 가벼운 SNS 글에서는 왠지 헛헛함을 느꼈는데, 절묘한 자리에 한편의 글들이 있는 것 같아요. 다음 책도 기대할게요."
9788937490927,10,교양서 보다는 무겁고 학술서 보다는 가벼운 이런 책을 얼마나 기다려왔는지. 문사철 졸업자들의 갈증을 해소해줄 책.
9788937490927,10,사이즈가 작아서 가방에 쏙 넣을 수 있는 게 맘에 들어요. 천천히 읽어볼 만한 주제인 듯...
9788937490927,10,책 받고 나서 한두 꼭지씩 읽다 보니 어느새 다 읽어버림. 4개월마다 한 호씩 나온다고 하니 왠지 감질맛 난다.ㅠㅠㅠㅠㅠ
9788937490927,10,기후변화 같은 환경 문제에 무심한 한국 사회에 정혜선의 글은 시사하는 바가 크다.
9788937490927,10,깊이와 재미 사이
9788937490927,10,"아래 댓글의 세대 규정에 대한 문제의식은 <청년팔이의 시대> 를 읽어보시면 좋을 것 같습니다. ˝세대주의는 교묘하게 계산된 이데올로라기보다는 오히려 너무 일상적으로 편재해 있는, 대다수 사회 성원들이 공유하고 있는 상상에 가깝다.˝ --- <한편 1호 - 청년팔이의 시대> 중에서"
9788937490927,10,지금 이 시대를 들여다볼 수 있는 책이어서 좋습니다. 인문학에 관심이 없었던 분들도 쉽게 접근할 수 있을 것 같아요.
9788937490927,2,"동의받기 어려워보인다. 왜냐하면 참여자들의 특권의식 때문이다. 특정한 세대라고 자신들을 규정하는 순간 그와 다른 세대들은 이 규정 밖에 놓이므로 그것은 또다른 배타이다. 그것은 위에서 아래로 내려다보는 수직적 시선이며, 이러한 시선은 결코 동의받지 못함은 물론 차별하면서 동시에 차별받"
9791163641582,10,표지 디자인이 뭔가 다음 레벨로 바뀐 느낌! 이번 필진도 정말 우람하네요=)
9771227003006,10,월간 샘터가 특별한 이유는 일반인들의 이야기도 많기 때문입니다.각 호의 특집란과 행복일기 등 독자들이 투고한글들로 채워져 있습니다
9788937491412,8,읽고 나면 각 주제에 관한 책들을 찾아보게 만든다
9788937491412,8,솔직히 아직 어렵다. 통찰과 상상력 향상을 위해 구독을 했는데 쉽사리 손이 잘 가지 않는다. 해를 넘기지 말자는 의지로 간신히 완독은 했는데 당최 무슨 말인지 모르겠다.  부족한 문해력을 탓할 수 밖에. 그럼에도 현 시대에 깊이 사고할만한 주제를 상기해 주는 것에 감사하며 계속 읽어 나가련다.
9788937491412,8,"기획이 멋집니다.학술서적이나 논문은 엄밀성을 지키려  빠르게 변화하는 .. 상황에 뒷쳐지는 면이 있는데..한편은 .. 세대, 인플루언서, 환상  세권 모두 시대 상황에  깊이 생각해볼만한 주제를 잘 캐치해서 써주신것 같습니다."
9788937491412,10,신기한 잡지
9772733807003,10,오랜만에 처음부터 끝까지 완독했네요.
9772733807003,10,진짜 너무 좋은 문예지다. 처음부터 끝까지 빠뜨리기 싫은 좋은 글들의 향연이다. 특히 문지혁 작가의 글이 좋았다.
9772733807003,8,정명섭의 글을 제외한 모든 글의 밀도와 수준이 높다. 읽는 내내 즐거웠다.
9772733807003,8,픽션과 논픽션 그 중간지대의 글들도 모두 잘읽었습니다. 앞으로도 기대합니다.
9772733807003,10,"읽었던 이야기 중 가장 인상적이었던 것은역시 황정은 작가의 ‘기담‘이었다. 신혼부부가 낡은 빌라를 사면서 벌어지는 이야기다.내가 집에서 겪었던 감정들과 너무 비슷해서읽어내려가는 동안, 오랜만에 소설을 읽으면서맞아 나는 이런 이야기들을 좋아했어.이런 이야기를 하고 싶었어... 하며 반가웠다."
9772733807003,10,간결하고 시원한 편집이라 읽기 편한 문예지입니다. 기분에 따라 읽고싶은 단편을 읽어볼 수 있어 좋구요. 저는 남궁인 의사의 글이 좋았어요.
9772733807003,10,기대되는 잡지. 특히 논픽션에 대한 글이 다양하게 실렸으면 좋겠다.
9772733807003,10,아무리 생각해도 너무 좋은 기획입니다. 오래오래 잘 부탁드려요. 감사히 읽겠습니다.
9772733807003,8,기대됩니다
9772733807003,10,문예지가 새로 나왔네요!  어떤 내용이 담겨있을지 궁금해요
9772733807003,10,"각 섹션마다 디자인이 달라지고 글체, 여백, 크기가 달라져 여러 권의 책을 읽는 것 같은 착각을 하게 했다.에픽은 여러 장르들을 한 곳에 모아 놓은 종합선물세트 같은 느낌이다. 맛있는 걸 먼저 먹을지 나중에 먹을지 골라서 먹는 재미가 있듯이 에픽도 그런 재미가 있는 것 같다."
9772733807003,8,"논픽션, 픽션과 논픽션이 섞여있는 글, 1 1리뷰, 픽션, 만화까지 다양한 장르의 글들이 수록되어 있는 잡지라원하는 장르의글을 골라읽는 재미가 있습니다."
9772384367000,10,"커버 스토리가 ‘김애란‘이란 것만으로도 충분한 호라고 생각했는데, 안에 담긴 각 코너들이 또 한 번 구매를 확신하게 했어요. 새로운 이름들도 보이고 점점 더 보고 읽을거리가 많아지는 잡지라 읽는 재미가 커요."
9772384367000,10,"괴로워하던 시기에 김애란 책을 읽었다.많이 위로 받았고, 많이 괴로워했다.그의 얼굴과 글이 실린 이번 악스트는 조금 더 특별할 것 같다."
9788937469039,10,강보원씨 글 읽어봐요. 좋은 글입니다.
9788937469039,10,"최근에 루카치 번역서가 많이 발간되었고 루카치를 다시 읽고자 하는 노력도 일고 있는데, 리얼리즘과 재현을 주제로 택했으면서 루카치를 다시 읽고자 하는 시도는 없고, 절반을 체현과 수행성 문제로 할애할 거면 주제를 수행성으로 선정하고 주디스 버틀러나 어빙 고프먼을 다시 읽는 편이 낫다."
9788937491337,10,지적 자극과 잡지의 즐거움이 통통 튄다.
9788937491337,10,세대 편보다 내용이 풍부하다. 어린이의 유튜브 경험과 2500년전의 인플루언서들을 함께 볼 수 있는 잡지가 있어 다행이다.
9788937491337,6,글을 쉽게 쓴 사람이 어째서 한명도 없나.
9788950984526,10,"제목에서 드러나듯 SF에 충실하다. SF 소설과 영화를 리뷰하고, SF 작가를 인터뷰하고, SF 소설을 실었다. 좋아하는 작가들이 여럿 참여한 소설도, 좋아하는 작가를 인터뷰한 것도, 칼럼도 재밌게 읽었다."
9788950984526,10,라인업 대박. 2호 언제나오나요?
9788950984526,6,이 시리즈만 따라가도 sf에 대한 시야가 넓어질거 같다. 초보 sf 독자로 맞이하기 좋은 책.
9788950984526,8,"뒤늦은 평이라 내용에 대한 것은 생략하고(‘인지공간’ 소름 돋게 최고! 2권을 기다린다는 말로 대신하고), 검정 지면은 제발 재고해 주시길. 눈도 피로하고, 잉크 때문인지 아직도 냄새가 ㅠㅠ 환경에도 좋을 리 없을 것 같다 ㅠㅠ"
9788950984526,8,편집과 만듦새 예쁘고. 각기 다른 맛 단편들 좋고. 사랑스러운 노력들 감동스럽고.
9788950984526,6,수록된 소설의 수준이 고른 것에 비해 칼럼이나 비평의 질은 편차가 크다. 잡지 이름처럼 오늘의 sf 현실을 보여주는 것 같아서 안타까웠다. (정보라 작가 에세이는 최고)
9788950984526,4,"SF라면 척추반사처럼 장바구니에 담고 보는 사람이라 필진도 안 보고 바로 샀는데 실망스럽다. 글 좀 쓴다는 사람이 블로그에 끼적거린 수준의 글이 대다수. 좀 더 진취적인 상상력, 유려한 글을 기대해선 안됐던걸까... 창간호에 과한 기대일 수도 있겠지만, 애쓴 창간호가 이거라면 앞으론 기대 안됨"
9788950984526,10,"SF에 대한 관심이 요즘 부쩍 많아졌다. 2호가 언제 나오나 기다려진다. 비정기간행물이라 안나올수도 있겠지만, SF발전을 위해서라도 나오는게 좋겠다. 다양한 문학의 발전은  작가가 발표할 수 있는 지면이 있어야한다."
9788950984526,8,행복한책읽기의 과학소설 무크 ‘Happy SF‘는 단 2회 출간하고 개점휴업상태. 이 책은 과연...
9788950984526,10,지금은 ‘한국 SF의 르네상스‘라고 말할 수 있을까? (그런데 ‘르네상스‘를 이야기하려면 그 이전의 ‘리즈 시절‘이 있어야 한다. 써놓고 보니 부당전제다.) 그럼에도 오랜만에 보는 SF 전문지가 반가울 따름이다.
9788950984526,10,최근 SF작품을 꾸준히 출간하고 있는 arte다운 잡지. 국내 SF작품은 배명훈 작가의 '고고심령학'이나 여러작가의 단편 모음집 정도를 읽었고 주로 외국작가의 고전SF물이나 유명작가의 작품만 읽어왔는데 이 잡지를 통해 국내작가의 작품에 새롭게 눈뜨는 계기가 될 것 같다.
9788950993023,6,책 속 배명훈 작가의 단편 <임시조종사>. 통신사 광고음악으로도 선보인 <이날치밴드>의 국악 판소리로 들으면 최고의 콜라보가 될 듯. 판소리를 글로 읽으려니 아무래도 제 맛이 안난다랄까.
9788950993023,10,"1990년대에 KINO 모았던 책장처럼, 2020년대에는 오늘의 SF 꽂히는 책장"
9788950993023,8,"창간호, 2호 둘 다 사서 재밌게 잘 읽었는데 편집 디자인만 제발 좀 바꿔주세요. 특히 좌측정렬과 글자체, 자간 같은 것들은 읽는 사람을 고려해서 디자인한 건지 의심스럽기까지 합니다. 잡지이긴 하지만 인터뷰든 소설이든 이미지보다는 텍스트 위주의 책인데 가독성이 너무 떨어져요."
9788950993023,6,"창간호보다 나아졌음에도 논픽션이 아쉽다. 용비어천가가 된 듀나론, SF에 대해 별로 할말이 없는 민규동 인터뷰, 단답형 문답지가 된 김창규 인터뷰. 백미인 픽션은 다 좋지만, 그중에서도 홀로 익살떨기에 집중하고 있는 배명훈이 특이할만 하다. 다음 호가 벌써 기대된다!"
9788950993023,10,각자의 방식대로 들려주는 새로운 sf의 이야기가 강렬하다. 먼저 1호에 이어 2호를 읽게 되어 기쁘다. 코로나 때문에 이동이 자유롭지 못한 지금 다양한 분야의 글이 실린 잡지가 흥미롭다. 재밌거나 슬프거나 둘 중 하나만으로 보고 싶은 욕구가 생긴다. SF를 창작한 사람들로부터 이야기를 듣게 되어 친근하다.
9788950993023,8,"구성이 좀 특이 하다면 특이하고 신선하다면신선한 느낌이다.SF잡지를 책으로 만들어진 책인데,국내유일의 SF무크지?! 이다. 책은 인트로,에세이,인터뷰, 신작SF 등등 여러가지 목차가 있다. 대부분 나는 모르는 작가들이어서 어떻게 써내려 갔을지 한사람 한사람마다의 분위기를 파악하는것은 재미있었다."
9788950993023,8,한 편 한 편이 넘넘 매럭적인 sf단편소설들의 향연
9791163641353,10,8호도 너무 예쁘고 알차네요~
9791163641353,10,벌써 일주년호라니!
9791163641162,10,혹시 전자책 발간 계획은 없으신가요? 전자책으로 발간됐으면 정말 좋겠습니다 기다리고 있을게요ㅠㅠ
9791163641162,10,아...색감보소
9791163641162,10,키워드 리스트를 받아놓고 기다리고픈 잡지로세
9772384289005,10,"여러 나라의 추리소설을 읽다 보면 그 나라의 경찰 조직이 어떻게 구성되어 있는지 잘 몰라 아쉬웠는데, 이번 호수에 소사전 형태로 알기 쉽게 정리해주셔서 정말 좋았어요!"
9772384289005,10,재밌습니다.^^
9791163640981,10,5호 언제 나오나여? 이거 필진 어떻게 다 섭외한 걸까여.............대박...
9791163640981,10,4호도 넘 즐겁게 읽었어요! 5호 기다립니다~
9791163640981,10,4호 언제 나오나 기다렸는데 나온 거 보고 허버허버 장바구니에 넣음 ㅠㅠ 이번에 최애 시인 이제니 시인까지 있어서 넘 기대되는데 표지는 액자에 넣어 두고 싶다
9791163640981,10,표지 필진 이번에도 역시 역대급
