ISBN13,rating,review
9772636147022,10,"여자친구 예린 화보에서 처음 보는 매력이 폴폴폴!! 역대급 화보가 나온 듯!! 운동 관련 기사가 많아 늘 큰 도움 받았는데, 영양과 식단 관련 정보도 다양해 읽을거리가 풍부하네요. 모처럼 사도 또 사도 아깝지 않은 잡지. 부록도 늘 최고라 절로 구매하게 되는데 미스트도 좋네요. 늘 끼고 삽니다"
9791188311736,10,집에 대한 이야기는 늘 궁금해요. 여러 집을 세 개 카테고리로 나누어 읽어볼 수 있어 좋았답니다!! 무엇보다 잡지의 얼굴인 표지가 진짜 멋있네요. 색감과 사진의 조화가 아름다워요. 언제나 믿고 보는 어라운드!
9772233889004,2,어제 주문했는데 상품엔 오늘(내일) 도착이라면서 배송조회하니 3/8일 도착 예정 염병
9791190460057,10,두 달이 지났네요. 이번 호도 예약구매합니다. 21세기 베스트 특별판이라니 기대가 큽니다.
9791190109024,10,"킨포크나 시리얼, iiin의 장점들을 합한 잡지다. 제일 좋은 점은 판형과 지질이다. 손에 착 감기고 목욕하며 읽기에도 부담없다. 단점은 일년에 한번 나온다는 것. 다음 호는 어느 고을일지 기대되고, 경주에 가고 싶어졌다."
9788991976115,8,방대한 자료가 가장 큰 장점...하지만 가끔 보이는 잘못된 정보가 옥의 티...
