ISBN13,rating,review
9791195704903,10,"윤내현 선생의 <중국의 원시시대>부터 애독자가 된 독자로선 한반도가 통일이 된 이후에는 모르겠지만, 현재까지 나온 고조선 관련 서적으로는 이만한 책이 또 있을까 싶다.  서양에서라면 분명 문제작이거나 명저 반열에 등록될 책이다. 모든 분들께 적극 권합니다."
9791195704903,10,곧 윤내현의 고조선연구(하)가 출간됩니다. 한국고대사에 관심 있는 분들에게는 일독의 가치가 충분한 책입니다.
9788998468835,10,진정한 학자는 사물이나 사안을 객관적으로 바라볼 줄 아는 사람이다.
9788998468835,2,책을 읽지는 않았는데 신문에 리뷰한 걸 보고 상당히 황당했다. 광개토대왕 업적비에 왜가 신라와 백제를 친 기록을 적었다고 결론을 내렸다는데... 참 내... 광개토왕의 업적을 적어도 모자는데 거기에 왜나라 찬양을 했다고? 이 사람도 노태돈씨처럼 식민사학자인가 아니면 내가 잘못  읽은 건가.
9788961873710,4,"결국, 일제의 비문 조작은 없었다는 중국-일본측 논리에 암묵적 동조를 보내는 것 같은데...."
9791185650906,10,참 의미있는 책이군요..
9791155855348,2,"수 많은 역사학자, 고고학 전문가 교수님들이 수십년을 연구해도 밝혀내지 못한 우리 민족의 장구한 참역사의 근원지를 생물교육과 나오신 일개 아마추어 역사동호인이 단 몇년의 독자연구로 밝혀내시다니, 정말 놀랍습니다 ㅋㅋㅋ"
9788958628002,8,조선시대보다 더 역동적이고 파란만장했던 고려시대를 조금이라도 알게되었고 더 많은 관심을 불러일으킨 책. 고려가 있었기에 조선이 있었고 대한민국도 있게 되었음을 새삼스럽게 느끼게 되었다.
9788958628002,10,역사교육은 정말 저자들이 어떻게 재미있게 가르치냐에 따라 사람들이 관심을 가질지 말지를 극명하게 보여주는 분야다. 통사류의 끝도 없는 암기과목이 될거냐 아니면 정말 흥미진진한 과거로의 탐험이 될거인지는 정말 역사저자들에게 달렸다. 이책은 그런면에서 정말 괜찮았다. 하루만에 완독했다.
9788958628002,6,너무 일반적이고 초보적인 내용이라서 좀 실망했음. 중앙일보의 중앙선데이 연재기사들 편집해서 책으로 출판했는데.. 고려사에서 관심가는 토픽을 1개씩 정해서 설명하는 입문자용 도서.
9791195326495,10,다른 책을 읽다가 주석에 있는 걸 보고 사서 읽었습니다. 너무 재미있어서 후속권도 샀습니다. 저는 역사전공자는 아닌데 일반인이 읽어도 쉽게 이해할 수 있도록 잘 설명되어 있습니다. 읽는 내내 이 책에 저자가 얼마나 애정을 가지고 공을 들여 썼는지 느낄 수 있었습니다. 올해 가장 잘 산 책!!
9791195326495,10,고조선 역사에 관한 알파와 오메가. 대단한 것은 실증적이고 날카로운 논증에 따르지만 어렵지 않고 쉽게 읽힌다는 점이다. 위대한 학자의 피와 땀이 고스란히 담겨 있다. 일독을 권한다
9791195326495,10,근대적 학문연구 방법론에 숙달된 논리적이고 총명한 사람들이 중국25사 지리지와 동이전 사료를 어느 정도 알고 있는 상태라면 윤내현교수만이 대한민국에서 유일하게 한국사를 연구하고 있다는 사실에 동의할 것이다.
9791195326495,10,이 책을 까고 싶으면 제발 다 읽어보고 까주기 바란다. 그리고 제발 근거를 가지고 논리정연한 방식으로 비판하기를 바란다. 이 책도 비판에 자유로울수는 없으나 지금처럼 무작정 까대는 현실은 정말 개탄스럽다.
9791195326495,10,"한국고대사 연구에 있어 강단사학의 최대 권위자는 노태돈이나 송호정 이런 것들이 아니라, 바로 <고조선연구>를 펴내신 윤내현 교수님이라고 생각합니다. 이 책을 통해 뿌리깊이 썩은 강단 식민사학의 적폐가 청산되기를 기원합니다."
9791195326495,10,"오, 드디어 재출간 되었군요. 윤내현 선생의 노고와 출판사에 고마움을 전합니다.방대하고 상세하면서도 문제 제기적인 문장이라서 술술 잘 읽힙니다.이 책이 많은 분들의 품에 안겨 사랑받기를 바라면서...!"
9791195326495,10,한국고대사는 이 책을 중심으로 다시 씌여져야한다. 현교과서는 다 구라다.
9791195326495,10,한국열국사연구도 내주시면 감사합니다~~
9791195326495,10,학자란 이래야합니다.
9791195326495,10,필독
9791185087078,8,언제부터 스케일이 이렇게 넓어졌는가. 역사적 사실의 반론제기
9791195307708,10,아파치는 아버지에서 유래... 우연히 YouTube 보고서 정말이지 신기하다 했다. 아메리카 원주민들은 옛날 알라스카쪽을 통해서 이주 정착한 정도로만 알았는데 남아메리카까지 우리와 너무 닮았다는게 놀라웠다.
9791195307708,10,고대부터 현대까지 제도권 역사의 근본은 허구라는 것을 깨닫지 못한 분은 책 제목만 봐도 뭔 소리?? 하겠죠.멕시코를 비롯 아메리카 대륙 원주민들의 조상은 우리의 조상과 하나의 문화공동체였다는 것을 다양한 근거와 분석을 통해 이야기해주는 책. 북미판 쓰신다고 했는데 계속 고대하는 중입니다
9791195307708,10,"풍부한 고대사, 언어학, 민속학적 사례들을 통하여 아메리카 원주민의 기원이 한민족에 닿아있다고 밝힌 한국 인류학의 기념비적 저작. 후속작이 기대되며, 영어, 스페인어로 빨리 번역되길 바랍니다."
9791195307708,8,아메리카 인디언과 우리민족의 연관성 주장한 글이라 하루 밤새에 읽었다 언어학과 관습으로 접근하여 공감은 가나 의문점 철기문화는 왜없고 바퀴 문화가 나타나지 않은데 설명이 없고 지배층이 아닌 백성들 위주로 갔다고 해도 3-7세기에 주로 갔다면 위 두문화와 한자가 있어야 이부문에는 무리가
9791195307708,10,남미 주민들의 기원에 관한 충격적 저작! 놀라운 주장이 넘쳐나는 책으로 후속작이 기대된다.
9791195307708,10,"인터넷에서 관련 특강을 보고 구하게 된 책이다.  거의 지구 반대편인 멕시코에서 우리네 문화와 유사한(거의 흡사한) 것들이 발견된다는 것이 신기했고, 그걸 문화인류학적으로 접근한 방식이 놀라웠다. 아직은 가설이겠지만, 충분히 음미해볼 만한 책이다. 유투브 강의도 찾아보시면 좋을 듯~~~"
9791195307708,2,우리나 중국이나 똑같네.... 중국의 동북공정이나 우리나라의 아메리카공정인가??? 멕시코인들은 우리민족의 후손이니깐...
9791195284207,10,한국 고대사의 진실을 밝힐 관건인 낙랑 문제에 관한 결정적 역작이다. 이제껏 소개되지 않은 여러 전거들이 담겨있어 관심 있는 독자들에게 일독을 권할만한 책이다.
9788956057446,8,조선전쟁 생중계 보다는 살짝 부실하단 느낌이에요. 사료 부족이 가장 큰 원인인듯.
9788976418449,10,"- 본인은 한문학과 전공 공부하는 참고서로 보는 중- 의역이 아닌, 원문을 최대한 해치지 않은 직역 위주로, 원문공부하다 이해가 가지 않는 구절을 볼 때 특히 도움됨- 책이 출판되기 이전까지의 삼국유사에 대한 연구 저서, 논문 등을 총망라하여 공부하는데 상당히 편리함"
9788992151559,10,한국사의 뒷 이야기를 알 수있는 책!
9788958626879,8,드라마를 통해 정도전이라는 인물을 굉장히 매력적으로 봤습니다. 역적의 누명을 썼지만 그가 왜 그렇게 할수밖에 없었는지 역사의 진실이 궁금하네요.
9788958626879,10,정도전에 대해 생각해보게 되는 책이네요
9788958626879,8,"사극 ｀용의 눈물｀로 정도전에 대한 관심도가 높아졌을 때 처음 나왔던 책이다. 그 때는 읽지 못 했다가 사극 ｀정도전｀을 본 후 읽게 되었는데, 드라마 내용과 이 책 내용의 차이를 살펴보는 재미가 쏠쏠했다. 그리고 정도전을 위인이 아닌 공과를 모두 가진 한 명의 인간으로 서술한 게 마음에 들었다."
9788958626879,10,정도전은 조선을 자신이 꿈꾸는 왕권과 신권이 조화를 이루는 나라로 만들고 싶어했습니다. 이방원과의 권력투쟁에서 패하여 역사뒤로 사라졌지만 조선의 건국에 큰 공헌을 했고 무엇보다 요동정벌에 대한 꿈을 잃지 않았죠. 중국에 사대를 하는 것만이 능사는 아니었으며 법치의를 표방했습니다.
9788958626879,10,몇 년전에 이 책을 읽었다. 국가는 허상이 아닌 실천적 가치 기준에 의하여 건립되어진다는 진리를 깨달았다. 역사는 돌고 도는 것이라고 했던가? 그렇다면 이제 세로운 세상이 나타날 것이다. 정도전과 같은 인물이 나타나면 말이다.
9788958626879,10,정도전이 인기가끌어서 급조된 책이라 생각했었는데 아니었습니다.조선 건국의 1등 공신이었으나 역적으로 몰려 그 업적마저 과소평가된 정도전역사에 만약에는 없지만 만약에를 생각해보게 되는 책입니다.
9788958626879,10,한 사람의 인생이 역사의 주요 전환기가 될 수 있다는 점에서 매력적이었다. 그 동안 제대로 알지 못한 정도전이란 인물에서 가슴 뛰는 우리를 돌아보게 한다. 새롭지 않은 새로운 역사를 바라보는 관점에 충분히 매료되었다.
9788958626879,10,정말 좋은 책이다 ㅋㅋㅋ. 정도전이라느느 인물에 대해 이보다 잘 쓴 책이 있을까 싶다. 정도전과 같은 인물이 600년전 사람이라니
9788958626879,8,최근에 그게 부각되는 정도전에 대하여 한참전에 조명하여 썼다는 것에 대해 작가에게 갈채를 보냅니다 조금 손 봐서 다시 낸 것이라고 하니 기대됩니다.
9788958626879,10,"이 책은 작년 드라마 ｀정도전｀의 유행에 맞춰 급히 나온 책이 아니다. 당시로서는 정도전에 대한 재평가의 인식이 미미했던 97년에 이미 출간되어 큰 관심을 받아온 책이다. 진중한 책이란 말이다. 책의 내용이 충실함은 물론이고, 한영우 교수의 <정도전>과 더불어 정도전 재평가에 큰 역할을 했다."
9788958626879,10,정도전에 대한 새로운 해석이 계속 나오는거 같아 이책도 기대됩니다
9788958626879,6,정도전에 대해 다시 생각하게 되었다
9788958626879,8,｀조선｀이라는 국가의 청사진을 제시한 정도전이라는 인물을 입체적으로 조망할 수 있는 책이었습니다.
9788958626879,4,드라마 정도전을 봤다면 굳이...
9788958626879,8,우리나라의 역사는 기득권층의 이익만 강조하던 썩엎빠진 양반의 역사만이 아니라 그 건국 이념을 주창한 정도전과 이성계의 마음속에는 평민들도 같이 잘 살아보자는 마음을 가지고 있었던 것을 알게 하여준 책입니다.
9788958626879,8,정치란 진실추구가 아니라(이건 언론이..) 성과추구가 아닐까 싶다. 이 또한 단기성과냐 장기성과냐에 따라 지지여부가 갈릴테지만... ｀天道無親｀이라는 문장이 유난히 기억에 남는다. 어떤 정치인을 기대해야 할지 참고가 되는 책이다.
9788958626879,8,kbs 정도전을 다시 복습하는 기분으로 읽은 책. 정도전 OST를 들으며 읽는 것을 추천
9788958626879,10,탐사 기자 출신답게 정도전의 일생을 낱낱이 분석하며 독자의 이해를 돕는 책.
9788958626879,10,정도전이 지금 이시대에 있었다면 무슨 생각을 했을까
9788958626879,10,"정도전을 통해, 열열한 민본사상을 엿 볼 수 있었다."
9788958626879,10,정도전. 잊혀진 인물이지만 이책으로 인해 다시 부활했으면.위인으로 재조명 받아 마땅하다.
9788958626879,10,역사 속에서 어떤 삶과 어떤 선택을 해야 하는 지.  이에 대한 성찰을 던져줄 수 있는 인물에 대한 새로운 형식의 평전.
9788958626879,10,꼭 드라마가 아니더라도 정도전에 관심을 가질 이유는 충분하다.
9788958626879,10,읽는 내내 흥미진진하다. 재미있는 영화를 한편 본 느낌.
9788958626879,10,아주아주 흥미롭습니다. 지금의 정치인은 어떠해야 하는지도 살펴볼 수 있군요.
9788958626879,10,"단순히 고려 망하고 세워진 나라 조선이 아니라, 조선 개국의 의미를 알게되었다. 우리 역사에 의미있는 건국/개혁가가 있었다는 걸 알았다. 조선을 더 알아보고싶게 만든 책."
9788958626879,10,"정도전열풍에 저도 합류.. 이유가 있겠죠? 열풍에는..? ㅎㅎ재미있게 읽을 수 있는 책입니다. 금방 다 봤어요. 다만, 제 생각에는 정도전에 대한 작가님의 애정과 시선이 많이 반영된 거 같다는..."
9788958626879,6,"역사 카테고리만큼 유행을 타는 분야가 있을까 싶지만, 적어도 이 즈음 ｀정도전의 부활｀은 조금은 의아스럽기도 하고 반갑기도 하고. 내가 알고 있는 정도전과 책 속에서 움직이는 정도전을 맞춰가는 재미가 있다랄까."
9788958626879,8,이 책으 저자가 혹시 알라딘 사장님?
9788993952537,6,막상 정도전에 대해선 많은 설명이 없다
9788993952537,6,우암 송시열은 중용을 주희와 달리 해석하는 백호 윤휴에게 ˝하늘이 공자에 이어서 주자를 낸 것은 진실로 만세의 도통을 위한 것˝이라면서 ˝주자가 모든 이치를 다 밝혀놓았으니 주자가 밝힌 것을 외우기만 하면 된다˝라고 말하며 그를 사문난적으로 몰았습니다.
9788993952537,10,이책을 읽고 다른 인식의 전환을 느꼇다.
9788993952537,10,흥미로운 주제다
9788993952537,2,역사에 관심이 많아서
9788993952537,10,"대하드라마 정도전을 보면서 같이 읽었던 책. 여말선초의 역사적 사실과 이성계, 정도전, 이방원 등의 역사적 행보를 재미있게 풀어내고 있다."
9788993952537,10,이시대에 꼭 필요한 역동적이며 진취적이며 의리있는 인간적 삶을 돌이켜보게한다.
9788993952537,10,"조선의 기초를 마련한 정도전의 생각, 위대한 생각"
9788993952537,10,대중적인 역사 서적
9788993952537,10,정도전에 대한 고찰...
9788993952537,10,정도전에 대한 재조명을 통해 역사를 가깝게 느끼게 해줬기에 즐거운 독서였습니다. 이덕일 샘의 힘있는 문장도 좋았습니다.
9788993952537,10,정도전이 꿈꾸는 세상이 600년전만은 아니겠지요
9788993952537,8,균전제에 너무 많은 부분이 할당이 되어 있어서 정작 ｀정도전｀의 이야기는 반도 못 꺼낸 듯 하다. ｀그의 시대｀ 또한 토지 분배 이야기 하다가 끝나는 느낌이다. 이덕일 작가의 균형잡힌 서술은 돋보이나 소재의 안배가 많이 부족한 작품
9788993952537,8,요즘 붐인듯해서 하나 샀는데 읽을만 하네요
9788993952537,10,"600년 전, 신권과 왕권의 싸움에서 왕권에 밀려 사라져간 조선의 설계자, 정도전. 오늘 다시 그를 주목하는 이유는 강력한 왕의 시대가 계속 되고 있는 오늘의 정치현실 때문인가."
9788993952537,4,부자의 것을 빼앗아 제대로 분배하면 문제가 없다는 뉘앙스는 농업경제와 도시경제의 간극을 제대로 이해하지 못한 선전(propaganda)입니다. 양극화가 없는 사회는 모두가 못사는 공산주의지요. 그런 사회를 원하는건가요?
9788993952537,6,잘 읽었습니다.
9788993952537,10,"정도전이라는 과도기적 시대의 인물에 대해 강한 호기심이 있었는데, 그 의문을 풀어주는 책입니다"
9788993952537,6,"처음 이덕일 소장의 ｀사화로 읽는 조선사｀를 읽고 그때 정말로 재미와 충격이었다 
그 이후 웬만한 책을 거의 읽어 왔는데 ~  지금와서 한가지 생각이 든다. 대부분 평설의 형태를 취하지만 재미가 있게 쓰는 것은 이해되나 출처나 관련 자료는 밝히지 않는다는 것이다. 혹 이유를 알수있으면 좋겠습니"
9788993952537,10,드라마 정도전 출연진과 제작자분들이 강의 들은 내용을 재구성했다고 하는데 단숨에 읽었습니다. 학교에서 배우지 못한 우리 사회에 철학과 사상을 알게 됐고 이덕일역사학자님 책은 으~~~~ 늘 새롭고 긴장감을 불러일으킵니다. 유형원의 반계수록 소개를 하셨는데 꼭 한번 읽고 싶네요!
9788984944596,8,후삼국의 전쟁사를 이해하기 쉽게 정리된 책... 유익했어요.
9788984944596,10,"임용한 선생이 최대한 쉽게 쓰려고 애썼는데도 읽기가 어렵다는 얘기들이 난무하는데, 솔직히 내가 볼 땐 고등학교 수준 독해력만 되어도 무리가 없는 책이었다. 지나치게 쉬운 책들에만, 도판에만 골몰하면 이해력이 떨어지는데 정말 피해야 할 함정이다. 가급적 책은 정독하자."
9788984944510,8,마지막 백제귀족들의 비겁함 흑치상치 의자왕의 소심 고대 충청도 전라도 지역의 귀족수준의 저열함이 잘 나오고 경상도 귀족들의 열정이 잘 묘사된 삼국통일 이야기
9788952110664,10,"백제와 고구려는 우리와 별 상관이 없다는 이상한 주장을 하는 사람들, 또 삼국통일 이후 백제 고구려 유산은 다 없어졌거나 신라만 한국사에 기여했으며 백제 고구려 유민은 그 시로 없었다는 이상한 주장 하는 사람들이 있습니다. 그런 이들이 반드시 보고 정신 차려야 할 책입니다. 좋습니다."
9788952110664,10,정말 좋은 책일것 같네요
9788991510944,10,"고려말을 권문세족의 횡포와 공민왕의 좌절로 정리하기에 부끄러워 읽은 이승한의 <몽골제국과 고려> 1탄. 쿠빌라이의 부마 충렬왕은 일본원정에 줄기차게 동원되고 공주수행원, 응방, 환관을 통한 측근정치를 자행한다. 권력이 원으로부터 비롯되는 시대를 심도 있게 잘 짚은 대중서로 대체불가하다."
9788991510944,8,"일본 원정에 관한 책임에도 불구하고, 정작 일본 원정에 관한 내용은 뒤에 가서 매우 간략하게 나오고, 초반 부분은 전작인 고려 무인 이야기에서 나왔던 내용의 재탕이라, 조금 실망..."
9788974112417,10,"경주가 거쳐온 길 뿐만 아니라, 신라가 지역차별적 요소 및 정복 국가적 요소를 통일 이후에도 극복하지 못하여 무너지는 과정까지 종합적으로 살펴볼 수 있는 역작. 백제, 고구려 부흥 운동이 그저 이름만 빌린 것에 불과하다는 말도 안 되는 괴설들이 판치는 요즘, 필독이 필요한 도서."
9788984943520,8,공민왕을 까는 역사학자는 처음 봤다. 이것이 임용한의 매력.
9788984943520,8,답장이 늦어 죄송합니다. 책 잘 받았습니다. 많은 참고가 될것 같네요. 감사합니다.
9788984943520,10,국내 교양역사 작가 중 최고!! 특히 조선국왕이야기와 전쟁과 역사는 필견.
9788987096872,8,목간으로 살펴보는 사비 백제사의 이면.
9788978322089,6,절판됐다가 다시 나왔군요
9788987096742,6,토기로 들여다본 백제인의 생활상.
9788987350882,8,남들에게 막 읽어보라고 강요하고 싶은 책.
9788987350882,6,"작품 자체는 좋으나 오타,틀린 한자,엉성한 문장구조 다수 존재"
9788987096582,8,고려사 전문가의 알찬내용이 돋보인다...
9788960010017,10,이해하기 쉽게 짜여있어 재밌다.
9788974832568,10,간만에 읽기 좋은 사서
9788953424258,10,나정 우물터 발굴에 관한 역사스페셜 보고 구입결정~!
9788971992135,6,"무릉왕릉를 통해서 바라본 당대 백제의 역사와 문화는 깊은 감동을 준다. 하지만 졸속으로 발굴되었다는 사실은 참 안타깝기만 하다. 그 당시의 기레기들과 책임감 없는 관리, 학자들이 아직도 살아있다면 죄책감을 느끼고 살아가야 한다."
9788971992135,10,"잠시 보려고 든 책을 아침부터 지금까지 단숨에? 다 읽고 말았다. 무령왕릉이란 한 주제를 가지고, 발굴 이야기부터 당시 역사적 상황, 문화, 예술, 교류까지. 특히나 필자의 글힘은 영화를 보게 하는 듯하다."
9788971992135,8,고대 동아시아의 중심에 백제가 있었고 또 그 중심에 무령왕이 있었음을 알 수 있었다
9788901047515,6,백제사에 대한 다른 시각을 알기엔 좋은 책. 다만 백제사를 이책으로 처음 접한다면 비추. 백제사를 어느정도 이는 상태에서 비교해보면서 읽는 것만 추천.
9788901047515,4,소설같음. 백제 왕족과 귀족 그리고 당대의 주변국 상황에 대한 간략한 소개. 그 얼개 정도만 취할 수 있음.
9788901047515,4,"2006년 재판 1쇄를 구입했는데, 개정판이란 표현은 잘못된듯. 서문도 초판 서문밖에 없고, 개정 부분에 대한 설명도 없음. 대륙백제는 글쎄..믿을 수가 있어야지."
9788901047515,10,고구려왕조실록을 끝내고 백제왕조실록을 읽고 있는데 이전에 알지 못했던 흥미진진함
9788901047515,10,다른 왕조 실록도 읽어봤지만 이렇게 어렵고 재밌는 책은 백제편뿐인것 같아요!ㅎㅎ
9788901047508,4,"고구려 영토 부분에서나 여러가지로 유사 역사학의 냄새 나지만, 고구려와 주변국들에 대한 상황을 싣고있어서 의미있음. <삼국사기>와 <삼국 유사>,일본 <서기> 등등을 토대로 작가가 자신만의 사관으로 고구려 왕조사를 정리하여 놓은 것임. 어쩌겠나 ..."
9788901047508,10,좋습니다
9788901047508,10,적어도 내가 보기엔 고루려가 진정한 한국의 역사. 이책은 모두가 읽어야할 필독서다
9788901047508,10,우리민족이 꼭 알야할 고구려역사 고구려의 역사를 이해하기쉽게 한권으로 정리한 책
9788901047508,10,"고구려의 기상을 느낄수 있었고, 주몽태왕부터 보장태왕까지 알기쉽게 나왔있어 좋음"
9788901047508,10,700년 고구려의 역사를 체계적으로 볼수 있는 책으로 매우 유익했음
9788901047508,10,최근 화두가되고있는 고구려를 쉽게정리할수있는 최고의 시리즈! 고구려여 영원하라!!
9788988165461,10,전쟁을 통한 역사 알기 우리의 고대사를 재해석 했다.
9788988165461,10,탐정처럼 추리를 통해 밝혀내는 '나는 지난 과거에 네가 한 일을 알고 있다.'
9788979400441,10,"조선 역사만 편식하는 상황에서 김종서에 감사하며, 최승로의 시무 28조를 읽고, 전쟁 전에 서희와 손소녕은 어떤 언쟁을 벌였는지를 읽고, 신라가 고려에 속하기까지 오고 간 서신들을 읽다가 귀주대첩 강감찬의 외모에 대한 기록도 읽어본다. 이것만으로도 구미가 당기지 않는가?"
9788979400441,8,역사는 살아있다
9788973005284,10,고구려의 역사와 문화가 깔끔히 정리된 최고의 고구려 개론서
9788971966884,8,정말 좋은 책입니다.  우리가 알아야 할 것들이 나와 있는 백과사전입니다.
9788934911166,10,"필독도서. 가치를 따질수 없이 귀한 책. 다양한 역사서에 담긴 천문현상을 분석하여 많은것을 깨닫게 해주는 책. 우리를 죽이는 심정으로 심혈을 기울여 중국, 일본, 친일파가 역사 말살과 날조를 해왔을텐데..정사서들, 한단고기 등의 역사에 남겨진 천문현상을 통해 무엇이 진실인지를 말해준다."
9788934911166,8,고대 천문학이라는 생소함 분야에 대해 매우 흥미가 생기게 한 책이다. 남겨진 천문기록이 귀중한 자산이라는 것도 누끼게 해준다. 더많은 관심과 연구로 새로운 사실들이 밝혀지길 바란다
9788934911166,10,천문학을 과학적으로 분석하고 평가하여 우리의 역사를 판단한 사실은 역사를 고증하는데 많은 역할을 한다고 생각한다.
9788934911166,10,우리의 역사와 연관하여 함께 천문학을 공부할 수 있는 좋은 책으로 추천하고 싶어요
9788971966846,10,사진찍듯...머리속에 확~~통째로 찍어 넣다...백제사~~
9788971966839,10,고구려~나의 고구려~~유물도 보기 힘든 고구려..풍부한 도판이 있어서 너무 좋은책
9788971966839,10,역사책읽으면서 같이 사진으로 생활사를 볼수 있어 좋아요
9788985905312,8,"한국불교, 금석문에 관심있는 이에게 좋은 자료이다."
9788985905312,10,1차 사료로서의 충분한 가치가 있다고 보여짐
9788995057117,8,삼국유사와 쌍벽을 이루지만 잘 알려지지 앟은 역사책인 제왕운기의 단행본으로는 국내 유일 번역본. 다만 본문의 제왕운기 상하편 중 중국사를 다룬 상편의 경우 군데군데 한자가 괴상한 기호로 잘못 입력되어 있다.
9788972912255,8,한국인의 원형적 사고가 담긴 불멸의 고전
9788972912255,6,삼국유사를 사진과 함께 볼 수 있는 기회
