ISBN13,rating,review
9788976965509,6,"광개토대왕릉비 신묘년조 기사를 가상스토리이자 허구라 하는데, 해석치곤 너무 없어 보인다. 최신 연구성과를 친절하게 전달하곤 있으나 고대사 관련 강단사학계의 한계에 닫힌 기분."
9788976965509,8,전면개정판임을 내세운 것에 부끄럽지 않게 초판의 장점을 계승하면서 지난 20여 년 동안 이루어진 연구 성과와 새로운 발견을 잘 반영했다.
9788962463040,10,사이비사학을 그럴 수도 있겠다고 ‘믿는’ 사람은 꼭 읽어보시길..
9788962463040,2,고조선을 말살하려던 일제식민사학자의 계승자들이 쓴 매국적 한국고대사. 이런 인간들이 한국사학계의 주류를 형성하고 있다. 이 저자들이야말로 민족사의 발전을 위해 폐기처분해야 할 적폐들이다.
9788962463040,10,"고대사에 대한 여러 정치적 의도가 담긴 유사역사학, 북한, 중국, 식민사학에 대한 우리시대 사학자들의 대답.학문이 정치에 복무하면 추악해진다."
9788962463040,6,1980년대 이후 오랜만에 대중과 다시 소통하려는 역사학자들의 시도는 성공할 것인가?
9788962463040,2,우리나라 강단 사학의 모습을 여과없이 보여주는 졸작. 돈주고 절대 사보지 마시라.그리고 여기에는 사학자들 외에도 비전문가가 지껄이는 헛소리도 있다.
9788937431999,10,내가 갖고 있는 한국 고대사에 대한 개념 내지는 상식을 완전히 오류의 구렁텅이로 몰아 넣어버린 책이라 생각한다. 한국인의 선조에 대해 여러 책을 통해 알고 있었던 것이 전부가 아니라고 수정해 준 책입니다. 한국 고대사에 관심이 있는 분들께 일독을 권해 드립니다.
9788937431999,10,"우선, 관점이 좋다. 시베리아 고고학의 방법론을 들여와 중국의 굴기와 한반도 중심주의를 넘어서는 좀더 보편화된 관점. 이야기하듯 써나가지만 저자의 오랜 공부의 결실이 쉬운 듯 깊이 있게 담겨 있다."
9788937431999,8,우리가 잘 모르는 유라시아에 대한 여러 정보 및 지식을 제공해 주심에 감사.그러나 역사적으로 유라시아에 모든 근본을 두려는 시도에는 얼마간의 반대의견이 있고좀 더 깊이있는 연구가 계속되어야 한다 사료됨
9788952117137,10,대단한 역작이다. 비록 갖은 수모를 당했지만 그렇게 그렇게 고려는 지워지지 않고 명맥을 유지했다.
9788952117137,6,쿠빌라이 칸의 지리한 형제간 권력다툼과 절 사위로 삼아주세요~ 따라다니던 고려왕 얘기가 씌여있다.
9788952117137,10,이렇게 핵심만 정리해서 쓰기도 힘들거다. 다음엔 살을 더붙여 몽골제국 흥망사가 나오길 기대한다. 좋은 책.
9788984353282,10,뿌샘은 자료가 참 좋은 거 같아요
9788984353282,10,"고려편도 나왔네요 ㅎㅎ 얼른 완간 되기를,,, 내용을 읽으면서 관련 사료를 확인할 수 있어서 좋아요 페이지도 늘었네요 ㅎ"
9788936413361,10,고려와 원 제국의 역사를 살펴볼 수 있는 책. 당시의 역사를 꼼꼼하게 살필 수 있도록 한다.
9788984944336,10,괜찮은 역사책...옥천 단양이 왜 중요한지 잘 알게 해주네..
9788984944336,10,한국사 교양서적에 있어선 둘째가라면 서러워할 임용한 선생의 신작. 전에 냈던 전쟁과 역사 - 삼국편을 세권 분량으로 보완하셨다고. 이름만 보고 구입하는 저자 중 한 명.
9788981331252,2,"저자에 말처럼 신라가 중국사의 일부였다는 주장은 터무니 없으며 근거가 없는 논리 비약이다., 신라는 오히려 당과 전쟁을 벌였고 승리했으며 나침반 세뇌등 세계 전쟁기술에 큰 영향을 끼친 강국이었다. 신라는 고구려백제를 계승하지도 않았고 고구려백제는 계속 존속했다. 강국 발해도 일어났다"
9788981331252,8,10년만에 장만하는 보물같은 책.
9788981331252,8,잘받았습니다.
9791156121541,6,"정통론, 언제까지 유교 탈레반이 역사 의식을 지배해야 하나! 그래서 아쉽다."
9788974839642,2,질문형 주제는 그 반대가 글쓴이의 주장인 듯...글쓴이만 10명이다... 그리고 아직도 임나일본부를 언급하다니 이해가 안 된다.다른 하나는 시민들의 역사 지식이다...추천사가 정말 오만하고 교만하다.대중을 극복 대상으로 보다니...본인들만 진실을 안다고 생각하는 편협함이 짜증난다.
9788974839642,8,임나일본부설 광개토대왕비 단락은 최근 100년간의 역사학자들의 토론 배틀의 진수를 보여줌..재미있음.
9788974839642,2,건강한 재야사학조차 사이비역사학이란 말도 안 되는 프레임으로 덮어씌워 자기네들 밥그릇인 식민사학을 옹호하는 조선일보 같은 매국역사책
9788974839642,2,"본인들의 일본을 향한 욕망을 투영한 책. 이 자들은 한국인이 아니다. 역사학의 기본을 무시하고 논지를 건너뛰는, 그야말로 최악."
9788974839642,6,내용이 얇다
9788974839642,8,‘크고 아름다운 것‘을 욕망한다고 하더라도 사이비 역사는 사이비 역사일 뿐이다.
9788974839642,10,"정말 밉다. 책의 내용은 ˝우리 대화가 너무 없었던 것 같네, 내 이야기도 좀 들어주지 않을래?˝로 요약된다. 이미 많은 시간을 사이비에 허비한 과거가 있었던 나에게는 너무 늦게 걸어준 대화요청이다. 스스로 깨닫기전에 좀 더 빨리 대화를 걸어주었더라면 나의 시간을 허비하지 않았을지도 몰랐는데"
9788974839642,10,쇼비니즘으로 잘못된 역사를 전파하는 유사역사학을 통쾌하게 비판한 책. 추천!
9788974839642,10,역사학의 기본인 사료비판을 통해 사이비역사학을 조목조목 비판하고 있는 아주 잘 된 책이다~~
9788974839642,10,유사역사학의 여러 문제점을 이해할 수 있었다. 다양한 소재가 읽기에 재미를 더해 준다. 올해의 추천 도서!
9788952233677,8,이야기가 하나같이 재밌고 잘 읽힌다. 이런 책 있는 지 몰랐는데 잘 산 거 같다.
9788952233677,10,제주말이 또랑한 인물들이 풀어내는 이야기들이 너무 토속적이고 재미있다. 제주 여행갈 때 들고 갔다가 시리즈 한권씩 읽고 있는데 이런 작업을 해낸 작가의 의지가 고마울 정도.
9788958289074,4,책이 어렵고 읽기힘든 이유는 저자의 딱딱한 글투 때문이기도 하지만 근본적으로 도해(圖解)가 너무 적은게 원인이다. 지린성이 어딘지 나는 잘 모르고 쑹화강도 많이 듣긴 했지만 정확한 위치는 모르고 랴오허 선양 푸순 다 모른다. 그 정도는 갖추고 와야 책을 접하는 예의인가? ㅎ 여튼 불친절했다
9788958289074,6,고구려와 백제의 뿌리가 된 부여는 어떤 나라였을까?
9788958289074,2,"난하도 모르면서 무슨 고대사인가. 북경 위의 조하가 예하, 부여하로 불렸다는 청대지리지를 빼고 어찌 북부여를 논하겠나. 본부여의 소서노가 요서로 들어가 백제를 건국했다는 25사기록도 무시하고 무슨 부여를 논하나? 다 지금의 요녕성 얘기다."
9788958289074,10,"송호정 교수의 책은 주로 고조선사가 많았다. <한국생활사박물관>이나 <한국 고대사 속의 고조선사>등이 그렇다. 근거 없이 주장을 나열하지 않고, 근거를 바탕으로 한 논리전개가 좋다. 다만 조금 딱딱하고 어려운 느낌은 있다. 어쨌든 부여사를 다룬 책은 너무도 귀하고 그래서 반갑다. 좋다."
9788958289074,10,부여사만을 이렇게 따로 다루는 책은 처음보는거 같네요. 한번 읽어볼만한 책인것 같습니다.
9791185134192,10,기존 강단사학의 한사군 한반도설을 유지하면서 삼국사기 기록들을 퍼줄맞추듯 하다보니 가설이 장황해졌다. 결론은 중국내 동이족(맥족)이 한반도 고대국가의 지배자였단 가설이고 이기백류 보다  참신하다. 추후 삼국편을 통합해서 시대별로 더 간단하게 만들면 이해가 더 빠를거 같다.
9791195322206,10,중국 사서에서 발굴하는 고조선 기록들. 사학과 교수들한테도 들어보지 못한 자료들. 제대로 된 고조선연구소 설립되었으면 좋겠습니다.
9791195322206,10,"오랫동안 많이 부족하고 아쉬운 우리 역사의 합리적 규명에 대한 탄식과 감성에만 의존, 실존적 사괸에 대한 극복능력 부족의 틀을 조금이나마 깨뜨린 글 같아서 이 저자의 다른 책들도 읽어 보았다. 부족하다고 생각하던 사료들의 편린들이 여기 저기 우리를 기다리고 찾아내기를 기다린 둣."
9788994079721,10,"<몽골제국과 고려> 2탄. 외가와 처가가 모두 몽골인 충선왕. 생의 대부분을 원에서 보내며 원 황위계승에 깊숙이 개입하는 한편, 아비와 권력을 다투고 세자를 죽이고, 양위 후 조카를 통해 아들을 견제한 기묘한 시대의 풍운아. 심양왕을 겸하고 티벳에 유배됐다 죽은 우리 역사의 특별한 세계인."
9788994079721,8,"원간섭기에서 고려의왕과 몽고의왕족 사이에서 경계인의 삶을 살면서 아버지와 아들과 권력다툼을 했던 충선왕 이야기이다. 고려무인, 원간섭기를 다른 이승한박사의 연작중 하나로 가히 읽을만하다. 당시 시대상을 쉬우면서도 핵심을 놓치지않고 다룬다."
9788994295428,10,역사서는 확실한 고증이 필요하지만 고대사의 세계는 실증이 어렵다.  환단고기는 위서논란이 있지만 위서로 치부해버리기에는 놀라운 사상과 역사가 담겨있다. 천부경 등등.. 고대사에 대한 인식의 확대를 위해 읽어볼 가치가 충분하다. 독립운동의 한 부분인 대종교의 근간 사상을 담고 있다.
9788994295428,8,쉽게 적혀있어서 전반적으로 개념 잡는데 좋아요
9788994295237,10,너무좋은책이에여 감사합니다
9788994295237,10,"방대한 양의 역사서, 구매에 절대 후회없습니다.우리의 역사뿌리를 찾아 떠난다고 생각하니벅차오릅니다."
9788994295237,10,"한민족의 잃어버린 창세 역사를 올바르게 알 수 있어서 참으로 감사한 책입니다. 워낙 방대한 역주본이라 두고두고 읽는 중이지만, 읽을 때마다 놀라움을 금할 길이 없습니다."
9788994295237,8,"역사는 지난 시간의 박제이기 때문에 다양한 각도에서 봐야한다고 생각한다. 누구는 머리를,누구는 가죽만을 보고 있을 수도 있다. 무조건적인 배척이나 비아냥보단 가능성을 열어두고 단서를 섭렵하려는 자세가 중요하다고 생각한다."
9788994295237,10,인류 기원의 장대한 역사.사대주의와 식민사관으로 잃어버린 우리 역사.배달 청구 동이... 지금의 우리 역사교육은 이 말의 어원과 뜻을 제대로 설명하지 못한다. 그러나 환단고기의 역사는 이 말을 온전히 설명한다.
9788994295237,2,"상식 있는 모든 이들은 역사의 진실 여부를 판단할 때 다른 나라에서 하는 얘기도 참조합니다. 이 점 반드시 유념해주십시오. 환단고기를 배척하는 것은 이것이 위서고, 기존 고고학적, 역사학적 증거와 부합되는 바가 없기 때문입니다."
9788994295237,10,"또한 우리나라가 역사의 진실여부를 판단할때에 주변국의 역사와 비교해보고 결정을 한다고 합니다. 허나 외국을 그러지 않는다고 들었습니다. 이점을 잘 생각해보시길 바랍니다.
무조건 환단고기를 옹호하는건 아니지만 또한 무조건 배척할 이유도 아직은 잘 모르겠습니다."
9788994295237,10,여러 책의 환단고기가 출판되어 있으나 그 중 최고의 책입니다. 다양한 사진과 방대한 자료로 설명되어 있어 참고로 보면서 이해하기에 정말 도움이 되며 기존 책들의 작은 글씨로 번역되어 있는 것보다 큼직큼직하게 구성되어 있어 보기에도 정말 편합니다.
9788994295237,10,"우리나라 사람은 참 불행합니다. 자신이 태어난 나라의 역사를 바르게 알고 있는
사람이 드물기 때문입니다. 일본의 식민사관 이나 중국이 왜곡해 놓은 역사가 우리나라 역사라 잘못 알고있는 것은 반드시 고쳐 나가야 합니다. 이 책은 그런 우리나라 역사의 진실을 밝혀주는 소중한 책이 될것입니다"
9788994295237,2,환타지 소설 목록에 있어야할 책이 왜 역사목록에 있는거죠?
9788994295237,10,우리나라 잃어버린 역사와 문화를 되찾고 나아가 인류의 시원문명(뿌리)을 알 수 있는 유일한 역사책이 100년의 세월을 기다려 제대로 번역이 되어 나왔네요~ 두고두고봐야 할 책이라서 강력 추천합니다!!
9788943103965,8,정민의 이전 책들-지나치게 교훈적인-과 달리 퍼즐 맞추기의 재미도 좀 있네요
9788943103965,8,"역사.. 그 케케묵은 것에서 또 다른 즐거움을 발견할 수 있는 책입니다. 역사에 관심 있으신 분도, 관심이 없어도 읽을 것을 찾는 분도, 모두 만족할만한 책이네요. ^^"
9788943103965,8,굉장히 기대되는 작가의 기대되는 테마. 그런데 책꼴이 완전 옛날책같아요.
9788931573916,10,"동이는 BC2000년 이전부터 동북아에 단군조선을 열었고, 그 일파는 BC1600년 무렵 중원으로 가서 상[商 혹은 은(殷)]을 세운다. 한족의 하(夏)나라를 제압해 천하를 통일한 상은 550여 년간 중원을 다스리면서 갑골문자를 창조하고 청동기문화를 꽃피웠으며 인쉬[은허(殷墟)] 등에 대규모 궁전을 건설한다."
9788952110022,8,"동아시아사의 관점에서 본 삼국 통일 전쟁은 고구려, 백제, 신라 세 나라뿐만 아니라 당 제국, 왜, 설연타 등이 뒤엉켜 싸운 고대판 세계 대전이었다."
9788952110022,8,"논문형식을 갖추었고 내러티브가 특별히 살아 있진 않지만 거북할 만큼 딱딱하진 않다. 아니 재미가 있다! 왜 신라는 당을 ｀끌여 들였고｀ 북쪽은 결국 ｀포기｀했는지가 늘 궁금했는데 어느 정도 해결이 됨. 신라는 원래 백제가 타겟, 당은 고구려가 타겟. 당시 왜가 대국 노릇을 한 것도 처음 알게 됨."
9788937425943,10,삼국시대 이전의 기록들이 대부분 전하지 않기에 항상 갈증처럼 느껴졌다. 특히 문학적인 기록들은 그 가치를 더욱 빛나게 한다. 고카페인 같은 서양 고대사와 달리 산사에서 마시는 그윽한 차 한 잔이라 해야 할까.
9788937425943,8,책이 너무 멋지다. 소장가치 가득. 들어본 이야기가 정말 많다. 천천히 차분히 읽어보기에 좋다. 아이들이 중학생 때쯤 읽으면 좋겠다는 바램으로 소장하려고 한다.
9788937425943,10,사기 시리즈를 읽었던 터라 번역자의 이름을 보고 고민하지 않고 잡았습니다. 덕분에 잘 읽었습니다.
9788937425943,8,고전을 읽기 쉽게 번역한 것이 마음에 들었습니다. 다만 주석이 정확하지 않은 부분이 눈에 띄어 아쉬웠습니다.
9788937425943,10,읽어본 삼국유사 중 으뜸 삼국유사 무슨 부연설명이 더 필요 할까요~
9788973377336,2,유사역사학이 여기 또..
9788973377336,8,주신의 역사에 대한 조곤조곤 설명해 주어서 읽기 쉽다. 주신(조선)은 금속가공기술을 가진 유목민의 이동과 관련있다는 주장에 개한 근거를 상세하게 들고 있다.
9788973377336,8,솔직히저자분의스토리텔링능력이떨어져읽는데힘들었어요하지만우리나라사람누구나한번쯤읽어봤으면하는책이에요읽고서광활한중앙아시아평원을질주하던기마민족의피가제몸에흐르고있다는걸알고자부심을가졌습니다잠시나마한국인으로서자부심느낀건일생처음이었습니다
9788973377336,8,한국에대한 개념을 새롭게 할 수 있는 계기가 되었습니다.
9788973377336,6,"우리가 잘 모르는 내면의 역사를  알려주고 있지만
책의 내용이 쫌 어렵다"
9788973377336,8,"신랑이 보고 싶어서주문했는데오자마자 하루종일 있더군요,, 역사에 대해서많이있어요"
9788901047539,8,고려 역사의 전체적인 흐름을 읽기는 좋은 책. 하지만 조선역사보다는 내용이 부족한건 어쩔 수 없는듯.
9788901047539,10,고려왕조가 어려운 역경을 끊임없이 극복해 나가는 과정은 정말 드라마틱하다. 조선왕조의 명분외교와 달리 실리외교를 왜 해야하는지를 현대에 사는 우리에게도 설득력있게 잘 보여준다.
9788901047539,10,태종 광종 성종 공민왕 중심의 수능 역사만 보다가전체를 한눈에 보니 흐름을 잘 알 수 있어서 좋았습니다.
9788901047539,8,"고려에 대해선 많이 알려진 바가 없어서인지 너무 새로운 내용으로 다가왔다. 모르는 것을 새로 알게되는 신선한 느끼?!! 그러나 너무 정치위주여서 약간 지루한 면이 없잖아 있었고, 다른 고려를 알기위해서는 다른 책들도 봐야하겠다."
9788901047539,10,"저자의 삼국왕조실록을 재미있게 읽어서 고려왕조실록도 읽어 보았다. 출간 당시에 실록을 제대로 번역한 사서가 부족했고 내용도 미흡했는데, 본서는 왕의 재위 연대순으로 편제하고, 고려 왕실 계보, 재위시 일어났던 여러 사건들을 자세히 기술하여 역사지식 함양 및 시대 흐름 파악에 도움이 됐다."
9788901047539,10,고려왕조 뿐만 아니라  삼국시대가 끝나고 후삼국 그리고 고려가 세워지기까지 그 파란만장했던 역사를 고스란히 좀더 자세히 알 수 있는  꼭 알아야할 역사들!
9788901047539,8,고려를 보면서 무엇을 배워야할까요?
9788901047539,10,조선왕조실록에 이어 읽고 있습니다. 고려에 대해서는 조선보다 아는 것이 적어 정말 새로 알게 되는 것이 많다는 생각이 듭니다. 고려에서 삼국의 나라별로 이어갈 예정입니다.
9788901047539,8,아쉬움점은 지도가 간간히 나왔으면 좋았을텐데.... 그부분이 아쉽네요
9788901047539,10,조선왕조만 볼 줄 알았지 고려왕조도 정말 흥미진지합니다^^ 강추합니다.짱입니다.
9788901047539,10,조선만 알지 고려에 대해 새롭게 알게 되었습니다.
9788901047539,10,되풀이 되는 역사.. 미래를 알고자 한다면 과거를 알아야 하지 않겠습니까?
9788901047539,8,귀족정치를 고집했던 고려왕조의 이야기를 사실과 재치로 풀어가는 최고의 역장이다.
9788901047539,8,한국사에 관심이 있으시면 재미있게 엮어 놓았어요.
9788901047539,10,박시백의 만화 조선왕조실록으로 시작해 고려로 옮겨가며 선택한 책
9788901047539,8,고등학생 아들이 영풍문고에서 이 책을 사왔기에 반품하고 알라딘에 신청했답니다.
9788901047539,8,KBS에서 방영중인 천추태후를 보면서 관심을 갖게 되어 주문햇는데 조아요^^
9788901047539,8,책이 생각보다 뚜껍네 ㅋㅋ 빠른 배송 좋아요~
9788981331269,8,여러 삼국유사 중에 옮긴이의 해설이 가장 매끄러운 책.
9791197147401,4,"고조선 위치 비정에 최종적으로 낙랑군의 위치를 현 평양으로 하는 노태돈, 송호정의 제자와 후배 다운 결론이네...결국 서울대학교 출신들은 틀을 벗어나지 못하고 있다."
9791190777117,10,한국역사에 참 귀한 연구물입니다. 적극 추천합니다.
9791190777117,10,출간에 감사드립니다~!!
9791190777117,10,토왜 매국세력 뉴라이트로 뒤범벅된 강단사학과 관에서 싫어하는 거 보면 훌륭한 책이라 생각합니다.
9791190777117,10,구매합니다~~~!! 교육부가 출간발행금지??? 다각적인 연구노력은 하지 않고 발행금지라니 어처구니가 없네요~~!!
9788963125985,10,신기한 조각상들을 소개하고 치밀하고 객관적으로분석했다. 치우침이 없고 넘치지 않는다.
9791196265656,10,낙빈기 성인은 하늘에 계시지만 김재섭 성인께서 아직 살아 계셔서 이런 훌륭한 책을 볼 수 있다는 게 정말 행운인 거 같습니다. 아무쪼록 오래 사셔서 더 좋은 책을 출간하셨으면 하는 바램입니다.  만수무강 하시기 바랍니다.
9791156121534,10,"이 책이 다시 나오기를 손꼽아 기다렸어요.....중고본도 구하기 힘들어서 겨우 3,4권만 구해서 읽었는데 전부 다시 봐야겠네요....."
9788952240422,10,교수님 책이 오랜만에 나왔네요 궁금했는데! 언제나 외로운 싸움에 앞장서 주셔서 감사드려요
9788952240422,10,"단군조선, 고조선 그 자체인 요하문명에 대해 쉽게 알려줍니다. 춘천 중도 유적 깔아뭉개고 장난감 레고랜드 지으려는 강원도 최문순 지사에게 권해주고 싶은 책."
9788960622012,10,나름 잘 정리된 책. 그런데 아래 리뷰는 아무래도 이 책을 읽은 것만으로는 본인의 선입견이 정리되지 않는 모양~ 이런 쪽으로 연구된 책 열권은 더 읽어봐야 이해할듯. 일본서기는 뭔 왜 하필이면 일본서기를 참고함??
9791130615059,8,한 점 유물이 기지의 역사가 되기까지의 고단하고 불안한 길을 좀이나마 가늠해 볼 수 있게 하는 책. 박물관에 적을 두고 학자의 길을 간다는 것은 최선의 포지션이니 일부인들의 폄하는 넘기시길. 고대사 읽다보면 비행기 없이도 장거리 교류 활발했고 경계나 적대의식은 요즘보다 덜했다는 생각 듦.
9791130615059,10,연구실 책상과 박물관 수장고에서 ‘백제‘라는 숨겨진 보물을 하나씩 알아가는 자전적 이야기이자 한 편의 백제유산답사기.
9791130615059,10,백제판 셜록홈즈! 섹시한 고고학! 금동대향로가 파묻히던 그 순간을 목도한거 같은 경험을 할 수 있었다.  마치 드론을 타고 정림사지와 능산리사지를 여행하는 것 같았다. 깊이와 재미 둘 다 보장
9791130615059,10,우리가 오래된 유적을 직접 가는 이유는 거기에 ‘진짜’가 있기 때문이다. 황량한 터 밖에 남아있지 않지만 거기에는 정말 ‘역사’가 있다. 지금까지 답사기를 들고 절터를 찾았다면 이제부터는 이 책을 들고 미륵사지나 정림사지에 보시라. 이 책에는 백제의 ‘진짜’ 이야기가 담겨있다.
9791130615059,10,박물관에서 일하기를 꿈꾸는 학생들이 꼭 읽어야할 책입니다! 백제에 관해서도 재미있는 내용들이 많지만 저자의 박물관에 대한 애정과 깊은 고민이 느껴지는 글이네요!!
9791130615059,8,다시금 아는 만큼 보인다는 걸 깨닫게 해주는 것 같습니다.박물관에서 그냥 스쳐지나쳤던 기와가 새롭게 보일 것 같아요~
9791159876059,10,삼국유사와 제왕운기 기록을 근거삼아 잃어버린 역사를 찾는 책으로 삼위태백의 기록중 삼위를 기록을 실증적으로 추적한 책으로 실증 배달국사 1 권은 의미있는 책입니다.
9788977460706,2,한반도가 인류의 발상지라고? 이런 말도 안되는 주장이 식민사학자들이 공격할 빌미를 준다. 좀더 확고한 근거에 기초한 추론이 아쉽다.
9791185134383,10,이희진 선생님 학술회의 영상 보고 어떤 분인지 궁금해서 찾아봤는데 정말 좋은 책입니다 ! 평소에 백제에 많은 애정이 있었는데 공기관이나 주류 학자들의 방해가 만만찮은데도 항상 주장 굽히지 않으시는 이희진 선생님 응원합니다 !
9791195307715,10,저자의 전작에 이어 이책까지 읽어봤다.대단히 흥미를 끄는 사실이고 이제 역사추적팀이나 학자들이 좀 나서야할 때가 아닌가 생각을 해본다.
9791195307715,10,저자는 태극-고리-태양신 숭배의 연관성을 과학적 방법으로 설명한다. 우리나라와 남미의 시공을 넘나든다. 게다가 흥미진진하다. 기존의 무지와 절대주의를 차분하게 지적한다. 국수주의도 경계했다. 책이 잘 읽힌다. 리처드 도킨스를 좋아하는 분들께 이책을 권한다.우리 역사의 DNA가 보일 것이다
9791195704972,6,기존 통설과는 매우 다른 내용이 많아서 완전히 믿기에는 무리가 있다. 현실적인 고대사 연구의 한계로 인해 많은 부분이 고문들에 의존하고 추측성 내용도 많다. 하지만 통설과 다른 새로운 의견을 알 수 있었다는 것에 의의를 둔다.
9791195704972,10,"주류 강단의 매국사학의 적폐를 청산하고, 이땅 곳곳의 친일 청산을 바라는 한국인 필독서"
9791195704903,10,읽으면 읽을수록 점점 미궁에 빠지게 만들었던 그동안의 고조선사를 단번에 ‘팩트’의 수준으로 올려놓는 책이다. 고조선사가 이제야 머릿속에서 정리가 된다.
9791195704903,10,"고조선에 관한 가장 권위있는 책입니다. 이병도, 노태돈, 송호정 따위 주류 강단의 매국식민사학과는 비교할 수 없는 한국고대사 연구의 금자탑!"
9791195704903,10,선생님 고생 많이 하셨습니다.
