ISBN13,rating,review
9791157060283,8,"주로 일본의 입장이 많이 반영된 동아시아사. 대륙과 해양의 충돌을 야기한 주체가 거의 다 일본이었으니 책 제목상 그렇게 흐르는 건 어쩔 수 없는지도... 재미있고 유익한 책이지만, 방대한 시기를 총괄하다 보니 다이제스트 같은 느낌도 있음. 분량을 늘려서 좀 더 디테일을 키웠으면..."
9791157060283,10,동아시아에 대한 아주 분석적인 책이네요.
9791157060283,10,한반도의 지정학적 위치와 동아시아의 판도에 대해 과거를 돌아봄으로써 미래를 준비하게 해주는 역사서.
9791157060283,10,"우리나라에선 특히 유효하고 여전히 진행중인 지리적 분쟁들에 대한 문제들에 대한 역사적, 비판적 시각을 기를 수 있다."
9791157060283,8,한국의 지리적위치가 일본군의 침략과 여러사건들을 일으켯다는걸 알고가네요
9791157060283,10,"임진왜란사를 공부하고자 책을 살펴보면, 김시덕 교수의 이름은 피할 수 없이 마주치게 되어있다. 그런데 이제 김시덕 교수의 시야가 조금 더 넓어진 것 같다. 한중일의 시각을 넘어 동아시아 전역으로 그 범위를 넓혔다. 역사를 좋아하는 이로써 두근두근 설레는 마음을 감출 수 없다"
9791157060283,10,동아시아 중 지리적 위치가 좋은 우리나라. 우리나라의 미래를 생각해볼 수 있는 책이 아닐까 싶다.
9791157060283,10,동아시아 역사에 대한 새로운 시각이 흥미로운 책. 꼭 한번 읽어보세요
9791157060283,10,열국지로 시야를 넓히는 것도 중요하다고 봅니다.
9791157060283,10,한반도의 지정학적 위치는 참 중요한 거 같아요
9791157060283,6,땅의 역사만 보다 바다를 보게 하는 책
9791157060283,10,"우리 상황을 객관적으로 보는 것만이 우물안 개구리를 탈피, 여러 방면에서 죽죽 커가는 진짜 강한 나라가 될 수 있다. 김시덕 선생과 같은 새로운 시각의 소장파 학자들이 많아져야 하는 이유다."
9791157060283,10,지리적 요충지 한반도...
9791157060283,10,동아시아의 역사를 이해함으로써 우리나라의 뼈아픈 역사도 같이 이해할 수 있을 듯 하다.
9791157060283,10,해양역사를 공부할 수 있는 귀한 책이네요.
9791157060283,8,임진왜란 이후의 한중일 삼국의 역사를 비교해서 알 수 있었습니다.
9791157060283,10,21세기 한반도의 미래전략을 짜려면 오백년 동아시아역사의 흐름에 대해 배워야할것같다.
9791157060283,10,"한반도에국한된,좀더넓게는중국과일본정도에그친우리시야를확트게하는책.19C초에오키나와,마카오,난징,베이징을거쳐귀향한홍어장수문순득은어떤생각을했을까?조선이500년을유지한것이조선의위대함의증거가아닌것과마찬가지로,조선의멸망이조선인을폄하하는증거가될수없다는부분은특히공감이간다."
9791157060283,10,"소중화와 삼국지적 세계관으로 인해 주변 민족을 보지 않는 선입견, 그리고 일본 침략과 제국주의에 대해 절대악으로만 규정하는 편견을 잡아준 책. 이러한 행태가 우리에게 유리한 입장으로도 그리고 다른 민족에게도 다른 형국으로 작용할 수 있음을 보여준 책."
9791157060283,10,동아시아 역사에 관심있으면 꼭 보세요
9791157060283,10,"한중일 그리고 러시아, 몽골, 미국 등 역사속 다양한 관계들에 대한 이야기에 푹 빠지게 된다. 객관적 역사보기는 가능할 것인가?"
9791157060283,4,"임란이후 해양강국일본이란 존재가 등장함으로써 비로소 한반도는 대륙에대해서 교섭력을 가지게 됐다니? 이는 한민족의활동영역을 사실상 한반도로 국한시켜 생각하는 반도사관처럼 보인다.고구려나 발해,고려가 대륙정세변동과 관련이 없었나? 일본의 침략사관적 시각이 엿보인다면 지나친 말일까?"
9791157060283,10,저자의 깊은 내공이 묻어나는 책!!
9788933705315,10,베트남전쟁 이야기입니다. 쉽고 간단하게 설명되있어서 처음읽는 사람에게 좋을것 같습니다.전투에 관한 묘사보다는 전반적인 전쟁이야기를 다룹니다.
9788933705315,10,베트남전쟁을 역사적인 관점에서 기술 했다. 전쟁사라기보다는 역사서라고나 할까??
9788933705315,8,한국사시민강좌 맨뒤편에 광고가 실렸더군요...신뢰로 사는 책입니다.
9791188990696,10,새로 출간된 <중앙아시아사>를 읽고 역사에 대해서 많이 배웠습니다. 그래서 <중앙아시아사>의 역자가 쓴 <몽골제국의 후예들>도 구매하게 되었습니다. 이 책은 몽골 제국의 후기 역사에 대해 아주 상세하게 다루고 있습니다. 중앙아시아사에 관심있으신 분들에게 적극 추천합니다.
9791188990696,10,몽골제국을 좋아하는 이들이라면 반드시 봐야 할 책입니다. 저의 경우 몽골제국의 후예들에 대한 새로운 관점을 가지게 되었고 그 가치는 돈으로 환산할 수 없네요. 역사모들에게 강력 추천합니다!
9791188990696,10,그 동안 14세기 이후 몽골제국이 어떻게 되었는지에 대해 궁금했으나 이에 대해 알려 주는 책이 없었다. 이 책은 시대적으로 공간적으로 텅 비어있던 부분을 꽉 채워주었다. 로마제국 못지않게 빛났던 몽골제국은 그렇게 쉽게 사라진 것이 아님을 증명해 준 반가운 책이다. 소장가치가 있다.
9791188990696,10,"몽골제국이 티무르/무굴제국, 카자흐/우즈벡/크림 칸국/북원으로 어떻게 이어졌는지, 러시아, 오스만, 청제국에 어떤 영향을 미쳤는지에 대해 알고 싶은 이들에게 추천. 국제 중앙유라시아학계 최고 권위의 저술상을 받은 전문가가 토론토대에서 강의하는 내용을 바탕으로 쓴 책. 어려울 수는 있다."
9791188990696,6,"잘못된 역사인식을 심어줄 수 있는 책이다. 완전히 몽골인의 시각에서 유라시아 역사를 보고 있다. 지나친 몽골 중심의 역사관은 오히려 유라시아의 진정한 문화적, 문명적 주체들을 제대로 보지 못하게 만드는 오류를 야기한다. 비추천."
9791162204948,6,비속어 난무...ㅡ ㅡ역사 이해는 둘째솔직히 뭔 말인지 모르겠는 우리말 아닌 말들이 많음.그래서 비속어 잘 아는 분들에게만 권함
9791162204948,10,"중학교 사회책 역사책에선 몇 줄로 훑고 지나치던 태평천국, 거의 반 권 할애해서 풀어 놓았다. 잘 몰랐던 조직 성격, 전투 과정, 나름 흥미진진하게 보았다. 청군, 태평천국군 어떤 놈이 더 (덜) 나쁜 놈인가 고민했는데 아무리 봐도 민중한테는 두 놈들 다 악이었다. (이거 뭐 차악이 없어...)"
9791162204948,10,웃으며 쌓는 지식
9791162204948,8,"제일 마지막 페이지, 고우영 초한지의 팬으로서 고우영 선생님 스타일의 “태평천국” 등장인물 씬이 가장 인상적인 장면이었다. 태평천국 난의 진행과정 이야기가 잘 요약 압축되어있는 편."
9791162204948,10,"데포르메를 어느 정도까지 보여주어야 하는 것에 대해서 의견이 갈리는 듯하다. 어쨌든 동북아역사에 대해 이만큼 유쾌하고 쉽게 알려주는 책은 별로 없는 것은 분명하다.드립력이 약해졌다는 평가도 있지만, 드립을 좀 줄이더라도 박시백처럼 저변을 확대하는 편이 나을 듯하다."
9791162204948,6,책 읽는 동력이 되었던 드립은 2권에산 다 어딧다 날려드셨나요? 이럴겁니까?
9791162204948,10,믿고 보는 굽시니스트. 동부아 근대사를 이보다 쉽게 설명해준 책이 있었던가?
9791162204948,2,한국 얘기는 딱 한번 나온느데 책 제목에 한중일 세계사가 했을까. 책 내용이 너무 수준이 떨어진다
9791162204948,8,태평천국에 대해 이렇게 자세히 알아도 무슨 이득이 있을까 하면서도 책장은 술술 넘어가 버렸고 다음권을 또 어떻게 기다리나 싶다.
9791162204948,4,제1권 아편전쟁 편에 비해서 좀 실망스럽다. 드립력이 약해졌다. 본격 역사서가 아니므로 작가 개인 취향이 더 드러나는 것이 오히려 개성을 잘 드러내는 길인 듯.
9791162204948,10,이제 나왔다!!!!
9791162204948,10,언제 나오냐고!!!!!
9788994612584,8,"미국이 어떻게 분활정치를 통해 일본을 지배했고, 그 과정에서 일본의 자주파와 미국 추종파들이 얽혀 어떻게 일본의 정치를 이끌어왔는지를 한 일본인 외교관의 시각으로 정리해놓은 사료이다. 일본을 알아야 한국도 올바른 대응을 할 수 있다는 점에서 도움이 된다."
9788994612584,10,"다소 음모론적인 내용도 있지만, 그래도 미국과 일본의 관계의 이면을 잘 알 수 있었습니다. 우리나라와 미국의 관계도 일본의 관계와 본질은 다른 것이 없을 것이기 때문에 한국인들에게도 아주 의미가 있는 내용인 것 같습니다. 국제관계의 속내를 알고 싶으신 분은 꼭 읽어보세요."
9788994612584,10,"아마도 이책을옮긴이나해제를맡은 문정인은‘그러므로 한국은 미국을 배척 해야만하고믿어서는 안된다‘라는 이야기가 하고 싶어서이책을 소개 했다고 생각된다.그러나,오히려 이책에 담긴 일본과한국이미국이라는 역사상 최강국의 힘을 이용하고 상생할것인가에 대한고찰이오히려미국의존재를빛나게한다"
9788994612584,10,"지금 강대국 미국이 동아시아쪽에 어떻게 영향을 줬는가 배울수 있네요,"
9788994612584,10,미국과 우리나라는 뗄레야 뗄수 없는 관계인데 그런 의미에서 재미있게 읽었습니다.
9788994612584,10,일본과 미국과의 관계를 조금은 다르고 새롭게 정의내려주는 책으로 신선한 것 같습니다. 각각의 입장에서 바라본 견해와 의견들을 비교하고 대립해나가면서 읽고 그 안에서 동아시아의 위상이나 위치도 간접적으로나마 알 수 있어 현재 각국 나라들과의 관계에 대해 생각을 해볼 수 있게 하여 좋아요.
9788994612584,10,"메디치미디어의 동아시아관련 도서 중에서 개인적으로는 이 책이 가장 흥미가 가요. 일본의 사례라는 것이 약간 아쉽지만 어쨌든 한국과 밀접한 관련이 있는 동북아의 나라인만큼, 목차를 봐도 조목조목 내용이 치밀하게 잘 구성된 것 같아서 꼭 읽고 싶어지는 책들 중 하나입니다."
9788994612584,10,"일본도 은근히 미국의 지지를 받고 있고, 미국도 중국과의 관계에서 전략상 일본을 필요로 한다. 지금이라도 미일 관계를 철저히 분석하지 않으면 한국 외교의 미래는 어둡다."
9788994612584,8,어찌보면 잘 몰랐던 이야기를 알찬 구성과 소개로 우리에게 잘 전달해주는 좋은 책이다~!
9788994612584,10,사실상 세계의 지배자인 미국의 힘 그리고 한중일사이에 우리의 미래와 역할다양한 관점을 통한 동아시아의 패권경쟁매우 흥미로운 구성입니다
9788994612584,10,최근 동아시아사에 흥미가 많이가서 시대별로 책을 읽고 있는데 최근 동아시아에서 미국의 존재감은 절대 빼고 갈수 없는 부분이죠. 기대됩니다.
9788994612584,10,요약 -미국은 일본을 호구로 보고 있습니다. 국내 요약 -그 호구를 찬양하는 호구 돌아이가 있습니다. 정답 :ㅇㄷ ㅈㅊㅇ
9788994612584,10,다른 나라 시점에서보는 책이군요. 조상이 읽는다면 지피지기 백전백승에 도움이 됐을만한 책이네요.
9788994612584,10,미국이 동아시아에 어떻게 영향을 미치고 있고 또 그 결과로 한중일의 복잡한 역학 구조가 어떻게 변화할지도 이 책을 통해서 감 잡을수 있을꺼 같네요. 앞으로 우리나라의 미래에 대해서 다시한번 생각하게 해주는 책입니다.
9788994612584,10,몰랐던 역사적 사실이 잘 나와있는 책이네요. 우리나라에서도 이런 시각을 가진 책이 나왔으면 하는 바람이 있습니다
9788994612584,10,미국이 동아시아에 미친 영향을 일본의 시각에서 보았지만 우리 나라에도 대비시켜볼 수 있는 책이었어요.
9788994612584,10,흥미로운 내용이네요. 추천합니다.
9788994612584,10,역사를 알면 미래가 보인다.우리가 몰랐던 사실들이 너무 많았네요.
9788994612584,6,"알아두면 좋을 것 같습니다. 아니, 알아둬야 할 것 같습니다."
9788994612584,10,제목이 너무 자극적인 것 같아서 뭘까하고 들어왔는데 흥미롭네요.
9788994612584,10,동아시아의 역사를 이해함으로써 우리나라의 뼈아픈 역사도 같이 이해할 수 있을 듯 하다.
9788994612584,10,미국이 동아시아를 지배해나가는 과정을 보며 미국과 일본 사이에 얽혀있는 것들을 알게 되리라는 생각이 듭니다. 더불어 우리나라의 자리잡음의 중요함도.
9788994612584,10,아픈 역사를 되돌아보는 계기가 될 것 같습니다.
9788994612584,10,흠 씁쓸한 내용이군요. 우리나라의 존재성이...
9788994612584,6,"미국이 어떤 나라인지 우리와 일본, 중국은 어떤 입장에 있는지를 알게 해주는 책인것 같아요,"
9788994612584,8,미국은 스스로의 이익에 충실한 나라일뿐이란것을 새삼느끼게 해준 책이다.
9788994612584,6,"책의 내용은 좋지만, 오타,오식이 너무 많아서 읽는 동안 내내 거슬림"
9788994606170,10,히로시교수님의 ‘양반‘을 읽고 그 치밀한 연구에 감명받아 구입. 자꾸 이런 새로운 시각의 책이 나와야한다.
9788932472003,8,"이슬람에 대한 그동안의 편견을 깨는데 도움을 받은 책이다. 이 책을 계기로 미디어에서 나오는 모든 정보들을 걸러내는 장치를 가지기 위해 독서를 해야할 필요를 다시 느낀다.
 지루하지도 않고 어렵지도 않게 잘 씌어져서 누구나 쉽고 빠르게 이슬람 문화에 대해 깊게 이해할 수 있다."
9788958283089,10,원작자의 글도 훌륭하지만 정말 좋은 번역이 무엇인지 보여준다
9788958283089,10,드디어 다 읽었다.
9788958283089,10,중앙아시아아의 역사를 잘 알수 있다.
9788958283089,10,재미있고 정영목의 번역 역시 훌륭하다.
9788958283089,6,중앙아시아의 근대사를 좀 더 흥미롭게 만드는 이야기..
9788952205629,8,"재미있는 소책자입니다. 조선후기부터 일제강점기시기까지 질병에 조선사회에 어떤 영향을 미치고, (조선이든, 일본이든) 정부가 어떻게 대응했는지, 어떤 철학과 과학적 발견을 기반으로 정책을 펼쳤는지 알 수 있습니다. 아쉬운 점이라면, 저자의 문제의식이 지나치게 반일본적이라는 점입니다."
9791162209042,8,"이것을 택스트로 보았다면? 내용은 풍부해졌겠지만, 간결한 서사를 짚어내어 볼 수는 없었을 듯도 싶다. 정제된 서사가 이미지와 합쳐짐으로써 몰입도가 높아졌다는 생각. 굽시니스트는 시사인 연재도 굉장하지만, 이 책에서도 굉장하다."
9791162209042,10,이번 시리즈가 제일 맘에 드네요.
9791162209042,10,믿고 보는 굽시니스트. 한중일 근대사를 이보다 재미있게 보여줄 수는 없을 것.
9791162209042,10,"이 격동의 시기의 한중일의 역사를 풀어낸다는것 자체가 큰 도전이지만, 굽본좌는 자신의 흐름을 잃지 않고 풀어나간다."
9788963192239,10,"각 동아시아역사가 아니어서 좀 아쉽다. 각국 역사인 줄 알았는데, 그래도 주제서답게 친절하고 재미있다"
9788963192239,10,의미있는 에피소드와 역사적 이벤트를 중심으로 동아시아 역사를 눈높이에서 훑어주니 쉽게 읽힙니다~ 동아시아를 넓은 시야로 보는데 많은 도움이 되었습니다~
9788963192239,10,동아시아사 배우면서 잘 이해가 안되었던 부분들이 이 책을 읽어보니 해소되는 듯 하네요~ 동아시아사를 더 쉽고 재미있게 배울 수 있을 것 같아요.
9788962461138,10,1937년 18만 고려인 강제이주! 그 맥락과 실상을 정확히 알고 다시는 그런 일 없게 하는 것이 후대의 소명. 그 일이 서(히틀러)와 동(일제)으로 포위된 스탈린정권이 짜낸 쇼비-인종주의적 국가작전의 일환으로 당시 60개 소수민족 300여만 명이 같은 재앙을 겪었음을 알게 된 것 등 수확이 크다.
9788936482398,4,"솔직히 기대했는데, 일본기자들의 실력과 글빨이 별로다."
9788967357511,10,저자는 제2차 세계대전의 서막을 중일전쟁으로 지목한다. 아울러 국공내전에 대해 다른 시선으로 접근하고 있다. 중일전쟁을 집중 조명한 점에 점수를 준다.
9788967357511,8,"나름의 치우침&공백이 있으나 공식적-대중적 역사 기억의 좋은 보충제가 되는 책. 장제스의 ‘고난‘에 대해 상당히 공감하게 되었고 태어날 때부터 친일판 줄 알았던 왕징웨이의 마음의 궤적도 이해하게 됨, 심지어 중국을 분노와 복수의 대상으로 봤던 당시의 일본군&대중의 심리기제마저도. 착잡..."
9788967357511,10,중일전쟁과 장제스
9788967357511,8,"중화인민공화국의 중일전쟁 프로파간다에 대한 탁월한 해독제. 잊힌 동맹(forgotten ally)이라는 원제에 걸맞게, 군사적인 측면보다는 외교와 정치적인 부분에 서술의 초점이 맞춰져 있다. 만약 군사 분야에 더 관심이 많다면 역자가 직접 쓴 <중일전쟁>(2015) 쪽을 읽는 편이 더 만족스러울 듯."
9788963474014,10,"이 책은 동남아시아사 분야의 명저인데, 아쉽게도 잘 알려지지 않았다. 이상국 교수님이 잘 번역해주셔서 쉽게 읽히면서도 깊이 있는 내용이 인상깊다. 비단 동남아시아사에 관심이 없더라도, 근대국가가 만들어지는 과정에 관심이 있다면 꼭 읽어봄직하다. 절판되기 전에 사두는 편이 좋겠다."
9788963474014,10,"1994년에 출간된 책이 25년 만에 처음으로 우리말로 번역되어 나왔다. 우리가 태국이라는 나라를 동남아여행 인기상품과 음식천국 정도로 관심을 갖게 된 것도 얼마 되지 않는것 같으니, 독립된 하나의 국가로서 태국 역사에 관심은 ... 이 한 권의 책을 열심히 읽어도 많은 편견에서 벗어날 듯하다."
9791160801835,8,인도 역사를 처음 접하는 나에게 입문용으로 좋은 책이었다.
9791189709020,8,이번 권은 조선 연대기 빼고는 다시 중국 이야기다. 2차 아편전쟁 치르고 서양과 중국이 베이징 조약 맺고 태평천국은 꺼질 듯 말듯 아직 안 망함....5권가야 망한다고...지나온 일 재미거리로 보는 우리야 전쟁이 지루하네 마네 하지만 직접 전란 겪은 당시 사람들의 개개 삶은 얼마나 비참했을지.
9791189709020,10,믿고보는 작가
9791189709020,8,"2권에 나왔던 인물과 지명들인데... 그새 모호하다. 앞선 편은 정돈된 느낌으로 일사불란하게 흘러가는 느낌이었는데, 이번 편은 조금 정신없아 쫓겨온 느낌이다. 다루는 스케일의 차이인지도. 어쨌든, 완결까지 흐트러짐없이 달려갔으면 하는 바램이 있다."
9791189709020,8,너무 재미있음. 4권 몰아사면 공책 2권 준다는데. ㅠㅠ저처럼 나올때마다 바로바로 사는 펜에게도 공책을 !!!!
9791189709020,10,믿고 보는 굽시니스트. 4권까지 나오고도 아직 할 이야기가 많다니!
9791189709020,10,역시 멈추지 않는 드립력
9791189709020,10,돼영제국 생각나서 자다가도 웃었...ㅠㅠ
9791189709020,10,계속해서 나오는거 실화임???
9791189709020,8,12월 30일 발간 예정이라는게 스포일러
9788984354265,8,토판을 발굴하고 해독한 학자의 편집에 의해 소개되는 고대 수메르의 기록들. 토판 발굴 초기 학자가 소개하는 이야기라 감회가 새롭다
9788984354265,8,잘 알려져 있지 않은 세계최초의 문명 수메르에 대한 다양한 이야기를 담고 있지만시간 순서가 아닌 주제에 따라 책이 진행되다보니 중간중간 흐름이 끊어져 아쉬운 책
9788984354265,10,점토판으로 해독되기 시작한 인류 최초의 역사...나는 구약 창세기란 것이 수메르점토판의 해적판이다라는 것에 급관심이 쏠려 현재 구할 수 있는 서적을 다 확보했다.흥미로운 독서가 될 것같다.유튜브에도 동영상이 좀 있으니 참조하시길...
9788984354265,8,Informative
9788984354265,10,전문가가 정리한 고대 문명이야기
9788984354265,10,수메르!! 역사의 시작이었다. 39개의 최초의 사건들을 잘 해석해 놓은 책이다.
9788967351281,8,"이 책은 수부타이 위주의 이야기를 풀어나가고 있지만 일반적인 인문역사서가아닌 군역사서이다. 따라서 전략과 전술 위주의 해설이 많고, 마지막엔 그런 부분에 대해 정리된 챕터가 따로 있다."
9788967351281,8,이런 장수들이 있었으니 그렇게 전세계를 휩쓸수가 있었겠지..반항하면 나라와 민족이 아예 역사와 지도에서 소멸하고 항복하면 살려주고..
9788967351281,10,한때 세계역사의 지도를 바꾼 장군인데 한족이아니라서 그런지 푸대접을 받다가 결국 서양인의 손에 씌여졌네요 ...
9788967351281,10,최고의 전략가 ...
9788967351281,10,역사속에 가려진 새로운 인물을 소개하였습니다.
9788967351281,6,제목 그대로 ｀ 칭기스칸의 위대한 장군;이다 그러나 당한 입장에서 보면 너무나 잔인한 인물이다
9788967351281,6,BBC에서 선정한 명장 순위는 인터넷에서 떠돌던 거짓자료 아닌가요? 암체어 것만 진짜로 알고있는데..
9788994606309,10,"평범해보이는 고수. 15~19C 동북아 파노라마를 무겁거나 추상적이지 않은 생생한 이야기로 조근조근 펼쳐 보이며 조선의 유니크함에 대해 균형 있게 평가. 19C 비극이 16C 전세계 은의 흐름에서 잉태되는 중에, 조선은 그 흐름에서 멀찍이 나와 있었어도 어쩔수없이 언제나 세계사 흐름 속에 있었다는."
9788994606309,10,조선과 명청의 관계가 오늘날 북한과 중국과의 관계를 엿보는 키워드라고 생각해서.
9788994606309,8,"단일 역사가 아닌 조선과 중국이라는 거대한 관점에서 바라본다는 점에서 흥미롭다. 일본에서의 최신 중국, 한국 관련 이론도 포함되어있으면서도 쉽게 이해할 수 있도록 써놨다."
9788994606309,8,좋은 책인데... 개정판을 냈으면 뭐가 바뀌었는지 좀 자세히 알려주면 좋겠다.
9788992985765,10,"차의 역사로 본 재미있는 동아시아 사회경제문화사. 보이차를 자주 마셔서 호기심을 가지고 읽어 보았는데 기대 이상의 내용. 차 문화 출발과 번성 이유, 동아시아및 세계에 미친 영향들이 이해하기 쉽게 쓰였다. 차의 역사를 공부하며 동아시아 문화 전반을 자세히 공부한 느낌."
9791160946680,10,"1부에서는 몽골 제국의 정복과 분열을, 2부에서는 몽골 제국이 세계사에 끼친 정치/문화/사회/경제적 영향을 정리했다. 몽골 제국을 ‘세상의 정복자‘가 아닌 ‘세상의 변화자‘로 재조명하는, 좋은 몽골 제국사 입문서."
9791160946680,10,잘 쓰인 몽골제국사 입문서. 개설서의 넓이와 전문서의 깊이를 고루 갖췄다.
9791190630788,10,무조건 별다섯이죠. 겨울내내 기다려 왔다. 어서 7권 사봐야지. 갠적으로 태평천국의 난이 재미있었고 공부도 많이 되었다. 한중일 비교하는 입체적 역사공부 넘 재미있는 걸.
9791190630788,10,정말 오래 기다렸습니다..... 단행본으로 보려고 계속 기다렸어여.....
9791156121473,10,그냥 교과서 같은 책이고 또한 논문 같은 책이다. 하지만 쉽게 써놓은 책이라서 학생이든 직장인이든 교양서적으로 읽어봤으면 하는 책이다.
9791190182911,4,"내용이 충실하긴 하나 어휘 선택과 문장 표현을 다듬었으면 좋았겠다. 꿘 파워, gg친다, 천하의 빌런, 퍼펫 소굴....같은 컴퓨터게임 은어 사용을 너무 남발하여 개인적으론 조금 짜증스러웠다. 재미를 살리고자 한 의도는 이해하겠지만 지나치면 독이 된다."
9791190182911,8,7권 언제 나옵니까 눈 빠질것 같슴돠 ㅠㅠ
9791190182911,10,7권 왜 안나오나요???
9791190182911,10,굽시니스트. 말이 필요없다. 복잡한 동북아 근대사를 가장 쉽고 재미있게 알 수 있는 만화.
9791190182911,10,현대의 일본을 이해하기 위해서는 메이지 유신을 반드시 알아야 하는데이해하기 쉽게 그 이전의 역사를 보여주고 있습니다.
9791160870442,6,"베네딕트 앤더슨이 동남아시아 지역 연구에서 어떤 위상에 있는지를 아는 번역자 또는 편집자라면 적어도 책의 외국어 고유명사 표기 기준이 영어여서는 안 됩니다. 족자카르타 왕의 비서 ‘Soemardjand‘가 ‘소마르젠‘이고, 네덜란드의 자바 문학 연구가 ‘Theodoor Pigeaud‘가 ‘테오도르 삐고‘라니요..."
