ISBN13,rating,review
9791185473734,10,15분 요리랑 15분 운동이 정말 실천가능하고 쉽게 뚝딱 만들수 있어서 활용도가 만점인 책이여요!!!!  운동도 따라하기 쉽고 영상으로도 볼수 있어서 너무나 좋다는~~사두고 책꽂이에만 있는 그런 책 아니고 정말 본전 뽑는 책^^
9791185473734,10,"누구나 ! 타이틀이 너무나 와닿는 다이어트 책인섯 같아요! 초보로써, 시작함으로써, 거리감없고 쉽게 다가갈수 있는 다이어트책관련 정보와 식단, 운동까지 함께 병행항수 있어서 어렵지 않게 차근하게 시작할수 있을것 같아요!"
9791185473734,10,다이어트를 시작하며 식단도 운동도 너무 복잡해서 귀찮고 육아하며 할애할 시간이 커서 쉽지않았는데 저녁 30분 누구나 다이어트 책은 그 두가지를 다 한번에~! 30분만에 가능하게 하다니 정말 신기방기 꼭 필요한 책이라 바로 구매했어요ㅋ 건강한 식사와 운동법 너무 기대되요
9791185473734,10,"막 살을 엄청 빼겠다고 생각해서 산 책은 아니다. 몸이 건강해지고 40  이전에는 근육을 만들고 싶어서 산 책인데, 하루 30분 투자로 내가 세운 목표를 달성하는데 아주 가까워질듯하다. 운동 뿐 아니라 식단까지 친절하게 안내해주니 이거야말로 두 마리 토끼를 잡는거 아닌가. 고마운 책이다."
9791185473734,10,집에 다이어트식단책이  몇권있기에 조금 고민하다 주변평이 좋아 구매했어요 책을 받아보니 단순히 식단만 나와있는게아닌 운동요법까지 알차게 나와있어 넘 맘에 드네요 다이어트 레시피또한 간단해서 쉽게 만들수있단게 강점이구요 새해맞이로 다이어트! 이 책을 보며 성공하고싶어요
9791185473734,10,하루에 단 30분 투자로 건강한 다이어트를 할수있다니~그렇게 부담되지도 않으면서 꾸준하게 실천할 수 있겠네요.게다가 식단과 홈트를 동시에 배울수있어  다이어터에게 강같은 책이네요.안자매님의 비법이 궁금해요.특히 그동안 다정쌤 인스타로 다정팁과 운동영상 잘 보고있어서 무한 응원합니다!!
9791185473734,10,"다이어트란 안 좋은 습관, 식단에서 좋은 습관으로 변화하는 과정이 가장 중요한 것 같아요.그러한 과정을 처음에 잘 잡아 줄 수 있는 책이라는 생각이 들었어요. 단순히 초절식, 고강도의 트레이닝이 아닌 누구라도 쉽게 집에서 따라할 수 있는 내용이 담겨있어 좋네요."
9791185473734,10,다이어터라 다이어트 관련 레시피나 책을 많이 찾아보곤하는데 일상에서 다이어트를 하는데 많은 도움이 되는 책 같아요!!! 집에서 소장하고 많이 응용해서 다이어트 꼭 성공할겁니다^^
9791185473734,10,"저녁30분 누구나 다이어트알지만 어렵지만 또 시도해보지만 이 책과 함께라면누구나 된다. 식이요법, 운동법 두가지 토끼를 잡을 수 있는 책^^"
9791185473734,10,"워너비 몸매를 가지신 안다정,안다미자매님들이 레팩에 다이어트 책을 냈다고해서 구입해보았다.다이어트는 덜먹고 더움직이는것이 진리이기때문에 이런 서적은 잘 안보는 편이었다. 레시팩토리에서 내놓은 책인만큼 다이어트 레시피도 운동법도 놓치지않은 책이라 만족 또 만족스러웠다"
9791185473734,10,"다이어트는 무조건 굶는다고 성공하지도운동만 한다고 성공하지도 않는 까다로운녀석인데,그런 녀석을 잡도록 도와줄 책인것 같아요식단조절 운동길잡이까지, 다이어트할꺼라고 책을 몇번 사봤지만 번번히 앞부분 몇"
9791185473734,10,하루 30분으로 내 몸이 달라질 수 있다니 너무 기대돼요!!
9791185473734,10,"다이어트 요리하면 구해야하는 식재료들이 은근 까다롭던데 이 책은 구하기쉬운 재료와 3단계로 조리하는 넘나 간단 요리, 근데 포만감과 맛도 좋아서 너무 맘에 들고  홈트가 영상으로도 연결되니 초보자도 쉽게 따라할수 있겠더라구요~^^진짜 누구나 다이어트 가능할 멋진 다이어트책입니다"
9791185473734,10,건강을 위해서 뭔가를 시작해야하는데 무엇부터 해야할지 막막할 때 보면 좋은 것 같아요. 간단하고 맛있는 요리레시피부터 부위별로 알려주는 홈트까지 :)큐알코드가 있어서 더 따라하기 쉬워요.저녁 30분 누구나 다이어트 책보며 이번에는 건강 관리 꾸준히 도전입니다!
9791185473734,10,책에 욕심이 많아요.특히 레시피 책이나 다이어트 책에요.ㅡ.ㅡ그래서 많이 사고 잘 보지 않는데이번엔 잘 보고 열심히 실천해야 겠어요.책에 나오는 다이어트 레시피와 운동요법이 너무나 마음에 듭니다.
9791158463410,2,초보 베이킹 분들에게는 너무 어렵고 복잡해요새로운식자재는 물론이고 재료구하는데 돈이 너무 많이나가네요  일상생활에서 구할수 있는점이 없어서 아쉬워요
9791158463410,10,체중에 민감한 여성 고객들의 불안한 생각과 입맛을 동시에 잡을 수 있지 않을까 싶은 책!
9791185473604,10,다이어트 식사 루틴을 알아보면 거의 항상 오트밀 요리가 포함되어 있어서 호기심이 생겨 구매한 적이 있는데 막상 먹어보려고 하니 맛도 생각과 다르고 어떻게 요리해야 맛있게 먹을 수 있을지 떠오르지 않아 막막하더라구요. 그런데 이렇게 오직 오트밀만을 다룬 요리책이 나오다니 최고예요!
9791185473604,10,"이렇게 다양하게 오트밀을 즐길 수 있었다니, 정말 놀라웠고 유용했습니다! 추천합니다!"
9791185473604,10,가까이 두고 활용하면서 매력 만점인 오트밀을 이용한 다양한 요리를 만들어볼 수 있을것 같아서 기대됩니다
9791185473604,10,최초의 오트밀 전문 요리책! 수록된 레시피만 따라해봐도 생소한 오트밀에 대한 응용 감각이 생길 책! 쉽게 구할수 있는 재료 몇 가지 만으로도 가능한 레시피들! 단순하게 레시피를 모으기만 한 책이 아니라 작가님께서 집필에 거의 1년이 걸릴정도로 고퀄리티 책. 특히 베이킹 챕터는 보물같습니다.
9791185473604,10,오트밀이 좋다는건 알았지만 오버나이트 오트밀로만 먹어봐서 다르게 먹는 방법은 없을까? 하다가 알게된 책이에요! 일반 요리부터 베이킹까지 모두 들어있어서 오트밀을 알차게 활용할 수 있어서 너무 좋아요 ㅎㅎ 음료로 만들어먹는 방법은 또 처음이라 도전해보려고요! 감사합니다!!
9791185473604,10,오트밀에 관심밖이였다가 우연히 출간 소식을 듣고 책내용을 살펴보았다.식사대용과 간식으로 건강하게 먹을수 있는 레시피들이  신기하고 밀가루가 들어가지 않고 베이킹할수 있는걸 보고  당장 구입!! 사은품으로 왔던 오트밀로 나이트오트밀부터 시작해보니 생각보다 맛이 괜찮았다. 코스트코에서 대용량 오트밀을 구매해서 하루에 한끼는 나이트오트밀로 먹고 있다 .포만감도 좋고 건강해지는 느낌! 빵과 케이크를 좋아하는데 이젠 밀가루없이 오트밀가루로 건강한 디저트로 도전해봐야겠다. 신랑도 아침에 씨리얼로 때우는데  이제 슬슬 오트밀을 추천해줘야겠다
9791185473604,10,"오트밀이라는 새로운 재료를 사용해서, 밥부터 베이킹, 오나오, 스무디, 소스까지 어디든 사용할 수 있는 만능 재료라는 것을 보여줍니다. 오트밀 입문용으로 무조건 구입해야하는 기본서라고 생각합니다! 이 책을 통해 건강도 챙기고 요리에 재미도 붙이는 일석이조의 효과를 모두 누리셨으면!"
9791185473604,10,평소 오트밀을 즐겨 먹는 편이였는데도. 책에서 훨씬 더 많이 활용 할 수 있는걸 보고 놀랐어요!모카오나오나 크럼블은 바로 실행해봤는데 너무 간단하게 따라할 수 있는 레시피라 앞으로 하나씩 다 해볼라고요!!
9791185473604,10,"다양한 오트밀로 질리지 않게 다양하게! 건강요리로 맛있게!^^정말다양해요^^ 베이킹까지!다이어트하면 먹는게, 한정되어있는데,다양하다보니 이것저것 만들어 볼수 있어서 좋아요~^^ 고소하고 건강까지 챙기고, 포만감도 든든해서 한끼로 좋은것같아요!"
9791185473604,10,"지금 녹차바나나오나오, 오트밀크럼블 등 몇몇 요리를 해서 먹었는데 하나같이 다 맛있고 생각하지도 못한 레시피들이 가득해서 너무 좋아요. 오트밀 사놓고 신문지식감때문에 박아두신 분들은 이 책 보시고 오트밀의 매력에 빠질 것이라고 확신합니다!!"
9791196556686,6,한식에 설탕만 빠진거라 크게 특별한 레시피는 없어요 해키키를 더 추천드려요
9791196556686,10,키토식단에 처음 진입하시거나 요리를 잘 못해서 키토식으로 음식을 해먹기가 부담스러운 분들이 이 책을 만난다면 많은 도움받을 수 있을거 같아요~ 소장을 추천드립니다
9791196556686,10,"저탄고지를 만나고부터 요리를 시작하시게 된 분이라면, 이번 해피키토한식이 딱 좋을 거 같아요. 우리가 매일 먹는 기본반찬 레시피들이 다양하게 있고, 각종 요리팁도 무궁무진하거든요.  어느덧 15년차가 다 되어가는 저에게도 새로운 꿀팁들이 많이 들어있었어요."
9791196556686,10,"저 진주님 요리책 해키키와 해키키도시락 다 있는 사람이에요 ㅎ 한식편 안 살 수 있나요! 전과 나물, 국에 이르기까지 실용적 키토레시피가 가득합니다. 책장을 넘기는 맛은 해키키보단 덜 한게 아무래도 한식이라 정갈한 (이국적이지않은)비주얼 때문이겠죠. 늘 탁자에 두고 잘 참고할만한 책입니다."
9791196556686,10,"현재 고혈압이 진행중이고, 당뇨가 간당간당해요.키톡제닉을 시작했지만 여러 탄수인과 살고있어 완벽히는 안되요.그래도 1편인 해피키토키친으로 많은 도움을 받았어요.그래서 2편인 해피키토한식에도 큰 기대를 하게됐어요.아직 만든건 몇가지 없지만 기대되요~~~♡♡"
9791196556686,10,양식 레시피 위주의 기존 키토 레시피를 한식으로 전환할 수 있는 좋은 레시피북. 이제는 K-KETO 시대!
9791196556686,2,구매하려고 교보갔다가 이건 좀 심한데? 싶어서 돌아나오게 한 책. 해키키에서도 당황스러운(돈을 지불하고 사서 볼만한 수준이 아님)레시피가 몇 개 있었는데 이 책은 그 비중이 반 이상인 듯. 다음엔 제대로 된 책 내주세요. 기대했다 실망이 너무 크네요.
9791165213022,10,다이어트 요리책으로 참고하기 좋아요
9791165213022,8,다양한 레시피로 건강하면서 다이어트 할수 있는 레시피들이 많아서 좋아요
9788931459821,8,재료나 조리법이 생소한 것도 있지만 단계별로 접근할 수 있도록 구성되어 있어 괜찮아요. 조금씩 요리 실력이 늘어가는 재미도 있을 듯 ㅎㅎ
9788931459821,10,<건강한 집밥 외국요리편>이라고 보면 돼요. ^^ 저탄수고지방식 하면서 재료특성상 외국요리에 적합한 경우가 많아 요즘 한창 책을 보던 중이던차에.. 책 받아서 열공하고 몇가지 해봤는데 가공식품을 쓰지 않는 팔레오 레시피임에도 비교적 간단하고 맛있어요..재료본래의 맛을 많이 살려주네요.
9788931459821,10,팔레오 레시피라는 생소한 분야를 만화와 함께 접해보면 더 쉽게 다가갈 수 있을 것 같아요 한 가지 재료로 여러가지 방법의 음식을 조리해 볼 수 있는 레시피와 가공식품을 배제한 자연 식재료도 너무 마음에 들어요
9788931459821,10,키토제닉 카페에서 서평단에 당첨되어서 한번 받아서 읽어보게 되었는데 내용도 상당히 알차고 사진도 하나하나 자세히 나와있어서 좋았습니다!팔레오 다이어트를 하고싶은분들과 좀 더 건강하게 살고자 하시는분들은 한번쯤 구매해봐도 좋을것같습니다.그리고 만화도 중간에 나와있어 재미있습니다!
9788931459821,10,"가공하지 않고 건강에 이로운 진정한 자연 식재료를 섭취하는 식이요법 팔레오 이책은 팔레오에 관해 만화책 형식으로150개 이상의 팔레오 레시피를 배울수 있습니다 특히 이책은‘요리할 준비가 얼마나 되어 있는지’에 따라 목차를 나눠서요리할 시간이 충분하고 특별한 요리할 준비가 되었을 때, 미리 만들어 두었던 음식을 새롭게 재빨리 바꾸고 싶을 때, 요리할 시간도 없고 준비도 전혀 되어 있지 않을 때 등 요리할 준비가 얼마나 되어 있느냐에 따라 해당하는 파트로 가서 레시피를 보고 만들어 볼 수 있습니다이책 한권이면 맛있으면서도 영양이 풍부한 식사를 준비하는 즐거움 건강한 식단을 짜는 습관을 통해 각종 질병을 예방할수 있을것 같습니다"
9791196556617,10,와~~정말 필요한 책이예요키토식을하면서 헛갈리고 해먹을것도 없고 정말 난감한 상황이었는데 이책을 받아 보니 속이 다 시원하네요일상생활에서도 재료만 약간 바꿔서 조리하니 좋아하는 음식도 해먹을수있겠어요무엇보다도 초코렛 가득 발린 아이스크림을 보고 감탄했어요 ㅎㅎㅎ
9791196556617,10,일단 2가지 요리 따라해 봤는데 맛있었어요.많이 짜지 않고 자극적이지 않아서 좋았고요..남편이 키토제닉 다이어트중이라서 다양한 메뉴시도중이라서 아주 유용한 책이될거 같군요.
9791196556617,6,재료 목록에는 있는데 과정엔 어디에 쓰이는지 설명이 없네요. 과정이 자세하지 않고 간단하게 편집된 느낌. 두 가지 따라했는데 맛있었어요. 닭볶음탕은 칼칼한게 맛났습니다.
9791196556617,2,요리책 중에 가장 싫어하는 유형의 책입니다. 글자만 많고 중간 요리 과정이 사진으로 제공되지 않네요. 요즘은 유튜브에 링크까지 정확히 제공하려 노력하시는 분들도 많은데 최악이네요
9791196556617,10,아직 책의 전반부만 읽었지만 키토제닉에 대한 소개와 자세한 가이드가 잘 되어있어요. 실질적으로 실천하는 사람들에게 도움이 되는 도시락 싸기 노하우도 좋았습니다. 재료와 방법이 간결하게 정리되어있어서 매일 오늘 무엇을 먹을지 고민할 때 큰 도움이 됩니다. 추천해요. :-)
9791185473123,2,리뷰 보고 샀다가 너무 실망했어요.상식선의 내용들과당연한 칼로리 (양을 줄였으니까요)자주 보진 않을것 같네요.
9791185473123,10,추천! 다양한 책을 봤지만 이 책이 가장 간단하고 맛도 있고 요리수도 많아요. 찜 덮밥 비빔밥 샐러드 면 등 나누어 있어서 그때마다 골라서 볼 수 있어 좋아요.
9791185473123,10,요리와 다이어트 두마리 토끼를 다 잡아볼려고 ㅎㅎㅎ
9791185473123,10,이거 진짜 괜찮은 책이네요.요리책을 서너권 샀는데 제일 만족스럽습니다.구하기 어려운 재료도 없고 까다로운 조리법도 없이거의 모든 요리가 해볼만 하거나 해보고 싶은 구성이네요.최근 구입한 요리책 중에 제일 만족합니다.
9791185473123,10,다이어트 하시는 분은 사세요 파스타류부터 덮밥 볶음밥 아주 좋아요
9791185473123,10,믿고사는요리책 ㅣ레시피팩토리ㅣ이번책도 신뢰하는마음으로 구매정말 초보자입장에서 자세한 설명이 항상 좋다
9791185473123,10,다이어트레시피 굉장히 막막했는데같이 잘 할수있을것같아요단걸못먹는게 힘든타얍이 아니고 짜고 매운 한식식단을 못먹는게 더 괴로운 제게 딱좋은 레싶ㄱ
9791185473123,10,쉬운운동방법부터 국/드레싱/밥/면요리등 다양하면서도 자세한 레시피가 있네요 무엇보다 맛있는 음식입니다! 전혀 돈이 아깝지 않은 책입니다 너무 만족스럽고 좋아서 출판사의 다른 책도 구매하려구요!
9791185473123,10,배추덮밥 너무 맛있게 먹는 아이들 때문에 바로 구매합이다. 2016년엔 야채 안먹는다고 야단 그만치고 이제 배워서 맛있게 식습관 바꿔보려구요^^
9791185473123,10,더라이트도 정기구독하는데 이책도 보고싶네요~엄청 기대됩니다~~
9791185473123,10,"운동도 점점 건너뛰게 되고 몸은 불어나고 걱정인데, 이 책을 보고 건강한 식단으로 음식을 해먹어 봐야겠어요.자취하면서 아무거나 먹어서 복부비만이 심각한데 꼭 실천해서 효과를 보고싶어요~"
9791185473123,10,바쁜 직장맘이라 살찌는 줄 알면서도 볶음밥같이 금방하게 되는 음식들을 먹이게 되는데 요 책으로 건강하고 간편한 밥상을 차려주겠어요!
9791185473123,10,"가장 관심있는 부위, 쉽지 않은 부위에 관한 책이라 진짜 기대되요! 얼른 구매해야겠어요~"
9791185473123,10,래시피 팩토리에서 신간이 출간 되었다니 기대 됩니다^^레시피가 궁금하네요^^저도 구매하러~
9791185473123,10,믿고 보는 레시피팩토리 책! 더구나 뱃살 빼는 프로그램이라니 구매하러 갑니다^^
9791185473123,10,더라이트에 low GL 프로그램 잘 따라하고 맛있게 먹고 효과를 좀 봤는데 이렇게 LOW GL로만 구성된 책이 나오니 너무 좋아요^^ 얼른구매해야겠어요
9791158461683,10,든든하기 먹으면서도 건강하고 슬림한 몸매를 만들 수 있는 레시피를 통해서 지속 가능한 다이어트에 도전해볼 수 있을 것 같아요
9791158461683,8,"자유식을 먹어도 살찌지않는 레시피, 한그릇 든든히 먹을 수 있어 좋네요."
9791158461683,10,든든회 먹으면서 다이어트를 할수있다니 지인들에게 꼭 필요한 것 같아요!
9791185473093,10,책 구입하고 이 년이 넘었다. 지금 봐도 참 진국 레시피북이라는 생각이 든다^^ 주위에서 쉽게 구할 수 있는 한국 야채들을 활용해서 어떻게 그럴싸한 스무디를 만드는지 한 권으로 뚝딱 알려줌. 최고의 스무디 레시피북 :)
9791185473093,10,내몸과 가족이 건강해지도록 구입과 동시에 시작해 보련다.몸속 노폐물이 쑥쑥 빠지길 기대하며!!
9791185473093,10,"과일이랑 채소를 갈아먹은 후 별 운동없이 뱃살이 빠지고 피부가 많이 좋아진 것을 체감하고 있던 터라 더 열심히 하기위해 이 책을 구입했다. 대체 할 수있는 과일과 채소의 종류가 많고, 계절 별로 제철 스무디를 해 먹을 수 있게 분류해주는 작가의 세심함이 돋 보인다. 물론 맛 또한 좋았다^^"
9791185473093,6,재밌겠다. 해먹어야지 :)2015. Sep.
9791185473093,10,"아이스크림에 푹 빠진 아이에게 아이스크림 대신,다이어트로 한 끼 가볍게 먹고싶은 나에게 한 끼 식사로,부쩍 건강에 신경쓰는 남편에게 간식으로 챙겨줄 수 있는 건강스무디책 기대됩니다!"
9791185473093,10,정크푸드에 길들여져서 건강을 많이 잃어버린다는걸 매번 느끼던중에 이번에 로푸드에 관심을 가지게 되었습니다. 그야말로 생명을 주는 살아있는 재료를 고스란히 우리몸에 에너지를 주게되는게 바로 로푸드인것같더라구요!~사계절 내몸에 건강한 에너지를 줄수있는 로푸드스무디 정말 기대많이됩니다
9791185473093,10,쉽고 맛있는 레시피만 모은 알짜배기 책. 레시피 뿐만 아니라 생소한 로푸드에 대한 기본 개념과 채소의 손질 방법부터 남은 펄프 활용법까지 꼼꼼하게 챙긴 책! 개인 소장은 물론이고 선물용으로도 구입했다. 스무디의 처음부터 끝까지 친절하게 챙긴 책! 완전 추천합니다!!!
9788997449170,10,"해독주스 응용해서 자주 먹으니 활기차고 몸도 피부도 좋아지는 것같습니다. 몸이 차거나 추워질 때 해독주스, 스무디류는 따뜻, 미지근하게 해서 드세요. <올가니카 비건키친>도 샀는데 세계저명인사의 한국인 비건셰프가 저자인데 참조해볼만 한 것같습니다."
9788997449170,4,생채소냐 삶은채소냐의 문제는 좀 더 연구할 필요가 있더군요. 오히려 생즙을 선택하는 것이 훨씬 현명할 것 같아요.
9788997449170,10,책 보고 잘 만들어먹고 있습니다^^
9788997449170,10,평소 궁금했던 건데 책으로 만나 반갑네요^^
9788997449170,10,채소 과일은 생으로 먹는 게 최선이라고 생각했는데 흡수율을 높일 수 있는 방법을 배울 수 있어 좋네요. 독소까지 배출할 수 있다니 아침 저녁으로 챙겨 마셔야겠습니다.
9788997449170,8,"이런 건강에 관한 책, 참 좋습니다."
9788997449170,10,건강에 관심이 많았는데 한 번 읽어볼만한 책인 것 같습니다.
9788997449170,10,모든 치료의 첫걸음이 바로 해독주스임을 알게 되었어요.더욱 건강한 나를 만나기 위한 필수품인 해독주스를 통해 건강한 새해를 맞이하렵니다.
9788997449170,10,살면서 우리몸에 독소에 대해 잘모르고 해독주스가 어떤 작용을 하는지 잘 몰랐는데 책에는 다양한 기능의 해독주스를 만드는법과 효과에 기능이 잘 저술되어 있어서 좋은 정보가 많아서 좋은 거 같습니다.
9788997449170,10,진심으로 대단하신분의 책이네요 자연치료 정말 중요한 거 같아요 특히나 생활에서 간편하게 해독주스를 통해서 나의 건강을 챙길수 있다는 점에서 정말 좋은거 같아요
9788997449170,10,몸의 독을 해독하는 것이 정말 중요한 거 같아요. 해독주스 먹으면서 몸이 많이 가벼워지는데 서재걸 선생님 정말 많이 아시는거 같아요. 그리고 좋은 정보를 가르쳐 주시니까 더 좋네요.
9788997449170,10,굉장히 화제가 되었던 해독주스라 호기심이 생겨 집에있는 재료로 만들어 본 기억이나네요. 완벽히 따라하진 않았지만 그때 진짜 몸이 건강해지는 것 같은 느낌이었어요. 좋은것 보단 맛있는 것 위주로 먹었는데 이 책 보면서 잊고있던 해독주스에 대해 알아보고 제대로 만들어 먹어 몸 생각해야겠어요
9788997449170,10,해독주스 피부건강에 좋다고해서 집에서 만들어먹어봤었는데 이 책을 읽어보고 중요성과 필요성도 느낄 수 있겠네요.
9788997449170,8,해독 주스... 솔직히 맛은 없지만 건강을 위해 먹고있습니다.
9788997449170,8,독소를 빼주는 해독주스 유익한책이 되겠네요..
9788997449170,10,요즘 유행하는 해독주스에 관한 책이라 끌렸어요
9788997449170,10,해독주스에 관한 이야기라 해서 양배추삶은 물부터 생각했어요. 그러나 목차를 보니 이거 제가 오해 제대로 했네요. 해독에 관한 다양한 내용들이 들어있어보입니다. 직장생활하면서 몸이 축나고 있다는 느낌이 많이 드는데 책을 꼭 읽어봐야겠어요.
9788997449170,10,해독주스 건강에 참 좋다고 들어서 이 책을 보고 만들어먹었는데 참 만족스럽네요 ^^
9788997449170,10,"막연한 효능설명이 아닌 해독방법과, 원리등이 자세하게 나온 책"
9788997449170,10,어머님께서 관심있어 하셔서 읽어보게 되었는데 유익한 책이었습니다.
9788997449170,10,내 몸을 깨끗하게 그리고 건강하게 그리고 날씬하게
9788997449170,10,해독을 위해 이 책으로 레시피를
9788997449170,10,해독쥬스 좋다는 말을 많이 들어 만들어보려했는데 이책에서 자세히 설명되어있어 좋아요 .. 좋습니다.
9788997449170,10,"몸속 독소와 노폐물을 정화해주는 해독주스 어떤 채소와 과일을 함께 갈아마셔야하는지 생으로 먹어야하는것, 삶아먹어야하는 채소를 알려주네요."
9788997449170,10,건강에 관심을 많이 가지는 요즘 여러 방송매체들을 통해서 해독주스에 대한 효능을 듣고 관심을 가지게 되었네요. 처음에는 과연 효과가 있을까 반신반의하면서 마셨으나 요즘은 꼭 챙겨먹네요. 해독주스의 효능과 방법 등 상세하게 써져있어서 좋았네요
9788997449170,10,내몸의 독소를 빼주는 해독주스에 대해 자세히 알수 있어서 너무 좋습니다. 갈고 삶아서 먹는 과일과 채소는 90프로 이상체내에 흡수된다고 하니 앞으로는 그렇게 먹어야 겠어요.
9788997449170,10,친구가 해독주스 이 책을 읽고 직접 해독주스를 갈아와서 친구들과 함께 마신 기억이 있습니다. 건강해지는 느낌과 실제 그 날 든든하면서도 더부룩하지 않은 느낌이 인상적이었어요. 이벤트 도서로 다시 만나게 되어서 반갑네요^^
9788997449170,10,"요즘 유행하는 해독주스.
막연하게 블로그등 인터넷만 보고 따라해서, 이게 진짜 효과가 있을까 궁금했습니다. 근데 이 책을 통해 진짜 해독주스에 대해 알게 되어 좋았습니다. 만드는 방법과 왜 효과가 있는지에 대해 알게 되어 매우 명쾌했습니다."
