ISBN13,rating,review
9791155096130,10,파스타는 먹고 싶은데 해먹기는 귀찮을 때 이런 방식의 파스타도 괜찮을 것 같아요.
9791155096130,10,냄비를 이용해서 근사한 파스타가 만들 수 있군요. 멋지네요.
9791155096130,10,"이게 정말이라면, 저같은 싱글족 남자에겐 딱이겠어요. 요즘 쿡방이다 뭐다 방송에서 죄다 요리하는 거, 먹는 거 위주로 방송하다 보니 저도 어느새 그걸 따라하고 있어요. 재료와 솜씨도 중요하지만 주방 도구들도 무시못하는 게 요리더라구요. 그 비용도 만만찮구요. 근데 이걸 냄비하나에? 대박."
9791155096130,10,이것 저것 다 필요없이 냄비 하나로 만들 수 있어 좋다.
9791155096130,10,초보엄마인 저도 이 책으로 할수있을것같아요~가족이랑 오붓하고 고급지게 파스타해먹고싶어지네요~
9791155096130,10,냄비만으로 멋진 요리가 탄생할수 있다니 신기하네요 다른 음식도 이런 구성의 책으로 출간되면 좋을것 같습니다
9791155096130,10,시간과 도구가 부족해도 멋진 한끼를 만들 수 있다는 기획의도가 참 마음에 든다. 늘 먹던 파스타에서 벗어나 색다른 파스타를 즐기기에 손색이 없는 책이다. 냄비와 재료만 있으면 짧은 시간에 멋진 파스타 탄생! 바쁜 현대인들에게 딱 인 책!
9791155096130,10,요즘 요리에 관심이 많아졌는데 냄비로 파스타를 만들 수 있다고 하니 궁금해서 읽어보고 싶습니다.
9791155096130,10,파스타 면은 항상 냄비에 삶아서 따로 준비하고후라이팬으로 다시 요리하곤 했었는데레시피가 정말 반전이네요.따라하기 쉬운 내용으로 구성되어 있고 간단하게 외식 대신 할 수 있어서좋은 것 같아요. 파스타 너무나 좋아하는 1인으로서 이 책 대만족입니다.
9791155096130,10,요리는 유용하면 유용했지 쓸모 없지는 않다. 이참에 요리 스킬을 배우면 사람이 모일 껏이다.
9791155096130,10,"현대 사회에 와서 패스트푸드가 비약적으로 발전한 이유 중 하나는 현대인들의 바쁜 생활양식 때문일 것 입니다. 그런 의미에서 냄비파스타는 냄비하나로 요리에서 셋팅까지 가능하니 일석이조! 한 권 구비해놓고 바쁠때 이용해도 좋고, 특식으로 손님들이 왔을때 만들어도 반응이 좋습니다."
9791155096130,10,파스타는 어렵다고 생각하기 쉽다. 하지만 이 책과 함께라면 라면만큼 쉽게 해 먹을 수도 있겠다. 고3인 딸을 위한 야식으로 또 주말에 가족들을 위한 특별한 한끼 식사로 파스타를 만드는 것도 좋을 듯 하다. 흔히 아는 레시피뿐만이 아닌 처음 들어보는 생소한 레시피라도 간단하고 매력적이다.
9791155096130,10,파스타를 만들려면 왠지 우리가 모르는 조리도구가 필요할것 같은데 냄비 하나로 맛있는 파스타를 만들 수 있다는것을 보여줘서 기대됩니다.
9791155096130,10,파스타는 특별한 요리라는 생각에 집에서 자주 하지는 않는다. 특히 요리를 못하는 사람들에게는 어려운(?) 요리일수도 있다. 하지만 간단하고 빠르게 만들수 있는 레시피들이 담겨있다고하니 요리 초보들도 쉽게 만들어볼수 있을듯하다.
9791155096130,8,요즘 원팟 요리가 뜨고 있는데ㅎㅎ 이 책 유용합니다.
9791155096130,10,파스타를 너무 좋아하는데 재료 준비부터 과정이 번거롭다고 생각했거든요 이젠 초간단 레시피로 특별한 파스타를 만날수 있어서 너무 좋습니다 한번에 뚝딱하고 누구나 쉽게 따라할수 있고 먹음직스러운 새로운 파스타를 만나니 행복하네요
9791155096130,10,냄비 하나면 다양한 파스타를 아주 단순한 방법으로 만들어 먹을 수 있어서 얼마나 편한지 모르겠어요. 실용적인 레시피가 많이 담겨있어서 만족스러웠습니다.
9791155096130,8,한꺼번에 몰아 넣어 끓여도 된다는 발상의 전환을 주는 책. 재밌다.
9791155096130,10,뒤처리 귀찮아서라도 먹고 싶어도 잘 안했는데 쉽고 간단한 방법이 있었네요 유용한 레시피들도 많아서 좋았습니다
9791155096130,10,요즘 오일파스타 만들어먹는 재미에 푹 빠졌어요 ! 오일파스타 만드는게 라면만큼 쉬울 줄을 정말 몰랐거든요 ! 쉬운 파스타 요리법들에 대해 더 알고싶네요 !
9791155096130,10,맛나는 파스타가 기대되네요
9791155096130,10,가족들이 워낙 파스타 좋아해서 자주 해먹는데요. 냄비에 가능한 파스타라는 간단함과 신선함에 다양한 재료 사용할 수 있따는 점에 너무 알찬 책 :)
9791155096130,10,파스타가 어렵게만 느껴지는데 쉽게 따라할수 있는 레시피로만 되어있는거 같아서 관심이 가네요
9791155096130,10,집에서 간단하게 맛있는 파스타를!
9791155096130,10,냄비 하나로 간단하게 만들수 있다는게 역시 좋으네요 만들기는 좋아도 치우는거 싫어하는 저같은 사람에게 꽤 유용한 책입니다
9791155096130,10,맨날 파스타나 한 번 해 먹을까 하다가 재료 사오는 것 마저도 귀찮아서 거르는 게 다반사였는데 이 책 보면서 냄비 하나 끌어안고 따라해봐야겠네요 기대됩니다...
9791155096130,10,집 나온지 근 3년차입니다. 음식물 쓰레기 나오는 거 너무 싫어해서 밥을 거의 안 해먹고 일회용으로 해 먹는 걸 좋아하게 됐는데 냄비 하나면 근사하게 파스타 만들어 먹을 수 있다고 하니 도전해 보고 싶네요. 기대되는 책입니다.
9791155096130,10,항상 파스타를 망치는 저에게 가장 필요한 책인듯!
9791155096130,8,맛있는 파스타를 지금보다 더욱 간단하게?!! 세상에 천국이네요! ㅋㅋㅋ
9791155096130,10,"정말 간단하게 제대로 된 집파스타를 먹을 수 있는 책! 재료도 간단하게 정리되어 있고, 레시피도 간단하기 이를 데 없다. 그냥 따라했을 뿐인데 웬만한 이탈리아 가정식 부럽지 않은 한 끼를 즐길 수 있었다."
9791155096130,8,파스타도 만들려면 생각보다 냄비 챙기고 접시 챙기고 엄두가 안 날때가 많은데 냄비 하나로 끝낼 수 있다는데 확 끌리네요 ^^
9791155096130,10,귀차니즘과 자취의 콜라보로 한그릇 요리를 사랑하는 저에게 최고의 책이 아닐까 싶습니다.
9791155096130,10,많은 재료없이 간단하게 냄비하나로 쓱싹쓱싹 만들수있는 초간단 레시피 .이제 저도 집에서 주말에 파스타 해먹는 여자가 될꺼에요
9791155096130,10,냄비 하나로 짧은 시간 안에 쉽고 간단하게 만들어볼 수 있는 파스타 레시피라니 흥미롭네요 어렵다 귀찮다 핑계대지 말고 꼭 따라해보고 싶어요
9791155096130,10,정말 간단하게 만들수있을것 같아요 . 냄비파스타 왠지 양푼에 만드는 국수같은 느낌일꺼 같네요 ㅎㅎ
9791155096130,10,요리할 도구가 부족해도 요리할 시간이 부족해도 간단한 레시피로 만들 수 있는 파스타 요리법을 알려주어서 도움이 될 거 같아요
9791155096130,10,"냄비 파스타라는 제목만보고 덥썩 구입한 책인데요,레시피들이 참신해서 좋습니다. 조금 얇은 감이 있어서 아쉽긴 하지만, 그래도 내용의 탄탄함과 레시피들의 다양성으로 승부한것 같아서 만족하는 편입니다.냄비로 하니 얼른 만들어낼수 있고 비교적 손이 덜가는 장점이 있네요.열심히 만들어봐야죠."
9791155096130,10,만들기 어려울 거라고만 생각했던 요리들이 이렇게 한냄비로 만들수 있다니 생각 외네요. 한번 따라서 만들어보고 싶어요
9791155096130,10,냄비에 이렇게 요리가 담기니 고급스러우면서도 정겨워보이고 따라해보고 싶습니다.
9791155096130,8,파스타를 더 맛있게 만들어 먹을 수 있을듯해요
9791155096130,10,"파스타는 늘 어렵고 복잡한 요리인 줄 알았는데 조리에서부터 상차림, 설거지까지 냄비 하나로 완성되는 요리였다니! 혼자사는 사람에게는 재료부터 조리, 설거지까지 거의 완벽에 가까운 요리네요. 책 보고 배워야겠어요!!"
9791155096130,10,"파스타 따로 삶고 재료 볶고 소스 끓이고 하려면 솔직히 귀찮았는데, 냄비 하나로 파스타 만드는 법을 알려주는 책이라 좋아요! 여러 가지 메뉴에 도전해 볼 수 있겠어요."
9791155096130,10,"간단하기도 하고 설거지거리도 많이 안생길거 같아 꼭 따라해보고 싶어요, 이렇게 다양한 종류가 있다니 놀랍네요, 맛도 있을것같아요"
9791155096130,10,냄비에 간단하게 다양한 파스타 요리를 즐길 수 있도록 알려주어 좋네요
9791155096130,10,너무나 간단해서 친구들이 집에 오면 뚝딱 만들어줄수있을것 같아요
9791155096130,8,파스타 한번 하면 냄비부터 시작해 갖가지 조리도구들로 주방이 어수선했는데 냄비하나만으로도 다 해결이 된다는 게 정말 신기하네요. 이 책으로 파스타요리가 쉬워지길 기대해봅니다.
9791155096130,10,레시피 꼭 참고해서 다양한 파스타 요리에 도전해보고 싶네요~기대됩니다^^
9791155096130,10,"냄비로 시작해서 끝나는 다양한  냄비 파스타 레시피,어피 모임가면 꼭 파스타를 먹게되는데 잘못먹어서  파스타 입맛없는 사람이라 나는 왜이럴까 걱정했으나, 레시피를 보고 따라하기 쉽고 맛있게보여서 파스타를 좋아하게 됬어요,매우 큰 도움이됩니다. 강력추천해요~"
9791155096130,10,냄비에 파스타를 통째로 요리할수 있다는 생각은 못했네요. 마음에 드는 냄비 하나 구입해서 맛있는 파스타와 그릇째 사용할수 있는 실용적인것 같습니다.
9791155096130,10,"파스타는 한 접시로 식사를 끝낼수 있기 때문에 굉장히 간단해 보이지만, 사실은 손이 굉장히 많이 가는 요리다. 특히나 맛있게 먹고 나서 해야했던 엄청난 설거지들.. 그럼에도 포기하지 못하는 건, 해주면 가족들이 맛있게 잘 먹기 때문에. 이제 냄비 하나로 만들어 보자."
9791155096130,8,빠르고 실용적으로 파스타 요리 맛나게 만들고 즐길수 있는 책으로 기대가 됩니다.
9791155096130,10,냄비로 뚝딱 만드는 파스타 레시피들이 한가득입니다. 요즘처럼 한끼를 쉽고 빠르게 해결하고 싶어하는 때에 이 책의 레시피들은 참 친숙하면서 간단해서 좋습니다.이 책으로 파스타의 종류가 이렇게 많은 지도 처음 알았는데 앞으로 도전해볼 레시피들이 많아서 부자가 된 기분입니다.추천합니다.
9791155096130,10,"전통 냄비 파스타 레시피는 놀라움을 갖게 한다. 전문파스타 음식점이나 아니면 반 조리된 레토르트 파스타가 전부였던 것에서 벗어나 냄비하나로 만드는 파스타, 그 맛이 도 훌륭하다니.. 간편하지만 완벽한 한끼를 선물해주는 이 책이 나에게 선물이 된다."
9791155096130,10,시간과 도구가 부족해도 완벽한 한끼를 만들어 먹을 수 있다는 말에 반가움이 앞섭니다. 파스타를 좋아하지만 즐겨먹을 수 없었는데 이렇게 간편하고 쉽게 만들 수 있어 편안하게 즐길 수 있을 것 같아요. 심플한 냄비 파스타 레시피로 나만의 특별한 한끼를 만들 수 있기를.
9791155096130,10,"냄비에 라면을 끓이는 것처럼 파스타를 만들 수 있다면 누구나 만들어 먹을 수 있을 것이다. 지금까지와는 전혀 다른 파스타 요리는 누구나 쉽게, 부담없이 빠르게 할 수 있어 좋으리라 생각한다. 거기에 저렴한 재료를 쓸 수도 있으니.......당장 따라해보고 싶어진다."
9791155096130,10,야매 요리 같지만 정식 파스타의 맛과 풍미를 느낄 수 있는 정통 요리책
9791155096130,10,"냄비 하나로 가능한 레시피라니, 주방에도 요리하는 사람에게도 꼭 필요한 소품이 아닌가 싶어요."
9791155096130,10,파스타를 맛있게 만들어 먹기 위해서는 도구보다 식재료가 중요합니다.
9791155096130,10,파스타 종류도 많네요. 한 냄비로 저런 것을 다할 수 있다는 점부터 신기합니다. 요즘 아이들은 서구입맛이 입에 맞는지 해주면 좋아할 것 같아요. 재료야 마트나 인터넷으로도 구할 수 있으니 1인가구 시대에 맞는 메뉴이기도 한 것 같고 영양적으로도 크게 나쁠 것 없는 것같아요. 설거지까지 논스톱
9791155096130,10,"귀찮은 거 싫어하는 편이라 이것저것 만들어 먹으면서도 설거지 최소화, 재료 최소화 하곤 했는데요 냄비 하나로 끝난다니 확 끌리네요 음식도 맛있어 보이구요! 기대가 됩니다!!"
9791155096130,10,냄비 하나로 여러가지 다양한 레시피의 파스타를 만들 수 있다니 너무 매력적입니다. 꼭 따라 해봐야겠어여~
9791155096130,10,파스타와 냄비의 조합 만큼 집안에서 쉽게 먹기 좋은 조합은 없습니다. 식당에서는 대형을 쓰지만 소규모인 경우에 매우 적합한게 냄비입니다. 특히 이 책에서 다양한 파스타 요리에 대해 설명해 주고 있어 마트에서만 먹는 스파게티가 아닌 다양한 스파게티에 대해 설명해 주고 있어서 고맙습니다.
9791155096130,10,파스타를 냄비로 해먹을 수 있다는 것만으로도 간편함이 전해져옵니다. 사실 파스타를 좋아하면서도 쉽게 하지 못하는 것은 쉬운 것 같으면서도 어렵기 때문이에요. 책속에 실려있는 레시피로 내 손으로 만드는 파스타로 즐거운 만족감을 얻게 되기를 기대하며.......
9791155096130,10,"냄비하나로 라면만큼 쉽게 만들 수 있는 ｀파스타｀라니..정말 기대됩니다. 냄비하나 들고, 책 사들고 당장 시작해야겠어요~~~"
9791155096130,10,냄비에 이렇게 요리가 담기니 고급스러우면서도 정겨워보이고 따라해보고 싶습니다.
9791155096130,10,맛있고 보기 좋은 파스타를 이렇게 쉽게 뚝딱 만들 수 있게 해주는이 책은 정말 저에게 딱이네요~~
9791155096130,8,식당의 메뉴판 같은 표지가 재미있네요. 다양한 냄비요리들을 책 한권으로 만나볼 수 있어 요리하고 싶게 만들어요
9791155096130,10,냄비에 요리하는 초간단 파스타 레시피..집에서 꼭 만들어 보고 싶네요..기대됩니다~~
9791155096130,10,냄비 파스타라니!! 생각했던 것보다 어렵지 않고 다양하게 응용해볼 수 있는것 같네요. 실 생활에 적용할 수 있는 아이디어가 많아서 기대됩니다!
9791155096130,8,여러 종류의 파스타 요리를 냄비 하나로 간단히 만들어 집에서 즐길 수 있어 좋네요.
9791155096130,10,파스타를 좋아해서 여기 저기 맛집을 찾아다니다 이제는 직접 만드는 재미에 푹 빠졌어요!  식재료만 달라지면 정말 특색있고 맛에 멋까지 가미되는게 파스타 레시피인 것 같아요. 한식에 비해 간단하지만 맛있게 먹을 수 있는 피스타가 담긴  이 책을 통해서 실력 발휘할 수 있을 것 같아요!
9791155096130,10,파스타를 집에서도 쉽고 건강하게 만들어 먹을 수 있는 방법을 배울 수 있어서 좋습니다.메뉴도 다양해서 더욱 기대됩니다.
9791155096130,10,"요리를 먹는 즐거움을 느끼기 위해서 너무 많은 과정이 들고 치우는 것이 힘들면 맛있는 음식도 잘 못먹게 되는데, 이렇게 좋은 방법이 있다니 반갑습니다. 소박하지만 맛있고 따뜻한 음식을 만날 수 있도록 안내해주는 책이라 가까이 두고 친해지고 싶다. 자주 해먹게 될 것 같은 요리라 반갑다."
9791155096130,10,"파스타 정말 좋아합니다! 면을 삶은 다음 팬에서 볶은 야채랑 같이 볶아주는 과정을 거치는데요, 더 간단하게 만들 수 있는 냄비 파스타라니 끌리네요!! 구매합니다!!"
9791195385423,10,요리에 관심 많으신 분께 선물했어요. 좋아하시네요
9791195624003,4,꿀키님 레시피 좋아하는 사람인데 너무 기본중의 기본을 써서 그런가 간단하다고 해야하나 성의가 없다고 해야하나... 좀 실망스러운 부분이 있지만 다음책에서는 좀 더 난이도 있는 책을 기대해 봅니다.
9791195624003,10,"알찬 구성이 좋습니다! 앞부분 꿀팁도 은근 유용하고, 자주 참조할거 같습니다"
9791195624003,10,워낙 유명하신 블로거라 가끔 구경하고 있었는데 이렇게 책이 나오네요!혼자살다보니 따라할 만한 레시피가 많아서 기대되요
9788996950523,8,발효식초의 기본개념에 대해 공부하기 좋은 책. 도심속 아파트 베란다에서 소규모로 다양한 식초만들기 시도해보고 싶은 분들에겐 부족. 그리고 여기에도 종초에 대해선 그다지.... 지금으로선 카페에서 거래되는 종초를 구매하여 사용하는 수 밖에 없는 듯. ㅠㅠ
9788996950523,10,꼭 만들어 보고 싶은 전통발효식초식초만들기 초보자인 저도 전통발효식초를 쉽게 만들수 있도록 설명과 사진이 잘 나와있네요
9788996950523,10,기다리던 책이 드디어 출간되었다.그림까지 자세하게 나와있어 초보자들도 가정에서 쉽게 따라할 수 있도록 되어있어 참고하기에 참 좋겠다.궁금함이 속 시원하게 풀리며 해결된다.
9788952775795,10,빵을 너무나 좋아하기에 이렇게 다라 만들고 싶어요. 집에서 놀고 있는 오븐을 가동해야겠습니다. 자신은 없지만 배우고 싶은 레시피에 반해 용기가 생기네요.
9788952775795,10,빵을 좋아하기에 직접 만들기도 했는데요. 다양하게 만들고 싶었던 차에 책 속의 레시피에 끌렸답니다. 모두 도전하고픈 맛있는 레시피이기에 군침이 돕니다.
9788952775795,10,브런치를 좋아하는데 메뉴도 다양하고 ..디저트까지 너무 완벽한 책이네요~~샌드위치도 꼭 따라서 만들어 보고 싶어요^^카나페는 티타임에 너무 좋을 꺼 같아요♡♡빵이라는 주재료이지만 채소를 곁들여서 다양하게 연출되는게 너무 멋진 일이예요^^*
9788952775795,10,이런 좋은 책을 만나게 되어 기쁘네요
9788952775795,10,비교적 간단하게 만들 수 있는 요리 세 가지가 다양한 레시피로 소개되어 있는 책이라서 무척 좋아요. 친구나 다른 손님 왔을 때 얼른 만들어 대접하기에도 딱이네요! 게다가 저칼로리 저녁까지! 저칼로리로도 맛있게 만들어 먹을 수 있다는 데에 아주 많이 기대가 되는 책이에요.
9788952775795,8,식사용으로 먹기 딱 좋은 빵 구성이네요. 빵은 주로 간식용으로만 먹는데 여기에 있는 빵들은 대체적으로 달지 않고 위에 부담이 덜가면서 들고 먹기 편한 것 같아요. 특히 홈파티 같은 것 할때 매우 유용하다 싶네요. 다양한 재료로 보기도 좋고 맛도 좋고 건강하게 만들기 쉽지 않으니까요.좋네요.
9788952775795,8,빵은 그냥 사다먹고 식빵으로 계란이나 잼 바른 토스트만 해먹곤 했는데 이렇게 다양한 레시피가 있다니 정말 해먹고 싶어지네요 레시피대로 따라하면 저도 맛있는 브런치나 빵을 이용한 요리가 될것 같아요 아이들 간식으로 만들어줄때 꼭 필요한 책이네요
9788952775795,10,특별하면서도 맛있는 레시피로 가득해서 좋네요.
9788952775795,10,"샌드위치,토스트,카나페로 만찬이 차려질수 있다는것에 깜짝 놀랬어요.정갈한 만찬에 초대된것 같은 사진 덕분에 읽는 내내 행복했답니다. 저도 열심히 레피시를 따라하고 있는데 맛도 아주 좋아요.신선한 재료로 정성스레 만들어 가족들에게 칭찬 들었답니다. 감사합니다."
9788952775795,10,요즘 빵 만들기에 취미가 생겼는데 이 책을 읽어보면 많은 도움이 되겠습니다.
9788952775795,10,"아침을 거즘 안 먹고 가는데, 먹어도 간단히 모닝빵이나 토스트를 해먹고 가는데, 이 책을 보면, 좀더 다양한 방법을 알 수 있어 보다나은 영양가 있는 아침을 먹을 수 있을 것 같아요^^"
9788952775795,10,화려한 완성품과는 다르게 칼로리 걱정도 덜 수 있고 일석이조네요
9788952775795,10,간단하게 집에서 만들수 있고 영양밸런스를 맞출수 있어서 도움이 되겠네요.
9788952775795,10,요리가 취미생활 이거나 간단히 간식 만들어 먹기에 좋다.
9788952775795,8,기본빵으로 다양한 요리가 가능하다는 사실을 알게되었습니다
9788952775795,10,영양 밸런스도 맞출 수 있고 식사대용으로도 만점인 것 같네요.^^ 레시피대로 따라해서 만들어봐야겠어요.
9788952775795,8,바쁜 요즘 가족들에게 편하게 먹을 수 있으면서 영양가를 다채워놓은 샌드위치 레시피를 기대해봅니다.
9788952775795,10,저녁이 즐거워지는 시간^^
9788952775795,10,나의 식탁이 이 책으로 인해서다채롭고 풍요로워 질거라는 확신이 듭니다~~
9788952775795,10,맛있는 디저트및 음식을 좀더 알차고 맛있게 만드는법을 보여주네요.. 정말 제대로 한번 도전도 해보고싶고 만들어 보고싶습니다. 이책 하나만 있어도 가게를 열어 장사를해도 한해 1억이상은 벌겠네요. 돈벌기 참 쉽죠.. 이책 하나만 있으면되니.. 적극추천입니다.
9788952775795,10,맛있는 음식이 가득해요
9788952775795,10,"제빵을 신나게 하다보면 남는 빵이 남기 마련인데, 남는 빵을 어떻게 사용할지에 대해서까지 나오니 더 좋네요! 장바구니에 쏙!"
9788952775795,10,"미호의 책들은 대부분 깔끔하고 언제 읽어도 부담이 없는데, 이 책 또한 굳이 꼭 이걸 만들어야겠다! 하지 않고 그냥 슥 봐도 좋습니다. 어려운 설명도 아니기에 슬렁슬렁 보다 어느 날 재미삼아 만들어보기에 굿!"
9788952775795,10,"이제 브런치 식당이나 카페 같은 곳에서는 가격이 너무 비싸서 사먹기가 부담스럽더라고요. 그래서 요즘에는 책과 인터넷을 보면서 직접 만들어 먹으니 입맛과 취향에 맞게, 가격도 절감하면서 재미도 잡고 있습니다^^ 이 책도 다양한 레시피를 알려준다고 하니까 좋네요 기대됩니다!"
9788952775795,10,빵을 먹는것도 만드는것도 정말 좋아하는데요 이 책에 제가 생각하는 기본 요리부터 아이디어 요리까지 다양한 건강 레시피가 있어 좋고 요리의 사진들도 너무 예쁘고 자세히 설명해주어 따라하기 좋은것 같습니다! 꼭 한번 읽고 싶고 매우 기대됩니다!
9788952775795,10,쉽게 구할 수 있는 빵으로 다양한 레시피를 시도해볼 수 있어서 좋아요 맛 뿐만 아니라 건강까지 챙겨주는 알짜배기 레시피라서 꼭 따라해보고 싶네요
9788952775795,10,"매일 아침 과일잼에 토스트가 지겨워질 무렵이었는데 이런 신간이 나오다니 솔루션이 나타났네요. 맛뿐만 아니라 칼로리와 영양소 밸런스까지 바로 잡는 방법이라니... 지금까지 빵을 대했던 저의 태도에 반성하게 되네요. 당장 샌드위치,토스트,카나페 정독해야겠어요 :)"
9788952775795,10,"빵순이 엄마를 위해 준비된 책인 듯 합니다. 케이크는 밥솥을 사용해서 만들어 본 적이 있어요. 그 때가 중학교 때 였던 것 같은데, 꽤 쉽게 되서 놀랐던 기억, 스프도 직접 밀가루 사용해서 만들어보구요. 만드는 거 좋아해서 이 책 사용해서 만들어보고 싶네요."
9788952775795,10,빵을 좋아하지만 레시피를 이용해서 만들어본적이 없는데 시도해보고 싶어지네요. 영양밸런스를 맞춘 간편한 레시피들이 담겨있는거 같아 기대됩니다
9788952775795,10,빵을 먹을때에도 칼로리를 낮추고 영양가를 높이는 레시피들이 많아서 관심이 가네요. 다양한 방법의 레시피를 통해 빵도 더 맛있게 먹을수 있고 레시피도 간단한거 같아 도전해보고 싶어져요 기대됩니다
9788952775795,10,"저칼로리와 영영까지 챙긴 빵으로 만든 샌드위치, 토스트가 너무 기대되며 꼭 한 번 만들어 봐야 할 것 같습니다."
9788952775795,10,"바쁜 직장일을 병행하면서 혼자 살면서 집에서 음식을 챙겨먹기가 쉽지 않은데요. 자주 거르는 것도 한계가 있고, 사먹는것도 한계가 있어서 이 책을 눈여겨 보았습니다. 간단식도 있지만, 간단하면서도 저칼로리! 구성도 있어서 먹으면서 관리가 되니깐 참 유용할 것 같단 생각이 들었어요!"
9788952775795,10,"빵이라면 정말 사족을 못 쓰지만 칼로리때문에, 살이 자꾸 쪄서 끊은 적도 있어요. 저칼로리 영양만점 빵요리책, 정말 기대됩니다."
9788952775795,10,나들이 갈 때 인스턴트 샌드위치를 사서 가곤 했는데 이젠 집에서 직접 만들어서 즐길 수 있을 것 같습니다. 조금 몸이 고생할지라도 더 건강하게 즐길 수 있을 것 같아요!
