ISBN13,rating,review
9788960517271,10,"우튜브로 계속 지켜봤었는데 이렇게 책으로 나오다니, 레시피만 따로 보고 싶을 때 딱 적당하네요. 소장각입니다!!"
9791196464462,10,재료 고르기부터 드레싱 선택까지 쉽게 밀프렙 할 수 있게 알려줘서 좋습니다~ 한 번 먹을 분량과 5일치 밀프렙할 양을 각각 알려줘서 쉽게 샐러드를 만들 수 있었습니다!
9791196464462,10,밀프렙 샐러드를 준비하기위항 재료손질 용기고르기 부터 보관법까지 상세하게 나와있어서 유용합니다!
9791196464462,10,"간헐적단식 시작 2주째, 야식안먹기는 성공했으나, 낮동안 마구잡이로 식사를 하는바람에 체중감량이 뜻대로 안되었어요.한끼는 샐러드로 대체하고자 책을 선택.여러 레시피가 있어 신납니다"
9791196464462,10,"최소 작심오일은 가는 꿀팁이지 않을까 싶어요!이 책 하나만 있으면 다양한 레시피가 있어 샐러드에 질릴 일이 없고, 그래서 더 오랫동안 다이어트가 가능할 것 같아요:) 게다가 내 손으로 직접 만드니까 시중에 파는 샐러드보다 믿음직스럽구요!밀프렙 샐러드 for 간헐적 단식 완전 추천해요!"
9791160801507,8,레시피를 꼭 안따져봐도 그냥. 정갈하니 예뻐서라도 부엌 책꽂이에 넣고 싶은 책. 보기만해도 각 채소 자체의 맛이 궁금해지는 깔끔한 편집이 좋다.
9791160801507,10,좋은 자극이 되었습니다. 게을러터져서 실천은 아직이지만...
9791160801507,10,"휘리릭 훑어보기에도 좋고, 두고두고 봐도 좋은 책이예요.요즘 항상 눈에 보이는곳에두고 실천중입니다.^^ 채소습관"
9791160801507,10,"‘채소 습관‘ 타이틀이 와닿아서 구매했습니다. 책을 읽고 궁금한 음식은 당근 카레와 쑥갓 주스입니다. 집에 당근, 카레, 귤이 있으니까 쑥갓만 한 단 사가지고 들어가면 둘 다 해서 맛볼 수 있겠네요. (아래 100자평 쓰신 분처럼, 저 역시 활자가 작은 게 무척 아쉽네요.)"
9791160801507,6,활자(글자체)가 작은게 아쉽네요..
9791160801507,10,평소에도 채식을 많이하려고 하는데 채소로 다양하게 해 먹을 수 있는 방법을 알려줘서 좋은것 같아요.
9791185401478,2,아무리 생각해도 요리책에 레시피가 제대로 나오지 않는다는 사실은 충격적이다. 이렇게 대충쓰고 만 삼천원이나 받아먹다니... 유튜버 하루한끼가 대세인 이유는 간단한 준비물로 정확한 레시피를 알려주기 때문이다.
9791185401478,10,요리를 너무 쉽게 하고 귀엽게 먹는다. 완전히는 아니지만 비건을 쉽게 시도해 볼 수 있을 것 같다.
9791185401478,4,요리 못하는 분께 레시피책으로는 추천드리지 않습니다멋도 모르고 따라 만들었다가 역겨워서 혼났음
9791185401478,8,읽고 나면 왠지 마음이 든든해지면서 나도 해봐야지 용기를 얻게 된다.
9791185401478,10,"‘채식‘에 방점을 둔 책. 요리가 아니라, 채식. 자랑이 아니라, 환경. 혼자가 아니라, 같이. 어렵게 말고 쉽게, 궁서체로 말고 명랑체로 하는 책. 재밌는 책."
9791185401478,10,"그림과 사진으로 되어있어 금방 금방 읽을수 있었고, 재료도 간단하고 조리법도 간단해서 쉬웠거든요.면요리와 특식 등 현미밥, 야채, 과일에서 좀 더 응용할수 있는 요리들이 많이 나와서 너무 좋았습니다.처음채식하는 사람이 쉽게 접근하면 좋을 책이에요"
9791185401478,10,좋아요 너무 기다리고 있었어요.. 유투브랑 인스타 구독하고 있는데 책으로 접하니까 또 새로워요. 간직하고 매일 꺼내볼게요. 항상 응원합니다!
9791197022043,10,"저탄수 베이킹이지만 케이크부터 식사빵까지 메뉴가 엄청나게 다채로워요.하지만, 에리스리톨이나 파우더 타입코코넛가루 브라운 스워브등의 재료를 정말 완벽하게 갖춰두고 시작해야 좋은 결과물을 얻을 수 있습니다. 베이킹샵에서도 구하기 힘들고, 해외배송인것도 있어요."
9791197022043,10,초보자도 쉽게 접근할 수 있고 아몬드가루와 코코넛 가루를 적절히 사용할 수 있는 레시피가 많아요.케이크 좋아하시는 분들에겐 건강한 케이크 만들어 드실 수 있어서 좋을것  같아요.빵순이지만 밀가루때문에 걱정이시라면 충분히 대체할 수 있는 베이킹이 이  책에 가득합니다. 추천해요♡
9791158462246,4,다이어트가 아니어도 간단히 식사준비하는데 도움이 됩니다.
9791158462246,10,"남편 퇴근이 늦는날 국,찌개,기타 반찬들 만들지 않고 가볍게 간단히 해결하고 싶은 찰라 아주 제목과 내용이 눈에 쏙 들어와서 구입한 책이에요. 시간이 아예 걸리지 않는 메뉴들은 아니지만.. 건강을 위해 날 위한 한끼 정도 해보기에는 괜찮네요.."
9791158462246,8,구매자가 한 명도 없는데 리뷰는 한가득인 이상한 현상..결국은 그냥 질러버렸고 현재 2주 레시피 실행중이다.제법 맛있고 따라하기 어렵지 않은 레시피지만 좀 대충 쓴 감도 없지 않다.몇 가지는 정말 맛있다!
9791158462246,10,1권도 참 도움이 되었는데 아무래도 밥이라고 하니까 시간은 천천히 걸리겠지만 더 건강하게 몸 관리할 수 있을 것 같아서 샀습니다. 기대했던 것어럼 이런 밥요리도 있구나 싶어서 얼른 요리를 따라하고 싶어지네요
9791187504085,10,주로 일반식 기준이다. 보면 나도 이정도는 따라할 수 있겠는데?하는 생각이 든다. 난 실제로 이 책에 나와 있는걸 참고해 그냥먹기엔 물리는 닭가슴살을 이용해 요리를 해 맛있는 음식을 먹을 수 있었다!
9791187504085,8,이 앞에 나온 책을 신주단지처럼 모시며 저만의 레시피로 만들어 애용하는 메뉴들이 많이 있습니다. 개정판 나온 것도 너무 좋으네요. 같이 도시락 싸는 동료에게도 추천했어요. 저염식 식단으로 꾸릴 수 있어서 생활 습관에도 많은 도움 되었습니다.
9791187504085,6,남편 배 좀 줄여보려고 샀는데 재료가 호불호가 갈리는 재료가 많아서 몇개 못만들었어요. 더욱이 외국에 계신 분이라면 이 책 비추해요. 도라지 깻잎 우엉 같은 재료들은 사실 한인마트에 팔긴하지만 구입하기 까다로울뿐더러 냉동보관해야하는 단점때문이예요. 저는 많은도움은 못받았네요.
9788954670296,10,케토채식에 대한 설득이 아주 명료하게 나와있다. 건강한 지방에 대한 설득과 몸의 에너지원에 대한 깊은 고찰이 인상깊다 ! 한식에 대한 레시피도 있었으면 좋을거같다는 생각이 든다
9788954670296,10,사람들이 알고 있는 키토제닉 다이어트의 다른 이름은 고기 다이어트다. 나 또한 고기만이 허용되는 다이어트라고 믿고 점점 힘들어질때 이 책을 만나 베지테리언 키토제닉 다이어트도 가능하다는걸 알았다. 상세한 설명과 요리법 까지 누구나 건강한 케토 다이어트를 시작할수 있다 이 책과 함께!
9788954670296,6,케토채식이 좋은 이유가 설득력 있게 서술되어 있다. 하지만 한식 위주로 식사하는 사람은 별로 먹을게 없을 것 같고 예시로 나온 레시피도 맛있어 보이지 않는다. 본인에게 어떻게 적용할지는 각자의 몫으로 남을 것 같다.
9788954670296,10,맛있는 음식을 약으로 활용하는 방법을 통해 건강한 식사를 할 수 있도록 도움받을수 있겠네요
9788954670296,10,채식과 케토제닉의 단점을 보완한거라 더욱 믿음이 가네요. 다이어트에 꼭 필요한 식단로 구성되어 있는것 같아 너무 좋아요. 꼭 필요한 책입니다.
9788954670296,8,키토제닉과 채식 사이에서의 균형점을 잡은 합리적인 식단에 관한 책. 저자의 소신처럼 우리 모두 각자에게 알맞은 방식의 식단을 찾는 것이 중요한 게 아닐까?
9788954670296,10,닥터 윌 콜은 현재 케토제닉 식단에서 발생되고 있는 여러가지 문제점들을 시원스럽게 풀어내고 있다.그러면서도 채식의 단점을 보완하고 케토제닉에 적용할 수 있는 채식의 방법을 다양한 각도로 제시한다.
9788954670296,10,와 식단 구성 괜찮네요! 채식이 좀 안 맞는다고 느꼈는데 여기에 케토제닉을 넣으니 더 저한테 잘 맞는 것 같아요 요리도 맛있어 보임 ㅎㅎㅎ
9788954670296,10,올 해 더 이상 미룰수 없다 결심하고 생애 마지막 다이어트에 도전중입니다. 지엠식단도 사실 견디기 힘들어 계속 고비가 오던중 새로운  케토채식을 접햇네요 ㅎㅎ 다시 고고합니다~~~
9788954670296,10,"정말로 건강한 식단은 우리에게 희망이고, 바램이다! 하지만 그렇게 하기는 힘들다! 왜냐하면 제대로 된 지식과 방법을 모르기 때문이다! 이 책은 그러한 우리의 문제점을 해결하여 제대로 된 건강한 식단을 제공한다!"
9788954670296,10,케토채식 처음 들어봤는데 정말 흥미롭네요~ 이 책을 통해 제 몸의 밸런스를 잘 찾아보고 싶네요~
9788954670296,10,내 몸을 건강하게 유지하고 올바른 식습관을 통해 우리몸에 완벽한 식사가 되도록 도움이 되는 책이라서 건강에 더욱 도움이 될 것 같아요..
9788954670296,10,"다이어트 식단들이 오히려 건강을 해치는 경우가 있는데, 이 책의 나온 식단들은 케노제닉과 채식의 장점만을 취하고 있어서 그런 면에 있어서는 안심이 되네요. 이 책의 도움을 받아서 건강한 다이어트를 성공할 수 있으면 좋겠습니다."
9788954670296,10,건강관리를 위한 식단 구성에 큰 도움이 될 것 같습니다. 케토제닉과 비건 식단의 장점만을 결합한 것이라고 하니 좋은 효과를 기대할 수 있을 것이라 생각합니다.
9788954670296,10,"무조건적인 다이어트적인 음식조절법이 아니라, 임상실험을 거쳐서 인증 된,  내몸의 신체대사에 알맞은 음식법을 찾을 수 있고, 더욱 건강한 식사를 이끌어 내는 요리법이 적혀있기에, 기대가 크고, 맛있고 건강한 아침과 저녁식사를 할  수 있을것 같아요."
9788954670296,10,"많은 분들이 관심을 갖고 있는 저탄고지 식단. 하지만 저탄고지의 장,단점은 물론 정확한 방법 조차 모르는 이들이 많습니다. 이 책은 저탄고지 식단인 케토제닉과 채식의 장점을 합친 케토채식 식사법에 대한 내용을 담았습니다. 저탄고지와 채식의 단점을 극복한 획기적인 식이요법입니다."
9788954670296,10,"채식이 안맞는 사람에게도,채식을 처음 도전하는 사람에게도 무리 없이 입문할수 있는 케토채식은 생소하다보니 이곳 저곳에서 자료를 끌어모아야만 하는데, 그 자료를 쉽고 지루하지 않게 정리해준 케토채식 책 하나면 도전해보기 쉬울 것 같아요. 더부룩하고 악영향을 끼치는 밥상은 이제 그만!"
9788954670296,10,"채식과 케토제닉의 장점을 합친 케토채식 식이요법과 식단을 소개한 책이에요.먹어야 할 음식과 먹지말아야 할 음식,글루텐,곡물,유제품을 배제한 75가지 케토채식 메뉴 및 4주간의 식단표와 레시피가 담겨있어요. 제대로 건강해지고 싶은 이들에게 이 책으로 케토채식에 도전해보면 좋을 것 같아요."
9788954670296,10,케토채식이라니 처음 들어보는 개념인데 정말 신기하네요. 식이요법의 끝판왕같은 느낌? 기대됩니다.
9791185473567,10,재료 그대로의 맛과 영양을 최대한 살린 에어프라이어 요리를 배워볼수 있을것같아서 기대됩니다
9791185473567,10,집에 있는 시간이 많아 에어프라이어로 이것저것 해볼까 해서 구입했습니다 간단하면서 건강식이라 저도 좋고 아이들도 좋아해요^^ 둘째가 책 가져와서 오늘은 이거! 내일은 저거! 매일 해달라는 해서 책 사길 잘했다는 생각이 듭니다~!
9791185473567,10,"요리를 하는 편이 아니라서 에어프라이어는 전자레인지 대용으로 사용했었는데,이렇게 쉽고 다양한 다양한 요리를 할 수 있는게 신기하고 재미있었습니다! 덕분에 다이어트에 도움이 많이 됩니다:)"
9791185473567,10,"다른 에어 프라이어 튀김 요리와 다르게, 공장표  튀김이 아닌, 최대한 수제로 칼로리 까지 염두를 하고 만들어 건강식 튀김으로 저자가 가족을 생각하는 레시피에 다이어트 효과를 도톡히 보는 음식류를 만들어 튀김을 포기하지 못하는 분들에게 체중 조절과 풍족한 섭취를 가능하게 도와준다."
9791185473567,10,에어프라이어 꿀팁이 떠도는 와중에 정확한 정보가 하나로 싹 정리된 자료가 필요하다면 두말않고 이 책을 고르시기를! 그림과 키워드로 잘 정리되어있어서 주방 서랍에 넣어두고 유용하게 쓸수있다.
9791185473567,10,"에어프라이어기를 사놓고, 냉동식품을 해동을 해  굽는 기본적인 간편조리만을 해왔는데, 건강다이어트 요리법 제목처럼 건강한 요리법을 전개하여, 보다 따라 요리를 할 수 있게, 아침과 저녁식사의 시간을 보다 효율적이고, 즐겁게 보낼 수 있도록 해주는 요리책  추천합니다."
9791185473567,10,요즘 젊은 사람들이나 요리를 좀 하는 분들에게 에어프라이기는 유명한 요리기구라고 생각합니다. 하지만 많이 알려진 만큼 제대로 쓰는 방법을 아는 사람은 드문 것 같습니다. 그들을 위해 나온 아주 유용한 책이네요.
9791185473567,10,"생활의 필수품처럼 자리잡은 에어프라이어.  이 책은 그 에어프라이어를 이용해 차별화된 건강한 요리, 건강한 다이어트 요리를 만들 수 있게 해준다. 덕분에 냉동식품만 튀겨대던 나의 에어프라이어가 훌륭한 요리사로 변신할 것 같은 기분이 든다."
9791185473567,10,"에어프라이어 입문자에게 필요한 정보의 기초부터 하나씩 알려주어 굉장히실용적이고, 가장 핵심인 메뉴들까지도 하루의 시간대별로 알차게 구성해주어 정말좋습니다. 평소 어떻게 해먹을지 난감해 손을놓은 재료까지도 정말간단히, 하지만 맛있게 먹을수있는 메뉴들이많아 정말 큰도움이 될것같습니다"
9791185473567,10,"매번 기름진 냉동제품 데우는거로만 써오던 에어프라이어가 이젠 요리도 한다!!! 다양한 에프요리책들이 나오지만 다이어트도되는 에프요리책은 첨인듯싶어요^^간식과 메인요리 몇개 해봤는데 너무 맛있고 아침,점심,저녁,간식으로 나뉘어 내맘대로 다이어트식단짜서 활용하면 좋을듯해요"
9791185473567,10,"콩콩이님 도시락 영상을 보며 에어프라이어 조리법이 궁금했었는데 책이 나와 넘 좋아요 그동안은 냉동식품 데워먹거나 삼격살 굽는정도로 활용했던 에프였지만 이 책 한권으로 브런치부터 디저트, 안주까지 다양하고 건강한 또 맛있는 요리를 만들수 있어 굿~!!"
9791185473567,10,이 책의 가장 큰 장점은 발상의 전환인것 같아요에에프라이어는 냉동식품에 최적화 되었다죽은 치킨도 살려낸다그래서 살이찐다그런데 이 책의 레시피들을 따라해보고서는건강하고 맛있는 요리도 가능하구나라는걸알
9791185473567,10,"초창기 에어프라이어 레시피라고 하면 냉동식품들이 대부분이라 딱히 소장하고 싶은 마음이 별로 안 들었는데, 에어프라이어로 만드는 ‘건강‘, ‘다이어트‘ 요리 레시피북이라고 하니 일단 콘셉트부터가 너무 와닿았다."
9791185473567,10,"요즘 가정에서 많이 사용하지만,감자, 만두, 치킨 데워먹는데만 거의 사용하는 것 같아요.건강한 요리와는 거리가 멀게 생각했는데다양한 다이어트 건강식이 소개되어 너무 좋아요~편하게 온 가족의 건강을 생각한 요리를 만들 수 있을 것 같아요~"
9791185473567,10,요즘에는 어느 가정에나 꼭 있는 에어프라이어-!에어프라이어 전용 냉동식품이 나올정도로 요즘은 필수템이 되었는데요항상 똑같은 요리만 만들어먹다보니 색다른 것도 도전해보고 싶지만 결국에는 또 그요리...이렇게 애정하는 레시피팩토리에서 에어프라이어 책이 새롭게 나와서 너무 좋아요
9791185473567,10,요즘은 마트에서 시식도 에어프라이어로 하고 에어프라이어용 냉동식품도 많이 나오더라구요. 거의 필수 가전제품이 된 느낌입니다.. 에어프라이어로 튀김요리만 해먹는다는 인식이 있었는데 이 책으로 하여금 건강한 레시피를 시작하고 또 다른 분들도 많이 전파해주셨으면 좋겠어요!
9791185473567,10,요리하는시간을 줄이기위해 에어후라이기를 사둔 워킹맘인 나에게 매번 간편식에 냉동식품만 휘리릭 돌려 먹인 후 괜한 자책감이 들게도 했는데... 이 책 한권이면 에피타이저와 메인요리후 먹는 디저트까지 한번에 코스요리를 즐길 수있는 레시피로 우리주방 총괄셰프 될듯.
9791185473567,10,"전자렌지만큼 익숙해진 에프. 매번 만두 먹고 삼겹살만 먹었더니 청소도 너무 힘들고, 살도 찌는 기분이었어요. 그렇다고 안쓰자니 자리도 많이 차지하고, 뭔가 아깝고. 약간 에프와 멀어질 것 같은 요즘인데 딱 제가 찾는 책이 나왔네요. 케일칩같은 메뉴 너무 좋아요"
9788970673530,2,보다가 짜증나서 구석에 두었습니다. 기본적인 재료 정리도 제대로 되지 않았습니다. 주요재료를 빼먹은 것도 있고 재료를 중복으로 기재한 것들도 있습니다. 차라리 키토카페에서 얻은 정보가 더 도움됩니다.
9788970673530,10,저탄수 고지방 다이어트를 결심하고 이런저런 책을 많이 읽게 되었는데 결국 중요한건 실천이더라구요. 제대로 실천해보고싶지만 먹지 말아야하는 음식들부터 맛있고 다양하게 어떻게 식단을 짤수 없을까 고민하던중 이 칙을 만나게 되었습니다. 4주식단구성으로 되어있어서 그대로 따라하기만 하면되
9788970673530,10,이 책 하나면 저탄고지를 쉽게 할 수있을것같아요^^음식종류도 다양해서 어떤 음식을 먹어야하는지 고민도 필요없습니다.매일 매일 종류를 달리해서 하는 키토식이라면 얼마든지 할 수있을꺼같아요!! 저는 활용도가 늪아서 강추합니다!!
9788970673530,10,저탄고지하는 1인으로서 이책은 진심 유용합니다.좀더 맛있고 즐거운 식단을 하기위한 래시피가 아침점심저녁으로 4주식단이 나와있으니  오늘은 어떻게 식단을 장만하지? 라는 걱정거리가 없어졌어여.   이런 키토식 책 넘흐 좋아여~~  일반 탄수식이하시는 분들에게도 유용할거같아요^^추천합니다.
9791159000522,10,"실제로 따라하기 쉬운 레시피로 되어 있고, 사진과 레이아웃이 너무나 깔끔해서 마음에 드는 책이다."
9791159000522,10,선생님~~~~~~~너무 예쁜 김옥란 선생님~ 감사합니다.몇권 구입해서친정엄마랑 친구랑 선물 할래요~!
9791159000522,10,책이 예쁘고 사진이 깔끔해서 좋네요. 다여트식 ‘무조건 맛있어야한다’니 정말 멋져요. 뭔가 속시원한 기분? 다만 이댁 할아버님처럼 살 빼시라고 엄마 선물해드릴건데 글씨가 좀작은게 아쉽네요. 그런것도 쬐꼼 고려해주시길 바래요.
9788968330278,10,메뉴 구성이 좋습니다. 장보기 쉬운 구성에도 높은 점수를 주고 싶습니다.
9788968330278,8,간단하고 좋네요
9788968330278,10,다시 다이어트를 시작하면서 참고할만한 샐러드책을 찾고있었는데 이책이 제일 적당해보이더라구요! 1주일마다 정해진 야채를 메인으로 샐러드를 구성해놔서 장 볼 때 낭비도 없고 좋았습니당 레시피들도 다 훌륭하구요 추천하는 책이예요
9788968330278,10,샐러드를 시작해보려고 구매했어요. 이제 책보고 따라서 한번 만들어 보려구요 구매할때 따라온 텀블러도 너무 좋네요. 책 따라서 주스 만들어서 텀블러에 마시려구요.
9788968330278,10,"아침에 산뜻하고 속편하게 주스로 시작하니 든든하네요~ 책의 레시피대로 신선한 과일야채를 부재료와 적합한 비율로 섞어 마신지 이틀뿐이지만, 확실히 구매하길 잘했다는 생각입니다*^^*"
9788968330278,10,식습관을고칠라고
9788968330278,10,음식을 이용해 몸을 정화
9788968330278,10,"장보기 편하게 되어있고, 양이 정해져 있어 좋아요."
9788968330278,8,요즘 건강에 관심이 많아서 읽어봤습니다.
9788968330278,10,집에서 손쉽게 만들수 있어서 정말 좋아요.간단하고 맛있습니다.
9788968330278,8,아침을 간편하게 먹으려고 하고 있는데 저녁도 맛난 샐러드로 간편하게 먹게 해주는책이에요^^
9788968330278,10,초보 요리인 제가 쉽게 따라할수 있는 재료와 설명이에요~책 구성이 보기 편하고 두고두고 하나씩 샐러드 해보면 건강해질거 같아요^^
9788968330278,10,아주 마음에 드는 요리책이었습니다.책을 따라 일주일치 장을 보고 책에 수록된 레시피들 따라해가며만들어보니 정말 남는것 없이 잘 먹어 뿌듯했습니다.건강주스 부분도 알고 있던 것 외의 재료의 쓰임에 잘 이용했습니다.
9788968330278,8,"건강 주스에 관한 책은 많지만, 2~3가지 재료로 1주일(?)동안 활용할 수 있는 주스와 샐러드를 함께 적어줘서 좋은 것 같다. 각 재료의 고르는 법과 손질법, 보관법도 나와있음"
9788968330278,10,요리할때 이미지 설명이 분명해서 따라하기 쉬웠구요.채소별로 좋은 점과 영양분이 설명되어 있어서 영양분에 따라 챙겨먹을 수 있어서 좋았답니다.
9791185473734,10,내 생활에 맞는 맞춤 다이어트 식단 짜는 법부터 운동 난이도에 맞춘 홈트 계획표 만들기까지 도움받을 수 있을것 같아서 기대됩니다
9791185473734,10,"무리하게 다이어트를 길게 하는 것보다 흥미를 가지면서 하루 30분이니 부담도 되지 않아서 이책을 샀었고 기대이상으로 다이어트에 재미도 생기고, 숙제처럼 하는 것이 아니라, 재미와 줄어드는 몸무게에 기쁨도 함께 하면셔 더욱 고맙게 읽은 책입니다."
9791185473734,10,"몸이 뻐근하고 허리 목디스크와 살도 찌는 것 같아서 다이어트를 알아보고 있었는데, 제목에 (누구나)라는 말이 희망적이라서 이책을 사게 되었습니다. 처음부터 어려운 단계가 아니라 누구나 손쉽게 할 수 있는 운동이라서 재미를 부치면서 즐겁게 운동할 수 있었고 너무 너무 도움이 많이 되었습니"
9791185473734,10,믿고 구매하는 레시피팩토리의 책! 레시피가 정말 초간단하면서도 보기가 쉽다. 배고프고 지친 저녁시간에 10분이면 뚝딱 준비할 수 있었다. 책에 소개된 홈트를 유튜브 영상보면서 하니 도움이 됐다
9791185473734,8,내용 갠찬아요 가독성도 좋고 무엇보다 쉬운레시피가 많아요 맛도 갠찮을듯
9791185473734,10,"코로나로 센터에서 운동하는 것이 여의치 않아진 이후 운동하는 습관이 완전히 무너져 건강에 적신호가 오기 시작하던 때에 만난 책입니다. 저녁식사로는 조금 양이 부족하지만 고단백 저칼로리로 식이조절하면서 홈트를 함께 할 수 있도록 구성된 책이라 구매했는데, 예상보다 훨씬 맘에 드네요."
9791185473734,10,새해되어 다이어트 계획하려고 구입했어요! 저녁식단과 30분 운동 등 부담없이 시작할 수 있어 좋은 것 같아요! 장보고 내일부터 다이어트 시작하렵니다^^
9791185473734,10,바쁘다는 핑계로 저녁식사도 대충 때우고 운동도 제대로 못하는데 짧은 시간에 알차게 따라할 수 있어 좋아요.
9791185473734,10,육아맘들은 사실 많은 시간을 할애해서 운동하긴 어려운점이 있죠~ ˝저녁 30분 누구나 다이어트˝ 란 책 제목에 끌려서 구입하게 되었습니다.저녁식단이나 간식으로 먹을 수 있는 15분이면 만드는 초스피드요리와 1
9791185473734,10,딱 지금 시국에 필요한 책인거같아요. 더군다나 전 헬스장이 멀리있는지라 이런 책 발간이 더 반가워요. 따라하기 쉬운 운동만이 아니라 쉽게 따라 만들어먹을수 있는 식단까지  모두 관리해주는 착한 책이라 좋아요.
9791185473734,10,식단과 운동 한 권에서 모두 만날 수 있는거 너무 최고 아니냐구요!
9791185473734,10,"일단 부담없이 저녁30분투자하는 다이어트라는게 좋은 것 같아요! ㅎㅎ 따라하기 쉽고 맛있는 간단한 레시피랑, 제가 체력이 많이 약한데 운동설명도 함께 되어있으니 좋네용 ㅎㅎ"
