ISBN13,rating,review
9788968330278,8,아침을 간편하게 먹으려고 하고 있는데 저녁도 맛난 샐러드로 간편하게 먹게 해주는책이에요^^
9788968330278,10,초보 요리인 제가 쉽게 따라할수 있는 재료와 설명이에요~책 구성이 보기 편하고 두고두고 하나씩 샐러드 해보면 건강해질거 같아요^^
9788968330278,10,아주 마음에 드는 요리책이었습니다.책을 따라 일주일치 장을 보고 책에 수록된 레시피들 따라해가며만들어보니 정말 남는것 없이 잘 먹어 뿌듯했습니다.건강주스 부분도 알고 있던 것 외의 재료의 쓰임에 잘 이용했습니다.
9788968330278,8,"건강 주스에 관한 책은 많지만, 2~3가지 재료로 1주일(?)동안 활용할 수 있는 주스와 샐러드를 함께 적어줘서 좋은 것 같다. 각 재료의 고르는 법과 손질법, 보관법도 나와있음"
9788968330278,10,요리할때 이미지 설명이 분명해서 따라하기 쉬웠구요.채소별로 좋은 점과 영양분이 설명되어 있어서 영양분에 따라 챙겨먹을 수 있어서 좋았답니다.
9788901114286,10,가족이 마주앉아 먹는 저녁식사의 의미를 더 많이 알려준책
9788901114286,8,집에서 먹는 밥이 최고다..
9788901114286,6,현대인의 건강을 잘 이해하고 설명하고 있음
9788901114286,10,최고
9788901114286,8,집밥의힘이란놀랍다
9788901114286,8,아기를 키우는 입장에서 읽어보니 공감도 많이되고 반성도 됩니다.외식 좋아하면 안되겠어요..집에서 다양하게 맛있는 먹거리 준비해보려고 노력해야겠어요
9788901114286,10,반정도 읽었는데  도움많이되네요       평소 장을 볼때 햄같은 가공식품을 가끔 샀는데  이책 읽고난후로는 마트에서 가공식품코너는 아예 가질않고  야채 과일 고기 생선 코너만가요  아이들한테  과자도  조금만 주고요
9788901114286,8,"별생각없이 쉽게 사먹이던 음식들.. 맛있으라고 쓴 양념들... 좋아하니까 사준 간식들... 이런것들이 모여 내아이를, 나를, 내 가족을 이루고 있었네요. 오늘먹은 음식은 내일의 나를 만든다는 말이 깨달아집니다. 어머니=집밥 이라는 공식을 다시되새겼네요."
9788901114286,8,건강이 최고입니다.
9788901114286,10,"늘 아무 생각없이 넘치게 먹고, 넘치게 양념장들을 쓴 것에 대한 반성이 된다. 엄마들 가족들을 위해 꼭 읽어보세요~!!!"
9788901114286,10,이책처럼 자주 꺼내읽는 책이 없을정도로 매우 유용합니다..외식하고 싶을때 꺼내서 읽게되네요~^^*
9788901114286,10,독한 음식이 얼마나 사람을 험하게 하는지. 좋은 음식이 얼마나 사람을 여유롭게 하는지. 텔레비젼을 통해서 한 번. 책을 통해서 또 한 번. 알게 되었습니다.
9788901114286,10,집밥의 힘.. ^^ 무시하면 안되겠습니다.
9788901114286,10,집밥이 최고죠!! 자기의 입맛에 맞는 반찬과 밥이 건강을 보장합니다.
9788901114286,10,정성이 들어간 음식의 중요성을 새삼 깨달았다. 요리도 즐겁게즐겁게~
9788901114286,10,책을 읽는동안  아이들에게 미안한 마음을 갖게했지만 더잘할수 있도록 도와준 책이다
9788901114286,8,양육 태도에대해 각성하게됩니다.
9788901114286,8,"뭐,,,그런대로,,,기대보다는 좀 못하지만,,,읽어 볼 만해요.^^"
9788901114286,10,"학원이 아닌 정성과 관심, 음식이 아이들의 성장이 중요한 이유를 알 수 있다"
9788901114286,10,아이를 키우는 부모들에게 꼭 추천하고 싶은 책입니다. 음식의 힘이 놀랍네요.
9788978494113,10,환우분들 모두 힘 내시길 바랍니다!
9788978494113,10,모두들 쾌유를 빕시다. 이겨내면 그만입니다.
9788978494113,10,"도움이 많이 되고 있습니다. 
암 환자는 채소만 먹어야 되는 줄 알았는데 치료 중일때는 잘 먹어야 된다는 사실을 배웠다."
9788978494113,10,친구 주려고 샀습니다. 도움이 많이 될 것 같아요
9791185473734,10,내 생활에 맞는 맞춤 다이어트 식단 짜는 법부터 운동 난이도에 맞춘 홈트 계획표 만들기까지 도움받을 수 있을것 같아서 기대됩니다
9791185473734,10,"무리하게 다이어트를 길게 하는 것보다 흥미를 가지면서 하루 30분이니 부담도 되지 않아서 이책을 샀었고 기대이상으로 다이어트에 재미도 생기고, 숙제처럼 하는 것이 아니라, 재미와 줄어드는 몸무게에 기쁨도 함께 하면셔 더욱 고맙게 읽은 책입니다."
9791185473734,10,"몸이 뻐근하고 허리 목디스크와 살도 찌는 것 같아서 다이어트를 알아보고 있었는데, 제목에 (누구나)라는 말이 희망적이라서 이책을 사게 되었습니다. 처음부터 어려운 단계가 아니라 누구나 손쉽게 할 수 있는 운동이라서 재미를 부치면서 즐겁게 운동할 수 있었고 너무 너무 도움이 많이 되었습니"
9791185473734,10,믿고 구매하는 레시피팩토리의 책! 레시피가 정말 초간단하면서도 보기가 쉽다. 배고프고 지친 저녁시간에 10분이면 뚝딱 준비할 수 있었다. 책에 소개된 홈트를 유튜브 영상보면서 하니 도움이 됐다
9791185473734,8,내용 갠찬아요 가독성도 좋고 무엇보다 쉬운레시피가 많아요 맛도 갠찮을듯
9791185473734,10,"코로나로 센터에서 운동하는 것이 여의치 않아진 이후 운동하는 습관이 완전히 무너져 건강에 적신호가 오기 시작하던 때에 만난 책입니다. 저녁식사로는 조금 양이 부족하지만 고단백 저칼로리로 식이조절하면서 홈트를 함께 할 수 있도록 구성된 책이라 구매했는데, 예상보다 훨씬 맘에 드네요."
9791185473734,10,새해되어 다이어트 계획하려고 구입했어요! 저녁식단과 30분 운동 등 부담없이 시작할 수 있어 좋은 것 같아요! 장보고 내일부터 다이어트 시작하렵니다^^
9791185473734,10,바쁘다는 핑계로 저녁식사도 대충 때우고 운동도 제대로 못하는데 짧은 시간에 알차게 따라할 수 있어 좋아요.
9791185473734,10,육아맘들은 사실 많은 시간을 할애해서 운동하긴 어려운점이 있죠~ ˝저녁 30분 누구나 다이어트˝ 란 책 제목에 끌려서 구입하게 되었습니다.저녁식단이나 간식으로 먹을 수 있는 15분이면 만드는 초스피드요리와 1
9791185473734,10,딱 지금 시국에 필요한 책인거같아요. 더군다나 전 헬스장이 멀리있는지라 이런 책 발간이 더 반가워요. 따라하기 쉬운 운동만이 아니라 쉽게 따라 만들어먹을수 있는 식단까지  모두 관리해주는 착한 책이라 좋아요.
9791185473734,10,식단과 운동 한 권에서 모두 만날 수 있는거 너무 최고 아니냐구요!
9791185473734,10,"일단 부담없이 저녁30분투자하는 다이어트라는게 좋은 것 같아요! ㅎㅎ 따라하기 쉽고 맛있는 간단한 레시피랑, 제가 체력이 많이 약한데 운동설명도 함께 되어있으니 좋네용 ㅎㅎ"
9791185473734,10,15분 요리랑 15분 운동이 정말 실천가능하고 쉽게 뚝딱 만들수 있어서 활용도가 만점인 책이여요!!!!  운동도 따라하기 쉽고 영상으로도 볼수 있어서 너무나 좋다는~~사두고 책꽂이에만 있는 그런 책 아니고 정말 본전 뽑는 책^^
9791185473734,10,"누구나 ! 타이틀이 너무나 와닿는 다이어트 책인섯 같아요! 초보로써, 시작함으로써, 거리감없고 쉽게 다가갈수 있는 다이어트책관련 정보와 식단, 운동까지 함께 병행항수 있어서 어렵지 않게 차근하게 시작할수 있을것 같아요!"
9791185473734,10,다이어트를 시작하며 식단도 운동도 너무 복잡해서 귀찮고 육아하며 할애할 시간이 커서 쉽지않았는데 저녁 30분 누구나 다이어트 책은 그 두가지를 다 한번에~! 30분만에 가능하게 하다니 정말 신기방기 꼭 필요한 책이라 바로 구매했어요ㅋ 건강한 식사와 운동법 너무 기대되요
9791185473734,10,"막 살을 엄청 빼겠다고 생각해서 산 책은 아니다. 몸이 건강해지고 40  이전에는 근육을 만들고 싶어서 산 책인데, 하루 30분 투자로 내가 세운 목표를 달성하는데 아주 가까워질듯하다. 운동 뿐 아니라 식단까지 친절하게 안내해주니 이거야말로 두 마리 토끼를 잡는거 아닌가. 고마운 책이다."
9791185473734,10,집에 다이어트식단책이  몇권있기에 조금 고민하다 주변평이 좋아 구매했어요 책을 받아보니 단순히 식단만 나와있는게아닌 운동요법까지 알차게 나와있어 넘 맘에 드네요 다이어트 레시피또한 간단해서 쉽게 만들수있단게 강점이구요 새해맞이로 다이어트! 이 책을 보며 성공하고싶어요
9791185473734,10,하루에 단 30분 투자로 건강한 다이어트를 할수있다니~그렇게 부담되지도 않으면서 꾸준하게 실천할 수 있겠네요.게다가 식단과 홈트를 동시에 배울수있어  다이어터에게 강같은 책이네요.안자매님의 비법이 궁금해요.특히 그동안 다정쌤 인스타로 다정팁과 운동영상 잘 보고있어서 무한 응원합니다!!
9791185473734,10,"다이어트란 안 좋은 습관, 식단에서 좋은 습관으로 변화하는 과정이 가장 중요한 것 같아요.그러한 과정을 처음에 잘 잡아 줄 수 있는 책이라는 생각이 들었어요. 단순히 초절식, 고강도의 트레이닝이 아닌 누구라도 쉽게 집에서 따라할 수 있는 내용이 담겨있어 좋네요."
9791185473734,10,다이어터라 다이어트 관련 레시피나 책을 많이 찾아보곤하는데 일상에서 다이어트를 하는데 많은 도움이 되는 책 같아요!!! 집에서 소장하고 많이 응용해서 다이어트 꼭 성공할겁니다^^
9791185473734,10,"저녁30분 누구나 다이어트알지만 어렵지만 또 시도해보지만 이 책과 함께라면누구나 된다. 식이요법, 운동법 두가지 토끼를 잡을 수 있는 책^^"
9791185473734,10,"워너비 몸매를 가지신 안다정,안다미자매님들이 레팩에 다이어트 책을 냈다고해서 구입해보았다.다이어트는 덜먹고 더움직이는것이 진리이기때문에 이런 서적은 잘 안보는 편이었다. 레시팩토리에서 내놓은 책인만큼 다이어트 레시피도 운동법도 놓치지않은 책이라 만족 또 만족스러웠다"
9791185473734,10,"다이어트는 무조건 굶는다고 성공하지도운동만 한다고 성공하지도 않는 까다로운녀석인데,그런 녀석을 잡도록 도와줄 책인것 같아요식단조절 운동길잡이까지, 다이어트할꺼라고 책을 몇번 사봤지만 번번히 앞부분 몇"
9791185473734,10,하루 30분으로 내 몸이 달라질 수 있다니 너무 기대돼요!!
9791185473734,10,"다이어트 요리하면 구해야하는 식재료들이 은근 까다롭던데 이 책은 구하기쉬운 재료와 3단계로 조리하는 넘나 간단 요리, 근데 포만감과 맛도 좋아서 너무 맘에 들고  홈트가 영상으로도 연결되니 초보자도 쉽게 따라할수 있겠더라구요~^^진짜 누구나 다이어트 가능할 멋진 다이어트책입니다"
9791185473734,10,건강을 위해서 뭔가를 시작해야하는데 무엇부터 해야할지 막막할 때 보면 좋은 것 같아요. 간단하고 맛있는 요리레시피부터 부위별로 알려주는 홈트까지 :)큐알코드가 있어서 더 따라하기 쉬워요.저녁 30분 누구나 다이어트 책보며 이번에는 건강 관리 꾸준히 도전입니다!
9791185473734,10,책에 욕심이 많아요.특히 레시피 책이나 다이어트 책에요.ㅡ.ㅡ그래서 많이 사고 잘 보지 않는데이번엔 잘 보고 열심히 실천해야 겠어요.책에 나오는 다이어트 레시피와 운동요법이 너무나 마음에 듭니다.
9791158463281,10,채소 요리를 맛있게 해먹는데 도움을 주는 이양지 선생님의 채소이야기와 어떻게 해먹을 때 우리몸에 좋을지 생각하게 해주는 책이란 생각이 들어서 꼭 읽고 싶어지네요.^^ ~~!~영양과 맛 두가지를 잡은 채소 요리를 통해 건강하고 균형잡힌 삶을 살고 싶네요.^^~~~
9791158463281,10,맛과 영양 최고인 채소 요리로 건강한 삶을 유지하고 싶어서 꼭 읽어 보고 싶은 무척 기대되는 도서 입니다 ♡
9791158463281,10,하루 한가지 채소요리를 통해서 건강한 몸과 마음을 만들 수 있으면 좋겠네요~ 채소가 몸에 좋은 건 알지만 잘 안 먹게 되서ㅠㅠ 이 책을 통해 채소도 좋아하게 되었으면 좋겠어요~ㅎㅎ
9791196556686,6,한식에 설탕만 빠진거라 크게 특별한 레시피는 없어요 해키키를 더 추천드려요
9791196556686,10,키토식단에 처음 진입하시거나 요리를 잘 못해서 키토식으로 음식을 해먹기가 부담스러운 분들이 이 책을 만난다면 많은 도움받을 수 있을거 같아요~ 소장을 추천드립니다
9791196556686,10,"저탄고지를 만나고부터 요리를 시작하시게 된 분이라면, 이번 해피키토한식이 딱 좋을 거 같아요. 우리가 매일 먹는 기본반찬 레시피들이 다양하게 있고, 각종 요리팁도 무궁무진하거든요.  어느덧 15년차가 다 되어가는 저에게도 새로운 꿀팁들이 많이 들어있었어요."
9791196556686,10,"저 진주님 요리책 해키키와 해키키도시락 다 있는 사람이에요 ㅎ 한식편 안 살 수 있나요! 전과 나물, 국에 이르기까지 실용적 키토레시피가 가득합니다. 책장을 넘기는 맛은 해키키보단 덜 한게 아무래도 한식이라 정갈한 (이국적이지않은)비주얼 때문이겠죠. 늘 탁자에 두고 잘 참고할만한 책입니다."
9791196556686,10,"현재 고혈압이 진행중이고, 당뇨가 간당간당해요.키톡제닉을 시작했지만 여러 탄수인과 살고있어 완벽히는 안되요.그래도 1편인 해피키토키친으로 많은 도움을 받았어요.그래서 2편인 해피키토한식에도 큰 기대를 하게됐어요.아직 만든건 몇가지 없지만 기대되요~~~♡♡"
9791196556686,10,양식 레시피 위주의 기존 키토 레시피를 한식으로 전환할 수 있는 좋은 레시피북. 이제는 K-KETO 시대!
9791196556686,2,구매하려고 교보갔다가 이건 좀 심한데? 싶어서 돌아나오게 한 책. 해키키에서도 당황스러운(돈을 지불하고 사서 볼만한 수준이 아님)레시피가 몇 개 있었는데 이 책은 그 비중이 반 이상인 듯. 다음엔 제대로 된 책 내주세요. 기대했다 실망이 너무 크네요.
9791185473260,10,"건강때문에 식습관을 바꿔야해서 구입한 책입니다. 식재료별로 어떤 요리를 할 수 있는지에 대한 뒷부분 목차가 아주 도움이 되고 있고, 2.1.1법칙 기억에도 잘 남고 요리할때도 어렵지 않은 법칙입니다. 장볼때 염두에 두고 식재료를 사고 있습니다."
9791185473260,10,서점에서 직접 보고 샀거든요. 책이 일단 예쁩니다. 딱 해보고 싶게 생겼어요. 내용도 알차지요. 먹는걸 바꿔야 건강한 삶이라는거 알면서도 사실 잘 못하는데 뭔가 쉽게 쉽게 만들수 있고 할 수 있는 요리들이 꽤 많아서 참 좋네요
9791185473260,8,요즘 방송에서도 많이 나오는 단어 ˝대사증후군˝ 식단관리도 중요하다고 생각되어 구매한 책으로 선물용이라 아직 제가 읽지는 못 했지만 선물 받은 분이 좋아했습니다.
9791185473260,10,"뭔가 싶던 대사증후군에 대한 설명과 경각심, 그리고 방지를 위한 다양한 식단들로 꽉 채워져있는 책. 혼자서라면 ‘제대로 하고 있나‘ 싶어 불안했을텐데, 이 책을 따라 하다보면 그런 불안감 없이 안정적으로 식단을 꾸릴 수 있어 좋았다. 계량부터 조리까지 하나하나 세심하게 안내해주고 있음."
9791185473260,10,요리법이 간단하고 잘 나와있어 쉽게 보고 따라 할수있네요건강하게  요리해서 .. 가족건강에 도움이 되었음 좋겠어요
9791185473260,10,대사증후군잡는식단 대사증후군에관심이생겨구매했습니다 제가몰랐던내용들이많더군요 과일도누군가에게독이고누군가에겐약이고 잡곡이며조리법까지 대사증후군을잡는식단에서많이배우고갑니다 참고하며음식해볼려합니다 이해가쉽게잘짜여져있어서좋ㄴ요
9791185473260,10,"식단 조절의 중요성부터 상세히 설명해두어서, 조리법이나 재료를 선택하는 데에 많은 도움이 되었습니다."
9791185473260,10,믿고구매하는 요리책 수퍼레시피 사이트ㅎㅎ 쉽고 이해잘되서 다른책들도 사볼까싶네요
9791185473260,10,"더 가벼운 도시락,뱃살잡는 Low gl 다이어트 요리책 두권 다 만족하고 믿고 구매하는 레시피책시리즈라 생각합니다 구성살펴보니 좋았어요 아쉬운점은 더 가벼운 도시락처럼 요리이름과 사진이 함께 정리되있어서 페이지 찾기가 수월했는데 뱃살잡는과 이책은 없어서 아쉬워요"
9791185473260,10,항상 믿고 구입부터 하고 보는 레시피팩토리 책~ 신랑과 제가 콜레스테롤 수치가 높아서 조절하려고 하는데 딱 마침 이런 책이 나오다니! 넘나 좋은 것~~ 열심히 맛있게 조절해서 먹도록 하겠습니다.
9791185473260,10,믿고보는 레시피팩토리!! 덕후가 되어버렸어요. 모두 수집할테다아~ GL책만으론 아쉬웠던 식단까지 있다고 해서 더 기대중이에요. 전 시키는대로 하는 스탈이라.. 이번엔 꼭!! 뱃살좀 줄여볼랍니다 ㅠㅠ
9788974793357,6,너무 단순합니다. 좀더 과학적인 고찰을 보태어 한차원 높였으면....그러나 말씀은 훌륭하지요.
9788974793357,10,"목차만 읽고 있어도 힐링과 명상인 책. 너무 아름답다. 단순한 음식책이 아니라 삶과 사는 법, 거기에 이어진 그리고 삶을 이어가는 먹는다.는 것에 대한 깊은 생각과 감명을 선사하는 책."
9788974793357,10,세속적인 가치에서 한 걸음 물러나 자연을 건강하고 넉넉한 마음을 담은 사찰음식을 보니 마음이 편안해지고 힐링이 되는 것 같아요. 사찰음식이 우리에게 주는 행복감과 불교의 깨달음을 책을 통해 알아갈 수 있어서 큰 의미가 있는 독서가 될 것 같아요. 자연과 함께 하는 삶이 아름답게 느껴지네요.
9788996347255,10,이책 만큼 자주 보는 책이 없네요~ 신간 또 내주세요~~
9788996347255,10,저자의 이유식 책 도움을 많이 받아서 이 책까지 이어서 샀습니다. 마찬가지로 책이 좋네요.
9788996347255,10,"레시피팩토리의 책은 믿고 구매해요. 6살 울아들 밥을 저보다 울신랑이 해준는 일이 많은데 서투른 우리 부부에게 좋은 책인 것 같아 기대되네요. 가장 평범함 요리를 가장 잘 알 수 있게 만든 책이고, 한번에 먹을 수 있게 되어 있어 좋습니다. ^^"
9788996347255,10,"인덱스가 있어서 해먹고 싶은 요리를 쉽게 찾을수 있고 챕터별로 반찬, 국물요리, 일품 등으로 나뉘어져 있어 편리합니다. 설명도 쉽게 되어있어서 좋아요"
9788996347255,8,첫 아이를 낳아서 키울때 제가 젤 어려웠던 것이 반찬 만들기 요리였네요. 그래서 주문한 책인데 괜찮아요. 아이들 먹이기 좋은 반찬들이 잘 정리되어 있네요.
9788996347255,4,"대체로 평이한 음식들이고 레시피입니다. 요리에 대해 거의 모르시는 분들이 사용하기 좋고, 집에서 직접 음식 주로 해드시는 분들은 돈 낭비에요"
9788996347255,6,아이가 있는 집에서 꼭 필요한 책인것 같네요.
9788996347255,10,책 보고 소고기 덮밥도 해주고 깍두기도 담갓어요 자세히는 나와잇지 않지만 간단한 음식위주로 잇어서 정말 따라하기 쉽고 좋아요
9788996347255,8,"잘 활용하면 좋을텐데,,, 전작 아이가 잘 먹는 이유식은 따로있다 보다는 못 한 듯."
9788996347255,10,"두 돌 지난 아기는 똑같은 메뉴를 먹지 않는다. 그래서 이 책을 열심히 활용하고 있다. 물론 그대로 따라할 수는 없지만 아이디어를 많이 제공한다. 새우케첩볶음을 해줬는데 잘 먹는걸 보면서 뿌듯했고, 불고기는 가족메뉴로 대성공! 책이 잘 펼쳐져서 부엌에 놓고 쓰기 좋다."
9788996347255,10,"한참 유아식 중인 딸래미 밥상 떄문에 고민이 종종 되더하구요~워낙 골고루 잘 먹어서 걱정은 안하는데,,아이 위주로 덜 얼큰한 것을 만들려보니, 어른 먹을 게 마땅치 않아서^^;;이 책 사고서 남편에게 덜 미안해요~^^"
9788996347255,10,뭐해주면 좋을지 생각안날때 한번씩 찾아서 해주면 좋을것 같아요. 책이 크지않고 사진과 레시피가 보기편한것 같아요.
9788996347255,6,"이유식 책은 많은 데 비해 유아들 음식 책은 종류가 적어서 골랐다. 넘겨볼 때는 괜찮은 요리들이 많아 보였지만, 막상 이렇게 만들어도 아이들은 잘 안 먹는다는 게 함정. ㅋ"
9788996347255,8,간단하면서 건강한 레시피들이 있어서 좋아요
9788996347255,10,이유식도 잘먹여서 사봤어요역시최고
9788996347255,2,"대략적인 요리 방법을 이미 아시는 분들에겐 비추입니다. 알고있는 요리법에서 간을 싱겁게 해라..
레시피 정도 참고할 정도이지, 초보 엄마가 알아야할 기본적인 이론은 약합니다."
9788996347255,10,아이들을 위한 먹거리를 만드는 일이 항상 고민이라 이책을 구입했네요.. 좋은 레시피가 많아서 좋아요
9788996347255,10,돌 이후에 반찬은 어떻게 해줘야 하나 고민이 많은데 딱 알맞은 책이에요
9788996347255,8,아이밥을 따로 만들 필요 없이 온 가족이 함께 먹을 수 있는 좋은 식단.
9788996347255,8,가끔 한번씩 해보면 좋은 듯하네요 쉬운 요리들이 많아요
9788996347255,10,이유식 이후에 바로 구매!! 쉽게 잘 설명되어 있어 따라하기 좋은 책. 주방에서 나의 '믿는 구석'
9788996347255,8,반찬이나 국 뭐할까 고민하다가 펼쳐보면 아이디어가 떠오르는 책. 실용적이네요.
9788996347255,6,이유식 보다는 만족도가 떨어진다.
9788996347255,6,"글쎄요... 이유식책 사면서 샀는데 그럭저럭 갠찬은거 같아요...
이책을 보니 제가 게으르다는 생각이 드는 군요..."
9788996347255,10,"마더스 고양이의 2가지 책은 아이를 키우면서, 정말이지 잘 활용하는 책이 되었다.
일반 요리책이였다면, 몇번 보다가 말았겠지만... 읽으면서 육아에 지친 엄마의 마음을 토닥이는 따뜻한 느낌이다."
9788996347255,8,이유식을 떼면서부터 유아식에 관심이 생겨 구매하게되었다. 난감하던차에 무척 쉽고 무엇보다 어른상 아이상을 따로 준비하지 않아도 된다는 장점이 가장 좋았고 실제로 레시피대로 해보고 맛보았을때 '우와~^^'
9788996347255,10,"어른 반찬과 아이 반찬의 관점에서 잘 설명되어 있어서 특이하고, 마음이 편해요. 어제 이 책 보여주면서, 먹고 싶은 거 골라~ 하며 아이들에게 물어봤어요. 닭봉찜닭 만들며 보니까 책이 보기 좋고 설명도 좋아요."
9788996347255,10,"별 기대없이 샀는데 주말마다 요리하는 재미가 쏠쏠하네요. 
간단하고 이해하기 쉽게 재료 설명이 되어 있고,
오이무침, 닭봉찜, 돼지고기 수육을 해먹었는데
아이들이 좋아해요. ^"
9788996347255,10,개인적으로 첫 아이를 키우는 내내 마더스고양이님의 ｀아이가 잘 먹는 이유식은 따로 있다｀를 닳도록 보며 이유식을 만들어 먹였기에 무척이나 기대되는 책입니다.
9788975278624,6,꼭  보고싶은 책이거든요^^
9788975278624,8,소담한 책
9788975278624,8,"왠지 자연적일 것 같아서..
식품은 인스턴트 보다는 자연식, 그리고 채소가 가장 좋습니다. 특히 봄에 막 싹이 돋아난 채소는 일년의 단 한번 뿐인 보양식이라고 생각합니다."
9788975278624,6,다이어트 하는데에 많은 도움이 됐어요
9788975278624,8,잡초로만 생각했던 각종풀들을 먹을수있는 반찬으로 만드는법까지 나와있어서 참유익!
9788975278624,10,인간 몸은 자연이다. 자연이 주는 가장 좋은 음식. 이 음식만이 인간을 살리는 보양식
9788975278624,10,아이들이 더 좋아하네요. 단이 누나 화이팅!!!
9791158463373,10,인스타에서 식단 구경만 했었는데 이렇게 레시피가 책으로 나와서 너무 좋아요! 얼른 아이한테 만들어주고 싶네요ㅎ
9791158463373,10,70가지 식판~~~120개가넘는레시피이정도면 입맛없는 우리아이에게 맛잇고 영양가득 식사할수있게 준비할수있겟죠 완죤 기대됩니다
9788931459821,8,재료나 조리법이 생소한 것도 있지만 단계별로 접근할 수 있도록 구성되어 있어 괜찮아요. 조금씩 요리 실력이 늘어가는 재미도 있을 듯 ㅎㅎ
