ISBN13,rating,review
9791190065702,10,"다이어트, 건강한 식단은 맛없는게 특징(?)인데 맛있게 먹을 수 있도록 고뇌(?) 하신게 티가 난다... 하지만 난 3권은 아직 못샀다는점........ 그래도 난 건강해지고이써!!!"
9791190065702,10,3번째 시리즈 나오면 바로 살 거에요!!
9791190065702,10,1편 효과 봤어요 우선 맛있어서 계속할 수있었던거같아요 2편은 내용도 안보고 구입합니다
9791190065702,8,1권 보고 따라하면서 살이 많이 빠졌었어요. 든든하면서 살도 빠지는 신기한 경험을 했었기에 믿고 질렀어요.그런데 1권보다는 전체적으로 요리들이 맛있고 재료가 많이 들고 손도 많이 가요. 요리하기 쉬운것도 큰 장점이었는데 이번엔 그게 좀 아쉽더라고요.
9791190065702,10,리뷰 귀찮아서 포인트 준다 해도 잘 안남기는 일인 입니다 그런데 이책의 레시피는 정말...!!!!!!가히 최고에요!!!보통 맛이 없거나....먹어도 먹은것 같지 않은 양이거나 이런데 이건 뭐 먹고 살짝 남길 정도에요 맛은 또 어찌나 맛있는지....애들 저녁 또는 간식으로도 대령 중이에요.!!
9791190065702,8,구성이 좋습니다. 자연식물식 하고 있지만 꽤 응용할 수 있는 요리가 있습니드.
9791190065702,2,"단기간에 살은 빠질지 모르겠으나, 병원 갈 일은 많아지는 레시피들...다이어트 불변의 법칙 꼭 보세요!!!"
9791190065702,10,헐 짱 좋다
9791190065702,10,책 오길 기다렸다가 오자마자 정독했어요레시피도 쉽고 너무 맛있는 다이어트식이 많아 아주 유용할 것 같아요장볼때 책 이용해서 장도 보고 요리도 해먹어봤는데 완전 맛있어요!다이어트 식단은 맛없다는 편견을 없애주는 책입니닷앞으로도 이 책으로 즐거운 다이어트 해볼께요!
9791190065702,10,"1권도 평소에 참고할 레시피가 많았어서 2권도 기다렸다가 바로 주문했어요!저는 보통 디디미니의 레시피를 참고로, 제 입맛과 냉장고 상황에 따라 다르게 변형해먹어요. 1탄만한 2탄 없다고들 하는데 2탄은 더욱 편하고 손쉽게 접할 수 있는 재료들이 많아 좋아요! 몸이 단단한 힘을 얻는 걸 느껴요"
9791190065702,10,진짜 미니님은 항상 믿고 삽니다 항상 도움많이되요 다음레시피 책도 기대할게요❤️❤️
9791190065702,10,정말 제가 레시피요리책 왠만하면 안사는데ㅠㅠ미니지우언니꺼는 믿고 샀어용!! 게다가 요리레시피만 있는게 아니고 이것저것 깨알팁과 생활다이어트를 하는 사람들에게 너무 좋은말들도 많거~그리고 무엇보다 중요한 간단하고 구하기쉬운 재료들로 요리할수있는 식단이라는 점이 가장 장점이 아닐까용
9791190065702,2,육류 위주의 고단백식사는 만병의 지름길입니다. 살만 빠진다고 건강한 것이 아님을 명심하시길
9791190065702,8,훈제오리샌드위치를 양파 빼고 점심도시락으로 만들어왔다. 꽤 맛있어서 이 책에 신뢰가 가기 시작했다.
9791190065702,10,제가 진짜 요리고자인데도 이 책에 나와있는 요리는 뚝딱 잘 해서 자신감이 생기게 되었어요! 그 덕분에 살도 빠지면서 다이어트 음식에 대한 거부감도 사라지고 속세음식에 대한 유혹도 많이 사라졌습니당 특히 하루에 한 번 화장실 꼭 간다는 점이 제일 좋았어요 여러모로 도움을 많이 받은 책입니당
9791190065702,10,"일단 레시피가 너무 간단하고 사진도 포함되 있어서 만들기 수월 할 것 같아요. 식단 기록지까지!! 책도 큼지막하니, 완벽하네요!"
9791190065702,8,"미니님 두번 째 책 진짜 많이 기다렸어요~ 저번 책도 레시피가 넘 쉽고 맛있어서 좋았는데, 이번 책도 넘 좋더라구요. 역시 최고최고! 주변에 막 사보라며 권유하기까지 했답니다. ㅋㅋ"
9791190065702,10,"두번째 레시피북이 출시된다고 해서 누구보다 빠르게 예약구매로 겟 했어요! 첫번째 책에는 없었던 전혀 다른 새로운 레시피들과 미니님의 다이어트 꿀정보들이 대방출 되었더라구요! 맨날 고구마,계란,닭가슴살만 먹어야하는 지루함을 벗어나고 싶은 분들에게 이 책은 신세계를 보여줄거에요!"
9791190065702,10,생각보다 쉽고 구하기 어렵지 않은 음식들로 건강하고 맛있게그리고 음식도 눈으로 먹듯이 예쁘기까지한 음식들을 미니님이 얼마나 노력하셨는지 알수 있었습니다. 책을 받는 순간조차 너무 행복하지는 마법같은 책이였네요. 대한민국의 모든 다이어터 분들에게꼭 추천드리고 싶습니다. 화이팅^^
9791190065702,10,"1권도 너무 많은 도움이 되었는데, 더 쉽고 더 맛있는 레시피라니요! 너무 기대됩니다!!"
9791190065702,10,"안 사면 손해! 1권이 진짜 맛있고 너무너무 쉬워서 2권도 구매하러 왔어요. 믿고 보는 미니님 레시피, 믿습니다!"
9791190242462,10,좋은책입니다! 잘 활용하겠습니다
9791190242462,10,"항상 깔끔하게 핵심만 쏙쏙 만들어주신 유튜브 영상이 많이 도움이 되어서 책으로 출간되어서 편하게 요리할 수 있겠다 싶어 책으로 주문했습니다. 좋은 영상, 책 감사합니다."
9791190242462,4,유튜브 무니키친채널은 고급지고 깔끔한 느낌인데 책은 왜이렇죠? 표지부터 요란스럽고 편집도 약간 옛스럽네요.도서관에서 먼저 읽어보고 예쁜 요리책은 꼭 소장하는 편인데 코로나로 도서관을 못갔더니 이런 불상사가ㅠ  기대가 컸어서 실망이 더 컸습니다.
9791190242462,10,책 받았습니다. 레시피도 다양하고 초보자도 쉽게 만들수 있어서 좋네요ㅎㅎ매우 만족합니다~!
9791190242462,10,넘흐 기대되효감사합니다
9791190242462,10,평소에 레시피들 열심히 따라했어서 책을 구매했어요! 얼른 책 받아보고 싶네요 너무너무 기대가 됩니다ㅎㅎ
9791190242462,10,유튜브로만 보던 무니님 레시피를 드디어 책으로! 핸드폰은 동영상 다음으로 넘어가기 전에 멈췄다가 그사이 화면꺼지고 불편한점이 있었는데 책과함께 보면 너무 좋을것같아요. 감사합니다
9791190242462,10,다이어트 중인데 맛있는 음식을 참기 힘들다면 정답은 바로 이책에!
9791190242462,8,저탄고지 조리법때문에 구입했는데 이 책은 맞네요. 대부분 저칼로리 책이 더 많더라구요.—: 매우 구체적이고 실용적이나 간혹 초보에겐 힘든 요리법 있어서 별 한개는 뺐어요. 아주 유용할듯 싶습니다
9791190242462,10,유튜브에서 따라하다~책 나온다해서 바로 구입했어요^^ 내용  당연히 좋고~ 책 구성도 좋아요
9791190242462,10,키린이에게 너무 유용한 책입니다 ㅠㅠ
9791190242462,10,유튜브 잘 챙겨보고 있지만 바로바로 훑어보기엔 동영상의 한계가 있었는데 마침 책이 나와서!!행복합니다. 정갈한 느낌이 좋아요!중요한 내용은 아니지만 마파두부 덮밥 레시피 재료에 돼지고기가 빠져있어요~
9791190242462,10,저탄고지 키토제닉  관련 조리책들이 나올때마다 설레는 마음으로 구매하고 있습니다. 무니님 책도 너무 기대되네요. 유툽으로 도움 많이 받고 있어서 소식 발견하자마자  찾아와 구매합니다!
9791190242462,10,아직 책을 받아보지못했지만! 저탄고지 레시피북에 다이어트 지식도 함께라고하셔서 기대가됩니다!!
9791190242462,10,유튜브로 보다가 책이 나온다니! 기대!
9791190242462,10,유튜브를 보면서 기대했는데 드디어 출간되네요! 기대됩니다^^
9791190242462,10,유튜브 보면서 많이 도움 받았어요 책으로 나오니 반갑네요
9791190242462,10,무니키친 저탄고지식 기대하고 있어요.책으로 출간되면 더 가까이 하게 될 듯 해요^^
9791190242462,10,최근에 저탄고지 다이어트를 하면서 알게 되었는데 휴대폰으로 보면서 요리를 만들다보니까 불편했는데 오늘 유튜브를 보다가 책 출간 소식영상을 봐서 바로 구매했습니다! 책보고 더욱 열심히 해서 올해 원하는 다이어트와 건강을 찾고 싶어요~
9791190242462,10,"유투브에서 치즈케익 따라하면서 구독하게 되었어요. 만들기 쉽고 또 맛도 좋아 자주 만들게 돼요, 물론 건강에도 좋구요. 감사합니다. 책 잘 볼게요~^^☺"
9791190242462,10,유튜브로도 정말 잘 보고있었는데 책이 나온다니 너무너무 기대돼요! 언제나 실망시키지 않는 레시피로 믿고 따라하고 있구요❤️ 책을 구매함으로써 그 보답을 조금이나마 하는것 같아서 뿌듯합니당
9791190242462,10,무니님 레시피로 맛있는 저탄고지 다이어트를 할 수 있었어요. 이렇게 책으로 출간되어 너무 기쁜 마음입니다. 늘 좋은 레시피 개발 하시느라 힘들텐데 항상 감사한 마음입니다!
9791190242462,10,무니키친님의 모든 영상을 사랑하지만 먹으려는 레시피를 다시 찾고 영상을 보면서 요리하는게 조금 번거로워서 책 준비하고 계시다고 했을 때부터 나오면 바로 사야지 생각했어요! 유튜브 확인하고 바로 질렀어요! 늘 유용한 레시피 감사합니다! 책 발간 정말 축하드려요!!
9791190242462,10,저탄고지식을 시작하고 제일 도움을 많이받은 채널 무니키친입니다. 영상 틀어놓고 따라하는게 힘들어 책으로 나왔으면 했는데 정말 좋네요 ㅠㅠ
9791190242462,10,요리 똥손인 저도 유튜브 보면서 따라했었는데책으로 나와서 너무 좋아요안그래도 책으로 안나오나 궁금하던 참이었습니다 ㅎㅎ책 빨리 받아보고 싶어요~
9791190242462,10,진짜 맛있는 레시피여서 자주 따라해가지고 핸드폰으로 레시피 보기가 불편해서 책 나오길 너무나 바랬는데 나와서 너무 좋아요ㅠㅜ❤️❤️ 사은품도 어쩜... 감사합니다 무니님 고생하셨어요 어서 오기만을 기다릴게요❣️
9791190242462,10,유튜브 영상 보면서 레시피 정리된 책이 있으면 참 좋겠다 생각했는데 책이 나와서 무척 기뻐요! 책 참고해서 다양한 요리 만들어보겠습니다~ 감사해요
9791190242462,10,무니님 레시피는 진짜 요알못인 저를 크게 발전시켰습니다! 베이킹이면 베이킹 요리면요리 카페면카페 못하시는게 없는 금손무니키친님!!! 무조건 믿고먹는 레시피아닙니까!!!! 나만알고싶은 무니님 레시피지만 널리널리 더유명해져서 대박나세요!!!
9791190242462,10,유튜브 보고 맨날 따라했는데 이렇게 책으로도 나와서 너무 좋아요❤️❤️이젠 책 펴놓고 따라하면 더 편하게 요리해 먹을 수 있겠네요! 늘 좋은 레시피들 정말 감사합니다
9791190242462,10,너무 좋은 레시피책!!! 응원합니다.
9791190242462,10,무니님 축하드립니다   드디어 책이 나오는군요유튭으로  열심히  따라해먹었었는데핸폰영상이라  가끔  불편했었거든요  이제는  편하게  볼수  있겠어요기대하며  바로 예약 구매합니다축하드려요
9791190242462,10,유투브로 항상 잘 보고 있고 실제로 몇번이나 따라해서 먹어봤는데..베이킹까지 너무 맛있는 레시피들이었어요. 영상으로 보는거라 불편했었는데 책으로 나와서 너무 기뻐요!! 출간하면 바로 구입해서 따라해 볼 거에요!!! 너무 기대됩니다!!
9791165210731,10,건강 때문에 다이어트를 시작해야만 했는데 저는 사실 운동하는 것도 별로 안 좋아해서 하루에 만 보 정도 걷는 운동만 하려고 했어요. 그러다보니 식단이 필수겠더라구요. 조금 귀찮을 순 있겠지만 내가 먹는 음식을 해본다는 게 재밌었고 그리고 쉽게 구할 수 있는 재료로 뚝딱 만들어서 좋았어요.
9791165210731,10,맛있으면서 다이어트가 가능해서 좋습니다.그런데 전 살이 잘 안빠지네요 ㅋ
9791165210731,10,살까말까 망설였는데 후회없음ㅋㅋ 리뷰왠만하면 안다는데 재료가 시중에 살수있는것들이고 내가 너무좋아하는것들로만 구성되어있어서 흥할수밖에 없는 책이다.다이어트나 현미채식같은 레시피책들 좋아해서 몇십권을 보유하고있지만 이책 정말최고다.아이디어도 너무좋고 !이미 라미님팬됐음ㅋㅋ
9791165210731,10,다양한 다이어트 방식에 대하여 많이 저술되어 있어서 좋은 것 같습니다.
9791165210731,10,하루 세 끼 챙겨먹으며 인생 몸매를 만들수 있는 건강한 다이어트 비결과 똑똑한 식단을 배워보고 실천해보면 좋을것 같아요
9791165210731,10,다른 책들과는 다르게 정말 믿음이 가는 책이네요! 건강한 다이어트! 유지할 수 있는 다이어트! 이 책으로 성공하고 싶네요
9791165210731,10,건강한 다이어트를 할 수 있을꺼 같아요!!영양사님이시니 영양소가 가득한 다이어트 레시피라 믿음이 갑니다!!신랑이 건강하게 살이 빠지는 그 날까지 열심히 준비해주려구요!!^^
9791165210731,10,다이어트 할 때 정말 힘든게 식단이죠 운동이야 그냥 몸뚱이 쓰면 되지만 식단은 이거 먹어도 될까 라고 참 많이 생각하는 거 같아요 칼로리도 되게 신경쓰게 되고요 안 그래도 지금 다이어트 열심히 하고 있는데 이 책이 정말 유용할 거 같네요
9791165210731,10,믿고 먹을 수 있는 라미 레시피~ 영양사라는 저자의 직업에 더욱 믿음이 가네요~ 기대됩니다~
9791165210731,10,인스타를 통해 라미님을 알게되었고 종종 식단을 참고하던 중 책이나온소식을 듣고 바로 겟겟겟!!! 다이어트로 힘들때 증량할 때 유지할 때 양조절해서 맛있는 레시피들 참고합니다. 이보다 더한 노력들로 하루하루를 채워가는 라미님 여리레시피 너무 좋아요
9791165210731,10,이책도 사야할까요?
9791165210731,10,"다이어트 레시피책 많이 샀었어요..하지만 시중에서 잘 볼수없는 재료, 다이어트에는 좋지만 구하기 번거로운 재료 가 있는 레시피가 허다했습니다ㅠ 하지만 이책은 그냥 집앞에 슈퍼만 가도 구할수있는 재료레시피가 많아요! 그래서 너무 좋아했습니다^^ 하나하나 맛있게 요리해보고싶은 책이에요"
9791165210731,10,직접 겪어온 이야기들을 바탕으로 구성된 레시피북이라 와닿게 읽으면서도 필요한 정보들이 많이 담겨있어서 자주 보게될 것 같은 책이예요. 모호한 계량법도 정확히 나와있고 조리시간도 그리 길지않은 메뉴들로 구성되어 있어 다이어터 유지어터라면 꼭 가지고 있어야할것 같아요!
9791165210731,10,다이어트는 식이요법이 제일 중요한데 이 책이 도움이 많이 될 것 같아요. 요요 없이 건강하게 다이어트를 하기 위해서 꼭 참고해야겠습니다. 기대되네요.
9791165210731,10,"팁만 모아놓은 책이 아니라 직접 경험한 실패담까지 생생히 실어 책을 보면서 공감하고 쉽게 읽을수있어 좋았고, 구체적으로 사진들과 함께 설명이 적혀있어 차근차근 살을 빼기 좋다. 내용도 직장인/가성비 등 사람마다 다른 상황에 맞춘 목차로 채워져있어 알찬 다이어터 참고용 책이다"
9791165210731,10,모태뚱뚱에서 인생몸매로 거듭난 10년차 영양사 다이어터가 알려주는 다이어트 비결과 요리법을 담은 책이에요. 적게 먹고 몸을 혹사시키는 다이어트가 아닌 손쉽게 구할 수 있는 재료를 가지고 탄단지섬 골고루 챙겨먹는 맛있고 건강한 레시피로 누구나 스트레스없이 다이어트할 수 있겠어요.
9788969524058,10,"무척 게으른 사람이지만, 쉬워보이는 메뉴부터 시작했습니다. 맛있고 재미있어서 계속 도장깨기하듯 따라하고 있어요. 백프로 키토식은 못 하지만, 다양해진 식단만큼 삶이 좀 풍요로워지는 것 같네요. ^^ 비단, 키토식 하시는 분들이 아니라도 참고할만한 맛있는 식단이 많습니다. 추천해요."
9788969524058,10,다이어트와 건강에관심을갖으니 자연스레 키토제닉을 접하게되더라구요 처음접한책은 외국인저자가쓴글이어서 음식재료도 첨보거나 구입하기어려운제품들이었어요~진주의한그릇키토식레시피는 구입하기 쉬운식자재로 다양하고 약간은 이국적인 요리들이많아서좋았어요
9788969524058,10,"키토제닉 다이어트를 시작하고 싶거나삼겹살만 구워 먹기 지치신 분들,혼자 유투브 이곳 저곳 찾아가며 음식하기 힘든 분,다양하고 맛있게 건강한 키토식을 원하시는 분들은이 책을 참고하셔도 좋을 것 같아요.서평단으로 선정되어 책을 제공받아 작성하였어요."
9788969524058,10,"키토식단을  하면 재료도 어렵고 어떤 음식을 먹어야 하나 막막한데이 책에 재료구입부터 손질법, 쉽고 간단한 레시피가 상세히 담겨있어이 책 한권만으로도  키토식단을 충분히 할수 있을것 같아요너무 유용하고 괜찮은책!!"
9788969524058,10,바쁜 현대인들에게 한 그릇으로 끝내는 신박한 요리책입니다.요리에 꼭 필요한 도구며 기본 양념등 알차게 나와있네요 .건강한 먹거리를 위해선 좋은 재료 약간의 노동력이 필요하죠.기본만 갖추어져 있다면 레스토랑 부럽지 않는 요리를 집에서 충분히 즐길수 있습니다.플레이팅이 넘 예뻐서 호기심 가득했는데 진주님 이력을보니 ㅎㅎ전문가셨네요. 좋은책 감사해요
9788969524058,10,진주님 완전 찐팬이예요첫발간 책부터 다 구매했는데요 진짜 저 책보고 레시피 따라하면서 요리도 많이 늘고 처음엔 정말 삼겹살만 매일매일먹었는데 진주님 책 만나고나선 요리가 엄청 다양해지고 맛있게 다이어트하는중이예요 6개월동안 총 20키로 감량했구요 지금도 감량 중이예요
9788969524058,10,키토제닉바이블 주~님! 진주님! ㅋㅋㅋ 해키키때부터 쭈욱 레시피보고있어요.~ 맛있고 따라하고픈 요리가 많은데 이번엔 한 그릇으로끝낼수있다니 넘 좋아요. 초반에 저탄고지에대한 설명도 조금씩 있어서 마음 다잡기에 좋고요 ㅋ 한식.양식.중식 레시피모음집이네요!
9788969524058,10,"책이 아주 고급져요.저탄고지에 대한 기본 설명과 기본 재료, 도구들에 대한 설명도 있습니다.고급진 손님 요리부터..게으른 심플 메뉴까지.. 다양하네요.키토식 유지에 도움이 될것같습니다"
9788969524058,10,한 그릇 키토식 귀찮은게 많고 요리는 재미있지만 뒤처리를 싫어하는 저에게 정말 좋은 책 입니다.간편하고 자세히 적혀있고 맛도있어 요린이도 잘 따라만들수 있어요. 진주님 매책마다 레시피를 보고 무릎을탁!치며 이런 요리도있구나 감탄합니다.이책도 열심히 따라해서 너덜너덜하게만들어볼게요
9788969524058,10,"남편은 밀가루알러지에 당뇨가 왔어요.저도 갱년기 다가오며 살도 찌고 아무래도 이대로는 좀 곤란하다 생각하던 차에 키토식에 댜해 알게되어 책을 접하게 되었습니다.해외돌면서 십여년 살면서도 밥에 국,한식만 고집했는데 식생활개선용으로 유익합니다.새로운식사 지침서로 추천합니다."
9791185473185,10,도시락이 아니더라도 해먹기 좋아요. 간단하고 다양한 다이어트 음식들 요리법이 있어요. 개인적으로 해산물은 별로 좋아하지 않고 집에서 해먹기 조금 어려운데 해산물 요리가 많이 없어서 좋아요.
9791185473185,10,"여러 종류의 도시락이 등장하는 것이 인상적입니다. 다이어트가 아니더라도 과일, 채소, 견과류등으로 대신하는 사람들과 어릴 때 엄마가 싸주신 도시락 생각이 나는 사람들에게 안성맞춤. 기존 도시락책들의 화려한 면면을 보다보니 소박한 밥상이 생각이 납니다.(차별화)"
9791185473185,10,기재된 재료가 없더라도 다른 재료로 대체해서 활용할 수 있어서 좋아요 만족합니다.
9791185473185,10,더라이트라는 출판사를 믿고 봅니다. 건강식이에다 다이어트 식이거든요
9791185473185,10,다양한 레시피가 디테일하게 수록되어 있네요 굿굿
9791185473185,10,"직장에 한권, 집에 한권 두권을 사고 두어도 아깝지 않습니다."
9791185473185,10,도시락메뉴 때문에 고민이 많아서 고민하다가 사기로했어요. 저염 저열량 저당이니까 확실히 요리법대로만 하면 좋을 것 같아서 삽니다!
9791185473185,10,"다이어트 하는데 아무래도 도시락 싸기가 귀찮고 뭘 싸야 할지고민이 되서 안싸게 되요. 저염, 저당, 저열량의 도시락이라 궁금하고 따라 싸보고 싶네요~!!"
9791185473185,10,안그래도신랑이 다이어트도시락싸달라고해서 막막했는데 넘기대되요~~!!야채만먹일수없으니 든든하면서도건강한도시락을원해서 검색많이했는데 책으로모아놓으니 이제 신랑도시락걱정이없네요!!구하기어려운재료가아니라 맘편히시작해보려구요~~!감사합니다
9791185473185,10,"잃어버린 건강도 되찾고 점심값도 아낄겸 도시락을 싸고 다녀볼 생각이었는데 메뉴나 반찬, 레시피가 막연하더라구요 그런데 더 가벼운 도시락만 따라해도 매일 매일 색다르고 맛있는 건강 도시락을 맛볼수 있겠어요! 모든 메뉴 따라해서 다이어트도 하고 건강도 되찾을게요~^^"
9791185473185,10,워낙좋아하던 독자라 이 책또한기대되네요~건강에 한발더 다가가게해주는 정말 건강한서적!다이어트에도 너무도움이될거같아요~보자마자 마구 도시락이싸고싶어지네요~!착한 내용 실한 레시피 기대만땅입니다!
9791185473185,10,요즘 다이어터 모드인데 저염식 음식이 만들기 너무 어렵더라구요 ㅠㅠ 그런데 슈퍼레시피에서 더라이트 더가벼운도시락 100 이라니!!! 이것만따라해도 살빠지겟어요!!
9791185473185,10,도시락에도 다이어트에도 관심이 많은데~ 이건 딱 저를 위한 책 같아서 기대가 커요~~ 평소에 슈퍼레시피의 레시피도 많이 따라해봤는데~ 쉽고 맛있어서 자주 해먹게 되더라구요~ 건강한다이어트를 위해 구매해요~
9791185473185,10,직장인으로써 점심은 외식을 할 수 밖에 없는데 가벼운 도시락 메뉴를 고민없이 해결해주는 책~ 레시피도 많아서 집에서 먹을 때도 활용할 수 있겠어요! 정말 좋네요~ 어제 주문에서 당일 받아서 살펴보니 정말 알차요
9791185473185,10,더라이트 구독하면서 맛있게 다이어트하고있는데 인기메뉴를 모아모아 새로운레시피들이 가득한 더 가벼운 도시락이 나왔다는 소식을 듣고 냉큼 구매를 해버렸네요~~~ 너무 만족하면서 구독하는중인 더라이트 엑기스를 모아놨으니 안살수가없어요^^  더 가벼운도시락 화이팅~!!!!!아자
9791185473185,10,저염 저당 저열량 다이어터들의 맞춤 레시피 100가지의 풍성한 레시피라 좋구요 굶는다이어트가 아닌 건강한 다이어트를 위한 맞춤도서같아요^^내게 꼭 필요한 책이라 바로 구입합니다.건강한 다이어트에 큰 도움이 될것같아요!감사합니다♥
9788960517271,8,다이어트 식단에 대한 지식과 설명은 식단포기자에게 이해하기 쉽고 자세히 설명되어있음이점은 아주 높이 평가합니다 식단포기자였던 나를식단 찬양자로 만들었음레시피 설명 부분은 아쉽습니다 레시피가 간단하다고 설명 부분까지 간단하게 한 느낌?
9788960517271,2,"책이 정말 성의가 없음.그냥 유투브 내용을 책으로 만들었는데, 얇고 사진도 없고 그림에 과정도 없고 그냥 정말 성의가 없음."
9788960517271,10,가끔 보는 유튜브 블로그인데 책도 재미있네요
9788960517271,4,책이 너무 성의 없어서 놀람레시피 과정이라도 사진으로 보여주고 해야 하는 거 아니냐ㅎㅎ 진짜 충격
9788960517271,6,따라해 보고 다시 올께요~
9788960517271,10,너무 재밌게 보고 영상보면서 캡쳐하고 메모하면서 이것저것 만들어먹었는데 책으로 나온다니 대박!하면서 얼른 구입했네요 ^^ 강추합니다! 쉽고 배부르고 운동없이도 뺄수 있다는게 제일 인거같아요!
9788960517271,10,저 맛불리님 덕에 한달만에 6키로 빠짐 이책은 진짜다
9788960517271,10,"책 크기가 작아서 놀라고 레시피가 사진이 아닌거에서 조금 실망했지만 맛불리님 책을 기다렸기에, 또 글을 읽으면서 음성지원이 되는것만 같아요^^"
9788960517271,10,맛불리님이 다이어트하신 과정도 자세히 잘 나와 있고 중요 레시피 정보까지 알 수 있어서 너무 좋아요!
