ISBN13,rating,review
9791195655519,10,오늘  출간된다고해서  바로  주문했어요  너무  기다려져요  당근시러님  김치책  너무  기대되요  책  출간하시느라  너무  고생하셨어요 ~~
9791195655519,10,완전 기대가 되어요~~~^^
9791195655519,10,예약 알람 해놓고 바로 주문했어요~ 너무 기대하고있습니다~
9791186519042,10,설명이 잘나와 있고 레시피가 다양해서 맘에 들어요.
9791186519042,10,쿠키 만드는법을 배울수 있습니다.
9791186519042,10,쿠키베이킹에 대해 쉽게 알수있습니다.
9791186519042,10,쿠키 종류가 정말 많군요. 쿠키를 먹는 것도 좋아하지만 만들기도 좋아하기에 마음에 드는 책입니다. 책 속의 레시피를 따라 만들고 싶어요.
9791186519042,10,보기만 해도 기분좋아지는 쿠키네요
9791186519042,10,달달한 디저트가 생각나네요
9791186519042,10,다양한 쿠키의 세계 속에 푹 빠져들다
9791186519042,10,집에서 쿠키 만드는데 좋을 것 같아요.
9791186519042,10,온 가족이 좋아하는 맛있고 건강한 쿠키를 초보자도 쉽게 만들 수 있을 것 같아 너무 기대됩니다.
9791186519042,8,디저트가게라면 어디에서든 맛볼 수 있는 쿠키지만 정말 맛있는 쿠키는 찾기 힘들어요 이 책을 잘만 따라하면 실패없이 완벽한 제품이 나오는 레시피라니 기대가 됩니다
9791186519042,10,집에서 만드는 간단한 쿠키. 레시피 사진과 함께라 따라하기 쉽네요
9791186519042,8,건강한 쿠키 사랑스런 쿠키를 만들어서 이웃들에게 선물해주고 싶어요
9791186519042,10,정말 내입맛에 드는 맛있는 쿠키레시피~ 따라해보고 싶네요
9791186519042,10,저같은 초보자도 이해하기 쉽도록 설명과 사진이 잘나왔습니다.홈베이킹용으로도 좋고 선물용으로도 좋을 레시피들이 많습니다. 이제하나씩 만들어 보려구요~ 좋은 레시피 감사합니다. ^^
9791186519042,10,목차가 알짜배기로만 구성되어 있는거 같아서 기대가 큽니다 미리보기 사진에서도 정말 따라하기 쉽게 되어 있는듯 보이네요
9791186519042,8,한국인이 좋아하는 쿠키들 위주로 레시피가 구성되어있어서 좋아요.
9791186519042,8,초보도 따라할 수있도록 사진으로 이루어진 레시피가 좋습니다.
9791186519042,10,쿠키를 굽는 방법 뿐 아니라 여러가지 종류랑 어울리는 다양한 차도 같이 소개해줘서 더욱 더 유용한 정보가 될 거 같아요
9791186519042,10,초보자도 쉽게 따라할 수 있을것 같아서 좋네요
9791186519042,10,"일단 책이 너무 깔끔하고여,군더더기 없이 딱 필요한 정보만 알차게 들어있어 구매했어요.모든 단계의 과정샷이 들어가 있어 보고 따라하기 너무 편해요~초보자라면 정말 도움이 될 책."
9791186519042,10,맛있고 건강하고 즐겁게 쿠키를 만드는 과정이 사진으로 친절하게 설명되어있어좋습니다.초보자도 배우고 고급실력을 갖춘분도 베이킹 센스를 배울수있는 멋진 책이네요.
9791186519042,10,아이 방과후시간에 쿠키 만들어오는 것을 보면 캐릭터를 그려넣기도 하고 그것을 입체적으로 만들어올 때도 있었는데 모양과 입이 다 즐거웠어요.쿠키도 반죽이랑 굽는 시간에 따라 좀 틀리다는 것도 알았고 견과류나 과일로 토핑을 해도 좋더라구요. 잘 만들어 선물까지 한다면 금상첨화가 아닐까..
9791186519042,10,쿠키를 굽는 방법 뿐 아니라 여러가지 종류랑 어울리는 다양한 차도 같이 소개해줘서 더욱 더 유용한 정보가 될 거 같아요
9791186519042,10,"제과제빵 책은 비앤씨월드 출판사 믿음이 갑니다. 이 책 또한 실망시키지 않네요. 레시피는 한눈에 보기 쉽게 한 페이지에 깔끔하게 정리되어 있고, 요리 과정은 상세하게 사진과 함께 알려줘서 따라하기 쉽겠어요."
9791186519042,10,쿠키만드는 책은 많지만 정말 맛있는 쿠키를 만드는 책은 바로 이책인것 같아요..콕 집어 홈베이킹을 가장 맛있게 만들수 있게 도와주는책 저한테 꼭 필요한 책이네요..맛있는 쿠키 얼른 먹고 싶네요..^^
9791186519042,10,요즘 베이킹에 맛들였는데 볼때마다 따라하고 싶어져요!
9791186519042,10,"쿠키종결자라는 말이 딱 어울리는 책인 것 같아요, 베이킹을 하다보면 너무달거나 너무 바삭해서 항상 실패를 하곤했는데 친절한 설명과 다양한 쿠키 레시피가 있어서 재밌게 따라하기 좋네요,물론 맛도 있구요! 정말 좋은 베이킹책이에요"
9791186519042,10,쿠키 만들면서 실패하는 경우가 많은데 이책의 레시피만 있으면 성공할수 있을거 같아요. 기대되는 책입니다
9791186519042,10,간단한 쿠키를 자주 굽는 편인데요 BnC 홈베이킹이 진짜 맛있다니 저도 도전해보고 싶어지네요. 레시피가 잘 나와있는거 같아 쉽게 따라해볼수 있을거 같아요 기대됩니다
9791186519042,10,"단 한조각을 먹어도 진짜, 정말 맛있는 쿠키를 먹고 싶죠! 그래서 정말 이 책이 기대됩니다. 가장 아끼는 레시피들만으로 채워져있다니...정말 저도 만들어보고 싶어요~"
9791186519042,10,쿠키 레시피북이라니 기대됩니다!
9791186519042,10,쿠키 종류가 이렇게 다양하고 만드는 법도 많을 줄은~
9791186519042,10,"밀가루, 특히 쿠키는 제가 너무너무 좋아해요. 초보자들도 쉽게 만들 수 있도록 신경써서 책을 만드셨다니 더 마음에 들어요~"
9791186519042,10,저같은 초보 홈베이커들이 보면 정말 딱 좋은 책인거 같아요. 실패에 대한 부담대신에 행복하게 설레며 만들 수 있을 거 같습니다. 기대됩니다. 예쁘고 맛난 쿠키에 커피 한잔을 곁들여서 여유를 즐기고 싶네요!!
9791186519042,10,세상의 온갖 맛있는 쿠키란 쿠키는 다 있네요! 다 먹어보고 싶어요 ㅠㅠ
9791186519042,10,다양한 시간과 공간에서 언제 어디서든 맛있게 즐길 수 있는 쿠키 레시피 꼭 배워보고 싶었어요 일상에서 혹은 누군가에게 선물할 수도 있는 다양한 쿠키 하나씩 만들어보고 싶네요
9791186519042,10,우리사랑하는 애기가 좋아할 만한 쿠키로가득하네요~~얼른따라해봐야겠네요~~
9791186519042,10,다양한 쿠키를 만들어먹을 수 있어서 무척 좋네요. 특별한 기념일에는 항상 비싼 돈을 주고 샀는데 이제 제가 직접 예쁘고 먹음직스럽게 만들어 주면 좋은 추억이 될 것 같아요. 맛있고 예쁜 쿠키를 직접 만들어서 먹으면 삶이 더 행복해질 것 같습니다.
9791186519042,10,식감과 재료별로 구분해 놓아서 원하는 쿠키를 선택하기도 편하고 따라 만들기 쉽게 구성되어 있는 것 같아요. 실수하기 쉬운 부분을 잘 짚어줘서 초보자에게 유용하겠네요.
9791186519042,10,과자를 집적 만들어 먹는 것과 사서 먹는 것에서 경제성을 비유로 하자면 사서 먹는게 낳습니다. 그냥 만족감으로 한다면 수제 쪽이 낳습니다.
9791186519042,10,먹고 싶은 쿠키들이 잔뜩이라 사서 해보고는 싶은데... 오븐 있어야 하나요ㅠㅠ 다양한 레시피들 실제로 만들어서 먹고 싶네요
9791186519042,8,여러가지 쿠키를 만들어 볼 수 있어서 좋습니다.
9791186519042,10,"다양하고 멋진 쿠키들을 초보 베이커도 쉽게 따라할 수 있도록 알째배기 레시피 30가지와 중요한 포인트와 팁, 홈베이커들이 흔히 겪는 시행착오를 줄이기 위해 Q&A를 담고 있어 직접 베이킹하는데 실질적인 도움이 될 듯 합니다."
9791186519042,10,쿠키들이 정말 예쁘고 설명도 자세히 나와있어서 정말 좋네요! 베이킹 좋아하는 저로써 너무 기대되고 꼭 한번 읽어보고 싶습니다!
9791186519042,10,베이커리가 취미인 저로써 도움이 많이 된 책이었습니다.
9791186519042,10,다양하고 건강한 레시피의 쿠키를 접할 수 있어서 너무 좋았습니다!
9791186519042,10,"허니비 케이크의 조은정셰프의 책이라 더 믿음이 가고 초보자 들도 쉽게 따라할 수 있도록 자세한 설명과 이해를 돕는 사진들이 있어서 따라하기 좋은 책이고, 중요한 포인트와 팁들로 완성도 높게 만들수 있도록 이끌어 주어 초보자들에게도 추천하고 싶은 책"
9791186519042,6,쿠키를 이렇게 만들어 먹으면 맛있겠네요. ^^
9791186519042,10,조은정 셰프가 개발한 홈베이킹 레시피 정말 기대가 됩니다...목차를 보니 모두 해보고 싶은 신선한 레시피들이에요! 꼭 구매할게요^^
9788992533812,8,사진에 끌렸다. 스타우브의 묵직한 광택만으로도 맛있다. 스타우브를 사게 만든 책. 그만큼 강력하다.
9788971904909,10,"동생이 먼저 보면서 ｀전복을 튀기는데,｀라고 말해서 ｀왜? 귀한것을 튀겨? 그냥 먹어도 맛있는데｀라고 말했는데, 책을 읽으면 ｀전복도 튀겨주세요~~~｀라고 싶을만큼 모든 튀김들이 다 먹고 싶어져요. 튀김은 오징어 튀김, 새우튀김, 야채튀김정도만 알다가 신세계를 만난 느낌...^^"
9788971904909,10,요리관심없는 여친한테 사줘야겠다 ㅎㅎㅎㅎ
9791195017676,10,정말 아이키우면서 필요한 이유식정보만 쏙쏙 !! 정말 쉽고 간단하게 되어있어서 좋아요 > <
9791195017676,10,이유식 기초부터 상식까지 쉽게 알려줘서 좋아요~레시피대로 천천히 따라하면 이유식 정복할 수 있을 것 같아요^^
9791195017676,10,이거대로도 만들고 응용해서도 만들고 부분부분 팁도 있어서 만들기 수월했어요~간식도 있어서 핵꿀
9791195017676,10,너무 너무 좋아요 초보엄마인 저에게 딱 좋은 책인거 같아요 >.<우리 하준이가 너무 잘먹네요 간단한레시피에 영양까지 어울어진 좋은 레시피네요
9791195017676,6,안심하고 이유식을 먹일 수 있는 방법을 제시해주기 때문입니다.
9791195017676,10,이유식 초기부터 말기까지 활용도 높은 레시피들과 이유식 상식들이 가득해서 만족 스러워요
9791195017676,10,이유식을 시작하기에 앞서 무척이나 고민이 많았는데 이 책을 접하고 이유식은 식은죽 먹기라는걸 느꼈어요...^^ 다른 분들도 이 책보면서 겁내지 않고 저처럼 쉽게 이유식 시작하셨으면 좋겠네요~
9791195017676,10,"정말 필요한 정보들이 가득한 책이에요.^^이유식 책으로 강추에요!~일단 책이 크고, 종이 질감이 좋아서 보기가 좋구요. 메뉴랑 레시피도 마음에 들어요.뭐니뭐니해도 가장 마음에 드는건, 식단표와 알짜정보들이네요!~이유식 재료 먹는 시기라던지, 하루 이유식 스케쥴, 단계별 정보가 가득해요"
9791195017676,10,믿을만한 레시피로 영영가있는 이유식을 해줄 생각하니 너무 좋네요특히 단계별로 식단표가있어서 메뉴 고민할 필요가 없어서 좋아요내일부터 이유식시작이라 방금 책보고 만들고 왔어요추천합니다~!
9791195017676,10,"저는 이유식만드는것보다 매일매일 메뉴선정이 더힘들었는데,안심이유식책에는 이유식 초기,중기,후기마다 한달 식단표가있어체크하면서 이유식을 만들수 있어 좋더라구요!​단계별로 체크해야할사항도 바로 옆페이지에 있어 한눈에 파악하기 쉬워 그날 만들메뉴보면서"
9788993418989,10,"자신만의 스타일을 고수하며 사는 사람들은 그들만의 멋이 난다. 흔한 킨포크 스타일에서 진일보된, 찐한 진심이 담겨있는 사진, 글, 요리 다 멋지다♡ 사실 따라할 엄두가 나는 요리는 몇 개 없지만 '잘 먹고 사는 맛과 멋'에 대한 좋은 에너지를 충전받은 느낌이라 충분히 만족한다."
9788967351151,10,"홍차의 교본, 지은이의 열정과 시간을 우리는 편안하게 즐기면 되는시간이다."
9788967351151,10,"홍차며 녹차며 마시기만 했지, 원산지며 브랜드별 소개며 만드는 하나하나의 과정까지도 보기 좋게 읽게될 줄은 몰랐습니다. 티 테이스팅도 알게 되었으니, 다음 번 홍차는 조금 더 색다른 맛이겠지요."
9788967351151,8,이 분야에서는 최고의 책이 아닐까?
9788967351151,10,부쩍 요즘 관심사가 ...
9788967351151,8,"기존에 읽었던 홍차에 관한 책들은 홍차 브랜드가 많이 설명된 감각적인 느낌이라면, 이 책은 정석 같은 느낌이어서 더 많이 배우게 된것 같아요. 이 책 때문에 중국 출장갔다오신분이 주신 차를 그동안 녹차인줄 알고 마셨는데, 우롱차라는것을 알았어요. ㅋㅋ 어쩐지 맛이 좀 독특하다 했어요. ㅎㅎ"
9788967351151,10,홍차는 맛있다
9788967351151,10,군더더기 없이 잘만들어진 책입니다.
9788967351151,8,홍차에 대해 알기 위해서
9788967351151,8,"홍차에 대한 가이드북과 에세이를 여러 권 갖고 있지만, 이 책의 정석 같은 접근이 마음에 든다."
9788967351151,10,"홍차를 다룬 책들을 보며 느꼈던 갈증이 해소되는 느낌입니다. 이 차가 어떻게 길러지고 어떤 여정을 거쳐 내 앞에 놓인 잔에 담기게 되었는지 한 번이라도 궁금했던 적이 있다면, 홍차를 마실 때 늘 꼼꼼히 고르는 사람이었다면 꼭 읽어보아야 할 책!"
9788967351151,10,감성을 강조하는 다른 홍차관련 책들과 달라 좋다.
9788967351151,10,이것이야말로 홍차에 대한 모든 것. 굉장히 전문적인 지식도 담고 있지만 또 굉장히 흥미진진해서 무척 재미있다. 홍차 뿐만이 아니라 홍차와 관련된 세계사 전체에 지식이 있으셔서 정말 다채로운 홍차에 관련된 지식들을 알수 있다.
9788971904398,10,최고의 샌드위치 책. 다른 책에서는 찾아볼 수 없는 기본정보가 알차다.
9788971904398,8,샌드위치에 대해서 정말 세밀하게 설명이 잘 되어 있네요꽤나 흥미롭게 잘 보고 있어요~
9788971904398,10,이 체계적이며 과학적인 책 덕에 내가 샌드위치 만들기에 항상 실패했던 갖가지 이유를 알 수 있었다. 다양한 샌드위치의 연원과 특징도 정리되어 있어 요리를 즐기지 않는 사람도 한 먼 읽어본다면 더 지적으로 브런치를 즐길 수 있겠다.
9788971904398,10,샌드위치에 관한한 가장 성실하고 꼼꼼한 책.이 책 한권이면 원하는 샌드위치를 먹을 수 있다.
9788971904398,10,"카페 준비를 하고 있기도 하고, 가족들이 빵을 좋아해 아침이면 샌드위치를 준비한다.매일 매일 같은 샌드위치에 질려있는 상태에서 새로운 샌드위치를 만들어 볼 수 있어 좋다.물론 우리나라에서 구하기 힘든 것들이 재료로 나오기도 하지만 그럴땐 그냥 비스끼리한걸로 대체해도 그럴싸한 맛이 난다. 비주얼도 ^.^b"
9788971904398,8,전문적인 샌드위치 책 한 권 갖는 느낌
9788971904398,8,일반적인 요리법이 아닌 프라모델 조립하듯 샌드위치만드는 방법이 소개되어 신선하고 좋았음.
9788971904398,10,"다양한 종류의 샌드위치가 어디서 왔는지 어떻게 만들어지는지 알 수 있어 조리서로서도, 킬링타임용 정보지로도 탁월한 즐거움을 주었다."
9788971904398,10,너무나 유용하고 샌드위치에 대한 지식이 풍부하고 모든면에서 완벽한 책이예요!포장팁들도 너무 좋고! 파티할때도 도움이 되는 레시피가 많네요!
9788971904398,10,속 재료의 특징도 나와있어 샌드위치를 만들때 레시피를 이해 할수 있었고 만드는데도 도움이 되었어요 구하기 힘든 재료도 있었지만 대체 할수 있는 재료로 만드니 고급브런치가 부럽지 않네요 ^^;
9788971904398,10,요새 아침에 끼니를 샌드위치를 먹을때가 많은데 책을 보고 따라서 만드니깐  완전 맛있습니다^^
9788971904398,10,카망베르 & 컨트리로스트 만들었는데 너무 맛있음 ㅎ 따라하기 쉽당
9788994799629,10,쉽고 간단하고 예쁘고...아즈젛아
9788994799629,10,미니오븐도 가능하다는?
9788994799629,10,내손으로 만드는 건강한 오븐요리
9788994799629,10,집사람에게 주면서 맛있는 요리를 해달라는 목적으로 산책.... 몇몇개의 요리는 성공^^
9788994799629,10,배가고파요
9788994799629,10,설명이 잘 되어있다. 하지만 내 결과물은.....
9788994799629,10,요리의 즐거움
9788994799629,10,맛있는 거 먹고 살자
9788994799629,10,오븐을 사고 나서 본 도서.여러가지 오븐요리하는 참고가 되었다.
9788994799629,10,오븐요리에 대해 설명이 간단하면서도 잘 알아볼 수 있도록 유용하게 나온 것 같아요ㅡ 잘보고 맛있는 요리 만들도록 하겠습니다.
9788994799629,10,"집에있는 오븐으로 해먹을수있던건 아주 한정적인.. 치즈 녹이는 정도의 음식밖에 못해먹고있었는데, 오븐 제대로 활용해서 맛난음식 해먹을수있을거 같아요아직 산후조리중이라 해먹을수없는 상황이지만, 집으로 컴백해서 딸래미 맛난 간식부터 해줘야겠어요 미리미리 정독해서 슉슉슉~!!"
9788994799629,10,집에 몇년째 사용하는 미니오븐이 있음에도 간단하게 쿠키나 굽고 식빵이나 구워먹는 정도로만 사용하는데...이번 기회에 좀 더 다양한 요리들을 할수 있을것 같아서 너무 신나고 좋아요...
9788971904312,10,"카레좋아하는 아들과 일주일에 하나씩 따라해보고 있어요. 죄송한 말이지만, 이제 카레는 외식 안해요. 지나치게 감동적인 책 입니다."
9788971904312,10,그동안 구매했던 요리책 가운데 만족도가 가장 높은 책이예요. 아주 알차네요
9788971904312,10,혹시 카라멜라이징 양파 만들기에 지치신 분이 있다면 이 책에 15분 만에 만들 수 있는 비법이 적혀있으니 꼭 보시길 바랍니다 그 이외에 카레 루 성분과 재료의 궁합 루 조합하기 다양한 실험적인 재료로 만든 카레가 잔뜩 있으니 카레를 좋아하신다면 읽어보세요
9788971904312,10,카레 좋아하는 분께는 매니악한 책..ㅋ
9788971904312,8,이것은 좋은 책입니다.ㅠ 카레 좋아하시는 분들은 꼭 보세요ㅠㅠ여기 있는 걸 모델로 다양하게 응용도 가능할 것 같아요. 아 그런데 일본 책이라 중간중간 우리나라에서 구하기 힘든 재료가 나와서 아쉽게 별 하나 뺐어요 ㅋㅋ
9788971904312,10,책을 보고 새삼 느낀다. 카레에 들어가는 야채나 고기는 역시 큼직하게 썰어야 군침 돈다는 것을! 꿀꺽-
9788971904312,10,비프 카레 만들었는데 색다름... 흐흠
9788971904312,10,시중에 나와있는 카레만 먹다가 이번에 색다른 카레를 만들어서 먹었는데 넘 맛있었네요 ^^
9788996508458,6,그저그래요
9788996508458,10,간편하니 이쁘고 맛있네요
9788996508458,10,아이에게 매일 하나씩 만들어주기로 결심.
9788996508458,8,"제목 그대로 한그릇에 아이를 지켜줄 고른영양소를 담을수 있게 레시피가 나와있는데,,요리초보인 제가 따라하기에는 조금버거운 레시피들이 절반정도라 아직 활용을 못하고 있어 아쉬워요."
9788996508458,10,솜씨 없는 엄마지만 아이 밥상은 정말 최선을 다하고 싶지요. 간단하면서도 쉽게 할 수 있는 친절한 레시피에 아이 건강까지 챙길 수 있으니 정말 좋네요. 아이와 가족이 함께 할 수 있는 식탁이 될 수 있을 거 같아
9788996508458,10,매일 아이밥을 챙겨먹이면서도 혹시 부족하거나 빠진부분는 없을까?? 라는 고민을 해결해 줄수 있는 책이예요.  새롭고 간단한 메뉴도 좋고 세세한 영양분석까지....
9791197161803,10,금음체질 요리 레시피 유용해요 !!!!
9788998171940,10,정말 귀엽고 예쁜 도시락 싸기 좋은 책입니다 자세히 나와 있어서 따라만 하면 라이언김밥부터 뽀로로 고양이 등등 손쉽게 예쁜 도시락을 만들수 있어서만족스럽습니다 완성도 있는 캐릭터 도시락을 싸기 좋은 꿀팁이 가득하네요^^
9788927811732,6,내용은 알찬데 감미료가 들어가서 별점 뺐어요. 일반 음식에는 참치액이 들어가고 물김치에는 아스파탐이 들어가더군요.. 그게 좀 실망이네요.  딸의요령에서 아이들이 먹을 수 있는 반찬으로 응용하는 팁은 정말 맘에 들어요
9788927811732,10,우선 계량컵과 계량스푼을 사용해서 정확하고 변함없는 맛을 낼수있고 또한 마치 바로 옆에서 가르쳐 주는것처럼 세세하고 친절한 설명으로 다른 요리책들과는 비교가 안되는 완성도 입니다. 이책저책 사지마시고 이거 딱 1권이면 요리마스터 가능할것 같습니다.
9788927811732,10,설명이 이렇게 자세하게 나온 요리책을  지금까지 본적이 없고 놓치기 쉬운 비법들을 하나하나 전수 받는 느낌이 들게 하는 책이라 넘 마음에 들어요^^
9788954674843,10,기대이상이네. 사진도 너무 좋다.
9788954674843,10,"치즈의 종류 설명은 당연하고, 각각의 특징과 맛, 플레이팅, 치즈 만드는 법, 레시피까지. 집에서 치즈 즐기는 법이 아니라 치즈의 거의 모든 것이라고 해도 무방할 정도로 알찬 내용의 책, 먹지 않아도, 읽는 것 만으로도 집에서 치즈를 즐기길 수 있는 책이다."
9788954674843,10,평소 너무좋아하는 치즈샵 치즈플로 조장현대표님 책이라고해서  발매전부터 매우기대하고있었던 책이에요역시 기대이상 퀄리티의 책 이네요평소 먹는치즈만 먹게되는경향이있었는데 생소한 브라운치즈나  프로마쥬블랑 같은 새로운치즈도 알게되서 좋았고  다양한  치즈응용요리법 소개도 좋아요
9788954674843,10,와 너무 좋아요. 평소 치즈를 좋아해서 이것저것 다양하게 먹고 있었지만 알고 있던게 얼마나 부족했는지 확인하게 됐네여. 이렇게 맛있고 다양한 치즈가 있다니!! 그냥 먹어도 맛있겠지만 요리까지 있어서 더 좋네요. 치즈 요리 꼭 도전해보겠습니다!!
9788954674843,10,치즈를 좋아하지만 카프레제 샐러드와 파스타에 갈아 넣는 파르지미아노 치즈 조합밖에는 몰랐어요. 이 책에는 각종 치즈 만들기와 시중에서 구할 수 있는 치즈를 활용한 다양한 레시피가 가득해요. 코로나19로 외식이 어려운 요즘 저희 집 식탁이 훨씬 풍성해질 것 같아요.
9791166030857,10,아이가 디저트 만들기 취미를 갖고 있어서 퇴근후마카롱을 선물해줬어요~ 다양하고 예쁜 모양이 많아서 정말 좋아합니다^^
9791190938389,8,문성실. 이름만 들어도 성실한 못하는게 없는 주부. 멋지다. 난 요리 잘하는 주부가 그렇게 멋지더라.. 오늘 뭐먹지는 날마다 고민이고 주부의 숙명이다. 같은 재료로 다른음식이 탄생하는. 책에 맞춰 장을 보면 가계에도 도움이 될것같다. 이렇게 간단하게도 요리를 맛나게 할 수 있구나. 부럽다
9791164261260,8,초급부터 고급까지 데코 방법과 응용법을 다루고 있어서 좋아요. 다만 친절한 설명 보단 이미지 위주의 내용인점은 조금 아쉽습니다. 초보보다는 중상급자분들에게 더 유용할것 같아요.
9791164261260,10,1~3까지 다 모았어요!! 진짜 도움 많이 받고 있어요!!
9791164261260,10,기다리던 데코책~ 장식물작업에 유용하게 쓰겠어요~
9791164261260,2,책 가격에 비해 내용이 너무 없음....하
9791160074901,4,목차보고 맘에 들어 구매 했는데 과정 사진도 없고 구할수 없는 재료도 있고 잘 인볼것 같아요.
9791164261055,10,가루하루의 에클레어라는 이유만으로 충분히 구매할 가치가 있는데 따라하기 쉬운 시원시원한 사진과 오랜 노하우가 느껴지는 레시피가 감동입니다~~~
9791164261055,10,깔끔하고 군더더기 없는 배치와 눈에 잘 들어오는 상세샷이 마음에 듭니다. 재료 설명과 과정 설명이 쉽게 풀이되어 있어서 사진 보면서 따라하기 좋아요~ 1권2권 같이 샀는데 다음 시리즈도 너무 기대됩니다~~
9791164261055,10,조금은 높은 가격대에 고민하다가 서점에서 직접 보고 책과 내용 퀄리티 보고 구매했어요~ 가루하루의 에클레어를 집에서도 만들어 볼 수 있어서 너무 만족 합니다!
9791164261055,10,"해외에 살면서 국내에서 핫한 가루하루의 레시피를 접할 수 있다는게 꿈만 같네요!  영문도 함께 실려있는 점, 글루텐프리 레시피가 있는 점, 익숙한 재료와 킥이 되는 특별한 재료들을 조합하는 레시피 등이 특히 좋았습니다. 마스터북 시리즈의 다음 책도 기대가 됩니다"
9791164261055,10,딱 한마디로 완성본!!다른거 안봐도 될만큼 에클레어에 대해 세세하고 잘 정리되서 나와있어서 보기 좋은 책이에요. 그냥 대박인 책이에요♥♥
