ISBN13,rating,review
9788993357608,8,당뇨 식단에 대한 친절한 소개
9788993357608,10,건강에 도움이되요^^
9788993357608,8,신랑이 이 책을 보더니 이렇게만 만들어준다면 자기는 다 먹어줄수있다고 하네요. ^^;; 제가 그렇게 만들어주기 힘들것 같아요. ㅋㅋ 당뇨식단인데 맛있게 구성이 되어 있어요. 식단관리 도움이 될것 같습니다.
9788993357608,10,"현재 먹을 수있는 ,만들어 먹을 수있는 방법과 맛도 있는 좋은 조리법이 나와있어서 도움을 많이 받고 있습니다. 식사때에 먼저 살펴보고 해당되는 음식을 만들고 기록하면서 몸의 반응을 살피고 있습니다. 건강은 생활이라서 하나 하나 보면서 조리를 배워 갑니다."
9788993357608,8,"깔끔한 구성, 당뇨에 대한 간략하지만 핵심정보가 잘 정리되어있다.
음식의 구성도 나름 좋은편이다. 그런데, 평소에는 잘 쓰지 않던 재료들이 많아서인지, 큰맘을 먹어야만 책의 조리를 흉내낼수 있을것같다. --;; 그것이 단점이라면 단점."
9788993357608,8,저혈당식이라고 나와있는 책중에 한식위주로 나와있어서 무척 맘에 듭니다.
9788993357608,10,당뇨환자들도 먹을 수 있는 음식이 많다는 희망을 주는 책. 다양한 메뉴가 아주 유용함
9791196616052,10,쉽게 따라하기 쉬운 요리법이어서 좋았어요. 특히 책에 담긴 요리의 감성적인 느낌이 좋았어요. 뉴욕 코리아타운에 her name is han 디렉팅을 맡았다는 문장을 읽고 믿고 읽었습니다.  그때 식당 음식이 정말 맛있어서 자주갔어요!
9791196616052,10,채소과일먹기에 관한강의를 도서관줌강의로듣고 요즘 매일 채소과일먹기에 힘쓰고있어요. 사진이너무예쁘고 어렵지 않아 해먹어 보고싶은 음식이 너무많은책입니다.  채식주의가 아닌 채소 친화적 애티튜드 라는 말이 너무 인상적입니다. 매일 채소를 가까이하는 일상을 만들어가고싶어요
9791196616052,10,"받자마자 몇개 해봤어요. 나와있는 대로 해도 좋고 , 냉장고에 남은 채소로 변형해서 해봤는데 맛잇네요!"
9791197022043,10,"저탄수 베이킹이지만 케이크부터 식사빵까지 메뉴가 엄청나게 다채로워요.하지만, 에리스리톨이나 파우더 타입코코넛가루 브라운 스워브등의 재료를 정말 완벽하게 갖춰두고 시작해야 좋은 결과물을 얻을 수 있습니다. 베이킹샵에서도 구하기 힘들고, 해외배송인것도 있어요."
9791197022043,10,초보자도 쉽게 접근할 수 있고 아몬드가루와 코코넛 가루를 적절히 사용할 수 있는 레시피가 많아요.케이크 좋아하시는 분들에겐 건강한 케이크 만들어 드실 수 있어서 좋을것  같아요.빵순이지만 밀가루때문에 걱정이시라면 충분히 대체할 수 있는 베이킹이 이  책에 가득합니다. 추천해요♡
9788965181750,6,독자층이  젊은 세대일 것이라 생각했을까흐린 색상의 글씨. 사진 밑의 깨알같은 크기의 글씨...돋보기 없이 읽기가 너무 어렵고 피곤하다 책은 큰데도  글씨가 너무 작다그럼에도 내용은 좋다. 화분에 채소 키우는 법과 함께 바로 옆 페이지에 요리법까지... 딱 원하던 책
9788965181750,10,집에서 채소를 키우고 싶었던 사람들에게 추천해주고 싶은책 !!집에서 키우는 채소는 일단 힐링이 되지만 어떻게 키워야 하는지 잘 모른다그럴때 이책을 산다면 시작부터 마무리까지 도와준다는법일단 그냥 요리책말고 채소를 키우는 법과 비료 쓴는법병충해는 어떻게 극복하는지 까지 알려줌
9788996347293,10,집에서도 해먹을 수 있는 레시피가 맘에 들었습니다
9788996347293,10,계량이 정확하고 건강에 좋은 음식이 많아서 좋네요.
9788996347293,4,메뉴가 너무 고급져서 집에서 쉽게 해먹기 어려움
9788996347293,10,요리 초보도 따라하기 쉽게 사진과 설명이 훌륭합니다. 맛도 좋고 몸에도 좋아 거의 매일 이 책에 나온 레시피로 요리합니다.
9788996347293,10,조리방법이 복잡하지 않고 설명도 잘 되어있어요 ^^ 채식에 관심이 있어서 찾아보게되었습니다. 도움이 많이 되었어요
9788996347293,10,"기본적인 재료 준비와 다듬기, 기본 소스가 잘 정리되어 있고, 만들기도 어렵지 않고, .. 기본적으로 지향해야할 밥상의 모습이 아닌가 생각이 든다. 하나씩 하나식 해봐야겠다는 생각이 든다. 이번에 성공한 또 하나의 책 - 요리초보에게도 유용."
9788996347293,6,"아이가 아토피가 심하게 오면서 가족모두 먹거리를 바꾸어야 했다. 인스턴트, 유제품,계란,생선일부를 제외하고 하니 정말 먹을게 없었다. 그래서 이책을 사서보며 따라해봤는데 확실히 손은 많이가는데 고기나 생선등을 쓰지않고도 맛있는 밥이 완성되었다. 신기하다."
9788996347293,8,건강식 조미료 없이 원재료의 맛을 느낄 수 있고 건강에도 좋고 사찰음식은 요즘 유행하는 힐링 그자체다 조미료와 자극적인 음식들이 넘쳐나는 시대에 자연으로 한걸은 다가서는 듯한 느낌이다
9788996347293,10,"항상먹는 그런그런음식말고 좀더 자연에 가깝고 건강할 수 있는 요리방법중 하나가 사찰요리라 생각들어요 가장 간소한 조미료만으로 맛도 건강도 챙길수있고,  그렇다고 요리방법도 까다롭지않고 쉽게 따라할 수 있게 정말 잘만든 요리책인것 같아요"
9788996347293,10,사찰음식을 가정식으로 접목시켜 누구나 맛있고 건강하게 즐길수있는 실용적인 보물 레시피를 연구개발해낸 정재덕셰프에게 무한감동과 감사를 드린다.여기 소개된 채식식단이야말로 궁극적으로 우리가 추구해야할 밥상이 아닐까..한국을 늘 그리워하는 멀리 떨어진 친지에게 따뜻한 이책을 선물하련다
9788996347293,10,"｀사찰음식은 맛없다,재료가 생소하다,종류가 한정적이다｀라는 편견을 완전히 깨게해준
정말 보물같은 채식 사찰 레시피들입니다.현대인들에게 꼭 필요한 영양가득 건강한 가정식을 사찰 조리법으로 만든 누구나 쉽고 맛있게 따라할수 있는 힐링 요리들!!! 정말 강추하는 소장가치 충분한 요리서입니다!"
9788996347293,10,"정말.말 내 건강에 대한 소중함을 일깨워주고, 우리가 얼마나 가공식품, 육류, 자극적인 양념에 길들어져있는지.내몸을 혹사시켰는지 반성하게 하는 책  향신채를 안쓰고 이렇게 맛난 음식을 만들수 있는지 감동!"
9788996347293,10,"이 책은 보석상자다.

내몸이 원하는 가족을 위한 가볍지만 영양만점의 한끼
계절에 따라 주제에 따라 다양한 메뉴로 그때그때 맞춰서 꺼내보는 나만의 보물상자
어렵게만 느꼈던 사찰음식과의 거리를 좁혀서 매일반찬으로도 충분히 쉽고 간편하게 만드는 조리법
이제 매일매일 내몸을 위한 힐링을~"
9788927811480,10,"평소 저염음식에 관심이 많았는데 이 책에서 다양한 비법을 소개하고 있네요. 맛있게 먹을 수 있는 저염 레시피, 당장 따라하고 싶어요."
9791197178207,10,"근력을 키우고 싶은 채식지향인으로서 두부나 소이프로틴 정도만 챙겨먹고 있었는데, 다채로운 메뉴를 알게되어 좋습니다. 오븐을 이용하긴 어렵지만 여건이 마련된다면 다 한번씩 해보고 싶네요. 사진이 없는 페이지는 음식의 형태를 상상하기 어렵긴 해도, 검색하면 되니까요~! 좋은 책 감사합니다!"
9791197178207,8,갱년기 체중증가로 다이어트를 시작하며비건식품에 관심이 많아졌어요알라딘에서 좋은음식 책자를 구경하다구입하게된 쿡북 만족합니다.정석대로 다 따라 하진 못하고 있지만 노력하고있습니다.
9791197178207,10,비건을 지향하는 저에겐 아주 특별한 책 입니다. 플렉시테리언을 하고 있지만 집에서 먹을 수 있는 비건 요리에 항상 목이 말랐었거든요. 다른 레시피 책보다 이해하기 쉽고 전에 보지 못했던 다양한 요리가 있어서 저는 대만족 입니다!! 구성이 좋았어요. 모로코풍나 인도풍 등등 두부탕수 강추입니다
9791197178207,8,"채식에 관심이 많아지다보니 채식으로는 단백질을 어떻게 채울까가 궁금했어요..! 이런저런 상식들과 상세한 레시피, 식단까지 구성된 책을 받으니 건강이 절로 챙겨지는 기분입니다! 좋은 책 감사합니다!"
9791197178207,8,비건인데 단백질을 듬뿍 섭취할 수 있는 레시피가 잔뜩이라 좋습니다. 병아리콩 과자는 만들어봤는데 엄청 맛있었어요
9791197178207,6,쿡북이니  실물 사진 기대했는데  설명만  있으니  이건  쿡북이랄지  비건에세이랄지 정체성이  불분명한 책. 호감도 떨어짐.
9791197178207,10,비건 삶을 지향할때 외부의 시선은 운동하며 육식의 단백질을 먹지.않으면 근육을 키울수 없다고 생각한다 하지만 이 책은 그 편을 깨주고 얼마든지 비건으로도 근육과 체력을 키울수 있는 이론적인 이야기와 레시피가 잔뜩있어서 너무 좋았다
9791197178207,6,요리책치고 요리사진이 많지는 않아요. 요리과정사진은 아예없는 편이고 완성본 사진만 좀 있는정도라서 요리초보분들께는 별로 추천드리지않습니다그거랑 별개로 요리시작에 앞서 영양에 대한 이것저것 기초상식들은 되게 유익합니다! 식단표도제공되어서 좋구요 나중에 한번도전해보려구요
9791197178207,8,향신료를 써야하는 레시피들이 꽤 있다. 낯설긴하지만 도전해볼 만 한듯?
9791197178207,10,좋아옹!!!
9791197178207,8,여러 가지 비건푸드 레시피가 모여 있어 마음에 듭니다.
9791197178207,10,신박한 메뉴가 많아 너무 좋았어요 확실히 튼튼하게 다이어트하는 느낌이 들어요
9791197178207,8,"운동하는 채식주의자들에 맞춤 책으로 여러 다양한 고단백 레시피를 제공해 준다. 요리에 앞서 재료, 운동 정보들도 정리가 되어 있다. 요리별로 영양 정보라든지 보관 정보 등 정리가 잘 되어 있고 30일 식단도 좋다. 재료 준비가 문제겠지만. 책이 생각보다 크고 표지가 얇아서 놀랐다."
9791197178207,10,기다리던 책 받아서 좋아요. 프로틴 레시피 많아서 참고하기 좋을 것 같아요. 간편하게 할수 있는 레시피 많습니다
9791197178207,10,채식을 하면서도 근손실을 막을 수 있다니!
9791197178207,10,기다리던 책입니다. 건강한 식사를 위해
9791197178207,10,왜 이제 나왔나요ㅠㅠㅠ 채식을 유지하면서도 건강하게 단백질을 섭취하고 근육을 키울 수 있는 방법을 이제라도 알게되서 천만다행 ㅠㅠ
9791197178207,10,생각보다도 더 요리 종류가 많아서 좋구요 식단표와 해설도 친절해서 더 좋은 듯 합니다
9791197178207,10,메뉴가 다양하고 그동안 본 책하고는 다른 게 많아 샀습니다. 갖춰야 할 게 많다 보니 선뜻 시작하기는 어렵지만 차곡차곡 하다 보면 할 수 있을 것 같아요. 비건 하이프로틴 조합이라 참 마음에 듭니다.^^
9791197178207,8,"사진이 좀더 많이 있었으면 더 좋았을 것 같아요. 한국에서 잘 쓰지 않는 식재료를 사용하는 경우도 많아서 약간 부담이 되는 부분도 있어요. 그렇지만 어느정도 구할 수 있는 것으로 대체할 수 있을 것 같고, 매우 자세한 설명과 다양한 요리가 수록되어 있는 것이 장점인 것 같아요. 유용하게 쓸게요"
9791197178207,10,비건지향이지만 비건 요리 관련 책은 처음 구매해봤는데요. 재료도 다 나와있고 겹치는 것들이 많다보니 몇 가지 더 구입해서 잘 해먹을 수 있을 것 같아요. 너무 좋아요.
9791197178207,10,올해부터 비건 지향으로 식습관부터 조금씩 바꾸는 중인데 어려움이 많았습니다 부디 이 책이 도움이 되기를 바랍니다
9791197178207,6,정말 하이프로틴 쿡북 이네요!! 생각보다 전문화된 요리에 놀랐어요집에없는 재료가 좀 있어서 다른걸로 대체해서만들어볼 생각입니다하지만 한끼에 영양섭취라던가아주 유용한 정보가 자세하게 있어서그점이 아주 좋네요
9791197178207,10,선물하기 참 좋은 책 인 거 같아요~ 주변 채식주의자 친구에게 선물했더니 레시피가 꼼꼼히 적혀있다고 좋아라 하네요!
9791197178207,10,채식주의자는 아니지만 고기섭취를 줄이고 싶어 이 책을 구매했습니다 좋은 참고가 될 것 같습니다
9791197178207,10,"하루에 먹을 수 있는 비건 요리방법이 그림과 같이 제시되어 있어, 요리해서 먹고 싶은 욕구가 생긴다. 채식주의자가 아닌 사람도 채식주의에 같이 참여할 구 있는 졸은 책이다."
9791197178207,10,재미있어요. 채식을 계속 하고 있지만 재료들에 대한 자세한 설명과 더 다양하게 먹을 수 있는 방법들이 있어서 좋아요. 여유롭게 하나하나 먹어보고 싶네요
9791197178207,10,평소에 먹던 것보다 더 넓은 스펙트럼의 요리를 먹게 될 것 같아요 비건 파이팅 !
9791197178207,10,"최근 건강상의 문제로 운동과 식습관 모두에 관심을 가지게 되면서 구매하게 된 책입니다. 다시금 탄단지로 구성된 균형잡힌 식단의 중요성을 깨닫게되네요. 한끼식사부터 디저트, 소스까지 다양한 레시피가 수록되어 있어 유용합니다. 식단표 참고해서 저만의 30일 식단표도 구성해봐겠어요!"
9791197178207,8,"간단한 영양지식과 조리방법, 영양소g, 식단구성이 있어서 좋았다.  특히 비건소스, 비건치즈, 타르트지 등 꼭 필요한 것부터 설명해줘서 따로 알아보지 않아도 되는 점과 조리과정이 간단한편이라 따라하기 어렵지 않을 것 같다. 아쉬운점은 조리과정이 필요한 요리엔 사진이 조금 더 있었더라"
9791197178207,10,생각보다 구하기 쉬운 식재료로 비건요리를 만들수 있다는 점에서 좋은 것 같아요. 단지 오븐 쓰는 요리는 좀... 레시피 외에 비건으로 운동하기 위한 준비과정도 들어가 있다는 것이 매우 참고가 되네요.
9791197178207,10,비건으로 살아가려면 꼭 필요한 것이 라 생각되서 구입 하게되었습니다 건강한 비건 으로 좋은 시간이 될것 같습니다 감사합니다
9791197178207,10,균형잡힌 채식 수행을 위한 레시피 북
9791197178207,8,책 받기를 엄청 기대하고 있어요. 작년부터 비건 디저트를 먹기 시작하면서 원래 채소와 과일을 고기보다 더 좋아했던 식성이라 더 거부감이 없는것 같아요. 미국에 있는 동물보호소에 출장을 가게 되었을 때거기서 비건식만 일주일동안 하면서정말 더 몸이 가벼워지고 깨끗해 지는걸 느꼈어요.
9791197178207,10,"비건이 되면 단백질이 부족하다는 얘기를 제일 많이 듣고 살았고, 실제로 저 역시 머리빠짐,무기력 등 신체증상을 겪어서 포기했었는데 올바른 채식을 공부해보고자 구매했습니다."
9791197178207,10,완전 기대하고 있네요~
9791185473567,10,재료 그대로의 맛과 영양을 최대한 살린 에어프라이어 요리를 배워볼수 있을것같아서 기대됩니다
9791185473567,10,집에 있는 시간이 많아 에어프라이어로 이것저것 해볼까 해서 구입했습니다 간단하면서 건강식이라 저도 좋고 아이들도 좋아해요^^ 둘째가 책 가져와서 오늘은 이거! 내일은 저거! 매일 해달라는 해서 책 사길 잘했다는 생각이 듭니다~!
9791185473567,10,"요리를 하는 편이 아니라서 에어프라이어는 전자레인지 대용으로 사용했었는데,이렇게 쉽고 다양한 다양한 요리를 할 수 있는게 신기하고 재미있었습니다! 덕분에 다이어트에 도움이 많이 됩니다:)"
9791185473567,10,"다른 에어 프라이어 튀김 요리와 다르게, 공장표  튀김이 아닌, 최대한 수제로 칼로리 까지 염두를 하고 만들어 건강식 튀김으로 저자가 가족을 생각하는 레시피에 다이어트 효과를 도톡히 보는 음식류를 만들어 튀김을 포기하지 못하는 분들에게 체중 조절과 풍족한 섭취를 가능하게 도와준다."
9791185473567,10,에어프라이어 꿀팁이 떠도는 와중에 정확한 정보가 하나로 싹 정리된 자료가 필요하다면 두말않고 이 책을 고르시기를! 그림과 키워드로 잘 정리되어있어서 주방 서랍에 넣어두고 유용하게 쓸수있다.
9791185473567,10,"에어프라이어기를 사놓고, 냉동식품을 해동을 해  굽는 기본적인 간편조리만을 해왔는데, 건강다이어트 요리법 제목처럼 건강한 요리법을 전개하여, 보다 따라 요리를 할 수 있게, 아침과 저녁식사의 시간을 보다 효율적이고, 즐겁게 보낼 수 있도록 해주는 요리책  추천합니다."
9791185473567,10,요즘 젊은 사람들이나 요리를 좀 하는 분들에게 에어프라이기는 유명한 요리기구라고 생각합니다. 하지만 많이 알려진 만큼 제대로 쓰는 방법을 아는 사람은 드문 것 같습니다. 그들을 위해 나온 아주 유용한 책이네요.
9791185473567,10,"생활의 필수품처럼 자리잡은 에어프라이어.  이 책은 그 에어프라이어를 이용해 차별화된 건강한 요리, 건강한 다이어트 요리를 만들 수 있게 해준다. 덕분에 냉동식품만 튀겨대던 나의 에어프라이어가 훌륭한 요리사로 변신할 것 같은 기분이 든다."
9791185473567,10,"에어프라이어 입문자에게 필요한 정보의 기초부터 하나씩 알려주어 굉장히실용적이고, 가장 핵심인 메뉴들까지도 하루의 시간대별로 알차게 구성해주어 정말좋습니다. 평소 어떻게 해먹을지 난감해 손을놓은 재료까지도 정말간단히, 하지만 맛있게 먹을수있는 메뉴들이많아 정말 큰도움이 될것같습니다"
9791185473567,10,"매번 기름진 냉동제품 데우는거로만 써오던 에어프라이어가 이젠 요리도 한다!!! 다양한 에프요리책들이 나오지만 다이어트도되는 에프요리책은 첨인듯싶어요^^간식과 메인요리 몇개 해봤는데 너무 맛있고 아침,점심,저녁,간식으로 나뉘어 내맘대로 다이어트식단짜서 활용하면 좋을듯해요"
9791185473567,10,"콩콩이님 도시락 영상을 보며 에어프라이어 조리법이 궁금했었는데 책이 나와 넘 좋아요 그동안은 냉동식품 데워먹거나 삼격살 굽는정도로 활용했던 에프였지만 이 책 한권으로 브런치부터 디저트, 안주까지 다양하고 건강한 또 맛있는 요리를 만들수 있어 굿~!!"
9791185473567,10,이 책의 가장 큰 장점은 발상의 전환인것 같아요에에프라이어는 냉동식품에 최적화 되었다죽은 치킨도 살려낸다그래서 살이찐다그런데 이 책의 레시피들을 따라해보고서는건강하고 맛있는 요리도 가능하구나라는걸알
9791185473567,10,"초창기 에어프라이어 레시피라고 하면 냉동식품들이 대부분이라 딱히 소장하고 싶은 마음이 별로 안 들었는데, 에어프라이어로 만드는 ‘건강‘, ‘다이어트‘ 요리 레시피북이라고 하니 일단 콘셉트부터가 너무 와닿았다."
9791185473567,10,"요즘 가정에서 많이 사용하지만,감자, 만두, 치킨 데워먹는데만 거의 사용하는 것 같아요.건강한 요리와는 거리가 멀게 생각했는데다양한 다이어트 건강식이 소개되어 너무 좋아요~편하게 온 가족의 건강을 생각한 요리를 만들 수 있을 것 같아요~"
9791185473567,10,요즘에는 어느 가정에나 꼭 있는 에어프라이어-!에어프라이어 전용 냉동식품이 나올정도로 요즘은 필수템이 되었는데요항상 똑같은 요리만 만들어먹다보니 색다른 것도 도전해보고 싶지만 결국에는 또 그요리...이렇게 애정하는 레시피팩토리에서 에어프라이어 책이 새롭게 나와서 너무 좋아요
9791185473567,10,요즘은 마트에서 시식도 에어프라이어로 하고 에어프라이어용 냉동식품도 많이 나오더라구요. 거의 필수 가전제품이 된 느낌입니다.. 에어프라이어로 튀김요리만 해먹는다는 인식이 있었는데 이 책으로 하여금 건강한 레시피를 시작하고 또 다른 분들도 많이 전파해주셨으면 좋겠어요!
9791185473567,10,요리하는시간을 줄이기위해 에어후라이기를 사둔 워킹맘인 나에게 매번 간편식에 냉동식품만 휘리릭 돌려 먹인 후 괜한 자책감이 들게도 했는데... 이 책 한권이면 에피타이저와 메인요리후 먹는 디저트까지 한번에 코스요리를 즐길 수있는 레시피로 우리주방 총괄셰프 될듯.
9791185473567,10,"전자렌지만큼 익숙해진 에프. 매번 만두 먹고 삼겹살만 먹었더니 청소도 너무 힘들고, 살도 찌는 기분이었어요. 그렇다고 안쓰자니 자리도 많이 차지하고, 뭔가 아깝고. 약간 에프와 멀어질 것 같은 요즘인데 딱 제가 찾는 책이 나왔네요. 케일칩같은 메뉴 너무 좋아요"
9788970673530,2,보다가 짜증나서 구석에 두었습니다. 기본적인 재료 정리도 제대로 되지 않았습니다. 주요재료를 빼먹은 것도 있고 재료를 중복으로 기재한 것들도 있습니다. 차라리 키토카페에서 얻은 정보가 더 도움됩니다.
9788970673530,10,저탄수 고지방 다이어트를 결심하고 이런저런 책을 많이 읽게 되었는데 결국 중요한건 실천이더라구요. 제대로 실천해보고싶지만 먹지 말아야하는 음식들부터 맛있고 다양하게 어떻게 식단을 짤수 없을까 고민하던중 이 칙을 만나게 되었습니다. 4주식단구성으로 되어있어서 그대로 따라하기만 하면되
9788970673530,10,이 책 하나면 저탄고지를 쉽게 할 수있을것같아요^^음식종류도 다양해서 어떤 음식을 먹어야하는지 고민도 필요없습니다.매일 매일 종류를 달리해서 하는 키토식이라면 얼마든지 할 수있을꺼같아요!! 저는 활용도가 늪아서 강추합니다!!
9788970673530,10,저탄고지하는 1인으로서 이책은 진심 유용합니다.좀더 맛있고 즐거운 식단을 하기위한 래시피가 아침점심저녁으로 4주식단이 나와있으니  오늘은 어떻게 식단을 장만하지? 라는 걱정거리가 없어졌어여.   이런 키토식 책 넘흐 좋아여~~  일반 탄수식이하시는 분들에게도 유용할거같아요^^추천합니다.
9791186137727,8,이유식때 닥터오한그릇뚝딱을 봐서 그런지 요리초보 엄마는 유아식 기본서(?)로는 부족한 느낌입니다. 세컨책으로 적당한거 같아요 기본서 또 알아보려구용 ㅎ
9791186137727,10,식판 구성이 좋고 요리법이 간단해서 쓸모가 많습니다. 추천합니다.
9791186137727,10,어느 순간부터 했던 몇가지 음식만 하고 있는 저를 발견하고 ^^ 조금 쉽게 다양한 반찬을 만들어 보고싶어 구매했어요~ 요리법이 복잡하지 않아 맘에 들어요^^ 잘 이용하고 있습니다~
9791186137727,10,갖가지 메뉴도 있고 아내가 많은 도움이 된다고 하네요. 책도 괜찮아요~
9788927808084,10,건강이 염려되어 식생활에 변화를 주고 싶어 찾다가 발견했는데.. 만들기쉬운 요리라 따라하기 좋을듯..메뉴 떠오르지않을때도 유요할것 같고 구성도 괜찮은것 같아요..인쇄상태도 굿~
9788968330278,10,메뉴 구성이 좋습니다. 장보기 쉬운 구성에도 높은 점수를 주고 싶습니다.
9788968330278,8,간단하고 좋네요
9788968330278,10,다시 다이어트를 시작하면서 참고할만한 샐러드책을 찾고있었는데 이책이 제일 적당해보이더라구요! 1주일마다 정해진 야채를 메인으로 샐러드를 구성해놔서 장 볼 때 낭비도 없고 좋았습니당 레시피들도 다 훌륭하구요 추천하는 책이예요
9788968330278,10,샐러드를 시작해보려고 구매했어요. 이제 책보고 따라서 한번 만들어 보려구요 구매할때 따라온 텀블러도 너무 좋네요. 책 따라서 주스 만들어서 텀블러에 마시려구요.
9788968330278,10,"아침에 산뜻하고 속편하게 주스로 시작하니 든든하네요~ 책의 레시피대로 신선한 과일야채를 부재료와 적합한 비율로 섞어 마신지 이틀뿐이지만, 확실히 구매하길 잘했다는 생각입니다*^^*"
9788968330278,10,식습관을고칠라고
9788968330278,10,음식을 이용해 몸을 정화
9788968330278,10,"장보기 편하게 되어있고, 양이 정해져 있어 좋아요."
9788968330278,8,요즘 건강에 관심이 많아서 읽어봤습니다.
9788968330278,10,집에서 손쉽게 만들수 있어서 정말 좋아요.간단하고 맛있습니다.
