ISBN13,rating,review
9788960517271,8,다이어트 식단에 대한 지식과 설명은 식단포기자에게 이해하기 쉽고 자세히 설명되어있음이점은 아주 높이 평가합니다 식단포기자였던 나를식단 찬양자로 만들었음레시피 설명 부분은 아쉽습니다 레시피가 간단하다고 설명 부분까지 간단하게 한 느낌?
9788960517271,2,"책이 정말 성의가 없음.그냥 유투브 내용을 책으로 만들었는데, 얇고 사진도 없고 그림에 과정도 없고 그냥 정말 성의가 없음."
9788960517271,10,가끔 보는 유튜브 블로그인데 책도 재미있네요
9788960517271,4,책이 너무 성의 없어서 놀람레시피 과정이라도 사진으로 보여주고 해야 하는 거 아니냐ㅎㅎ 진짜 충격
9788960517271,6,따라해 보고 다시 올께요~
9788960517271,10,너무 재밌게 보고 영상보면서 캡쳐하고 메모하면서 이것저것 만들어먹었는데 책으로 나온다니 대박!하면서 얼른 구입했네요 ^^ 강추합니다! 쉽고 배부르고 운동없이도 뺄수 있다는게 제일 인거같아요!
9788960517271,10,저 맛불리님 덕에 한달만에 6키로 빠짐 이책은 진짜다
9788960517271,10,"책 크기가 작아서 놀라고 레시피가 사진이 아닌거에서 조금 실망했지만 맛불리님 책을 기다렸기에, 또 글을 읽으면서 음성지원이 되는것만 같아요^^"
9788960517271,10,맛불리님이 다이어트하신 과정도 자세히 잘 나와 있고 중요 레시피 정보까지 알 수 있어서 너무 좋아요!
9788960517271,10,"우튜브로 계속 지켜봤었는데 이렇게 책으로 나오다니, 레시피만 따로 보고 싶을 때 딱 적당하네요. 소장각입니다!!"
9791156756606,10,"따라하기엔 넘 시간이 걸리는 책인듯해서 요리를 좀 하는 친구에게 줘버렸다. 그럼에도 저자는 글도 맛있게 잘 써서 읽을만 했고, 주방에 전시하면 뭔가 있어보일듯한 사진과 두께를 가지고 있다."
9791156756606,10,밤에 읽다가 배고파 죽을뻔했어요.ㅎㅎ 마침 이 책을 읽기전 ‘치즈랑 소금이랑‘에서 나왔던 메밀 갈레뜨에 대한 설명이 있어서 더 반가웠답니다. 요리 레시피만 소개된것이 아니라 요리사의 이야기도 함께 있어서 더 좋았습니다.
9788983798190,8,초보자에게 좋을듯한 책입니다
9788983798190,10,진짜 자세하게 나와있어요.평소 빵을 만들며 궁금했던건 이 책 속에 다 적혀있어서 무장정 만드는게 아니라 공부 하면서 베이킹을 할수 있어서 너무 좋아요.
9788983798190,10,일단 하라니 ˝왜˝인지도 모르고 했던 단계들에 대한 의문이 해소되었다.집에서 빵 만들고 싶은 초보는 꼭 구비 해 두면 좋을 책
9788983798190,10,"전문적으로 배운 경험 없이 홈베이킹 하는 사람의 가장 큰 고민은 궁금증이 생겨도 물어볼 사람이 없다는 걸 거예요. 내 반죽이, 빵이 엉망인데 왜 이렇게 됐는지 알 수가 없는 거죠. 이 책은 그 의문에 대한 답을 거의 다 줘요. 정말 도움 많이 됐어요."
9788983798190,10,집에서 빵을 자주 만드는 편인데 궁금증도 생기도 막히는 부분이 생겨 답답했는데 이책 덕분에 모두 해결되었어요.빵을 입문하는 분들에게 필수에요.
9788983798190,10,평이 좋아 구매했어요.책 정말 자세하네요.기본서로 하나씩 갖고 있음 좋을듯~
9788983798190,10,초보가 궁금했던 많은 내요이 있어서 좋아요레세피는 많지않지만 알찬느낌
9788983798190,10,매우 마음에 드는 책. 빵을 만들다보면 생기는 질문들에 대한 답이 차곡차곡 자세히 적혀있다. 진작 있었다면 인터넷을 그렇게까지 헤메지 않았을텐데 싶다. 빵을 처음 만들던 시절로 돌아가 책을 딱 한권 산다면 이 책을 선택할 것이다.
9791191075014,10,"예쁜책입니다. 글도 음식도, 다 좋았읍니다."
9791190242547,10,유투브로 보다가 책이 있음 더 활용잘할것같아 주문!새내기 초보주부라 요리 어렵게만느껴지는데 도움 많이될것같아요!
9791190242547,10,아 정말 만족합니다 오랜만에 좋은 요리책 산거같아요 일단 요리가 간단하고 입맛이 저희집이랑 비슷(청양고추  자주 쓰시는 게)해서 맘에 들었어요 그리고 무엇보다 구성이 좋네요 ㅜㅜ 글자크기라던가  디자인 다 맘에ㅈ듭니다 요리하고싶은 욕구가 불끈하네요
9791190179232,8,팬심에 샀는데 내용은 기대에못미쳐 ㅠ^ㅠ
9791190179232,10,기본적인 한식에서부터 아이들이 좋아할만한 그리고 가정에서 손님들과 즐길만한 요리도 다양하게 가득합니다. 무엇보다 사진이 이쁘고 쉽게 따라할 수 있을만큼 친절한 설명이 마음에 듭니다. 저같은 요알못도 이제 하루에 하나씩 도전해볼 생각입니다. 마트부터 가야겠네요
9791190179232,10,"테크노전사가 단아한 주부가 되어. 이쁜그릇에 맛있는 요리를... 책속의 사진속 그릇들이 눈에들어오는 건 나역시 어쩔수 없는 주부라 그런가 보다.^^우선 구하기쉬운 재료와 쉬운요리법 소개가 마음에 들었다.이책을 간단히 표현하자면간편함과 편리함, 단아함과 정갈함이 돋보이는 맛있는 책이다."
9791190179232,10,요리 잼뱅이인 나에겐 너무 좋은 책~~^^https://www.instagram.com/p/B_7t56DlOzg/?igshid=p2yq7402iaku
9791190179232,2,요리를 기본이라도 하시는 분이라면 한번 더 생각하시고 구매하셨으면 합니다. 내용이 너무 실망스럽습니다.  편스토랑을 보신 생각으로 기대치를 가지진 마셨으면 합니다
9791190179232,10,보기 편하고 쉽게따라할수있어요
9791190179232,10,좋아요
9791190179232,10,좋아요
9791190179232,10,쉽게따라 할 수 있는 요리방법이 수록되어있어서 도움이 많이되네요~방송도 잘보고 있어요! 책도 잘보겠습니다! 감사합니다~
9791190179232,10,편스토랑 보고 왓어요~ 요리를 취미로 시작하려 하는데 정말 도움 많이 되네요~!! 잘보고 요리할게요!!!!
9791190179232,10,다양한 레시피에 쉽게 따라할 수 있어서 좋다 아주 만족하는 요리책!
9791190179232,10,편스토랑 보면서 음식에 관심을 갖게 된 남자입니다. 기본적인 내용에서부터 어려울 수 있는 음식까지 쉽게 접할 수 있어서 너무 좋았습니다.처음 구매한 요리책인데 만족스러워 다행입니다. 추천합니다!
9791190179232,10,"방송 보면서 궁금했던 레시피도 자세히 설명되어 있고, 아직 공개되지 않은 레시피까지, 게다가 사진도 디자인도 예뻐서 소장 가치 있는 요리책이네요. 두고두고 잘 볼게요~"
9791190179232,2,얼마전 티브이에서 의사 남편과 살면서 오랜만에 방송에 나오는걸 봤다. 요리식재료나 조리기구등이 남다른게 이렇게 요리책 나온거 보니 퍼즐조각이 맞춰진다. 그러고보니 황금알을 낳는 거위라 여겨지면 뭔들 못사랴. 비싼 요리기구사서 책내면 벌어들이는 효과가 만만치 않으니 말이다.
9791190179232,10,다른 요리책들에 비해서 잘 구성 된 편 입니다. 다양한 요리들이 비교적 새롭고 쉽게 설명 되어 있습니다.
9791190179232,10,원형도마 받았어요! 생각보다 사이즈가 미니해서 놀랐는데 냄비 받침으로 써도 좋을 것 같아요.
9791190179232,10,"편스토랑 보면서 이정현 씨 레시피 궁금했는데, 만능간장부터 파김치, 달걀장, 명란오일파스타 등 레시피가 101개나 있어서 차근차근 따라해보고 싶은 레시피가 한가득 담겨 있다. 사진도 정말 예쁘고 보기 편해서 두고두고 펼쳐볼 것 같다. 당분간 우리집 식탁은 이정현 씨 요리로 차려야지~~"
9791190179232,2,음... 이게 뭘까요 예약하고 기다리고기다려서 온 책....상당한두께에 기대하며 열어봤더니 멸치볶음 고등어구이 소고기미역국.명란구이.. 내용도 허술하고 실망이 이만저만이 아닙니다 뭘 기대한거지? 이정현님 편스토랑에서의 화려한 레시피들 스킬들 다 어디갔나요
9791196772017,10,정미경 선생님께서도 샐러드를 정말 좋아하셔서 맘먹고 따로 샐러드 레시피를 냈다고 하시네요. 실속있는 레시피랑 또 요즘 추세에 맞는 이국적인 레시피 모두 맘에듭니다. 집에서 새로운 샐러드를 도전하는 데 큰 도움이됐어요!손님초대때도 써먹으려고요!푸짐하고 예뻐서 좋아요!
9791196772017,10,오랜만에 나온 정미경 선생님의 신작! 역시 기대 만발. 맛은 안 먹어봐도 정미경 쌤이니 걱정 없을 거 같네요.
9791196772017,10,"정미경선생님의 새로운 시리즈네요! 항상 잘 보고 있습니다ㅜㅠ 반찬, 국, 찌개 등 많은 도움을 받았는데요. 정미경 선생님 레시피로 맛있게 즐기기 어렵던 샐러드를 더 맛있게 먹을 수 있을 것 같아요~!"
9791196772017,4,책을 급하게 만들었는지 편집이 엉망이예요.50쪽 정도 읽었는데 벌써 두 군데가 잘못됐어요.완성사진에 들어가야 하는 글귀가 바뀌어 있는 실수 하나는 그런가보다 했는데완성사진이 서로 뒤바뀌어 있는 두 번째 실수를 발견하고 리뷰 남기러 왔어요.서문을 읽고 기대 많이 했는데... 아쉽습니다.
9788931587036,10,봄소식과 함께 왔군요. 색깔이 너무 맘에 들어요~
9788931587036,8,수미네 반찬 1권을  어머니와 이모에게 선물드렸는데 엄청조아 하셨어요~ 두분이 찜질방에서 만나시면 레시피이야기로 시끌해요~일요일 아침은 어머니의 새로운 음식을 만들어 동생네 까지 모여 수미네반찬 책덕에 입이 호강입니다.2권 나온줄 아시면 또사 달라고 하시겠네요. ㅠㅠ^^
9788931587036,2,아쉬운 내용 ㅠㅠ
9788971905678,10,소스 만들기부터 보관방법까지 모든 게 담겨있네요!1
9788926396858,10,메뉴가 다양해서 좋아요
9788926396858,10,따라하기쉬워요
9788926396858,10,"1권과 다르게 볶음요리 중심으로 나와 있네요. 역시 사진과 함께 설명이 나와 있어 알기 쉽고, 따라 만든 요리도 맛있네요~"
9788926396858,10,역시 백종원~~맛난 밥상 차려서 식구들과 알콩달콩 먹을게요
9788926396858,10,실생활 더욱이 먹거리에 대한 다양한 메뉴를 잘 소개해 줘서 아주 유용하게 활용하고 있습니다.정말 도움이 되는 책이며 2권도 빨리 구입해야겠다는 생각입니다.정말 모두에게 추천하고 싶은 좋은 책입니다~~~
9788926396858,10,입소문난 책이라서 구매해보았어요.저같은 요리초보엔 딱이라고..^^
9788926396858,8,방송내용이 더 자세하게 나오길 기대했는데 생각보다는 무난한 레시피북이었어요. 만능간장 파트가 확실히 많은데 이게 이렇게까지 많을 필요가 있을까 싶어요. 다음에 나오는 책은 좀 더 다양하게 나오겠죠?
9788926396858,8,저같은 초보에게는 괜찮은 도서인듯해요^.^ 만능간장 레시피보다 더 다양한 내용이었으면 더 좋았겠지만 전 완전 요리초보이기에 만족합니다ㅎㅎ
9788926396858,8,집밥 백선생 정리. 방송 보지 않고 바로 써먹기는 어렵지만 보고 그때그때 찾아보기는 편하다.
9788926396858,4,책에 영양가 거의 없습니다.백종원 사진이 반이에요.
9788926396858,10,사무실 직원에게 선물 했더니 엄청 좋아하네요. 제가 선물하면서 책에 나온 음식 중 한가지를 만들어서 사진으로 보내달라는 미션을 부탁했는데 정말로 만들어서 보내 주었네요.^^ 감사드립니다. 그래서 저도 저를 위해 책을 한권더 구입하렵니다.
9788926396858,10,실용적인 내용으로 나온다면 도움이 많이 될 것 같아요. 특히 저같은 초보자들에게는..!
9788926396858,2,사은품때문...완전 실망....계량컵증정.... 한다고 쓰여있었으면서 밑에 둘중 하나는 뭐에요..=.=참나원...알라딘계량컵증정 [!] 느낌표까지 붙여놓고 현혹시키기는...좀 당한느낌.알라딘 완전 실망.!!!!!!
9788926396858,8,방송으로 나왔던 레시피가 있는 책. 재미를 위한 방송과는 다르게 정리가 잘 된것만으로도 값어치는 충분하다. 이벤트만 빨리 했어도 완벽했을 책.
9788926396858,10,집밥 백선생 레시피중 아주 초반 레시피만 들어있어요 그래서 만능간장 내용이 대부분...친정엄마가 사달래서 사드렸더니 첨엔 엄청 좋아하시더니 요리가 너무 초보스럽다고 하시네요 당연한 말씀을;;;
9788926396858,10,사고났더니 계량컵이벤트 ㅠㅠ집밥에서 나왔던 레시피가 중복되지만검색하지 않고 언제든 들춰볼 수 있어 편할 거 같네요
9788926396858,10,..그다지 추천하고 싶지 않습니다. 그냥 요리마다 검색해서 만드는게 나을듯합니다..(전적으로 제생각 -요리초보-)
9788926396858,6,만능간장의 비중을 낮추었다면 더 좋았을 것 같은데... 무튼 유익한 건 인정!
9788926396858,8,만능간장을 이용한 여러가지 요리를 간단하게 만들수 있게 되어 있어 요리를 처음하는 사람들에게 아주 좋은 요리책입니다. 요리를 좀 할줄 아는 사람들도 쉽고 빠르게 요리를 할수 있어서 좋네요.. 볶음소스. 찌개소스 등...  좀더 다양한 요리를 할수 있는 책도 빨리 나왔으면 좋겠어요
9788926396858,10,52권 있는데 요게 더 효율적인듯 합니다~ 기대하고 구매합니다.
9788926396858,8,아이들에게 인그턴트 사주기보다 직접해주기를 원해 구입했다. 요리를 같이 만들며 재밌었다. 하지만 애들은 다른 반찬을 먹었다. 아이들이 먹기에는 양념도 강하고 채소가 많다...ㅋㅋ 그래도 추천한다. 음식만들기에 용기를 얻었기에...
9788926396858,8,1권에 이어 2권도 구매~~
9788926396858,10,집에서 해 먹는 요리 위조인것 같습니다. 1권 보다 더 실용적인듯 합니다.
9788926396858,10,기대됩니다^^
9788926396858,8,백종원씨는 요리에 대한 편견과 선입관을 허문다. 요리는 어렵고 시간 걸리고많은 기술을 요하는게 아니라고 말한다. 일상의 흔하고 저렴한 식재료로 든든하고 맛있는 한끼밥을 만드는 방법을 알려준다. 매일의 식탁에 약간의주의와 노력을 기울이면 우리의 삶이 보다 풍성해진다.
9788926396858,10,벌써부터 기대가 됩니다.
9788926396858,10,식사 준비를 하는데 있어서의 많은 도움이 돼면서 가족모두 즐겁게 식사를 할 것 같아서 너무 괜찮을 것 같네요~~
9788926396858,8,실용적인 내용으로 나온다면 도움이 많이 될 것 같아요. 특히 저같은 초보자들에게는..!
9788926396858,10,너무기대되용ㅠㅜ!
9788926396858,10,밖에 나가서 먹는것보다 집에서 만들어 먹는게 엄청 기대가 되네요.. 그유명한 백쉐프..믿고 가니 맛도 따로 오겠죠..ㅎㅎ
9788926396858,10,백종원님의 책 1편을 구매했기 때문에 2편이 나왔다는 순간 무의식적으로 그냥 구매해야 겠다는 생각이 들더군요.. 정말 요리 초보자들에겐 좋은 책이라 이번에도 기대됩니다.
9788926396858,10,백종원님이 나오는 프로그램 즐겨보는 주부입니다.보면서 누구에게나 조리법이 쉬워서 책도 구매해보고 싶네요
9788926396858,10,백종원씨 프로그램 나오는 거 종종 보는데요. 누구나 따라 할 수 있을만큼 쉽고 재미있게 설명해 주시네요. 이 책 소장할 만한 가치가 있는 것 같아요.^^
9791155641118,6,책표지보고 가오나시인줄 알았어요 ㅎㅎ
9788991075979,6,"뒤늦게읽었다 이제두가지를기억한다 개인에게맞는활용을위해느슨한레시피를선택했다는것, 그리고 마지막장에빛깔고운파파야를보며내가먹는것의형체와빛깔과성질이곧나를이룬다는에대한재각성이다 나는 내자유의지와현재를또본다 부담없이읽히는책이니휴가나여유있을때한번보기를권한다"
9788991075979,8,예쁜 외모도 외모지만 자연스러운 흰머리와 얼굴에 온화한 표정이 그렇게 멋스러워 보일 수가 없었다. 진정한 삶이 어떤것인지 항상 고민하는 우리들이 참고하면 참 좋을 책이다.
9791164261062,10,꼭 전문가가 아니라도 홈베이킹 하는 사람들이 견문을 넓히기 좋은 책.여행하는 듯한 느낌이 들 뿐만 아니라 웬만한 베이커리에서는 찾기 힘든 여러가지의 과자들이 들어 있기 때문에 이 시기에 더더욱 필요한 책이에요이 책을 읽고 나면 프렌치 레스토랑에서 디저트를 알고 고를 수 있게 될 거예요
9791164261062,10,현대 제과의 뿌리를 찾아 프랑스 전역을 돌아보는 여행이 참 즐거운 책이에요 ^_^
9791164261062,10,프랑스제과 공부에 진짜 도움많이 될거 같아요. 처음보는 디저트도 많고 생소한 것도 많은데 그만큼 공부되는거 같아요. 좋은책 너무 감사드려요~
9791164261062,10,"몰랐던 생소한 과자들도 많아서 좋고, 보기 편하게 되있어서 좋은 책인 것 같습니다. 같이 넣어주신 포스터도 너무 귀여워요!!"
9791196616052,10,쉽게 따라하기 쉬운 요리법이어서 좋았어요. 특히 책에 담긴 요리의 감성적인 느낌이 좋았어요. 뉴욕 코리아타운에 her name is han 디렉팅을 맡았다는 문장을 읽고 믿고 읽었습니다.  그때 식당 음식이 정말 맛있어서 자주갔어요!
9791196616052,10,채소과일먹기에 관한강의를 도서관줌강의로듣고 요즘 매일 채소과일먹기에 힘쓰고있어요. 사진이너무예쁘고 어렵지 않아 해먹어 보고싶은 음식이 너무많은책입니다.  채식주의가 아닌 채소 친화적 애티튜드 라는 말이 너무 인상적입니다. 매일 채소를 가까이하는 일상을 만들어가고싶어요
9791196616052,10,"받자마자 몇개 해봤어요. 나와있는 대로 해도 좋고 , 냉장고에 남은 채소로 변형해서 해봤는데 맛잇네요!"
9788969930330,8,"요리 잡지 같은 책이에요. 술 종류, 신기한 안주요리가 많아요"
9788969930330,10,술을 안주와 함께 먹어보고자 구입. 술과 어울리는 안주를 짧은 시간에 만들어 볼 수 있게 잘 나와 있네요따라해 보고 싶은 요리들과 다양한 술 소개도 좋아요
9788969930330,10,"외출을 자제해야하는 이번 주말, 냉동실에 보관 중인 족발을 꺼내 ‘이태리 족발‘을 만들어 우리집 가장 예쁜 그릇에 담아 시원한 맥주 한 잔하며 세상 근심과 시름, 분노를 잊어야겠어요. 셰프님들의 맛난 안주 다 해먹다보면 코로나도 사라지겠지요?"
9791197030116,10,제빵은 반죽부터 좌절이라 항상 어려워서 제빵기를 기웃거리다 발견한책입니다. 집에서 하는 손반죽이라니!! 홈베이킹제대로알기부터 읽고 있습니다. 제가만든 빵을 얼른 아이에게 주고싶어요
9791197030116,8,제빵을 시도해보싶은 1인입니다 책 정말 맘에 드네요 초보에게 완전추천입니다 재료도 비교적 간단하고 만드는 방법두 간단합니다 주로 식빵같은 담백한 빵 위주지만 가독성 좋게 되어있어 더 좋네요
9791197030116,10,빵알못이지만 마미오븐님 레시피는 초보자도 쉽게 만들수있는 레시피를 알려주셔서 이책으로 맛난 집빵만들기에 도전해보고자합니다 ~자신만의 손반죽노하우도 알려주시고 감사해요 대박나세요^^
9791197030116,10,유튜브에서 베이킹레시피 얻을겸 눈팅하며 알고 있다가 인스타이벤트덕분에친숙해진 마미오븐님 ^^손반죽 쉽지않은데..쉽개 알려주시고 놓칠수있는 팁도 잘 알려주셔서 좋았어요 책출간소식에 예약해두고 받는날만 손꼽아 기다렸네요*요책보며 베이킹할 생각에 행복합니다😃
9791197030116,10,카스테라는 항상 마미오븐님꺼 레시피로 만들어요 유튜브보면서 베이킹하던게 엊그제인데!!책출간소식듣고 바로 예약구매로 했지용 ㅋㅋ 초보자분들위주로 책을 만들으셔서 보기좋아요 특히 덧가루뿌리는방법이라든가? 등등 초보자분들이 놓칠만한부분들을 콕콕찝어주셨어용!전 강추입니다!!!
9791197030116,10,유투브에서 많은 도움 받고 있는 마미오븐님 책이 출판됐다는 소식을 듣고 바로 예약 구매했어요 :) 믿고 만드는 마미오븐님 레시피답게 알차고 꼼꼼하네요- 초보분들도 충분히 따라할 수 있게 잘 설명해주긴 것 같어요. 요즘 유행하는 품목들도 있고 아주 좋네요 ^^
9791197030116,10,인스타에 책 떴다는 소식 듣고 바로 구입했습니다~~>♡<  마미오븐님 손반죽 따라해서 처음으로 빵 성공했는데 기대되네요~~~♡
9791195655571,10,유튜브에서 우연히 마늘 장아찌 레시피 검색중 보게된 당근시러님 채널~!  한번만 따라해보면 맛보장 레시피란걸 금세 알아차리게된다 그 많은 반찬들을 찬찬히 같이 해보고 싶다는 일념으로 사게된 나의 최애 레시피책♡
9791195655571,8,"익숙한 반찬, 따라 만들어 보고 싶은 반찬이 많다. 이 책 덕에 식탁이 조금은 윤택해질 수 있을 것 같다."
9791195655571,10,매일 무슨 반찬 해야하나 고민했는데다양하고 간편한 반찬요리들이 많아서 너무 좋아요.자세한 요리과정사진부터 설명도 꼼꼼해서초보주부인 나도 충분히 쉽게 따라할수 있어 대만족입니다.당근정말시러님 책 레시피대로만 그대로 똑같이 따라 하기만하면되니 좋은데 심지어 맛있다고 가족들한테 엄지척 칭찬받는 책이에요
9791195655571,10,블로그 포스팅도 캡처해서 보관중이지만 역시 책으로 보니 더편리해서 자주 활용하게 되는 것 같아요. 레시피 양도 적당하고 과정이 쉬워서 매일 매일 따라하는 즐거움이 커요.
9791195655571,10,"60대 중반인 저희 어머니가 당근정말시러님의 오랜 팬이십니다^^ 작가님의 블로그를 매일 들어가 보시고, 책 출간을 하실때마다 선예약으로 구매 해달라고 부탁하세요. 이번 책에서 배우신 무생채도 가족들 입맛에 딱이에요. 140자 내로 어머니의 팬심을 담기가 어렵네요. 오래오래 요리해주세요!!"
9791195655571,10,"블로그 레시피 뜰때마다 캡쳐를 해서 만들어보다 맛보장가정식레시피3를 구입했는데 너무 만족스러워서 이번 책도 나오기만을 손꼽아 기다렸어요. 역시나 재료구입부터 준비, 조리과정, 팁 등 너무나 자세하게 설명해주셔서 초보 주부에게 도움이 너무 많이 되네요 제 입맛에도 딱이에요 강추합니다"
9791195655571,10,쿠킹클래스 듣는것처럼 정말 자세히 알려주시고 내용도 알차요. 사진만 번지르르한 요리책과는 차원이 다릅니다. 저자의 내공도 느껴지고 무엇보다 실생활에서 바로바로 응용할수있는 요리여서 좋아요. 장아찌레시피까지 같이 받길 잘했어요. 당근정말시러님 정말 감사합니다!!이런책많이써주세요.
9791195655571,10,"당근시러님 인스타도 블로그에도 알림되어 있어 레시피 올려주실 때마다 다 캡쳐 해놓고 파일로도 보관중이지만 소장하고싶어 이번에도 구입했어요 배송도 꼼꼼하게 장아찌 책도 잘 도착했어요.이번편은 늘 먹는 나물, 조림류지만 당근님 레시피로 일률적인 맛이 나고 한결같이 유지할수 있어 좋아요."
9791195655571,10,"블로그 통해서 보고 있다고 알고 있다고 해도 책으로 나온 요리책을 따라갈수가 없네요. 일목요연하게 정리도 잘 되어있고, 사진컷도 다 좋아서 그대로 따라하면 될것같은 기분이 드는 요리책. 책 예약해서 구매한 저 자신을 칭찬해요~^^ 요리하고싶어지는 요리책~ 꼭 구매하세요"
9791195655571,10,요리를 많이 하고 남편 입맛이 까다로운 편이예요.요리를 아주 잘하지는 않는터라 레시피가 았어야 하는데당근정말시러님의 레시피는 정말 디테일 하게 짚어주고 간이 똑 떨어져서 실패가 없어요. 그날 밥상이 특히 맛있는 날이면 남편이 꼭 당근정말시러님의 레시피냐고 물어봐요.^^ 바로 쟁여요~
9791187504085,10,주로 일반식 기준이다. 보면 나도 이정도는 따라할 수 있겠는데?하는 생각이 든다. 난 실제로 이 책에 나와 있는걸 참고해 그냥먹기엔 물리는 닭가슴살을 이용해 요리를 해 맛있는 음식을 먹을 수 있었다!
9791187504085,8,이 앞에 나온 책을 신주단지처럼 모시며 저만의 레시피로 만들어 애용하는 메뉴들이 많이 있습니다. 개정판 나온 것도 너무 좋으네요. 같이 도시락 싸는 동료에게도 추천했어요. 저염식 식단으로 꾸릴 수 있어서 생활 습관에도 많은 도움 되었습니다.
