ISBN13,rating,review
9791189199517,10,정보를 얻기 힘든 료칸에 대해아주 핵심적으로 파고든 책입니다.정말 도움이 되네요
9791189199517,10,아직 가보지 못한 료칸 여행! 이 책보고 좋은 곳으로 꼭 다녀왔으면 합니다.
9791189199517,10,료칸 가격대가 비싸고 어떨지몰라 한번도 묵어본적이 없는데 책에 나오는 경치좋은 곳에 위치한 료칸에서 가족들과 즐거운 시간 보내고 싶어요
9791189199517,10,사진만 봐도 근사한 료칸의 모습이 느껴지네요. 일본의 료칸에 대해 알고싶다면 꼭 읽어봐야할 책 같아요!
9791189199517,10,자신이 원하는 료칸을 지역에따라 손쉽게 알수있도록 정리된 책 같습니다.
9791189199517,10,료칸에 대한 정보가 있는 책이라니 너무 좋네요 예전에 큰맘 먹고 료칸에서 숙박했던 좋은 추억이 떠오르네요^^
9791189199517,10,겨울에는 역시 온천이죠! 일본의 료칸이 총 집합되있는 이 책 한권이면 온천여행은 문제없을 것 같습니다!
9791189199517,10,일본 몇 번 가봤는데 료칸 숙박은 한번도 경험하지 못했네요.. 온천을 좋아하는데 료칸으로의 온천여행 함 가보고 싶어요.. 책의 도움을 받아 딸과 그리고 엄마와 3대 모녀의 료칸여행 추진해봐야겠어요~~
9791189199517,10,지금까지 도시여행과 맛집 여행을 했다면 이 또한 너무나 매력적으로 다가오는 책이내요 료칸이라는 전통적인 여행은 또다른 일본애 모숩을 볼수있는 나를 설레게 하는 그런 두근거림으로 다가옵니다. 아직 한번도 온천여행을 안해봤지만 이책을 보면서 준비하는 시간을 가져봐야겠어요 ~~~
9791189199517,10,"큰맘먹고 준비해서 가는 료칸, 이왕이면 전문가가 선정한 특색있는 곳으로 가보는 건 어떨까. 다녀와서도 다음 료칸을 찾아보게 만드는 책."
9791189199517,10,일본여행하면 꼭 머물고 싶은 숙소가 료칸이죠^^ 책 읽는 것만으로도 여행이 너무 하고 싶어지는 책일 것 같아요
9791189199517,10,"점점 쌀쌀해지는 날씨에, 일본의 온천 료칸으로 여행을 떠나보고 싶었는데 많은 도움이 될 것 같습니다."
9791189199517,10,료칸에 대한 정보가 멋진 사진과 함께 자세하게 설명되어있어서 좋은 것 같네요 부모님과 일본을 여행한다면 료칸을 다녀오고 싶었는데 제게 필요한 책이네요^^
9791189199517,10,휴양을 위한 일본여행하면 바로 떠오르는것이 료칸이지요. 이런 책이 나오길 기다렸습니다.
9791189199517,10,언젠가 부모님을 모시고 꼭 한 번 가보고 싶습니다. 아직 료칸을 이용해 본 적이 없어서 이 책을 통해 많은 도움을 얻을 수 있을 것 같습니다!
9791189199517,10,"항상 게스트하우스, 에어비앤비만 이용했던 일본 여행인데, 이제 돈도 벌고 하니 한번쯤 친구와 오로지 쉬기위한 목적으로 료칸 여행 가보고 싶어지네요ㅠㅠ!"
9791189199517,10,솔직히 비싸서 이용하기가 참 고민되는데 꼭 한번 경험해보고 싶네요^^ 사진만 봐도 설렙니다!!!
9791189199517,10,일본 여행 중 하루 정도는 료칸을 생각하고 있는데 일본 내 료칸 정보가 알고 싶어요....
9791189199517,10,아직 료칸을 경험하지 못했지만 이 책과 함께라면 멋진 료칸 여행을 보낼 수 있을거 같아요!
9791189199517,10,료칸에서의 숙박이란 최고의 일본여행의 정점이 아닐까 싶네요.일반호텔만큼 정보를 찾기 힘든데 좋은 책이 나와서료칸 선택에 어려움이 없겠어요.내년 1월 홋카이도 여행 료칸 선택에 참고하면 좋겠네요.
9791189199517,10,"일본여행에서 빠질 수 없는 료칸, 여행중에 참고하기 좋은 책이 될 것 같습니다."
9791189199517,10,"부모님을 모시고 료칸여행을 하고 싶었는데, 어떻게 해야하나 고민을 하고있었습니다. 헌데 이렇게 좋은 책이 발매되었을 줄은 몰랐네요:) 정말 기대됩니다!"
9791189199517,10,일본 료칸에서의 호젓한 하루누구나가 꿈꾸는 여행중 하나 아닐까요?그에 데한 욕망을 만족시켜주는 책일거 같아서 기대가 큽니다.
9791189199517,10,매번 같은 도심속에 있는 호텔과 게스트 하우스가 아닌 일본이라는 색과 향이 가득 배인 료칸에 대한 정보를 지역별로 찾을 수 있어 매우 좋은 가이드 북인 것 같습니다!
9791189199517,10,고즈넉하니 온천을 즐기는 여행을 끔꾸고 있는 저에게 딱 맞춤책이 될거 같아요.
9791189199517,10,4년 전 유후인 지역 료칸을 처음 다녀온 이후 료칸에 빠져서 매년 일본 료칸여행을 가고 있습니다. 이 책이야말로 딱 제가 찾던 료칸 안내서 같아요. 일본인 및 외국인 공동저자라서 현지인 저자가 추천하는 료칸들! 그리고 외국인의 시각에서 매력적인 료칸들!을 같이 볼 수 있을 것 같아요.
9791189199517,10,"부모님과 함께하는 온천여행을 준비중입니다, 일본료칸의 정보를 잘 정리한 책이라서 꼭 읽고 싶네요."
9791189199517,10,"일본 여행의 주된 목적이 료칸이 되어버렸는데, 가격이 만만치 않다보니 매번 선택시 엄청난 고민과 갈등과 혼돈에 빠져버려요. 혼돈 속에서 방향을 잡아줄 기준이 될 수 있는 책일 것 같아서 꼭 읽어보고 싶어요!"
9791189199517,10,근사한 료칸 정보만 따로 묶어 놓아서 보는 것만으로도 행복해질 수 있을 거 같아요^^
9791189199517,10,일본에서는 료칸이죠. 좋은정보들이 많이 있을것같아요. 기대되요!
9791189199517,10,"일본하면 료칸,료칸여행에 꼭 필요한 좋은정보 인듯합니다"
9791185831619,6,늘 인스타 등에서 사진으로만 만나다가 글로 만나니 새로운 느낌이...
9791187496724,10,"교토의 현지인들이 즐겨가는곳, 번화가가아닌 골목 구석구석의 매력을 볼수있다.구역 별로 상세하게 카페,식당의 유의사항까지 아주 잘 소개되어있어마치 나만알고싶은 보물지도같고 나만알고싶은 그런책이다.다른 일반적인 여행가이드 책과는 다르니, 담백한 책을 원하면 꼭 한번 읽어보길 권한다"
9791187496724,6,사실 정보를 필요로 하는 사람에게는 그다지 도움이 안 되긴 한다. 교토에 자주 가본 사람 입장에서 안 가본 장소를 찾고 싶다면 들춰볼만한 책. 좀 더 교토의 주요 관광지 근처였으면 좋았을 것 같기도... 사진이나 책의 생김은 예쁘다.
9791187496724,6,교토란 공간의 ‘일상’에 관심 가진 저자의 선택에 공감하여 구입하였다. 다만 일상의 좋은 모습만 보려고 한(혹은 반대편 일상을 모습을 외면한듯한) 느낌을 받았다. 달에도 앞뒤가 있고 우리가 사는 세상에 낮밤이 있는 것처럼 일상도 그런 모습을 가지고 있을텐데... 이런 아쉬움이 많이 남는 책
9791186972342,10,이 책을 보는 순간 바로 도쿄 이자카야로 가고 싶다. 이 책 한권을 들고 도쿄여행을 해도 괜찮을 만큼 친절한 책이다. 메뉴판에 일본어까지 상세하게 넣어줘서 어려움없이 먹고 싶은 메뉴를 시킬 수 있다. 사케를 좋아하지 않았지만 이 책을 보면 자꾸 사케가 마시고 싶어진다.
9791196152468,8,"고즈넉하다. 딱 그 말이 떠오른다.  과거와 잠깐의 예전, 지금, 어제와 오늘의 회상이 와리가리를 하면서 저자가 살고 느낀 일본과 도쿄의 이야기가 가와바타 야스나리의 설국을 시작으로 이런 저런 책과 문인들, 그리고 지식인들과 함께 그려진다."
9791195838882,10,일본 여행 계획하면서 잘 읽고 있습니다.
9788967940942,10,"짧은 여행으로는 도쿄의 갤러리나 박물관을 구경할 여유가 없어서 항상 아쉬웠는데, 이번 겨울에 워홀을 가게 되어서 예술적인 공간을 방문할 수 있는 기회가 생겼어요. 이 책을 보니 지역별로 세세하게 소개가 되어있어서 쉽게 찾아갈 수 있을거 같아요. 버킷리스트 해제할 수 있는 기회! 기대됩니다."
9788967940942,10,"갤러리나 뮤지엄에 가보고싶다 생각하지만, 막상 여행일정을 계획하다보면 정보가 부족해 놓치게 되더군요. 항상 아쉬운 마음이 있었기에 [도쿄의 작은 공간]이라는 책을 발견한 것이 굉장히 기쁩니다~ 여유롭고 차분하지만 저에게는 가장 특별한 가이드 북이 될것 같습니다^^"
9788967940942,10,박문관이 상세하게 나온책은 여행책자중에 처음본것 같아요 기대됩니다
9788967940942,10,도쿄의 작은 공간에 나와 있는 곳들을 찾아다니다 보면 진정한 힐링이 되지 않을까 하는 생각이 드네요. 미술관이나 박물관 등의 문화적 공간만을 모아둔 이 책으로 인해 도쿄로의 여행이 마음의 풍요로움으로 이어질것 같네요. 무척 기대됩니다!!!
9788967940942,10,도쿄는 캐도캐도 나오는 금광이랄까요.양파같다고 할까요.이정도면 도쿄는 다 아는데 싶었다가 이 책을 통해수박 겉핦기였다는것에 놀라고 가네요.뻔한 관광지가 아닌 레알도쿄를 만나고 싶다면 강추합니다
9788967940942,10,원래부터 박물관에 관심이 많았는데 책 내용이 참 알차 보여서 도쿄 갔을 때 엄청 유용할 것 같아요~
9788967940942,10,"작은 공간에 대한 동경은, 남들과는 다름, 색다름, 낯섬에 대한 것에서 시작되지요.남다른 기호에 대한 책일 것입니다."
9788967940942,10,싼마이같은 내 여행을 고급지게 해줄 것 같은 그런 느낌적인 느낌을 주는 책인 것 같아요. 나도 럭셔리한 여행을 하고픈데 뭘해도 티가 안 날것 같네요. 근데 이 책은 나에게 뭔가 사소한 변화를 줄 것 같아요~^^
9788967940942,10,그 동안 안 가본 곳이 많네요~~ 이 책 들고 도쿄 놀러가고 싶어요 :)
9788967940942,10,일본여행은 보통 먹는거 관광지만 생각할 법 한데 이책은 또다른 문화공간을 알 수 있게 해주네요. 도서관 미술관등 문화예술 좋아하는 친구들과 함께 간다면 참 좋을 것 같아요
9788967940942,10,"사람들이 많이 찾는 관광지가 아닌, 취향에 맞는 장소를 찾을 수 있는 안성맞춤 책이네요. 도쿄에 갈 때마다 열심히 검색해서 한 두군데씩 찾아갔었는데, 귀한 정보가 이렇게 깔끔하게 정리되어 있다니 너무 좋은데요!"
9788967940942,10,도쿄가면 항상 가던 미술관만 가는데 다양한 미술관이 나오는 이책이 많은 도움이 되겠네요.
9788967940942,10,요즘 일본여행에 빠져있고 곧 도쿄 여행중입니다. 이 책을 읽고 여행가면 조금 더 의미있고 재밌는 여행을 할 수 있을 것 같아요! 정말 기대 만빵입니다. ^^
9788967940942,10,"도쿄여행은 먹부림이나 쇼핑하러 다녀온 정도였는데,  이 책이 있으면 좀더 깊게 도쿄의 문화를 맛볼 수 있을것같아 기대가 되네요.  관광객들에게 잘알려지지않은 포인트들로 여행을 더 알차게 가고 싶었는데 좋은 책이 나왔네요."
9788967940942,10,일본에 사는 동안 나름대로 문화생활을 많이 즐겼다 생각했는데 이렇게 멋진 곳이 숨어있을 줄은 몰랐어요! 도쿄는 저에게 정말 애착이 가는 도시인데 책에 나온 곳 따라다니면서 또 다녀오고 싶어지네요.
9788967940942,10,"도쿄를 좋아해서 매년가고 수없이 가봤지만, 작가님이 추천하신 곳은 딱 한 군데 밖에 안가봤다니 정말 놀랍네요. 거의 다 가봤다싶어서 올해는 도쿄가 아닌 후쿠오카에 갔다왔는데 다시 도쿄에 가고 싶어지는 책이에요~ 조용히 여유를 즐기는 여행을 하고 싶을 때 딱일 것 같아요. 정독해보고 싶네요!"
9788967940942,8,"갈때마다 관광지, 맛집, 쇼핑 찾아다니다가이런 곳을 찾아다니는것도 색다른 여행일것 같아요"
9788967940942,10,도쿄에 다녀온지 얼마되지 않아 다시 도쿄행 비행기표를 찾는 저에게는 너무나 반가운 책이네요~
9788967940942,10,"디자이너로 일하고 있는 저로썬, 도쿄는 정말 매력적인 도시입니다. 영감을 주는 숍이나 갤러리가 많더군요! 다음 도쿄는 그런곳들을 둘러보는 여행을 하고싶었는데 이 책을 참고하면 많은 도움이 될것같네요! 꼭 읽어보고싶은 책입니다 :)"
9788967940942,10,뻔한 곳이 아닌 숨겨진 도쿄의 구석구석을 소개하는 이런 책 기다렸어요!
9788967940942,10,모두 똑같은 관광지 안내 책자보다 훨씬 가보고싶고 기대되는 책이네요 _  도쿄의 작은 가게들 작은 공간들에 대해 흥미가 마구마구 생기네요~
9788967940942,10,이런 주제와 특색이 있는 여행책 너무 좋아요. 미술관 순례 좋아하는 너무 기대되요~!!
9788967940942,10,"도쿄에 있는 미술관, 갤러리에 관심이 아주 많아서 관련책들을 산 적도 있는데, 이 책은 정말 반갑네요. 제가 알지 못했던 곳들이 얼마나 많을지.. 정말 기대됩니다."
9788967940942,10,사람이 북적거리는 도쿄 관광지도 좋지만 이렇게 뮤지엄만 소개되는 책도 있었으면!! 했었어요.. 넘 기대되요!!!
9788967940942,10,미술관 갔다가 뮤지엄샵에서 기념품 사고 미술관 내 카페에서 커피 한잔 하는걸 너무 좋아해서 이 책 너무 기대됩니다!
9788967940942,10,나만의 도쿄 나만의 공간을 찾는 사람이라면 이책이 꼭 필요할꺼예요.
9788967940942,10,누구나 다 가는 곳이 아닌 나만 알고 싶은 핫 플레이스가 한권에 다 요약되어 있어요!
9788967940942,10,도쿄의 작지만 알찬공간을 한권으로 엿볼 수 있습니다.
9791185152677,8,오토바이를 타면 여행의 폭이 넗어지진다는 부러움과 일본 서점이 그래도 살아남은 이유는 커뮤니티의 역할과 연대를 한다는 것. 한국은 빠르게 온라인으로 넘어온게 독인 분야가 서점이다.
9791185152677,8,경남 진주 헌책방 주인인 글쓴이가 오토바이로 일본 헌책방 탐방한 얘기. 얼마 전 나온 양미석 도쿄 책방 얘기랑 겹치는 대목이 좀 있다. 최종규 작가 얘기도 반가웠다. 나귀님이 언젠가 말씀하셨던 신한미디어 이끌던 박노인 선생 얘기도 그랬고. 책동네는 생각보다 좁다는 걸 읽으며 실감했다.
9791185152677,8,"유유의 책. 부러운 점 세 가지. 오토바이를 탄다는 것, 책방을 한다는 것, 그리고 오토바이로 일본의 헌책방투어를 했다는 것.  한국보다 좀더 낫다는 거지 일본도 책방이 살아남기가 팍팍한 듯..."
9791155360583,10,"초등자녀를 둔 엄마기에 아이와 함께 즐기는 게스트하우스, 마을과 친해지는 게스트하우스, 개성 만점 게스트하우스 리스트가 제일 반가웠어요. 가족과 함께 일상에서 비일상으로 훌쩍 여행을 떠나 일본의 게스트하우스에 묵는 즐거움을 누리고 싶어요."
9791155360583,10,"아주 얇은 책이지만,  일본 내에 있는  다양한 게스트하우스  정보를 얻을 수 있게  되어 좋았습니다^^"
9791155360583,8,"가하하 퐁기는 유명하죠,,, 게라게라는 없네"
9791159824715,4,"일본 워홀 준비에 도움이 될까 싶어서 구매하였는데, 생각보다 ‘이런게 있구나‘ 싶은 내용은 없었습니다. 다만 처음 워홀을 생각하시는 분들이 구매하면 큰 도움이 될것 같습니다."
9791159824715,10,3분기 워홀 준비하는 친구 선물하려고 한권 더 구매했어요.!
9788925560069,4,소설보다 재미없어요
9788925560069,8,"좋아 이런 자기중심적인 작가같으니. 나오는 장소를 찾아보고, 몇 곳은 저장했다."
9788925560069,8,"여행, 언제나 날 설레게 만드는 단어.배를 타고 일본 항구 마을 이곳저곳을 여행하면서 쓴 에세이.부산과 시모노세키 여객선 이야기에선 가본적 있는 내게 뜻밖의 추억을 떠올리게 해줘서  더없이 반가웠다.  또다시 떠나고 싶다. 어디든~~"
9788925560069,10,오쿠다 히데오 수필 특유의 유쾌한 템포가 있다.
9788925560069,10,"떠나고 싶을 때, 그냥 가벼운 글줄로 내 마음까지 상쾌해질 거 같을 때,오쿠다 히데오 글쓰기를 안다면, 더없이 즐겁게 읽을 수 있는 꺼리가 그득하다."
9788925560069,4,"기행문.뭘타고 어디가서 뭘먹고 아땟고,어딜가서 뭘보고 뭘먹고 어땟다.나는 기행문은 체질적으로 안맞나봐."
9788994909912,8,"이 책 한권만들고 일본 여행을 하고 싶게 만드는 매력이 있다. 일본 여행은 도쿄, 오사카, 나가사키 등 대도시만 가봤는데 책 속에 나온 작은 도시 맛탐방을 떠나고 싶게 만든다. 허영만 선생의 그림도 좋지만 그 옆에 실사 사진도 같이 실어줬으면 하는 아쉬움도 있다."
9788994909912,8,"허영만선생의 삽화와 맛있어 보이는 수많은 음식점, 그리고 멋진 관광지까지! 넘치는 볼거리를 담은 일본 여행서다. 입장료, 개방시간, 전화번호 등 이 책만 가지고도 알차게 일본 여행을 할 수 있도록 독자들에게 큰 도움을 준다."
9788994909912,8,허영만이란 이름만으로 신뢰할 수 있는 브랜드였던 시기가 있었다. ｀말에서 내리지 않는 무사｀부터 다소 실망스러운 면이 있었다. 이 책도 그 연장선에 있는 것 같다. 그 이유가 왜일까. 허영만화백이 예전의 명성을 다시 찾기를 기대하며/
9788994909912,6,일본미식탐방기라기 보다는 여행안내서에 가까워요.
9788994909912,10,"평소 맛집 찾아다니는걸 좋아하는데, 일본의 맛집이라니 더욱 기대가 됩니다! 거기다 유명 만화가 허영만 선생님의 그림과 함께 책을 읽으면 더 재미있게 볼 수 있을것 같아요. ^^*"
9788994909912,10,"허영만 선생이기에 일단 5점. 하지만, 이젠 일본의 맛에 대해 수많은 책으로 어느정도 실체가 파악이 된 만큼, 국내의 요식업에 대한 문제와 개선을 실질적으로 해나갈 전망과 비전을 다루는 치밀한 서적도 좀 많이 보고 싶다. 왜 우리음식점(한식중심)들은 위생과 마켓팅, 그리고 전통에서 밀리는지등"
9788994909912,8,단순한라면뿐아니라일본의다양한 여행지정보도담긴
9788994909912,10,일본 음식기행이 주지만 해당 지역의 관광지에 대한 정보도 충실히 담겨있어요. 일본이 초행이 아니라면 가이드북 없이도 이 책 하나 들고 현지인처럼 즐기고 올 수 있을 것 같아요.
9791185967707,6,팬심으로 산 책. 시즌 4 정도까지만 언급이 되어 있다. 화보집 정도의 가치. 새로운 건 없다
9791185967707,8,"드라마에서 다루지 못한 가게의 특징이나 히든 메뉴, 특별한 주문 방법까지 상세하게 나와 있어서 당장 들고 일본으로 떠나고 싶은 충동을 자극하는 책이다. 고독한 미식가 드라마 팬이라면 꼭 소장하고픈 책."
9791185967707,8,"고독한 미식가 너무 재미있게 보고 있어서, 만화도 읽었는데 맛집 가이드북까지 나와서 반가웠습니다."
9791185967707,10,"채널제이에서보고검색해봄. 남자주인공이 조금나이들어보이는게 아쉽지만, 재미잇던데"
9791185967707,10,후속편도 내주시길~~
9791185967707,10,역시 드라마와 같게 보고나면 배고픔이 밀려오는 책다시한번 도쿄를 가봐야할것 같은 책입니다
9791185967707,10,"음식 사진들을 보고 있으면, 사진 속으로 막 빨려들어갈것 같은 기분이들어요.한국이었다면 바로 찾아가보았겠지만, 그럴수 없으니 사진과 맛에 대한 평가 그리고 분위기만으로도 어떻게든 사진과 비슷한 요리를 만들어 먹고 싶은 충동이 듭니다. 요리책보다 더 요리하고 싶게 만든 책 ^^"
9791185711362,8,얇기는 하지만 내용이 알찹니다. 단지 아쉬운 것은 앞부분의 일부만 컬러이고 뒷부분은 흑백이라는 점...음식만화는 모두 컬러야 제대로라고 생각되지말입니다.
9791185711362,8,책을 보면 식욕이 막!!!ㅠㅠ 전체가 컬러면 더 좋았을거란 아쉬움이 남는..
9791185711362,10,만화로  그려져 있는   음식 소개를 볼  때마다  군침이 꿀꺽  넘어갑니다 ㅋㅋㅋ
9791185711362,10,후쿠오카 가고싶다
9791185711355,6,내용도 괜찮고 음식일러스트도 맛있어보였다. 하지만 삼분의 이가 흑백이라 그 맛있어보임을 느끼는데 많은 아쉬움이들었다ㅠㅠ 가격이 좀더하더라도 다 컬러였다면 더 좋았을것 같다
9791185711355,8,얇은 책에 내용은 알차서 좋습니다만 앞부분 일부만 컬러네요.그리고 여행갈때 어느 맛집을 들러야할지에 도움이 되어서 좋았습니다.
9791185711355,10,오사카에 가고 싶다
9791185711355,6,맛집들이나 대표요리에 대한 설명이 만화책치고 자세한데 약간 일본예능프로를 보는것처럼 오버스러운 느낌이 책에서도 느껴져서 살짝 당황.
9788996452560,10,어디로든 떠나고 싶은 요즘이다.이른 가을 바람에 내 맘이 설렌다.북해도의 여기저기 내 마음속에 저장~~^^
9788996452560,8,책을 읽고 나니 북해도에 너무너무 가고 싶어진다. 딸과 함께. 가볍게 읽을 수 있는 심플한 여행기.
9788996452560,6,200쪽짜리 사진집이 만원이 넘네
9788996452560,10,"감성적인 사진과 멋진 편집과 디자인, 그리고 여행정보 등 볼거리도 많지만글 속에 사진 속에 녹아있는 버튼티님과 아이들의 감성 또한 진실되고 따뜻해 보여서 좋았다"
9788996452560,8,"작년에 큰아이만 데리고 다녀온 북해도, 다음엔 두 아이 모두와의 여행을 꿈꾸며-"
9788996452560,10,책만 보는 걸로도 북해도에 간 듯 마음이 시원해집니다.
9788959195213,8,이 책 하나들고 경로를 쫓아 여행하면 재미있을 것 같다. 일본식 맛집탐방이고 지도로 머물던 곳에 대한 정보가 소상히 나와있다.
9788959195213,8,"사진은 전공을 안 하셔서 그런가, 어째 그려진 음식이 사진 속 음식보다 더 나아 보이는지? 그래도 궁금해 궁금해! 1) 토스트 위에 단팥 얹어 먹으니 맛있다고?  2) ""끈적할 정도로 진한 온천""이면 온천 물이 어떻다는 것?  3) 기차 안에서 먹는 갓 만든 따끈한 도시락--담에 반드시 먹어보리라!"
9788959195213,8,책으로 여행하기! ^^
9788959195213,10,첫 리뷰 처럼 타카기 나오코의 책이기에 구매! 귀엽게 생긴 캐릭터가 여기저기 돌아다니며 맛있게 생긴 음식을 먹어주니 그저 즐겁다!!
9788959195213,6,"재미는 그냥저냥, 음식 소개도 주마간산으로 훑고 지나감. 만화로도, 음식 소개서로도 조금씩 부족하다. 타카기 나오코 작가의 작품을 좋아하지만 이번 책은 조금 아쉽다."
9788959195213,6,"스토리 컷 만화 방식보다는, 그냥 일러스트 삽화 구성이었으면 어땠을까 싶다. 어디를 갔고 뭘 먹었다 정도의 스토리라서 만화적 재미는 부족함. 음식 소개도 기대보다 간략함."
9788959195213,10,하여간 이 저자책은 너무 특이해요...참 별것 아닌것 같은데 웬만한 여행 가이드북보다 더 자세하게 정보까지 더해져서 재미에 유용성까지 업~시키네요.하루빨리 죄다 번역되었으면...아예 이참에 일본어를 공부하나...ㅋㅋ
9788959195213,10,으아아아~ 먹부림 여행 정말 좋아하는데~~~ 이 루트대로 다니면서 여기 나온 음식 다 맛보고 싶은 심정이예요ㅎㅎ
9788959195213,10,"이 책도 번역판이 나왔군요~ 채다인님 번역이라면 믿을 수 있고, 하여간 가보고 싶고 먹고 싶어지는 책이랍니다. 온천여행편도 나오면 좋겠어요."
9788959195213,10,"작가님의 팬입니다. 여행정보책이라기보단 친한 친구가 여행가서 먹고 논 이야기를 해주는 느낌이랄까.. 공감가는 즐거운 여행기입니다. 아, 이벤트 응모합니다. http://zekisis.blog.me/20183849191"
9788959195213,10,책을 읽다 보면 일본행 비행기 티켓을 사러가고 싶어진다.
9788959195213,10,일본은 내년에 가겠지만;ㅅ; 저도 제대로 먹고싶어요 _ !
9788959195213,10,"몇년 전에 애니북스에 타카기 나오코 작가의 작품 발간을 요청했었는데, 드디어 발간! 감사합니다! 진짜 이 작가 작품은 다 나왔으면 좋겠습니다."
9788959195213,10,넘 좋아하는 작가라 무조건 사야지!ㅎㅎ 이 저자 작품 싹 다 나왔으면~ >_<
9788959195213,10,"아니, 이 분 완전 친절하심. 제대로 드셨다! <혼자살기 5년차>이후로 완전 팬, 배빵빵 땜에 일본 (먹으러) 가고 싶어졌다...!"
