ISBN13,rating,review
9788927811329,10,여행책 좋아해서 샀는데 초반부터 몰입이 좍 되네요 ㅋㅋ 두시간 동안 세계여행한 느낌!! 사진도 좋아서 더 재미있게 봤습니다^^
9791196248727,8,"셜록 팬으로서 읽지 않을 수 없었고, 이 책을 덮고 나서 다시 셜록 홈즈 전집을 정주행하게 된다. 이런 형태의 여행을 할 수 있다는 점이 신선하고, 나만의 주제로 여행을 해야겠다는 생각도 들게 한다. 셜록홈즈, 아가사 크리스티, 사드, 뤼팽, 장 바티스트 그루누이의 흔적을 찾는 흥미진진한 여행."
9791196248727,6,추리소설 팬으로서 저자 개인에게 매우 의미있는 여행이었을 듯 싶다. 이런 여행을 할 수 있고 해낸 그가 부럽고 멋진 사람같다.
9791196248727,10,"상상과 현실이, 픽션과 논픽션이 공존하는 색다른 유럽여행. 셜록을 찾아 나선 여정의 끝에서 마주한 것은 아직 꿈 쑬 수 있어 행복한 자기자신."
9791190938471,10,내 세상은 경험하는 만큼 넓어진다. 내 이해의 폭도 경험하는 만큼 넓어진다. 간접 경험일지라도.
9791190065696,8,여행 행복 글쓰기 영어 등 내 인생에서 하고 싶고 즐기고 싶은 일을 생각나게 한 가볍지만 가볍지않은 책
9791190065696,10,일체유심조 - 모든일은 내가 마음먹기 나름이라는 진리.그곳이 어디든 모든일은 마음먹기 나름 일상을 여행화낯선 것을 익숙한 여행으로 경계를 조금씩 확장한다
9791190065696,10,진정한 여행이란 새로운 풍경을 보는 것이 아니라 새로운 눈을 가지는 것이다.
9791190065696,8,지금 읽고 있는중. 김민식 작가의 책은 재미가 있다..
9791190065696,10,첫번째 화살은 맞아도 두번째 화살은 피하자
9791190065696,10,제가 엄청 좋아하는 분입니다. 이 분의 책은 다 읽고 이분의 블로그도 매일 가서 읽습니다. 힘든 시절의 말이나 글은 웃기게 하시지만 그 마음을 잠시라도 감정이입해보면 마음이 찡합니다. 인간적으로 너무 존경합니다. 많은 분들이 이분의 글을 읽었으면 하는 바람으로 이 글를 씁니다.
9791190065696,10,"여행을 자주 가는 편이 아니고 사실 일상업무가 여행이 되고 있는데, 제목처럼 여러가지 습관들이 여행을 통해 만들어지곤 하지요. 일상이 여행인 나에게도."
9791190065696,10,"이 분, ‘영어책 힌권. . .’에서도 느꼈지만 대단하다. 본인은 역마살이라고 하지만 그 적극성과 긍정적 성격은 이 분의 힘이고 동력이구나 싶다. 가장 좋았던 건 가족들과 한 여행 이야기. 돈이 아니라 시간을 들이고, 서로 스타일 맞춰주는 가운데 지극한 행복을 맛보는 것, 부럽고 따라하고 싶다!"
9791190065696,10,내가 지향하는 삶. 가볍고 경쾌하게. 지금 바로 여기. 나만의 길을 가면그만.
9791190065696,10,"인생을 즐길 줄 아는 롤모델 ‘김민식PD‘님의 신간을 설레는 마음으로 만났습니다. 강의장에서 만났던 그의 겸손함과 소탈함에 반했습니다.이 책을 읽고 나니, 여행을 통해 만난 사유들, 그리고 매일 풀어내는 글을 통해 그만의 단단함이 쌓여왔다는 것을 알았어요.김민식PD의 인생철학책! 강추!"
9791190065696,10,산티아고를 그리워 하는대신 뒷산을 오른다..... 벌써 이 한줄에 저는 이 책이 가져다 줄 즐거움이 느껴진다. 제마음의  Must read book 으로 선정 합니다.
9788998342340,6,용기있는 세계 여행. 자유로운 영혼. 사랑하는 아내. 좋았다.
9788998342340,10,"선물받았던 책이 맘에 들어, 다른 친구에게 선물하려고 또 구매했어요. 새로운 도전을 위해, 특히 해외로 나가는 친구들에게 종종 선물합니다. 스테디셀러인 데에는 다 이유가 있어요. ^^"
9788998342340,10,여행에 대해서 가벼운 말로도 많은 것을 느끼게 해주는 책입니다.
9788998342340,10,정말 비타민 같은 책 !!  자유와 사랑을 몸소 느낄수 있게 해주는 책 . 추천합니다 :
9788998342340,8,삶에대한 은은하지만 강한 열정이 부럽다.
9788936470333,2,"책상태 ‘상‘이라고 해서 주문했는데 어이가 없네요. 1997년도 출판이고 책값도 12,000원인데 13,000원 받는 건 무슨 심뽀인지...."
9788936470333,10,얘기도 감칠맛나게 잘하시고 글도 그 못지않다
9788936470333,10,"선물했는데, 좋다고 하시네요..^^"
9788936470333,10,"건축은 그 시대의 문화와 전통, 환경을 담으며, 그것은 역사가 되어 우리에게 남는다."
9791190382304,10,"불교경전처럼 어려운 말이 나오는 책이 아니라서 누구든지 읽기에 좋습니다. 각국에서 만난 다양한 사람들과의 인연, 그들의 삶에서 배움을 얻기도 하는, 스치는 관계 속에서 ‘나’를 찾아가는... 무엇보다 ‘집콕’ 생활 중인 이 시기에 대리만족하며 두고두고 읽을 수 있는 책이 아닐까합니다."
9791197193378,10,우리가 여행을 가는 이유에 대한 여러가지 생각들을 진지하게 때로는 (아니 자주) 유머러스하게 풀어내고 있다 떠나지 못하는 여행이 아쉬운 사람이라면 꼭 읽어보시길 곧 떠날 여행의 설레임으로 밤잠을 설칠지도 모른다 관광지의 멋진 사진이나 음식 사진은 기대 마시길(그런건 sns에 널렸다)
9791197193378,10,드디어 판사님 이 글은 고양이가 썼습니다 드립을 칠 수있겠군요!!!! 크리스마스는 넷째고양이 책과 함께 해야 겠네요!! 왜냐고는 묻지마요...
9788925567235,10,"집을 떠나 여행한다는 것을 두려움으로 느끼는 나같은 사람도 있다. 그래서 절대 멀리 가는것은 피하고, 어지간하면 당일치기로. 내가 아는 곳만 잠시 방문하는 수준의 여행을 한다. 그래서 내게 여행서는 특별하다. 혹여나 떠나볼까하는 용기를 주니까. 이 세상은 괜찮은 곳이라는 위안을 주니까"
9788925567235,10,"SNS를 통해 처음 알게 된 청춘유리님의 책, 프로 여행러의 멋진 사진과 여행의 문장 기대됩니다^^"
9788925567235,10,18세에 여행을 시작하여 11년동안 65개국 500개 도시를 여행한 작가의 여행에세이. 프로 트레블러인 그녀의 경험담이 우리의 여행에 도움이 될것을 확신한다.
9788925567235,10,여행은 언제나 옳다고 믿는 사람으로 그녀의 행보에 응원을 보내고 싶어요.많이 보고 듣고 느끼는 여행이야말로 사람을 크게 만드는 것 같아요. 저도 여행을 좋아하지만 아직 가보지 못한 곳이 더 많기에 이 책을 읽으며 떠날 꿈을 꾸고 싶네요.그녀의 여행기가 기대되는 이유입니다.예쁜 사진은 덤^^
9788925567235,10,11년간 65개국 500개 도시를 여행했다니 실로 대단합니다. 그 내공을 이번 책으로 조금이나마 느껴보고 싶습니다!
9788925567235,10,"블로그나 SNS를 통해 사진을 접하긴 했지만, 이런 여행담은 여행이 다 끝나고나서, 또 시간이 지나고 나서 더 빛을 발하는 법이죠. 그리하여 소장각 !!!!"
9788925567235,10,평소 좋아하던 여행작가님 책이라 이번책도 기대가 되는것 같아요 .작가님 사진이나 글을 보면 마치 내가 여행을 하고 있는것같아서 대리만족이 되는데 이번책도 글뿐만 아니라 예쁜 사진도 함께 있어서 읽기 좋을것 같아요
9788925567235,10,여행은 언제나 즐겁죠^^ 500개의 도시나 방문했다니 너무 멋지고 부러워요! 저는 그렇게 많은 여행은 힘들지만 책을 통해 대리만족 할 수 있을 것 같아서 기대되네요^^
9788925567235,10,여행작가의 책을 읽을때면 그 마음이 그대로 전해져 읽는 동안 함께 여행하는 느낌이 들어 참 좋다.11년간 65개국 500개 도시를 보며 작가는 어떤걸 느끼고 어떤 마음이었을까? 너무 기대되고 설레는 책이다. 그냥 글만 있는것이 아니라 사진도 함께 있어 더 좋은 것 같다^^
9791190382298,8,생각보다 편히 읽은. 느낌 좋은 책. 원제스님 답다
9791166030253,8,재미있고 쉽게 써서 술술 넘어가네요. 코로나로 해외여행을 못가고 있는 상황에 책을 읽으니 세상이 빨리 정상적으로 되서 해외 여행 가고 싶어요~
9791165790479,8,"가볍게 읽어볼만한 도서. 일종의 여행하면서 국가별 술에 대해서 다루고 있는 도서인데, 한국에는 한국을 대표할만한 술이 좀 파워가 약하다는 점에서 아쉬움이 든다.. 막걸리 ? 소주 ? 아닌가. 편견 일까?"
9791165790479,10,스피릿로드를 조금 손 봐서 다시 낸다는 이야기 듣고 메모만 해 두었는데 오늘 밀린 책들 주욱 검색해 보다가 알았습니다. 고생하셨어요. ... 주중에 이 글에 ‘구매‘ 표시가 붙을 겁니다. :D
9788925536774,10,믿고 구입했어요. 유튜브 영상을 쭉 지켜본 사람이라면 알죠 메이님의 따스함과 꾸준함을 !!
9788925536774,10,걍 믿고 보는 여행자메이~~ 읽기전에 꼭 ‘때때로 괜찮지..‘ 도 읽어보시는걸 추천bb
9788954442367,10,https://m.blog.naver.com/jamo97/221897064054드디어 손꼽아 기다리던 신간이 나왓어요♡
9791190073042,10,"신랑과 결혼하면서 시간날때마다 함께 세계 곳곳을 돌아다니며 여러 나라의 문화, 생활 등을 직접 경험하자고 했어요^^세계지도가 있으면 세계 여행 루트를 짤때 넘 좋을 것 같아요! 딱이네요! 기대되요^^"
9791190073042,10,지금 당장은 코로나 때문에 못떠나지만!! 코로나가 끝나면 해외여행갈 때 참고하면 너무 좋을거 같아요!! 아가랑 지도 보면서 어디에 어떤 나라가 있는지 이야기해보면서 행복한 상상도 할 수 있을거 같아요!
9791190073042,10,"남편과 연애하면서부터 여행을 자주 다녔는데 지금까지 어디어디 갔는지 표시도 못하고기억도 점점... 사라지더라구요~ 앞으로 가고싶은 곳도 많은데 어디부터 가야할지도 모르겠고 어디어디가 있는지도 모르겠고~ 에이든 세계지도로 갔다 온 곳도 확인하고, 앞으로 계획도 세울수 있을것 같아요"
9791190073042,10,지리쌤이 추천해주셔서 구매했어요ㅎㅎ 교과서로 세계지리 배울땐 따분했는데 지도 직접 보면서 여행지랑 역사/문화를 같이 읽으니까 내가 직접 여행하는것같아서 더 재밌어요!
9791190073042,10,"세계여행 계획하는데 정말 필요했던 지도에요! 구성이며 내용, 품질 모두 훌륭합니다! 각 국가들의 요약된 역사정보와 일러스트로 표현된 상징물들이 눈에 쏘옥 들어오네요~~미리 읽어두고 보면서 여행 루트짜는것도 재미있어요^^"
9791190073042,10,코로나 시국도 사국인 만큼 어딜 나다니지 못해서 코로나 사라지면 떠날 세계여행 계획좀 짜보려고 구매했어요. 받아보니 대박 만족스럽네요  인터넷 찾아서 이걸 조사하려면 시간이 엄청난데 시간절약도 되는거 같습니다. 매우 만족스럽습니다!!
9791188434275,10,처음으로 산 여행 책. 견문위주의 여행책이 아니지만 오히려 그곳에 채취를 더 실감나게 느끼게 되었다. 부모님께서도 극찬하신 책이라서 가족 다같이 보고 있다.
9788958077466,10,"문구를 사랑하는 사람이든, 문구덕후이든, 문구를 그냥 일상용품으로 쓰던 사람이든 누구나 읽어도 좋은 책.우리 사용하는 가장 가까운 자리에 있는 문구용품에 대한 애정을 불러일으킨다. 응원하고 싶은 힘!"
9788958077466,6,"누군가는 열심히 살아온 이유로 훌쩍 떠나 여행을 가고,누군가는 자신의 전공과 취미를 더 넓히고자 여행을 떠나고,누군가는 새로운 삶의 터전으로 여행을 떠난 그 곳이 제2의 고향이 되기도 한다.이 책은 세계 여러"
9788958077466,10,"책을 잘 샀다는 생각을 오랜만에 했다. 문구에 흥미가 있다면, 한 번은 읽어 볼만한 책이다."
9788958077466,6,개인적으로는 ˝문구˝를 기대하고 읽었는데 ˝나의 여행기˝ 부분에 더 초점이 맞춰진 내용이었던게 아쉬웠습니다. 저자가 운영하는 문구 브랜드에 관심이 있으신 분들이라면 한 번 읽어 볼 만은 할 것 같아요. 저는 저자에 대한 배경지식이 없이 책을 읽어서 그런가 블로그 여행기 읽는 느낌이었네요 :(
9788958077466,10,"소장가치가 있는 아주 정성스레 만들어진책.문구를 좋아한다면, 읽어보자.동지애가 솟아오른다."
9788958077466,6,문구에 대해 관심이 많아 선택했는데 기대와는 다소 다른 내용이었다
9788958077466,8,책 끝에 가서야‘좋아하는 것을 좋아하는 용기에 대하여‘라는부제의 의미를 이해 할 수 있을 것 같다.
9788958077466,10,문구덕후 1인으로써 당장이라도 가방을 메고 문구점투어를 진행하고 싶어지는 책이였네요♥
9788958077466,10,점점 digitalization 되는 현 시대에세대를 떠나 문구덕후이건 아니건 한번 쯤 이 책을 열어보고 직간접적으로 느껴보는 것은 어떨까?혹은 당신의 다음 여행지에 해당 도시가 있다면 지나가는 동선에 하나쯤 추가해보는  것도 나쁘지 않겠다.
9788958077466,10,평소 작가의 문구를 사랑한 사람이라면 꼭 읽고 싶었던 책. 설레고 따뜻한 여행 이야기뿐만 아니라 꿈을 좇는 젊은 청춘을 응원하고 싶어지는 책. 참 곱고 다정한 책.
9788958077466,8,문구매니아로서 이런 책은 꼭 봐줘야한다. 문구매니아를 대표해 다른 나라까지 발로 뛰어준 저자에게 박수를! 구매로 보답한다.
9791189856717,2,뭘 이야기 하고싶은 것인가 묻고싶다.
9791189856717,10,친한 누나가 담백하게 들려주는 여행이야기...!덕분에 여행 에세이들을 찾아서 읽고 있습니다..
9791189856717,10,감성적이네요 사진이 특히 좋아요 나도 여행가고 싶고 ㅠㅠ
9791189856540,8,다양한 삶의 형태와 그 형태를 만들어 가는 인생 여행기
9791189856540,10,이 책은 단순한 여행 가이드북이 아니다. 유튜브 <원지의 하루>로 구독자 6만여 명의 사랑을 받고 있는 이원지 저자의 여행 유튜버 성장기를 담고 있는 책이다. 읽다 보면 어느새 나도 모르게 그녀의 목표에 응원을 하고 있다. 여행을 직업으로 살아가는 이야기가 궁금하다면 꼭 읽어보길 바란다.
9788998965167,2,"후지와라 신야의 여행서와 비교해 본다면 한참 수준이 떨어진다. 고작 300여 일을 여행해 놓고서는 세계 곳곳을 잘 아는 것처럼 폼을 잡고, 여행이 어떻다는 식으로 규정하고 단언하고 있으니 말이다. 여행서로서 기본도 갖추지 못한, 감정 과잉과 가벼운 단상이 전부. 글보다 저자만 돋보이는 책."
9788998965167,6,작가의 건강한 정신이 글에 묻어난다.나는 절대 따라할 수 없지만 따라하고 싶게 만드는꼰대스럽지 않은 해피바이러스가 가득한 책.
9788998965167,10,"글이 정말 예뻐요ㅎㅎ 단순히 어디 갔다 왔다, 어디 갈 땐 뭘 조심해라 이런 내용이 아니라 여행 하면서 느낀 점들, 본인의 생각이 아주 예쁘게 표현되어 있어서 읽는 내내 힐링되는 느낌 :)"
9791187949152,10,"조선의 동포들이 보릿고개를 넘던 무렵, 무려 스무 달 동안 세계일주라... 이들의 여행 방식으로 다닌다면, 지금의 기준으로 얼마의 돈이 들까요? 가늠조차 안 되는구만요.책을 읽는 동안 내가 나혜석이 되어 봤습니다. 인터넷 시대가 아닌 100년 쯤 전이니, 날마다 얼마나 가슴 뛰는 경험이었을까요!"
9791187949152,10,나혜석과 함께한 세계미술여행
9791187949152,8,오래된 여행기인 것을 감안하고 보면 재미있어요.
9791187949152,10,100여년 전에 작성된 유럽여행기로 가볍고 재미있게 읽었습니다.
9791187949152,2,과제 때문에 읽고있긴 한데 재미가 멸종했습니다.따로 관심있는 사람이 아닌이상에야 사는건 비추입니다.신여성의 대표이신 나혜석의 삶의 애환이 담겨 있지만 사실 요즘 사회에서는 이해가 힘들수도 있다고 생각합니다.
9791185823201,8,개인적으로 기대했던 스코틀랜드 이야기는 그냥 그랬지만 덴마크 시민학교나 멕시코 인형 공방(?) 이야기는 마음에 들었던...
9791186889091,8,아주 잼나게 읽었습니다.  읽는 동안 당최 좀이 쑤셔 견딜 수가 없더군요 ㅎㅎ  마지막에 나오는 [부자학 강의]은 그야말로 옥의 티라 생각합니다 ㅜㅠ
9788952777102,10,유익한책이네요
9791186517925,2,새벽 2시 한껏 갬성에 취해 올린 글과 셀카를다음날 출근길에 보며 얼굴이 화끈거리는 심정혹은 10년만에 로그인한 유년시절 싸이월드를 발견한 느낌아님 녹음된 내 목소리를 들을때 느끼는 고통여행은 나에게만 감동이고 서사이다그 감정을 지면 너머의 독자에게 전달한데는 실패편집장 실화냐
9791186517925,10,"지친 일상 가운데 여행하는 듯한 기분을 들게 해주는, 사진 전문가가 아니라 나의 눈으로 본 것 같아서 더 아름다운 그런 책입니다."
9791186517925,6,사람답게 사는것이란 여행을 하는것이다
9791186517925,8,여행 정보를 얻기 보다는 여행 감성을 느끼고 싶다면 괜찮은 책이예요. 저는 여행 이야기보다 젊은 나이에 겁없이 세계 여행을 꿈꾼 청춘에게 더 높은 점수를 주었습니다.
9791186517925,4,"청춘유리님을 예전부터 팔로우 했고 그녀의 강의를 듣기도 했지만 이 책은 많이 실망스럽다. 여행기라고 하기에는 불친절한 느낌? 작가님의 그때그때 감정만 쭉 써내려간 느낌으로, 누군가는 만족하겠지만 일단 나는 실망스러웠음. 작가님의 SNS가 이 책보다 더 많은 여행기가 들어가있다고 생각함.."
9791186517925,6,"너무나 기대했던 책이고,작가였다 어쩌면 그게 약이 될 수도 독이 될수도 있을 것 같다. 약이 됬던 건 작가님의 삶을 더 가까이 느낄 수 있던 것. 먼 이야기가 아닌 친 언니가 들려주는 이야기 같았다 하지만 너무 기대했던 탓일까 설렘을 갖고 읽어가던 첫 마음과는 달리 내용이 정리 되지 않은 느낌"
9791186517925,2,"말 그대로 제목빨인 책. 좋게 말하면 가볍고, 솔직하게 말하면 유치하다. 돈 아깝다"
9791186517925,10,예쁜 풍경과 글이 있는 최고의 여행책
9791186517925,10,"책을 읽는 내내 이 사람, 여행하면서 참 행복했구나 싶었다. 나의 청춘도 지금 이렇게 반짝반짝 빛나고 있을까, 나도 저렇게 강렬하고 따듯한 에너지를 뿜어낼 수 있을까 생각이 들며 나의 삶을 뒤돌아보게 되었다."
9791186517925,10,여행은 누구나 꿈꾸는 동경이다. 청춘유리님의 예쁜 사진이 많고 엽서도 그림처럼 예쁘다.
9791186517925,2,재미도 없고 내용도 없고 심지어 잘 쓰지도 못한 일기장을 굳이 돈 주고 사 볼 이유가 있는가에 대해 생각하게 해준 책
9791186517925,10,개인적으로 많은 여행에세이를 읽었지만제일 추천하고 싶은 책이다.작가의 이야기가 너무나도 공감이 되어빨리 읽어졌는데 하루에 다 읽는 것이 너무 아쉬워책을 잠시 접어두었다.정말 심장을 뛰게 하는 책입니다!
9788971996942,10,삶에 대한 성찰이 가득 담겨있지마 어리석은 빈자에겐 쉽게 체득될 수 없는 내용들이기에 곁에 두고 몇번은 보아야 할 책
9788971996942,10,너무도 좋은글들이네요^^
9788971996942,10,"더불어 세계사, 더불어 인류의 희망, 더불어 평화, 생명 상생의 지구가 되도록 신영복 선생님이 직접 여행하며 우리에게 보내준 편지. 환한 답장을 준비하며 오늘도 최선을 다하는 우리가 되길-"
9788971996942,8,신영복 선생님이  타계하시고  그동안  읽지 못했던  선생님의 책을 구입해 읽고 있다.담론이나  강의에 비해 쉽게 읽혀지는 책.그러나  큰 어른의  지헤를  배우기엔  아직  내 그릇이  너무 작은 듯 하다.
9788971996942,10,개정판을 소장하려고 구입했어요. 오래전 읽었는데 새롭겠죠?
9788971996942,10,삼가 고인의 명복을 빕니다.
9788971996942,10,"책이 서재에서 보이질 않아, 다시 구입해 두었다. 아무 곳에나 펼쳐 읽어도, 놀랍다. 어떻게 이런 혜안과 따뜻한 시선으로 세상을 바라보실 수 있는지... 나에겐 존경과 놀라움 그 자체로 다가오는 분이시다."
9788971996942,10,"삶의 여러 순간에서 드는 생각은 각기 다를진데, 좋은 책을 통하여 닮고 싶은 분의 생각을 알 수 있다는 것은 큰 영광이고 복이네요. 선생님의 깊은 생각과 넓은 사고의 숲을 더불어 함께 즐길 수 있어서 행복한 책이었습니다. 감사합니다."
9788971996942,10,신영복님의 깊고 너런 성찰을 볼수 있어서 너무 좋았어요
9788971996942,10,신영복 선생님의 깊이 있는 이야기를 들어볼수 있어서 좋았습니다.
9788971996942,10,"신영복선생님의 22개국을 여행한 기록한책 그 나라에 관련된 글과 그림,사진을 같이 보니 선생님의 메세지가 더욱 더 잘 전달 되네요 개정판이 나와 너무 좋습니다"
9788971996942,10,생각의 지평을 넓히기에 이만한 책이 또 있을까 싶다.
9788971996942,10,개정판이라서 읽어봤는데 여행하는 과정에서 사람에 대한 성찰에 대한 내용이 흥미롭습니다. 신영복 작가의 글과 더불어 그림과 사진들이 짜임새 있게 잘 구성되어 있고 내용이 잘 저술되어 있어서 좋은것 같습니다.
9788971996942,10,신영복 선생님의 성찰이 가미된 여행 에세이 기대됩니다.
9788971996942,10,신영복님의 여행을 통해서 경험하고 느끼게 되는 다양한 생각들을 접할수 있어서 좋은거 같아요. 읽고 싶은 책입니다.
9788971996942,10,개정판이 나와서 좋습니다. 신영복 선생님의 깊이 있는 메시지를 전해듣고 싶습니다.
9788971996942,10,개정판이라 더욱 반가운 신영복의 <더불어숲> 소장할만한 가치가 충분하다
9788971996942,10,저자 신영복님이 여행과정에서 느낀 인도적 성찰이 독자들로 하여금 유사한 성찰의 기회를 제공하기를 바라며 재개정판의 성공을 기원합니다.
9788971996942,10,여행을 좋아하시는 분들에게 추천해요..!
9788971996942,10,신영복 교수님의 책은 무조건 믿고 사서 봅니다...^^
9788971996942,10,여느 여행관련 책들하고는 달리 이 책에는 알 수 없는 무언가를 느끼게 해 주는 매력이 있습니다. 이렇게 여운이 오래가는 여행관련 서적은 또 없을 거 같아요.
9788971996942,10,궁금한 책입니다. 일반적인 여행서와는 완전히 다른 모습을 하고 있네요.
9788971996942,8,유명한 여러 곳들이 사연이 있네요. 여행하기 전에 좀 알고 가면 좋을 것 같습니다
9788971996942,10,단순한 여행서가 아니라 작가의 이야기가 담겨 있어 다른책들과는 차별화된 책이에요~ 잘 읽엇습니다~
9788971996942,10,천편일률적인 기타 여행서와 달리 여행지마다 깊은 철학과 삶에 대한 이야기가 담겨 있어서 더욱 좋은 것 같습니다
9788971996942,10,여행한 기록을 모두 책으로 냄으로써 독자도 간접적으로 그 기나긴 여행을 통한 것들을 함께 느껴볼 수 있는 좋은책이라는 생각이들고 그로 인해서 자신의 삶에 대해서도 생각해볼 수 있는 좋은 기회가 되는 책이라는 생각이 듭니다.
9788971996942,10,유명한 여러 곳들이 사연이 있네요. 여행하기 전에 좀 알고 가면 좋을 것 같습니다.
9788971996942,10,제목이 말하는 숲은 여러 의미가 있네요 ^^ 저도 삶을 한번 둘러봐야겠어요.
9788971996942,10,"사진이나 찍고 경치나 즐기는 여행기가 아닌, 삶에 대한 깊은 통찰과 성찰이 담긴 에세이"
9788971996942,10,신영복 선생님의 깊이 있는 이야기를 듣고 싶어요. 새로운 모습으로 개정판이 출간되어서 반갑네요!
9788971996942,6,여행을 통해서 느낀것들이 기대됩니다.
9788971996942,10,신영복 선생님의 더불어숲 개정판이 출간되어서 참 반갑습니다. 기대됩니다!
9788971996942,10,"이미 있는 책임에도 개정판이라서, 그리고 신영복 선생님 책이라서 구입했습니다. 조심스럽게, 배려있는 어투로 우리 이성을 깨우치는 선생님의 글, 늘 책상에 두고 조금씩 읽으려고 합니다."
9788971996942,8,나무와 숲으로 이야기하는 깊이에 감탄이 나옵니다.
9788971996942,10,신영복 선생님의 깊은 성찰의 책을 새로이 다시 볼 수 있어 더욱 기대가 됩니다. 진정한 올바른 것일까등등의 자문에 대한 답을 기대해요.
9788971996942,10,신영복 교수님의 책은 항상 기대됩니다. 이전판으로 읽었었는데 개정판이 나왔군요. 다시 봐야겠습니다.
