ISBN13,rating,review
9788954655972,8,"점점 더 사회적으로 나에게 부여된 정체성이 때로 감옥처럼 느껴지는 순간이 많아지면서, 여행은 내가 누구인지를 확인하기 위해서가 아니라 내가 누구인지를 잠시 잊어버리러 떠나는 것이 되어가고 있다. (p.180)"
9788954655972,10,명절이 껴있지만 빠른배송 해주셨어요 ~지인이 추천해줘서 읽어보고싶어서 구매했어요
9788954655972,6,여행은 일상의 부재
9788954655972,10,좋아서 두 번 읽었는데 또 읽고 싶네요.
9788954655972,6,"부산에 내려가는 길, ktx에서 펼쳤던 책.좋지도 나쁘지도 않은 심심한 책이다."
9788954655972,8,여행의 이유는 수만가지. 각자가 느끼는 것도 가지가지. 여행 가면 돌아오고 싶은건 매한가지. 코로나 때문에 여행 못하는 요즘은 그리웁지.
9788954655972,10,여행 다녀 온 후에 읽으며 웃을 수 있단 책입니다. 나의 여행 때 에피소드도 떠오르며 많은 공감할 수 있어요.
9788954655972,10,김영하 작가의 여행기를 통해 지난 나의 여행을 돌아보게 되었다 어떤 의미였는지 내 무엇을 변화시켰는지. 책을 덮고 난 후 이제는 나의 여행기를 돌아보고 싶다.
9788954655972,10,"여행의 이유보다는 여행의 의미가 더 맞는듯. 첨엔 가볍게 볼 생각으로 펼쳤는데 의외로 여행에대한 깊은 고찰이 있어 쉽게 읽혀지지는 않았다. 여행이란 무엇이며 그 의미가 무엇이길래 인류는 여행을 하고싶어하는지, 그 여행을 통해 얻게되는건 무엇인지 잘 알게해준 책."
9788954655972,10,"첫장부터 끝장까지, 자기가 그림자처럼 여겨졌다는 미국에서의 일상이 와닿았던 책."
9788954655972,10,김영하 작가님 소설도 에세이도 다 좋은..
9788954655972,8,"김영하의 소설은 정말 재미있다. 그의 소설은 최고다. 그러나 산문집은 글쎄다, 잘 읽히지 않았고 특히 이번 산문집에는 그 특유의 유머도 별로 없어서 나에겐 기대 이하였다."
9788954655972,10,나의 이야기
9788954655972,8,밑줄긋고  싶은 글이 많은 책.
9788954655972,8,여행을 떠나는 길에 읽었어요. 여행이 한층 풍요로워 좋았습니다.
9788954655972,8,세상을  살아가는  이유중에  하나~나를  위한  시간과 공간여행~ 꼭 필요한 거같다.바쁘다는  핑계로 세상을 넘  건조하게 산거같다.인생  뭐  있어~ 욕심을  내보자~
9788954655972,2,수식어 많은 글은 싫어하지만ᆢ내용이 없어도 너무 없다.
9788954655972,10,담백하다. 물 흐르듯이 자연스러운 문장과 함께 김영하의 머릿속에 ‘동기화‘되는 느낌이다. 작가 김영하의 매력에 흠뻑 빠져들게 된다. 내 여행의 이유도 그처럼 다채롭고 묵직해지는 계기가 될 성싶다.
9788954655972,8,"I am comforted from knowing that I am just a different person after reading this book, and am trying to accept that difference."
9788954655972,8,작가의 여행 경험을 모두 사용한 여행의 이유에 관한 뻔하지 않은 다차원적 접근. .
9788954655972,10,김영하작가의 책은 장르불문하고 일단 재밌다. 글도 가독성이 높아 술술 읽혀 마음만 먹으면 앉은 자리에서 다 읽을 수 있다. 여행이라는 단어 하나로 이렇게 넓은 이야기를 풀어내는 지식이 감탄스럽다.
9788954655972,8,"여행지에 따라 somebody가 되기도 하고, nobody가 되기도 한다는 부분에서 김영하 작가의 통찰력이 대단하다고 느꼈음."
9788954655972,2,"구매후 아직까지 다 못읽은 책.  작가의 추억을 끄집어 낸 내용인데, 읽으면서 이해할려고 하면 벌써 작가는 멀리 가있음. 따라갈수가 없고 집중이 안됨."
9788954655972,4,"책을 받아드는 순간부터 실망스럽다. 책의 완성도, 표지, 어느 것 하나 공들인 흔적이 없다. 이렇게 소홀한 책을 작가의 명성만 믿고 독자 앞에 내놓은 출판사나 작가에게 적잖이 화가 난다.포장의 초라함을 내용의 성대함으로 만회할 수 있을지..."
9788954655972,2,김영하의 글은 읽기에 속도가 나지 않는다. 소설이든 에세이든. 이유가 뭘까?
9788954655972,8,유명한 작가인데 이유가 있구나. 재밌었다.
9788954655972,8,그 흔한 감상적인 여행 에세이가 아니고 자기 고유한 생각이 드러난 글이어서 좋았다. 다만 초반부의 맛깔스러움이 뒤로 갈수록 밋밋해지는 느낌이어서 아쉬웠다.
9788954655972,8,계속 구매를 미루고 있던 찰나에 부산 여행 계획을 빌미로 구입했다. 여행지에서 읽으려 했것만 그 순간을 참지 못하고 읽는와중에 리뷰도
9788954655972,2,올해 TV매체 덕을 가장 많이 본 작가의 책. 베스트셀러가 되려면 글을 잘쓰기보다 열심히 TV출연을 많이해야한다는 걸일깨워줬다.
9788954655972,6,딱 제목만큼의 책이었다. 약간은 식상한 느낌이라 실망 한스푼.. 좋은 기억으로 남을 김영하 작가님의 책을 만날수 있기를..
9788954655972,6,단숨에 다읽어 내려갔다. 왜일까?  재미가없다...  난여행책 자주읽는데 이런건진몰랐다...ㅜㅠ
9788954655972,8,여행의 순간에 존재할 때에 비로소 삶이 새롭게 시작됨을 느낀다. 작가님 삶의 결에서 동질감을 느끼며 위로를 받았다. 여행이 함축하는 다양한 의미를 생각할 수 있는 행복한 시간이었다.
9788954655972,2,작가만 보고 예약구매는 이책으로 끝입니다그리고 명성에 맞는 책가격이네요.....심하다는 생각 안드시나요??
9788954655972,8,이제 기발한 소설보다는여유로운 산문이 더 김영하의 몸에 맞는 듯합니다.
9788954655972,8,쉽게 넘어가는 듯 하면서도...한편으로 머리가 복잡하기도 했던 책
9788954655972,10,가볍게 읽히면서도 공감되는...
9788954655972,10,제목만봐도 설레임. 보고싶었던 책 이제서야 읽게되었네요.
9788954655972,6,문득문득 떠나고 싶다 라는 생각을
9788954655972,8,김영하의 책을 많이 읽진 못했지만 이 책 한 권으로 왜 사람들이 그의 글을 사랑하는지 알 수 있었다. 에세이로서 갖춰야 할 요소들을 두루 갖춘 간결한 책. 가독성 좋은 글의 미덕이란 바로 이 책을 두고 하는 말일지도.
9788954655972,10,얄미운 김영하. 외국에 살며 한동안 한국책은 읽지않고 지냈다. 하지만 이 짧은 책을 읽은 후 아름다운 한국어를 더 읽고 싶은 갈망에 며칠을 쩔쩔 맸다. 지긋지긋한 집구석일지언정 내가 태어난 나라에서 나의 언어만 쓰며 살고 싶다는 해묵은 욕망을 김영하의 다정한 글이 사정없이 자극한 것이다.
9788954655972,8,"‘세련된‘ 작가의  ‘세련된‘  산문, ‘말끔한 ‘ 작가의 ‘말끔한‘ 이야기. 이 책은 이렇게 정리해본다."
9788954655972,6,"[여행의 이유](203p)-김영하  어둠이 빛의 부재라면, 여행은 일상의 부재다."
9788954655972,10,"여행하는 인간, 호모 비아토르"
9788954655972,2,"알랭 드 보통과 무라카미 하루키 사이를 고민하며 자신의 유년기에 지나치게 천착하는, ‘모든 여행 경험’이 필요로 될 만하지 않은, ‘여행의 의미’ 부터 설정을 다시 해야할 것 같은, 과대 광고되었얼 뿐 너무 시대에 뒤쳐지는 여행기. 그래도 베스트셀러라 완독했습니다. 인생 워스트 여행책 1위."
9788954655972,6,작가의 세세함이 잘녹아 있으면서 읽기 편한 글이다. 다만 작가가 권두에서 말하는 ‘여행과 배움’이라는 관점에서 작가는 결국 ‘사회주의’ ‘공산주의’ 그리고 허울뿐인 ‘민주화운동’이라는 것에 대해 자기가 보고 싶은 것만 보고 아무 것도 배우지 못했다. 뭐 그래도 여행은 갈만하다.
9788954655972,8,"˝이야기를 통해 인간은 현실에서 무질서하게 일어나는 여러 일들을 어떻게 받아들여야 하는지를 배운다. ~우리 의지와 무관하게 닥쳐올 때, 우리는 자신의 내면을 지켜내야 하고 그럴 때 이야기가 우리에게 심리적 틀을 제공하는 것이다.˝"
9788954655972,10,"좋은 책은 탐구하고 싶어지고 깊게 파고들어가고 싶어진다. 오랜만에 줄을 치고 포스트잇을 붙이면서 읽고 싶은 책을 만났다. 올해에도 다른 많은 다양한 책을 접했지만, 개인적으로 올해 최고의 책을 꼽으라고 하면 어김없이 <여행의 이유>를 언급하고 싶다."
9788954655972,4,"늘 지겨운 일상에서 떠나고 싶어하면서 ‘노바디‘는 또 되기 싫은 ‘썸바디‘의 한가한 신세 타령. 인용은 지겨웠고 자화자찬은 민망했으며 합리화에 가까운 과도한 의미부여에 적응이 힘들었다. 여행은 결국 자기 뒤통수를 돌아보는 것이라는, 그 뻔한 얘기를 이토록 길게 할 수 있다니."
9788954655972,6,"여행의 목정에 대해 다시 생각해보는 책. 저자의 배경지식에 감탄, 생각과 사고방식이 나랑은 확실히 다르다."
9788954655972,10,여행을 하고싶게 만듬
9788954655972,10,아주 재미있게 읽었어요!  내가 왜 여행을 좋아하는지 정리해주셨어요~^^
9788954655972,8,"여행의 시작은 삐끗했지만, 곧나의 패배로 이어지는 건 아니다. 뜻하지 않았던 좌절을 겪으며 새로운 기회를 얻기도 하니까."
9788954655972,10,"첫번째 글을 읽고 역시 작가는 글로 말하는 사람이구나 싶다. 내가 왜 여행을 좋아하는지, 이 책을 통해 좀더 명료하게 인식할 수 있었다."
9788954655972,10,"읽으면서 너무 공감되는 부분이 많았어요, 상처가 깃든 곳으로부터의 탈출구가 여행이라는 구절에 많이 공감되었고, 공항에만 가도 기분이 좋았던 제 모습을 돌이켜보게 되었습니다. 여행을 하면서 현재를 살았던 제가 그리워지네요, 현재를 살러 가야겠습니다"
9788954655972,10,요즘 여행은 먹고 찍고 자는곳에 치중하지만여기서의 여행은 새로움의 여행이다.그 곳에 전해지는 이야기들에 집중하게 해서좋았다.
9788954655972,10,나에게 인생 책이 된 김영하 작가의 여행의 이유
9788954655972,10,여행에 관한 작가의 에피소드와 박학다식을기분좋게 만나는 순간들즐거웠어요
9788954655972,8,좋아요
9788954655972,8,인간은 왜 여행을 꿈꾸는가. 그것은 독자가 왜 매번 새로운 소설을 찾아 읽는가와 비슷할 것이다.
9788954655972,6,그만의 여행의 이유를 들었다. 그래서 남는 것은 ‘글쎄‘그만의 이야기를 그저 늘어놓고 들은 듯한 기분. 나는 조금 다르게 생각하는데 라는 내 의견이 나오게 해줌은 감사할따름. 하지만 조금더 소통의 폭을 넓혔다면 좋지 않았을까.나도 나 나름의 여행의 이유를 찾아야겠다.
9788954655972,6,방송발 무시 못한다는거 조금 느꼈어요ㅋ 알쓸 좋아해서 믿고 샀는데 글에 집중력이많이 떨어져서 아직 다 읽지를 못했; 비슷한 시기에 구입한 소년이 온다는 당일에 다 읽었는데 말이죠
9788954655972,8,읽고나면 여행 가고싶어지는 책
9788954655972,6,"여행은 여유있는 삶에서 나오는 것이 아니라 채우기위해 필요한 듯하다. 바쁜 생활이 금전적이나 다른 영역의 모든 것에서 채우는 것이 아니라 쏟아내는 것이라 한다면 조금 벗어난 공간을 여행한다는 것만으로 떠나는 마음, 준비하는 마음이 휴식과 충전과 다시 채움으로 돌아오는 과정이 아닐까..."
9788954655972,10,에세이가 더 좋다고 생각되는 건 나만의 느낌일 뿐일까? 작가도 좋아하지 않을 수 있을 듯... 많이 공감 되고 많이 배우게 되는 글들이다.
9788954655972,10,여행 가서 읽으려고 샀습니다. 처음 몇 장을 깔깔거리며 읽고 이 책과 김영하 작가에게 완전히 반해버렸어요. ㅎㅎ 이런 저런 이유로 독서와 멀어졌는데 다시 책을 손에 잡게 해주네요!
9788954655972,8,이렇게 좋아하는 뭔가가 나에게도 있을까?
9788954655972,10,"책 좋습니다.작가의 사유의 깊이도 느껴집니다. 맞아 나도 이런 생각했는데! 생각은 했지만 표현하지 못했던 감정을 손에 쥐게 해주는게 작가의 역량이라고 생각합니다. 요새는 해외여행 과잉기인가 싶습니다. 해외에 에너지를 쏟기보다, 어디를 가든 여행의 이유에 에너지를 집중할 수 있게해줄책"
9788954655972,10,김영하 작가의 글을 읽으면 즐겁다. 여행의 이유를 읽는 동안 함께 자주 여행을 했었던 오랜 친구들과 여행을 다녀오기도 했다.8월 가족 독서토론 선정도서.
9788954655972,8,깊은 에세이다. 여행  추천지 따위는 없다. 정말 제목 그대로 ‘왜 여행을 하는가?‘ 에 대한 고찰과 사색이다. 저자의 개인경험도 많이 드러낸 것으로 보아 저자도 이책에 애착이 있어보인다. 경험을 통해 (철학적) 사유에까지 이른 과정이 정말 잘 쓰여져있다. 모두에게 추천!
9788954655972,8,여행가기 좋은책
9788954655972,10,굿
9788954655972,8,"여행을 하는 이유는 무엇일까? 자신을 돌아보기, 힐링, 다른 문화에의 동경? 그 이유는 다양하겠지만 내가 이 책에서 찾은 이유는 나를 힘들게 하는 그 모든것으로부터 멀어지는것이다. 뭔가 나를 지치고 힘들게하는 일들이 생길때 새로운 환경과 경험들이 오롯이 나 자신을 느낄수 있게 해준다."
9788954655972,10,결코 술술 읽을 수 없는... 독서대 펴 놓고 천천히 정독 할 수밖에 없다.
9788954655972,2,내용이 중구난방인거같아요... 작가님이 뭘 말할려는지도 잘 모르겠구요
9788954655972,10,근래 읽은 최고의 한국어 텍스트였다.
9788954655972,10,나에게 여행의 이유는 비즈니스였는데 이제는 나를 찾는 여행의 이유를 만들고 싶다.
9788954655972,8,여행을 통해 실질적으로 얻어지는 것은 너무나 많다.나 자신을 객관화 시켜서 넓게 바라볼 수 있는 능력도 모두 여행을 통해서라고 할수있다. 여행이란 궂이 직접 뛰는 여행만이 진정한 여행일까? 누군가 그랬듯이 ˝독서는 앉아서 하는 여행이다.그리고 여행은 서서하는 독서이다.
9788954655972,2,정말 재미없어요  사지마세요
9788954655972,10,좋아하는 류의 에세이. 여행 에세이지만 여행 에세이 같지 않은.
9788954655972,10,읽고 싶다!
9788954655972,10,"여행의 이유를, 여행의 의의를 알게 됐습니다. 첫 에피소드 강렬했구요, 아래 다른 분 말씀처럼, 작가의 말, 슬펐습니다."
9788954655972,10,완벽하지 않은것이 완벽한 것이다꼭 무언가를 얻으려 하지 말고 하다보면 얻어지는 것이 있다
9788954655972,10,"책이 작고, 그리 두껍지 않고, 가벼워 보였지만, 정말 즐거운 독서였다. 좋은 책이다. 써주신 작가님께 감사드린다."
9788954655972,6,서른여섯번째 책. 코타키나발루 가는 길에 읽으려고 산 책. 산문? 이어서 쉽게 읽혔다. 김영하가 느끼는 여행에 대해서 쓴 책? 인데 공감운 막 음.... 그냥 그렇구나 하고 넘어간듯 ㅎㅎㅎ
9788954655972,10,김영하작가에게 썩 호감이 있진않는데 글이나 말투는 너무맘에든다 여행기같지않은 여행기
9788954655972,2,"음, 잘모르겠다. 재미도 없고 감동도 없고 남는 것도 없던 책."
9788954655972,2,"다 주관적이긴한데, 별갯수 많은건 서포터즈나 협찬인건가요.. 아님 읽기는 한건가요.맥락도없고, 무슨말을 하는지 도통 알수도 없고, 어떤 단락은 문맥도 맞지않아서 이건 대필작가가 있나 싶을 정도입니다."
9788954655972,6,여행가고 싶어지네
9788954655972,2,베스트셀러 작가가 되려면 먼저 TV에 나와 얼굴을 알려야한다.
9788954655972,10,손에 들고 가볍게 읽을 수 있는 책 재질이 맘이 들었어요. 공감한 부분도 있고 내가 미처 깨닫지 못했던 부분들도 생각하게 해주는 무겁지 않은 글. 좋았습니다.
9788954655972,10,친구가 표지보고 ˝요즘엔 저런 표지가 유행인가봐.˝라고 하길래 김영하 작가가 직접 그린 거라 알려줬더니 ˝저런...˝이라고 했어요.
9788954655972,10,소설가 김영하의 산문은 어떨까하는 생각으로 예약구매했던 책입니다. 여행은 흔하게 인생의 메타포로 사용되지만 김영하 작가님 만의 경험이 녹아들어 풀어낸 문장들은 역시 일품입니다.
9788954655972,8,며칠전 서점에서 샀는데 바캉스에디션이 나오다니..글이 짧아요 그점도 아쉬움.김영하 작가님 새소설 기다리고 있습니다
9788954655972,4,"기대를 해서일까? 내가 원한 ‘여행‘이란 테마의 글이 아니었다. 쉽게 읽히고 편하게 볼 수 있는, ‘여행‘ 그 자체에 집중해서 ‘여행‘과 관련한 작가의 에피소드나 그가 바라보는 방식의 여행지를 알고 싶었다. 아니었다. 생각보다 무거웠고, 글쓰기 관련 수업을 받는 느낌도 들었다. 아쉽다."
9788954655972,10,"김영하님의 소설은 독특한데 반해 에세이가 특히 마음에 듭니다. 말과 글 모두 대단하신 작가님. 요즘 베셀 작가들과는 비교할 수 없는, 사유가 있는 김영하님의 글을 좋아합니다."
9788954655972,8,여행은 일상의 부재라는 걸 다시 깨닫게 해 주는 책.
9788954655972,8,여행세포를 깨워주는 책작가의 글을 읽으면서나도 나만의 여행을 해야겠다는 생각이 들었습니다.
9788954655972,8,좀 짧은 듯 하지만 재미있다. 거기에 생각할 거리도 던져준다. 이 정도면 돈 값은 충분히 하는 것 같다.
9788954655972,10,환대 그리고 신뢰..여행 뿐만 아니라 인생에서도 중요하지요
9788954655972,6,알쓸신잡에서 묵직하게 울리던 그의 말에 비하면 이번 여행 에세이는 개인적으로 별로였습니다.근간에 읽은 김민철 작가의 <모든 요일의 여행>이 더 깊은 향기를 남기더군요.(개인적 취향입니다만)처음에 나온 책 표지는 시즌에 맞게 바캉스 에디션으로 바뀐 것 같은데..글쎄요...물론 김영하 작가를 좋아하는 편이지만 그의 글은 이번에 처음 읽었기에 그만큼 기대가 큰 탓도 있습니다.
9791190710169,10,코로나로 인해서 여행을 가지 못하고 있는 나에게 오랜만에 여행다녀온 듯한 느낌을 받아서좋았던 책이다. 빨리 코로나 끝나서 책 제목처럼 다시 여행을 가고 싶다.
9791190710169,10,사진이 정말 좋아요! 여행이 다시 시작될 그날을 기다리며 보고 또 보게 될 것 같아요 :)
9791190710169,10,‘언젠가는‘ 포기가 아니라 목표이고 희망이죠일단여행을 떠나기 위한 티켓을 준비하세요다시 여행을 떠나겠습니다가 목표점까지 안전하게 모십니다
9791188331918,10,"이건 사진전이자.. 작가의 감성과 에피소드, 삶의 연륜이 묻어나는 책입니다. 버킷리스트, 사랑, 행복, 자유 등으로 정말 현대인들에게 필요한 키워드로 집필했습니다. 유럽 여행을 한 번도 가보지 못한 제게는 유럽 여행을 가는 것 같았고로망이던 영국도 볼 수 있어 위로가 되었습니다."
9791188331918,10,한편의 작품집같은 여행 에세이사진들이 참 좋았고 마음속에 쉼표를 찍어가는 기분이 들 정도로 울림있는 문장들로 가득했습니다힐링하면서 꿈도 꾸게되는 멋진 책!
9791158161248,10,어떤 책은 마치 내가 쓴 듯한 문장을 보여 준다. 인생의 한 순간에 분명하게 느낀 감정인데 미처 표현 못했거나 일기에 쓰고 나선 한참 잊고 지내던 기억을 단숨에 소환하는 문장. 이 책이 그랬다.
9791158161248,6,예전 책 너무 좋아해서 설레며 예약했는데기대가 너무 컸던 걸까요... :(
9791158161248,6,"내가 김소연을 사랑했던 건 오래 전 그녀가 쓴 길지도 짧지도 않은 어떤 글 때문이었다. 이후 그녀의 몇몇 산문선은 눈부시도록 좋았고, 그 기대감에 이번 책도 샀는데 기대가 너무 컸던 모양이다. 글이 너무 적고 사진으로 가득한, 휘발되는 문장들이 다소 밋밋하게 느껴졌다."
9791158161248,10,기대돼요♡
9791158161248,10,김소연 시인 너무 좋아합니다. 얼른 읽어보고 싶어요!!!
9791158161248,10,기다리는 작품입니다!  빨리 받아보고 싶어요.
9788993928488,2,"의식의 흐름대로 써내려간것 같은 책이다. 논리의 비약과 감정의 서사가 너무 주관적이라 전혀 공감되지 않는다. 그저 계속 오그라들기만 할 뿐. 결국 시간이 아까워서 다 읽지 못했다. 이 책에서 제일 좋았던 부분은, 표지다."
9788993928488,10,소중한 사람에게 받은책이라 한페이지 한글자가 소중했다
9788993928488,8,"나라면 찍지 않았을 사진들, 나라면 무심코 지우고 말았을 사진들이었다.그의 사진에는 감정이 있다. 사랑이 하고 싶어졌다."
9788993928488,2,생일 기념으로 표지에 낚여 구매.여행 사진집 중 이렇게 무미건조한 느낌의 책은 처음인 듯.아직까지 내 책장에 있으나 곧 팔거나 정리할 책.
9788993928488,6,중간중간 이해가 어려운(필자의 지나친 독백) 부분도 있었지만 진짜 감탄사가 나오는 멋진 문장도 있었다.사진과 글귀의 조화사 멋진 책이였다.그리고 이 작가에 대해서 관심입문한 책이랄까.
9788993928488,10,짧은 독서시간동안 작가와 함께 여행을 다녀온 기분.가을에 읽기 좋은 책
9788993928488,8,책을 읽으며 처음으로 삿포로로 떠나고 싶다는 생각이 들었다. 이병률의 문체는 바람을 쐬고 온 듯 숨통을 트이게 하는 매력이 있다.
9788993928488,10,글 사진...마음의 안정과 평온함을 주는...
9788993928488,10,글이 이쁘고 사진으로 채워진 여백도 이쁘네요.
9788993928488,4,내가 나이가 든건가. 내 감정이 마른건가.기대에 못 미쳤다 이번엔
9788993928488,10,반신욕할 때...은행에서 대기할 때... 엘레베이터 기다릴 때... 식당에서 주문 음식 기다릴 때... 차 안에서 누군가를 기다릴 때...일상의 틈에서 읽으면 더 와 닿는 책!!!역시 이병률 작가님!!!
9788993928488,6,훌쩍 떠나 여행하고 싶게끔 만든 책-
9788993928488,10,문체가 너무너무 예쁨ㅠㅠㅠ
9788993928488,2,책이 별로다당신이 밉다
9788993928488,10,몇 번을 읽어도 허한 마음을 채워주는
9788993928488,8,밑줄치고 싶은 문장이 너무 많아서책이 노랗게 바랬다
9788993928488,6,끌림보다는 별로
9788993928488,10,"이병률 작가님 너무 좋아요!! 개인적으로 ｀끌림｀보다 살짝 더 끌리는 책이예요. 글도 좋고, 사진 또한 너무 좋아요~"
9788993928488,6,여행가고 싶어진다..
9788993928488,8,｀끌림｀때부터 이미 좋아하게 된 이병률 작가님의 책. 감성이 담긴사진과 평범하지만 안평범한 글들. 언제나 추천하는 책 중에 하나!
9788993928488,10,여유없이 달려온 요즘 잠시 멈춰 나를 바라볼수 있는 책
9788993928488,10,여행책을 좋아하지 않는 편입니다. 여행책은 왠지 풋내기 작가의 허세가 들어있는 경우가 많아서요. 하지만 이 책은 아니었습니다. 제목처럼 담담합니다. 오랜시간 회자되는 이유가 있구나 하는 책입니다.
9788993928488,10,느낌이 참 좋았던 책
9788993928488,8,어느덧 독자는 저자의 감정을 여행하게 된다
9788993928488,10,이 책 읽고 생애 첫 혼자가는 여행 티켓을 바로 끊었으니 말다했다. 감성적으로도 포근하지만 삶을 보는 지혜로운 눈이 함께 담겨있어서 더욱 좋다.
9788993928488,10,여행을 좋아하는 사람이라면 이 책은 다 읽어보지 않았을까?
9788993928488,10,제목만으로도 끌린 책. 글 하나하나가 맘에 와닿는다.
9788993928488,8,여행에세이의 기본
9788993928488,10,이 책을 읽은 후 내 마음에도 바람이 불던 순간을 기억한다.
9788993928488,8,가장인상깊고 아직까지기억에남는다.
9788993928488,10,여행서가 시집이 될 수도 있구나 싶었던 책
9788993928488,10,엄살부리지 않아 좋다
9788993928488,10,"사진과 이병률의 감성이 아름답다,
다른 여행에세이들과는 다른 여행을 일상처럼, 보내는 그에게 반했다"
9788993928488,8,"말랑한 책이다. 마음 편하게 읽을 수 있고, 읽고 나면 어디론가 훌쩍 떠나고 싶어지는 힘을 가지고 있다."
9788993928488,8,느리게 살고싶다..
9788993928488,10,떠나자
9788993928488,10,여행을 다녀오고 바로 읽었던 책이라 더 마음에 와 닿았던 책.. 중간 중간 가슴을 내려앉게 만드는 문구들이 있다
9788993928488,8,여행에 대한 아득한 그리움을 안겨주는 책
