ISBN13,rating,review
9791187316589,10,"교토에 대한 볼거리, 먹을거리,  즐길거리가 많고, 여행지에 대한 설명도 이해하기 쉽게 잘 되어있어서 여행가도 큰 무리는 없을거 같아요내용도 잘 정리되었고 여행갈때 가져가도 될거같네요"
9791187316589,10,"일본의 교토는 정말 가보고 싶은 곳인데, 이렇게 저자분의 교토에서 한 달 살기 여행기로 작성된 도서를 읽게되어서 정말 좋았다. 다도체험이라던지, 신사구경, 카페방문등은 정말 가보고싶은 공간이었다. 아직 교토는 가보지 못했지만, 이 책을 통해 저자의 생각에 무척 공감이 되었으며, 재밌었다."
9791187316589,10,이 책 한 달의 교토는 경험을 엮은 에세이 면서 여행 가이드북이기도 하고한편의 서정적인 소설처럼 잔잔한 이야기책이기도 한 느낌이다.사진마다 교토 특유의 여유로움과 잔잔함이 담겨있어 좋았다
9791187316589,10,일단 주제부터 마음에 들었어요! 꿈꾸는 디지털노마드 번역가의 삶과 교토에서의 한달살기라니ㅠ 마치 여행일기를 훔쳐보는 것처럼 같이 여행하는 기분도 들고 표지부터 내용까지 읽으면서 넘나 설레입니다ㅋㅋ빡세게 여행다니는 게 아니라 체험도하고 자연도 즐기는 모습에 저도 읽는 내내 힐링됐어요
9791187316589,10,"교토에 자유여행을 다녀온 적이 있어서 더욱 관심이 가는 책이다. 여행을 하면서 인물이나 건축물, 역사에 관해 좀더 잘 알고 왔더라면 하는 아쉬움을 느꼈기에 다시 만날 교토 이야기가 기대된다. 더불어 한 달 살기와 디지털 노마드 번역가란 직업에 대한 매력, 장점도 알 수 있겠지~"
9791187316589,10,교토 한번쯤 가보고 싶던 곳이었는데 이렇게 책으로나마 경험할 수 있어서 좋네요. 관광지의 역사나 가볼만한 곳들을 알려주어서 좋아요. 번역일을 하시는 저자의 이야기들을 통해 프리랜서 번역가에 대해서도 알수 있습니다. 여행시에 많은 도움이 될만한 이야기도 많아요.
9791187316589,8,"교토의 정갈함을 글과 사진으로써 느낄 수 있는 책, 그리고 표지가 핑크핑크하고 예쁜 게 마음에 드는 책, 카페에 가서 커피를 마시며 책으로써 교토를 느낄 수 있는 책"
9791187316589,10,역사를 좋아해서 관광지와 관련된 일본 전국시대 이야기 등이 흥미로웠다. 단순 에세이라고 생각했는데 관광 정보가 잘 정리되어 있어서 여행서로도 손색없음. 교토 역사 기행을 가보고 싶다는 충동을 일으킨 책!
9791187316589,10,<한 달의 교토>는 교토에서 한 달 살기라는 나의 새로운 꿈 하나를 선물해 주었다. 교토의 봄의 벚꽃내음이 내가 앉아있는 책상에 솔솔 불어오는 듯 했다.
9791187316589,10,"추운 겨울에 읽으니 교토에서의 봄이 더욱 아름답게 느껴지는 것 같아요. 작가님 블로그에서 하루 하루 올라오던 여행기도 재밌게 읽었는데 책으로 모아서 읽으니 더 좋네요! 글 읽는 내내 힐링받는 느낌,,, 오랜만에 재밌게 잘 읽었어요"
9791187316589,10,"날짜별로 되어 있어 아껴 읽으려고 했는데 너무 재미있어서 앉은 자리에서 다 읽어버림. 실제 교토 여행시에도 도움이 될 내용이 많고 디지털 노마드 프리랜서 번역가의 일상과 교토 관광이야기가 절묘하게 잘 어울린다. 재미와 실용, 간접 여행 기분에 예쁜 표지까지 대만족^^"
9791190257169,10,"동네 목욕탕부터 대형 스파까지라는 부제로 호주에 유명한 라디오 진행자인 스티브 와이드와 미쉘 매킨토시가 외국인의 눈으로 바라본 일본 온천의 모습을 아름답게 느낄 수가 있겠습니다. 일본을 좋아한다면, 온천을 좋아한다면 꼭 이 책을 보시길 적극 추천 드리겠습니다! 일본 온천 순례 좋아요~"
9791157113972,10,일본에 대한 소소한 이야기 입니다.
9791196703905,10,사진도 예쁘고 뉴이스트의 마음이 담긴 거 같아요. 추억을 공유하는 느낌이라 너무 좋아요.
9791196703905,10,개인적으로 뉴이스트의 팬이라서 구매하게 되었습니다.
9791195592388,10,"올여름 교토를 가지 못해서, 또 한 번 이 책을 읽었다. 내가 살았던 곳의 바로 옆 동네에 저자가 머물며 쓴 이야기들인데, 너무 익숙한 풍경들의 이야기가 반갑다."
9791195592388,10,"여행 에세이라 하면 혹해서 보고 싶은 마음과 또 뻔하지 않을까 하는 마음이 공존한다. 이 책은 오롯이 아, 여행 가고 싶다... 아니 여행 잘 다녀왔다 하는 기분을 안겨주었다. 해변에서 랄랄라도 이 작가님도 처음인데, 조만간 다른 여행 에세이도 사게 될 것 같다."
9791195592388,10,"교토 여행을 앞두고 워밍업 차원에서 구입했는데, 교토 가는 날이 빨리 돌아오기만 바라고 있다. 계획했던 곳들 이외에 책에 나온 장소들도 추가했다. 여행서 따로 구매 안 해도 될 듯 하다."
9791195592388,10,"책을 두고 이런 말 하긴 좀, 그렇지만 책값이 아깝지 않은 책. 좋은 글이다."
9791195592388,10,평소에 여행서를 즐겨보지는 않지만 해변에서 랄랄라의 책은 신간이 나올때마다 들여다 보게 된다. 출판사의 이름답게 책을 보고 있자면 나도 모르게 입가에 미소가 랄랄라 나올것 같기 때문이다. 뭔가  나 어릴때
9791195592388,10,늘 기대되는 <해변에서 랄랄라>의 책들.
9791190065016,10,작가가 따뜻한 시선으로 바라본 여행지와 사람들 이야기도 좋고 작가가 자신의 생각을 풀어낸 부분도 좋았다.(후자는 기대하지 못했던 부분이기도 하다) 필력이 상당하다. 특히 카페 에리카 편은 모범적인 영화 감상기 및 탐방기가 아닐지. 뒷맛이 매우 깔끔하고 책의 밀도도 높다.
9791190065016,8,재밌다. 글 잘쓴다
9791190065016,8,"도쿄에 가고 싶어지는 책이었습니다. 이런 곳은 꼭 가보고 싶다고 생각한 곳이 대부분 문을 닫거나, 잠시 휴업중이라 아쉬웠습니다.잔잔한 일요일 오후 3시에 보는 걸어서 세계속으로 같은 느낌이라 가끔 여유가 필요할 때 읽었습니다."
9791190065016,10,도쿄여행을 좋아하는 나에게 아직 도쿄는 흥미로운 제목인 동시에 도쿄여행이 하고 싶은 나에게 너무 끌리는 제목이었다책을 받은 순간 너무 가벼워좋았고 사진과 흡사한 그림은 너무나 빠져들게했고 구글앱으로 하나하나 장소를 찾아보며 빠져들었다
9791160402438,4,"이런 글도 책으로 만들어주니 좋은 세상이다. 본론 이전에 서론이 너무 길고 그조차 본론에 이어지지 않는 경우가 태반이다. 그리고 작가의 시선과 고찰이라고 해야하나 거의 중3,고1정도다."
9791160402438,4,이다혜라는 이름을 지웠으면 책이 주목받지 못했을듯. 방송에서 뜨면서 요즘 너무 다작하시는듯.
9791160402438,2,이 시국에? 방사능을?
9791160402438,4,"이다혜 기자의 글 정말 좋아했습니다. 특히 ebs ‘요즘 뭐 읽어?‘ 코너를 듣고 책을 선택하는 좋은 정보를 얻게 되어서, 이 책에 대해서 기대하며 읽었는데, 좀 실망스럽습니다. 우선 편집이 너무 듬성듬성해서 기대가 떨어지게 됩니다. 치밀하고 타이트한 구성을 바랬는데, 아쉬워요."
9791160402438,10,오랜만에 보는 글맛이 살아 있는 에세이에요!
9791160402438,10,론리플래닛 같은 여행책이 아닌 편하게 잘 읽히는 여행에세이를 생각하면 좋을 듯!
9791160402438,2,제목 낚시. ‘밤 산책자‘라고 제목을 붙인 이유를 모르겠다. 그냥 뻔한 교토 여행책.해상도 깨지는 사진을 큼직하게 두 페이지로 넣거나 딱히 특별하지도 않은 사진을 한 페이지씩 넣었다. 너무 화나는 책.
9791160402438,10,편하게 읽히고 장소에 얽힌 각각의 에피소드가 재밌습니다.
9791160402438,4,음 잘 읽히는 에세이 느낌이고 특별히 숨겨진 장소가 소개되는건 아니에요 그리고 삽입된 사진 퀄리티가 정말 놀라운 저화질에 해당 장소인지 아닌지도 모를 대표성 없는 사진이에요 싸이월드 사진첩인줄 알았네요 그냥 표지만 예쁜 책
9791160402438,10,예정에 없던 휴가를 내게 만든 책이라니! 보물지도를 손에 얻은 기분이에요
9791160402438,10,남이 쓴 여행기는 거의 읽지 않는다. 읽고 나면 부럽기 때문이다. 그런데 이 책에서 저자가 교토를 바라보는 시선을 따라가다 보면 읽는 것만으로도 여행하는 기분이 든다.
9791160402438,10,"설렘 가득한 여행 책이자 교토 에세이. 마음까지 화사해지는 예쁜 책이구나 싶었는데, 알짜 정보와 다정한 감상까지 있으니... 더할 나위 없는 책인 듯!"
9791160402438,10,곧 교토 갈 생각인데 가지고 가야겠... 책 너무 이쁨
9791160402438,10,한 장 한 장 글에서 교토의 사계절이 느껴져요~
9791160402438,2,1만5천원 짜리 싸지 않은 여행 화보집인데 사진이 너무너무 아쉽다. 종이질의 문제인지 출판사 문제인지 아니면 인쇄의 문제인지 사진이 일간신문에 나오는 사진의 질에도 훨씬 못 미치는 상황. 환불하고 싶다. 서진이 엉망이라 글도 눈에 안 들어옴.
9791160402438,10,교토 여행 준비중이어서 구입했는데 단숨에 읽었어요. 처음가는 교토지만 자신있게 갈수 있을만큼 작가님의 안내와 글이 너무 좋았습니다. 특히 여행서에 없는 내용들이 너무 알찼어요 ㅎㅎㅎ
9791160402438,10,"오늘 정말 우울한 날이었는데 이 책에서 벚꽃 사진을 보고, 이다혜 작가님 특유의 유머에 깔깔거리고 기분이 확~ 좋아졌어요. 교토를 가보지 못 했는데 대리만족한 기분입니다.^^ 작가님이 오늘 저를 구원하신듯요!"
9791160402438,10,이다혜님 글이야 믿고 보는거구요 전자책 좀 빠릿빠릿하게 내주세요 ㅜㅜㅜㅜㅜㅜㅜㅜㅜㅜㅜㅜㅜㅜ
9791196011635,10,극찬하고 싶은 책입니다. 저는 지금 이 책을 읽으며 재미와 다양하게 사로잡힌 생각에 혼란스럽습니다. 일본행 비행기 티켓도 찾고있는 저를 발견합니다.
9791187795759,10,일정 코스를 정해주어서 계획을 구성하는데 편함.
9791188073337,10,"마구로센세 시리즈는 만화 형식이라서 재미있기도 하고, 설명이 자세해서 직접 가본 듯한 기분이 듭니다. 다음 시리즈도 기대합니다."
9791188073337,10,"오키나와! 한번 가보고 싶은 섬입니다.마구로센세! 재미있는 기획이라, 오키나와도 기대됩니다. ^^"
9791188073337,10,마구로 센세~ 오키나와 눈에 쏙들어오는 구성 꼭 보고싶네여!!
9791188073337,10,마구로 센세 시리즈 책은 어려울거 같은 타국의 언어나 정보를 만화로 쉽게 설명해주고 있어서 참 좋은 책입니다. 오키나와의 특성을 어떻게 잘 담았는지 기대가 되네요~
9791188073337,10,마구로센세와 함께 오키나와로 갑시다  어렵지않아요
9791188073337,10,오키나와 여행 시 알고 가면 좋을 남다른 꿀팁이 너무너무 궁금해요. 오키나와에 가고 싶어 하는 저와 같은 사람들에게 귀여운 캐릭터들이 여행의 묘미를 더해줄 것 같아요! 두 캐릭터의 파란만장한 오키나와 여행기가 궁금합니다^^
9791188073337,10,나올 것이 나왔군요!! 오키나와 편도 어떤 꿀팁과 정보가 가득할지 기대됩니다 :-)
9791188073337,10,마구로 센서 믿고 봅니다:) 이 책들고 오키나와 떠나겠습니다!
9791188073337,10,3월에 가족 여행 계획중이에요~ 한번도 안가봤는데 도와줘요 마구로센세~!
9791188073337,10,일본 최고의 휴양지 오키나와에서 마구로 센세와 힐링할 수 있을 것 같습니다!
9791188073337,10,"여러 가지 이유가 있겠지만 휠체어 이용하는 딸램이 가장 좋아하는 나라가 일본입니다. 늘 오사카와 도쿄 대도시로만 여행 다녔는데 올해는 일본 다른 곳 오키나와를 가고 싶다고 합니다. 마구로센세 편의점과 메뉴판 시리즈 두 권 모두 있는데, 신간이 나왔군요. 마구로 센세 캐릭터도 너무 좋아요!"
9791188073337,10,한번쯤 꿈꾸는 오키나와여행 이책 한권들고 다녀오겠습니다!
9791188073337,10,친절하고 자세하고 쉽게 가르쳐 주는 마구로센세가 이번에는 오키나와 편이네요 꼭 읽고 싶어요
9791188073337,10,"얼마전에 다녀온 오키나와, 아직 못가본 곳, 못 먹은 음식들은 마구로센세와 함께 할래요-w"
9791188073337,10,일본에서 가장 일본답지 않은 곳이라 가봐야겠다는 생각이 가득하던 차에 참고하기 좋은 책이 나온것같아 좋습니다. 숨겨진 오키나와의 명소들이 궁금하네요!
9791188073337,10,마구로센세 시리즈부담없이 책장넘기며 볼수있는 책이죠믿고 보는 책입니다
9791188073337,10,오사카 와카야마편을 재밌게 잘 봤어서 이번 오키나와편도 되게 기대가 크네요. 태풍이라는 변수 속에서 마구로센세의 오키나와 여행은 순탄하게 잘 흘러갔을지 정말 궁금합니다!
9791188073337,10,오키나와 곧 갈 예정인데 미리 알고 가면 너무 재밌을 것 같아요정말 너무너무 기대됩니다 !!
9791188073337,10,몇년전 겨울 따뜻한 남쪽나라가 궁금해서 다녀온 오키나와... 계획도 준비도 없이 떠난 여행이라 다녀온 뒤 아쉬움만 남았었다. 이젠 제대로 준비해서 많은 것들을 느끼고 싶다. 이 책이 도움될 것 같다.
9791188073337,10,"오키나와는 여러번 가 봤는데, 마구로 센세는 어떻게 여행을 했을지 기대가 됩니다."
9791188073337,10,오키나와의 끝없는 매력에 빠져들 준비 완료입니다.
9791188073337,10,믿고 사는 마구로 시리즈!!! 오사카에 이어 오키나와도 바로 get! 라는걸로 ^^
9791188073337,10,오키나와는 누구에게나 OK라서 오키나와...겠죠? 오키나와를 꿈꾸는 여행자를 위한 지침서<마구로센세가 갑니다 2편 : 오키나와>! 제가 한번 읽어보겠습니다.
9791188073337,10,오키나와 여행은 계획만 해봤지 갈 생각은 해보지 않았는데한적하고 여유로운 여행이 가능하다고 해서 와이프와 함께 다녀올 생각입니다.오키나와에 대한 책이 많진 않은 듯한데 여행가기 전에 읽어보면 상당히 재밌을 듯합니다.
9791196429942,4,인생맛집이 아니라 그냥 유명한 곳이라 가도 기본 1~3시간은 대기해야 하는곳을 굳이 왜 책으로 만들어서 알려주는 건지 잘 모르겠어요. 참신하지도 않고요. 오사카 여행갈때 보려고 샀는데 도움이 안되었어요. ㅠㅠ
9791196429942,10,한국사람들에게 유명한 집이 아니더라도 정말 맛있는 집을 찾아가고 싶었는데 이런 책이 나와서 너무나 기뻐요! 타베로그로 찾아보는 것도 힘들었는데 책 참고해서 다음 여행엔 더 다양하고 맛있는 음식 먹어보고 싶네요 :)
9791196429942,8,엄마랑 1월에 간사이 여행을 가는데 좋은 참고가 될것같습니다♡
9791196429942,10,오사카는 음식때문에 가끔 여행이 생각나는거 같아요..그만큼 맛의도시 오사카여행인데가깝고 접근성 좋은 해외여행지라 그런지 인터넷에도 맛집 정보들이 난무해서 단순히 홍보들인건지 진짜인지 어딜가야할지 모르겠더라고요. 현지인맛집 추천도서인 황작가님 인생맛집 참고해봐야겠어요!
9791196429942,10,이런 감동의 책이~ 있다는것에 놀라고오사카의 맛나는 맛집을 찾아 맛을 보아 놀랐습니다.
9791196429942,10,오사카에 여러번 갔지만~아직도 저는 관광객들만 바글바글한 맛집 가서~ 줄서다 지칩니다. 이제부턴 똑소리나는 현지 맛집만 가렵니다!! 겨울에 같이 갈 지인들께 팍팍 티나게 맛집 자랑해보려고요~~☆ 저도 이제 맛집 고수가 되는거겠죠? ^^
9791196429942,10,저번 여행 때 이분 각종 후기 보고 맛집 잘 찾아다녔는데 진짜 반갑네요! 완전 기대됩니다^^
9791196429942,10,인생맛집~! 궁금하네요~~ 책들고 다니면서 하나씩 먹어보고 싶어요.
9791196429942,10,곧 오사카로 여행을 가 맛집들을 이곳저곳 찾다가 알게되었습니다!! 좋은 정보들에 직접 평가까지 남길수 있다니 더욱 기대가 되네요^^ 대박나세여!
9791196429942,10,오사카 하면 역시 먹방~! 꿀정보가득한 책 너무 좋네요
9791196429942,10,여행에서 중요한게 또 먹거리인데 대표 블로거인 황작가님이 소개해주시는 맛집이라니 너무 기대되네요! 일본어 1도 모르는 저 같은 여행자에게 꼭 필요한 간단한 회화까지 너무 좋습니다^^
9791196429942,10,여행의 백미는 현지인들이 가는 숨은 맛집 찾는 것입니다.많은 도움이 될 수 있을것 같습니다.
9791196429942,10,이 책한권 들고 오사카 먹방 투어 가겠습니다!
9791196429942,10,여행에 있어 내가 무엇을 먹을까 고민은 미리 해결을 하는 게.좋은 서적이 될 것 같습니다.
9791196429942,10,늘 여행을 갈 때면 이것저것 검색해보는데도 실패하는 맛집들이나 못 가본 맛집들이 나와서 속상한데ㅠㅠ 조금 더 안정적으로 맛집을 공략하는데 도움이 될 것 같습니다^^
9791196429942,10,"오사카에 맛집이 많다고는 하지만, 정보가 부족해서 관광객들 몰려가는 그런 곳이나 프랜차이즈 위주로만 다녀오곤 했습니다. 진정한 오사카 맛집 탐방을 위한 솔직한 정보, 기대해봅니다."
9791196429942,10,황작가가 꼽은 인생맛집에 한번 가보고 싶네요!
9791196429942,10,오사카 한 열번은 갔는데 아직 맛보지 못한 곳이 새로운 곳이 남아 있다니 다시 갈 이유가 생겼네요...기대됩니다^^
9791196429942,10,오사카에 가면 매번 블로그 검색해서 가거나 아니면 가장 유명하다고 소문난 곳 위주로 가다보니 생각보다 맛집이 아닌 경우가 많더라구요 이책을 통해서 정말 맛있는 오사카 음식을 먹고 올 수 있을꺼란 기대가 되네요 여행에서 먹는 즐거움이 진짜 큰데 많은 도움이 될 것 같습니다!!
9791196429942,10,여행가서 정말... 어디가 맛있는지 몰라서 들어갔다가 낭패를 본 기억이.... 여행시 도움이 될 것 같은 좋은 책이네요!
9791196429942,10,"올해 8월에 오사카를 다녀왔었고, 이번 겨울에 재방문할 예정입니다. 8월이 한여름이라 가까운곳만 찾아서 먹었었는데, 좀 더 여유롭게 제대로 된 맛집을 찾아다녔으면 하는 아쉬음이 남습니다ㅠㅠ.. 이 책이 있다면 그런 고민을 조금이나마 덜지 않을까 생각합니다 ㅎㅎ"
9791196429942,10,항상 맛집 찾아볼때 타베로그에서 한번 검색해보고 가는데 책안에 타베로그 평점도 있어 그럴필요도 없어 보이고 영수증 붙이는 곳 까지 있어 탐방하는 재미가 쏠쏠할것 같네요!
9791196429942,10,으아 맛집이라니.. 이 책으로 맛집만 돌아다녀도 오사카 여행은 충분할거 같네요. 작가분이 고생해서 찾아낸 맛집을 너무 쉽게 얻는거 같아 미안하지만 이 책 한권이면 오사카 먹방여행은 끝일듯합니다.
9791196429942,8,오사카에서 국한된 곳만 가는 편이라서 이책이 있다면 아주 효율적으로 맛집 탐방가능할 것 같네요 황작가의 센스를 믿겠습니다. ㅎㅎㅎㅎㅎㅎ
9791196429942,10,올해 4월에 고독한 미식가의 고로상처럼 일부러 골목을 다니다가 우연히 한 자루소바집에 식사를 했는데 인생 맛집이었습니다. 아직도 그 때 기억이 잊혀지지가 않네요. 오사카 곳곳에 있는 골목식당의 맛집을 이 책과 함께 찾아 떠나고 싶네요!
9791196429942,10,맛집 소개하는 여행도서라면 아무래도 음식 사진이 중요하죠. 큼지막한 사진 덕분에 눈으로 미리 맛볼 수 있으니 식당 선택에 큰 도움이 될 것 같아요.
9791196429942,10,"오사카에서 뭘 먹어야 할지 고민일 때, 이 책 한권이면 딱이겠네요!"
9791196429942,10,일본에서 먹방투어하는 걸 너무 좋아해서 이번 달에도 오사카로 떠나는데 한국에 많이 알려져서관광객들이 많이 있는 음식점 말고 오사카 현지인들이 애정하는 맛집이 많이 소개되어 있어 너무 기대되네요!
9791196429942,10,제 여행의 목적은 맛집 투어인데 오사카는 맛집의 천국이죠. 이 책과 함께면 맛집들을 놓치지 않고 다 먹어보고 올 수 있을 것 같아요 ^^
9791196429942,10,오사카 갈때마다 뭘먹어야할지 고민하고 여기저기 블로그들을 찾아보곤 하였는데요.이책 한권 들고 가면 굳이 그러지않아도될거같아요
9791196429942,10,"여행을 떠나면 가장 먼저 찾는 곳이 식당과 술집입니다. 황 작가님의 오사카 맛집이야기, 기대됩니다. ^^"
9791196429942,10,"몇박며칠로 짧게 다녀오는 것으로는 절대 오사카의 맛을 다 알 수 없다고 생각해요. 현지에서 지내면서 발굴한 보석같은 맛집, 알려주셔서 감사합니다. 해당 음식의 유래와 종류, 맛있게 먹는 방법은 물론, 간단한 회화까지 알려주셔서 ほんま、ありがたいなぁ。"
9791196429942,10,오사카 가는 한국인들 다 한번씩 가보는그런집은 절대 맛집이 아니죠그래서 이 책이 기대됩니다
9791196429942,10,숨겨진 맛집이 정말 많을것 같습니다. 기대됩니다.
9791196429942,10,항상 여행가면 걱정인 밥집 걱정이 줄어들 것 같아요.
9791196429942,10,한번가본 도쿄에서는 인생 맛집을 찾았지만 여러번 가본 오사카에서는 아직 까지도 인생 맛집을 찾지 못하였는대 황작가님 책으로 오사카에서의 인생 맛집을 찾아보고 싶네요!!
9791196429942,10,"황작가의 시선으로 바라본 진짜 일본의 맛, 기대됩니다."
9791196429942,10,"어떤방식으로 맛집을 검증하고, 어떤부분이 세세히 설명이 되어있을지 궁금해지는 책입니다"
9791196429942,10,일본을 10번 다녀왔는데 그 중 오사카만 8번을 다녀올 정도로 맛집을 사랑하는데 오사카의 맛집이 총망라 되어있다니 너무 기대됩니다.
9791196429942,10,"먹거리는 좀 포기하는 편이였는데, 한 해 한 해 나이를 먹어가니 맛난 게 먹고 싶어지더라구요. 이렇게 안전빵 가이드가 나오면 완전 땡큐죠!!"
9791196429942,10,"‘황작가‘, ‘맛칼럼니스트‘ 어느 유명한 사이비종교 수준의 지식을 전파하는 자가 떠올라 바로 끄려했으나 표지의 구석에 조그맣게 적힌 풀네임을 보니 아니군요. 식문화로 유명한 오사카의 그 수많은 가게들 중에서 ‘이런곳이 맛집이다!‘라 인지시키는 설득력이 얼마나 책에 담겨있을지 기대됩니다."
9791196429942,10,오사카는 맛집들이 너무 많은데 그걸 다 찾아가보시고 책으로 내주시니 검증된 맛집이 될꺼 같아서 너무 기대됩니다.
9791189199517,2,표지랑 옆면 너무 심하게 찢어진 책이 와서 귀찮지만 교환했습니다 ㅜㅜ 다음부터 유의바랍니다. 누가봐도 너무 심한 불량상품이네요 ㅜㅜ
9791189199517,10,와 사진만 봐도 너무 풍경이 아름답네요. 료칸 여행은 한번도 안가봤는데 이 책을 통해서 부족한 지식도 얻고 료칸 여행도 한번쯤 도전해 보는데 있어 너무나 필요한 책이네요.
9791189199517,10,일본에 여러 번 갔지만 아직 까지 료칸에서 숙박을 해본적이 없습니다.하지만 이번 11월달에 부모님을 모시고 료칸에 갈려고 찾아보고 있었습니다.그러던중 전국 곳곳의 료칸들에 대한 정보가 들어있는 이 책은 최고네요!
9791189199517,10,처음으로 일본에 가서 하룻밤을 묵었던 곳이 료칸이었는데 그때의 정말 좋았던 기억이 새록새록 떠오르게 만드는 좋은 책이에요. 일본 여행갈 때 료칸을 체험해보려고 하는 분들에게 아주 좋을 것 같네요!
9791189199517,10,일본여행 2번.. 아직 료칸에 머물러보질 못했네요. 조용하면서도 대접받는 느낌을 받을 수 있을 것 같은 료칸... 이 책에서 좋은 정보를 얻고 싶습니다~
9791189199517,10,전 맛집 투어만 해왔습니다. 이번엔 부모님을 모시고 효도여행을 갈 생각인데 료칸은 가본 적이 없어 낯설지만 이 책과 함께 가면 료칸에 대해 잘 모르던 저도 성공적인 효도여행을 할 수 있을 것 같아요^^
9791189199517,10,"유후인을 다녀왔을 때 료칸에서 좋은 기억을 가득 갖고 왔었네요. 아직 방문하고 싶은 료칸이 참 많은데요, 료칸의 매력과 료칸에 대한 궁금증이나 관심을 모두 충족시켜 줄 수 있는 책이라고 생각합니다."
