ISBN13,rating,review
9788971996942,10,신영복님의 더불어숲 개정판이 나왔네요. 책을 읽으면서 작가와 함께 세계여행을 하는 기분을 느낄 수 있을 것 같아서 너무 기대가 됩니다.
9788971996942,10,더불어 숲이 개정판으로 새롭게 나왔네요. 신영복님의 깊은 성찰을 이 책을 통해서 만날 수 있어서 정말 좋습니다.
9788971996942,10,신영복님의 더불어숲 개정판 너무기대되네요선생님의 메시지 다시한번 새길수 있어너무좋아요
9788971996942,10,더불어 숲 개정판이 나오다니 정말 기대돼요
9788971996942,10,새로운 개정판으로 돌아온 신영복 선생님의 더불어숲 소장하고 싶어지네요. 신영복 선생님은 여행을 통해서 어떤것들을 느꼈는지 궁금합니다.
9788971996942,10,신영복 선생님이 쓰신 여행기라니 벌써부터 마음이 설렙니다. 함께 떠나는 마음으로 이 책을 읽어야겠네요.
9788971996942,10,"더불어 숲, 늘 한결 같고, 또한 새롭게 다가오는 글귀들이죠."
9788971996942,10,새롭게 바뀐 더불어 숲. 기대해봅니다.
9788971996942,10,18년만에 개정판으로 출간되는 책이었네요. 기대됩니다.
9788971996942,10,신영복 선생님의 깊이 있는 여행기라 너무 좋아요
9788971996942,10,숲이 많아야 지구가 산다더군요... 기대할께요
9788971996942,10,더불어 숲이 되자는 철학아래 진정한 강함이란 무엇인지 생각해 보게 되는 책입니다.
9788971996942,10,굳이 읽었던 책을 개정판으로 다시 만나는 까닭은 세계지도는 그대로여도 우리도 세상도 다시 돌고 돌아 이렇게 흔들리고 있기 때문입니다.
9788971996942,8,나무가 나무에게 말했습니다. 우리 더불어 숲이 되어 지키자.
9788971996942,10,신영복 선생님의 새로운 이야기를 기대해봅니다.
9788971996942,10,신영복 선생님의 세상에 대한 생각들을 엿보면서 같이 생각할 수 있어서 좋아요.
9788971996942,8,읽으며 많은 생각을 하게 해주는 책입니다.
9788971996942,10,많은것을 생각하게 하고 우리가 나아가야할 길이 무엇인지 깨달았습니다.이시대의 보물인 신영복 선생님 감사합니다.
9788971996942,10,세계의 많은 역사 유적지와 역사현장을 신영복 선생님의 시각으로 듣고 볼 수 있어서 좋은 것 같습니다
9788971996942,10,신영복 선생님의 문체와 발자취를 따라 함께 하는 세계여행.
9788971996942,10,신영복 저자의 감옥으로부터의 사색을 통해서 인상깊었는데 이 책 또한 무척 관심이 가고 기대가 되네요
9788971996942,10,역사는 과거가 지나 현재가 있고 미래가 있죠..숲 이라는 말의 의미가 그 뜻인듯  하네요.직접  가보고 느낀 경험이 역사의식과 겹쳐져서 생각을 많이하게 하네요.추천합니다.
9788971996942,10,여행지를 단순히 보는 것이 아니라 과거-현재-미래를 이어서 생각해 볼 수 있게 하는 책입니다. 신영복 선생님의 눈으로 함께 여행하면서 인류의 역사에 대해 심도있게 생각해 볼 수 있을 것 같습니다.
9788971996942,10,신영복 선생님의 책이라 더 기대가 되는데요. 현재의 삶에 대해서 다시 생각해볼 수 있는 계기와 미래에 대해서도 생각해볼 수 있는 책인 것 같아요. 인류의 역사에 대해서 제대로 알고 공부하고 싶네요. 이 책 꼭 읽어봐야겠어요
9788971996942,10,신영복님의 명작. 여행지에서의 상념과 힘있는 메시지와 좋은 글들이 너무나 좋은 작품.
9788971996942,8,신영복 선생이 전해주는 세계 곳곳의 이야기와 선생이 느꼈을 감상들 유적 이면의 모습들이 흥미롭습니다.
9788971996942,8,신영복님의 더불어 숲 이군요. 저자의 인생의 생각과 깊이에 놀랐다가 저자가 오랜세월 감옥생활을 했다는 것 보고 놀랐던 기억이 납니다. 추천받아 읽었는데 매우 좋았습니다. 요즘 너무 사회적으로 사람보다 실적이나 금전이 위주인 것 같아 이런 책이 필요하다고 봅니다.
9788971996942,8,여행을 통해서 느낀것들이 기대됩니다..
9788971996942,10,신영복 선생님의 책이라 꼭 읽어야할것 같아요
9788971996942,10,선생님의 새책 읽어보고싶어요 기대됩니다
9788971996942,10,진정한 참어른의 말씀.. 계속 들을 수 있기를
9788971996942,10,꼭 읽어보고 싶은 선생님의 새책!
9788971996942,10,작가님의 역사적 현장의 기행문을 읽으며 함께 여행하는 기분을 느낄 수 있어요.
9788971996942,10,믿고보는 신영복선생님!이 책도 읽어보고싶네요~
9788971996942,10,예전에 읽었느데 새로운 개정판으로 다시 읽고 싶습니다. 기대됩니다.
9788971996942,10,"신영복 선생님의 『더불어 숲』은 이미 읽은 책이지만, 12월 7일 돌베개 출판사에서 개정판이 나온다고 해서 기대되는 마음으로 미리 책을 구입했습니다. ^^ 거기다 이벤트로 <2016 신영복 서화 달력>까지 받을 수 있어 더 좋습니다. *^^*"
9788964562185,10,좋아요
9788964562185,10,제 머릿 속에 아름다운 세계여행을 수놓은 책입니다.
9788964562185,10,여행을 좋아하는 자
9788964562185,10,세계여행 가고싶어요
9788964562185,10,추천합니다.
9788964562185,10,나의 여행을 위해
9788964562185,10,공감 백배 현실상황과 현실의 벽을 허물고자 하는 이들에게 주고픈 책.당장이라도 떠나고 싶게 만드는 유혹하는(?) 책.
9788964562185,10,표지부터 여행을 가고 싶게끔 만드네요.
9788964562185,10,다시한번 여행에대해 생각하게되었네요 좋은책입니다^^
9788964562185,10,세계여행은 언제나 나의 로망
9788964562185,10,"여행정보책과는 달리 직접 세계를 여행하면서 지출한 돈, 교통편, 장소에 대한 설명 등 실질적이고 자세한 정보가 많습니다"
9788964562185,10,바쁘게 열심히 달려온 한해가 저물어 가는 즈음 무엇을 위해 달려 왔고 무엇이 의미있게 남겨지는 가를 잠시 생각해 볼수 있는 지금 시기와 잘 맞는 책이다.
9788964562185,10,책을 통해 세계여행에 대한 꿈을 가지게 되었습니다.
9788964562185,10,언제나 꿈꾸는 세계여행 생생하게 접할 수 있네요
9788964562185,10,저도 세계여행하고싶어요
9788964562185,10,이 일상 속에서 저도 잠깐 멈추어보고 싶네요.
9788964562185,10,해당책을 읽어보고싶어서 주문했습니다.세계여행은 죽기전까지 저의 바램이기에 이책도 읽어보고 꼭 세게여행도 가보고싶네요~~
9788964562185,10,떠나지말아야 할 이유가 하나 더 늘기전에 떠나자
9788964562185,10,저의 버킷리스트에 들어있는 내용이네요. 저도 세계여행 가보고 싶어요. ㅎㅎㅎ
9788964562185,10,세계여행을 꿈꾸고 있는 내게 도움이 많이 된 책이었다.
9788964562185,10,책으로도 여행기분을 느끼게 해줍니다.
9788964562185,10,좋아요 그래서 구입합니다.
9788964562185,10,도전하게 만드는 책
9788964562185,10,표지가 좋네요
9788964562185,10,"세계일주 준비중인데 큰 도움이 된 책이에요.딱딱하게 적혀있는 그런 글이 아니라 이해하기 쉽고 재미있어요.특히 부부의 여행간 에피소드, 각자의 추천 여행지 아주 좋아요!"
9788964562185,10,젊은 중장년층에서 용기와 희망을 주는 에세이가 감동적이었습니다.
9788964562185,8,괜찮다. 괜찮아. 그래도 나 잖아.
9788964562185,10,표지가 너무 멋있어요
9788964562185,10,세계여행 마음만 들어도 기분이 좋아지네요.
9788964562185,10,"여행책을 구입하는 이유가 그러한 여행을 하고 싶어서 정보수집차 혹은 현실에서 그러지 못하기에 타인의 여행을 글로 사진으로 따라가는 재미인데, 이 책을 통해서 대리만족을 했다.물론 난 들어있는 사직서를 과감하게 던지지 못했지만."
9788964562185,10,의미있는 여행책
9788964562185,10,"이 부부의 도전하는 모습, 사랑하는 모습이 너무나 아름답네요^^"
9788964562185,8,쉽게 얻기 힘든 세계여행에 대한 구체적인 정보와 흥미로운 이야기의 매력적인 만남
9788964562185,8,손미나씨가 추천한 여행 책 기대되네요
9788964562185,10,지금삿어요 기대대요 서점에서 잠깐봣을때 책이 너무 좋더라구요 ㅎㅎ
9788964562185,8,누구나 한번쯤은 생각을 해보는 일이지만 행동으로 옮긴다는건 너무 어려운 일인데 우선 감동입니다.
9788964562185,10,정보가 가득하지만 감흥은 아쉬운 여행 정보 책과. 말랑말랑 감성은 자극하지만 실제 여행에 도움이 되는 정보가 부족한 여행 에세이의. 중간 즈음. 도움 되는 정보와 여행을 부르는 순간을 전하는 글들로 가득해서 추천하고 싶어요~
9788964562185,10,누구나 한번즘 생각으로 해보지만 실천이 어렵듯이 참 대단한듯합니다꼭 이루고싶은 맘을 먹게 해주네요^^책 잘 읽고 이번여행 무사히 마치겠습니다좋은 정보 감사드려요 이책으로 많은 여행지를 꿈꾸며 한번 도전해보겠습니다truely : 신혼여행은 이테리로 다시 가고싶은 남자
9788994197845,8,"가족이기 전에 한 팀으로서 각자의 역할을 맡아 예측할 수 없는 매일의 과제를 헤쳐나가는 모습이 멋지다. 이렇게 팀원으로 어우러져야 어른은 꼰대가, 아이들은 철부지가 되지 않지. 애들 섞인 가족이라 현지인들과의 융화가 더 쉬웠던 것 같고. 우리 사회도 소득에 따른 벌금 누진제를 도입하자!"
9788994197845,8,때로는 답답하고 너무 저돌적인 것 같다고 느껴지는 한 가족의 세계여행기. ‘대체 이 사람들 왜 이렇게 준비가 안됐지? 아니 왜 저러지?‘ 라고 생각되는 부분도 있지만 완벽한 것은 없다는 생각도 들고 그게 가족이라 가능했다는 생각도 든다. 세계여행은 결과가 아닌 과정이니까..
9788994197845,8,아주 멋집니다~. 나도 이제 슬슬 떠날 준비를...
9788994197845,10,아버지는 운전을 하고 박여사님은 길을 찾고 삼남매는 각자 자기가 할 수 있는 일을 한다. 여정중에 곤란하거나 당황스러운 일이 닥칠때면 다같이 헤쳐나가는 가족애가 부럽다. 아버지의 글도 좋았지만 박여사님의 그림과 삼남매의 포토에세이가 너무 좋았다 *^^*
9788994197845,10,여행을좋아함
9788994197845,10,가족모두 유럽여행을 가고싶지만 현실은 녹녹치않다. 모든걸 뒤로하고 떠날 수 있는 용기가 나기를.....
9788994197845,8,나의 소망을 먼저 이룬 가족이 부럽다.
9788994197845,10,재미있어요
9788994197845,10,멋진가족!
9788994197845,10,감동적
9788994197845,8,"이 대담한 여행을 따라하긴 힘들겠지만, 글을 읽으며 함께 두근대고 눈물 흘리는 것 만으로도 영혼은 약간의 자유를 얻는다."
9788994197845,8,다른 여행 책들과는 느낌이 조금 다른 가족적인 훈훈함...
9788994197845,10,여행
9788994197845,10,고정 관념을 바꾸게 하는 책의 힘!!
9788994197845,8,함께 여행을 떠나기를...
9788994197845,10,늘 해보고싶었던 가족끼리의 여행을 실천한 이 가족에게 박수를 보내고 싶습니다여전히 꿈만꾸고있는 저에게 자극이 된 이 책을 추천합니다.
9788994197845,10,여유와 유머가 가득한 행복하고 당찬 가족의 세계일주. 박수를 보낸다.
9788994197845,10,떠나야 하는 이유는 충분하다. 언제 떠날까. 어떻게 떠날까. 떠난 이후는 어떻게 될까. 이런 고민을 한번에 해결해주는 책이다. 그래 떠나보자. 온가족이 함께 한다면 죽기야 하겠어? ㅎㅎ
9788994197845,10,가족들이 버스를 몰고 세계여행할 수 있다는 생각을 하고 실천을 했다는게 놀라울 따름이었다.
9788994197845,10,세계여행의 길잡이가 되어줄 것 같아요.
9788994197845,6,"몇시간만에 다 볼 수 있는재미난 내용임, 빼빼가족의 용기와 적응력에 박수를 보냅니다."
9788994197845,8,슬픈 내용이 아닌데 콧등이 자꾸 시큰했습니다.아이를 키우는 입장에서 생각해보니 1년이란 시간을 이렇게 보낼수 있는 용기가 대단하게 느껴집니다.잃은것보다는 얻은게 더 많은 여행이었겠지요..?저도 책을 통해 빼빼가족과 함께한 여행 재밌기도 떨리기도 했습니다.
9788994197845,8,"우연한 기회에 읽고싶은 책을 읽게되었죠빼빼 가족의 삶이 평범한 대한민국 가족들의 이야기는 될 수 없어,더 멋지고 자연스럽게 그 생활을 동경하게 된 것 같아요다시한번 나를 돌아보게 되고,행복의 조건이 무행복의 조건이 무엇인지 생각하게 되는 시간이었던거 같아요빼빼가족 응원합니다~"
9788994197845,10,"재밌고 유익합니다! 지금 바이칼호수의 어부들을 만나는 여정까지 봤는데, 사투리도 정감가고, 잘읽히는 책입니다. 또 간간히 알아두면 좋을 정보도 나오고.. 다 읽고는 블로그에도 서평 쓸 예정입니다^^ 좋은 책을 읽어서 기분이 좋네요~"
9788994197845,10,여행을 좋아하고 항상 여행하고 싶어하지만 떠날 수 없는 저에게 단비와도 같은책이에요...
9788994197845,8,개인의 여행기는 많이 읽어 봤지만 가족 여행기는 처음 읽어봤는데 읽으면서 가족여행에 대한 매력을 느꼈습니다. 저도 늦지 않게 이런 이야깃 거리를 만들 수 있도록 노력하려고 마음 먹었습니다!
9788994197845,10,여행가기 어려운 사람들에게는 필독서가 될듯 합니다
9788994197845,8,내가 꿈꾸던 가족여행읽어보고 싶엇던책! 바로구매!
9788994197845,10,학교에서는 배울 수 없는 소중한 경험... 그것도 가족과의 여행이라니.... 정말 부러운 가족입니다.
9788994197845,10,가족끼리 저렁게 장시간 세계를 여행 할 수 있다는 것 평생 잊지 못할 추억을 만드시고 오신 것 같아요. 저도 나중에 가족들과 꼭 함께 떠나보고 싶어요.
9788994197845,10,미니버스 타고 세계여행이라니! 아 낭만적이에요.
9788994197845,8,너무너무 부럽고 꼭 가고싶은 여행이네요. 똑같게는 못해도 그 마음과 용기를 닮고 배우고 싶습니다. 그래서 1년이 아니라 아이랑 1개월이라도 떠나보려구요. ^^
9788994197845,8,우선 책 제목이 확~! 와닿았다. 그리고 궁금증이 확~! 생겼다. 버스를 타고 세계여행을 한다고? 어떻게? 그래서 책을 구입했다.책을 읽으면서 그저 감탄을 연발할뿐이다. 우와~ 그동안 볼 수 없었던 너무나도 특별한 여행기다.그것도 한가족이 그것도 남들이 가보지 않은 버스길을 통해서
9788994197845,10,"참 대단하고 멋있네요, 저도 그렇게 떠나보고 싶어요"
9788994197845,10,"무려 25개 국, 163개 도시... 빼빼가족 대단합니다."
9788994197845,10,여행을 통해 더 끈끈한 가족애가 이어질듯... 부러버요~
9788994197845,10,빼빼가족 멋있네요. 그들의 도전과 용기를 응원합니다!
9788994197845,10,빼빼가족의 용기에 무한 박수를 보냅니다.부러워만 말고 실천할 수 있는 용기가 제게도 생기길 바래봅니다. ^^
9788994197845,10,잼잼
9788994197845,10,350일 동안 버스로 여행을 떠난 빼빼가족의 이야기. 이 책 덕분에 신 실크로드 아시안 하이웨이를 알게 되었네요. 그 긴 시간동안 여행을 한 가족들의 생생한 경험담. 25개 나라를 함께 만나볼 수 있어서 좋았어요.
9788994197845,8,"이 책은 가족의 사랑을 바탕으로 여행에 필요한 팁가지 갖추고 있어 여행의 색다른 즐거움을 주고 있다. 거기에 캠핑카와 국경정보, 나라별 유류바까지.자칫 소홀해지기 쉬운 부분까지 짚어주어 많은 도움이 된다."
9788994197845,10,누구나 할 수 없는 걸 해낸 가족이네요.  이런 여행을 꿈 꾼다면 좋은 선례가 될 것 같습니다.
9788994197845,10,"세계일주 여행을 꿈꾸는 저로서 너무나 부러운 책이네요. 이 가족의 도전이 대단해보이고 덕분에 저 역시 도전하고픈 용기를 낼 수 있을 것 같아요. 더불어 여행 에피소드와 사진, 에세이 재미나게 읽을 수 있네요."
9788994197845,10,꼭 읽어 보고 싶은 책이 나왔네요! 기대하고 있었어요^^
9788994197845,10,읽으면서 한편의 세계여행을 한 기분이었습니다. 수능끝나고 가족들하고 배낭여행갈 계획을 한번 짜볼생각을 하게됬네요 ^^
9788994197845,8,가족과의 여행 부럽기만 합니다 저에게도 자극이 될 수 있기를
9788994197845,10,빼빼 가족의 350일 동안의 여행이야기는 여행의 설렘은 물론 가족의 사랑을 함께 할 수 있어 정랄 좋답니다. 여름방학을 맞아 가족과 함께 여행을 하고 싶다는 바람을 갖게 합니다.
9788994197845,10,세계 여행 낭만으로 보면 안됩니다. 여행국 사정 모르고 가면 그냥 죽음입니다.
9788994197845,8,오호~~ 드디어 책으로 나왔군요. 책이 나오기전부터 화제가 많이 되었었는데...가족과의 여행을 생가하는 저로서 정말이지 용기와 많은 정보를 주는 책이네요.또한 내용이 너무나 진솔하고 사진과 그림이 좋아요. ^.^
9788994197845,8,"가족여행, 참 좋지요,."
9788994197845,8,가족이 함께 여행한다는 게 의미있는것같아요. 기대됩니다
9788994197845,10,350일간의 가족 여행. 버스로 신 실크로드 아시안 하이웨이를 달려 유럽의 끝까지 여행한 그들의 진솔한 이야기와 여행정보와 각 나라의 문화까지 생생한 사진과 함께 만날 수 있으니 행복합니다.
9788994197845,10,얻는 게 있으면 잃는 것도 있는 법. 가족과 버스로 세계여행이라니. 내가 보기에 한없이 부럽기만 한 이 기적을 실행하려 이 가족이 얼마나 비웠을까? 그리고 그 이상 채웠을까?를 궁금해하며 책장을 넘기게 될 듯
9788994197845,10,"버스로  25개 국, 163개 도시를 여행한 가족이라니 부럽고 대단해보이네요. 제겐 꿈인데 이런 여행을 실행으로 옮긴 가족에게 박수를 보냅니다. 또한 덕분에 세계 여러나라의 문화를 함께 느낄 수 있어서 좋은 시간이 될 것 같아요."
9788994197845,10,현지의 분위기를 눈 앞에서 보는 듯한 생생한 삽화와 사진이 곁들여져 제가 실제 여행하는 인상을 받았습니다.
9788994197845,8,"가족과 떠나는 세계여행이라...이게 말이 쉽지, 아무나 할 수 없는 결정 아니겠습니까. 꿈이 실현되는 기분이네요. 새로운 문이 열리는 기분입니다."
9788994197845,10,"빼빼가족과 함께 여행하는 듯한 느낌을 주는 책! 사진으로만 봐도 그들의 감동, 기쁨, 행복이 충분히 전해져옵니다."
9788994197845,10,보기만해도 여행 다녀온 느낌...용기가 대단하다. 언젠간 나도 꼭ㅠㅠ..
9788994197845,10,방송에서 보고 너무나 부러워했었는데 글과 사진으로 다시 만나게 되어서 좋았었다.꿈을 실현시킨 가족들의 용기가 정말 부럽고 사진으로만 봐도 그들의 행복감이 느껴지는것 같아 좋았다.
9788994197845,10,"괜히 무서운 시베리아횡단,어디서 세계여행의 용기가 났는지 정말 부럽습니다.정말 대단한 빼빼가족이네요."
9788994197845,8,가족과 함께 긴 시간 세계여행을 계획했다는 것만으로도 부럽다.실행으로 옮기기 정말 어려운 일이 아닐까 싶다. 나도 부모님이 건강할때 이런 여행을 꼭 한번 해봤으면..
9788994197845,10,닮고 싶은 가족의 이야기
9788994197845,10,누구나 한번쯤 꿈꾸는 일이지만 실행에 옮기는 사람은 드문데 멋지고 부럽습니다.
9788994197845,10,"머리속에 있는 계획을 옮길 줄 아는 용감한 가족들의 이야기,정말 인생의 행운을 가진 가족이네요. 읽고 용기내어 떠나보고 싶네요."
9788994197845,10,요줌 캠핑카로 여행하는 게 부러움을 갖게 하는데 이 책은 캠팽카 여행에 많은 도움은 주고 있어요. 그리로 빼빼 가족의 여행 이야기로 즐거운 시간을 함께 하며 눈으로 보는 즐거움이 더해져 두 배의 감동을 주고 있답니다.
9788994197845,10,방송으로 봤습니다.꿈으로만 생각했던 여행을 현실로 하고 있는 가족들이 너무나 멋졌어요.너무 부럽기도 했구요.꿈을 꿈으로만 끝내지 않고 실현할수 있다는 것을 알려주고 용기를 주는 책이었습니다.
9788994197845,8,"여행이라는 건 누군가에게는 정말 요원한 일이지요. 이렇게 멋진 인생을 사는 가족, 생생한 경험에서 전해진 감동을 기대합니다."
9788994197845,10,가족과 함께 한번쯤 멀리 여행하고 싶어지네요....
9788994197845,8,버스안에 우리의 공간을 꾸려 떠나는 여행. 한동안 그런 꿈에 사로잡혔던 적이 있어요. 그런데 꿈만 꾸었을 법한 일을 실제로 행하는 사람들이 있습니다. 시간에 쫓기며 비슷한 굴레를 살아가는 현대인들에게 다른 삶이 가능하다는 것을 알려주는 반가운 책!
9788994197845,10,정말 꿈만 같은 이야기네요 그 과정에서 에피소드도 많았을거같아 궁금하고 기대됩니다
9788994197845,10,대단합니다. 남이 하지 못하는 것을 하는 것. 그것이 바로 일반사람과의 실행력 차이가 아닐까?
9788994197845,10,저도 저렇게 가족과 긴 여행을 떠나보고싶네요~~~
9788994197845,10,"내가 할 수 없는 것들에 대한 부러움과 존경으로 응원을 보내게 되는 이야기들로 가득하다. 그들의 용기는 행운이었고, 그 이야기를 읽는 나도 행운!"
9788994197845,8,나도 언젠가 여행을 떠나고 싶다고 생각하게 만드는 책.
9788994197845,10,"용감한 가족, 몽골의 모든 것을 담고 오다!"
9788994197845,10,"보고 감탄하고 놀랍고,신비롭고 여러가지 생각이 들었던 책입니다.한편으로는 부럽기도 하고,마음이 따듯해지네요."
9788994197845,8,이러한 대장정을 실행에 옮기다니 놀랍다...
9788994197845,8,부럽다는 생각이 드네요 가족끼리 여행을갈수 있다는것 그리고 그걸 실행할수 있다는점다양한곳을 여행하고 다양한 이야기도 가득찬 여행기
9788994197845,10,다큐로 봤던 빼빼가족 이야기가 책으로 나오네요. 방송도 재밌었는데 책으로 나온다니 반갑네요. 기대됩니다!!
9788927803812,10,세계 곳곳의 수도원을 찾아 떠나는 여정의 책이다. 아름답고 오랜 수도원을 통해 인간의 삶을 투영하는 사진과 내면일기와도 같은 여행기에 매료됨.
9788991094352,8,철학교수가 알려주는 여행에 대한 인문학적 고찰
9788991094352,10,이제껏 관광만 해온 나에게 이 책은 철학이 있는 여행을 할 수 있는 눈을 열어주었다.
9788991094352,8,여행을 좋아하는 사람에게 여행이란 무엇인가를 되새겨 보게 해 주는 책.
9788991094352,10,"철학자의 눈으로 읽어낸 인문학적 여행, 여행의 인문학이란,,"
9788991094352,10,나는 너무 오래 여행중이다 사뮬베게트는 파리로 가서 고통pain을 빵pain으로가르친다
9788991094352,10,뭔가 다시 꿈을 가질 수 있을 것 같은 희망..!!
9788991094352,8,"다소 지루함도, 여행자 와 다양한 문화를 존중할 수 있는 여행에 대한 의식 성숙"
9788991094352,10,저자가 꽤나 유머러스한 사람임을 느낀다 촌철살인마(?)같다고나 할까. 즐거운 책이다
9788991094352,10,"여행의 달인이 말하는 여행, 최고의 감탄사를 연거푸 외칠 수밖에 없네!"
9791189612887,10,막연한 소망이 아닌 실천을 해 내는 힘을 주는 책이였다. 세계여행 뿐 아니라 진정으로 이루고 싶은 일이 생겼을 때 임해야 할 자세를 배울 수 있었다.
9791189612887,10,주옥같은 글과 사진을 보며 여행이 인생과 많이 닮았음을 알게 되었습니다. 진짜 솔직하게 최애책으로 등극했습니다.
9791189612887,10,세계여행에 도전할 수 있게 용기를 주는 책이다! 이런 날것 그대로의 여행기를 읽고 있으면 떠날 용기는 이미 내안에 용틀임 중일 수밖에! 섬세하고 꼼꼼한 여행기록들이 감동적이다.이책을 가이드로 여행을 계획하련다. 세계여행을 꿈꾸며 용기가 필요한 사람들이 꼭 읽어야 할 필독서! 강추강추강추
9788993525977,10,여행을 떠나서 우리가 만나는 건 결국 자신과 자신이 지나온 모든 시 공간이라는걸 저자의 따스한 시선 속에서 느꼈습니다. 작가의 글 속에서  나 자신의 시간과 공간을 돌이켜보게 되네요.
9788993525977,10,몸으로 느끼는 소박한 여행을 하며 느낀 소회를 사진과 함께 담담하게 풀어낸 여행 산문집이네요. 어디론가 떠나고 싶은 마음을 촉촉하게 적셔줍니다.
9788993525977,10,추천합니다
