ISBN13,rating,review
9791186274644,10,가장 뛰어난 미국 소설가에게 5년마다 시상되는 ‘윌리엄 딘 하우얼스 메달’ 최초 수상자라니 기대가 됩니다..
9791186274644,10,여자들이 강인하게 변모하면서 성장하는 이야기를 담아내고 있어 좋습니다.
9791186274644,10,"시골의 농가에서 자신에 모든걸 희생하는  어머니 결혼하지 않고 소박하며 기품있게 살아가는 중년 자매,오로지 약혼자와의 결혼에 목매는 여성, 19세기 미국여성의 삶"
9791186274644,10,여성들의 강인함을 보여주고 인간승리의 본을 보여주는 책 같습니다.남성이나 여성이나를 떠나서 한쪽 성을 피폐하게 하고 부당하게 대우하는 모습은 사라져야 된다고 생각합니다.여성도 인간이고 그 가치가 있습니다.차별을이겨내고여성으로서당당하게사회에서인정받고싶은이에게청량음료효과기대
9791186274644,8,흥미로운 이야기입니다.
9791186274644,10,미국 19세기 여성으로서의 삶을 잘표현한 섬세한 소설이네요  그시대의 여성의 다양한 시선이 다채롭네요 기대되네요~
9791186274644,10,"재산권도, 선거권도 없이 여성이 한 사람으로 인정받지 못하던 19세기 평범하고 무던하게 살아가던 여성들이 변화를 앞둔 갈림길에서 강인한 인간으로 빛나는 모습을 보여주는 작품들이라 의미있는 책이네요."
9791189337094,10,임소라는 천재다
9791189337094,10,이것은 소설인가 르포인가스릴러 같다가도 성장소설 같다가도여튼 나는 양해중씨가 좋다 나도 양해중씨의 그림자가 되고싶어
9791189337094,10,"언제나 양해를 구하는 양해중씨의 19가지의 그림자는 나와 당신이 겪었을 법한 이야기이자 동시대를 살아가는 여성들에게 양해를 구하는 꽁트 형식의 르포이고, 소설이면서 사실이다. 양해중씨는 지금도 나와 당신에게 양해를 구하는 중이다. ‘당신의 그림자를 제가 좀 들여다 봐도 되겠습니까?‘"
9791189337094,8,무섭도록 진짜인 소설. 내가 만나본 게 틀림없는 양해중 씨. 좋고 슬퍼요.
9791189337094,10,명불허전. 옴니버스 형식을 원체 좋아해서 내용 뿐 아니라 형식 면에서도 만족하며 읽었다. 양해중 씨 같은 친구가 있었으면 하고 바라는 마음이 들기도 하고 나도 양해중 씨 같은 구석은 있으나 용기 면에서 한참 모자란다는 생각도 하고.
9791189337094,10,"어디선가 본 것 같고, 누군가에서 들은 것 같고, 옆에서 본 것 같고, 직접 겪은 것 같은 이야기들."
9791189337094,10,"믿고 읽는 임소라 님 글, 신간도 너무 좋아요."
9791196893958,2,역대 최악의 번역. 진심 구글번역기 보다도 더 형편 없는 번역.여기 리뷰 쓰신 분들 중 번역에 대해서는 한마디도 하지 않는 것이 이상할 정도에요. 출판사를 검색해 보니 이 책을 번역한 “구원” 이라는 사람이 번역한 책으로만 구성 되어 있네요. 이 출판사는 앞으로는 걸러야 겠어요.
9791196893958,10,"분노로 이글이글 타올랐다가, 통쾌해졌다가 여성들의 연대에 뭉클해지는 빼어난 단편들. 몇몇 작가의 발견. 살짝 번역 문장 이상한 부분이 보이고 글자 빠진 부분도 보이지만 —.— 실린 작품들이 좋아서 별 다섯 준다."
9788937490958,8,"가벼운 미러링인가? 했다가 무거운 경고를 받고 나온다. 권력의 속성을 본 듯도 하다. “오늘 길 위에서 처음 두려움을 느꼈다.”(332)고 일기에 적는 이가, 여자든 남자든, 있음에야."
9788937490958,8,약간의 쾌감과 약간의 불안감(?) 책 속에서 남자와 여자의 위치의 변화가 나타나면서 거기서 오는 불안정감과 두려움 같은 아무튼 여러가지 감정을 느꼈던 것 같아요 어디서도 볼 수 없는 내용의 신선한 소설이라고 생각합니다 드라마로 나오면 꼭 볼 것 같아요
9788937441318,8,폭력적인 가부장제 속에서도 앞으로 나아가는 가족들. 그들에게서 희망을 본다
9788937441318,10,"아버지 유진으로 상징되는 세계(폭력적이고 위선적인 가부장, 부정부패가 만연한 국가 나이지리아, 광신적 종교 등)를 벗어나 ‘원하는 것이 될, 원하는 것을 할 자유’의 세계로 나아가는 한 가족의 이야기. 결말이 다소 아쉽지만, 그럼에도 충분히 매력적이고 눈부신 작품이다."
9788937441318,8,"그들은 때때로 놓지 못하는 수치와 죄책감으로 침묵 속에 잠길 때가 있겠지만, 서로에게 고맙다는 말을 건넬 수 있는 사람이 되어 오늘도 살아갈 것이다. 실체가 있는 곁, 고모와 사촌들과 신부님이 있어서 (더 빨리) 가능했고, 내일도 괜찮을 캄빌리 그리고 <보라색 히비스커스>."
9788937441318,10,새로 나타난 괴물 같은 작가라고 하더니 정말 기대를 저버리지 않는군요. 흥미롭게 잘 읽었습니다.
9788937441318,10,"권위적인 아버지, 복종하는 어머니, 마음 속에 저항의 씨앗을 키워나가는 오빠와 이 모든 것을 관찰하는 나 ‘캄빌리‘. 16살 언저리의 캄빌리가 아프지만 서서히 자신의 알을 깨기 시작하는 과정을 담고 있다. 나이지리아의 풍경과 생활 속으로 훅 들어가지만 결코 낯설지 않은 이야기."
9788937441318,10,나이지리아의 여성작가의 책을 처음 읽어봤는데 속도감있게 전개되는 내용들이 좋았다. 가부장을 직접적으로 다루지만 불편하지 않은 소설이었다. 올해 내한을 한다는데 꼭 만나보고 싶은 작가이다. 소설가 아디치에에 대한 흥미를 갖게 만드는 소설이었다.
9788937441318,10,고민하는 분들 계시다면 그냥 pick하세요. 진짜 재밌어요. 책 뒷표지에 어떤분이 500권을 사서 아는 사람들에게 나눠주고 싶다고 적혀있더라고요. 저도 공감해요. 주인공 소녀가 가부장적인 가풍 속에서 느낀 엄청난 공포감과 학대받는 가족의 가슴아픈 사연이 구구절절 묻어나요. 강추합니다
9788937441318,8,"잃은 것들에 작별 인사를 하는 순간, 우리는 성장할 수 있다."
9788937441318,10,아버지 캐릭터가 입체적이어서 현실감 넘쳤다. 미메시스로서의 소설이 제 장점을 보이는 순간.
9788937441318,8,"자신들이 자유롭지 않다는 것 자체도 자각하지 못했던 두 남매가 원하는 것이 될, 원하는 것을 할 자유를 찾기까지의 고통스러운 성장기. 변화와 성장이 아무리 느리고 고통스럽다고 해도, 자유를 찾아도 그 다음에 짊어져야 할 것들이 많다 해도 자유와 변화, 성장을 향한 갈망은 막을 수 없다."
9788937441318,8,극단적인 종교적 강요와 가부장적인 마인드가 무서움을 느낄 정도였다. 폭력적인 집에서 자라면 이런 삶이 비정상인지 본인들도 모른다는게 더 소름돋는다.
9788959406968,10,그레이스 페일리 떄문에 사봅니다.
9788935670215,8,틀에박힌듯 극변하는 시대적 상황 속에서 두 주인공의 여성으로서의 선택과 과정이 너무 아슬아슬하고 애처로와서 감정이 요동친다.
9788935670215,10,문득 리나야말로 진짜 마녀라는 생각이 들었다. 좋고 나쁜 두 가지 모두의 의미로서의 마녀. 다만 60년대 이탈리아 시골 마을이 감당하기에는 그 마력이 너무도 강했다.
9788935670215,8,"젠더 관계에 엄청 파고듦. 특출한 외모& 탈랜트, 그리고 못말리는 성격 덕분에 사회 사다리 상하좌우의 다양한 남성들을 경험해 본 여성들의 쓰린 고백. 피와 살을 내주고 얻은 경험에서 발굴한 엔초와 미켈레라는 레어템은 감동적. 그러나 상대방의 편지나 일기를 매개로 스토리를 이어가는 건 구식."
9788935670215,10,시대적 배경도 다르고 국적도 다른데 왜 난 그녀들에 감정이입이 되었을까?보통 소설 속의 한 인물에 감정이입이 되곤 했는데이 소설은 레누와 릴라의 감정을 왔다갔다오곤 했다.
9788935670215,8,보기보다 짧게 느껴진다. 레누의 한 걸음 한걸음 낯설지 않아.
9788935670215,6,중간중간 넘겨버리고 싶을 정도로 세세한 이야기가 있었지만 지루하진 않았다 레누의 행동이 너무 답답하게 느껴졌다결말이 어떨지.. 레누와 릴라의 앞으로의 인생이 어떨지 궁금하닿ㅎㅎㅎㅎ
9788935670215,8,주인공들의 어리석고 무모한 행동에 한숨을 쉬다가 그들에게서 나 자신의 어리석음과 치기를 발견했다. 그래서 책을 읽다 중간중간에 나 자신을 돌아보곤 했다.
9788935670215,10,중학교 1학년 때 필독서라고 해서 순진하게 젊은 베르테르의 슬픔과 좁은 문을 읽었더랬다. 정말 순진해서 하나도 공감 못 했었더랬다.... 그러나 그 시절 나폴리 4부작을 읽었더라면 어땠을까? 어른이 되는 과정동안 수 많은 선택에 있어 알 수 없는 불안과 두려움이 조금이나마 해소 되지 않았을까?
9788935670215,8,"1권에서 느낀 감정과는 사뭇 다른 2권의 이야기는 약간의 충격과 혼돈으로 마음이 흔들렸다.읽다가 멈추기를 반복했지만 완독을 할 수 밖에 없었던 것은, 나도 모르게 작가의 다음 말들이 궁금했기 때문이다.상황에 처한 인물의 내면 심리묘사는 무심한 듯 하면서, 인간의 밑바닥까지 꿰뚫는 칼날같다"
9788935670215,6,레누와 릴라의 이야기인데 2권에서는 주로 레누가 릴라를 부러워하고 질투하는 상황이 많이 나온다. 컴플렉스와 질투를 가진 여자의 내면 세계를 엿볼수 있다. 뭐든 면에서 비교하고 끊임없이 질투하는 모습의 레누가 가엾기도하지만 지겹기도했다. 그냥 너대로 살아보라고 제발!!
9788935670215,6,2부는 너무 길어서 그런지 다소 지루함. 3부 볼까말까 망설이게 하네요.. 그래도 보게 될 것 같은 예감은 레누와 릴라의 다음 인생이 궁금해지기 때문이죠!
9788935670215,10,대단한 흡입력이다
9788935670215,10,"1편보다 흡입력은 떨어지지만 여전히 재밌다. 더불어 6-70년대에 대한 궁금증이 증폭된다. 그러나 이 책의 매력은 (그럼에도 불구하고) 한시적 시대성(?)에 머무르지 않고, 인물에 대한 깊은 통찰력에서 비롯된 보편성일 것이다."
9788935670215,8,언제나 나올까 기다렸던 소설 중 하나. 최근에 3권이 나온다는 소식이 너무 반가웠다. 두껍지만 전에 질리지 않는다.
9788935670215,10,리나의 격정적이고 거침없는 삶의 행보에 나도 함께 설레고 아프고 지쳐갔다. 그럼에도 그녀의 삶에 박수를 보내고 응원하고 싶다. 작가의 세심한 인물감정묘사와 시대상이 어우러진 리나의 삶의 격동기! 그럼에도 그들은 아직 십대들이다. 한없이 안고 토닥여주고 싶은 리나와 레누...
9788935670215,10,두번째 시리즈 나와서 너무 좋네요 릴라와 레누의 삶을 통해서 고민하며 서로 변화해가는 이야기 흥미로워요
9788935670215,10,성장을 담은 2부이군요. 전작에 비해 주인공의 성장스토리를 어떻게 담아낼지 무척 기대됩니다
9788935670215,10,세번째 이야기는 언제나 볼수있을까요?두소녀 이야기에 완전 빠져버렸네요...
9788935670215,10,우정이란 무엇인가를 다시 한번 생각나게 합니다.
9788935670215,10,두여성의 너무나 다른 인생의 모습에서 우리 삶의 한편을 만나네요.
9788935670215,10,진정한 페이지 터너. 600페이지가 넘는데 밤부터 새벽에 걸쳐 다 읽었습니다.
9788935670215,10,"일어나는 사건, 사고도 많고 등장인물도 제법 많다. 그럼에도 불구하고 템포가 빠르다. 대단한 흡인력이다."
9788935670215,8,두 여성의 삶과 연대를 통해 새로운 삶을 위한 의지에 대해 생각합니다.
9788935670215,10,드라마틱하고 역동적인 소설입니다
9788935670215,10,인간 감성을 속속들이 엿볼 수 있는 역사소설입니다
9788935670215,10,이런 소설을 백 편 정도 읽고 싶다.
9788935670215,10,릴라와 레누의 청년기를 다뤘다니 매우 기대됩니다. 1부가 정말 재밌었어요.
9788935670215,10,주인공의 삶이 드라마틱하게 바뀌는 두려움이 가득한 청년기를 그리고 있습니다. 그러나 두 여성은 우정으로 그 두려움을 모두 극복하고 앞으로 나아가게 됩니다.
9788935670215,10,오랜 우정을 쌓은 두 여성의 청년기 삶을 다루는 내용을 담고 있는데 그 속에서 그들의 우정과 연대가 잘 드러나는 작품이라 좋아요
9788935670215,10,정말 위대한 책입니다. 여성분들이 읽어보시면 더 와닿을 작품입니다. 우정과 인내의 이야기. 눈부시게 아름답네요.
9788935670215,10,"두 여성이 가난,무지, 남성의 폭력에 대항해서 진정한 자신의 삶을 찾아가는 이야기입니다. 그들이 자신의 성과 이름을 지키기 위해서 한 노력과 도전이 돋보입니다."
9788935670215,10,"릴라와 레누의 관계를 기묘하면서도 매혹적으로 풀어냅니다. 인물, 사건, 배경 등도 참 아름답게 묘사해놓았어요."
9788935670215,10,너무나 기다렸던 나폴리 시리즈 드디어 2권이 나왔네요. 1권의 끝이 불길했는데 역시나 결혼생활이 행복하지 못하네요. 위기와 혼란이 가득한 청년기를 다룬 나폴리 2부 너무 기대됩니다.
9788935670215,10,누구나 경험해 봤을 이야기라 공감이 갑니다.
9788935670215,10,우정에 관한 이야기라 좋네요.
9788935670215,10,나폴리 4부작 중에서  제2권은 릴라와 레누라는 두 여성의 삶의 청년기를 이야기하고 있습니다.  일상적 폭력에서 벗어나려 하는 여자의 삶을  정확하게 묘사하고 있어서  읽다보면 빠져들게 됩니다.
9788935670215,10,친구에 대한 이야기라 기대됩니다.
9788935670215,10,읽어보고 싶은 책이네요.
9788935670215,10,앞부분만 읽어보았는데 나의 눈부신 친구부터 읽어봐야겠다는 생각이 들어요.
9788935670215,10,"연작 중 2부예요. 그래서 주인공의 청년기 시절내용이네요. 사람의 성장 과정을 이렇게 담아낸다는게 참 이색적이면서 감동적이예요. 스토리에 푹 빠져서 공감하고, 고개를 끄덕이게 되는 이야기죠. 특별하지 않지만, 그렇다고 평범하지도 않은 삶. 그게 우리 개개인의 실제 삶이겠죠."
9788935670215,10,인간의 다양한 변모. 그 동인을 찾아가는 과정속에서 우리는 더욱 성숙해져간다.
9788935670215,10,전작에 이어지는 <새로운 이름의 이야기>에서는 주인공의 삶이 어떻게 바뀌는지 너무 너무 기대됩니다.
9788935670215,10,두 여성에 서로 다른 삶을 통하여 많은 것을 느낄 수 있고 그녀들의 우정에 관한 내용이 재미있습니다. 많은 스토리가 잘 구성되어 있고 두 여성에 심리상태에 대한 표현이 재미있게 저술되어 있어서 좋은 것 같습니다.
9788935670215,10,"여자의 일생을 보는듯한 시리즈입니다. 나폴리 시리즈중 2번째권인 이 책, 새로운 이름의 이야기는 주인공의 청년기 시절을 담고 있습니다. 그래서 그런지 삶에서 느껴보는 방황과 좌절, 도전이 다양한 각도에서 조명되고 있습니다. 삶의 의미를 찾아가는 주인공을 통해서 한번쯤 깊은 공감할만해요."
9788935670215,10,두 여성의 동반성장의 힘을 느껴보고 싶다면...
9788935670215,10,"평생 동안 이어진 두 여인의 아름답고 가슴 아픈 우정을 솔직하게 그리고 있다. 경제적 빈곤과 사회적 폭력에 맞서 싸우며 자신의 삶을 당당하게 개척해 나가는 릴라와 레누, 그리고 그녀들의 도전적 삶을 통해 여성과 소수자의 연대와 우정이 가지는 사회적 의미를 생각해 볼 수 있는 기회를 제공한다"
9788935670215,8,새로운 이름이라는 것은 단순히 이름을 의미하는 것이 아니라 두 여성이 지금까지 갇혀 있었던 현실에서 벗어나 새로운 삶을 살아가는 것을 말하는 거였네요.
9788935670215,10,두 여성의 기나긴 세월에 걸친 우정을 다룬 나폴리 4부작 시리즈! 요번 작품은 두 여성의 청년기를 다룬 두 번째 이야기네요. 청년기는 온갖일을 다겪는 질풍노도의 시기인데요. 소설에서는 어떤 일들이 그녀들을 기다리고 있는지 작가님의 글이 기다려지네요.
9788935670215,6,"서로 다른 삶을 살아가는 두 여인의 60년의 우정을 담은 시리즈로 <새로운 이름의 이야기>는 두번째 이야기인데요, 이탈리아를 배경으로 하지만 한 개인, 한 인간이 가질 수 있는 감정들에 공감이 되는 것 같습니다. 두 사람의 우정이 어떻게 이어지게 될지, 앞으로가 궁금합니다."
9788935670215,10,두 여인의 같이 살아온 우정과 함께 시대적인 상황도 들여다 볼 수 있어서 기대가 되는 소설입니다.
9788935670215,10,인물들의 우정과 성장이 인상깊습니다.
9788935670215,10,"분노와 열정, 두려움과 투쟁, 의지와 우정이 강렬하게 뒤얽히는 놀라운 경험."
9788935670215,10,한때는 서로 의지했던 두 여성이 이제는 서로 다른 방식으로 자신의 삶을 개척해나간다. 이 후 그들의 삶이 어떻게 전개될 지 두근거리며 기다린다.
9788935670215,10,두 여성이 우정과 연대를 통해 두려움을 모두 극복하고 앞으로 나아가게 하는 이야기가 많은 생각이 들게 하네요
9788935670215,10,"두려움, 자아를 찾아가는 청년기의 두 여성, 레누와 릴리의 일상은 무심하게 지나쳤던 시간을 되돌아보게 한다. 그리고 그들의 우정이 견고해져가는 과정은 불안하지만 조금씩 견고해져가고 있어 흐뭇해지기도 한다. 같은 여성이기에 더 공감이 가는."
9788935670215,10,"유년기를 지나 청년기에 접어든 두 여성의 우정, 정말이지 보통의 우리들에게 공감을 갖게합니다. 거기에 자전적인 소설이라는 사실에 더 몰입하게 되는 것 같아요. 보통 여성의 우정은 결혼하면 끝이라고들하지만 책 속에서 만나는 레누와 릴리의 우정은 든든해서 부러움을 갖게 합니다."
9788935670215,10,두 여인이 우정을 지키고 살아가는 60여년의 세월이 어떻게 표현되고 전개될지 무척 궁금해지네요.
9788935670215,10,"두 여성의 60여년 간의 우정을 그린 이야기 중 2번째 이야기인 이 책은 청년기의 모습을 보여주고 있다. 다른 무엇보다 4부작으로 이어지는 우정은 그만큼의 소중함을 전해주고 있을 뿐만 아니라 역사도 함께 하고 있어 많은 생각을 하게 한다. 또 하나, 저자의 자전소설이라는 사실에 현실감이 더해져 마치 한 편의 영화를 보는 것 같은."
9788935670215,10,"책을 통해서 내 주변사람들을 떠올려보고,두 여인을 중심으로 펼쳐지는 이야기가 기대됩니다."
9788935670215,10,나의 눈부신 친구의 다음 이야기로 또 다른 즐거움을 담고 있어요. 청소년기에 겪는 여러가지 감정을 함께 극복하고 나가는 모습은 우정의 힘이 얼마나 큰 지 실감하게 해줍니다. 그래서 되돌아보게 됩니다. 지금 내 곁에 있는 우정은 어떤 모습을 하고 있는지.그리고 앞으로 내가 지켜야 할 우정의 모습을 그려보게 되는......
9788935670215,10,두 여인의 오랜 우정과 삶의 변화의 과정이 섬세하게 잘 표현된 소설이라서 기대를 하게 됩니다.
9788935670215,10,"1부는 사춘기를 그려 많은 공감을, 2부는 청년기를 그려 긍금해지네요.  두 사람이 각자 다른 길로 들어서면서 어떤스토리로 엇갈릴지 기대가 됩니다. 이제 막 청년기를 지나가고 있는 지금 꼭 읽어보고 싶네요. 결혼생활, 자신의 꿈. 두 선택이 어떤 결과를 가져오는지 꼭 읽어봐야겠어요."
9788935670215,10,두 여성의 이야기가 흠미롭게 진행되네요. 다음편이 기대되요.
9788935670215,10,그녀들의 운명이 어떻게 흘러갈지 가슴이 떨려온다.운명의 소용돌이를 아름답게 묘사하는 저자의 필력이 감탄스럽다.
9788935670215,10,"무언가를 시작하는 두려움속에서도 자신이 선택하고 미래를 향해 나아가는 도전정신과 그 새로운 시작을 알리는 새로운이름의 이야기, 요즘 많이 읽기에 좋은 책일듯 싶어요."
9788935670215,10,나폴리를 배경으로 한 대하드라마 느낌이 나네요두여자의 일대기를 시대적 상황과 맞물려 방대한 양으로 풀어냈지만 전혀 지루함이 없이 읽을수 있을정도로 흡입력이 뛰어난 작품입니다
9788935670215,10,엘레나 페란테 4부작 시리즈중 두 번째 이야기! 그녀들의 청년기 이 또한 기대해봅니다.
9788935670215,10,줄거리만 보면 가볍게 느껴지지 않는 청년기 인데 이 청년기를 어떻게 가볍게 그려냈을지 기대되네요.
9788935670215,10,섬세한 감정표현과 매력적인 문체들이 잘 어우러져 읽는 재미를 주고 있는 소설입니다. 저자의 자전적인 이야기라는 사실에 현실감이 더해져 마치 한 편의 영화를 보는 것 같은 기분도 들었어요.
9788935670215,10,작가의 심리 묘사가 정말 세밀하고 가볍지 않아 좋네요읽을수록 몰입도가 뛰어나 시간가는줄 모르고 읽게 됩니다
9788935670215,10,나폴리 4부작 중 청년기를 그린부분 기대됩니다!
9788935670215,10,60년간의 두 여성의 우정을 통해 인간의 심리와 역사까지 담아낸 명작입니다.
9788935670215,10,나의 눈부신 친구의 몰입력을 그대로 유지하며 그녀들의 매력적이 이야기가 펼쳐집니다.
9788935670215,10,두 여주의 성장 스토리!! 그리고 정말 깊은 우정이야기~ 어서 보고  싶네요
9788935670215,10,랄라가 너무 안쓰럽다. 남성우월주의에서 도망치는 랄라의 모습이 남일같지않게 느껴져서 더 안쓰럽고 집중해서 보게 되는 작품이다.
9788935670215,8,처음 보다 나중이 더욱더 느낌이 오네요 다음 권이 기대됩니다
9788935670215,10,나폴리 4부작 중 1권을 너무 재밌게 봐서 2권이 기대됩니다청년기의 설렘을 또 어떤 방식으로 풀어나갔을지 완전 보고싶습니다!
9788935670215,10,두 여주인공의 우정과 성장스토리가 어떻게 펼쳐질 지 궁금하고 기대됩니다.
9788935670215,10,점점더 격렬해지는 내용에 책장이 어떻게 넘어가는지 조차 몰랐다.이 추운 겨울 두 여자의 운명이 뜨겁게 가슴을 울릴 단 하나의 책!
9788935670215,10,인간의 감성을 샅샅이 파헤친 지극히 가벼운 소설 같지만 거대한 역사 이야기를 담고 있어 기대됩니다.
9788935670215,10,인생이라는 그리고 삶의 대한 생각을 다시 하게 된 책인것 같아요.
9788935670215,10,세계적인 베스트셀러 작가 엘레나 페란테의 ‘나폴리 4부작의 두번째 이야기가 나왔네요. 장바구니에 담아야겠습니다.
9788935670215,8,청년기를 주인공들이 어떻게 지나는지 기대됩니다
9788935670215,10,두 주인공의 우정을 그린 작품으로 그녀들의 고민과 삶의 모습을 보면서 깨달을 수 있어서 기대됩니다.
9788935670215,10,두여자의 청년기는 유년기와는 어떻게 달라졌는지 궁금해집니다
9788935670215,10,두려움을 극복하고 이겨내는 두 여자의 60년간 우정과 사랑이 멋지게 보였습니다..
9788935670215,10,두여자의 우정과 사랑에 관한 주제는 흔하지만 작가의 필력으로 결단코 뻔하지 않은 내용이 되었네요 툭툭 내뱉는듯한 문체가 오히려 좋았던것 같습니다
9788935670215,10,"서로 다른 환경과 성격마저 다른 두 여인의 60년간의 우정을 다룬 4부작 중, 두번째 이야기가 드디어 나왔네요. 우정과 사랑, 인생을 아우르는 서사가 읽는 줄거움을 주는 것 같습니다."
9788935670215,10,정말로 좋은 책이라고 추천합니다~~~
9788935670215,10,몰랐던 작가인데 책소개를 보니 굉장히 읽고 싶어지네요.
9788935670215,10,"개개인이 얽혀서 만들어내는, 거대한 이야기."
9788935670215,10,재미있어 보이는 이탈리아 연애 소설이네요 기대됩니다
9788935670215,10,찬란하기만 할 줄 알았던 두 여성들의 우정도 금이가고 흔들리기도 하네요 두 여자의 마음이 섬세하고도 세밀하게 묘사되서 내가 실제 소설속 인물이 된것마냥 감정이입이 됩니다 변치않은 우정이란 없는 것인지 궁금해하면서 읽고 있어요
9788935670215,10,이탈리아의 아름다운 소설이 상륙했네요. 인생이 담겨있는 소설이라 더욱 좋아요.
9788935670215,10,기대되는 책이네요 꼭 읽어보고 싶네요
9788935670215,8,여자의 우정이야기 재미있게 읽을 수 있겠습니다.
