ISBN13,rating,review
9788998441074,10,긴 분량이지만 한 번 읽으면 멈출 수 없다. 박진감과 긴장감을 제대로 느낄 수 있다. 30년 전 소설이지만 너무도 선연하게 다가오는 것은 왜일까.
9788998441074,10,재미 있어요~^^
9788998441074,10,충격적입니다. 소름 돋습니다. 작가의 말처럼 한 쪽에 경도되지 않고 동등한 자리에서 조화롭게 살아갈 수있었으면 좋겠습니다. 모든 독자분들이 같은 생각이길...
9788998441074,10,책이 나올 당시의 시대상을 생각하고 읽으면 더욱 놀랍게 느껴지는 책입니다. 책이 생각보다 두꺼웠는데 북마크를 꽂을 새도 없이 한번에 읽었습니다. 어느정도 공감이 가지 않는 부분 역시 있었지만 문장 하나하나가 곱씹게 되는 좋은 책입니다.
9788998441074,10,2020년 아니고 1990년대에 쓰여진 책이라니너ㅓㅓㅓㅓㅓㅓㅓㅓㅓㅓ무ㅜㅜㅜㅜㅜㅜㅜㅜㅜㅜㅜ멋지니까 아묻따 걍 읽어야 함양귀자 작가 도장깨기 2
9788998441074,10,"90년대 페미니즘을 대표하는 책이라는게 과언이 아닌,,내용이 너무 흥미진진해서 빠져들어서 읽었네요"
9788998441074,10,영웅에 걸맞는 결말이라는 생각이 든다. 지금까지는 남성들이 전유했던.
9788998441074,10,책을 펼치자 마자 정신없이 읽었습니다. 제 마음속의 노벨문학상이에요. 꼭 꼭 읽어보시길 추천합니다.
9788998441074,10,주인공을 혐오하다가 사랑하게 되었다.
9788998441074,10,버지니아 울프만큼 깊고 이갈리아의 딸들만큼 시원한데 양귀자는 재미와 씁쓸함을 각각 한 꼬집씩 더 넣었다.
9788998441074,10,"아 재판해서 다시 나오네요ㅜㅜ2019년의 가장 기쁜 소식입니다.ㅜㅜ이 책을 처음에 읽었을 때, 충격 잊지 못해요ㅜㅜ첫머리 작가의말에 나오는 할머니 이야기가 정말 슬펐고 작가란 그런 삶의 파편들을 그러모아 이야기로 남기는 작업이구나..하고 생각하게 됬습니다."
9788901248202,10,근현대사의  아픔을  소녀의  눈으로  담담하게  묘사한다.순식간에  읽었다.
9788901248202,10,갈아입은 표지로 더욱 아름다워진 싱아!!
9788901248202,10,"박완서 타계10주기 개정판으로 더 예쁘게 돌아온 박완서 장편소설, 역시 명작이네요."
9788901248202,10,박완서 작가를 알기 위해서는 반드시 이 소설을 읽어야 한다.
9788901248202,10,한정판 책!! 자주색바탕에 싱아인듯한 꽃이 예쁘게 피어있다. 책을 덮으며 정말 잘 읽었다. 안 읽었으면 후회했을듯한 책이다.
9788901248202,10,외우는 역사가 아니라 이야기를 통해 알게 되는 과거는 더 기억에 남는 것 같았다. 그때의 시절을 읽으며 지금의 삶이 얼마나 고마운 순간인지 느낄 수 있었고 또 그 때를 견디고 이겨내주신 분들 덕분임을 더 알 수 있었다.
9788901248202,10,찬란한 어린 시절과 성장 과장을 흠뻑 취해 보고 싶다면 ‘그 많던 싱아는 누가 다 먹었을까‘를 읽기를 추천한다. 아픈 역사의 순간순간의 모습에서 갑자기 어른이 되어버린 소녀의 이야기는 이제 시작이다. 그녀와 함께 세상 이야기 들어보길 추천한다.
9788901248202,10,새롭게 옷을 입고 예쁘게 독자 앞에 선보인 박완서 작가의 대표작이네요. 표지가 참 마음에 들어요. 소설은 말할것도 없구요.
9788901248202,10,예전에 학창시절 읽었던 책을 추억삼아 다시 읽게 되더니 ..
9788901248202,10,정말 많은 세월이 지났음에도 변함이 없다. 매번 읽을 때마다 감동적이다.
9788901248202,10,당신은 레드 콤플렉스를 자기 검열하고 있지 않습니까?
9788901248202,10,요즘 각 출판사마다 박완서 작가 타계 10주기를 맞아 멋진 개정판들이 출간되고 있다. 그 중에서도 웅진출판사에서는 연작 자전 소설 두권이 출간되어 더 의미 있는 작품들이다. 특히 개인적으로는 멋진 표지가 인상적이었고 한국 문학의 거목의 삶을 엿볼 수 있는 시간이 되었다.
9788901248202,10,"그시절, 그녀 옆에서 시큼한 싱아를 함께 먹고싶다.나는 살아보지 못한 시간임에도 마치 함께 걷는 기분이 들만큼 세심하게 기록한 우리의 역사.격동의 시대, 그녀의 목소리가 더해져 더욱 마음이 아리다."
9788901248202,10,꼭 읽어야 할 필독서!
9788901248202,10,박완서의 저전소설을 통한 역사증언이다
9788901248202,10,"역사 교과서에서만 배우던 일제시대의 내용들이 이 책에 자세하게 나와있어서 신기하기도 하고 , 마음 아프기도 했어요. 그리고 책 첫 부분에 정말 시골만의 정겹지만 아름다운 풍경들을 세밀하게 묘사되어있어서 아름다웠어요."
9788901248202,10,아... 엽서 갖구 싶다.......
9788901248202,10,지금에 와서 다시 읽어보니 배경이 되는 시대의 참혹함이 더욱 생생히 다가오네요
9788954677523,6,캐이트 쵸핀이라 읽습니다
9788954677523,4,"코호북스에서 작년에 펴낸 <그녀들의 이야기>라는 책과 영미 여성작가 단편모음이라는 컨셉도 같고, 작가진은 거의 동일하며 겹치는 작품이 셋이나 된다. 누런 벽지나 맨스필드의 작품은 수록된 앤쏠러지만 수두룩해 보이는데,  신선미가 떨어져 고리타분한 기획처럼 보인다."
9788954677523,10,기대합니다!
9788954677523,10,"케이트 쇼팽, 버지니아 울프, 이디스 워턴 등... 기대됩니다 :)"
9791191247022,10,사전에 기록될 단어들을 모으던 시기에 미처 기록되지 못했던 단어들을 모아온 사람들의 이야기를 소설로 읽을 수 있어서 좋았다.
9791191247022,10,"언어에 담기지 않은, ‘기회가 없었던’ 사람들의 역사. 언어와 사전의 역사, 여자 노예 ‘리지’의 역사, 그것을 기록한 사전편집자 ‘에즈미’의 역사. 기회를 갖지 못한 단어들. 복원하고자 하는 시도. 에즈미는 시장을 돌아다니며 교육받지 못한 이들에게 발언권을 주고, 그렇게 단어를 수집한다."
9791191247022,10,"문장들이 아름답고 힘이 있다. 단어를 사랑하는 이야기인가 하면, 다른 사람을, 세상을 사랑하는 이야기이기도 하다. 부드럽고 섬세한 말들에 힘을 얻게 되는 기분."
9791191247022,10,"책을 읽으면서 몇몇 얼굴들이 떠올랐습니다. 직접적으로 얽혀 있지 않은 느슨한 연대일지라도, 어떤 마음들을 볼 때마다 울컥울컥해지곤 합니다. 이 책을 읽으면서도 그랬어요.오랜만에 소설을 읽으며 따뜻한 마음이 전해졌습니다. 오래 읽히기를 바라는 마음입니다.�"
9791191247022,10,만약 내가 단어라면 어떤 쪽지에 적히게될까? 내가 단어라면 어떻게 정의될까? 실제 옥스퍼드사전을만들던 스크립토리엄의 모습을 찾아보니 눈물겹다.
9791191071344,4,"문단미투 관심있거나, 소설 재미가 아닌 의미로만 읽는 걸 좋아하시는 분들..........에게.....새롭게 쓴게 있나하고 봤더니 그런 건 없었음"
9791191071344,10,책 소개에 ‘동의‘란 단어가 얼마나 위태롭고 다각도에서 살펴 볼 필요가 있다고 되어있는데 공감이 가고.. 이 책을 꼭 한번 읽고싶어집니다.
9791191071344,6,성폭력 고발문학은 당연히 필요하다. 하지만 영상과 별반 다를게 없이 사건 기록처럼  재현에만 신경쓴 소설은 무슨 의미가 있을까 싶다. 단순한  사건기록은 시사프로그램이 더 뛰어난데.
9791191071344,10,기대됩니다!
9791191071344,10,미투운동의 힘을 느끼게 해주는 책.
9791191071344,10,"구시대의 그릇된 사고로 인해 자행된 폭력들이 지금까지 이어져오고 있다는 사실이 놀라울 따름입니다. 당시에 주인공이 얼마나 고통스러웠고 부끄러웠을지 감히 이해하기 어렵습니다만, 더이상 가해자의 그림자 아래 숨어있지 않고 세상에 그 아픔을 고백해준 저자의 용기에 박수를 보내고 싶습니다."
9791191071344,10,실화라니...재미있겠네요바로 구매
9791191071344,10,기사로 본 사건을 담은 책이네요. 며칠 전 우리나라에도 비슷한 사건이 있었죠. 많은 사람들이 읽길 바라며 구매합니다.
9791191071344,4,소아성애. 사건중심. 기록. 노잼
9791191071344,10,실화라는 것에 놀라움을 금치 못하겠네요.우리나라도 이런 피해자가 안 나오길 바라면서 구매
9791158886141,10,샀어여.. 딴 데서 샀나?구매가 안뜨누만 어캐된 건지...목록을 만들 때가 된 거이지.
9791158886141,10,추천합니다
9791158886141,10,이 책도 내 아이에게 추천하는 도서목록. 아직 어려서 읽어도 이해 못하겠지만 사춘기가 와서 생각이 깊어질 때 같이 읽고 이야기를 나누고 싶은 책. 이런 일이 발생하지 않을거라고 확신 할 수 없음에 무서웠다.
9791158883843,10,책 표지가 예뻐요 동화책 같아서 환상소설같기도 하고.문체가 간결하고 이야기 진행이 흥미진진해서 놓을 수가 없었어요. 하지만 다시 읽기는 힘들거같아요.
9791158883843,10,"왜 SF로 분류되어 있는지 모르겠습니다. 제 기준에선, SF라고 할 만한 요소는 없고요, 재미는 있습니다."
9791158883843,8,"더 그로테스크한 1984 현대판!전체주의에 갇힌 한 여성의 독백,성과 권력.문뜩 등장하는 성경말씀이 이리 섬뜩하다니"
9791158883843,10,통제된 사회에서 주인공의 심리묘사가 탁월하다. 현재와 과거를 오가는 묘사는 그녀가 처한 상황을 더욱 안타깝게 여겨지게 보여준다.
9791158883843,8,읽고 싶네요
9791158883843,10,"지적인 작가의 지적인 작품. 번역이 아주 좋다고 느꼈어요. 단순히 재미있는 소설을 넘어선, 시대에 대한 날카로운 통찰력이 돋보이는 작품입니다."
9791158883843,8,"여성을 여러 계급으로 나누어 국가가 통제하는 사회라는 설정이 디스토피아 소설 중에서 이 작품이 갖는 독특한 점. 지난 달에 읽고 쓰려니 또 기억이 가물거리지만,  섬세하면서도 조심스러운 화자의 이야기를 따라가며 읽는 과정이 매우 스릴있었다. <증언들>도 기대된다."
9791158883843,8,후속작 내용이 너무도 궁금해진다 빨리 증언들을 보러가야겠다
9791158883843,10,많이 재밌습니다. 아주 마음에 들어요. 다음 이야기 사러 갑니다.
9791158883843,8,"다가올 시간들에 대해 ‘희망‘을 의무적으로 주입시켜 보지만 가슴 한 켠엔 비관적인 미래상에 대한 불안감을 가지고 있다.지금 이 상황에, 책은 공포감마저 감돌아 진도가 더뎠으나, 읽고 난 후의 느낌은 오히려 명쾌해지는, 거울 삼을 수 있는 디스토피아 소설이다.작가의 다음 책을 찾아 읽고 싶다."
9791158883843,10,"미드 #핸드메이즈테일 #시녀이야기 시즌 1 감상 후, 뒷 이야기가 궁금해서 구매했던 책입니다."
9791158883843,10,정신없이 읽었어요. 책을 덮고도 한참 머리에 남씁니다. 꼭 보세요!
9791158883843,4,"Goodreads의 엄청난 스코어로 믿고 구매해서 읽었으나, 오웰의 1984, 헉슬리의 멋진 신세계보다 별로였다."
9791158883843,10,음...상상인지 실화인지 모를.. 100년전 디스토피아를 간접적으로 느낄 수 있었음.
9791158883843,10,"책에 담긴 내용에 비해 분량 자체가 어마어마한 것도 아닌데, 지나치게 압축적이지도 않고 흥미진진하게 이야기가 흘러가는 것이 새삼 놀랍다. 몇 십 년이 지나도 찬사를 받을 것 같은 작품."
9791158883843,4,잘 읽히면서도 남는것은 별로없다현실에 감사해진다
9791158883843,8,"소설이라 만만하게 생각했는 데 읽는 데 꽤 오래걸렸다. 뒤로 갈 수록 재미있지만, 재미보다는 생각많아지는 문장들의 향연."
9791158883843,10,그저 최고..
9791158883843,10,끈기가없어서 아직 다 못읽었지만 이 책 추천많이받았어요^^
9791158883843,10,예전에 읽다가 포기하고 다시 읽는 중인데 너무 절망적이고 끔찍한 세계관이라 무서운 장면 없이 거의 스릴러급 공포입니다.
9791158883843,10,"페미니즘 소설입니다. 그러나 페미니즘 어쩌구 갖다 붙인 이상한 책 수 십권보다 이 책 한 권이 더 가치있습니다. 재미와 감동, 모두 담고 있습니다.마거릿 애트우드의 책을 사는 것은 명예로운 일이지요."
9791158883843,8,애트우드의 세번째 책으로 읽었다. 책이 더해질수록 작가의 매력이 커진다.
9791158883843,10,"애트우드의 <시녀 이야기>는 기억과 목소리, 전달, 그리고 역사에 대한 이야기다. 한 사람의 목소리가 어떻게 잊혀지지 않고 전달되고 기록되어 역사가 되는지, 그것을 대하는 나의 태도는 어떠해야 하는지에 대한 이야기다. 역사가에 의해 만들어지는 게 아니라 스스로 잉크가 되는 이들의 이야기다."
9791158883843,10,"“출산을 위해 징집된 여성”들이라는 전제만으로도 충분한 공포인데 길리아드 내의 규율과 처형, 인간상들의 묘사는 가히 충격적이다. 더군다나 1985년에 쓴 소설이라니. 책을 읽는 내내 오브프레드의 절망과 체념이 체화 되는 느낌이다. 오랜만에 완전한 소설이다."
9791158883843,10,읽다가 혈압올라서 책을 내려놓았다. 이 책을 보고나서 매드맥스를 보면 속이 후련해진다
9791158883843,10,사우디아라비아에서 이미 이 소설과 거의 비슷한 일이 일어난 전례가 있다는 점에서 더욱 소름끼치는 소설이다. 책 한 권에 이렇게 다양한 페미니즘적 주제를 담아냈다는 것이 놀라웠다.
9791158883843,10,재독인데 역시 재밌네요
9791158883843,10,줄거리만 봐도 내용이 궁금해지네요!
9791158883843,8,설명만으로도 충격적이라 꼭 보고 싶은 책입니다!
9791158883843,10,미드를 보고나서 원작이 궁금했었는데 이렇게 원작이 나오게 되다니 기대됩니다
9791158883843,8,소개글만으로도 무서우면서 실제 일어날 지도 모르는 일이라 생각하니 섬뜩해집니다.어떤 스토리가 펼쳐질지 기대됩니다.
9791158883843,10,시녀이야기 꼭 읽어보고싶어요
9791158883843,4,전 이 책이 어렵네요. 무서운 세상이긴 한데 와닿지도 공감이 되지도 않아요
9791158883843,10,섬뜩하네요..내용을 어떻게 풀어나갔을지 너무 긍금합니다~~
9788960901667,8,처음으로 사보는 실비아 플랏의 책.  공경희님의 번역도 기대하며~
9788960901667,10,옮긴이의 말 읽다 기절할 뻔함. 너무 얕아서. 예민하고 민감한 소설을 이제 막 다 읽었을 독자들 앞에서 자살에 대해 그따위로 표현하다니. 자살 강국에서.
9788960901667,6,"지금 막, 받았다. 택배기사님의 거친 호흡소리가 아직도 귀에 남았다. 길고 길었던 장마가 끝나고 무더운 여름이 시작될 모양이다. 기대 가득한 실비아 플라스가 쓴 ‘벨 자‘를 손에 든다. 리커버 에디션 표지는 생각보다 이상하다. 책을 펼치니 본문도 내용에 비해 여백이 많다. 아쉽다. 첫느낌은..."
9788960901667,8,얼마나 많은 여자들이 정신병의 이름으로 고립되었을까. 억압이 정신병을 낳는다. 벨자는 억압이고 에스더는 벨자 아래에서도 자유롭고자 했다. 작가 자신이기도 한 에스더라는 인물은 문학작품에서 기억되고 탐구되어야할 여성 캐릭터라고 본다.
9788960901667,10,나는 살아있다. 나는 살아있다. 나는 살아있다.
9788960901667,10,고요한 숨막힘
9788960901667,6,외롭고 이해 받지 못한
9788960901667,6,이 책을 조금 더 젊은 날에 읽었더라면 찌르르- 마음에 더 크게 와 닿았을 텐데 그 점이 조금 아쉽구나. 똑똑하고 특출난 여성이 가부장제 사회에서 모순을 겪으면서 스스로를 어떻게 망치는지 안타깝다.
9788960901667,10,여성으로서 읽기 괴롭지만 여성이기에 더 읽어야 하는 책이라는 생각이드네요.
9788960901667,6,"모든것이 허용되는 듯 보이지만, 사실은 유리병에 갇힌 삶."
9788960901667,8,"삶에 대한 열망과 좌절을 냉탕과 온탕처럼 오락가락 하면서 자괴감과 싸우는 지난한 과정을 겪어 본 젊은이라면 누구나 공감할 수 있는 치열한 갈등, 하지만 여자라면 멘붕이 올 수 있는 공감이니 주의요망"
9788960901667,10,삶을 갖는 방식으로 사랑하는 것과 버리는 방식으로 사랑하는 것. 나는 후자의 방식이 더 믿음직스럽다.
9788960901667,10,"갈기갈기 찢긴 영혼을 억지로 모아 붙여놓고 버텨보려는 절규. 굉장히 고요하지만, 굉장히 고통스럽다."
9788937473135,10,신기해요.  신경끄기의기술을 영어로 읽고 우연히 한국어버전 리뷰보고 너무대조적인 평가로 놀랐는데 이 김지영 책 영어로 읽고ㅡ영어분야에 몸담아서  훌륭한번역 소문듣고 ㅡ72년 김지영으로 공감느껴 지인에 추천도  했는데 여기 리뷰 진짜 씁쓸하네요. 우리사회 진짜 썩을대로 썩었나봐요
9788937473135,10,영화보다는 더 구체적이고 사실적이라 더 마음에 닿았던 구절들.  남자의 시선으로 보면 페미니즘
9788937473135,10,그냥 소설책일뿐인데 많은 생각을 하게 되는 것 같다. 이게 현실이다
9788937473135,4,어..음..80년대생인 저희 언니한테도 공감이 안되고90년대생인 저도 공감이 안갑니다..네..
9788937473135,8,"이 책을 읽으며 여자라는 이유로 남동생에게 학업을 양보하였던 어린날의 어머니와 우스갯소리로 하는 넷째인 나에게 여자라서 낙태를 고민했다는 이야기, 귀가시간이 자유로운 그친구의 남자 형제에 비해 항상 9시에 들어가던 내 친구 등 내 주위 여성들의 삶이 떠올랐다."
9788937473135,10,"82년생이 아님에도 불구하고, 김지영씨가 겪은 일들이 낯설지않다. 소설을 뒤늦게 읽어서인지 왜 이 책이 그렇게 논란이 되었는지 잘 이해가 가지 않는다. 소설과 영화의 다른 부분들이 있다고 하는데, 영화도 궁금해졌다."
9788937473135,10,어떤면에서 나 자신을 보는거 같았습니다. 얼마전 티비 여러 채널에서 했었고 폰으로도 볼수있는데 티비로 먼져 보고 많이 울었습니다. 저 또한 마음의 병이 있거든요. 다 내려놓고 싶기도하고...
9788937473135,2,성 혐오 가득한 프로파간다 소설. 팔리는 이유는 작금이 페미니즘의 시대이기 때문이다. 페미니스트 입맛엔 이 만한 작품이 없을 것이다. - 빌려 읽어서 망정이지 무턱대고 구입했으면 후회했을 뻔.
9788937473135,8,너무 사실적이던데 왜 판타지라고 할까?
9788937473135,2,"그당시 여성들의 일생과 결혼 육아등이 나온건 좋은데- 일반화를 하지는 말것, 모든 여성을 저렇게 비참하게 그리는 건 잘못되었다. 그래서 여성들 사이에서도 호불호 강하게 나뉘는 소설이고"
9788937473135,2,공감을 받는다는건 시기를 잘 타고난 책. 읽고 공감할수는 있지만 이 책을 읽으면 무의식적으로 모든 남성은 차별받는것이 없는 것처럼 느껴지게 한다. 모든 차별은 없어져야 하지만 반쪽인것이 문제.
9788937473135,8,"읽는 내내 공감과 불편함이 교차했다. 가부장제 한국사회에서 여성이 겪는 불합리하고 부조리한 면들이, 성장과정과 사회환경 속에 실상이 드러나고 있다. 양성 평등사회이라 하지만 아직도 잠재적이고 표출되는 현상들이, 정책과 의식의 실천적 변화를 통해 보다 나은 방향으로 개선되기를 기대한다."
9788937473135,10,인생책입니다. 술술 읽히고 공감되고 ...
9788937473135,10,"왜 이제서야 읽었는지 후회가 됐다. 두고두고 몇 번을 읽어도 공감이 되는 책이다. 남녀불문하고 한 번씩은 읽으며 여성들의 삶을 조금 더 이해할 수 있길.김지영이라는 사람의 삶을 잔잔하게 잘 그려냈다. 그와 주변 여성들이 겪는 경험, 알게 모르게 차별을 가하는 남성들을 묘사하는 책."
9788937473135,4,"노벨상을 수상한 폴란드의 여류작가와 비교했을때 문장력이나 표현들은 책이라고 부르기도 민망할만큼 처참해서 부끄러운 수준이다. 문학적 가치는 거의 없다고 봐도 무방함. 그럼에도 불구하고 이 책을 샀던 이유는 한국여자들의 노벨, 바이블로 추앙받을만큼 시대를 관통하는 메시지를 기대했기때문."
9788937473135,10,"이 책이, 이 책을 원작으로 만들었다는 영화가 왜 논란인지 알고싶어서 읽었는데 더 모르겠다ㅠ너무나 평범한 이야기인데이런줄 몰랐었나?작가가 이 시대의 평균 여성의 삶을 꼼꼼히 정리해놓아서 감탄했다가장 보통의 남자는 가장 보통의 여자가 이런 줄 몰랐나보다한국은 언제 달라지려나?"
9788937473135,10,페미니즘 입문서로 제격
9788937473135,10,군더더기 없는 현실을 보여줬던 소설
9788937473135,10,이 책은 더 이상... 소설이 아닌.. 정치적인 무언가가 되어버렸기때문에 나는 당연히 별점 다섯개를..소설로써 부족한 부분이 있을지는 몰라도 적어도 역겹고 불편하진 않다.
9788937473135,6,르포기사? 큰 감흥은 없는 듯....
9788937473135,10,"현대사회에서 살아가는 김지영씨가 힘들어보여요항상 남자가 먼저야,여자는 그러면 안돼 이런 편견이 많아서 이런책을 쓰신 것 같네요 여자로서 공감됬고 정말 재밌었어요 :)"
9788937473135,10,이런 곳의 평가나 기사 댓글만 봐도 우리나라 여성들이 얼마나 살기 힘든 지 알 수 있다. 누군가는 비현실적이라고 말하고 다른 누군가는 지나치게 현실적이라 한다. 차별을 겪은 사람은 현실이라고 소리치는데 차별을 겪지 않은 사람들은 이 소설을 ‘과대망상‘이라고 칭하며 비난한다. ^^ 아오 빡쳐
9788937473135,10,자기가 모른다고 없는 일이라 생각하는 사람들이 누구보다 더 읽어야하는 책
9788937473135,8,김지영씨의 이야기 잘 들었습니다. 라는 인사를 전해야만 할 것처럼 너무나 현실적인 이야기......
9788937473135,2,극단적인 설정으로 편가르기하는 느낌이라 해야하나? 문학성은 매우 떨어지지만 시기를 잘 만난 책이라는 말뿐.. 문제의식은 있을지 모르지만 책 자체가 너무 별로라 돈이 너무 아까웠다
9788937473135,10,"여자가 일생동안 겪을만한 사건을 담아서, 흥미롭게 읽었다! 강추!!!"
9788937473135,10,듣고싶은 이야기
9788937473135,10,"이책이왜 불편하나요. 이토록 팩트인데, 다만 모든 여성혐오, 여성 차별, 몰카, 성추행, 성희롱등의 가지각색의 일을 한 인물이 몽땅 겪으니 읽는동안 나 스스로가 너무 고통스러웠습니다..그것이 유일한 단점,,"
9788937473135,6,"저자 조남주 작가가 몇 년생인지 보니 1978년생.이 시리즈에는 1968년생 이장욱 작가도 있다.책 나온 지 그래도 몇 년 되었으니, 50 안 넘으면 젊은 작가로 보나 보다.이 괜한 반가움은 나이든 탓인가 보다."
9788937473135,10,여성이라면 누구나 공감할만한 보편적인 이야기
9788937473135,10,나도 그랬지. 하며 읽은 책
9788937473135,2,차라리 백지를 보고 있는것이 더 유익할듯
9788937473135,10,"여성으로 산다는건 우리나라에서 유리천장이 괜히 나온것이 아니겠지. 1,500원 커피를 마시며 된장녀 소리를 듣는 김지영을 보며 공감을 느낀다.나또한 상대방의 상황 파악하지 않고 펙폭 날린적은 없는지 돌아보게 된다."
9788937473135,10,"왜 많은 사람이 이 책에 공감하는가, 왜 어떤 사람은 불편하게 느끼는가. 우리 사회가 점점 더 나은 방향으로 가야 하며, 변화해갈 것이라는 하나의 계기."
9788937473135,10,"평은 처음 남기네요..영화를 보고 책을 읽었습니다.영화를 보고 실망스럽고, 내 삶이 더 힘들다..라는 생각을 했습니다.영화는 약간 육아에 초점이 맞춰져 있다면, 책은 삶의 있습니다.그동안 불합리라 생각못했던..당연히 그렇다고 생각했었던작가가 참 많이 고민하고 만든 책이라는 생각이 들었"
9788937473135,10,망상이라고 공감할 수 없다고 말 하는 사람들이 너무 부럽다.  겪어보지 않아서 공감이 가지 않는다면 피해 받은 사람들의 입장을 생각하려는 노력이라도 한다면 얼마나 좋을까. 아버지들의 청년들의 고통에는 그렇게 공감하고 가슴아파 하는 사람들이 왜 여성의 서사에는 이렇게 불편해 하는지.
