ISBN13,rating,review
9788993456639,10,"내용이 알차고, 많은 도움이 됩니다"
9788968325564,8,복습하는 단계로 풀어 보니 괜찮아요.
9788926147412,10,초등생 아들의 수학을 이끌어준 책입니다.
9791125935964,8,"가볍게 복습 개념으로 단원 마무리하면서 풀리기 좋아요. 현재 심화 경시 기출 문제 2회만 제외하고 모두 다 풀렸는데, 문제가 경시대회라고 하기엔 좀 많이 쉬워요. 어려운 경시문제 풀릴 분들은 패스하심이 좋을 듯해요."
9788928629800,10,"과학자가 꿈이라는 아이에게 꿈을 키우기 위해 어떤 길을 제시 해야할지 몰라 고민하던 중에 이 책을 알게 되었어요.흥미로운 주제와 보고서를 쓰는 방법, 그리고 궁금증을 해결하는 모든 것들이 알차게 구성되어 있어서 많은 도움이 될 것 같습니다.다행이도 오늘 받아본 책을 아이도 좋아하네요~."
9788947529396,10,경제학의 기초적인 부분을 쉽게 공부할 수 있었기 때문이다
