ISBN13,rating,review
9788968487316,8,데이터 설계에 대해 궁금하던 차에 읽고 도움이 됐습니다.
9788968487316,10,책 전반부에서는 유저의 입장에서 데이터베이스를 사용할 때 경제적으로 고려할점이나기술적으로 고민해야할 점들을 서술해 놓은점이 인상적이었다.
9788931454727,6,얉고 넓은 네트워크 통신에대한 내용을 주로 다룬다.마지막으로 갈수록 내용이 대충인 듯한 느낌이 없지않아 있지만입문자라면 처음 한번 훑기에 나쁘지 않다.
9788931454727,10,일본 아마존 네트워크 분야 베스트 셀러라고 한다 학교 다닐때 이해보단 달달 외우기만 했는데.. 이책을 읽어보니 풍부한 그림과 이해하기 쉽게 단계적 이해(?)라고해야되나공통점 정의 하나씩추가하면서 설명하는방식이 이해하기 쉽고 그림도 많아서 좋았다
9788931454727,10,네트워크 처음 공부하기에 좋네요!!
9788968482878,8,비싼 책이지만 읽는 내내 충격을 감추지 못했음.
9788968482878,6,원서를 제본까지 떠서 가지고 있지만..번역서로 나와서 구매했습니다.음..솔직히 가격이 너무 센거 같습니다.
9788968482878,6,원서를 알고 있었어서 이번에 번역서가 나온다는 소식에 주저없이 구매했습니다만...이 책의 가격은 좀 너무 센 거 아닌가 하는 생각이 듭니다.
9791158390389,4,하.. 진심 리눅스 할줄모르면 구매하지 마세요초반에 설치가 중요한데 솔직히 배우는 사람은 한대의pc로 수행하는데 혼자 여려대 pc로 수행할경우 설치하는것만 보여줍니다.진심 하다가 인터넷 찾아서 하는게 더 빠를정도로 가상분산 하둡설치는 그냥 불친절하게 설명합니다.
9788966261703,2,부탁입니다. 번역 다시 해서 천천히 재출간 해주십시오. 부탁드립니다. 제발요. 좋은 책을 번역 문제로 이렇게 사람들에게 실망을 주는 것은 정말 슬픈 일입니다.
9788966261703,10,단순한 아이디어를 엮어서 복잡한 생각을 만든다. 어떻게? 이 책이 답을 알려준다.
9791158390174,10,말이 필요 없는 명서..  자바 ORM 표준 JPA 프로그래밍과 같이 보면 아주 굿굿
9788968482212,2,"일부러 글을 멋부려 써서 불필요한 군더더기가 많고, 핵심을 미리 말 안하고 말을 뱅뱅돌림책을 읽다보면 육하원칙대로 안써서 독자가 이해하기힘든 부분이 많음, 그래도 꾹 참고 읽다가 도무지 중도 포기함대학 전공서적은 대부분 안그러던데 유독 DB 쪽 기술서적중에 이런 책들이 많더라."
9788968482212,10,환기
9788968482212,6,"초보자에 입장에서는, 삽화가 많지만 초보자가 보기에 적당한 책은 아니며 개념이 잘 설명되어 있지도 않아서 학습을 위한 책도 아니라고 생각한다. 조금은 알고 있는 사람이 방향을 정하기 위해서는 도움이 될수는 있을듯하다."
9788968482212,10,책의 서문에서 말하듯이 현실적인 데이터 모델링 능력을 향상 시켜주는 책입니다. 처음에는 조금 낯설지만 다시 곱씹어 읽으면 저자가 얼마나 고민하면서 써 내려갔는지 알 수 있습니다.
9788968482212,10,스토리텔링식으로 친근하게 핵심을 잘 꿰뚫어주며 실무에 쓰는 내용을 엿볼 수 있어 어설프게 공부한 초보자에게 정리를 해주는 정말 필요한 책입니다. 추천합니다.완전한 초보자도 대충 1회독 하고 두 번 보면 전부 습득할 수 있을 것 같습니다.
9788960881662,10,사이툴만 다룰수있는 쌩초보였습니다.책 덕분에 포토샵 공부를 시작하게되었어요.일러스트레이터에 대해 자세히 써주셔서 좋은 공부가 되고있습니다저자님께 감사합니다 잘 설명해주셔서 어렵지않아요
9788960881662,8,"보통 작법서를 보면 자주  ｀여기서 무슨일이 일어났길래 이렇게 된거지..?｀ 라는 생각을 하게되는데요, 이 작법서를 읽으면서는 그런 생각이 한번도 안들었습니다. 세세하고 알기 쉽게 잘 나와있네요."
9788960881662,8,포토샵을 이용한 기본적인 채색 스킬을배워가는데 도움이 되는 책입니다.
9788960881662,10,"우선, 안타깝게도 데생에 필요한 부분이 조금밖에 없어서 아쉬웠지만, 그것을 만회할 수 있을 정도로, 정밀한 설명과 이미지 그리고다양한 방법들을 알 수가 있어서 정말로 좋았습니다.추천을 10에 10을 주고 싶네요^^"
9788960881662,10,미리 구매했지만.... 그림 그리는데 정말 자세히 적어준 책입니다. 최고에요. 책도 정말 두꺼워요
9788960881662,8,초짜용이라기보단 정말 TCG일러스트 입문에대한 책임으로 어느정도 지식있는분들이 구매하시는게 좋아요 알차고 좋습니다!
9788960881662,10,설명도 적절하고 일러스트들 수준이 상당하네요
9788960881662,10,일러스트가맘에듭니다
9788960881662,10,구매예정인 도서!
9788960881662,8,안읽어봤지만 일러스트에 관심이 많고 표지가 되게 이뻐서 나중에 한번 사보고싶다.
9788960881662,10,이 이상으로 더욱 완벽한 작법서가 있을 수가 없습니다.
9788960881662,10,그림을 잘 그리고싶엇는데 이 책을 보고 모르던 부분을 보충할 수 있었습니다. 그리고 안에 들어있는 일러들이 너무 이뻐서...
9788960881662,10,일러스트 작법 가이드
9788960881662,10,그림이 예쁩니다
9788960881662,10,괜찮아보여요
9788960881662,10,갖구싶은 책...
9788960881662,10,좋음.
9788960881662,8,이런 화풍의 일러스트 과정을 세세하게 서술해놓은 책은 저는 처음봤어요책으로는 아무래도 한계가 있다보니 동영상도 있었으면 하는 아쉬움은 있네요
9788960881662,10,가지고싶은데 아직 못샀지만 꼭 소장하고 싶은 책 ㅠㅠㅠ
9788960881662,10,헣ㅎ헣
9788960881662,8,이런책도 나오니 좋네요.
9788960881662,10,관심가는 책입니다.
9788960881662,10,그림 그리기 도움이 많이 될것 같네요. 개인적으로 추천하고 싶은 책입니다.
9788960881662,10,도움이 많이 될것 같네요
9788960881662,10,그림 그리기 좋아서
9788960881662,6,일러스트에 관심이 많아서요
9788960881662,10,좋다고 여겨지는 책
9788960881662,10,일러스트 레이터를 지망하는 사람이라면 한번쯤은 보는 것도 나쁘지는 않을 것 같다. 프로 일러스트 레이터들이 쓰는 책이라면 신용도 가고 그들이 겪고 배운 지식들을 우리가 다시 배울수 있기 때문에 이책을 추천한다.
9788960881662,10,일러스트와 그림 그리기에 관심이 많아서 읽어보고 싶어요.
9788960881662,10,썩 괜찮았음
9788960881662,10,볼맛날듯
9788960881662,10,그림 잘 그리고 싶어요 ㅠ
9788960881662,10,그림 짱짱맨
9788960881662,10,이거사고싶음 적립 깁미
9788960881662,10,이거 진짜 최고더라구요 그림실력많이일어났어요
9788960881662,10,존잘니뮤.....
9788960881662,10,일러 잘그리고싶다
9788960881662,10,일러스트 그리기를 좋아하여 보게 되었습니다. 추천해드립니다.
9788960881662,10,관심있는 책입니다. 조만간 구매해볼까 생각중입니다.
9788960881662,10,좋아요
9788960881662,10,많이 도움이 됩니다.
9788960881662,10,핫한 카드겜
9788960881662,10,매우 도움이 됩니다
9788960881662,10,저에겐 이책이 최고인것 같네요.
9788960881662,10,일러스트가 아름답네요.
9788960881662,10,일러스트레이터 지망생으로서 정말 많은 도움이 되었다. 저말고 다른 지망생에게도 감히 추천해주고픈 책이다!
9788960881662,10,일러스트 공부에 많은 도움이됩니다.
9788960881662,10,일러스트를 좋아하는 본인으로써는 마음에 들었음.
9788960881662,10,사고싶다
9788960881662,10,제 취향입니다!
9788960881662,10,표지 일러부터 맘에듬ㅎ
9788960881662,10,새로운 형식 을 알게돼었고 친절하게 설명했다
9788960881662,10,트레이딩 카드게임 일러스트를 다룬 국내 일러스트 작법서라서 무척 반가웠습니다.
9788960881662,10,일러스트가 꼴릿하다
9788960881662,10,만화를 좋아하는 사람에게 이유가 필요하지는 않음
9788960881662,10,그림그릴때참고하기조음
9788960881662,10,재미있습니다.
9788960881662,8,일러스트에 기초적인 도움을 주는 책
9788960881662,10,게임 일러스트를 배우기에 적합합니다. 보통 게임 일러스트 학원 다닐 돈이 부담스럽다면 일단 이 책을 보는걸 추천하고 싶네요
9788960881662,10,일러스트 중요
9788960881662,10,개~~조은~~~
9788960881662,10,나름 참조가 되네요
9788960881662,10,일러스트에 대한 도움이 많이 되었습니다.
9788960881662,10,일러스트에 관심이있어요!
9788960881662,10,일러가 이뻐보입니다
9788960881662,10,너무 마음에 들어요!!
9788960881662,10,잘받았습니다.
9788960881662,10,"그림쪽 서적을찾던도중  보이던게 TCG 일러스트 작법서였습니다  작가님 블로그를 보고 구매를 결심했는데요! 역시나 책을 받고 보니 일러스트들의 구체적인 작업방식, 툴에 대한 식들이 빼곡히  있고 처음보는 들을 위해 포토샾 사용법, 인물 그리는 법등 많이 수록되어있어서 매우만족스럽습니다 ㅎ"
9791185553139,10,좋은 책인것 같아요
9791185553139,10,"SEO자료도 부족하지만, Wordpress관련된 SEO자료는 더욱 부족하다. Wordpress를 생각하면 꼭 함께 고려되는 SEO. 이 책은 그런 면에서 Wordpress Project를 진행하는 모든 사람이 읽어야할 책이라고 생각한다."
9788966189953,8,부록으로 있는 자료들을 활용하여 다양한 실습을 할 수 있어 초보자가 자신의 실력을 향상시키기 좋은 교재입니다.
9788966189953,10,게임 제작에 관심있는 분께 추천하고 싶네요
9788966189953,10,게임에 관심있으신 분들 읽어보세요 공부 많이 됩니다.
9788966189953,6,흥미롭습니다.
9788966189953,10,게임을 직접 만들어볼수 있다니 정말 신기하네요
9788966189953,10,게임에 대해 관심이 많았는데 정말 좋은 교재가 될것 같아요
9788966189953,10,관심있는 분야여서 많은 공부가 될듯 합니다.
9788960776005,10,"세부적으로 게임 기획에서 중요한 항목들이 잘 나열되어있네요. 게임기획 현업인이나 지망생, 게임 기획에 관심있는 모든 분이 보셔도 좋은 책입니다. 각 항목별로 정보를 세부적으로 잘 설명해 놓았으며 보기 쉽게 항목을 나열해 놓아 간단히 읽기 좋습니다. 나중에 교재로 활용하고 싶은 정도네요."
9788965400677,10,Java web 프로그래밍 전반에 대해 이해할 수 있는 좋은 책 입니다. 프레임워크 없이 시작해서 db connection pooling 거쳐 mybatis에서 spring까지 구성도 좋고 내용도 훌륭합니다
9788965400677,8,Java 웹개발 실제 개발 스킬 쌓는 목적으로는 제일 좋은 책 같습니다. 다른 책들 검토해보고 내린 결론...
9788965400677,10,엄진영강사님 비트 학원에서 2013년에 강의를 듣고. 워낙 대단하신 분이라 얼마전에 블로그에 책 내셨다는 얘기보구 바로 구입했습니다~ 책내용은 개발자로서 이 책을 안사는건 시간낭비다 라고 말씀드릴수 있겠습니다 .
9788965400677,8,"책은 아직 모르겠으나 저자 소개에 보면 1995년에 웹브라우저와 웹에디터를 개발했다고 하는데, 맞는 정보인가요? 모자이크가 93년에 만들어졌는데 95년에 한국에서 브라우저를 개발했다니요?"
9788997716357,4,"크툴루와 관련된 신화에 대한 설명이라기 보단, 크툴루 신화의 뒷 이야기를 설명한 책.구성이 어떤 신화적 존재가 어느 책에서 먼저 등장했고, 어느 어느 책에 영향을 줬다. 하는 식으로 작성되있어서 크툴루 신화 그 자체를 이해하는 데, 별 도움이 안됩니다."
9788997716357,8,잘 나와있어서 좋은데 글자가 째깍째깍해서 읽다보면 머리를 책상에 박고있어요
9788997716357,10,"TRPG 크툴루의 부름을 플레이할 때 참고용으로 샀다. 내용이 풍부하고 이해하기 쉬우며, 각 페이지마다 같이 읽으면 좋은 책이 나와있어 좋은 자료집으로 쓰고 있다"
9788997716357,10,러브크래프트 전집과 함께 읽어요.
9788966260980,10,프로그래머 또는 프로그래머와 같이 일하는 사람들을 위한 고전. 25년이 지나도 원문 수정할 것이 없다는 점 또한 재미있다. 사람 마음은 그만큼 잘 변하지 않는 것이다. 동의.
9788960774506,10,"책을 구입하고 그에 대한 서평을 적은 적이 없는데, 이책 아주 괜찮습니다.
왠만한 대학 교수가 만든 책보다 더 좋습니다. 특히 그림에 핵심 요약 내용 문구를 삽입한건 정말 좋습니다. 추천합니다."
9788992649964,6,적용해서 사용하기에는...애매한 부분이 있다.
9788994506487,8,배송도 빠르고 완전 좋아요
9788965400288,8,ABAP 배우기에 매우 좋은 책입니다. 전자책으로도 나오면 좋겠습니다.
9788965400288,8,abap 배울 때 도움이 많이 된다는 이야기를 들었음.
9788992939850,2,뭘 읽었는지 모르겠음
9788992939850,4,내용은 장황하기 그지 없으나 정작 가려운 부분은 그대로이더라
9788992939850,8,기대됩니다.
9788996241027,10,괜찮습니다 상당히 유익합니다.
9788996241027,10,리눅스 관련 기초 명령어부터 차근차근 알려줘서 배우기 좋았어요!
9788979146608,6,한번쯤 읽고 지나가면 도움이 됩니다.
9788979146608,10,제안업무를 이토록 사실적으로 안내하는 책은 못본것 같다. 제안업무담당자 필독서.
9788979145601,10,입문자에게 언제나 최고인 Head First의 SQL입니다.쉽고 재밌게 공부했습니다.데이터베이스에 대한 막연함을 벗어날 수 있어 참 좋았어요.
9788979145601,10,내용을 쉽게 설명해서 이해하기 쉬워요
9788979145601,8,SQL이 뭔지도 모르던 저에게 최고의 책입니다. 다만 중급자 이상은 별로 배울 게 없을것 같네요.
9788979145601,10,그냥 무난함 그자체인듯합니다.
9788979145601,8,가벼운 마음으로 일고 있습니다. 약간의 기초가 있는분은 소설책 읽듯이...
9791161754659,2,"예제가 많긴 한데 말 그대로 예제 코드만 던져주는 수준이라 초보자가 이걸 보고 따라하기는 불가능에 가깝습니다.그렇다고 숙련자가 보기에는 4.26.0 기준으로 삭제되었거나, Deprecated 된 메소드를 굉장히 많이 사용하는데다 번역의 문제인지는 몰라도 각 기능에 대한 설명이 매우 부실하네요."
9791161754659,4,목차 중 ‘GameplayAbility API - AttributeSet으로 통계 구현‘GameplayAbility 로 통계 기능도 처리할 수 있나..?Stat 을 통계로 번역해서 한참을 헤맸습니다.번역이 좀 아쉽네요
9791162243725,4,최신간임에도 불구하고 Swift 4와 Xcode 9(책의 앞 부분은 6.1)을 기준으로 하고 있습니다. 1쇄라 그런지 물음표를 자아내게 하는 편집도 있어요. 책 내용이 얼마나 좋은지를 떠나 책 표지와 소개에 컴퓨터 서적으로 가장 중요한 언어와 IDE 버전을 명시하지 않았다는 점은 납득할 수가 없습니다.
9788965402817,10,여러 RPA 솔루션이 있지만 국내에서 만든 RPA 솔루션이 책으로 나와서 관심있게 보고 있습니다. 프로그래밍을 모르는 사람도 책을 보면서 업무 자동화를 쉽게 만들어 볼 수 있을 것 같습니다.
9791161754482,2,다음과 같은 이유로 추천하지 않습니다.시험 버전 SAA-C01이 만료되고 SAA-C02로 바뀐 시점에 책이 나옴시험 내용의 개략적인 소개에 지나지 않음연습문제가 실제 시험 문제보다 매우 단순오타나 문제 오류가 보이지만 정오표 올라오지 않음결론: 시험에 참고는 될 수 있음.
9791162243053,8,BPF 라이브러리가 갖는 각종 기능에 대해 여러 예제와 더불어 설명한 책다만 책 자체의 목적 상 리눅스 시스템에 어느 정도 숙련된 경우가 아니라면 추천하기 힘들 것 같다.종이책보다는 전자책이 활용에 더 도움이 될 것으로 보인다.
9788931461763,10,답답하고 딴소리하는 챗봇의 세대는 이제 끝!!! 똑똑한 녀석으로 똑부러지게 일잘하는 챗봇을 만들어 보세요~
9788995447451,10,SQL을 배우기 시작하고자 하는 분들께 더 없이 좋은 책 같습니다.~!
9788931461633,4,"내용이 너무 옅고 별 내용없어서, 안 사시는 걸 추천드려요. 꼭 구매하셔야겠다면... 가까운 도서관에서 빌려서 훑어본 후에 구매 결정하세요."
9788931461633,2,안드로이드 스튜디오 세팅하는 것 외엔 내용이 너무 없네요. 책도 심하게 얇고 아무리 초심자 대상이라지만 제목만 얘기하고 다른 책 읽으라는 식이라 황당했음
9788931461633,10,진짜 하루는 아닌 거 같지만…쨌든 만들 때 꽤나 도움이 되는 건 사실이네요~
9788931461633,10,자세한 설명과 기초적인 내용들이 많아서 관심있는 초보자들이 보기에 참 좋은거 같아요
9788931461633,10,호기심으로 구매하였습니다. 초보도 만들 수 있는지... 궁금함에! 스마트시대에 공부해 놓으면 좋을 것 같아서요!!^^ 오늘부터 차분히 읽어보겠습니다ㅎㅎㅎ
9788931461633,8,이 책을 안드로이드 스튜디오와 코딩에 대한 경험이 아예 없는 분들에게 추천드립니다.책을 처음 읽었을 때 최대한 쉽게 설명하려 했다라는 느낌을 받았습니다. 허나 그만큼 깊이 설명하는 부분은 모자랐던 것 같습니다.그리고 자바 책을 하나 추가로 사야할 것 같습니다.
9791188621712,10,목차에 나온 주제들이 다소 뻔하고 당연한 것들 같아 보이지만 읽어 보면 도움이 많이 됩니다.
9791188621712,2,"읽어도 읽어도, 글 쓴이는 무슨 말을 하고 싶은 걸까 생각하게 만들었습니다. 이 책을 읽기에는 제가 부족한가봅니다."
9791188621712,10,"서론은 다소 추상적이고 두루뭉술했는데, 읽으면서 실용적으로 사용할 수 있는 다양한 방법을 제시해주는 점이 좋았습니다. 기억력 이야기할 때 지겹게 인용하는 에빙하우스가 안 나온 것도 좋았어요. IT와 상관없이 늘 무엇인가를 많이 배우고 창조해야 하는 사람은 재미있게 읽을 수 있을 듯합니다."
9791161753560,10,그저 빛
9791161753560,10,몇안되는 정석
9791161753560,6,게임 코딩하는데 꽤 팁과 도움되는 부분이 있어 괜찮은 책. 다만 이책이 기초 게임 서적임을 감안할때 그냥 2D 게임로직과 C++ 게임 클래스 만드는 과정을 좀더 심화적으로 더 파는게 나았을거 같음 솔직히 3D Opengl 넣은건 솔직 너무 무리수였다고봄...  600페이지 가량 분량에 너무 욕심을 낸거같음
9791161753560,10,갓북...
9791161340548,6,너무직역이라 읽기 힘들어요
9791188621545,4,"html,css,js,제이쿼리,php 모두 입문서 정도만 뗀 입문자입니당.어렵습니다. 뭔소린지 잘 모르게습니당...js는 잘하시는 분이 봐야 할 것 같습니다...고양이는 못 할 것 같습니다.."
9791188621545,10,"프론트개발을 꿈꾸고 있는 디블리셔입니다. 새로운 언어를 습득할때 인터넷 뒤져보다가 이렇게 디테일한 예시를 한번에 모아서 찾아보기 어려워 결국 책을 찾게 되는 것 같습니다. 특히 책에 나온 트랜지션, svg 관련 기술은 실무에서 바로 적용해보려고 합니다. 고양이도 할 수 있게 만들어주는 책!"
9791161752945,4,"책 내용은 좋은데, 원서 266페이지짜리를 429페이지로 만들어서 들고 다니지도 못하게 디자인 하는건 무엇때문인지. 편집에 3명이나 이름이 올라가 있던데 독자들의 읽기 편한 환경에 대한 의견은 없었을까? 제발 책값 부풀리기가 아니라 독자 중심으로 생각해주길 바란다."
9791161752945,6,책 자체 내용은 괜찮은 거 같은 데 번역이 심하다. 옮긴이 말처럼 용어가 어려운 건 알겠지만 용어 번역 문제가 아닌듯 한국어 어순으로 무슨 말인지 이해할 수 없는 말이 많아서 책 자체의 가독성이 심하게 떨어짐. 안그래도 이해하기 쉽지않은 책인데 번역탓에 난이도가 훨씬 더 어려워짐
9791196672430,10,관심있는 내용이어서 기대됩니다.
9788970938905,10,라즈베리파이 내용이 전문적이고 꽤 깊이가 있음.파이썬 부분 또한  이해하기 쉽게 설명이 잘 되어 있음
9791157831357,10,거의 베이스부터 차근차근 설명해주신덕에 절차지향이 아닌 객체지향은 어떤식으로 코드를 짜야하는가에 대한 제 의문점을 해결해준 책이라 생각합니다. 좋은 책 내주셔서 너무 감사드립니다!
9791157831357,10,객체지향이 실용적으로 잘 설명되어있네요~감사합니다^^
9791162241479,6,재미있고 술술 읽히기는 하는데....남는게 많지않네.내가 과문해서 그럴지도 모르겠음.
9791162241479,10,"이 책을 왜 쓰게 되었는지 작가는 이렇게 말한다. “내가 하는 일, 데이터를 다루고 표현하는 것을 쉽게 설명할 방법이 무엇일 지 고민하였다.”한다. “세상의 모든 일은 한 걸음부터 시작된다.”며  역사 속에 숨어 있는 흥미진진한 데이터 이야기를 아주 재미나게 풀어서 끝까지 단숨에 읽게 만든다"
9791186886908,10,아직 다 보진 않았지만 배송도 빨라서 좋았네요.
9791196203757,8,인프라 운영/데이터 엔지니어로 필요하여 구매합니다.
9791158391263,6,리액트를 잘 아는 사람이 대충 훑어 볼 계획이라면 몰라도 초보자가 읽기엔 부담이 되는 내용입니다. 필요한 사항은 다 있는 것 같아도 설명이 하술하기 때문에 이책만 보고 이해하기 어려울 것 같네요.특히 10장의 실습예제는 중요한 라우터 기동까지 하면서 앱제작과정을 볼 수 있었습니다.
9791158391263,8,"제대로 따라하면서 읽지는 못해서 단언하긴 어렵지만,전체적으로 나쁘진 않다고 생각합니다.다만 일부 예제나 설명이 종종 혼란스러운 느낌을 줄 때가 있습니다."
9791188621408,8,리눅스의 구조 같은 것을 차근차근 알려주는 점은 종습니다. 근데 확실히 책 소개에서도 그랬던 것처럼 리눅스를 어느 정도 다룰 줄 아는 사람이 보면 괜찮을 것 같은 난이도입니다. + C언어 코딩도요. 예제에 쓰이는 코드에 대해서 설명을 해주긴하는데 친절한 설명은 아니에요
9791158391218,8,스프링 마이크로 서비스에 대해서 설명이 자세할 것 같아서 구매합니다.
9791161752082,10,"기초적이고 필수적인 내용들을 많이 다루고 있습니다만 중간중간 코드가 스타일 가이드와 다소 어긋나는 부분이 있으니 꼼꼼히 공부하고자 하시는 분이라면 golint, gofmt와 같은 도구 또는 이를 지원해주는 코드 에디터를 이용하시길 권해드립니다."
9791161752082,10,고랭 붐은 온다..
9791162241264,6,그냥 간편하게 보기엔 괜찮은정도인거같습니다.생각보다 내용이 알차다는 느낌은 못받았어요.또한 설명이 엄청 상세하다고 느껴지지않습니다.
9788960882348,2,수박 겉핥기식
9788960882348,10,"아주 괜찮게 읽었습니다. 이해하기도 쉽고, 현업에서 필요한 내용들이 잘 담겨 있는 것 같아 업무 적용하기 수월해보이네요!"
9788960882348,10,기존 책들이 너무 메뉴얼이라 실무 내용이 궁금했는데 원하던 책이 나온듯 합니다.
9791186710357,6,지나치게 예제 따라하기방식입니다 이론설명이 초반에 나온후 나머진 예제 소스 완성해가는 방식입니다
9791186710357,10,새로운 기술을 익히는 건 우리 개발자의 삶에선 숙명(?)과 같은 일일 것이다. 프런트엔드 개발에서 이젠 빠질 수 없는 필수 라이브러리가 되어버린 RxJS라는 강력한 무기를 빠른 시간 안에 배워 내것으로 만들자!!!
9791186697665,2,"예제 파일은 어디서 받는지 적혀 있지도 않고, 설명하는 내용이랑 그림은 위치가 다르고... 출판사가 책 내기전에 읽어나 봤는지 모르겠네요. 다시는 이 출판사 책 사지 않아야겠습니다."
9791195942527,10,회사에서 Oracle 11c에서 12c로 업그레이드를 하면서 DB관리하는데 많은 어려움을 느끼고 있는 상황에서 해당 책을 접하고 DB운영업무에 많은 도움을 받았습니다. RMAN 백업/복구 부분도 잘 모르는 부분이었는데 예시가 잘 설명되어 있어 장애시 빠른 대처가 가능할 거 같습니다.
9791195942527,10,Oracle RMAN 과 ASM  에 대해서 알기 쉽게 예제로 설명한 책 ...
9791188621149,10,해들리 위컴님의 은총
9791186710302,8,내용 알차고 좋은데 오타가 너무 많습니다.
9791188621200,8,국내저자 도서중에 가장 깊이 있지만 난이도가 스텝바이스텝은 아닙니다 하지만 내용은 참 좋습니다
9788940635773,2,"내용이 부실함, 심지어 연습실습문제는 책에 설명안된부분이 문제로 나옴(그만큼 내용이 부실함)"
