ISBN13,rating,review
9788970508887,8,책은 쉽고 초보자가 배우기도 적합합니다. 레퍼런스북을 원하는 분이라면 다른책을 추천합니다.
9788970508887,8,이책 수정판 인가요????
9788970508887,10,이거 수정판 맞나요?
9791156644552,10,"이책만 읽고 뭔가를 할 수 있게 된다하기 보다는, 웹페이지가 어떤식으로 구성된다는 대략적인 상식정도를 갖출 수 있다는 느낌이네요.그야말로 초보용 입문서로는 충분한듯 합니다."
9791196395773,10,수학의 정석 같은 느낌이랄까....
9791196395773,10,Sqld를 준비하는 분들에게 반드시 필요한 책이네요~!
9791187370949,10,"R 과 데이터 분석 두가지를 처음 접했는데, 그 두가지를 적절하게 소개하고 활용하는 방법 등 그리고 분야를 넓히는 방법까지 알수 있게 되었다. 기초부터 차근차근의 스타일은 아니고, 바로 본론으로 들어간 느낌이다. 그래서 오히려 더 재미있게 접할 수 있던 것 같다."
9791187370949,10,제가 원하던 기초 문법이 잘 나와있어서 공부하기 너무 좋았던 것 같아요. 만족합니다 !
9791187370949,10,따라해보며 실습하기가 좋습니다. 설명도 잘 되어 있구요. 다만 텍스트 마이닝 쪽에 언급된 라이브러리가 현재 책에 설명된 방법으로 다운로드 및 설치가 안되는 상태이더라구요. 그거 구글링 해가며 해결하느라 애 좀 먹었습니다. 책 구성 및 내용은 좋습니다.
9791187370949,10,많은 프로그래밍 입문자용 책을 읽었는데 정말 잘 읽히고 적절한 예제가 많아서 쉽게 익힐 수 있었습니다. 덕분에 R이 어떤 언어인지 그리고 어떻게 쓰는지 알았으며 전공을 들으면서 다방면으로 응용할 수 있었습니다.
9791187370949,6,도적 중의 도적. 그림 그리기 연습
9791187370949,10,초보자가 접근하기 쉽게 되어있다!
9791187370949,8,요즘 R을 통한 데이터 분석을 많이 하고 있는데요. 그 중에서도 조금 더 쉽게 R을 이해할 수 있도록 도와주는 책입니다. 초보자에게 필요한 책인 것 같아요.
9791187370949,10,프로그래밍 경험이 없어도 쉽게 따라할 수 있습니다. 따라하다가 실수하거나 시행 착오가 있을 만한 부분에 대해서도 잘 설명되어 있습니다. 저자의 github에도 자료가 잘 설명되어 있습니다. 전체적으로 만족합니다.(내용   책 편집   가격)
9791187370949,8,"R을 처음 접하는 사람에게 용기와 흥미를 갖게하는 좋은 입무서입니다. 자세한 기초 설명보다는 바로 데이터프레임,그래프를 다루어 볼 수 있게 구성되어 있습니다. 대신, 여러 설명을 많이 생략했기 때문에 이 책 다음에 좀 더 자세한 책을 볼때 당황할 수 있겠습니다."
9791187370949,10,철저히 실습 위주의 책입니다. R이 어려울까봐 두려운 사람들에게 훌륭한 입문서가 되어 줄 것입니다. 여러 좋은 팁과 간단하게 적용하도록 하는 문제가 곳곳에 있어 지루하지 않게 해줍니다. 개인적으로 컬러라 좋았습니다.
9791162243077,10,이것이 포스트 코로나 시대의 산업 리더 한빛미디어와 자수성가 it 피플의 표본 갓동빈님의 만남이닷
9791162243077,4,유튭에서 많이 올라오길래 샀음. 확실히 책은 고퀄임. 음.. 근데 강의 없는 것도 있어서 아쉬움. 코테 첨이라 잘 모르는 것도 많은데 중간 중간 강의 없는 거 보면 좀 답답. 이해 안되면 그냥 넘어가야 되고. 뭐 책에 질문 깃허브에 올리면 답해준다고 해서 가봤더니..흠.. 강의 다 올려주시면 안돼요?
9791189909178,8,"기본 설명 파트도 괜찮고, 재미있는 문제들에 대해서 pythonic way를 잘 제시해주긴 하지만, 정작 문제풀이 파트에서는 왜 그 카테고리에 포함되는 문제인지, 어떻게 그 결론에 도달하는지 과정에 대한 설명이 부족한 것 같습니다."
9791189909178,10,전문성이 느껴지네요~~소장가치 훌륭한 책입니다.두고두고 공부하려구요^^
9791189909178,10,내용도 알차고 분량도 많아서 만족합니다. 단 처음부터 뛰어들기엔 추천하지 않습니다.
9791189909178,10,일단 사보았습니다
9788970506791,10,좋은 책 감사합니다
9788970506791,10,다른 데이터베이스와 다르게 호환성이 좋은 오라클 잘 배워보겠습니다.
9791162243039,10,코딩버전 수학책 수학익힘책 버전 느낌이에요! 진짜 초등학교 쌤이 알려주듯 0부터 열까지 다 알려줍니다! 저처럼 아무것도 모르는 분들께 너무너무 좋아요! 덕분어 코딩이 점점 더 재밌어져요!!
9791162243039,4,파이썬 세팅 내용 외에는 너무 기본적 연산 코딩 수준인데책의 목적이 뭔지 알수가 없다. 기분만 뭔가 해봤다는 문과생들의 헛된 만족인건지..알멩이가 없다.
9791162243039,10,좋은책임. do it말고 이거 사세요.
9791162243039,10,이미 코딩은 의무교육화 되었고 정부의 일자리 정책으로도 디지털 일자리 창출을 내세우고 있다. 4차 산업혁명을 앞두고 있는 지금  앞으로는 공고한 일자리가 아니라 거듭 학습과 일자리가 갱신될 시점이다. 이러한 시대에 코딩은 하나의 상식으로 자리매김할 것이다. 입문자 중의 입문자를 위한 저작
9791162243039,10,난해한 프로그래밍을 어떻게 얼만큼 접근해야할지 몰라 헤매고 있던 차에 읽고 동영상도 보게 되었는데요. 그림과 친절한 설명을 듣고 기본적인 개념과 용어에 대해 의미와 원리를 깨닫게 되었습니다.
9791162241516,10,다만 유니티를 어느정도 해봤다라는 사람에겐 추천하지 않는다. 입문서로만 추천
9791162241516,10,예제를 따라 만들어보면서 쉽게 익힐수 있습니다.
9791162241516,10,유니티로 게임을 만들 때 필요한 기본적인 지식을 완벽하게 배울 수 있습니다.
9791162241516,10,"이론에서 실전까지, 기초부터 심화과정까지 일목요연하게 망라된 필독도서라고 생각됩니다. 저자분 유튜브 채널에도 들어가봤는데 강의 동영상도 매우 유익하네요!"
9788992649209,10,"초보자에게 좋은 깔끔한 책입니다. 초급자 뿐만 아니라 중급자를 대상으로 하는 다른 책에서 언급하고 지나가곤 하는 중요기능들에 대해 꼼꼼히 잘 설명되어 있습니다. 각 예제에 대한 설명도 읽기 좋게 디자인되었고, 글도 술술 잘 읽힙니다."
9791156644446,2,이책은 ... 엄청 급하게 기능들을 짜집기만 한 느낌이 들어요.다른 책에 있는 내용들처럼 개념들 소개만 하는 느낌. 자세한 설명도 없고 예시는 거의 끝에 있는 부록에 있는 쇼핑몰 만들기 정도?
9788970504735,10,프로그래밍의 정석 파이썬은 기본적인 파이썬에대한 설명과 많은 연습문제로 구성하고있습니다. 마지막은 간단한 게임풀이로 확실히 쉽게 접근할수있도록 하였습니다. 저자의 유튜브에 강의까지 함께 할수있어서 더 쉽게 책을 읽을수 있었습니다. 파이썬에 관심있고 접해보신분께 추천드립니다
9788954754071,10,파이썬 배우려고 샀어요. 아무래도 책이 있으면 더 잘 공부하겠죠...?
9788954754071,8,"인공지능, 머신러닝, 딥러닝을 배우기 위해 기술서적으로 학습하고 있는데 수학이 상당히 많이 관련되어 있어  정석을 보며 고교수학을 다시 공부해야 할까 했는데 다행이 EBS에서 좋은서적과 동영상 강좌를 준비해 주어 고맙게 여긴다. 40대 후반에 다시 수학을 공부하게 될 줄 생각도 못했다. ㅎㅎ"
9788954754071,10,의외로 본격적인 AI책. 아무래도 파이썬 자체에 대한 설명은 조금 약한 편이라 파이썬을 알고 보면 더 좋을듯합니다(몰라도 따라 하면 되니 별 문제는 없어보입니다). 교육과정에 얽매이지 않고 인공지능에 필요한 수학을 꽤 깊이 다뤄놨습니다. 좋은 책이라고 생각합니다. 세상은 넓고 고수는 많다!
9788954754071,8,"AI에 필요한 간단한 수학 지식들을 빠르게 공부해볼 수 있는 책. AI를 공부해보려고 하는 데 수학이 부족하다, 잘 모른다고 생각 하는 사람이라면 반드시 한번 읽어볼만한 책."
9791162242742,10,"1판보다 번역도 좋고,  읽기 좋네요."
9791162242742,10,2탄이 드디어 나오네요..! 기대됩니다!
9791162242742,10,기대합니다
9791162242742,10,2판 번역본이 드디어 나오네요. 필독서!
9791162242742,10,기대되요
9791156641070,8,이 책에 나와있는 아누이노 실험을 하나씩 해보고 있는데 내용이나 구성이 잘 되어있네요 ㅎㅎ
9791156641070,10,대학교재 ㅎ
9788956748252,10,"색,명암 등에 대한 공부법까지 제시해주기 때문에 배경을 공부할 게 아니라도 도움이 되는 책입니다"
9788956748252,10,"초보자, 독학자 입장에서 차근차근 알려주니 좋습니다."
9788956748252,8,"실무의 꽃, 배경 일러에 교과서 같은 책. 너무너무 예쁘고 맘에듭니다. 증정엽서가 까딱 잘못하면 책을 손상시킬것같아서 포장지만 남겨둔채 꺼냈는데 이것들도 하나같이 예쁘네요. 잘 보겠습니다. 고마워용~^^"
9788956748252,10,너무 좋아요 최고
9788956748252,10,그림을 그리다 문득 배경의 부실함이 신경쓰여 주문했습니다. 초보자도 이해하기 쉽게 잘 설명해주셨고 기본기의 부재로 미처 신경쓰지 못한 부분도 꼼꼼히 짚어주셔서 독학하기 좋은 책인 것 같습니다.
9788956748252,10,책에 대해 쉽게 쓰여져있고 보기 좋아서 잘배우고 있습니다 ㅠㅠ
9788956748252,10,책을 5분의 1 분량정도 읽었는데 뭐야 엄청 도움 되네요! 진짜 추천해요. 안에 엽서도 너무 예뻐요ㅠㅠㅠㅠ 안에 있는 일러스트들도 너무 예쁘고 정말 아주 기초적인 부분부터 그림 효율적으로 그리는 팁들까지 잘 돼 있어서 도움이 엄청 많이 되는 것 같네요!
9788956748252,10,"설명이 굉장히 자세하고, 초보를 위한 드로잉이나 빛 이론과 연습방법도 있어서 좋습니다."
9788956748252,10,"배경을 진심으로 그리고 싶었는데, 무엇부터 해야할 지 몰랐습니다. 막상 시작하면 항상 어딘가 부족했구요..그런데 이 책을 천천히 읽어나가보니 정말 저같은 생초보도 끈기를 갖고 읽으니 많은 걸 얻었습니다! 맨 뒤에 엽서도 정말 이뻐요! 동봉된 방식이 조금 아쉬웠지만, 정말 최고예요 이 책은!!"
9788956748252,10,갓갓책이에요ㅠㅠㅠㅠㅠ
9788956748252,8,책을 받자마자 쭉 읽어보는데 내용이 알차고 상세해서 좋았습니다.
9788956748252,8,책은 잘받았습니다. 훑어 보는데 맘에 들어요. 다만 증정 엽서를.. 책 내지에 찍찍이..?같은 거로 붙이는 바람에 뜯어내는 과정에서 본책 컬러내지 한가운데가 우다다 뜯기고 말았어요.평소 책 보관에 힘 쓰는 사람인데 새 책 사자마자 뜯겨나가는 장면보니 할말잃은.. 코팅된 종이에붙이지그랬나요ㅠ
9791186710050,8,기존 번역본보다 가격적인 측면은 좋은데 여전히 흑백인쇄입니다. 문맥으로 이해가 돼서 모든 그림을 원서와 병행할 필요는 없지만 아쉽네요.
9791186710050,4,R버전은 차치하고서라도 왠만하면 코드 리뷰는 한번 해보고 출판을 했으면 좋겠습니다.
9791186710050,8,번역이 조금 아쉽긴 하다...
9791163032069,10,"단순히 개발에 대한 안내만 제공되는 것이 아니라 배포, 운영까지의 내용을 포함해서 장고 입문하시는 분은 하나의 프로젝트를 완벽하게 끝낼 수 있는 좋은 책입니다.완성도를 높일 수 있는 꿀팁들도 꽤 많아서 내가 웹개발을 하고 싶은데 어떻게 시작해야할지 고민일 때 매우 도움될 것 같습니다."
9791163032069,10,파이썬 기초문법을 익힌다음에 프로젝트형으로 공부하기 좋은 책입니다.
9788970933986,10,빅데이터 개념부터 확인하고 싶다면 추천. 빅데이터의 정의부터 데이터 수집 및 분석까지 개념을 정확하게 확립할 수 있다.
9791163031413,2,이책은 전혀 도움이 안된다고 생각이 됩니다...    이유  1. 코드올려놓은거랑 책에 적은거랑 비교 하면  엄청나게 차이가 있구요... 둘째... 그리고 책대로 코드를 작성하니깐 에러도 나고 그러네요..
9788968480911,10,진짜 강추한다. 이 책의 저자들이 Gof나 다른 패턴도 서술해서 출판해주면 무조건 살 의향이 있다.
9788968480911,10,기본적인 개념정리하기 좋은 책인 것 같다.
9788968480911,10,왠지 좋을 것 같아요.. 새책이 새책 처럼 안보이는 북 디자인이네요.
9788968480911,10,"이 책은 연습문제와 연습문제의 해답이 함께 있습니다. 객체에 대한 기본적인 개념과, 디자인패턴을 입문하기에 좋습니다. 학부4학년쯤에 여유를 갖고 읽으면, 괜찮을 것 같네요."
9791160508796,2,리액트 부분만 설명 하셨으면 좋았겠습니다.  관심도 없는   express mongodb koa 서버쪽  이건거 나오니까 중간까지 읽다가 닫고 다른 교재 찾고 있습니다.그리고 초보 책 아닙니다.
9791160508796,6,코드에 오타를 내거나 안넣어 놓거나 해서 쓸데없이 시간낭비를 시킴 이북인데 설마 오타겠어 하고 믿은 내가 바보였음
9791160508796,10,"비교적 최신에 쓰여진 글이라 쓰면서 몇 개의 오탈자 빼고는 따라가는데 전혀 지장도 없고, 굉장히 잘 쓰여진 책인 것 같습니다. 패스트캠퍼스에서 온라인 강의하는거 듣고 이 분 알게 됐는데, Todo말고는 프로젝트가 전혀 없어서 황당했는데 책엔 블로그 프로젝트가 있어서 좋네요!"
9791160508796,10,"입문서로 적절하고, 서술이 친절합니다."
9791160508796,10,쥐에에에엔장!!!! 개정판 믿고있었따구!!!!!
9791160508796,10,쥐엔장 2018년버전 책 산지 얼마안됐는데...
9791163030034,10,"html 태그 또한 속성과 값을 가진 객체입니다. 그러한 html 태그객체의 속성,값, 형태를 조작할 수 있게 도와주는 언어가 javascript 입니다. javascript, jquery에 대해 기초 정리가 덜 되거나 처음 접하시는 분에게 추천합니다."
9791163030034,6,"자바스크립트를 빠르게 돌릴 수 있는 책이다. 엄청 잘 하고 싶으면 자바스크립트 전문 서적을 보는 것을 추천드리고 어느정도 할 줄 알고, 복습용으로 적합하다."
9791163030034,4,책의 연습예시랑 완성파일이랑 다르고 책에 있는대로 해보면 작동이 안됩니다.  초보라서 따라하는 것만으로 벅찬데 예제가 혼란을 주는 것 같습니다. 다운로드 파일 최종 업뎃이 2017년도 파일이고 저는 2019년 구입. 특히 내장객체 부분... 이분야에잘모르는사람이라.리뷰 쓸까말까 하다가 남겨봅니
9791163030034,8,정말 열심히 만든 책이라고 생각합니다. 만드는데 정말 수고하셨습니다.그런데 오타가 한 두 곳이 아니네요. 전면 개정판이라서 그런듯. 재판 나올 때 오타 전부 수정해서 만들어 주신다면 더욱 완벽한 책이 될 것이라고 생각합니다.
9791163030034,4,친절해서 좋으나 개인적으로는 별로였어요. 저는 학원으로 배웠던 지식과 거의 유사해서 개념확장이 거의 없네요.
9791163030034,10,자바스크립트와 제이쿼리를 처음 공부하는 사람들에게 좋은 책이다. 체계적으로 공부할 수 있게 공부계획이 잘 짜져있고 여러 예제들을 통해서 이해하지 못했던 부분들이 잘 이해가 되었다. 입문자들에게 추천하는 책이다.
9791163030034,10,html과 css를 어느정도 배우고 자바스크립트 공부를 이 책으로 시작했는데 기초부터 자세히 나와있고 실습코딩을 따라하면서 많이 배울 수 있어서 좋았다.
9791163030034,10,"자바스크립트와 제이쿼리를 이 책을 통해 처음 접했는데, 이해 쏙쏙되게 설명되어 있었다. 이 책의 편집자들과 소통하는 카페에서는 질문도 나눌 수 있어서 이 책을 고르게 되었다. 반복 학습을 하며 실력을 더 길러야 겠다!"
9791163030034,8,php와 병행하면 좋을 듯 하다! ajax부분이 이해가 안된다! 입문용으로 딱인듯!
9791163030034,8,처음 자바스크립트와 제이쿼리를 배우는 사람들에게 입문용으로 좋은 책입니다. 동영상 강의와 소스 코드도 함께 제공되어서 독학으로 공부하기에 더 수월했던 것 같습니다!:)
9791163032311,10,국산 서적이 넉넉지 않아 걱정이었는데가뭄의 단비입니다
9791163032311,10,Do it 시리즈 답게 깔끔하고 핵심을 잘 짚어준다.
9788970508948,2,예제는 괜찮은 편이나 예제 소스에 오타가 많음. 소스를 돌려보고 오류가 없는지 확인을 하고 배포를 했으면 좋겠음.오타 수정하고 배포 좀 하시죠....
9788970508948,10,별점 1개 주고 나 혼자 보고싶을 정도입니다. 오탈자가 아직 많지만 공부하는 데 큰 지장은 없어서 만족합니다.
9788970508948,10,예제도 괜찮고 마음에 듭니다. C   OPENCV API 책과 더불어서 국내 책 중에 가장 좋은 책 이라고 생각합니다.
9791189909208,10,"관련 전공자는 아니지만 책의 내용이 궁금하여 구입해서 읽었습니다. 어렵지 않을까 걱정했었는데 개요와 예시 등이 적절하게 배치되어 있어 읽는 내내 흥미롭고 즐거웠습니다. 다만, 몇몇 전문용어가 원어 그대로 사용되고 있어 따로 뜻을 찾아봐야해서 초보자에겐 아쉬웠습니다. 좋은 책 감사합니다."
9788965402602,10,책이 정말 좋긴 한데 전자책이 없는 게 아쉽군요... 회사에서 시간날 때 보기는 전자책이 좋아서..
9788965402602,8,정말 주니어 개발자를 희망하는 젊은이들에게 너무나도 소중한 책입니다. 다만 피드백이 요즘엔 아예 없으신데다 다른 책들에 비해서 오류가 너무 많습니다. 그런 점들은 좀 많이 아쉬웠습니다.
9788965402602,10,책 정말 좋습니다. 실무를 이미 하고있어서 그런지 가볍게 읽으면서 적용이 가능했습니다. 자사 서비스의 트렌드를 제시해주고 스스로 구축해보기에 무리없이 잘 써주셨습니다. 감사합니다.
9788965402602,10,원래 리뷰 잘 안 적는데 너무 잘 공부하고 있어서 적습니당내용도 알차고 빠르게 웹개발부터 배포까지 할 수 있어서 좋아요!!저자분 깃허브에 이슈 올리면 답변도 빠르게 달아주시고 여러모로 많은 도움 받고 있습니다!!좋은 책 써주셔서 감사해요ㅎㅎ
9788998139766,10,정말 잘 읽었습니다. 이런 좋은 책 많이 만들어주세요.
9788998139766,10,공부하면서 느끼는 것은 객체지향 패러다임은 ‘조직‘내에서 이루어지는 행동들을 개념화하고 구조화하여 사용하고 있는 것 같다.협력이 이루어지기 위해서는 ‘책임‘이 전제가 되어야 한다는 것과 여러 구성원들의 요청과 응답으로 과제를 완수하며 목표를 향해 나아간다는 점이 더욱 그렇게 느껴진다.
9788998139766,4,글쎄요 저는 뭔가... 번역서 읽는 느낌였어요.
9788998139766,10,제발 앞으로도 책 많이 써주세요.출간하는 즉식 즉시 읽도록 하겠습니다.감사합니다.
9788998139766,8,좋은 책임은 틀림없다. 그러나 흔히 알고 있는 내용을 다른 측면에서 바라보기 때문에 다 알고 보는 사람과 배우기 위해 읽는 사람이 각각 읽었을 때 그 얻어가는 내용의 질량의깊이가  다를 수밖에 없다.
9788998139766,10,객체지향이 무엇인지 쉽고 빠르게 알 수 있는 소개서.
9788998139766,10,이 책은 객체지향을 주로 쓰는 프로그래머라면 필수적으로 읽어야 하는 책
9788998139766,10,"특정 언어에 대한 이야기는 최대한 배제한 채로, ｀객체 지향｀에 대한 개념을 다시 정립하려고 읽은 책인데 분량은 적지만 내용이 참으로 알차다. 멘탈 모델, 도메인 모델 등 학부 언어의미론 전공시간에 배웠던 개념을 프로그래밍에서도 그대로 적용한다는 점이 흥미롭다."
9791163032052,10,이지스퍼블리싱이 사이트 분석을 위한 책 ‘Do it! 구글 애널리틱스 입문을 읽게되었다.가장 큰 특징은 웹 사이트가 따로 없어도 데이터 분석을 연습할 수 있다는 점이다. 또한 실습 → 복습 → 도전으로 이어지는 100개 이상의 과제를 풀며 구글 애널리틱스의 기초를 탄탄히 다질 수 있다.
9791163032052,10,"그 전까지, 불친절하고 너무 ˝교과서˝같은 구글 애널리틱스 책이 대부분이었다면 친절히 실무까지 안내해주는 실전 입문서"
9791189184018,8,소스가 돌아가지 않는다는 것에 주의. 카페에서 파일을 제공해주시지만 실제 프로젝트 파일이 아니라 페이지파일뿐. 그거 빼고는 si 초심자가 보기에 적절한 내용. 좀 더 비싸지만 자바 웹을 다루는 기술이 인강도 주고 완성된 소스를 줌
9791189184018,10,저 나이서른초중반 프로그래밍 배운 지 1년도 되지 않은 학원출신인데 이 책으로 공부해서 SI인력사무소 피해서 취업 성공했습니다. 좀 어려울 수 있지만 정말 좋은 책입니다
9791160501315,4,막상 재미에 대한 진짜 이론은 없음.. 그냥 저자가 생각하는 게임이란 무엇인가? 가 좀더 정확한 제목일듯...어떻게 하면 사람들이 재미를 느끼게끔 게임을 기획하고 설계해야 하는가? 라는 질문데 답을 찾고자 하면 이책은 아닙니다. 이책이 왜 베스트셀러인지 이해가 안갑니다.
9791190665810,10,웹 프론트 개발을 시작하는 개발자 혹은 실무 경력이 있는 개발자에게도 매우 추천할 만한 책이다. 어른이 나이가 들면은 이런 말을 하지 않는가? ˝지금 아는 것을 그때도 알았다면?˝  웹 기술의 발달과 웹 브라우저의 호환성을 맞추기는 어려움이 많았지만 이 책은 그 어려움에 파 해법을 제시한다.
9788980782970,10,"스프링 입문자에게 최고의 가이드인거 같습니다. 입문자에게 너무 무겁지도, 가볍지도 않은 적당한 수준의 설명과 예제가 이 책의 장점입니다.자바를 알고 계시고 프로그래밍 기초, 객체지향 개념이 어느정도 잡히신 분들이 보시면 좋습니다."
9791195730469,4,"책에 오류가 너무 많습니다. 어떤 건 설명이 완전히 반대로 되어있고, 7장 확인문제에는 PK도 넣어두지 않아 테이블 생성 자체가 안되는 문제도 생기네요"
9791195730469,10,도움 많이 받았습니다
9788966261031,10,좋은 책. 백그라운드가 어느 정도 있어야 무슨 말을 하는지 떠올려보며 수월하게 읽을 수 있을 것임(안그러면 약간은 추상적으로 들릴 수 있음). 비슷한 책을 몇 권 읽어보았기에 새로이 인사이트를 느낀 부분은 없었다. 사실 더 오래된 책이라서 그렇긴 하지만
9788966261031,10,프로그래머라면 읽어봐야할 책입니다
9788966261031,10,전문적인 프로그래머가 되고싶으면 옆에 두고 항상 읽어볼만한 책입니다.
9788966261031,8,프로그래머가 되기 위한 멋진책
9791197193521,8,노션에 대해 아주 친절하게 설명해주는 책입니다. 하나하나 세밀하게 그림을 통해서 설명해주기 때문에 아무 것도 모르는 사람도 따라할 수 있습니다. 이런 류의 툴을 처음 접해보는 초심자에게 유용할 것 같습니다.
9791197193521,10,노션을 배우기는 했는데.. 활용을 잘 못하고 있었는데.. ‘한권으로끝내는 노션‘ 책을 보면서  나만의 노션을 만들수 있고 쉽게 따라 할 수 있어서 막히는 부분 없이 만들었던거 같습니다. 노션의 매력또한 잘 어필 되어 있고 노션으로 많은 자료를  한 곳에 모을 수 있어서 많은 도움을 받았습니다..
9791197193521,10,"노션 설치를 하고 어떻게 써야 할지 막막했는데, 책 예제로 쉽게 홈페이지를 구축 했다. ﻿기존에 에버노트를 사용해서 그런지 노션만의 기능을 중점적으로 봤다. 뒷부분은 결과물을 먼저 보여주고 따라 하는 식이었는데, 설정 작업을 세부적으로 안내해서 이해가 쉬웠다."
9788998756444,10,"다른 책에서는 상세히 다루지 않는 IPv6에 대해서 자세하게 다루고 있으며 TCP/IP 소켓 프로그래밍의 여러가지 모델(멀티쓰레드, IOCP, Multiplexing)에 대해서 간결한 코드와 친절한 설명으로 기술되어있습니다. 소켓 프로그래밍의 다른 교재보다 본 교재가 이해가 쉬웠습니다."
9788979143409,8,내용 자체는 풍부한 예제와 친절한 설명등 좋구요대신 이시리즈 자체의 특징같긴한데 책 구성이나 분위기자체가 좀 정신이없다고할까 난잡하다고할까 사람마다취향좀탈듯하구요 자바책 한권 떼고보셔야 확실히 이해가고 저처럼 c++보고 오셔도되긴해요 c++과 자바차이 비교해보면서 보는것도 재밌네요
