ISBN13,rating,review
9788960778818,6,주로 본인의 경험담과 철학에 대한 이야기. 좋은 내용도 있으나 별로 근거가 없는 내용도 있어 비판적인 시각으로 보는 것이 필요한 서적이다.
9788960778818,10,당장의 기술이나 비법을 가르쳐주는 책이 아니다. Rule of Thumb. 밥 아저씨의 수십년의 시행착오를 정리한 책이다. 모든 프로그래머가 가슴속에 품고 있어야 하는 책이다.
9788960778818,10,로버트 C. 마틴형님의 책이다. 무슨 말이 필요하냐.
9788960777873,10,최근에 국내에 출간된 게임 디자인 서적중에 최고가 아닐까 싶습니다. 신경쓴 번역이 특히 인상 깊네요.
9788968481789,10,고급 윈도우프로그래밍로 가는 등대
9788994506791,10,정말좋네요^^
9788994506791,10,다른 기술서적에 비해 많이 얇아서 실망하실 수도 있겠지만(?) 내용은 정말 알찹니다. pointer를 처음 배울 때 이 책이 있었다면 좋았을 텐데 하는 생각이 들어요. CS를 전공하거나 C를 제대로 사용하길 원하는 사람이라면 책장에 반드시 꽂혀있어야 할 책이라고 생각합니다.
9788966260676,10,훌륭한책이네요
9788996852124,10,공부하려고 친구한테 추천받고 샀습니다. 일단 깔끔한 외.내부 디자인이 취향저격입니다. 기초부터 친절하게 설명해주는 구성이라 혼자 공부하기 딱 좋아요. 강추합니다~~
9788996852124,6,기본적인 반응형 웹페이지 제작기법이 보이는 책입니다.
9788996852124,8,"css대신 js로 반응형 웹을 구현하였으며, 후반부에서 웹개발 단계별[기본>콘텐츠>js>css] 사이트제작 과정이 돋보인다. 하위문서에서 미디어쿼리 인식을 위한 스크립트나 jqm에서 터치인식을 위한 스크립트"
9788979149623,8,이 책에 나와있는 것만 실천해 나가는 것도 보통이 아니라고 생각합니다. ㅜㅜ하지만 프로그래머로 살아가기 위해 필요한 내용을 참 많이 다루고 있습니다.프로그래머를 준비하는 사람이나 입문하여 경력을 쌓고 있는 사람이 한번보면 좋겠네요. ^^
9788979149623,10,"진정한 소프트웨어 개발자를 꿈꾸는 많은 이들에게 정말 좋은 책입니다.
소프트웨어 산업의 본질을 꿰뚫는 날카로운 지적과 팀웍을 위해 필요한 소프트웨어 개발의 핵심 Job Title의 글로벌 현황을 알수 있습니다.
특히 중요한 것은 좋은 SW를 위해 고객중시, 개발자간 소통을 강조하는 면을 주시하세"
9788979149623,8,"프로그래머를 준비하는 친한 친구녀석이 있습니다. 비록 집안이 안 좋아서 자기 공부에 매진하기 힘든 녀석이지만, 꿈을 놓치진 말라는 의미로 이 책을 선물하려고 합니다.
부디 좋은 내용이 가득하길 빌어봅니다 ^^"
9788979149623,4,"초짜 개발자 지만 굉장히 실망스러운 책. 미국의 개발환경에 대한 소소한 정보를 제외하곤 다른 자기개발서와 별반 다르지 않음. 특히 유명 개발자의 인터뷰는 처음부터 끝까지 같은 내용의 되풀이. 
한준 요약: 프로그래밍에 미치세요."
9788979149623,10,"읽는 내내 천기누설의 느낌을 받으며 읽은 책, 프로그래머가 알아야하는 기술에서 부터 대인관계까지 모든게 들어있어서 두꺼울수밖에 없는 책. 하지만 읽다보면 어느세 마지막장인 책."
9788960773318,8,리눅스 커널을 시작하기에 좋은 책. 리눅스 커널의 상세 구현보다는 어떤 생각으로 설계되었는지 잘 알려주는 책. 코드 구현에 치중되어 있거나 깊은 OS관련 배경이 필요한 것도 아님. 읽는 도중에 가끔씩 난해한 번역이 나오는게 단점.
9791162243404,10,"디자인 패턴에 대한 입문 책패턴에 대한 정의부터 시작하여 왜 발생하였고, 무엇을 해결하고자 만들어졌는지 알 수 있어서 좋았다. 예시 코드가 php 인게 개인적으로 안타까웠지만 디자인 패턴에 대하여 가볍게 읽고 쉽게 이해 할수 있었다."
9791165212674,10,"정말 추천하는 책입니다!! 우선 IT적인 부분을 충실하게 담고 있으며 재미있는 요소를 충분히 넣어 흥미롭게 공부할 수 있었습니다. 또한 여러가지 프로젝트로 구성되어 있기 때문에 꾸준하게 공부하기 아주 좋고, 동영상 강의도 수록되어 있어서 따라하기 아주 좋았습니다."
9791163031765,10,초보/입문자도 기초부터 배포까지 한권으로 모두 배울 수 있는 좋은 길잡이
9791163031765,10,이책의 강점은 ‘디테일‘이었습니다.독자가 헷갈릴 만한 부분의 코드 한줄 한줄과 작동원리를 세세하게 설명해주었습니다. 저자분이 독자가 이책을 읽음으로써 하나의 완전한 웹앱을 만들 수 있게 만들겠다는 의지가 느껴져 좋았습니다. PWA에 관심있는 사람에게는 꼭 권하고 싶습니다.
9791190665407,8,이 책은 교과서가 아니다. 미리보기다. 팜플렛은 믿지말자.대충 임베디드 <소프트웨어> 엔지니어가 어떤 일을 하는 사람인지를 알려준다.개인적인 생각이지만 당연한 이야기가 복잡하게 써져있거나 복잡한게 너무 짧게 설명되어있다.하지만 개발 능력이 우선시되는 초보자의 경우 시간 절약에 유용
9788966262670,2,솔직히 내용 좋음. 이미 React에 대해 잘 알고 있다면 더 좋은 책임.그런데 React를 모르는 사람한테도 좋은지는 잘 모르겠음그럼에도 불구하고 이 책에 1점을 이유는 React는 UI 라이브러리인데 책에 UI 사진이 단 한장도 없음. 이 책은 프론트엔드 개발자를 위한 책임
9788966262670,10,함수형 컴포넌트   실무에서 바로 써먹을 수 있는 구성. 마음에 듭니다
9791161754239,6,입문자가보기에는 어려울 수도 있는 책 코드가 잘 설명이 되어 있다고는 생각하기 어려웠다대신 말이 어렵지 않다 꼭 예제코드 다운로드를 해서 공부하는걸 추천!
9791162242858,10,빠르게 앱 개발을 경험하고픈 플러터 입문자에게 추천합니다. 꼭 필요한 소스코드 예제로만 구성되어 있어서 독학하기 좋습니다.
9791162242858,8,4장 위젯부터 무작정 따라하면 기본을 다지는데는 충분합니다 분량이 부담없어서 며칠이면 될겁니다
9791196707125,10,어려운 주제인 튜닝을 쉽게 풀어쓰려 애쓴 흔적이 엿보이는 책이다. 저자 특유의 꼼꼼하고도 섬세한 설명과 이해를 돕는 그림들이 독자를 도와준다. 덕분에 오라클 튜닝에 큰 무리없이 입문하고 있다.
9791196395742,10,오라클 책의 끝판왕
9791160509519,4,API를 분리하지 말라는 말이 이해가 안되서 원서를 찾아보니 API break가 이렇게 번역되었더군요 ㅠ.ㅠ
9791160509229,2,"번역이... 저만 이해안가는줄 알고 찾아보니, 많이들 이해 안간다는 말들을 하네요몇번을 읽어도 이해 안가는 부분이 아주 많습니다... 물론 웹은 처음이나 선행으로 html/css/js 정도는 했고요..많이 실망했습니다. 부족한부분은 웹 서핑으로 해결했습니다.다음 판에서는 번역에 신경 써 주시길"
9791160509229,6,"예제를 따라가면서 하도록 되어있는데, 코드를 수정할 때 앞뒤에 대한 설명이 많이 부족하여 따라가기 어렵습니다."
9788931461312,10,저도 돈 되는 앱을 만들 수 있을까요. 기대됩니다
9788966262441,8,큰애가 공부하려구 주문한 책인데~ 잘 보면서 열심히 공부하고 있어요.
9788966262441,8,자료구조를 공부한 후 처음 알고리즘을 공부하기 위해 구입했는데 비교적 만족스럽습니다. 깊이 있고 세세한 설명보다는 프로그래밍에서 많이 사용되는 주요 알고리즘들을 빠르게 공부하기에 좋은 책입니다. 친절하고 자세한 해설을 기대하시면 실망하실 수 있습니다.
9788966262403,10,추천합니다! 자세한 설명과 적절한 예시
9791162240908,10,"국내 나온 고언어 책중 제일 만족스럽습니다(?) HTTP에 대한 역사와 이해를 코드로 풀어나가고 있는데, go언어를 사용합니다. go언어를 접해보지 못한 사람도 문법 이해후엔 술술 따라올 수 있습니다."
9791160507461,10,RxJava를 이해하기 위한 선수 지식을 앞장에 설명해 놔 책장을 넘기는 속도가 줄어들지 않았다. 최신 RxJava Version을 이용하였다.각장 마지막 부분에 챕터별로 어떠한 내용을 다루었는지 요약되어 있다. 전반적으로 함수형 언어의 입문용으로 좋은 책이다!
9791162241455,10,아직 반도 못했지만 만족하고 있고 이해하기 좋습니다.
9791162241202,8,읽는데 오래 걸리지도 않는다. 입문서답게 매우 얇다. 정말 입문자에게 당장 필요한 내용만을 발췌해서 7일만에 책을 끝낼 수 있도록 도와준다. 게다가 실무에 연관되어 적용할 수있는 다양한 예제를 전체 분량의 30%에 걸쳐서 제시한다. 예제별로 책에서 다루고 있는 부분을 최대한 활용하려고 한다.
9791196395711,6,"다소 쉬운 부분도 많고, 너무 레퍼런스(소개) 형식이라 내용이 깊이있지 않음. 인터넷에 잘 찾아보면 나올 내용을 굳이 책으로 산 느낌 어마어마하게 좋은 느낌은 아니다."
9791196395711,10,"오라클 개발자, 관리자라면, 항상 가까이 놓고 봐야할 책이네요."
9791196395711,10,정말 속속들이 알고 싶다면 봐야 할 바이블 끝판왕!
9791161751801,6,최소 게임 한두개만들어보신분아니면 추천안함. 거기다 교육용에셋은 보통 책에서 배포하기마련인데‘필자는 에셋스토어에서 이런걸구했으니 너네도 에셋스토어에서 비슷한걸구해봐라‘ 라는식의 진행이라 약간맘에안들었지만 RPG장르를 유니티로 처음접해보는학생으로서 충분한것같음.
9791161751801,8,유니티에 능숙하신분들에게 추천합니다~ 초보나 입문자분들은 보기 어려워요ㅠㅠ RPG게임이 대충 이렇게 만들수 있다는걸 알아서 괜찮았어요!
9791160504736,10,"자바스크립트 처음 공부하는데 설명도 잘되어 있고 쉽게 따라해보면서 이해할 수 있는 예제가 특히 좋습니다. 하루 15분이라는 말에 걸맞게 짧은 파트별로 나누어져 있어 부담없이 공부할 수 있고, 오히려 계획했던 것보다 더 많이하게 되는 것 같네요."
9791185885155,10,Git을 사용자 관점에서 잘 설명해 주는 책이다. 그 덕분에 부담없이 읽어내려가면서 재밌게 Git의 사용법을 익힐 수 있다.
9788966262137,10,처음에는 두꺼운책들에 익숙해져있어서 400페이지가 이렇게 얇을 거라고는 생각도못했어요. 어제 밤에 받았는데 재밌어서 잠도 안자고 밤샘하면서 보는 중입니다. 책을 보는데 옆에서 말하는 것 같아요!!
9788966262137,10,앞으로 안드로이드 개발에 꼭 필요한 언어라서 구입하게 되었습니다.아직 다 보진 않지만 입문서로는 충분한 것 같습니다.
9791162240212,10,구글e북으로 구매했다가 후회했습니다. 이런 좋은책은 종이책으로 소장해야 되는데 말이죠. 스프 그동안 대부분의 스프링책을 읽어봤지만 개념적인 부분에 있어서 스프링책중에 가장 좋은 책이라 생각됩니다.
9791160502886,10,기대되는 CentOS 7 서버 가이드북입니다.
9791160502886,10,기초를 쉽고 이해하기 쉽게 이론이 재미있게 설명이 되어 있어서 좋은 것 같습니다.
9791160502886,10,기초를 튼튼히 쌓을수 있어 큰 도움이 됩니다
9791160502886,10,컴퓨터 초보자에게는 너무 어려운 리눅스 서버의 세계를 입문할 때 유용한 책입니다. 기초 개념부터 시작하여 직접 활용할 수 있는 다양한 예제를 따라하다 보면 어느새 리눅스 서버의 개념이 잡히는 것 같습니다.
9791160502886,10,리눅스 서버에 대해 기초부터 탄탄하게 배울 수 있어서 좋네요. 챕터별로 상세하게 설명해줘서 좋아요.
9791160502886,10,리눅스 서번에 관심있는 사람들에게 안성맞춤인 책이네요 쉽고 상세하게 잘 서술되어있어서 따라하기도 쉬운거 같아서 좋은 책이네요
9791160502886,10,누구나 쉽게 따라 할 수 있게 차근차근 설명하고 있어서 내 손으로 서버 환경을 구축하여 다양한 서비스를 운영할 수 있도록 도움받을수 있을것 같아요
9791160502886,10,리눅스 서버를 구축하고 관리하는 과정들을 자세하게 배울수 있어서 좋고 용어 설명이 쉬워서 잘 활용할수 있을것 같아요
9791160502886,10,예비 인프라 엔지니어를 위한 과외 수업이라는 부제에 맞게 이 책으로 차근차근 CentOS 7을 배워 봅시다.
9791160502886,10,과외수업이라는 개념으로 접근한 책이어서 보다 알차고 구성이 좋은 책 같습니다. 길벗답게 앞서가는 컨셉입니다.
9791160502886,10,"이제 막 시작하려는 초보자를 위한 책으로, 부담없이 차근차근 익힐 수 있어서 좋습니다."
9791160502886,10,리눅스 입문자들에게 큰 도움이 될 것 같아요.
9791160502886,10,기초적인 내용부터 따라갈 수 있게끔 내용 정리가 깔끔하게 되어 있기 때문에 리눅스 서버에 도전해 보고 싶어요.
9791160502886,10,리눅스 서버를 처음 접하는 사람들에게 쉬운 설명으로 하나하나 안내를 해주기 때문에 기대가 됩니다.
9791160502886,10,"CentOS를 사용해서 다양한 서버 환경 구축과 보안 대책, 네트워크 지식을 쌓을 수 있어서 배워 보고 싶어요."
9791160502886,10,리눅스를 처음 접하는 사람들이 배우기 쉽게 구성이 되어 있어서 무척 기대가 됩니다.
9791160502886,2,이 책 관심있어서 살라다가 ~ 알바들 조작때문에 다른 책 사야겠군
9791160502886,10,초심자도 부담없이 접근할 수 있도록 책이 구성된 것이 마음에 들었습니다.
9791160502886,10,"CentOS 에 대한 것과 환경구성, 리눅스 등 많은 부분을 다뤄서 너무 좋습니다"
9791160502886,10,서버 구축에 필요한 기초 지식부터 서버 관리에 관한 사항까지 한 권의 책으로 학습할 수 있다는 점이 장점이네요.
9791160502886,10,리눅스의 기본 지식과 서버 구축을 위한 전반적인 방법을 알 수 있게 구성이 되어 있네요. 쉬운 설명이 좋네요.
9791160502886,10,리눅스에 대해 처음 접근하는 사람들이 보면 좋은 책이네요. CentOS 7.4 버전을 기준으로 기초부터 상세히 공부할 수 있습니다.
9791160502886,10,리눅스를 처음 접하는 분들도 책 설명대로 따라하면 쉽게 익힐 수 있을 것 같습니다.
9791160502886,10,리눅스에 대해서 알기 쉽게 설명해주고 있습니다.
9791160502886,10,리눅스 서버에 대해 문외한부터 숙련자를 위한 바로 그 책~
9791160502886,10,인프라 엔지니어를 향한 길.. 이 책에 초급을 위한 팁부터 고급 정보까지 가득하네요.
9791160502886,10,"예비학교, 리눅스 서버가 처음인 초보자도 쉽게 접근할 수 있는 책인 것 같아 기대됩니다."
9791160502886,8,길벗과 함께 차근차근 배우는 리눅스와 서버운영.
9791160502886,10,뭔가 좋아보이네요~ 열심히 노력하면 확실히 익힐 수 있겠죠?
9791160502886,10,리눅스 시리즈는 버전별로 취급이 달라서 매우 어렵습니다. 그래도 이 부분은 매우 중요합니다.
9791160502701,6,입문자용이라 해서 샀는데솔직히 직접 해 보니까 입문용으로는 조금 어렵습니다.ㅠ
9791160502701,8,책 자체는 좋습니다. 일본 IT교재들이 대부분 그렇듯 설명이 자세하고 난이도가 높지 않습니다. 번역도 중상급은 됩니다. 다만 오타가 너무 많아요...
9791160502701,6,이렇게 리뷰가 많은데 구매한 사람이 0명이라니 다 알바인가요?
9791160502701,10,동적으로 HTML 데이터를 생성하여 동적인 웹 문서를 빠르고 쉽게 작성하는데 유용한 PHP를 그림으로 쉽게 차근차근 배우고 핵심 예제로 기초 문법을 이해하는 PHP입문서로 알차네요.
9791160502701,10,PHP코드에 대한 기초적인 이해부터 향후 응용에 이르기까지의 체계를 세울 수 있습니다.
9791160502701,10,PHP문법에 대한 정확한 이해를 할 수 있다.
9791160502701,10,그림을 이용한 설명과 체계적인 서술이 돋보인다
9791160502701,10,PHP를 배우는데 좋은 책 같네요.
9791160502701,10,기초를 쉽고 이해하기 쉽게 이론이 재미있게 설명이 되어 있어서 좋은 것 같습니다.
9791160502701,10,기초를 쉽게 설명해줘서 좋습니다
9791160502701,10,쉬운 풀이과정으로 이해가 잘 됩니다
9791160502701,10,예제가 다양해서 배운 이론을 확실하게 점검하고 넘어갈 수 있는 점이 마음에 듭니다.
9791160502701,10,웹프로그래머가 되기 위한 필독서로 요건을 충분히 갖춘 책이네요 초보자 눈높이에 맞는 쉬운 해설과 불필요한 내용이 없어 좋습니다
9791160502701,10,PHP를 제대로 익힐수 있도록 이론과 기법들을 자세하게 배우고 과정들을 확실하게 이해해볼수 있어서 좋네요 기초부터 탄탄하게 준비하니까 많은 도움이 됩니다
9791160502701,10,서버 프로그래밍 언어인 PHP를 처음 공부하는데 있어 많은 도움이 될 것 같은 책입니다.  다양하고 직관적인 예제와 그림을 통한 친절한 설명으로 경험이 없는 비전공자에게도 적합합니다.
9791160502701,10,정말 누구나 쉽게 배우 수 있는 교재라 좋았습니다. 예제도 많고 그림으로 쉽게 이해할 수 있어 좋았어요. PHP 코드를 기초부터 차근차근 배우고 싶다면 이 교재를 추천드립니다.
9791160502701,10,실제 웹 페이지를 만들때 사용하는 기법까지 자세히 설명되어 있는 책이라 PHP를 기초부터 탄탄하게 제대로 다질 수 있어 만족스러웠습니다.
9791160502701,10,우리가 너무도 잘 아는 페이스북 등이 바로 이 PHP로 작성되었음을 알아야 합니다. 이 책으로 PHP를 제대로 한번 배워 봅시다.
9791160502701,10,과외수업이라는 개념으로 접근한 책이어서 보다 알차고 구성이 좋은 책 같습니다. 길벗답게 앞서가는 컨셉입니다.
9791160502701,10,"이제 막 시작하려는 초보자를 위한 책으로, 부담없이 차근차근 기초 개념을 익힐 수 있어서 좋습니다.다양한 그림과 예문으로 이루어진 깔끔한 편집 구성이 더욱 마음에 듭니다."
9791160502701,10,소개글처럼 초보자들을 위한 책이다보니 기초적인 설명부터 시작되는데 좋은것 같아요충분한 예문이 익숙해질때까지  반복할수 있어 좋습니다
9791160502701,10,PHP를 기초부터 탄탄하게 배울 수 있는 점이 아주 좋은 것 같습니다. PHP의 기초 문법부터 세션과 쿠키처럼 실제 웹 페이지를 만들 때 사용하는 기법까지 마스터할 수 있어서 유용하네요. 무엇보다도 풍부한 예제와 그림 설명이 도움이 많이 됩니다. 추천할 만한 교재라 생각합니다.
9791160502701,10,"웹프로그래밍을 처음 배우는 사람들에게 정말 좋은 교재라 생각합니다. 차근차근 단계적으로 배울 수 있도록 구성되어 있는 점이 아주 좋은 것 같습니다. 특히 입문자의 경우 처음에는 혼자서 공부하기 어려운 감이 있는데, 이 책은 그러한 사람들의 눈높이에서 쉽게 쓰여져 있어 도움이 많이 됩니다."
9791160502701,10,서버프로그래밍 언어 php의 기초를 쉽게 배울수있다고 하니 기대됩니다.
9791160502701,10,웹프로그래머가 되기 위한 입문서로 강력 추천합니다군더더기 없는 해설과 예문이 이해를 돕기에는 충분할듯 하네요
9791160502701,10,주변에서 많이 사용되는 PHP의 기초부터 탄탄하게 다질 수 있게 체계적이고 효율적으로 구성이 되어 있어서 관심을 가지게 됩니다.
9791160502701,10,다양한 예제와 그림으로 기초 문법과 개념을 다질 수 있어서 PHP를 어렵지 않게 배울 수 있을 것 같아요.
9791160502701,10,풍부한 예제와 그림으로 기초 문법과 개념을 탄탄하게 알찬 구성으로 서버 프로그래밍 언어 PHP를 익히는데 많은 도움 될 것 같네요.
9791160502701,10,"널리 쓰이고, 일반인이 배우기에 적합한 PHP 프로그래밍 언어의 개념과 원리, 기초 문법을 차근차근 가르쳐주는 책이라 관심을 가지게 됩니다."
9791160502701,10,"PHP를 쉽게 이해할 수 있게 그림과 함께 설명해주고, 다양한 예제가 수록되어 있어 좋습니다."
9791160502701,8,초보가 해도 금방 이해가 될만큼 쉽다는게 무척 마음에 듭니다
9791160502701,10,PHP입문할려고하는데 목차를보니 예제위주로 실제작업으로 접근하는 내용들이 눈에 뛰네요.
9791160502701,6,"php를 다루는 책을 크게 래퍼런스한 리스트화된 기능에 대응된 예제를 다루는 것, 또는 프로젝트성 예제풀이가 있다고 보는데 이 책은 두가지를 적절하게 섞어놓은 내용으로 판단된다. php 에 관심이 많아 개발에 첫 도전하고 싶을 때 접하면 꽤나 적합하다고 본다. 작가의 이력 또한 꽤 흥미롭다."
9791160502701,8,PHP가 아직도 생명을 유지하는것은 그만큼 가치가 있기 때문입니다
9791160502701,10,PHP를 공부하는데 필수적인 책 같네요 설명도 잘 되어있고 풍부한 용례도 있고 편집이 보기좋게 잘 되어있어서 초심자에게도 괜찮은 책 같아요
9791160502701,10,PHP 책이 탄탄한 해외에 비해 막상 국내에서는 PHP 발전속도에 맞는 책을 찾아보기 어려웠다. 특히 PHP에 입문하려는 예비 개발자들에게 마땅한 추천 기본서가 없던 차에 이 책의 출간 소식은 더욱 반갑기 그지없다. 쉬운 듯 하면서도 자세하게 설명해 웹 개발을 더욱 즐겁게 시작할 수 있을 것이다.
9791160502701,10,웹프로그래밍의 기본이 바로 PHP가 아닌가 싶습니다.그렇기에 이책으로 첫발을 떼는건 과연 어떨지 궁금하네요
9791160502701,10,PHP에 대해 잘 몰랐었는 데 이 책을 통해 기초부터 자세하게 배울 수 있는 시간이 될 것 같습니다.
9791160502701,10,초보자가 보기 편하게 커리큘럼이 짜여져있고 공부하는 사람의 눈높이에 맞춰서 설명해주고 있는 듯한 기분이 듭니다
9791160502701,10,요즘 PHP에 관심이 많은데 초보자를 위해 기초부터 차근차근 알려주고 책을 보면서 따라할 수 있으니 유용합니다
9791160502701,10,"페이스북,워드프레스,미디어위키 등 수많은 웹 서비스를 만들어 낸 대표적인 서버 프로그래밍 언어인 PHP를 쉽게 배울 수 있는 책이에요.간결한 예제로 기초문법을 확실히 하고 그림으로 개념을 다질 수 있어 프로그래밍 경험이 없는 비전공자도 쉽게 시작해볼 수 있을 것 같아요."
9791160502701,10,어려울 것이라고 생각했었는데 차근차근 따라가다보니 길이 보입니다
9791160502701,10,쉽게 따라할 수 있을것 같습니다^^
9791160502701,10,비싼 학원 수강료 내지않고 쉬운 해설과 실전에 맞는 예제풀이로 전문분야를 셀프 스터디하기 최적화된 ‘길벗‘ 시리즈의 웹 프로그래머를 위한 친절한 과외 수업~
9791160502701,10,웹 프로그램을 자유자재로 다룰 수 있다면 큰 경쟁력을 갖추는 건데 길벗에서 출간된 도서라 기대가 됩니다.
9791160502701,10,예비 웹 프로그래머의 필독책!!! 길벗이라 믿음가고 기대가 큽니다.
9791160502701,10,기초를 다질 수 있어서 좋을 것 같아요
9791160502701,10,처음 입문하는 사람들에게 도움이 될 것 같습니다.
9791160502701,10,웹 초보자들도 쉽게 배워보는 프로그램 언어..궁금하고 기대됩니다~~
9791160502701,10,프로그래밍 배우는데 도움이 많이 되는 책이네요
9791160502701,10,복잡도 기초를 튼튼히 잡아주면 쉬어집니다.이것이죠
9791160502701,8,PHP 첫걸음을 길벗과 함께
9791160502701,10,실제 웹페이지를 만들 수 있어요
9791160502701,10,PHP를 처음 접하지만 정보처리 영역의 내용과 겹치는 부분이 많아서 좀 더 쉽게 공부할 수 있을 것 같아요. 정보처리 영역을 공부하면서 부족했던 부분을 PHP 기초를 공부하면서 보완할 수 있어서 프로그래밍 공부에 큰 도움이 될 것 같아요. 개념과 문법을 확실하게 공부할 수 있어서 좋아요.
9791160501681,8,고급도전과제 해놓고 알아서 하라니... 그럼 책을 왜 샀죠? 기본은 이거 도움말에도 있는 내용인데... 허
9791185890791,8,스칼라 입문서로 좋다고 해서 구매합니다.
9788966262083,10,"vim 기초 딱지를 때신 분들에게 추천 드립니다. vim을 활용하는 방법에 대한 정말 알짜배기 내용으로 가득찬 책입니다. 페이지는 350페이지 가량이지만 700페이지 같은 느낌입니다.Vim의 기초를 습득하시고, Vim의 진정한 힘을 느끼고 싶은 분들이 보시면 좋겠습니다."
