ISBN13,rating,review
9788966262199,8,컴퓨터공학과 2학년 정도 수준이 읽기 가장 적당한 책인거 같다. 진입을 원하는 비전공자가 흥미용으로 읽어보기엔 살짝 어려운것 같다. 하지만 여러가지 개념들을 이런것이 있다 라는 정도로 읽고 각 부분에 관해 심화된 서적이나 인터넷을 통해 공부하면 배의 학습효과를 얻을 수 있을 것 같다.
9791162240342,8,c# 기초 배우기 위한 목적이라면 이 책이 괜찮다.오타가 조금 있긴 하다.
9791162240342,10,언어말고 프로그래밍이 뭔지 맛보고 결정하게 해준다라는 모토가 딱 맞는거 같아요 재밌어서 더 배우려고 합니다
9791162240342,8,진짜 아무 것도 모르는 사람만 사시길... 그리고 책의 내용은 둘째치고 pope kim이라는 사람을 만나는 금쪽같은 기회를 선사해준 책.
9791162240342,10,50이 넘어 컴퓨터 코딩에 대한 미련에서 개념이라도 알아보고 싶어 구입한 책이다. 이책은 코딩에 대한 기본 개념이 없는 사람이 가장 자연스럽고 빠르게 코딩을 이해하고 실제로 코딩작업까지도 할 수 있게 만들어주는 책이다. 코딩의 개념을 처음으로 접하며 알고 싶은 사람에게 강추한다.
9791162240342,10,구매하자마자 조금씩 따라해보다가 다른 것들에 정신 팔려서 손 놓고 있었는데 100자평 쓰면서 다시 시작해야겠다는 생각이 드는군요..ㅎㅎ;; 따라해보기 적절하고 이해도 잘 되는 편입니다~
9791162240342,10,처음 배우는 분들도 알기 쉽게 써져 있습니다.
9791162240342,10,"설명이 구체적이며, 저자 자신의 표현을 사용한다.연습문재들이 재밌다."
9791162240342,10,진짜 새상품같이 잘 받았습니다. 좋은 금액으로 거래해주셔서 감사합니다.
9791162240342,10,입문자에게 정말 친절하게 설명해줘서 처음부터 자세히 읽기만한다면 다 이해가 잘 되는것 같다.
9791162240342,10,프로그래밍 언어를 가르치는 것이 아니라 프로그래밍을 가르쳐줍니다.
9791162240342,10,"정말 입문자에게 좋은 책입니다. 개념부터 차근히 가르쳐 주는게 참 좋았습니다.원래의 뜻부터 개념, 사용법까지 친절하게 알려줘서, 코딩을 모르는 제가 술술 읽혔습니다.개념이 잡히는 느낌이 잘 듭니다. 이 책을  다 읽으면 본격적인 다음 레벨의 코딩책들을 읽을 수 있을 것 같습니다."
9791162240342,10,입문자에게 좋은책입니다. 쉽게 써져 있어 책장 넘기는데 어려움이 없습니다. 친절하게 버그를 잡는(디버깅) 법 다루고 있어 더욱 마음에 듭니다. 프로그래밍을 배우고 싶어 하는 입문자에게 선물하고 싶은 책입니다.
9788992939003,10,실무에서 MySQL을 다룰때 옆에 두고 있으면 든든합니다. ^^
9788992939003,10,어렵긴 하지만 고급내용이 많습니다. 두고두고 봐야겠네요
9788992939003,10,"최고의 mysql 서적입니다. 특히 개발자를 위한 내용이 많습니다. 설계와 튜닝, 쿼리테크닉 등 .. 여러 노하우와 사례가 가득합니다. 강력 추천합니다"
9788960771451,10,"매우 친절하고 똑똑한 기획선임이 궁금했던걸 시원히 얘기해주는 기분이다. 심지어 내가 궁금해해야 했었는지도 몰랐던 것도 ""너 이랬었지?"" 라며 이야기해준다. 어려운 기술에 대해서 진짜 이야기하듯 말해줘서 술술 읽힌다. 이 책은 값을 올려빋이야 한다."
9788960771451,10,정말 소장해야할 책
9788960771451,10,기획자에게는 꼭 필요한 서적..
9788960771451,10,반갑다!! 회사 책상 위 둘만한 책이 또 하나 나왔구나!!
9791165920296,10,굿굿
9788965402565,10,기본을 익히기 좋은 입문서입니다 내용과 번역 모두 좋습니다
9791162241639,8,앞부분 보고 있고 초보자인데 내용 짱 좋은 것 같습니다~~
9791162241639,10,Python으로 크롤링을 진행하니 확실히 수월하다. 웹 프로그래머라면 읽어볼만한 책이다.
9788960882485,6,다 재체두고 일단 예제대로 작동되는 게 얼마 없음
9788960882485,10,"장고가 처음이라면 입문하기 좋은 책입니다! 저도 장고가 처음이였고, 웹프로그래밍 또한 거의 처음이였는데 눈에 바로바로 보이는 결과물들이 공부하는데 더 보람을 느끼게합니당 그리고 예제뿐만 아니라 다른 명령문들도 같이 수록 되어있어서 혼자서 이러지리 만져보면서 공부하기 좋아요!"
9791161752600,8,"백과사전같은 책입니다. 개발과 관련된 모든 주제를 망라하고있고,그 주제에 관련된 쓸만한 이론을 분류해뒀습니다.그래서 한번 읽고 끝내는 책이라기보다,필요할때 발췌해서 뽑아읽는 책에 가까워요.그래서 내용적으로는 너무 집중이 분산되고 무겁다는 느낌이든다는 단점은 있지만 내용은 충실"
9791161752600,10,"게임 기획, 디자인 입문을 위한 국내 서적 중 베스트 같습니다."
9791163030300,10,상세하게 개념을 짚어 주고 많은 예시로 이를 보강하였으며 더불어 실무에서 자주 사용되는 표현들을 알 수 있어 초심자가 공부하는 데 많은 도움이 되었습니다.
9791163030300,10,"아무것도 모르는 초보자가 배우기는 딱 좋은 책인 것 같습니다. 해설이 깔끔하고 실무에서 쓰이는 것들도 중간중간에 알려주셔서 엄청 많이 도움되었던 것 같습니다.책 중간중간 보다보면 한글에 오타가 조금 있는 것을 발견했는데, 그 것빼고는 모든게 완벽하다고 말하고 싶습니다."
9791163030300,10,가독성이 정말 좋습니다. 책 표지에 써 있는 대로 비전공자도 공부하기 좋습니다. 강추합니다.
9791163030300,10,5년차 프로그래머 입니다. 실무에서 데이터베이스를 많이 사용은 하고 있지만 기초가 부족하다는 생각이 들고 지금의 실력을 업그레이드 할 수 있을 만한 책을 찾다가 이 책을 접하게 되었는데 정말 쉽고 내용도 알차고 많은 도움이 되었습니다.
9791163030300,10,데이터베이서 처음 공부하는 학생임에도 불구하고 이 책으로 공부하니 막힘없이 공부할 수 있었습니다.  이해 하기 쉽게 이론과 많은 예제들이 있으며 무엇보다 보기가 편합니다. !
9788931555400,8,"기획을 하는 입장에서 또 신입이나 5년 미만의 기획자를 교육해야 하는 입장에서는 꽤나 유용한 서적임에는 틀림 없습니다만, 문서를 작성하기 위한 방법 보다는 다른 여타의 책처럼 게임 기획에 대한 세부 설명이 대부분인 책입니다."
9788970509389,6,앞 챕터는 좋아 보이나 뒷 챕터는 아쉬운 책. R의 가장 기초적인 부분을 배우기에는 좋지만 어디까지나 아주 ‘기초‘를 배우기에 좋은 책이다. 뒤로 갈수록 설명이 불충분하고 오타가 자주 발견된다. 책에 적힌 그대로 코딩했는데 실행이 안되거나 에러가 생기면 직접 오타를 찾아야 한다.
9791185890852,10,쉬는 시간에 잠깐씩 읽다보니 어느세 다 읽은 책.인터넷 속 여러가지 방법론보다 책으로 정리된 내용이 읽기 좋았다. 실제로 실용적이며 내용의 재사용이 즉시 가능하다는 장점을 가지고 있다. 좋은 내용의 책을 통해서 많은 분들이 실무에 도움이 되길 바란다.
9791185890852,10,"책이 두꺼워서 어디서 부터 뭘 봐야 할지 모르겠지만,,, 회사에서 가끔씩 꺼내서 읽고 싶은 대로  읽어도 도움이 된다."
9788966261208,8,"웹을 지탱하는 네트워크 기술을 이해하기 좋습니다, 어렵지 않으며, 번역도 좋은 편 입니다.다만 다소 오래된 책(2002에 쓰인 원서)이라 보지 않아도 될 만한 옛날 내용이 많이 있으니까 보고 싶은 내용위주로 빼먹으셔야 합니다. 그외 아쉬운 점은 그림과 설명하는 텍스트가 페이지를 넘겨야함.."
9788997924103,10,다른 책으로 jsp 공부하였는데 초보자의 입장에서는 너무 어렵게 써있었습니다. 그래서 책을 찾던 중 우연히 발견하게 되서 구매해서 보았습니다. 개념부분이 다른 책에 비해서 잘 나와있고 그 동안 원리에 대해서 궁금했는데 궁금한 점들도 책에 나와있어서 공부하는데 도움 많이 됬습니다.
9788968480713,8,일에 대한 열정!!! (그런데 번역은 영~~~)
9788968480713,10,"폴그레이엄은 글을 정말 잘 쓴다. 어려워할 만한 이야기를 쉽게 풀어 설명하는게 그의 특징이다. 자칫 어려울 수도 있는 프로그래밍 이야기를 재밌는 문화적 측면, 비즈니스와 버무렸다."
9788968480713,10,우와! 기다리던 책이 나왔다.
9788979149142,6,"프로그래머에게 유악한 내용이다. 한번 읽어볼 만하다. 그런데 언어의 예제가 C++, 파이썬, 자바, 자바스크립트 마구 석여 있어좀 혼란스럽다.  그리고 이질적인 삽화들이 읽는데 방해가 된다."
9788979149142,6,기본중의 기본인 내용들. 하지만 모르거나 생각 못해본 사람들이라면 꼭 읽어봐야겠지?
9788979149142,8,상당히 좋은 내용! 읽기전과 읽은 후에 코드가 바뀌는 놀라운 책!
9788979149142,8,부끄러운 이야기이지만 개발경력이 10년이나 된 나로써도 상당히 도움이 되는책.
9788979149142,10,"번역이 매우 충실하고 원저자의 내용또한 최고이다.
개발자로써 꼭한번 봤으면 하는 좋은 책이다."
9788979149142,10,"이 책 제목이 곧 내용이다. 가독성에 항상 주의 집중해서 코딩을 한다면, 자연스레 우아한 코딩을 하게 될것이다."
9788979149142,8,"프로그래머가 기본적으로 알아야 할 내용을 다루고 있습니다. 초급자나, 코딩에 대해 개념이 제대로 잡히지 않은 순련자들도 볼만합니다"
9788979149142,10,프로그래밍에 입문하는 초보자가 실전에서 참고하여 사용할 수 있는 도서이다. 마치 옆자리의 친절한 사무실 선배가 업무에 관해 조언해 주는 듯한 주옥 같은 내용이  코딩관련 기초습관 연마용으로 권장한다.
9791165920449,10,너무 좋아요 마스터했어요
9791158391980,8,기대되네요
9791162242223,10,"책 페이지는 588쪽이고요. 스위프트 기초부터 확장, 고급을 공부할 수 있습니다. 아이폰 개발에 초점을 맞춘 스위프트를 풀어내기 보다는 프로그래밍을 스위프트로 할 수 있는 책인 것 같습니다. 그래서 완전 초심자보다는 프로그래밍 기본 문법을 한번은 훝어본 분이 읽으면 좋습니다."
9788966262410,10,책이 칼라 인쇄다.초보자가 안심하고 볼 수 있게 친절함이 베여있다.
9788931554649,10,2달 밖에 맥스 배우지 않았지만 그 상태로 봐도 이해 참 잘 됩니다. 좋은 팁도 많이 소개되어있습니다.☆☆☆☆☆
9788968482946,8,"비전공자이고 나름 이해 잘가게 쓴 것 같은 책 몇권을 독학하던 중 중간에 건너뛰거나 생략된 구간으로 인해 에러 해결하다가 답답해서 책을 덮는 경우가 많았습니다. 그 때 이책을 봤는데 굉장히 좋았습니다. 차근차근, 빠진 구간 없이, 반복되어 보일지언정 초보자들이 헷갈리지 않게 잘씌여진 책,"
9788968482946,10,짱 좋아요~
9788968482946,2,그닥.. 지은이가 실무를 경험해보지 않은것 같다.
9788968482946,10,"비전공자인데 이해에 도움이 정말 많이됐습니다. 여타 프로그래밍책들이 그렇듯 본문보다는 소스로 읽어야하는데, 갑자기 건너뛰는 구간 없이 소스가 난이도순으로 차근차근 진행됩니다. 본문도 짧고 간결해서 좋았습니다. 덕분에 웹개발을 제대로 시작했습니다."
9788968482519,8,윈도우 함수와 Partition By 에 대한 설명과 예제가 잘 설명되어 있다. 한번 읽어두면 조금 레벨업된 느낌이 든다.
9788968482519,10,기본적인 SQL 사용이 가능한 후 이 책을 읽으므로서 중급이상의 실력을 가출수 있는 실력 향샹에 도움이 되는 내용이 많이 들어 있는 것 같다..
9788968482045,4,"Super Bible은 커녕 설명에 있어서 굉장히 부실한 책입니다. 예제또한 정리되어 있지 않으며 번역까지 좋지 않습니다. 개정3판이 출간된지 오랜 시간이 지난 후에 나온 책이라 매우 기대했는데 정말 실망스럽습니다. 처음 등장하는 용어에 대한 미비한 설명에 엉망인 번역, 돈이 아깝습니다."
9788998139940,4,전반부 java에 대한 기초적인 설명에 있어서 저자만의 생각이나 사설이 많이 담겨서 이 책을 읽어 배우기 보다는 ˝이러한 생각을 할 수 있구나˝ 라는 느낌이 드네요.
9788998139940,10,도서관에서 빌려 읽었는데 구매하려 함무작정 머릿속에 구겨넣었던 원리와 개념들이 신기하도록 쉽게 이해되서 감동
9788998139940,10,기초가 중요하다는 말은 누구나 공감하지만 기초를 쌓는데 큰 도움을 주는 책은 또 그다지 많지 않은게 현실이기도 합니다. 그런데 이 책은 자바 객체 지향 프로그래밍의 기초를 한 권에 담았다고 해도 과언이 아닐 정도로 충실하고 친절하네요. 오래 곁에 두고 볼 책입니다.
9788998139940,10,"Java jsp & servlet을 충분히 알고 있고 습득한 상태에서 이 책을 보면 스프링에 대한 전체적인 흐름과 개념을 알 수 있어서 너무 좋았습니다. 토비의 스프링 보기 전에 보면 UML과 디자인 패턴,OOP 개념은 확실히 알고 갈 수 있습니다."
9788998139940,10,회사에 있어서 읽었습니다. 초반에 알아야할 기본 지식이 쉬운 말로 설명이 잘 되어있어요. 술술 읽혔습니다.
9788994774480,10,생활코딩에서 이고잉님의 강력 추천을 받고 사게되네요각종 언어에 대해 역사적 흐름으로 이해를 돕는 책
9788994774480,6,이 책은 나름의 존재 이유가 있겠다. 하지만 나에게 도움이 되었는지는 말하기 머뭇거려진다
9788994774480,10,언어를 많이 알아갈 수 록 보이는게 많겠지
9788994774480,8,프로그래밍 언어의 각종 요소를 살펴보고 각 요소들이 왜 생기고 어떻게 발전해왔는지에대해 알려주는 책. 전개 방식이 논리적인 연관관계에 따라 잘 설명되어있고 예제도 여러 언어로 적절하게 들고 있어서 즐겁게 읽을 수 있었다.
9788994774480,8,"재미지게 빨아들이는 Programming Language 입문서. 내용이 초보용인건 맞는데, 오히려 초보들이 설렁설렁 넘어가다 다 아는줄 알까봐 걱정. 오히려 나중에 정리겸 보면 좋을 듯. 초판은 오타 좀 있으니 유의 필요"
9788991268807,10,무난함. 이런 저런 가이드라인들.
9788991268807,10,뻔한 이야기가 있을 것 같지만 정말 주옥같은 말이 가득한 책. 프로그래머의 길을 가려는 사람이라면 두고두고 읽어볼 만한 책.
9788991268807,10,두고두고 볼만한 책 ... 한국의 현실이 안타가울뿐
9788991268807,8,프로그래밍 세상을 여행하려는 사람들을 위한 조언과 안내서
9791190665803,10,퀀트 포트폴리오 전략의 기초에서 백테스트에 이르기까지 데이터 사이언스가 금융 도메인 지식을 만났을 때 필요로하는 핵심 지식들을 깔끔하고 이해하기 쉽게 정리한 책이다.
9791161754635,6,"초판이라 그런것인지, 예제대로 치면 안돌아갑니다.결국 주어진 github 링크에서 코드를 뒤적일 수 밖에 없음ㅠㅠ"
9791157831821,10,실용서인데도 잘 읽힙니다.
9791162243282,10,유닉스와 관련한 역사를 이야기 식으로 재미있게 설명함. 오버가 아니고 마치 당시에 벨 연구소에 함께 있었던 것처럼 실감나게 느껴졌다. 강추.
9791165211721,6,고등학생 아들이 앱만들기에 관심이있어 구입하게 된 책입니다. 개인컴퓨터 상황에 따라 깔아야할 것들이 많고 책자에 생략된 화면도 있어 앱만들기가 쉽지는 않은듯합니다
9791165211721,10,"안드로이드 어플 공부를 위해 여러 안드로이드 서적과 강의를 찾던도중 모두의 안드로이드 책을 알게되고 읽으면서 다른 타 강의의 기초 내용, 타 서적 보다도 쉽게 빠르게 IDE의 사용법과 코드 내용을 이해할 수 있었고오류가 없어 좋았던 책이므로 어플에 관심이 있다면 첫 책으로 가장 추천한다."
9791158391997,8,"책의 내용은 좋지만, 2권으로 나눈 것에 비해서 한쪽이 너무 두꺼워 실제로 볼때 약간 불편합니다."
9791162242841,8,AWS에서 공식적으로 제공하는 모범 사례들만으로는 부족합니다. 그 때 발견한 책이 바로 이 책 한빛미디어의 ˝배워서 바로 쓰는 14가지 AWS 구축 패턴˝ 입니다!이 멋진 책은 보고 참고 할 수 있는 패턴을 무려 14가지나 설명하고 있습니다.
9791162242834,10,플로터의 개발환경부터 예제 프로젝트까지 접해보면서 플로터의 기능들을 설명해 놓았다.기존 안드로이드나 ios 등을 했던 개발자들은 다트 문법을 훑어보는 정도로 해서 익숙해 질듯 하지만 스마트폰 개발이 처음인 분들은 다트 사이트 등에서 문법과 사용법을 좀 더 익히고 접할 필요가 있을듯하다.
9791162242834,6,"프로그래밍을 아예 모르는 초보에게는 다트문법 부분부터 막히겠다 싶네요.별도로 Dart를 먼저 공부하거나, 최소한 프로그래밍 기초중의 기초 책이라도 먼저 보고 이책으로 넘어와야 겠네요. 다트문법 설명이 개념적으로만 되어있어 완전 쌩초보는 힘들겠네요.조금만 먼저 알고 오면 어렵진 않습니다"
9791162242834,4,책 소개엔 입문 활용서라고 해놓았는데 초보입장에서 참 난감하고 너무 불친절하다 가령 코딩을 따라하다보면 이 코드를 어느 부분에 넣어야 되는지 설명도 없고 지면때문에 전체 코드를 생략했다고 했는데 최소한 어느 부분에 넣어라는 힌트조차 없다 생초보가 따라하기엔 힘들지 않나 싶다..
9791163031451,4,글의 내용과 작성 파일 이름이 맞지 않아 혼동이 오는 경우가 많아서 학습의 어려움이 너무 큽니다.
9791163031451,10,가장 최근에 나온 리액트 서적이라 그런지 다른 책들에 비해 최근 동향을 기술하고 있다는 점이 좋았습니다. 내용이 쉽지는 않아서 몇번 반복해서 복습을 해야 될 것 같네요. 나중에 개정판이 나온다면 리액트 네이티브에 대해서도 다루어진다면 더욱 좋을 것 같습니다.
9791163031451,10,자세하기가 아주 자세하고 내용이 깊다. 캬 어렵다.
9791163031451,6,내용은 정말 좋다. 약간 투머치인 감이 없지않아서 책을 다 보기도 전에 지칠 것 같다. 유튜브 강의가 몇 개 없어서 아쉽다. 뒷 부분까지 보기는 무리일 것 같고 앞 부분이라도 보면서 개념 정리 하면 좋다.
9791163031451,4,"내용은 좋지만 너무 세세한 내용까지 담은 나머지 학습량이 과도하게 많습니다. 말 그대로 시간과 노력 대비 가성비가 떨어지는 교재. 그리고 유튜브 강의를 무료 제공한다고 하는데 유튜브에는 정작 동영상 몇 편 안 올라와있고, 그마저 아주 초반 부분만 다뤄 큰 쓸모가 없습니다."
9791163031451,10,그냥 댓글은 달 수가 없어서 5점주고 댓글을 답니다. 책 받자마자 쓴거라 나중에 읽고 수정할 수 있으면 수정하겠습니다. 펼쳐보니 2020년 교재에 클래스로 컴포넌트를 구현한다니 이 점이 무척이나 아쉽네요. 공식문서에서도 함수형을 권장하고 있는데.. 물론 둘다 공부해야 하는건 맞지만 아쉽습니다
9791163031451,10,"단순히 리액트를 소개하는 책이 아닌 고급 기술, 실무 개발 예제까지 폭넓게 다루는 책"
9791188621729,10,인터넷으로 무료로 볼 수 있는 러스트 공식 도큐먼트의 한국어 번역본입니다. 한번 쭉 읽어보면 러스트의 철학과 방법론에 대해 배울 수 있습니다. 앞으로 러스트 책이 더 많아졌으면 좋겠습니다.
9791162890141,6,C 를 알고 있는 사람에게는 C   부분이 너무 간단하게 언급되어 있고 C  의 개념을 잡기에는 부족한 책으로 비추천함. 오직 c   를 처음 접하는 사람에게만 추천함. /  이 책을 읽고 C 를 읽어보는 것은 괜찮으나 C 를 읽고 이 책을 읽는 것은 추천하지 않음.  초보자용 책으로 적합
9791186573167,10,유니티 쉐이더를 배우고 싶은데 도통 쉐이더라는게 뭐하는지 모르는 사람들에게 추천하는 입문용!
9788968484988,10,파이썬을 제대로 다루고 싶다면 반드시 읽어야할 책
9788968482311,6,처음부터 단계별로 입문자를 위해 친절하게 잘 설명되어 있습니다. 첫걸음을 위한 용도로 적합합니다. 하지만 편집이나 구성이 반듯반듯 하고 진부한 그림도 있어서 다소 교과서처럼 딱딱해 보입니다.
9791195444953,2,오역떄문에 읽기가 힘듭니다.
9791195444953,2,이게 왜 바이블인지 모르겠다.설명이 더럽게 어렵다.그렇다고 해서 코드가 상세히 나와있는 것도 아니다.그래서 내가 바보인가 싶어서 다른 책에서 설명한 같은 패턴을 보면 이해가 잘된다.그럼 책이 이상한거 아닌가?
9791195444953,10,"GoF, Gang of Four. 객체지향 소프트웨어 대가 4 인방을 지칭. 원서는 1994년에 출판된 이후 프로그래머의 필독서가 됐다. 2007년 국내 번역됐고, 다시 개정판이 나왔다. 개정판에서 뭐가 달라졌을까. 번역이 나아졌기를 기대한다."
9791195444953,10,객체지향 프로그래밍 이론을 공부한다면 반드시 읽어볼 것을 권하는 책
9788966260768,10,설명이 아주 잘되어 있습니다. 개념이 쏙쏙 들어와요. 자바스크립트 좀 더 공부해야겠다 맘 먹은 분은 무조건 이 책으로 시작하시기를 추천드립니다. 다른 책 다 검토해보고 이 책으로 구입했고 많이 도움이 되었어요.
9788966260768,10,"이 책 정말로 좋습니다. 국내 다른 서적들은 뭔가 보면서 부족한 들었지만, 이 책은 그런게 없어서 너무 좋았습니다. 번역도 부드럽게 잘 되었네요."
9788966260768,8,"http://daejin.blogspot.kr/index.html2013/08/01-02.html｀니콜라스 자카스｀ 상당히 좋아하는 저자이지만, 역시 두꺼운 책(1,186페이지)은 읽기 어려운 것 같습니다. 손이 정말 잘 가지 않습니다. 그런데 오늘 퇴근 10분정도 남겨두고 잠깜 보고 갈까했는데, 아주 좋은 내용을 읽어서 이렇게 블로그"
9788966260768,10,"엄청난 두께의 첫 모습에 겁먹을 필요는 없어요. 무엇보다 조금만 읽다보면 아시겠지만, 쉽고 명확한 설명들이 넘쳐나거든요. 군더더기가 없다랄까요? 아무튼 기본적인 문법이나 내용 정도는 보신 분들이라면, 강력 추천하는 책입니다."
9788966260768,10,"자바스크립트 완벽가이드를 레퍼런스로 가지고 있어야 한다면, 이 책은 꼼꼼한 실무지침서 같은 느낌이다. 두께에 먼저 놀라기는 하지만 많은 그림과 친절하고 꼼꼼한 설명이 이해을 돕는다. 뭔가 빠진 듯한 다른 자바스크립트 서적보다는 단단하게 기본기를 공부하겠다면 이 책을 추천한다"
9788994774299,8,리눅스 입문서로 부족함이 없습니다. 구성이 좋아서 설명이 이해하기 쉽네요^^
9788994774299,8,"도서관에서 벌써 3번이나 빌려서 보았고, 결국 이책의 글솜씨나 책구성이 맘에 들어서 결국 구입하게 되었답니다.^^｀"
9788994774299,6,입문서로는 안성맞춤인거 같네요.
9788994774299,8,전반적으로 책의 내용이나 구성이 입문서로는 부족함이 없어 보입니다.매장마다 커맨드를 쉽게 알 수 있도록 친절한 설명이 되어 있습니다.
9788995062920,10,"그 명성 그대로, 감동의 도가니탕..^^
원리를 알아야 최적화가 가능합니다."
9788989975588,10,고전. 구체적 사례들은 너무 오래된 것들이지만 기반 원리는 현재도 적용이 가능함. 겉만 번지르르한 말들이 아니라 실제 그 자체를 적나라하게 보여줌.
9788989975588,6,생각보다는 별로.. 자기 주관은 뚜렷한 책...
9788989975588,8,이책은 초급자에게 어렵다. 현장의 경험이 있는 자만이 공감할 내용들이다.
9788989975588,8,이제 IT에 입문했다면 이해를 하지 못 할지도... 중급자라면 아!라는 생각을 할
9788989975588,8,괜찮네요.  어느 개발자나 읽어 보면 자기 얘기 같고.
9788989975588,10,"소프트웨어 개발뿐만 아니라, 어쩌면 모든 생활과 접목할 수 있는 ""영리한 책""!"
9788989975588,10,"컴퓨터 일에 종사한다면 필독서 인것 같다.
많이 느끼고 많이 배운책 고마운 책."
9791162243695,10,애저의 모든 것... 처음배우는 애저 그러나 모든 것을 담고 있는 국내 유일의 애저 교과서애저에 대한 막연한 궁금증은 이책 한권으로 의문들이 풀렸다.  https://plmis.tistory.com/1201 에 가면 이책의 서평맵이 있다.
