ISBN13,rating,review
9788936472672,10,"책을 고를 때도, 읽을 때도 많은 도움이 되었어요.아이책의 세계도 어마어마 하던데 길잡이가 되어 준 책이예요."
9788936472672,10,아이들의 생각이나 마음을 표현하는 책인것 같습니다. 표현에 서툴른 아이들의 마음을 들여다 볼 수 있을 것 같습니다.
9788936472672,10,그림책을 여러가지 각도로 이해하고 우리 아이들의 마음을 더 깊고 잘 이해할 수 있게 해주는 책이라서 추천합니다.
9788936472672,10,"저자가 의사인만큼 아이들의 심리적, 신체발달적인 부분을 잘 설명해 놓은 책이었습니다. 육아서라고 해도 될 만큼 그림책보다 더 큰 의미를 가진 책. 읽고 많은 것들을 배우고 알 수 있는 기회가 되었습니다. ^^"
9788936472672,10,서천석 박사님이 추천하는 그림책들은 그동안 아이에게 어떤 책을 읽혀야 할까 고민하고 막막해 하던 부모들에게 좋은 길잡이가 된다. 특히 그림책의 스토리와 그림에 주목하여 어떤 성향의 아이가 어떤 부분에 주목해서 볼 수 있는지 안내하고 있어 책을 선택하는 데 많은 도움이 된다. 다양한 그림책에 대한 정보를 얻고 접근 방법을 알려주는 고마운 책이다
9788936472672,10,추천해주신 그림책을 읽으며 아이의 마음도 내 마음도 돌아보게 됩니다.
9788936472672,10,아이의 시선으로 그림책을 볼 수 있는 책.책을 더 읽고싶어지게 하는 책.
9788936472672,10,"부담스런 육아서에 지쳐있는 엄마에게 육아서이지만,휴식같은 책..."
9788936472672,10,그림책을 통해 아이의 정서발달을 설명하고 있어 육아에 도움이 많이 되요
9788936472672,10,도서관에서 우연히 빌려보았다가끝까지 꼼꼼이 읽었네요. 알라딘에서 다시 구입했구요. 아이들의 눈높이에서 그림책들을 다시 볼수 있는 좋은 책이랍니다
9788936472672,10,그림책을 아이와 함께 읽으면서 마음을 나눌 수 있어서 좋아요.
9788936472672,10,마음에 여유가 생깁니다.
9788936472672,10,서천석 선생님의 수년 간에 걸친 '그림책 사랑'의 집대성!
9788936472672,10,"좋은 그림책을 선택하는데에도, 그리고 그림책을 읽은 아이 마음을 공감해줄 때도이 책에서 얻은 인사이트가 크게 도움이 될 것 같아요!"
9788936472672,10,세아이 엄마로써 그저 단순하게 아이들에게 책만 읽어주면 되겠지 라는 생각을 했었는데 이 책을 통해 아이들의 동화책에 담겨있는 깊은 의미를 알게 되었고 다시한번 아이들의 책을 관심깊게 보게 되었다.
9788936472672,10,그림책을 읽은 아이들 마음을 느끼고 싶습니다.
9788936472672,10,도움되는 책
9788936472672,10,그림책에 나와있는 그림을 통해 아이의 마음을 읽어주어  엄마가 아이를 더 잘 이해할 수 있게 하는 책
9788936472672,10,아이들의 그림책 독서를 통해 조금이나마 친근하게 소통의 길을 열어볼 수 있는 접근법을 재발견함
9788936472672,10,good
9788936472672,10,아이에게 읽어줬던 책 내용의 새로운 의미를 알게 되었고 이책을 통해 아이에게 읽어주고 싶은 책들도 많이 생겼어요. 연령별 추천도서 리스트도 참 좋아요
9788936472672,10,그림책을 통해 나를 발견하고 아이를 발견할 수 있게 해 주는 고마운 책 입니다 ^^
9788936472672,10,서천석님의 글을 읽고 개안하게 되었어요 그래서 이  책을 선택합니다.
9788936472672,10,표현을 하지 못했던 아이들도 그림책을 읽으면서 자신의 마음을 조금씩 열어가면서 감정표현하는 것을 보고굳이 다그치지 않아도 그림책 한권을 다 읽고 나면 아이의 마음을 알게 됩니다.
9788936472672,10,아주 알찬 내용
9788936472672,10,아이를 기르는 부모에게 응원이 되는 책입니다.
9788936472672,10,우리 아이에게 그림책을 골라줄때 꼭 참조할 책이에요.
9788936472672,10,거창하진 않지만 맘에 와닿았던 책
9788936472672,10,우리아이들은 어른들과는 또다른  방식으로  책을  보고 느낀다는 사실을  다시 한번 알게해준  책이다.  글자에  치중해서 열심히  읽기를  반복했지만  아이가  그림  한장한장을 보며 숨은 그림 찾듯이  뚜러져라
9788936472672,10,서천석 닥터가 소아정신진료와 그간의 아이들 책을 읽은 경험을 바탕으로 잘 정리하여 나온 책입니다. 책육아하시는 분들께 권하는 베스트 도서입니다.
9788936472672,10,그림책으로 아이들의 마음 이해하기. 그리고 위로와 감동은 덤
9788936472672,10,서천석 선생님의 가이드로 아이에게 어떤 책을 읽어줄지 도움을 얻었어요.
9788936472672,10,아이의 마음뿐 아니라 내가 몰랐던 내 마음도 들여다볼수 있어서 좋았어요~
9788936472672,10,서천석의 책이러면 모두 좋음.
9788936472672,10,"국민육아멘토이신 서천석 선생님의 그림책 이야기,아이들 마음 뿐만 아니라 엄마들 마음도 읽어 주시네요~상황별로 설명되어있는 특히 3장 심리적 어려움에 처한 아이를 위해... 편은아이의 행동을 이해하는데도 큰 도움이 되네요.글은 제가 읽고 저희 아이들은 책 속 표지 보는 재미에 빠졌답니다~"
9788936472672,10,그림책과 아이들. 아이들 마음을 그림책으로 이해한다.
9788936472672,10,육아의 어려움을 이해하는 선생님의 처방전.
9788936472672,8,아이들의 마음을 헤아릴 수 있는 기회를 준 책이에요..다양한 상황과 책들을 소개해 줌으로써 도서 선택의 방법도 알게 되었네요..선물하고 싶은 그런 책입니다.
9788936472672,10,아이들 마음을 짐작해 책을 읽어 줄 수 있어 좋습니다.
9788936472672,10,무작정 고르던 그림책에 가이드 라인을 제시해주는 책
9788936472672,10,평상시에도 서천석님의 캐스트나 트윗을 즐겨보는 저에게 많은 즐거움과 아이의 책읽기에 대한 많은 생각을 할수있게하는계기가됨
9788936472672,10,그림으로 마음을 읽어낼수 있다는 것은 예전부터 알려진 사실이다.하지만 일반인이 알기 쉽게 출간된책은별로 없는 듯 하다.이책에 기대를 거는이유는 누구나 알기쉽게 설명해냈기때문이다.
9788936472672,10,그림책과 독서 대중을 잇는 훌륭한 가교.
9788936472672,10,책 제목처럼 그림책으로 읽는 아이들 마음 들여다 보아요
9788936472672,10,아이들의 마음은 알것 같으면서도 어려워요~~
9788936472672,10,요즘 그림책육아에 관심이 많은데 읽어보니 내용도 알차고 무엇보다 마음에 와닿는 내용이 많아 좋네요~제가 가지고있는책도 다수 포함되어있어서 더 관심있게 읽었어요
9788936472672,10,"한참 그림책을 보여주기 시작할 때라, 그림책 고르는 데 도움받고자 구매했습니다. 읽다 보니.. 제가 놓친 부분도 세세히 짚어줘서, 아~ 이런 의미구나.. 싶네요. 책육아를 꿈꾸는 맘들에게 참 좋은 책이 아닌가 싶어요."
9788936472672,6,뭔가 가르침을 받은 느낌이예요.
9788936472672,10,도서관에서 우연하게 보게 되어 많은 도움을 받아 구매하게 되었어요.
9788936472672,10,서천석쌤의 책의 책이라 기대하고 구매합니다
9788936472672,6,아이들이 진짜 괴물로 자라나지 않기 위해서는 우선 괴물의 시기를 살아가지 않으면 안된다는 말이 굉장히 와 닿았습니다.
9788936472672,10,그림책에 관심이 많은데 기대를 안고 구매합니다.
9788936472672,8,남매둥이 홀로육아에 도움이 될것 같아서 구매결정. 수령하자마자 정독하려구요.
9788936472672,10,소개만 봐도 기대되는 책이에요.
9788936472672,10,아이들 마음을 잘  이해할 수 있었습니다. 아이들도 이책을 참 좋아하네요.
9788936472672,10,아이가 클수록 이런 저런 생각이 많아집니다. 좋은 책이라는 말을 많이 들어서 기대를 갖고 구매합니다. ^^
9788936472672,10,좋은 책일것 같아서 기대감을 가지고 구입합니다.
9788936472672,10,읽어본 사람이 추천해줘서 저도 구매합니다.저에게도 좋은책이 되었으면 좋겠네요
9788936472672,10,읽는 내내 위로가 되는 책입니다.
9788936472672,10,서천석 선생님 믿고 구매해요. 그림책으로 읽는 아이들 마음 기대됩니다~
9788936472672,10,책을 통해 아이와 더 가까워지고 싶어서 구입했어요. 무엇보다 아이들을 향한 따뜻한 시선이 마음에 들어요.
9788970673967,10,"어렸을 때부터 글쓰기라고 하면 마냥 어렵고 회피하는 그런 것이었는데 이 책을 보면서 글쓰기는 필요한 상황, 목적에 맞게끔 맞는 글을 쓰기 위한 중요한 부분이라 글쓰기에 대한 두려움이 있는 사람이라면 한 번쯤은 봐두면 좋을법한 책인 것 같습니다."
9791190779203,10,어릴때부터 그림그리기는 세상을 보는 시각이 넓어진다는 말이 참 마음에 와닿습니다.. 그래서 아이들이 아주 어릴때부터 그림그리는걸 즐겼구나 싶었어요. 자기가 아는 사물들을 그리는게 세상을 알아가는 과정이었다니! 아이들에게 늘 그림그릴수있는 환경을 제공하는것이 정말 중요하단걸 생각했
9791190779203,10,아이들 얼굴을 그려주고싶어서 선택한책~^^ 밑그림 그리기도 있어서 아이들도  옆에서 같이그리네요. 서로의 얼굴도 그려보고 같은 물체를 보고 그려보고 웃으며 그림그리기.잼있는 시간보냈네요.매일 선긋기 연습을 하다보면 아이들 얼굴을 그릴수있는날이 올꺼같아요.
9791185823638,10,아이를 잘 키운다는 것이 정량적 평가만 받던 시절이 있었다. 외고나 서울대를 보내면 만점이고 인 서울은 낙제 커트라인인듯. 이 책은 이같은 평가의 오랜 집단최면에서 엄마들을 깨워낸다. 이제부터 엄마들의 바람직한 자각이 시작된 것이다!
9791185823638,10,"우리 모두는 마녀 엄마, 아빠인것이다. 그 힘든걸 모두다 묵묵히 해내고 있다. 이제 당연한게 아니라 대단한것이라는 평가를 해줘야한다. 옛날보다 쉬워졌다고 하지만 현재에도 애키우고 사는게 대단한 일이다. 그래야 서로 잘 살고 더 애를 낳을수 있지 않을까나? 인구가 줄어든다니 걱정이다."
9791164062508,10,저희아이는 집중력도 좋지않아서 가만히 앉아서 무언가를 멋하거든요 그러던중에 이 책을 알게되었어요 ㅎㅎ 아이가 쉽고 재미있으니까 너무 좋아해요ㅎ 무엇을 그려야할지 몰라했었는데 주제가 있으니 더 쉽게 그리고 그 옆 공간에 창의력폭발~~ 진짜 좋네요 ㅎㅎ 만3~6살아이들한테 추천합니다 ㅎ
9791187158202,10,저는 전집 다 있는데 신기하게도 36개월 아기지만 자꾸 책 보여달라고 해서 많이 보여주고 있어요. 영어 전문 출판사는 역시 다르네요. 한글 발음 표기도 다 있어서 너무 좋습니다.
9791187158202,10,아직 아기가 어리지만 제가 영어를 너무 못해서 이걸로 공부하고 아가랑 영어 공부 재미나게 해보고 싶어용!!ㅋㅋ
9791188915149,8,아이의 기질과 부모의 양육방식을 이해하는데 도움이 되었습니다.사회성이 높은 민감성 기질의 강점 약점을 알려주는 부분에서 caution이 엉뚱한 글이 올라와 있습니다. 수정 부탁드려요.
9791188915149,10,"아이를 잘 안다는 게 뜬구름같았는데, 자세한 기질 테스트를 통해 이제 명확해지네요. 육아서를 아무리봐도 내 아이에게 딱 들어맞지 않는다는 느낌이었지만, 이 책은 달라요. 아, 바로 이거구나! 싶은 명쾌한 답이 나옵니다. 덕분에 육아에 있어 좋은 기준점이 세워졌어요."
9788998156855,10,0세~6세 아이가 있는 집에서 보고 적용해보면 좋은 책입니다. 정리도 깔끔하게 잘 되있어요. 제 아이는 6살이 넘었지만 책 보고 응용해서 재미있게 놀았습니다.
9788998156855,10,"아이들은 각 시기에 특별한 감각으로 모든 것을 흡수한다. 아이가 민감기의 원리를 따르지 못하였다면 발달의 기회를 놓치며, 이는 한번 놓치면 영원히 사라진다.⠀0~3세는 정신적 태아기로 이때의 아이들은 고도의"
9788998156855,8,비싼 교구를 사지 않아도 일상 생활 속에서 활용할 수 있는 활동들이 많이 소개되어 있네요.
9788998156855,8,아이와 집에서 어떤 놀이를 할 수 있을까 고민하다가 구매했는데 다양한 방안을 제시해 주어서 하나씩 해 보고 있습니다. 다만 대상 연령의 폭이 넓어서 내 아이가 당장 써먹을 건 생각보다 적다는 게 조금 아쉽습니다.
9788965291619,10,발도르프 교육을 제대로 공부하려면 반드시 읽어야 할 첫 번째 책! 루돌프 슈타이너의 4구성체와 발달론의 기초를 배울 수 있다.
9791187749349,10,여기 있는 놀이로 아내가 많이 시도해보는데 참신한 게 많네요~~
9788994273846,10,나의 육아서 1pick!
9788994273846,10,"자연스러운 육아를 격려하는 구체적인 내용에, 처음부터끝까지 고개 끄덕이며 읽었습니다."
9788990220127,10,아이와의 대화에 관한 바이블.
9788990220127,8,왜 자녀양육서의 고전이라 불리는 지 읽으면 알게 된다 번역서의 특성상 술술 읽혀 나가진 않게 되지만 나를 돌아보게 만든 책
9788990220127,10,와우! 표지만 화려하고 읽기 쉬운 육아서와는 차원이 다른 책
9788990220127,10,대화란 이런것이다 알려주는책. 쉽진 않다.
9788990220127,8,"상대방의 감정을 읽어라 > 자신의 감정에 솔직하라 > 자신의 감정을 읽을 수 있는 능력을 키워야 한다. 자신의 감정이 어떤지 관찰하라!노력에 대해서 칭찬을 받는 아이들은 어려운 과제에 더욱 끈질기게 매달리는 태도를 보인다.아이들의 생각과 감정에 관심을 기울일 것이며, 겉으로 드러난 행동, 곧 고분고분 하거나 반항하는 태도에 대해서 대응하지 않고, 그런 행동을 유발하는 감정에 대처하겠다는 다짐하면서 출발해야 한다. p135˝정말 무척 당황했구나.˝˝자존심이 상했겠구나.˝ ˝그 때문에 화가 났겠구나.˝˝그 때는 운전사 아저씨에게 정말 화가 났을 거야.˝ ˝오늘 기분 나쁜 일이 있었나본데.˝ ˝일진이 나빴나 보구나.˝ ˝오늘 힘들었나 보구나. ˝ ˝누가 널 못살게 굴었나 봐. ˝˝애, 푸딩은 네 사람이 같이 먹을 거야.˝ 훼손되지 않은 정보를주었다. ˝버스를 타고 가는 것을 생각해 봤니?˝˝싫어 여러 번 갈아타야 해˝ ˝버스 타는 것은 싫은가 보구나.˝ p148˝피곤한가보구나. 열심히 공부 했으니까. 준비가 되거든 다시 해.˝˝내가 채근하고 소리지르고 억지로 시키지 않았는데도 머리를 깎아서 기분이 좋았어요. 아들에게 선택할 기회를 주었어요 그렇게 하면 체면을 살려줄 수 있을까 해서요.˝흔하디 흔한 일시적인 해결책을 제시하는 것보다, 어려움을 마음으로 알아주며 이해해 줄 때 아이는 더욱더 용기를 얻는다 p172˝ 그러니까 돈이 등교시간을 잘 지키고 숙제도 꼬박꼬박하고 공책정리도  깔끔하게 하면 좋겠다는 말씀이시군요.˝ 지난 잘못을 탓하기 보다는 앞으로 고쳐야 할 점에 대해서 초점을 맞출 수 있게 해주었다.  비난 대신 앞으로 나아가야 할 방향과 희망을 주었다.승낙을 나타내는 몇 가지 표현˝너가 원한다면.˝ ˝네가 바라는 것이 진정 그것이라면.˝˝결정은 네가 내려.˝˝사실 그건 네게 달려 있어.˝˝그것은 전적으로 너 선택에 달려 있어.˝ ˝내가 어떻게 결정하든, 난 다 괜찮아.˝뭐든 아빠가 다 들어주게 할 수 있다는 딸의 말을 인정하지 않을 수 없었다. 딸 질이 자기를 싫어한다고 느낄 때, 자기 마음이 얼마나 큰 상처를 받는지, 자기가 딸에게 얼마나 많은 사랑을 받고 싶은지를 깨달았을 때, 비로서 그는 ˝안돼.˝라고 말할 수 있었고, 또 그렇게 하리라고 다짐 할 수 있었다.행동에는 한계를 정하되, 소망이나 감정에는 제한을 두지 말아야 한다. 감정은 이를 확인하여 정리해 줘야 한다. 행동은 한계를 정해두고 제지해야 한다. p189벌을 줄 때는 아이를 화나게 하는 일은 피해야 한다.아이의 상한 마음을 대신 표현해 주면서 이해 이해하는 자세를 보여 주어야 한다.아이가 무슨 부탁을 하는데 거절 할 경우가 있다.  현실에서는 만족시킬 수 없어도 상상 속에서는 허락하는 것이 좋다. ˝ 지금은 기사를 거절할때. 당신 기사를 실어 줄 수 있었으면 정말 좋았을 텐데요.˝라고 하면서 운을 뗍니다.성숙한 사랑은 약점을 거부 하지 않으면서 강점을 받아들인다. 성숙한 사랑을 할 때는 남자나 여자 모두 상대를 이용하거나 소유하려고 하지 않는다. 각자는 자기 자신의 소유잉 뿐이다.  그런 사랑은 상대에게 자신의 가장 훌륭한 점을 펼치고, 가장 훌륭한 자신이 될 수 있게 하는 자유를 준다. 사랑과 성관계는 같은 것이 아니지만, 운이 좋은 사람은 그 두가지를 결합할 수 있다. p299아들 때문에 기분이 좌우되지 않았고1. 지혜의 출발점은 아이의 말에 귀를 기울이는 것이다. 2.  아이의 지각을 부정하지 말아야 한다 감정을 반박하지 말아야 한다. 3. 비난하지 말고 길잡이를 해주어야 한다. 문제를 이야기하며 가능한 해결책을 제시해 주어야 한다. ˝책을 도서관에 반납해야겠더라. 반납 기한이 지났어. ˝4. 화가 날 때는 ˝나˝라는 말로 시작하여 자기가 본것 느낀것 기대했던 것을 이야기하는 것이 좋다. ˝나 화났어 나 약 올라 나 분통터져 나 분개했어 나 깜짝놀랐어˝지혜의 작은 침묵이며, 권위에는 용기가 필요한 것도 배웠어요. 그래서 말은 적게 하고 대신 말을 많이 들어요.  문제가 발생하면 훈계하지 않고, 해결책을 찾아요. 변명하거나 대놓고 불평을 터뜨리지 않으면서 아이들의 불평에 대응하는 법을 배웠어요. 사실을 인정하는 칭찬을 할 때 내가 ˝나˝라는 말로 시작했다는 것을 눈치챘나요? 판결을 내리는 칭찬을 할 때는 ˝당신˝이란 말로 시작했거든요. ˝난 당신의 관심을 높이 평가해요˝"
9788990220127,10,여태껏 어떤 육아서보다 가장 최고라 기억되는 책.아이의 마음을 읽는 마법같은 탁월한 책
9788990220127,10,있던 책을 언니에게 주고 새로 사서 본 책. 알고는 있지만 실천이 힘든 상황들을 다양하게 소개하고 있으며 그 상황들에게 지금의 나의 육아 방향을 잡아보게 하는 책입니다.
9788990220127,10,아이를 키우는 엄마들이 봐야할 책!
9788990220127,10,나는 무엇보다도 부모와 아이와의 관계가 중요하다고 생각한다. 부모와 아이와의 관계가 아이의 성격과 애착부분등 모든 면에 작용하고 아이에게 영향을 미치기 때문이다.
9788990220127,8,좋아요
9788990220127,10,선생님이 추천해주셔서 읽었는데 읽으면서 계속 아하아하 하는 마음이 들었던 책.
9788990220127,10,"다른 책들은 이 책을 바탕으로 쓰여진 책들이다.
당연히 하나만 선택하라면 이 책을 선택할것이다."
9788990220127,10,늘 마음을 다잡게 해주는 육아의 바이블같은 책.
9788990220127,10,읽어라!
9788990220127,10,성공하는 사람들의 7가지 습관- 인가를 읽고 다른 자기개발 서적이 필요없다고 느꼈었는데.자녀 교육서적은｀부모와 알아야 할 모든 것｀ 과 이 책 두 권으로 더이상의 관심을 접었다.지극히 기본적인 귀감이 될만한 이야기.
9788990220127,8,이 책처럼 대화하기가 상당히 어렵다...실천만 할 수 있다면 나도 좋은 엄가가 될 수 있지 않을까??읽고 또 읽어야겠네 ^^
9788990220127,8,사람을 대하는 태도와 배려를 알려주는 책입니다
9788990220127,10,"이 책은, 그냥 마스터피스다. 덧붙일 말이 없다. 부모와 아이 사이의 대화에 촛점을 맞춘 책, 우리는 대부분 잘 몰랐을 뿐. 모든 육아서의 앞자리에 놓여져야 할거다."
9788990220127,8,살짝  미심쩍은 부분도 있긴하지만 사람이 사람을 대하는 가장 기본적인 태도를 알려준다.
9788990220127,10,왜 이제서야 이 책을 읽게 되었을까요. 두고두고 몇번씩 읽고 싶은 책입니다. 좋은책은 서로 빌려주고 빌려보는 맛이 있지만 이 책은 제 동료와 시아주버님께 선물까지 했습니다.
9788990220127,10,잘 받앗습니다 ㅎㅎ
9788990220127,8,"좋은 부모란 참 어렵지만,그렇게 되기 위해 노력하고 계신 많은 분들이 보기 좋은 책!"
9788990220127,8,아이에게 내가 잘못한 것들이 자꾸 떠오르네요
9788990220127,10,내 아이를 이해하기 위해서 한번쯤은 꼭 읽어야하는 책입니다.^^
9788990220127,8,살며시 스며드는 책입니다
9788990220127,10,잘 보면 알 것이다.단지 부모 자식간의 이야기만이 아니라는 것을..강추!!
9788990220127,8,유명한 만큰 많은 도움이 되네요. ^^
9788990220127,10,정말 좋은책! 자주 복습을 해주어야 한다..^^
9788990220127,10,"대화의 기술, 칭찬의 기술, 체벌의 기술, 의사소통의기술이 모두담겨 있다."
9788990220127,10,"아이의 행동을 이해하는데 도움이 됩니다
부모님들 꼭 읽어보세요"
9788990220127,8,"너무도 유명한책, 부모가 되고서는 내 아이와 좀더 가깝게 다가가기 위해 고른책"
9788990220127,10,읽고 이 책도 믿음이 가서 구입했다. 찬찬히 두고볼 책
9788990220127,10,모든 육아서의 시작 . 이 책 먼저 읽고나야  다른 책이 진정 이해되기 시작한다.
9788990220127,10,각 상황에 따라 어떻게 행동하고 대처하면 되는지 자세히 예시가 나와 있어 좋은 책
9788990220127,8,따뜻한 부모가 되기위한 고전!
9788990220127,10,제가 무심코 한 말과 행동이 내 아이에게 좋지않은영향을끼친다는것을다시깨달았어요
9788990220127,10,아직 다 읽어 보지는 못했지만 열심히 읽고선 부모로서의 기술을 익혀야겠다
9788990220127,10,"아이를 둔 부모라면 누구나 꼭 봐야하고, 미리 읽어두면 좋은 책"
9788990220127,10,언젠가 나도 엄마가 될 사람이라서 미리 읽어두고 나중에 실천하고자 구입했는데 만족
9788990220127,10,부모와 아이 사이에 보이지 않는 담이 있습니다. 그런 담을 허물기 위해 필요한 책.
9788990220127,10,"하임 기너트 박사의 사이 시리즈, 자녀의 성장단계에 따라 꼭 봐야할 책."
9788990220127,10,예전에 구입한 책이지만 많은 도움을 받은 책입니다.꼭 읽어보세요.
9788990220127,10,엄마와 아이들 사이의 터닝 포인트 되었다.
9788990220127,10,제가 8년 전에 구입하여 읽고 우리집 아이들(3명 )키우는데 큰 지침이 되고 있습
9788990220127,10,딱딱하지만 유익한책
9788990220127,8,언니의 추천으로 읽고 있어요..아직 이른 나의 선택.아이가 6개월이거든요.내용
9788990220127,10,추천받아 사서 읽고 벌써 4번째 다른 사람에게 선물해주고 있는 책
9788990220127,6,저자는 정말 천재다!
9788990220127,8,조금 어렵긴 하지만 아이와의 관계에 많이 도움이 되는 책이네요.
9788990220127,10,육아의 '동아전과'! 아~~ 감사해요
9788990220127,8,"특히 아이들의 얘기가 읽을 만 했어요
부모와 십대사이도 읽었는데 비슷하네요"
9788990220127,10,모든 부모에게 강력추천합니다. 특히 저처럼 고집센 아이를 둔고집센 부모에게요..
9788990220127,10,읽고 또 읽고 ...반성...그리고 작은 실천..우리 아이를 움직이는 작은 시작
9788990220127,10,"사회가 복잡해지면서 아이를 부모만 키우는 세대가 되었다.
아이와의 신비한 대화"
9788990220127,10,학급홈페이지 이용 어머니들께 추천했어요
9788990220127,10,20여분에게 빌려 주었는데 읽고 그분들이 다시 구매했다. 두고 두고 읽을거란다.
9788990220127,8,"아이 감정 상하지 않게 교육하는 방법이 구체적인 사레와 함꼐,,실현은 어렵지만."
9788990220127,10,쉬운 대화 내용으로 흥미롭게 진행되는 유익한 책입니다. 초보 부모에게 강추~~
9788990220127,10,아이의 감정 공감해주기의 베스트셀러~
9788990220127,10,새언니에게 선물했는데 참 좋다네요.
9788990220127,10,육아의 고전답습니다. 열독하고 있습니다..
9788990220127,10,부모와 아이 사이는 부모라면 한번쯤은 꼭 일어야 하는 책입니다.
9788990220127,8,"내 아이와 나의 관계, 그리고 사랑에 대하여 다시한번 돌아보게 해주는 책이라고 본다"
9788990220127,8,내가 읽고 3번째 선물하는 책.
