ISBN13,rating,review
9788934986652,10,아이와의 대화가 한결 부드러워졌습니다. 마음이 편안한 아이로 키우는 것이 가장 중요하다는 부분에서 신선한 충격을 받았습니다.
9788934986652,10,가는말이 고와야 아이의 행동도 바르다는걸 확실히 알게해준 책. 해서는 안될말은 내가 어려서 많이 들었던 우리 부모님세대의 차갑고 날카로운 언어였다.그래서 그런지 오은영 선생님의 언어는 따뜻하다.그 따뜻함을 배울수 있어서 너무 감사하다.
9788934986652,10,육아를 위한 지침서이지만 사실은 이 세상의 모든 사람의 모든 관계게 해당하는 내용이다. 우리들은 어른이 되었지만 여전히 아이같이 유치하고 어리숙하게 하는 말과 행동으로 가족들을 비롯한 주위 사람들에게 상처를 주기 때문이다. 그런 의미에서 좋은 부모란 좋은 관계를 아는 성숙한 인간이다.
9788934986652,10,"마음을 먼저 공감해주는 말, 아이의 입장과 상황을 고려한 말, 내가 듣고 싶었던 말"
9788934986652,10,좀더 편하게 아이와 대화할 수 있는 엄마가 되기 위해 읽어 보았습니다. 알면서도 잘 되지 않던 말들... 책을 읽으며 제시된 문장을 따라 읽어도 보고 그 말들을 아이에게 써보려고 노력하는 엄마가 되어 가는 요즘이다. 조금씩 천천히 아이의 마음을 이해해가는 엄마로 성장할 수 있도록 도와주는 책
9788934986652,10,마음만 먹으면 볼수 있는 오은영 박사님의 육아조언. 혹시 가볍게 소비되고 말 책인가 의심하며 샀는데 역시 엄지척. 위로받고 또 배웁니다.
9788934986652,8,아이늘 키우는 엄마에게 꼭 권장하고 싶은 책이네요~
9788934986652,8,참 ...난감할때가 많은데 ...많은 도움이 되겠어요^^/
9788934986652,10,이런걸 보는 내가 행운아
9788934986652,10,"듣지도 보지도 못했던 말들, 혼자 연습하는데 왜 제가 눈물이 날까요. 제 내면의 아이가 먼저 수용받는 기분이 들어서 참 좋습니다. 감사합니다."
9788934986652,4,가끔은 정말 ‘부모가 들어야 할‘ 얘기가 아니라 ‘부모가 듣고싶어하는‘ 얘기를 하는 게 아닐까....
9788934986652,10,육아서인데 왜 엄마인 제가 힐링이 될까요?ㅜㅜ
9788934986652,10,정말정말 원했던 책입니다.수많은 육아서와 교육관련책들을 읽으면서 늘 아쉬웠던 적용부분이 이 책에 다나와요우리아이들이 유아기를 훌쩍지나서 발간되어 아쉽지만 그래도 지금이라도 읽을수있어서 얼마나 다행인지....소리내서 읽어보고 바로바로 적용합니다.진심 감사합니다
9788934986652,10,아이들과 있으니 오고가는 것이 ‘말‘⠀그 말들을 어떻게 하느냐가 큰 관건이었다.⠀ 이 책은 ‘말‘에 대한 책이다.말에 대한 중요성을 설명하기보다 아이와 함께하는 일상에서 도움이 될 만한 말들을 구체적으로
9788934986652,10,알고있고 알법도 한 아이에게 해줄 말들인데 실상 사용하기엔 머릿속이 깜깜 해지고 책을 반복해서 외우다시피하면 아~이땐 이런말을 해줘야는구나!다시 한번 되새김하며 그동안 내 표현이 잘못되어서 아이에게 상처를 준거란걸 느끼게 해주는 책이었습니다아이가 잘못한게 아닌 엄마인 내가 잘못ㅠ
9788934986652,8,마음이 편안한 아이...맞아요. 부모 마음은 부모가 다스립시다.
9788934986652,10,기대하고있어요~~믿고보는 오은영선생님*^^*
9788934986652,10,기대됩니다!
9788934986652,10,아기키우면서 읽어보고 싶네요
9788934986652,6,기대됙니다
9788934986652,10,"선물받아서 잠깐 읽어봤는데 오은영박사님 목소리가 들리는것 같아요제마음도 따뜻해지고 아이를 대하는 내 모습도 돌아봅니다육아회화, 라는 주제 답게 아이에게 상황에 맞추어 해줄수있는 가이드북이에요미리 예습해서 그 때 그 때 맞게 잘 사용하려고요~아이의 정서에 행동에 도움이 될듯 합니다"
9788934986652,10,국민 육아멘토 오은영 박사님의 신간 너무너무 기대됩니다!
9788934986652,10,"코로나블루로 아이들과 함께하는 시간이 더 늘어나면서 더 욱하게 되고 우울함에 아이들에게 스트레스를 고스란히 전달해주는 것이 아닌가 고민하고 있는 저에게 너무나 와닿는 문장들, 표현들이 담겨있어서 다시 반성하고 부모는 부모여야한다는 말에 공감하게 되네요"
9788934986652,10,목차만 훑어봐도 생각할 거리가 많아지네요. 같은 의도라 할지라도 입밖으로 나오지 않았던 말이 많았는데 오은영 박사님의 소리 내어 연습해보기 방법은 간단하면서도 유용합니다.
9788934986652,10,"정답은 없겠지만, 최선을 시도하는 이러한 다양한 접근법 기대됩니다"
9788934986652,10,"아이에게 가장 좋은 훈육법, 오은영 박사가 들려주는 현밀착육아회화. 조카가 있어 매우 공감하면서 읽었습니다. ^^"
9788934986652,10,요즘 아이들 정말 키우기 힘들다고 한다. 우선 부모의 말을 듣는 시늉도 안한다. 아이가 왜 그럴까 깊이 생각해볼 문제다. 이 책엔 부모라면 누구나 공감할 상황별 대처방안이 제시된다. ‘이럴 땐 이렇게’ 아이의 반감은 줄이고 공감은 늘려보자.
9788934986652,10,"우리아이가 달라졌어요, 금쪽같은 내 새끼.엄마도 아빠도 처음이라 아이키우기가 최고로 어렵다. 부모의 말이 바뀌면 아이의 행동도 바뀐다. 우리 아이를 키우고 부모를 키우는, 오은영의 현실밀착 육아회화 130가지!!"
9788934986652,10,오은영박사님 책 읽을 때마다 내 육아태도를 점검하게 되어요.이번 책도 기다립니다.
9788934986652,8,티비 잘 보고 있어요 오은영 박사님 책 기대되요
9788934986652,8,프롤로그만 봐도 많이 봐온 말들이지만 직접하기엔 연습이 필요한 말들이에요. 기대하게 돼요^^
9788934986652,10,무척 기대됩니다!!
9788934986652,10,오은영 박사님! 각종 방송에서 말씀하셨던 육아꿀팁 잘 쓰고 있는 터라 많이 기대됩니다.
9788934986652,8,오은영박사님 하면 믿고 듣고 보는 거져!!!무한신뢰합니다.기대가 많이 되네요^^
9788934986652,10,오은영박사님 책은 꼭 구매해요
9788934986652,10,기대됩니다.
9788934986652,8,오은영 박사님의 책이니 영상을 보는 듯할 것 같아요. 기대됩니다
9788947546874,10,이책을 통해서 우리는 부모가 먼저 부자 마인드로 거듭나야 한다고 말하고 있다. 여러 사람들을 하브루타 밀리어네어 프로그램을 통해  그 결과는 많은 부모님들이 놀라운 변화를 경험 하였다.
9788947546874,10,금수저는 아니지만 부자 마인드를 전해주고 잘 살 수 있도록 하는 교육! 꼭 필요한 교육이네요. 우리나라는 돈 공부를 제대로 안 시켜줘서 스스로 공부해야하는데 기대되는 책입니다!!
9788947546874,10,하브루타 교육법에 관심이 생겨 이책을 알게 되었어요요즘 아이들에게 경제 교육은 꼭 필요하다 생각해서 기대가 많이 됩니다
9788947546874,10,제목보고 너무 끌려서 그자리에서 바로 읽기 시작했네요 사실 요즘 재테크에 다들 관심들이 많은데 자녀 생각까지 하면 고민되거든요 이 책읽고 많이 배웠네요 강추입니다!
9788947546874,10,"내 아이의 부자수업을 읽고나서 내 아이의 경제교육을 틀을 잡을 수 있었습니다.특히 유대인들의 창의력과 기부를 통해서 많은 깨달음을 얻었고,그것을 곧 내 아이에게 연결될 수 있을 거 같아서 이책은 저에게 큰 선물 같습니다.감사합니다."
9791188915415,10,따라하기도 쉽고 재료 안 사러 가도 되서 좋아요. 가끔 재료 준비하다가 김빠질때가 있는데 바로 놀아줄 수 있어서 좋아요. 아이도 너무 좋아합니다.
9791186494622,10,장난감사모으다가 현타왔어요이제돌지난아이랑 뭐하고 놀아줘야되나고민했는데너무 도움되요ㅋㅋ
9791186494622,10,요즘 엄마표 놀이 많죠?여기저기 너무 좋은 놀이는 많은데 내 아기에게 맞는 연령의 놀이인지 여기저기 흩어져 있어서 기준점 잡기가 어려웠는데 이 책은 세돌이전의 어린아기가 할 수 있는 놀이가 많아 좋아요. 이책을 기준삼아 우리 소중한 아기에게 다양한 놀이 해주려고합니다. 아기는 잘 놀아야 잘 크니까요!
9791186494622,10,아이와 함께 집에서 쉽게 구할수 있는 재료로 엄마표 몬테소리 활동을 할수 있게 상세한 사진과 설명 들이 너무나 도움이 됩니다. 몬테소리 비싼교구는 부담스럽고 우리 아이에게 몬테소리 활동을 해주고 싶은 부모님들에게 도움이 될 책이네요
9791186494622,10,평소 궁금했던 몬테소리 활동들! 아이와 함께  활동들 따라하고있습니다 너무 유익해요
9791186494622,10,간단한 실생활 도구로 아이와 추억을 만들 수 있는 책을 만나 기뻐요♡
9791186494622,10,몬테소리를 몰라도 집에서 쉽게 따라할 수 있는 마법같은 책
9791186494622,10,"아이와 무얼하며 놀아줄지, 코로나시대에 집콕하며 펼쳐보고 엄마표 몬테소리해주기 딱 좋은 책이다."
9791186494622,10,6개월맘인데 몬테소리식 교육에 관심이 생겨서 공부하던 중에 엄마표 아이중심 놀이책이 나와서 어머나!!! 제가 정말 필요하던 책이 마침 나왔어요 유치원선생님이자 아이엄마신데 이렇게 최고의 책을 출간하시다니 존경스럽습니다!^^ 오늘 처음 만들어서 놀아줬는데 대만족이네요♡
9791186494622,10,누구나 쉽게 따라할 수 있는 엄마표 몬테소리 놀이의 즐거움을 아이와 함께 할 수 있기에 꼭 해보고 싶어요.
9791186494622,10,생활 속 재료를 활용해 영아지도를 할 수 있는 구체적인 프로그램이 큰 도움이 될 것 같습니다. 감사합니다.
9791186494622,10,"집에서 흔히 있는 물건과 다이소에서 쉽게 구할수있는 재료로 엄마표로 해볼수 있어서 넘 좋은책놀이에필요한 각종카드와 이미지자료도 다운로드 할수있고 프린터로 쓱뽑아서활동하면 될 것 같고챕터마다 권장월령,놀이목표도 제시되 있어눈에 쏙쏙 보기 쉽다한가지씩 활동해봐야겠다"
9791186494622,10,씬디티쳐님 인스타보고 구입합니다~33갤 17갤 두 아들에 적용해보려구요.많은 분들의 추천 또한 믿음이 가네요.
9791186494622,10,집에서 충분히 만드는 교구로 쉽게 설명해줘서 좋은 책이에요. 교구 만드는 값은 저렴한데 내용은 절대 저렴하지 않아요. 발달별 놀이를 쉽게 알려줘서 진짜 좋은책이용
9791186494622,10,아이와 무엇을 하고 놀아야 할지 막연했을 때 신디쌤 놀이 참고할 수 있어서 넘넘 감사했어요!!ㅎㅎㅎ 잘 정리되어있는 책으로 만나게 되어 넘 좋네요~~ 출산 선물로도 아주 좋을 것 같아요~~~!!^^
9791186494622,10,인스타에서 많이 보고 따라했었는데 이렇게 책으로 나와서 너무 좋네요~~바로 예약구매 합니당~!!
9791186494622,10,쉽게 따라할 수 있는 엄마표 몬테소리 놀이❤ 기존에도 아이와 잘 따라하며 놀았었는데 더 많은 놀이를 볼 수 있어서 기대되네여!!!!!
9791186494622,10,씬디쌤 인스타에서 많이 보고 따라했는데 이렇게 책을 출간했다는 소식듣고 버선발로 달려나왔습니다ㅠ 넘 기대되고 아이있는 친구들에게도 다 추천해야겠습니다!!
9791186494622,10,씬디쌤표 놀이들을 책 한권에 모아모아 한번에 볼수 있다니 넘넘 기대돼요! 저희 아이와도 재밌게 놀아볼게요 :-)
9791186494622,10,씬디티쳐님 안녕하세요 히히인스타잘보고 있어요 책 나왔다는 소식듣고 얼른 예약합니다여기저기 알려줄게요 고마워요 ㅎㅎ
9788997396658,10,부모님을 이해하고 나를 이해하기 좋았습니다 감사합니다
9788997396658,10,왜 1위인지 이해가갑니다. 다시한번 나를 생각해보게되고 앞으로 어떻게하면 좋을지 가이드가 되어줄 책입니다. 신랑도 꼭 읽었으면 좋을 그런 책입니다
9788997396658,10,“못참는 아이”에만 포커스를 두고 읽기 시작했다가 “욱하는 부모”가 핵심이라는 결론에 도달. 욱은 하지 말고 사랑을 바탕으로 하지만 단호하게 가르치는 것이 중요. 만3세를 갓 지난 아이를 둔 부모에게 추천할 만한 책
9788997396658,10,진짜   감탄이  절로나와    한권을 외워야겠어요   하나하나가 마음에속 속
9788997396658,2,개인적으로 추천하고 싶은 육아서적은 아닌것 같네요.ㅠㅠ^ 유명하신 분이기에 믿고 구매했는데 잘못된 방법들도 많은것 같아요. 베스트 셀러인 이유를 모르겠네요.. 유명세 때문인건지..ㅠㅠㅠ
9788997396658,10,나는 책을 읽으면서 감명깊은 문장이 있으면 책 모퉁이를 접는데 이건 너무 많이 접어서 책이 더 빵빵해졌다 ㅋ. 문장이 아니라 전반적으로 깔려있는 기조가 맘에 들고 계속해서 나 자신을 다잡아야 한다고 느낀다. 대여섯권 더 사서 아이가 있는 지인에게 나눠줬다. 읽고 또 읽어야 할 책.
9788997396658,10,이거 그냥 바이블....포스트잇 한통을 북마크 하는데 다썼어요~! ㅎㅎ
9788997396658,10,많은 분들이 꼭 읽어보시기를  권해드려요~~
9788997396658,10,욱하지 않은 않는 부모는 없다. 강도의 차이와 표현의 방법이 다를 뿐. 못참는 아이는 이 세상 모든 아이들이 그렇다. 욕구를 숨기거나 억누르는 환경에 따라 어른들이 볼 때는 잘 참는 아이로 보일 뿐이다.
9788997396658,6,'욱'하지 말라고 부모들한테 반복적으로 이야기해주고 있다. 특히 사례들을 보면 남일같지 않아 더욱 집중하게 된다.하지만 뒤로 갈수륵 반복적인 이야기만 나온다. 해결방법은 하나. 욱하지 말자... 내 생각에는 필요한 부분만 빌려읽음 좋을 듯하다
9788997396658,10,참 실용적인 책이라고 생각합니다.우연히 도서관에서 보다가 ˝아 이건 사야겠다˝ 했습니다.왜냐햐면 밑줄을 쫙쫙 긋고 싶은 마음이 솟구쳤기 때문이지요
9788997396658,10,정말 필요한 책이예요 아이에게 화낼 상황때마다 참고 이 책읽어요 요즘은 욱하지 않게 되더라구요^^
9788997396658,8,"두고 두고 다시 읽고싶은 책. 감정그릇을 키우지못한 채 부모가 된 나를 키우고,우리 아이를 잘 키우기  위해 읽어야 할 책.책 내용은 굿!다만. 책이 크고 무거운 점. 표지나 삽화 디자인이 전체적으로 많이 촌스러운게(?) 아쉽다~작고 가볍게 만들었다면 더 자주, 들고 다니며 볼수있었을듯."
9788997396658,10,"반드시 육아를 위한 책은 아닙니다. 내면 속에 자라지 못하고 남아있는 어린 아이가 가끔 느껴지는 사람들이라면, 남은 인생을 위해 꼭 읽어야 하는 책이라고 생각했습니다."
9788997396658,10,한 글자 한 글자 버릴 말이 없다.
9788997396658,10,아이 키우면서 꼭 봐야 하는 책.
9788997396658,10,남편이랑 같이 읽으려고 샀어요. 계속해서 들춰보고싶은 그런 책입니다.
9788997396658,8,오영은선생님 책은 잘 안읽혀서 안읽었는데 이책은 오래 준비해서 쓴 책이어서 그런지 내용 구분이 잘되어 있고 이해도 잘되요. 책장에 두고 생각날때마다 읽어도 좋을 책입니다.
9788997396658,10,너무도 유명한 인물이지만 오은영 박사의 육아서는 이것이 처음이었는데알기 쉽게 쓰여졌고 실전 위주의 교육이라 얻은 것이 많았다.무엇보다 부모로서 나를 자꾸 되돌아보게 됐다.
9788997396658,6,베스트여서 사긴 했는데.......
9788997396658,10,"책을 읽으면서 경이로움을 느낍니다.내가 어떻게 성장해서 이런 어른이 되었는지, 어떤 가정이 내 성격 형성의 토대가 되었는지 매우 명확하게 쓰여 있네요.나의 문제점과 동시에 자녀를 나와 같이 키우지 않도록 많은 지침이 알기 쉽게 설명되어 있습니다.많은 미혼, 기혼남녀들에  강력 추천합니"
9788997396658,10,"3대가 반성하고 변하게 한 책이예요.욱하는게 자랑도 아니고, 아이가 부정적 감정을 처리하는 방법을 지금 잘 알려줘야겠다고 생각하니 아이에게 화도 덜 내게 되고요.아이가 짜증낼때 그저 안때리기만 하면되는 줄 알고 말로 다그치고 화내고,못참는건 아니가 아니라 내 자신이구나 깨달았네요"
9788997396658,10,도움이 많이 되었다.
9788997396658,10,"내 자신을 위한 책인것같았다...^-^읽고나서 나의 육아방식이 확! 180도 바뀌지는 않았지만, 정말 많은 변화가 있었다. 욱하지 않고 마음을 다 잡는 방법도 배우고, 욱한다는건 자랑이 아니라는걸 깨우쳐준 책 ㅎㅎ 정말 소장할만한 책인것같다! 잊을만 할때쯤 다시 읽어두려한다~~"
9788997396658,10,진짜 도움됐어요. 제 자신을 돌아보게 됐습니다
9788997396658,10,아이보다 어른인 자신을 위한 책
9788997396658,8,"욱하는 내 자신이 싫었지만 , 이제는 인정하고 스스로 고쳐야 함을 알기에 두렵지만 읽게 된 책!우리 아이에게는 나와같은 실수를 하지 않게 바라며 하나씩 고쳐나가려 한다. 쉽지가 않다 ㅜㅜ"
9788997396658,6,육아에서의 기본을 잃지 않기 위해 가끔은 이런 책이 필요하다. 방송을 많이 하셔서일까?본질까지 가는 긴 설명이 몰입을 방해한다. 사례들도 일반화하기엔 공감이 안되는 것들도 많아서 핵심정리가 챕터 뒤에 있음 좋겠단 생각이다. 그럼에도 나쁜 육아 습관에 경종을 울리기에 넘치는 책이다
9788997396658,8,오은영박사님....감사합니다...
9788997396658,10,천천히 읽고 있어요한장 한장 정말 도움이 많이 되네요욱! 하다가 꾹 참게 되고... 아이 마음을 좀 더 생각하게 되었네요완전 강력추천 합니다 ^^
9788997396658,10,올바른 아이의 교육법에 대해 잘 알수 있는 좋은 책입니다
9788997396658,10,초보 육아에 힘들어하는 엄마들에게 반드시 필요한 책이라고 생각되네요
9788997396658,10,전문가가 알려주는 올바른 아이의 교육법이라.. 정말 기대되네요
9788997396658,10,신뢰할 수 있는 전문가가 알려주는 아이 교육법이라 더욱 믿음이 갑니다
9788997396658,10,좋은 부모의 올바른 교육열로 이끌도록 지적해주는 좋은 책입니다
9788997396658,10,올바른 부모의 교육을 알려주는 좋은책
9788997396658,10,내가 아이들을 키울 때 과연 어떤 마음을 가지고 키웠을 까를 이 책을 읽으며 다시한번 되돌아 볼 수 있는  계기가 되었다.부모의 잘못으로 아이들이 겪는 아픔을 조금이나마 위로해 주고 다가갈 수 있는 제 자신이 되기 위해 이책을 읽고 또 읽어 봅니다.
9788997396658,10,여러 사례를 보면서 어떻게 대처를 해나가야 되는지 방법을 찾을수 있어서 기대가 됩니다.
9788997396658,10,다양한 행동분석을 통해서 근본적인 원인을 찾을수 있어서 읽어보면 육아에 도움을 받을수 있겠어요.
9788997396658,10,"참을성이 부족한 아이들을 이해하고, 감정 조절을 잘 할수 있도록 조언을 들을수 있어서 좋은것 같아요."
9788997396658,10,"육아서적 많이 읽는 편인데, 이책은 딱 좋았다..질질 끄는 내용도 없고, 그동안 내가 읽었던 육아서적을총망라한듯 한 느낌이다. 이 책은 오래동안 두고 보고싶다"
9788997396658,10,무엇보다 문제점 뒤에 숨어 있는 아이와의 소통의 부재가 크게 다가온다.
9788997396658,10,베스트셀러인 이유가 있습니다.똑 소리 나는 조언이 좋습니다. 방송에서는 접할 수 없었던 세세한 조언들이 특히 마음에 들었습니다.추천 들어갑니다.
9788997396658,10,훈육의 달인인 오은영 선생님께서 지으신 부모교육서라 많은 도움이 될 것 같아요. 사례별로 구성이 되어있어 상황에 따라 어떤 방법으로 접근해야 할 지 알게되어 좋은 것 같아요.
9788997396658,10,좋은 부모가 되기 위한 자세에 대해 좀 더 생각해 보게 합니다.
9788997396658,10,순간의 감정으로 욱하게 되는 것이 내 아이에게 얼마나 안 좋은 영향으로 미칠 지 제대로 알지 못했던 것 같습니다. 이 책으로 좋은 부모가 될 수 있는 방법을 배우게 된 것 같습니다.
9788997396658,8,"결국 부모의 감정이 자녀에게 전달된다는 건데, 섬뜩하기도 하고 미안해지기도 합니다. 매우매우 읽고 싶은 책이네요."
9788997396658,10,자녀와 부모가 같이 감정 조절을 하기 위해서 읽어보면 좋을것 같아요. 오은영 선생님의 명쾌한 처방을 기대해봅니다.
9788997396658,10,"어떤 동기로 이 책을 읽게 되던 간에, 저자가 풀어놓은 내 '욱'의 속살을 들여다 보는 것은 부끄럽기도 하지만, 좋은 부모가 될 수 있는 도전의 기회를 준다."
9788997396658,10,화를 내지 말아야지 하면서도 자꾸 말을 듣지 않는 아이의 모습을 보게 될 때면 나도 모르게 화를 낼 때가 있어요. 오은영 박사님의 책을 통해 감정조절 방법에 대해 자세히 알아볼 수 있어서 좋았습니다.
9788997396658,10,공든 탑이 무너진다는 말의 대표적인 원인이 ｀욱｀이 아닐까. 보이지 않는 곳에서 하는 것까지 닮아있는 아이를 보며 부모부터 변해야 함을 느낀다. 제발
9788997396658,10,오늘도 참지 못하고 아이에게 욱하는 제가 반성이 되네요
9788997396658,10,아이들의 감정적인 문제는 대부분 부모로부터 시작된다. 부모의 감정조절을 통해서 아이의 행동을 바로잡을 수 있는 기회.
9788997396658,8,참 좋은 책인 것같아요.이제 시대가 달라졌으니 육아법도 달라져야겠죠.
9788997396658,10,우리 아이 어릴때 이 책을 알았다면 참 좋았을거 같아요.이제라도 접해 볼 수 있으니 기대가되는 책입니다.
9788997396658,10,아이를 키우고 있는 부모라면 누구나 겪는 화가 났을때의 상황을 어떻게 대처 해야할지 알려줄거 같아서 두고두고 볼 책인거 같습니다.
9788997396658,10,아이를 대할때 가장 어려운 것이 감정 조절이더라구요. 기다리는 것도 힘들구요. 기다리면서 감정조절하는게 너무 힘든데 이 책을 통해 배울 수 있을 것 같습니다.
9788997396658,10,"저자는 부모의 감정조절 실패가 아이에게도 그대로 영향을 미치는 점에 주목하고, 못 참는 아이에 대한 부모의 올바른 교육법을 제시하고 있어요.  욱하는 육아법의 문제점을 이야기하면서 못 참는 아이를 대하는 법을 상황에 따라 구체적으로 소개하고 있어서  많은 도움이 될 것 같아요."
9788997396658,10,"육아에 정답은 없다. 그러나 이책은 육아에 있어서 방향성을 잡아주는 좋은 책인거 같다. 잘못된 부분, 안좋은 태도는 줄이고 긍정적인 마음을 갖게 해주는 도덕교과서와도 같은 책"
9788997396658,10,아이의 감정을 이해하고 제대로된 도움을 주기 위한 부모가 꼭 배워야 할 것들로 이루어진 책입니다. 부모로써의 자신을 객관적으로 바라보고 아이의 행동 역시 분석적으로 볼 수 있도록 도움을 주는 책이네요.
9788997396658,10,감정조절의 효과를 톡톡히 보는 책이네요!
9788997396658,10,읽다보면 암걸릴것 같기도 하고 시원하기도 하고...
9788997396658,10,오은영 선생님 책이라면 믿고 볼수있어요.
9788997396658,10,아이가 아닌 엄마에게 문제가 있지 싶어 고민하다가 주문했습니다.언제나 후회하면서도 참지못하고 욱하는 부모에게 상처받아 흔들리는 딸아이에게 너무나 미안합니다.항상 눈에 보이는 곳에 책을 두고 오늘부터 상처주는 말을 하지 않는 엄마가 되도록 노력하겠습니다.
9788997396658,10,나를 돌아보게 하는책
9788997396658,10,나도 모르게 무의식적으로 행동하는 모습이 아이에게 어떤 영향을 끼치는지 반성하게 되었네요. 아이의 잘못된 행동에 대해 현명하게 대처하는 법을 하나씩 배워갑니다.
9788997396658,10,"읽을수록 나를 돌아보게 하는 책이네여. 많이 느끼고 깨닫게 됩니다.욱하는게 당연한게 아닌, 감정조절이 안 되는 이유였다는걸 다른사람을 통해알게 되니 아이들에게 미안합니다."
9788997396658,8,아이와 부모의 관계가 참 힘들군요.. 그래도 이 책을 보고 조금이라도 더 나아졌으면 좋겠습니다.
9788997396658,10,참 스스로를 돌아보게 되는 책이다. 지금도 종종 욱하는 이 성미가 이 책을 남다르게 바라보도록 만든다.
