ISBN13,rating,review
9791190776011,10,"이현아 저자가 가진 에너지와 따뜻함이 느껴지는 책. 탄탄한 연구로 인용된 서적들도 좋았고, 그림책 창작이라는 새로운 시도를 상세히 안내해주어서 많은 도움을 받았습니다. 그림책을 바라보는 관점 자체를 바꾸어주는 책이었어요. 이현아선생님 존경하고 응원합니다."
9791190776011,6,서평후기가 너무 많아서 구매를 망설였어요.그림책교실 사례를 모아둔 에세이에 가까워요새로운 것을 알려주는 게 아니고기존에 해왔던 그림책놀이수업을학교 지속적으로.진행한거라 . 그림책교실풍경이 궁금하신분들에게 좋을듯해요.
9791190776011,8,드디어 책을 내셨네요. 온라인 연수로 듣는데도 열정에 감동받고 가슴이 뛰었네요. 책도 좋지만 연수를 다시 봐야겠어요.항상 응원합니다.
9791190776011,10,그림책을 통한 창작수업 프로젝트의 사례가 궁금하고 기대됩니다. 아이들이 즐거워하는 수업을 진행한 그림책 활용방법을 알 수 있을 것 같아 기다리게 되네요!
9791190776011,10,현직교사가 운영한 그림책 프로그램 활용사례 기대됩니다. 아이들에게  효과적인 그림책 활용 방법이 있으리라 기대합니다.
9791190776011,10,현직 교사의 생생한 경험이 더해진 책이라 더 보고 싶다는 생각이 드네요. 더불어 제가 참고하여 아이와 함께 해볼 수 있을 거란 기대에 찹니다.
9791190776011,10,"저역시 공교육 현장에서 아이들과 그림책으로 소통하기를 사랑하는 교사인지라, 주제가 너무나 와닿네요. 그림책과 함께하는 아름다운 학교이야기 너무나 기대가 됩닏."
9791190776011,10,벚꽃이 활짝 핀 요즘 아이들과 그림을 그리고 싶은 날씨인데 그럴수가 없죠.그래서 더욱 아이들에게 그림을 재미있게 그릴수 있는 방법을 알려주고 싶은데 이현아 선생님의 책이 많이 도움이 될 것 같습니다.
9791190776011,10,"책의 저자이신 선생님의 연수를 본 후, 그림책에 대해 가지고 있던 막연한 호기심이 그림책을 활용한 아이들과 소통에 대한 고민, 학급 특색 교육으로까지 커졌습니다.그런 선생님의 그림책 수업이 잔뜩 담긴 책이라니!! 항상 곁에 두고 그림책 활용 수업을 구상할 수 있다니!!! 너무 기대됩니다ㅎ"
9791190776011,10,그림책이 주는 힘을 알 수 있다니? 놀랍습니다. 기대됩니다. 그림책 한 권으로 그림책수업을 하는 방법을 알 수 있을 거 같아 기대하고 기다립니다.
9791190776011,10,6년간 학교현장에서 이미 검증해본 그림책이니 독자는 그대로 활용하면 되겠네요~^^ 출간 기대됩니다!!
9791190776011,10,"그림책수업, 책놀이 관련 책이 봄물에 방개 기오나오듯 하는 요즘. 현직교사의 연수를 담당하는 전문가 선생님이 전하는 그림책 수업은 그 수준부터 다를 것 같다!"
9791190776011,10,아이와 엄마가 함께 그림책을 만들어보면 좋을 것 같아요. 그림책을 보기만 할게 아니라 이야기를 담아 창작해보면 너무 좋겠습니다.
9788925567921,2,이런 천박한 제목의 책이 버젓이 팔리고 있다니.. ㅈㄹ은 또 뭐고 18이 뭘파는 의미인지나 알고 쓰는 건지?..
9788925567921,2,"저급한 제목과 저급한 내용,  아무리 돈버는 데 급급해도 출판사에서 이런 책을 내서 작가의 질을 떨어뜨려놓다니...."
9788925567921,2,"제목을 보고 큰 충격을 받은 책입니다. 어떻게 이런 천박한 제목을 서점에서 팔 수 있는가, 호기심에 구입했으나 별 내용도 없고 제목만큼이나 비밀글에서나 할 법한 말투와 표현이 늘 마음을 상하게 하네요.평생동안 책을 구입해서 후회한 것은 이 책이 처음이네요"
9788925567921,2,"마지막 2년간 학원, 고액과외...."
9788925567921,10,"정제되지 않은 자연어로 쓴 날것의 맛, 강렬하며 깊숙히 들어온다. 즉시 실행해볼것. 하지않을 이유가 없기때문에."
9788925567921,4,"좋게 얘기하면 명문대 합격 수기, 나쁘게 말하면 몹시 긴 자기 자랑   자식 자랑. 이런 식의 글쓰기가 먹힌다는 건 아이들 뿐 아니라 어른들의 독서력(또는  독해력) 또한 바닥이란 걸 반증하는 것이다. 교육서적이란 포장을 걷어내고 가벼운 수필 정도로 생각한다면 읽을 만 하다."
9788925567921,2,책들이 다 똑같은 내용. 책 제목만 바뀐 리커버.짜집기한 내용들...나만 믿고 따르라...종교인가요.어찌 확신하고 그렇게 말할 수 있나 궁금하네요.책장에 넣어두기도 민망하네요.
9788925567921,6,"그래요. 사교육 없이 일명 좋은 대학 이른 나이에 간 것은 분명 우리 나라 공교육에 경종을 울릴만 하고, 학년이 높아질수록 학원과 학습지에 밀려 아이들이 정작 뛰어놀지도 못하고, 독서가 왠말인가요... 한번쯤 읽어볼만하지만, 소장까지는 글쎄요... 그냥 하은이를 낳으시면 됩니다."
9788925567921,2,난 별로
9788925567921,8,"애 키우며 이런저런 삽질에 괜찮다는 육아서 탐독, 주변 엄마들의 갖가지 육아마인드를 접하다 하은맘책 다시 집어들어보니 이게 답이다 싶다. 욕설같은 제목이니 과도한 딸 자랑이니 악평이 많은데 저자가 제시하는 글의 요지만 잘 파악해서 체화해 내 자식 잘 키우면 되는거다. 책은 추천ㅎㅎ"
9788925567921,10,블로그 보면서 강의 들으면서 많이 기다렸습니다~울다 웃다..내용이 이리 통쾌할수가..ㅎ
9788925567921,2,올해 산 책 중에 가장 돈 아까운 책
9788925567921,2,"책 제목이 너무...  절대 읽고 싶지도, 집에 두고싶지도 않네요."
9788925567921,2,제목부터 눈길끌어 책 좀 팔아보자는 욕심으로 가득한 책. 책육아라는 말도 웃기고 참 별로임
9788925567921,10,작가님 책은 3권 다 읽었어요. 진정 아이를 어떻게 키워야할지 알게 되네요. 힘들때마다 읽으면 정말 힘이나요. 누구나 도전할수있게 해주셔서 고맙습니다^^
9788925567921,2,전하고 싶은게 뭔지는 알겠는데...독서량 많은 사람이 썼다고 보기엔 너무 저급하고 지극히 개인적인 딸자랑 사진집?그 이상의 의미는 없어 보임. 책 팔아서 꼬옥 전액 기부해주세요ㅡㅡ 그나마 내 돈쓴 의미는 있게..강의때는 제발 막말험담은 좀 가려서 하시길..
9788925567921,2,책 제목이 너무 불쾌하다 육아서 제목이 너무 저질스럽다  책 제목이 저따위여서 내용도 신빙성을 못느끼겠다 마켓팅도 적당히해라 당신 아이한테 당당히 책 제목을 소리내서 읽어줄수 있는지 생각해보시길!!!
9788925567921,2,18년 동안 육아했다는 것인지? 출판사의 마케팅 안넘어가기를. 제목이 싸구려 욕지질이라 애는 욕안하게 잘키워주시길 기원하겠습니다. 그럼 이만 18년책육아
9788925567921,10,한글자 한글자 진리이다한권 다 줄 칠 판이라 한장 넘길때마다 조심조심다 읽은후에도 새 책이네책에 쌔게 표현했다 싶겠지만 현실에 적용해봐라 정말 진리이다10살 7살 남매 티비없는 거실에서 배깔고 스삭스삭 책장 넘기는 소리만 들릴때의 그 짜릿함 느껴보고 싶지 않은가
9788925567921,2,진짜 블로그랑 내용 똑같아요.. 글도 진짜 짧고요 본인이 대박책이라고 하도 글 올리셔서 사봤는데 ㅜㅜ 내용이 진짜 없어요...
9788925567921,2,정말 쓸데 없는 내용이에요... 마케팅에 속아 산 책 ㅎㅎㅎ책육아 했던 분 책이 왜 이러나요... 18년 같이 책을 봣으면 최소한 어떤책이 좋은 책인지 아실텐데 내용도 없고 같은말 반복 알라딘에서 한달에 책 10권 정도 사는데 사고 처음 후기 남겨요
9788925567921,10,"우리가 정보가 없고,자료가 없어서 못하나요?실천하지않아서 마음을 내려놓고 기다릴줄몰라서 그러는 거지요. 작가님처럼 아이를 무한사랑하고 .무한 책과 놀수있도록 하는게 우리 엄마의 할일이죠. 작가님 책읽고 다시한번 마음잡고 실천하겠습니다^^"
9788925567921,10,십팔년 인생의 값진 보물들로 가득찬 책!!누가 읽느냐에 따라 그 값어치는 천차만별.딱 아는 만큼만 보일지어다~~!!!
9788925567921,2,본인 아이 한 명 키워본 경험만으로 이러면 너희들도 성공할 수 있어!자식 명문대 보낼수 있어!하는 거 부끄러운 줄 아는 시대가 오길.
9788925567921,10,짧게 짧게 툭툭 써내려간 글처럼보이지만얼마나 많은 고민과 경험의 결과물인지 해본 사람은알듯.˝하은이 처럼 크지않아도 된단다 딸아 너는 이세상 고유한 보석같은 아이란다 있는그대로 널사랑한다˝이거면 됐지 않을까진심으로 작가님께 감사하다~~
9788925567921,4,"그래도. 느끼는 바는 있다.다시 한 번 아이 책을 집게 되는 동기는 준다.그치만 자기 딸의 너무 잦은 미사여구, 비교우위적표현은 문득문득 거북함"
9788925567921,10,"내 아이를 비로소 제대로 품을 수 있게 만든 책이 불량육아, 군대육아였다. 나랑 아이를 살린책이다. 이번 책은 실천종합정리완결편~ 해봐야 아는 책, 치열하게 실천해본 사람만이 간결하고 정확하게 적힌 단어와 행간의 깊은 의미를 이해할 터이다. 책육아와 배려육아의 진짜 깊은 맛을 말이다~~~"
9788925567921,10,"아이를 24시간 끼고 있어보면 감이 딱 옵니다~미치고 팔짝 뛰겠다는 것을요.뭐가 뭔지 도통 모르겠는 그 시간속에서 나도 살고 애도 살릴려고 육아서를 폈어요. 십팔년책육아는 뻔한 박사님,교수님 이야기가 아니라,이시대를 뜨겁게 사는 한 어머니의 이야기 였습니다! 가슴뛰는 이야기 느껴보세요!!"
9788925567921,10,와우~너무 솔직하고 진짜만 얘기하는 명쾌한 해법 가득한 책!!!
9788925567921,10,제목을 약점으로 지적하는 독서평은 안타깝다.그건 그냥 비판일뿐 대안이 없다.목차만 베껴써봐도 이책을 따라해 보고싶은 욕심이 날터인데.비판적 독서평을 보며... 이책을 읽고 책육아를 하는 엄마들은 경쟁력을 갖췄구나 안도?를 해본다.나만 읽고싶은 책이다.
9788925567921,10,우선 책표지가 너무 좋아요~쓰담쓰담하다보면 더 정이 가는 신기한 책~처음에는 미친듯이 물흐르듯 술술 넘겨보다가 어느순간 눈물이 핑돌면서 글자하나하나 눈물어린 눈으로 읽게 되는 책~한권 더 사서 우리아이 크면 주고 싶은 책이에요~
9788925567921,10,"책이 아니었다면, 책육아가 아니었다면 나는 진정 성장해야할 필요성도 느끼지 못한채...영혼없는 삶을 살았을 것 같다. 정말 징글맞게 힘들고 모르겠는 육아이지만.깨달아 갈수록 행복해지는...나와 내애의 삶. 너무감사한책이다."
9788925567921,10,"페이지 넘길 때마다..가슴이 먹먹하고, 미안함과 죄스러움에 눈물, 콧물 쏟고 있는 못생긴 나를 발견하는.그러다 다시 두 주먹 불끈쥐게 만드는..나 거듭나리라~ 책 육아 뚫어내겠다! 내가 이 구역 미친년이다! 외치고싶게 만드는.. 육아계의 바이블 같은 책."
9788925567921,6,대부분 블로그에 있는 글이라 아쉽네요
9788925567921,10,진짜 제대로 해본 사람만이 리얼공감할수 있는..그래서 한장 한장 넘길때마다 눈물바람이 되는 책이다너무 고운책 ♡
9788925567921,10,책을 읽으면 읽을수록 몸에서 힘이 스르르 빠지고 있는 느낌이에요온 몸에 힘이 잔뜩 들어가 나도 힘들고 너도 힘들고... 그러고 산거 같아요힘빼고 처음부터 다시 시작하라고 언니가 책 써주셨나봐요감사합니다~♡
9788925567921,10,"아기띠 매고 간 서점에서 만난 나의 첫 육아서! 불.량.육.아대한민국 초딩맘으로 살면서소비육아가 아닌 진짜육아하는,육아의 신대륙을 발견하게 해준 육아계의 린치핀, 하은맘님!하은맘님의 육아인생을 완전연소시켜 나온 십팔년 책육아가 곁에 있으니육아농사는 걱정 없을 뿐이고!!"
9788925567921,10,글 한문장마다 많은 의미와 경험이 녹아들어 계속 줄긋고 필사하게 만드는 감동적인 책이네요. 책육아시작한후 가슴을 또다시  뛰게한 책써주셔서 정말 감사해요.읽고 실천하면 아이와 엄마가 성장할 수밖에 없는 초대박성장실천서네요.
9788925567921,10,아이를 아기띠에 안아서 내책 읽어주며 재우는 편인데요. 이 책은 주옥같은 말들이 숨어 있는데..소리내어 읽어줄 수는 없다는 함정이 ㅎㅎㅎ
9788925567921,10,"정말... 이거이거 장난이 아니예요.또 다시 책의 바다에 빠진 느낌.한 번 잡으면 정말 접을 수가 없어요.훅~ 들어가서 빠져서는...재미, 감동,,, 힐링까지....이 책의 여운이 오래 남을 수 있게읽고 또 읽고 꾹꾹 읽고....정말 액기스 책이예요..♡"
9788925567921,10,육아의 본질을 꿰뚫고 아주쉽게 풀어서 써준 인생 책아이와 함께 성장하고 내인생을 찾아가는 여정을 함께 하고픈 인생 멘토 언니를 만났다.
9788925567921,10,한권더 주문! 수령했습니다...한권은 내 아이가 자라서 아이를 낳았을때..이 책은 고전이다.. 네 아이도 이리 키워라 하며... 주려고 포장도 안뜯고 모셔둘거에요...
9788925567921,10,아까워서 줄도 못치고 읽었어요.읽기는 후루룩 읽어지는데 한 줄 한 줄..그냥 못 넘어가겠어서.한 줄에 수십권의 책이 인생이 녹아있는.암~~것도 몰랐을 때 읽었으믄..별 거 없네 싶을 책.아는 만큼 보인다고..지금은 한 줄 한 줄이 넘 귀하고 공감가고.
9788925567921,10,절대포기하지 않고 열심히 따라 갈께요....
9788925567921,10,"세상을 따라가지 않고, 진짜 정답을 따라갈수 있는 인생의 지침서 입니다. 저도 십팔년 동안 꼭 작가님처럼 살고싶어요"
9788925567921,10,"1장 읽을땐 오랜만에 책이 나와 마냥 신나고2장 읽을 땐 너무 많이 풀어서 눈이 휘둥그레!3장 읽을 땐  하은이 생각에 내 자식들 생각나서 눈물나고..4장 읽을땐 소름돋고, 가슴이 터질 것 같고...가슴이 먹먹해 졌어요.이것은 육아책이 아닙니다.청소년 필독서이며전 국민 권장도서입니다."
9788925567921,10,"하버드연구에 의하면, 무슨 연구에 의하면 그런 어디서 읽고 끌어다 쓴 그런 책 아니고,100%내가 경험하고 깨달은 것만 쓰겠다는 자존심이 느껴지는 책입니다."
9788925567921,10,후기를 적을 수 있는 영광을 저자에게 돌립니다. 우주대미녀 울언니 사랑해요. 책표지마냥 보들보들 자꾸 다시 읽으면서 쓰다듬고 싶어진다는ㅎㅎㅎ이 책으로 육아하는 엄마들 지랄병 잠재우고 아이들 살려냅시다. 아이는 우리의 미래니 언니는 우리들의 미래를 구원할..구.세.주!
9788925567921,10,"사교육, 학습만화로 단편적인 지식을 넣어주고 싶은 마음이 들때마다 다시 이 책을 펼쳐요. 쉽게 가는 길이 옳은 길이 아님을. 알려주셔서 감사합니다.제대로 키우려면 엄마인 저부터 제대로 살아야죠. 책 여러번 읽으며 삶의 철학으로 삼을게요. 감사합니다."
9788925567921,10,알라딘 굿즈 안 나오나요? 기다리고 있어요~~
9788925567921,10,"나를 유일하게 위로(?)해 준 육아서의 여왕 김선미 작가님의 세번째 책.아이 직접 끼고 키워보셨나요? 고고하게, 우아하게 육아 되시던가요?난 아무리 발버둥쳐도 잘 안되던데, 죽겠던데...ㅠ_ㅠ귀한 내새끼한테 자꾸 소리지르고 화내게 되던데...아는만큼만 보이는 책! 실행하는 책!"
9788925567921,10,블로그 글 읽다가 눈알빠질지경이라 전부 필사해야하나..하고있었는데! 이리도 친절하시게 책으로~!! 감사합니다.. 역시 책이 훨~좋으네요. 블로그는 왠지 허상같았는데ㅎ 역시 책!! 이 제 제손에 있으니 마치 손잡고있는 느낌!! 한번씩 정신나갈때마다 들고있는것 만으로두 힘이 되네요
9788925567921,10,십팔육아는 초고수의 내공이 들어있는데 이걸또 알아내려면 나도 어느정도 그길에 서있어야전율돋고 고개끄덕이게 되고 눈물흘리게 되는구나 하고 경험을 했어요
9788925567921,2,똑같은 내용의 책을 세권이나 내다니..대단하심...자화자찬 자기자랑 딸자랑하고 싶어서 낸책.
9788925567921,2,책제목이 너무하네요.아이가 한글을 더듬더듬 읽기시작했는데 구매하고나서 책을 책장이나 아이시야에 놔둘 수가 없어요.  목차만 그럴듯하게 뭔가 비결을 알려줄 것 처럼 해놓고 실상은 에세이같은 내용이라 부모의 불안을 이용한 마케팅같아 불쾌함을 금할 길이 없습니다.
9788925567921,10,이건 무조건 구입! 산전수전 다 겪은 18세 딸 엄마의 생생한 경험담이 절실합니다!
9788925567921,10,하은이..육아시리즈를 쭉 읽어왔는데...드뎌 이렇게 멋진 아이로 자랐다니 넘 감동이에요. 힘든시절 눈물 닦으며 지친 육아의 힘이 되주셨던 저자님께 축하 박수보내요.
9788925567921,8,하은맘이 강조하는건자연에서 놀고 책읽히고 엄마도 성장하며 책읽고쉽게쉽게 읽혀지지만 내용이 쉬운건 아니다.책육아의 모든부분이 다 들어가있다.책사기가 망설혀지면 하은맘 블로그에 글부터 읽어보고 책사서 읽어보시기!두려움으로 책육아 망설여 지는분은..언니글읽고 정신차리시면됩니다.^^
9788925567921,10,"기대되는 책이에요, 호다닥 읽어보려구요."
9788925567921,4,"불량육아 군대육아와 같은 내용... 책 전반부는 책육아 해야한다. 책 후반부는 책육아하면 다 된다. 이거에요..그래도 그 하나 진득하게 하는 간단한일이 어려우니 또 읽습니다,,"
9788925567921,8,아이를 낳고 가장 처음으로 접한 육아서 ‘지랄발랄 하은맘의 불량육아‘.사실 하은이 처럼 집중적인 책육아로만 키우진 않았으나 8년이 지난 지금 우린아인 미국원어민이 되어있다. 진짜 되더라.처음 잡았던 책이 불량육아가 아니었다면 이 길을 걸을 수 있었을까? 나에게 너무나 고마운 책이다.
9788925567921,10,육아관을 넘어서 삶의 철학까지 나눠주셔서 감사합니다
9788925567921,10,저번에 강의 들을 기회가 있어서 들었는데 넘 재밌었어요~~^^ 책도 기대기대!!
9788925567921,10,책육아하겠다고 이제 시작한 지 얼마 안 됐는데 벌써 흔들흔들하는데 이 책 정신 딱 차리게 해줄 것 같네요! 기대됩니다 ^^
9788925567921,10,부럽고 대단하고!!근데 또 책 냈다니 또또 부럽고~~ㅎ 궁금합니다!! 십팔년씩이나 됐다는게 더 놀랍습니다!^^
9788925567921,10,육아의 신이네요^^.  육아도 방목형으로 부모가 스트레스 받지 않고 하고 싶어서 다른 육아를 잘 보지 않는데요. 그래도 궁금하고 박수쳐주고 싶네요^^
9788925567921,10,"제목도, 내용도 매우 궁금해지는 책입니다."
9788925567921,10,비인이면 부전이라.
9788925567921,10,"표지보고 카타르시스 느꼈는데 목차보고 울어요,, 읽기도 전에 이러쿵저러쿵하는 이들,,그래서 행복한 육아중이신가요? 저는 작가님 덕에 더이상 왜이래?라고 묻지 않고 어떻게 내애랑 남편이랑 재미나게 살까,,행동하느라 바빠졌어요. 많이 기다린 책이 있다는 것만도 행복하고 감사해요^^"
9788925567921,10,인세 전액을 기부하는그 마음~실천~응원합니다.언니는 제 육아스승로 시작해서인생 스승이세요~
9788925567921,10,기다리고기다리는책~~
9788925567921,10,완전 기대 되요. 불육 군육 읽고 삶이 바뀌었어요.책 내주셔서 감사합니다
9788925567921,2,지랄발랄까진 이해했지만 책 제목에 십팔년이라니... 중의적으로 읽힐 것을 뻔히 알았을텐데 엄마들 타겟인 책에 십팔년이라니... 스스로도 여성이면서 여자한테 하는 욕을 제목에 넣고 싶으셨는지ㅉㅉㅉ
9788925567921,2,이책의 핵심타겟이 여성이고 저 십팔년이 어떤 중의적 표현으로 읽힐지 뻔히 알면서도...어떻게 제목을 이렇게 지을 수 있죠
9788925567921,6,하은맘팬클럽서 많이나오셨네요.저도어제열시오픈되자마자 구매했습니다 담주책 기다려봅니다
9788925567921,10,29일날 온다고? ㅠㅠ 그때까지 말라죽이려고 작정을 했구만~이 언니 ... 예판은 제발 하지말아요~ 기다리다 눈.목 다 빠지겠구만;;;
9788925567921,10,책내주셔서 감사할뿐
9788925567921,10,아씨...나만 꼭꼭 숨겨놓고 읽고싶으다#~~
9788925567921,10,기다리고 기다리던 세번째 책이 드디어 나왔네요!! 너무너무 기대됩니다.. 받는순간 휴대폰끄고 방문닫고 정독할랍니다!!!
9788925567921,10,아~~책 얼릉 읽고 싶어요~~
9788925567921,10,"아.묻.따 책육아!아직도 멀은 엄마지만,매일 다짐하며 지내면 변화가 조금은 오겠죠!"
9788925567921,10,또 책내주셔서 감사합니다~~♡
9788925567921,10,닥치고 일단 구매
9788925567921,10,앗싸!기분좋은 출판소식에 당장 구입했네요^^강연장에서도 뵙고 싶어요~!!^^
9788925567921,10,주문 완료요!
9788925567921,10,인세 전액 기부하는 스케일!이번 책은 표지 일러스트까지 섹시하고만요.묻지도 따지지도 않고 바로 주문합니다^^
9788925567921,10,구매하지 않을 수 없다!!!제목도 어쪔죻아...ㅋㅋㅋㅋㅋㅋㅋㅋ나와 내 아이의 인생을 바꿔놓은 나의 육아 인생의 메메메메메메멘토!!!! 응원응원합니다 !!!!
9788925567921,10,어여 내 품으로 와서 십팔년책육아 내껄로 만들고 싶어요~~~~!!!!
9788925567921,10,와 대박 당장 구매!! 십팔년책육아라니ㅋㅋㅋ
9788993635089,10,많은 육아서를 읽어봤지만 모두 아이를 이런 방향으로 고쳐야하고 명문대에 간 사례들만 나와 있다. 중학교 사춘기때 이외에도 또 한번의 위기가 찾아온다.  그대로 받아들임을 일깨워주는 책이다. 주옥 같은말들로 마음속에 한자한자 새긴다.
9791160505795,10,"체계적으로 정리가 잘되어있어서 아이 놀아줄때 보기 쉬운책입니다. 300가지 놀이가 있는데, 300가지안에서도 단계별로 나뉘어 있어서 발달상태를 보고 쉽게 접근하여 놀이할수 있습니다. 아이와 어떻게 놀아줄지 한정적인 고민에 빠졌는데, 이책이 쉽게 접근하도록 도와줘서 놀이할때 수월했습니다."
9791160505795,10,제대로 놀아주는 것이야말로 영유아기에 해줄 수 있는 최고의 영재 교육하나 더 가르치고 하나 더 사기 보다아이와 최선을 다해 놀아줘야지 다시 한 번 더 내 자신을 다잡을 수 있었던 책이었어요.월령별 필요한 활동을 체계적으로 제시하고 이어서 도움을 얻을 수 있었어요.
9791162180105,6,"저자가 심리학 전공자는 아니예요, 상담가라서 그런지 글이 전문적이고 체계적이진 않아요. 여러 방법이나 주제를 이끄는 각각의 챕터의 글에서 핵심파악이 어렵습니다. 좀 모호하고 추상적인 문장들이다보니 몰입도가 떨어져요. 그리고 불필요한 예시가 많다고 느껴지네요."
9791162180105,10,"자존감, 양육에 관련해서 주옥같은 비유들이 많고 마음에 와닿네요. 약간은 추상적인 얘기들일 수는 있지만 여운이 많이 남아요."
9788952234650,8,"얼마전 육아에 너무 지쳐있을때, 아이 행동에 이해가 가지 않을때 주제에 맞게 찾아보려고 구입했습니다. 주제별로 짧게 코칭해주어 쉽게 읽고 이해할수 있어 좋습니다"
9788952234650,10,"아빠의 입장에서 본 아들은 아주 상식적이다. 하지만 엄마의 입장에서는 책 제목처럼 엄청난 감정의 기복을 겪는게 현실이다. 믿고 기다리고 함께 겪어 주는 것, 아들의 든든한 돌의자가 되어 주는 것이 부모의 최선이라는 생각이 든다."
9788952234650,4,딸아들 다 겪어보고 주변도 둘러본 결과 아이 성향마다 다른듯. 꼼꼼하고 기센 초등여아들 사이에 눌린 아들엄마들의 심리를 파고드는 책. 틈새시장 공략 대성공. 딱 세바시 강연만큼.
9788952234650,6,"아들은 안키워봤지만, 요즘 아들들을 주로 대하는 일을 해서 도움 좀 얻어보려고 읽었는데 조금 도움이 되었다. 기술보다 태도를 배울수 있다. 간추리면 얼마안되는 얘기를 반복한게 흠."
9788952234650,10,강의를 통해 만난 최민준 소장에 대한 신뢰와 피식 웃음짓게 하는 제목에 대한 호기심으로 구입한 책. 가볍게 읽을려고 했는데 읽을 수록 밑줄이 많아지고 다시한번 읽어야겠다고 생각하며 방금 마지막 페이지를 덮었다. 좋다. 추천추천-
