ISBN13,rating,review
9788952778437,10,소아과 선생님이 추천해주셔서 샀는데 정말 주옥같은 책입니다. 나와 아이가 달라지는 책입니다
9788952778437,10,아이를 키우면서 실제 경험하신 내용들과 전문적인 조언이 함께 곁들여 있어 아주 유익했어요. 주변에 아이 키우는 친구들에게도 추천하고 싶네요.
9788952778437,10,"육아서 많이 읽어봤지만, 이렇게 아이의 마음 읽기에 관해 도움이 되는 책은 처음인 것 같아요. 일상 생활이 달라졌어요ㅠㅠㅠㅠ 책을 읽게 되서 제가 감사드립니다!!!!"
9788956055404,8,주영에게 빌려서 읽음.
9788956055404,6,나의 경제적 자립을 육아보다 우선순위에 놓는 것(돈벌어야 해서 아이를 남에게 맡기는 것)에 죄책감을 느낄 필요가 없다는 사이다같은 조언에 감사한 마음을 느꼈다. 이 책을 읽고나니 죄책감은 한뼘 줄고 행복감은 한뼘 커진 엄마가 된 듯 하다 ^^
9788956055404,8,육아를 하는데 정말 사이다같은 말들이 가슴에 팍팍 와 닿는 책
9788965291558,6,"가볍게 읽히는 책이예요. 한국의 극성스러운 육아 방식에서 무엇을 취해야할지, 무엇을 자제해야할지도 생각할 수 있는 좋은 기회였습니다만, 솔직히 책값이 이렇게 비싼 이유는 모르겠어요."
9791185541389,6,"관계, 언어발달, 호기심, 창의성, 감정, 성격, 사회성 등 양육분야에 관한 다양하고 방대한 서적들의 내용을 일목요연하게 잘 정리하였다. 다른 서적에 언급된 연구나 주장들을 한 권으로 볼 수 있다는 점이 장점이지만, 왠지 수험공부할 때 잘 정리된 단권화 책을 본 느낌이다."
9791185541389,2,수준이하입니다.
9791185541389,2,유명한 양육서의 짜집기. EBS의 아이의 사생활 시리즈를 읽었다면 이 책은 읽지 않아도 됨.
9791185541389,2,내용을 떠나 이들의 마케팅은 과하다. SNS를 통해 교묘히 베스트셀러로 만든다. 여기에 젋은 청춘들을 끌어들이는 모습도 열 받는다. 해괴한 집단이다. 로크미디어 출판사는 무조건 거른다.
9791185541389,2,짜깁기와 인용 투성이로 피인용자의 불쾌감을 유발.
9791185541389,8,아이교육에 관심이 많아 구입하게 된 책! 너무 기대됩니다~^^
9791185541389,4,"제목 그대로, 저자가 ‘공부‘한 내용을 정리해 놓았습니다. 그런데,저자의 공부가 막상 저에게는 크게 와닿지 않네요. 마치 여러 논문의 초록을 정리해 놓은 초록집 같은 느낌...물론 새로 알게 된 내용도 좀 있지만, 전반적으로 다소 지루하고, 새로운 통찰같은 걸 찾기는 좀 어려워 보입니다."
9791185541389,6,17개월 아이 키우는 부모인데 도움 많이 될 듯요. 기대됩니다.
9791185541389,4,"기대만큼 읽을 거리, 줄 그을 내용 없어요. 두고두고 읽힐 책도 아니고 그냥 중고로 팔려고 합니다;; 읽고싶은 분들은 도서관에서 빌려읽으세요"
9791185541389,8,"책 구성도 좋고, 아이의 입장에서 사고할 수 있게 되었다."
9791185541389,6,너무 어린 아이를 가진 부모가 읽기에는 좀 버겁네요. 아기가 돌쟁이라 나중에 크면 다시 한 번 읽어보는게 좋겠습니다.
9791185541389,10,초등학생들 키우는 부모이다. 육아관련 서적을 여러권 보았지만 아이들의 심리와 교육 관련 정보는 항상 흥미진진하다. 부모공부는 일단 재미있다. 부모공부라는 책 제목에 걸맞게 좋은 지식들을 쉽게 풀어놓았다. 어린아이를 키우든 초등학생을 키우든 보면 좋을 책이라고 강추한다.
9791185541389,10,기대만발~~~~ 궁금한 점이 많아서 찾아보다가 발견한 책!
9791185541389,2,"저널 및 근거중심으로 쓰였을 걸로 기대한 연구자 겸 의사 엄마한테는 너무 실망스럽습니다. 돈,시간낭비니 읽지 마세요 제가 peer reviewer면 major revision 드렸습니다"
9791185541389,10,아이를 키우며 집사람과 함께 고민해봐야 할 문제들을 일목요연하게 잘 정리해 놓았네요^^ 현재 아이를 키우는 부모님들 모두에게 적극 추천합니다.
9791185541389,10,어서주문해서 읽어봐야겠어요. 기대됩니다!
9791185541389,10,책이 도움이 될 거같아요 기대됩니다
9791185541389,10,양육 완벽주의에서 탈출
9791185541389,10,도움이 많이  될듯합니다^^
9791185541389,8,육아상식을 잘 정리한 책입니다. 공감이 많이 되네요.주위에 추천하고 싶은 책입니다.
9791185541389,10,아이에게 가장 영향을 많이 주는 사람이 부모라고 생각합니다. 아이를 바르고 훌륭하게 잘 키우기 위해서는 부모가 늘 배우는 자세로 끊임없이 노력해야합니다. 그러기에 '부모교육'을 읽는것으로 첫 걸음을 떼시길 바라요^^
9791185541389,10,기대됩니다. 부모는 그냥 되는 게 아니라 교육이 필요하니까요.
9791185541389,10,제가 알고있었던 잘못된상식이 보입니다. 유익합니다
9791185541389,10,재미있게 읽고있습니다 공감하는 부분도 많고요. 오늘부터 두아이의 애착관계 형성을 위해 더 노력해야 겠어요~^^
9791185541389,10,지인이 올린 페이스북에서 <부모공부>를 알게 되었습니다. 늦은 나이에 4살 딸아이를 키우는데 지금 내가 잘하고 있는건지 궁금할 때가 많았습니다. 그런데 이 책을 알게 되어서 너무 기뻤습니다. 이성적으로 감정 조절 잘 해서 키우고 싶은데...아무튼 빨리 받아서 읽어보고 싶은 책입니다.
9791185541389,8,만 4개월 아가를 키우고 있는 엄마입니다. 아이가 커갈수록 육아가 정말 어렵다는 것을 알게되는요즘입니다. 아이들이 저절로 큰다는 것은 다 거짓말..ㅡㅡ 아이에게 조금이라도 더 나은 부모가 되기 위해 꼭 읽어보고 싶습니다. 기대되는 책입니다.
9791185541389,10,˝다만 최악의 상황에서조차 아이를 위해 노력하지만 실수하는 부모들이 있을 뿐입니다.˝양육 완벽주의에서 벗어나도록 용기를 주는 말씀이네요...
9788997195848,10,그림을 잘 그리는 방식이 정해져 있는 줄 알았지만 성향에 따라 다르게 표현하고 진행해야 한다는 것을 처음 그림을 접하는 아이들과 부모님들에게 전하고싶었습니다.
9788952233462,4,제목만 교과서 읽기의 힘이라고 했지 사실은 독서의 중요성을 강조한 시중의 평범한 책의 하나에 불과. 정작 교과서를 어떤 식으로 공부해야 하는지에 대해서는 그저 그런 얘기밖에 없음. 제목을 책읽기의 힘이라고 하는 솔직함이라도 있었으면 좋았으련만.
9788952775832,8,아들 둘 키우는데 도움이 될 것 같아서 구매해 봅니다.
9788952775832,10,"아들 키우면서 어렵고 힘든점이 많았는데, 많은 도움이 되었어요. 옆에두고 항상 읽고 기억하고픈 육아서네요 ~"
9788952775832,6,유별난 조카녀석을 이해하는데 도움이 되는 것 같아요.
9788952775696,10,사진으도로 알아보기 쉽게 되어있고 생각치도 못한 놀이들이 많아서 놀랐어요. 미리 알았더라면 참 좋았을거 같아요.8개월 아기에게 해주니까 참으로 좋아하네요. 앞으로 키워가면서 책에 수록되어 있는 많을 놀이들을 함께 해줘야겠어요~좋은 엄마 되게 도와주셔서 감사해요^^
9788952775696,10,"집에 있는 물건들로 편하게 우리 아가만을 위한 장난감을 만들고놀이할 수 있어서 정말 좋았어요.가격부담도 없고, 재활용 차원에서도 참 좋은거 같아요!!"
9788952775696,10,이번에 우연찮게 알게된 아기 뇌가 좋아하는 오감발달놀이 책 !재료살필요도 없는 재활용장난감이라 일단 너무좋았고아기개월수 마다 놀아줄수있는 장난감 설명도 너무 잘되어있어서좋았어요 ! 집에서 놀면 늘 지루해하던 저희아들이 이젠엄마표 재활용장난감으로 잘가지고 노네요 ♡
9788952775696,10,90가지 중에서 몇개나 만들어 줄 수 있을까 했는데 정말 집에 다들 가지고 있는 재료들로 만드는거라 부담없이 해줄 수 있겠어요. 오늘 사과놀이 해줬더니 너무 좋아하네요. 아직 문화센터도 안다니는데 문화센터 못지않게 아이 오감발달 충분히 채워주겠어요 ^^
9788952775696,10,아이가 어려서 어떻게 놀아줘야하나고민이 많았는데이책으로 장난감도 만들어주고함께하는 놀이를 할수 있어서 좋은거같아요^^개월수에 따라 나와서 더 좋았어요:)
9788952775696,10,아이랑 어떻게 더 잘 놀아줘야 하던차에 좋았던 책  중요한건 아이가 원하는것을 캐치하고 그에 맞는 흥미로운 장난감을 만들어주는것 그리고 다양한 재료를 제공해주는것이 아닌가 싶더라고요 아이개월수에 따라 놀이가 많이 나와있어서 하나하나 다 해려고요 !
9788952775696,10,어린이집에 안보내고 싶어도 해주는게 없어 보내야 하나 고민도 많이하고 매일매일 함께하다보니 할수있는 놀이도 고갈되어 점점 아이와 함께 놀아줘야한다는 부담감이 컸는데 이 책을 만나고 하루에 한장씩 아기놀이 하다보니 재밌어요. 너무 좋습니다.
9788952775696,10,아기한테 필요한 건 비싼 장난감이 아니라 엄마 아빠와 같이 아기 취향에 맞춰서 함께하는 놀이가 필요한거죠 ! 놀이는 아기도 엄마도 아빠도 다 즐거워 하고 재밌어해야 진정한 놀이가 되는 거라고 생각해요 단계별로 다양한 놀이 방법이 소개 되어 있어 참 유익한 책이에요
9788952775696,10,문센가는것도 매일이 아니라 어떻게 놀아줄까햇는데이책으로 완전 재미잇는시간 보내요 ^^감사합니다
9788952775696,8,15갤 아이와 집에 있는 것들로 재밌게 놀아줄수 있을거 같아요!! 굿굿입니당~~
9788965290506,10,정말 많은 깨달음과 정보를 접한 책이예요~ 이 책에서 언급한 EBS 다큐멘터리도 함께 보면 정말 좋을 것 같아요! 강추합니다^^
9791195277964,10,아이에게 올바른  성교육을  한다는 것이 막연하게 느껴진다. 무엇부터 시작해야 될지 ...책임은 부모에게 있지만 부모또한 올바르게 배우지 못했기에 먼저 배워야 됨을 깊이 느끼고 올바른 가치와 태도가 중요함을 일깨워 주는 책이다.
9791195277964,10,"두 자녀를 둔 부모로서 영적인 성교육의 기본적인 책임은 바로 부모에게 있다는 것을 깊이 느끼고, 깨닫게 해준 감사한 책이다.내 자녀에게 정말 하나님이 주신 아름다운 성을 이해하기 쉽고 구체적으로 제대로 알려주고 싶다면 꼭 일고 보길 강력 추천 합니다."
9791195277964,10,하나님의 축복과 은혜의 관점에서 좀 더 여유롭고 솔직한 모습으로 다가갈 수 있는 대화법을 배울 수 있었던 것은 너무나 감사한 일이다. 아이들과의 성을 이야기할 때 어떤 태도와 목적을 가지고 할 것인 가에 대한 명확한 지침서가 되어주었다.
9791195277964,10,성교육이 절실해진 요즘이다. 하지만 나도 어렸을 때 배운건 수치심뿐. 아이에게 구석구석 설명하기 어려운 과제다. 이론은 알겠지만 아이의 수준에 맞게 설명하기란 하늘의 별따기. 그런 고민을 싹 해결해준 고마운 책이다. 아이를 키우는 부모라면 꼭 읽어야 할 성교육지침서다.
9788956059266,4,설명에 낚임 .이렇게 쓰면 많은 사람들이 사서 보겠지어디가 0세부터 6세 아 내 돈 ..
9788956059266,8,"마음으로 읽어주는 책을 원했고, 지식전달에 급급하기 보다는 같이 감정을 나누며 이야기 하는 시간이 필요한 때라 생각이 든다. 좋은 부모가 되려면 나부터 배워야 한다!!"
9788956059266,10,쉽게 재밌게 읽혀집니다.이 책을 읽고 그림책이 너무너무너무 좋아졌어요.소개된 책들을 하나씩 읽어보며 아이와 대화해 봐야겠어요.
9788956059266,10,어떤 그림책들이 있나 도서관에서 훑어 보려고만 했는데 글을 재미있게 쓰셔서 술술 읽혔네요. 사실 글을 재미있게 썼다기보다 아이들과 나누는 대화가 참 재미집니다. 소개된 그림책 목록도 비교적 신선하고요.
9788956059266,10,재밌어서 술술 잘 읽히네요. 그림책이 이렇게나 다양하고 생각할거리도 많다는걸 알게 되었어요. 게다가 아이와 재미있는 대화거리로도 그림책이 매개체역할을 하구요. 저도 그림책 육아하려구요.
9788956059266,10,우리 아이에게 단행본의 재미를 선사해 준 책!!! 추천한 책들 읽으며 얘기 이런저런 이야기 많이 나누게 되었다.
9788956059266,10,현실적으로 도움이 많이 된 책이에요 ㅎㅎ
9788956059266,10,추천도서마다 아이들이 정말 좋아합니다.
9788956059266,10,엄마의 열정과 노력이 녹아있어서
9788956059266,10,아이와 그림책으로 대화하는 법을 배웠어요 이 책을 읽고 읽어보고 싶었던 책이 많았는데 말이죠^^
9788956059266,10,아이와 함께하는 즐거운 책읽기... 단순한 학습법이 아닌 엄마와 아이간의 나눈 이야기가 너무 공감됩니다!!
9788956059266,10,책 육아의 필요성과 중요성은 알지만 막막해하는 엄마들에게 쉽게 접근할 수 있도록 도와주고 다양한 추천도서들을 만날 수 있어 활용도도 높다.
9788956059266,10,책과 그림을 좋아하는 우리 아이를 위한 책
9788956059266,10,엄마와 아이를 위한 책읽기 시작을 도와준 책
9788956059266,8,우리 아이의 책읽기에 불을 지펴준 고마운 책입니다.작가님과 꽃님이가 많은 자극이 되었습니다.
9788956059266,10,그림책 선택에 많은 도움이 되었어요
9788956059266,10,수많은 그림책 중에 어떤 책을 골라서 아기와 함께 읽을지 막막한 엄마들에게 조곤조곤 안내 해 주는 즐거운 책이었습니다.
9788956059266,10,그림책 육아를 시작하려는 분들에게 길잡이가 되어주는 책입니다.
9788956059266,10,그림책 볼때 엄마의 세심함과 노력과 엄마가 해 주었던 말들을 보며 많은 도움을 받고 있어요. 감사합니다.
9788956059266,10,투표요
9788956059266,10,예비 유치원 교사입니다. 교사가 되었을 때 아이들에게 들려주고 싶은 동화가 많이 소개되어 있네요.아주 유익하고 실용적인 책입니다^^
9788956059266,10,그림책에 대한 관심와 애정을 갖게 해줍니다
9788956059266,8,도움됩니다.
9788956059266,10,그림책은 어린 아이들이 읽는 책이 아니다. 오히려 어른들이 먼저 읽고 아이들에게 읽어주어야 하는 책이다.또한 그림책은 어린이들만 읽는 글밥이 없거나 조금 있는 읽기 쉬운 책이 아니다. 그림책에 담긴 그림을
9788956059266,10,아이들이 좋아할 그림책 소개는 물론이고 틈틈이 소개되는 육아 팁이 매우 유용한 책.
9788956059266,10,기존 그림책과 차별화된 새로운 그림책이 많이 나와있어서 도움이 많이 되었습니다.
9788956059266,10,그림책에 대해 잘 알 수 있게 써 있어요
9788956059266,10,다른 여타 어려운 전문적인 서평적보다 지극히 개인적이지만 아이들을 키우면서 공감되는 부분과 쉬운 설명이 와닿았어요.
9788956059266,10,두고 두고 볼 엄마책입니다..^^
9788956059266,10,이 책을 읽으며 그림책 교육을 잘 배워 활용했네요~^^
9788956059266,10,육아에 필요한 책들
9788956059266,10,한번 읽으면 잊혀지지 않는 책입니다
9788956059266,10,그림책 육아 지향하는 1인으로 아이에게 책을 읽어주면서도 가끔 어떨땐 막막할때가 있었다. 아마도 방법을 제대로 몰라 그랬던듯..읽고 질문하기 바빴던 잘못된 책읽기에서 재미나게 대화하며 즐겁게 책읽기를 배울수 있었던 좋은 책이다.
9788956059266,10,좋은 그림책들 추천 받고 갑니다.^^
9788956059266,8,"꼭 읽어보고 싶은 책이었어요. 기회가 되면 한권 사야지.. 했는데 블로그나 인터넷 서평에 속은 적도 여러번이어서 장바구니에 담았다가 안사고 사려다가 또 안사고..그랬답니다. 이번에는 꼭 사서 보려구요, 여러명이 추천하는데는 그만한 이유가 있지않을까요?"
9788956059266,10,아이랑 읽는 그림책을 좀 더 깊이있게 집어주며 읽어줄 수 있게 도와주는 고마운 책~!
9788956059266,10,도움되었어요
9788956059266,10,아이와 함께 이렇게 책도 읽고 생각해볼수 있구나 느꼈어요.. 더불어 좋은책 소개해주신것도 감사요..
9788956059266,10,아이와 함께 읽고 생각할 수 있는 꺼리 등을 다양하게 제공해주고 무엇보다 아이들과 어떻게 책을 읽을지에 대해 고민하게 해준 정말 고마운 책입니다.
9788956059266,10,정말 도움이 되는 책이다. 읽고 한 권 더 사서 아기 친구 엄마에게 선물했다.
9788956059266,10,첫째 키우며 참 열심히도 그림책 읽어 주다가 다시 둘째를 키우려니 예전 같지 않네요. 다시 마음 다잡으려 구입한 책이었습니다
9788956059266,10,책을 위한 책이라고 할까요? 아이에게 이미 읽어주었던 책인데도 이 책을 읽고 난 후엔 그 책들이 새로워 보이고 안보이던 것이 보이고 달라보이더라구요. 아이들이 있는 집이라면 곁에두고 우리가 읽은 책과 어떻게 또 다른 느낌인지 함께 보면 좋을것 같아요. ^^
9788956059266,10,그림책은 정말 무궁무진한 것 같아요.
9788956059266,10,그림책 관련책을 수십종 읽어보았지만 이 책처럼 재미있고 유익한 책이 드물었다.한권한권 아이와 함께한 내용이 가슴에 와 닿았다.
9788956059266,10,많은 육아서들중에 구입한 도서..두고보며 읽기좋아요^^
9788956059266,10,"그림책을 읽고 아이와 어떻게 이야기하면 좋을지, 좋은 팁이 되었다.소개된 그림책을 찾아보는 것도 큰 재미."
9788956059266,10,아이가 좋아하는 그림책을 찾아가서 그걸로 내 아이를 더 잘 알게되는 과정
9788956059266,10,"이전에 제주도에서 아이들과 지낸 이야기를 쓰신 책도 즐겁게 읽었었는데, 이번 책은 아이들과의 대화가 많이 담겨있어 더 재미나게 읽었네요. 소개된 그림책들을 벌써 주문하기도 했고요. 공감되는 이야기가 많아 고개를 끄덕이며 웃으며 보게 되는 책."
9788956059266,10,나의 로망을 그대로 담아낸 책나도 책을 함께 읽고 읽어주며 아이들과 생각을 나누면서 키우고 싶다
9788956059266,8,정말 만은 도움이 되었어요 있던 책도 있고 했는데 아이와 한달이 아닌 몇개월동안 다른곳에서 살아보고싶네요
9788956059266,10,"그림책 관련 서적을 많이 읽었지만 이렇게 깊이있게 그림책을 읽어간 책은 없었습니다. 꽃님이와 꽃봉이가 부러웠고, 제 아이들도 이렇게 그림책을 놓고 엄마와 깊이있는 이야기를 나눌 수 있길 기대하게 만드는 책이에요. 리뷰 잘 안쓰는 편인데 이건 정말 꼭 추천하고 싶어요^^"
9788956059266,10,"너무 재미있게 읽은 책이에요. 근데 소장하고 싶어지는..우리 아이들과 계속 활용하고 싶어져요. 저자가 글을 너무 진솔하게, 재미있게 또 감동있게 잘 쓰는것 같아서 읽는내내 미소가 지어져요"
9788956059266,10,강추!!!!! 단순한 그림책소개가 아니라 그림책을 보며 아이들과 대화를 하게 만드는 책.주옥같은 그림책 소개들도 좋고!!!강추!!!!
9788958270690,10,"넘어지고 또 넘어져도 걸을 준비가 되었을 때 마음껏 걸을 수 있도록 움직인다.자발적 의지와 운동능력, 12개월 36개월,소통하고 집중하고 성장한다."
9788994803258,10,"아이들에게 자연스럽게 스킨십도 할 수 있고, 아이들이 따라하기 쉬운 스킨십 놀이로만 책이 구성되어 있어서 아이들을 가르치기도 편리하고, 추천할 만한 책이다."
9788994803258,8,4살짜리 아이와 손유희 하며 너무 즐겁게 보냈습니다그외에도 발도르프 놀이를 가까이 집에서도 할수있어 너무 좋습니다
9788963056746,8,아들이 특별하다는 인식이 아닌 좀 다르다는 시선에서 출발하는 책. 기본적으로 다르면 다른데로 인정해주자는 거죠. 이해하려고 애쓰지 마세요. 그냥 받아들이세요. 그리고 가끔은 단호하고 엄격해지세요. 이런전제로 할때 아들은 어쩌면 단순하고 해맑아서 더 키우기 쉬울수도 있어요.
9788963056746,10,"멈춤 없이 술술 잘 읽히고, 남자인 아들의 심리와 발달, 행동과 태도를 이해하기 쉽도록 가이드를 주는 책. 이 책을 아들을 키우는 모든 엄마들에게 추천합니다. 우리 시어머니가 이 책의 가이드대로 남편을 키워주셨더라면 좋았을걸..합니다. ^^;;"
9791195095414,4,소녀의 심리학을 읽기 전에 읽어보다 200쪽 부근에서 그만 읽게 되었다. 지나치게 한쪽에 치우쳐있다는  느낌에 읽기에 거북했다.
9791195095414,10,남자 아이들을 이해하는데 많은 도움이 되었습니다.
9791195095414,6,알고보면 불쌍한 남자들이다.실제론 약한데 강해 보여야 하는 남자들인것 같다.
9791195095414,8,"남자아이들의 행동이나 생각 등을 이해하는데 도움이 되었습니다. 교실 내에서의 구체적인 적용 방법이 나오지 않은점은 아쉽지만, 그건 앞으로 제가 찾아봐야겠습니다."
9791195095414,8,소년들의 성장과정에서 발생할 수 있는 심리적 특성들을 이해 하는데 도움이 됩니다.
9791195095414,10,"남자아이가 그토록 치열하게 생의 의미와 목적을 찾는 동안 세상은 반드시 응답을 해주어야 한다. 자신의 자리에 드디어 바로 설 때까지. 제대로 된 통과의례조차 없는 시대, 모든 소년의 지난한 투쟁과 영웅담을 어떻게 소중히 지켜줄 것인가."
9791195095414,10,심리학에 대한 흥미로운 이야기들을 통해 헤쳐나가는 이야기로 읽은 걸 후회하지 않은 책이다.
9791195095414,6,재밌어여ㅛ
9791195095414,10,평소 생각해보지 못했던 부분에 대해 설명해 주어 읽고 나서 시야가 넓어졌기 때문이다
9791195095414,8,고집과 반항이 가득한 소년기의 심리학을 다룬다니 흥미로울거 같네요.
9791195095414,6,"나의 아들의 사춘기때 어찌 해야할까 고민이 많던참에 글을 읽고 아주 조금은 도움을 받았던것 같다. 우리나라에 적합한 책이라고는 할수 없지만, 남자아이를 이해하는데 조금은 기여를 하는 것 같다"
9791195095414,8,소년의 심리의 실제에 대해 알고 싶어서 구입한 책이었어요. 그런데 심리학에 대한 전문적인 지식이 적은 저는 읽는데 꽤 어려움을 느꼈어요.
9791195095414,8,"아들을 군대에 보내고 나서야 이 책을 읽게 되었는데, 아들의 성장과정이 눈앞에 펼쳐지는 것 같네요.미리 읽어두었더라면 좀 더 지혜롭게 아들을 이해하는데 도움을 받았을 것 같습니다.하지만 지금 읽은것도 도움이 되어서 주변에 추천을 해주었습니다."
9791195095414,6,이 책이 청소년 권장도서란 말인가??? 정녕....
9791195095414,8,불과 이삼주 전에 두권이나 구입했는데 오십퍼센트 세일??ㅠㅠㅠ 어쨌든 추천함;;
9791195095414,10,사내아이만 둘 키우는 엄마라 구입했네요~ 울 아들의 심리를 알수 있겠죠?
9788993267433,8,아이가 3~4살때 진작 읽었으면 좋았을걸 하는 생각입니다.내용 좋구요.. 이건 e북이 없어서 종이책으로 구매했는데 수시로 자주볼것 같네요. 추천합니다
9788993267433,10,구체적으로 상황예시가 되어있어서 아이에게 적용하기 쉬울 것 같아요.
9788993267433,10,아이의 마음을 공감할수 있는 기술을 가르쳐주는 실예가 많이 나와있어 도움이 많이 될듯 합니다 정신과에서 간호사로 근무하는 친구가 권해줘서 구입했는데 실생활에 적용하기 좋게 나와있어서 좋습니다
9788975276859,10,"강의를 듣고, 책을 읽고 선생님이 좋아 강의를 또 들었습니다. 사춘기 문턱의 딸과 뒤를 아들과 사이좋게 지내려고요."
9788975276859,10,강의 듣고 너무 좋아서 책도 샀는데 책도 좋네요
9788975276859,10,중학생 자녀를 둔 부모들에게 권하고 싶은 책입니다.  많은 도움이 되고 있습니다.
9788975276859,10,현직 교사로서 많이 공감되고 새로웠다. 저자의 풍부한 학생경험과 많은 공부에서 나온 현실적인 이야기들이 아닌가 싶다.
9788975276859,10,"책을 읽으면서 많이 공감했다.내가 어려워하던 아이의 습성이나 나를 어려워하는 아이의 시선 어디서 어긋나있는지 무엇이 잘못되었는지  책을 읽으면서 구구절절 마음에 와 닿았다.
중학생 아이가 있는 부모라면 누구나 한번은 꼭 읽어보길 바라며..^^"
