ISBN13,rating,review
9788981602536,10,대학 전공때문에 주문하였어요
9788971403945,10,이 책은 노봉수 교수님이 쓰신 책인데 내용상으로도 실무를 하기에 좋습니다. 부디 이 책이 식품가공에 관심있는 식공과와 식영과 학도들에게 도움이 되길 바라겠습니다^^
9788981602369,10,대학교재라서 급하게 주문햇는데 배송도 빠르고 책상태도 굿! 잘쓰겟습니다~
9788936316006,10,대학 전공책이라서 구매하였습니다
9791136008220,10,한권으로 다섯가지 자격증을 공부할수 있어서 1석 5조입니다!
9791136008220,10,"필기가 세분화되어서 금전적으로 부담이 되었습니다. 교재도 나누어여 하나, 하지만 본 교재는 한권에 세부과목을 다 해결하도록 하였답니다. 하지만 내용도 좋아서 후회가 없어요. 요약노트가 눈에 띄고 기출문제도 알차게 포진되어 있어서 푸는 재미도 좋습니다."
9791136008220,10,조리기능사 필기시험을 위한 맞춤형 교재인 것 같아요!
9791136008220,10,5과목 이론 공부와 동시에 익힐 수 있는 출제유형이 들어있는 책이기 때문에 추천합니다!!
9791136008220,8,"5과목을 한권에 마칠 수 있어 가성비 좋고, 암기노트가 있어 훓어내며 단기간에 흐름잡기 좋고 요약보기하기 좋고, 실전동형모의고사도 10회분 정도로 넉넉하고 실전엽습으로 좋은 것 같아요."
9791136008220,10,"탄탄한 문제 구성과, 한권으로 모든 종목의 조리기능사를 대비할 수 있는 최고의 교재!!"
9791136008220,10,필기가 강화된 조리기능사를 대비하는 최고의 교재!
9791136008220,10,5과목 통합으로 구성되어 있어 골라보기 좋았고 중요한 내용은 깔끔하게 정리되어 있어 만족스러웠습니다.
9791136008220,10,파트별로 핵심키워드와 합격 포인트로 내용을 미리 알수 있고 이론과 문제 병행 해서 바로바로 문제를 습득할수 있도록하였으며 다양 한 문제유형을 접할수 있어서 좋습니다
9791136008220,10,핵심 이론으로 이론을 정리하고 적중 문제를 풀면서 오답정리를 하고 모의고사와 CBT 교재풀이로 문제를 엄청 돌렸다. 그랬더니 한번에 합격-! 구성 아주 좋아요!
9791136008220,10,종목별로 학습이 가능한 게 좋습니다.
9791136008220,8,수학에 정석이 있다면! 조리 기능사에는 에듀윌이 있다. 서평단으로 알게 되었지만 서평단 그 이상으로 좋은책이라는 생각이 든다. 특히 식품위생학 파트가 정리가 잘 되어있다. ㅎㅎ
9791136008220,10,"효율적인 구성, 풍부한 이론과 문제. 이 한권으로 딱입니다. 다른 자료가 더 필요없네요. 아주 좋아요~"
9791136008220,10,저희 어머니께서 요리하는 것을 굉장히 좋아하시고 잘하십니다.늘 한식 자격증에 대해서 하고 싶다는 마음을 가지고 계셨는데 이번 에듀윌도서를 계기로 시작하게 되셨습니다. 이 책은 총 5가지의 종류의 필기를 목적으로 제작되었는데 자세하게 표시되어 공부를 하시는데 도움이 될 것 같습니다.
9788981601041,10,좋아요
9788981601041,10,책잘받았습니다~
9788936309879,10,소재에 대해 공부하기 위해 구매하였습니다. 자세한 설명과 수많은 내용이 많은 도움이 되었습니다. 가끔 모르거나 궁금한게 있으면 다시 들여다봅니다. 선생님들도 의상을 공부한다면 꼭 한번쯤은 읽어봐야한다고 하셨는데 책 정말 좋아요 척척박사님 보는 기분입니다!
9788981602802,10,일단 먼저 책 두께부터가 아주 적당하더군요. 그리고 책 표지도 꽤 괜찮고 차례부분도 잘 정리되어 있으며 내용도 알아보기쉬워서 정말 좋아요.
9791136008947,10,단기에 한식 조리기능사 필기 준비하는데 충분한 문제집이었습니다!개념만 있는게 아니라 각 개념 마무리 문제와 10회분의 모의고사 문제들이 더 꼼꼼하게 공부 할 수 있었습니다!
9791136008947,10,한식조리기능사 필기 준비하는데는 문제를 많이 풀어보는 것만큼 좋은 게 없는 것 같아요 추천합니다!
9791136008947,10,한식조리기능사 필기 준비하는데 기출문제를 많이 풀어보는 것이 좋다고 해서 풀고 있어요!! 정말 좋은 것 같아요!! 조리기능사 준비하시는 분들이면 이 책 추천드려요!
9791136008947,10,한식조리기능사 필기 준비하는데 이만한 책이 없는것 같아요. 빈출 족보이론 정말 좋아요!
9791136008947,10,한식조리기능사 필기 알아보다가 에듀윌 총정리 문제집 알게 되었는데 정리도 잘 되어있고 필수내용만 쏙쏙 모아 놓아서 유용한 것 같습니다 ㅎㅎ 본 리뷰는 출판사에서 진행하는 서평단에 참여하여 무상으로 도서를 제공받아 실제로학습 후 솔직하게 작성한 후기입니다
9791136008947,10,"한식조리기능사에 출제되는 빈출이론을 빠르게 학습할 수 있고, 한식조리사 필기시험 문제를 정말 많이 풀어볼 수 있어서 좋은 것 같아요. 문제를 풀면서 상세한 해설이 제공되어 독학으로 공부하기에 안성맞춤 교재라고 생각합니다."
9791136008947,10,얇은 필수만 모은 가성비 갑! 각 페이지 하단에 정답이 바로 있어 시간 절약까지 굿!
9791136008947,10,"한식조리기능사필기시험은 빈출족보이론 필수문제 300선 기출복원모의고사 이렇게 있습니다. 한식 조리기능사필기시험은 위생과 조리가 철저히 안전하게 준비해야하기때문에 위생과 안전관리, 재료, 구매관리 문제가 있습니다. 그럼 한식조리기능사필기 시험을 어떻게 공부하는지 알려드리겠습니다."
9791136008947,10,개념정리도 상세하게 나와있고 정답해설도 자세히 나와있어서 좋습니다.한식 조리기능사 필기시험을 준비하는 사람들에게 이 책을 추천합니다.
9791136008947,10,사실 총정리 문제집이라고해서 딱 시험문제만 있을거라고 생각했는데 생각보다 구성이 알차다. 10일 공부 합격을 플랜으로 한식조리기능사필기에 자주 나오는 족보와 필수문제 300개 기출복원 모의고사로 이 책 한권으로 충분히 합격할수있어보인다.
9791136008947,10,마무리까지 완벽히 하고싶을 땐 총정리 문제집이 잘 맞습니다. 문제 해설이 눈에 잘 띄게 되어있어서 시간낭비 없이 정리됩니다.
9791136008947,10,"시험 응시 전 공부한 내용이 복잡하게 섞여 머릿속이 복잡한 경우가 있는데, 그럴 때 이 문제집으로 깔끔하게 총정리 할 수 있다는 점이 정말 좋았습니다. 특히 필수 keyword가 요약 부분에 나와있어서 참고하여 공부하기 좋았습니다!"
9788981603687,10,개인 자영업에서도 두루 참고가 될 것 같네요^^
9791136007407,10,깔끔한 디자인에 한식조리기능사 시험을 단기간에 학습할 수 있도록 커리큘럼 되어 있어 좋습니다.
9791136007407,10,38개월 베스트 1위라서 구매했는데 역시 .. 다 이유가 있다고 느낀 책!무엇보다 단기간안에 한식필기를 대비할 수 있다는 점이 굉장히 매력적!단순히 눈으로만 보는 개념이 아니라 그 후 바로 문제를 풀면서 그 개념을 바로 복습할 수 있던것도 맘에 들었음~!
9791136007407,10,역시 자격증으로 유명한 에듀윌에서 만든 한식 조리기능사 필기!핵심테마와 문제풀이의 페어로 반복되는 구성으로 요잘모인 사람도 쉽게 이해할 수 있게 되어 있어요테마별로 진도를 체크할 수 있도록 나뉘어 있어서 하루하루 따라하다보면 정말 일주일만에 책한권이 끝나네요!
9791136007407,10,단기에 한식조리사자격증 취득을 하고 있어서 정독하고 있는 책이에요. 마음의 여유가 되면 이책을 읽고 필기시험을 보려고요. 핵심만 제공되엇 괜찮네요.
9791136007407,10,즐겁게 학습할 수 있고 휴대도 간편한 한식조리기능사 필기 수험서
9791136007407,10,이론과 문제가 중요한 부분만 콕콕 있어서 단기간 시험 준비하기에 정말 좋았습니다!
9791136007407,10,학습을 계획하고 하나둘 공부를 할 수 있도록 구성되어 있는  에듀윌 한식조리기능사 교재 단기학습 플래너로 단기간 속성으로 필기합격!!학습계획을 세워서 효율적인 학습이 가능해요
9791136007407,10,부담없이 보기 좋은 교재입니다. 필기독학으로도 충분히 해 낼 수 있도록 플래너제공과 모의고사 QR코드로 3회분도 시험치는 날 대비하여 연습을 할 수 있게 편안히 문제풀이.강의가 제공되어 좋습니다.이론정리도 아주 잘 되어있고 최신출제경향에 맞춰 문제도 깔끔해서 보기가 좋습니다.
9791136007407,10,"조리기능사 실기만 생각하고 공부하다가 필기에 막막한데 얇은책 한권으로, 1주만에 끝낼수 있다는게 너무 좋아요"
9791136007407,10,"플래너가 있어 효과적인 학습을 할 수 있도록 도와줍니다. 핵심테마에 대한 토막강의, 교재풀이가 있어 도움이 많이 되었습니다. 암기노트도 제공되어 독학학습을 하기에 적합한 교재입니다."
9791136007407,10,"단기 합격에 용이하게끔 교재가 구성되어 있는데요. 테마별 학습과 문제풀이, 토막강의를 활용하시면 좋을 것 같아요. 기본구성은 ‘핵심테마-필수문제‘의 반복입니다.  그리고 맨 뒤에는 기출복원문제가 있으니 끝까지 활용 잘 하시길 바라요! 제일 좋았던 점 중 하나는 QR코드 채점인데요, 정말 편함."
9791136007407,10,"시중에 유사한 교재가 많아 오히려 선택의 고민이 된다면이론과 문제를 한 권으로 1주 만에 한식조리기능사 필기를 정복할 수 있는에듀윌 교재 선택을 추천합니다. 교재는 37개의 핵심테마의 이론과 문제로 구성되는데요,,, ​교재 중간중간 QR 토막강의, CBT교재풀이가 제공된답니다~"
9791136007407,10,전공자가 아니여서 낯설기에 어렵고 부담스럽게 느껴졌던 자격증 취득은 가벼운 책 무게에 덩달아 가볍고 편하게 느껴졌습니다. 테마별로 중요도에 대해 별체크로 강약을 두고 QR코드로 강의를 연계한 체계성에 책 한 권 잘 선택했다는 뿌듯함이 듭니다.
9791136007407,10,자격증 시험을 준비하는 모습 사람들의 염원은 단기간에 끝내는 것이다. 1주만에 끝낼 수 있도록 스케줄을 제시해주고 분량도 부담스럽지 않아서 다른 학업이나 직장이 있는 분도 부담없이 시작할 수 있어 좋다! 직장인인 나도 저녁 시간만 활용해서 공부 중이다! 모두 합격 하길 바란다!!!
9791136007407,10,"우선 제일 맘에 들었던건 1주, 2주 플랜이 이미 짜져있어서 그에 따라서 계획을 세워서 할 수 있게끔 가이드를 해준 점이 참 맘에 들었어요~한 테마가 끝날 때마다 그에 응하는 문제가 들어가있어 쉽게 동선을 그린점도 좋았구요~ 그리고 마지막에 필수인 기출복원 모의고사까지! 완벽했습니다~"
9791136007407,10,학습 커리큘럼이 만들어져있어 처음 학습하는 사람들에게 좋을 것 같습니다. 또한 각 단원별 제공되는 토막강의로 이해도를 높여주고 있습니다. 또한 마지막 CBT 3회를 풀어볼 수 있도록 구성되어 있어 시험을 미리 경험해 볼 수 있을 것 같습니다.
9788968442155,10,작은아이가 올해 이번학기에 복학해서  학교 공부 할때 필요한 책이라서 주문했어요. 어제 도착해서 열심히 공부하네요.
9788961542142,8,정답이 다른게 몇 개 있지만 깔끔한 개념정리와 이해하기 쉬운 예시구성이 좋습니다.
9788935405541,4,"중고구매최상 퀄보다 중퀄 겉표지 , 속 하자 다 있음"
9791127281229,10,깔끔해서 보기 좋습니다.
9788998591304,10,요리에 처음 접근하시는 분들께 좋은거 같습니다.
9788998591304,10,"오, 생각보다 정말 괜찮네요...! 무엇보다 사진이 진짜 많아서 편함!"
9788988274712,10,잘받았습니다~~
9788981601713,10,배송 빠르네요 굿굿 책도 좋구요!
9788981601713,8,교재로 사용해요~
9788936313708,6,좋습니다.
9791188892877,2,상태 상이라더니 내부에 낙서가 많아요 이게 어떻게 상태 상인지 이해 할 수 없네요. 배송도 저희지역이 한진택배 파업이라 반품되서 확인해달라했더니 그런적없다고 잡아떼고 택배사 확인하고 다시연락하니 그제와서 확인한다하고 최악이에요
9788981602642,10,배송도 빠르고 원하던책 다른곳보다 저렴하게 구입해서 좋습니다! 다음에 또 전공서적 살때 알라딘 이용할 생각입니다!
9788983071651,10,대박임
9788936313043,10,"배송도 빠르고, 안전하게 깨끗하게 알라딘 뽁뽁이봉투에 배송되어왔네요^^
박스가 아니라 책에 상처가 안나 기분이 좋아요^^"
9788971401521,10,의상심리학에 관심이 있다면 도움이 될만한 책이네요 :)
9788986016949,10,식품관련 전공자들이라면 한번 정독 하시길...
9791188105052,10,젤라또 하면 유명한게 이탈리아 젤라또 라고 생각 합니다. 건강하고 맛있는 아이스크림을 찾다가 마침 이 책을 발견 해서 좋네요^^
9788971407028,10,영양학을 쉽게 풀어쓴 책
9788981602628,10,열공합시다
9788988274910,10,"정영택씨에 대한 지명도는 제과업계에서 높아서 망설임 없이 책을 구입하였습니다.
책 구성과 제공된 레시피등 모두 만족도가 높습니다.
좋은 책입니다."
9788977396883,8,단원마다 flow chart가 있어서 큰그림을 그리고 이해하는데는 도움이됩니다.
9791156859949,10,섬유업계 종사자들에게는 무조건 필독서로 추천합니다.
9788926881965,10,"2012년 초판본을 구매하고 있는 독자.  또 사야될까하다가 구매해서보니,구매하길 잘했어요. 화장품초급연구원에게 강력추천. DIY입문자에게는 어려움. 실재 화장품제형을 연구하는데, 이론기초와 제조꿀팀이 부족한 분에게 큰 도움이 될 책.  더 좋은 책 집필 부탁드립니다. 100자평존칭 생략"
9791136009401,10,무료로 제공되는 강의 덕분에 어렵지 않게 공부 할 수 있습니다.
9791136009401,10,실기 공부를 책 하나로 독학할 수 있다니 신세계네요
9791136009401,10,모든 강의가 무료로 제공되고 실기 준비를 책 한권으로 완벽하게 할 수 있어요!
9791136009401,10,책 속에 자가 인쇄되어 있는 센스로 정확한 길이로 자르는 연습이 가능한 완벽한 조리기능사 실기 책! CD까지 들어있어 독학까지 가능한 센스
9791136009401,10,책 속에 QR코드가 있어요! 다른 유튜브 영상보다 좋았던 점이 감독위원위이 직접 알려줘서 핵심만 쏙쏙 나왔다는 점! 그리고 다른 유튜브는 너무 길더라구요 ㅠ.ㅠ 그래서 보기가 힘들었어요.아주 간결하게 담겨 있어서 좋았어요! 진짜 반복해서 보는게 가장 중요하더라구요! 책 구성도 훌륭해요
9791136009401,10,책에 구성과 내용이 알차서 혼자서도 실기시험준비에 문제없다
9791136009401,10,제가 본 qr코드 중 제일 잘 사용된 책이라고 생각이 듭니다. 다음에도 (컴퓨터 실기나 이런데에도 적용되었으면 좋겠습니다)
9791136009401,10,책 구성이 너무 좋아서 쉽게 공부할 수 있어요
9791136009401,10,가장 가까운 한식을 공부한다면 친절한 설명과 함께 가능한 교재인 것 같습니다.
9791136009401,10,조리기능사 실기 학숩교재 1위를 하는 이유가 있네요 핵심만 콕 찝어서 잘 정리되어 있습니다 깔끔한 책표지 만큼이나 조리방법 설명 내용도 눈애 쏙쏙 들어오도록 잘 편집되어 있네요 이 한권이면 한식 실기 자격급 따기에 걱정 없을것 같습니다
9791136009401,10,컬러풀한 스탠드형 핵심요약집으로 편하게 한식 조리기능사 실기시험을 준비하실 수 있습니다.
9788920035296,10,"아주 오랫만에  좋은 책 읽었다. 어려운 지리학 이야기를 이렇게 쉽게 쓸 수도 있구나 싶고, 원로 학자로서 저자의 범접할 수 없는 내공이 느껴지는 문장이었다. 우연히 보아오던 산, 바다, 강, 호수 등에  자연의 오묘한 이치가 있음과 그것을 밝혀내는 글에 놀라울 뿐이다."
9788935405923,10,안전하고 빠른 배송 감사합니다
9788963305165,10,아동 미술 치료 중에서 좋은 교재라고 생각 합니다 주변사람들께 강추 하고 자 합니다
9788963305165,8,"관심이 있어서 끝까지 읽으려고 했는데, 좀 교과서적..."
9788936300449,10,무척 만족스럽습니다. 양장수업을 듣고 보니 더욱 이해가 잘 되네요.거의 모든 것이 망라되어있어서 무척 좋습니다.
9788936300449,10,자세한 설명과 그림이 초보자도 볼수있는 아주 좋은 책을 구입하게 돼서 기뻐요
9788936317300,10,이 책도 왠지... 기대가 되네요^^
9788961834247,10,좋은 교재로 인하여 알차게 사용하겟습니다
9788958282150,10,그림책 공부에 도움이 되는 책입니다^^
9788958282150,10,우리 아이 그림책 고를때 많은 도움이 됐어요 주위에도 추천 많이 했답니다.
9788958282150,8,친구의 권유로 샀는데 그림책을 다시 한번 보게 되더라구요.
9788971401613,4,생 초짜여서 한복 만들려고 사게 되었는데 생각보다 세부 설명이 적어서 만드는데 애먹었습니다.책을 본 것보다 인터넷을 본 것이 더 도움이 되었을 정도입니다. 다음에 개정판이 나오게 되면 세부설명이 더 있었음 하네요.
9788961832816,6,"아직 자세하게 읽어보지는 않았지만 기대됩니다.
다만 포장해서 올때 구겨져 왔어요."
9788991847569,10,찾고 있던 책! 일러스트가 맘에 들었으면 좋겠네요.
9788958281023,10,책이 정말 예쁘게 나왔어요.. 내용도 이해하기 쉽게 잘 쓰셨습니다. 그림책 공부하기에 참 좋은책입니다^^
9788958281023,10,그림책공부 모임을 하면서 알게된 책입니다.그림책 고를때 아주 도움이 많이 돼요
9788935402618,2,기본을 배우기는 좋지만 치수 엉터리에 봉제가되지않는 디자인이나 패턴... 별로에요~ 개정좀 해주세요 제~~발
9791156858706,10,작은아이 학교 공부에 필요해서 주문했어요. 기다렸던 책이라 기대되요.
9791157636181,10,마음에 쏙 드는 책이에여
9788998591571,8,이 분야에 제대로 된 내용 정리가 안 됐는데 기본 정리가 된 책. 학술회의에 포커싱이 많이 되어 있어요
9788961838382,10,호텔리어가 되는 실질적인 길을 가르쳐 줍니다.
9788962787702,8,"옮긴이의 선택을 믿고 구입한책! 소마틱스이후 계속되는 코어탐험이 모든 요가,무술,체조,춤의 자세에 의미를 부여하고, 깊이를 더해준다. 저자들은 다르지만 한결같은 논조를 유지하는게 옮긴이의 의도가 느껴진다."
9788970937144,10,미생물학 어렵습니다만 매우 잘 정리가 되어있어 좋습니다.
9788984893320,8,많은 도움 되었습니다.
9788958950950,6,좋습니다.
9788983256805,10,"면접을 볼때, 취업 준비를 할 때 꼭 필요한 책입니다 !!"
9788936303655,8,자료 충실. 다만 전문용어 해설이 불친절한 것과 바지 재단이 빠진 점이 흠.
9788942610037,8,"유능한 부모가 도리수 있다고 합니다..

어린아이들을 다루는데 있어서 정말"
9791163282815,10,"이번 ‘슬기로운 매너생활‘은 학교와 현장에 근무하면서 느꼈던 기본생활 예절과 실천방안을 여러 단계로 정리되어 있고, 협업하면서 인사 예절과 사과가 왜 필요하고 해야 하는지 등 코로나 펜데믹 상황 속에서 살"
