ISBN13,rating,review
9788970593029,10,맞는 방향인지 답답했을때 디자이너의 개념을 알게해 준 책. 추천
9788970593029,8,개념서가 아닌 실무자가 쓴 디자인 이야기와 흥미로운 일본의 디자인사례 그리고 비젼
9788970593029,10,읽으면 읽을 수록 디자인에 대해 다시 생각하게 됩니다..
9788970593029,8,디자인이란 무엇일까?저자의 디자인 방법론과 철학이 담긴 책.
9788970593029,10,잘읽히는 뚜렷한 관점의 디자인책. 추천요!
9788955272451,6,음악이론책처럼 두껍지않고 뭔 그냥 배달책자처럼 엄청 얇아요 그냥 딸려주지 굳이 2000원 내고 살 필요가 있나 싶네요 주변에 여러명 필요하면 다 사지말고 한분만 사서 나눠보세요
9788955272451,10,좋습니다
9788955272451,2,이건 풀이집이 아니라 그냥 답집입니다. 딸랑 답만 있어요. 정말 성의없네요.
9788973003709,8,"성악과 다니면서 피아노가 많이 부족했느데 이 책을 통해서
빠르게 습득하고 있습니다"
9791185475042,10,연기전공자입니다. 이 책은 최고의 연기서적입니다. 많은 분들이 소장하고 읽었으면 좋겠어요!
9791185475042,10,연기를 독학하고 싶어서 구매하게 되었는데연습하는데 기본적인 틀을 잡을 수 있게 해주는 좋은 지침서인 것 같습니다
9788970853178,8,"책의 상태부터 살펴보니 비닐로 포장되어 왔고 개정판이네요그리고 외관을 살펴보니 찍힌 자국이나 흠집이 없네요(이 부분은 만족함)그러나 내용면지가 하얗지 못하고 약간 누렇게 변색되어 있고,내용면에서 오타나 맞춤법,잘못된 부분이 있는지 없는지는 차근히 공부해야 알 것 같네요~ 80점 줄께요~"
9788970844992,10,언제 들어올까요? 작년부터 기다렸는데 ㅜㅜ
9788970844992,10,서양미술사의 교과서같은 책이라 내용적인 면에서 코멘트할 것은 특별히 없는 듯 합니다. 가볍고 보기 좋아요. 다른 이론서들도 문고판이 적극적으로 나올 수 있으면 좋겠습니다.
9788970844992,10,요즘같은 시대에 진득하게 앉아서 큰 판형의 책을 읽기란 부담스럽죠. 특히나 우리나라 책들이 좀 큰편이기도 하고..컴팩트한 사이즈에 휴대하기도 좋을 것 같아서 문고판 구입하겠습니다
9788970844992,10,"모든 고등학생에게 사랑을 담아, 이 책 서문을 읽어주고 싶다. 이 책은 번역도 최고고, 판형 구성이 영문판과 똑같고, 도판도 영문판과 같은 인쇄소에서 나왔다고 할 정도로 잘 만들었다."
9788970844992,8,그가 작성한 서문만 읽었음에도 불구하고 한쪽으로 치우치지 않으려는 그의 시선에 벌써부터 두근거립니다. 내용부분과 도판부분이 나뉘어져 있는것도 특색있구요. 전시회를 관람하다보니 더 알고 싶어 구매하게 되었습니다. 이 한 권으로 조금이나마 한 걸음 나아갈 수 있길 기대합니다.
9788970844992,10,휴대하기가 매우 좋습니다. 만족합니다.
9788970844992,10,지대넓얕 책을 보고 서양미술사에 관심이 생겨 보게 된 책. 그림이 많아서 그림을 찾아보면서 보는 재미가 있다. 분량이 많아 몇 번 더 읽어봐야 할 것 같다.
9788970844992,10,무겁고 두꺼운 원판보다 오히려 가까운 곳에 두고 언제든 쉽게 펼쳐보기 좋은 사이즈의 이 책이 더 마음에 듭니다. 표지 일러스트도 원판의 오리지널리티를 살렸네요. 미술사 공부의 바이블이나 다름없는 책인만큼 내용에 대해서는 더 말할 필요도 없을 것 같구요. 사철제본이라 더 좋습니다.
9788970844992,6,멋지고 좋은데 비치는 종이 때문에 읽기가 좀 힘드네요. 소장용이 아닌 정독을 위해 처음으로 이 책을 접하는 눈 나쁜 독자로서 그 점이 아쉽습니다.
9788970844992,10,"미적으로, 지적으로도 만족하지만,  이것은 책 자체가 아름다운 물건."
9788970844992,10,서양 미술사는 곰브리치부터 시작. 양장판이 비싸 구입하지 못한 분들에게 단비같이 내려준 문고판
9788970844992,10,북디자인 센스에 만족한다.
9788970844992,10,진짜 생각보다 작네요.그래서 더 좋다는 아랫분말씀에 100% 동감^^;;가볍고 손안에 쏘~옥 들어옴이 참 맘에 들어요.
9788970844992,8,생각보다 훨 작다. 그래서 좋다.
9788970844992,10,역시 문고판이라 그런지 같은 두께의 책과 비교해봐도 좀더 가볍고 작아서 소지하기도 더 나은 것같다. 다음페이지가 비치는 성경책같은 종이로 이루어져있는데 마음에 든다.
9788970844992,8,문고판으로 사길 잘 했다는 생각이 듭니다.
9788970844992,10,원판보다 개인적으로 훨씬 좋으네요
9788989544449,10,음악 감상을 제대로 하려면 이론을 익히지 않을 수 없다. 여태컷 보아온 책 중에 가장 알차다.
9791189716028,10,"사진입문서, 사진 교재로 사용중인 이 책.  사진에 대한 모든 것들이 한 권의 책으로 볼수 있어서 참 좋습니다."
9788940803912,2,"지금 방금 물건 받았습니다.
제가 왠만하면 상품평 나쁘게 안씁니다만,
새책 구매한것 같은데... 표지 스크레치 상태도 심하고 
군대 군대 찍혀있고요 보아하니 배송중에 손상된게 아닌것 같은데 새책이 왜이러죠?"
9788940803912,8,아.. 언제 다 읽나!
9788963300580,10,음악 교수법에 대해 잘 정리된 신간입니다.
9788988951026,6,8판/맞춤법 틀린 부분이 너무 많고 설명이 꼼꼼하지는 않아서 처음 접하기엔 비추천
9788988951026,8,학교교재라서 유익하게 잘 쓰고 있어요
9788966851287,8,｀개론｀에 좋은 책
9788966851287,10,서양음악에 대한 기본입문서로 종교음악부터 뮤지컬까지 자세하게 구성되어있어서 좋은 것 같아요.
9788970596181,10,"UXD와 관련된 한글 서적이 쏟아지고 있지만, HCI개론이 가장 폭넓고 충실하게 UXD를 다루고 있다고 생각한다. 개정판에서는 사용자 분석 부분의 개선이 두드러져 보인다. 개정판을 손꼽아 기다렸다."
9788995316801,10,서양중심의 건축 역사서. 그 시대 문화와 함께 읽혀 많은것을 배울 수 있다.
9788995316801,10,서양건축사를 시작하고자 한다면 이 책이 정답. 참고서 같은 서양건축사 책이 넘치는 판에 이 책은 마치 고전과 같은 느낌을 준다.
9788995316801,10,ㅎㅎ 책이 너무 좋습니다
9788995316801,2,절대 사지 마세요. 개정판에서는 도판이 다 삭제되서 책이 가치가 없습니다. 후회중
9788995316801,8,수업 교재로 쓰고 있어요. 책은 좋아요
9788972960027,10,선생님이 추천하신 책이라 다른 이유없이 구입하게 되었습니다. 음악교육 교재로는 좋아요~
9788972960027,10,시창과 청음교재는 최고입니다.
9788940803325,10,가장 좋아하는 디자이너와 가장 좋아하는 디자인 책. - 디자인이란 무엇인가. 계속이 물음을 던지는 책.
9788937434747,10,"실질적인 ‘작문‘에는 도움이 되지 않을 수도 있지만, 서사 구조에 대한 직관과 통찰력이 대단한 책입니다. 영리하고 치밀한 시나리오를 쓰고 싶은 분들에게 추천합니다 :)"
9788937434747,10,이건 보물이다. 쉽고 명쾌하며 논리적이다.
9788937434747,10,딱딱해보이나 기초부터 잡을 수 있는 책
9788937434747,10,짧지만 많은 것을 얻을 수 있는 책.
9788937434747,6,딱딱한 책이지만 분명히 얻을건 많은책
9788937434747,6,잘 나와있긴한데 너무 지루하게 써있는것같은느낌이들어요ㅜ
9788937434747,8,첫인상은 딱딱한 듯 했으나 읽고나면 뼈대가 잡히는 책입니다. 책값합니다. *^^
9788999706165,10,좋아요
9788958912842,2,"주문하다가,누리카드결체를오라인으로하는데취소가돼서.다시앙바구니에놓고.나중에다시누리카드로결체합니다.외국도서란같이결체하게되서.취소도같이하게되는겁니다"
9788958912842,10,미술치료에 관심이 있는 아내를 위하여 다량 구매하였습니다. 이 책이 나름 유명한 책이군요. 학지사 응원합니다. ^^;
9788958912842,8,평생교육원 수업을 위해 구매한 책입니다. 주교재라서 보는 이유도 있지만 특별한 수업없이 구매해서 아이들에게 가족에게 그림을 통해 서로 마음을 나눠보기에 좋은 책인것 같습니다. 미술치료에 관심이 있다면 꼭 한번 읽어보면 좋은것 같습니다.
9788958912842,10,매우 알차고 체계적으로 미술치료의 이론들을 학습할 수 있습니다. 자세한 설명으로 이론을 체화하고 실질적인 적용과 사례까지 담아 매우 고마운 책이에요
9788972960065,10,어렵지않아요
9788972960065,10,친구가탐내네욬ㅋㅋ
9788972960065,6,내용은 알찬데 71년에 나온 책이라 편집이 조잡하고 폰트 가독성이 매우 떨어집니다.
9788972960065,10,w좋아요
9788979302035,10,"100자 평만 딸랑 썼다고 해서, 이 책이 별로일 것이라고 생각지 말아요. 심리학적, 과학적, 철학적 개념들이 어떻게 디자인에 적용되는지 그 어떤 책보다 흥미롭게 보여줍니다. 최고 수준의 책입니다."
9788989544395,10,낙소스 라이브러리에서 악보와 함께 공부할수있는 점에서 전판보다 편하고좋다
9788952746146,10,"대학원 수업 시간에 필요한 책이라서 구매를 했습니다. 이 책은 미술을 전공하는 학생의 교양 도서입니다. 특히, 미술을 정공하고 이론적으로 정공하는 학생들에게 심화 학습과도 같은 책입니다. 미술 글쓰기에 대한 폭을 넓히기 위한 분이라면 읽어보는 것도 나쁘지 않을 것입니다."
9788970857190,8,"책의 상태부터 살펴보니 비닐로 포장되어 왔고 개정판이네요그리고 외관을 살펴보니 찍힌 자국이나 흠집이 없네요(이 부분은 만족함)그러나 내용면지가 하얗지 못하고 약간 누렇게 변색되어 있고,내용면에서 오타나 맞춤법,잘못된 부분이 있는지 없는지는 차근히 공부해야 알 것 같네요~ 80점 줄께요~"
9788956542225,10,운동학습과 제어 분야의 바이블 책입니다. 체육 임용고시를 준비하시는 분들께 질독서 입니다.
9788913009938,8,좋습니다-수업시간에 배우는 책이라샀는데. ..
9788976241238,10,필요한 날 당일 오전중에 받을 수 있어서 다행이었어요. 무료에다 빠른 배송까지 최
9788997716326,10,깔끔하고 이해하기 쉽게 정리가 잘 되어있어요영문판도 구매해서 함께 보고 싶네요
9791185167664,10,단종된 예전 버전의 번역에 비해 훨씬 나은 번역을 보여준다. 필기를 위해서인지 빈 공간들이 적지 않고 글씨 크기가 좀 작은 점은 아쉽다. 하지만 이런 양질의 책을 번역본으로 볼 수 있다는 점에서 너무나 감사한 책!
9788999702310,10,"들여다보고, 관심가지고, 움직이게 하고, 느끼게 하고, 이야기하게 하고, 깨닫게 하고. 사랑하여, 사랑받기까지도."
9788936310622,8,"보고 따라 할 수 있고, 책에서 권해주는 대로 해 보면 스스로 실력이 조금씩 늘어남을 느낄 수 있었어요."
9788936310622,10,"발상, 디자이너들에게 물을때. 다시금 되묻게 된다면 이 책을 펼치십시오!!"
9788940803172,10,"처음 받자마자 드는생각.. 두둥... 완전 무겁다... 역시 깔끔한 디자인은 너무 멋있었어요.앞으로 서양미술사를 마스터할 수 있을 것 같은 생각이 드는 책입니다. 무겁긴 하지만 , 정말 마음에 들고, 배송까지 완벽하게 빨라서 기분 좋습니다. ^-^.이 책... 진짜 무겁긴 무겁네요."
9788940803172,10,곰브리치와는 또 다른 맛이 있다. 뭔가 더 술술술 재밌게 읽혀지는 기분
9788940803172,10,생각이상으로 좋은 책인듯
9788940803172,10,서양미술사의 큰 흐름을 한권으로 볼 수 있다.
9788940803172,10,곰보다 더 편하게 읽히네요.배경도 잘설명되어있구요^^
9788940803172,10,원래 양장본책을 싸게 팔기 위해 겉표지만 바꿔서 낸 책. 양장본이 비싸다면 추천!
9788940802878,8,국내에 있는 책 중 가장 잘 쓰여진 동양미술사
9788940802878,10,제임스 캐힐의 '중국회화사'보다 읽기 편하다.
9788940802878,10,중국 종교문화의 특성과 한국 종교문화의 독자성에 대한 자연스러운 대비와 감상을..
9788974091255,8,사진의 전반적인 이론과 개념을 잘 정리한 책이네요
9788974091255,10,"사진을 공부하는 사람이라면 반드시 읽어야 하는 책이 아닐까 싶다.
이론보다는 실전이 중요하다고 생각하지만 기본적 이론 뿐만아니라 사진을 찍는사람의 마음자세를 고쳐주고 더 많은 생각을 하게 해준다."
9788988951019,6,그래도 중고서점에서 샀으니 싸게샀어요비싼만큼..풀이과정이나 약간의 설명이 있었으면 좋겠어요
9788988951019,2,어차피 같이 봐야하는데 따로 구매해야하는것도 맘에 안들고 과정없이 딸랑 결론만 있어서 도움도 안됩니다값은 또 되게 비싸고.
9788988951019,6,해제집을 따로 사는게 좀 그렇지만...
9788988951019,8,해제집을 따로 사야하는게 불편합니다.
9788988951019,4,굿
9788988951019,2,"왜 상품평점에 0점을 주지못하는것인가? 
난 이책이 맘에 안든다"
9788936313708,6,좋습니다.
9788992607315,10,투시는 어렵습니다 하지만 책은 친절하군요
9788992607315,4,아 화나 ㅋㅋㅋㅋ 책 주문시 내일도착이래서 주문했던건데 화요일 밤에 주문해서 수요일 소식없고 목요일 출고 금요일 도착이 말이 돼요? 어제까지 필요했던거라 책 필요없어졌는데 분철해서 환불도 못하고 짜증나네 ㅋㅋㅋ 내일도착이란 말 쓰지나 말던가요 예정일에서 2일이나 밀려서는 어쩌란거;
9788992607315,10,투시를 쉽게쉽게 풀어줍니다. 200페이지 좀 넘는데 그림이 워낙 많아서 진짜 금방다읽어요
9788992607315,8,"머리말에 써있다 원근법 참 쉽다고, 번역하는 사람은 참 어렵다고, 이미 아는 사람은 쉽겠지 모르는 사람은 뭘해도 모르겠고, 이걸 사놓고도 사실 손이 선뜻 가지 않는다. 힘들다 원근법"
9788992607315,8,한 장 한 장 읽으면서 따라그리니 투시원근법의 원리를 이해하는 데 도움이 되네요.
9788992607315,10,정말로 친절한 투시원근법. 단계별로 차분하게 배울 수 있어요
9788992607315,10,투시원근에 대한 기초를 잡아주는책.
9788992607315,6,"만화그리는 아마추어인의 입장에서, 배경과 소실점의 기초 기념과 감 잡는데 유용."
9791185954165,10,저자와 역자 모두 근대철학 전공자라서. 헤겔 부분까지 매우 탁월하게 핵심을 짚고 있다. 다만 그 이후는 너무나 빈약하다.
9791185954165,10,미학 입문에 좋은 책
9788999703010,10,미술치료하는 분들께는 꼭 추천합니다. 근데 여기 저자소개가 동명이인으로 잘못 올라온것 같아요
9788992607896,8,카메라나 세부적인 렌즈에 대해 전혀 무지한 상태에서 이 책을 접했다. 한 세 번쯤 읽으니 렌즈 사용과 원하는 렌즈 사용을 위한 조명을 어떻게 사용해야되는지에 대한 대략적인 정보는 알게됐다. 깊지는 않지만 넓고도 쉽게 가르쳐준다.
9788970853208,8,"책의 상태부터 살펴보니 비닐로 포장되어 왔고 개정판이네요그리고 외관을 살펴보니 찍힌 자국이나 흠집이 없네요(이 부분은 만족함)그러나 내용면지가 하얗지 못하고 약간 누렇게 변색되어 있고,내용면에서 오타나 맞춤법,잘못된 부분이 있는지 없는지는 차근히 공부해야 알 것 같네요~ 80점 줄께요~"
9788958912996,10,"미술치료를 배우면서 여기저기 조언을 구하다가 찾은책이다
좋은 참고가 된다"
9788958912996,8,미술심리치료사 2급 준비중이라 구매했는데 책이 참 깔끔하고 좋아요^^
9788958912996,8,다양한종류의 치료기법과 그에 따른 상담과정으로의 적용과 사례를 통해 사용하기좋다
9788958912996,8,칼라로 되어 있어 보기 쉽고 그림도안같은것도 편하게 되어있어서 보기 쉽다.
9788968668654,4,"허접한 번역, 책을통해 얻는 지식보다 인터넷 사전검색으로얻는 지식이 더 알차다 돈이 아까움"
9788973005291,10,교양수업에서 교재로 쓰고있는 책인데 배울게 많이 들어있어서 좋다
9788973005291,10,교과서중의 교과서. 내용이 풍부해서 좋다.
9788997716272,10,보관
9788997716272,10,번역은 나쁘다. 내용은 훌륭하다.
9788997716272,8,조셉 캠벨의 [천의 얼굴을 가진 영웅]의 현대적인 주석서 같은 느낌의 책입니다. 천의 얼굴을 가진 영웅을 재미있게 읽으셨다면 틀림없이 재밌을 것입니다. ^^
9788997716272,8,때로 통제가 불가능한 만연체의 문장들로 인해 별 -1. 책 자체는 매우 직관적이고 재미도 있다. 영화 속에서 조셉 캠벨의 그림자를 만나는 즐거움.
9788966850655,10,"음악사 개론으로 어떤 책이 좋을지 여러 권을 살펴보았다. 이 책이 가장 마음에 든다. 체계적으로 정리도 잘 되어 있고, 한 눈에 들어오도록 편집도 잘 되어 있다."
9788956763262,10,"추천을 많이 받은 관계로 샀습니다. 
운동생리학을 대학교때 교양으로 공부하기는 했었는데, 이번에 운동을 시작하면서(직장인입니다)
운동시 일어나는 과정을 이해하고자 하는 욕심이 들었죠. 물론 운동에 도움이 될지는 아직 모르겠습니다. 살펴보니, 이해하기 쉽고, 올 칼라로 잘 되어 있습니다!"
9788956763262,10,"체육 임용고시를 준비하는 수험생으로,
역학과 생리학에서 막혀서 쩔쩔매는데..ㅠㅠ
뭔가 쉬워요..쉬워도 너어어어어어어어어어어어어어어무 쉬워요ㅋㅋㅋㅋㅋ"
9788992607445,8,과연.... 이것이야 말로 짜친 연기를 피할 수 있는 임시방편이로세.
9788957861240,10,"스타니슬랍스키 시스템을 공부하고 싶은 분이라면 이 책 추천 드립니다. 실습을 하시면서 참고 교재로 쓰시면 좋을 것 같아요.연극 자체가 실습이다 보니책만 보시면 이해가 쉽지는 않을 것 같아요.물론 실기 경험이 있으시다면, 다시 한번 연기술을 점검하는 참고서로 읽어 보시면 좋을 듯."
9788958912095,8,강의 교재로 급하게 구매했는데 빠른 배송으로 강의를 지정 없게 들을 수 있어 감사합니다.
9788903161035,10,인터넷으로 중고책을 첨으로 사봤는데 깔끔한 책에 놀라고 싸게산거게 좋아라했습니다
9788997436903,8,정오표가 있으나 그외에 오타가 확인됩니다. 그것외에는 훌륭한 스트렝스 교본집이라고 생각합니다. 책 읽은 뒤 마크 리피토의 유튜브로 복습하는 것도 많은 도움이 됩니다.
9788997436903,6,그리고 오류를 수정하지 않고 그냥 정오표를 끼워넣은 점 또한 좀 충격적이었네요.
9788997436903,10,"리프팅 운동을 처음 시작하는 분들에게 적극추천, 영상을 보는 것도 좋지만 책으로 하나하나 공부해 나가는 것도 좋은듯"
9788997436903,10,스트렝스 훈련의 유일한 입문서
9788999715358,10,명쾌한 기법 참고가 너무 잘되네요꼭 필독서인것 같습니다
9791185521015,6,한창호와 허문영이 훌륭한 평론가라는 데는 이견의 여지가 없다. 그러나 훌륭한 역자가 아니라는 데도 이견이 없을 것이다.
9791185521015,8,"장르에 대한 성실한 성찰. 다소 교과서적인 부분도 있으나, 그것이 오히려 장점으로 작용한다. 다만 분석 텍스트가 할리우드 초기 작품들인만큼, 공감의 여지가 줄어드는 것은 어쩔 수 없는 현실"
9788940804452,8,미학과 예술 이론에 대한 주요 사상가들을 선별하여 잘 다룬 거 같네요. 깊이는 아쉽지만 전체적인 담론의 그림을 그리는데 도움이 될 거 같네요.
9788940804452,8,"인문학이나 사회학을 공부하는 분들이라면 이 책은 소장가치가 있을것으로 생각됩니다. 여러 철학자들과 미학자, 사회학자의 간단한 생애와 이론, 저서들을 소개하고 있습니다. 이 책으로 공부를 하기엔 한계가 있겠지만 다른 분야, 다른 책으로 넘어갈 수 있는 디딤돌 역할을 해낼 것으로 생각됩니다."
9788940804452,10,"현대의 예술 이론 사상가 이름 정도만 알고 있고 스스로 깊이있는 탐구를 해보고 싶지만 갈피를 못잡고 있는 분들에게 추천드릴만한 책입니다. 이론가들의 개념, 사상, 저서가 간략하게 축약되어 있어서 쭉 읽어보고 예술 이론으로 첫 발을 디딜 수 있게 도와주는 책이라고 생각합니다."
9788940804322,10,기초부터 단계별로 구성되어 있어 연필스케치 배우는데 좋은 교재입니다~
9788963307305,10,대학 주교재로 쓰임 괜찮음. 법쪽은 학회 규칙을 법으로 봐서 아쉽다고 하심.
9788970853192,6,"책을 살펴보니 비닐로 포장되어 왔네요~그리고 외관을 살펴보니 찍힌 자국이나 흠집은 없네요(이 부분은 만족함)그러나2019년도 발행일이고 내용면지가 하얗지 못하고 약간 누렇게 변색되어 있고,내용면에서 오타나 맞춤법,잘못된 부분이있는지 없는지는 차근히 공부해야 알 것 같네요~78점 줄께요~"
9788973376322,2,"제목은 한국형이라는데 수 많은 시나리오 작법서 여기서 조금, 저기서 조금 짜깁기 한 것 뿐인 허접한 책."
9788973376322,6,많은 도움을 받은 책!
9788973376322,8,전공수업시간에 이 책을 공부하며 시나리오에 대해 배울 수 있었고 지루하고 어렵지 않게 적혀져 있었기에 재미있게 공부할 수 있었습니다.
9788973376322,10,우선 빠른배송 너무 감사합니다.^^시나리오 작법서라고 하면 대부분 외국도서를 가르치고 접하게 되는데 그 많은 해외의 교재들 보다도 더 우리나라 정서에 맞게 쓰여진 책이라고 생각해요. 내용이 어렵지 않고 재밌게 딱딱하지 않게 설명되어 있고 무엇보다 편안함이 느껴져요. 감사합니다^^
9788973376322,8,"시나리오쓰기에 정답은 없지만, 우리나라 영화계에 오랫동안 일했던 사람으로서 배워둘만한 부분도 많았다."
9788973376322,8,엄숙하게 얘기하지 않아서 좋다. 다 읽고 나서 선명하게 남는 몇 줄만으로 읽어볼 가치가 있다.
9788973376322,10,네 베껴쓰겠습니다 오늘부터 당장
9788973376322,10,우리나라영화를 예시로보여 굉장히 집중도가 높은 책
9788973376322,4,시나리오가 한국적인 것은 과연 좋은 것일까?
9788973376322,8,"사진과 적절하게 잘나와잇어서 재밌게 보기 편한것같아요 
좋네요 ㅋ"
9788973376322,10,"포장재질이 완벽해서 흠집하나 없이 다음날 바로 도착, 기대한 것만큼 만족스러움."
9788973376322,6,쉽고 편하게 읽힌다는 것이 이 책의 미덕. 초심자에게 권하고 싶다.
9788973376322,4,촘 돈 아까워요
9788988544051,10,미술치료에 관심있는 사람은 사야 할 책.
9788956055909,10,진작 사서 읽을 걸 그랬다. 영화로 무슨 수업을 하느냐며 책 제목부터 맘에 안들었는데 그 부분에 있어 저자는 나같은 놈을 위해 한마디 한다. 예술은 가르칠 수 없는 것이라고...스스로 그 규칙을 새롭게 발견할 때까지 아무런 가치도 없다는 말에 무한 신뢰를 하며 책을 펼쳤고 후회하지 않았다.
9788956055909,8,"영화를 막 제작하려는 초보 감독들에게 권해주고 싶은 책. 영화를 30여년간 제작하고 10여년간 가르친 저자의 경험에서 우러나온, 영화제작의 기초가 되는 시나리오 구상, 카메라 앵글 등에 대한 명료한 설명으로 구성된 책. 영화를 보는 입장에서도 유용한 글이다."
9788956055909,8,내용이 조금 아쉽긴 하지만 좋은 책입니다. 영화제작이나 시나리오 작성에 큰 도움이 될 것 같아요.
9788962061109,8,"스포츠 사회학의 최고봉!
임용고시를 준비하는 학생이라면 필독하세요!"
9788970842660,4,"내용은 상당히 좋네요.그렇지만, 책의 상태가 안 좋았어요.마치 중고 책을 받은 느낌."
9788970842660,10,정확한 인체드로잉을 위해 누드 드로잉이나 해부도 연습  중요한데 비싼 값 합니다. 중간에 트레이싱지 간지로 뼈대 도판 겹쳐놓은 것도 좋습니다.
9788970842660,10,기초의 기초 개인적으로 독학으로 공부하시는 분들께 강력추천하는 도서입니다.
9788970842660,10,"그림그리시는분들은 한번쯤보셔야할책.사진과 여러포즈, 근육과 뼈의 배치도 볼수있어서 인체를 따라그리기보다는 이해하기 참 좋은것같네요."
9788970842660,10,평생 소장하게 될 책. 인체를 다양한 예시로 보여주기 때문에 해부학적 지식을 어렵지 않게 습득할 수 있다. 수십 번을 보아도 새롭고 흥미로운 책이다.
9788970842660,8,good
