ISBN13,rating,review
9788920011351,10,좋아요
9788920000966,10,보건환경학과 학생분들은 꼭 구매하세요. 산업위생(산업)기사시험에도 유용합니다.
9788920020155,10,내용이해 하기 쉬워요~~ 박동욱 교수님 짱
9788920035296,10,"아주 오랫만에  좋은 책 읽었다. 어려운 지리학 이야기를 이렇게 쉽게 쓸 수도 있구나 싶고, 원로 학자로서 저자의 범접할 수 없는 내공이 느껴지는 문장이었다. 우연히 보아오던 산, 바다, 강, 호수 등에  자연의 오묘한 이치가 있음과 그것을 밝혀내는 글에 놀라울 뿐이다."
9788920031595,2,국제경영 교재에 왜 인적자원관리 내용이 나오는지... 방송대 커리큘럼이 원래 국제경영시간이 인적자원관리를 배우는건지.. 참 황당한 책이다. 2장부터 5장까지 내용은 왜 국제경영학이라는 책에 포함된건지 알 수가 없다.
9788920035630,10,어머니가 올해 대학 공부를 시작하셔서 사 드린 책인데 제가 읽게 되네요~ 대학 교재라기보다는 교양 서적처럼 슬슬 넘겨보기 좋습니다.
9788920029882,10,박동욱 교수님 강의 열심히 하십니다.. 내용 보기 좋아요
