ISBN13,rating,review
9788970842660,10,"집에 수많은 미술관련 서적이 있지만 가장 많이 열어보는건 이 책과 잭힘, A루미스 세 권 뿐이다.
 해부학 관련 자료도 찾아보면 대부분 의학관련 해부학인데 이 책은 그림그릴때 필요할정도의 깊이로 설명해줘서 좋음"
9788970842660,10,인체를 그리는 데 도움이 많이 되었다!
9788970842660,6,신체에대해 자세히 나와있고 보기편하다
9788970842660,8,"몸에 대해 생각해 보게 됨.
내가 보는 몸과 내가 생각하는 몸은 무엇이 다른가..."
9788970842660,10,"미술, 만화계에 입문하는 사람이라면 당연히 인체에 대해 공부해야 된다고 생각한다. 이책은 인체사진, 자료가 수많이 수록되어 있어서 인체 공부하는데 최적이다."
9788970842660,10,유익함
9788970842660,10,번역판이 있는지 몰랐어요 대박. 잘볼께요
9788970842660,10,"흐아아, 사진 좋아요. 편집 좋아요. 책 크기 딱 좋아요. 내용 좋아요. 가격.. 이해해요. 출판사 고마워요."
9788970842660,10,"인체를 연구하는 예술가라면 꼭 필요한 책이겠네요. 
너무 좋습니다."
9788970842660,8,미술공부용으로 샀는데 괜찮네요. 근데 확실히 포즈는 많이 부족....()(
9788970842660,10,더할나위 없이 좋은 미술용 해부학책.
9788970842660,10,맘에들어요~!! 다른것도 여러권 살까하다가 이것만 샀는데 이거 하나만 있어도충분
9788970842660,8,"2007년 쿠폰없이 33,600원에 싸게 업어왔음. 사진이 격하게 크다."
9788970842660,10,조각을 하기 위해 필요한 책입니다 너무 마음에 들어여
9788995651308,10,잘 보고 있어요. 도움이 많이 되네요.~~~^^
9788995651308,10,작가들에게 많은 지식을 주는 책
9788995651308,10,이제 본격적으로 드라마작가의 꿈을 키울수 있겠네요 ^^
9788995651308,10,유명한 작가들이 참여한 프로젝트인 만큼..만족. 딱떨어지는 깔끔한 책입니다.
9788995651308,10,스폰지 포장으로 흠집하나 없이 깨끗하게 도착했습니다. 기대한 것만큼 만족함
9788995651308,2,"별점을 줘야 하는게 안타깝다.
노인 냄새 나는 작가들의 자위질 구경 놀이"
9788995651308,10,"정리가 잘 되어있고, 읽으면 읽을수록 많은 도움이 되는 책!"
9788995651308,10,"드라마를 좋아하고 관심이 있다면 한번은 꼭 읽어볼만한 책!
똑부러지는 책이다"
9788995651308,8,잘 읽히고 따뜻한 격려도 있다. 단막극 위주의 작법 설명이 좀 아쉬움.
9788995651308,6,유익한 책입니다.
9788970590707,6,이책좋아요ㅋㅋ
9788940802885,10,"중국 외에 일본, 인도 등 접하기 어려운 국가의 미술사까지 접할 수 있다."
9788940802885,10,동아시아 종교문화의 보편성과 각국의 독자성에 대한 인식의 지평을 넓힐 수 있는 책!
9788952746306,8,디자인 시대별로 특징들과 칼라 도판들이 가득해요~~~ 참고하기 좋으네요
9788987322889,8,괜찮아보입니다.
9788987322889,10,좋은 책입니다. 추천하고 싶네요.
9788987322889,8,시중에 나온것중에 제일 잘되어있는 교재
9788930100458,10,"회화를 소재로, ｀안다는 것｀(인간의 지각과 인지 기제)에 대해 과학적으로 접근한 연구서. 번역서들 중에서 보기 드물게 매끄러운 문장이 일품!!"
9788930100458,10,미술을 이해하기에 상당히 도움이 되는좋은책!
9788972121510,10,코팅지가 아니어서 좋고 인쇄 퀄리티도 좋은데 두꺼운 책 치고 제본이 덜 튼튼해서 앞 부분 페이지 분리됨ㅠㅠ
9788959163182,10,악보도 볼 줄 몰랐던 내가 피아노를 칠 수 있게 해준 책!
9788959163182,10,교수님 보고싶어요~~ 2009년 수강했었는데 당시에는 교재 집필중이었는데 출판하셨군요~ 교수님 덕분에 클래식에 더 빠져들었습니다~^^
9788959163182,10,"어휴.. 너무 좋아요ㅠㅠ 처음에 도서관에서 음악 이론 관련된 책들 쭉 살펴보다 이거다! 하고 골랐던게 바로 이 책입니다. 자세한 설명, 많은 예제들.. 말이 필요 없습니다. 강추!!"
9788959163182,10,비전공자 교양수업교재였는데 기초부터 하나하나 너무 자세하고 좋아요 ㅎㅎ 설명이 쉬우니 독학하시는 분께 추천!
9788959163182,10,음악학 독학 입문서로 선택. 양장으로 나왔으면 더 좋았을 텐데.
9788959163182,10,｀음악학｀의 탄탄한 기초를 쌓는데 최적의 책!
9788959163182,10,저자가 진행하는 연세대학교 인기 교양강좌(교재와 동일 제목)의 강의교재이기도 합니다. 정말 기초에서부터 차근차근 가르쳐줘서 나름 화성학의 깊은 분야까지 다루므로 입문자에게 강추합니다
9788959163182,10,정말 친절해서 좋습니다.
9788959163182,10,"이 책을 사서 독학 중 인데, 음악 이론을 쉽게 풀이 했을 뿐만 아니라. 음원을 함께 제공하여 이론으로만 넘어가지 않고 그 즉시 현장에서 바로바로 실제로 익히면서 그 차이를 느끼게 해주는 교제."
9788952730213,10,한국전통미술에 대해 제대로 1~10까지 알려면 꼭 읽어봐야하는 필독서...
9788952730213,8,시대를 따라 한국미술을 보여주는 책. 왠지 모르게 현대미술은 그리 정감이 가질 않는데 박물관에서나 볼 수 있는 과거의 한국미술은 마음이 끌린다. 이름모를 장인이 만들었을 미술품앞에서 그 시대는 어떠했을지 잠시 생각에 잠겨본다.
9788952730213,8,아직 읽지는 않았지만 정말 자세히 알수있을것 같습니다.
9788952730213,10,"두께에 질릴꺼 없어요,문장이 좋아서 깊이있는 내용을 재미있게 읽을 수 있어요.강추!"
9788952730213,10,좀더 심도깊게 공부하고 싶은 사람에게 추천!
9791196080235,10,"PT를 받다가 근막이 궁금해져서 산 책인데 너무 좋습니다. 근막통증증후군에 대해 잘 나와있네요. 빈칸을 채우며 읽기때문에 학습하기 좋게 되어 있고, 무엇보다 책사이즈가 맘에 드네요.(얇고 간결. 저는 이런 책이 좋아요!) 전편 ‘해부학 쉽게 공부하기‘도 살 계획입니다!"
9788956543437,10,내용이 충실한 책  읽기도 편함
9788955661262,10,깔끔하다! 그리고 재밌다
9788970596167,10,교수님이 설명하시는게 이해하기 힘들었는데 이책을 가진 친구한테 책 빌려보니 텍스트와 그림으로 나와있어 이해하기 수월하다! 당장 구입!
9788970596167,8,열심히 공부하고 익혀두어야 겠다! :) 내가 원하는 꿈을 위하여 한걸음을 앞설 수 있게 해주는 책!
9788989544425,10,현대음악을 알고싶어 사게 되었다.
9788970858319,4,저 이책은 안들어오는것인가요?? 답변쩜 부탁 드립니다.
9788970856209,8,"책의 상태부터 살펴보니 비닐로 포장되어 왔고 개정판이네요그리고 외관을 살펴보니 찍힌 자국이나 흠집이 없네요(이 부분은 만족함)그러나 내용면지가 하얗지 못하고 약간 누렇게 변색되어 있고,내용면에서 오타나 맞춤법,잘못된 부분이 있는지 없는지는 차근히 공부해야 알 것 같네요~ 80점 줄께요~"
9788930100557,2,"하루배송 상품이라 주문했는데 정확히 일주일걸렸네요. 
바쁜분들 주문하지 마세"
9788930100557,10,굳~~공부
9788930100557,10,학교 교과서로도 사용하고 그리고 사진에 대한 많은 역사를 쉽고 재미있어요^^
9788952730114,8,술술 읽혀지네요 ㅎㅎㅎ
9788952730114,10,"으 이제 읽을 일만 남았다
완전 열씨미 읽어줄테다"
9788952730114,8,"미술 교사가 되기위한 필독서라고 할 수 있죠.
하지만 책을 처음 받았을때 주황색의"
9791186089774,4,nasm을 공부하려고 샀지만... 번역을 한사람이 너무도 많아서인지 용어가 계속 바뀐다. 동일개념의 영어단어가 한국어로는 계속 변화하는 기현상을 볼수가 있다. 더군다나 오역이 군데군데 나오는데 너무하다... 그냥 영문판보세요.
9791186655344,8,번역만 빼면 완벽합니다. 다만 원래 글이 적은편이고 글보다는 그림이 중요한 책이라 넘어갔네요.인체드로잉을 참고하기엔 최고의 서적이지만 글의 번역이 엉망이라 저자가 열심히 써둔 인체전반에 대한 구조설명이 다 날아가버린 수준입니다. 그래도 그림만큼은 매우 좋았기에 별4개 드려요.
9791186655344,2,"번역 진짜 너무 한거 아닌가. 거의 구글 번역기 돌린수준,  3만원짜리 책에 몇줄 안되는 번역가지고 너무 성의없다. 읽다 짜증나서 집어던졌다. 그냥 영문판 재구매해서 볼란다"
9791186655344,10,"인체드로잉 실력 향상을 기대하며 구입한 책입니다.수록된 수많은 예시 그림을 성실히 관찰하며 그리기만해도 인체구조, 밸런스를 터득할 것 같네요.간결하고 쉬운 설명도 좋았습니다."
9791186655344,10,"책이 정말 좋아요! 그림도 많지만, 그림에 붙은 뼈와 근육별 설명이 참 자세하고 이해하기 쉽습니다. 전체적인 인체의 형태나 기본적인 뼈, 근육의 이름을 알고 계신 분들이 보시는 게 가장 좋을 것 같습니다.(책날개에 뼈,근육 일람표가 있긴 해요) 공부하시는 분들 꼭 구매하세요!"
9791186655344,10,책 좋은듯요. 다만 처음 인체책 구입하시는분에게는 불친절할수있으니 다른책이 더 나을수있겠네요
9791186655344,10,그동안 인체책 보면서 지루한설명들 읽어도 이해 잘 안가고 금방잊고 그냥 그리면서 외우게 그림이나 다양하게 많이 실어줬으면 좋겠다...저와같은 이런 생각하신분들 바로 이책입니다. 바로 이런책을 원했습니다 최신기법의 아나토미~랑 비슷하게 좋아요 따라그리기는 이게 그림이라서 더 편하고
9788966800278,8,"영화에서 처음 시도되었거나, 중요한 장면을 중심으로 영화사를 기술."
9788986377446,10,"정신적 마음가짐은 물론 실전적 행동지침까지, 종합선물세트같은 책"
9788940804148,10,현대미술의 다양한 사조와 개념들이 정리되어 있어서 공부하기 좋습니다. 도판도 칼라네요^^
9788940804148,8,사전이라는 말 답개 무수히 많은 용어들이 정리되어 있었습니다. 미술을 공부하면서 많은 도움이 될 것 같은 책이네요 ^-^ 알라딘 배송 빨라서 너무 좋았어요~
9788964061534,8,연출 카메라 모두 공부하기에 안성맞춤인것같아요
9788964061534,8,이해하고 공부하기 좋은 책이네요
9788989544340,10,배송도 빠르고 수업 교재로 쓰고 있는데 잘 읽고 있습니다~~
9788970593913,10,북디자인의 기본을 알고 싶은 분께 추천합니다.
9788970593913,10,학교 주교재로 사용하는 책인데 빨리 책 준비해주시고 배송도 예상보다 빨리 해주셔서 갑사해요 ^^ 이책은 진짜 북디자인이나 편집디자인에 꼭 필요로하는책!
9788970593913,10,진짜 교과서. 좀 비싸지만 좋은 책입니다.
9788970593913,10,두고두고 도움이 되는 책^^ 기획자에게도 디자이너에게도 필수!!
9788970593913,10,내게 꼭 필요했던 책...을 위한 책ㅋㅋ
9788970593913,8,편집자에게도 디자인을 볼 줄 아는 능력은 필수죠. 곁에 두고 참고하고 있습니다
9788970593913,10,전문가라면 꼭 읽어보고 소장해야될책.
9788970593913,10,"디자인의 기초적인 내용부터 시작해서 깊이있게 파고들어가는 말 그대로의 ""교과서"""
9788970593913,10,"현재 혹은 앞으로 편집디자인을 하고싶은 사람들을 위한
좋은 지침서.. 강추!!"
9788958912613,10,실제 음악치료에 사용될 예시들이 있어 좋아요!
9788940802731,10,진짜 최고최고 입문서로 엄청 좋은 것 같다. 특히 한국인이 썼기때문에 어색한 번역투없어서 이해하기가 훨씬 쉽다.
9788940802731,6,너무 쉽게 나온것 같아요.. 내용도 많이 부실. 그냥 입문자에게 딱..
9788940802731,8,"수업시간에 필요한 책이라서 구했는데.,,알라딘 밖에 없더군요"
9788970842073,10,미술사를 공부하는 학생들이라면 꼭 필요한 책
9788970842073,10,소장가치 100%. 내용과 구성과 디자인 모두 훌륭한 책
9788970842073,10,"배송도 잘 되었고 가격도 맘에 든다
이제부터 읽고 공부하는일만 남았다"
9788970843018,8,"일단 책이 되게 무겁다는거 ㅎㅎ
컬러판이라 그러려니 하지만 
들고다니기 힘들다"
9788997716838,8,그림책 공부를 하면서 기호학에 대해 관심을 갖게 되었다. 여타의 기호학 책은 어려워서 읽을 엄두를 내지 못했다. 이 책은 실제의 이미지를 실어 기호학을 구체적으로 설명하고 있다. 무심코 지나치는 무수한 기호와 상징들이 어떻게 작용하며 우리의 삶의 방식을 규정하는지 잘 나와 있다.
9788940805077,6,교재.............
9788940805077,10,개정판이 드디어 나왔군요.....기다렸습니다..
9788940805077,10,"내용이 알차고 번역이 꼼꼼하다. 하나의 키워드에 대해 특정저자의 지적 여정이 흥미롭게 펼쳐지며, 예시로 등장하는 작품들과의 연관성도 매우 주목할 만 하다. 미술사/비평에 있어 튼튼한 기초를 잡아주는 훌륭한 책."
9788997142156,8,참 유익한 책입니다. 가격이 쎄서 중고도 없을정도로 인기가 있어요. 그만한 가치를 하기에 별 5개를 주고싶지만 가격이 역시;..
9788997142156,10,생각보다 굉장히 세세하게 적혀있네요~ 대학교에서 강의자료로도 쓰는 교재 인가봐요~ :)
9788962570267,10,"동일저자인 하남길 교수님의 다른 책인, 체육과 스포츠의 역사는 잘못된 부분이 많았었는데..체육사신론 받자마자 탐독중.."
9788962570267,10,체육사에 대한 전반적인 내용이 모두 담겨 있어 참고서적으로는 아주 아주 최고!!!
9788989485650,10,자세한 사전과도 같은 책
9788989485650,6,영화를 공부하는데 도움이 되지만 권하고 싶지는 않다.
9788972975090,4,"이 책을 산 이유는 흥미로운 리뷰를 봤기때문이였다. 대학교재로 구매한 후에 책이 재미있어서 공부와 별로 보게된다는 리뷰. 나는 대학생의 그 정도 리뷰이면 내 수준의 지식으로 읽어도 나쁘지 않을 거라 생각했다. 하지만 이게 웬걸, 내가 예술과 철학에 대해 문외한인것인지.. 이해가 되지않는다."
9788972975090,10,"철학, 예술 분야 모두 관심 있는 분야라 책을 구입하게 되었는데 내용도 이해하기 쉽고 분야도 다양해서 정말 잘 샀다고 생각합니다!!"
9788986353815,10,저자의 한국어판 서문을 읽고나니 책을 놓지 못하고 죽 읽었다. 근래에 연이어 이렇게 지적 즐거움을 주는 책을 읽을 수 있어서 기쁘다.
9788986353815,10,"'예술의 종말 이후'의 예술은 어떠한 것인가? 라는 질문을 던지게한다. 1997년 발표되고 2004년 한글로 번역된 20년전의 글이지만 여전히 생동하는 지금의 예술작품들에 의문을 던진다. 아서단토가 '예술'과 '예술산업'의 구분을 어떻게 인식했지, 그의 철학적 감각이 어디까지 미쳐는지 궁금하다."
9788986353815,8,"예술이 종말을 고했다. 모더니즘 미술의 종말일 뿐이다.워홀의 60년대 이후 모든 것이 예술이 될 수 있는 시대가 되었다는 것이다. 이 책은 컨템퍼러리 논하지만 80년대 나온 책이다. 포스트모더니티적 조건을 이해하면서 포스트모던니즘을 기피하는 이유는 통시적,공시적 이유가 있어보인다."
9788986353815,10,아서 단토 선생 영면하소서...
9788930110808,8,"동양화에 대해 미술사적 지식만 알고 싶은 사람으로써는 문방사우 장이 지루하게 느껴질 수도 있지만, 그림과 함께 읽는 동양화의 기본 지식 백과사전 역할을 충실히 하는 책."
9788930110808,10,"동양화, 말만들어도 가슴이 설레이는 말입니다요 ㅠㅠ"
9788930110808,10,화투 이야기가 아니다. 우리의 그림을 감상하는데 꼭 들고 다녀야 하는 책이다
9788970841557,10,"어느순간부터 아파하는 자신을 만나게 된다면, 자신의 색을 되돌아보라. 내 의식도 모르는 나의 무의식을 색깔은 말해주고 있다. 인간 내면의 색채지향성과 심리치료의 가능성까지 제시해주는 역작중의 역작"
9788970841557,8,"색을 통해 알아보는 인간의 심리학, 숨겨진 비밀들을 캐내다."
9788972960072,10,답지...
9788972960072,10,바로 삽니다
9788986353266,10,미학의 기본 개념들에 대한 탁월한 정리정돈!
9788986353266,8,웹디자인 수업에서 추천받아 읽었습니다. 기본 개념 익히디에 도움이 되었습니다
9788986353266,10,"기본에 충실한 책, 어려운 용어나 개념들을 소화시키기 좋게 정리해놓아 정말로 입문서로 최고라고 생각되네요."
9788986353266,10,미학의 기본 개념을 익힐수 있어 좋습니다.
9788986353266,10,간단하면서도 풍부한 내용이 매우 마음이 듭니다.
9788955751949,10,취미로 시작하시는 분들에게는 어려운 그림같고 미대 입시준비생이나 수채화 고급자나 볼만한 책 같습니다.예제위주로 설명이 있는게 아니라 완성작을 감상하고 보는눈을 길러주는데 유용할것 같습니다.
9788932319162,10,"진정으로 이로운 연구를 오래 해나가려면, 눈과 마음에 따뜻함이 깃들어 있어야 한다는 것을 느꼈습니다. 쉽게 읽히지만 정밀한 분석과 통찰이 담겨 있어 얻은 것이 많습니다. 미학 분야 개관서가 드문 가운데, 훌륭한 책으로 공부를 시작하실 분들이 부럽습니다."
9788973009954,10,춤을 추는 이유를 이렇게 근원적인 부분에서부터 읽어보는건 정말 즐거운 독서다. 추천
9788979302066,6,"목적이나 프로세스 단계에 맞는 방법론까지 추천해줘서 프로젝트를 진행하는데 맞는 방법론을 찾기 좋았다.그러나 때로는 여러 방법론을 묶어 다른 방법론으로 소개하는등, 일부러 용량을 부풀려 비용을 더 받는 느낌이 들었고하드커버인데다 생각보다 커서 휴대성이 떨어짐."
9788979302066,2,도서관에서 보고 좋아서 구매했는데하드백 책 표지가 잔뜩 구겨져서 왔어요. 뭘까요? ㅠㅠㅠㅠ
9788979302066,8,좋은책
9788979302066,6,결코 추상적이지 않은. 실무적 위치에서 디자인의 방법에 대해 고민한다. 번역도 이정도면 훌륭한 듯.
9788955661378,8,좋은 사전은 공부를 새롭게 할 때 반드시 필요하다. 이 책은 영화를 공부하기에 적합하다.
9788955661378,8,"영화예술에 대한 시대상, 사상, 예술의 근본적 의의와 그 이상에 대한 총서의 느낌이 강하다."
9788972183945,10,테마별로 악곡에 대한 해설을 체계적으로 해 놓은 점이 좋아서 구입했습니다.
9788972183945,10,좋아요!
9788996075257,8,좋아요
9788991847569,10,찾고 있던 책! 일러스트가 맘에 들었으면 좋겠네요.
9788970853154,6,"책을 살펴보니 2019년 발행일이네요 그리고 외관을 살펴보니 찍힌 자국이나 흠집이 없네요(이 부분은 만족함)그러나 내용면지가 하얗지 못하고 약간 누렇게 변색되어 있고,내용면에서 오타나 맞춤법,잘못된 부분이 있는지 없는지는 차근히공부해야 알 것 같네요~ 77점 줄께요~"
9788970842745,10,두꺼운 책이 아닌 가볍게 들고 다닐 수가 있어서 좋습니다.
9788970842745,6,"얇은데 알차게 내용이 많은거 같아요
무엇보다 도판도 많아서 마음에 드네여"
9788970591483,10,소장용
9788970591483,8,good
9788930035286,10,컬러판으로 되어 있어 지루하지 않게 공부할 수 있어요
9788955660463,6,"내공 있는 깊이에, 번역체 문장을 얹었을 때."
9791189865160,10,"리뷰가없어서 별 기대 안하고샀는데,책 두껍고 굉장히 도움이많이되고 공부 열심히 하고있습니다.디테일하게 이것저것 정보가많고 맨뒤쪽에는 모의고사도있어 좋습니다.답지없어서 당황했는데 사이트들가서 다운받아서했습니다"
9788940801093,10,프리미엄 붙여서 정가보다 높게 받고 팔던 사람들 생각하면 얼마나 고맙고 통쾌한지 ㅋㅋ책 내주셔서 감사합니다 한글에 관심있는분들께 추천
9788940801093,10,재출간 감사합니다. 정말 보고싶던 책이었는데 구하기가 너무 어려웠습니다.바로 구매합니다~
9788971998373,8,"미학사에 대해 개괄적인 내용을 이해할 수 있는 서적이다.그러나 용어가 너무나 전문적이였고, 미학자들과의 비교분석이 있었으면 이해하기에 더 쉬울 것 같다.약간의 일본 학자 느낌이 나기도 한다.추후 ‘예술철학-플라톤에서 들뢰즈까지‘를 읽어보고 싶다"
9788955751871,2,‘그/그녀‘라니 아마추어스럽다.
9788955751871,10,기대와 달리 책내용이 너무 허술하다같은문장 같은 내용만을 계속 반복반복~~50쪽이면 충분한 내용을 200쪽으로 늘려놓은책!!!
9788993596601,10,초보자보다는 중급자에게 추천하는 책. 설명이 상세하지 않다. 기본적인 운동 자세들을 익혀야 책에서 말하는 내용들을 이해하기 좋다
9788993596601,10,헬스장에 처음 발을 딛는 초보자에게 추천할만한 좋은 책.
9788966800650,8,"책을 읽는 내내 한국의 허접한 다큐멘터리, 예컨대 ˝다이빙벨˝ 따위를 떠올렸다. 그렇게 만들면 안된다는 것을 책은 조용히 말해주고 있다."
9788964069363,4,너무 빈약하고 돈이 아깝습니다.애니메이터 서바이벌 키트 하위호환이랄까요... 서바이벌 키트를 다 읽을 시간이 없는 분이나 애니메이션 서적이 처음이라면 읽을만 하겠습니다...
9788955082562,10,좋은 책. 제발 복원시 이렇게 버젓이 정리된 치밀한 연구결과를 적극 반영하는 문화가 자리잡길 바랍니다.
9788955082562,10,배송 잘 받았어요~
9788963304540,10,실제적용하기에 아주 좋아요
9788963304540,8,집단미술치료 프로그램을 정리한 책으로 심리치료에 도움이 되는 책입니다
9788962060744,10,"기초라고 보기에는 심화같지만, 이정도는 알아야 임용고시 준비생이라고 여겨지네요.."
9788951110467,10,중세 천년의 기독교미술을 다룬 책. 페이지마다 선명한 도판이 이해를 쉽게 해 준다
9788991847460,10,고급인문서를 읽는 체험.
9788991847460,10,책 괜찮습니다...
9788995572023,10,음악과 음향에 관심이 있으면서 전기 관련 분야를 공부하고 싶은 사람이 보기에 좋은 책입니다. 저자가 재미있는 사례를 들어서 개념 설명을 이해하기가 쉽습니다. 딱딱한 이론서가 아니라 유머가 있는 책입니다.
9788983071453,6,"쉽게따라그릴수는있지만,
그림을어느정도그릴수있는사람에게더도움이될듯하네요;"
9788932905969,10,"고전, 미, 서양문화 백과사전. 거기에 서사시,철학,문학 까지.. 번역도 맘에 들고 읽기 아까운 책이다..!"
9788932905969,10,아름다움이란 무엇인지. 인간은 왜 아름다움을 그토록 추구하는지근본적인 본질을 이해할수 있어서 좋았습니다.
9788932905969,10,그리스의 미에 대해 알수있어서 좋아요.본질적인 미에 대해 다시 생각해볼수 있어서더욱 더 좋았습니다.
9788932905969,8,"움베르토 에코의 해박한 지식을 알수 있는 책이다. 문학, 회화, 음악등을 넘나들며 이런 지식을 가지고 있다는 것이 부러울뿐이다."
9788932905969,10,미의 역사를 아름다운 볼거리 사진 중심으로 서술했기 때문에 가벼운 마음으로 일별할 수 있음
9788932905969,4,도판을 제외하고 읽는다면 굉장히 얄팍해서 실망스러운 책이다.
9788932905969,8,흥미롭습니다.
9788932905969,10,미학에 대해 깔끔하게 정리하고 있다.
9788932905969,10,"움베르토 에코.
끝."
9788932905969,10,아름다움이란 결코 불변하는 것이 아니라 시대와 문화에 따라 다른 면모를 지니고 있다
9788932905969,10,활자에서 전해지는 지적 쾌감이 너무 좋은 책
9788932905969,10,"오늘 , 세트로 구매했는데 그야말로 환상 ^^"
9788932905969,8,좋은 책을 즐거운 교재로 황용하도록 하겟습니다
9788932905969,8,멋진 책. 그림과 글이 참 좋습니다.
9788988360941,10,현대미술을 정리하기에 딱 좋은 책
9788975481758,8,"색이 없는 곳은 지옥이라고, 에곤 쉴레가 그랬었단다."
9788974094133,10,번역체로 인해서 간혹 호흡이 길어지는 문장이 많지만 그럼에도 중요한 내용들이.
9788975484834,10,너무 쉽게 예화로 ᆢ 제게 넘 어려웠던 미술심리를 쉽게 접근할수 있어 넘 좋았어요
9788975484834,10,"여러가지 사례와 함께 적혀있어 쉽게 미술치료에 대해 이해할 수 있는 책!미술치료에 입문하면서 처음으로 읽어본 책인데, 배경지식이 있으면 더좋겠지만그렇지 않더라도 어렵지 않게 읽을 수 있는 것 같다."
9788975484834,8,미술치료는 미술일까? 마술일까?
9788895566072,6,영화분석을 독학으로 하기위해 샀지만 내용자체가 혼자공부하기엔 어렵네요
