ISBN13,rating,review
9788895566072,6,영화 분석에 필요한 작업이 압축되어 나오며 책에 실린 실제 영화 분석도 재미있게 읽을 수 있다.
9788895566072,10,이제야 발견했음을 땅을 치고 후회한다.
9788994512259,2,글을 잘 못쓰시는건 분명함 교정도 안한듯 거슬리는 문장이 넘쳐남
9788997436507,10,사람들의 움직임과 뇌는 불가분의 관계를 가지고 있다하지만 현대인들은 뇌와 움직임을 연결하는 법을 많은 부분 잃어버렸다 이책은 그방법과 원리를 알려준다 단지 처음하는 사람은 약간 낯설수 있지만 꾸준히 하다보면 효과를 체감할것이다 참좋은 책이다
9788997436507,10,"신체 트레이닝 등 모든 운동에 있어서 먼저 익혀야할 중요한 자료예요.취미로 마라톤, 웨이트를 하는데 딱히 운동이 아니라 하더라도 기본으로 익히면 정말 많은 도움을 받을 수 있는 교본이예요."
9788952115126,10,"이 책으로 현대미술사 공부 입문에 많은 도움을 받았습니다. 제리코를 시작으로 한 낭만주의 이후로, 사상(-ism)의 흐름에 따라 작가들이 추구하던 가치가 어떻게 변화했는지 구체적으로 잘 알려줍니다. 현대미술사를 공부하기 시작한 극극초기에 읽으면서 큰 흐름을 잡아가며 읽기 좋습니다."
9788971803622,10,아주 만족합니다!!!
9788997436026,8,"남자는 힘이다,를 쓴 맛스타드림이 파벨의 책에서 결정적 영향을 많이 받은 것으로 보인다. 솔직히 맛스타 드림이 파벨 책의 내용을 베낀 게 많다. 남자는 힘이다.. 원조??가 되는 책이라고 할까...  웨이트 운동을 한다면 한 번 쯤은 읽어볼만 하다."
9788997436026,10,스트랭스 훈련의 최고지침서!!!
9788973142309,8,"쉽지 않은 내용이지만, 라캉을 미술, 예술에 접목한 결과물이라 진지하게 읽을 필요가 있을 거 같습니다."
9788964061169,10,편집 공부에 유용합니다.
9788996361930,10,어릴 때 피아노 배우면서 어린이용 책으로 음악이론을 배운 것으로 시작하네요. 상세하게 설명이 되어 있어서 잘 따라가면서 공부하니 이론을 체계적으로 익히게 되는 듯합니다.
9788996361930,10,음악을 더 깊이 이해할 수 있게 되어서 정말 좋다.
9788936308384,10,색체에 대한 설명으로인하여 내 색체 감각이 한층더 높아진거 같다. 도음이 크게?
9788989722946,10,생각하는 법을 생각에 접하는방법을알려주는책입니다.
9788989722946,8,처음 이책저책 보고 공부할때 도움을 받았던 기억이 나네요...
9788989722946,6,사진은 볼만...
9788989722946,8,사진만 찍다가 이제 사진에 관한 책 한권 봐야겠다는 생각이 들었을때 만나서 좋았다
9788989722946,8,이 한권을 다보고 나니 내가 마치 사진 작가가 된듯하네요^^
9788986377286,6,번역이 마음에 안 들지만 내용 진짜 좋다.
9788986377286,8,심심하거나 우울하거나 좌절스럽거나 문득절망감에 빠질 때읽는다.
9788986377286,8,작가란 성실함 그 자체! 그 자세를 어떻게 하면 계속 유지시킬 수 있는가를 생각해 보게하는 책.
9788986377286,10,맛있는 책이었다.
9788986377286,10,시나리오 공부를 하는 사람에게 이만큼 위로가 되는 책도 없다. 선물로 또한권 구입.
9788986377286,10,"아직 읽어보진 않았지만, 재밌게 읽을 수 있을 것 같아요"
9788986377286,10,"시나리오 작가를 꿈꾼다면 반드시 읽어야할 필독서
좋은 습관으로 꿈을 이루세요"
9788986377286,8,처음엔 별로였는데 글을 쓰다보면 피가 되고 살이 되는 조언들. 그들도 다르지 않아..
9788985825672,8,"운동역학의 바이블 책!
체계적이고 확실한 기본기를 잡는 데 좋은 책입니다."
9788985825672,6,"자세한 예문설명과 그림으로 쉬운 이해를 할 수 있었습니다,."
9788995673386,10,단소의 기본을 익힌 후에는 혼자서도 보고 연주할 수 있어요. 다양한 곡에 도전~
9788986270433,8,연기 전공자가 아니더라도 ｀즉흥연기｀는 상상력을 자극했던 체험만으로 흥미롭다. 그러나 이야기는 지루하다. 처음부터 끝까지 진지한 태도를 유지하지 않는다면 고개를 꾸벅꾸벅 거릴 수도......
9788986270433,8,인간의 상상력과 창조력을 자극하는 방법을 알려주는 책입니다. 연기자가 될 사람이 아니라도 충분히 읽을 가치가 있습니다. 강추함
9788986270433,10,감사합니다
9788986270433,10,책 잘 받았고 교수님께서 추천해주신 책이라 기대가 큽니다^^
9788986270433,10,정말 연기자가 아니더라도 읽을만한 좋은책입니다.
9788970841168,10,"출간된지 오래 되었지만, 이 책만에 중국미술사 개론서가 있을까? 대답은 No!!"
9788970841168,10,매우 좋은 내용으로 필요한 부분에 많은 도움이 된 책이다.
9788940800898,10,좋아요
9788940800898,8,멋지네요
9788940800898,10,읽어두면 좋을책
9788940800898,6,"요점이 간략하게 소개되어 있어, 몸의 형태를 제대로 잡지 못하는 초보자에게 추천. 다만, 비교적 덜 디테일한 설명이 아쉬움."
9788940800898,10,기본적으로 가지고있어야할 책이라고 생각해서 구입했습니다 ^ㅂ^
9788930120203,10,"박물관에서 일하게 되면서 샀는데 유물 다루는 실무쪽에 관해서 정말 자세하게 적혀있습니다.
이 책으로 공부한후, 실무쪽으로 들어가시면 실수하실일은 없을거라 생각합니다!"
9788968241161,10,드디어나왔습니다 꼬박이년만에건강운동관리사협회와보건교육건강증진학회원들의  협력으로오리무중인간행동에대하여 미국스포츠의학회에서 펴낸최근도서를 한국사회에똿~~^^
9791188314522,10,디자인 씽킹을 한 번도 배워본 적이 없는 상태라도 이해하기 좋습니다. 즉 입문자용으로 추천!
9791188314522,6,다 추천해서 읽었다고. 이런 식으로 장난치지 맙시다.
9791188314522,10,"디자인적 생각방법이 단순히 하나의 분야에만 국한되지 않고, 여러 분야에 적용될 수 있다는 것에 많은 걸 깨달을 수 있었습니다. 내용 퀄리티도 좋고, 무엇보다 전공자가 아닌 일반인이 읽어도 술술 읽히는게 큰 장점이라고 생각합니다. 좋은 책 소개해준 지인에게 감사를"
9791188314522,10,정말 잼있게 읽었네요 주변지인추천으로 읽었어요 시간가는줄 모르고 책안으로 푹빠졌네요ㅎㅎ 기회가 된다면 또 한번 더 읽고싶네요^^
9791188314522,10,요즘 트렌드가 디자인 씽킹이라 관심이 많았었는데 디자인 관련 업종에서 근무하는 지인이 추천해줘서 읽어봤습니다. 초심자도 읽기 쉽게 서술되어 있어서 시간가는줄 몰르게 읽었네요~ 도움이 많이되었습니다 ㅎㅎ
9791188314522,10,디자인 회사다니는 친구가 추전해줘서 읽음!디자인 공부하는 사람들이나 디자인회사 입사전필독도서로 지정해도 좋을정도로 여러가지 다방면으로 도움 많이 받았어요~♡
9791188314522,10,디자인에 관심이 생기면서 디자인 관련 업종근무하는 친구가 추천해줘서 읽었는데 ..확실히 전문가 추천 책이라 그런가 도움이 되네요!! 생각보다 어렵지 않게 술술 읽었어요~
9788942915811,10,캘리그라피와 다르게 기의와 기표의 접점에서 탄생한언어 이전의 의사소통를 가능케 하는 매우 창의적 발상의 아이디어 북!!!!
9788998690359,10,"‘50 CAMERAS’는 종군기자의 카메라 니콘을 비롯해 한때 니콘과 보급형 카메라 양대 산맥이었던 캐논, 위에서 내려다보고 찍는 롤라이 플렉스, 가난한 사진가들의 ‘워너비’였던 라이카 등 올드카메라 50종의 이야기를 담았다. 수집가라면 누구나 군침을 흘릴 만한 카메라가 가득하다.-서울신문"
9788926886137,10,환경을 구성한다는게 얼마나 사람들을 위해 배려되며 만들어지는지 알게된 것 같아요잘 읽었습니다.
9791158902926,8,"저자만의 새로운 이야기를 발견하기는 어렵지만, 서구 극장의 역사를 개관하는 묵직한 연구임은 분명하다"
9788931456752,6,정서와 배색을 연결할 때 참고할 만하지만. 활용도가 크지는 않다.
9791196106201,10,서퍼에게 꼭 한권씩 있어야 할 기본서.
9788994679754,10,"일하느라 피로가 쌓여있어서 스포츠 마사지샾을 자주가곤 했는데 가기에 돈도 들고 시간도 걸리고 해서 직접 할 수 있는 책을 검색하다가 구입했는데, 마사지 하는 방법, 요령, 효과등 상세하게 잘 나와 있습니다. 마사지 책 보고 직접 하고 스포츠마사지샵은 안가고 있습니다. 보기 쉽고  이해됩니다"
9791160580020,6,그리드에 관해서 깔끔하게 정리해놓았다. 군더더기가 없어 좋았다.
9791160580020,2,유쾌한 농락. 표지부터 사지말라고 시위하는 중.
9791160580020,10,그리드 시스템은 정보를 의미있고 논리적이고 일관성있게 구성하도록 돕는다. 그리드에 대한 철저한 분석을 담은 스위스의 그래픽 디자이너 요제프 뮐러 브로크가 쓴 이 고전 ‘Grid Systems‘은 그리드 시스템에 관한 지식을 쌓는데 큰 도움이 될 것이다.
9791160580020,4,디자인이 이렇게 엉망인 디자인 실용서라니
9788972243892,6,"이 책의 구성은 마음에 든다. 필라테스를 전문적으로 배워서 티칭까지 생각하는 사람들에게는 좋은 지침이 될 수도 있었을 책이지만, 번역이 참 부자연스럽다. 읽어 내려가기에 진도도 안 나가고 이해가 가기 힘든 단어 선택들 때문에 이 책을 펼쳤다 놨다를 수십번 반복하게됨."
9788999707056,8,"사람들이 모든 것의 80%를 시각으로 받아들인다고 한다.수용하는 것의 기억력 증가는 강력한 색채의 효과를 이용할 수 있겠다.정열의 빨강,억제의 효과가 있는 초록경계의 표시 노랑색활기넘치는 파랑색은둔의 검정색 등등다양한 색채의 효과를 생각케 한 책이다.VMD를 새로운 시각에서 살펴"
9788956543529,10,"작년부터 필라테스에 관심을 갖게 된 40대 초반의 남성입니다.우연한 기회에 필라테스를 알게 되어 궁금증에 여러행사에 다녀봤습니다. 박람회, 엑스포 등등.얼마전에는 요가의 날 행사에도 다녀 왔습니다.여성들만 있을 줄 알았는데.남성도 드물지만 보이더라구요.우리도 필라테스로 다이어트를"
9788956543529,8,매트를 이용한 동작같은 것은 홈트레이닝이 가능할 것 같아서 기대가 많이 됩니다. 필라테스 입문서로 손색이 없을 것 같아요
9788956543529,8,근육통 디스크.... 를 예방하기 위해서 필라테스는 배우고 싶은데 갈 시간은 없고... 책 잘 보면 도움이 되겠네요. ^^
9788956543529,10,정말 기대되는 책이네요..필라테스를 배우고 싶어집니다.
9788993596557,8,"개입되는 근육들을 알 수 있어서 좋습니다. 다만 그림이 작아서 이 책 하나로 근육까지 다 공부하기는 어렵고, 전문적인 근육 해부학 서적과 함께 보신다면 시너지 최고입니다."
9788993596557,8,"동작에 대한 스트레칭 방법들이 자세하게 나와 있어 좋은것 같아요. 처음엔 이해하기 어려울 수도 있는데, 근육과 같이 공부하면 도움이 될거에요."
9788993596557,10,동작에 대한 설명이 자세하고 같은 부위의 스트레칭을 난이도별로 여러 개 제시해주어서 좋네요. 이론적인 설명을 100% 이해하지 못하는 사람에게도 충분히 도움이 됩니다.
9791185609966,10,목차가 꼼꼼해보이네요.
9788942607808,10,현실참여 작가인 러시아의 바실리 폴레노프의 ｀초야권｀과 ｀불타버린 숲｀을 보니 중세 농노들의 비참한 삶과 딸들에 대한 성적 수탈까지 서슴치 않았던 영주의 행동은 인간의 존엄성을 훼손하는 행위라는 생각까지 들게 했어요.
9788966186617,10,이번해들어 칼라감각에 대해 심히 고민했던 저에게 단비같은 책이었어요!! 기초에서 부터 차트별 컬러에선 감사함까지 느꼈습니다. 좋은 책을 구하게 되어서 너무 좋아요!
9788925549712,10,뉴욕 현대미술관의 컬렉션을 보는것 만으로도 기쁨이다. 수 많은 작품들 구입도 했지만 많은 사람들이 기부하여 만든곳이라 하니 대단한것 같다.
9788925549712,8,"책상 옆에 굴러다니는, 머리 비울때 훑기 좋은 책, 너무 작은 사이즈는 단점."
9788925549712,8,그림이 너무 작아서 ㅠㅠ
9788925549712,8,반값 할인으로 사서 좋았지만 책을 펼쳐서 보기가 부담스러운 재질이었다. 물론 그외에는 모마미술관의 대표 작품들을 간략한 설명과 함께 볼 수 있어서 좋았다.
9788925549712,4,책이라기보다는 도록에 가깝다. 책의 판형을 무리하게 줄여서 도판도 작고 글씨도 작다. 심지어 글씨가 흐릿하기까지해서 가독성이 매우 떨어진다. 책의 기본원칙이 지켜지지 않아 책이라기보단 저렴한 도록 정도로밖에 생각되지 않는다.
9788925549712,6,판형을 확인 안 하고 주문. 책이 너무 작다. 최소한 이 두배는 되어야... 책이 작아 도판이 작은 건 말할 것도 없고 글자도 너무 작다.
9788925549712,10,현대미술의 대표적인 작품들을 만나본다.
9788955276817,10,이원주 작곡가님의 다른 곡을 접하면서 반해서 산 악보집이다.성악을 전공한 사람이면 꼭 한번은 익혀보고 무대에서 불러보고 싶은 곡들이다.
9788993512441,2,몇년전에 블루스하모니카 마스터라는 책이 있었는데 지금은 품절. 기다리고있는 사람들이많은듯 한데 현재까지 재판이 안나오네요.. 연세대 교수님이 저술한 이 다이아토닉 하모니카교재가 시중에 나외있는 유일무이한 교본이 되었네요.페이지에비해 가격이 많이 비싼데 내용은 그런대로 볼만.....
9788997038107,10,강심장이 되라라는 책을 읽으면서 책속의 내용이 저희 현실속 경험과 만나 책을 읽는 내내 저에게는 의미있는 경험과 지식이 되었습니다. 그래서 이번 강심장을 만드는 심리훈련도 읽을 생각을 하니  기대가 됩니다!
9788957269794,10,체계적인 정리가 돋보인다. 번역도 훌륭
9788957269794,10,주요한 영화 이론을 잘 정리했군요. 영화를 심도 있게 보려는 사람들에게 도움이 될 거 같습니다.
9788996915201,8,"로고타입과 심벌, BI 등 아이덴티티 디자인의 용어와 개념을 알려주고 아이덴티티 디자인의 다양한 조형원리, 그리고 역사와 미래에 대해 소개하는 책이었다. 특히 현재 트랜드라는 플렉서블 아이덴티티 디자인이 흥미깊다.
좋은 책이다."
9788996915201,8,아이덴티티 디자인에 대해 잘 알게 됬네요. 디자인전공자가 된듯~ㅋ
9788966800094,8,사례들이 빡빡하게 있고 도움이 많이 됩니다. ㅅㅅㅅ 좋은책입니다.
9788970415697,4,인디자인으로 포트폴리오 만드는 사람들에겐 썩 도움이 안 되는 책. 구닥다리 팁이라고 왜 샀냐고 핀잔 들었음ㅠ
9788970415697,10,"포트폴리오를 위한 실질적인 팁, 대부분 그림으로 친절한 예시를 보여준다@"
9788970415697,10,눈으로 보기 좋은듯.
9788972183990,10,"째즈와 블루스의 ｀쏠｀을 알고 싶다면, 반드시 읽어보길~!"
9788963307329,10,"다만, 입문하다 하산하고 싶어지는 부담스런 완성도!"
9788962850734,10,좋은 책입니다.  작가의 유튜브 채널도 아주 좋습니다.
9788962850734,10,수채화에 관심이 생겨서 샀는데 도구준비부터 기초적인 물조절법까지 내용이 유익합니다.
9788962850734,10,수채화를 처음 시작하는 사람에게 좋은 책입니다.
9788962850734,8,그럭저럭 상태 깨끗하고 괜찮네요
9788962850734,10,책 마음에 듭니다 ....  베리굳
9788962850734,10,그림을 보는것만으로도 책값을 능가합니다.
9788970924632,10,"기대했던 만큼 좋은 책이라 마음에 듭니다. 자수 베갯모들의 아름다움을 한컷 볼수 있습니다.다들 도안도 이쁘고, 자수 솜씨도 수준급 들이라  참고 자료로 좋습니다."
9788970595849,10,"상품의 사진을 보며, 디자인이란 무엇인지를 생각해보는 시간을 갖고 있습니다."
9788970595849,6,아들에게 읽으라고 주었는데 읽고 있는지...
9788970595849,10,이 책이 반값이라니!!
9788970595849,8,모더니즘을 베끼는 일로 아는 천박한 기획/개발자들에게 추천한다.
9788970595849,10,책을 읽고 나면 내가 디자이너 라고 말하기 부끄러워진다.
9788955751567,10,이거우리   중학교 독서퀴즈대회 출제 문제에 이책이 포함되어 있어서 읽어보았는데 화가들의 시점을 더욱더 이해하기 좋은 책이다
9788964061091,8,"아방가르드, 실험영화에 대한 입문서로 좋습니다. 너무 방대하지 않게 잘 정리했습니다."
9788964061091,10,아방가르드한 영화란 무엇인가. 이 책으로 탐구해보자
9788996188193,8,핀란드 방문전이라 도움이 될까하여 책을 사봤어요. 문체가 딱히 재밌지는 않으나^^ 여러가지 브랜드 들과 문화에 대한 이해가 되어서 좋네요. 사우나나 공원등의 사진도 있는 것이 좋았습니다. 핀란드가 왜 디자인 강국인지 알게되었으니까요
9788996188193,10,쉽게 읽히는 비주얼적인 책. 새로운 세계를 보는 신선한 감각.
9788996188193,10,북유럽앓이 중인데... 이 책이 작은 위안을 주네요...
9788996188193,6,때깔은 좋은데 내용은 부실한듯. 핀란드 디자인의 스타일을 대충 훑기에는 적절함
9788996188193,10,도서관에서 빌려보았으나 사고 싶은 책. 핀란드가 좋아지네
9788996188193,8,자연에서 번뜩이는 자연스런 아이디어를 찾는 부러운 핀란드 사람들...
9788996188193,10,나른함을 쉬엄쉬엄 즐기고 싶다면!
9788996188193,10,볼것도 읽을것도 많네요..눈과 머리가 시원해지는 기분이예요
9788996188193,8,핀란드의 디자인을 통해 그들의 삶의 가치와 자연과의 조화를 볼 수 있었던 책ㅎ
9788996188193,10,음미하면서 찬찬히 읽어볼만한 책이에요. 세련된 디자인들이 눈을 흥미롭게해줘요
9788996188193,8,시원시원한 레이아웃으로 보기 편해요~
9788996188193,10,책이 참 세련되었네요.
9788996188193,8,글의 구성이 너무 자연스럽고 내용 또한 놓치기 아깝다.
9788996188193,8,그 나라의 자연과 문화가 반영된 디자인만이 세계적인 경쟁력을 갖는다는 것을 보여줌
9788996188193,10,올해 디자인 관련 학과에 입학한 소라에게 선물.
9788996188193,10,"딱 떨어지는 디자인. 그 속에 아기자기함.
이쁜 사진이 너무 맘에 들었던 책. 소장용"
9788996188193,8,디자인이 하루 아침에 나오는게 아니지. 광화문 광장에 절망한다.
9788996188193,8,디자인에별로관심이없는직종인데도흑백의예쁜사진과간결한문체때문인지~~깔끔합니다
9788996188193,8,디자인만이 아니다. 건축과 삶과 거리까지. 마음으로 가까와지는 핀란드를 느낀다.
9488974833855,10,"한권쯤필요한 독백책 
여자대사만있어서좋아요"
9488974833855,10,표지가 핑크색으로 변했네요~좋아요!
9788940803219,8,작품이 탄생하기까지의 모든 공정이 담겨 있어 디자이너들과 장인들의 작품에 애착을 느끼게 하는 책. 우연히 놀러갔던 20년전 종로 작업실이 생각나네.(졸업전 취업한 딸애의 선물로 구입한책)
9788996100454,4,역자는 왜 하필 이 책을 선택했을까.....역자의 말에 고개를 끄덕이고 싶진 않다..
9788952751997,10,수채화 물감 안료에 대해 알고 싶어서 구매했습니다. 알기 쉽게 잘 설명되어 있어요.
9788952751997,4,"책의 의도는 훌륭한데 번역이 영. 미대 출신이 번역한 게 맞는지. 윈저 앤 뉴튼(고유명사)을 ˝뉴튼과 윈저˝로, 색상명에 쓰는 hue를 ˝색조˝라 직역해 놓는가하면 또 막상 필요한 건 번역을 안해놓고. ˝릴리프˝라든지 ˝바이어스˝라든지. 뜻을 이해 못하고 번역한 듯 종종 앞뒤가 안 맞아 읽기 힘드네요."
9788952751997,6,초보자를 위한 가이드라고 하기엔 좀 어려운감이 있음. 그러나 말 그대로 색채를 보는 재미는 있음.
9788952751997,8,따라 그릴 수는 없지만 정말 그림이 예쁜 책 나도 그렇게 그려봤으면 - -
9788952751997,8,맘에 들어요//
9788970593616,10,"편집은 조금 엉성하지만 내용은 좋음요즘 기획하고 있는 논문과 연관하여 쓸 수 있는 소재가 무궁무진함착한 디자인, 착한 공간, 그리고 착한 가치관"
9788981338732,10,꼼꼼하고 화려한 도판과 문양을 분석한 섬세한 그림만으로도 충분히 책값을 한다.
9788970843551,10,조선후기 미술의 대외교섭을 한눈에
9788986016277,10,"목공예에 관심이 많았었는데, 구입하면 목공예에 대한 정보를 얻을 수 있을 것 같네요"
9788992214179,2,아하하하~ 과제하려고 샀다~ 피봤다
9788981055806,10,기초를 이해하고 간단한 즉흥연주를 위한 재미있는 교제
9788981055806,10,스케일별 설명과 연습거리들이 가득! 정말 좋은 책이네요.
9788981055806,10,책 괜찮아요^^ 잘 되어 있어요~^ㅇ^ 추천해영^ㅇ^ㅎㅎ
9788986353938,10,미술에 대한 공부를 하고 나면 깊이있는 이해를 하지 않을까 싶어서 읽기 시작했는데..... 재미가 솔~솔~나서 자꾸만 읽게 되네요. 몰랐던 것을 하나씩 깨치는 느낌.....그 즐거움이 무지 크네요.^^
9788995281017,8,기존 지휘법 책의 기본 지휘법(리허설 위주)의 지휘에서 벗어난 다양한 실전 지휘 테크닉을 그림과 함께 설명해 주어 지휘에 도움을 받는군요. 입문자 분들에게 추천할만 합니다.
9788988360842,10,잘 보겠습니다.ㅎㅎㅎ
9788988360842,10,좋은책입니다.
9788955660135,10,사회과학 박사논문인데 이렇게 인문과학에 근거한 연구를 하다니 참 멋지네요^^
9788972181804,8,알라딘관리자가 금액 잘못 올려 차액 송금하랬던.. 그렇지만 재미있게 읽고잇음.
9788972181804,8,연주하는 사람은 누구나 읽어야 할 책이다.
9788988360378,10,"양서를 반값 구매~ 무엇보다 도판이 정말 좋습니다. ˝일목요연˝,, 현대 추상 미술의 세계는 정말 상상초월입니다."
9788988360378,10,사고 싶었던 책인데 역시 좋다. 이 시리즈는 추천
9788986016536,10,인체조각을 할때 필요한 책입니다.
9788983070555,8,배색도 사고 칼라도 샀는데 색 공부하기 아주 적절한 책
9788983070555,8,퀼트배색할때 많은 도움을 받을거라는 선생님의 권유로 구입했습니다~
9788972435211,10,예쁜 꽃그림이 많이 담겨있어 참 좋습니다. 책무게도 꽤 가볍고 컬러 인쇄 상태도 좋아서 가지고 다니면서 힐링이 필요할때 보려구요^^
9788972435211,8,좋습니다. 참...
9788936901721,10,이 책을 통해 무용감상법을 제대로 배웠다
9788940801116,4,내겐 어려웠다..
9788940801116,10,27년전 대학 시절에도 탐닉햇던 고전 드로잉 기법
9788970840635,8,"건축,인테리어디자인 전공자뿐만 아니라 기계, 공학분야 등에도 유용한 드로잉 지침"
9788940801048,4,옛날 책이라 한자가 아주 많다. -_-;;
9788940801048,4,"간단간단하게 볼수있고, 이것으로하여금 실력이 차츰 늘 생각을하니 기분이 좋습니다"
9788932309477,10,제가 불교용품을 하고 있는데 이책이 많은 도움이 되네요..
9788978395106,10,한옥문화원 강사님의 추천으로 구입했는데 정말 잘 샀다는 생각이 듭니다
9788978395106,10,"전통건축에 관심이 있는 분이시라면 꼭 권장하고픈 책입니다.
정리 잘되어 있습니다."
9788975481901,8,예술치료사는 점쟁이가 아니라는 것.
9788975481901,10,"★만다라 뿐 아니라 타로, 미술치료 등에도 도움이 되는 멋진 책이므로 강추합니다~!"
9788975481901,10,내용이 알차서 도움이 많이 되는 책!
9788975481901,10,만다라 속에 담긴 개인 혹은 집단 무의식의 상징을 잘 풀어놓은 좋은 책으로 강추~!
9788930035293,10,"깔끔한 디자인, 풍부한 참고자료 아주 좋아요 !!"
