ISBN13,rating,review
9788955616477,8,가볍지만 인생의 길잡이가 되어주는 책세부적인 내용에 저자의 주관적인 부분이 없잖아 있지만이책에서 추구하는 가치관에는 전적으로 동의한다
9788955616477,6,철학서 같은 내용이다현대인의 물질주의  욕심  이기주의당연시 대는 소유욕  을 다시한번 생각하게 하는책
9788955616477,6,분명 좋은 내용인건 맞지만엄마 잔소리같이 들린다.왜 그렇게 해야하는지 설명도없이그렇게 하라는 내용들이 많다
9788955616477,6,알면서도 이렇게 산다!그럼에도 불구하고 한 번쯤 읽어볼만한 책.하지만 다신 읽지 않을 책.
9788955616477,10,프랑스 도인의 책이에요^^ㅋㅋㅋ  도미니크 로로의 내공이 만만찬을듯 합니다. 로로의 다른책도 구입해야징~~
9788955616477,8,"삶을, 머릿속을 정리해 주는 책이라 좋았습니다."
9788955616477,2,군데군데 메모할만한 구절들이 있기는 하지만 그다지 감흥이 큰 구절들은 아니다. 저자의 분위기나 문체 스타일은 나긋나긋하다못해 졸리기까지하다. 내용 또한 재미없기 그지없다.
9788955616477,8,마음의 여유^^
9788955616477,8,내용은 심플하지 않다.육해공군 다 다루고 있다. 심지어 피부관리까지도 논하고 있다. 일본에서 사는 프랑스여인의 글이라 그런지 일본식 자기개발서라는 느낌을 지울 수 없다. 그래도 자신의 내면과 외면을 잘 돌보고 이치에 맞는 삶을 살자는 저자의 말에는 공감한다. 인간답게 살기위해서 말이다.
9788955616477,10,심플하게 산다는 것은 단지 간소한 삶에 만족하는 것만을 의미하지는 않는다. 심플한 삶은 보다 고결한 사고방식과 생활방식을 동경하는 것이기도 하다. 소유하지 않으면서도 잘 살려면 결핍 앞에서도 긍정적인 태도를 가져야 하며 물질적인 것을 행복의 기준으로 생각하지 않아야 한다.
9788955616477,8,"다 아는 이야기 같지만, 정리해서 논리적으로 풀어가니 가슴에 와 닿습니다. 이 책을 읽으며 심플하게 살기 위해 신발정리를 했습니다. 큰 결심이 필요했습니다. 우선순위를 정해 놓고 보니. 욕심으로 붙잡고 있는 것들이 있는 것들이 보여서 굿바이 했습니다."
9788955616477,10,삶이 복잡다단하게 느껴질 때마다 펼쳐볼란다. 심플! 진정 추구하고 싶은 삶~
9788955616477,10,"˝사는 데 많은 물건은 필요치 않다. ｀심플한 삶｀이란 욕망을 줄이는 삶이다. 돈을 벌고 싶다고, 지위가 높아지고 싶다고 욕망하지 않는 삶이다. ｀시간을 낭비하면 안 돼｀ ｀언제나 무슨 일이든 해야 해｀라고 생각하지 않는 것. 그게 심플한 삶이다.˝ (조선일보 인터뷰에서) 너무나도 동감 ~"
9788955616477,6,동양의 정신을 서양인에게 훈계 듣는 아이러니
9788955616477,8,"책 제목만으로도 삶의 무게를 조금 덜어내는 느낌이 드는 책..
몸도 마음도 가벼워지고 싶다"
9788955616477,6,제목그래도 심플한 책이었음 ㅋㅋㅋㅋ....
9788955616477,10,"자기계발 카테고리에 들어가기엔 너무 아쉬운, 가벼운 철학서에 가까운 인생 지침서. 복잡하지 않게, 단순하고 소박하게, 나의 중심을 잡고 살고 싶은 이에게 추천해 주고 싶은 책."
9788955616477,6,"한번쯤 쓱 읽어보기에는 곱씹을게 있고, 두고두고 읽기에는 가벼움이 많다. 한 번쯤 두어시간 시간을 내서 읽어보기에는 적당하다."
9788955616477,10,"살면서 참고할 부분이 제법 많다. 하지만 가장 기억에 남는 건 ˝배가 부르면 그만 먹어라˝ 아, 명언이다 ㅠ"
9788955616477,6,"복잡한 도시생활에서도 미니멀리즘을 추구하며 심플하게 살자는 것이 핵심이다. 실용서로 보기에는 도움이 되는 구체적 내용이 없고, 철학서로 보기에는 알맹이가 부실하다. 다만 ˝alone˝의 어원 설명은 새롭다. ˝alone˝은 ｀all one｀(완전한 하나)의 의미."
9788955616477,10,"책 제목처럼 내용도 심플합니다. 심플하면서도 알차게 구성된 책이구요. 지인의 소개로 구입해서 보게되었는데 올해의 책 후보로도 손색이 없을 정도입니다. 이 책일 읽자 마자 집안의 묵은때와 그동안 아까워서 버리지 못하고 쌓아 놓았던 옷가지며 책, 신발, 등등 정리를 했답니다. 너무 좋아요!"
9788955616477,10,다시 쓰는 내인생의 리스트와 동시에 구입!깔끔한 표지처럼 책내용도 심플라이프를 추구하고 엑기스로 방향을 제시해서 읽고있으면 마음이 홀가분해짐!잡동사니로 가득찬 머리와 주변을 깨끗하게 정리하는데 도움됨!
9788955616477,10,"일반 정리 뿐만 아니라, 인생전반의 정리를 알려줍니다. 아주 맘에 드는 정리관련 책."
9788955616477,10,"심플하게 산다는 거. 이 책은 물건과 관련된 삶을 말하는거다.싼 가격의 물건들이 다양하게 쏟아져 나온 이후, 싸다는 이유로 필요없는 것을 집에 쌓아두고 사는 현실. 이 책을 읽으면 잘 정리하고 살 수 있을듯"
9788955616477,10,"이나영의 유니클로 울트라스트레치 진 광고 컷을 언어로 푼다면, 에세이로 쓴다면 바로 이와 같지 않을까."
9788955616477,8,심플 그자체입니다. 책만 보지말고 실천하려고 애쓰려고 합니다.
9788996222682,10,"이 책이 김밥파는 사장님의 가벼운 이야기쯤으로 알았다면 큰 오산입니다. 요즘 젊은 직장인, 창업을 꿈꾸는 이들에게도 많은 도움이 되리라 봅니다. 열정없는 사람에게는 필요가 없는 책입니다. 세상의 성공은 희생없이 얻을 수 없다는 것이죠."
9788996222682,8,CEO중에서 김밥이라는 시스템을 미국판 스토리 감사하다^^
9788935703265,10,"1,2,3권 다음은 처음으로 E북으로 구입했었는데 결국은 책으로도 장만함.  세상은 나를 위해 많은걸 해주는데  2020년 다시 읽는 이 책도 세상이 내게 준 큰 선물.  아낌없이 먹어 소화흡수시키리."
9788935703265,10,"몇년간 1,2,3권만 갖고있다가  트랜 비밀은 e북으로만 봤는데  꽂힌부분이 있어  아예 책으로 또 주문했다.  나의 세계가 더 좋은길로 가기위해 이것까지  사라고 ~목마르다고  이걸 사버리라고 외쳐서.. 특별한 아말감을 더 느끼고 내것을 만들어야지.. 바딤젤란드와 박인수님 감사합니다."
9788935703265,10,트랜서핑 총정리 및 심화학습
9788935703265,10,˝지금 너의 모든 것은 네가 생각한 것의 결과˝˝늘 깨어 있으라˝ 말씀이 떠오른다.심리치유서로서도 손색이 없다.
9788935703265,10,"이 책은 트랜서핑 4, 5권을 번역한 책입니다. 4권 : Ruling Reality, 5권 : Apples Fall to the Sky"
9788935703265,10,리얼리티 트랜서핑 시리즈의 후속편. 실질적인 내용들로 구성되어 있어 많은 도움이 되었다.
9788935703265,10,"1,2,3 시리즈와 반복되는 부분도 있지만...그냥 꼭 한번 읽어보시길.."
9788935703265,10,트랜서핑 시리즈 전부를 추천해야할 정도로 흥미롭고 인식을 확대해주는 책. 이 책은 트랜서핑 시리즈의 핵심만을 뽑아 정리해놓은 책인만큼 좀 더 이해하기 쉽게 되어있음.
9788935703265,10,｀트랜서핑의 비밀｀ 의 문을 열고 들어가 인생의 파도를 골라 타자!
9788935703265,10,"""매트릭스""에서 네오 앞에 주어는 빨간약... 그게 바로 이책이다."
9788935703265,10,새로운 세상이 있군요!
9788935703265,10,"눈의 위치를 바꿔 보니 세상이 달라진다, 잠재의식을 버려라, 신기하다..."
9788935703265,10,당신이 알고있는 시크릿을 양자물리학이란 과학으로 설명해준다.
9788935703265,10,자기계발서를 가장한 신비학 서적!
9788952206503,2,뻔한 이야기만 주구장창 늘어놓고 반복하는 책. 사이비종교 방불케하는 생각이면 다 이루어진다. 지금까지 읽은 책중에 최악의 책임
9788952206503,2,잘 풀린 사람들이 모여서 믿으라며 쓴 종교책
9788952206503,10,긍정적인 인간되기내안의 나를 다스리는 방법
9788952206503,2,신비주의를 뒤집어 쓴 신자유주의의 복음서 이 책보다 더 짜증나는 것은 이 책을 언급하며 주위 사람들을 쥐어짜내는 인간들이다오늘도 이런 인간을 만났다.자매품 (하면 된다)
9788952206503,10,이책을 읽고 저의 마인드가 변했고 실제로 도움도 많이받았고 생각지도 못한 행운도 저에게 다가왔습니다.생각만 하는게 아니라 행동도 해야 이루어 지는것 같아요
9788952206503,2,희대의 망상. : 흔한 성급한 일반화의 오류. 논증은 없다. 그저 교묘하게 설득할 뿐.
9788952206503,10,상상하고 감사하라. 끝
9788952206503,2,래리 킹 曰 ˝ 만약 당신들이 비전 보드 위에 내 사진을 붙여 둔다면 가서 그걸 부셔 버릴 겁니다. ˝
9788952206503,2,이런 책을 빨고 숭배하는 사람들의 지적수준은 박근혜급이라는 것이다 이 전체 책을 보면 부자가 될 것 같은 기운이 오니?ㅋㅋㅋㅋㅋㅋㅋㅋㅋㅋㅋ
9788952206503,2,이 거 잀을 시간에 그냥 다른 공부하는 게 꿈을 이루는 데 유익.
9788952206503,2,별 하나도 아깝다. 그냥 박ㄹ혜가 많이 좋아할 것 같은 책
9788952206503,8,몇년전읽은거라  잘생각이 안나지만..아직도 친정집에 있는책
9788952206503,4,내 마음가짐만 바꾼다고모든 것이 나를 위해 돌아가지 않는다는 걸모르는 어른이 있나?그냥 듣기 좋은 소리 모은마취약 같은 책.
9788952206503,8,난 주문을 외도 잘 안되던데. . 아직 내공이 부족한가. 그래도 어느 정도는 믿고 있다.
9788952206503,8,"주장을 설득하기 위한 근거는 허무맹랑하게 들릴 수 있으나, 삶을 이로운 방향으로 이끄는 시크릿임에는 틀림없다."
9788952206503,2,사이비종교도아니고ㅋㅋㅋ웃음만나옴.
9788952206503,6,그럴듯한
9788952206503,8,"이 책을 읽고 나서 긍정적인 마인드를 가지고 직접 실천하게 되면 얼마나 큰 삶의 변화가 자신한테 일어나는지를 알려주고 있는 것 같은데, 과연 맘 크게 먹고 행동으로 그대로 옮기게 되면 책의 내용대로 자신한테 놀라운 기적이 일어날까? 생각과 맘 먹기 나름이라고 여겨진다."
9788952206503,2,세계 여러 빈곤국가 특히 북한같은 곳에 이 책을 대량 보내 준다면 과연 그 나라는 빠른 시일내에 빈곤에서 벗어날 수 있을까? 그렇다고 자신있게 대답할 수 있는 사람은 아무도 없을 것이다. 국가전체경제에 있어 국민세금이 절대적인 비중을 차지하는 요즘 빈곤은 절대 개인 의지만의 문제가 아니다.
9788952206503,10,맞는 얘기인듯!그러나 습관들이기는 힘든..
9788952206503,10,좋아요 정말 자신감생겨요😁
9788952206503,10,자기암시 긍정의효과
9788952206503,8,"긍정적인 마음으로 목표를 세워 집중하면 이루어진다메시지 좋습니다 집중하면 단, 나 자신이 움직이고 노력하게 되겠죠"
9788952206503,10,끌어당김의 법칙으로 들어서는 입문서.
9788952206503,8,내용이 궁금하군요
9788952206503,8,믿어라 그럼 될 것 이다.
9788952206503,10,말이 필요업는 긍정적 에너지를 심어주는 책이다.
9788952206503,8,꿈을 꾸게 해주는 책. 온 우주가 나를 위해 존재하는구나 행복해지는 책이죠. 물론 믿고 그에 맞는 행동을 해야합니다.
9788952206503,10,비밀을 아는가
9788952206503,8,"살아가면서 희망이 없어질 때 힘을 주는 책 같아요.
읽고 나면 긍정적인 사고방식이 생기는 책이지요."
9788952206503,10,"끌어당김의 법칙은 많이 알려진 자기계발서이다.
많은 사람들이 끌어당김의 법칙을 사용하고 있고
또한 성공한 사람들도 있다. 끌어당김의 법칙은
경제상황이 어떻든 간에 상관없이 원하는 것을 얻을수
있는 법칙이다."
9788952206503,8,"읽으면 가슴이 두근거린다.
정말로 무언가가 이루어질 듯한 느낌을 갖게 해준다"
9788952206503,8,생각의 힘을 보여주는 좋은 책이다. 내가 이루고자 하는 방향을 끊임없이 생각하고 노력하면 내게로 이루어질 수 있을 것이다!
9788952206503,8,무언가 다시 시작할 때마다 펼치는 책
9788952206503,10,시크릿 한번은 읽어봐야 할꺼 같은 내용이다
9788952206503,8,"마음으로 진정 원하는 것이 이루어지는게 아니라.
끊임없이 상상하고 손에 들어있는 느낌을 계속 예단한다면
이루어진다는 내용에 감동했습니다."
9788952206503,2,우선 유명하구 어느정도 마음을 울림
9788952206503,6,간절한 것은 이루어진다
9788952206503,8,긍정적인 생각을 가지게 되었다
9788952206503,8,긍정이 중요한걸 한번더 생각하게 만들어줘서
9788952206503,8,모든 자기계발 서적의 기본개념을 담고있는 책이라고 생각해서 선택했습니다. 구체적이지는 않지만 인생을 사는 데 있어 큰 그림을 그릴 수 있게 해줬어요.
9788952206503,8,실천할 용기를 주는 책입니다.
9788952206503,8,"어떤 생각을 가져야하는지, 생각의 힘이 얼마나 큰지 중요한것인지 볼수록 느끼게되는책."
9788952206503,10,단순한 시크릿을 넘어 생활의 시크릿을 새삼 느끼고 실천하는 삶은 제 인생의 또다른 변곡점을 주었답니다.
9788952206503,2,자기계발서인척 하는 뉴에이지 종교서적.
9788952206503,10,한때 열풍이 불었던 책.  결국 긍정의 마인드가 중요하다는 결론. 어차피 세상이 내 뜻대로 되는 것은 아니니 optimistic하게 살자는 내용
9788952206503,2,이런 책 이제 싫다. 희망이나 감성보다 팩트를 보고 이성적으로 이겨내자.
9788952206503,8,단순한 원리를 다시금 생각하게 해주는 책
9788952206503,10,간절히 원하면 이루어진다! 힘든시절 읽고나서 많은 힘이 되었던 책. 앞으로도 이루고싶은 일이 있으면 간절히 원하는 주문을 외야겠다. 이책 강추.
9788952206503,4,자기세뇌는 구조에 대한 무지함을 낳는다.
9788952206503,8,가볍게 읽을만합니다.
9788952206503,10,"부담없이 편한 마음으로 한번 읽어볼 만함,"
9788952206503,8,"양자역학적 관점에서 일어날 수 있는 방식을, 마음과 태도에까지 연결시켜 전개, 타당성이 있는 내용이라 여겨진다."
9788952206503,10,《연금술사》의 해설서...쯤으로 여겨지는 유쾌한 읽을거리. 꼭!  연금술사를 먼저 권함.
9788952206503,2,차라리 하늘에서 돈 벼락이 떨어지기를 기대하는 것이 확률이 더 높다.
9788952206503,10,"30번도 더 정독한 내 인생의 최고의 책, 한두번 읽고 논평하지 마라."
9788952206503,6,"도움되는 부분 반, 위험한 부분 반."
9788952206503,10,긍정적으로 삶을 살게 하는 책!
9788952206503,10,목표 열정 도전 그리고 시크릿이다! 꼭 한번 읽어보시길
9788952206503,8,꿈꾸는 자는 꿈을 이룬다
9788952206503,10,시크릿은 제가 지금 읽고 있는 책인데요 아직 끝까지 읽지 못했지만 굉장히 재밌는책입니다 ㅎㅎ고등학생때에서 필독도서라고 나와있던 책이구요 제친구들도 정말 많이 읽어봤더라구요~~ 하지만 저는 이제 처음 읽어보게되었답니다 ㅠㅠ
9788952206503,8,비디오로 한번 본 후에 책으로도 읽고 있는데 생각보다 진도가 잘 나가진 않아도 긍정의 에너지를 끌어 오려고 노력 합니다.
9788952206503,10,정말 믿어 보시길 바랍니다.
9788952206503,2,뻔한 이야기를 마치 대단한 발견인 양 지나치게 과장되고 피력학 있음. 사기성 종교설교를 방불케해서 거부감마저 느껴졌다. 솔직히 최근 몇변간 선택한 책중에 최악입니다.
9788952206503,2,온갖 미사여구로 독자들을 유혹하지만 정작 실용성은 없는책
9788952206503,2,"나폴레온 힐, 아니 그 이전 바이블의 마태복음까지.. 예전부터 뻔하게 말하던 바라면 이루어진다는 종교적 믿음을 재포장해서 울궈먹은 책에 불과하다."
9788952206503,8,빨리오네요
9788952206503,2,말하고자 하는내용은 단 한줄.....200페이지로 써 놨다....
9788952206503,2,믿으면 이루어진다. 이 점에서 이 책은 종교 경전과 다를바 없다. 현대인들이 버려야 할 것 중 하나. 현대는 합리와 이성의 시대이지 무분별한 믿음의 시대가 아니다.
9788952206503,8,굳게 믿고 그것을 구체적으로 상상하면 이루어 진다.
9788952206503,10,긍정적 마인드!! 힘들때 읽으면서 미치도록 자신을 사랑하게 되는책!!
9788952206503,2,"이 책의 아쉬운 점은 믿으면 이루어진다고 그 한마디를 길게 말한다...
가장 중요한 것은 믿는 것을 얻기 위해 행동하는 것인데...
희망고문같은 책..."
9788952206503,10,"최고의 책!!! 입소문을 듣고 책을 구매하였습니다.
우리주변에 흔한 내용을 사람들은 깨닫지 못한거 같습니다. 
깨닫지 못한 부분을 책으로 차근차근 알려주어서 생각도 많이 하게되었습니다."
9788952206503,10,선물용으로 몇번째 산 책. 의심하지 말고 믿어라. 믿는자에게 구원이 있을지니. 종교란 그런것이다.
9788952206503,10,설명이 필요없는 추천도서! 혼자읽기는 아까워 선물용으로 또 샀습니다.
9788952206503,10,"이 책은 정말 보면 볼수록 끌어당김의 법칙이 창조해내는 사실들이

사실 같기도 하고 거짓 같기도 하고 아리송 하다 그도 그럴것이 마법같은 일들의 이야기만 가득 실려있다"
9788952206503,2,예전엔 맹신했지만 지금은 아니다. 생각만으로 다 이루어진다고? 행동을 해야 비로소 이뤄진다.
9788952206503,10,"부정적인 사고를 많이 없애준 책ㅋㅋ
친구한테도 지금 빌려줬는데 다 읽고 같은 생각을 하기를 바라는 책 ㅋㅋ"
9788952206503,10,론다번이 하는 이야기를 잘 들어보자. 그리고 그 이야기의 근거를 잘 찾아보자.
9788952206503,2,터무니없다. 틀린말은 아니지만 풀어내는 방법에 있어서 실망을 안겨준 책.
9788952206503,2,"공상과학소설
물은 답을 알고 있다와 같은 류의 책"
9788952206503,8,"｀긍정의 힘｀을 무시하지 않는다. 그러나 긍정만이 모든 것의 해법이 아니라는 것도 안다. 비밀이라고 하지만 이제는 너무 흔하게 된 그 비법이, 실제로 우리의 삶을 제발 바꿔줬으면 좋겠다."
9788952206503,10,성공학에 대한 현대인들의 지침서 역활을 현재 하고있지 않을까 생각한다.
9788952206503,10,긍정적인마음만으론 되는게 아니라 긍정적인생각을 하니까 저절로 실천하게됨
9788952206503,10,평생 두고두고 보게 될 책.
9788952206503,10,비밀을 공유해요.  모두가 잘 살았으면 해요
9788952206503,6,지금 이 순간 자신의 인생이 실패라고 느껴지는 영혼이 있다면....
9788952206503,8,"오랫세월을 외국 생화을 하고 귀국해서 보니, 나만 이책을 몰랐었네,,,"
9788952206503,10,워낙  경제 .경영분야에 관심이 많아 구매하려고 장다구니에 담아났습니다 나에게
9788952206503,8,다른 사람책 빌려서  다 읽고 나서 또 읽고 싶어서 책을 사게 되었어요.공감가는 책..
9788952206503,4,긍정 무조건 긍정 화나도 긍정. 긍정이 무조건 좋은 것만은 아니다.
9788952206503,10,우연히 찾은 이책은 나의 생각에 강렬함을 보태어줬다. 알면서 표현못한 그무엇찾았다
9788952206503,8,삶을 다시 돌아볼 여유가 생겼어요.
9788952206503,8,엄마랑 같이 보는데 좋은 책 이예요.
9788952206503,10,친구의 추천으로 TV다큐를 먼저 접했는데.. 이해하기 쉽게 만들었더군요. 전 추천이요
9788952206503,10,원하는 대로 이루어진다는 말 믿고 읽어볼래요~!
9788952206503,10,설마 그럴까... 보단 정말 그렇게 될꺼야 라고 ....^^
9788952206503,6,글쎄...
9788952206503,4,기대만큼은 아니다
9788952206503,2,뉴에이지로 가득한 책. 기독교인은 절대 읽지 마세요
9791186274798,10,노인인이 아니더라도 이 책은 노후관리를 위해 읽어보는것이 좋다.일종의 노인으로써 삶의 비전을 제시해준다고 할까?어차피 누구나 나이들고 약해지는데 나이듦을 비참하게만 생각하게 하지 않고 책임감을 가질수 있게한다.
9791158888398,10,환경을 생각한다는 취지의 책인데 실물 종이책 말고 전자책도 같이 나왔으면 더 좋았을 것 같아요! 전자책 기다려봅니다.
9791158888398,10,"쓰레기를 버릴 때도 늘 헷갈렸던 내용을 쉽게 알려주어 자주읽게되요우리의 생활에 밀접한 소비의 장보기, 일회용품의 위생용품 , 외출시 사용대체품, 외식과 먹거리 쓰레기 줄이기 실천방법과 팁 등 많은 정보들이 있어 추천드려요."
9791158888398,10,진정한 지구사랑 실천 책!!기대됩니다
9791158888398,10,제가 찾고 있던 책입니다. 구체적 실천 방안도 나와있는 것 같아 기대됩니다.
9791158888398,10,평소에 실천 몇 가지하며 살고 있는데 이 책에선 또 다른 방법들을 더 알려줄 것 같아 기대됩니다.
9791158888398,10,구체적인 실천 가이드가 있어서 막연했던 제로웨이스트 쉽게 동참할 수 있을 것 같아요!
9791158888398,8,실천가이드로 읽어보고 싶습니다.
9791158888398,10,"지구를 위해, 환경을 위해, 작은거라도 내가할 수 있는 일을 찾아보고 싶었다. 이 책이 도움이 될 것 같고, 자극이 될 것 같다!"
9791158888398,10,알고있지만 실천은 어려운 환경적 습관. 이 책을 통해 알고 있다고 생각했으나 제대로 알지 못했던 환경문제에 대해서 알고 싶습니다.
9791158888398,10,쓰레기 차~암 줄이고 싶은데 말이죠. 잘 읽어보겠습니다. 기대되어요~
9791158888398,10,환경문제에 관심갖고 있는 요새 너무나도 기대되는 책입니다! 저같은 평범한 사람들이 무엇을 환경을 위해 할 수 있는지 읽어보고 실천해보고싶어요!
9791190630344,8,부자의 말센스는 어떻게 다를까? 궁금도 했고 어떤 위협에도 굴하지 않고 살아남을 수 있는 남다른 말센스의 비결을 좀 더 세세하게 읽어 보고싶었다.
9791190630344,10,"잘사를 하시는 분이라면, 특히 사람 상대하는 일을 하시는 분이라면 꼭 읽어봐야할 책이다. 김주하님 유튜브 강의를 같이 보는것도 도움이 된다."
9791190630344,10,업종은 달라도 사람 대 사람의 일에서 본질은 같다는 것. 책을 읽으면서 이렇게 밑줄을 많이 그은건 처음인 듯 하다. 한마디 한마디가 주옥같아서 여러번 읽을 책. 조만간 종이책으로도 사야겠다.
9791189430207,6,2020: 도비가 되기 위하여. near future: ˝STAY!!!!˝
9791189430207,10,"리뷰 잘 안남기는데 혹시나 저자분들이 보실까 감사의 의미를 담아 남깁니다. 아무도 해주지 않았고 어디서도 듣지 못했지만, 꼭 필요한 이야기입니다. 대학원생의 막연한 불안감은 덜고 나를 돌아볼 수 있었습니다. 대학원생의 바이블이라고 해도 손색이 없습니다. 책 만들어주셔서 감사합니다."
9791189430207,10,"대학원을 졸업한 뒤에 읽었는데도 큰 도움이 되었어요! 무엇보다 제목에 끌려서 보게 되었는데, 주변에 대학원 진학에 관심있는 분들께 꼭 추천하고 싶습니다!!"
9791155056608,2,다 좋은데 카드보관 하기에 적절치 않은 종이케이스가 많이아쉽습니다.시간이 지나면 너덜너덜 해질 게 뻔하니까요.다른 상품들처럼 틴케이스로 해주시죠.틴케이스를 추가로 구매해야 하는 불편함이 적지 않네요.
9788974256425,10,"인생에서 여유있는 삶을 원한다면, 이 책을 읽어보는 것도 좋다.https://m.blog.naver.com/gkb5786/221680121941"
9788974256425,10,실행하라. 그러면 힘을 얻게 되리라.
9788974256425,10,"말이 안되는 얘기, 호구되는 일인 것 같지만....보상을 바라지않고, 보상에 연연하지 않고 일하는 습관과 태도로 일을 하는 것이 매우 중요합니다. 무엇을 하든 그런 식으로 하면 빠르게 성장할 수 있고, 그러다보면 차별화되어 더 높은 자리도 가고 보수도 많아집니다. 명확한 목표까지 더하면 굿~~"
9788974256425,10,이 책이 자기계발서의 원조인 느낌인 것  같아요!꼭 한번쯤은 읽어봐야 할 책인 것  같습니다.저는 개인적으로 일단 도서관에가서  읽어보고 괜찮은 책은 구입하는데  구입한  책입니다.
9788974256425,2,진부하다
9788974256425,10,부의 문을 열어주는 책....
9788974256425,10,"보상을 바라지 않고 일하는 습관, 명확한 목표, 부자가 되겠다는 강한 신념을 바탕으로 열심히 살아가면 반드시 부자가 될 수 있다는 저자의 철학에 깊은 감명을 받았다. 진정 부자가 되고 싶다면 이 책을 반복해서 읽고 행동으로 실천해 보길 바란다."
