ISBN13,rating,review
9791196015299,10,명상에 대해서 쉽고 편하게 소개해준.ㄴ 책이에요.일러스트 덕분에 더 잘 이해할 수 있었어요어렵게만 생각했던 명상이 부담없이 느꼈어요 감사합니다
9791196015299,10,"지금 이 순간 나를 위해 할 수 있는 최고의 마음 운동이 명상이란 걸 알려준 책. 명상을 궁금해 하던 이들, 명상을 모르던 이들 그 누구나 막힘없이 읽을 수 있는 책이다. 기분이 안 좋을 때 이 책부터 펴고 하나둘 따라해보면 신기하게도 바로 흔들리던 감정이 잡힌다. 이제 명상은 필수다!"
9791186320792,10,주위에서 추천해줘서 구입했는데 너무 기대됩니다. 감사합니다.
9791186320792,10,아나운서라 역시 읽어볼만 합니다추천
9791186320792,10,아나운서가 쓴 말하기특강 책이라니 꼭 한버 읽어보고 싶네요..
9788957363461,10,"가장 난해한 질문이겠지만 이 책을 통해 세분화 되고 무겁지 않은 질문에 답하다 보면 퍼즐을 맞춰가는 즐거움으로 결국 자신만의 큰 그림을 보게 된다. 명확한 답은 아직 멀었지만 조금씩 찾아가고 있고, 무엇보다 내가 솔직해지기를 원한다"
9788957363461,8,"특히 매력은 ‘과거-현재-미래‘순으로 이어진다는 것. 그리고 과거부터 나를 끄집어내며 현재를 바라보고, 앞으로 미래에 내가 그리는 방향으로까지 이어지도록 질문을 던져준다.이 책은 한 페이지 한 주제에만 집중하게 페이지 구성이 되어있다. 그래서 하루에 1페이지씩 온전히 나와 마주할 수 있다."
9788957363461,10,나의 과거를 돌아보고 나를 알아가는 책
9788957363461,10,나를 찾아가는~ 나를 알아가는~ 나를 되돌아 볼 수 있는 멋진 다이어리북^^
9788957363461,10,"나는 누구이며, 어떻게 지금에 이르렀으며, 어디로 가는지 자기 자신에 대해 알고자 하는 분들에게 추천해요. 자기 자신을 정확히 알 수 있는 좋은 책입니다. 하지만 아무에게도 공유하면 안됩니다."
9788957363461,10,가장 솔직한 나를 찾을 수 있는 시간과 기회를 주는 책이었습니다!
9788957363461,10,나를 알게 해주는 다이어리북이라서 그 동안 깨닫지 못했던 것과 나를 소중하게 생각하는 마음을 느끼게 해 줄 것 같습니다. 꼭 읽어보고 싶은 책이라 기대가 됩니다.
9788957363461,10,내 자신에게 솔직하다면 구입하세요.하지만 자신의 일기장보다 솔직하게 적을수 있을까요
9788957363461,10,"코로나로 집에만 있는 요즘 우울이 찾아올 때, 이 책을 찾아들고 나에 대해 생각하고 기록하는 시간을 가지는 것도 좋을 것 같습니다!"
9788957363461,10,Q&A  a day  사용해보고 참 좋았는데 그 책을 넘는 흥미로운 다이어리 북이 나왔네요.완전  기대됩니다.
9788957363461,10,나에 대해 돌아보고 깊이 생각하게 해줄 좋은 책일 것 같아요.미국과 유럽에서 인기있었던 다이어리북이라 더 기대가 되네요. 한국서도 대박나길 바랍니다.
9788957363461,10,어떤 질문들이 있을지 엄청 궁금하네요.과연 적고도 불태우고 싶을지 소장하고 싶을지 모르겠지만요 ㅎ
9788957363461,10,당신은 누구세요? 라는 질문이 생각납니다. 이름뿐만이 아니라 어떤 점에서 나란 존재를 표현할 수 있을지? 이런 질문을 던지는 책이기에 새롭게 찾을 내가 기대됩니다!
9788957363461,10,ㅎㅎ 이책 틱톡에서 봤는데 한국어판 소식 듣고 사러왔어요. 표지도 너무 예쁘네요. 써보고 괜찮으면 신년 선물로도 좀 살까 해요.
9788957363461,10,예전에 유행했던 100문 100답이 생각나서 주문했습니다! 평소에는 생각해보지 못했던 주제들에 대해 고민해보고 답해보면서 나 자신에 대해 좀 더 알게 될 것 같아요! 연말이지만 모임도 못하고 여행도 못 가니 요런 소소한 일들 하면서 시간 보내려고 합니다. 얼른 배송오면 좋겠어요^^
9788957363461,10,표지가 넘 예뻐요~ 딱 제가 원하는 다이어리북입니다 ♡
9788957363461,10,쓰고 태우라는 마지막 말이 엄청 강렬하네요. 나를 돌아볼 수 있는 책일 거 같아 기대됩니다!
9791197296604,10,동서양의 이론을 모두 소개해 더욱 다양한 관상에 관한 이야기를 접할 수 있다. 관상에 관한 다양한 지식을 접하고자 한다면 도움이 될것이다.
9791160075564,10,"보통의 자기계발서와 다르게이책은 인터뷰 형식으로 진행되는데대화를 읽는게 신선하고 좋다결국 얘기하는건 항상 그 아는내용인데도풀어가는 방식이 달라서 더 마음에 와닿고 좋다자기계발서를 쓰고,성공한사람에게 ..내가 질문하고 싶었던걸 해주는거 같아서 가려운곳 긁어주는듯한느낌이다."
9788954755955,10,"제목에 한 번 놀라고, 책 내용에 한번 더 놀란다.70년생과 90년생을 편가르는 것이 아닌, 함께 나아가는 방향을 제시하는 책90년생으로서 이런 작가같은 70년생분들이 있다면 회사가 재밌지 않을까 싶다.한 줄 한평. 우리 회사 부장님에게 신입들에게 꼭 추천하고 싶은 책"
9788954755955,2,생애 최악의 책입니다. 70년대 생들이 만만합니까? 제일 치열하게 최선을 다해 ... 힘든 삶을 버텨내고 있는 우리나라의 40대들을 무시라는 책입니다ㅡ 90년대생들 ... 이런 책들 덕에 더 오만해 집니다.  심지어 이책을 2년차가 20년차 선배에게 1월 첫 출근일 선물이라고 던져주네요ㅜㅜ
9788954755955,8,90년대생이 온다. 2000년대생이 온다를 패러디한 ‘70년대생이 운다‘이다. 세칭 ‘꼰대‘들의 상심한 마음을 토닥토닥해준다.
9788954755955,6,재미있는 관찰이었습니다
9788954755955,10,70년대생의  항변 같지만 반대로 적극적으로 소통하고 이해함으로써 좋은 리더가 되길 바라고 인간관계에 있어서 성숙함을 가지도록 도와주는  교양서내요^^
9788954755955,8,"후배들과의 관계에 대해 고민하는 요즘인데, 참고가 될 책인거 같아요. 표지가 위트있어요!"
9788954755955,2,책 참 쉽게 쓰네요
9791190015295,8,기대돼요
9791190015295,10,긍정성도 훈련이 필요하죠!
9791164453603,10,"귀엽고 아담한 사이즈, 램스킨으로 오래 지나도 고급스러운 책의 겉표지, 앤이 나에게 하는 질문들도 굿!!"
9791189088224,8,"우리는 흔히 주변에 가까이 있는 사람, 가족이나 친구들, 혹은 직장 동료들의 감정을 무시하는 경향이 있다. 모두 소중한 사람들이다. 그들을 아끼고 사랑하고 싶은 독자들의 일독을 권한다"
9791190826235,6,밑줄로 기억하고 싶은 문장이 그리 많지는 않다
9788934990611,10,"⏺ 주역을 오랜 시간동안 연구해 온 작가가 아이를 운 좋은 아이로 잘 키우는 방법에 대해 설명한 책이다.⠀우선 부모가 ‘운‘이 무엇인지, 어떻게 하면 내 아이에게 좋은 운이 오는지 알아야 내 아이에게 좋은 운을 줄 수가 있다.⠀⏺ ‘운‘을 너무 역학적이고 철학적인 심오한 의미를 지니는 대상"
9791191053043,10,초연결시대. 많은 사람과 연결하지 않으면 살아남을수 없는 시대가 되었다. 연결역량이 뛰어난 사람은 파워와 돈을 가지게 되는 시대다. 이런거 생각하면 정말 불안해진다. 그래서 읽어보려고한다. 목록을 보니 읽고싶어진다. 구매자가 남자40대가 가장 많네.
9791191053043,10,이 책에서 나온 유튜브 세상의 변화와 전망을 보면서 깜짝 놀랐다. 세상이 모두 유튜브 중심으로 돌아가는 것 같고 유튜브가 마치 살아 움직이는 거대한 생명체 같았다. 특히 이 책에서 선정한 77개의 유튜브 채널을 보면서 나도 나만의 유튜브 채널을 갖고 싶다는 욕망을 강하게 느꼈다.
9791191053043,10,도움이많이 되네요초보유튜버인 제게 도움이되네요
9791164160679,10,퇴사를 하고 1인 기업가로 수익화할만한 것을 찾고 있다가 이 책을 만났다.sns 플랫폼으로 나를 브랜딩하고 수익화로 연결하려고 하는데 생각만큼 쉽지 않았다.이 책은 나처럼 시행착오를 겪다 1인 기업가로 성공한 사람들의 사례담이 대거 수록되어 있다. 실질적으로 도움을 받을 책이라 생각한다
9791164160679,10,이 책의 가장 큰 장점은 우리가 무지하고 몰랐던 다양한 분야의 사례를 꼽아서 설명해주시기때문에 다방면으로 창업 사례들과 마케팅 사례들을 알수있는것이 좋았어요:)
9791196933142,10,좋은영향을 받아 긍정에너지로 저도 백일의기적을 믿어보려고합니다^^
9791196933142,10,누구나 그렇듯 저도 꼭 이루고싶은 소원이 있는데요소원을 이루고싶은 생각과 소원을 이룰수 없다는 의구심을함께 불러들여 이룰수없었다는걸 이책을 통해 알게 되었어요소원을 이루고싶지만 제대로된 방법을 몰라
9791196933142,10,도서이해하는데아주큰도움이되었습니다
9791196933142,10,한번쯤 읽어야할 책. 인생을 다시 생각하는데 도움이 됩니다.
9788901244464,10,책보고 실행중인데 노트가 나와서 너무 좋아요ㅡ 바로 구매 합니다
9788901244464,2,어쩜 디자인이 비커밍 노트랑 비슷하네..
9791190776066,8,코로나로 지친 몸맘들에게 간단하고 편안하게 쉼터를 안내해 주는 책! ^^
9791190776066,10,"최근에 처음으로 요가를 시작했어요. 아직 손이 발끝까지도 닿지 않는 초보자이지만, 욕심 내지 않고 호흡만 깊게 따라가는 것만으로도 몸이 편안해지는 걸 느껴요. 새로 시작한 요가와 함께 이 책을 읽고 싶어요. 지금, 여기 있는 나를 느끼며 매일 내면의 고요함을 찾아 보려구요."
9791190776066,10,"명상의 목적인 평온. 이 책을 통해 마음의 평온, 신체의 평온을 얻길 기대합니다."
9791190776066,10,불안하고 흔들리는 마음을 명상으로 잠재울수 있게 배울수 있는 책이라 기대해요늘 마음으로만 명상하고 싶다고 생각했는데 어떻게 시작해야할지 모르고 궁금했어요
9791190776066,10,명상이나 요가 배우고 싶은데 제대로 배울 기회가 없었어요. 혼란한 마음을 가진 요즘 1일 1명상 1평온에서 제대로 배워보고 싶어요
9791190776066,10,요가는 하고 있는데 명상도 시작하고 싶어서 이 책 읽어보고 싶네요!! 하루 한번으로 맘이 평온해지길기대합니다~~
9791190776066,10,오롯이 나의 마음을 알수 있고 몸을 편안히 만들어 주는 1일 1명상이라는 것이 평온을 만들어준다는 것을 많은 사람들에게 알려주시는 디아님의 이야기를 알수 있어서 너무 좋아요.
9791190776066,10,체육관에서 운동을 통해 몸을 건강하게 하는 것처럼 명상을 통해 우리 정신과 마음도 건강하게 유지해야하는 것 같아요 :-) 책을 통해 1일 1명상을 하고 싶어요. 저는 주로 빗소리나 싱잉볼 소리를 틀고 명상을 하는데 책을 읽으면 조금 더 규칙적으로 명상을 할 수 있을 것 같아요
9791190776066,10,3년넘게 독학으로 명상을 해오지만 여전히 감이안오던차에 이 책 제목이 너무나 끌려서 이분 전작들을 읽었어요. ˝사과를 먹을땐 사과를 먹어요|˝딱봐도 명상관련책이구나싶었고 내용도 무척 와닿았습니다. 몸과명상관련책도 쓰셨더라구요. 그래서 믿음이 갑니다. 이번엔꼭명상을 내꺼로만들고싶네요
9791190776066,10,명상이 좋다는 것은 알고 있었으나 선뜻 해보지 못 하고 있었습니다. 1일 1명상 1평온 책제목처럼 명상을 책  보고  배워 마음의 평온을 갖고 싶습니다.1일 1명상 1평온 책이 무척 기대됩니다.
9791190776066,10,"명상을 하고 있어 기대가 되는 책입니다. 평온, 평화로움 속으로 들어가는 명상은 행복을 꿈이아니라 현실로 만들어주는 건강한 방법이죠. 참 기대가 되네요"
9791190776066,10,명상어플을 얼마전에 구입해서 사용중인데 무척이나 좋더라고요. 하지만 매일 하기가 어려워지는 1일 1명상 1평온과 함께 30일 명상도전하고 싶어요!
9791190776066,10,"1일 1명상 1평온명상을 하겠다고 다짐하시만 쉬울것 같은 그 고요한 머무름이 결코 쉽지 않습니다. 나를 위한 30일 명상수업이라니, 책을 따라하다보면 명상이 습관화되고 평온이 찾아올 것 같아 무척 기대됩니다."
9791190776066,10,심란한 시기. 명상이 절실합니다.코로나로 인해 아이들과 계속 같이 있으니숨이 턱 막히고 어지러울때가 많습니다.저를 돌볼수있는 책 같아요. 기대해봅니다~~
9791190776066,10,"COVID-19로 인하여 사회와의 거리를 두고 있는 시점에 스스로를 돌아볼 기회인 듯 하네요. 하루 명상 한번을 통하여 변하는 모습을 기록해두고 싶네요. 나 스스로가 어떻게 변할지 모르겠지만, 어제보다 조금 더 나은 내가 되기를 바라는 마음에 읽어보고 싶은 책입니다."
9791190776066,10,출판사에서 연재하는 글을 읽으면서 나도 모르게 평온해졌어요. 수많은 명상책보다 우리정서에 꼭 맞는 책입니다. 너무 궁금한 책입니다.
9791190776066,10,"너무 빠르게만 외치는 요즘, 만성 피로를 달고 사는 현대인들에게 필요한 힐링에서 가장 친근한게 바로 명상인 것 같아요 그래서 기대가 되는 책입니다!"
9791188331901,8,기다렸는데 새로 나와서 반가웠음.음..구판이 속지 더 짜임새있고 칸이 넓어 메모하기도 좋고 글귀도 여러군데 있고 더 디테일하고 알찬 느낌. 컬러도 구판이 더 취향에 맞음. 기다렸는데 아쉬움. 구판도 같이 만들어주세요!
9788947545921,8,좋은 설명은 신뢰를 이끌어낼 뿐만 아니라 주위 사람들까지 행복하게 해주는 셈인데현대 사람들은 더 이상 긴 설명에 집중하지 않고 필요한 정보만 빠르게 얻기를 원하는 시대로 바뀌었고그렇기 때문에 상대를 내 말에 집중시키는간결하고 더 인상적이면서도 핵심을 명확히 전달하는 설명 전략책
9791162541494,2,돈받고 책 소개하는 작가의 추천이라...
9791162541494,2,ㅜㅜ돈이아깝습ㄴ니
9791162541494,4,저자는 이책을 써서 더 부자가 되었을거 같다. 나같은 사람이 사 읽어서..  다 읽는데 1시간도 안걸리는 책..  다 아는 내용의 자기.개발서 같은 느낌이랄까..
9791162541494,2,책을 일주일만에 다 쓴 건 자랑이 아니다. 실제 사례도 없고 주장뿐이라 얄팍함.
9791162541494,8,요즘은 부자가 되는 것에 대해 관심이 많아 부와 관련된 책을 많이 읽고 있는데 이책은 첫부분은 흥미롭다가 뒤로갈수록 뭔가 2% 부족한 것 같은 느낌이 들게 하는 책이다
9791162541494,2,김새해 작가 추천 역시!!!! 뒷광고 빨;;
9791162541494,8,"부자를 꿈꾸자들을 위한 가벼운 자기 개발서, 10회독 해보라 안내하는데 1회독이면 충분한 내용~"
9791162541494,8,"돈에 의둘려 사는 삶이 아닌, 돈의 주인이 되는 삶에 대한 이야기가 실려있다."
9791162541494,2,오늘도 난 마케팅에 속았다.. 여백 진짜 많아요. 내용도 없고.. 오프라인 서점에서 봤다면 안 샀을 텐데 하..
9791162541494,2,자기계발서 관련 책만 수십권사고 읽어봤지만 이 책은 정말 돈아까움 ㅠㅠ..알라딘 100자평 처음써봄..바로 중고시장으로.. 나도 다른분처럼 30분에 다읽음 핵심없고 기존책들 짜집기 그것도 깊은 내용은 없음..유튜브는 광고였나봄 김새해작가님 구독취소함..아무리 광고여도 이 책은 너무함
9791162541494,10,요즘같은 때일수록 기본이 되는 책을 꼭 읽고 싶다. 빨리 받아서 읽어봐야지~~
9791162541494,2,"차라리 김승호 씨의 ‘돈의 속성‘을 읽는 걸 추천한다. 초등학교 시절 유행했던 자기개발책을 본 느낌이다. 15000원 정도의 책을 30분 정도 걸리는 시간으로 완독했다. 여백이 많고 가볍다. 저자는 책을 일주일 만에 완성 했다고 하는데, 진짜 그런 느낌이다.  글자 수 제한이라니... 더 말리고 싶은데"
9791162541494,2,저자가 1주일만에 쓴 책.. 나는 다 읽는데 10분도 걸리지 않았다. 이렇게 인사이트가 없는 자기개발서는 정말 처음이다. 20여년 알라딘 고객으로 처음 리뷰남기는 책. 적립금 써서 3불에 샀지만 30센트를 주기도 아까운 책이다.  세이노칼럼 10개보다 못한 책이다.
9791162541494,10,10대 20대들에게 추천
9791162541494,10,"세계 1% 부자들은 정말 획기적인 아이디어로 성공하는줄 알았는데, 알고보니 정말 작은 생각의 차이에서 다르다는 걸 알수 있을 거 같아요. 짧고 명확안 문구도 눈에 딱딱 들어와서 더 인상적인 책!"
9791162541494,4,사려고 하다가 김새해 작가 추천 있어서 마음 접었네요 ㅠㅠ
9791162541494,10,따로 노트에 적어 두고 싶은 문장들이 가득하다. 모쪼록 천천히 읽기를.
9791162541494,10,기본적인 내용인데도 꽂히는 말들이 많다. 나도 투잡 말고 파이프라인을 연결시키는 방법을 고민해봐야겠다
9791162541494,10,필요한 핵심만 잘 담겨진 책 기대했던대로 좋네요!
9791162541494,10,욘스마인드가 새로운 이름으로 ....감사합니다
9791162541494,10,기대별점입니다.
9791162541494,10,역시 기대했던 좋은책입니다
9791162541494,10,요즘 부자에 관련된 책이 많이 나오더라구요... 아무래도 다들 먹고 살기 어렵고 힘들어서 그런거겠죠?월급에 전전긍긍하는 제 자신이 너무 괴로워서 이 기회에 마인드라고 함 닮아보고 싶다는 그런 생각으로 읽어보려구용
9791162541494,8,부에 관한책을 여러권 읽어봤지만 공감가는 목차에 부분이 많네요 지금 읽고있는책 다읽은후 꼭 읽어보려합니다
9791162541494,10,구입하려구 장바구니 담아둔 책중 하나인데요. 다른 경제도서의 필요한 액기스가 한권에 다 담겨있는것 같아요. 좋은책은 목차만 봐도 알겠더라구요.
9791162541494,10,욘스 마인드 구하기 어려웠는데 중고책도 10만원정도에 거래되고 있고 이렇게 새 책이 나와서 상당히 기분좋네요 구하려다가 비싸서 안사고있었는데 제목이 바뀌었는데 우연히 잘 발견했네요 바로 지릅니다
9791188314508,10,요즘같은 시대 젊은이들에게 자기계발에 대해 좋은 양식이 될것 같습니다.잘 읽었습니다.
9791188314508,10,집에서 있는동안 가볍게 읽어보려고 구입했는데^^읽는 동안 몰입했어요~복잡하게 생각하고 복잡하게 사는 현대인의 바쁜생활 단순함에서 오는 미학을 생각하게 만들어준 책이었습니다^^
9791188314508,10,화려한 것 보다는 단순한 디자인이 더 어려웠는데 도움이 된 것 같아요~ 생각도 변화되는 듯하구요ㅋㅋ
9791188314508,10,예전엔 화려하고 스킬적으로 멋진 디자인들이 유행이였는데 요즘은 단순한게 유행이잖아요. 그걸 어떻게 표현해야할지 너무 막막했는데 도움이 된거같아요..!! 비워내기..!!!
9791188314508,10,현재 시대같이 복잡한것이 만연하다고 느낄때 읽으면 도움이 많이 되는거같습니다. 단순함을 추구하시는 분들에게 추천합니다.
9788901242088,6,"서핑에 관심 있는 나로서는 딱 중반 정도까지는 재미있게 읽었다. ‘못하는 것에 도전하고 그것을 지속하는 것의 중요성‘을 이렇게 신선하게 풀어가다니, 하면서. 근데 뒤로 갈수록 점점 모성애 넘치는 감정을 뿜으면서 책이 산으로 가는구나. ‘아, 낚였다‘ 싶을 만큼."
9788901242088,10,"80페이지쯤 읽고 있다. 저자의 메세지가 (기대하지 않았는데) 상당히 의미있고 깊이도 있다. 더 읽어나갈 부분이 기대된다. 나에겐 번역도 무리가 없고, 잘 읽힌다."
9788901242088,4,소재는 신선한데 군데 군데 번역이 좀 부족한거 같아요
9791197028885,10,‘복식호흡? 발성??? 목소리에 좋다는건 아는데 어떻게 하는거지?‘ 고민하는 사람들이라면 꼭 읽어야할 서적!♥ 직장을 다니며 자기계발하고 싶었던 나에게 꼭 맞는 책이었다. 21일 트레이닝하며 어떤 변화가 생기는지 일지도 작성할 수 있고 낭독연습을 해볼 수 있는 글도 매우 재밌다!^^ 꼭 한번은 읽
9791197028885,10,"믿고 따라하는 우지은 작가님의 책! 신간이 나왔다는 소식을 듣고 바로 서점으로 향했습니다. ^^ 목소리 훈련이라는 것을 30일 완성 목소리 트레이닝으로 처음 접하게 됐었는데,힐링 보이스도 역시나! 유익한 정보 뿐이네요 ^^ 감사합니다!"
9791197028885,10,목소리가 좋아지고 싶어서 추천 도서를 찾던 도중 힐링 보이스를 알게 되었어요. 목소리에 대한 자신감이 생기고 명상과 함께 읽다보면 정말 치유가 되는 감정을 받았습니다. 앞으로 더 좋은 목소리로 많은 사람들에게 영향력을 전달할 수 있도록 하겠습니다. 감사합니다. ^^
9791197028885,8,목소리가 항상 작고 톤의 높낮이가 없어서.. 고민하다가 책을 알아봤습니다. 우지은의 힐링보이스책 새로 나왔던데.. 너무 유익하네요. 감사합니다.
9791197028885,10,"단순히 아나운서같이 멋진 목소리를 만들어내는 방법에만 치중한 내용이 아니어서 좋았습니다~!내 몸과 마음의 상태가 어떤지에 따라 고스란히 표현되는 것이 목소리였다는 사실..유튜브에 보니 명상 자료도 있더라고요!나의 몸과 마음을 들여다보고, 진짜 내 목소리를 찾아 스피치 할 수 있기를!"
9791197028885,10,"제 돈주고산 후기입니다. 목소리는 눈에 보이지 않는 스펙이죠. 성공하고 싶으신 분들,,, 목소리 중요합니다. 제가 요즘 회사에서 너무 많이 느껴요.직급올라갈수록 회사내 미팅이나 발표시에 목소리 진짜 중요합니다.. 지인에게 선물하려고 한권 더 구입합니다~!!!♡♡♡"
9791197028885,10,"우지은 작가님의 책은 믿고 구매하게 됩니다. 말도 잘 못하고, 아이 같은 목소리에..자신감도 없어서 여러책을 찾다가 우지은 작가님의 책을 접하게 되어었는데, 정말 도움 많이 받고 변화되었습니다. 역시 이번 신간도 구매하길 잘했다 생각이 드네요, 좋은 책 내주셔서 정말 감사합니다!"
9791162541432,6,마인드 바로잡는 용도로 한 번 읽을만 합니다.
9791162541432,2,핵심은 없고 자기자랑이 대부분이다돈이 있는 사람을 위한 책이다
9791162541432,10,부에 대한 가치관과 사고를 정립하기 좋은 책.
9791162541432,10,"월급만으로는 절대 부자가 될수 없는 사실을 깨달은 저자의 큰 깨우침들을 아낌없이 풀어놓은 감사한 책. 특히나 ‘가격결정권‘을 손에 넣어야 한다는 점의 강조와 부업이 아닌 본업에 집중하여 큰돈을 벌것, 왜 부자는 일등석에 타는지에 대한 이야기들은 너무나 인상깊고 큰 도움이 되는 이야기였다."
9791162541432,8,"자본주의 세상에서 부자란 무엇인지에 대한 정의를 내려본 적이 있는가? 이 책을 읽고 부자가 무엇인지, 어떻게 부자가 되는지 알게되었다. 돈을 대하는 자세, 물질적인 부자를 너머 부자의 정신적인 가치까지 아는 사람은 얼마나 될까. 어려운 일이 아니라 그저 열차에 올라타는 선택만 하면 된다."
9791162541432,4,너무 뻔하고 평범한 내용입니다
9791162541432,4,기대할  것이 없는 평범한 내용
9791162541432,10,"어느 날 갑자기 벼락 부자가 되고 나서 오히려 불행해지는 사람들을 보면 돈을 버는 방법보다 부자의 마인드와 태도가 무엇인지 아는 게 더 중요해 보인다. 돈이 되는 ‘방법‘이 아닌, 돈이 되는 ‘생각‘이 뭔지 알려주는 책."
9791162541432,10,책 소개글만 읽어도 슬퍼진다씁쓸한 기분이 드는건 평생 일을 해야하는걸 깨달았기 때문이겠지
9791162541432,10,"내가 돈을 좇아가는 게 아닌, 돈이 나를 따라오게 하려면 평소 어떤 마음가짐을 가지고 행동해야 하는지, 그로 인해 내 그릇이 얼마나 넓어질 수 있는지를 쉽게 설명한 책이라 좋다."
9791162541432,10,적당한 비유로 이해하기 쉽게 풀어놓아서 읽기 편했습니다.  당장 눈앞의 부를 쫓기보다는 방향을 제시해주는 책입니다.
9791162541432,10,내게 부족했던 것은 무엇이고 어떻게 가치있게 돈을 벌고 쓰는 것인지 깨닫게 해준다
9791162541432,2,이런 목차의 일본 책은  이미 충분하다
9791162541432,8,"왜 고급 자동차가 아닌, ‘부의 열차‘인가? 가만히 있어도 알아서 움직이고 서기 때문이다. 돈을 쫒는자가 될 것인가? 돈이 쫒아오게 할 것인가의 반복학습이다."
