ISBN13,rating,review
9788936470746,10,"지금까지 알라딘에서 두 권, 오프라인 서점에서 두 권, 총 네 권을 주문해서 그 중 세 권을 지인들에게 선물로 주었다. 책을 선물로 주고 싶으나 어떤 책을 선물로 줘야할 지 모를 때 가장 먼저 떠오르는 책."
9788936470746,10,고등학교입학하는데 독후감숙제라서 구입했어요
9788936470746,10,"재일교포 지식인의 눈과 마음, 그리고 우리의 역사. 그리고 그림의 힘"
9791190938471,10,내 세상은 경험하는 만큼 넓어진다. 내 이해의 폭도 경험하는 만큼 넓어진다. 간접 경험일지라도.
9788962918946,10,코로나 시대로 국내 이동도 자유롭지 못한 지금ㅜㅜ 책 한권으로 미서부 여행을 했습니다. 사랑스러운 부부의 여행기와 아름다운 풍경들 사진으로 눈호강 제대로 했네요
9788962918946,10,여행 못가는 코시국에 이만한 여행 에세이가 없다. 지루할 틈 없는 스토리 텔링이 좋았다.
9791191266054,10,"진득한 묘한 여운이 남는 인문학 서적.매일 육회와 육전을 먹으러 가던 광장시장이 아닌,예전의 시간부터의 이야기들을 알수 있어서 좋았다. 현대로 넘어오는 지금 그 중간에서 많은 이야기들을 머금고 있는 서울의 골목길들을 책으로 탐방할수 있어 참 좋았다."
9791166492167,8,"부족하기에 공감할 수 있고,성장함으로 용기를 줄 수 있는10대들이 꿈꿀만한 그런 유럽여행기^^"
9791166492167,10,작가의 마음이 따듯해서 읽는 내내 기분이 좋아져요. 유럽에 또 가고싶네요!
9791197020148,10,"그 흔한 -해라, -해야한다. 가 아닌 새로운 책입니다. 비슷한 문체와 감성, 교훈에 한참 질린 요즘.. 유쾌한 글을 써주어서 감사합니다. 브런치에 연재하셨을때부터 남모르게 응원했어요. 예약주문해서 책장에 꽂아두니 노랑이 상큼하네요!"
9791170400370,10,"박완서 작가 10주기를 맞이하여  다시 『모독』을 펼쳐본다. 그녀가 세상을 떠난 지 10년, 그동안 우리는 얼마나 더 모독스러웠을까를 생각한다. 내가 아무렇지 않게 행한 모든 행동과 내가 무심코 뱉어버린 말들과 내가 지닌 편견들과 욕망과 이기심이 빚은 모독을 다시 이 책을 통해 정화하고 싶다"
9791197219467,10,생소했던 타이중을 제대로 꽂히게 만든 책. 이색적이고 다양한 매력이 있는 타이중의 모든 것!
9791197219467,10,"이 가이드 북을 받아보고 참으로 감동한 지점이 있다면, 책이 아주 세세하고 상냥하다는 거에요. 현지 여행 물가, 숙소에 대한 이해, 추천일정, 여행 준비물, 화폐와 환전에 대한 모든것, 알아두면 좋을 월별 유의사항 등등.. 너무나도 상냥하고도 잘 설명해 두셨어요.타이중에 꼭 가보고 싶어지는책"
9791186274774,10,"여행이 힘든 요즘, 책으로 떠나는 시베리아 횡단열차.그 속에서 일상이 주는 소소한 행복을 느끼게 해주는 책."
9791186274774,10,시베리아 횡단 열차. 우리는 언제쯤 다시 탈 수 있을까?
9791186274774,10,신선한 새벽 공기 같은 느낌이 옵니다. 힐링 예감.
9791166032769,10,"지리산둘레길 트레킹을 계획하고 있다면 무척 도움이 될만한 책이다. 코스별로 소요시간, 추천명소 등이 정리되어 있고 직접 묵었던 숙소와 들렸던 음식점까지 소개해주셨을 뿐만 아니라 중간중간 코스별 팁도 알려주신다. 읽고 있으면 왠지 모르게 마음이 차분해진다."
9791166032769,8,지리산둘레길 완주 기록이자 코스 안내서
9791166032769,10,"지리산둘레길을 걷고 싶은 사람들에게 아주 자세한 길잡이가 될 듯 합니다. 구간마다 소요시간, 거리, 비용은 기본이고 숙소나 식당 소개도 함께 나와 있어 유용합니다. 원하는 구간만 골라 걸을 수도 있고 사진 보고 맘에 드는 구간을 선택할 수 있어서 좋아요. 이 책 한 권이면 걱정 없네요~"
9791197285110,10,문화유산ODA는 막연하게 어렵고 궁금했는데 이번 책을 읽고 친근하게 다가오는거 같았어요. 어려운 환경속에서도 천천히 세월과 함께 일을 진행하시는 연구원들에게 존경의 박수를 보내고 싶어요. 좀더 생생한 현장이야기가 담긴 다음 시즌을 기대해 봅니다.
9791197285110,10,"문화유산ODA 하면 라오스 사례를 자주 접했는데요, 라오스팀의 이야기가 있다고 해서 바로 구입했습니다. 받자마자 읽었는데, 우리나라의 ODA전문가분들의 실질적인 이야기를 접해서 정말 좋았어요. 그리고 특히 라오스의 이야기는 정말 생생해서 기대했던 것 보다 훨씬 감동적이었어요"
9791190382298,8,생각보다 편히 읽은. 느낌 좋은 책. 원제스님 답다
9791185831992,10,단순한 독일 여행기가 아닌 그들과 살아가며 그들의 눈으로 또는 이방인의 눈으로 본 독일의 모습을 재치있고 유쾌하게 담아낸 책입니다. 종존 이해가 되지 않던 궁금증들을 과거와 현재를 넘나드는 박학함으로 속 시원히 풀어주어 독일을  조금이나마 더 이해할수 있게 되었습니다.
9791185831992,10,"독일이란 나라에 대하여 평소 궁금했던 생각들이 있었는데, 잘 풀어낸 책이란 생각이 듭니다. 기대되는 책이네요."
9791185831992,10,"독일은 여러모로 저에게는 특별한 나라입니다. 처음 밟은 유럽땅이 독일이기도 하고, 독일 축구 국가대표도 정말 좋아해요. 저처럼 이방인이 바라보는 관점이니 더 공감하는 부분도 많고, 독일에 대해 더 잘 알아갈 수 있을 것 같은 책입니다. 기대됩니다!"
9791185831992,10,독일에 살면서 독일에 대해 사소한것에 대해 궁금한것을 파헤졌다니 정말 기대되네요. 코로나 상황이라 여행하기 힘든데 이런책 읽으면서 집콕해도 기분 전환이 될것 같네요.
9791185831992,10,독일에서 살면서 느낀 이야기라 더 기대되네요~ 여행으로 몇주간 느낀 독일과는 또 다른 이야기들이 펼쳐 질꺼 같아서 꼭 읽어 볼꺼예요~
9791185831992,10,저자가 독일에 살면서 겪은 것을 엮어놓은 책이라 간접 경험으로 독일 문화를 알 수 있을 것 같아 읽어보고 싶네요
9791185831992,10,"수많은 타향살이 경험기가 난무하는 가운데 독일살이 책은 드물었던 것 같다. 책을 다 읽고난 독자라면, 독일은 왜? 없었지? 하는 의문이 들 것이 분명하다. 꼼꼼한 취재와 따뜻한 저자의 시선이 얽혀 독일의 매력이 책 속에서 생생히 느껴진다."
9791185831992,10,이 책이 아니었으면 결코 몰랐을 이야기!! 누구나 아는 겉핥기 지식이 아닌 실제 생활에서 나오는 재미있고 쓸모있는 독일 이야기입니다. 읽다가 재밋어서 피식하고 가슴 뭉클한 에피소드도 있는 강력추천할 만한 책이에요.
9791185831992,10,유럽 연합에 속해 있는 나라들은 동등한 권리를 갖지만 브렉시트로 영국이 빠지면서 실질적으로 독일이 이끌어가고 있네요. 이 책의 저자는 독일에서 평범하면서도 이방인으로 살면서 무엇을 보고 느꼈을지 기대됩니다 :)
9791185831992,10,"읽을 예정인데 정말 기대되네요!! 독일이라는 나라에 관심을 가지기 시작하면서 궁금했는데 지루하지 않게, 이방인의 눈으로 즐겁게 읽을 수 있을 것 같아요 :)"
9791165394561,10,동문들의 소식으로 선생님의 존함과 출간을 전해듣고 바로 검색해보니 간단한 목차배열을 읽는것 만으로도 숨막히는 비경이 손에 잡힐듯 다가오는 느낌입니다. 배송은 내일 된다하니 벌써부터 가슴이 설레이네요~ 내내 건강하시기 바랍니다.
9791196872243,10,책장을 펼치자마자 단숨에 읽어내려간 책. 여성으로 엄마로서 매우 공감되는 내용. 나의 이야기이다. 희말라야를 선물해준 작가님 고맙습니다. 산을 좋아하지 않는데 내일부터라도 등산을 해야 겠다라는 다짐을 하게 해 준 책
9791196872243,10,"엄마인 작가는 왜 히말라야는 왜 갔을까? 히말라야를 가기까지, 그리고 여성으로서 사회에 자신이 겪었던 불합리한 면면을 이야기한다. 책을 다 읽고 덮었을 때 나도 모르게 눈물이 흘렀다."
9791196872243,10,"<엄마, 히말라야는 왜 가?>를 읽으면서 여성, 출산, 육아에 관해 표현할 길 없던 내 심정을 비로소 언어로 만난 느낌이었다. 군더더기 없이, 그러나 절절하게. 기자이자, 정치하는 엄마들 공동대표였던 저자답게 글엔 정보가 많고 단숨에 술술 읽히지만, 마음에는 가시지 않는 어떤 지점들이 새겨진다."
9791196872243,10,"히말라야를 잠시나마 느낄 수 있었던엄마, 히말라야는 왜 가?​읽어보기 전까지는 뻔한 여행 에세이인 줄만 알았어요.하지만 엄마의 이야기, 또 나의 이야기..​공감하면서, 화나면서, 그리고 깨달으면서용기가 되어준 책이에요"
9791196872243,10,"엄마의 목소리에 사회가 화답하는 속도가 빠를 수록, 아님 느리더라도 제대로 대답한다면 세상은 생각보다 훨씬 더 나은 것이 될 수 있다고 믿는다. 세상이 나아진다는 것은 무엇이겠나,당신의 든든한 안전망이 되어주겠다는 말이 아니겠나 ‘힘드니까 죽어야지‘가 아니라 ‘힘들어도 다시 해볼게‘라는 생각을 하게 될 지 모른다고"
9791196872243,10,엄마 희말라야는 왜 가? 코로나 시대에 여행을 갈 수는 없지만 여행의 어떤 루트 라기 보다는 사유의 흐름을 따라 갈 수 있는 에세이. 나에 대해 돌아보고 엄마 됨에 대해 생각해 보고 일상을 더 단단히 살아갈 용기를 얻었다!!
9791196872243,10,저는 남자이지만 많이 궁금한 책입니다. 이 사회가 여자들만의 고민이 아닌 사회가 함꼐 남자가 여자가 함께 만들어 가야 더 행복하다 생각이 들고 저희 아내도 함꼐 읽고 싶어 기대 되는 책입니다.
9791196872243,10,나를 생각하고 세상과 미래를 생각하며 확장해가는 큰 여행을 다니면서느꼈던 감정을 함꼐 공유하고 싶다~여행하는 사람들을 만나고 그 안에서 희망과 노력과 변화와 다양한 감정을 공감할수 있을것 같아 기대가 된다. 특히 책 소개에 묘사된 작가의 어린시절이 기가 막히다~~ 어서 읽고 싶다
9791196872243,10,"학생때 히말라야들 다녀왔습니다. 정말 최고의 시간이었습니다. 아이 아빠로, 남편으로, 가장으로 살면서.. 힘들도 지쳐서 그런지 요즘 부쩍 히말라야 생각이 더 자주 납니다. 아마 이 책을 지은 분도 그런 생각에 히말라야로 갔던 것인지. 책을 기다리는 설렘 오랜만입니다. 감사합니다!"
9791196872243,10,"오래 기다렸다! 맘충, 경단녀로 대변되는 현실 속에서 어떻게든 엄마 노릇을 잘 해보려고 고군부투 하는 이들에게 진심어린 위로와 힘을 줄 책이다. 반갑고 기쁘다. 기혼 유자녀 여성은 물론 정책 입안자, 활동가, 남자를 포함한 모든 돌봄 양육자들에게 권한다."
9791195148264,10,"이 책은 여행 자체도 여행자 자체도 아닌, 여행에서의 시선과 마음을 다루고 있다. 마냥 들뜨지도 신나지도 않은 그 마음이 언젠가의 나의 여행도 떠올리게 해서 매우 편안한 독서를 하였다. 손에 스윽 감기는 가볍고도 거칠거칠한 표지와 내지도 매력적이다. 종이책으로 만나서 특히 반갑다."
9788927811749,10,코로나가 해외에 갈 수 없는데 애기랑 갈 수 있는 국내 여행지가 잘 소개 되어 있어 너무 좋네요! 애기랑 함께 할 수 있는 놀이도 많이 소개 되어 있고요! 코로나 시대에 애기 엄마들의 도움이 되는 책이에요 !
9791189510183,10,너무 기다렸어요 작가님 짱~!
9791162850657,8,바람이 분다..걸어야겠다. 라는 제목을 발견하고 얼마나 놀랐는지....!! 일기장이 털린 줄 알았습니다. 2013년 제주에서 땡여름을 게스트하우스에서 버티면서 아침마다 숙소를 의무적으로 나서 쓸쓸함과 외로움이 아무렇지 않은 듯 무작정 걷던나날들. 곶자왈에서 치유되어 가던 하루하루
9791187895190,10,책을 한번 읽기 시작했더니 놓을 수 없어 밤새 읽었습니다. 내용이 쉬우면서도 영성 적으로 깊이가 있어 좋았고 몇 군데에서는 전율이 일었습니다. 사진도 현장감 넘치고요.
9791187895190,10,"현지를 제대로 아는 사람의 안내가 담긴 여행기는 빛난다. 그리스도 신앙의 발자취와 함께하는 로마의 유적들을 보며 역사, 인물들을 깊은 묵상과 함께 만나고 현재의 내 삶과 신앙을 돌아보게 하는 거룩하고 아름다운 순례기이다. 놓쳤던 장소와 새로운 이야기, 맑은 영성이 나를 한 뼘 자라게한다"
9791165791957,10,도전에 끊임없는 작가님이라 작품이 더욱 기대됩니다. 그렇게 준비한 열정 기대 큽니다!
9791197050008,10,"너무 아름다운 사진들, 사진보다 더 아름다운 글...한번 들면 손에서 놓을 수 없고 다 읽은 후에도 자꾸 들춰보고 싶은 책입니다. 한 번 읽을 때보다 두번 읽을 때 울림이 더 큰 책입니다. 꼭 읽어보세요!!"
9791197050008,10,친구에게 선물해주니 넘 재밌었다네요.일상에 힐링이 되는 내용이라고 합니다 추천해요
9791197050008,10,답답한 일상에 쉼을 주는 책입니다. 힘든 시기에 내가 원하는 것이 무엇인지 돌아보게 되네요. 새로운 꿈이 생겼습니다.
9791197050008,10,코로나로 부쩍 늘어난 집안일과 아이 돌보기로 지쳐 있던 마음이 시원하게 뚫리는 것 같은 책이네요!
9788978640862,10,"책을 읽는 내내 작가와 함께 걷고 함께 사색하는 느낌이었습니다. 가슴이 따뜻해지면서 코로나가 끝나면 책을 따라 해파랑길로 여행 떠나고 싶네요~! 많은 이들이 읽으면 좋은 책, 추천해요~~"
9788978640862,10,평범한 여행길도 다르게 보이는 요즘에 읽으면 좋은 책이네요~ 표지의 바다사진처럼 책을 읽는 내내 마치 바닷길을 거니는 느낌이 들었습니다~ 코로나로 지친 우리에게 위로를 주는 책이네요~강추합니다~!!!
9791196260088,10,제주도 여행과 책을 사랑하는 친구에게 선물하고 싶어서 구매했습니다.
9791196260088,10,"제목처럼, 작은 책방의 힘을 보여주는 책.제주도 여행을 간다면 꼭 이 책을 가지고 다니고 싶다.제주도와 책방의 감성을 깊이 느낄 수 있어 좋은  도서."
9791196260088,10,시집 사이즈 책이라맘에 들었는데내용도 시적이어서 만족
9791189510176,10,"짜임새 있는 구성으로 디자인, 식문화와 다채로운 노르웨이 라이프스타일을 온몸으로 느낄 수 있었습니다. 요즘같이 코로나로 인해 몸살을 앓고 있을 때 잠시나마 책에 푹 빠져 노르웨이를 경험할 수 있었고 행복한 여행을 다녀온듯한 느낌을 받을 수 있어 너무 행복했습니다."
9791189930493,10,해외생활에 적응도 바빳을 텐데 생각을 정리하여 책을 낸 것이 훌륭하다. 꼭 읽어볼 책.
9791189930493,10,"어른이 된 후 한 번도 앉은자리에서 책을 끝낸 적이 없었지만, 일요일 아침에 문득 읽기 시작한 이 책은 마지막 장을 넘기고 나서야 침대에서 일어나야 함을 알게 되었습니다. 여행을 다녀온 친구에게 이야기를 듣는 듯한 편안함과 소재의 신선함이 그 원인이 아니었을까 싶습니다."
9791189930493,10,"작가가 1년 넘게 핀란드에서 교환학생으로 지내며 쓴 이 책은 핀란드에 대한 글이기도 하지만 한국에 대한 글이기도 하다. 더 나은 사회를 위한 깊은 고민을 책의 모든 부분에서 확인할 수 있다. 언젠가는 ˝세상에서 가장 행복한 나라, 대한민국˝이라는 책을 작가님이 쓸 수 있는 사회가 되면 좋겠다:)"
9791189930493,10,교육은 행복해지려고 받는 것이라는 말에 공감하는 분들께 이 책을 추천합니다. 집콕 중에도 잠시나마 핀란드의 향기와 교환학생 간접경험(?)을 느껴보고 싶은 분들께도 추천합니다.
9791189930493,10,다양함이 공존하는 평등한 사회를 만들기 위해 내가 기울이는 노력이 결국 다시 나에게 돌아올 것이라는 믿음을 얻었다
9791190061216,10,"SNS로 팔로우하는 작가님을 통해 알게 된 책인데, 여러 작가님들을 알아가고 그들의 여행 이야기를 들을 수 있어서 좋았어요. 같은 여행지여도 사람마다 경험하는게 다르기 때문에 여행이 가능해지는 그 날이 오면 저도 책에 등장한 여행지로 떠나서 저만의 여행을 하고 싶다는 생각을 하게 되었습니다"
9791190061216,10,"코로나로 어려운 시기 어려움을 조금이나마 덜어주는 책이에요 ! 저는 평소에도 여행 책을 좋아하며 읽는데 그 이유는 여행 책들이 읽으면 그 짧은 순간에 책으로 여행하는 느낌이에요 코로나로 여행을 맘대로 하지 못하는 시기 책으로 여행이라.., 너무 좋습니다"
9791190061216,6,"다양한 작가들, But 별 통찰없는 에피소드들ㅜ 아무래도 한 작가가 책임감있게 오래도록 깊이, 농후하게 사유하는대신 다양한 사람들이 짧게짧게 겪은 에피소드들을 엮은 이유일테죠. 그래도 표지가 맘에 듭니다."
9791190061216,10,딱 이때다!!몇몇 아니 수많은 무지한 어른들의 무책임한 행동으로 겨우겨우 조용히 이겨내던 우리의 일상에 그야말로 찬물을 확 끼얹듯이 지금 코로나 사태로 다시 시끌시끌하다.⠀해외 여행은 고사하고 국내 여행도 마음대로 할 수 없는 기막힌 현실이 너무도 답답하다.⠀ 책의 내용도
9791190061216,10,다시 여행을 꿈꾸게 만들어주는 귀한 책! 그리운 풍경이 내 손안에서 펼쳐지며 마음이 먹먹해졌다. 그 때 떠날 수 있었던 것처럼 또 다시 떠날 것을 기대하게 만들어주는 책!
9791190061216,10,사진이 정말 예뻐요. 에세이도 알맞게 예쁘고요. 꿈 꾸는 것 같이 힐링 되는 책이에요
9788993525830,10,"평범한 ‘나‘에서 ‘유방암 환자‘로, ‘유방암 환자‘에서 다시 ‘나‘로 돌아가기 위해 여행을 떠난다.⠀비록 머리카락이 없어 가발을 쓰고 각 나라마다 시간시간 지켜서 먹어야했던 약들을 챙기는 번거로움이 있"
9788993525830,10,"에피님의 블로그 글빨(!)은 익히 알지만 책으론 어떨까 궁금했습니다. 결론은 단발성 작가가 아니네요!글에는 인품이 드러나지요. 담백하고, 담대하고, 유머러스하면서도 자기성찰이 담긴 문장이 정말 좋았습니다. 한권 더 사서 친구에게 선물했어요.덧. 차기작으로 시집도 좋을 것 같은데요:)"
9788993525830,10,에피님~^^어제 책 받자마자 앉은 자리에서 다 읽었어요구절구절 마음에 와 닿아서 조금씩 아껴 읽으려 했는뎅....기대이상 이었어요폭풍 공감하며 울다가 웃다가 난리도 아니었네요마음에 위로 듬뿍 받아갑니다벌써 차기작도 기대 뿜뿜 입니다~건행~!!!!!
9788993525830,8,꼭 완치하셔서 마시고 싶으셨던 데킬라 소금이랑 맛있게 드셨음 좋겠습니다! 저는 평소에 누군가가 그토록 원하는것을 아무 감정없이 하고 있는거 같네요... 위내시경 받고 아무 문제없다는것을 들었을때 뭔가 다시 태어난 기분이었는데...  매일매일 새로 태어나는것처럼 살아야겠어요!
9788993525830,8,살아간다는건 참으로 소중한 시간입니다. 밝고 건강한 웃음으로 자신을 마주하고 내딛는 세계속의 여행을 즐기는 에피님의 한걸음 한걸음을 응원합니다
9788993525830,10,드디어 애정이웃 에피님의 책을 오늘 받고 단숨에 읽었어요. ^^책을 보면서 얼마나 마음고생을 많이 하셨을지.. 코끝이 찡해졌어요.그럼에도 불구하고 유쾌한 일상과 용기있는 여행.. 항상 그녀를 응원합니다. 엄마와토마토/정말 감동 받았습니다.
9788993525830,10,그냥 늘 당신을 응원합니다 ♡
9788993525830,10,"현재 유방암 무료국가검진은 만 40세부터 해당됩니다. 단순히 검진이 유/무료인점을 떠나서, 재난적의료지원 자체가 국가건강검진을 통해 확정받아야 가능합니다. 결국 젊은 유방암 환자는 의료 복지의 사각지대에 놓여있는것이나 다름없어요. 사람들이 이 문제에 많은 관심을 가져줬으면 좋겠어요."
9788993525830,10,힘내요~홧팅에티를응원합니다~~
9788993525830,10,제목이 특이해서 예약구매했어요 무슨 내용일지궁금합니다
9788993525830,10,기대되는 책입니다~휴가때 읽으려고 구매합니다^^
9788993525830,10,방금 전 예약 바로구매했습니다! 잘 읽겠습니다 감사합니다 ㅅㅅㅅㅅㅅ
9788993525830,10,요즘처럼  모두가 힘든시기  잘 이겨내도록 용기와 희망을 주는 책 인 것 같습니다 ~  빨리 읽어보고 싶네요^^
9788993525830,10,얼른 받아서 읽어보고 싶네요!ㅎㅎ 기대만땅입니다~~!!
9788993525830,10,흔들리는 나의 삶을 흔들어버린 책나는 이 앞에서 작고 하찮아진다
9788993525830,10,작가님 항상 응원합니다!
9788993525830,10,힘든 시기에 좋은 글 읽을 수 있게 되어 너무 기대가 됩니다!작가님 응원합니다:) 건강하시고 다음 글도 기대할게요~~~
9788993525830,10,책 출판 축하드려요~~ 여행사진이며 이야기들 너무 기대됩니다!
9788993525830,10,에피님 블로그(https://blog.naver.com/effy0424)블로그에서 출판소식듣고 들어왔어요 에피님 축하드려요~^^ 책 읽고 후기 남길께요
9788993525830,10,학교에서 책 출판하신 거 들었어요 늘 응원하고 있습니다 화이팅~~~~!!
9788993525830,10,이젠 작가로서의  새로운 삶에 도전 하는 에피님 진심 응원합니다~앞으로도 좋은 글 독자와 공감할 수 있는 글 많이 써 주세요^^
9788993525830,10,브런치에서 보고 글이 좋아서 예약구매했어요. 늘 응원할게요~
9788993525830,10,과거의 후회와 현재의 걱정이 생각이 많아지는 30대를 시작하고 있는 요즘 작가님의 경험을 토대로 쓰여진 이 글을 읽으면서 무엇을 해야 할지 앞으로 어떻게하면 좀 더 보람있고 뜻깊은 삶을 살수 있을지 느끼게 해주는 책인것 같습니다. 앞으로 좋은 작품들 기대하도록 하겠습니다.
9788993525830,10,에피님 책 방금 주문했어요 :) 빨리 책 받아서 읽어보고 싶어요.정말 많은 사람들에게 좋은 힘이 될것같아서 기대 기대중입니다!!!
9788993525830,10,에피님한테 긍정 에너지를 받고 있는 팬이에요! 기다리던 책인데 드디어 만나게 되네요. 빨리 읽어보고 싶어요.
9788993525830,10,빨리 받아보고싶어요~
9788993525830,10,상상조차 힘든 일을 어린 나이에 당당하게 헤쳐나가시는  아름다운 분~~주옥 같은 책 빨리 만나고 싶어요^^
9788993525830,10,요즘  코로나 공포로 모두 힘든 시기에 우연히 빨간 표지의 머리가 눈에 띄는  젊고 예쁜 아가씨의 얼굴에서  삶에 대한 씩씩한 대처 방법에 많은 걸 배우게 될 것 같아요기대가 됩니다~~~~예쁜 작가님 힘내시라고  예약 구매 합니다~♡응원 합니다^^
9788993525830,10,인스타로 알게된 에피님의 책출간 정말 축하드려요
9788993525830,10,사람에겐 어떠한 상황이든 고난이 있는 법이지요~ 우리 작가님에겐 그냥 그런 상황이 좀일찍 찾아 왔을뿐 앞으론 좋은일 꽃길만 걷길 기원합니다~^^
9788993525830,10,"이미 블로거 사이에서 너무나 유명한 ‘에피님‘의 책이라니 당장 구매입니다. 재미는 물론이고, 감동은 덤... 거기다가 여행사진이며 이야기로 풍성할 듯!"
9788993525830,10,아프신 어머님과 여행 못간것 힘이 못되어준게 생각나네요  주변사람이나 자신에게 힘든일이 생겼다면 같이 공감되면서 힘낼수있게 해주는 좋은책인듯같네요 작가님  어린나이에도 힘내면서 극복해나가는 모습 응원합니다
9788993525830,10,코로나19로 힘든 시기에 씩씩하고 긍정적인 에피님의 에너지가 힘이 될 것 같아요.
9788993525830,10,에피님 블로그(https://blog.naver.com/effy0424) 이웃이라서 출간 소식 듣자마자 달려왔어요. 주변인들과 같이 읽으려고 5권 샀어요. 빨리 나왔으면 좋겠어요!!
9791166030253,8,재미있고 쉽게 써서 술술 넘어가네요. 코로나로 해외여행을 못가고 있는 상황에 책을 읽으니 세상이 빨리 정상적으로 되서 해외 여행 가고 싶어요~
9791137211193,10,홍콩의 민주화를 응원합니다
