ISBN13,rating,review
9791136005441,10,책 구성이 아주 깔끔해서 이 책 한권으로 토클 끝내는데 문제 없다는 생각이 들었어요!진짜 2주안에 효율적으로 끝내기 딱 좋은 책이라고 생각합니다. 압축노트도 헷갈리는 것만 잘 모아놓은 것 같아요~
9791136005441,10,퀄리티가 뛰어납니다.오류및 오타가 없어 문제 틀렸는지도 검산안해ㄷ 좋아 보기가 편합니다.
9791136005441,10,"2주만에 딸 수 있게 알찬 구성과 문제 구성도 너무 맘에 들어요. 시험장에 들고 갈 수 있도록 알찬노트가 있어서 너무 편합니다. 책 이름은 2주끝장이지만, 한달 준비하실 분들, 1주일 벼락치기 하실 분들을 위해서 플랜도 짜져있어서 정말 좋아요. 저는 2주구성으로 진행했어요!"
9791136005441,10,"국어능력 시험 문제집 인만큼 오탈자도 없고, 이론도 깔끔하게 정리되어 있고, 문제도 알차요. 특히 시험장에서 훑어볼 수 있는 ‘압축노트‘가 있어서 든든합니다."
9791136005441,10,"책에 오류나 오타가 없고, 깔끔합니다. 영역별 학습전략이 있어, 공부하기 좋습니다. 부록도 정말 유용할 것 같아요."
9791136005441,10,"책 제목이 2주 끝장인데 제목대로 시험 유형을 잘 압축해서 담았네요. 한 달, 2주, 1주플랜에 맞춰서 공부할 수 있게 플래너도 들어 있고 부록으로 들어있는 압축노트가 괜찮아서 배경지식 좀 있고 벼락치기로 하실 분들은 압축노트만으로도 어느 정도 효과 볼 수 있을 것 같네요."
9791136005441,10,"실제 시험과 유사한 유형과 난이도의 문제로 구성되어 실전 감각을 익히며 공부할 수 있습니다.어휘 정리가 잘 되어있고, 유형별 학습이 가능합니다. 압축노트도 포함되어 있어 들고 다니면서 보기에도 좋습니다."
9791136005441,10,실제 시험과 유사한 유형과 난이도라서.아무래도 실전감각을 익힐 수 있습니다.아무래도~ 항상자격증 시험으로 유명한 에듀윌이라서! 추천드립니다~ 앞으로도 믿고 이용할수 있도록하하겠습니다! 내용에서도 오타가 적어서 한국어 시험에서 더욱 신뢰가 가는 책 입니다!
9791136008688,10,"설명 분량이 적절하다 생각되었습니다. 특히 한 두 줄 정도 먼저 간단히 정의를 내리고 이후에 구체적으로 설명을 하고 있다는 점, 관련 기출이 담겨 있는 것이 장점이라고 생각합니다."
9791136008688,10,"일반상식 문제집 한 권이면 충분한 것 같아요. 공기업일반상식, 상식책, 시사이슈, 기본상식, 상식문제를 찾고 계시는 여러분들이라면이 책 솔직하게 말하면, 정말 추천해드리고 싶습니다."
9791136008688,10,"취업에 필요하고 시험에 나오는 상식들만 모아서 정리 되어 있으며, 다양한 분야의 상식과 상세한 설명이 제공되기 때문에 학습하기 매우 좋습니다!"
9791136008688,10,"뉴스랑 검색으로 시사상식 공부할 땐 시간도 오래걸리고 흩어져있는 단편적인 정보들을 단순 암기하는 것 같았어요. 근데 다 통하는 일반상식으로 공부하니 핵심tag, 더알아보기, 기출처, 관련용어 등으로 체계적 학습이 가능해서 좋았어요. 기출문제도 있구요!"
9791136008688,10,"책이 분야별로 잘 나뉘어있어서 좋아요 :) 빈출은 따로 되어있고, 내용별로 구조화되어있어서 도움이 돼요!"
9791136008688,10,"처음 책을 받고 너무 두껍길래 편리하게 들고 다니긴 어렵겠다 생각했는데 1, 2권으로 분할해서 들고 다닐 수 있더라고요! 또 특별부록이 있어 언제 어디서나 가볍게 상식 공부하기 너무너무 좋은 책 같아요♥"
9791136008688,10,취준 시작하느라 막막한데 ㅜㅜ 기업 정보 수집에 같이 검색할 키워드를 유용하게 제공해줌.
9791136008688,10,시사상식 대비하기 이 책 한권으로 걱정 덜었습니다ㅜㅜ!!
9791136008688,10,취업에 꼭 필요한 상식들이 분야별로 수록되어 있어요! 취준생 분들에게 강추합니다!
9791136008688,10,"취업에 있어서 일반상식이 중요해지고 있는데, 책 한권으로 준비할 수 있어서 좋은 것같아요 다양한 분야의 상식이 자세하게 나와있어요!"
9791136008688,10,"공기업 취준 중 시사 관련 질문에 대비하기 위해 에듀윌 통합대비서로 공부하기 시작했습니다. 취업에 필요한 상식만 모아놓은 책 찾다 보니 자연스럽게 베스트셀러인 책을 찾게 되고, 출제된 상식 위주로 구성된 상식 문제가 마음에 쏙 들더라고요."
9791136008688,10,"책 안에 고빈출상식 용어와 일반 상식 용어가 다 수록되어 있어서 학습하기에 정말 편하였고, 취업 준비생이라 시간적 여유가 많지 않은 편인데 통합대비서이기 때문에 빠른 시간 안에 효율적으로 학습할 수 있어서 좋았습니다."
9791136008688,10,"분야별 다양하고 상세하게 일반상식 지식이 수록되어있어서 공기업 필기시험 대비로 좋아요! 공기업 취업준비를 위해 일반상식 교재를 찾고 있었는데, 이 한 권으로 공부하면 될 듯 합니다. 감사합니다!"
9791136008688,10,"1권, 2권으로 나뉘어져 있어서 딱히 분철도 필요없고, 폭넓은 상식덕분에 혹시 내가 가진 지식이 부족하지는 않을까? 고민하지 않아도 되서 좋았어요"
9791136008688,10,이 책 한 권만으로도 충분히 시사상식영역 대비할 수 있을거 같네요. 만족합니다!!
9791136008688,10,책 분리되는 것 진짜 좋아요. 분야별로 기본 상식은 물론 기출문제와 최신시사상식까지 점검 및 공부 가능합니다. 역시 자격증 및 취업준비는 에듀윌인가봐요. 취업준비를 위하여 시사상식 책을 찾는다면 한권으로 끝낼 수 있는 에듀윌 시사상식 통합기본서책 추천드려요. 고민하지마세요
9791136008688,10,"책이 1권, 2권으로 분리될 수 있도록 되어 있고, 각각의 분야 별로 잘 나뉘어서 정리되어 있습니다. 그리고 특별 부록이 안에 있어 가볍게 들고 다니기도 정말 좋은 것 같아요! 그리고 최신 정보도 잘 반영되어 있으며, 이해하기 쉽게 정리되어 있어서 상식 공부하시는 분들께 정말 추천합니다!!"
9791161981154,10,기대되네요. 7급 psat과 공기업준비를 동시에 끝내는 이론과 기출의 완벽한 조합일거같아요
9791136008275,10,매일 한회씩 풀기 좋아요 정말 만족스러워요
9791136008275,10,"6대 출판사를 다 뽀실 수 있는 에듀윌의 신간 NCS책!! 출제사들을 다 꼼짝말게 하네요!! 너무 알찬거 아닙니까 그 유명한 휴노, 행과연까지 쏙쏙 있으니 공기업 준비할때 꼭 풀어보면 좋을 것 같아요!! 한전, LH 꼼짝말자!!"
9791136008275,10,"6대 출제사의 공통 빈출유형과 기출변형 모고, 기출모고를 최신 3개년을 모아서 공부할 수 있으니 신유형 대비와 다양한 학습에 좋을 것 같습니다. 6대 출제사 유형 모음이니 경제적 여유가 없는 취준생들에게는 가성비까지 좋은 책이네요. 2021 취준생 필독서 같습니다."
9791136008275,10,"최근 3개년동안 6대 출제사와 기업별 출제사가 바뀌는 것을 잘 파악해 준 책 인것 같습니다. 자신이 원하는 직장의 출제사 정보를 알 수 있는 방법도 적혀있고, 출제사별 숙지해야하는 사항과 시험 유형을 친절히 알려주고 있는 것 같습니다. 시험을 준비하는 취업준비생에게 너무 도움되는거 같네요"
9791136008275,10,"기업의 채용대행사는 매년마다 달라지기도하고 기업별로 채용대행사가 다르기에 대행사에 맞는 NCS의 학습이 필요합니다. 에듀윌 NCS 6대 출제사 기출PACK의 경우, 6개 출제사별의 기출문제들을 한번에 학습할 수 있으며 완벽하게 대비할 수 있다는 점에서 적극 추천합니다."
9791136008275,10,기출을 정복하는 자가 실제 시험을 정복한다.이 책은 기출문제로 구성되어 있기에 일반 봉모보다 문제의 질이 훨씬 더 좋다. 스터디원 전원 구매하여 스터디에서 한문제 한문제 꼼꼼히 분석하고 시험장에 들어간다면 훨씬 더 좋은 결과를 기대해볼 수 있을 것이라 생각한다.상반기 화이팅!!
9791136008275,10,"진짜 기업마다 출제 대행사가 너무 다양해서 어느 장단에 맞춰야할지 항상 고민했는데 이번에 에듀윌에서 작정하고 6대 출제사별 기출pack을 내줘서 너무 좋습니다! 피셋형, 모듈형 그리고 응용 모듈까지! 각 문항별 출제사 정보도 있을 뿐만 아니라 상세한 해설도! 꼭 취뽀 성공하겠습니다!"
9791136008275,10,어떤 유형이 나와도 각 유형의 특징과 출제경향을 체계적으로 정리해서 기출을 마주하여 준비를 잘할 수 있게 책이 잘 만들어져서 있는 거 같아서 반복적으로 실력을 단련시키고 싶어진다.
9791136008275,10,NCS의 여러 출제사별로 문제를 구분해서 풀 수 있어 좋은 것 같습니다. 시험을 앞뒀을 때 필요한 문제를 골라 풀 수 있다는 편리성이 좋습니다. 또한 기업에서 출제되었던 문제들을 풀어보고 그 변형까지 알아보면서 다양한 문제를 접할 수 있는 책의 구성이 취준생들에게 큰 도움이 될 것 같습니다.
9791136008275,10,굉장히 기대가 되는 책입니다 ! 다양한 출제사의 다른유형을 단한권의책을 풀수있다는 것 만으로 최고의 장점을지녔다 생각해요 !!! 한권에 문제가 수록되어있어 문제를 풀면서 비교분석할수있을 것같이요 ! 이책을 통해서 출제사별 유형을 완벽히 분석해 열심히 준비할수 있을것 같아요 ㅎㅎ
9791136008275,10,"취업을 준비하고있습니다. 처음 공기업 취업 준비를 하면서 어떻게 시작해야할지, 어떤 공부를 해야하는지 복잡하고 어려웠는데 이 책은 한 권에 궁금했던 정보들이 다 들어있어 참고하기 너무 좋은 것 같아요~ 특히 자격증, 취업 참고서로 유명한 에듀윌 책이니 믿고 구매할 수 있을 것 같아요~"
9791136008275,10,"한 권의 문제집으로 주요 6대 출제사들의 문제들을 전부 풀어볼 수 있는게 가장 큰 장점인 것 같습니다. 게다가 기출변형 모의고사도 있어서 마지막으로 정리할 때 정말 좋을 것 같아요. 저도 열심히 풀어서 출제사 별로 특징을 정확히 파악하여, 시험 대비에 유용하게 활용하겠습니다!"
9791136008275,10,﻿NCS 대비 최종적으로 마무리할 수 있는 교재로는 필수 교재네요... 기본서를 어떤 책으로 공부했더라도 실전 대비용 기출문제는 반복적으로 풀어봐야 할 필요가 있을 것이라고 생각하는데 실제 기출문제를 완벽히 분석해서 시험에 충분히 적응할 수 있게 구성되어 있네요.
9791136008275,10,"6대 출제사별 공통 빈출 유형을 깔끔하게 정리해놓아서 기대가됩니다! 보통 취준생들이 여러 공기업을 한번에 준비하는데, 여러 교재 살 필요 없이 이 책 한 권으로 대비할 수 있어서 좋네요.빈출 빈도가 높은 문제들로 구성되어있고 모의고사까지 제공되니 실전에도 좋을거 같아요!"
9791136008275,10,출제사 별로 기출 유형이 정리되어 있어 ncs를 처음 시작하는 저에게 큰 도움이 될 것 같습니다! 유형분석 하고 모의고사 까지 공부하면 빈틈없이 공부할 수 있을 것 같아요 또 무료 인강과 상세해설까지 활용하면 공부 효율이 무척 높아질 것 같습니다! 에듀윌 도서로 공부하고 꼭 취뽀 하겠습니다^^
9791136008275,10,"공기업 취업을 준비한다면 ncs는 특히나 중요한데, 기관별로 출제사가 달라 이 책으로 공부하는게 맞는지 저 책으로 공부해야하는지 의문을 많이 가졌습니다. 6대 출제사의 공통 빈출 유형으로 완벽하게 ncs를 잡고, 원하는 기업에 꼭 취업할 수 있는 길이 점점 다가오는 것 같아요! 에듀윌 짱!"
9791136008275,10,"공기업, 공공기관을 준비하고 있습니다. 여러교재를 많이 보게 되는데요. 그중에서도 유독 노랑색으로 통일되어 있는 에듀윌 교재가 눈이 띄었고 여러권을 보게되었습니다. 이번 6대 출제사 기출팩도 상당히 기대가 되는 이유입니다. 무료로 NCS 출제사별 기출을 제공하는 것도 매우 좋습니다!"
9791136008275,10,가난한 취준생으로서 출제사마다 문제집을 구매하기가 많이 부담됐는데 6개 출제사가 한권에 들어있눈 책이 출간되어서 너무 다행이에요. 실전모의고사랑 기출변형모의고사까지 수록되어있어서 실전감각 향상에도 큰 도움이 될거 같아요. 에듀윌 ncs 풀고 내년 상반기 취뽀!!
9791136008275,10,"5년간의 직장생활을 하다 이직을 하려니 , 취업시장이 많이 바뀐상태여서 뭐부터 해야 할지 막막했습니다. 종류도 너무 많고 그렇다고 그걸 다 보기엔 역부족인것 같아 , 에듀윌 도움을 받고자 들어갔다가 우연히 이 책의 출시를 알게되었습니다. 역시 하면서 책을 기다리고 있습니다."
9791136008275,10,"이번에 나온 신간도서도 6대 출제사 기출팩이라 다양한 기출 유형을 분석할 수 있고, 다양한 출제사의 문제를 직접 경험할 수 있기 때문에 공기업 취준생들은 필수적으로 꼭 풀어봐야할 교재가 될 듯 하네요:)"
9791136008275,10,역시 취업 준비는 에듀윌! 에듀윌 신작인 5대 출제사 기출문제집 한 권만 사면 6개의 출제사 문제와 기출 유형 파악에 엄청난 도움이 될 거 같습니당 !! 특히 에듀윌 풀면서 답지가 정말 친절하다고 느꼈는데 이번 책도 기대가 됩니당 공기업 취준생으로써 꼭 풀어보고 싶어요~~
9791136008275,10,"기출을 구하기도 쉽지 않은데 기출을 한곳에 정리해놓은 2021 신간 에듀윌 NCS 6대 출제사 기출PACK!!, 출제사 기출을 한곳에 정리 되어 있어, 기출 문제 파악하고 익히기 좋을 것 같네요!!"
9791136008275,10,믿고사는 에듀윌에서 2021년 맞이 신간이 출시됬네요! 공기업 취업 준비생으로써 NCS는 꾸준히 풀어줘야하는데 영역별 대비 뿐만아니라 자신이 가고싶은 회사의 시험 유형별로 대비 또한 매우 중요하다고 생각합니다. 신간의 6대 출제사는 공기업 주요 시험에서 접할 수 있는 출제사여서 기대가 됩니다
9791136008275,10,역시 에듀윌! NCS 완결판을 출판하네요.출제사별 기출을 통합하여 빈출 유형으로만 구성했네요.그동안은 출제사에 맞게 문제집을 따로 사야 했었는데 문제집 값이 반으로 줄여 주네요. 크리스마스 선물 같은 2021 에듀윌 NCS 6대 출제사 기출PACK! 기대합니다.
9791136008275,10,기출문제 구하기가 쉽지않은데 이거 한 권이면 모두 대비가 되겠어요ㅠㅠ 특히 휴노형이랑 행과연 스타일 문제로 고생했었는데 모의고사도 수록되어있으니 시간재고 실전처럼 공부하기 좋아요 이전에 봤던 에듀윌 책에서 자세하고 친절한 해설이 좋았는데 이번책도 기대됩니당 열공하고 취뽀할거에요!!
9791136008275,10,2021년 대비 에듀윌 NCS 6대 출제사 기출 문제집 믿고 볼수 있을것 같아요~구성을 살펴보니 빠짐없이 되어있어서 공부하기에 딱 적합한 책이네요~
9791136008220,4,내용이 너무 부실해요.
9791136008220,10,한권으로 다섯가지 자격증을 공부할수 있어서 1석 5조입니다!
9791136008220,10,"필기가 세분화되어서 금전적으로 부담이 되었습니다. 교재도 나누어여 하나, 하지만 본 교재는 한권에 세부과목을 다 해결하도록 하였답니다. 하지만 내용도 좋아서 후회가 없어요. 요약노트가 눈에 띄고 기출문제도 알차게 포진되어 있어서 푸는 재미도 좋습니다."
9791136008220,10,조리기능사 필기시험을 위한 맞춤형 교재인 것 같아요!
9791136008220,10,5과목 이론 공부와 동시에 익힐 수 있는 출제유형이 들어있는 책이기 때문에 추천합니다!!
9791136008220,8,"5과목을 한권에 마칠 수 있어 가성비 좋고, 암기노트가 있어 훓어내며 단기간에 흐름잡기 좋고 요약보기하기 좋고, 실전동형모의고사도 10회분 정도로 넉넉하고 실전엽습으로 좋은 것 같아요."
9791136008220,10,"탄탄한 문제 구성과, 한권으로 모든 종목의 조리기능사를 대비할 수 있는 최고의 교재!!"
9791136008220,10,필기가 강화된 조리기능사를 대비하는 최고의 교재!
9791136008220,10,5과목 통합으로 구성되어 있어 골라보기 좋았고 중요한 내용은 깔끔하게 정리되어 있어 만족스러웠습니다.
9791136008220,10,파트별로 핵심키워드와 합격 포인트로 내용을 미리 알수 있고 이론과 문제 병행 해서 바로바로 문제를 습득할수 있도록하였으며 다양 한 문제유형을 접할수 있어서 좋습니다
9791136008220,10,핵심 이론으로 이론을 정리하고 적중 문제를 풀면서 오답정리를 하고 모의고사와 CBT 교재풀이로 문제를 엄청 돌렸다. 그랬더니 한번에 합격-! 구성 아주 좋아요!
9791136008220,10,종목별로 학습이 가능한 게 좋습니다.
9791136008220,8,수학에 정석이 있다면! 조리 기능사에는 에듀윌이 있다. 서평단으로 알게 되었지만 서평단 그 이상으로 좋은책이라는 생각이 든다. 특히 식품위생학 파트가 정리가 잘 되어있다. ㅎㅎ
9791136008220,10,"효율적인 구성, 풍부한 이론과 문제. 이 한권으로 딱입니다. 다른 자료가 더 필요없네요. 아주 좋아요~"
9791136008220,10,저희 어머니께서 요리하는 것을 굉장히 좋아하시고 잘하십니다.늘 한식 자격증에 대해서 하고 싶다는 마음을 가지고 계셨는데 이번 에듀윌도서를 계기로 시작하게 되셨습니다. 이 책은 총 5가지의 종류의 필기를 목적으로 제작되었는데 자세하게 표시되어 공부를 하시는데 도움이 될 것 같습니다.
9791136007506,10,직업상담사2급 합격에 최적화 된 도서인 것 같아요! 1차와 2차 시험을 한권으로 공부할 수 있어서 좋아요. 핵심을 다지고 문제풀이로 탄탄하게 마무리하고 싶은 수험생에게 추천합니다!
9791136007506,10,"항상 자격증 수험서는 에듀윌만 보고있습니다. 직업상담사 자격증이 쉽지 않는 자격증인데 얼마나 좋은 내용이 담겨 있을지 기대됩니다. 탄탄한 기본서로 1, 2차 한번에 준비할게요!"
9791136007506,10,기대하고 기대한 직업상담사 2021년판이 나왔네요~열심히 공부해서 한번에 합격 노려볼거에요~^^에드윌은 믿을수있는 합격 파트너니까요~^^
9791136007506,10,직업상담사를 준비하는게 막막했는데 필기와 실기를 통합한 책이라서 준비하는데 실용적이고 좋을거라는 생각이들어 안심이 됩니다 이론을 탄탄하게 다지고 공부하면 마지막에 빠르게 회독가능할거같습니다 공부할때 끼고 살겁니다!! 짱좋아요
9791136007506,10,이책은 직업상담사를 준비하기위한 이론서인데요 보통 필기따로 실기따로 책이 많이 나와있는데 필기와 실기를 통합한 책이라서 더 좋아요 시험이 필기와 실기는 객관식과 서술형의 차이인데 시작부터 이론을 탄탄하게 다지고 공부하면 마지막에 빠르게 회독가능한 장점이 생깁니다 추천해요!
9791136007506,10,한 챕터의 이론을 공부하고 나면 바로 그 이론에 맞는 기출문제로 이론개념이 잘 정립되었는지를 확인할 수 있어서 좋을 것 같습니다. 그리고 자격증 시험이라는 게 매년 추가되는 기출문제도 있고 수정되는 이론도 있어서 최신 이론서로 공부하는 게 좋은데 일찍부터 준비할 수 있다는 점이 기대돼요
9791136007506,10,"법이 시험과목에 포함되는 책들은 항상 개정된 내용이 잘 반영되어있느냐가 참 중요한데, 에듀윌 직업상담사 대비 핵심이론서는 개정된 법과 출제기준을 반영해서 좋네요. 또 1차, 2차 시험 준비를 한 교재로 가능하게 해서 수험생들에게 가격 부담을 낮춰줘서 유용할 것 같습니다."
9791136007506,10,직상사에  관심이 많았는데 큰맘먹고 공부하기로 마음을 먹었네요. 까페도 가입하고 여러 인강들도 어떤지 정보를 찾아보니 많은 분들이 에듀윌이 까다로운 문제 출제에 잘 맞게 문제들이 수록되어 있다고해서 이번에 출시 예정인2021에듀윌 직상사 문제집이 참 기대됩니다.
9791136007506,10,"최신 반영이 된 문제집으로 1,2차 시험을 한번에 준비할 수 있다는 점이 정말 큰 장점인 것 같아요. 자격증 준비를 할 때면 항상 시간이 촉박하곤 했는데 에듀윌만의 노하우로 체계적으로 빠르게 준비할 수 있도록 도움을 주네요!!"
9791136007506,10,"﻿에듀윌에서 <2021 에듀윌 직업상담사 1, 2차 핵심이론서> 교재가 새로 출간 되었네요.. 직업상담사 시험은 2차가 주관식으로 정말 공부하기가 쉽지 않은데요.. 시간이 부족한 수험생들은 핵심요약집 교재로"
9791136007506,10,독학으로 1차와 2차를 동시에 준비하는 수험생들이 많은 시험인데 동차준비하려면 교재는 어떤걸 선택해야 하는지 막막합니다. 이번에 나온 에듀윌 핵심이론서는 개념은 확실하게 챙기면서 동차준비를 목표로 시간 절약까지 할 수 있는 똘똘한 책입니다!
9791136007506,10,"날이 갈수록 난이도가 점점 까다로워지는 직상사 시험을 3개년 기출문제와 1,2차 동시에 준비할 수 있는 핵심요약이 담겨 있어서 무난하게 잘 준비할 수 있을 것 같습니다. 그리고 기출 예상문제와 모의고사도 함께 수록되어 있어서 기출문제만으로 살짝 부족했던 문제풀이 연습을 더 할 수 있습니다."
9791136009289,10,"작년에도 이 책으로 공부를 했는데, 너무 유용했던 것 같아요 ㅎㅎ 기출문제는 다른 곳과 같지만, 해설에서 차이가 얼마나 나는지 알 수 있어요! 타 강의듣는 친구들도 이 책을 사서 공부하는 거 보면 에듀윌 책이 그만큼 좋다는 걸 알 수 있는 거 같아요:)항상 믿고보는 에듀윌 감사합니다 ㅎㅎ"
9791136009289,10,전에 써보니까 괜찮더라구요~ 다시한번 도전도전
9791136009289,10,군무원 15개년 기출은 물론 완벽한 해설이 돋보이는 에듀윌 군무원 기출문제집 기대됩니다
9791136009289,10,"이번에 군무원에 도전해보려는 직장인 입니다! 처음이라 많이 떨리지만, 에듀윌 15개년 기출문제를 보니 자신감이 생깁니다~"
9791136009289,10,군시생입니다! 에듀윌에서 이번에도 이렇게 15년간의 기출 문제를 정리하고 복원하여 문제집을 출간해주니 정말 고맙다는 말밖에 나오지 않습니다. 에듀윌의 기출 문제집 풀고 꼭 합격하겠습니다!
9791136009289,10,"올해 첫시험 준비중인 직장인입니다! 어떤 시험이든 기출이 가장 중요하다고 생각하는 사람인데, 마침 에듀윌 군무원 기출문제집이 나왔다고 해서 정말 기대 중입니다. 좋은책으로 열심히 공부해서 좋은 결과를 얻을수 있었으면 좋겠습니다^^화이팅!"
9791136009289,10,군무원을 준비중인 학생으로써 이런 기출 문제는 정말 저한테 많은 도움이 된다고 생각해요ㅎㅎ 다행이도 이번년도부터 기출문제를 가르쳐준다고하니 어떤 방식으로 나오는지 이제 알겠습니다.
9791136009289,10,자료가 많이 부족해 힘든 시험이었는데 에듀윌에서 15개년 기출문제집이 나와서 기대됩니다! 차근차근 개념부터 기출까지 학습하면 합격 해낼 수 있을 것 같습니다.
9791136009289,10,15년치의 국어 기출문제를 모두 수록하여 난이도 다소 어렵고 난해한 군무원 국어 공부를 효율적으로 할 수 있어서 좋은 것 같습니다. 그리고 상세한 해설은 물론 고난도 문제를 따로 풀어볼 수 있어서 실력점검을 위한 공부도 함께 할 수 있습니다.
9791164449347,4,그림이 많고 인쇄상태가 조잡함. 편집도 깔끔하지 못함.
9791136008909,10,신홍명 교수님의 국어 강의와 동형모의고사를 통해 합격하겠습니다.
9791136008909,10,실전과 같은 에듀월동형풀고합격하겠습니다
9791136008947,10,단기에 한식 조리기능사 필기 준비하는데 충분한 문제집이었습니다!개념만 있는게 아니라 각 개념 마무리 문제와 10회분의 모의고사 문제들이 더 꼼꼼하게 공부 할 수 있었습니다!
9791136008947,10,한식조리기능사 필기 준비하는데는 문제를 많이 풀어보는 것만큼 좋은 게 없는 것 같아요 추천합니다!
