ISBN13,rating,review
8809529011892,10,30대 후반의 나이에도 티비에서 빨강머리앤이 하면 챙겨보게되는 열혈팬입니다. 언제봐도 사랑스러운 앤을 달력으로 1년을 함께 보낸다면 더할나위없이 좋은 해가 될거같아요^^
8809529011892,10,코로나로 힘든 요즘에 하루 한번씩 긍정의 빨강머리앤을 만날 수 있는 일력이라면 바로 구매각이네요. ㅋㅋ
9791165342432,10,운동하기 싫어하는 사람들도 운동하게 만드는 책. 사진과 도표가 많아 이해하기 쉽다.
9791165342432,10,"어떤 나이라도, 어떤 이유라도 스쿼트를 처음 시작할 때 보기 좋은 책"
9791165342432,10,가볍고 누구나 실천할 수 있는 운동법!
9791165342432,10,정말 간단한 운동만으로 혈당 조절할 수 있는 방법을 알려주는 책
9791165342432,10,"근력운동에 초점이 맞춰진 운동이 아니라, 혈당을 낮추기 위한 운동에 초점이 되어있어 부담스럽지 않게 따라할 수 있었다. 실제 사례와 , 건강지식 , 그리고 맨뒷장에는 포스터 형식의 7초 스쿼트, 7초 푸시업 자세가 있어서 오려서 벽에 붙여두고 따라하기 기 좋게  알차게 구성되어 있다."
9791165342432,10,"매일 스쿼트를 하지 않아도 되고 일주일에 2번만으로도 효과를 볼 수 있다는 내용이 담겨있는, 하루만에 쑥- 읽힌 책이다. 간단한 건강지식과 쉬운 방법을 제시해주고 있으며 절취선으로 분리도 가능한 ‘7초스쿼트‘ 포스터까지 운동과 친숙해지기 딱 좋은 책이다."
9791165342432,10,짧은 시간을 투자해 근육을 만들 수 있다니 도전해 볼만 하다.
9791165342432,10,"건강을 챙기기 위해 스쿼트를 시작해봅니다,"
9791165342432,10,나이를 먹을수록 정말 필요한 건 근육! 7초 스쿼트를 통해 노후근육을 대비하자!
9791165342432,10,"일주일에 단 2번 ,하루 3분 당뇨 잡는 기적의 운동법 혈당이 쑥 내려가는 7초 스쿼트!"
9791165342432,10,부담 없는 운동으로 당뇨병을 비롯한 성인병을 잡을 수 있다니 구원 같다. 얇은 책 안에 필요한 지식만 알차게 담겨있다.
9791165342432,8,"지척에 산책로와 등산로, 호수를 낀 공원까지 두고서도, 집콕만 하는 귀차니스트에게 찾아온 구원서~"
9791165342432,10,7초 스쿼트의 동작은 먼저 양팔을 똑바로 앞으로 내밀고 양발은 어깨너비보다 넓게 벌린 채 선다. 그리고 5초 동안 천천히 허리를 낮춘다. 그다음은 넓적다리가 바닥과 평행시킨 상태에서 멈추고 2초 동안 유지한다. 마지막 동작은 반동을 이용하지 않고 일어선다.
9791190242462,10,좋은책입니다! 잘 활용하겠습니다
9791190242462,10,"항상 깔끔하게 핵심만 쏙쏙 만들어주신 유튜브 영상이 많이 도움이 되어서 책으로 출간되어서 편하게 요리할 수 있겠다 싶어 책으로 주문했습니다. 좋은 영상, 책 감사합니다."
9791190242462,4,유튜브 무니키친채널은 고급지고 깔끔한 느낌인데 책은 왜이렇죠? 표지부터 요란스럽고 편집도 약간 옛스럽네요.도서관에서 먼저 읽어보고 예쁜 요리책은 꼭 소장하는 편인데 코로나로 도서관을 못갔더니 이런 불상사가ㅠ  기대가 컸어서 실망이 더 컸습니다.
9791190242462,10,책 받았습니다. 레시피도 다양하고 초보자도 쉽게 만들수 있어서 좋네요ㅎㅎ매우 만족합니다~!
9791190242462,10,넘흐 기대되효감사합니다
9791190242462,10,평소에 레시피들 열심히 따라했어서 책을 구매했어요! 얼른 책 받아보고 싶네요 너무너무 기대가 됩니다ㅎㅎ
9791190242462,10,유튜브로만 보던 무니님 레시피를 드디어 책으로! 핸드폰은 동영상 다음으로 넘어가기 전에 멈췄다가 그사이 화면꺼지고 불편한점이 있었는데 책과함께 보면 너무 좋을것같아요. 감사합니다
9791190242462,10,다이어트 중인데 맛있는 음식을 참기 힘들다면 정답은 바로 이책에!
9791190242462,8,저탄고지 조리법때문에 구입했는데 이 책은 맞네요. 대부분 저칼로리 책이 더 많더라구요.—: 매우 구체적이고 실용적이나 간혹 초보에겐 힘든 요리법 있어서 별 한개는 뺐어요. 아주 유용할듯 싶습니다
9791190242462,10,유튜브에서 따라하다~책 나온다해서 바로 구입했어요^^ 내용  당연히 좋고~ 책 구성도 좋아요
9791190242462,10,키린이에게 너무 유용한 책입니다 ㅠㅠ
9791190242462,10,유튜브 잘 챙겨보고 있지만 바로바로 훑어보기엔 동영상의 한계가 있었는데 마침 책이 나와서!!행복합니다. 정갈한 느낌이 좋아요!중요한 내용은 아니지만 마파두부 덮밥 레시피 재료에 돼지고기가 빠져있어요~
9791190242462,10,저탄고지 키토제닉  관련 조리책들이 나올때마다 설레는 마음으로 구매하고 있습니다. 무니님 책도 너무 기대되네요. 유툽으로 도움 많이 받고 있어서 소식 발견하자마자  찾아와 구매합니다!
9791190242462,10,아직 책을 받아보지못했지만! 저탄고지 레시피북에 다이어트 지식도 함께라고하셔서 기대가됩니다!!
9791190242462,10,유튜브로 보다가 책이 나온다니! 기대!
9791190242462,10,유튜브를 보면서 기대했는데 드디어 출간되네요! 기대됩니다^^
9791190242462,10,유튜브 보면서 많이 도움 받았어요 책으로 나오니 반갑네요
9791190242462,10,무니키친 저탄고지식 기대하고 있어요.책으로 출간되면 더 가까이 하게 될 듯 해요^^
9791190242462,10,최근에 저탄고지 다이어트를 하면서 알게 되었는데 휴대폰으로 보면서 요리를 만들다보니까 불편했는데 오늘 유튜브를 보다가 책 출간 소식영상을 봐서 바로 구매했습니다! 책보고 더욱 열심히 해서 올해 원하는 다이어트와 건강을 찾고 싶어요~
9791190242462,10,"유투브에서 치즈케익 따라하면서 구독하게 되었어요. 만들기 쉽고 또 맛도 좋아 자주 만들게 돼요, 물론 건강에도 좋구요. 감사합니다. 책 잘 볼게요~^^☺"
9791190242462,10,유튜브로도 정말 잘 보고있었는데 책이 나온다니 너무너무 기대돼요! 언제나 실망시키지 않는 레시피로 믿고 따라하고 있구요❤️ 책을 구매함으로써 그 보답을 조금이나마 하는것 같아서 뿌듯합니당
9791190242462,10,무니님 레시피로 맛있는 저탄고지 다이어트를 할 수 있었어요. 이렇게 책으로 출간되어 너무 기쁜 마음입니다. 늘 좋은 레시피 개발 하시느라 힘들텐데 항상 감사한 마음입니다!
9791190242462,10,무니키친님의 모든 영상을 사랑하지만 먹으려는 레시피를 다시 찾고 영상을 보면서 요리하는게 조금 번거로워서 책 준비하고 계시다고 했을 때부터 나오면 바로 사야지 생각했어요! 유튜브 확인하고 바로 질렀어요! 늘 유용한 레시피 감사합니다! 책 발간 정말 축하드려요!!
9791190242462,10,저탄고지식을 시작하고 제일 도움을 많이받은 채널 무니키친입니다. 영상 틀어놓고 따라하는게 힘들어 책으로 나왔으면 했는데 정말 좋네요 ㅠㅠ
9791190242462,10,요리 똥손인 저도 유튜브 보면서 따라했었는데책으로 나와서 너무 좋아요안그래도 책으로 안나오나 궁금하던 참이었습니다 ㅎㅎ책 빨리 받아보고 싶어요~
9791190242462,10,진짜 맛있는 레시피여서 자주 따라해가지고 핸드폰으로 레시피 보기가 불편해서 책 나오길 너무나 바랬는데 나와서 너무 좋아요ㅠㅜ❤️❤️ 사은품도 어쩜... 감사합니다 무니님 고생하셨어요 어서 오기만을 기다릴게요❣️
9791190242462,10,유튜브 영상 보면서 레시피 정리된 책이 있으면 참 좋겠다 생각했는데 책이 나와서 무척 기뻐요! 책 참고해서 다양한 요리 만들어보겠습니다~ 감사해요
9791190242462,10,무니님 레시피는 진짜 요알못인 저를 크게 발전시켰습니다! 베이킹이면 베이킹 요리면요리 카페면카페 못하시는게 없는 금손무니키친님!!! 무조건 믿고먹는 레시피아닙니까!!!! 나만알고싶은 무니님 레시피지만 널리널리 더유명해져서 대박나세요!!!
9791190242462,10,유튜브 보고 맨날 따라했는데 이렇게 책으로도 나와서 너무 좋아요❤️❤️이젠 책 펴놓고 따라하면 더 편하게 요리해 먹을 수 있겠네요! 늘 좋은 레시피들 정말 감사합니다
9791190242462,10,너무 좋은 레시피책!!! 응원합니다.
9791190242462,10,무니님 축하드립니다   드디어 책이 나오는군요유튭으로  열심히  따라해먹었었는데핸폰영상이라  가끔  불편했었거든요  이제는  편하게  볼수  있겠어요기대하며  바로 예약 구매합니다축하드려요
9791190242462,10,유투브로 항상 잘 보고 있고 실제로 몇번이나 따라해서 먹어봤는데..베이킹까지 너무 맛있는 레시피들이었어요. 영상으로 보는거라 불편했었는데 책으로 나와서 너무 기뻐요!! 출간하면 바로 구입해서 따라해 볼 거에요!!! 너무 기대됩니다!!
9791190233309,10,면역항암제의 시대다. 면역이 새로운 화두로 떠오르고 있다. 저자가 수년간 기능의학을 연구해온 정성이 들어있는 책이다. 건강할때 면역을 챙겨야겠다. 한권 더 사서 친구에게 권해보려 한다.
9791187616696,8,얼굴위주다 보니 색칠하기 쉽진 않지만 그림이 너무 예뻐서 맘에들어요 다양한 소녀들이 그려져 있는데 아무래도 좀 다 비슷비슷하게 생겼지만 ... 그래도 맘에 들어요 감사합니다!
9791187616696,10,친구한테 선물하려고 주문합니다!행복해하면 좋겠네요 ㅎㅎ
9791187616696,10,아이돌 닮았어요~^^ 색연필로 이렇게 예쁘게 컬러링할수 있다니..대단하네요.
9791187616696,10,그림을 잘 그리고 싶어서 기대 되는 책.연습삼아 그려서 똥손이 금 손이 되길 기대 하며~
9791155361337,10,미싱한지 몇년은 되었지만 어려운건 못하고 있었는데 곁에두고 미싱하면서 보면 딱!!! 일것 같은 책이네욤^^이제 미싱의 달인이 되는건 문제없겠지요??^^열심히 책보고 한번 해봐야겠어욤~
9791155361337,10,공부를 할려면 교과서만 있어도 좋지만 참고서가 있으면 더 쉽게 접할 수 있지요이 책이 바로 재봉을 하는데 있어 참고서가 될 책입니다!!!! 알찬 구성에 옆에 두고 두고 볼 수 있는 편리함까지 아는 것도 다시 확인하고 모르는 건 알아가는 정말 좋은 책입니다~~
9791155361337,8,깔끔하게 정리가 잘된 쏘잉입문교과서라는 느낌이에요.설명도 자세하고 일러스트도 깔끔해서 가독성이 우수해요타이틀이 sewing basics 인만큼 쏘잉입문자들이 보기에 정말 좋은 책이라는 느낌이에요.내용이 충실하
9791155361337,10,두께가 두껍지않아서 내용이 빈약할꺼라고 생각하시면 안될꺼 같아요.작지만 알차게 핵심요소들로 구성되어 있어서 언제나 옆에 두고 활용하기에 딱인 재봉틀 지침서에요.독학하시는 분이시라면 필독서! 꼭 읽어보시기를 추천드립니다!
9791155361337,10,기본에 충실한 서적이네요. 하다보면 잊거나 가볍게 넘기게되는 기본중의 기본설명이 아주 잘 되어있어서너무 좋아요 ^^ 한번 더 초심으로 돌아가게되어서 ㅎㅎ조금 더 꼼꼼한 옷만들기가 가능하게 되었어요~굿입니당 ~ >ㅁ<
9791155361337,10,역시 즐거운 상상이네요^^ 표지부터 깔끔해요. 노트인데 핵심만 뽑은 요점정리노트느낌으로 순서도 방법도 깔끔하게 정리되어있네요. 헷갈리는 부분은 항상 검색했는데 손에 딱 들어오고 옆에 두면 진심 자주 보게될것같아요.
9791187330073,10,"사이먼북스 책들은 다 좋은내용임은 틀림없다. 존 맥두걸 박사, 하비다이아몬드, 더글라스 그라함 책 모두 읽었는데 다 강신원 역자이자 사장님이자 편집자님이 만든책이라 그런가 문체나 뉘앙스 표현모두 한사람이 쓴 책 같다. 반복되는 표현이나 말투도 그렇고 번역에 조금 의문이 생긴다."
9791187330073,8,자연식물식의 고전~
9791187330073,10,실천의 단계로 인도하는 묵직한 힘이 있는 책이다. 음식으로 날 망가트렸는데 이제 음식으로 나와 내 인생을 되찾고자 한다. 강추!
9791187330073,10,"개인적으로 맥두걸 박사의 자연식물식 책은 나에게 인생 서적이라고 할 수 있을 듯 하다.나름 채식인으로서 많이 공부했다고 자부해왔는대, 내가 생각했던 고정관념들을 모두 깨버리는 파격적인 서적이였다."
9791187330073,10,"살 안찌고 건강하게 사는 법, 그리고 윤리적으로 사는 법~ 나와 다른 생물들을 위한 삶을 살기위해 다짐한 지금, 너무나 필요한 책이에요. 결심이 흔들릴 때 책 읽으며 마음 다잡으려고 합니다~"
9791196031732,10,필라테스를 하면서 몸 속 근육의 움직임 하나하나에 조금씩 주의를 기울이게 됐어요. 동작에 따른 유기적인 근육 변화를 이해하고 운동을 하는데 도움을 주는 책입니다.
9791196031732,10,초보에서 고급까지 난이도별 다양한 응용 동작을 통해 필라테스를 제대로 배워볼수 있네요
9791196031732,10,정적인 운동으로 필라테스가 제격입니다
9791196031732,10,따라하기 쉽게 나와있어요
9791196031732,10,필라테스 교본으로 훌륭합니다.
9791196031732,10,이책대로 따라하면 필라테스가 어렵지 않네요
9791125429852,6,이런 지침서들은 두고두고 보는 책이라읽었다 강아지가 증상을 보일때나 다시 찾아봐야지
9791125429852,10,"개를 키우면서도 한 번도 이런 책은 생각을 안 했는데, 있네요.맨날 키우면서 이뻐할 줄만 알았지, 행동특성을 파악하게 되고 어디가 아파서 한 행동인지를 알게 해주는 점이 좋네요."
9788969520982,10,많은 기법이 들어있진 않지만 헛갈리는 장미수 놓기가 자세히 설명되어 있어 도움이 됐어요.
9788972219392,10,"오늘 배송 받아봤는데, 자세하게 예시가 나와있어서 세밀묘사에 도움 될거 같아요"
9788972219392,8,70대 어머니에게 선물해 드린 책. 꽃을 좋아하시는 어머니가 즐겁게 색칠하고 계십니다. 책의 짝수쪽에 채색된 그림과 사용된 색상이 나와있어서 홀수쪽 색칠할 때 도움이 된다 하십니다. 꽃그림이 크고 복잡하지 않아서 나이드신 어머니도 쉽게 작업할 수 있습니다. ^^
9788972219392,10,아름다운 꽃이 살아있는 거 같아요~~색연필로 사용해서 쉽고 간단하지만 너무 이쁜 꽃이 되네요♡♡힐링도 되면서 스트레스 풀리기엔  안성맞춤인데여~~ㅎㅎ
9788972219392,10,초보자가 쉽게 배울 수 있도록 도와주니 도움이 많이 되었어요
9788972219392,10,색연필로 이쁜 꽃을 컬러링할 수 있게 되어 있어서 스트레스 해소에 정말 좋을 것 같아요
9788971904299,10,도구 사용법과 실종류 도안보기가 상세하게 나와있네요 DVD까지 보니까 문화센터는 다음으로 미뤘어요 책으로 문화강자 봤는 느낌이네요.
9788971904299,10,서점에서 눈에 확들어와 책을 구입했습니다. 내용도 충실하고 따라하기 쉽게 잘 설명되어있더라구요 ㅎㅎ 추천합니당 ^^
9791190931328,8,비염환자들이 한번쯤 읽으면 좋다. 대단히 특별한 내용은 아니지만 많은 도움이 된다.
9791190931328,10,환절기 비염으로 고생하는 사람들이 많은데 코질환에 대해 제대로 이해할 수 있고 코질환과 치료법에 대해 쉽게 생활속에서도 따라해 볼 수 있도록 알차게 담겨있어 실천해 볼 수 있어요. 올바른 생활습관으로 코건강을 지켜나가는데 도움이 많이 되네요~
9791190931328,10,환절기와 겨울이 되면 비염으로 늘 괴로움으 반복중이 이책을 만나 반갑고 책을 읽고 좋은 습관을 배울수 있었다. 비염완치를 위해 책의 내용을  실천해 보려한다.
9791190931328,10,"성인이 되고 보니, 주변에 비염으로 고생한다는 사람이 꽤 많더군요.<1분이면 코가 뻥 뚫린다> 제목을 본 순간, 아! 마음도 환하게 뻥~ 뚫리는 시원한 느낌이!!코 관련 질병과치료법이 잔뜩 담긴 이 책, 천천히 여러번 읽어서 좋은 습관들을 하나씩 몸에 익혀가려고 해요."
9791190931328,10,코질환이 심한 가족이 있어서 읽어보았습니다. 실생활에서 실천할 수 있는 팁이 많아서 좋습니다.
9791160075618,10,"유럽의 사회문화적 특징을, 명문 축구 클럽들의 운영 철학과 역사를 통해 엿본다."
9791160075618,10,"축구를 책으로 배워서 축구지적능력을 기를 수 있는 정교한 책!! 축구를 좋아한다면, 유럽축구철학 이정도는  알아야죠!!"
9791160075618,10,유럽명문클럽의 역사를 만날 수 있는 서적
9791160075618,10,모든 스포츠에는 ‘이야기‘가 있다. 그 스토리를 따라가다보면 우리 삶의 이야기를 볼 수 있다. 그게 나는 참 좋다.
9791160075618,10,"이유 없이 승리하는 클럽과 독자적인 승리 방정식을 구축한 클럽, 갑자기 벼락부자가 된 클럽과 명장의 축구 철학을 구현한 클럽까지 유럽인들의축구에 대한 사랑과 열정은 계속된다."
9791160075618,10,축구를 좀 더 재밌게 즐기는 방법! 이 한권으로 유럽축구 완전정복!
9791187100966,10,코바늘잡는 기초부터 모든 과정샷과 설명이 상세히 설명되어 있어 초보분들도 어렵지 않게 배우실수 있는 책이예요!! 그리고 하나같이 이쁘고 귀여지 않은 아이들이 없어서 뭐부터 만들지 행복한 고민에 빠져 있어요!! 정말정말 도움이 많이 되는 책입니다!! 강추합니당
9791187100966,10,귀여운 동물인형만들기와 사랑스러운 사람인형만들기-다양하고 예쁜 손뜨개인형이 수록 되어 있어요.코바늘뜨기의 기초와 인형 만들기 기초를사진과 함께 상세한 설명으로소개되어 초보자들도 쉽게만들 수 있어요
9791187100966,10,까악~~~육아하느라 바뻐  시은맘님 책 나온지도 몰랐는데~~시은맘님 블로그 보고 알아서 알라딘으로 후딱 들와서 20일에~~주문해~~~오늘 22일 받게 되었어요~~~행복행복~~아직 많이 서툴르지만 한코한코 정성을 기우려 떠보겠습니다~~~노력을 통해 저도 어여쁜 인형이 나오겠지요♡
9791187100966,10,너무나 기다려지는 책입니다.빨리 받아 보고 싶어요
9791187100966,10,저또한 시은맘님의 클래스 101 수강했던 학생입니다:) 작품 하나하나 만들면서 또 다른 작품은 없을까 하다 책을 발간하셨다는 소식을 듣고 이렇게 바로 구매 하였네요!! 완전 기대중입니다!!
9791187100966,10,너무기대되요 얼른받아서 만들어보고 싶네요
9791187100966,10,시은맘님 광팬입니다~^-^ 클래스101 원데이 다 들었구여~~출판까지하시고 넘 기대됩니다 !! 구매완료!!!이쁜인형들 만들어주셔서 감사합니다♡
9791187100966,10,시은맘님 인형들이 너무 귀여워 평소 눈여겨봤었는데 드디어 책으로 만날수 있게 되어서 너무 좋아요.빨리 책이 왔으면 좋겠어요^^
9791187100966,10,인스타에서 눈으로 구경만했는데..이제저도직접떠볼수있겠네요너무기대됩니다.빨리받아보고싶어요
9791187100966,10,처음 시은맘님 작품보고 가서 배워보고 싶었지만 거리가 멀어서 아쉬워하고 클래스101도 수강해볼까 망설이기만 했는데(코로나시국 늘 아이와 함께라ㅠ) 시은맘님의 책이 나온다니 너무 기대가 되고 어떤 내용일지 궁금해요!! 구매했는데 예쁜 아이들이 가득할거같아서 설레네요♡
9791187100966,10,코바늘인형 책을 기다리는 저에게 시은맘의 도안을 볼 수 있다니! 코로나 시국에 집콕의 재미를 느끼며 어린 아이 있으신 직장분들께 선물해드려야겠어요! 기대됩니당!!
9791187100966,10,"드디어 오프라인, 온라인 강의에 이어 책으로 선생님의 인형들을 만나보게 되다니 너무 기대가 됩니다. 이번에도 부디 열심히 인형을 만들어야겠어요. 선생님의 실을 다 빨리 사용하길"
9791187100966,10,인스타보고 너무 귀여워서 책도 구매했어요.얼릉 만들어보고 싶어요.책 출간도 축하드려요^^
9791187100966,10,"남몰래 시은맘님 팔로 하고 작품들 눈여겨 보고 있었는데, 이렇게 책으로 나오다니요! 너무 감동인데요. 저도 이런 마음인데, 시은맘님께선 더 애틋하고 뭉클하실 것 같아요. 책출간 축하드리며 초판 뿐 아니라 2쇄, 3쇄 ... Nnn번쇄 하여 대박나시길 바라봅니다."
9791187100966,10,인형을 잘 뜨진 못하지만 너무 예쁜 인형이라 책이 기대됩니다!! 예쁜 책 만들어 주셔서 시은맘님께 감사드립니다.
9791187100966,10,너무 너무 좋아하는 시은맘샘의 도서가 나온다니... 바로 검색해서 예약구매 했답니다.작고 작은 귀엽고 이쁜 미니어처의 세계로 입문해보렵니다 . 언능 받고 싶어요
9791187100966,10,다른 뜨개 인형들과는 다른 매력이 있는것 같아요~ 빨리 받아보고 싶어요~~~
9791187100966,10,"101클래스 1,2차 모두 수강중인데 아직 완성은 못했지만 남은 기간안에 모든 인형 다 만들꺼에요!! 사실 인형옷 수강도응원 했었는데 안되서 넘 슬펐는데 책 출간 되서 그나마 위안 삼아요~ 출간 넘 축하드립니다 ♡"
9791187100966,10,항상 인스타랑 클래스로 잘 보고 있던차에 책까지 발간되여 너무 좋아요 얼른 받아서 만들어 보고 싶어요 ~^^
9791187100966,10,세상에 귀여운걸 이길수 있는 건 없습니다그 귀여운 손뜨개 인형들이 잔뜩 들어있는 책이라니!작가님의 팁도 한가득 들어있다니!두근두근 기다리며 기대평 남겨요~ ^^
9791187100966,10,귀여운 도안들 기대하고 있어요! 얼른 받아서 만들고 싶어요!
9791187100966,10,"101 수업 1, 2차 다 참여했는데 새로운 아이들을 책으로 만날수 있게되어 너무 기쁩니다. 어서 보고싶어요^^"
9791187100966,10,코바늘인형책중 다양한 제품이 들어있네요~천천히 도전해보려구요..넘 기대됩니다~^^
9791187100966,10,"우연히 인스타 방문했다가 빠져 든 뜨개 인형들을 만들어 볼 수 있어서 기대가 큽니다~ 빨리 떠보고 싶네요. 책 출간 축하드리고, 출간해주셔서 감사합니다. 대박나세요~!"
9791187100966,10,클원에서도 유명한 작가님 책이라 기다리고 있었어요! 쉽지만 완성도있는 인형 만들 수 있다고하여 더욱 기대중입니다.
9791187100966,10,시은맘님 인스타로 늘 보고있다가 책 나온다는얘기에 구매했어요!! 너무 귀여운아이들 이번기회에 만들어보고싶어요!!보기만해도 힐링되서 넘 기대됩니다!!
9791187100966,10,시은맘님 클래스101 첫 수업 듣고 코바늘 세계에 입문했어요! 라마 너무 떠보고 싶어요 얼른 받아보고 싶네요
9791187100966,10,기다렸어용.쌤 이쁘 작품들 만들어보고싶어거든요.
9791187100966,10,아수파우도 구매해서 예쁘게 만들었어서 더욱 기대하고있습니다 ! 빨리 받아서 만들어보고싶어요 !!
9791187100966,10,인스타로도 열심히 구경하고 전에 빨간머리앤 키트도 구입했었고 팬이었는데 이렇게 도안집이 나오다니 너무너무 좋네요. 뜨개인형 만드는 분 작품 중에 제일 좋아하는 작가님이새요~
9791187100966,10,인스타와 클래스 101 통해서 잘 보고 있던 작가님의 책이 나온다니 기대가 됩니다~~~^^ 당장 만들지는 못하겠지만 소장각입니다~~♡ 출간 축하드립니다~ 책 기대할께요^^
9791187100966,10,예전부터 기다리고 기다렸던 책이 출판돼서너무나 기쁩니다!!열심히 만들어볼게요 감사합니다~
9791187100966,10,인스타보고 넘 이뻐서 구입했어요~ 기대되네요
9791187100966,10,클래스101수업듣고 있어요 책출간 소식듣고 바로 구매했어요 기다림조차도 셀레게 만드네요 축하드립니다~^^
9791187100966,10,시은맘  인형완전 좋아요~원츄~~~~저도 곧고고입니다~
9791187100966,10,인스타로 귀여움을 탐닉만 했었는데 이제 직접 도안보고 떠볼 수 있을 것 같아서 두근거립니다.얼른 받아서 하나하나 귀엽게 만들고 싶어요!!
9791187100966,10,클래스에서 첫만남^^~  시은맘님의~~책~~정말정말 기대되어요~  색감도 넘넘 이쁘고 인형도 넘~~ 아기자기 이쁜~얼른 책 받고 싶어요~~축하합니다~
9791187100966,10,시은맘님의 인형들은 늘 기대를 져버리지 않아서책나온다는 소리듣고 달려와서 바로 구매했어요.막 두근두근 ㅎㅎ 책출간하신거 진심으로 축하드립니다.
