ISBN13,rating,review
9791187194729,10,아기 시츄 아찌와의 즐거운 소통을 위해 구입했는데 참 사길 잘했단 생각이 드네요. “개는 개다. 개는 개니까 막 대해야 된다는 것이 아니라 개는 사람이 아니니 개 그 자체로 이해하고 존중해야한다.” 무지개다리를 건넌 저자의 반려견에게 부치는 편지에서 참 많이 울었네요..
9791187113331,10,패턴 공부 시작하는데 그림과 설명이 상세해서 전 시리즈 구입했습니다.
9791187113331,10,"패턴학교 책은 다 원서로 사다가 이것만 번역본으로 구매했는데, 확실히 원서보다는 한글이라 눈에 잘 들어오네요. 그렇지만 전부 번역되지는 않아서 원서 구매해도 별로 다를건 없을 것 같아요. 책 구성 좋고, 패턴도 좋습니다."
9791185346946,8,인간의 온갖 질병은 자연으로부터의 격리에서 비롯되었다. 접지(earthing)하고 발바닥을 지압함(reflexology)으로써 신경계와 혈액계를 정상화시킨다. 결국 몸의 모든 신호가 정상으로 돌아온다. 하루 20분 이상하면 효과가 좋을 것 같다. 흙밟을 땅이 도시에 별로없지만 찾으면 있다.
9791188726295,2,패턴북을 사는 이유는 패턴뜨기가 싫어서인데 옷 핏이 안맞으면 어쩌자는거죠 바지가 너무거서 ㅋㅋㅋㅋㅋㅋㅋㅋㅋㅋㅋㅋ아 열받네
9791188726295,10,생각보다 다양한 옷의 패턴이 있어 만족.
9791188726295,6,오비츠 11 인형이 있다 보니 이 교과서를 너무 사고 싶어서 구매 했습니다.하지만 타이트한 스키니한 느낌의 바지를 입힌다거나 한다면 패턴을 좀 수정 해야할거 같네요.후드티 랑 바지 만들어 봤는데 오버핏 셔츠도 많이 나오다 보니 후드티는 너무 귀엽네요.
9791188726295,10,원작에서도 책 중간 중간에 패턴이 있어 사용하는데 불편함이 있다는 글을 본 적이 있어요. 혹시나 한국어로 발간될 때에는 부록으로 따로 내주지 않을까 내심 기대했는데 원작이랑 똑같이 중간에 패턴이 수록 되어 있네요. 오비츠11 바디에 비해 패턴이 크게 나온거 같아요 참고부탁드립니다.
9791187616481,10,뜨개 블랭킷이 갖고싶어 두달전부터 코바늘을 배우기 시작한 저도 금방 이해할 만큼 정말 친절한 책입니다. 블랭킷을 뜨고 싶은데 색 조합과 패턴 조합이 어려우시다면 꼭 사세요.
9791187616481,10,아기자기한 다양한 색상으로 따뜻한 겨울에 어울리는 블랭킷 만들어 보고 싶었어요!더군다나 코바늘로 블랭킷 만드는 책이 출간되어 너무 기쁩니다 :)어떤 다양한 도안으로 책에 담겨있을지 너무 기대 됩니다!
9791187616481,10,30가지의 다양한 패턴으로 만들어 볼수 있는 블랭킷~ 파스텔톤의 블랭킷과 보기만 해도 따뜻해 보이는 블랭킷이 가득한 책인 것 같아요~^^
9791187616481,10,다양한 디자인과 배색이 너무 예뻐요! 예쁜 블랭킷들을 어떻게 만들어낼지 기대되는 책 이에요.
9791189709068,10,"책의 구성이 장미를 키우는 초조자에게 도움이는 되는 내용으로 1. 4계절 1년 12달에 날씨와 상황에 대한 대비와 예방을 위한 해야할 일들과 꼭 필요한작업에 따른 물품도 설명해주고, 2.우리집 환경에 맞는 장미를 선택할 수 있는 방법 등이 아주 미음에 든다. 저자에게 감사를 전한다~^^"
9791189709068,4,장미 종에대해서는 자세히 나와있는데 키우는 법은 조금 간단히 나와있어 생각했던 실용서는 아닌것같아요.
9791189709068,10,"식물은 각각의 특성마다 주어야 되는 거름과 방제 등등이 다르고,특히 장미는 아름다움에 정비례하여 많은 수고로움을 원하는데 치치의 사계절 장미정원은장미집사가 알아야 하는 세세한 내용들이 알차게 들어 있어 초보 가드너들에게 적극 추천합니다.다가오는 봄이 기대됩니다."
9791189709068,10,장미에 대한 사랑과 열정으로 그동안의 노하우와 정원의 기록을 담은 책이라니 너무나 기대됩니다. 장미만의 정보와 노하우가 담긴 책을 찾기 어려웠는데 만나게 되어 참 기쁘네요!
9791188907427,6,저는 옆에 그림 그릴 수 도 있는 책인 줄 알았는데 설명만 나와 있어서 받아보고 약간 실망했어요 ㅠㅠ 제가 제대로 안 찾아본 탓이죠 ㅠㅠ 그래도 자세하게 설명되어 있어 좋습니다
9791188907427,10,인스타 오일파스텔 체험단에 뽑혀 키트 체험 해보았어요~어릴때 크레파스로 그림그리던 느낌이 나서 설레고 신나는 체험이었습니다~쓱쓱 그리면 멋진 그림이 완성되어서 너무 기분좋았어요~
9791188907427,10,그림에 대한 솜씨가 없어도 쉽게 재미있게 그려볼수 있어서 참 좋았습니다 추천합니다
9791188907427,10,오일파스텔의 첫걸음은 이 책으로! 사랑스러운 오일파스텔의 매력에 푹 빠지게 될 거에요!
9791188907427,10,키트로 체험해봤는데 재미있었어요   쉽기도 쉽고 그리면서도 힐링이 되서 좋았어요  오일파스텔이 아니여도 크레파스로 아이들과 같이 그려도 될것같아요
9791188907427,10,체험단 키트로 튤립을 그려보았는데 처음 해봤지만 쉽게 따라할 수 있었습니다! 컬러도 잘 알려주시고 블랜딩할 때도 쉽게 할 수 있게 사진으로도 잘 나와있네요 다른 꽃들도 그려보고 싶어요~^^
9791188907427,10,"스텝 바이 스텝으로 아주 친절히 잘 알려주는 훌륭한 교본입니다. 초보도 쉽게 따라할 수 있게 상세히 잘 안내되어 있어요. 특히 칼라매치에 대해 안내하는 부분이 유용했습니다.사두고 여유가 없어 따라하지 못 해도, 소장용으로 보고 즐겨도 괜찮을 만큼 참고 작품들이 예뻐요."
9791196080235,10,"PT를 받다가 근막이 궁금해져서 산 책인데 너무 좋습니다. 근막통증증후군에 대해 잘 나와있네요. 빈칸을 채우며 읽기때문에 학습하기 좋게 되어 있고, 무엇보다 책사이즈가 맘에 드네요.(얇고 간결. 저는 이런 책이 좋아요!) 전편 ‘해부학 쉽게 공부하기‘도 살 계획입니다!"
9791189199500,10,"‘무엇을, 얼마나‘ 먹느냐 만으로는 살을 뺄 수 없다. <언제, 몇 번만> 먹느냐가 인슐린 콘트롤의 관건!"
9791189199500,8,"칼로리 보다는 무엇을 먹느냐, 인슐린이 우리 몸의 체중 유지에 어떤 영향을 주는가에 대해 알게되었습니다."
9788997772292,10,좋은 책 잘 받았습니다.종이접기 하시는 분들은 필수 구매 하십시요 정말 알찬 책입니다.내년에 나올 시리즈가 기대 되네요!
9791160505207,10,"상식사전, 이런 책팔이 시리즈 별로 좋아하지 않습니다만, 이 책은 제목만 부끄럽지 내용은 꽤 알차고 재밌습니다. 골프를 즐긴 시간이 꽤 오래됐는데도 이렇게 모르고 있는 부분이 많은줄 몰랐습니다."
9791160505207,10,와인을 대화주제로 하다가 커피로 넘어갔다가 수제 맥주까지 도달했습니다. 여름휴가때 골프이야기를 하게되니 기본 상식이 꾀 있다고 착각하고 있었네요. 상식사전 전체 시리즈를 발견하고 머리속 상식 정리한번하려합니다.
9791160505207,10,'골프  상식사전'  고급 스포츠란 인식이 깊었던  골프에 누구나  쉽게 시작할 수 있는 기본양식과  상대방에 이기려는  골프가 아닌 진정한 매너 스포츠로써  지켜야 할  모든 것이 들어있는  고급스러운 상식책입니다.
9791186886755,6,조금 어렵지만 나름 재밌게 한거같아요. 전 하다가 포기했고 제친구는 끝까지 다했어요.
9788998866129,10,인정 하지 않을 수 없는 책다른 책에서 뒤지고 뒤져도 나오지 않은 내용을 이책에서는 자세히 다뤄주고 있네요세세한 궁금증들을 책에서 가볍게라도 다뤄주고 있으니 무척 만족합니다
9788998866129,10,가볍게 들고 다니면서 읽기 좋은 책.
9788998866129,10,타로카드의 상징을 해석하는 것은 자의적인 상상이 아니라 다양한 맥락에 대한 이해와 통찰을 통해 그것이 인도하는 개념의 세계로 나아가는 정교한 작업입니다. 대한민국의 서점에 이런 책이 있다는게 놀랍습니다. 가독성이 떨어진다는 분은 독서량이 매우 부족한 것으로 보입니다.
9788998866129,10,이걸 이제 보다니ㅋㅋㅋ 현업자들이 보면 매우 부끄러울 책이다.이 책을 보고나서야 상징공부를 어떻게 해야하는지 배웠다. 그간 제대로된 공부없이 대충 근거가 부실한 입문자용 책 몇 권 보고 시작한 사람들 많을텐데 입문자에게든 숙련자에게든 확실한 길잡이가 되어줄 것 같다.
9788998866129,10,입문자 용은 아닙니다. 하지만 타로를 어느정도 학습하신 분이라면 근원을 알아야 파생된 해석과 리딩이 가능합니다. 풍부한 해석과 오류 없는 리딩을 위해서라면 꼭 일독하시길 바랍니다. <누드 제본이라 불편하실 수는 있습니다. >
9788998866129,2,책에 책등이 없음. 책 몇번 펼치면 책장 다 떨어져서 흩날릴 것 같이 생김. 문의해보니까 누드제본이라고함
9788998866129,2,카발라/연금술 선행지식 없이 보는 사람들에게는 매우 불친절한 책입니다. 나름 상징학에서 발췌한 주석을 인용했는데 A.E.웨이트가 의도한 이미가 아닌 자의적 해석으로 비춰지며 무엇보다도 현업자들도 혀를 내두를 정도의 가독성입니다. 이해하고 보면 쉬운 것도 어렵게 써놓았습니다. 비추입니다.
9788998866129,10,저자는 입문자들이 알아야 할 내용이라고 하지만 솔직히 어느정도 타로를 할 줄 알고 봐야 할 책.인터넷의 떠도는 근거없는 지식말과 제대로 된 지식을 원한다면 적극 추천.나에게 가장 좋았던 부분은 제일 뒤 관련도서목록을 보고 연계해서 공부할 수 있는 점.
9788998866129,10,"우아 메이저카드도 들어있어요! 초보자용 다 읽고샀습니다!초보자용 사실 때 동시 구매를 추천드려요. 초보자용 읽을 때, 카드가 배송중이라 보면서 읽을 수 없었어요. 카드와 같이보면서 읽으면 이해하기 좋답니다."
9791196311223,10,감사하게 잘 읽었습니다. 도움이 많이되었습니다.
9791188601066,10,기다리던 번역본!! 앞의동화도 너무 귀엽고 패턴 설명 및 구성도 알차요!! 책을 보자마자 막 만들고 싶은 욕구가^^* 생겨요!!귀여운 곤충 만들기!!
9791188601066,10,기다리고 기다렸던 한국말 번역본입니다역쉬 라리라라는 실망시키지 않는군요^^동화책한권과 코바늘도안집한권 두권의 책을 얻은거같은 곤충손뜨개인형코바늘패턴북!!! 완벽하게 맘에드네요더 많은 후기는 https://m.blog.naver.com/lelele7454/221297402446
9788980974337,10,"얇아서 성과물 내기 좋고, 매일 반복 적용하기 좋아용"
9791160072440,10,글쓴이가 개괄적으로 ˝나는 내 농장을 이렇게 꾸몄다˝를 예쁜 사진들과 자신이 만든 부케작품을 통해서 보여줍니다. 전문적이진 않습니다만 예쁜책입니다.
9791160072440,10,책 너무 예뻐요~ 사진이 하나같이 다 아름다워서 저도 화원 이쁘게 가꾸고 싶네요. 화단이라도 예쁘게 가꾸고 싶은 욕구가 물씬 풍기는 책이예요.
9788901220970,10,"영어원서책도 있는데 한국어로도 소장하고 싶어서 구매했습니다. 카드도 정말 너무 예쁘네요. 카드 퀄리티에 대한 말이 있던데, 가와이타로덱보다 훨씬 두껍고 퀄리티 좋았습니다(가와이 덱은 정말이지..). 영어 원서책보다 종이질 정말 좋고, 칼라 프린트도 예술입니다. 역시 인쇄기술 한국이 최고!!"
9788901220970,6,왜 메이저덱만 있는가..카드 때문에 산건데 제대로 안 읽어보고 산 제 잘못이죠..그리고 아는거랑 해석이 다른 점이 많아서 새로 공부하는 기분이라 어렵네요ㅜ
9788901220970,10,재밌어용 !@ 카드는 새로 사야되지만 ㅋㅋㅋ
9788901220970,6,카드 별 해석이 면밀하고 키워드 수는 많지만 실질적인 해석에는 그다지 도움 되지 않는다.
9788901220970,10,카드 너무 이쁘고 책 내용 정리가 잘 되어있어서 좋았습니다♡♡ 다만! 만물상 작가님께서 마이너 타로 카드도 그려주신다면 좋겠습니다♡
9788901220970,6,웨이트덱의 상징체계를 어느정도 아셔야 좀 쉽게 진도를 빼실 수 있을 것 같습니다. 기초강좌나 입문서 접하신 분들은 딱 복습 용으로 좋겠네요. 부록은 정말 너무해요ㅋㅋ 도저히 들고 리딩할 수 있는 품질이 아닙니다. 만물상님의 고운 그림을 어떻게 이런 마분지같은데 인쇄할 생각을 하셨는지..ㅠ
9788901220970,6,타로카드 일러스트가 너무 예쁜건 인정하지만 책 속 내용은 참.. 키워드나 해석문장 위주가 아닌 카드를 들여다보고 그 깊은 뜻을 이해해보자 위주의 설명인데 솔직히 막 와닿거나 하진 않았습니다. 표현 자체가 좀 뜬구름 잡는 듯한 표현도 꽤 있었어요
9788901220970,6,책은 관심없어서 모르겠고 카드때문에 구매했는데 그림은 너무 예뻐요. 카드 꺼낼려면 책 비닐커버 잘라내야 해서 불편하고 책안에 부록카드 그림이 있는 것도 아니고 그냥 카드만 따로 판매했으면 좋았지 않았겠나 싶어요.
9788901220970,2,현직 타로마스터임. 카드 품질이 너무 떨어짐. 하기야 이 가격이니 의심했어야는데.  쩝
9788901220970,10,"레이첼 폴락님의 책을 좋아해서 구입했어요.만물상작가의 그림은 개인적으로 별로 좋아하지 않아서...타로의 상징성을 괜히 해칠까봐 우려했는데..나쁘진 않네요^^책 내용은 완전 강추!입니다.올만에 영감 가~득~한, 인생의 선물같은 책!!!"
9788901220970,6,만물상 작가분의 그림체를 좋아해서 구매했는데 만족해요. 책은 좀 어려웠어요. 정방향과 역방향일 때 가지는 의미도 좀 한정적이어서 아쉬웠어요. 다양한 예시와 그림 설명이 있었다면 더 좋았을듯 해요.
9788901220970,10,"만물상 작가님의 메이저카드가 탐나서 구매하게 되었습니다. 그림은 굉장히 예쁘고 아름다운데, 카드 퀄리티는 좀 많이 낮은 편이에요. 스프레드용은 아니고 소장용이네요. 책 내용은 기대 이상입니다. 술술 읽기 좋고, 입문용으로 다른 책과 함께 읽으면 좋을 것 같습니다."
9788901220970,8,비닐커버가 씌워져 있길래 책을 더럽히지 않고 볼 수 있어 좋다 싶었는데 뒤에 타로카드가 비닐커버 안에 들어있어서 카드를 꺼내려면 커버를 잘라야 해서 좀 아쉽네요. 카드는 따로 들어있었으면 더 좋았을거 같아요. 그래도 카드 일러가 넘 이쁘고 내용도 충실해서 좋네요.
9788901220970,4,완전 초보자가 보기에는 좀 어려운 것 같아요. 타로카드 그림이랑 책에 설명된 부분이 같았으면 하는 아쉬움이 있네요
9788901220970,8,타로는 처음인데 이해가 잘 안되는 부분도 많았어요ㅜㅁㅜ 개인의 차이겠지만 조금 어려웠습니다. 그래도 타로카드는 예쁘게 잘 왔어요! 배송은 2일인가 3일인가 일찍 왔습니다!
9788901220970,8,이제10대가된 초딩조카에게 상납하였습니다.. 왜 마이너덱이 없는지 추궁당하였습니다.. 마녀의 자질이 충분한것 같습니다..
9788901220970,10,입문자에게 좋은챡
9788901220970,10,"사진과 동일한데 실제로 배송 받고 보니 더 예뻐서 홀딱했고, 한번 책을 읽기 시작하면 멈출 수가 없어 끝까지 다 읽게 되었다.기본에 충실하되, 지루하지 않고, 심플하게 잘 정리되어 있어서 좋았다."
9788901220970,10,타로 카드 진짜 예뻐요 하루에 한장씩 뽑으면서 운세 점 쳐볼래요 ㅋㅋ
9788901220970,10,책 내용은 1도 관심이 없고 순전히 카드가 예뻐서 구매했어요 ㅋㅋㅋㅋ 그림이 참 예쁘네요 ㅋㅋㅋ
9788901220970,10,만물상 작가님 타로카드가 정말 예뻐요...타로 카드 관심없는데 일러가 탐나서 구매했네요
9788967441845,10,반복적인 말들이 자주 나와서 그랬지만~내용상으로는 새로운 생각을 할 수 있게 좋았습니다. 그리고 책 제목을 정말 잘 지었다고 생각해요
9791133450176,8,좋은 기회에 귀여운 자수책을 받아보게 되었다 ​요즘 고양이들이 귀엽고 귀엽다 아기자기한 자수로 나타내니 당장이라도 나에게 달려올것만 같다 ​​난로 앞에 앉아 즐겁게 자수 놓을 생각뿐이다 ​100가지 이상의 자
9791158950705,10,매일접어요. 어려운만큼 성공하고나면 보람도 백배~~^^접기가. 능숙하고 도전하기 좋아하는친구들께 강추!!
9791158950705,10,정교하고 색종이 한장으로 접을 수 있어 좋다. 이번 책은 종류가 다양하지 않은 대신 다양한 무늬의 색종이가 포함되어 좋다. 난이도는 어른도 접기 까다로운 수준이다.
9788969521248,8,스티치 방법 설명은 좋은데 초보에게는 많이 어려운 책이었다. 그리고 노안이 웬수라 흰실 스티치 책들 죄다 정리 ㅠㅠ
9788969521248,10,가격 착해서 별 드려요 ~구성 내용 좋아요 ^^
9788964942642,10,흥미롭네요관심이 많았는데 재미있게 봤네요
9788964942642,10,매니아와 관심자 사이에 적당히.레어템.
9788984319813,10,재밌고유익해요!
9788984319813,10,진짜 사시면 절대 후회 안하실 정도로 좋은 책이고 너무 재밌고 중간에 툰으로된 스토리도 읽어가면서 색칠하는 재미가 너무 재밌어서 좋았어요
9788984319813,10,스트레스 해소용으로 샀는데 너무 재밌어요. 엽서북도 사고 싶어요
9788984319813,10,다른 컬러링북들은 너무 단순하거나 너무 복잡해서 항상 질렸었는데 딱 적당한 난이도에 만화 형식으로 되어있는 부분들도 있고 종류도 다양해서 질리지 않아요 :)
9788984319813,10,아이랑 잼나게 하고있어요
9788984319813,8,"처음부터 아주 유명한 컬러링북을 사서 생각보다 너무 진도가 나가지 않아, 그게 오히려 더 스트레스가 되기도 해서 아쉬웠는데, 이 컬러링북은 적당히 단순, 적당히 복잡하면서도 이야기가 있는 책이어서 더 재밌게 여가활용 삼아서 할 수 있어 좋은 것 같습니다."
9788984319813,10,"와, 이런 느낌이었구나! 이 책을 먼저 사서 갖고 놀다가 오히려 웹툰을 가까이 하게 된 1인입니다. ^^ 마구 식욕이 끓어올라 분식점에라도 달려가게 될 것 같은데 의외로 시각적 포만감이 질높게 채워지는 탓인지 제 경우는 이 책 때문에 먹거리를 찾게 되지는 않아요.암튼 그냥 보기만 해도 재밌어요."
9788984319813,10,그림이 참 맛깔스럽게 잘 그렸어요.. 저두 그렇게 그리고 싶었는데 힐링이 될거같아요..
9788984319813,10,책보다가 책뜯어먹게 생겼어요.. 너무 리얼학
9788984319813,10,컬러링북 되게 좋아하는데 구매하고 싶네요. 그리고 그림도 진짜같아요! 칠하면서 재밌게 칠할수 있는 컬러링북인 것 같습니다! 가지고 있기만 해도 든든한 책일 것같네요^^
9788984319813,10,넘 귀여운 책이네요~컬러링북 좋아하는데 꼭 구매하고 싶네요~^^
9788984319813,10,웹툰 재밌게 봤는데 컬러링북으로도 만나볼 수 있어서 좋아요 일러스트만 있는게 아니라 작가의 코멘트와 메뉴 소개 등 다양한 읽을거리도 있어서 지루하지 않고 재밌고 즐겁게 색칠 할 수 있을것 같아 더 좋네요
9788984319813,10,엽서가 엄청 귀여워서 쓰기가 아까울 정도네요. 컬러링 북이지만 그냥 보는 것만으로도 배부른 책이에요
9788984319813,10,"오무라이스 잼잼 웹툰의 팬으로서 이런 특별한 컬러링북이 나온 걸 보니 정말 기쁘네요~ 오무라이스 잼잼에 나오는 작가님이 정말 잘 묘사해서 그린 음식 일러스트들을 좋아했는데, 직접 컬러링할 수 있다니 기대가 큽니다."
9788984319813,10,"음식 컬러링북이라니! 제가 아는 거라 더 재밌게 칠할 수 있을거같아요!ㅋㅋ기존에 나왔던 다른 컬러링북은 대부분 옷이나 그냥 일반 무늬, 패턴 등이라 별로 흥미가 가지 않았거든요. 조카랑 같이 칠하면서 다음엔 이거 먹을까? 이런 식으로 얘기도 할 수 있을거같고^^ 좋아요!"
9788984319813,10,"책 제목 부터 한눈에 쏘오옥~ 들어오네요^^시선을 잡아끌듯 재밌는 먹거리 이야기에 아트한 일러스트 ｀오무라이스 잼잼｀은 눈으로 즐기고 마음으로 먹는 정성이 듬뿍 담긴 책이 아닐까 싶습니다.책의 기대감을 주는 재밌는 먹거리 이야기에 빠지다 보면, 왠지 활력보충까지 될것 같아요~"
9788984319813,10,음식일러스트에 대한 흥미가 있었는데 마침 관련도서가 출판되었네요기대되고 흥분되네요!!
9788984319813,10,오무라이스 잼잼을 재미있게 보았는데 그것을 소재로 한 컬러링북이라 기대됩니다.
9788984319813,10,요즘 요리에 관심을 갖기 시작했는데 400여 일러스트로 꽉꽉 들어차있다고 하니 구매해서 읽어보면 도움이 되겠습니다.
9788984319813,10,다양한 음식을 주제로 한 컬러링북이라 눈도 즐겁고 하나하나씩 컬러링 하면서 맛있는 음식을 먹는듯한 대리만족도 느낄수 있을것 같네요.
9788984319813,8,보기만해도 재미있는 컬러링 북이네요 즐거움과 식도락을 대신할~
9788984319813,10,음식을 주제로한 컬리링북이라 기대됩니다.
9788984319813,10,컬러링도 재미있는데.. 알록달록 먹고 싶은 음식을 칠하는 책이라니... 너무 재미있고 색칠하면서 배고파질것같아요^^
9788984319813,10,다이어트의 적이다. 색칠하다 보면 넘넘 먹고 싶게 만드니까~!!!
9788984319813,8,초등학교 인기있는 책중 하나인 오무라이스 잼잼의 컬러북이라니 정말 색칠하면서 먹고 싶은 생각이 막 들거 같아요 화려한 색으로 칠하고 감상해보고 싶네요 정말 재미있을것 같아요
9788984319813,10,맛있는 음식 그림을 색칠하면 마음이 풍요로워질것 같습니다.
9788984319813,10,음식이 일러스트러 그림으로 나온 컬러링이라서 그런지 색칠하는게 재미있고 정말 재미있게 구성되어 있어서 만족하고 재미있습니다.
9788984319813,10,보통 시중에 판매되고 있는 컬러링 북들은 꽃 아니면 풍경 같은 그림들만 있었는데 이 책은 특이하게 우리주변에서 볼 수 있는 먹거리를 소재로 하여서 흥미가 생기고 볼 때마다 식욕이 돋는 희한한 컬러링북 같다. 기대된다.
9788984319813,10,컬러링 재밌어보여요! ㅎㅎ
9788984319813,10,컬러링이 참 예쁘고 맛나게 보입니다. 맛있는 것들을 색칠하면서 군것질을 같이 하면 참 행복하겠네요. 추천합니다.
9788984319813,8,색감이 더해진 컬러링 북 무척 기대가 됩니다.대상을 좀 더 선명하고 세밀하게 독자에게 전달할 수 있도록 만들어져 있어 보는 사람들에게 흥미를 더해 줄 것 같습니다.
9788984319813,8,"저자의 오무라이스 잼잼 만화책을 보면서 음식, 그에 대한 추억등을 떠올리며 침을 질질 흘렸었는데(절대 배고플때 보지 않는 책), 컬러링 북으로 나왔네요. 오무라이스 잼잼 책보다 좀 더 그림이 디테일하게 그려진 듯 하네요. 일단 먹는 것이라 참 좋은데, 문제는 색칠하면서 다이어트는 저멀리??"
9788984319813,10,최고의 컬러링북 입니다!
9788984319813,10,그림쟁이 한테 선물해주면...무척 기뻐해줄 것 같은데...더구나 소재가 신선하네요.
9788984319813,10,컬러링 북ㅋㅋㅋㅋㅋㅋ 음식 스케치해도 다른 그림체일듯
9788984319813,8,음식 일러스트를 보는 것만으로도 군침이 돌고 다양한 음식에 마음까지 행복해지는 색다른 컬러링북 같아요.
9788984319813,8,"나도 쉐프는 될 수 없어도,컬러링 쉐프는 될 수 있을 것 같아요.일상음식의 컬러링이라 더 기대됩니다."
9788984319813,10,먹방이 유행인데~ 사고 싶은책~ ^^
9788984319813,8,기대됩니다~
9788984319813,10,컬러링북 기대되고 추천드려요^^
9788984319813,10,음식컬러링북 기대됩니다~
9788984319813,10,음식만화는 진리죠...기대됩니다
9788984319813,10,음식을 소재로한 컬러링북을 통해서 책과 독자가 1:1로 소통하는 새로운 형태의 1인 쿡방과 같은 느낌을 주는 신선한 책이다.
9788984319813,10,"평소 좋아하던 웹툰인데, 이렇게 컬러링북으로 나오니 좋네요 !"
9788984319813,10,"컬러링북이 이제는 이렇게도 나오는군요. 단순히 색칠만하는게 아니라 비하인드 스토리도 읽고, 색칠도 하고 작가의 코멘트도 읽으면서 추억을 되새길 수 있어서 좋을 것 같아요!"
9788984319813,8,그림만으로도 궁금증을 유발하는 책이네요
