ISBN13,rating,review
9791186274620,10,나 혼자 떠나는 백제 여행이라니! 코로나19가 잠잠해지면 역사 교과서에서는 만날 수 없는 ‘살아 있는 역사 공부의 현장‘에 한번 떠나보고 싶어요.
9791186274620,10,"일상에, 부끄럽지만 얇은 배경지식에 별재미를 누리지 못한 박물관을 보다 풍요롭고 뜻깊게 만들어줄 책이라 눈길이 가네요. 밖으로 나갈 수 없는요즘, 위안과 대안의 책이 될것같네요"
9791186274620,10,역사도 배우고 여행도 즐길 수 있어서 의미있는 시간이 될 것 같습니다.
9791186274620,10,백제에 대해 궁금한 부분을 흥미로운 여행으로 풀어 보며 배울 수 있어서 좋아요.
9791186274620,8,간단한 백제 역사 기행을 하려고 할 때 초안을 잡을 수 있는 책이다.
9791186274620,10,"여행은 커녕 당연하다고 생각했던 일상조차 일정부분 멈추어버린 지금, 덕후 출신 역사학자를 따라 <일상이 고고학> 시리즈를 보면서 집콕 여행을 즐기는 기분도 괜찮은 듯 합니다."
9791186274620,10,일상이 시리즈의 두번째 도서. 이번엔 백제 여행입니다. 거창한 역사지 여행이 아니라 동네 산책이나 극장 나들이 처럼 가볍고 흥미롭게 떠나는 백제 역사 여행 입문서. 백제 문화에 관심있는 분들이라면 이번 여행에 무조건 탑승 하시길 바랍니다.
9791186274620,10,"특정 시대나 나라를 컨셉으로 여행 한 적이 없습니다.백제를 주제로 여행할 수 있는 기회를 주는 책입니다.산책하듯 편하게, 흥미로운 여행 하겠습니다."
9791190938051,4,"간단을 추구하는 요린이라면 추천, 나름 요리 고수라면 비추천한다. 특별한 캠핑요리를 원한다면 약간은 실망스러울수도 있다. 메뉴선정이 힘든 초보캠퍼라면 메뉴 정하기로는 괜찮은 것 같다."
9791190938051,10,요리책을 읽으면서 불편했던 점은 바로 계량이었다. 이 책은 밥숟가락과 종이컵 계량법으로 설명을 해준다. 캠핑요리 관련뿐만 아니라 캠핑 용품이나 짐 꾸리기 노하우도 알려준다. 캠핑 초보자라면 쿠킹 노트를 꼼꼼하게 읽어보길 바란다.
9791190938051,10,요즘 캠핑이 다시 대세이다. 처음에 바리바리 싸서 가던 캠핑이라면 요즘은 단촐하지만 감성적인 캠핑. 버너와 코펠로 해결가능한 음식들 소개. 그래서 마음에 들었다. 가볍게 떠나고 싶다. 하지만 아이들은 라면으로만 떼울 수 없으니까 이런 요리 좋다. 떠나라
9791190938051,10,캠핑요리 하면 코펠에 라면이나 그릴에 고기정도 구워먹는 식단만 생각했는데 이 책을 직접 살펴보니 정말 다양한 레시피들이 가득하더라구요. 캠핑에가면 왠지 몸에 좋지 않은 인스턴트를 더 먹게되었는데 건강요리로 만들어 먹을수 있어서 너무 좋은것 같습니다!
9791190938051,10,"‘마트에서 구할 수 있는 친근한 식재료에 다섯 가지 과정을 넘기지 않고 갖은 양념을 배제한 심플하고 건강한 음식‘이것이야말로 ‘요알못‘인 나에게 필요한 요리 기준이다. 집에서 해먹기에는 어쩌면 캠핑 요리가 제일 간단한 요리가 아닐까?제목처럼 쉽고 맛있게 요리가 되는 요리책, 추천!"
9788926898567,10,구성이 세련되고 내용이 좋습니다
9788926898567,6,기후 다시 공부하는 건 재밌다
9788926898567,8,어렵게만 느껴졌던 세계지리는 여행자의 시선으로 쉽게 풀어써서 재밌게 보았다.해외여행을 자주 가는 사람들에게는 좋은 정보가 될 거 같다.
9788926898567,10,세계지리가 궁금할 때 후루룩 읽기 좋은 책. 어렵지 않으면서두 어지간한 내용은 다 담긴 것 같다. 특히 세계 기후를 알려주는 곳이 유용했다.
9788926898567,10,세계지도를 읽어본다는 색다르고 흥미로운 책이였어요~
9791158161071,10,옆에 두고 계속 읽고 싶은 책
9791158161071,8,"난 문체에도 호불호가 강한 편이어서 무조건 믿고 보는 작가님이 몇 분 있다. 당연히 이병률 작가님도 그 중 한 분이다. <끌림> 과 <바람이 분다 당신이 좋다> 에 이어, 이번 책까지. 대부분의 여행 에세이가 그러하듯, 대단한 가르침과 깨우침이 없더라도 마음 한 켠이 따뜻해지고 또 사색하게 만든다"
9791158161071,10,날씨가 점점 따뜻해진다. 여기저기 떠나고 싶어지는 맘을 누르며 책을 읽는 중...
9791160803099,10,"선생은 자신의 전공관련 최고 수준 학술서를 지속적으로 발표하는 한편, 정확한 지식을 쉽게 전달하는 ˝한국어로 된 읽을 만한 산문˝을 제공하는, 우리나라의 귀중한 자산이다. 머리가 둔하여 브로델의 번역서나 문명교류사에 대한 학술서는 제때 따라잡지 못하고, 이번에도 당의정에 행복해한다."
9791160803099,10,파리의 건물.다리 그리고 박물관등 모든것 하나 의미가 있었다. 옛 건물의 사연을 읽다보면 파리가 다시 보인다. 그냥 스쳐갔던 풍경이 역사와 함께 그 자리를 지키고 있었다. 책을 읽고나니 진정한 여행이 무엇인지 느껴진다.나도 책과 함께 파리로 가고 싶다
9791160803099,10,서양사라고는 개론서 몇권 공부한 것이 다였는데 이 책을 읽으면서 나의 무지함이 무척 부끄러워하며 읽었다. 파리 역사와 여행의 콜라보라는 점이 매우 신선하게 다가왔다. 쉽고 재밌고 파리가 눈앞에 펼쳐지는 그런 기분을 느끼게 해주는 좋은 책이었다.
9791160803099,10,파리를 ‘중심부 역사‘로 바라본 새로운 경험이었습니다. 파리와 프랑스에 대한 지적 호기심을 자극하기에 충분했습니다.
9791160803099,2,저자가 지향하는 학자로서의 삶은 무엇인가? 안정적인 교수? 잘 나가는 작가? 유시민처럼 되고 싶지만 그의 아류에도 미치지 못하는 글.
9791160803099,2,서양사학 교수가 파리에서 지내다 온 후 풀어낼 지식이 이 것 밖에 안 된다니.  최고의 대학에서 강의한다는 사람의 깊이가 이 정도뿐이라니 실망이 아니라 절망적이군요. 건축가가 통찰한 인문학의 수준이 훨씬 낫습니다. 별 한개도 아까워요.
9791160803099,10,프랑스의 고대부터 현대까지의 역사를 설명하면서 파리 곳곳의 유적이나 관광지를 소개하는 책. 작가님의 설명을 들으면서 파리를 직접 여행하는 듯한 기분이 들어서 좋았습니다. 언젠가 이 책 들고 파리 여행하는 날이 꼭 왔으면 좋겠습니다!
9791160803099,10,"파리를 유럽 대표 관광지로 생각하고 에펠탑, 몽마르트언덕, 마레지구, 개선문, 샹들리제 거리 등을 도장깨기하는 사람들이 많다. 나도 역시 파리를 갔을 때 많이 들어본 곳 위주로 눈도장찍어보러 다녀왔다. 사실"
9791160803099,8,힘든 환경에도 시민을 위한 교양역사서를 줄곧 내는 서울대 서양사학과 출신 학자님들 감사합니다.
9791160803099,2,참.. 우리나라 최고의 대학이라 불리는 서울대 교수가 쓰는 책이라는게 왜케 얄팍한지 모르겠다. 싼티나는 책 많이 내는 출판사 휴머니스트... 마케팅 때려서 많이 팔면 끝인가? 한국의 홉스봄은 언제쯤 볼 수 있을까?
9791196205546,6,책이 조금 구겨져서 왔어요. 종이가 잘못 넘기면 잘 구겨지는 재질이네요ㅜㅠ내용은 재밌어요. 바르셀로나에 있는 기분을 느낄 수 있어요~ 가볍게 읽기 좋아요
9791196205546,10,"페이지를 넘길 때마다 바르셀로나 여행기억들이 오버랩되어서 좋았어요. 4년 전 여행 때에는 미처 보지 못한 골목 구석구석까지, 좀 더 느긋하게 바르셀로나를 만끽할 수 있었구요.가우디 파밀리아성당이 완공되는 2026년에 다시 찾아가보려구요. 그 때까지 이 책 보면서 마음을 달래볼까 합니다!"
9791196205546,10,책 속에 수록된 올 컬러의 바르셀로나 곳곳의 풍경 사진과 매력있는 가게들이 매혹적인 여행기이다.관광을 위한 꿀팁도 있고 이 책을 읽다보면 바르셀로나에 가서 이 책에 수록된 가게들을 꼭 방문해보고 싶단 생각을 하게된다. 또한 사진들이 잡지책처럼 예쁘고 감각적이라 읽는 내내 즐거웠다.
9791196205546,10,누구나 꿈꾸는 삶의 여유 !저자의 슬로우 라이프도 예쁜 사진들도힐링시간이였어요
9791196205546,10,"절로 떠나게 만들고 싶어 하는 책파란색의 Barcelona의 글씨부터 눈에확 띄던,그리고 A Paris를 쓰신 작가님들이 쓰신책이라니더욱더 마음에 확 와닿던 Barcelona읽는 첫장부터 고딕하고 여유롭고 햇살 내리쬐던 바르셀로나가일상에서 벗어나얼른 내게로 오라는 느낌이로 맞이하고 있어요"
9788925567235,10,"집을 떠나 여행한다는 것을 두려움으로 느끼는 나같은 사람도 있다. 그래서 절대 멀리 가는것은 피하고, 어지간하면 당일치기로. 내가 아는 곳만 잠시 방문하는 수준의 여행을 한다. 그래서 내게 여행서는 특별하다. 혹여나 떠나볼까하는 용기를 주니까. 이 세상은 괜찮은 곳이라는 위안을 주니까"
9788925567235,10,"SNS를 통해 처음 알게 된 청춘유리님의 책, 프로 여행러의 멋진 사진과 여행의 문장 기대됩니다^^"
9788925567235,10,18세에 여행을 시작하여 11년동안 65개국 500개 도시를 여행한 작가의 여행에세이. 프로 트레블러인 그녀의 경험담이 우리의 여행에 도움이 될것을 확신한다.
9788925567235,10,여행은 언제나 옳다고 믿는 사람으로 그녀의 행보에 응원을 보내고 싶어요.많이 보고 듣고 느끼는 여행이야말로 사람을 크게 만드는 것 같아요. 저도 여행을 좋아하지만 아직 가보지 못한 곳이 더 많기에 이 책을 읽으며 떠날 꿈을 꾸고 싶네요.그녀의 여행기가 기대되는 이유입니다.예쁜 사진은 덤^^
9788925567235,10,11년간 65개국 500개 도시를 여행했다니 실로 대단합니다. 그 내공을 이번 책으로 조금이나마 느껴보고 싶습니다!
9788925567235,10,"블로그나 SNS를 통해 사진을 접하긴 했지만, 이런 여행담은 여행이 다 끝나고나서, 또 시간이 지나고 나서 더 빛을 발하는 법이죠. 그리하여 소장각 !!!!"
9788925567235,10,평소 좋아하던 여행작가님 책이라 이번책도 기대가 되는것 같아요 .작가님 사진이나 글을 보면 마치 내가 여행을 하고 있는것같아서 대리만족이 되는데 이번책도 글뿐만 아니라 예쁜 사진도 함께 있어서 읽기 좋을것 같아요
9788925567235,10,여행은 언제나 즐겁죠^^ 500개의 도시나 방문했다니 너무 멋지고 부러워요! 저는 그렇게 많은 여행은 힘들지만 책을 통해 대리만족 할 수 있을 것 같아서 기대되네요^^
9788925567235,10,여행작가의 책을 읽을때면 그 마음이 그대로 전해져 읽는 동안 함께 여행하는 느낌이 들어 참 좋다.11년간 65개국 500개 도시를 보며 작가는 어떤걸 느끼고 어떤 마음이었을까? 너무 기대되고 설레는 책이다. 그냥 글만 있는것이 아니라 사진도 함께 있어 더 좋은 것 같다^^
9791156161653,8,지도가 많이 아쉽습니다다른 내용들을 볼만합니다
9791189680060,10,"이 책이 읽은 이가 실종되는 책으로 유명하던데, 글 내용이 좋아 친구들도 선물해줬는데 갑자기 연락 두절되는 건 아니겠죠?ㅋㅋㅋ"
9791189680060,10,역마는 축구보다 야구에 가깝다. 한페이지 한페이지 거를 타선이 없다.
9791189680060,10,"작가에게 역마 여정동안 윤동주 시집이 있었다면, 나에게는 이 역마가 있었다."
9791189680060,10,"누구에게나 우울함은 있다. 그 우울을 만든 시련이나 우울의 깊이는 서로 다를지 몰라도 그러한 우울을 즐기는 자는 없을것이며 누구나 이 기분을 피하고 싶어한다.그리고 그 방법으로 이 작가는 여행을 택했고, 이 작가의 이 소설을 읽고 나또한 여행을 택했다.노트북대신 이 책을 들고서말이다."
9791189680060,10,읽으면서 내내 불편한 부분 없이 술술 읽히던 책작가 본인의 생각과 주변 모습을 직접 거기 있는 것처럼 느껴지는 책 ㅎㅎ 앞으로 응원합니다 묵돌
9791189680060,10,"묵돌님 글은 사람 마음을 움직이는 무언가가 있는거 같습니다. 글을 잘 모르는 저도 앉은자리에서 끝까지 다 읽었네요..ㅎㅎ 말주변이 없어서 잘 설명은 못하겠지만 좋은글 좋은책임에는 분명합니다! 일,학업,삶 등에 지쳐 어디론가 훌쩍 떠나고싶은 분들에게 추천해요!"
9791190065696,8,여행 행복 글쓰기 영어 등 내 인생에서 하고 싶고 즐기고 싶은 일을 생각나게 한 가볍지만 가볍지않은 책
9791190065696,10,일체유심조 - 모든일은 내가 마음먹기 나름이라는 진리.그곳이 어디든 모든일은 마음먹기 나름 일상을 여행화낯선 것을 익숙한 여행으로 경계를 조금씩 확장한다
9791190065696,10,진정한 여행이란 새로운 풍경을 보는 것이 아니라 새로운 눈을 가지는 것이다.
9791190065696,8,지금 읽고 있는중. 김민식 작가의 책은 재미가 있다..
9791190065696,10,첫번째 화살은 맞아도 두번째 화살은 피하자
9791190065696,10,제가 엄청 좋아하는 분입니다. 이 분의 책은 다 읽고 이분의 블로그도 매일 가서 읽습니다. 힘든 시절의 말이나 글은 웃기게 하시지만 그 마음을 잠시라도 감정이입해보면 마음이 찡합니다. 인간적으로 너무 존경합니다. 많은 분들이 이분의 글을 읽었으면 하는 바람으로 이 글를 씁니다.
9791190065696,10,"여행을 자주 가는 편이 아니고 사실 일상업무가 여행이 되고 있는데, 제목처럼 여러가지 습관들이 여행을 통해 만들어지곤 하지요. 일상이 여행인 나에게도."
9791190065696,10,"이 분, ‘영어책 힌권. . .’에서도 느꼈지만 대단하다. 본인은 역마살이라고 하지만 그 적극성과 긍정적 성격은 이 분의 힘이고 동력이구나 싶다. 가장 좋았던 건 가족들과 한 여행 이야기. 돈이 아니라 시간을 들이고, 서로 스타일 맞춰주는 가운데 지극한 행복을 맛보는 것, 부럽고 따라하고 싶다!"
9791190065696,10,내가 지향하는 삶. 가볍고 경쾌하게. 지금 바로 여기. 나만의 길을 가면그만.
9791190065696,10,"인생을 즐길 줄 아는 롤모델 ‘김민식PD‘님의 신간을 설레는 마음으로 만났습니다. 강의장에서 만났던 그의 겸손함과 소탈함에 반했습니다.이 책을 읽고 나니, 여행을 통해 만난 사유들, 그리고 매일 풀어내는 글을 통해 그만의 단단함이 쌓여왔다는 것을 알았어요.김민식PD의 인생철학책! 강추!"
9791190065696,10,산티아고를 그리워 하는대신 뒷산을 오른다..... 벌써 이 한줄에 저는 이 책이 가져다 줄 즐거움이 느껴진다. 제마음의  Must read book 으로 선정 합니다.
9791187795988,8,"교과서에 실리지 않은 우리의 역사!역사가 승자의 논리라 하지만그 논리에 짓밟히고, 굶고, 죽어나간이름없는 민초들을 생각하면 눈물이난다.그 역사의 흐름이 지금도 흘러가고있으니 더욱더 가슴아프다."
9791187795971,10,"<대한민국 징비록>을 읽고 이 저자의 책은 모두 소장해두기로 했다. 만절필동( 萬折必東 再造蕃邦 만절필동 재조번방)은 사대의 표상인데 문정권인사들이 즐겨쓴다. 문희상의장이 펠로시 미하원의장에게,, 노영민주중대사가 신임장제정때 썼다. 조선시대의 중국사대는 문통의 중국몽으로 쭉 이어진다"
9791187795971,6,지금 조선일보에 연재하는 내용은 3권으로 나오는 건가요? 책이 시대순으로 쓰여지지 않은 것 같네요..
9791196248727,8,"셜록 팬으로서 읽지 않을 수 없었고, 이 책을 덮고 나서 다시 셜록 홈즈 전집을 정주행하게 된다. 이런 형태의 여행을 할 수 있다는 점이 신선하고, 나만의 주제로 여행을 해야겠다는 생각도 들게 한다. 셜록홈즈, 아가사 크리스티, 사드, 뤼팽, 장 바티스트 그루누이의 흔적을 찾는 흥미진진한 여행."
9791196248727,6,추리소설 팬으로서 저자 개인에게 매우 의미있는 여행이었을 듯 싶다. 이런 여행을 할 수 있고 해낸 그가 부럽고 멋진 사람같다.
9791196248727,10,"상상과 현실이, 픽션과 논픽션이 공존하는 색다른 유럽여행. 셜록을 찾아 나선 여정의 끝에서 마주한 것은 아직 꿈 쑬 수 있어 행복한 자기자신."
9788959759217,10,맛있는 인생살이는 부엌에서 결정된다~ 깔끔하고 아기자기한 모습을 보니 그저 흡족해집니다
9788959759217,10,2인가게를 언젠가는 나도 꼭 한번 차려보고 싶다는 생각이 드네요
9788959759217,10,마음이 통하는 사람과 함께하는 사업경영은 정말 힘이될 수 있지 않나 생각해 봅니다.
9788959759217,10,요리와 공간의 어우러짐을 잘 엿볼 수 있지 않나 싶어요.
9788959759217,10,"특이한 소재를 담았네요. 부부,연인,친구, 헝제,자매 가 만들어낸  일종의 동업에 관한 이야기 입니다. 특성에 맞게 그리고 특색을 살려서 두 명이 만들어낸 하나의 작품같은 느낌."
9788959759217,10,여러가지 사연이 있는 사랑스럽고 맛있는 가게를 소개받을수 있다니 기대되는 책이에요. 혼자보다는 둘이 더 의지도 되고 재밌을거 같아요. 국제커플들의 이야기까지 나온다니 더 읽어보고 싶은 책이네요.
9788959759217,10,2인 카페라면 부담 없이 시작할 수 있을 것 같은데요. 그런 카페만을 담은 책이기에 끌렸어요. 저도 가족과 함께 2인 카페를 차리고 싶었기에 도움이 된 책입니다.
9788959759217,10,"책 한권안에 맛집도, 먹음직한 요리와 디저트도, 귀여고 아기자기한 인테리어도, 사람사는 이야기 등 다양한 관심사가 한데 모여 있는 것 같았어요. 그저 음식만 먹고오는 것 보다 이렇게 인간적인 이야기를 함께 보고 있으니 더 정겨운 느낌이 드네요."
9788959759217,10,2인 가게의 꿈을 심어준 책입니다. 저도 동생과 함께 핸드메이드 디저트나 홈패션 쪽에 관심이 많아서 유심히 본 책입니다. 자극이 팍팍 되네요.^^
9788959759217,8,사진도 있고 재미있게 볼수 있어서 좋아요
9788959759217,10,좋아요~
9788959759217,10,평소 제가 많은 관심을 갖고 있는 분야라 더 기대되고 끌려요 ... 앞으로 제가 하고싶은ㄴ 일이기도 하고 .. ㅎㅎㅎㅎ재미있게 소개되어있는것같네요 ^^
9788959759217,10,다양한 가게들이 소개되어 있어 좋은 것 같다
9788959759217,10,인생에서 맛있는 음식은 중요한 요소에요~
9788959759217,10,그동안 몰랐던 가게들이 많네요 한번 가보고 싶어요
9788959759217,10,"커피와 디저트, 이 빠질수 없는 관계처럼 2인 가게의 장점들이 보여요"
9788959759217,10,정말 매력적인 소박하고 아담한 가게들이네요
9788959759217,10,둘이서 운영하는 아담한 가게들. 소박한 멋에 담긴 진짜배기 맛을 즐길 수 있는 곳
9788959759217,10,커피와 디저트... 여자라면 밥보다 더 좋아하는 것들. 먹으러 가고 싶다. 눈으로라도 보고 싶다..
9788959759217,10,요즘은 천편일률적인 대리점 형식의 가게들이 많은데 개인이 운영하는 가게들을 볼 수 있어서 더욱 갚진것 같아요. 사람이 모여서 사는 세상인데 동업을 하면서 힘든점도 많겠지만 그것을 이겨내고 자신들만의 가게를 만든다는 것이 정말 아름답습니다.
9788959759217,10,여기에도 있고 저기에도 있는 똑같은 가게들보다 세상에서 하나뿐인 아담하고 소박하면서도 정감 있는 맛집이 더 끌리죠. 사장님 두 분의 케미가 느껴지는 곳에 꼭 한 번 들러보고 싶네요.
9788959759217,8,동업과 가족이라는 말이 같다는걸 보여주는 사례네요. 그들의 끈끈함이 뭍어나옵니다
9788959759217,8,"맛집 소개 책, 그 중에서도 2인 운영 가게만 소개한 것도 독특합니다. 도착이 기대되는 책입니다."
9788959759217,10,"그들의 가게가 있고, 그곳에는 그들의 삶이 담겨있고, 그들의 행복한 음식들로 가득하다~~책을 보고 있는데 마음이 절로 따사로와진다~~"
9788959759217,10,"동업도 결국엔 사람과 사람의 정으로 한걸음씩 맞춰가야한다는 것을 일깨워주면서, 각양각색의 스토리들이 참 흥미롭네요."
9788959759217,10,"둘이 함께하는 2인 가게 사업의 주제속에서 흔히들 놓치고 있는 진짜 맛집의 다양한모습들을구체적인 사례와 다양한 사진들을 통해서 친절하게 설명해 주는,로드푸드에 특히나 관심이 많은 사람이라면 절대 놓칠 수 없는 책인것 같네요^^"
9788959759217,10,제대로 딜리셔스한 가게들인 것 같네요.. 북적이지 않고 조용하게 즐길 수 있어서 좋은 것 같아요
9788959759217,10,대형 프렌차이즈가 대부분 문을 닫는 요즘..독특한 매력을 가진 작은 가게가 더욱 경쟁력 있을 것 같아요.. 직접 찾아가보고 싶은 가게들이 참 많네요
9788959759217,10,둘이라서 더 좋은 특별함이 있네요 함께 하는 사람과의 따뜻한 이야기까지 만나볼 수 있는 매력적인 가게들을 알 수 있어서 좋아요
9788959759217,10,주택에서 하는 가게는 그다지 흔하지 않습니다. 저도 살아가 보면서 학원 하나를 제외하면 그런 각게들을 본 적이 없습니다. 그만큼 독특한 가게이면서 내부 역시 가정집 같은 분위기를 품습니다.
9788959759217,10,사람이 많은 체인카페보다는 조용한 개인이 운영하는 카페를 좋아하는데 그런 곳을 찾기 쉽지 않더라구요. 책 속 카페들은 하나같이 너무 예쁘고 가보고 싶은 곳들이네요. 한군데씩 가보다 보면 우리 나라 곳곳을 둘러볼 수 있겠네요.
9788959759217,10,"완전 꿈이예요! 사랑하는 사람과 같이 작은 카페, 식당을 운영하는 것! 엄마랑, 친구랑, 남자친구랑 늘 함께하면 좋을 것 같아요"
9788959759217,10,"기존의 요리책과는 달리 붑, 친구, 형제, 자매, 커플이 운영하는 2인 가게 20곳의 소개와 그 가게에 숨어있는 이야기를 함게 함으로써 맛은 물론 마음까지 포만감을 주고 있어요. 거기에 커피와 디저트에 대한 소개와 그들만의 노하우와 정성이 곁들여져 마치 그 곳에 있는 듯한 특별한 즐거움을 전해주고 있답니다. 이렇게 한 잔의 차와 달달한 디저트가 그리워지는 날 곁에 두고 눈으로 보고 마음으로 전해지는 따뜻함을 가슴에 안아보는......."
9788959759217,10,매력적인 가게들이 눈길을 끄네요... 이 책을 들고 이 맛집들을 투어 다녀보고 싶어지네요-
9788959759217,10,책을 통해 알게되면 꼭 한번 이상 가보고 싶네요~
9788959759217,10,"아, 정말 매력적인 가게들이 즐비하네요. 꼭 가보고 싶은 곳들, 알짜배기 장소가 소개되어 있는 듯 합니다."
9788959759217,10,음식의 맛까지 좌우할 수 잇는 인테리어나 플레이팅에 관해 배울 수 있어서 좋습니다.
9788959759217,10,여러가지 사연이 있는 사랑스럽고 맛있는 가게를 소개받을수 있다니 기대되는 책이에요. 혼자보다는 둘이 더 의지도 되고 재밌을거 같아요. 국제커플들의 이야기까지 나온다니 더 읽어보고 싶은 책이네요.
9788959759217,10,동업은 항상 문제가 생긴다는 속설이 있는데 이렇게 따듯한 카페와 이쁜 사진들을 보니 고정관념도 깨지고 아주 좋은거 같아요. 기대되는 책입니다
9788959759217,10,작고 아담하고 친근하고 포근하고 아련한 그리움까지 맛볼 수 있는......좋아요!!!
9788959759217,10,너무 부러운 컨셉의 맛집들이네요. 사랑하는 언니와 함께 달달하지만 쌉쌀한 동업 저도 하고 싶어요. ^^
9788959759217,10,동업이 진짜 힘든데 잘되는 가게들의 노하우를 알고 싶네요
9788959759217,10,"달달하고 맛난 디저트가 많이 소개되고, 그 가게를 운영하는 사장님들의 이야기도 재미있네요^^"
9788959759217,10,정말 이 책은 맛집의 특징을 잘 잡은 것같아요 ㅎㅎ  거기다가 다양한 스토리도 나와있어서 엄청 재밌었습니다.
9788959759217,10,맛있는 가게들이 많이 있네요
9788959759217,10,전국 곳곳에 숨어 있는 2인가게에 대한 따뜻한 사연과 운영노하우등이 수록되어 있다. 물론 맛있는 식사는 기본코스
9788959759217,10,둘 이상이 함께 공유할 수 있는 행복감을 전파해주네요
