ISBN13,rating,review
9791160074819,10,카드는 그림이 있는쪽에 일정한 도트무늬로 엠보싱 코팅이 되어져 있네요...미끄럼방지천 인줄 알았읍니다. 그래도 잘 봐지고요..솔직히 좋아요. 처음엔 별로였는데 카드보다는 질문자의 태도가 역시 중요한듯합니다
9791125468240,10,선생님 원데이클래스 듣고 정말 좋았는데 책으로 만나게 되어 기뻐요. 찬찬히 읽어볼게요~
9791187310365,10,당뇨에 대해 이해 할 수 있었고 많은 당뇨치료사례들을 보면서 당뇨 극복에 대한 희망이 생겼습니다. 많은 도움이 됐습니다.
9791159431654,10,수면을 전공하시는 신경과 교수님들께서 총출동하여 저술하신 수면의학 교과서로 한글로 되어있어 읽기 편하고 증례가 첨부되어 있어 실제 진료에 직접 도움을 받을 수 있습니다.  신경과 선생님들 외에도 수면장애 환자를 접하시는 모든 분께 적극 추천합니다.
9791195994953,4,글씨가 너무 작아서 따라적기 힘들어요
9791195994953,10,제가 원하던 책이 드디어 나왔네요!!항상 다이어리를 꾸준히 쓰는데 많은 도움이 될것같아요글씨연습할수있는 공간이랑 펜추천도 있어서 너무 좋아요
9791188829149,10,달리기랑 거리가 멀지만 서울 안에 달릴만한 곳이 이렇게 많을 줄 몰랐어요. 사진스팟까지 정리되어 있어 찾아보는 맛도 쏠쏠할 것 같구요. 앱하고 연동되면 더 활용하기 좋은 디비가 될 것 같네요.
9791188829149,10,"100명의 주인공 중 한명입니다.서울의 방방곡곡 돌아다니며, 좋은 코스와 관광지, 맛집, 포토스팟, 그리고 100명의 스토리까지. 엄청난 정성이 담겨있어, 볼거리가 정말 많습니다.서울에 이렇게 아름다운 곳이 많았나 하며 감탄하시리라 확신합니다."
9791188829149,10,기다리던 책이 드디어 도착했네요..러너로써 꼭 필요한 책이었는데 이제 마음껏 서울을 달려볼 수 있겠어요. 고향은 전라도라 대한민국 달리기 책도 나왔으면 좋겠어요
9791188062270,10,"취미 미싱러들이 마음 가볍게 도전 할 수 있는 한복 서적이네요 ~ 한권으로 남아, 여아, 성인남녀 한복 패턴을 모두 제공하고 있어서 앞으로 있을 명절이나 행사 준비를 패밀리 한복으로 준비할 수 있어요 - 소품편도 꼭 한복이 아니더라도 평소에도 많이 사용할 수 있는 디자인이 제공되고 있어요"
9791188062270,10,서적제목처럼 아이들뿐만 아니라 성인 한복까지 만드는 과정이 상세히 설명되어 있고 패턴까지 포함되어 있어 집에서 충분히 혼자서 한복만들기에 도전해볼수 있는 책
9791164359158,10,눈 건강 책을 많이 읽는중인데 신기하면서 몰랐던 사실들을 알게됐어요 재밌네요
9791187100812,10,네이버카페 돌스샵이란 곳을 통해 서평이벤트에 당첨되어 받아본 니트로 완성하는 인형옷 스타일링제목을 어느분이 지으셨는지는 모르겠지만제목과 딱 맞아떨어지는 알찬구성의 책입니다
9791187100812,10,니트로 완성하는 인형옷 스타일링탑다운형식으로  쉬운설명과 페어아일과 예쁜소품모자등 다양한 스타일의 옷과 모자그리고 가방이 수록되어있어 ㅂ느기가 좋네요.뜨개기법과 어릴적가지고 놀았던 종이인형도 수록되어 어린시절을 회상하게 되네요.공은경작가님의 섬세한 옷이 감성을 자극하네요^^
9791187100812,10,인형 오너라면  소장해도  좋을  예쁜 책입니다.아기자기  좋아하는  뜨개하시는 분들께도  강추합니다.내 인형의 패션 스타일링에 꼭 필요한 핸드메이드 뜨개옷과 소품을 소개하는  책입니다.초보분들도  충분히  뜰수  있는  자세하게  설명되어  있어요
9791187100812,6,뜨개질을 왠만큼 할 수 있는분은 가능할지 모르겠지만 초보는 도전하기 어려울것 같아요.
9791187100812,10,예쁜 도안이 많아 기대중입니다♡♡ 예약주문했는데 빨리 받아보고 싶어요~^^
9791187100812,10,예판 기간이 길어서 현기증나요ㅠㅠ어여 받고 싶은데!!!헐벗은 제 인형에게 이쁜 옷 입혀주고 싶네요~~
9791187100812,10,기대되는 책입니다  ^^
9791187100812,10,사랑스러운 뜨개인형옷 너무 기대됩니다
9791187100812,10,기대되네요~~^^어서어서 나왔음 좋겠어요 ㅎㅎ
9791187100812,10,기대기대중이예용!!!빨리받고싶네요
9791187100812,10,어린아이가 산타를 기다리는 맘 같다고나 할까요?? 하루라도 빨리 받아보고 싶은 맘입니다^^
9791196343026,10,코로나로 집콕하면서 우드카빙을 시작하였는데 이 책이 많은 참고가 되었습니다  사진도 이쁘고 초보자가 시작하기에  자세한 설명이  도움이 됩니다
9791164260720,10,인형들이 너무 예뻐서 보자마자 뜨개욕 뿜뿜이라 구매했습니당! 대바늘 인형만의 매력이 있는 거 가타요ㅎㅎ 겨울동안 열심히 떠보려구용
9791164260720,10,엄청 쉽고 설명잘되어있어요인형들도 귀엽구 색감도 이쁘고하나하나 만들어보고싶어서 기대하고있네요금방 완성되가서 놀라는 중이에요ㅎ
9791164260720,10,옥토끼님의 귀엽고 정교하고 따뜻한 색감을 가진 대바늘인형을 보고 저도 떠 보고 싶다는 생각을 해 왔었는데 이렇게 좋은 도안과 뜨개법까지 볼수 있는 책을 내어 주셔서 감사합니다~예쁘게 만들어 보여 드릴께요~^^
9791164260720,10,"드디어 내손안에 들어온 귀여운 손뜨개 인형 책 ~한국에는 대바늘 뜨개인형 도안책이 잘 없어서 늘아쉬웠어요.해외인형작가님들도 많고, 코바늘 인형책도 많은데... 항상 아쉬웠지요 하지만 이렇게 옥토끼님이 사랑스런 아이들로 가득한 책을 내주셔서 너무 기쁩니다!"
9791164260720,10,예약 배송 받을 정도로 기다렸던 책이에요^^ 쉽게 만들면서도 예쁜 인형을 원했는데 이리 책으로 출간되니 넘 좋네요!!! 이제 주변에 소소하게 선물할 인형들 만들어봐야겠어요^^
9791164260720,10,오랫동안 기다리고 기다렸던 옥토끼님의 손뜨개 인형책이 출간! 한걸음에 달려와 구입했어요. 넘나 귀여운 인형들이 기다리니 낼부터는 뜨태기 극복!
9791164260720,10,책잘받았어요~작가님의 맘이 보이는 책이예요~  서술도안과기호도안이 함께 들어 있어서 보기좋아서 넘 좋았어요. 출간축하드립니다~  하지만 실 정보가 없어서 아숩더라구여~같은느낌으로 뜨고싶어서 비슷한 실 찾는중이예요~~  그래도 예쁜책이 내손에 들어와서~  기분이 좋아요~  감사합니다~^^
9788934999324,10,많이.배우고 갑니다
9788934999324,10,환자 케이스를 들고오면서 설명해서 공감하면서 읽을 수 있었고 정리세션이 마지막 챕터에 있어 좋았습니다. 이런 어느정도 챌린징하는 책이 많이 출간되면 좋겠습니다.
9788934999324,10,암 치료의 최신 지견이라면 면역항암제를 꼽을 수 있을 것이다. 면역항암제에 대해 이만큼 자세히 요약한 책은 찾기 힘들다.
9788934999324,8,"면역계가 건강한 자기 세포를 지키려고 설치해둔 ‘면역관문’을 교란하여 면역체계를 무력화시키는 암세포와이에 대응해 관문을 아예 차단해버리는 ‘면역관문 억제제’를 개발하는 과학자의 무기경쟁, 항암면역요법."
9788990116000,10,하루 15시간 공복을 실행하고 있습니다. 9시간 동안은 먹고 싶은거 가리지 않고 먹습니다. 그런데 체지방 감소와 복부 지방이 엄청 낮아졌네요. 주5-6회 한시간씩 근력운동도 꾸준히 하고 있습니다. 과거와 달리 체지방 관리가 아주 쉬워졌습니다. 책을 읽진 않았지만 공복은 적어도 저에게 보약입니다
9788990116000,10,"1주일에 한번이라도 정해진 공복의 시간을 만들면 과식이 불러오는 해를 제거하고, 노화나 식생활로 인한 손상을 리셋할 수 있으며, 자가포식이 활성화되어 몸이 안에서부터 생기를 찾아 되살아나게 하는 자가포식 우선 공복 시간동안 내장이 충분한 휴식을 취하면서 혈당치도 서서히 내려가고 음식을 먹고 나서 10시간 정도가 지나면 간장에 저장된 당이 소진되기 때문에 지방이 분해되어 에너지로 쓰이게 된다. 16시간이 지나면 몸이 지니고 있는 자가포식구조가 작동하기 시작하는데 이때 노화되고 있는 세포조직속에 수분이 채워지면서 새로운 단백질을 생성하게 된다 단 주의 할점은 반드시 간단한 근육 트레이닝을 병행해서 인체에 필요한 근육이 감소하는것을 막아야한다.이책을 통해 공복’이란 최고의 명약으로 질병과 피로, 노화를 모르는 몸을 만들어보자."
9788990116000,10,"공복이라고 하면 몸을 혹사시킨다는 부정적인 이미지만 있었지, 쉬게한다고 생각해 본적이 없었어요. 며칠 후에 나오면 꼭꼭 읽고싶네요."
9791189430429,8,개정판이 나와서 구입업데이트된 내용 이외에는 이전판과 큰 변화는 없으나 이정도로 헬스케어 빅데이터에 대해 총괄하는 책은 없는 듯
9788990116970,10,"치매 증상을 눈에 띄게 개선하는 비(非)약물요법이 존재한다는데 그중 하나가 ‘두뇌 트레이닝 도호쿠(東北)대학교 교수인 이책의 저자와 구몬교육연구회 학습요법센터가 공동 개발한 학습요법으로 이미 국내외에서 치매 환자의 증상 개선에 효과적이라고 다수 인정되었다고 한다. 지금까지 10만 명이 넘는 환자와 가족이 이 요법을 통해 ‘대화가 가능해졌다’ ‘기저귀가 필요 없어졌다‘와 같이 노의 쇠퇴를 성장으로 되돌려놓았다고 한다. 이책에서 제시하는 두뇌 트레이닝은 ‘아슬아슬하게 어려운‘ 문제를 풀때 뇌세포를 활발하게 움직이게 한다고 한다.단순한 숫자나 기호를 이용하여 어려운 계산과 암기 문제를 최대한 빨리 풀면서 평소 자신의 한계 속도를 뛰어넘어야 뇌의 정보처리 속도가 올라간다고 한다.즉 간단한 계산이나 기억의 정확성보다는 ‘푸는 속도’가 중요하다는데 스스로 풀 수 있는 문제를 빠른속도로 푸는데 목표를 두고 하루 10분만 투자해보자 이때 ‘많이 풀수록 좋겠지!’라고 생각하기 쉬운데, 이것은 큰 착각이다 라는게 치매전문 의료진들의 조언이다 두뇌 트레이닝에서 가장 중요한점은 단기 집중, 속도전 인간의 뇌는 아무리 길게 집중해도 유지 시간이 15분이라고 한다 그렇다면 스마트폰 15분동안 꺼놓고 수학정석 문제 풀이에 도전해볼까?"
9791196484934,10,"기본책의 이론을 충실히 시험해볼 수 있어서 좋은 것 같아요. 다 읽고 외국인 친구에게 줄 생각인데, 친구도 마음에 들어했으면 합니다."
9791196484927,10,워크북 있는 줄 모르고 책만 샀는데 너무 마음에 들어서 재구매할려고 들어왔어요 실강듣기는 여건이 안돼서....ㅜ우선 책으로 친구랑 같이 연습해볼라고합니다. 독학이 진짜 될지모르겠지만..지금은 자신감뿜뿜이네요! 아직은 어렵지만.. 빨리 잘쓰고싶네요ㅎㅎ추천합니다
9791196484927,10,캘리를 단계별로 연습할 수 있어서 너무 좋아요!!무조건 따라쓰는게 아니라 포인트를 집어 주고 반복해서 쓸수 있는 것도 좋구요. 글씨체만 배우는게 아니라 원리를 배우니까 책에 없는 글 쓸때도 응용할 수 있어요. 캘리초보인데 중상급수준까지 마스터할 수 있을거 같습니당캘리책 중 가장 실한듯.
9788990116956,10,이책은 한의학에 기본지식을 만화로 알려주는 책으로 오행색체표를 통해 목-화-토-금-수의 특성에 대해 배울수 있습니다 급성병 만성병의 증상과 원인까지 인체를 하나의 통일된 것으로 생각하고 전신의 균형을 어떻게 해야 찾을수 있는지 이책을 통해 기본 한의학 지식을 쌓을수 있습니다.
9791188554256,10,간만에 구매한 뜨개책. 보고 따라 만들 아이템들이 많아 보입니다
9791188554256,10,깔끔하니 우리말로 되있어서 좋네요...도안보고 여러개 떠봐야할거같아요...배송도 빨랐구요 적극추천요
9791188554256,10,모자와 가방 디자인이 특이한 게 많고 이쁘네요.나뭇잎 가방 뜨고 싶어 구매했어요.에코안다리아실을 대체할 국산실 사서 떠보려합니다.
9788998866143,10,"오랜 시간 나름의 시간과 노력을 들여 동서양의 우주 기본 물질의 체계에 대하여 연구하였으나, 여전히 4원소는 풀기 힘든 난제 였습니다. 특히나 점성술과 타로에서의 4원소 체계의 상이함이 이해하기 어려웠으나 본서를 통하여 상당부분 갈증이 해소되어 감사드립니다."
9788998866143,10,유난히 어려운 코트카드의 상징을 단순한 키워드가아닌 자세히 알수있는책 코트해석편이 너무나 기대됩니다
9788998866143,10,"코트카드에 그려진 그림 상징의 의미와 각 카드 당 긍정적인 면, 부정적인 면, 주의해야 할 부분 등을 설명하는 책입니다. 타로카드를 좋아한다면 매우 즐겁게 읽을 수 있을 정도로 알찬 내용을 담고 있습니다."
9788998866143,10,읽어서 나쁠거 없는 책
9788998866143,10,난해한듯하면서도 재미있는책 자신이 중급자라고 생각하면 분명 살이되고 피가되겠지만초보자들이 접근하기엔 조금 어려울순 있겟지만 일단 사서 후회는 안함
9788998866143,10,코트 카드는 해석이 어려운점이 많았다. 그런데 마침 코드카드를 중점적으로 해석한 책이 나왔다고 하여 구매하게 되었다. 우선 부록으로 들어있는 카드부터 한장한장의 퀄리티와 개개인의 이해도 향상에 굉장히 도움이 되었다. 내용또한 코트카드를 이해하기위한 사전지식이 포함되어 공부하기에 좋다
9788998866143,10,타로카드의 해석 책을 접한 후에 다음 작품을 기대했던 저로써 바로 구매하였습니다 임상훈님의 책은 다른 책들에 비해 타로를 공부할때 대표적인 키워드들만 나열한 다른 책들과 달리 임상훈님의 인생과 카드의 모든 모습을 담아낸 책이라 할 수 있습니다
9788998866143,10,지금까지 우리나라 사람이 쓴 타로카드 관련도서(번역본 제외)중에서는 가장 정확한 자료를 바탕으로 한 전문서적.
9788993746518,10,기차 타고 여행가면서 하려고 샀어요.아이들이 너무 좋아하네요~
9788960882652,10,작가의 그림이 마음에 들면 구매 권장. 완전 생초보보단 어느정도 그림 입문 된 사람한테 괜찮을 듯
9788960882652,10,입문자분들 도움됨 기본적으로 좋은 팁들이있음 물론 다른 작법서에서도 볼수있지만 그래도 기본기도 좋으시고 설명도 좋게 알려주시고있음 고수분들은 이 책 필요없을듯요 입문자들은 사셔도 좋음
9788960882652,10,입문자에게 권장
9788960882652,8,"내용은 다른 책과 동일하지만, 특유의 그림체와 여러가지 참고할만한 포즈가 많이 있고, 첨언도 많이 해줬으므로 다른 영양가 없는 책보다는 평균 이상은 간다는 느낌의 작법서입니다."
9788960882652,10,조씁니다 쪼아요
9788960882652,10,잘 정리된 작법서 같습니다.
9791158462932,10,운동 동작과 초보가 갖게되는 궁금증을 세세하게 짚어주어서 좋은 책
9791158462932,10,어제 저녁에 주문했는데 퇴근하니 벌써 와있어요.브로마이드가 없는지알구 당황했는데 표지였어요ㅋㅋ그림도 귀엽고 쉽게 따라할수있을것같아요
9791158462932,10,책보고 따라하기 좋아요 그림이 귀엽고 설명도 친절합니다 아령이랑 짐볼도 구입했어요^^
9791158462932,2,광고와 달리 별로 도움되는 동작도 없고 그냥 살빼신 분이 책 하나 쓴듯
9791158462932,6,일본인저자.운동강도가 생각보다 강하진 않아요.평소에 운동하셨던 분이라면 만족못하실듯.다이어트 홈트 입문서 수준.일러스트는 볼만함
9791158462949,8,올해들어서 마스크를 써서 그런가 빠르게 걷는게 힘들다. 보폭을 넓게 걷는것도 신경써야하고... 아 실천해야 되겠다.
9791158462949,10,노년에 꼭 유지해야할 근육들을 5대 노년증후군에 대한 대응안으로 단련하도록 돕고 있다. 어르신들께서 연습하기 쉽게 설명과 그림이 자상하다. 다만 동영상을 따라하면 되게 동영상이 QR코드와 함께 있었더라면 더 좋지 않았을까 싶다.그럼 홀로 거주하시는 어르신들도 따라하시기 편했을텐데...
9791189807115,10,인생 폼롤러책을 찾았어요 제가 딱 원하던책!!!폼롤러로 필라테스랑 테라피요가수업을하고있는데 회원분들께 좀 더 나은수업해드릴수있을꺼같아서 설레네요^^
9791189807115,10,근육과 그에 따라 발생하는 통증 유발점별로 폼롤러 동작이 소개되어 있어서 좋습니다. 동작 자체는 종이책으로 표현이 한계가 있어 책에서 소개한 동작을 유튜브등에서 찾아보면 좋습니다.
9791189807115,10,폼롤러를 활용한 근육별 smr 동작과 100가지가 넘는 필라테스 응용 동작이 있어서 너무 좋아요
9788997787333,10,번역본으로 나와서 넘 좋아요. 몇개 만들어봤어요 나와 있는 작품들이 다 이뻐요
9788997787333,10,"여름에 잘 쓸만한 실용적이면서도 멋진 가방, 모자와 그밖의 소품들이 알차게 구성되어 있어 좋아요~^^ 작품과 도안만 나와 있는 것이 아니고 코바늘 기초기법과 작품에 들어가는 기법이 또 한번 친절하게 설명되어 있어 만들때 좋아요~ 니트러브에서 서평이벤트 기회를 얻어 빈센트코튼으로 책속의 작품중 담숨에 네트백을 만들어 보았어요~"
9788997787333,10,기초 코바늘뜨기 이외에도 변형뜨기에 대한 사진과함께 설명이 자세하여 다른 작품에 응용할 수 있어 좋아요. 일서를 볼 때 일본어 번역기를 사용하면 번역이 매끄럽지 않은 아쉬움을 단번에 해결해주고  오리지널보다 가격도 좋아요. 다만 실의  실제 굵기 사진이 없는 부분은 조금 아쉽습니다.
9788997787333,10,도안이 쉽게 설명돼있고 가방도 딱 적당한 크기에요.
9788997787333,10,기본뜨기 위주라 어렵지 않아요
9791189584214,10,"이제 3살이 되어가는 반려견(비숑)을 키우면서 사람보다 더 짧은수명을 가진 반려견들이 어떻게하면 더건강하고, 더 안전하고, 더 행복하게 우리와 살다가~생을 마감한 그들을 떠나보낼지를... 걱정하고,고민 하였었"
9791189584214,10,"짜임새 있는 순서와 예쁜 구성, 그리고 사진으로 보여주니까 더 쉽게 우리 강아지에게 마사지 해줄 수 있겠어요. 어쩌면 소홀했는지도 모르겠어요. ""이렇게 잘 챙기는데 설마 아프겠어? 뭐가 불편할까? 얘는 행복한 편이야."" 하면서요. 이 책을 보면서 내심 미안해져서 이제 더 잘 케어해줄거랍니다^^"
9788974796648,10,10살 노견을 키우며 언젠가 다가올 이별을 생각하며 이별이 끝이 아님을 우리는 영적으로 연결되어있고항상 함께함을 깨닫게 해주는 소중한 책. 동물은 영혼이 없다고 하는 기독교 등 대부분의 종교와 다른 고차원적인 불교의 관점이 참 맘에 와닿는다
9788958205807,10,정말 유익하고 좋은책인데 120쪽 서식지 부분에 fluminensis가 플루미넨스시로 적혀있네요
9788958205807,10,꽃말의 유래를 찾아가는 여정이 즐거웠다. 정원사와 플로리스트라면 재미있게 읽어갈수 있을듯.
9788958205807,8,"내가 잘한 일 중 하나가 라틴어를 공부한 것이라고 생각하기에 라틴어 관련 신간은 늘 반갑다. 1990년에 고영민 편저, <알기쉬운 라틴어 문법>으로 공부를 시작했으니 벌써 29년이 흘렀다. 제목부터 매력적인 신간을 통해 다양한 분야에서 사용되는 라틴어에 대한 관심이 확장되길 기대한다."
9791195603299,10,"예뿍님,감사합니다."
9791155361290,10,"자수 배우고 싶어서 블로그 강좌들 찾아 다닌 적 있는데 기초부터 자세하게 나온 곳은 잘 없었어요. 이 책은 진짜 기초부터 차근 차근 설명이 되어 있어 따라 배우기 넘 좋다 여겨집니다. 준비물, 스티치 방법들 자세히 설명되어 있고 색색 수실 일러 따라서 수를 놓아보겠습니다. 번창하세요"
9791155361290,10,곁에 두고 “봐야 할” 스티치 노트!!가볍지만 에센스만 모아모아 ~ 속 찬 기본서입니다.큼지막한 컬러 그림에 유형별로 분류된 스티치~보기 좋고 쓰기 편한 유용한 책이에요!! 강추강추!!
9791155361290,10,노트처럼 얇은 그러나 속은 너무나도 알찬 자수책~~친절하게 자세히 설명되있고 초보자부터 자수를 좀 한다는 사람들도 많은 도움이 될듯합니다.기본 자수부터 응용부분까지 ~~그리고 깨알팁까지~~곁에두고 오래오래 볼수있는 기본지침서입니다^^
9791155361290,10,자수 잘하고 싶은 사람~♡​첫 시작을 하는 사람~♡​독학하는 사람~~~♡​어느누구에게도 좋은 책이라고 생각되어요
9791155361290,10,군더더기 없이 자수기법맛 84가지나 나와서 넘 맘에드는책곁에 두고 따라하면 금새 자수 프로가 될듯초보들도 쉽게 따라할수 있고 정말 쓰임새 많은 스티치들이어서 넘 추천하는 책
9791155361290,10,"총84가지의 스티치로 구성이 되어 있어서 초보들이 책을 보며 연습하기에 적당한 스티치 갯수 같아요.스티치의 응용편도 나와 있고 처음과 마지막을 잇는 법,모서리에서 어떻게 스티치를 해야하는지도 상세하게 잘 나와 있어서 초보에겐 정말 딱 좋습니다.강추합니다"
9791158462802,10,"고양이와 함께하면 함께할수록 계속 공부해야겠다는 생각이 들어요. 김명철 선생님 유튜브 정말 열심히 보고 있는데, 책도 머리맡에 두고 열심히 공부하겠습니다! 냥이도 집사도 모두 행복한 삶을 위해!!"
9791158462802,8,"개의 문제 행동 원인이 산책 부족인 경우가 많다. 고양이 문제 행동 원인은 의외로 사냥 놀이였다. 개만 키워봐서 미처 몰랐다. 야생냥은 ‘사냥하고 먹고 싸고 자고‘ 본능을 스스로 충족할텐데, 집냥은 사냥을 못하니까 집사가 같이 해줘야(해드려야) 했다. 개와 고양이는 다르다는 걸 다시금 느꼈다."
9791158462802,6,"초보 집사들이 보기 좋은 책. 분량은 적지만, 영역동물인 고양이를 알아가기 위한 사례들과 꼭 알아야할 이야기들이 나와 있다. 저자가 문제 고양이 집사들을 컨설팅하는 프로그램을 했고, ‘세상에 나쁜 고양이는 없다‘ 인간이 문제를 만들거나, 방치한다.는 것을 좀 알라고 조곤조곤 좋은 말로 함."
9791158462802,10,기존에 고부해 애청자였고 고양이 관련 서적을 많이 소유하고 있어서 그렇게까지 새로운 느낌의 책은 아니었던 것 같아요. 그래도 읽으면서 제가 좋은 집사였는지 나쁜 집사였는지 책 내용에 비추어보면서 다시 한 번 반성할 수 있었습니다ㅠㅠ 더 노력해서 냥님을 모셔야겠어요..
9791158462802,8,사람이나 고양이나 양육자는 피양육자의 입장에서 양육해야하는 것이 진리. 중복되는 서술이 아쉽지만 고양이를 이해하게 해줘서 고마운 책.
9791158462802,10,"집사가 되었습니다, 두둥!집사가 되기전에 구매한 책을 열심히 읽어보려 했으나 잘 들어오지 않더니만집사되고 하루만에 통독했습니다. 실감이 팍팍나는 책, 동영상도 찾아보고. 도움 많이 받았어요.감사합니다."
9788994177311,10,호남소재 김알바의 소재이야기. 사장 아들이라는데 몰랐어요.
9791185330587,10,이 책은 자연식을 해주고 싶은데뭐부터 해야할지 모르는 집사님들 다양한 자연식을 해주고 싶은집사님들에게 정말 도움이 많이 되는 책인건 확실하네요간이 필요없으니 똥손 요알못인 저에게도 좋은 책..!!
9791189612139,10,영문 손글씨 연습에 참 좋은책이에요. ^^
9791158462680,4,책 리뷰가 좋아서 기대했지만 솔직히 가격에 비해 기대에는 못미치는 책입니다. 이미 다른책을 통해 만들어본 경험이 있다면 굳이 필요한 책은 아닌거 같네요. 만드는 과정  사진이 너무 작아서 재봉경험이 없는 완전초보는 따라하기 힘들 수 있습니다.
9791158462680,6,배송은 빠르나 책이 조금 훼손되어 있어서 그게 아쉬움.. 검수 꼼꼼하게 하셔야할듯
