ISBN13,rating,review
9788974574369,10,아이가 문법에 약하고 공부하기 막히면 접어버리기 쉽상인데 이책은 기초부터 쉽게 가르쳐줘 관심을 갖고 하게되네요
9788974574369,10,문법에 대한 기초를 탄탄히 할수 있도록 도와주는 책이라서 읽어보면 좋겠어요.
9788974574369,10,쉽게 혼자서도 공부할 수있게 구성되어있고 활용문장을 많아 수록해놓아 좋습니다.
9788974574369,10,책에서만 있는 문법이 아닌 실제로 쓰기에 적합한 문법 이야기라서 참 실용적이고 괜찮은 책이네요. 영어를 기본부터 익힐수있게 하는 책입니다~~
9788974574369,10,3년 문법 공부에 아주 좋아요
9788974574369,10,아직 문법에 약한 중학생들에게 너무나 좋은 책인 것 같아요. 특히 문법을 토대로 자기가 원하는 문장을 쓸 수 있도록 한다는 점이 마음에 드네요.
9788974574369,10,점점 더 어려워지는 문법 때문에 고민하고 있는 아이에게 1학년부터 3학년까지 차근차근 되짚어 볼 수 있는 좋은 교재가 나와 반갑네요.
9788974574369,10,매번 배워도 매번 헷갈리기 쉬운 문법을 쉽게 정리해주어서 좋습니다
9788974574369,10,문법을 이해하고 활용해서 문장을 쓰는 서술형 평가를 대비하고 중학 문법의 핵심을 익힐수있는 좋은 기회네요
9788974574369,10,"중학교 1학년때부터 문법을 확실히 잡아가는 것이 중요한데요, 3학년때에는 거의 완성 단계라서 기초를 튼튼히하는 노력이 필요합니다. 이 시리즈로 탄탄하게 잡아간다면 아이들의 기초가 전혀 흔들리지 않는답니다. 믿고 보는 시리즈라서 주변에도 추천하곤 했어요.이 시리즈로 쭈욱 가자구요."
9788974574369,10,서술형을 쓰는데 있어서 맞춤법이나 문장의 자연스러움을 이끌어내기 위해 훈련하기 아주 좋은 책 같아서 많은 중학생분들이 이책을 통해서 문장력을 키우고 자신만의 좋은 문체를 가질 수 있었으면 좋겠다는 생각이듭니다.추천합니다.!
9788974574369,10,어려운 영어 문법에 대해서 수준별로 공부할 수 있도록 공부에 도움을 주는 책입니다.
9788974574369,10,영문번에서 무조건 많이 쓴다고 문법이 완성되는 것은 아니죠. 그래서 체계적인 학습법이 필요합니다. 그런 체계적인 학습법을 이 책을 통해서 배우면 정말 도움이 될 것 같습니다.
9788974574369,10,간략한 영어문법 설명이 학년별로 나뉘어 있어서 쉽고 체계적으로 영어문법을 공부할 수 있을것 같아요.
9788974574369,10,수준에 맞춰 문법에 보다 쉽게 접근할 수 있는 좋은 책입니다
9788974574369,10,내신에 대비해서 꼼꼼하게 학습할 수 있도록 단계별 구성이 잘 되어있어 차근차근 공부하기 좋은 책입니다.
9788974574369,10,중학교 영문법도 생각보다 어려운데 보다 쉽게 배울 수 있을 것 같아요.
9788974574369,10,영문법을 쉽고 재미있게 머리에 쏙쏙 박히게 알려주고 있어서 큰도움이 되네요
9788974574369,10,문법에 대한 바람직한 길을 보여주는 바람직한 책이라 생각되네요
9788974574369,10,개념과 규칙을 시각적으로 쉽게 파악할 수 있어 직접 다양하게 변화시켜 보면서 서술형 문제에 대비할 수 있겠네요
9788974574369,10,"문법을 잡아야 영어학습을 제대로 할 수 있는데, 쉽게 이해할 수 있도록 구성되어 쉽고 꼼꼼하게 학습하기  좋을것 같습니다."
9788974574369,10,고등학교 들어가지전에 알아야할 모든 문법이 있어요
9788974574369,8,중3 영문법은 이 한권으로 충분해요..좋은 도서네요!!!!
9788974574369,10,학생들이 쉽고 재미있게 공부할 수 있도록 구성했어요.
9788974574369,10,문법 쓰기 학습을 통해 문법 기초를 넘어 서술형까지 정복하기
9788974574369,10,스피킹과 어휘에 비해 우선순위가 떨어지는 문법공부지만 문법이 탄탄해야 영어공부가 완성됩니다. 기대됩니다.
9788974574369,10,문법이 쓰기다 중학 3학년 마무리타 일격을 가하는 멋진 책
9788974574369,10,"실용적이고, 실전적이다"
9788974574369,8,쓰는 것으로 문법을 공부할 수 있다는 것이 신선합니다
9788974574369,8,문법의 기초를 다지는데 도움이 되겠네요.
9788974574369,8,쓰기로 문법을 익힐 수 있다니 왠지 새롭네요
9788974574369,10,영어 문법에 대해서 두려워 하거나 어려워 하지말고 이 책을 통해서 영어를 써 본다면 저절로 문법을 알게 될 것입니다.
9788974574369,10,고등학교 올라가기 전에 탄탄하게 실력을 다질 수 있겠어요
9788974574369,10,내신에 대비해서 꼼꼼하게 학습할 수 있도록 단계별 구성이 잘 되어있어 차근차근 공부하기 좋은 책입니다.
9788974574369,10,문법에 강해지는 중학 영문법 문법이 쓰기다..공부에 많은 도움이 되겠네요..기대됩니다~~
9788974574369,10,고등학교 가기 전에 해두면 좋아요
9788974574369,10,영어는 손놓은지 오래라서 중학생 수준이 저한테 딱맞네요~
9788974574369,10,3권의 책으로 나뉘어서 학년별로 있으니까 본인의 수준에 맞춰서 공부할 수있으니까 좋네요.
9788974574369,10,중학교 영문법도 생각보다 어려운데 보다 쉽게 배울 수 있을 것 같아요.
9788974574369,10,아이의 학업에 있어 가장 중요한시기에 가장 적절한 도움이 되는 책이길 기대합니다.
9788974574369,10,영작하여 쓸 수  있게 배우는 영문법 꼭 아이들 공부하게 해야겠어요.
9788974574369,10,문법은 이해하는것이 아닌 활용해야 영문장을 자유자재로 쓸수 있습니다. 이책을 통해 문법의 기초 논리성을 통해 영어 문장 구성능력을 체계적으로 학습하면서 중학교과서에 수록된 문법 완전하게 내것으로 만들수 있습니다.
9788968060625,6,중학생용이고 교과서를 같이 이용해야 합니다 그냥 문제집이에요 따로 설명이 더 없고 예문같은거도 없습니다 영어 공부 다시해보실려는 성인 분들한테는 비추천입니다..
9788993456615,10,중학교 때 머리싸매고 풀었던 기억나네요. 두고두고 도움이 되는 책입니다.
9788960274709,10,단어와 문장 수준이 중학교 3학년인 저에게 적합하게 맞는 것 같습니다 역시 중학영어시리즈가 공부하는 데 체계적이고 좋은 것 같습니다
9788960274709,6,"기대만큼 못미치는 책이었습니다. 문제의 일부가 너무 문법위주고, 또한 보너스 문법문제 역시 부족한 설명에 수박겉핥기로만 다루니 별로더군요. 어휘도 본문에 있는 어려운 단어들까지 모두 커버해주지 못해서 아쉬웠네요."
9788926010877,10,중3과정의 단계까지 모두 마쳤다면 다시 한 번 돌아보고 부족한 부분은 복습하면서 고등 진도 나가도 늦지 않을 듯 합니다.. 마음만 앞선다고 빨리 가는 건 아니니까요.. 기초 다지기는 반드시 필요한 과정입니다.. 모든 학생들 화이팅 하세요~~
9788926010860,10,중학교 때는 잘 알지 못합니다. 고등의 숨 막히는 생활과 부담감을... 후회하지 않는 시간을 잘 보내길 바랍니다^^ 오늘도 열심히 화이팅합시다^^
9788926010860,8,기본의 기본인 기탄입니다...
9788959973361,8,3학년 큰아이가 점점 물어보는 단어가 많아져서 스스로 찾아 벌 수 있는 사전을 알아보던 중 평이 좋아서 구입하였습니다.초등학생이 보기에 적절한 글자크기와 적절한 예문과 삽화가 맘에 들어요. 단어수가 아주 많지는 않지만 꼭 필요한 단어로구성되어 있어요. 앞으로 잘 활용했으면 좋겠어요.
9788959973361,10,초3인데 영어학습지를 하고 있어요. 그동안은 어린이 그림 영한사전을 쓰다가 어휘에 한계가 와서 어른 사전을 줬더니 글씨가 너무 작고 아이 혼자 찾아보는데 힘들어 하더라고요. 그래서 수소문 끝에 구입한 게 이건데 만족입니다. 아이가 혼자 찾기에도 부담없고요. 어휘도 다양해요. 만족합니다.
9788959973361,10,정말 제대로 된 사전인데...제대로 시장에서 인정받지 못한 것이 아쉽네요.페이퍼 사전 내용뿐 아니라구판 부록인 CD-ROM을 작동해보면.. 출판사가 얼마나 작정하고 만든 제품인지 알게됩니디ㅏ.
9788959973361,4,오호 리뷰가 이렇게 다를 수 있다니 신기방기... 아이 보라고 사긴 했지만 어떻게 찾는 단어 마다 없는지..........-_-;;;; 물론 스마트폰에 다 있긴 하지만 폰중독 우려로 사전을 사준건데 이래서야 폰을 줘야할듯..
9788959973361,10,초최강 초등 영어사전인듯싶네요^^  예문도있고 찾기도편하고 부록도 담겨있어서 참좋은 사전같아요^^  많이들. 사용해도좋을거같음!
9788959973361,10,슬슬 영어단어 외우기에 관심을 보이는 초등학생아들!! 지루하지 않게끔 알차게 꾸민 사전이 어른이 보기에도 공부욕구를 느끼게한다.
9788959973361,10,잘샀어요. 크기도 제가 찾던 사이즈고 한영사전까지들어 있고...사전이 왜이리 이쁜지...요즘 애들은 좋겠다.
9788959973361,6,아이가 참 좋아합니다. 단어의 예제와 그림편집 등 정말 잘 만든 사전입니다.
9788959973361,10,"아이들이 활용하기에 편리합니다. 단어관련그림과 여백, 예문이 좋았습니다."
9788959973361,10,아이들도 찾기 좋고 어른들도 별책 보면서 공부하기 정말 좋아요^^
9788959973361,10,"초등사전은너무단어가 없어 고민고민하다가 찾은사전인데요,아이들이보기넘편하게되어"
9788959973361,10,친구에게도 추천해서 3권을 구입했어요. 아이가 잘 찾아서 사용하니 뿌듯하네요.
9788959973361,6,"초등 1학년 아이가 단어를 찾다가 짜증스러워 하네요.
없는 단어가 왜 이리 많은지.."
9788959973361,10,초등학교 1학년  아이가 단어 찾기도 쉽고 무엇보다도 책의 선명도가 좋아요.
9788959973361,10,복잡하지 않고 눈에 잘 들어와 초등 저학년 쓰기에도 좋아요. 부록도 참 좋아요
9788900454413,10,"아이랑 직접 학습해 보핬는데 문제수가 정말 많아서 좋았어요. 단어, 듣기및 말하기, 문법 파트로 나눠저서 핵심노트-만점노트-연습분제-실전테스트까지,충분한 문제양이 있어서 확실히 학습 할수 있을 것 같아요.단원별 평가문제가 4회나 제공되어서 중간고사 대비 아주 좋은 문제집이예요."
9788926157916,10,"기본서 공부하기 전에 개념 탄탄하게 다지는데 좋은 교재에요. 제곱근 개념 어려워 해서 방황하다 중학연산으로 개념설명 읽고 연습하다보니 기본서 공부에 속도가 붙네요~ 그림으로 개념설명을 해줘서 이해가 쉽고, 다양한 문제유형으로 개념의 확장까지 연습시켜줘서 유용하게 활용했습니다."
9788926157916,10,반복적인 계산을 통해 자연스럽게 수학이 이해될 수 있었습니다! 다른 연산책에 비해 두껍던데 문제가 많아서 그렇던데 너무 좋았습니다!
9788926157916,10,"진짜 좋습니다. 개념을 이미지화하므로써 학생들의 이해도를 높이며, 문제들도 많아서 개념을 익히는 기회를 제공합니다. 다시 개념을 물어봐서 학생이 개념을 정확히 이해하고 있는지 확인이 가능하고, 또한 개념 모음 문제로 응용력도 키울 수 있습니다. 개념간의 연계와 단원 마무리도 깔끔하게!"
9788959904969,10,중1 학생입니다!진짜 정말 만족스러워요다른 책에는 없는 것들도 자세하고 꼼꼼히 표로 잘 정리되어있어서 정말 만족스럽습니다!
9788959904969,10,충분한 문법연습을 할수 있어서 만족스러워요. 이렇게 많이 써보면서 연습하고 싶었었는데 반가운 교재예요.
9791164422777,10,책이 본교재와 워크북으로 이루어져 있어서 더 많은 문제를 풀 수 있다는 장점이 있었어요! 또 문제간의 간격도 넓고 글자의 크기가 적당해서 문제를 푸는데 보기에도 좋았습니다. 마지막으로 워크북으로 실력을 알 수 있어서 좋았던 것 같아요
9791164422777,10,아이가 직접 고른 책이니만큼 수학에 흥미를 가지게되는 책이 되길 바래요
9791162401668,10,고등학교 올라가기 전 기초 베이스를 만들기에 적절합니다. 유형별로 나눠져 있어서 독해를 좀더 디테일하게 연습할 수 있을 것 같아요.
9791186367940,2,세트면 구성품 설명이 있어야지 걍 세트요 ~
9788926154434,10,"개념탑에서는 개념과 기본문제를 학습할 수 있어 좋고, 익힘탑에서는 다양한 응용문제들을 풀 수 있어 좋아요."
9788926154434,10,중학교육과정에 맞춘 디딤돌의 투탑수학 체계적입니다.
9788926154434,10,개념설명이 잘 되어 있는 투탑이라 2학기 수학 예습용으로 사용하고 있습니다. 엄마 도움없이도 스스로 자학학습하기에 딱 알맞는 문제집인 것 같아요. 개념책과 개념익힘책이 함께 있어서 더 잘 공부할 수 있는 것 같아요.
9788926154434,10,개념부터 차근차근 쌓아가기 좋은 교재입니다.
9788926154434,10,예비중에게 꼭 필요한 기본개념수학 교재인거 같아요! 강추입니다.
9788926154434,10,중학개념서로 구성이 알차게 되어 있어요. 미리미리 예습하기에 좋아요. 투탑수학 강추합니다.
9788926154434,10,개념을 꼼꼼히 잘 잡아주는 것 같아요 기본 개념서로 우리 아이에겐 필수교재가 되었어요. 개념 꼼꼼히 잡아줘서 예습하기 좋아요~
9788926154434,10,"중1 아이랑 투탑수학 1-1을 써보고, 2학기 중등수학 선행개념서로 pick한 투탑수학!!!2학기 수학이 개념이 확실하고, 다양하게 적용할 수 있는 도형파트라 개념이 더욱 중요한데,개념을 확실히 잡아줄 수 있는 투탑수학으로 2학기 개념도 확실하게 잡고 갑니다. 투탑수학 짱!!!"
9788954743716,10,초등6학년에겐 필수교재인것 같습니다.EBS강의도 무료로 보고 공부하게되어 정망 만족합니다
9791188612000,10,예비중 아이 지금 예습시키고 있어요. 너무 만족한 중학연산 추천해요!
9788900421453,6,개념정리가 핵심만 잡고있어 가독성이 좋습니다.유닛1개에 개념정ㄹㅣ 반쪽 문제풀이 반쪽이라 구성이 깔끔해보이네요. 뒤에 워크북이 활용도가 높을거 같습니다.다만 시중여타교재들과의 차별성이 있어보이지 않아 아쉽습니다.
9788900421453,8,"제가 수업 시작할때 품사의 개념부터 잡고 시작하는데, 이책도 그렇게 시작합니다. 그래서 아이들이 좀더 쉽게 문장을 이해할수 있게 되고, chapter당 문제가 충분해서 문제풀고 개념잡고 그 다음 단원으로 넘어가기 좋습니다. 저는 이 책 구성이 마음에 들어서 방학특강 교재로 선정했습니다. ^^"
9788954725125,6,흑백이라 놀랬어요...다른분들 말씀대로 믿고 강의랑 같이 봐야겠어요..분철 좋아요 ㅎㅎㅎ
9788954725125,10,역사 공부하기 좋은 교재 입니다. 강의 들으며 하기 좋아요 강추합니다.
9788954725125,8,내용을 한페이지라도 미리 보여줬으면 좋겠습니다. 설마 책이 가로로 출력돼서 세로로 넘기는 책일거라곤 생각도 못했네요... 그랬으면 스프링분철 신청했을텐데 말이죠...
9788954725125,10,분철해서 배송받았음 그래서 책 넘기는데 불편함은 없었다여긴 문제가 없다. 그러니까... 기출 문제집처럼 문제 나오고 번호 고르는 그런게 없음 빈칸 채워넣고 개념 정의 영향 이런거 적혀있는 책이다. 난 이거랑 다른 문제집 같이 사서 공부함!
9788954725125,10,역시 역사는 너무 어렵네요. 시험결과는 불합격이지만 다음에는 할수있을거 같아요 ㅅㄱ
9788954725125,10,공부를 하는데 무난한 교재입니다.
9788954725125,10,이렇게 좋은 책이 만원밖에 안하다니..믿을 수가 없어요! 스프링 제본도 같이 신청했는데 책 읽기 너무 편하고 좋습니다^-^
9788954725125,10,매우 만족
9788954725125,10,아침에 주문해서 오후에 받으니 너무 좋아요 출근해서 주문해서 퇴근후 책도착너무 너무 좋네요
9788954725125,10,분철했으면 참 좋았을 거 같은 책.처음 받기 전 평범한 책 생각했는데 '강의노트'라고 적힌 걸 다시 한번 봤어야 했다... ㅋㅋ 가로로 보아야 하는 그냥 필기용 책. 개인적으로 알라딘 쪽에서 분철 지원해줬으면 정말 좋았을 거 같다... 뭔가 책 보기가 불편하다 ㅠㅠ
9788954725125,10,"개념도 보기 좋게 정리되어 있고, 자신이 스스로 정리할 수 있는 부분도 있어서 공부하기가 편리하다."
9788954725125,10,강의가 너무 좋아 책까지 구입하게 됐어요
9788954725125,10,"한국사능령검정시험을 위해서 구매함 교재인데, EBS중학에서 최태성쌤 강의를 무료를 들으면서 열심히 공부하고 있습니다. 한국사를 처음접하시더라도 이 교재와 강의 하나면 완전 정복할듯 싶습니다. 감사합니다."
9788954725125,10,큰별쌤의 완벽 노트 정리! 덕분에 한국사 검정시험 잘봤습니다. 중급에서 고급까지 선생님만 믿고 달리겠습니다!!!!
9788954725125,10,최태성샘 강의들으면서  올해 첫 시험을 보고 결과 또한 좋아서  기분이 좋아요...5월에는 고급1급을 향해 고고고~~~고급도 최샘의 강의를 들으며 준비하려합니다^^
9788954725125,8,보통 교재는 설명만 씌여있는 게 많은데 이 교재는 자기가 스스로 내용을 정리하게끔 되어있어서 복습효과가 좋은 것 같아요.
9788954725125,10,추천받아서 친구것까지 2권구입
9788954725125,10,강의도 좋고 다 좋네요!한국사 준비하는데 도움 많이될것같네요
9788954725125,6,"페이지 방향이 넓게 설정돼 있어서 필기하는 데 좀 어렵고,사료 정리하는 부분이 좀 더 깔금하고 보기 좋게 정리되었으면 좋았을 듯."
9788954725125,10,내가 쓴 강의 판서로는 못 보겠다는 분께 추천합니다!!
9788954725125,10,한국사 능력시험을 준비하는 사람에게 필수!! 최태성 선생님의 강의와 이 책과 함께라면 단번에 붙을 거라는 자신감이 들어요 ㅎㅎ
9788954725125,10,시험 준비하시는 분들 모두 좋은 결과 있으시길 바라요~!
9788954725125,10,3급 합격을 기원하며 100자 평을 남깁니다.임용고사 준비하는 분들 화이팅입니다!
9788954725125,10,정리기법이 정말 효과적이라고 생각합니다. 인강 판서 그래도 옮겨놓으셔서 솔직히 별로일거라고 생각했는데 정말 머릿속에 잘 들어와서 시험도 가뿐히 통과했습니다:) 인강들으면서 복습 꾸준히 하시면 시험은 문제 없을거라고 생각합니다
9788954725125,10,역시 최태성선생님이십니다. 아들이 EBS 강의를 들으며 독학했는데 빨리 3급 따기 좋다고 합니다. 강의를 듣고 기록할 공간이 있어 정말 좋았습니다.
9788954725125,10,"ebs동영상강의와 더불어 기출문제까지,,, 한국사능력검정시험대비에 아주 좋은 교재입니다.........."
9788954725125,10,괜찮네요 ㅋㅋㅋㅋㅋ
9788954725125,10,EBS 강의 판서를 그대로 옮겨 놓은 책입니다. 강의들으면서 공부하는데 딱입니다. 다만 강의를 듣지 않고 책으로만 자격시험 준비하기에는 다소 무리가 있습니다. 꼭 강의를 들으며 공부하셔야합니다. 다른 구매자분들이 말씀하셨 듯 사진이 흑백이란 점이 아쉽지만 가격으로 본다면 만족합니다.
9788954725125,10,강의들으며 필기하려고 샀는데 내용도 너무 깨끗하고 좋은거 같아요 강추 @.@
9788954725125,8,"요점정리에는 딱입니다.
필기싫어하시는 분들에겐 안성마춤 ㅎ"
9788954725125,8,"한국사 검정능력 자격증 따기 위해 책 주문합니다.하자 없는 놈으로 빠른 배송 부탁합니다^^
사진 선명하게 잘 보이는 걸로 검수해서 보내주셔요!!!!!!!!!!!"
9788954725125,10,합격으로 이 책을 보증합니다. 전 3급 합격!^^
9788954725125,8,"ㅋㅋ 정말 판서내용 그래로 적혀있고, 사진이 잘 보이는게 있다는게 흠이긴 하지만, 강의 완강하고 중급합격했어요."
9788954725125,6,도움이 많이 되고 있습니다.
9788954725125,10,최태성 선생님 덕분에 한국사에 대한 즐거움을 느끼게 되네요.
9788954725125,6,사진이 흑백으로 크게 되어 있으며 최태성선생님 강의 들으며 이용하기에 편리하게 되어 있다.
9788954725125,8,책 사실 분은 이 책이 강의노트라는 점에 유의하셔야. 그냥 내용 쭉 정리된 일반학습서 생각하면 열어 보고 당황하심. TV채널 돌리다 우연히 강의 보고 반해서 책 샀는데 선생님 판서하신 게 그대로 있어서 좋았음.
9788954725125,10,최태성 선생님의 수업을 위해 필요한 강의노트
9788954725125,10,"한국사 3급 따려고 샀는데 인강과 같이 듣기에는 좋아요
근데 혼자 공부하기에는 내용이 부족한 것 같아요"
9788954725125,10,우연히 알게된 최태성 선생님 강의! 사막에서 찾은 보석 같습니다. 큰별샘과 함께 열심히 공부하고 싶어요.
9788954725125,10,임용고사 필수! 이 강의로 올인!
9788954725125,10,ebs강의 판서내용을 그대로 책으로 엮어서 요점 중심으로 공부하기 좋습니다. 단... 강의와 함께 공부하심 가장 효과적일 듯 싶습니다.
9788954725125,6,"중급은 중학생용 고급은 고등학생용이라고 써있어서 한권은 반품신청했어요. ㅠ.ㅠ 
한명은 이제중1이 되고요. 한명은 고2가 되는데 잘몰라서 중급 두개주문했다가 낭패를 봤네요 문제는 없고 설명만 듣는 거에요"
9788954725125,10,학교에서 권장하는 자격증 중 하나여서 구매합니다.
9788954725125,10,임용에 필수^^ 한권 추가요
9788954725125,10,책 구성이 이상해 보였지만 일단 강의가 너무 좋구요 책구성은 강의내용에 맞게 만들어진거네요^^
9788954725125,10,판서내용 외에도 다양한 자료나 표가 수록되어 있어서 좋아요
9788954725125,10,최태성 선생님 믿고 구매했는데 책 좋네요 ㅎㅎ
9788985456982,10,중등용이기 보다는 초등용으로 적합한듯..하루 한장씩 차근차근 외우는 중인데중요단어가 앞부분이라 독해시 많은 도움이 되는듯 싶어요.
9788985456982,10,단어가 어렵지 않아서 아이들이 성취감을 느끼며 공부할 수 있도록 구성되어 있는것이 큰 장점이네요- 아이가 쉽게 따라오고 있어서 가르치는 저도 보람을 느껴요~!
9788985456982,10,초등고학년 교재로 사용하고 있습니다. 예문도 나오고 책크기도 갖고다니기 편합니다. 뜻도 빨간 필름으로 테스트할수 있어 좋아요
9788985456982,10,개정 3판과 개정판 모를 먼저 봐야 하나요?????
9788985456982,10,초등학생인 동생 가르쳐주려고 구입했습니다. 하루에 5단어씩 부담없이 외우도록 하고 있습니다.
9788985456982,10,우선순위 영단어 영어공부의 시작...
9788985456982,10,중학 영단어를 공부하기 편하게 정리한 참고서다.
9788985456982,8,매일 단어 공부를 위해 샀습니다. 아이가 보기에 편하게 생각하고 쉬운 단어부터 나와있어서 좋습니다.
9788985456982,10,기초 영어단어책으로 사용하기 괜찮아요.
9788985456982,8,초등용 기초 단어용으로 괜찮은것 같아요
9788985456982,10,아이가 지난 1달 필리핀 어학연수를 가서 유용하게 이용했습니다.
9788985456982,8,중학교에 입학전에 공부하려고 샀는데 예문도 잘 되어있어 외우기 쉬울것 같네요
9788985456982,10,단어를 얼른 정리하는데 아주 유용한 책입니다 MP3를 활용하면 더 좋습니다^^
9788985456982,4,뭡니까? 수능단어 비율은 변하기때문에 바꿔도 되는데 중등꺼까지 바꿀필요가 ...
9788985456982,10,"오오 생각보다 너무 좋네요 디자인이나 크기가 한손에!!!
가격도 괜찮고 영어단어 굿!"
9788985456982,8,기초단어를 단기에 정리하기에 도움됩니다.예문과 함께 응용까지..방학기간 보람있게~
9788985456982,2,기존 책하고 많이 달라져서 당황스러울 뿐입니다
9788985456982,10,초등4학년인데 겨울방학동안 쉬운단어정도는 익히려고...
9788985456982,10,학생들을 가르치면서 왕기초는 이책으로 시작한다. ^^
9791164992720,10,문제수갑
9791164429790,10,신 수학의 바이블 개념 중학 중학교 입학을 앞둔 아이 개념을 위해서 선택했어요  중단원 테스트 대단원 테스트로 학업성취도 테스트로 워크북으로 이루어진 교재는 핵심을 쉽고 빠른시간에 이해할수있어요   본교재 / 워크북/ 정답과 풀이로 3권으로 분리해서 사용할수 있는점도 편리합니있어
