ISBN13,rating,review
9791136007766,10,당황하지 않도록 도움을 받을 수 있을 것 같습니다.
9791136007766,10,공기업 취업의 특성상 필요한 것이 모두 있습니다.
9791136007766,10,"최신기출 분석과 꼼꼼한 해설, 실전 감각까지 키울 수 있는 퀄리티 높은 기본서!!!! 코레일 취업을 원한다면 무조건 추천드립니다~"
9791136007766,10,에듀윌 교재가 가장 공부하기 좋은 거 같아요. 깔끔한 구성 정말 좋습니다!
9791136007766,10,"최신 기출 유형이 반영된 NCS, 전 직렬 전공 핵심 개념이 담긴 2021 에듀윌 코레일 기본서 추천해요!"
9791136007766,10,코레일 NCS는 처음 준비하는데 에듀윌 코레일 기본서 덕분에 최신 기출 유형 분석과 대표 기출 문제 등을 알 수 있어서 좋아요!:-) 실전 연습문제 및 해설을 통해 시험을 더욱 꼼꼼히 대비할 수 있을 것 같습니다!
9791136007766,10,2021 코레일 합격을 목표로 하고 계신 분들!!!!!!! 고민하지 말고 에듀윌 NCS 기본서 구매하세요 후회 없으실 거예요 2020년 상/하반기 코레일 필기시험 최신경향 분석도 수록되어 있으니 도움 많이 되실 겁니다!
9791136007766,10,이번에 코레일 취업준비를 시작하게 되었어요. 올해 합격이 목표라 교재 선택에 신중했는데 에듀윌 NCS 교재가 오류가 적고 전반적인 퀄리티가 좋다는 말을 들어 구매했어요. 실제로 20년도 상/하반기 기출복원 문제를 통해 코레일 필기시험 최신 경향을 분석하고 수록해 만족스러웠어요!
9791136007766,10,코레일 필기 시험을 대비하여 기본기를 탄탄히 다질 수 있는 교재입니다! 실전 연습 문제가 수록되어 있어 실전 감각을 기를 수 있어요. 추천합니다!!
9791136007766,10,"책 디자인도 깔끔하고 NCS 영역별 대표기출 유형 수록, 2020년 상/하반기 코레일 필기시험 최신경향 분석 수록 등 또 각 분야 별 전공 문제들도 수록되어 있어 구성이 참 좋네요 코레일 필기시험 대비에 딱 좋은거 같습니다"
9791136007766,10,NCS 방향성 잡는 것과 동시에 전공 정리까지 확실히 할 수 있는 기본서입니다. 그와 동시에 실전연습 문제도 수록되어있어서 한 권으로도 부족함을 느끼지 않을것같아요.
9791136007766,10,구성도 깔끔하고 특히나 전공별 기초에 대한 내용이 수록되어 있어서 좋았습니다
9791136007766,10,코레일 철도공사 취업을 준비중이시라면 이 교재와 함께하는 것을 추천드립니다 :D
9791136007766,10,책도 깔끔하고 좋아여!!! 특히 ncs유형별로 구분되어 있고 실전문제랑 전공문제들도 각각 있음 문제 풀기 좋음
9791136007766,10,비전공자인 저도 이 책만으로 공부하고 전공을 대비할 수 있도록 잘 구성되었습니다 그리고 NCS 유형별 문제 수록도 철저하게 나와있습니다.
9791136007766,10,"코레일 필기를 처음 준비하는데 기본이 되며 유용합니다. 특히 앞부분에 경쟁률, 직렬, 코레일 인재상 등 기본적인 부분을 섬세하게 알려줘서 많은 참고가 됩니다. 문제도 최신경향 분석, 유형연습 문제/실전연습 문제, 대표기출 유형 등으로 분리해 꼼꼼하게 대비할 수 있어서 만족합니다."
9791136007766,10,코레일 기본서를 무엇을 고를지 고민이 된다거나 코레일을 준비해야 하는 분들은 이 책 추천합니다!
9791136007766,10,코레일 NCS 대비에는 이 책이 딱이죠~! 이 책 하나로 코레일 NCS 완벽 대비
9791136007766,10,코레일을 대비하는 NCS 준비생들에게 꼭 필요한 기본서! 이 책 하나로 완벽대비!단기간에 빡공이 가능한 학습서라고 생각합니다!
9791136007766,10,코레일 ncs가 난이도가 높은 편인데 각 ncs영역별로 대표기출 유형이 수록되어있어 나의 강점과 약점을 파악하기 쉬우며 부족한 부분을 채워넣으면서 공부할 수 있습니다.!또한 실전모의고사까지 수록되어있어 마지막으로 정리하기도 유용합니다.
9791136007766,10,ncs와 전공이 함께 있어 공부하기가 편해요!
9791136007766,10,코레일의 최신 경향이 수록되어있어 코레일을 준비하기 위한 최적의 도서라고 생각합니다.
9791136007766,10,실전에 대비하기에 적합한 문제유형으로 구성되어 있어서 좋습니다.
9791136007766,10,영역별 대표 기출문제와 실전문제까지 모두 들어있는 알찬 책입니다!
9791136007766,10,"코레일 대비하기 최적화 되어있는 교재라고 생각합니다. Ncs 유형별, 기출모의고사 수록되어 있어 공부하기 좋습니다:-)"
9791136007766,10,실전 연습 문제 수록이 되어있어 시험장에 들어가기전에 시험 유형을 알 수 있어 좋습니다
9791136007766,10,최근 시험 경향에 맞게 문제 구성이 되어있어서 실전시험대비를 하기에 좋습니다.  자신감이 생겼습니다.
9791136007711,10,비전공자에게 추천하고 싶은 민법 기본서
9791136007711,10,에듀윌 공인중개사가 좋다고 해서 강의 신청했는데 책과 함께 보니까... 이해도 쉽고 가시성도 좋습니다. 눈에 잘 들어와서 여러 번 볼 수 있을 거 같아요.
9791136007711,10,이책으로 나는 공인중개사가 될수 있다!!!아자!!
9791136007711,10,에듀윌 민법책은 민법 처음공부하는 사람에게도 이해도 쉽게 정리가 잘 되어 있네요.^^
9791136007711,10,에듀윌 공인중개사 강의를 들으며 최소 5회독하면서 달달 외울 책! 빠릿빠릿한 법 개정과 최신 기출예상문제 수록으로 올해 합격을 위해 꼭 필요한 책! 괜히 이 책 안사서 한 문제 차이로 떨어졌다고 울고불고하지 말자!
9788992561372,4,오타가 너무 심하고 일부 문장에 조사나 설명이 빠지는 등 공식 수험서라고는 볼 수 없는 수준입니다.
9788992561372,8,"검색마케터, 시중에 교재가 많지는 않네요ㅜㅜ 잘 참고해서 공부하겠습니다."
9788992561372,6,자잘한 오타가 넘 많고 계산식 공식도 순서가 이상해유.. 제대로 검수(?)를 안한 느낌이 드네요. 시험 교재가 이거밖에 없는데ㅠㅠ
9791190346641,8,12월 17일 구매..  아직 1쇄본임
9791165763312,6,"중복선지 다수에, 답과 해설도 문제 바로옆이나 아래가 아니여서 가독성이 좋진 않습니다.하지만 편집이 아쉬울뿐 선지내용은 좋습니다."
9791165763312,10,책 배송 잘 받았습니다 교환받는거라 조금 기다려야 했는데 책 퀄리티도 좋고 제본 상태도 만족스럽습니다 굿굿
9791165763312,10,짱인거가태요 이거만 다 소화하면 만점나올듯...
9791136007575,10,"SMAT자격증 취득하기위해 이 책을 공부하는데, 타 교재보다 좀더 깔끔하고 한눈에 들어오게 되어있어서 너무 좋았습니다. 타교재는 기출본 요약본을 따로 들고다녀야하는데, 요약본과 기출본이 한권에 묶여서 휴대하기 편한점도 마음에 들었습니다."
9791136007575,10,혼자 공부하기에 아주 적합한 책 입니다 ! 시험장에 가면 다들 에듀윌 노란 책 들고 다닌다네요 .. ㅋㅋ곧 시험인데 좋은 점수 받을 수 있을 것 같아요 !본 리뷰는 에듀윌 서평단에 참여하여 출판사로부터 무상으로 도서를 제공받아 실제로학습 후 솔직하게 작성한 후기입니다.
9791136007575,10,SMAT 자격증 시험은 처음인데 1주 완성으로 공부해서 합격할 수 있을것 같은 교재였어요
9791136007575,10,단기간 시험 대비 할 수 있는 핵심 요약 책입니다!
9791136007575,10,"1주끝장이라는 말이 맞게 정말 잘 되어있어요 설명도 잘 되어있고, 챕터 끝날때마다 예상문제가 있는데 실제 시험 봤을 때 도움도 많이 됐고 동영상까지 무료로 제공 되니 정말 모르는 부분은 동영상으로 강의 들으며 이해할 수 있어 좋았습니다."
9791136007575,10,1주만에 자격증을 준비하는 분들의 필독서! 믿고 보는 에듀윌 교재라 그런지 핵심만 쏙쏙 들어있어서 공부하기 너무 편하고 좋았어요~ 추천합니다!
9791136007575,10,타사도서대비오류&오타가 현저하게 낮습니다. 다른책들을 보면 오타때문에 시간을 많이 뺏기는데 에듀윌 책이 좋은점이 오타가 없다는것입니다. 그래서 문제보고 시험장에 갈 수 있어 좋은 책들인것 같습니다.
9791136007575,10,1주만에 SMAT를 끝장 보실 분은 꼭 사셔야 합니다! 완벽하다는 단어가 아깝지 않을 정도로 완벽한 기본서입니다.
9791136007575,10,올해가 가기전에 단기간에 자격증을 취득하고 싶었어요 올해 이직도 맘처럼 안되고 힘들었는데 우연히 SMAT라는 자격증을 알고 에듀윌로 선택했고 역시 시험주관처 공식인증 교재라서 그런지 깔끔하고 시험규정 시험출제범위 유형등 잘 나와있고 좋았습니다
9791160182521,8,정리 깔끔하고 좋아요어플도 그렇고 책도 그렇고 수험생 고려를 많이 해서 만든 게 느껴짐다만 비닐포장까지 돼있음에도 불구하고 내부 종이들이 구겨져서 옴(제작과정에서 불량 발생한 상품이 그냥 판매되네요)
9791136008565,10,직장인이지만 회계는 모든 경제의 기초이니 배우면서 자격증도 획득하려 합니다~합격 갑시다!
9791136008565,10,"이론과 실무, 기출문제까지 잘 수록되어 있어서, 독학으로 전산회계1급 준비하기에도 좋은 책"
9791136008565,10,전산회계 실무 이론 모두를 한방에 완벽하게 잡을 수 있는 교재!
9791136008565,10,이론편과 실무편   최신 기출로 구성해서 한 권으로 전산회계 1급을 합격할 수 있는 실무 실전 대비가 가능한 책!
9791136008565,10,회계에 대해 잘 몰라도 독학할 수 있는 책인 것 같아요. 이론부터 실무까지 한 번에 풀 수 있어서 좋았습니다. 책 디자인도 깔끔하고 전년도 교재보다 문제 양도 많아져서 만족합니다. 독학으로 전산회계자격시험 보시는 분들에게 도움이 많이 될 것 같아요.
9791136008565,10,회린이라도 가능한 가성비 갑 에두윌이다
9791136008565,10,책 한 권으로 이론부터 실뭏까지 전산회계1급을 쉽게 공부할 수 있는 책입니다.
9791136008565,10,﻿﻿전산회계자격시험을 준비하고 있는 취준생에게 추천합니다!
9791136008565,10,회계 어렵게 생각했는데 에듀윌 접하고 생각이 바뀌었어요! 완전 강추합니다 :)
9791136008565,10,입문용으로도 괜찮아요! 가볍게 시작하기 정말 좋습니다. 그치만 저는 총정리 용으로 더 추천드려요~!
9791136008565,10,전산회계 1급 독학하기 딱 좋은 책인거 같습니다.
9791136008565,10,회계 비전공자지만 책 커리큘럼으로 이론 실무 한번에 독학 가능한 교재인 것 같습니다.
9791136008565,10,비전공자도 거리낌없이 쉽게 접근할 수 있습니다. 전산회계 1급 취득하기에 적합한 교재 에듀윌 최고에용
9791136008565,10,회계를 처음 접하시는 분들께 매우 추천하는 책입니다! 전산회계는 에듀윌과 함께 하세요!!
9791136008565,10,회린이에게 정말 딱이다 그저 빛 에듀윌
9791190670418,10,책구성이 알차고 인강까지 같이 들을수 있어 더욱좋습니다. 소통능력은 꾸준한 학습만이 살길입니다. NCS에 알맞게 어떻게 더 유용하게 독해하고 문제를 풀수있는지 강의이고 책입니다. 강사님의 노하우와 문제해결능력 사고방식을 길러주는 아이디어와 방법으로 구성되어 알차다고 생각합니다. 처음싲박하
9791190670418,10,"고난이도라고해서 걱정했는데, 고난이도 뿐만 아니라 ncs입문자를 위한 문제도 많이 수록되어있어서 좋았다. 또한 문제푸는 방법이나 해설이 잘 되있어서 입문자에게 추천한다!! 이걸로 건보뿌실거다!!!"
9791190670418,10,NCS 의사소통을 위해 처음으로 구매한 책입니다! 기본기가 많이 부족해서 걱정이었는데 책을 보고 교재와 인강으로 공부하면 실력을 쌓을 수 있겠다는 느낌이 들었어요! 처음은 기본기부터 잡아주고 심화되는 내용이 진행되는 거 같아서 좋네요 ㅎㅎ 이 책 뿐만이 아니라 다른 고N고 시리즈도 좋다고 생각합니다
9791190670418,10,"의사소통 능력 부분이 너무 약해서.. 고민하던 중에 추천을 받고 풀게 되었습니다. 기본형 문제부터 약간 고득점용 문제까지 다양하게 많고, 기출문제 수록되어있는 점이 가장 맘에 듭니다. 해설지만 보고도 충분히 이해가 갈 정도입니다. 이 책을 다 풀고 나면 분명히 실력 상승될듯.."
9791190670418,10,"왜 점수가 오르지 않는지 알고 싶으신 분들,,, ! 이 책입니다... 진짜! 저의 단점 약점을 파악할 수 있었어요. 상반기 필합,, 가능할 것 같아요..!"
9791190670418,10,문제가 나쁘지 않아요
9791125480617,10,다른 자격증 시험 준비하면서 제일 의지가 되던 기억이 있어서 이번 직업상담사 2급을 준비하면서도 제일 많이 도움받을 수 있을 것 같은 기대가 됩니다! 수험생입장으로서 가장 친절하고 자세한 길잡이 역할이 되어 주는 문제집입니다!!
9791125480617,10,내년 직상2급 도전하기에 적합한 책이라고 생각합니다! 단권이론서로는 짱인것 같아요!!! 합격기원입니다
9791125480617,10,"아니 이렇게 깔끔하고 자세하게 설명되어있는 책이라 더 기대되는걸요 ? 이거 한 권이면 합격할 수 있을 것 같아서 기대가 됩니다. 한 번 공부해서 바로 합격할 수 있도록 열심히 공부할 맛 날 것 같아요 ,,"
9791125480617,10,"내년 초 직업상담사2급 도전하려고 준비 중입니다~!인터넷검색, 직업상담사 관련 카페 등에서 시험 준비나 과목들 정보를 모으고 있는데, 시대에듀 문제집 추천이 가장 많더라고요! 1차 필기 2차 실기까지 이 책 한 권으로 동차합격 목표로 열공하겠습니다❤️"
9791125480617,10,서술형에 약해서 2차시험이 항상 산처럼 느껴졌는데 저같은 사람도 충분히 할 수 있겠다는 생각이 들게 해 주는 구성이 무엇보다 마음에 들어요. 시중에 수험서는 많지만 최단 시간 투입으로 최고의 결과를 내고 싶어서 이 책을 선택했어요. 끝내기로 내년엔 꼭 동차합격해서 이직 성공하고 싶습니다!
9791125480617,10,직업상담사 책하면 1등 아닙니까! 이 책 읽고 마스터여 한방에 합격으로 남길게요!!
9791125480617,10,시대고시 다른 수험서나 인적성관련 서적들을 봤었는데요. 이번 직업상담사 2급 시험 도서는 한권으로 단권화가 되어 있어서 보기에 가독성이 굉장히 좋을 것으로 생각이 됩니다. 또한 합격노하우 비법노트가 담겨 있어서 공부하는데에 많은 도움이 될 것 같네요.
9791125480617,10,아이 셋을 낳고 난 후 뭔가 생산적인 일이 하고 싶고 자격증을 따서 자존감도 높이고 싶은 생각에 이것저것 알아보던중 저에게 딱인 교재가 나타났어요. 젊었을때의 청춘처럼 저의 청춘을 다시금 새겨넣을 수 있는 교재임에 틀림없어요~^^
9791125480617,10,파란색으로 기출에 출제되었던 중요한 내용이 체크되어 있어서 따로 중요한 내용만 따로 정리하면서 공부할 수 있다는 점이 좋아요 단색으로 이론이 정리되어 있으면 처음 공부하는 입장에서 뭐가 중요한지 파악하기 힘드니까요. 그리고 중요키워드로 정리하면서 시험에 딱 적합하게 공부할 수 있어요
9791125480617,10,한권으로 필기실기 다 노릴수 있는게 장점인거 같습니다. 직상 준비에는 시대고시는 정평이기에 개정판도 기대됩니다.
9791187870715,10,"표지 색상이 맘에 들어요. 아무래도 하반기 문제들을 수록해서, 얇은 편이에요.해설이 자세하고 친절한 편입니다!"
9791136006837,10,항상 기본 이론을 공부하다보면 실제시험과 유사한 유형&난이도만을 선별해서 풀고 싶다는 생각을 했습니다! 그런 문제집이 출시되었다고 해서 구매했습니다! “본 후기는 에듀윌 온라인 스터디 참여하여 솔직하게 작성한 후기입니다.”
9791136006837,10,최신 경향 기출문제집으로 기출문제를 파악해요!
9791136006837,10,최신 경향 기출 문제가 다양한 직렬별로 수록되어 있고 해설이 꼼꼼하고 정리가 잘 되어있어요.
9791136006837,10,실전처럼 시간재고 풀기 아주 유용합니다.
9791136006837,10,마지막까지 함께할 교재.
9791136006837,10,"기출문제 순서는 최신순으로, 국가직, 지방직, 서울시 순이어서 난이도가 점점 어려워져서 점점 실력을 올릴수 있을것같다."
9791136006837,10,최신기출문제집 필요하신 분들 딱이에요
9791136006837,10,"다양한 직렬의 6개년 기출문제를 풀어볼 수 있고, 취약 영역을 체크할 수 있어 좋아요"
9791136006837,10,헤설이 잘 되어있어 좋아요
9791136006837,10,자신의 취약영역을 분석할 수 있어요!
9791136006837,10,기다렸던 에듀윌 교재입니다. 역시나 군더더기없는 문제-해설-합격예측서비스 구성이구요. 문제도 난이도있게 잘 구성된것같습니다 만족해요
9791136006837,10,구성이 좋습니다!
9791136006837,10,다양한 직렬의 기출문제가 들어있어 연습하기에 좋을 것 같습니다. 본 후기는 에듀윌 온라인 스터디 참여하여 솔직하게 작성한 후기입니다
9791136006837,10,해설지가 자세하고 다양한 직렬의 문제를 접할 수 있어 도움이 됩니다.
9791188567164,10,경영학이 워낙 휘발성이 강해서 걱정인데 객관식 경영학으로 완전히 타파하겠씁니다!! 꼭 취뽀할거에용~!~!
9788971872116,10,농업직 공무원 수험서의 기본
9788971872116,10,책을 사서 빠른 배송도 좋았는데책이 깔끔하지 않네요 종이에 기름때같이 묻어있고 겉표지도 벗겨져있고...마치 누가 썼던것처럼가격이 저렴한 것도 아닌데 기분별로네요
9788971872116,10,기본서중 진리죠! 열공!!
9788971872116,10,농업직공무원 준비서적으로 한권이면 ㅇㅋ
9788971872116,8,알찬 내용..그러나 인도자가 필요 할 듯...혼자서는 보기가 조금 힘이 들더라구
9791186608883,10,효율성이 중요시되는 공무원시험에서 수많은 단어책들 중믿고 구매합니다. 정말 단어들이 우선순위대로 다 있는지 기대됩니다
9791186608883,10,단 한권으로 정복하는 공무원 직렬별 영단어!!! 다른 단어장 저리가라 필요없다 이 책만으로 정복할수 있는 단어장
9791186608883,10,"적중율 좋기로 소문이 자자한 공무원 수험 영단어!최고의 적중율로 소문이 자자하지요! 빈출순, 직렬별로 구분도 잘 되어 있어서 시간도 절약되고 중요한 단어 부터 외울수 있어서 좋아요. 작년판에 비해서 많은 부분이 더 좋은 방향으로 개선이 되어 수험생들에게 더욱 도움이 될것 같네요."
9791186608883,10,시중의 단어장에서는 찾아볼수 없는 수험생 맞춤형 단어장입니다.단어장을 열심히 외웠는데 독해에는 하나도 적용이 되지 않았던 경험이 있는분들에겐정말 좋은 책이 될것입니다. 왜냐하면 빈출순대로 단어가 나열되어 있고 뜻도 시험에 나온뜻으로 제시되어 있기 때문입니다.
9791186608883,10,"공시생 영단어 필수교재!! 2020대비 완전 리뉴얼되어 불필요한 지엽적인 단어들은 모두 제거하고 유사어,파생어를 강화하여 작년대비 군더더기가 사라졌네요. 1.단어배열방식 변경 2.표제어통합으로 암기분량감소. 3. 단어발음이 한글발음으로 표기 등 2021버젼 무척 기대됩니다."
9791186608883,10,"공시생의 어휘암기 필수책!어휘암기 범위를 줄일 수 있으며, 직렬별로 구분되어 있어서 내가 필요한곳만 범위줄여서 볼 수 있어요. 2020버전도 있지만, 이번에 동의어 유의어까지 개정되어 있어서 재구매 합니다. 어휘공부 범위를 줄여서 엑기스만 공부하기 좋아요."
9791136005533,8,"9급공무원대비에 맞는 교재인 것 같아요. 9급공무원 교재로는 최고인 것 같구요, 9급 공무원 준비하면서 처음 써보는 데요. 아주 좋네요;. 에듀윌 공무원 광고로 많이 봤습니다. 9급공무원책을 많이 써봤지만 영어"
9791136005533,10,주어와 동사 보어 등을 퍼즐처럼 시각화해 한눈에 이해되고 적용하기도 좋아요. 한권으로 문법이 정리되어있고 꼭 외워야할것은 ㅇㄱㅁㅂ으로 표시되어있어 회독할때 이것만 봐도 좋을거같아요.
9791136005533,10,잘 읽혀져서 초시생들에게 독학러에게 필수교재로 추천드립니다!
9791136005533,10,혼자 공부하기에도 좋은 기본서!
9791136005533,10,이론을 읽고 난후 바로 범위내의 문제를 파악할 수 있어서 좋았어요! 회독플래너가 있어서 무리없이 다회독할 수 있어요
9791136005533,10,회독 플래너까지 기대됩니다
9791136005533,10,9급 공무원 영어 기본서로 좋아요~
9791136005533,10,혼자서 공부하기에 계획짜기 부담스러운데 회독하는 플랜에 맞춰구성되어 반복하기 좋습니다.
9791136005533,10,기본서로 활용하기 좋아요
9791136005533,10,"에듀윌 교재는 직관적이고, 가독성이 좋아서 만족스러워요!!"
9791136005533,10,9급공무원 영어는 에듀윌 기본서로 충분합니다!!!
9791136005533,10,최신기출분석을 기반으로 이론->적용->문제풀이->복습의 프로그램으로 완벽하게 학습할 수 있도록 도와주는 기본서에요!
9791136005533,10,"공무원 영어를 처음 시작하는 수험생이나,영어가 어느 정도 정리가 된 공시생이라도,9급 공무원 영어 고득점을 위해서 반드시 한 번은 다시 정리할 필요가 있는영어 기본서 교재라고 생각해요."
9791136005533,10,"최근 5개년 9급 기출을 바탕으로 영역별 출제 문항수와 출제 개념을 분석해두었더라고요. 개념학습 하기 전, 영역별 출제비중과 개념을 파악해 더욱 전략적으로 공부할 수 있어서 굿!"
9791136005533,10,"사람들이 많이들 공부하는 에듀윌 영어 기본서죠. 독해, 문법, 어휘로 3권 분권으로된 2021 에듀윌 9급 공무원 기본서 영어예요!"
9791136005533,10,"바로 내가 내일의 공무원 합격 주인공이 되는 그 순간까지... 문법 어휘 독해의 3박자를 갖춘 밸런스 업 영어 기본서를 기대합니다. 아무리 내용이 꽉찬 수험서도 지루하기만 하면, 무용지물인데... 웬지 노란 표지를 접하고 나면 얼마나 속독속해 로 이끌어줄 지, 일취월장할 수 있을지 기대합니다."
9791136005533,10,"영어는 전년도에 열심히 안해서 이번년도에 에듀윌책 사서 열심히 해보려고 합니다!! 역시 믿고 사면되는 에듀윌 너무 기대가 됩니다.영어는 다른것보단 문법,단어,독해가 중요한거같아 더욱더 체계화 되있고 세세한"
9791136005533,10,에듀윌역시 좋아요~
9791136005533,10,"(기대평) 철저한 기출 분석으로 문제 유형, 개념을 파악하여 공부 방향을 잡을 수가 있고, 자연스러운 회독으로 공부의 효율을 높일 수 있을 것 같습니다. 또한, 어휘를 많이 아는 것이 큰 무기라 생각하는데, 이는 단 한 권으로도 어휘를 마스터하는 것에 큰 도움이 될 것 같아 기대가 됩니다!"
9791164841219,10,딱 매경 공식 가이드 한 권으로 2주만에 71회 매경테스트 우수 합격했습니다 ㅎㅎ 다른 책은 보지 않아 비교 할 순 없지만 공식 가이드라 그런지 연계율이 매우 높아 만족도가 높습니다. 추가로 매경 준비하시는 분은 시험 며칠 전 페이스북에 올라오는 주요 단어? 보시면 좋을 듯 합니다 ㅎㅎ
9791164841219,10,매경테스트 준비하면서 봤던 도서에요! 경영 경제 관련해서 잘 몰랐어서 막막했는데 이 책 통해서 잘 공부할 수 있었네요 문제를 통해 배운걸 적용해 볼 수 있었고 연계율도 꽤 높아서 좋았습니다 추천합니다ㅎㅎ
9791155027981,10,가독성 좋고 세권을 한권으로 줄여서 한 번에 정리하기 딱이예요!
9791136008633,10,정말 좋습니다.
9791136008633,10,퀼리티와 분량 크기까지 완벽하네요. 감사합니다.
9791136008633,10,실제 시험지 같은 문제집이라서 실전을 생각하고 마무리하기엔 좋은 것 같아요!
9791136008633,10,"택배로 책 받자마자 실제 시험지 크기와 같아서 놀랐어요!실제 최신기출유형을 반영해서 좋고, OMR카드도 있어서 정말로 시험치는 것처럼 테스트 해볼수 있어서 좋아요!˝에듀윌 온라인 스터디 참여하여 솔직하게 작성한 후기입니다.”"
9791136008633,10,실제와 매우 흡사합니다 유용해요 특히 QR코드!!
