ISBN13,rating,review
9788937413711,10,무조건 믿고 보는 김혼비
9788937413711,10,기대됩니다!
9791197360404,10,전 책을  별로좋아하지 않는사람입니다 .하지만 조영권 작가님 중국집 책부터 경양식집에서  이책까지 지루하지않고 음식사진과 피아노조율이란 매력적인 직업의 컨텐츠에 접목시켜 좋은것같아요 이제 세권째가 어떤작품일지 기대됩니다 화이팅~.^
9791197360404,10,라디오에서 며칠 전 우연히 듣고 읽어봤네요. 경양식 추억 돋네요. 몇군데 가보고 싶어지네요.
9791197360404,8,"인스타 맛집에 아주 질렸는데 이런 오래된 식당 소개 반갑다. 식당 소개도 좋지만 피아노 조율사 18년, 직장인의 애환도 함께 볼 수 있어서 좋았다. 근데 소개한 식당 한 군데도 가보지 못했는데 가보기 전에 없어지면 어쩌나 걱정이네..."
9791197360404,8,책 자체는 좋았다. 그런데 책 읽고 책에 나온 식당을 4곳 찾아갔는데 책에서 묘사한 그런 느낌은 아니었다...
9791197360404,10,"평소에 구독하던 블로그의 주인분께서 쓰신 책인데다, 경양식 매니아인지라 반갑게 텀블벅 펀딩했었습니다. 블로그 포스트들처럼 언제나 식사에 진심인 분이시기에 정보들도 알차고 가독성도 좋아서 술술 읽힙니다. sns 맛집에 지친 노포 매니아들에게 강추해요"
9791197360404,10,"군침이도네요,,,아저씨의 담담하고 담백하면서도 신난 말투가 잘 살아있어서 읽는 동안 덩달아 즐겁고 흐뭇했어요. <중국집> 재밌게 읽어서 또 샀는데, 그때 느꼈던 저자분의 매력이 그대로 살아있으면서 옛날 경양식이라니 신선했어요. 지난번에 없던 인터뷰 섹션까지 생겨서 더 유익했네요! 츄릅"
9791197360404,10,소재랑 분위기가 일본인줄 알았는데 한국책일 줄이야 ㅎㅎ꼭 읽어보고 싶네요!!
9788972916529,10,김은희 작가님이 방송에서 추천해주셔서 보게되었는데 진짜 재밌어요. 읽고나면 동네 뒷산이라도 걷고싶어질거에요.
9788972916529,2,커버 디자인을 대체 무슨 생각으로..?
9788972916529,10,역시 최애 작가님이라 신작 나온 것 보고 묻지도 따지지도 않고 구매했어요. 입담 세계 최고 브라이슨 님!
9788972916529,10,기대되는책
9788972916529,10,가장  재미있게  읽은  여행기    도서관에서    두번이나  대여해  다시  읽은  기억이  새롭다
9788972916529,8,기대되는책입니다
9788972916529,6,왠지진지할듯함
9788972916529,8,이 책의 100자평이 별로 없는 이유는 사람들이 이미 구판을 사서 다 읽었기 때문입니다. 제가 읽은 여행기 중 가장 유쾌했습니다. 강력 추천합니다.
9788972916529,10,여행기에 그림이나 사진한장 없이 오로지 저자의 말로 여행을 이끌어가는 방식이 좋다. 세상에서 가장 재밌는 여행작가이자 세상에서 가장 불친절한 여행작가. 좋은책이다.
9788972916529,10,"여행지에서 읽었다. 생각보다 힘든 여행이었는데, 사서 고생하는 작가의 발랄한 고행담이 내가 처했던 상황을 전혀 다르게-발랄하게-해석할 수 있게 해줬다. 역시 일체유심조가 맞긴 한 모양이다."
9788972916529,8,책 내용은 참 재밌으나 군데군데 글꼴이 다른 글자들이 눈에 띄네요. 편집자가 놀면서 일한 듯.
9791196975258,10,출시되자마자 구매해서 읽어봤어요!중간 중간 ˝아!˝ 하고 감탄하게 만드는 글이 있어서처음엔 가볍게 한번 보고 두번째 읽을 때는밑줄도 쳐가면서 읽고 있습니다뭔가 그 지역에 대한 자세한 설명을 더한 여행기라기 보다는작가님이 느꼈던 일화?를 압축해 놓은 듯 해요재밌습니다!
9791196975258,10,"화려하지 않지만, 여행기 속에서 만나는 여유로움이 읽는 내내 나도 가고싶다라고 느낄만큼 설레임을 느꼈습니다. 빡빡한 삶 속에서 한 달에 한 번, 내 자신을 마주할 수 있는 느긋한 일본전국여행을 제대로 느낄 수 있었습니다. ^^"
9791196975258,10,마스다 미리 작가님의 첫 혼자 여행 이야기! 혼자여행하며 느끼는 다양한 감정들이 완전 공감됩니다~게다가 귀여운 만화까지 들어 있어서 보는 재미 두배!
9788954655972,8,"점점 더 사회적으로 나에게 부여된 정체성이 때로 감옥처럼 느껴지는 순간이 많아지면서, 여행은 내가 누구인지를 확인하기 위해서가 아니라 내가 누구인지를 잠시 잊어버리러 떠나는 것이 되어가고 있다. (p.180)"
9788954655972,10,명절이 껴있지만 빠른배송 해주셨어요 ~지인이 추천해줘서 읽어보고싶어서 구매했어요
9788954655972,6,여행은 일상의 부재
9788954655972,10,좋아서 두 번 읽었는데 또 읽고 싶네요.
9788954655972,6,"부산에 내려가는 길, ktx에서 펼쳤던 책.좋지도 나쁘지도 않은 심심한 책이다."
9788954655972,8,여행의 이유는 수만가지. 각자가 느끼는 것도 가지가지. 여행 가면 돌아오고 싶은건 매한가지. 코로나 때문에 여행 못하는 요즘은 그리웁지.
9788954655972,10,여행 다녀 온 후에 읽으며 웃을 수 있단 책입니다. 나의 여행 때 에피소드도 떠오르며 많은 공감할 수 있어요.
9788954655972,10,김영하 작가의 여행기를 통해 지난 나의 여행을 돌아보게 되었다 어떤 의미였는지 내 무엇을 변화시켰는지. 책을 덮고 난 후 이제는 나의 여행기를 돌아보고 싶다.
9788954655972,10,"여행의 이유보다는 여행의 의미가 더 맞는듯. 첨엔 가볍게 볼 생각으로 펼쳤는데 의외로 여행에대한 깊은 고찰이 있어 쉽게 읽혀지지는 않았다. 여행이란 무엇이며 그 의미가 무엇이길래 인류는 여행을 하고싶어하는지, 그 여행을 통해 얻게되는건 무엇인지 잘 알게해준 책."
9788954655972,10,"첫장부터 끝장까지, 자기가 그림자처럼 여겨졌다는 미국에서의 일상이 와닿았던 책."
9788954655972,10,김영하 작가님 소설도 에세이도 다 좋은..
9788954655972,8,"김영하의 소설은 정말 재미있다. 그의 소설은 최고다. 그러나 산문집은 글쎄다, 잘 읽히지 않았고 특히 이번 산문집에는 그 특유의 유머도 별로 없어서 나에겐 기대 이하였다."
9788954655972,10,나의 이야기
9788954655972,8,밑줄긋고  싶은 글이 많은 책.
9788954655972,8,여행을 떠나는 길에 읽었어요. 여행이 한층 풍요로워 좋았습니다.
9788954655972,8,세상을  살아가는  이유중에  하나~나를  위한  시간과 공간여행~ 꼭 필요한 거같다.바쁘다는  핑계로 세상을 넘  건조하게 산거같다.인생  뭐  있어~ 욕심을  내보자~
9788954655972,2,수식어 많은 글은 싫어하지만ᆢ내용이 없어도 너무 없다.
9788954655972,10,담백하다. 물 흐르듯이 자연스러운 문장과 함께 김영하의 머릿속에 ‘동기화‘되는 느낌이다. 작가 김영하의 매력에 흠뻑 빠져들게 된다. 내 여행의 이유도 그처럼 다채롭고 묵직해지는 계기가 될 성싶다.
9788954655972,8,"I am comforted from knowing that I am just a different person after reading this book, and am trying to accept that difference."
9788954655972,8,작가의 여행 경험을 모두 사용한 여행의 이유에 관한 뻔하지 않은 다차원적 접근. .
9788954655972,10,김영하작가의 책은 장르불문하고 일단 재밌다. 글도 가독성이 높아 술술 읽혀 마음만 먹으면 앉은 자리에서 다 읽을 수 있다. 여행이라는 단어 하나로 이렇게 넓은 이야기를 풀어내는 지식이 감탄스럽다.
9788954655972,8,"여행지에 따라 somebody가 되기도 하고, nobody가 되기도 한다는 부분에서 김영하 작가의 통찰력이 대단하다고 느꼈음."
9788954655972,2,"구매후 아직까지 다 못읽은 책.  작가의 추억을 끄집어 낸 내용인데, 읽으면서 이해할려고 하면 벌써 작가는 멀리 가있음. 따라갈수가 없고 집중이 안됨."
9788954655972,4,"책을 받아드는 순간부터 실망스럽다. 책의 완성도, 표지, 어느 것 하나 공들인 흔적이 없다. 이렇게 소홀한 책을 작가의 명성만 믿고 독자 앞에 내놓은 출판사나 작가에게 적잖이 화가 난다.포장의 초라함을 내용의 성대함으로 만회할 수 있을지..."
9788954655972,2,김영하의 글은 읽기에 속도가 나지 않는다. 소설이든 에세이든. 이유가 뭘까?
9788954655972,8,유명한 작가인데 이유가 있구나. 재밌었다.
9788954655972,8,그 흔한 감상적인 여행 에세이가 아니고 자기 고유한 생각이 드러난 글이어서 좋았다. 다만 초반부의 맛깔스러움이 뒤로 갈수록 밋밋해지는 느낌이어서 아쉬웠다.
9788954655972,8,계속 구매를 미루고 있던 찰나에 부산 여행 계획을 빌미로 구입했다. 여행지에서 읽으려 했것만 그 순간을 참지 못하고 읽는와중에 리뷰도
9788954655972,2,올해 TV매체 덕을 가장 많이 본 작가의 책. 베스트셀러가 되려면 글을 잘쓰기보다 열심히 TV출연을 많이해야한다는 걸일깨워줬다.
9788954655972,6,딱 제목만큼의 책이었다. 약간은 식상한 느낌이라 실망 한스푼.. 좋은 기억으로 남을 김영하 작가님의 책을 만날수 있기를..
9788954655972,6,단숨에 다읽어 내려갔다. 왜일까?  재미가없다...  난여행책 자주읽는데 이런건진몰랐다...ㅜㅠ
9788954655972,8,여행의 순간에 존재할 때에 비로소 삶이 새롭게 시작됨을 느낀다. 작가님 삶의 결에서 동질감을 느끼며 위로를 받았다. 여행이 함축하는 다양한 의미를 생각할 수 있는 행복한 시간이었다.
9788954655972,2,작가만 보고 예약구매는 이책으로 끝입니다그리고 명성에 맞는 책가격이네요.....심하다는 생각 안드시나요??
9788954655972,8,이제 기발한 소설보다는여유로운 산문이 더 김영하의 몸에 맞는 듯합니다.
9788954655972,8,쉽게 넘어가는 듯 하면서도...한편으로 머리가 복잡하기도 했던 책
9788954655972,10,가볍게 읽히면서도 공감되는...
9788954655972,10,제목만봐도 설레임. 보고싶었던 책 이제서야 읽게되었네요.
9788954655972,6,문득문득 떠나고 싶다 라는 생각을
9788954655972,8,김영하의 책을 많이 읽진 못했지만 이 책 한 권으로 왜 사람들이 그의 글을 사랑하는지 알 수 있었다. 에세이로서 갖춰야 할 요소들을 두루 갖춘 간결한 책. 가독성 좋은 글의 미덕이란 바로 이 책을 두고 하는 말일지도.
9788954655972,10,얄미운 김영하. 외국에 살며 한동안 한국책은 읽지않고 지냈다. 하지만 이 짧은 책을 읽은 후 아름다운 한국어를 더 읽고 싶은 갈망에 며칠을 쩔쩔 맸다. 지긋지긋한 집구석일지언정 내가 태어난 나라에서 나의 언어만 쓰며 살고 싶다는 해묵은 욕망을 김영하의 다정한 글이 사정없이 자극한 것이다.
9788954655972,8,"‘세련된‘ 작가의  ‘세련된‘  산문, ‘말끔한 ‘ 작가의 ‘말끔한‘ 이야기. 이 책은 이렇게 정리해본다."
9788954655972,6,"[여행의 이유](203p)-김영하  어둠이 빛의 부재라면, 여행은 일상의 부재다."
9788954655972,10,"여행하는 인간, 호모 비아토르"
9788954655972,2,"알랭 드 보통과 무라카미 하루키 사이를 고민하며 자신의 유년기에 지나치게 천착하는, ‘모든 여행 경험’이 필요로 될 만하지 않은, ‘여행의 의미’ 부터 설정을 다시 해야할 것 같은, 과대 광고되었얼 뿐 너무 시대에 뒤쳐지는 여행기. 그래도 베스트셀러라 완독했습니다. 인생 워스트 여행책 1위."
9788954655972,6,작가의 세세함이 잘녹아 있으면서 읽기 편한 글이다. 다만 작가가 권두에서 말하는 ‘여행과 배움’이라는 관점에서 작가는 결국 ‘사회주의’ ‘공산주의’ 그리고 허울뿐인 ‘민주화운동’이라는 것에 대해 자기가 보고 싶은 것만 보고 아무 것도 배우지 못했다. 뭐 그래도 여행은 갈만하다.
9788954655972,8,"˝이야기를 통해 인간은 현실에서 무질서하게 일어나는 여러 일들을 어떻게 받아들여야 하는지를 배운다. ~우리 의지와 무관하게 닥쳐올 때, 우리는 자신의 내면을 지켜내야 하고 그럴 때 이야기가 우리에게 심리적 틀을 제공하는 것이다.˝"
9788954655972,10,"좋은 책은 탐구하고 싶어지고 깊게 파고들어가고 싶어진다. 오랜만에 줄을 치고 포스트잇을 붙이면서 읽고 싶은 책을 만났다. 올해에도 다른 많은 다양한 책을 접했지만, 개인적으로 올해 최고의 책을 꼽으라고 하면 어김없이 <여행의 이유>를 언급하고 싶다."
9788954655972,4,"늘 지겨운 일상에서 떠나고 싶어하면서 ‘노바디‘는 또 되기 싫은 ‘썸바디‘의 한가한 신세 타령. 인용은 지겨웠고 자화자찬은 민망했으며 합리화에 가까운 과도한 의미부여에 적응이 힘들었다. 여행은 결국 자기 뒤통수를 돌아보는 것이라는, 그 뻔한 얘기를 이토록 길게 할 수 있다니."
9788954655972,6,"여행의 목정에 대해 다시 생각해보는 책. 저자의 배경지식에 감탄, 생각과 사고방식이 나랑은 확실히 다르다."
9788954655972,10,여행을 하고싶게 만듬
9788954655972,10,아주 재미있게 읽었어요!  내가 왜 여행을 좋아하는지 정리해주셨어요~^^
9788954655972,8,"여행의 시작은 삐끗했지만, 곧나의 패배로 이어지는 건 아니다. 뜻하지 않았던 좌절을 겪으며 새로운 기회를 얻기도 하니까."
9788954655972,10,"첫번째 글을 읽고 역시 작가는 글로 말하는 사람이구나 싶다. 내가 왜 여행을 좋아하는지, 이 책을 통해 좀더 명료하게 인식할 수 있었다."
9788954655972,10,"읽으면서 너무 공감되는 부분이 많았어요, 상처가 깃든 곳으로부터의 탈출구가 여행이라는 구절에 많이 공감되었고, 공항에만 가도 기분이 좋았던 제 모습을 돌이켜보게 되었습니다. 여행을 하면서 현재를 살았던 제가 그리워지네요, 현재를 살러 가야겠습니다"
9788954655972,10,요즘 여행은 먹고 찍고 자는곳에 치중하지만여기서의 여행은 새로움의 여행이다.그 곳에 전해지는 이야기들에 집중하게 해서좋았다.
9788954655972,10,나에게 인생 책이 된 김영하 작가의 여행의 이유
9788954655972,10,여행에 관한 작가의 에피소드와 박학다식을기분좋게 만나는 순간들즐거웠어요
9788954655972,8,좋아요
9788954655972,8,인간은 왜 여행을 꿈꾸는가. 그것은 독자가 왜 매번 새로운 소설을 찾아 읽는가와 비슷할 것이다.
9788954655972,6,그만의 여행의 이유를 들었다. 그래서 남는 것은 ‘글쎄‘그만의 이야기를 그저 늘어놓고 들은 듯한 기분. 나는 조금 다르게 생각하는데 라는 내 의견이 나오게 해줌은 감사할따름. 하지만 조금더 소통의 폭을 넓혔다면 좋지 않았을까.나도 나 나름의 여행의 이유를 찾아야겠다.
9788954655972,6,방송발 무시 못한다는거 조금 느꼈어요ㅋ 알쓸 좋아해서 믿고 샀는데 글에 집중력이많이 떨어져서 아직 다 읽지를 못했; 비슷한 시기에 구입한 소년이 온다는 당일에 다 읽었는데 말이죠
9788954655972,8,읽고나면 여행 가고싶어지는 책
9788954655972,6,"여행은 여유있는 삶에서 나오는 것이 아니라 채우기위해 필요한 듯하다. 바쁜 생활이 금전적이나 다른 영역의 모든 것에서 채우는 것이 아니라 쏟아내는 것이라 한다면 조금 벗어난 공간을 여행한다는 것만으로 떠나는 마음, 준비하는 마음이 휴식과 충전과 다시 채움으로 돌아오는 과정이 아닐까..."
9788954655972,10,에세이가 더 좋다고 생각되는 건 나만의 느낌일 뿐일까? 작가도 좋아하지 않을 수 있을 듯... 많이 공감 되고 많이 배우게 되는 글들이다.
9788954655972,10,여행 가서 읽으려고 샀습니다. 처음 몇 장을 깔깔거리며 읽고 이 책과 김영하 작가에게 완전히 반해버렸어요. ㅎㅎ 이런 저런 이유로 독서와 멀어졌는데 다시 책을 손에 잡게 해주네요!
9788954655972,8,이렇게 좋아하는 뭔가가 나에게도 있을까?
9788954655972,10,"책 좋습니다.작가의 사유의 깊이도 느껴집니다. 맞아 나도 이런 생각했는데! 생각은 했지만 표현하지 못했던 감정을 손에 쥐게 해주는게 작가의 역량이라고 생각합니다. 요새는 해외여행 과잉기인가 싶습니다. 해외에 에너지를 쏟기보다, 어디를 가든 여행의 이유에 에너지를 집중할 수 있게해줄책"
9788954655972,10,김영하 작가의 글을 읽으면 즐겁다. 여행의 이유를 읽는 동안 함께 자주 여행을 했었던 오랜 친구들과 여행을 다녀오기도 했다.8월 가족 독서토론 선정도서.
9788954655972,8,깊은 에세이다. 여행  추천지 따위는 없다. 정말 제목 그대로 ‘왜 여행을 하는가?‘ 에 대한 고찰과 사색이다. 저자의 개인경험도 많이 드러낸 것으로 보아 저자도 이책에 애착이 있어보인다. 경험을 통해 (철학적) 사유에까지 이른 과정이 정말 잘 쓰여져있다. 모두에게 추천!
9788954655972,8,여행가기 좋은책
9788954655972,10,굿
9788954655972,8,"여행을 하는 이유는 무엇일까? 자신을 돌아보기, 힐링, 다른 문화에의 동경? 그 이유는 다양하겠지만 내가 이 책에서 찾은 이유는 나를 힘들게 하는 그 모든것으로부터 멀어지는것이다. 뭔가 나를 지치고 힘들게하는 일들이 생길때 새로운 환경과 경험들이 오롯이 나 자신을 느낄수 있게 해준다."
9788954655972,10,결코 술술 읽을 수 없는... 독서대 펴 놓고 천천히 정독 할 수밖에 없다.
9788954655972,2,내용이 중구난방인거같아요... 작가님이 뭘 말할려는지도 잘 모르겠구요
9788954655972,10,근래 읽은 최고의 한국어 텍스트였다.
9788954655972,10,나에게 여행의 이유는 비즈니스였는데 이제는 나를 찾는 여행의 이유를 만들고 싶다.
9788954655972,8,여행을 통해 실질적으로 얻어지는 것은 너무나 많다.나 자신을 객관화 시켜서 넓게 바라볼 수 있는 능력도 모두 여행을 통해서라고 할수있다. 여행이란 궂이 직접 뛰는 여행만이 진정한 여행일까? 누군가 그랬듯이 ˝독서는 앉아서 하는 여행이다.그리고 여행은 서서하는 독서이다.
9788954655972,2,정말 재미없어요  사지마세요
9788954655972,10,좋아하는 류의 에세이. 여행 에세이지만 여행 에세이 같지 않은.
9788954655972,10,읽고 싶다!
9788954655972,10,"여행의 이유를, 여행의 의의를 알게 됐습니다. 첫 에피소드 강렬했구요, 아래 다른 분 말씀처럼, 작가의 말, 슬펐습니다."
9788954655972,10,완벽하지 않은것이 완벽한 것이다꼭 무언가를 얻으려 하지 말고 하다보면 얻어지는 것이 있다
9788954655972,10,"책이 작고, 그리 두껍지 않고, 가벼워 보였지만, 정말 즐거운 독서였다. 좋은 책이다. 써주신 작가님께 감사드린다."
9788954655972,6,서른여섯번째 책. 코타키나발루 가는 길에 읽으려고 산 책. 산문? 이어서 쉽게 읽혔다. 김영하가 느끼는 여행에 대해서 쓴 책? 인데 공감운 막 음.... 그냥 그렇구나 하고 넘어간듯 ㅎㅎㅎ
9788954655972,10,김영하작가에게 썩 호감이 있진않는데 글이나 말투는 너무맘에든다 여행기같지않은 여행기
9788954655972,2,"음, 잘모르겠다. 재미도 없고 감동도 없고 남는 것도 없던 책."
9788954655972,2,"다 주관적이긴한데, 별갯수 많은건 서포터즈나 협찬인건가요.. 아님 읽기는 한건가요.맥락도없고, 무슨말을 하는지 도통 알수도 없고, 어떤 단락은 문맥도 맞지않아서 이건 대필작가가 있나 싶을 정도입니다."
9788954655972,6,여행가고 싶어지네
9788954655972,2,베스트셀러 작가가 되려면 먼저 TV에 나와 얼굴을 알려야한다.
9788954655972,10,손에 들고 가볍게 읽을 수 있는 책 재질이 맘이 들었어요. 공감한 부분도 있고 내가 미처 깨닫지 못했던 부분들도 생각하게 해주는 무겁지 않은 글. 좋았습니다.
9788954655972,10,친구가 표지보고 ˝요즘엔 저런 표지가 유행인가봐.˝라고 하길래 김영하 작가가 직접 그린 거라 알려줬더니 ˝저런...˝이라고 했어요.
9788954655972,10,소설가 김영하의 산문은 어떨까하는 생각으로 예약구매했던 책입니다. 여행은 흔하게 인생의 메타포로 사용되지만 김영하 작가님 만의 경험이 녹아들어 풀어낸 문장들은 역시 일품입니다.
9788954655972,8,며칠전 서점에서 샀는데 바캉스에디션이 나오다니..글이 짧아요 그점도 아쉬움.김영하 작가님 새소설 기다리고 있습니다
9788954655972,4,"기대를 해서일까? 내가 원한 ‘여행‘이란 테마의 글이 아니었다. 쉽게 읽히고 편하게 볼 수 있는, ‘여행‘ 그 자체에 집중해서 ‘여행‘과 관련한 작가의 에피소드나 그가 바라보는 방식의 여행지를 알고 싶었다. 아니었다. 생각보다 무거웠고, 글쓰기 관련 수업을 받는 느낌도 들었다. 아쉽다."
9788954655972,10,"김영하님의 소설은 독특한데 반해 에세이가 특히 마음에 듭니다. 말과 글 모두 대단하신 작가님. 요즘 베셀 작가들과는 비교할 수 없는, 사유가 있는 김영하님의 글을 좋아합니다."
9788954655972,8,여행은 일상의 부재라는 걸 다시 깨닫게 해 주는 책.
9788954655972,8,여행세포를 깨워주는 책작가의 글을 읽으면서나도 나만의 여행을 해야겠다는 생각이 들었습니다.
9788954655972,8,좀 짧은 듯 하지만 재미있다. 거기에 생각할 거리도 던져준다. 이 정도면 돈 값은 충분히 하는 것 같다.
9788954655972,10,환대 그리고 신뢰..여행 뿐만 아니라 인생에서도 중요하지요
9788954655972,6,알쓸신잡에서 묵직하게 울리던 그의 말에 비하면 이번 여행 에세이는 개인적으로 별로였습니다.근간에 읽은 김민철 작가의 <모든 요일의 여행>이 더 깊은 향기를 남기더군요.(개인적 취향입니다만)처음에 나온 책 표지는 시즌에 맞게 바캉스 에디션으로 바뀐 것 같은데..글쎄요...물론 김영하 작가를 좋아하는 편이지만 그의 글은 이번에 처음 읽었기에 그만큼 기대가 큰 탓도 있습니다.
9791190073073,8,이 책 한권 들고 떠나고 싶다. 코로나야 어서 가렴
9791190073073,10,여행계획을 짜는 순간부터 설렘은 시작되는 것 같아요! 에이든 여행지도는 아날로그적 감성으로 여행자들을 설레게하는 매력적인 지도예요. 하나 둘 모으다가 최근 에이든 국내여행 가이드북이 나온 것을 알고 얼른 get!
9791190073073,10,"전국의 추천여행지, 꽃 여행지, 액티비티 여행지, 박물관/미술관, 먹을만한 것, 살만한 것, 핫플레이스 꿀 정보들로 가득해서 정말 정말 좋아요!! 앞으로의 주말과 휴가가 든든하네요!! 완전 강추합니다^ㅁ^"
9791190073073,10,"여행 계획을 세울 때 소요되는 시간을 줄여줄 수 있는 마법의 책을 만났습니다.또한 여행 욕구를 자극하고,국내여행의 가이드를 제공해 주는 책, 추천합니다."
9791190073073,10,에이든 국내여행가이드북으로 국내여행계획을 알차게 세워볼수 있도록 다양한 정보와 사진이 수록되어 유익하게 볼수있고 역사적 지식까지 넓혀줄수 있어 좋네요.에이든 국내여행가이드북만 있으면 알찬 여행계획 하는데 든든하겠어요~
9791190073073,10,친절한 가이드북으로 여행 준비는 다 되었다. 이제 떠날 일만 남았다.
9791190073073,10,국내여행을 떠나기 위한 가이드북이 필요하시다면 에이든 국내여행 가이드북이 도움이 될거 같아요!
9791190073073,10,책한권 들고 책만 보았을 뿐인데 옛 감성으로 여행다운 여행을 할 수 있어요.
9791190073073,10,에이든 여행지도 알람떠서 구매했는데!! 역시 에이든은 다르군요!! 지도만 잘만드는 줄 알았는데!! 전국 가이드북 역시 실용적이고 짱 좋습니다!!
9791190073073,10,이번달 내내 방구석에만 있어서 답답했는데 책만 읽어도 전국 여행 다녀오는것 같고 너무 신나네요~ 역사지도도 정말 유익하구요. 늦가을쯤 코로나 잠잠해지면 월차내고 휴가 다녀와야겠어요!
