ISBN13,rating,review
9788926010839,10,중3은 우선 다들 학업에 임하는 자세나 마음가짐부터 다들 조금씩 달라집니다. 곧 고등에 올라가야한다는 부담감에 사뭇 진지해집니다.. 고등 올라가서 후회없도록 열공합시다^^
9788926010839,10,"초등까지는 계속 기탄수학으로 기본 계산력 향상을 위해 사용했는데 중1까지 나온것은 봤는데 중2, 3이 나왔군요...당연히 이어서 학원 기본 교재로 사용을 합니다. ^^ 적극추천이고요 기탄수학만 한게 없더라고요~"
9788926010839,10,"중학교 누나가 먼저 실천해봐서 검증된 연산 실력, 동생도 기탄으로 중학교까지 가렵니다."
9788926010839,10,"기탄에서 중3과정 연산까지 나왔네요.
항상 문제집하기 전에 연산을 먼저 하면 수월하게 진도를 나갈수 있어. 꼭 합니다. 굳이 몇만원들여 학습지 않해도 좋은 효과를 볼 수 있네요. 강추합니다."
9788985456968,8,좋아요
9788985456968,6,구성은 좋은데 폰트나 색깔 때문인지 애가 보기싫어하네요. 조잡해 보여서 눈에 잘 안들어온대요.
9788985456968,8,영어학원에서 추천하는 단어장이라고 하여 구매해봅니다.
9788985456968,10,근데 누가반품한책을 보내주셨네요 책은 더럽지않지만 안에 들어있는 우선순위영문법광고지에 누군가 글을 써놓았네요 귀찮고 더럽지않아 그냥볼께요
9788985456968,10,영어초짜인데 괜찮네요. 시리즈 다 살껄 그랬네요ㅎㅎ배송도 빠르고ㅋ
9788985456968,10,단어가 부족한 친구들 고등학생용으로 샀구요 중학생은 이 단어장에다가 교과서 단어추가해서 외우니 딱 좋네요 크기도 적당하구요
9788985456968,10,와 배송 정말 빠르네요 저녁에 주문했는데 다음날 오전에 받았어요
9788985456968,8,고등학교꺼랑 함께 구매했어요.쭈욱 볼려구요 ㅎ예전이랑 똑같은것같네요 ㅎ
9788985456968,8,"좋아요!!!!!!!!!!!!!!!!!!!!!!!!! 생각보다 괜찮고 우선순이로 되어 있어 편하네요 , 근데 생각보단 그렇게 좋진 않은것 같아요. 걍 영단어들만 있어서 정확히 외우기엔 부족할것 같아요. 근데 작아서 들고다니며 공부하기엔 편해요 . 들고 다니면서 편하게 외우고픈 분들에겐 추천해드려요.......ㅎㅎ"
9788985456968,10,가리는 책갈피도 있어서 외웠나 확인하기 좋아요
9788985456968,10,우선순위 시리즈는 말 안해도 오랫동안 사랑받아온 책이라서요. 책크기도 작아서 휴대도 간편하고 빨간 필름도 들어있어서 외운 단어 체크하기도 쉽죠.
9788985456968,6,이제 고등학교 들어가는데 중하교 단어 실력이 부족해서 정리하려고 삿는데 간단하고 좋은 것 같아요. 꾸준히 해서 실력이 늘었으면 좋겠네요
9788985456968,10,중학교 단어 총정리하려고 구매했습니다.
9788985456968,8,가능하면 매일 매일 조금씩이라도 외우게 하고 있습니다.  단어공부하기에 적당합니다
9788985456968,10,영어기본은 단어지요 혼자서 편하게 공부할 수 있는 책입니다
9788985456968,10,학원교재용으로 샀는데 짜임새있고 좋네요
9788985456968,8,좋다.
9788985456968,8,"군에 가 있는 아들한테 보내줬어요..
이 교재가 좋다고 동기가 얘기하더라고..
열공해설 실력 많이 쌓기를 기대합니다..
아드님, 화이팅~~~!!"
9788985456968,10,이 단어장이 가장 보기 편한 것 같아요.
9788985456968,10,★영어공부에 첫단계 발음과 함께 단어의 공부에 꽃인 검증된 우선순위 시리즈를 강추합니다~!
9788985456968,10,중학영단어를 정리하려고 구입했습니다. 구성이 괜찮네요.
9788985456968,8,정말 좋아욯ㅎㅎ
9788985456968,10,역시 중학교 영어단어는 우선순위가 최고입니다!
9788985456968,10,조카가 영어단어 외우기용으로 구매한 단어집이예요. 그런데 영어보다 한글 이해도가 떨어지는것 같습니다.^^;;솔직히 제가 읽어도 한글이 어렵다는 생각이 드는것이 있긴해요. 그래도 기초 영단어장으로 괜찮습니다
9788985456968,8,"중학교 2학년 수준에서 이 단어집이면 거의 못 읽을 교과서 없을 듯. 한 가지 아쉬운 것은 동사들은 자동사, 타동사 구분을 좀 더 명확히 해줬으면 더 좋지 않았을까 하는 생각이 들었습니다."
9788985456968,10,완전책도가볍고귀엽네여 갑자기단어외우고싶어짐
9788985456968,10,하루에 조금씩  공부하기 좋게되있네요. 만족합니다.
9788985456968,10,영어학원에서 사용하는 교재인데 이 학원 잘보낸것 같아요. 책이 참 충실하네요!!!
9788985456968,10,넘넘 좋아요~~~~~~~~~~~~~~~~~~~~
9788985456968,10,꼭 외워야하는 단어 책!!!
9788985456968,6,딱 중학생용!
9788985456968,10,영어공부에는 이만한 책은 없을 것 같아요.
9788985456968,10,책하자없이왔구요 배송도빨라서맘에들었어요~
9788985456968,8,잘받았습니다. 빨간색그거 참좋았어요. 검정색도끼워져있었으면 더좋았을듯....
9788985456968,10,"중학교 2학년,,할것은 많고 어떤게 유익할지 고민이였으나, 한번에 해결이 됨"
9788985456968,10,단어를 얼른 정리하는데 아주 유용한 책입니다 MP3를 활용하면 더 좋습니다^^
9788985456968,10,단어 외우기엔 이게 좋죠.
9788985456968,10,중요한 단어와 적절한 예문으로 공부하기 좋은 책입니다~
9788985456968,10,영어공부하려고 샀는데 배송도 좋고 좋은 단어들만 있어서 추천해주고 싶네요..!!
9788985456968,10,구정이라 늦을거라 예상했는데 다음날 바로 정확하고 빠른배송 너무 감사합니다..
9788985456968,10,중학생들이 꼭 암기해야하는 영단어들을  모아놓은 필수적인 단어암기책
9788985456968,2,영단어는좋은데배송처리가매우오래걸리네요
9788985456968,10,단어외울려고샀어요
9791125948230,2,세계사밖에 없어요ㅠㅠ제가 필요한건 중2 1년동안 사용할 교재인데ㅠㅠ
9791162401651,10,꼭 알아야 하는 핵심적인 것들을 연습하기 좋은 책.풀이 설명도 구체적이라 좋네요.
9788928326624,8,적립금 사용을 하게 해 주어서 고맙습니다.
9788959904594,10,숨마쿰라우데 중학수학 개념 기본서 덕문에 중학수학에 대한 두려움이 사라졌어요. 친절한 교재입니다. 만족스러워요.
9788968061059,10,영어 문법을 분석적으로 접근하여 빈틈을 매꿔준다
9791160020250,10,"2년전 사서 다하지 못했는데,  다시한번 시작해보려 합니다.  정말 나에겐 힘들지만 그런데로 재미도 있어요."
9788926010785,10,중학교 1학년 딸아이가 선행으로 공부하는 교재입니다.   미국에서 학교를 다니고 있는데 수학 선생님을   기탄수학 풀이과정으로 가르칠 정도입니다. 선생님도 감탄을 하네요... 수학을 지루해 했는데 요즘 기탄수학의 매력에 푹 빠져 있습니다.  제 아이에게 가장 소중한 책인듯 합니다. Keep Going.
9788926010785,10,연산의 기초는 기탄만한 것이 없네요~~
9788926010785,10,"중학교 처음 들어가서 학교 적응하랴.. 친구 사귀랴.. 학업에 소홀했더라도 다시 맘잡고 
복습과정, 예습과정 기초부터 잡아 나가면 큰 도움이 될 것입니다^^"
9788926010785,10,중2과정이 나와 너무 좋아요^^*고등학교 과정도 나오길!!!
9788926010785,10,"초등까지는 계속 기탄수학으로 기본 계산력 향상을 위해 사용했는데 중1까지 나온것은 봤는데 중2, 3이 나왔군요...당연히 이어서 학원 기본 교재로 사용을 합니다. ^^ 적극추천이고요 기탄수학만 한게 없더라고요~"
9788926010785,10,"기탄에서 중2과정 연산까지 나왔네요.
항상 문제집하기 전에 연산을 먼저 하면 수월하게 진도를 나갈수 있어. 꼭 합니다. 굳이 몇만원들여 학습지 않해도 좋은 효과를 볼 수 있네요. 강추합니다."
9788926010785,10,드디어 기탄 L단계까지 도전^^
9788926010785,6,후기가 없네요. 나온지 얼마안되서 그런가요?  k와 L도 기탄으로 해도 될까요?
9788992476041,4,기초없는 학생이 혼자 공부하기에는 별로네요.강의를 무료로 볼수 있을지 알았는데 강의가 12만원이란걸 알고 헉했어요.단순 문장구조 암기하는 문제집인듯해요.
9788992476041,10,지인 소개로 구매합니다. 아직 풀어보진 않았지만 좋을거 같아요.
9788992476041,10,방학때 문법 다지기로 활용할 계획입니다. 문장 외우기와 문법을 함께 좋습니다.
9788992476041,10,공부할려고 샀는데 배송도 빨리오고 책상태도 깨끗해서 맘에 듭니다~~
9788992476041,8,천문장임
9788992476041,10,영작도 연습할 수 있고 mp3 파일도 무료로 제공돼서 공부하기 좋은 책이다. 중등부터 기초를 다지고자하는 고입 전 학생까지 골고루 쓸 수 있는 책.
9788992476041,8,열심히 공부해 보자
9788992476041,10,기초를 다지기에 좋은 책입니다
9788992476041,10,1001개의 문장만 알아도  문법이 저절로 되는 책 같네요 쉬우면서 이해가 잘되네요......
9788992476041,8,영어에 기본으로는 아주 좋아요.. 적금추천합니다.
9788992476041,10,넘 좋아요. 아이들이 문법 이해하는데 쉽게 다가갈수 있도록 도움이되는 책
9788992476041,10,"문장 하나하나 공부하는게 어렵지 않고, 꾸준히 한다면 참 좋은 교재같아요^^"
9788992476041,10,"간단한 문장이지만 꼭 필요한 내용만 담았어요.
기초를 다지기에 좋습니다~~"
9788992476041,10,학생 과외용으로 구입했습니다. 예문으로 하는 영어공부! 아주 마음에 드는 책입니다.
9788992476041,6,대표 문장을 외우면 쉽게 문법을 익힐 수 있어서 좋아요.
9788992476041,10,항상 영어가 어렵게 느껴지는데 기초를 잡아서 한단계 업그레이드 하고 싶네요
9788992476041,10,영어 기초를 잡기에 좋은 책인것 같습니다. 천일문 사길 잘했네요^^*
9788992476041,10,중학생 과외 수업용으로 샀어요. 정리가 명확하게 되있고 개인적으로 강추에요
9788992476041,10,천일문 소문이 자자하던데.. 열공해보려구요!
9788992476041,10,하기 쉽고 기초하기에는 좋은책인거 같아요.
9788992476041,10,이거 저도 삽니다. 너무너무 좋다는 소문이 계속 돌아요
9788992476041,10,좋은거 잘 모르겠던데. 일반 시중 문제집이랑 비슷한듯.
9788992476041,8,열공하기좋은 서적예요
9788992476041,8,정말 좋다~
9788992476041,10,좋단 얘기만 들었지 막상 공부해보니 영어정복한 느낌?!
9788992476041,10,쉽게쓰여져서 혼자 공부하기에좋네요 문법처음접하는 초중에게 좋을듯.....
9788992476041,10,"역시 김기훈샘 강의 교재 !
쉽게 잘 되어 있네요 ."
9788992476041,10,책 내용이 좋음
9791125941255,10,아이가 과학에서 물리영역을 어려워해 고민중이었는데  주변에서 esc를 추천해주더라구요. 문제집을 받아보고 저도 주변에 추천중입니다
9791125941255,10,학년구분없이 중학 과학을 4개영역별로 각각 한권으로 핵심개념과 다양한문제를 쉽고 빠르게 공부할 수 있도록 구성되어 중학교 1~3학년과 고등학생까지도 단기간 과학을 빠르게 공부하고 싶은 학생들에게 강추^^
9791125324768,10,서술형 대비에 최적화된 교재
9791162400555,10,영문법을 알기 쉽게 총정리한 책입니다. 설명이 지루하지 않고 포인트 있게 나왔어요. 바로 풀어볼 수 있는 문제들도 적절하고요.
9791162400531,10,다른 좋고 유명한 것들 많지만 이 책의 장점은 내용이 자연스럽고 지면 구성이 눈에 편하다. 너무 빽빽한 책은 특히 중학생에게 보기 힘들 수 있다. 가능하면 3학년까지 같이 구비해 두길 추천한다. 전체적인 내용을 보는게 중요하다. 사실 문법은 중학과정에서 거의 끝난다.
9788974574581,10,초등 기본 문법책을 어느정도 마스터했다면 구문으로넘어가야할텐데 아주 안성마춤인 교재입니다
9788965420286,10,동영상이랑 같이 보려고 샀어요~
9788965420286,10,문법이 생소하고 어려운 초등학생 아들에게 엄마표 영어 공부리켜주기 위해서 주문했어요순차적으로 차곡차곡 준비하기 좋은 구성입니다. 그림으로 아이의 이해도 돕고 쉬운 구성으로 쉽게 받아들이고 있습니다.
9788965420286,10,영어 공부하시는 초보자 분들이 보시기에 괜찮다고 생각합니다. 보기도 쉽고 이해하기도 쉽게 되어있습니다.
9788965420286,8,영어초보자가 보기에도 쉽게 정리가 되어있는거같아요.
9788965420286,8,토플 준비하면서 기초적인 문법책이 필요해서 샀어요부담없이 풀기에도 좋고 기본적인 책 그대로 입니다.다만 자세한 예문이나 설명을 원한다면 이 책말고 다른 책 사는게 나을 것 같네요오랜만에 공부하거나 기초를 정리하기 위한 분들에겐 적합할 것 같아요
9788965420286,2,이책 정말 눈 아픕니다. 저처럼 노안이 온 사람은 절대 사지마세요. 해석부분이 너무 잔글씨라서 돋보기 쓰고도 잘 안보여서 책을 집어던지고 싶습니다. 책 글씨 좀 크게 인쇄할 수 없나요? 노안기 중년에게는 강력히 비추합니다.
9788965420286,8,쉬워서 좋은 책
9788965420286,10,"명성 만큼 훌륭합니다, 한국에 있다  미국으로 다시 돌아가는 분들도 격하게 추천하는 분이 있었습니다."
9788965420286,4,이거 구성같은건 좋은데 설명 없어서별로고 동영상강의없이 그냥 책만볼라면 사지마세요. 설명없어서 뭐가뭔지몰라요. 어플에 무료강의는 5분짜린데 유료강의에서 앞부분5분만짤라논거라서 결국엔 유료강의봐야하는데 유료강의는9만원돈하네요.ㅋㅋ
9788965420286,10,기초도 가물가물한 나에게는 이보다 친절하고 깔끔하게 정리되있는 책이 있을 수 없다 어려운 문법용어에 치중되지 않고 예문이면 예문 설명이면설명 틈틈히 점검할 수 있는 연습과 테스트까지 기초를 한달 안에 정복할 수 있는 용기가 생긴다 단 한페이지 안에 글씨가 너무 작고 빼곡한 게 흠이라면
9788965420286,8,대학다니기전에 문법이 부족해서 기초를다질려고 샀다.책의 구성도 나름알차고 삽화들이 있어서 책보는 맛이 더 좋은것같다.1000원 추가로 스프링 분철을 달았는데 너무 좋았다.이책은 오래볼수록 앞부분이 덜렁덜렁 찢어질꺼 같아서 불안했는데 안심하고 쓸수 있을꺼 같다.스프링 분철 아이디어 good!
9788965420286,10,문법은 늘 어려웠는데 설명이참 쉽고 그림도 많아서 이해가 잘되네요ㅎㅎ 이 책으로 꼭 왕초보 탈출하겠습니다!! 파이팅^^
9788965420286,10,삽화랑 연습문제가 잘 나와 있어서 이해가 쉬워요. 저같이 게으른 사람한테는 학습플랜도 도움되네요~ 초보자에게 여러모로 유용한 책~!!
9788965420286,10,우리엄마가 항상 끼고다니시는 교재 ㅎㅎ 어머니가 좋아하셔서 저도 기분이 좋네요 ㅎㅎ 제가 사드렸거든요~ 좋은 책 추천!
9788965420286,10,초보자들에게 좋은 교재입니다. 어머니가 영어공부하고 싶으시다고 해서 그래머게이트웨이를 사다드렸습니다. 어려운 용어가 없는게 무엇보다 좋아요쉬운 구성과 그림들이 학습하는데 부담이 되지 않게 공부할 수 있게 끔 해주는 것 같습니다
9788965420286,10,"어려운 문법 용어들이 없어서 초보들도 이해하기가 쉽네요.중간중간 삽화도 있고,실생활에서 쓸 수 있는 예문들이 많아서 기초문법공부하기 좋은 책이예요!"
9788965420286,4,저한테는 설명이 너무 없어서 어렵네요 해석되있는것도 없고
9788965420286,10,현재 약 3주정도 공부하고 있는데 정말 최고인것 같습니다.초보자가 보고 공부하기에는 딱!입니다.해커스 동영상 강의도 너무 좋아서 현재 지식이 무럭무럭 자라나고 있어요^^
9788965420286,10,열심히 보고 있어요! 합격!^^
9788965420286,6,쉬워도 너무 쉽다... 완전 초보나.... 영어를 수십년간 외면했던 사람들을 위한 책... ㅠㅠ
9788965420286,10,"거의 15년 만에 영어 공부를 다시 시작해 보려고 구입한 책인데, 잘 선택했다는 생각이 듭니다. 구성이 알차고, 재미있게 공부할 수 있도록 짜여 있어서 시간가는 줄 모르고 공부하게 되네요^^."
9788965420286,10,영어 기초 문법에 아주 좋을 것 같아요 ㅎ
9788960274518,8,영문법을 지도하고난후에 독해실력향상을 위해 구입했습니다.딸이 무척 책읽기를 좋아해서.문장듣기도 병행하고있습니다.
9788960274518,10,단원이 시작하기전 간단한 문법정리가 되어 있어 독해와 함께 문법도 공부할 수 있습니다. 지문도 길지가 않아 아이들이 지루해하지 않을 것 같아요
9788960274518,6,양이 적기는 하지만 쉬워서 부담이 없어요
9788960274518,10,상당히 괜찮은 책입니다. 문법별로 정리되어있는데다가 지문 자체도 좋습니다. 정리도 깔끔하게 잘 되어있고.. 제 시절엔 이런 책이 없었더랬죠.
9788960274518,10,문법 독해 를 동시에 할 수 있는 교재 선택해서 수업 하고 있습니다. 문법 정리도 되어 있고 그 부분에 맞게 독해가 구성되어서 학습 한 문법이 바로 적용되서 나타나 좋은 것 같습니다.
9788960274518,10,한번 배운 문법을 독해로 다시 다잡을수 있게 구성되어있습니다. 독해지문도 많고 완전 강추입니다!!!
9788960274518,10,"문법을 배우는 이유는 영어를 쓸 때 그만큼 빠르고 쉽게 사용할 수 있게 하기 위해서인데, 늘상 문법,리딩 따로 공부하게 되는데, 어떻게 사용되는지 알 수 있어서 문법이 어떻게 사용되는지 잘 알 수 있습니다^^"
9791164992133,10,이 책만큼 시험 준비하기 편한 책이 없는 것 같아요 걍 제일 빡세게 준비할 수 있음
9788928328826,10,국어의 어원과 훈민정음의 창제원리를 이해하고 문법을 이해하며 공부할 수 있게 도와줘서 좋아요.
9788928328826,10,문법이론에 대한 자기주도학습에 용이하다.
9788928328826,10,어려운 문법을 아이들이 보다 재미있게 배우네요
9788928328826,10,국어 문제집 풀기도 바쁜 아이들에게 국어 문법 문제집까지 풀라고 하기에는 너무 버겁지 않을까 했는데 하루 분량이 많지 않아서 쉬어가는 타임에 풀기 좋고 문법 하면 어려울것 같고 좀 지겨운 느낌이지만 구성과 해답의 친절한 설명으로 쉽게 다가갈 수 있을것 같아요.
9788960764583,10,심화용 문제집 처음 사보는데 중3마지막 학기 블랙라벨로 마무리 시키려고 구입해봅니다. 워낙 유명한 문제집이라서 기대중입니다.
9788926157893,10,개념서로 공부한뒤 연산문제집으로 여러가지 유형들을 꼼꼼하게 공부할수 있어서 정말 좋아요.
9788926157893,10,아이가 집에서 예습용 연산교재로 쓰고 있어요 개념을 눈으로 보고 머리로 이해가되게 해놓아서 어렵지 않게 한답니다 쉽게 접근하기 최고예요~~
9788926157893,10,연산문제집이지만 개념이 충분히~ 자세히~ 녹아있네요~ 선행으로 개념과 연산을 준비하기에 딱 좋은 교재에요~
9791129704863,10,정말 2학년이 되면서 챙겨야 될께 많아졌어요~ㅠㅠ자유학년제>시험 시험을 보면서 제일 조마조마한건 바로 “문법”문장간 법칙을 알아야하는데 알지못하니 풀수있나요 ㅜㅜ 하지만! 중학교 들어가기전 메가 스터
9791129704863,10,예비 중2인데 1단계 하고 2단계 구입했네요~평소 소설은 많이 읽는 편이지만 비문학은 잘 접하기 힘드기에 이렇게 비문학 독해를 꾸준히 하는게 많이 도움이 됩니다. 책 내용도 주제가 다양해 재미도 있으면서 유익하네요
9788959904853,10,"중학수학 개념을 제대로 배울수 있는 교재예요. Q&A스토리텔링 수학학습으로 재미나게 개념을 익히고 다양한 자료들, 문제들을 통해 수학 실력을 향상하는데 도움이 되는 교재라 매우 만족스럽습니다."
9788959904853,10,"중1 때부터 개념서로 책읽듯이 계속적 반복으로 개념익히기에 좋은 교재입니다. 개념서이긴 하나 기본 수준이 아니라 수학적 감이 조금이나마 있는 아이들이,초등 고학년에서 심화서 접한 친구들이거나 독서틀이 잡힌 아이라면 괜찮은 참고서지요. 문제는 기초수준은 아니니 교재구성을 본 후 구입권합"
9788968061332,8,기대되는 교재입니다 김기훈 선생님 교재는 거의 구입해서 봅니다 이번 교재도 바로 구입해서볼 예정입니다
9788928329823,10,초등학생이 중등선행할 때 꼭 추천해주고 싶은 책!베이직쎈은 중학교 기본 연산   개념   그리고 쎈에서 심도있고 다루고자 하는 기본 유형을 모두 만나볼 수 있어요. 이것 저것 여러 문제집 사 보신 분들은 아마 베이직쎈 구성보고 놀라실 것 같은데요.저도 시행착오 끝에 베이직 쎈 정착합니다!
9788928329823,10,"개념에 대한 설명이 아주 쉽게 되어 있고, 반복해서 문제를 풀면서 개념을 잡을 수 있습니다.문제가 단계별로 구성되어 있어 개념을 잡고 문제를 응용하기까지 체계적으로 습득이 가능합니다."
9788900443998,10,"중등 9종 교과서 지문을 바탕으로 단답형, 서술형, 논술형의 다양한 문제가 있어요서술형 답안 작성 능력 기르기에 자신감이 생길듯 합니다.점점 더 강화되는 내신 서술형 평가 대비에 도움되도록 빠작 서술형쓰기로 선택했어요~~"
9788900443998,8,2% 부족한 학생에게 딱 맞는 교재인 것 같아요. 서술형을 잘 못 쓰는 친구들의 특징이  공부를 하기는 하는데 내용을 정확하게 이해하고 넘어가지 않아서 입니다. 교재를 통해 지문 내용을 꼼꼼히 분석하고 문제의 의도를 알아내는 연습을 할 수 있습니다
9788936459673,10,중2 되는 딸아이를 위해서 주문했어요.2019년도 개정교과로 개편되서 새로 주문했는데 잘 읽었으면 좋겠어요.^^배송은 주문 다음날 왔습니다.
9788926155356,10,집에서 혼자 공부하는데 개념 설명이 잘 돼 있어서 아이가 좋아해요. 개념탑이랑 개념익힘탑으로 나뉘어 있어서 더 확실히 개념 잡을 수 있구요. 한번에 두권 완북하는 기분이 드는지 그것도 좋아하네요. 문제량이 딱 적당한듯요~
9788926155356,10,투탑수학은 개념북과 개념익힘북으로 나누어져 있어서 공부하기도 편리하네요. 중학수학의 개념을 개념북에서 한 번 공부하고 개념익힘북에서 한 번 더 잡아주니 개념을 탄탄히 해주는 교재입니다.간단하게 유형문제
9788926155356,10,"개념설명이 잘 되어 있어서 연산끝내고 개념서로 학습하기에 너무 좋은 교재에요. 문제유형도 다양하고, 문제를 풀다보면 개념을 다시 한번 익힐 수가 있더라고요."
9788926155356,10,이번 겨울방학때부터  풀고 있는데 개념별로 정리가 잘 되어 있어서 홈스쿨링 하는데 좋습니다.
9788926155356,10,중학수학 개념서로 딱이예요 ~ 개념설명이 잘되어 있어 개념 이해도 잘되고익힘탑이 따로 분리되어 있어 문제도 충분히 풀어볼 수 있어 좋더라구요
9788926155356,10,중등 개념서로 딱인것 같아요.자세하면서도 간단하게 한눈에 들어오는 교재네요중간중간 개념특강에서 한번씩 더 짚어주어 좋네요풀이집도 자세하게 나와있어서 혼자 또는 엄마랑 공부하기 좋은것 같아요
9788926155356,10,디딤돌 투탑 2-1 을 가지고 처음으로 학습해보았는데요..개념설명도 쉽게 되어 있어서 이해하기도 쉽고 다양한 문제로 부담없는 문제분량으로 접할 수 있어서 편하게 접할 수 있는 교재로 차근차근 공부하며 수학 개념도 잡고.. 실력도 쌓을 수 있을 것 같아요
9791162335444,10,문제가 많이 수록되어 있어서 실전력 강화에 도움이 될 것 같아요!!! 시험 직전에 풀면 딱인 교재네요 :)
9788959904525,10,개념 설명이 잘되어있고 문제들을 많이 풀어보며 체크할수 있어서 좋았어요. 만족스러운 교재예요.
9788959904525,10,중학국어 문법을 체계적으로 학습해보며 다양한 문제 풀이를 통해 실력을 키워볼 수 있어 좋았습니다.
9788927708100,10,정말 알차고 너무 좋은책!!
9788928320516,8,깔끔한 구성과 명확한 설명 적당한 양의 문제까지 전체적으로 아주 만족스럽습니다. 특히 서술형대비에 많은 도움이 될것 같습니다.
9788928320516,10,체계적으로 배열된 문제들이 인상깊네요.핵심개념을 보다 빠르게 알 수 있을것 같습니다.
