ISBN13,rating,review
9791162541968,2,노오력하고 모올입해야만 되는 건지
9791162541968,8,개인적으로 서문부터 흥미로웠고 밑줄 친 부분이 정말 많았다 실천포인트로 주는 내용들은 저자가 꼭 해보라는 응원의 메시지 같았다 ˝당신은 언제든 몰입 상태에 들어가는 법을 이제 안다. 무엇을 하든 완전히 빠져들 수 있다.˝ 이 말을 끝으로 책을 덮을 때가 시작이다
9791162541968,2,허풍을 엄청나게 떠나 영양가 없음. 당연하게도 해외 서적 사이트에서 평이 좋지 않다. 차라리 조지 레오나르드의 ‘달인‘이 더 와닿았다.
9791162541968,10,한계를 마주하고 답답했다면 이 책을 권하고 싶어요. 유익한 내용이 많아요. 두고두고 읽고 싶은 책.
9791162541968,10,나의 변화를 꿈꾸는 사람. 그만큼 간절하며 도전할 용기가 있는 사람에게는 정말 추천하고싶다.  다소 어려울수도 많은 부담감이 있을수도 있겠지만 그만큼 이 책 한 권에 다 담아 전해주고픈 작가의 의도는 너무 감사할 뿐.. 20분 단위로 끈어읽지않아도 저절로 그럴수 밖에 없었다.
9791162541968,2,알라딘 편집장님 이 책을 알라딘 전면에 홍보하시는 이유가......? 또 열정드립 하는 자기계발서 나왔네요.
9791162541968,10,안된다는 생각을 단 한번 이겨낸 순간 모든것이 쉽고 단순해졌다! 이 문구가 저를 책을 읽고싶게 하게끔 만든 문구예요.
9791162541968,10,"저자의 성공 모델인 리미트리스 모델의 핵심은 마인드셋, 동기, 방법이다. 학습방법의 학습을 통해 나의 한계를 극복하고 진정한 자기계발에 성공하자!"
9791162541968,10,"잠재력과 개발되지 않은 강인함, 지능, 집중력과 같은 잠재력을 발현시키는데 도움을 주는 책"
9791162541968,10,원제랑 너무 상관없는 번역제목이 안타깝다 담백하게 무한함으로 하던가 아니면 반어법으로 한계점이라고 하는게 더 나을듯...
9791162541968,10,아주 책을 씹어먹은 기분이었다. 정말 책을 야무지게 습득했다는 느낌을 체감하였다. ˝아! 책은 이렇게 읽혀야 되는구나! 맛깔난다˝ 하고 마지막 표지를 닫았다.
9791162541968,8,실천만 하면 참 좋은 내용들이 많습니다
9791162541968,10,나의 열정을 찾고 그것에 최대한 몰입하자. 스스로 만든 한계를 초월하라.뇌학습 방법의 학습이 여기에 있다.
9791162541968,10,"책을 읽고 나의 한계점을 돌아보게 되었다.나의 한계를 내가 감히 정할 수 있는것일까?책에서는 말한다.나의 개인적 결점이나 능력부족으로 실패한 것이아니라고,,,내가 나를 어떠한 틀에 가두어두고 어떠한 행동이나 말에 제한을 두고 있었다.성공의 공식이 그대로 녹아있는책 ,인정!"
9791162541968,8,내용은 도움될만한 내용들이 정말 많다. 유익한 책이다. 그러나 제목을 원제와는 상관없는 ˝마지막 몰입˝이라고 했는지 모르겠다.
9791162541968,8,세계적인 브레인 코치 짐 퀵의 이야기다. ‘학업지진아‘에서 세계 상위 1%가 극찬한 최고의 두뇌전문가가 된 과정이 담겨있다.
9791162541968,10,"자기계발서를 읽으면 가장 좋은 점은 책속에서 만나는 전문가들의 짧고 임팩트 있는 소중한 정보다 임상신경 과학자, 동기부여 강연가, 회복력 전문가 , 신경과학자, 통합영양학자, 심리학교수등 많은 세계의 분야별 전문가들의 조언을 듣고 짐퀵에게 브레인 코칭을 받았다^^"
9788901248752,2,누적되어 있는 통계자료만 봐도 알 수 있는게.. 부모의 재력이 자녀의 학업성취도(속되게 말해 명문대 합격)를 사실상 결정 짓는 사회구조 속에서 노력하면 성공할 거라는 낡은 신호를 주는 책들이 여전히 많이 팔리면서 학생들을 경쟁 속에 내몰게 하는 현실이 참으로..
9788901248752,10,"프랑스어 공부를 한 지 6개월이 넘었는데, 실력이 나아지지 않아서 고민하는 차에 이 책을 만났다.1/4/7/14 반복학습으로 매일 매일 꾸준히 공부해보려고 한다."
9788901248752,10,공부를 시작하기 전 공부의 기술 먼저 배우자..!!
9788901248752,8,새학기가 되다 보니 역시 ‘공부’라는 단어에 눈이 갑니다. 어떻게 노력하면 공부가 배신하지 않는지 차근차근 알려주는 책이네요.
9788901248752,8,결국 우리가 살아가는 방법 중 갑중의 갑은 ‘좋은 습관‘이다. 공부가 단지 입시용이 아니라는 것에 동의한다면 수험생이 아니라도 읽어볼 만한 책.
9788901248752,10,노력한 만큼 절대 배신하지 않는 결과를 낼 수 있는 ‘공부의 기술’을 가득 담은 책이다.
9788901248752,10,공부도 스킬이다! 효율적인 매뉴얼이 공부의 효용을 높인다!
9788901248752,10,공부의 기술 뿐만 아니라 어떻게 인생을 살아나가야할지 인생의 기술을 알려주는 책! 아이와 함께 읽어보고 싶은 책입니다!
9788901248752,10,절대 배신하지 않는 공부의 기술 긍정에너지토리파의 공부 습관 실제로 공부하는분들이 한번쯤 읽어보셨으면 하는 내용들이 잘 정리되어있습니다. 살면서 꼭 대학시험만 공부해야하는게 아닌데 앞으로 다양한 공부에 방법들을 접목 시킬수 있을것같아요. 노력은 배신하지 않습니다 !!!
9788901248752,10,"나와 공부는 뗄래야 뗄 수 없는 사이인데, 공부를 제대로 하는 방법을 이 책을 통해서 배우고, 정착하고 싶다! 너무 기대됩니다."
9788901248752,10,수능때 이 공부법을 알았으면 좀 더 효과적으로 공부 할 수 있었을 것 같아요. 한국사능력시험 공부할때 1/4/7/14 공부법 적용해서 공부해볼까합니다.
9788901248752,10,유용한 공부 방법을 꼼꼼히 기술했을 뿐만 아니라 노력을 향한 무한한 긍정으로 삶에 대한 열정을 부추기는 책이다.
9788901248752,8,"노력은 배신한다 . 방법을 모르면 ,공부에도 기술이다 이책대로 하면 노력과 공부가 최상이 될수있다"
9788901248752,10,취업을 위해 공부를 시작해야 하는 단계에서 이 책을 읽게 된 것이 나에게는 엄청난 기회였다. 복습과 노력의 중요성을 다시 새기며 긍정 에너지까지 얻어간다!!
9788901248752,10,복습위주의 공부법 1/4/7/14 프로젝트를 따라한다면 못 할 공부가 없을 것. 부모님이 먼저 읽고 습관을 잡아 주면 좋겠다. 초등학생때 부터 시작하면 더 좋을 것 같다.
9788901248752,10,나의 공부방법 중 잘못된 부분을 파악하고 좀 더 효율적이면서 나에게 맞는 공부방법을 찾아 개선할 수 있었습니다.
9788901248752,10,"구체적으로 내용이 잘 담겨있더라고요.. 양보다 질인 공부, 효율적으로 해보겠습니다!"
9788901248752,10,이 책은 많은 긍정의 메세지를 통해 내 자신을 보살펴볼 수 있었습니다.  남들과 비교하며 실패를 운운하는 내가 아닌 느리지만 천천히 포기하지않고 실현가능한 목표를 잡고 꾸준히 실천하는 방법으로 공부란 이런것이구나 라는걸 알게해줍니다. 자존감을 살리는 실행가능한 계획을 짜는 법을 배워봅
9788901248752,10,"저자의 진심어린 충고와 조언이 절절하다.경험한것과 확실히 얻은 지식만을 주시기에,충분히.설득력있다. 끝까지 읽고, 나를 바라보는 시선을 다시 생각했고,하루하루 더 열심히 살아야겠다는 장한 마음도 먹었다.감사합니다. 저는 저를 믿습니다"
9788901248752,2,시험준비를 공부로 착각하고 호도하는 이런 자기계발서 좀 그만 나오길 바란다.
9788901248752,10,공부 자존감이 낮은 수험생들이 꼭 읽어야 할 책이네요.
9788901248752,10,토리파의 14714 공부법! 복습을 체화하는 공부법이라는 생각이 들었는데 수험생들에게 유용한 공부팁이 많아 굉장히 유용한 책이었습니다. 찐으로 공부한 분의 리얼 경험기라 더욱 와 닿았네요. 유튜브 채널도 구독 했어요!
9788901248752,10,"요즘에 노력보단 배경,환경이 중요하다고 하는 수저의 시대인데 저자는 노력은 배신하지 않는다!!를 몸소 보여주며 희망을 준다. 공부의 비법도 체계적으로 들어가 있어서 잘 읽혔다."
9788901248752,10,"그냥 단순히 공부하는 방법이라고만 생각했는데, 공부하는 방법도 상세히 제시해주신 것은 물론이고 이 책을 주변에 추천하고 싶은 이유는 오히려 자기 자신을 지켜가며 공부하고 노력해가는 인생의 태도를 배울 수 있을 것 같아 제가 읽고 난 뒤 추천하고 있습니다."
9788901248752,10,내 노력은 헛된 것이 아니라는 것! 이번 개강을 이 책 덕분이 공부 의욕 넘치게 시작할 수 있게되어 너무 좋네요
9788901248752,10,"자신과 비슷한 사람들의 간절함을 모아 자신만의 공부법을 제시한 책.노력이 성공을 보장한다는 시대는 지나고, 자신의 노력조차 의심하는 시대 속 합격이 보장되는 공부법을 소개해주는 저자의 따듯한 마음이 느껴진다. :)"
9788901248752,10,기본에 충실하며 전략적인 효율에 집중하는 방식을 명쾌하게 정리하였기에 수험생이라면 꼭 한 번 읽어보고 벤치마크 해봐야 될 책이었다
9788901248752,10,뚜렷한 공부 목표를 가진 분들에게 확실한 동기 부여와 학습법을 전수 받는 시간.  더불어 목적이 공부가 아니더라도 충분히 자기계발에 활력을 불어 넣어 준다. 코로나 핑계로 놓치고 포기한 여러 과제를 다시 시작해 보겠다는 의지도 충만해진다.
9788901248752,10,"피나는 노력을 해야 이길까 말까니, 시간을 늘릴 수 없다면 공부법 책을 보고 효율을 늘려보도록 하자!"
9788901248752,10,뜬구름 잡는 이야기만 들어있을 줄 알았는데 막상 읽어보니 내용이 엄청 구체적이어서 놀랐습니다.
9788901248752,10,리파형 출간 축하드리면서 바로 읽어보겠습니다 -구도진-
9788901248752,10,유튜브 구독자입니다!!! 토리파 선생님 공부법 정리책이라니! 이건 두고두고 참고해야겠네요!! 최고입니다!
9788901248752,10,드디어 나왔네요!!!! 유튜브로도 잘 보고 있었는데ㅎㅎ 책으로 나와 두고두고 볼 수 있어 좋아욥ㅎㅎㅎ
9791155813355,10,IT가 사회와 경제하고 밀접하게 연결되어 있어서 하나하나 우리 일상에서 일어나고 있는 일들이 기본상식으로 알아가야 할 상황이라는 걸 인지시켜주었던 책이었다.
9791195522897,10,배송도 빠르고 책 상태도 좋았어요! 좋은 거래 감사함키다!
9788935213405,10,책을 읽고 보니 오십이 두렵지 않아지네요.오히려 내 삶이 준비 되었구나 이리 하면 되겠구나 안심이 됩니다
9788935213405,10,누구에게나 좋은 사람이 되어야 한다는 강박을 버리고 누구보다 나를 아끼며 살아간다면 그 누구와도 안정적인 관계를 유지할 수 있다. 앞으로의 인생을 함께할 소중한 인연을 지켜내는 중년의 인간관계론을 배워보자.
9788935213405,10,나이들어감을 실감하는 오십에 대해서 말하고 있다 지혜롭게 처신하고 자신을 잘 다스리는 방법을 이 책에서 말하고 있다
9788935213405,10,오십을 맞이하며 한번쯤 읽어보면 좋을  책
9788935213405,10,"책 속에는 저자 자신이 살아 온 세월동안, 생활과 경험 속에서 얻은 마음 속에 생각들과 자신과 주변의 이야기를 독자들에게 부담없이 이야기하여 시간가는 줄 모르고 읽게 된다. 꼭 오십이라는 나이대가 아니더라도 부담없이 술술 즐겁게 읽을 수 있는 에세이다."
9788935213405,10,오십은 자기 나이로 보면 기분 나쁘고 자기 나이로 대접받지 못해도 기분 나쁜 분기점이라고 한다. 외모평준화가 일어나고 나의 외모가 무리로 구분되는 .. 그래서 가치가 더 중요한 시점일지도 보이는 나가 아닌 존재하는 나로 살아가기 시작 척대신 진짜 나로.먼저 살아본 언니가 동생에게 들려주는
9788901248776,10,좋은 아이디어들이 너무 많습니다. 덕분에 해보고 싶은게 많아졌어요 ^^
9788901248776,10,디지털 파일을 판매한다니그리고 억대 수익이라니이 시대 꼭 읽어야 할 책입니다
9788901248776,10,신세계 발견!! 누구나 꿈꾸는 패시브 인컴을 실현한 저자분의 상세한 노하우 정말 도움 많이 됐어요
9788901248776,10,˝오호! 정말 솔깃한데.. 나도 도전해 볼까??˝ 싶은 마음이 굴뚝 같아졌다.
9788901248776,10,판매의 틀을 부셔준 책. 디지털 판매에 대하여
9788901248776,10,엣시Etsy라는 플랫폼에서 간단한 소스를 조합해 포스터 이미지를 만들어 판매하며 1년에 1억이란 큰 수입을 올린 이야기였고 도전과 열정의 감동적인 한편의 드라마가 연상 될 정도의 이야기가 담긴 책이었다.
9788901248776,10,이 책을 읽다가 유레카!!! 했습니다​제가 생각하던 것을 실현할 수 있는 아이디어를 이 책에서 얻었거든요!​
9788901248776,10,월급에서 독립하고 싶은데 내가 무엇을 잘하는지 갈피조차 잡지 못하고 있는 사람들이 꼭 읽어야 할 책!
9788901248776,10,"클래스101 때부터 듣고 싶던 강의였는데, 책으로도 나왔네요! 사이드잡 고민하고 있는 사람들에게 유용할 듯.."
9788901248776,10,돈 벌고 싶은 사람들은 당장 읽어 보아야 할 책.
9788901248776,10,노마드 그레이스 님 책이 드디어 나왔네요. 디지털 판매 꿀팁기대됩니다!!
9791158511982,10,"인생책으로 추가~! 세번째 읽고 있는데, 너무 좋은 내용이 많고 꼭 나의 멘탈관리책으로 삼아 성공은 덤이고 빛나는 내 인생을 만들어가고싶다!"
9791158511982,10,밑줄 치지 않은 페이지가 없을 정도로 가슴을 후벼파는 글귀들로 가득했다.결국 멘탈. 자기 감정을 컨트롤하는 것이 인생의 여정에 있어 대부분임을 비로소 깨닫는다.
9791158511982,8,"전작 돈에 비해  명작은 아니고, 여러가지 자기개발서에서 한 번쯤 본듯한 내용들이 많지만 그래도 멘탈 관리에 도움  되는 내용이 많습니다."
9791158511982,10,자존감이 떨어지거나 용기가 필요할때 읽으면 좋은 책!
9791158511982,10,보도섀펴의 <돈>을 읽고 정말 왜 이제야 읽었나 싶을 정도로 충격을 받았다. 그 보도섀퍼의 최신작 <멘탈의 연금술>! 보통의 자기계발서를 읽고도 좋았지만 보도섀퍼의 20대 신용파산자였던 그가 어떻게 세계적으로 유명한 머니코치이자 밀리언셀러 작가가 된 건지 이 한권으로 설명하는듯했다.
9791158511982,2,최대한 빨리 중고로 팔았다!!!!
9791158511982,2,올해 읽은 책 중 가장 뻔하고 설득력이 없었다.내가 가진 인생의 12가지법칙과 비교 했을 때 많이 아쉬움이 남는 책이다. 많고 짧은 챕터로 나눠져 있고 누구나 쉽게 이해 할 정도의 문장들. 딱 그정도
9791158511982,10,제가 원래 자기계발서들 특유의 두루뭉술함을 싫어하는데 이 책은 추천합니다. 현실적으로 실천가능한 구체적인 예시와 방법들이 많이 들어있기 때문입니다. 특히 2장에 ‘불안과 두려움‘을 다루는 팁과 사례들이 많이 나오는데 실제로 실천해보니 현실에서 큰 도움을 받았기에 일부러 100자평 쓰러옴.
9791158511982,4,황금같은 내용 위에 휘날리는 불순물 같은 번역대략 10페이지에 한번씩 자연스럽지 못한 문장에흐름이 끊겨 심호흡을 하게 되지만.책의 내용은 제목처럼 짐작되는 살면서 언젠가 들어봤던이야기지만 누군가에겐 힘과 위로가 될듯.
9791158511982,10,기대됩니다~~~~!
9791158511982,2,보도섀퍼라는 이름만 믿고 사기에는 시간과 돈이 아깝습니다. 기대했는데 너무 아쉽네요.
9791158511982,2,기대가 컸던만큼 실망도 크네요굳이 살필요는 없는책목차만 읽어도 충분
9791158511982,2,자기계발 철 지난 유행인 줄 알았는데 죽지도 않고 또 욌네
9791158511982,10,멘탈을 관리하는 저자만의 방법을 배우고싶어요 ^^
9791158511982,10,"보도 섀퍼의 돈의 그 작가의 신작이라니, 꼭 읽어보고 싶은 책입니다. 기대됩니다."
9791158511982,8,누구나 바라는 경제적 자유의 길이 궁금합니다.
9791158511982,10,세상 모든 장애물을 황금으로 만든 그의 신화는 뭘까 기대됩니다~
9791158511982,10,보도섀퍼의 돈을 읽고 인생의 태도가 바뀌었습니다. 오랜만의 신작이라니.... 문자를 받자마자 구매하고 기다리는 날이 기네요ㅠㅠ 목차만 봐도 벌써 정신이 드는 것 같습니다. 돈도 안 읽어보셨으면 꼭 읽어보세요.
9788997396870,8,"내가 그리 잘못 산 건 아녔어, 지금 이 정도도 괜찮아라는 위로와 격려를 받은 기분. 저자의 부드러우면서도 단호한 문체가 식상할 법한 내용을 식상하지 않게 전달한다."
9788997396870,10,"책장을 한장한장 넘길때마다 어린시절부터 달래지지 않고 남은 분노가 스르륵~하고 풀리는게 느껴졌어요. 물론 책한권 읽었다고 갑자기 따스한 성격이 되거나 너그러워진것은 아니겠지만, 어제보다 더 나은 오늘을 살것이라는 믿음을 얻었어요. 여유와 용서가 없는 분이라면 꼭 읽어보시길 추천드려요."
9788997396870,10,"늘 티비에서 뵈면서 참 좋은 말씀을 해 주시는 분이라고 생각했습니다. 책을 읽으면서  그 속에 담긴 깊이와 따뜻한 시선에 참 많이 위로 받았습니다. 이제 나의 부모님의 나이가 되어 과거의 나를, 부모님을 되돌아 볼 나이가 되었습니다. 그때 힘들었을 부모님께 선물 하고 싶은 책 입니다."
9788997396870,10,꼭 읽어 보겠습니다 ^^
9788997396870,10,머리론 아는데 막상 따라가는건 어려운 현실입니다
9788997396870,10,법륜스님책이랑 인생관이 비슷하셔요~ 자연스럽게 치유되는것도 신기하게 비슷해요
9788997396870,10,"그 누구보다 먼저 나 자신을 용서하고 스스로와 화해하라는 조언이 가슴깊이 와닿는다. 아프고 쓰라린 어린시절을 겪으며 남들보다 빨리 어른이 될 수 밖에 없었던 이들, 그 탓에 아물지 못한 상처를 억누른 채로 고통에 몸부림치며 살아가고 있는 이들이라면 꼭 권하고 싶다."
9788997396870,10,진정한 화해는 ‘내면의 나’와 화해하는 것이다. 어렵다. 타인과 (마지못해)화해하는 것 보다 몇 배 더 힘들다. 정신건강의학과 전문의인 저자는 많은 상담사례를 소개하며 ‘나를 발견하고 공감하면서 새로운 창을 만들어 진정한 나를 찾아가도록’ 돕는다.
9788965964223,10,라포 형성 과정을 디테일하게 설명해준다. 커뮤니케이션 역시 물리의 법칙과 마음의 법칙 안에 있다는 걸 확인한다. 대화에 어려움을 겪는 이에게 꼭꼭 눌러가며 읽기를 추천드린다.
9788965964223,4,"너무 뻔하디 뻔한 이야기를 끝도없이 계속 하는책, 대화의 핵심은 듣기이다, 상대방을 이해하라, 참아라, 화내지 않는다 등 초등학교 도덕책 수준의 너무나도 당연한 이야기를 몹시 어렵게 ‘전문적인척‘ 정신없이 풀어둔 책. 읽는 순간순간 너무 당연해서 화가난다"
9788965964223,10,정말 최고입니다. 줄 치고 치고 ... 책 닳게 생겼습니다. 특히 가족과의 갈등에 적용해보면 좋을것 같고 나아가 세일즈레도 적용될 요긴한 라포르 형성 대화법을 심리학을 적용해 잘 풀어냅니다. 최근 읽은 책중 최고!!
9788965964223,10,"흥미로운 사례(범죄,회사,부부,자녀)를 통해 소개되어 있어 술술 읽힙니다. 특히 소통의 방식에 4가지 동물을 대입하여 설명해주는데 “난 어떤 동물 방식에 강하고 상대는 어떤 동물인지, 서로 어떤 형태여야 좋은 대화를 이끌어낼지” 파악할 수 있는 점이 인상 깊었습니다."
9788965964223,6,특별한 방법을 기대하고 이책을 산다면 실망할 듯.  그리고 영국과 우리나라의 관계의 맥락이 달라서 예시가 잘 와닿지 않았음.
9788901248158,10,유리멘탈에서 벗어나는 첫걸음은 자신을 소중히 하는데서부터 시작된다.
9788901248158,10,단단해지기 위한 방법이라니!! 진짜 필요함
9788901248158,10,섣불리 스스로 유리멘탈이라 단정하지 말자
9788901248158,10,유리멘탈들 모두 모이세요 깨지기도 쉽지만 단단해지기도 쉬운 우리들에게 추천합니다
9788901248158,10,"어떤 일에도 아랑곳 하지 않는 마음을 갖는 여정, 나는 어떤 사람이고 어떤 멘탈을 가졌나"
9788901248158,10,남의 눈치 보게 만들고 아직도 유교적인 사회에 사는 우리를 도닥이는 심리책
9788901248158,10,한없이 약해질 때 읽어보면 좋은 책
9788901248158,8,타인의 눈치나 보면서 비굴하게 사는 사람들의 필독서
9788901248158,10,"다른 사람이 머릿속으로 어떤 생각을 하는지는 내가 머리를 굴려 고민해도 절대 알 수 없는 영역이기 때문이고 지금까지 어떤 사람이 나에게 호감을 보이며 잘해주었다고 해서, 그 호의가 앞으로도 쭉 계속된다는 보장도 없다는 뼈때리는 조언을 한다."
9788901248158,10,흔들리고 부서지는 마음을 위한 책
9788901248158,10,유리멘탈로 매번 상처받는 이들에게 솔루션을 주는 책!
9788901248158,10,각자에게 숨겨진 무한한 마음의 힘을 세상 밖으로 드러낼 수 있는 지혜를 배울 수 있다.
9788901248158,10,코로나로 인해 더 맨탈이 약해져있는 듯 하다. 유리멘탈이라는 단어가 그래서 참 와닿았다. 마음을 단단하게 하는 기술들을 간략하고 보기쉽게 기록해두었다. 나의 감정에 휩쓸리지 않는 방법들을 소개해준다.
9788901248158,10,유리처럼 쉽게 충격받고 좌절하는 사람들을 위한 최소한의 방어책
9788901248158,10,유리멘탈로 살아온 인생 너무 괴롭... 어떤 얘기를 해줄지 기대됩니다
9791162542002,8,"앞에 잘 보이지 않을 때 돌파구를 찾는 방법이 책을 가까이 하는 것이며,  먼저 경험을 하고 방향을 어떻게 잡았는지 기록을 들춰 볼 수 있는 곳이 책이다.  그 외에 자존감이 떨어질 때나 의욕이 다운되었을 때 무엇인가를 해서 야구선수의 투수처럼 잘 나가던 과거의 몸으로 만들어 놓아야 한다."
9791162542002,10,자기가 지금 책을 제대로 읽고있는지 또 어떻게 읽으면 도움이될지 알고싶다면 이 책안에서 답을찾을수있을것이다.​책을읽는 나만의 간절한 이유.나만의 독서법을 찾는데 도움이 되는책이다.
9791162542002,10,작가가 십여년의 독서노하우와 책읽기 방법이 고스란히 녹아 작가의 혼이 스며있는 책이다. 아무리 시대가 빨리 변하고 바뀌어도 책읽기는 변함이 없다는 진실. 독서는 항상 나와 함께하는 친구다.
9791162542002,10,기대되고 어서 읽고싶은 책~
9791162542002,8,책을 끊을 수 없고 계속 읽고 써야하는 이유를 이 책에서 만나보세요. 강추합니다.
9791162542002,10,"하루하루 단 몇줄이라도 매일매일 읽고 기록하는 습관을 들여 나의 현실에 안주하지 않고, 조금 더 발전된 나 자신이 되는 한 해가 되었으면 좋겠다."
9791162542002,10,앨작가님 기대됩니다♡
9788968332937,10,"이 책에는 내가 절실히 느꼈었던 운동의 필요성이 작가두분의 시각에서 인문학적인 필치로 일목요연하게 담겨있다. 1~9장까지는 동기부여적인 측면이,10~14장 까지는 실전운동 방법을 포함한 멘탈 코칭적인 측면이 실려있어서 여러가지 관점에서 책을 읽고 생각할수 있다는 점이 매력적이다."
9788968332937,10,"‘메멘토 살루테‘, ‘당신의 건강이 영원하지 않음을 기억하라‘"
9791158511906,8,"이렇게 열심히 사는 사람들을 어디서 만날 수 있을까. 책으로 만날 수 있어서 너무 좋다. 책 최고. 미라클 모닝에 대해서는 읽을만큼 읽었다고 생각했는데, 역시 모두에겐 각자의 팁이 있고, 나에게 도움될 좋은 팁들 많이 얻었다.  리뷰 보고, 책 고를 때, 그 리뷰를 쓴 사람의 다른 리뷰들을 참고할것"
9791158511906,10,왜 이렇게 화난 댓글이 많은지 모르겠지만...포인트는 ‘무조건 4시 반에 일어나라‘가 아닙니다. ‘잠을 줄여라‘도 아닙니다. 일찍 잠자리에 들고 몇시가 되었든 본인에게 맞는 시간을 찾아 일찍 일어나서 아무도 방해하지 않는 본인만의 시간을 가지라는게 핵심입니다...
