ISBN13,rating,review
9788960867680,10,"사회 생활을 하며 가장 중요한 커뮤니케이션을 중시하며, 사람들과 대화하는 법을 소개해준다."
9788960867680,10,나에게 필요했던 책 !
9788960867680,8,다른사람에게 관심을 가지는 것이 먼저고 또한 노력하고 자기만의 화술을 만들면 누구나 대화의 신이 될수 있겠다라는 책입니다. 저도 말잘하고 싶어서 읽었는데 도움 많이 받았어요 ~
9788960867680,10,멋진책이네요
9788960867680,10,"'훌륭한 화자가 되려면 훌륭한 청자가 되어야 한다는 것이다.' 가 가장 기억에 남고 공감이 된다. 평소 말이 많았었는데 이제는 말보다 경청하는 쪽으로 대화를 하려한다.대화의 신이 되는 길은 연습, 또 연습 인 것 같다."
9788960867680,8,소통하는 법을 알고 싶어 선택했습니다.
9788960867680,10,대화 못하는 나에게 도움이 되는 책
9788960867680,10,말하기를 잘하고싶어서
9788960867680,10,인간관계를 회복하고 리드하는데 있어서는 이책이 그나마 났다고 생각합니다. 하지만 자가 발전을 위해서는 책이아닌 자의적인 노력이 있어야 할것갔습니다.
9788960867680,10,최고의 진행자가 알려주는 최고의 인생 진행법
9788960867680,10,CNN뿐 아니라 거의 전 세계에서까지 저명한 인터뷰어 래리 킹유대인의 자손이 뉴욕 브룩클린 가난한 동네에서 자라 대학 졸업장도 없이 소련 미국 대통령등에 이르기까지 인터뷰를 이끌어낸 그리고 하루에 한 명꼴로
9788960867680,10,대화를 잘 할 수 있는 방법을 가르쳐 줍니다! 이 책 적으려고 들어왔는데 상단에 있어서 찾기 쉬웠네용!!
9788960867680,8,대화를 두려워 하는 사람에게 한번쯤은 추천해주고 싶은책!
9788960867680,10,항상 고민 중이 었던 것이 있었는데 이 책을 읽으면 도움이 되지않을까 해서요
9788960867680,10,대화를 잘 못하시거나 자신이 없으신 분들께 추천 합니다.
9788960867680,10,어떻게 대화를 이어가야 하는가에서 한단계 더 나아가기 위한 지침
9788960867680,10,굿
9788960867680,10,대화스킬이 필요한분
9788960867680,6,대화에 대해 깊은 생각을 하게끔 하는 책. 뱉는 다고 다 말이 아니다.
9788960867680,10,대화를 잘해졌다.
9788960867680,8,"성격과 관계없이 대화를 잘하기 위해서 우선 준비해야 할 것, 얼마나 철저하게 준비하는가? 말하는 것을 평생의 업으로 삼아 온 사람의 이야기는 새겨서 들을일이다."
9788960867680,10,대화에 있어서 자신없으신분 포인트를 잘못찾으시는분들 추천드립니다.
9788960867680,10,좋습니다
9788960867680,10,유용한정보가 많음
9788960867680,10,좋아하는분이신데 책도 재밌게봤습니다
9788960867680,10,대화라는건 상호의 반응과 자극임에도 불구하고 지금까지 혼자 단독으로 내 말만 하고 있던게 아니었나 반성하게됩니다.
9788960867680,10,광고에 나오는 이분 누군가 엄청 궁금했었는데 딱 발견한 책. 이 책을 읽으면 여러 방법으로 말을 잘 할 수 있구나 깨달을 수 있다. 특히 여러 말 잘하는 선수들의 사례들이 나와있고 실제상황에 유용한 팁들도 나와있어서 개인적으로 참 좋았다.
9788960867680,10,인간관계에 중요성을 다시한번 느끼게 해주는 책이다
9788960867680,10,래리킹은 워낙 유명하니까 어떤 책인지 궁금했어요.
9788960867680,10,대화의 신.. 읽어보고 싶은 책이에요
9788960867680,10,래리킹의 책은 언제나 불변하다
9788960867680,10,누구나 깨달을 수 있는 대화의 본질! 이 책과 함께면 네트워킹 파티에 던져져도 두렵지 않다!
9788960867680,8,강추요~^^
9788960867680,10,인생을 살다보면 내 이야기만 늘어놓는 내 모습을 보게 되는데..대화의 기술에 대한 깨알 지식을 주는 책
9788960867680,10,좋아요~~
9788960867680,10,대화의 중요성을 느꼈습니다.
9788960867680,10,하나의 기술을 말하고 이게 무조건 맞다! 이런 책이 아닌.다양한 상황과 경험을 통해 대화에서 생각할 것들을 챙겨준 소설
9788960867680,10,"유일하게 읽은책, 깊은 내용은 아니지만 어찌보면 지극히 당연하고도 심플한 룰들을 통해서 대화를 잘 해나갈수 있는 방법들에 대해서 설명하고있다."
9788960867680,8,대화의 중요성을 일깨워주는책
9788960867680,10,대화를 어떻게 해야하는지 래리킹의 입으로 듣는 확실한 방법.
9788960867680,6,"대화에 서투른 사람들이 초반부터 너무 어려운 내용을 보게 되면 더욱 두려워하게 되지만, 이 책은 쉽게 접근할 수 있는 방안을 제시해줘서 괜찮은듯 싶다."
9788960867680,10,ㅇㅖ전에 나온 책~ 대화의 법칙~도 읽었다!~ 이 책이 또 나왔으니~ 또! 읽을 생각이다!~ 읽는 시간 대비~ 얻어가는게 많을~ 책일거다!~ 아끼지 말고 시간과 돈!~을 투자하길!~^>^*
9788960867680,8,사람과의 관계가 가장 힘든 문제 중 하나인데 그 문제를 대화라는 방법으로 저자의 풍부한 경험을 통해 보여주고 있다.
9788960867680,8,말 한마디로 천냥 빛을 갚듯이 우리가 살아가는데 있어 중요한 말하는 법을 알 수 있어서 좋았다.
9788960867680,10,저에게 많은 도움이 되었습니다.
9788960867680,10,세상을 살면서 의사소통이 모든 것의 열쇠가 되는 것 같아서.
9788960867680,10,대화하라. 핸드폰 채팅이 아닌 얼굴과 얼굴을 마주하고 대화하라. 그리고 그 속에서 진정한 삶을 살아라. 래리킹이 이야기하는 이야기 속의 삶.
9788960867680,10,"내가 말하는게 무슨 문제가 있어서 사람들과 대화를 할때 트러블이 생길까, 하고 궁금해서 아무래도 래리킹이라는 사람에게 관심이 있어서 보게됬는데 뭔가 쉽고 이해가 잘돼서 한표 합니다."
9788960867680,10,말하는 중요함을 깨닫기 위해서 구입하고 읽어보았습니다. 말이 필요없네요
9788960867680,10,단순히 대화를 잘하는 방법을 설명한 책은 아니다. 래리킹의 인생을 통해 어떻게 하면 대화를 잘할수 있는지 어떤 자세를 취해야하는지 등.. 그의 경험을 바탕으로 한 산지식을 얻을수 있었다. 사람를 대하는게 힘들다. 대화를 더 잘하고 싶다면.. 한번쯤은 꼭 봐야할 책이다.
9788960867680,10,대화의 신 래리킹이 알려주는 대화의 방법.
9788960867680,10,"본인의 경험을 위주로 이해하기 쉽게 설명해 놓은 책.누구나 다 아는 얘기들이라고 생각할 수 있지만,누구나 다 꺠우치지는 못한 이야기."
9788960867680,10,현장의 생생한 사례를 들을수 있어 많은 도움이 되었다
9788960867680,8,"어디선가 봤던 것같은 내용이지만, 정리하는 기분으로 읽었다. 읽어봤던 책중에 다시한번 대화에 관하여 곱씹게 해준 고마운 책."
9788960867680,10,우연히 서점을 지나며 보게 된 책. 사람들과 끝없이 만나며 가장 필요했던 대화! 그 대화법을 이끄는 것이 힘든 사람들에게 도움이 될만한 책으로 큰 배움을 얻으며 보았던 첵!
9788960867680,10,래리킹의 멋진 화술
9788960867680,10,래리킹이니까!
9788960867680,10,"서로 얼굴을 마주하는 대화가 부족한 요즘, 꼭 필요한 도서!"
9788960867680,10,읽어봤는데 대화하는 것이 참 중요하다
9791155056097,8,활용할 수 있는 것들이 많아 마음에 듭니다.블로그에 가서 활동지를 다운로드 받으려구요.다만 카드가 좀 작게 나왔어요.감정카드도 같이 구매했는데 같은 곳에서 만든 것치곤디자인이나 기타 공통점이 거의 없어보여요.잘 활용하겠습니다.
9791188388394,2,신사고 운동의 양자역학을 끌어다 쓰는 행태를 비판하면서 본인도 역시 양자역학을 근거로 설명하는 아이러니.진화론을 비판하며 창조과학회 자료를 가져와 근거로 대는 허술함.역시 나는 이 작가랑 안 맞다.꿈꾸는 다락방 1을 그나마 좋게 봤던 느낌마저 희석되려고 한다.
9791188388394,6,"<이지성의 꿈꾸는 다락방> 1,2 다읽었는데, 1만 읽어도 충분할듯 하다. 이지성작가가 말하고자 하는 바(R =VD)를 전달받기에는. 참고로 난 이지성작가의 팬이며, 그의 인스타(@ejisung1)의 열렬한 구독자다."
9791161261171,10,책깨끗함
9791185823270,10,"작가는 출판 에디터 일을 하면서 고혈압, 스트레스, 저질체력만 남았다한다.마흔살부터 천천히, 조금씩, 꾸준히 몸을 움직인 끝에 올빼미족 게으름뱅이에서 아침형 근육노동자로 변신했다.⠀ 조금은 늦게 시작한 운동이지만  다시 찾은 체력으로인해 일상이 자신감있게 긍정적이고, 건강하게 바뀌었다는 작가의 에세이다."
9791185823270,4,기대 이하..
9791185823270,10,서른 네살. 몸이 무너졌어요. 통증이 심하고 모든 게 바닥입니다. 책을 읽고 다시 읽으며 일단 한 바퀴부터 시작했어요. 건강한 40대와 50대 그 이루를 꿈꾸며
9791185823270,10,책 읽고 동기부여 받아 수영과 달리기 재미있게 하고 있어요. 삶의 질이 높아졌습니다.
9791185823270,10,운동하고 싶게 해요.
9791185823270,8,책을 읽으면서 운동의 필요성과 동시에 나도 할수 있을것 같은 자신감이 들었다.  그런데  아드님이 1년의 방항끝에  지원한 9개의 대학에 모두 붙었다는 내용이 나오는데  수시 합격시 정시 지원이 불가능한 현실에서  어떻게 가능한 일인지  너무 궁금해짐
9791185823270,2,왜 하필 제목을 ‘마녀‘체력으로 해야했을까..
9791185823270,10,책읽다 오밤중에 집 밖으로 뛰쳐나가고 싶어졌다. 만화영화‘달려라 하니‘의 하니의 마음이 고스란히 느껴지던 책.
9791185823270,10,"작가님(에디터님^^)의 성장과정을 재미나게 풀어주셔서 읽는 동안 함께 성장하는 기분이었습니다. 저도 요즘 러닝에 빠져 사는데, 이 책을 읽고는 철인 3종까지 도전해보고픈 용기가 생겼습니다."
9791185823270,8,"운동하고 싶다는 생각이 든다. 사실 꼼꼼히 살피면, 내가 동감하기엔 운동의 강도가 너무 세고 여유도 없다. 그렇지만 이 책을 읽은 뒤에 운동을 해야겠다는 생각이 들었다. 그만큼 목적이 분명하고 메시지가 선명하다는 뜻."
9791185823270,6,요약:  같이할것 조금씩 부담을 줄것 두려움도 조금씩 극복할 것.  수영 마라톤 조깅 사이클 철인3종경기 미사리 인터넷에서 정보 얻기  프로그램을 흉내내기
9791185823270,8,"재미있고 유익하다!!! 🙄  책의 본 주제라고 할 수 있는 운동의 방법과 효과뿐 아니라, 작가의 인생 이야기와 중간중간에 좋은 책 구절을 인용하는 부분도 인상깊었다. 그리고 위 모든 내용을 맛깔나는 글솜씨로 버무린 것이 무엇보다 큰 장점이다."
9791185823270,10,"이 책을 읽고 새벽 수영을 시작했습니다. 건강한 몸, 탄력있는몸, 건전한 마음을 가진 분들이 더욱 멋있어보이게되었습니다. 읽기로 끝나지 않고 행동으로 옮길 수 있는 용기와 재미를 주는책, 추천합니다"
9791185823270,8,"너무나 공감하는데,나태함과 두려움.무엇이 문제인걸까."
9791185823270,10,먼북소리처럼 들렸던 체력키우기를 더이상 미룰나이가 아님을 알기에. 가야할길을알기에 그길을 걸어야겠다.
9791185823270,8,일단 표지 그림이 재미나다.책을 읽으면서 점점 철인 3종 경기에 빠져든다.결국 나는 내년에 마파톤 풀코스에 도전하기로 마음 먹었다.
9791185823270,8,운동하는 게 버겁다고 생각될 때 도움이 되는 책이다.
9791185823270,10,"지금까지 최고의 운동 장려서적, 왜냐하면 나를 뛰게 만드니까!! 이렇게 유쾌하고, 시원하고, 감동적이기까지 한 운동을 장려하는 책 있으면 내 앞에 보여주세요!"
9791185823270,6,기대만큼은 아니었다. 너무 기대를 많이 했는지도 모르겠다. 어쩌면 성별 차이가 독서 경험의 차이를 불러왔는지도 모르겠다. 하지만 함께 운동하고픈 마음에 아내에게는 추천한 책. 성별 차이가 분명하군. ㅋ
9791185823270,8,무너지는 체력으로 늘 고민하는 차에 딱 눈에 들어온 책. 꼭 마흔이 아니라도 공감할 수 있는 내용이 많다.
9791185823270,10,나이들수록 중요한게 체력인 걸 알지만 언제나 운동을 망설였던 저에게 건강한 에너지를 든 책이에요. 가볍게 읽다보면 밝은 에너지로 물듭니다
9791185823270,10,"최근 읽은 책 중에 가장 몸을 들썩들썩하게 만드는 책이다. 저질체력의 편집자가 수영, 달리기, 자전거를 즐기다가 철인3종경기까지 도전하는 이야기를 들으며 유쾌하기도 하고 찡하기도 했다. 새로운 운동에 도전하며 단련하고, 탄탄한 근육이 멋진 40대 이후의 삶을 상상해보는 것이 즐거웠다."
9791185823270,8,멋있다. 정말 멋있다.
9791185823270,10,"작고 예쁜 책, 그러나 에너지가 넘치는 책이다. 운동하라는 말들, 글들이 넘쳐나지만 잔소리로 들릴 때가 많은데, 이 책은 친한 언니가 때론 시크하게 때론 다정하게 수다 떨며 자신의 이야기를 들려주는 느낌. 일하는 여자들이 어떻게 일과 마음과 체력의 고비를 넘길 수 있는지 보여주어 힘이 되었다"
9791185823270,8,"이제 곧 작가가 운동을 시작했다는 나이를 앞두고 있다. 늘 마음 한구석에 있는 ˝나이들어서 운동한다고 뭐가 달라질까?˝ 하는 의문을 날려줬고, 아직은 시작하지 않았지만 언젠가는 나도 불현듯 이 책이 떠오르고 시작할 수 있지 않을까."
9791185823270,10,40세! 뭔가 변화가 필요한 시점에서 과감히 자신의 약점을 직시하고 솔직하고 유쾌하며 당돌하게 써나간 작가의 매력에 흠뻑 빠져드는 책이었다.곳곳에 에디터 특유의 예리한 고찰과 유연함이 드러나는 사고에 미처 생각지 못한 나자신의 여러부분을 돌아보게 되었다.
9791185823270,10,책을 읽는 내내 혼자서 픽픽 웃다가도 내가 해내지 못할 그런 강도높은 운동을 시작함에서 느끼는 절망에서 오기로 오기에서 뿌듯함으로 변화해가는 작가의 심정을 헤아릴 수 있었다.소소한 일상을 주제로 하여 읽기 쉽고 편하게 때로는 감동적으로 나를 깨우쳐준 책이다.
9788970342696,4,표절에 가까운 소재활용이 읽는 내내 불편하다. <Secret>을 읽어본 저자라면 누구나 느꼈을 불편함. 다만 보물지도에만 집착하면서 풀어냈기에 Secret을 다시 떠올리기에 괜찮은 계기.
9788970342696,10,읽다보니 혼자 보기 아까워서 지인에게 선물하기 위해서 한권 더 구매하였습니다.일러스트 색감도 좋고 내용도 많지 않지만 평이하고 쉽게 쓰여져 있어서 좋습니다. ^^
9788970342696,10,살면서 한 번쯤 나만의 보물지도를 만들어보자!!!!
9788970342696,8,시크릿 동양판.좀 더 와 닿는 듯.
9788970342696,6,지나치게 긍정적. 그래도 자신의 꿈을 실현하기 위해 작가의 글처럼 정리하는 것도 나쁘지는 않을 듯. 일단 내 꿈이 뭐지???
9788970342696,10,강추~~~
9788970342696,2,별루임...중고서적이라 그나마 다행...
9788970342696,10,내가 가장 하고자 하는 꿈을 이루기 위한 방법을 일깨워준 책.. 꿈을 만들세요
9791130614670,10,유툽에서 우연히 보다 40대 여성의 .... 란 말에 그냥구입 이룰건없고 빠듯한 인생  난 이미 늙었어 40대 늦었다 늙었다 란 말에 이도저도 두려운 나이 포기해? 다시시작해?라는 의문에 너역시 할수있지 라는 작은자신감을 심어준 책거창한 일부터가 아니다 작은 아주작은 시작도 공감!
9791130614670,8,"진정성이 느껴져서 좋았다. 어떤 상황이든 저자는 열심히 살았고, 살면서 배운 것, 얻은 것들을 나누고자 했다. 물론 운이 좋기도 했겠지만 그 운을 잡은 것도 자신의 노력이니까. 사채나 은행이 아닌 곳에 빚이 있다는 건 진짜 운 좋은 듯."
9791130614670,10,"아끼지않고 나누고싶은 저자의 진정성을 느껴서 참 좋았습니다사업에 관한 정보와 경영마인드를 알려주셨는데실무?적인 내용, 쪽집게사업방정식이(그런게어딧;;)라기보다 성공할수있었던 경험과 철학이 더많이 담겨있다 느꼈습니다."
9791130614670,10,창업을 꿈꾸는 사람이 읽어봄직하다. 자기계발서로는 부족할지 몰라도 창업이나 경영을 하는데 있어 좋은 조언이 될 것이다.
9791130614670,4,프랑스 유학한 저자가 한국에서 사업하시다가 실패하고 프랑스에서 사업 성공하는 내용입니다. 원래 안평범하신 분이라 예상과 다른 내용에 실망한 책입니다.
9791130614670,6,사업에 대해 고민하는 길목에서 읽었다.
9791130614670,10,평범하기보다는 특출났던 대한민국 여자가 큰 좌절을 2년만에 털어내고 인연과 운명을 엮어 성공의 결실을 맺은 갚진 이야기
9791130614670,10,"희망도서로 신청한 후 구립 도서관에서 빌려 반 정도 읽었는데, 읽을만한 자기 계발서인 듯 하다. 무엇보다 긍정의 힘을 가지고 다시 일어선 그 의지에 박수를!"
9791130614670,4,자기계발서 치고는..뭔가 참 아쉽다...구입후 꾸역꾸역 읽고재판매 어제하고 왔다. 빌려보시길..
9791130614670,8,전공 그러니까 직업을 여러번 바꾸면서 재기에 성공한 자서전으로 초밥으로 프랑스에서 성공한 사례이다. 개인 사업을 준비하는 사람에게 권해 드리고 싶은 책으로 사업의 수완에 대한 내용이 알차게 기술 되어 있다. 사업준비에서 자기과 맞는 컨설턴트를 만나는 것도 운과 복이라고 평을 내리고 싶다
9791130614670,6,잘읽었습니다
9791157527182,10,기본적인 면접책입니다. 예시가 꽤있습니다.
9791157527182,10,짧은 영어로 최대한 길게 답변할 수 있는 모범 답안을 참고해서 요령껏 대처해야겠군요
9791157527182,10,돌발 질문에 당황할 것 같다면 기본적인 내용이라도 확실히 대비하는 게 최선이겠네요
9791157527182,10,영어면접을 생각하면 너무 부담스러웠고 저절로 긴장이 되었어요. 하지만 이젠 이 한권으로 해결할 수 있겠네요. 예상 질문이 참 다양합니다. 영어 면접 전에 필수적으로 읽어야겠네요.
9791157527182,6,영어면접을 잘 볼 수 있는 노하우를 알 수 있다고 봅니다.
9791130605654,4,"미토코몬이라는 드라마 일본어 공부에 좋겠음--찾아보자! 만사에 신 상정하는 일본식 만신론, 일상 가다듬는 데 도움 된다. ｀상담은 에너지 도둑｀설에 공감하고, 명예와 돈은 따로 가야한다는 것도 진리라고 봄. 굽신거리면서 맘은 없는 친절 범람하는데, 당당함도 서비스라는 말/인식 널리 확산되길!"
9791130605654,4,기도하면 됨..ㅋㅋㅋ
9791130605654,2,그냥 긍정적인 생각을 가지라는 말이에요. 정말 내용 없음.
9791130605654,10,돈의 흐름을 만드는 부자들은 어떻게 관계를 유지하고 만들어가는지 궁금해지네요. 사람과 돈을 모으는 방법에 대해 알수있어 좋을것같아요.
9791130605654,10,신이라니. 과연 신의 나라 일본다운 발상이라 생각하면서도 내 자신의 삶을 되돌아 보게 된다. 나는 뭘 잘못해서 돈때문에 힘들까 하는... 일본 제일의 갑부가 들려주는 사람과 돈의 이야기를 듣고 싶다면 강추!
9791130605654,10,부자들의인간관계에는먼가다른무언가있을것같아요
9791130605654,8,사람과 돈을 함께 끌어들일 수 있는 방법이 있다니 정말 궁금하네요.
9791130605654,10,인간관계는 언제나 중요한 것이겠지요.
9791130605654,10,부자의 인간관계에는 뭔가 특별한 것이 있을까요?
9791130605654,10,부자가 되길 원하는가? 일단 이책을 읽어보시라!
9791130605654,8,"돈을 좋아한다고 말하면 어딘가 떳떳하지 못한 것 같지만, 돈 없이 인간관계만 좋아도 문제가 있다는 지적에 이젠 떳떳해지기로 했다!"
9791130605654,10,인관관계의 중요성
9791130605654,10,돈 보다 인간관계를 어떻게 다루는지가 부자가 되는 지름길
9791130605654,8,돈은 무작정 아무나 버는 것은 아닌 것 같군요. 돈을 버는 데에도 아는 것이 힘인 듯하네요
9791130605654,10,"정말 돈때문에 힘든데, 그런 저에게 딱 맞는 책이네요"
9791130605654,10,지금을 살아가는 사람들에게 돈이란 중요한 가치가 아닌가 싶은데요 돈의 흐름이 무엇인지 알려 줄 수 있는 책이라고 생각이 듭니다
9791130605654,10,돈이 좋아하는 사람이라 매우 흥미로은 책입니다.
9791130605654,10,인사가 만사다. 라는 말이 생각난다. 돈에도 적용되는 논리.
9791130605654,10,인간관계와 돈과의 결합 다시 생각 해 볼 수 있는 책
9791130605654,8,돈과 사람을 함께 끌어 당길 수 있는 방법이라니 흥미롭네요.두가지는 상반된거라 생각했는데 역시 부자가 된 사람은 사고의 흐름이 다르네요.
9791130605654,10,좋아요
9791130605654,10,"돈을 모으게 하는 부자의 인간관계는 어떤 것인지, 돈이 좋아하는 사람이 되기를 바라며 노력해야겠어요."
9791130605654,10,부자가 되고 싶어요 ㅎㅎ
9791130605654,8,부자의 인간관계? 부자들의 인맥은 전문성을 갖춘 사람들과 자신의 부를 위해 필요한 사람들과의 인간관계가 많을듯 하다. 서로 모이고 모여 정보를 나누고 필요에 의해 모인 사람들. 무엇을 가르쳐 주는 책일지 궁금하다.
9791130605654,10,돈을 모을 수 있는 방법을 알려주는 책인가요? 그럼 당장 구매하고 싶군요.
9791130605654,10,인간관계와 부자의 연관성이 무엇인지에 대해 명쾌한 답을 제시한 책이라고 생각합니다
9791130605654,8,인간관계의 중요성을 아무리 강조해도 지나치지 않죠. ｀부자의 인간관계｀라니 그들은 어떤 인간관계를 만들어가고 있는지 배워보고 싶네요.
9791130605654,10,돈 문제에 있어서 인간관계의 중요성을 알려주는 책
9791130605654,8,매일 경제신문을 읽어 경제의 흐름에 빠삭했다는 한 유명한 부자의 일화가 떠오른다. 부자가 되려면 그와 같은 무언가 특별한 점이 필요하지 않을까?
9791130605654,10,아둥바둥 돈을 모으는 것이 아닌 돈이 모이게 하는 부자. 사람을 모이게 하는 능력. 이렇게 될 수 있다면 정말 좋겠네요.
9791130605654,10,｀사람｀과 ｀돈｀을 모두 끌어당기는 50가지 법칙에 대해서 저도 잘 알고 싶습니다.
9791130605654,10,왜 부자가 되었는지 새로운 시각으로 만나볼 수 있네요. 사람을 끌어당기는 돈의 힘. 부자의 능력 기대되네요.
9791130605654,10,인간관계를 잘 하는 사람이 돈과의 관계에서도 승리할 수 있따
9791130605654,8,사이토 히토리... 좋아하는 사람인데 책이 나와 좋네요. ^^
9791130605654,8,"사람과 돈, 그 둘 사이의 핵심"
9788993834246,10,날마다 행복일기를 쓰다보니 운동은 좀 더 능동적으로 하는 자세가 필요하다는 것을 알게 되었습니다.그래서 수영을 등록하고 4개월째 꾸준히 하고 있습니다. 운동을 끔찍히 싫어하는 내가 이만큼 꾸준히 운동을 이어하고 있다는 것이 기적입니다. 날마다 쓰는 행복일기 덕분입니다.
9788993834246,8,일기잘쓰고있습니다
9788993834246,10,12월 1일부터 다시 행복일기를 쓰고 있어요. 행복은 과거속에서 뒤적이는 것이 아닌 현재와 앞으로의 삶에서 추구해야할 그 무엇이라고나 할까요?
9788935703814,2,시크릿류 책 중에서도 레벨이 낮은 책. 기독교 문화권에서 얼마나 명상의 본질을 왜곡해서 생각하는지 알 수 있다. 자기 욕구 망상이 명상은 아니다. 근래 약팔이들이 신비주의적 색채를 강화하기 위해 명상을 가져다 붙이는데 미래의 욕구 충족을 위한 명상이라니 코미디가 따로 없다.
9788935703814,8,사기전에  망설였으나  2020년 되서야  샀다. 바딤젤란드의 리얼리티트랜서핑 과  옮긴이가 같아서 박인수씨 성함 적힌거 보구믿고샀다.  난확실히 리얼리티 트랜서핑 부류지만  가끔은 이런 내용도 봐 주면서 뇌를 물렁하게 만들어야  갇히지 않는다고 본다.    박인수님~~!! 항상 감사합니다.
9788935703814,10,정신세계사 책 중 이균형 역자님의 책과 박인수 역자님의 책은 번역체의 어색함이 전혀 없습니다. 역자님한테 반하기는 이 두 분이 처음입니다. 박인수님과 이균형님이 번역하신 책들을 찾아서 읽고 싶을 정도에요. 작가도 물론 훌륭하구요 ^^
9788935703814,10,˝지금 네 모습은 네가 생각해 온 모든 것의 결과˝라는 석가의 가르침을 떠올리게 된다.
