ISBN13,rating,review
9791156644590,10,책 설명과 예제가 친절해서 좋습니다. 단점이라면 대학교재용으로 나와서 연습문제답은 안 주어집니다. 전 독학용으로 사서 문제는 안풀었는데 사기 전 참고하시기 바랍니다.
9788969651976,10,"한국사능력검정시험 준비를 마무리하면서 이 책을 사용했는데, 필살기노트와 시대공략편 문제가 정말 좋습니다. 특히 필살기노트가 진짜 마무리할 때 좋습니다^^"
9788969651976,10,"2주 단기로 합격하고 싶어서 샀는데 일주일 단기로도 가능할 것 같은 책입니다,,,! 무료인강이랑 쿠폰번호도 제공 받을 수 있어서 한국사 관련 자료로는 최고인 것 같아요! 2021년 한능검 심화를 공부하신다면 꼭꼭 필요한 책이라고 생각합니다! 꼭 합격할게요 추천드립니다!!"
9788969651976,10,해커스 시험 준비하는데 큰도움이 되었어요
9788969651976,10,시대별 / 회차별 문제가 다 있어 머릿속 내용을 다시 한번 정리하기에 굉장히 좋습니다. 강의도 깔끔합니다.
9788969651976,10,한국사공부는 정말 오랫만에 하는데 문제풀이 위주라서 지루하지 않게 공부할 수 있어서 좋았습니다!필기노트로 부족한 개념을 보충하고 문제에 자주 나오는 그림들을 공부 할 수 있어 실전에 대비할 수 있었습니다
9788969651976,10,무료 인강수업도 같이 들을 수 있고 기출문제도 등급별로 포함되어 있어서 시험대비 단기합격할 때 도움이 많이 될 것같아요. 체계적으로 문제풀이 대비할 수 있어서 실전대비에 충분하다고 생각합니다.
9788969651976,10,한국사능력검정시험 이번에 해커스 교재를 통해서 공부 할 예정입니다. 정말 기초부터 심화 개념까지 기출문제집 해설안에 잘 설명이 되어 있어서 좋아요. 그리고 무료인강까지 제공되니깐 문제 풀다가 모르는 내용이 나오면 즉시 인강을 볼 수 있으니깐 효과적으로 공부할 수 있을것 같습니다 .
9788969651976,10,최신 11회분 기출에 추가자료까지 알찬 교재입니다! 한국사능력검정 개편 후 두번이나 불합격했는데 이 교재로 원하는 급수 취득할 수 있을 것같은 자신감이 생깁니다! 해커스 한능검 기출문제집으로 준비하세요!삭제
9788969651976,10,2021년 한능검 시험을 위한 최적의 기출문제집이라고 생각한다.단순히 기출   해설로 구성된 게 아니라 10회분 중 5회분을 시대별로 재구성한 책이다.시대별로 모아서 풀어봄으로써 반복되는 선지와 나의 약점을 파악할 수 있다.올해 한능검 대비하시는 분들에게 가장 적합하지 않을까 생각된다.
9788969651976,10,"2021년에 시행되는 한국사 검정능력시험을 대비하려고 알아보던 중 해커스 한능검 기출문제집 심화책을 알게 되었습니다. 한능검은 사료가 중요한데 기출사료 모음집, 무료 해설강의, 최빈출 모의고사, 합격생 필살기노트까지 제공한다니 이 책으로 공부하면 합격 아니면 답이 없다고 생각합니다-!"
9788969651976,10,"점점 한국사 시험이 어려워지고, 이제는 겉만 훑고 넘어가는 식이 아니라 깊고 오래 공부해야 딸 수 있을 것 같다. 그런 점에서 기출문제만 따로 모은 문제집이 있다는 점이 유형들을 반복적으로 볼 수 있어서 좋다. 이 책 시리즈만 가지고도 한국사 합격하길 원한다!"
9788969651976,10,2021년에는 해커스로 한국사를 제대로 준비할 수 있을 거 같다는 생각이 들도록 체계적으로 구성이 되어서 무료인강을 같이 보며 암기력 강화에 뒷받침이 되어준 교재라는 생각이 들어서 더욱더 한국사공부에 집중도가 많이 높아지는 효과를 나타낼 거 같은 기대가 되는 책이라 생각한다.
9788969651976,10,한국사 시험 변경되고 한번도 치지 않았습니다. 자격증 취득한지 이년이 지나 다시 따려고 하는데 바꼈다고 하니 막막해서 시작을 못하고 있었습니다. 하지만 해커스의 1주 공략 실전문제풀이 이번 도서를 통해 다시 시작해볼 용기가 생겼습니다!! 이책으로 합격하고싶어요!
9788969651976,10,한국사능력검정시험 이번에 해커스 교재를 통해서 공부 할 예정입니다. 정말 기초부터 심화 개념까지 기출문제집 해설안에 잘 설명이 되어 있어서 좋아요. 그리고 무료인강까지 제공되니깐 문제 풀다가 모르는 내용이 나오면 즉시 인강을 볼 수 있으니깐 효과적으로 공부할 수 있을것 같습니다 .
9791165470579,10,문제가 많이 수록되어있어 반복이 되어 좋아요. 또 문제마다 해설이 자세히 설명되어있어 혼자 공부하기에도 어렵지 않고 문제마다 기본서 페이지가 명시되어있어 부족한 개념을 다시찾아보기 쉽게 되어있어요.
9791165470579,10,신용한 행정학 이론에 이어 기출문제집도 구매했습니다.책이 전체적으로 깔끔하고 선생님의 강의도 좋아서 신용한 선생님의 시리즈들은 다 구매해도 좋을 것 같습니다.^^
9791165470579,10,우선 2020년 행정학 지방 95 국가 90 받았습니다. 감사합니다. 하지만 다른 부분에서 부족하여 다시 도전하게 되었습니다. 좋은 강의로 항상 힘내주셔서 감사하고 언제나 응원합니다
9791165231613,6,저희 돈없어요 제발
9788969652096,10,"현존하는 다양한 출판사의 지사트 대비서가 많아 무엇을 선택해야 할 지 몰랐는데검색 후 잘 찾아 보니 패키지 구성도 괜찮아 보이고, 무엇보다 해커스에서 출판되는 도서라 믿음이 가고 기대가 됩니다. 물론 끝까지 다 학습 후 학습 평부터 입사 과정까지 후기도 올릴 수 있기를 기대합니다."
9788969652096,10,매년 베스트셀러엔 이유가 있겠죠 ㅎㅎ 인적성 준비하는데 누구나 실전모의고사를 풀어야하는데 해커스책 이용 안하는사람이없죠 실전모의고사라고 달랑 문제지만있는것도 아니고 파트 1 집중공략유형을 통해서 다시한번 문제유형을 상기시킬수있는기회도 있어요 그래서 이번책이 너무 기대됩니당
9791164542352,10,"책 배송은 빨랐는데 간혹가다가 페이지 아래 모서리가 접혀있어서 봤더니 책 만들때 종이가 제대로 안잘렸나봐요, 그런거 몇 장은 빼고는 좋아요 ~ 내용도 유익하고 책 나눠서 들고다니니까 가벼워요"
9791164542352,10,분철서비스 포함해서 주문했어요! 전산회계1급도 분철로 주문했는데 그 때처럼 완벽하게 분철을 해주셔서 너무 감사드립니다!!! 공부 열심히 해서 붙을게요^^ 참고로 세무회계는 해커스.....!!!!!ㅎㅎㅎ
9791164542352,10,내용이 정말 알차게 구성되어있어요 안에 있는 모든 문제는 실제 기출문제들로만 이루어져 있다는 점이 정말 맘에 쏙들었구요 무료강의의 선생님도 유쾌하고 재밌으셨어요 !! 미니북도 대중교통에서 활용도가 높고요 ㅎㅎ 추천합니다!!
9791164542352,10,별 다섯개에요 정말~~혼자 독학으로 어떻게 자격증 따나 걱정이 많았었는데책 받아보고 걱정이 사라졌어요~기출문제에 다양한 인강까지~혼자 독학하는 사람들한테 딱 인 첵이네요 ㅎ
9791164542352,10,혼자 공부하는 사람들에게 최적합한 책이 아닌가싶어요~~저도 공부해봐서 알지만 회계만큼 답답하고 이해하기 어려운 책은 없었거든요.근데 요건 이해하기 편해서 너무 좋아요
9791164542352,10,해커스 전산세무 2급 교재는 독학하기 좋은 것 같아요. 교재 내 무료강의도 포함되어 있는데 이 강의가 꽤 퀄리티가 높은 편인데다가 교재 자체에 핵심내용이 표시되어 있어서 한 번 더 확인하고 넘어갈 수 있어서 좋습니다. 분권도 가능하고요! 책이 공부하는 사람을 배려해주는 느낌이 커서 좋아요.
9791164542352,10,"혼자 공부하는 사람들에게 정말 좋을 것 같은 책 동영상 강의도 무료 제공이고 학습 플래너, 기출 문제까지 아주 구성이 탄탄하고 알차다 워낙 내용이 꼼꼼하고 실해서 다른 문제집 볼 것 없이 이것만 봐도 충분할 것 같다 제일 마음에 드는 부분은 시험 전 보고 들어갈 수 있는 요약서 너무 알차다"
9791164542352,10,최근 시험들을 바탕으로 출제 비중을 알려주니 중요한 부분에 더 집중할 수 있어요 함께 제공되는 미니북에 핵심 내용이 담겨있어 시험 전에 많은 도움이 될듯합니다
9791164542352,10,"책이 3권으로 나눠져있어 이론과 실기, 기출문제까지 각 파트별로 꼼꼼히 볼 수 있어 좋아요. 해커스 자체에서 주는 자료도 많고, 큐알코드로 시험관련 자료나 실기관련 공부자료, 인강을 연결시켜주어서 혼자공부하는 사람들에게도 도움이 많이 됩니다! :D"
9791136009517,10,작년에도 풀었었는데 발전소 통합으로 구성되어있어서 각 기업에 맞게 연습용으로 풀기 좋았어요!Psat형 피듈형 모듈형 유형이 골고루 있고 에듀윌 봉모는 매번 고퀄이라 이번에도 기대가 됩니다
9791136009517,10,"5대 발전공기업을 최신 기출경향을 반영한 모의고사로 준비할 수 있어서 정밀 기대됩니다!또한 PSAT, 모듈, 피듈형 별로 유형파악도 가능할 수 있어서 많은 도움이 될 것 같습니다!"
9791136009517,10,발전소 NCS출제경향을 가장 완벽하게 반영한 봉투모의고사라고 생각해요. 매번 에듀윌 봉모 시리즈로 NCS연습을 하는데 문제 퀄리티도 좋고 실제 시험유형과 유사하게 문제가 구성되어 필기시험 연습을 하는데 가장 도움이 되는 봉모입니다.
9791136009517,10,"발전회사에서 주로 출제되는 최신 유형문제로 2021년 채용을 빈틈없이 준비할 수 있는 교재가 될 것 같아요! NCS와 함께 전공시험도 함께 대비를 할 수 있고, 무료 해설강의, 상세한 해설집, 채점서비스가 제공되는 덕분에 취약한 부분을 빠르게 파악해 약점대비도 가능하다고 생각해요."
9791136009517,10,최신 출제경향 및 난이도가 반영된 피듈형/모듈형 봉모로 준비끝.에듀윌만 믿고 가겠습니다!
9791136009517,10,"한수원과 더불어 발전공기업 준비를 한권으로 할 수 있어서 좋습니다! 에듀윌 문제 퀄리티는 남다른 것 같아요 코레일도 에듀윌 개정판 구매해 준비하고 있는데, 구성에 놀라고 퀄리티에 놀랍니다 ㅎㅎ 발전공기업도 에듀윌로 준비해야겠네요~~"
9791136009517,10,봉투모의고사 구매할때는 항상 에듀윌 먼저 구입하게 되는데 취준생 입장에서 너무 기대됩니다!
9791136009517,10,너무 기대되는 책이에요 특히 5대 발전사를 모두 준비할 수 있다는게 메리트가 큰 것 같아요! 작년 준비하면서 힘들었는데 그나마 이걸로는 올해 대비를 잘 할 수 있을 것 같아서 마음에 드네요
9791136009517,10,"2021 최신판! 2021 에듀윌 한국수력원자력 5대 발전회사 NCS 전공 봉투모의고사 4 2회 ㄴㅓ무나 기대됩니다!! :)평소 에너지 공기업 및 발전사에 관심이 있는 취준생이라,2021 최신판! 2021 에듀윌 한수원 및 5대 발전사 ncs 전공 봉투모의고사는 반드시 ! 꼭! 필수적으로 공부해야 한다고 생각해요!"
9791136009517,10,기본으로 모의고사 4회에 타 교재에선 찾기 힘든 화학 전공 모의고사가 2회분이 포함되어 관심있는 한수원 및 남동발전 지원에 큰 도움이 됩니다!
9791136009517,10,"공기업 인턴을 하면서 발전사와 한수원에 꼭 가고 싶다고 생각했는데, NCS 출제경향을 완벽 반영하여 실전 풀이를 대비할 수 있는 이 책으로 꼭 합격하고 싶어요!"
9791136009517,10,벌써 2021년 봉투모의고사가 나와서 너무 도움이 될 것 같아요. 시험대비용으로 딱이예요! 취준생에게는 하루 빨리 새로운 문제를 풀어보는게 정말 정말 도움이 되는데 이번 봉모가 큰 도움이 될 것 같아요:) 에듀윌 문제 퀄리티가 좋아서 얼른 주문해서 풀어봐야겠어요
9791136009517,10,한수원 뿐만 아니고 5대 발전회사까지 준비하는 학생으로서 너무 든든한 교재네요. 정말 기대됩니다. 많은 공기업 취준생들에게 큰 도움이 될 것 같아요.
9791136009517,10,"ncs전공 준비에서 봉투모의고사로 실력을 가늠하고 계획하는 일은 필수입니다. 모의고사 구성 역시 psat, 피듈형, 모듈형이 들어있고, 전공/상식 까지 챙길 수 있으며 유용하게 사용할 수 있는 한국사 빈출키워드 노트, 핵심채용정보 분석 까지 있어서 유형을 익히고 감을 익히는데 아주 좋습니다."
9791136009517,10,"한수원과 5대 발전회사를 한번에 대비할수 있어 공기업 취준생들에게 도움이 되는 교재라고 생각합니다. PSAT, 모듈, 피듈형 등 다양한 NCS 유형을 학습할수 있다는 점도 굉장히 유용하다고 생각합니다."
9791190680035,10,문제들 옆에 준호쌤 코멘트들이 정말 큰 위로가 되어요.자기계발서 읽는 것 같아요. ㅋㅋ
9791164544820,10,프린트로 공부하다가 넘어왔는데 책편집이 너무 잘되어있어요! 스프링 추천!!
9791164544820,10,정말 좋습니다!
9791164544820,10,스프링제본으로 구매했는데 탁월한 선택한 거 같아서 너무 좋네요~ㅎㅎㅎ 해커스 이중석 교수님 수강하시는거 보고 정말 최고라 생각이 듭니다~ㅎㅎ
9791164544820,10,이중석 선생님 강의를 작년 껄로 듣고 있는데 프린물 인쇄해서 거기다 필기했는데 마침 그게 책으로 나와서 샀어요 ㅎㅎ 필기 안하고 복습 용으로만 사용할려고 산 건데 구성도 프린물이랑 차이 없고 깔끔하니 너무 좋아요. 복습용으로 추천합니다. 강의 작년꺼 들어보시길 추천합니다.ㅎㅎㅎ
9791161980928,10,"ncs psat형에 대한 배경지식이 전무해서 구매하게 되었습니다. 강의도 같이 들으면서 공부하면 psat에 대해 부족함 없이 대비할 수 있을 것 같아요,"
9791161980928,10,수리영역 풀이 시간을 줄이고자 구매했습니다. 이벤트로 제공되는 신헌 선생님 강의를 듣고 유익해서 책도 구매하게 되었어요. 아직 제대로 시작하기 전이지만 책 구성이 좋은 것 같습니다.
9791161980928,10,"가끔 예제나 예시가 없어서 이해가 잘 되지 않는 개념 설명도 있지만, 전체적으로 개념과 스킬이 많이 담겨 있어서 선택적으로 잘 익혀서 응용하면 좋을 것 같습니다. 해설도 친절해서 틀린 문제를 이해하는 데 도움이 많이 됩니다."
9791161980928,10,NCS 수리영역에 대한 기초가 없어 구매했습니다. 사칙연산부터 표 등 훨씬 쉽게 문제에 접근할 수 있는 방법이 제시되어 있어 기본 잡기 좋은 책 같습니다
9791161980928,10,"Ncs 수리영역을 너무 못해서 이번 기회에 샀는데, 인강 이도 같이 들으면서 공부할 수 있어서 좋은 것 같습니다! 특히 ncs 수리 1타 강사님 수업이라 더더욱 도움이 많이 될것 같아요! 열공하겠습니다! 감사합니다!"
9791161980928,10,"psat형을 다루는데 있어 기본기가 없다면, 시작할 때 한번즘 꼭 풀어보면 좋을것 같습니다 :)"
9791161980928,10,NCS수리능력&자원관리능력&문제해결능력 3가지 모든 영역을 제대로 마스터할 수 있도록 다양한 문제들을 접해볼 수 있어서 변별벽을 기르는데 안성맞춤이라 생각합니다!
9791161980928,10,역시 유명한 강사님은 다르네용ㅋㅋㅋㅋ 책에 설명도 자세하고 문제도 제법 있어서 인강과 병행하기에 좋아요 굿굿!!
9791161980928,10,"ncs 수리 자료해석 파트가 너무 약해서 기본서로 구매해서 공부중인데 내용 정리도 잘 되어있고, 시험에 자주 나오는 부분도 따로 정리되어 있어서 집중적으로 공부하기에 좋은 것 같아요. 열공하겠습니다!"
9791161980928,10,수리자료해석을 처음 공부하는 취린이도 쉽게 공부할 수 있을만큼 좋은 구성이었습니다!
9791161980928,10,ncs 수리 자료해석 처음 접하시는 분들께 정말 많은 도움이 되는 책입니다!게다가 강의 까지 병행하시면 많은 도움이 될 것 같습니다!
9791161980928,10,"NCS 수리 자료해석 기본서 중 베스트셀러이고, 신헌 선생님 설명을 잘 해주셔서 이번에도 믿고 구매 했습니다.저도 수리능력과 자료해석능력의 고수가 되고 싶습니다!!!"
9791161980928,10,이전 개정판도 한번 풀어본적 있는데 신헌 선생님 강의랑 함께 들으면서 풀면 귀에 쏙쏙들어옵니다! 2020개정판도 구매하여 이번 강의도 수강할 수 있어 너무 좋습니다!
9791161980928,8,ncs 자료해석 기본서 중 단연 최고가 아닐까 싶습니다. 너무나도 유명한 신헌 선생님의 강의와 함께 이 책으로 공부를 한다면 저도 ncs자료해석 고수가 될 수 있을것 같아요. 열심히 공부할게요! 취뽀하겠습니다!!
9791161980928,10,기본계산부터 응용까지 빠르게 문제를 풀수있도록 연습하고 있습니다 책구성도 좋아서 혼자공부하기에도 좋습니다. 전 강의를 들었었는데  신헌 선생님께서 유쾌하고 쉽게 가르쳐주셔서 수리에대한 거리도 조금이나마 좁힐 수 있었습니다.
9791161980928,10,처음 NCS 시작할때 수리가 되게 어렵게 느껴졌는데 신헌샘 교재하고 강의듣고 큰 도움됐습니다.위포트 기본서로 처음 공부하시다가 수리를 좀더 부족하다고 생각드시는분들에게 강력추천합니다교재가 깔끔하고 NCS 수리는 이 한권으로도 충분하다고 기대합니다!!취뽀합시다!!
9791136009036,10,이번 특별판도 100% 새문항이라니 구매하지 않을 수가 없네요.최신기출문제들로 계속 변화해가는 NCS흐름에 잘 맞춰볼 수 있을 것 같아 구매해보려합니다.
9791136009036,10,서교공이 제일 취업하고 싶은 기업인데이번에 에듀윌 봉모로 열심히 준비해보려고요자격증이랑 ncs 준비할때 늘 구매하는 책이라 믿고 이번에도 구매하려 합니다 :)실전감각 익히는데 이만한게 없는 것 같아요
9791136009036,10,10월에 시행된 서교공 기출문제가 반영되어 있어 정말 기대가 됩니다!! 그리고 모의고사도 무려 3회분이나 있어 실전감각 유지하는 데 큰 도움이 되리라 생각합니다.
9791136009036,10,공사의 기출을 복원하여 출제경향에 맞게 만든 봉투모의고사라 더 방향성이 알맞을것 같아 기대가 됩니다. 구성이 알차 실제 시험을 치듯 실전 감각을 기를 수 있겠네요.
9791186608890,10,"같이 공부하는 친구가 추천해주고, 카페에서 쪽지시험 처럼 무료로 뽑을수 있다고 하기에 주문했어요 핸디북으로 편하게 보려합니다 ㅎ"
9791186608890,10,보기 편하고 사이즈도 들고다니기 좋습니다
9791186608890,10,책이 아담하고 표지가 예쁘네요^^ 빈출순이고 공부하기에 부담없이 손에 잡히는 느낌이라 아주 마음에 들어요!
9791186608890,10,"공시는 매일매일 반복해서 해야할게 많아서 함들더라구요. ㅠ 한자를 의미있게 분량두자니 부담스럽고, 아예포기하자니 까막눈으로는 찍어서 맞출 확률조차도 없게되니 불안하구요. 휴대성과 분량이 좋아서 식사시간에 짬짬이 할 수 있어서 딱 좋아요!!!"
9791186608890,10,한자는 마왕한자로 공부하는게 좋은 거 같아서 구매했습니다!
9791186608890,10,공시생들 사이에 유명하길래 구매했습니다! 테스트지도 받을 수 있다고하니 기대되네요 열심히 공부해보겠습니다~!
9791186608890,10,이번에 처음으로 마왕한자 구매해서 보려구요 ! 책이 공부하기 좋다고 많이 들어서 정말 기대되네요 열심히 해야겠어요! ㅎㅎ
9791186608890,10,다들 한자는 이거 쓴다길래 공시준비하는 동생 사줬습니다.
9791125490807,2,표지에는 대문짝만하게 7회분이라고 써놓고 그 옆에 정말 작게 ncs 4회 + 온라인 모의고사 2회라고 써놓음 ㅋㅋㅋㅋㅋ 그래서 온라인 모의고사 응시하려고 하니  300명 선착순이라고 함 ㅋㅋㅋㅋ 대체 왜 이런식으로 책을 파시는지 모르겠네요。。。 돈이 정말 아까워요 ㅠㅠ 제발 양심 좀 챙기세요
9791125490807,8,모의고사를 많이 풀어볼 수 있겠네요
9791190020305,10,"인터넷에 모고 너무 좋다고 소문이 자자해서 구매했는데 너무 맘에 들어요ㅎㅎ 난이도도 딱 좋고, 성적 순위 실시간 서비스도 너무 마음에 들어요. 지방직 대비로 2 나오나요?? 그럼 2도 구매할거에요 ㅎㅎ"
9791190020305,10,"영어 모고 추천 많이 받고 구매했습니다:) 기훈쌤 쎄듀라면 믿고 살 수 있어요!!! 문제랑 해설지 퀄리티, 오엠알 서비스 등등....안살이유가 없네요! 열심히 풀고 꼭 합격하겠습니다!"
9791190020305,10,영어는 김기훈 마지막까지 믿고 가겠습니다
9791190020305,10,"문제의 퀄리티도 굉장히 좋고, QR코드로 인한 성적비교도 매우 좋은 것 같습니다. 동형모의고사로서 추천합니다!"
9791161011202,10,기술직렬이라100점방지용문제까지암기해야되나싶었는데사부님카페에커리큘럼을보고고민하지않고단원별800제구매했습니다많이알려고하다대충회독하는것보다영혼있이800제공부하는것이옳은방법이라생각합니다해설이바로아래에있는책은안좋아하는데왼쪽은문제오른쪽은해설이있어보기편합니다
9791161011202,10,"600제는 적고, 1200제는 많은 것 같아서 그 중간인 800제를 골랐습니다."
9791196395773,10,수학의 정석 같은 느낌이랄까....
9791196395773,10,Sqld를 준비하는 분들에게 반드시 필요한 책이네요~!
9791136007773,10,저번 하반기 SKCT응시할때 SK그룹에서 에듀윌 문제집을 참고한다는 느낌을 많이 받았습니다.  비록 면접에서 아쉽게 탈락했지만 이번에도 에듀윌 문제집과 함께 인적성전형은 무난하게 통과하리라 믿습니다!
9791136007773,10,SK는 수시채용이라 구비해놓고 지속적으로 연습하는 게 중요한 것 같아요. 대기업마다 출제 유형이나 자주 출제되는 분야가 조금씩 다른데 SK인적성 맞춤 대비서라서 준비하는 데에 용이할 것 같습니다. 최신 기출 유형 분석으로 문제에 활용할 수 있고 특강도 들을 수 있어 취준생에 딱입니다.
9791136007773,10,하반기 SKCT 에듀윌 너무 도움됬어요! 특히 실행역량파트가 지문 길이가 비슷해서 실전에서 당황하지 않고 시간 내에 풀 수 있었어요! 내년 상반기 재도전하여 에듀윌로 SK 합격하고 싶어요!!!
9791136007773,10,각 영역별 세부적인 유형 분석이 돼 있어서 개인별 약점 파악 및 보완에 도움을 받을 수 있어요또한 실전동형 모의고사와 하반기 기출복원에서 특히 실전에 대한 감을 익힐 수 있을 것 같아 선택합니다.
9791136007773,10,"난의도가 있기로 소문난 SK그룹이지만, 에듀윌 교재로 대비하면 꼼꼼히 대비할 수 있을 것 같아 선택합니다. 어려운 시국이지만 에듀윌과 취뽀에 성공하고 싶습니다."
9791136007773,10,대기업 인적성 검사중에서도 최고의 난이도를 자랑하는 SKCT를 준비하기 위해서 기출유형이 체계적으로 정리되어 있다는 점에서 2021 에듀윌 SKCT 도서가 기대됩니다. 대기업 인적성 검사는 에듀윌이 확실히 체계적이고 자세하게 나와 있는 것 같습니다.
9791136007995,10,기출문제와 예상문제를 한번에 볼 수 있어서 좋습니다. 구성도 깔끔하게 잘 되어 있구요.
9791136007995,10,단원별로 정리되어 있어서 부족한 파트가 어딘지 알 수 있는 장점을 가진 책입니다
9791136007995,10,해설이 진짜 좋아요플러스 이론 해설 완전 꿀팁입니다
9791136007995,10,모의고사도 수록되어있습니다.
9791136007995,10,모고가 5회분이나 되어 만족스럽다.
9791136007995,10,단원별로 정리되어 있어 공부하기 좋아요
9791136007995,10,"한국사 기출문제를 단원별로 풀 수 있고, 실전동형 모의고사까지 풀 수 있는 좋은 교재입니다~"
9791136007995,10,한국사는 꼭 단원별로 푸시는걸 추천드려요 ㅎㅎㅎ 강추!
9791136007995,10,단원별기출예상문제집은 지루함이 없이 새로운 문제를 풀 수있어서 가장 좋았어요.
9791136007995,10,"단원별 기출, 예상문제, 동형모의고사로 다양한 유형의 문제를 쉽게 열습할 수 있고 매우 효율적으로 공부가 가능하여 편리합니다!  책 구성도 깔끔해 보기 편해요!! :)"
9791136007995,10,교재구성이 깔끔하고 좋습니다.
