ISBN13,rating,review
9791157685240,4,"독해책으로는 너무 성의없고 문법책으로는 너무 엉성하다나름 꼼꼼하게 책을 고르는 편인데 이번엔 책표지와 목차, 나름 좋은 후기들에 속아버렸다역시 외국어 관련서적은 서점에서 직접 보고 고르지 않으면 꼭 후회하게 된다"
9791157685240,10,저는 영어 좀 하는 사람이고 영어관련 일을 해요.  악플에 가까운 리뷰까지 보고서도 책을 구매한 이유는 다른 사람의 시각으로 본 영어 문장들과 문법은 귀한 의견교환이 될 수 있어서예요. 제목에 낚인들 손해를 보면 얼마를 본다고. 결과는 다행히 참신합니다. 물론 일반적인 문법내용도 있지만 그
9791157685240,10,처음 책을 펼쳐볼때 제목에 너무 혹했나 싶어서 별 하나도 아깝다 생각했는데 그래도 돈 주고 산 책이니까 돈이 아까워서 읽는다는 심정으로 읽디보니 데목 정도까진 아니더라도 도움이 많이 되네요 ^^
9791157685240,2,제목하고 너무 다르다...별5개 준 리뷰어들이 회사 직원들은 아닌가 의심하게 됨..평생에 산 책중에 제일 후회하는 책. 이거 사실 분들 서점에서 한번 보고 사세요 아님 지금 가지고 계신 문법책도 이거보단 나을거에요
9791157685240,4,설명없이 무슨 수능 영어 문제 오답 푸는 것 처럼 그냥 이렇게 하면 된다~ ㅖ문하나 주고 끝이에요 그냥 제대로 된 문법 책을 사는 게 백번 나아요
9791157685240,2,시판되는 문법책과 다른점이 하나도 없으니 집에 문법책이 한권이라도 있으신분들은 그냥 있는거 열심히 보세요
9791157685240,10,단순히 수험생책이 아님
9791157685240,4,"이러한패턴은 대부분 이런식으로 해석이되므로 리딩패턴을 익히면 유용하다 라는 책인줄알았는데, 거창한 contents들에비해 내용이 부실합니다. 문법에대한간략한설명과 예문, 그리고 지문이 실려있는형태로 문법 정리에는 도움이 되겠지만 패턴을 익히긴 어려운책입니다"
9791157685240,2,해석이 절대적으로 필요한 책
9791157685240,4,본인이 영어와 친숙하지 않다 생각하시는 분들이라면 이 책은 피하시는게.. 친절한책은 아닙니다
9791157685240,4,"미리보기를 보면 본인이 연구한 좀 더 활용성 높은, 각각의 문형에 대한 해석 팁을 줄 것 같은데-마법을 기대한 것도 아니고 문형별 팁! 말이다- 그런데 그냥 똑같이 영어 문법을 좀 더 간결하게 정리했을 뿐이다. 그야말로 패턴을 정리만 해놨다.아주 잘 정리만 한 책이다."
9791157685240,10,영어기초를 뗐다면 문장패턴을 총정리해주는 이 책이 안성맞춤일 듯하다. 세상에 해석하지 않고 영문을 읽는 왕도가 있을 거라 기대하고 이 책을 골랐다면 기초부터 다시 공부하시길. 오히려 성실한 공부를 권하는 책이다.
9791157685240,4,영어 공부에 손을 놓고 지내는 죄책감 같은 걸 덜기 위해서 정기적으로 영어책을 사게 되는데 이번에는 이 책이었네요. 수능 문제집 같은 책이에요. 신박한 책을 원하신다면 이건 아닙니다. 저처럼 영어 잘 못 하고 흥미도 없는 분은 다른 책 보시는 게..
9791157685240,10,평소 궁금했던 내용인데 읽고나니 많은 도움이 되었어요 학습법에 큰 도움을 주는 책입니다 속도가 더디긴 하지만 만족합니다
9791157685240,2,제목에 속았네요. 독창적인 내용 하나도 없어요.해석하지 않고 읽는 법이 어디 있나요? 쥐뿔도 없어요. 거의 사기급.
9791157685240,10,사실 독해 공부를 하려해도 무엇을 읽을 지 정하기 어럽다. 영문이 처음에 쉽다가 점점 어려워 지는 구도가 시작하는 사람들에게 적합한듯하다.
9791157685240,2,"어떤의미에서는 공부에 지름길은 없다는것을 깨닳게 해준 책, 나에겐 그냥 문법책."
9791157685240,2,"매우매우 불친절한 책.제목에 홀려서 산, 매우 후회중인 책.정작 패턴은 120개인데, 내용도 적고 결국 문제집이랑 다를게 없는 책임.영어를 해석하지 않고 읽는 법을 배우고 싶었지 문제집을 사고 싶은게 아니었는데.그와중에 다른 리뷰들은 너무 좋아서 더 의심이 간다.조금 더 찾아보고 살껄."
9791157685240,10,내용이 참 좋네요~ 이 책 일고 영어 독해 실력이 좀 늘었으면 좋겠습니다 제발요~
9791157685240,10,올해 목표 원서 1권 독파하기가 난관에 부딪혀 있던 차에 발견한 보석 같은 책! 이 책을 통달하고 원서를 읽으면 원서 읽기 목표는 달성할 수 있을 듯!
9791157685240,10,졸업했지만 영어를 계속 써야하는 직장인이어서 읽어봤습니다.공부법에 많은 도움 받았습니다
9791157685240,10,"리딩은 스피킹이나 라이팅에 비하면 거저먹기라고 생각했는데, 웬걸, 막상 원서를 읽으려니 여전히 감으로 대충 의미를 때려맞추고 있었다. 수험영어가 타깃이라고는 하지만 이외의 텍스트 읽기에도 폭넓게 적용되는 핵심 문형책으로 참고하기 좋을 것 같다는 사견."
9791157685240,10,저에게 딱 필요한 책입니다. 문법을 잘 정리해주네요. 글의 내용을 이해하는 방법을 잘 제시해주고 있습니다. 영어 공부를 하시는 분에게 한번쯤 개념잡는 책으로 추천하고 싶네요. 속도는 더디지만 열심히 해보겠습니다.
9791157685240,10,영문 내용을 듣기로도 함께 다운로드 해서 들을 수 있어서 좋네요. 배운 만큼 읽기 능력을 기르면서 모든걸 읽게 해놨네요. 근데 구조가 처음에 쉬워도 영문 내용이 만만찮지 않은 레벨인 것 같아요. 열심히 이것만 읽어도 영어 해석 능력이 많이 올라갈 것 같아요. 만족합니다.^^
9791157685240,8,시험 영문을 보긴 하는데 보고 나면 이게 정말 내 실력인지 의문이 자주 듭니다. 실력을 점검하는데 도움이 되었으면 좋겠어요.
9791157685240,10,"수험생으로 도움이 많이 됩니다. 우리는 영어를 해석하지 않고 읽는 법을 이미 알고 습니다. 쉬운 구조, 내가 잘 알고 있는 구조로 된 문장은 해석하지 않고 읽으니까요.모르는 구조를 내것으로 만들어 보면 된다는 것인데, 이 책은 영문법의 전체를 두고 마디마디를 다 다루는 것 같아요."
9791157685240,10,"기초가 약하다고 다시 문법서를 찾는 학습자라면, 이책을 추천하고 싶다. 영문 난이도 올라가는 것이 느껴진다."
9791157685240,2,책 제목처럼 해석없이 구문을 파악할수있는 책이 절대아니네요구매후 읽어보고 솔직히 충격이었습니다기존 문법들의 무성히한 짜집기 편집일뿐이네요바로 반품할려다 그냥 책장에 던져놓았네요 에휴
9791157685240,10,좋은 책이네요
9791157685240,10,많이 읽으려고 하는데 속도가 너무 더디네요. 이 책으로 조금 자신감을 얻을 수 있으면 좋겠네요
9791157685240,10,해석의 고통에서 벗어나 읽기의 즐거움을 선사해줄 책이네요. 강추합니다.
9791157685240,10,"시험을 앞두고 정리하는 차원에서 보면 좋을 것 같다. 아울러, 대부분 초급자의 경우 독해 공부순서를 잘 알지 못하고 중구난방으로공부를 시작하고 정리하기 때문에 효율적인 효과를 낳지 못하는데 난도별로 읽어보며 빈틈을 메꾸는 기분으로 학습을 하는데 도움이 될 것같다. 읽다보면 체계가 눈에 들어온다."
9788953947979,10,"원서지만 밑에 주석이 적절히있어서 읽기에 어렵지않고,표지디자인도 깔끔해서 맘에 들어요.종이질은 두껍지만, 개인적으로 화이트페이퍼보단 크림색(?)또는 미색 종이가 눈의 피로를 덜하게하는것 같아서 좋은데,화이트페이퍼라서 아쉬워요."
9788974574864,6,초보분들은 어려워요기초라고 이름 붙은게 의아하네요어느정도 중급이상의 분들이 볼만할듯싶네요설명도 친절하지않고.그냥 간단하게 영어문장들 쭉있는주입식 교육 스타일의 책입니다
9788974574864,6,서둘러 읽기 보다는 짬짬이 계속 보는게 더욱 효과가 크다
9788974574864,6,헉.. 이렇게 책이 작고 얇은지..  밑에 글에 국산과자라는 말에 백번 동감입니다.  돈이 좀 아깝네요 .ㅠㅠ
9788974574864,10,"오늘와서 받았지만, 크기가 작고 거기에다 영문법을 알수있게 해줘요(^^). 거기에다 영어공부에도 도움이 많이 되어요(^^)."
9788974574864,10,"매일 10분 기초영문법의 기적으로 스터디를 진행하고 있는데 책의 구성이 심플하면서 좋습니다. 해석이 의역이기는 하지만, 책에서 의도하고 있는 이미지를 그리며 공부하기에 적합합니다. 문법 지식을 학습하고 암송하면서 혼자 공부하기에도 부담되지 않아 좋습니다!"
9788974574864,10,중도 포기 없이 첫장부터 끝장까지 하루도 안 빼고 공부한 최초의 영어책입니다. 지금 두번째 읽는 중인데 확실히 첫번째 읽을 때보다 수월하고 재미도 붙네요. 감이 생기는 거같은 느낌?!!
9788974574864,6,영어공부는 늘 그렇다.
9788974574864,10,잘보고있습니다. 가독성이 좋네요.꾸준히 보고 영어왕이돼야지
9788974574864,8,감사합니다. 잘보겠습니다.
9788974574864,10,책에서 권하는 방법을 꾸준히 반복한다면 분명 도움이 될거라고 생각합니다. 이 책에서 권하는 방법은 많은 영어실력자들이 추천하는 방법이기도 합니다.
9788974574864,6,정말로 매일 10분으로 기적을 만들 수 있을까요?
9788974574864,10,책 사이즈가 작아서 갖고 다니며 틈틈이 보기 좋아요.자투리 시간 활용해서 공부하기 편합니다.
9788974574864,10,꾸준히 공부하기에 좋은 책인것 같아요. 정리가 매우 잘되어있네요~
9788974574864,10,짧지만 매일 10분씩 영어 공부를 꾸준히 하면 실력이 많이 오를 수 있을 것 같아요! 특히 출퇴근 시간에 요 책 하나면 공부도 하고 좋을 듯해요>_<ㅎㅎㅎㅎ
9788974574864,10,말이 필요 없는 책! 여태껏 봤던 영어회화 그리고 영문법 책 중에 단연 최고입니다~~~ :  ))
9788946420540,10,"책을 처음부터 끝까지 읽어나가는 고전적인 방법도 좋지만, 목차 중에서 흥미를 유도하는 글부터 선별해서 또는 랜덤으로 읽는 방법도 권할 만하다."
9788946420540,10,약장사 같지만... 읽기만 해도 공부가 되는 책을 찾는다면 이 책 한 번 읽어봐~
9788901215006,6,이해는 쉬운데 어플이 오작동일으킬때가 있어요
9788901215006,10,두세번사서 다 선물했어요 학습만꾸준히 하면 발음.리스닝.문법. 거의 한번에 잡을수있어요. 멋진 책입니다. 제거 다시 사두려구요.
9788901215006,10,부모님드리려구요
9788901215006,8,가볍게 책읽듯이 보기 좋아요. 한글은 하나도 없지만 이해하는데 큰 무리는 없는 것 같고 부담이 없어 보기 좋았어요
9791155810453,8,아이에게 읽을만큼 읽은 다음 포스트잇에 요약해서 책에 붙이게 했어요 영어공부도 하고 역사공부도 하고 일석이조.
9791155810453,10,역사와 영어를 함께.. 사실 보기엔 매우 흥미롭긴 한데 과연 어떨지 궁금하네요ㅎ
9791155810453,10,역사를 안다는것 과 영어에 능숙해 지는것 둘다 현대인에게는 중요한 항목입니다. 굳이 청소년이 아니더라도 어른에게도 필독서가 될수 있습니다. 영어와 역사 둘다 친숙해지고 싶네요.
9791155810453,10,세계의 역사와 영어를 한꺼번에!! 이보다 더 유익한 책이 있을까?
9791155810453,8,1석2조네요.... 맨날 동화나 소설보다는... 알차고 재미있겠습니다. ^^
9791155810453,8,역사와 영어를 함께 배울 수 있는 책!
9791155810453,6,세계의 이야기와 역사를 알아가보자
9791155810453,8,"미국 초등학생보다 못한 내 영어실력을 향상시키기 위해 이 책을 샀다. 이제 중요한 것은 내가 읽기에 내용이 너무 유치하지는 않은가 하는 점과 과연 영어로 된 책을 다 읽을 수 있는가 일것 같다. 이번에는 꼭 완독할 수 있기를 바란다.  일단 책의 구성이나 디자인, 종이 질은 만족스러운 수준."
9791155810453,10,영어를 배우는 동시에 세계사를 같이 배울 수 있는 방법인 것 같네요 재밌게 동시에 할 수 있다니 일거양득!
9791155810453,8,역사 이야기 알기쉽고 재미있게
9791155810453,10,쉽고 재밌게 배우는 것이 가장 좋운 방법인듯
9791155810453,8,돈만 있다면 반드시 사고 싶습니다.
9788917949179,10,최고의 영어학습 교재!! 보이스액팅도 좋고 내용도 좋고 무엇보다 단어와 중요 구문 해설과 한글 해설까지 있어서 아리까리 했던 부분도 확실히 확인하고 넘어갈 수 있어서 참 좋다. 오늘 택배 받고 어린왕자부터 보는 중인데 나한테 딱 필요한 영어교재가 이거구나 하는 생각이 든다. 강추!!!
9788958075486,10,굿
9788958075486,4,처음에 외국어를 학습하는 사람에게 무엇인가 외국어를 배울 수 있는 비법을 전수하겠다라는 취지로 이책을 추천하고 또 선물하였다..나도 영어를 본격적으로 공부하고자 하는 마음에 책을 펼쳐들었는데 이 방법으론 성공하는 사람이 없을 듯했다 강렬한 마음으로 고른 데이팅게임 쉬운단어지만 정확한
9788958075486,2,자신의 프랑스 체류시 격었던 프랑스어 배움의 과정을 영어로 확대하여 설명하고 있긴 하나 본인의 방법이 다 들어맞는 것은 아닌데 본인 것만 진짜라고 하는지? 그리고 75개 언어를 하는 것이 아닌 배운 것으로 해야 하지 않을까? 10개 언어를 배웠지만 영어도 버벅거리는 나에게 그녀의 주장은 과장!
9788958075486,2,댓글 마케팅의 파워를 보여주는 쓰레기 같은 책.
9788958075486,6,그냥 동기부여하기 좋은 책이었다.
9788958075486,10,영어 20년만에 다시 시작해서 하루 3시간씩 4개월을 책보고 진행하여 지금 원서리딩 중입니다. 별점 한개주고 악플다는 사람들은 직접 실천해보고 글을 쓰신건가요?...진짜 따라해서 성공한 사람들이 얼마나 많은데! 틀린 공부법은 없어요 끝까지 믿고하는 학생과 중도포기자가 있을뿐이죠^^
9788958075486,2,"외국어를 73개 공부하는걸 마치 진짜 다 말을 할수있으면서, 동시에 공부도 하고있다 이런 뉘앙스로 한거지만, 참 뻐언한 내용을 가지고 나는 사람들이 공부한 뻔한 방법이 효과가 있었어! 라는 식이고, 또 그걸 풀어서 돈좀 벌어야겠다는 썩은 속내가 보임. 멋집니다그려 짞짝짞"
9788958075486,2,알라딘에서 책 구매하고 처음으로 환불신청한 책..지저분한 상술에 넘어간 내 잘못도있지만..책은 역시 들춰보고..추천받아 사야한다는..별 한개도 아까움
9788958075486,6,"이 책에 나와있는 그대로 실천하려면 시간이 많이야하며, 정말 큰마음먹고 해야하며, 정말 영어만 해야할것같습니다. 지금 책보고 3주~4주정도 지났는데 영어의 ｀감｀이 조금 늘었다고 느껴지네요."
9788958075486,10,내가 원하던 영어 공부 방법이 나와 있어서 보물을 찾은 것 같은 느낌이네요. 레몬 샘을 따라 한번 공부해 보려구요. 성공하면 여러분에게도 적극 추천할께요.
9788958075486,2,시간 겁나 많은 분들에게나 추천할만함...
9788958075486,10,꼭 영어공부가 아니라 가벼운 수필이라해도 이 책은 밁을 가치가 있네요.몇페이지 읽다가 너무 맘에 들어서 바로 사전을 주문했고...지금은 다니엘 스틸 책을 주문했네요.이런저런 방법론으로 상처받은 영혼이 이번에는 치유받을 느낌이 듭니다^^;;
9788958075486,10,다국어 천재가 저술한 도서는 영어를 어떻게 공부할 것인가를 구체적으로 서술한 내용으로 영어를 도전하고자 하는 분들에게 이 책을 추천합니다. 본책과 트레이닝북 2권당 1묶음으로 되어있습니다.
9788958075486,8,올해는 영어공부를 다시 하고 싶어 검색하다 제목에 이끌린 책이 <진짜 영어공부>이다. 영어학습 도서 같은 경우는 매번 사놓고 안쳐다보는 경우가 많아서 이번엔 다른 분들 리뷰도 많이 검색하고 고른 책. 올해는 조금이라도 꼭!!! 해내야지..
9788958075486,2,책은 직접 확인 할 것.
9788958075486,4,서점 가서 확인 해보고 역시 책은 확인하고 사야한다는 것을 느끼게 해준 책...
9788958075486,8,처음에 진짜공부라고했다 거창하거나 어렵지않다고 했다 물론 수고스럽움과 힘듬은 있으나 복잡하진않다 정말 아무것도 아닌것에 이렇게 열의가지며 하는데 저자처럼되기힘들다 직장을 가진핑계로 늦게끝난다는핑계로 하지말 끝은 봐야할듯하다.피해지지않으니깐
9788958075486,8,이 책을 보면서 영어 공부를 쉽게만 하려고 했던 내가 부끄러워졌다. 저자는 73개 언어를 습득하였다고 한다. 그런데 그것이 쉽게 얻어진 것이 아니라 부단한 노력에 의한 것이었다. 영어가 늘지를 않는다고 한탄만하였는데 안해서 안되었던 것이다.
9788958075486,10,"수많은 영어 공부책과는 다른 책.나의 경우, 서른이 넘은 나이에 외국에 나와 뒤늦게 영어로 공부해야 하는 상황원서들을 일일이 사전찾아 공부하다 답답한 마음에 주문한게 된 책저자처럼 몇개국어를 하는 것은 나에겐 꿈 같은 일이지만영어 하나만이라도 모국어처럼 부담이 없어지길 기대해본다"
9788958075486,10,가장 공감되었던 이야기는 선택의 문제라는 레몬쌤의 말씀~ 왜 못하지? 하는 자괴감에 빠지지 말고 다른 걸 잘했고 다른 걸 선택해서 열심히 했다는 말씀에 마음의 위안이 되네요.영어원서 읽기가 술술 되는 그날까지~ 아자아자~ ^^
9788958075486,10,최소한의 양을 채워보는것.
9788958075486,10,"외국어 습득과정에 있어서, 본인에게 가장 잘 맞는 공부법을 찾는 것이 가장 빠른 방법이라는 사실은 누구나 잘 알고있지만.. 그걸 찾기에는 너무 시간이 오래걸린다. 하지만, 정말 중요하다. 그동안의 여러방법을 투자해온 나로서 '쓰다'의 공부법은 정확했다."
9788958075486,10,나도 누군가에게 무얼 가르칠 기회가 생긴다면 이 책처럼 알려주고 샆다. 그나저나 이러다 영어학습법 분야 마니아 될 판. 죽어버려야지.
9788958075486,10,사기충전이 되는 것만으로도 돈값은 하는 책.
9788958075486,2,"정보 전달위주가 아니라 저자 본인의 영어 공부 수기 정도 많은 단어를 외워라, 기초 문법 공부를해라 그리고 각 400페이지 20권 정도의 책을 읽어라. 이책을 보고 느낀점은, 난 공부의 요행을 바라고 책을 샀고 그리고 벌을 받았다."
9788958075486,10,모든사람들이 영어가 익숙하기는 하더라도 완벽하게 구사하는 능력을 가진 사람은 몇 없다. 허나 이 책에서는 어떻게 영어에 다가가는지 정말 구체적으로 알려준다!!!!!!! 막연하게 얘기해주는것이 아니라 단어책까지 추천해주면서 설명해주니 영어 참 해볼만하겠다^^
9788958075486,10,영원한 숙제 영어 공부! 평생 시작만 한 책이 얼마나 많은지..보물은 만났다. 사전에 색연필로 단어를 칠하면서 내 안에 영어 단어가 차곡차곡 쌓여가는 게 느껴진다.. 도대체 이 책은 뭔가? 대박을 만났다. 6개월 후 내가 나도 궁금하다.
9788958075486,2,"제대로 돈 아까웠던 책이다. 한마디로 단어 달달 외우고 영어책 많이 읽으라는 내용을 자신만이 알아낸냥 완전 비싼 돈주고 짜증 제대로 나게 했던 책. 이런책이 베스트셀러라니 나도 73개언어를 공부한다는 말에 혹해서 구입했는데,마케팅의 승리다."
9788958075486,10,영어를 잘하고 싶은 마음에 영어공부법 책만 나오면 무조건 샀다. 그냥 이렇게 공부하면 돼｀하고 끝나는 다른 책들과 다르게 이 책은 매일매일 구체적으로 해야할 과제까지 트레이닝북에 있어서 도저히 영어공부를 안 할 수가 없게 만든다.
9788958075486,10,영어에 소질이 없어도 할 수 있을 것 같다. 사람을 주눅들게 하는 영어공부법이 아니다. 나도 할 수 있겠다는 희망을 준다.
9788958075486,8,2015년도 결심만 하고 넘어갈뻔했습니다. 꾸준함이 얼마나 힘이 센지를 증명해내고 싶게 만드는 책이네요.
9788958075486,4,왜 베스트셀러인지 궁금하네요~
9788958075486,2,"책을 쓸만한 지력이 없어보이는데,책 팔아보려는 쓸데없는 자기 자랑 ,일상생활담 아주 책 받아보고 놀랐다~~!! 이따위로 책 내려고 한다면 나도 낼것 같아~~~~ 이책 검색한분들 절대 책 사지 마세요~~~~"
9788958075486,2,상품평을 한번도 안 써봤는데 15천원에 이 책을 사서 너무 황당해서 처음으로 남겨봅니다. 이 책의 본문은 A4지 한장 정도로 요약할 수 있고 부록은 어디에서나 볼 수 있는 영어 단어 숙어입니다. 읽으면서 영어방법과는 상관없는 지은이의 경험담을 쓸데없이 채워서 책 분량을 맞췄을 뿐입니다. 비추!
9788958075486,10,상세한 공부방법 뿐 아니라.. 뭔가 희망의 메세지를 줬다고 할까요~ ㅎㅎ
9788958075486,8,개개인에 따라 공부 방법이 다르므로 쓰기를 무척 싫어한다면 권하고 싶지 않다.하지만 여러 방법을 써보았는데도 영어공부가 늘지 않는다면 속는셈치고 따라해볼만한 방법이다.일단 작가의 무한 노력에 찬사를 보낸다. 언어공부는 무한 반복 학습이라는 철학에도 공감이 많이 간다.
9788958075486,10,영어공부를  시작하는  조카에게 선물로 준 책. 조카아이가  지은이처럼  인내심과시간의  양이  필요한  영어공부에  천천히 다가가기를  바래 봅니다
9788958075486,8,"나도 이러 저러한 방법으로 해 보았고, 직장 생활하면서 외국인과 프로젝트도 수차례 해보았고, 결국 전공외의 언어에서 막히더군요. 이 책은 근원적인 방법에 대해서 알려주는것같아 어제 받아서 단숨에 독파하였습니다. 시간이 걸리더라도 한번 해보리라는 생각에, 이번에는 잘될거라 믿습니다."
9788958075486,10,저한테 맞는 영어 공부하기 가장 좋은 책이었어요.다른 분들도 쓰면서 하는 공부의 효과를 느껴보셨으면 좋겠어요.
9788958075486,10,저자의 정성이 느껴진다. 새로운 종류의 영어책
9788958075486,10,"미국에서 교환학생을 하면서 단순히 영어에 노출된다고 저절로 영어가 느는것이 아니라는 것을 깨달은 후, 개인적으로도 꾸준히 영어 공부를 하기로 마음을 먹었었습니다. 그러던 중 블로그를 통해 73개국어를 공부하는 레몬쌤을 만나서 차근차근, 영어에 대한 자신감과 기본기를 다지게되었습니다."
9788958075486,10,"정말 따라만 하면 진짜 영어 실력을 키워주는 책. 레몬쌤의 치열한 삶을 통해 끝임없이 자극받고 격려를 받게 된다. 결코 만만치 않은 방법들이지만 그래서 더 신뢰가 가는.. 공부하면서 정말 큰 행복감을 맛보게 하는 최고의 학습법, 멘토이다."
9788958075486,10,도서정가제전에 심사숙고해서 구입했어요 ^^ 도움이 많이 됩니다.
9788958075486,10,꺼졌던 영어에 대한 불씨가 살아나도록 도움을 주는책. 몇달 전 블로그를 통해 나도 그랬듯이 말이다. 책으로 만나니 더욱 읽기에도 공부하기에도 좋다. 강추!!
9788958075486,10,"레몬샘의 블로그에서 본 내용을 좀 더 일목요연하게 볼 수 있어서 좋아요레몬샘 블로그로 작년부터 영어공부하고 있는데, 정말 기가막힙니다. 강츄!!!"
9788956056326,2,"저자의 이력,걸어온길을 요점만 간략하게 추렸다.하버드,로스쿨,최초등의 수식어일뿐이라는것을 스스로 입증,고민도 깊이도 없다.*참고로 하버드,예일대의 라이팅클래스가 90여개 정도고 전담교수,강사가 40여명정도 있다, 1학년 때는 기초라이팅, 2학년 때는좀더 심화된 글 연구 보고서 기업지원 이력서,기사작성,매뉴얼 작성등의 다양한 글쓰기 수업이 있다. 미국대학에서 글쓰기 수업에 막대한 투자를 하는 이유는 생각의 힘을 길러주는 최고의 도구이자 자신의 생각을 완성하는 최고의 지침이기 때문이다."
9788956055428,8,저도 요즘 롱테일북스 책으로 공부하고 있어요..원서에 단어 정리 되어 있어서 편하네요..
9788956055428,8,단어장이 분리된 이후로 더 좋아졌어요. 오디오도 구성이 좋구요~
9788956054872,6,로알드 달 단편을 볼때 단어가 어렵다고 생각된다면 도움을 받을수 있습니다.
