ISBN13,rating,review
9788956056852,10,영화음악이 좋아 영화를 2번보고 책을 읽었는데 신기하게도 해석이 되더라구요.. 아이가 6학년인데 영화내용을 기억해서 그런지 모르는 단어가 나와도 전체적인 문맥은 이해하는 것 같아요. 책 읽기전에 영화보기는 필수입니다. 그래야 이해가 쉬워요.
9788956056852,8,영어공부하기 좋아요~~^^
9788956056852,10,"울 중학생 딸아이, 영화 겨울 왕국에 미쳤습니다. 그 여세를 몰아 영어 공부에 활용하기위해 구입합니다."
9788956056852,10,<겨울왕국> 넘 좋아서 2번이나 극장에서 보았습니다 그 감동의 물결이란 이루말할 수 없는... 하여 구입하게 되었습니다 지금도 CD를 틀어놓고 귀로는 감상하며 손으로는 그 느낌을 담아 이렇게 작성하고 있습니다 행복합니다 너무 좋습니다 알차게 잘 드겠습니다
9788956056852,10,영화를 재밌게 봐서 구입했습니다. 성인이 읽기에는 어렵지 않은 영어원서입니다. mp3 파일도 같이 들으면 리스닝 공부도 되겠네요. 추천합니다.
9788956056852,8,동화로 각색된 겨울왕국 소설이다.
9788956056852,6,CD는 플레이어에서 작동하지 않습니다. mp3라네요. 사놓고 나서야 알았습니다.
9788956056852,8,"조카가 넘 잼나게 봤다고 좋아하길래 사줘봤습니다. 단어장이 따로 있어 모르는 단어 찾아가며 읽을 수 있어 좋습니다. CD 도 좋구요,"
9788956056852,10,영여공부하기에 딱 좋네요.
9788956056852,10,"딸아이 집중듣기 하려고 샀어요.
배송도 바로 다음날에 왔어요.
재밌다고 웃으며 보네요...."
9788956056852,10,"하핳 구매했어요!
아직 오지는 않았지만 정말 기대가 됩니다~"
9788956056852,10,겨울왕국 디지털로 보고 나서 뭔가 아쉬워 3D로 한번 더 봤습니다. 둘 다 자막이었는데 이번에는 더빙으로 또 보고 싶네요. 무슨 말이 필요할까요. 강추입니다!! 올라프가 넘 귀여워요!!
9788956056852,10,영어 공부할겸 영화 너무 좋아요 ㅎㅎ 노래도 좋고!!
9788956056852,10,아들이 원서로 사달라고 해서 샀습니다. 받더니 원서가 맞다고 cd와 함께 좋아라 하면서 읽어요. 어려운 단어도 잘 정리되어 있어 맘에 듭니다.
9788956056852,10,겨울왕국에 빠진 초5딸래미가 사달래서 사준 책..이틀만에 다 읽어버리네요..재밌대요.
9788960498587,10,"일단 제목이 땡겨서 구매했는데 내용이 너무 알차서 대만족입니다. 하나의 주제에 대한 짧은 대화형태의 글이 있고 중요표현, 리뷰, 확장회화가 있고 따로 연습 해 볼 수 있는 엑스트라 질문이 있습니다. 회화 공부에 이보다 더 완벽한 책은 본 적이 없습니다. 학원 교재로 쓴다면 완벽할거같습니다"
9788960498587,10,"어쩜 한국인이 하고 싶었던 말만 이렇게 다 모아놨을까요? 대박이네요! 공부 안하고 그냥 읽기만 해도 귀에 쏙쏙 들어옵니다. 미드에서 몇 번 봤던 표현들도 보이고, 문장속에 이런 표현들이 녹아있어서 실제로 말하기에 많은 도움이 될 것 같습니다~목차 보자마자 소장하고 싶은 책입니다."
9791165340766,10,"아뿔싸, 이번 주말엔 이 책이다. 놓치지 말자고 다짐하며."
9791165340766,10,이런 책이 나오다니 굿bb
9791165340766,10,우리에게있어삶의의미를주는‘시옷‘들이무엇이있을까?기대하며책장을넘길것같다^^
9791165340766,10,기대가됩니다
9791165340766,8,장영희교수님의 글 좋아했었는데요....꼭 읽어보고 싶네요.
9791165340766,8,밑에 리뷰를 보니 많이 기대가 됩니다!
9791165340766,10,"독자들에게 부치는 편지와도 같은, 아름다운 시와 언어들."
9791165340766,10,고전 영시에서 사랑과 삶에 대한 성찰을 할 수 있을 것 같아요. 기대됩니다!
9788974575366,10,"기대를 많이 했는데요,  간편함을 목적으로 해서인지, 설명도 너무 간단하고,  예문의 구성도 좀...  생각보다 실망이 크네요"
9788974575366,10,깔끔하게 정리되어 있어서 보기 편합니다.
9788974575366,8,"'왕기초 영문법'이란 제목이 시사하는 바와 같이 초보자들이 시작하기에, 부담없는 양으로 쉽게 만들어진 영문법 가이드라인 책이다.어렴풋이 학창시절에 배웠을때 이해되지 않았던 영문법이 생각보다 쉽게 해석되어 지게끔 설명이 쉽고 간결하다."
9791155811320,6,아 나는 왜 사놓고 공부를 하지 아니하는가....
9791155811320,10,시험을 위한 단어가 아니라 편안하게 리딩을 위한 필수 영어책이라고 느껴져요. 아주 만족해요.이 한권을 다 보고나서 어떤 글도 편하게 읽혀질 것 같네요.
9791155811320,8,내용은 좋은 듯...
9791155811320,10,300 504 1100 모두 읽었는데 개인적으론 300이 504보다 수준이 더 높고 알찬 단어가 많다고 봄. 책이 예쁘나 스프링제본이 좀 되었으면... 이건 왜 스프링제본 옵션이 없는지?
9791155811320,8,"300단어를 외우면 앵무새 죽이기를 읽을수 있다는 컨셉으로 책이 구성되어있다.하나의 단어를 여러 문장에서 반복해서 보고 연습문제를 통해 외웠는지 확인하고,마지막엔 칼럼을 읽으며 또 확인하기에 지루하지 않게 단어외울수 있어서 좋았다."
9791155811320,10,팀원선물
9791155811320,6,basketball이 야구로 해석되어있는...? 재밌게 영어공부하긴 좋은 거 같은데 이런 건 거슬리네여
9791155811320,8,"단어에 [영어 발음]이 없는 것, ‘어법‘ 특징을 잡아주는 tip이 없는 것 이 둘 빼고는 좋다."
9791155811320,10,단어는 문맥으로~~ 좋은책임~
9791155811320,10,"하루 15단어씩 총 20일 최단기간에 리딩의 기본이 되는 핵심단어를 마스터할 수 있는 책이라니 부담없고 매력적으로 다가옵니다!! 가을은 독서의 계절이기도 하지만, 공부하기 딱 좋은 계절! 외우지 않고 문맥으로 익히는 영단어 꼭 도전해보고싶네요!!"
9791155811320,10,1100을 잠깐 가지고있었는데 막히는 부분이 꽤 있더라구요. 300은 최신판에다가 중급영단어라고 하니 누구나 부담없이 즐기기 좋은 책이라고 생각해요. 굉장히 기대하고있습니다! :D
9791155811320,10,‘공부하는 재미‘와 ‘정확한 어휘 구사력‘을 동시에 잡았다는 이 자신감부터 벌써 기대감 상승!이 책으로 공부하다보면 지적 리딩이 절로된다고하니 기대가 안될 수가 없겠죠? 문맥을 통해 배우는 것이기에 기존에 단어만 던져주는 단어장보다는 훨씬 좋은 것 같네요 :)심지어 반복학습까지 시켜주니 굿
9791155811320,10,"미국 영어 교사들이 강력 추천하는 필독서! 10년 연속 스테디셀러이니 더욱 믿고 공부할 수 있겠지요! 어려운 영어가 아닌 쉬운 영어, 재미있는 영어를 위해 ˝300 워드˝와 함게 하겠어요!"
9791155811320,10,전 외우기를 싫어해서 아예 안하게 되더라고요. 예전 영어잘하는 친구에게 들은 문맥을 통해서 단어 외우기를 이 시리즈를 통해 단어 익히고 싶습니다.
9791155811320,10,"워드 파워 메이드 이지와 지적 리딩 영단어 시리즈는 오랜시간동안 사랑받아옴으로써 입증이 된 영단어책이지만 단어의 수준이 높아 어렵다는 반응도 있었는데요, 단어의 난이도를 조절한 이 책이 그 아쉬움을 보완해줄 수 있을 거라고 생각합니다"
9791155811320,10,https://m.blog.naver.com/pdream78/221107636479 300단어를 문맥에 따라 익히는 책이랍니다. 단지 단순 암기가 아닌 맥락을 통해서 익힌답니다. 단계별로 진행되면 나도 모르는 사이 영어고수가 되어 있을 듯 합니다. 어서 만나보고 싶네요.
9791155811320,10,핵심단어들을 알차게 공부할 수 있어서 좋을 것 같아요!워드파워 메이드 이지 공부하기 전 단계에 공부하기 좋은 책일듯
9791155811320,10,Word power make easy 란책을 공부했는데 정말좋지만 저한테는 어려워서 중간에 멈추었는데요 이런책이 나와주어서 정말 좋네요 다시 수준에 맞춰 도전하고 싶습니다
9791155811320,10,504와 1100둘 다 가지고 있는데새로나온 300도 눈이 가네요~~기존의 책들로 효과적으로 단어를 외우는데 많은 효과를 봤어요!스토리를 읽으면서 단어를 보니 나중에 단어가 긴가민가 할 때도 스토리를 떠올리니 기억이 나더라구요.새 시리즈도 기대만빵입니다 ^^
9791155811320,10,504워드랑 1100워드 다 가지고 있어요~ 문맥안에서 자연스럽게 다양한 뜻을 이해할 수 있게 되있어서 좋은 것 같아요~ 300워드는 문학 관련 단어에 초점을 맞췄다니 더 기대가 되네요~ 어떤 수준의 단어들일까 궁금합니다 :)
9791155811320,10,이번 명절은 몸이아파서 병원에서 보내게 되면서 영단어 암기를 목표로했는데 구성이 좋은거 같아요 :) 긴연휴만큼 한 권도 충분히 암기할 수 있겠죠+ㅅ+??
9791155810408,10,영어공부와 얕은 역사를 동시에:)
9791155810408,10,"세계사라 더욱 편하게 읽을수있고, CD를들으면서 발음연습도 가능하다. 재미있게 영어실력 향상에 큰 도움을 얻을 수 있을 것 같다."
9791155810408,10,알지 못했던 사실을 여러모로 알게 되어서 좋았다.
9788956053837,8,참 좋아요 주위에 권유해 주고 싶네요 감사해요
9791165260118,10,전편에 이어서 잘 보고 있는 책입니다
9791157210978,8,"중학교 때 영어를 이렇게 배웠다면, 내 인생은 지금과는 분명 몇 도는 달랐을 것 같다. 영어는 이렇게 익혀야 한다. 유일한 단점은, 훌륭한 컨텐츠를 어설퍼 보이게 공력하는, 너무 큰 글자. 너무 많은 여백."
8809584510026,10,외면과 내면 모두 흠잡을 수 없이 화려하고 알찬 매력! 손바닥만한 책이 이만원이 넘길래 허걱하고 펼쳐보니 아쭈 매혹적이어서 구매하고 또 선물용으로 사려고 합니다.알록달록 보기 쉽고 서로 반대되는 문장들과 손수 채워볼 수 있는 빈칸 꼭 게임같습니다.해야하기보다 하게되는 영어를 만나 영광!
8809584510026,8,"영어? 공부? 아닙니다. 그저 굳은 머리에 매일 한 방의 침이라도 놓아보고자 만나봅니다. 올해 다 못보면 내년에, 작심삼일이면 건너뛰며 또 삼일, 차근차근 살아보려구요~ ^^"
8809584510026,10,플래너 옆에 바로바로 영어 명언이 나와있고 빈칸을 스스로 채울 수 도 있어서 영어 공부하는데 효과적입니다!  일상생활에서 영어 사용이 힘드신 분들은 명언을 통해 영어를 더 가까이 할 수 있는 좋은 기회가 될 것같습니다.
9791188808847,6,영어문장을 단순히 읽고 외우기하는것으로만 이해하고 학습하니 알지 못하는 문장들도 있었지만 문장구조를 이해하면서부터 이해력이 눈에 띄게 늘게 되었습니다. 뭐든지 구조를 알고 골격을 이해한다는건 깊이있는 학습을위해 꼭 필요한 일이라고 생각합니다.좋은책 감사히 읽었습니다.
9791188808847,6,내용은 좋으나 굳이 책의 크기를 이렇게 작게 할 필요가 있었을까요? 핸드북 수준이라 보기가 쉽지가 않네요.
9791188808847,10,정말 구조를 간략하고 그러나 확실하게 알 수 있게 쉽게 설명해준 것 같아요-반신반의했는데 개략적인 개관을 알 수 있어 도움되었고요 ^^
9791188808847,10,작고 가벼워서 들고 다니기 좋아요. 책에서 추천해준대로 하루에 한과씩 정독하고 있어요~ 문장구조라는 거를 처음 접해서 아주 익숙하지는 않지만 여러 번 보니 제 것이 되는 기분입니다!ㅋㅋ 올해는 영어를 정복하리라 기대해보며...ㅋㅋ
9791188808847,10,서점에서 보고 영어 초중급자용으로 좋은 것 같아서 구매는 안했지만 평점 남겨봅니다. 키 출판사책들이 좋은 책들이 많은데 딱 한가지 문제점이 있다면 종이가 너무 반짝거려서 스탠드 불빛 밑에서 공부할 때 잘 안보여요. 종이만 눈부심 방지 종이 쓰시면 만점일듯. 약간 노란끼나는 종이 추천요.
9791157524488,10,명성에 버금가는 책이네요! 매일  두어개씩만  풀어보려고 샀는데 너무  좋습니다^^
9791157524488,10,"좋은 지문의 선정과 정확한 번역이라는 두마리 토끼를 잡은책이라고 평하고 싶다.제대로 영어독해 실력을 쌓고자 하는 학도들에게 아주 좋은 길잡이가 되리라본다.단, 어느정도의 실력을 갖추신 분들만 보시기를..."
9788917949155,10,아이가 한글 책으로 알고 있는 친근한 이야기라서 내용 이해가 빠르고중간중간 나오는 노래가 좋은지 흥얼흥얼 따라하고 좋아합니다.중요포인트는 이야기 마지막 단계에서 성우가 설명해주어 책을 읽지 않아도저절로 귀에 들어오네요 (문법이나 중요발음포인트 등등)
9788932916217,8,"오역의 사례를 접하고, 뭐 이런 수준의 오역이 있나하고 한심하게 생각되는 그런 오역들이 있다. 외국어 번역도 고시처럼 고시제를 도입해라!!! 더이상 수준떨어지는 오역의 폭격으로부터 벗어나고 싶다. 안정효 선생님 감사해요."
9788932916217,10,"40일 동안 정독했습니다. 선생님의 10년 노력을 짧은 시간에 흡수하게 되니 감사할 따름입니다. 번역가의 길이 쉬운 길은아니지만, 영예로운 길이라는 사실을 깨달았습니다. 이 책을 통해서......"
9788932916217,8,번역 관련 실용서 중에는 <번역의 탄생> 과 함께 가장 좋네요. 두 권 다 갖추고 있으면 좋을 듯.
9788932916217,10,"외국어에 관한 탁월한 책은 모어를 다듬는 데도 큰 도움이 된다. 내용의 충실함은 물론이고, 언어 생활 전반에 걸쳐 귀중한 성찰과 고민거리를 던져주는 책. 미리보기로 접할 수 있는 짧은 서문만 읽어두어도 아주 유익할 것이다. 번역가이기 전에 영화광인 저자의 면모를 재확인하는 것도 큰 재미."
9788932916217,10,정말 두께도 내용도 어마어마한 책이에요. 대단한 에너지를 쏟아부은 책이라는 게 느껴집니다. 하나하나 내것으로 만들어가야겠죠.
9788932916217,10,"영화 자막 오역 사례를 중심으로 공부하는 영어 번역 노하우, 정말로 대단합니다. 해당 영화 장면 소개가 곁들여지기 때문에 재미도 있습니다. 감탄..."
9788932916217,10,"아직 A 단원 밖에 못 읽었으나 별 다섯 개 팡팡! 좌절감과 의지를 동시에 일깨워주는 야무진 일침이 가득, 아무 때나 펼쳐 보기 편하도록 섬세하게 기획하고 편성했다는 느낌을 주는 구성과 두께도 대만족. 번역가 지망생뿐 아니라 글을 다루는 사람이라면 누구나 읽어도 좋을 책."
9788932916217,10,번역자라면.. 영어책을 다루는 편집자라면 정확하고 바른 번역을 위해 누구나 읽어야 할 필독서입니다
9788932916217,10,"평소에는 심심할 때 아무데나 펴서 보기에 알맞고, 이 단어는 어떻게 한국어로 바꿀까? 궁금해질 때는 진짜로 도움이 되는 사전의 역할을 해서 엄청 편리해요! 내용과 잘 맞는 책 디자인이 너무 좋습니다. 두껍고 큰데도 대단히 가볍고, 본문에 하늘색이 들어가 있어서 가독성도 좋고 예뻐요."
9788932916217,10,"놓치기 쉬운 문맥의 흐름을 알게 해준 책입니다.

원서를 해석하고 번역할 때마다 나타나는 너무나 한심한 한글에 대한 나의 무지를 

여지없이 질타하며 가르침을 주는 지침서임."
9788917199109,10,워낙 좋아하는 책이어서 영어공부하는 재미도 있는 것 같네요.
9788917198874,6,헤드폰 표시 눌러도 음성이 안나옵니다. 피터팬 책은 되는데... 어떻게 해야 하나요?
9788917198874,8,"CD가 그냥 읽어주는 게 아니라 연기를 해서, 듣기가 재미있어요ㅋㅋ"
9788972558712,10,좋아요 초등고학년이 보기에도 편안한 책입니다 지루하지 않아요 다음권도 번역 나오면 좋겠어오
9788972558712,8,"해리포터 원서, 영어해석을 도와주는 책이 아니라 해리포터 시리즈(원서)를 훨씬 더 재밌게 읽을 수 있게 도와주는 책.8세 이전에 해외로 이민을 가서 영어와 한국어를 둘 다 사용하는 친구에게 빌려줬더니, 자기도 몰랐던 단어의 기원과 비하인드 스토리가 많았다고 정말 재밌다는 코멘트를 들었다"
9788972558712,10,해리포터를 원서로 읽기위해 도움을 받고 싶어서 샀는데 굉장히 유용하다. 무엇보다 배경지식도 같이 들어있어서 너무 좋았다.
9788972558712,10,판타지가 그리 영어독해 하기 편한 책은 아닌데다가 해리포터 팬인지라 이름의 유래나 기타 기본 표현들에대해서 보기위해 구매했습니다.
9788972558712,8,일상회화에서 많이 쓰이는 표현들도 정리되어 나와 있습니다. 원서 읽기 전에 또는 원서 읽으면서 옆에 놓고 보면 도움이 많이 될 것 같아요.
9788960498709,10,"미국 영어 문화 수업이 너무 괜찮아서 심화편도 나오자마자 구해서 읽었는데, 이번 편도 좋네요. 미국 영어와 문화의 다양한 양상을 배울 수 있었습니다."
9791186701607,2,큐알코드로 오디오북과 번역파일 받을 수 있다고 해서 구매했는데 홈페이지 도메인 만료로 연결 안 됨.
9788960497849,6,캐나다 15년 살았던 경험에 의하면 책 구성. 설명은 잘 되어 있으나 문장은  실 생활에서 사용치 않는 즉 추상적인 대화체가 많음
9788960497849,10,룩쌤 수업을 들어본 사람은 누구나 알죠 ㅎㅎ 정말 현존하는최강 질 좋은 컨텐츠로 무장한 수업입니다. 안보면 후회되는 수업인데..책까지 나오셧다니 정말 축하드리고 주변에도 추천중이에여. 룩쌤과 함께하는 수업은 하나부터 열까지 모두다 섭렵해야되여 ㅎ
9788960497849,10,수업용.
9791195427253,10,"이 책이 좋은 책인 이유.1. 구성이 독창적이면서, 영어 문장의 핵을 관통하고 있다.2. 통달한 사람만 할 수 있는, ˝군더더기 없는 간략한 설명, 그러면서 모두 담았다˝는 점3. 저자 약력을 보자. 학력 소개 없다. 그야말로 자기소개다. 그런데 그는 서울대 영어교육과를 나왔다."
9791195427253,10,"설명은 NIV 영어 성경을 쉽게 읽기 위한 방법으로 써 있는데..제가 보기엔 영문법 감이 안 잡히는 분들, 단어가 많이 나오는 문장에서 형식 구분 못하시는 분들(어디까지가 주어고 뭐가 목적어야..? 이런 거)에게 강추합니다. 좋은 책이네요. 전도할 때 써도 괜찮을 것 같아요."
9791195427253,8,"얇은 책임에도 불구하고 NIV 성경을 토대로 영어를 공부할 수 있는 내용이 압축적으로 들어 있습니다. 성경을 이용한 영어스터디를 할 때 유용하게 쓸 수 있으리라 생각되며, 좀 더 풍부한 학습이 이뤄지기 위한 후속 책이나 워크북을 고려해봤으면 합니다."
9791188808083,10,영어공부도 하고 성경공부도 하기에 안성맞춤이네요. 쉬운 영어로 되어 있어 읽는 재미도 있고 진도도 잘 나가요.
9791195570720,10,친절한 배송. 상품도 최상. 번창하세요
9791195570720,2,하~ 정말.. 책은 좋은데 오디오 어쩔라고 이렇게 만든걸까요? 아서에서 나오는 성우가 하는게 아니고 웬 남자분이 읽어주고(정말 재미없게 읽어줌.) 여자분이 한번더 읽어주는데 아이들이 너무 싫어할 스타일이네요. 쥬니비 존스 등 집에 오디오 있어 구매할까 말까 하다 구매했는데 오디오는 최악인듯
9788956056951,8,영어원서 입문서로 좋은 책임
9788980994656,8,"빈칸 채우기로 이용하거나, 본인 실력을 위해서 아예 전체지문을 받아쓰기로 이용해도 될 듯."
9788980994656,10,"누구나 볼 수 있는 책이었어요.

세계 곳곳의 사건, 사고, 이슈를 흥미롭게 다양한 이야기를 비교적 쉬운 단어로

짤막하게 단락 단락 기사로 되어 있어서 영어 뉴스를 시작하는 분들에게 

좋은 매력적인 책입니다~~~^^"
9788957977255,10,영어 공부하기에 쉽고 재미있다고 추천해주시는 분들이 많아서 한참 셜록 홈즈에 빠져있는 아이를 위해 책을 신청했습니다. 먼저 제가 읽어보니 문체도 간결하고 내용도 어렵지 않아 쉽게 읽어지네요~
9788957974667,10,"이 책을 만나기 전까지 접했던 영어 독해법은 한정적인 독해법이었다. 하지만 이 책을 영어를 독해하는데 눈이 트이게 되었다. 같은 문장이라도 어떻게 해석하느냐에 따라 올바르게도, 엉뚱하게도 해석될 수 있는데 이 책은 더 나은 해석을 위한 길잡이가 되어준다."
9788957974667,10,진짜 좋네요 그동안 제가 궁금했던것들이 바로 첫페이지부터 딱! 나오네요 속이 뻥 뚫리는 느낌. 설명도 군더더기 없이 딱 좋아요. 가독성도 좋구 너무 좋네요. 바로 다음편도 사야겠어요
9788957974667,6,영어문법 이해가 뒷바탕 되고나서 봐야지 잘모르는 상태에서 보면 어렵고 얻을게 별로 없을거 같습니다. 왜냐면 설명이 부족하다고 느껴져서 저자의 예문들이 뭘 말하고 싶은건지 초보자들은 알기 힘들거 같음. 이것이 저자의 의도인지 아닌지는 자자만이 알겟죠?..
9788957974667,2,"이책의 프롤로그에 써있듯이 지금까지 왔다갔다하는 식의 해석으로 힘들어하고 있음이 잘못됨을 알기때문에 그 부분을 바꾸고파서 책을 구매했는데..설명이 너무 부족하다.좀더 자세하게 왜... 이렇게 해석해야 맞는지..또,옳은방식의 해석을 계속연습을 반복하던가 해야할텐데 그런 부분이 약하다"
9788957974667,2,"볼때는 되는 듯 하지만, 막상 안되는.. 결국 영어로 된책을 많이 읽어야 한다는 결과는 다 똑같은거 같다."
9788957974667,10,"충격 그 자체였다... 나는 지금까지 무슨 공부를 한건가.
영어가 이렇게 쉽게 되는 것을... 그동안 무얼 공부한 건가.
이 책을 일찍 만났더라면 내 인생이 한참 바뀌었을 지도 모르겠다..."
9788957974667,10,이 책을 보면 어느정도 영어문장을 보는 눈이 생깁니다.
9788957974667,10,순탄한 해석을 위해 영어순해 BASIC 시작하려고 합니다 !!!
9788957974667,8,영어순해 공부하다가 다시 basic에서 시작합니다. 친절하진 않지만 하다보면 실력이 느는 책이네요.
9788957974667,10,영어를 배우는 단계라 우선 basic 부터 공부하네요 얇은 책이라 부담없이 보기 좋네요
9788957974667,6,저한테는 너무 어렵네요... 아직 초보라서 그런지...
9788956054476,10,영화를 보고난 후에 이 책과 CD를 들으니까 영화장면이 문장마다 떠올라서 유용합니다.
9788956054476,8,CD가 본문의 내용을 읽어줘서 듣기 공부에 매우 좋습니다. 내용도 재미나고 쉽네요. 영화랑 같이 보면 더 좋을 것 같습니다.
9788956054476,2,"영화의 실제 목소리가 나오는 것도 아니고, 영화 스크립트 대로 읽는 것도 아니고,
대본을 소설로 각색해서 한 사람이 계속 읽어주는 스타일이네요....
저는 영화 자체의 오디오북을 원했던 건데.... 아까운 내 돈ㅠ"
9788956054476,10,토이스토리 넘 재밌어서 영어공부 더 잼있게 할 수 있을 것 같아요..ㅎㅎ 감사
9788956054476,10,영어공부를 하고있는 저같은 학생에겐 딱이더군요
9788956054476,8,워크 북이 있어서 공부하기에 좋아요.
9788956054476,10,영화보고 구매합니다.~
9788917198911,8,이런 식으로 차근차근 영어를 배워나가는 것도 좋을 거 같네요.
9788917198911,10,아들의 마음속에 진정으로 아름다운 것이 뭔지 알려주기에 적당한 책이죠...?
9788917198911,10,명작동화 따로 사줄 필요없이 한권으로 다 해결되요
9788917198911,8,"아직 시작해보진않았는데 전체적인 구성이 좋은거같네요~
다음 단계도 기대할께요"
9788971723760,2,원서 읽어보려고 샀는데 내용 군데군데 빠진게 있네요ㅡㅡ 출판사에 문의해보니 반석에서 출판한 모든 영어원서는 영어공부 목적으로 만든거라 내용이 다들어가있지않고 70~80퍼 정도만 들어간답니다. 미리 알수있게 명시를 해놨으면 구매안했을텐데 진짜 불쾌하네요ㅡㅡ
9788971723760,6,반석 영한대역 시리즈 라고 적혀있어 오해하기 쉬운데 이것은 영어로만 된 책임.
9788971723760,10,가격도 싸고 좋아요 ^^
9788972559184,10,아이가 너무 좋아해요 다음에도 좋은 책과 좋은 가격 부탁드려요
9791185719269,10,성문 영미 명문선과 어깨를 나란히 할 만한 고퀄리티의 지문이 모인 독해책. 시험을 위한 독해라기 보다는 말 그대로 영어 지문을 읽는 내공을 기르는데 최적화된 책이다.
