ISBN13,rating,review
9788990700056,10,체계적으로 정리가 잘 되있네요~~ 빨리 공부하고 싶은 욕망이 들어요 ㅋㅋㅋㅋㅋㅋㅋㅋㅋㅋㅋ
9788990700056,8,"토익,텝스,토플,편입 등등 문법공부 기본잡기에 좋아요. 다만 왕초보자라면 약간 어려울듯.."
9788990700056,10,"강의와 같이 들어야할듯,,"
9788990700056,8,기본정립하기 좋아요
9788990700056,8,토플기본문법공부하기 좋아요
9788990700056,10,내용이 너무 많지 않아서 한권 다본 문법책은 이게 처음이네요. 괜찮아요
9788990700056,10,토익을 위해 ㄱㄱㄱ!
9788990700056,10,해커스가 좋군요~$$$
9788990700056,10,"빠른 배송... 헤커스라는 이름에 걸맞는 내용...
이만한 책은 없을 듯."
9788990700056,8,문법정리하는데 도움이 많이 되는거 같아요~깔끔하게 정리되어있는편이에요^^
9788990700056,10,문법이 약하다고 생각하는 분들에게 추천드립니다. 문법정리로서만 공부하시길..
9788990700056,8,문법 개념 잡고 싶으신 분들은 다른 기본서로 공부하고 이 책은 정리필요하신 분들만
9788990700056,10,"방학에 영어공부 좀 할려고 구매했는데 
좋은것같아요 열심히 공부할려구요!!^~^"
9788990700056,10,구성이 잘되어서 학습효과가 좋습니다
9788990700056,10,"영문법의 시작점을 찍게하는 책!
기본중에 기본을 잘하는 것이 실력을 쌓는 첫걸음!"
9788990700056,10,역시 영어은 해커스
9788990700056,10,문법의 기본이 잘다루어져있음. 초급단계에게 필요한 책.
9788990700056,10,"역시 영문법의 기초는 해커스로 다져야죠.^ㅡ^ 
대학가기전 마스터 하겠습니다."
9788990700056,10,"영어에 자신감을 가지고 싶어서 구매했어요~
열심히 문법 공부 할 수 있겠어요★"
9788990700056,6,부연설명이 좀 부족해요 싸이트에서 강의신청해서 같이 듣긴 했지만 왕초보로서는.ㅠ
9788990700056,8,약간의 부연설명이 부족하지만 초보자가 이용하기에는 좋은 책.
9788990700056,8,되게쉽다... 누구나 풀수있을 난이도..
9788990700056,10,"정말 좋아요 ~ 토익이나, 토플을 꼭 준비하지 않더라도 한번쯤은 꼭 봐야할 책이에요~"
9788990700056,10,책 자체는 좋은 것 같습니다. 아주 기초만 약간 있으면 괜찮을 것 같습니다.
9788990700056,10,문법의 기초죠
9788990700056,8,잘받았습니다.
9788990700056,6,좋긴 좋은데 완전 기초를 원하시는 분은 이책은 아니네요
9788990700056,10,어렵지 않게 핵심을 가르쳐주는 책. 정말추천해요!!!
9788990700056,10,"아주아주기본서, 중등교재부터보길원하는 성인을위한 쪽팔림방지용 교재 매우좋습니"
9788990700056,8,해커스는 정말 좋은 시리즈 이지요.
9788990700056,10,실력다지기에 좋은 책이예요!!!
9788990700056,8,인강과 같이 듣고있는데 좋은것 같네요
9788990700056,8,좋은책이라는건 인정하지만.. 완전 초보가 보시기에는 조금 어려우실듯..
9788990700056,8,고등학생이보기에좋은책인거같습니다
9788990700056,10,완전 좋아요~ 초보를 위한 책이에요 ㅎㅎ 문법을 잘 할 수 있을것 같아요!
9788990700056,8,문법 꽝인 사람들이 처음보기에 좋은 책
9788990700056,8,평보고 샀는데 이제 큰 맘 먹고 시작해보려고 합니다.
9788990700056,8,처음 시작하는 사람들이 하기 좋을 듯 정말 쉬우니까 좀 안다 하는 사람에겐 별로..
9788990700056,10,"지금까지 알아왔던 문법책 중에 가장 최고인듯!
구매 하셔도 절대 후회 없어요 ~"
9788990700056,10,해커 교재 첨 구입. 진짜 혼자하기 좋네요
9788990700056,10,말할것없이그냥굿말할것없이그냥굿말할것없이그냥굿
9788990700056,10,"토익,편입,수능 등등 기본문법은 이 책 하나면 모두 끝장볼듯하네요~문법초보에게"
9788990700056,10,딱 한달만에 끝냈네요! 처음 문법공부하는데 어려움없이 접근하기 너무 좋아요~!!
9788990700056,10,문법 기초를 이 책으로 다졌다고 해도 과언이 아닐 정도로 넘 잘 썼어요. 너덜해졌죠
9788990700056,8,믿을만 합니다
9788990700056,10,내용 정리가 쉽게 잘 되어있어요 기초가 부족하신 분들께 강추~ ㅋㅋㅋ
9788990700056,8,"내용 정리 잘 되어있어요~^^!
근데, 너무 문제가 쉽다는것, -_-;;"
9788990700056,10,역시 해커스 짱
9788990700056,10,"진짜 기초부터 배우는 책..
그래도 그래머 인 유즈를 추천"
9788990700056,10,당장 영어 공부를 시작 하라 ~당신의 미래를 위해
9788990700056,10,"매우 마음에 듭니다. 초보자 분들에게 과연 강추!
일단 지르시고 공부 합시다. ㅋㅋ"
9788962818642,10,영문법을 매우 쉽게 풀어 놓아서 처음에는 쉽게 접근했다가 점점 빠져들면서 나중에는 감동을 주는 국내 유일하게 단 하나 밖에 없는 독특한 영문법 책 이라고 생각됩니다 .
9788962818642,10,영어를 배우는 것보다 익히게 만들어 주는 책입니다이 책은 기초를 탄탄하게 해서 튼튼한 나무로자랄 수 있도록해 주는 영양분이 아니가 싶습니다또한 항상 선생님도 배우고 익혀서 알려 주시는 모습이 더 훌륭하십니
9788962818642,10,영문법책이후 이책도 구매하게되었습니다 둘다 지후쌤이 영어의 근본부터 들어가기때문에 무리없이 그리고 쉽게 차근차근 풀어나가줍니다 이 책을 첫장을 넘기며 느꼈습니다 이책도 정말 온갖정성을 쏟으셨구나 감사하다는 말을 전하며 리뷰마칩니다 #나만 알고싶은도서 xoxo
9788962818642,10,엄마표를 하다보면 문법으로 넘어갈 때 엄마표를 하던 아이들은 조금 어색해하고 한 번은 부딪히는 지점이 있습니다. 그때 논리적으로 문법을 아이에게 이해시키는 것은 정말 중요한데요. 그동안 많은 책을 봤지만 그냥 외워라가 아닌 이해를 바탕으로한 영문법을 접하게해줄 엄마표영문법첫단추라생각
9788960498617,10,"이 책 정말 좋네요~ 영어 공부를 할 수록 궁금한 내용들이 잘 담겨 있습니다.  추천 하고 싶고, 주변에 권하고 싶네요. 상황별 조금씩 다르게 적용 되는 예문이 수록 되어 있어 훨씬 이해가 쉬워요. 정말 괜찮은 책인거 같아 리뷰 남깁니다."
9788960498617,10,알듯 모를듯 햇갈리던 단어들의 미묘한 차이점들이 잘 정리되어있어요. 주제별로 예문대화도 같이 있어 실제 상황에서 어떤 느낌으로 쓰이는지 쉽게 알 수 있네요.
9788960498617,2,설마 했는데. 한국에서 영어 좀 공부하는 사람들은 거의 알만한 초보적 내용이 대부분이라. 한마디로 책 참 쉽게 냈다
9788960498617,10,평소 바라던 책이어서 구입했는데 실제 영어공부에 도움이 돼요 이 분의 다른 책도 읽고 싶어지네요
9788960498617,10,이책 너무 좋은거 아닙니까??비슷한 단어들의 자세한 설명과문장들로 한번더 공부가 되네요!!공부하는데 엄청도움될것같아요!!너무 유용해서 공부하고싶은 열정이 막 생기네요~저자님의 다른책들도 알고싶어지네요~감사합니다
9788960498617,10,고급 영어로 가는 첫 걸음은 단어의 뉘앙스를 제대로 아는 것. 적확한 영어 사용에 매우 유용.
9788960498617,10,영어활용면에서 도움이 되는 좋은 책이네요^^~이런뉘앙스를 정확히 알면 좋겠죠.
9788960498617,8,나 너 좋아해 / 나 너는 좋아해 두개 뉘앙스를 구별할 줄 아시는 분 계시나요? 계시다면 설명해주세요 저는 잘 모르겠거든요
9788960498167,6,영어가 직설적이면서 완곡한 이유가 궁금하시다면
9788960498167,10,"이 책은 영어 공부에 관심이 있는 모든 사람들이 쉽게 읽을 수 있게 쓰여져 있습니다. 개인적으로는 반복해서 읽으면서 각인시켜야 할 듯 합니다. 미국 여행, 유학, 출장 등을 앞두고 계신 분들이 보시면 좋습니다. 학생들도 영어 공부에 대한 개념을 형성하기 일독을 권유합니다."
9788960498167,2,영어회화문법 책의 같은 저자라고 기대하면 안됨. 잡담수준의 글모음. 특히 4부는 자신만의 개똥철학.
9788960498167,6,P182머리로 이해하는 것은 쉽지만  깨달은 바를 생활속에서 실천하는 습관을 형성할 정도의 변화를 가져오기 위해서는 그만큼 노력과 연습이 필요하다는 얘기이다.
9788960498167,4,영어 공부에 도움이 될까 해서 구입했는데 기대 이하에 실망스러웠음.
9788960498167,10,이렇게 영어 공부에 직접적으로 도움이 되는 미국 문화 공부는 처음이네요. 재밌게 술술 읽히기까지 해서 정말 강추합니다.
9788960498167,6,아 선생님 책은 믿고 사서 보는데 이번 책은 여전히 친절하긴 하나 좀 허술한 느낌.
9791190347006,10,"영어가 작동하는 원리? 같은걸 쉽게 배울 수 있어서 좋았어요. 사실 책으로 보면 엄청 간단해 보이는데, 이 간단한 원리가 우리말과 달라서 영어가 힘들었던걸 알게되었네요. 공부해도 회화 작문 실력이 안는다고 생각했다면 한번 공부해보시길 추천합니다."
9788917230581,10,유튜버 서메리님 추천으로 구입했습니다. 긴가민가하거나 이해되지 않는 부분이 있을때 찾아보면 좋습니다! 개인적으로는 ‘이러이러하다‘고 원칙만 알려주는 것보다는 왜 그렇게 사용하는지까지 알려줬으면 더 좋았을거라고 생각하지만.. 여러모로 도움 받고있습니다!
9788917230581,10,꾸준히 할 예정이다. 볼 만한 내용이 많은 책
9788917230581,10,레퍼런스로서 손색 없는 문법서의 결정판이라 할만합니다.
9788917230581,10,검색하는 기분으로 공부합니다 아주 유용합니다
9788917230581,10,"지난 3판에 이어 전면개정4판을 출간되자마자 구입하였습니다. 이번 전면개정판은 코** 등 유사 어법사전 보다도 생생한 실용어법과 표현들이 일목요연하게 정리되어 있어, 책상 서랍에 꽂아 놓고 수시로 찾아보니까 빠진 내용이 없어 든든합니다. 특히 영국유학 준비하는데 정말 유용한거 같아요~~"
9788917230581,10,유명하다해서 구매해봅니다 천천히 읽어보겠습니다
9788955185720,10,영문법에서 부족한 부분을 채워준 책입니다. 문체가 부드러워서 꼭 음성지원이 되는 것 같아요. 2권 심화편 내주시면 좋을 것 같아요.
9788955185720,4,그냥 다이제스트 한 영문법~ 시험에 나오거나 필수적인 영문법 정도.....상세 설명은 없고 간단히 빨리 정리 할수 있는 정도...넘 큰기대는 안하는게 좋음.
9788955185720,10,실용적인 문법을 위주로 핵심적인 내용을 담고 있어서 효율적이고 체계적인 학습을 할 수 있는 것이 좋습니다.
9788955185720,10,기본적인 문법 이론 정리와 실전에 필요한 문제를 수록하고 있어 실질적인 공부에 도움이 되는 책입니다.
9788955185720,10,"복잡하고 헷갈리는 부분에 대한 설명이 친절하고, 단계별로 풀어 나갈 수 있어서 좋아요."
9788955185720,10,"기초적인 영문법과 그에 어울리는 문제, 추가적인 미디어로도 배울 수 있다는 점이 학습에 무척 좋은 거 같습니다."
9788955185720,10,영문법의 기본적인 내용과 중요한 핵심 내용이 한눈에 보기 쉽게 정리가 되어 있기 때문에 좋은 것 같습니다.
9788955185720,10,꼭 필요한 영문법만 짚어주는 느낌
9788955185720,10,많은 정보와 다양한 내용들이 도움이 될 것 같고 상당히 유용한 것 같습니다.
9788955185720,10,영문법을 접근함에 있어 친절한 설명이 강점이다
9788955185720,10,"김대균 영문법, 저자의 이름이 교재에 들어가면 정말 자신있게 내세울 수 있는 그런 교재인줄 압니다. 김대균 강사가 영어의 문법을 여러분야의 부분에서 찾아서 수록해놓은 교재로 알고 있습니다."
9788955185720,10,실생활에 쓰이는 실용적인 문법의 구성으로 부담감을 줄이면서 자연스럽게 배워 나갈 수 있는 구성이 마음에 드네요.
9788955185720,10,암기와 직관적 이해의 조화
9788955185720,10,문법 때문에 영어를 어려워한 분이 많습니다. 계속 반복하시다면 감이 잡힙니다. 김대균영문법으로 실력을 쌓아보세요.
9788955185720,10,이번에는 적절한 영문법 책이 발행되었습니다. 이 책이면 회화 문법의 기초도 닦을 수 있겠어요.
9788955185720,10,처음에는 영문법 자체가 난해했지만 이 책으로 기본을 튼튼히 하게 되었습니다.
9788955185720,10,"기초가 가장 중요한 영문법, 어떤 시험에서도 빼놓을 수 없죠. 이 책을 읽으니 영어를 더 공부하고 싶어집니다."
9788955185720,10,김대균 영문법이 나왔군요! 완전 기대됩니다
9788955185720,10,적절한 난이도의 예문으로 골랐을 뿐인데 영문법 공부가 헷갈리지 않네요!
9788955185720,10,저자의 노하우를 바탕으로 핵심만 간단하고 명료하게 정리한 책이여서 영어 공부에 많은 도움이 되었습니다
9788955185720,10,영문법의 기초를 다지는데 가장 적합한 책이네요 저자가 워낙 유명하신 분이기에 많이 찾으실듯 합니다
9788955185720,10,문법책은 어렵고 지루하다는 편견을 깨주는 쉬운 영문법 책. 영문법 무조건 외워라? NO! 꼭 알아야 하는 영문법만 친절하게 설명해줘서 효율적으로 간단하게 공부할 수 있습니다.
9788955185720,10,학창시절부터 헷갈렸던 영문법을 꽉 잡아주네요. 성인이 되어 영어공부를 다시 시작했는데 이 책이 영문법 기초를 튼튼하게 해주고 있습니다.
9788955185720,10,저자의 이름만으로도 선택하는데 있어서 망설임을 화지 않아도 되는 확실한 영문법 책입니다.
9788955185720,10,대학 시절부터 토익 공부하면 무조건 김대균 선생님의 강의를 들었습니다. 김대균 선생님이 정리한 영문법 책이라고 하니 믿음이 갑니다.
9788955185720,10,실제 일상에서 쓰이는 예문과 명언으로 쉽고 재미있게 정리하고 공부할수 있을것 같아요
9788955185720,10,딱딱하고 어렵게 느껴지며 시간이 지나면 헷갈리기 쉬운 영문법을 노력하고 검증된 EBS 강의의 김대균 영문법으로 기본에 충실하면서 전체적으로 그리고 핵심에 집중하는 내용으로 쉽게 익혀봐요.
9788955185720,10,막 처음부터 외우려고 하지말고 소설책 읽듯이 가볍게 처음 본후에 계속 반복적으로 보면서 공부하시는 것을 추천합니다. 김대균선생님께서 필요없다는거 다 쳐내시고 하셨으니 안나온거에 대해서 미련두지말고 책에 나온것만 확실히 알아두면 점수는 확보될것입니다.
9788955185720,10,정말 쉽고 초보자들도 도전하기 좋은 포인트로 책을 만들었다는 것이 느껴지는 구성이네요. 영어 문법을 공부하려는 분들에게 꼭 추천하고 싶은 책입니다.
9788955185720,10,기초이면서 핵심인 영문법을 엄선해서 개인적 공부든 시험에서든 실용성 높게 구성하고 비교예문을 통한 상세한 설명과 문제를 통한 반복 정리로 확실히 내 것으로 만들어주는 김대균 영문법! 만족스런 교재네요.
9788955185720,10,오랜시간 터득한 노하우를 바탕으로 영문법의 가장 기본적이고도 핵심 내용만 간추린 책이라 추천합니다
9788955185720,10,이전에 김대균 선생님 강의 잘 들었는데 영문법 책이 새롭게 나왔다니 더욱 기대됩니다.
9788955185720,10,영문법 공부가 가장 어렸웠는데 중요한 핵심만 모은 책이라서 효과가 좋습니다. 많은 도움이 되네요.
9788955185720,10,중요하고 실용적인 부부만 쏙쏙 알려주시는 김대균 선생님의 알자 노하우가 담겨 있어 많이 도움이 되는것 같아요.
9788955185720,10,영문법이 너무 어려운데 이해가 잘되게해주세요
9788955185720,10,학생 때부터 익숙한 김대균 선생님이라서 더 믿음이 갑니다. 한동안 손 놓아 다시 토익을 시작하려니 걱정이었는데 이 책으로 시작해야겠어요.
9788955185720,10,오래 되어 잊어버린 영문법을 새롭게 공부하기에도 무척 좋은 책인 것 같아요.
9788955185720,10,어려운 영문법 도움좀 받았으면 좋겠습니다! 기초부터 심화까지 부탁합니다!
9788955185720,10,핵심 내용들을 공부할 수 있어서 좋은 거 같아요
9788955185720,10,핵심만 모아서 나온 완벽한 토익책! 잘나오는 영문법만 모아서 나와서 보기도 정말 좋은 것 같아요!
9788955185720,10,학생들부터 성인까지 함께 공부하기 좋아 한권으로 온가족이 영어정복할 수 있어요.
9788955185720,8,EBS 라디오 들으면서 공부하면 좋을것 같아요~~
9788955185720,10,EBS로 손쉽게 접근할수 있는 영문법책으로 정말 최고인것같아요. 그렇기에 큰 도움이 될 수 있을것 같습니다.
9788955185720,10,영어를 열심히 공부하고싶다면 이렇게 실용적인 영문법이 좋을 것 같아요.
9788955185720,10,어려운 영어 그 중에서도 실용적인 영문법을 공부하는 데 도움을 주는 책인 것 같아 기대됩니다.
9788955185720,10,지긋지긋한 영어문법을 좀더 쉽고 효율적으로 공부하게 하는 책이네요 내용이 충실하고 핵심적인 내용이 잘 있어서 공부하기에 좋은 책입니다
9788955185720,10,"영어를 공부해보고 싶어도 막상 공부를 하려고 하면, 어휘를 외우는 것도 어려운데 문법은 얼마나 더 어려울지 몰라서 쉽게 포기를 하게 되죠. 김대균 선생님과 함께 하면 그런 걱정을 싹 날리고, 쉽게 영문법을 공부할 수 있겠네요~"
9788955185720,8,문법은 늘 어렵지만 언제나 마스터하고 넘어가야 하는 필수적인 영어의 핵심입니다. 이 책이 최상의 시나리오가 되겠습니다.
9788955185720,10,문법의 중요성은 알지만 부담스러운 책들이 많은데 정말 중요한 핵심적인 문법만 담아서 시작하기에 좋습니다 자연스럽게 실제로 쓰는 기본적인 영문법을 배우면서 부담없이 조금씩 꾸준히 할수 있어서 전체적으로 공부하기에 유용해요
9788955185720,10,우리에게 꼭 필요한 영문법 알짜핵심들만 모은것이라서 책의 효율이 좋습니다. 김대균 선생님의 다른책으로 예전에 공부했던 기억이 좋아서 이번에 새롭게 구입해봤습니다. 여전히 내용이 풍성하고 추천할만합니다.
9788955185720,10,김대균 선생님의 책은 늘 도움이 많이 되죠. 이번에도 좋은 참고서이길 바랍니다
9788955185720,10,실용적인 예문과 핵심적이고 친절한 설명으로 영문법을 정리해줘서 좋아요!
9788955185720,10,예시와 문법을 쉽고 간결하게 알려줘서 괜찮아요
9788955185720,8,"늘 쉬웠던 영문법 공부가 없었는데, 이번에는 희망을 걸어봐도 좋을까요"
9788955185720,10,영어 수험공부를 할 때 가장 기본적으로 공부해야할 영문법에 대해 핵심 문법과 개념들을 세세히 알려주어서 처음 공부하는 사람들에게도 많은 도움이 될 거 같아요
9788955185720,10,영문법 너무 어렵고 시작하기 힘든데 이 책 읽으면 쉽고 재밌게 진행할수 있을거 같아서 기대가 크게 됩니다!
9788955185720,8,예문이 있어서 이해가 빠르네요.예전만큼 문법을 강조하진 않아도 문법이 언어의 기본인 건 분명하네요.요점이 잘 정리되어 있어 책손놓은지 오래된 직장인들 공부하기좋군요.
9788955185720,10,항상 숙제로 남아있던 문법을 해결할 수 있는 기회가 될 것 같아 기대가 되네요~~
9788955185720,10,어려운 영어 문법을 조금이나마 쉽게 공부해볼 수 있는 기회인 것 같네요. 워낙 유명하신 강사님의 책이다보니 더욱 기대됩니다.
9788955185720,10,늘 영문법을 시작하다 몇장 못넘기고 실패하고 마는데 영문법을 쉽고 재미있게 설명해주니 도움이 됩니다.
9788955185720,10,영문법 기초가 부족한 학생이 기본기를 다지는데 유용한 교재네요. 기대됩니다.
9788955185720,10,실용적인 문법을 다루었다고하니 기대되네요.
9788955185720,10,영어 문법의 핵심을 자세하게 풀어 설명해줘서 좋습니다. 영어 실력 향상에 도움이 많이 될 것 같아요.
9788955185720,10,명사부터 시작하는 문법 책이라 조금 당황했지만 아이가 말을 배울 때 가장 먼저 시작하는 명사부터 문법 범위를 서서히 확장시켜나가는 진행 방식이 학습에 많이 도움이 되었습니다! 역시 김대균 쌤!
9788955185720,10,"단지 문법 공부로만 끝나는 영어 공부는 쓸모가 없다. 문법을 바탕으로 회화, 작문, 독해 등 제반 실력이 늘어나야 문법을 공부한 진정한 의미가 있다. 이 책은 단순히 암기로만 끝나는 영문법이 아니라, 탄탄하고 섬세한 문법 지식을 바탕으로 나만의 생각을 효과적으로 담아 원어민과도 영어로 자연스럽게 소통하는 기적을 맛보게해 줄 것이다."
9788955185720,10,"김대균님 책을 예전부터 많이 봐왔어요. 이번에 영문법 다시 한번 정리할려고 구입했는데, 괜찮아요."
9788955185720,10,정말 유명한 저자라서 영문법 책 살피는 사람이라면 한번쯤 살펴보고 구입해볼 가치가 충분합니다.
9788955185720,10,놓칠 수 없는 핵심체크! 알짜 노하우가 담긴 영문법책을 만나게되어 조금 더 실용적으로 배울 수 있게 될 것 같아 기대가 커요!
9788955185720,10,영문법 총정리를 통해서 쉽고 좀더 이해하는게 더울 더 수월해진거 같습니다
9788955185720,10,김대균 선생님의 영문법 총정리를 통해서 재밌고 쉽게 영문법을 배울 수 있어 좋습니다.
9788955185720,10,쏙쏙 들어오는 강의에요!! 추천합니다
9788955185720,10,김대균 영문법이라니 영어 문법에 자신이 없었는데 공부하면서 자신이 생길 것 같습니다. 어려운 문법들도 머리에 쏙쏙 잘 들어오겠네요.
9788955185720,10,영어공부에 많은 도움이 될 것 같아요
9788955185720,10,해도해도 잘 늘지 않는 영문법 공부의 노하우를 알 수 있을 것 같아 기대됩니다. 이번 책으로 영문법 완벽하게 다지는 시간이 되었으면 좋겠습니다.
9788955185720,10,영어공부를 할 때 가장 중요하다고 생각하는 것은 밥을 먹듯이 꾸준히 하는 것이라고 생각하는데 공부를 하고 싶게 하는 책이라 꾸준히 반복해서 할 수 있게 도와주는 것이 이 책의 가장 큰 장점이라고 생각합니다. 꾸준히해서 실용적인 영어와 가까워지고 싶어요~!!
9788955185720,10,나이가 들수록 아이들의 간단한 질문도 답을못하고 있네요. 이제 엄마도 영문법 다시 공부해서 아이들의 질문에 멋지게 대답하고 싶어요!!
9788955185720,10,"정말 중요하고 필요한 문법을 담은 김대균 선생님의 오랜 강의 경력으로 쌓인 데이터를 기반으로 학생들이 궁금해 하는 점, 잘 모르는 점의 포인트를 잘 짚어낸 문법 강의서라 어느 교재도 설명하지 않았던 부분을 세세하게 설명되어 있어 기대가 되는 책입니다."
9788955185720,10,문법간의 차이를 확실히 설명해주는 점이 도움이 되네요. 강의를 들으며 함께 공부할 수 있어 좋아요.
9788955185720,10,쉽고 재미있고 간결하게 영문법 공부하기! 김대균 영문법 정말 좋네요~
9788955185720,10,꼭 필요한 내용과 핵심을 쉽게 설명하고 있다는 느낌!  매우 유익한 책이란 생각에 나와 애들을 위해과감히 구입. 끝까지 해볼랍니다!
9788955185720,10,다가가기 어렵던 영어를 쉽게 다가갈수있겠네요.
9788955185720,10,체계적으로 정리된 것 같아 좋습니다.
9788955185720,10,문법차이를 확실하게 설명해주눈 책이라 도움이 되는 거 같아요
9788955185720,10,역시 명불허전입니다.
9788955185720,10,지루하지않고 계속 가지고다니면서 쭉 여러번 읽어보고 확인하고 하다보면 영문법에 틀이 잡히게됩니다. 우선 계속게속 눈에들어오도록 읽어보세요
9788955185720,10,영문법.. 고등학교때부터 영어 문법문제는 버리고 시작했는데 성인이 되서도 영문법이 어렵네요이책보고 많은 도움이 될거 같아요ebs 로도 진행하신다니 강의도 무료여서 이용하기 더 편리할거 같습니다
9788955185720,10,처음 문법의 틀을 잡고 점진적으로 영문법에 대해서 배우고 명언부분도 담고 있어서 틀을 제대로 배울 수 있을 것 같아 기대되는 책입니다.
9788955185720,10,영문법에 대한 총정리..읽어 보고 싶네요~~ 궁금하고 기대됩니다!!
