ISBN13,rating,review
9788955185720,10,해외여행을 앞두고 있어 영어회화 책을 펴보니 적잖이 당황되는데 여행전에 기본적인 문법을 마스터해서 조금 더 자연스러운 영어를 구사하도록 노력해야겠어요. 토익전문가의 영문법책 기대됩니다.
9788955185720,10,기본을  배우면 실력이 늡니다.
9788955185720,10,이 책이 가지고 있는 목표는 거의 모든 세대에게 가장 핵심적인 문법을 전달하자!로 요약할 수 있습니다. 너무 사소하거나 너무 학구적인건 과감하게 제하고 시험과 회화에서 많이 쓰이는 문법들은 그 뉘앙스까지 정복하자는 취지지요. 놀라운건 기존의 두꺼운 영문법서보의 반정도의 두께라는 거..!
9788955185720,10,ebs강의로만 들을 수 있었던 선생님의 체계적인 수업을 책으로 만날 수 있어서 기쁩니다.
9788955185720,10,토익에서 유명한 김대균 선생님의 책이라 기대되네요
9788955185720,10,영어공부하는데 많은 도움이 되겠네요
9788955185720,10,영문법 강의로 명성이 자자하신 김대균 선생님의 강의와 교재로 영문법 공부를 완성할 수 있어서 좋아요. 기본 개념부터 시험에 나오는 핵심 문법 내용까지 알차게 공부할 수 있어서 좋아요. 영문법은 역시 김대균 영문법이네요.
9788955185720,8,토익으로 도움 많이 받아서 믿을 수 있다.
9788955185720,10,어렵게 느껴지는 영문법을 쉽게 공부해요
9788955185720,8,성문같은 어려운 영어에서 벗어나 조금 더 접근성 있게 설명해놓은 책
9788955185720,10,필요한 내용을 중심으로 이해하기 쉽게 구성되어 있어 머리에 쏙쏙 박힙니다. 원어민이 실제 사용하는 영문법을 중심으로 미세한 차이의 의미까지 설명하고 있는 점이 마음에 듭니다.
9788955185720,10,무엇보다 괜히 어렵기만 하고 실제로 별로 필요하지 않는 영문법은 빼고 실전형 영어에서 필요한 문법을 쉽게 정리해 주고 잇는 점이 좋네요. 특히 핵심내용을 바로바로 반복학습할 수 있도록 구성되어 있는 점도 마음에 듭니다.
9788962818444,4,"이전의 영어책들과는 다른 새로운 접근방식으로 설명을 하신점은 높게 평가합니다. 그러나 겉핥기식의 설명이라는 느낌을 지울수가 없었고, 여기저기서 읽으신 내용을 그대로 편집한 느낌이 듭니다, 일례로 최인철 교수님의 실용영문법 백과사전 184페이지는 거의 그대로 사용하셨더라구요 예문도 똑같"
9788962818444,4,내용은 둘째치고 배송 좀 곱게 해주면 안되나ㅠ새 책 뜯는데 표지부터 안쪽 3장까지 찢어진채로 왔다.보는데는 지장없지만 내가 중고책 산 것도 아니고 ㅋㅋㅋㅋ 이런 책을 받아야되나 ㅠㅠ내용도 생각보다 나같은 영포자랑은 좀 안 맞는 책이였다.어느정도 지식이 있어야 좀 이해할듯
9788962818444,10,가끔씩 유튜브로 보곤 했었는데 책이 나왔네요궁금해서 사서 중간정도까지 보고 있는데내용이 너무 유익해요ㅎㅎ재밌게 읽고 있습니다
9788962818444,4,책을 좀 읽어보고 후기와 별점을 달았으면 좋겠다. 아직 배송중이라는데 ˝기대할게요~ ˝ 이러면서 별 다섯개를 주는건 뭔가.
9788962818444,4,")를 뽑아낼 수 있을 때까지 학습 및 영어를 접하는게 해답입니다. 그러니 파닉스든 발음기호든 배우고, 직접 영어를 접하세요"
9788962818444,10,주지후 선생님  강의는 제가 평생 공부해온 문법에서는 보지도 듣지도 못했던 내용이었어요. 이분을 왜 이제 안거죠? 최고십니다. 신세계가 열릴거에요. 이해하고 쓰는영어를 습득하시게될겁니다.
9788962818444,10,지후쌤 프로필사진 너무 이쁘게 잘나왔어요. 출간축하드립니다.!!
9788962818444,10,오래전부터 영어를 익히고 있는 저는 작년부터 지후쌤을 알게 되었습니다 유튜브강의는 영어회화를 하는데 있어서 무척 유용했고 계속 반복하며 듣고 있습니다 책에 있는 내용을 2배이상으로 흡수 할수 있을거 같습니다 내일이면 책이 배송되네요 이 책은 평생소장하겠습니다!
9788962818444,10,이제 곧 받아볼수 있게되어서 너무 설렙니다!!!!!!!!유튜브가 아닌 이렇게 책으로도 공부를 할수 있게 해주셔서 감사합니다.
9788962818444,10,평소 챙겨보던 유투브 채널이라 책 너무 기대중입니다. 내일부터 배송시작이네요. 빨리 받아보고 싶어요
9788962818444,10,타이밍을 놓쳐서 예약구매 첫날에 구매를 못했네요...지금이라도 예약구매를 하게되서 다행이네요...너무나 기대됩니다~!!  빨리 받아보고 싶네요...^^
9788962818444,10,구독자로서 오래 기다린만큼 너무 설레입니다쌤 출간 축하드리고 항상 응원합니다!!앞으로도 좋은 강의 계속 부탁드려요
9788962818444,10,"별칭과 영어이름이 아닌 본명을 걸고 유튜브를 하는 영어 강사. 또한 대부분 자신이 놀던 우물에서 쓰는 말로만 표현을 단정짓지만, 주지후님은 아는 것도 근거를 찾으려 문헌을 참고하고, 주변 교수들과 의견을 나눈 후에 가장 쉬운 말로 전달. 문법을 외우지 않고 느끼게 함. 영어강사가 보는 영어책"
9788962818444,10,애들이 커 갈수록 영어실력이 향상 되면서 제가 위축되는것을 느낄때쯤 학원갈 시간적 여유가 없어서 유튜브를 검색하다가 지후쌤의 강의를 듣고 다시 영어 공부에 자신이 붙고 있는 구독자입니다. 책으로 영어 실력을 업그레이드하여 애들과 영어를 편안하게 구사하는 날이 곧이라 생각됩니다.감사요
9788962818444,10,"유튜브에서 현재완료편을 보고 머리를 탁 치는 경험을 한 후,  완전 팬이 되었습니다.언제나 명쾌하고  쉬운 설명 철저한 고증과 논증.영어 뇌를 만들어 주는 유일한 책이 아닐까  합니다.빨리 책 배송해주세요!"
9788962818444,10,기다리고 기다렸던 선생님의 영문법책!!!ㅠㅠ 기초부터 차근차근 이해하고 싶은 왕초보의 마음을 정확히 꿰뚫어서 설명해주시는 쌤 덕에 영어에 대한 희망과 꿈을 잃지않고있어요!!! 당연히 예약구매완료! 항상 감사드립니다!!♡
9788962818444,10,유튜브로 준비하시는 과정을 보았기 때문에 믿어 의심치않고 구매했습니다 :) 항상 어렵게만 생각했던 영어가 지후쌤 덕분에 친근해지고 있어요! 이 책도 분명 많은 사람들에게 도움이 될거라고 생각합니다가격도 합리적이고 소장가치 충분합니닷!!!
9788962818444,10,지후쌤 유튜브 강의 정말 유익하고 좋아서 기대 많이 했어요! 얼른 예약구매했습니다~ 기대되요 ^^
9788962818444,10,장담컨데 이 책은 기존의 무조건 암기 문법책이 아닙니다.이분은 문법들이 왜 이렇게 되었는지 이해시켜주시는 분입니다.이해가 되지 않는데 그저 ‘이렇게 외워‘라고 명령조에 질려 문법과 멀어졌던 분들은 꼭 이 책을 보셨음 합니다.거짓말이라고요?이 책과 지후쌤 유튜브에서 확인해 보세요~^^
9788962818444,10,유튜브 구독자로서 책이 나온다니ㅜㅜ기대됩니다! 지후샘의 영문법 강의 덕분에더이상 영어에 겁먹지 않게 되었고즐겁고 쉽게 접근할 수 있게 되었어요!
9788962818444,10,"오~완전 기대되는 책이네요^^*처음 알게됐는데, 책 미리보기 보고바로 예약했어요:-)"
9788962818444,8,저도 기다렸어요 유튜브 보면서 ... 빨리 보고 싶어요 책
9788962818444,10,"유튜브에서 보고 설거지할때마다 공부해요. 진짜 이런식으로 문법을 조물조물 만져주고 뉘앙스 완벽히 설명해주시는분 첨봤어요. 무조건 사야합니다. 특히 조동사 과거시제로 돌리는게 약간 한발짝 뒤로 빼는, 강요느낌을 뺀 것이라는 이 기가막힌 설명을 들은 이후 can you? 와 could you? 차이 파악!"
9788962818444,10,유튜브 꾸준히 봐왔어요강의 내용이 신선하기도 하면서쉽고 재밌게 말해주셔서 좋았어요!!책도 구매해서 볼께요~~
9788962818444,10,"너무너무 기다렸던 우리 지후쌤 책! 유튜브 보면서 영어 공부에 대한 엄청난 동기를 부여받았는데, 그게 책으로 나온다니! 너무너무 기대됩니다~~ 좋은 책 많이 많이 나오면 좋을거 같습니다."
9788998114114,8,왕초보가 쉽고 오랫동안 공부할수 있도록 어렵지 않게 구성되어 있어 좋았다.12년 연속 스테디 셀러!!!! 다 이유가 있는듯~^^
9788998114114,10,시원스쿨은ㅎㅎ 참 다양한 언어를 했었어요윤식당이 유행일때는 이태리에 가고 싶어서 스페인어를 했고 일어도 있고 지금은 업무에 필요하고 답답해서 다시 하고 있는데요 좋은점은 문법이 어쩌고 하는게 아니라 무조건 입을 열게 한다는 점이에요어떤 부분에 can/did/would you?!를 써야 하
9788998114114,8,단순한게 최고다
9788998114114,10,아주 쉽고 좋습니다. 간단한 문장이지만 반복을 통해 습득하는 재미가 있어요
9788998114114,10,"소문으로만 듣던 시원스쿨 기초영어법 책을 구매했는데, 정말 왕초보용으로 너무 좋습니다. 그리고 점점 난이도가 올라가지만, 기초적인 단어 공부하면서 하면 너무 좋을 것 같네요. 정말 짱입니다."
9788998114114,10,기초를 쉽게 배울 수 있어 좋아요
9788998114114,10,2015년 개정판으로 보내주시는거죠?
9788998114114,10,초보자들도 알기쉽게 되어있어요
9788998114114,10,시원스쿨이렇게 쉽게 공부할 수가...하고 눈이 반짝 떠지는 영어책. 기본을 놓치고 있었구나! 생각하게 해주는 책이었다.
9788998114114,10,빠른 배송 감사합니다...
9788998114114,10,이렇게 쉽게 공부할 수가...하고 눈이 반짝 떠지는 영어책. 기본을 놓치고 있었구나! 생각하게 해주는 책이었다.
9788998114114,10,"단어 외우느라, 문법 공부하느라 시간 낭비 마시고, 기초부터 천천히 흡수하세요. 외우는게 아닌 흡수하는 법을 알려줍니다."
9788998114114,10,"기초를 정말 잘쌓고 싶어 하는 학생이라면 정말 추천드리고 싶은 책입니다.시중에 많은 영어관련 교재들이 많이 나와있지만 다 문법이라든지 혼자서 공부하기에는 부담스러운 교재들이 많은데, 이책은 혼자서 훈련하"
9791157521968,8,수험교재이다 보니 아무래도 구식영문법의 설명이 남아있지만 나름 꼼꼼한 설명으로 드물게 알찬 책입니다. 중급자 이상이 정리용으로 보기에 적당합니다.
9791157521968,10,독학에 좋을 것 같아 샀어요. 알라딘 직배송 중고책도 분권 신청이 가능했으면...
9791157521968,8,부족한 채워줄 거 같은 책!!  쉽게 이해되도록 설명해놓아서 인상적이다.파이팅!!!!!!!!!!
9788960498228,2,별로다..
9788960498228,10,이 책은 어느 정도 영어 학습이 되어있고 어휘력도 뛰어나며 영어시험에서 고득점을 받음에도 여전히 원어민과의 자연스러운 대화가 어려운 사람들을 위한 책이다. 외국인은 전혀 알길이 없는 랜덤한 단어들의 조합인 이디엄을 잘 설명한 책이며 짜임도 좋아 원하는 이디엄을 바로 찾을 수 있다.
9788960498228,10,"김아영씨의 이전 영어문법책을 재미있게 공부해서, 구입을 했는데요. 일단 책이 편집상태가 이뻐요. 재미나게 공부할 수 있을꺼 같습니다."
9788960498228,10,구성도 찰지고 정말 재미있어요 근데 중상급 레벨 이상인 사람은 재미가 없을 수도 있겠어요 지금 필 받아 열심히 하고 있는데 당연히 이디엄은 모르는 게 많이 나오지만 그외에는 좀 쉽게 느껴져서 공부할 때의 기분좋은 긴장감은 좀 떨어지는게 유일한 단점입니다.
9788955185850,8,문제를 통해 영문법을 정리하기 정말 좋은 책입니다. 쉬운 내용부터 어려운 내용까지 다루고 있어 영어 실력 향상에 좋습니다. 해설이 조금 더 자세했으면 하는 아쉬움은 살짝 듭니다.
9788960495715,10,예문 문장이 길지 않고 짧다. 그래서 초급자가 연습하기도 좋고 실생활에서 쓰는 말이 많다. 쓸데 없는 표현이 없어서 나도 사고 친구한테 선물도 했다
9788960495715,6,쉽고 재미있게 공부할 수 있는 책인듯...
9791185719290,10,설명 자세하고 예문 많아서 좋아요
9791185719290,10,자타공인 김정호 타미 샘의 명강의
9791188669042,10,오호! 출판을 시작하셨나봐요? 앞으로 모든 한일쌤 영어책이 출판되길 !
9791197177903,10,참고하기 좋은듯
9788995151747,10,오래되었지만 괜찮은 책
9788995151747,4,"문제는 많이 풀어볼 수 있어서 좋은데 솔직히 문제 선지가 좀 ;; 그냥 내가 이 문법을 알아서 맞춘다기 보다는 다른 선지가 답이 될 수 없어서 정답을 고르는 뮨제들이 많음. 그리고 문장 해석하는 데 난이도가 꽤 있는데 ,, 문장 해석은 하나도 없음 ㅋㅋ 개판임"
9788995151747,10,기관토플 준비하기엔 딱이예요!
9788995151747,10,초급이신분은 다른책보세요..중급자이상이신분들이 문법 복습용으로 보기 좋습니다. 저는 만족하고 봅니다.
9788995151747,10,초급보고 공부하기 좋은 영문법
9788995151747,8,독학하기에는 어려운 책인 듯하네요. 강의를 같이 듣는 게 나을 듯합니다.
9788995151747,8,기관토플 준비용으로 샀습니다. 만족합니다.
9788995151747,10,기관토플을 준비하시는 이들에게 꼭 필요한 책 입니다~
9788995151747,10,문법정리를 기초로해서 문제와 함께해야하는 책입니다. 기초가 안됬다면 기본부터..
9788995151747,8,잘 활용하고 있어요...
9788995151747,8,내용이 잘정리되어있습니다. 기초로 딱 좋지만 문법 복습으로도 잘되있네요.
9788995151747,8,혼자 독학하기에는 어려운 책입니다!! 하지만 공부하고 나면 많은 도움이 되는 교재~
9788995151747,4,저도문법만되었는줄알았는데 어렵더군요 ㅠㅠ 초급은절대아닙니다
9788995151747,4,난 문법 설명이 되어 있는 책인 줄 알았음 ㅠ 문제만 있어요 ㅋㅋ
9791188669059,10,언제나. 명쾌한 설명입니다..부족한 부분을. 글어주는 느낌 입니다..기초인데. 종합수준입니다 이거보고. 문제집사서 공부하면.
9791157782284,4,로마자 표기법은 영어가 아니라 한국어에서 다뤄야하는거구만.
9791157782284,10,우리 아이가 중1인데 참 쉽고 재미있다고 하는군요
9791157782284,10,"매 단원에 기초편, 기본편, 중급편처럼 난이도 정보가 써져 있고, 암기할 부분은 초성을 따서 쉽게 암기할 수 있게 집필되어 정말 초보자가 보기에는 딱인 것 같아요. 그리고 저자 선생님이 인강에서 너무 쉽게 설명해 주시고, 모르면 카톡으로 실시간 답변해 주시니 더할나위 없이 만족합니다."
9791157782284,6,미리 보기로 정작 책이 어떤 내용인지를 알 수가 없네요. 목차랑 앞부분 부록만 있으니... 책 사러 종로까지 나가서 봐야하는지...
9791157782284,2,별로..
9791157782284,8,발음 기호부터 잘 나와있구요 열심히 공부만 하면 될듯하네요^^
9791157782284,10,"토익을 공부하는데 책이 너무 쉽고 재미있어서 좋아요. 특히 무료 인강도 시청할 수 있고, 저자 선생님에게 직접 질문하면서 공부할 수 있으니까 너무 좋네요."
9791157782284,10,저자분 열심히 활동하고 성의 있게 강의하는 것 같은데 댓글 보면 해도해도 너무들 한다.이곳저곳 돌아가면서 똑같은 악성댓글 다는 분들벌이 좀 나아지셨습니까?? 틀린 부분이 있다면 머가 틀렸는지 말은 하고 틀렸다 해야지 무조건 틀렸다고 해버리니... 여튼 난 좋았음!!
9791157782284,10,nathenkim이나 yehoon님은 옛날 영어라고 한 부분이 어디인가요?  솔직히 유니크 쏙쏙 영문법 만큼 현대적인 영어 한국에 어디 있나요? 이 책은 기존 잘못된 한국영어를 바로잡아 주는 최고의 책이라고 생각해요. 이 책만큼 정확한 영미 문법과 다양한 문장과 어휘가 수록된 책이 있으면 말해보세요.
9791157782284,10,이 책은 직접 봤을시 길게 늘어져있어 불편하다고 느낄 수 있으나네이버에 이 유니크 쏙쏙 영문법을 쳐보면 저자 홈페이지와 강의를 모두 유투브에서 볼 수 있고 한 강의당 15분씩 잘 설명해줘 이해하기 쉽고 좋습니다.
9791157782284,4,기초를 공부하려고 샀는데 사전같아요 수학책인데 공식만 적혀있고 관련문제 몇개있는.. 기초부터 할수있다고해서 샀는데 영못알은 도움아 안되네요
9791157782284,10,"좋아요 쉽게 잘 설명되어 있어서 이해하기 쉽게 되어있고,유투브 강의랑 같이하면 더 좋은것 같아요"
9791157782284,6,"초보자들에겐 불친절한 도서, 아는 사람에겐 요약 사전과 같은 도서. 잘보고 구매하시길"
9791196347123,10,너무가볍지도 쓸데없이 장황하지도 않고좋습니다.저자의 논리 흐름대로 읽어나가다보면 영문법의 뼈대를 자연스레 잡을수있을듯. 간결하고 핵심적인 설명과 예문들 심플한 확인문제로 구성되어있어용.만족힙니다 ㅎㅎ
9788959975426,10,영문법 기초가 부족할 경우 컴팩트하게 정리할 수 있는 교재다. 열흘 정도에 문법 전반을 빠르게 정리할 수 있는 분량이다.
9788959975426,10,토익 열공에 앞서 그놈의 문법 좀 확실히 하려고 구매했어요. 아자아자~!!
9788960498587,10,"일단 제목이 땡겨서 구매했는데 내용이 너무 알차서 대만족입니다. 하나의 주제에 대한 짧은 대화형태의 글이 있고 중요표현, 리뷰, 확장회화가 있고 따로 연습 해 볼 수 있는 엑스트라 질문이 있습니다. 회화 공부에 이보다 더 완벽한 책은 본 적이 없습니다. 학원 교재로 쓴다면 완벽할거같습니다"
9788960498587,10,"어쩜 한국인이 하고 싶었던 말만 이렇게 다 모아놨을까요? 대박이네요! 공부 안하고 그냥 읽기만 해도 귀에 쏙쏙 들어옵니다. 미드에서 몇 번 봤던 표현들도 보이고, 문장속에 이런 표현들이 녹아있어서 실제로 말하기에 많은 도움이 될 것 같습니다~목차 보자마자 소장하고 싶은 책입니다."
9788917230574,10,정말 영어 문법 공부 어려운데 이 책을 보면서 하면 쉽게쉽게 배울 수가 있습니다 강추합니다
9788917230574,10,"그림으로 배우는 영문법, 답답한 텍스트 설명에서 벗어나 그림으로 직관적으로 이해하고 오래 기억할 수 있는 비주얼 영문법. 유튜브 해설 강의와 함께한다면 단숨에 영문법을 정복할 수 있겠네요! 비주얼 영문법 추천합니다!!"
9788974575366,10,"기대를 많이 했는데요,  간편함을 목적으로 해서인지, 설명도 너무 간단하고,  예문의 구성도 좀...  생각보다 실망이 크네요"
9788974575366,10,깔끔하게 정리되어 있어서 보기 편합니다.
9788974575366,8,"'왕기초 영문법'이란 제목이 시사하는 바와 같이 초보자들이 시작하기에, 부담없는 양으로 쉽게 만들어진 영문법 가이드라인 책이다.어렴풋이 학창시절에 배웠을때 이해되지 않았던 영문법이 생각보다 쉽게 해석되어 지게끔 설명이 쉽고 간결하다."
9791157524471,10,영문법 처음에는 쉽다가 뒤로 갈수록 흥미가 없어지는데..이 책은 생각없이 샀는데 끝까지 다봤다~!
9791157523672,8,"상위권 중학생들 문법 마무리용으로 쓰고 있는데, 조금 어려워하는 애들도 있어서 다른 책들도 한번 사용해볼까 이리기웃 저리기웃 해봐도 역시 이책으로 돌아오게 되네요. 깔끔하고 핵심을 짚어주는 설명과 다양한 문제들이 좋습니다. 단 상위권, 특목고 준비하는 학생들에게 적합한것 같습니다."
9791155093214,10,문법 공부할때 아주 많은 도움이 되는 책입니다
9791155093214,10,영문법의 바이블
9791155093214,10,적당한 삽화로 지루함을 없애서 기초부터 확실히 공부중입니다. 그래머노트1을 구매하고 2도 구매합니다
9791155093214,10,영문법 공부에 아주 좋아요
9791155093214,10,재미있게 영어공부할 수 있는 책이네요 시리즈로 구성되어있어서 더욱 좋습니다
9791155093214,10,영어문법을 잘 설명해주고 있는 교재. 재미도 있고 구성도 좋아 마음에 들어요.
9791155093214,10,차근차근 영어 문법을 기초부터 탄탄하게 알려주는 멋진 교재 Grammar NOTE 마음에 쏘옥 드네요.
9791155093214,10,우리말의 문법과 다른 영어의 시제표현과 조동사 등 이 책에 나온 문법을 잘 알면 영어가 재미있어지고 쉬워집니다. 중학생 눈높이에 딱 좋은 교재가 나와서 반갑습니다.
9791188808847,6,영어문장을 단순히 읽고 외우기하는것으로만 이해하고 학습하니 알지 못하는 문장들도 있었지만 문장구조를 이해하면서부터 이해력이 눈에 띄게 늘게 되었습니다. 뭐든지 구조를 알고 골격을 이해한다는건 깊이있는 학습을위해 꼭 필요한 일이라고 생각합니다.좋은책 감사히 읽었습니다.
9791188808847,6,내용은 좋으나 굳이 책의 크기를 이렇게 작게 할 필요가 있었을까요? 핸드북 수준이라 보기가 쉽지가 않네요.
9791188808847,10,정말 구조를 간략하고 그러나 확실하게 알 수 있게 쉽게 설명해준 것 같아요-반신반의했는데 개략적인 개관을 알 수 있어 도움되었고요 ^^
9791188808847,10,작고 가벼워서 들고 다니기 좋아요. 책에서 추천해준대로 하루에 한과씩 정독하고 있어요~ 문장구조라는 거를 처음 접해서 아주 익숙하지는 않지만 여러 번 보니 제 것이 되는 기분입니다!ㅋㅋ 올해는 영어를 정복하리라 기대해보며...ㅋㅋ
9791188808847,10,서점에서 보고 영어 초중급자용으로 좋은 것 같아서 구매는 안했지만 평점 남겨봅니다. 키 출판사책들이 좋은 책들이 많은데 딱 한가지 문제점이 있다면 종이가 너무 반짝거려서 스탠드 불빛 밑에서 공부할 때 잘 안보여요. 종이만 눈부심 방지 종이 쓰시면 만점일듯. 약간 노란끼나는 종이 추천요.
9788967909116,10,"저자의 실제 경험과 노하우가 녹아있으며, 현지 영어에 대한 문법적인 실제 활용예가 적절히 설명되어 있음"
9788967909116,10,훌륭한 영어 문법서... 별 다섯개가 아깝지 않다.
9788986451085,10,좋은 책 입니다. http://hanjabbu.tistory.com/3128
9788960498709,10,"미국 영어 문화 수업이 너무 괜찮아서 심화편도 나오자마자 구해서 읽었는데, 이번 편도 좋네요. 미국 영어와 문화의 다양한 양상을 배울 수 있었습니다."
9788917232417,10,작가의 친절한 설명이 마음에 드네요. 아울러 그림 설명도 문법을 이해하는 데 도움이 많이 될 거 같습니다.
9788917232417,10,제 롤모델 서메리님 책이라 믿고 구매했어요 제목처럼 술술 읽히네요 입으로도 술술 나오기를 기대합니다
9788917232417,10,재미있게 영문법을 공부해 보고 싶습니다 기대됩니다앙.
9788917232417,10,"서메리 작가님의 ‘회사 체질이 아니라서요‘를 읽고 팬이 되었어요. 영어에는 자신감이 없었는데, 유튜브에서 작가님이 알려주신 방법으로 천천히 공부하고 있어요. 작가님이 직접 쓰신 영문법이라니.. 너무 기대되고, 읽고 싶어요."
9788917232417,10,영어포기자도 쉽게 영어에 입문할 수 있는 그런 책이 될 것만 같아 기대됩니다. 분명 저 같이 영어에 큰 어려움을 겪는 사람에게 필요한 책이 될 것 입니다.
9788917232417,10,친구에게 선물받았는데 내용도 구성도 너무 좋아요많은사람이 알았으면 좋겠습니다영문법 뿌시려면  서메리님과 함께합시다!!!
9788917232417,10,"현역 공무원 수험생으로서 영어가 많이 취약한지라 영어 문법이나 단어에 관심이 가던중에 이 책을 알게 되었습니다. 문법은 아무리 쉽다고 해도 어려워지고, 지루해지는 데 이 책은 서메리 작가님이 어떻게 어려운 내용을 쉽게 풀어가셨을지 기대가 됩니다! 영어초보자로서 매우 기대되는 책입니다!"
9788917232417,10,기대되는 서메리 작가의 영어책이네요. 꼭 필요한 책이 될 것 같습니다.
9788917232417,10,"꺅~~ 서매리님 책이네요!!재미있게! 쉽게 술술 읽히는 영문법, 저도 배우고싶어요!!"
9788917232417,10,서메리님 책이라뇨! 그것도 영문법! 아이들과함께 공부할 생각이었는데 너무 기대됩니다.^^
9788917232417,8,"유투브와 함께 공부할수 있으니 흥미 업업↖️↗️ 더더 쉽고,이해하기 쉬울것 같아요❤"
