ISBN13,rating,review
9788963980539,10,출간된지 얼마안됐을때 구입해서 손도 안대다 이제와서 리뉴얼강의와 함께 보고있습니다. 간결한 설명과 문법정리로 알아보기 쉽습니다. 다만 문제가 몇 없는건 단점입니다. 신버전은 문제가 많이 수록된 대신 다시 3권으로 분권되어 가격이 꽤 나가더군요. 강의와 함께보기엔 좋습니다.
9788963980539,10,"한일선생님 짱이예요ㅋㅋㅋ
영어 공부열심히할게요~~~~"
9788963980539,8,좋네요
9788960491762,10,활용할 수 없는 문법공부가 아닌 진짜 영어공부를 위해 공부하고자 한다면 이 책이 정말 도움이 되고 좋은 책입니다.
9788995049099,10,이해하기 쉽고 좋네요.옛기억도 나고 ^^
9788995049099,8,군더더기 없는 깔끔한 해설이 강점인 책.
9788995049099,10,왕두꺼움 ㅋㅋ
9788995049099,10,예문이 머리에 쏙쏙 회화와 문법이 동시에.
9788995049099,10,영어기초자에게 굉장히 좋은책이다 다시 하면 영어를 정리하는 사람에게도 좋은책이다
9788991141247,10,영어의 기본 의미와 원리를 저자가 고안한 도구를 통해 단순하고 명쾌하게 소개한다. 영어와 내가 일체가 되어 언어 그 자체로 경험하고 느끼고 표현할 수 있다는가능성과 희망과 만족감을 느낄 수 있다. 가능성과 발전과 확장에 기반을 둔 저자의 의지가 독자의 가능성과 맞닿아 있다고 생각한다.
9788955189841,10,현장에서 활용할 수 있는 회화 표현을 익히고 문장 구조를 이해하며 문법 지식을 자연스럽게 쌓아볼수 있을것 같아서 기대됩니다
9788955189841,10,"문법은 이해가 잘 안되는데, 외국인들이 많이 쓰는 회화를 통해 배우는거라서 확실히 도움이 되겠네요"
9788955189841,10,문법이 언어의 기본이죠. 꼭 봐야합니다.
9788955189841,10,회화표현이 많아서 좋습니다.
9788955189841,10,김대균님의 책이기에 믿고 봅니다.
9788955189841,8,지금 이 순간 영문법 다시 공부한다. 그리고 이 책으로 끝내겠다.
9788955189841,10,김대균의 내용이 많아서 좋은 것 같습니다.
9788955189841,10,실생활에 직접 활용할 수 있는 회화를 보다 알기 쉽게 배울 수 있는 시간이 될 것 같아 꼭 공부해봐야겠습니다.
9788955189841,8,모국어 뇌가 정말 정말 굳었는데 김대균 선생님이라면 굳은 걸 부드럽게 풀어주지 않을까 생각합니다.
9788955189841,8,김대균님의 책이어서 확실한 기대감과 자신감으로 시작할수 있습니다.
9788955189841,10,영어를 다시시작할수 있게 용기를 주는 책인것 같아 열심히 공부해보고 싶네요
9788955189841,10,딱딱한 문법이 아닌 실제 회화에서 적용할 수 있는 문법 포인트들이 정말 좋습니다~ 저의 영어 실력 향상에도 큰 도움이 될 것 같아 기대됩니다~
9788955189841,10,다시 시작하는 영어공부! 이번에는 성공할거 같다. 기대됩니다!
9788955189841,10,영어 공부를 다시 시작하기에 좋은 책
9788955189841,10,배움은 끝이 없습니다.
9788955189841,10,딱딱한 문법 대신 70개의 회화 표현을 바탕으로 문법 포인트를 배우는 영문법책이에요.원어민들이 자주 사용하는 회화표현을 통해 문장의 구조를 이해하며 자연스럽게 문법을 익힐 수 있고 회화실력도 늘릴 수 있을 것 같아요.
9788955189841,10,영어는 언제나 사람들이게 난제라고 봅니다. 계속 탐구해야 하는 언어로 보다 한국인이 쉽게 할 수 있는 방법과 지능 지수에 따른 과학적 접근등도 활용해서 학습자가 보다 효율적인 영어 습득의 길이 열렸으면 하네요! 어느 나이대든 떠나 효과적 접근식을 제시하는게 좋습니다!
9788955189841,10,영어 초보자도 알기 쉽게 A~Z까지 문법을 착착착 기대됩니다
9788955189841,10,효율적으로 영어를 공부할 수 있겠네요 현지 회화 표현에 담긴 문법 포인트를 쉽게 설명하는 방식이라 이해가 쉬워요
9788955189841,10,영문법을 공부하느라 애쓰지만 정작 실전에 도움이 되지 않는 무의미한 공부가 아니라 회화와 포인트 문법을 연결시킨 학습법이 효율적인 공부를 원하는 성인에게 적합할 것 같아 기대됩니다.
9788955189841,10,"영어는 잘하고 싶고, 다시 공부하는 것은 역시나 한숨이 나옵니다. 이 책은 뇌가 굳어진 성인에게 가장 효과적인 영문법이라니 슬그머니 용기가 생깁니다."
9788955189841,10,영어에서 제일 어려운게 영문법이더라구요 영어를 배울때도 차례차례 영문법을 공부해야는데 아무리 해도 항상 포기하고 마는 ㅠㅠ 아무리해도 해도 도저히 따라가기가 힘든 저에게 딱 좋은 책 같아요 기초 탄탄하게 공부해서 영어울렁증 탈퇴하고싶어여
9791190847018,6,기획도 좋고 구성도 좋고해설이 너무 부족한건 아쉽다.아예 초보자가 혼자 독학하긴 불가하고무조건 1000문제를 풀다보면 자연히 감이 길러지길 바래야함
9791190847018,10,관사는 한국인의 사고와 많이 다른 개념이라 어려운데 훈련이 되서 정말 좋네요.
9791196618377,2,"강의 자체는 나쁘지 않은데 책이 구립니다. 2020년 개정판이라는 게 정말 놀라울 정도로 가독성이 극악입니다. 책 내용은 좋지만, 다음 개정판에서는 제발 가독성에 신경 써주셨으면 합니다. 책이 내용만 좋으면 됐지 디자인이 뭐가 중요하냐고 하실 수 있지만 이건 그 수준을 넘어설 정도입니다."
9791186738283,2,강의들으실분만 사세요. 참.... 이게 47000원? 내 47000원....올해들어 제일 허투루 쓴돈이네요. 그냥 구문 문제집입니다.
9791186738283,10,가장 정확한 구문강의라고 감히 추천드립니다.
9791186738283,10,영어의 본질을 알게해주는 명강의를 위한 교재입니다
9791186738283,10,비타에듀부터 상변선생님 인강을 시청했습니다.TS1을 감명깊게 들어서 후기남깁니다.비타에듀때에도 화질이 좋았지만 로그인하고 귀찮은게 여간 아니지만 작년부터 유튜브에 고화질강의를 무료로 들을수 있는게 가장 큰 장점입니다.강의 교재 선생님 삼위일체 그자체입니다.
9788966376285,8,"입시생들이 아닌, 대학생 또는 대학 이상을 졸업한 한국 지식인에게 일독을 권한다.역사 및 기타 언어와의 비교분석을 통해, 또다른 시각에서 영문법을 접할 수 있다."
9788955335569,10,불필요한 수식없이 깔끔하게 필요한 내용으로 구성된 점이 다른 책과 차별된 가장 큰 장점입니다.
9791161501468,10,이책은 실용적인 영어표현이 많이 정말 좋아요(^^). 그리고 콩글리쉬로 생각할수있는것들을 줄일수있어서 정말 좋아요(^^).
9791187632337,8,"나는 솔직히 이해력도 좀 떨어져서 영작문이랑 읽어도 잘 모르는데 이 책은 무지 쉽게 읽힌다.베껴쓰면서 어떻게 작문구조가 이루어지는지 알게되니 오래 기억이 된다.미드로만 영어공부했는데, 영문법 보충이 필요하다면 강추!"
9791196190811,10,영어의 구조를 정말 잘 보여주는 책 문법 개념설명도 잘 되있어서 좋아요
9791196190811,10,모든 영어책 중에서 베스트입니다꼭 필요한 내용만 잘 정리되어있네요
9791196190811,10,최고의 영어책! 영어 기초 세우기에 정말 좋아요 :)
9791196190804,10,정말 필요한 핵심문법과 문장구조를 이해하기 쉽게 배울 수 있어서 좋아요.
9791196190804,10,유튜브 강의도 있어서 혼자서 쉽게 할 수 있고 기초부터 잘 정리되어 있어서 도움이 많이 되요
9791196190804,10,정말 유용해요
9791196190804,10,매우 실용적이예요. 영어 베이스를 탄탄하게
9791196190804,10,최고의 영어책! 영어 기초 세우기에 정말 좋아요 :)
9791195452460,10,"저자만의 통찰력으로 누구도 설명하지 못했던 원리와 인과관계를 저자의 체화된 언어로 이야기 하듯 쉽게 풀어내었다는 것이 믿기지 않습니다. 그동안 얼마나 많은 탐구와 고민,조사 다시 검증의 과정이 있었을지... 쉽게 잘 정리된 인문학 책을 그냥 날로 받아 먹는것 같아서 죄송할 정도입니다."
9791195452460,10,첫번째 파랭이 동사편에 이어두번째 초랭이 준동사편을 학수고대하고 있어염~~^^첫번째엔 텀블벅 동참했는데 이번엔 아쉽게 놓쳐서ㅠㅠ세번째엔 꼭 동참해야징ㅎ박영재샘~~!!!홧팅하시고 건강 잘 챙기세여♡♡♡
9791161500324,10,왕초보탈출이네요.
9791186560464,8,"주술목 형태의 간결한 문장형식을 유지하면서 명확한 동사를 사용하도록 노력하는 것이, 어색하고 어려운 단어로 우리말을 1:1 대응하여 번역하는 것보다 훨씬 쉽고 뜻이 잘 통하는 의사전달이 된다는 저자의 주장에 동감한다."
9791186560464,8,"영어란 그런것이다. 한국어를 생각해서 영어를 말하면 꼬이는거다. 어린시절 미국에 공부하러 가서 느닷없이 배운 영어였기에 3년이 채 되지 않은 시간동안에 배웠던 영어가 오늘날 까지 나를 살려준다..ㅎㅎ 그때 배운 그 느낌을 담은 공부법이 책으로 나온 듯하여 사 보았으나, 역시 맥락이 닿았다."
9791186560464,10,우리나라는 점수가 아니라 영어단어와 대화의 교육을 해야도는데 모든걸 등수와 등급 같은 숫자화 시키려다 보니...
9791186560464,10,세 단어로 문장의 골자를 만들고 나면그 후에 차분하게 필요한 정보를 추가하여표현하는 방법을 배울 수 있다는군요
9791186560464,8,그레잇!
9791186560464,6,단어를 많이 알고 숙어를  많이 아는 영어 기본 있는 사람한테  좋은 책이네요.영단어카드 받았는데 영단어카드에 영어단어 인쇄되어 있는줄 알았는데 그게 아니라 자기 스스로직접 손으로 적는거네요.
9791186560464,6,"기대를 많이 했는데요, 영어 초보인 사람보다  어느정도 실력이 되는 사람들에게 도움이 되겠네요.."
9791186560464,6,"어느정도 영어를 알아야 도움이 되는 책입니다. 뭐 여러 책에서 볼 수 있는 ‘지금껏 배운 걸 잊어버려‘라고 많이 말하는데요, 사실 뭘 잊어버리라는 건지도 감이 안 옵니다... 이책을 굳이 분류한다면 ˝영어 어휘가 풍부한 사람들이 좀더 심플하고 멋스러운 영작법을 할 수 있게 하는 책˝입니다"
9791186560464,6,"내가 하고싶은 표현을 간편히 할 수 있다는 것에서 유익한 책이다. 그러나 회화를 할 때, 내가 표현을 하고 바로 마주치는 난관은 상대의 말을 알아듣지 못한다는 것이다. 고로 그들의 표현을 알아야한다. 이 책으로만 안되는 이유이자, 별도의 회화 공부가 필요해지는 이유다."
9791186560464,10,책 63페이지  또 explore라는 단어는 더 딱딱한 분위에서는... 오타 발생 ‘기‘ 삽입바람
9791186560464,10,간단한 영어 해보고 싶습니다.
9791186560464,10,아....8월3일날 샀는데 그때는 100단어랑 카카오 메모지 안주더니 ㅜㅜ 늦게 살껄...ㄷ
9791186560464,8,어차피 끝까지 못갈지라도 굳어버린 뇌를 풀기 위하여 만나봅니다.
9791186858837,6,36페이지 빈도부사에서 never 을 naver 이라고 오타가 있어용...
9791186858837,10,한국인이 기초문법 공부하기 편리하게 구성해놓은 책Grammar in use와 비슷하지만 설명이 더 이해하기 쉽게 되어있습니다.
9791195452446,10,"박영재 선생님, 영문법 다시 읽기를 읽으니, 예전에 외우기 바빴던 사실을 이해하게 되어 무릎을 치게 됩니다. 좋은 책 감사하다는 말씀 전하고 싶습니다."
9791195452446,10,내용은 훌륭한데 오타가 많고 문장이 앞뒤가 안 맞는 경우가 허다하다 검색해서 찾아낸 정오표도 허술하기 짝이 없다 출간전에 작가 본인도 제대로 읽지않은거 같다 작가가 영어는 잘한다고 할 수 있지만 그걸 설명하는 국어 실력은 그에 상당히 못미친다
9791195452446,10,만족합니다. 후속작도 기대할게요.
9791195452446,10,"최근에 출판된 영문법책 중 단연 최고의 책이라고 생각된다. 진정성 있게 영어를 이해하고, 접근하는 사람이라면 반드시 읽어 봐야하고, 소장가치도 굉장히 높은 책이라고 생각된다. 차근차근 쉽운 설명과 과하지도 부족하지 않은 예문은 이해도를 배가시켜 주는것 같다."
9791195452446,10,오랜 기다림을 가치있게 만든 역작!저자의 영어학-영문법-에 대한 깊은 고민과 내공을 인문학적 교양서(?)로 풀어내다!!껍데기만 인문학 교양서는 가라~~~
9788996898849,10,영어문법 교재 중 가히 최고라고 말할 수 있을 정도. 저처럼 혼자 독학하는 분들에게 강추!!
9788996898849,10,이 책 정말 문법 이해가 잘 됩니다(드디어..ㅠㅠ 찾음)저는 완전 독학파인데 독학하기에 편합니다. 이해도 잘 시키지만 암기팁도 좋고요.
9788996898849,10,정말 좋은 책입니다.
9788996898849,10,"문법 정리하기에 좋아요~!머리속에 온갖 문법 때문에오히려 정확한 문법을 잘 몰랐는데이 책을 읽고 나니, 머리속이 한 번에 정리되는 것 같아요추천합니다 :)"
9788960494527,10,"동사나 문법을 한가지씩 활용해서 문장을 연습하는 방법이 매우 효과적이고 좋습니다. 게다가 의문문, 부정문, 주어를 바꿔서 연습할수 있도록 되어 있어서 적용력을 키울수 있어서 더욱 좋습니다. 이 책 시리즈만 전권 다 마스터 해도 문장에 대한 이해가 훌륭할 뿐만 아니라 문법도 걱정이 없습니다."
9788960494527,10,그림을 보고 생각하며 반복해서 쓸 수 있게 하여 좋습니다. 과 마지막 부분에 종합 그림을 통해 스스로 말할 수 있게 해서 좋고요~ 초등학생들의 영어기초와 말하기 훈련을 하는데 아주 좋은 교재인 것 같습니다.
9788960494527,8,영어는 훈련이다. 운동을 몸에 익히듯이 영어를 두뇌의 근육에 붙게 만드는 탁월한 학습서라고 할 수 있죠.
9788960494527,10,영어를 잘 하고 싶은 마음. .연산훈련으로 잘 할수있었음 좋겠어요.
9788960494527,8,단순하지만 쉬운 반복으로 인한 영어습득이 좋았다
9788960494527,10,영어 연산훈련이라...ㅋ
9788960494527,10,이 책 정말 쉽고 좋아요!!
9788960494527,10,영어연산훈련통해더쉽게영어암기방법을도와주는책인것같다ㅎㅎㅎ
9788960494527,10,학습에 도움이 될거같다.
9788960494527,10,영어를 잘하고 싶네요...
9788960494527,10,도움이 되었습니다 :)
9788960494527,10,영어에 대한 다른 접근이라고 보면 됨.
9788960494527,6,영어를 배울려고!!
9788960494527,10,"영어와 수학이 만나 상큼한 공부책이,..."
9788960494527,10,"영어를 하다 보면 어디부터 시작해야할지 모를때가 있다. 그런데, 이 책은 영어로 말하기 위해서 어떤 방식으로 영어를 익혀야 하는지를 보여주고 있다. 말하기를 잘하고 싶으면 이 책을 한번 읽어보자."
9788960494527,10,자주 사용되는 구문 위주로 나와있어 활용도가 높습니다.
9788960494527,10,쉽고 재미있게 시작할 수 있었어요. 그러나 영어는 인내다!
9788960494527,10,영어 초보자가 배우기에 너무 잘 되어있습니다.
9788960494527,10,정말 도움이 많이 되었던 책입니다. ^^
9788960494527,10,쉽고 확실하게 영어말하기 훈련할 수 있어서 좋아요^^
9788960494527,8,영어를 쉽게 배울 수 있을것 같습니다.
9788960494527,6,미리보기 웃겨요. 본문은 두 바닥이고 거의 앞껍데기와 뒷껍데기만 있네요.
9788960494527,10,좋아요~!!!
9791195458608,8,기존의 문법서들과 궤를 달리한다.  오래 전에 영어공부할 때 깨달은 부분들이다. 저자가 강조하는 부분들만 잘 알아도 영어가 그렇게 어렵게 느껴지진 않을것 같다.  기존 문법서들 보면서 설명이 충분치 않아 이해가 안되는 부분들이 많았는데 이 책이 그런  많은 부분을 상쇄 시켜준다.
9791195458608,10,최근에 원리로 배우는 영어에 관한 책이 좀 나오는데 가장 맘에 드는 책이 이책이었다.결국 구나 절이 되도 품사 역활인데 그걸 모르고 어려워하는 분들이 참 많다.어느 영문법책도 이책처럼 간단하게 설명한책을 보지 못했다.원리를 알면 쉽다.이책이 가르쳐 줄것이다. 내가 갖고있는 책중 손에꼽는다
9788996987734,10,재밌고 적절한 설명과 간단한 예문 등으로 아주 쉽게 공부할 수 있는 영문법입니다.
9788996987734,10,짱짱 좋아요
9788996987734,10,진짜 쇼크네요영문법의 새로운 패러다임.좋아요
9788996987734,6,관사 부분은 엉터리네요.. 1권만큼의 박력은 없습니다. ｀일본인의 영어｀라는 책이 관사 설명하는 데에 더 이치에 들어맞습니다.
9788996987710,6,영문법을 알기 쉽게 설명하였다.
9788996987710,8,성문 맨투맨 류의 a는b이다 같은 문법책에 지친 이들이 환영할 만한 책입니다. 구성면에선 아쉽지만 내용면에선 만족합니다. 부족한점도 있지만... 이 책과 그레머인 유즈를 같이 본다면 서로 부족한 점을 채워 줄 것입니다.
9788996987710,10,"영작하다가 궁금한것들이 넘 많아져서 도서관에 갔다가발견한 책. 영어가 '왜' 그렇게 생겨먹은건지를 '영어의과거(?)'와 또 그에따른 예들이 있어 그나마 영문법책중 가장 맘에든다.물론, 여러번 읽어서야 이해되는부분도 있긴하다. ㅋ그래도 무조건암기식이아니라 원리와 근거를 바탕으로설명이 되있어서읽어나가기에 큰 답답함은 없는듯하다.영문법쇼크1,2  전치사쇼크. 총3권그리고, 이번달 12월에 '단어쇼크'도 나온다하니 기대해봐야겠다.#영어#영어의이해방식#영문법쇼크"
9788996987710,8,"시제와 과거분사, 현재완료 이론은 아주 획기적임. 나머지는 별로..."
9788996987710,10,아래 글들을 읽고 살까말까 망설였다가 사서 읽게 되었다. 안읽었으면 후회할 뻔 했다. 나름 영어 잘 한다고 생각하고 외국여행가서 큰 불편함 없었지만 솔직히 영어를 편하게 쓰진 못했다. 영어를 쉽게 이해하지 못한게 원인이라 생각하는데 그 걸림돌이 된 것들을 많이 없애준 고마운 책이다.
9788996987710,8,"좋다 나쁘다, 이처럼 말 많은 책도 없을 것 같다.하지만 난 그렇게 생각한다. 나에게 좋은 책이란! 단 한문장이여도 나에게 보탬이 된다면그 단 한줄이 들어있다 해도 그 책은 좋은 책이다 라는 것이다.물론 영어의 수준들이 어느 정도인지는 모르겠으나, 신선하고 획기적인건 사실이다."
9788996987710,2,"말끝마다 약장수같은 ｀일본식 영문법 타파해야합니다｀, 가설검증도 안돼있어서 지맘대로인 분류법, 자기말만 옳다고 주장하는 근자감. 통사론 연구 같은 학위과정 밟아서 다시 책 쓰시길."
9788996987710,10,학생들은 물론 영어 선생님들에게도 가르침을 줄 수 있는 책이다. 기존 책들에 비해 설명이 논리적이고 이해하기도 쉬워 나로서는 배운 것이 정말 많은 ｀보물｀과 같다.
9788996987710,10,영문법 공부해보려고 주문했습니다~~ 많이 배울 수 있었으면 좋겠네요!
9788996987710,10,"우리는 지금까지 일본식영문법 때문에 속아왔고, 고생도 해왔는데, 이 책을 보니 정말 쇼크네요~정말 정확한 영문법 개념을 심어주는 최고의 영문법책입니다. 2편이 꼭 6월 중에 나오기를 기대하고 또 바랍니다^^*"
9788996987710,10,표지에쓰여있죠 영어학습자로서 이 책을 보지않는 것은 분명 비극이다읽고난후내가 이 책을 읽게 된건 분명 비극이다.빈수레가 요란하다.광고에  속았다.
9788996987710,2,저자는 본인이 세상을 바꾼 일이라도 한 듯 말한다.지식이 없는 상태에선 이 책이 대단하게 느껴졌다. 하지만 이 책엔 체계가 없다. 기존 영문법을 비판하기에 온 힘을 쏟고 있다. 이 책은 혁신이 아니라 말만 다르게 포장하고 알맹이는 그대로 그런데도 다른 책 을 쓰래기라고 하는게 아이러니하
9788996987710,2,"기대가 너무 컸나? EBS 한일 선생님 수업을 먼저 접해바서 그런지,,별로네요. 차라리 원서 영문법책을 정독 하느것이 나을듯."
9788996987710,10,한번 읽어보시오. 돈값하는 책이요.
9788996987710,10,영문법에 한 획을 긋는 책이라고 봅니다. 70페이지를 넘어가고 있는데..놀랍고도 놀랍습니다. 성문영어에 물든 분들은 꼭 보셔야 할 듯.. 우리가 배우는 영어가 무엇이 잘못되었는지 역사적으로 논리적으로 완벽하세 설명해 놓았습니다. 내가 배운 영어 공식들이 엉터리임을 인정하지 않을래야 않을 수
9788996987710,10,전치사 쇼크를 보고 놀라움을 금치 못했는데 영문법 쇼크는 차원이 다르네요. 특히 시제 부분은 상상을 뛰어 넘는군요. 대단합니다.
9788996987710,10,"-ing의 역사, 과거분사의 정의, 현재완료의 역사, 부정사의 역사, 미래는 있어도 미래시제는 없다, 분사구문이 아니라 동명사 구문이다.....가히 혁명적인 책이라고 해도 과언이 아닙니다. 책 한 권에 이렇게 흥분할 수 있을까..영어를 가르치는 사람들을 부끄럽게 만드는 책입니다."
9788996987710,6,"이책은 시제파트는 독특하나 그외 부분은 기존의 문법서들과 별반 차이가 없다고 생각됩니다. 시제 파트는 정말 읽어볼 만 하던데, 저자 개인의 의견인지 아니면 일반화 시킬만한 참고문헌이 있는지 몰라 판단을 유보합니다. 가격이 너무 비싸지 않나 싶습니다."
9788983968326,2,쉬운 말로 써도 될걸 무지 어려운 외계어로 쓴 책. 배운 학자가 쓴 책은 대중에게 쉽게 다가가지 못하는 걸까 ? 누군가 이해시키기 위해 쓸 책이 되레 영포자를 양산하게 생겼다
9788963980867,10,공무원준비중에 기초부터합니다~
9788963980867,10,스터디에서 추천해서 알게 되었는데 학생때 접했으면 영어를 좀더 쉽게 접했을텐데 많이 아쉽습니다 문법책의 베스트셀러 기대해봅니다
9788963980867,6,"강의는 완벽하나, 책은 굳이 필요가 없지 않나도 생각합니다.약간 아쉬움이 많은 책."
9788963980867,10,강의들으면서 하고 있는데 처음엔 책이 필요없지만 뒤로갈수록 필요하네요 ^^ 좋아요
9788963980867,10,"영문법 책을 많이 보진 않았지만, 영문법에 관한 한 최고의 책이지 않을까. 마치 금수복국의 복국처럼 설령 그것이 참 복국맛은 아닐지라도 남녀노소 누구나 즐길 수 있는 대중화된 맛 같은 것. 독자의 수준이 어떻든간에, 정통 문법이든, 대체 문법이든간에 쉽고 편하게 술술 넘어간다."
9788963980867,10,전에는 영문법이 어렵다고만 느껴졌는데 이 책을 보니까 한결 나아진것 같아요.
9788963980867,10,한국에서 유일한 영문법 책이라고 하니까 다른 영문법 책보다 사고 싶어지네요
9788962893465,6,"먼저 특수구문에 대한 문법적설명을 하고 지문을 통해서 확인하는방식입니다.중고급자용이라 그런지 앞에서 설명을 해놓았으니 지문속에서의 설명은 생략한다.니들이 알아서 해라!의 수준입니다.설명도 빈약하고 그나마 그설명도 다있는게 아니라 띄엄띄엄.그나마 선정된 지문,예문은 맘에듭니다."
9788961983099,10,영어학원에서 쓰는 교재라 본교재와 함께 워크북도 준비해요
9788960474802,10,눈이 번쩍 뜨이는 책이군요 항상 옆에 둬야 할 책!^^
9788960474802,10,그림으로 이해가 잘되요.
9788960473713,6,"아직 다 보진 못했지만, 씨디를 듣고있으면 귀에 쏙쏙.!"
9788960473713,10,배송 참 빠르네요. 잘 받았습니다. 잘보겠습니다.
9788960473713,8,사이즈도 적당하구요. 두권을 한번에 볼 수 있어서 좋으네요~ 분리할 수도 있어요
9788993413359,8,"그림으로 영어문장, 어순을 설명하며, 발음과 영단어의 의미 관계를 설명하고 있다.
그림으로 영어를 익히고자 하는 분들께 많은 도움이 될 책~"
9788993413359,10,★영어 의 기본적인 ...발상에 대한 것을 이미지를 통해 연구하고 있는책이며...참고도서로 추천합니다~!
9788993413359,4,발음을 어떻게 해야하는지 이미지로 그려내어 이해시키는 책이다.
9788960473041,6,"기본적이면서도 쉽지만 헷갈리는 단어와 문장들, 책에 쉽게 잘 설명해줘서 재밌게 공부했다. 이 책의 문장들을 통째로 외우면 다른 책으로 영어공부 할 때 쉽겨 느껴질 거 같다."
9788960473041,10,열심히 따라했더니 어느새 실력이 쑥쑥 향상되어있는 느낌이에요. 앞으로도 열심히 공부할게요 ^^
