ISBN13,rating,review
9788917198881,10,초록지붕집에 사는 앤셜리~ 한글책으로 내용을 파악한 후에 읽는 영어책이라서 어려운 단어도 무리없이 듣고 있습니다. 요즘 계속 이 책만 읽고 있어요.
9788917198881,10,영어 공부하기에 좋은 책입니다.^^
9788917198881,10,한번 시도해 보세요. 읽고 또 읽고 계속 반복되는 연습속에 쑥쑥 늘어가는 영어실력의 맛을......
9788917198881,10,어른도 읽기 재미있어요~아이랑 함께 읽으면 더 재밌을거 같아요~
9788917198775,10,영어 공부하기에 좋은 책입니다.^^
9788956053653,8,대본이 아니고 영화를 소설화한 책입니다. 물론 영어로 되어 있고요. 다만 오디오북의 성우의 읽는 속도가 좀 빠릅니다. 공부를 위한 원서였다면 조금 천천히 읽어줘도 될 것 같았습니다.
9788956053653,10,"영어 실력 향상에는 원서 읽기가 가장 좋은 것 같아서 주문했습니다. 아직 읽어보진 않았지만, 새책은 항상 사람을 설레게 합니다^^"
9788956053653,8,원서 읽기 첫 도전 책~ 쉽고 흥미로운 이야기로 영어읽기의 재미를 더해주는 책^^
9788956053653,10,가볍지만 인생을 배우는 책 좋아요
9788956053653,10,부담없이 듣기 교재로 사용하니 좋네요
9788956053653,10,"제가 원래 애니좋아하는데, 책으로 보니깐 몬가 더 새롭고 재미씀! 강추요 ㅋㅋ"
9788956053653,10,재밌을것가타요
9788917198768,10,"원서를 처음 시작하는 성인에 읽기에 아주 좋아요~ 저는 50번 정도 읽고, 오디오북 보면서 따라할거에요~ㅎ"
9788917198768,10,아이들 리딩과 리스닝을 한꺼번에 할 수 있어서 넘 좋아요
9788956053479,10,원서읽기에 큰 도움되요.
9788987915883,10,정리도 잘 돼있고 음성파일도 좋은데 잡소리가 조금 있다는게 흠. 발음 야간 부담스럽긴한데 책이 워낙 정리가 잘 돼있어서 괜찮음. 하루에 한챕터씩 보면 한달이내에 정독가능.
9788987915883,6,영화를 보고 읽으면 이해가 쉽다
9788987915883,10,일상 회화에서 사용할 수 있는 패턴이 좋아요
9788987915883,10,영화로 재미있게 보았다
9788987915883,8,칙릿의 대표작
9788987915883,8,공부하는게 재밌ㅇㅁ
9788987915883,8,자막없이 영어공부하는데 큰도움이 되었어요
9788987915883,8,재밌게 영어 공부하기
9788987915883,10,살아있는 영어공부에 큰 도움! 새끈한 영화
9788959951017,10,L/C 훈련에 최고에요
9788956553009,10,영문 명작선입니다. 영어에 재미를 붙일 수 있는..^^
9788956553030,10,한글로 보고 영문으로 보니 나름 아이가 자신감을 갖어 좋습니다.
9788972558781,10,영어학습교제로는 좋아요
9788972558781,10,"생각보다 재밌고, 감동과 교훈이 있습니다. 한 가지 흠이라면 마지막 부분이 좀 진부하다는 것^^*"
9788972558781,10,주문했어요~ 열심히 공부할께요~^^
9791197196805,10,교사용 교재처럼 컬러풀하고 다양한 예문에 친절히 설명된 교재가 문장을 쉽게 해석하는 법을 알려준다. 먼저 이 참고서를 만났더라면 더 즐거운 영어 스터디가 되지 않았을까 생각했다.
9788960498358,2,정말 돈 아까워요 만팔천원이나 주고 샀는데 일단 저한테 너무 쉬웠고 무슨 초등학생 영작연습 책 정도에요 폰트도 엄청 큰데 여백은 또 얼마나 많은지 바가지 쓴 느낌 만원도 아까워요ㅜㅜ 이정도 문법 설명에 문제량이면 차라리 중학생 문법책 3000제 같은책이 문법도 자세히 써져있고 백배는 나아요
9791157211241,10,"서울대영문과 졸업후 영어 교사와 강사로 30여년 보내신 걸로 압니다. 이후 영어 교재만 다수... <영어도사 1, 2> <순해정해>도 있고 넥서스에서 나온 영어순해 basic 영어순해 문맥순해 등도 있죠. 쉬운영어 전설영어~^^"
9791157211241,10,대학 시절부터 저자의 책을 읽으면서 영어 공부를 해왔으니까 벌써 30년 이상 세월이 흘렀네요.요즘 젊은 사람들은 저자를 잘 모르는 분도 계시지만 제가 대학을 다닐 때는 저자의 책을 한 권 이상 갖고 있지 않는 대학생을 찾을 수 없을 정도로 당시에는 영어 교육에서 대단한 권위를 갖고 있던 분이었습니다. 이번 저작도 그 권위에 걸맞게 영어의 문맥을 파악하는데 많은 도움을 받을 수 있는 내용들로 꽉 차있네요.감사합니다. 앞으로도 계속 좋은 책들 기대하겠습니다.
9788957974643,10,<영어책 한 권 외워봤니?> 에서 알게된 책. 영어 읽기에 많은 도움을 얻을.수 있는 책입니다.
9791189719395,10,"이 한 권으로 30개의 전치사를 그림, 이미지로 공부할 수 있습니다."
9791189719395,10,서점에서 봤는데 다른 덕분에 시리즈랑 같이 일단 너무 예뻐요 ㅋㅋㅋ 내용도 재미있어서 그냥 쭉쭉 읽힘.. 여러 권 사서 영어공부하는 친구들 선물로 주려고요...
9791189719395,10,"영어 공부하면서 전치사는 가장 헷갈리고 복잡했던 것 같은데요 이 책은 어렵고 복잡한 전치사를 만화로 설명해주는 책입니다. 이제 한번 봤지만 간단하게 이미지 배우니 더 쉽게 와닿는 것 같아요! 이제 영어를 막 시작했거나, 영어를 배우다 막힌 초중급자에게 강추합니다!"
9791189719395,10,전치사가 이미지로 기억 되는것 같아요~ 작고 가볍고 쉽고 좋아요^^
9791189719395,10,대~~박! 내가 찾던 책임! ㅎㅎ
9791189719395,10,"책이 들고다니기 좋아서 쟈철타고 왔다갔다 하면서 읽기 좋아요. ㅎㅎ내용도 재밌어서 지루하지 않고, 벌써 2번 완독했네요~ 너무 어려운 책보다 이렇게 실용적인 책이 더 많이 나왔음 하네여~ 그림도 넘 재밌고 다 읽고 벌써 누가 빌려달라서 줄섰네여 ㅋㅋ"
9791189719395,10,"책이 귀여워요~~~ㅋㅋㅋ 전치사가 은근히 까다롭고 헷갈리는 경우가 많았는데, 귀엽고 재밌습니당"
9791189719395,2,이걸 왜 샀는지 후회하고 있음...
9788960497566,10,"오늘 도착해서 받았는데, 영국영어와 미국영어의 차이점에 대해 알수있어서 너무 좋아요(^^). 우리나라에선 영국영어와 관련된 책이 적은데, 영국영어와 관련된 책들이 많이 발간되기를 빌고 있어요."
9788960497566,10,이 정도면 유용한 정보를 잘 담고 있어서 좋고 학생들에게도 보충학습 자료로 활용해도 좋을 것 같아요. 복사해서 쓸 생각이어서 분철 신청했는데 다른 부분은 다 좋은데 중간중간에 큰 글씨로 양쪽 페이지를 분할해서 대화체를 써놓은 부분들은 가운데쪽이 살짝 펀칭이 뚫려있다는 걸 감안해야할 듯요
9791187158059,2,왜 이렇게 평점이 높은지 이해할 수 없네요. 한글은 차라리 없는 게 나을 정도로 번역을 해놨어요. 그리고 빈칸을 왜 그런식으로 뚫어놓았는지 의문이에요차라리 다 채워주시지 불편하네요. 인터넷에서 해석된 문장 있는 걸 보고 공부하는 게 낫겠네요.
9791187158059,10,서점갔다가 우연하게 샀는데 구성도 좋고 깔끔하게 잘되어있어서 좋습ㄴㅣ다~~!
9791187158059,8,영어 공부하기에 너무 좋은 책인 것 같습니다. 책 구성도 깔끔하고 연설문 내용도 너무 감동적인 것 같습니다. 강력 추천합니다.
9791187158059,10,영어회화를 공부하고 있는 학생입니다. 애니메이션을 다보고 바로 미드로 공부로 하려고 했었는데 갭차이가 나서 다른것을 공부하려고 했습니다. 마침 이 연설문책을 발견하고 바로 구입해서 거의 반이나 들었습니다. 실제 미국인들의 회화발음을 공부하고 명언들을 배울수 있어좋습니다.
9791187158059,10,연설문들이 하나같이 전부 마음에 듭니다. 책 구성도 알차네요. 끊어읽기로 해석된 점도 개인적으로 좋습니다.
9791187158059,10,"생각보다 괜찮은 거 같아요~~ 확실히 일상생활에서 쓰는 문법이나 단어도 많이 나오는 거 같고, 잘 산 거 같아요"
9791187158059,10,mp3파일과 영상파일을 통해서 각 말의 억양과 발음을 잘 따라할 수 있어서 좋고 무엇보다 몇일동안 푸욱 빠져서 읽고 또 읽고 있습니다. 좋은 책 발간해주셔서 감사드리고 앞으로도 많은 책을 부탁드립니다!
9791187158059,10,학교 부교재로 사용한다고 해서 주문 했어요.
9791187158059,2,한영번역 연습할려고 샀는데 한국어 해석이 영문순으로 되어있어요 빈칸도 곳곳에 등장하고 어쩌자는건지 최소한 깨끗한 풀해석은 첨부라도 해놨어야죠 정말 화나고 돈아깝네요
9791187158059,10,"우연히 서점에서 본 top10 시리즈. 영어공부가 지겹고 재미없던 찰나에 새로운 자극을 위해 왼손필사책과 더불어 구매했다.쉽고 영양가 있는 영어공부가 가능해진다는 점에서 매우 유익하다. 날마다 필사를 하며 문장을 외울 생각인데, 생각보다 재미있다. 추천 꽝!!"
9791187158059,10,유튜브 영상 보고 멈춰서 따라하고 연설문은 검색해서 보고 그런게 불편해서 구매했는데 좋네요
9791187158059,10,영어공부뿐만 아니라 유익한 내용들로 마음도 좋아지는거같아요! 추천합니다.^^
9791187158059,10,여러 인사들의 유명한 연설을 들으면서 딕테이션 하고 단어도 외우고....나의 영어 실력이 쑥쑥 향상된 느낌... ㅎㅎ탁월한 선택이었네요...ㅎㅎ
9791187158059,10,"네이버, 유튜브 등으로 쉽게볼수있는 영상으로 좋은 연설을 모아서 쉽게 공부할 수 있었다! 여기저기 다니면서 여러번 반복해 듣기 좋은 연설들 특히 목차말고 준비된 순서대로 하니 따라가기 아주 좋았다! 마이클리시 전에도 읽고 공부하였는데 입문자에게 매우 좋은 책들이 많다!"
9791187158059,10,혼자 공부하는데 정말 좋은 책인것 같습니다어느 단계 이상 넘어가니까 영어실력이 잘 늘지 않았는데 영어가 조금씩 들리는게 느껴져요
9791187158059,8,단편소설 샀다가 어려워 연설문 재구매했어요회화에만 치중해서 공부하다가 독해도  함께하려고 공부중입니다직독직해가 쉽지가 않지만 꾸준히 하다보면 늘겠지 하는 생각으로 하고 있어요~
9791187158059,10,"마이클리시의 책은 독학하기에 참 좋은 책인것같아요. 무료인강도 수록되어있어 부담없이 보고 배울수 있는 점이 참 맘에 듭니다. 영어 연설문을 통해 공부하면서 감동까지 받을 수있고 명언도 배울 수 있어 좋습니다. 책은 연설페이지와 해석이 잘 되어있고, 해당문법에 대한 설명까지 꼼꼼합니다.^^"
9791187158059,10,열심히 공부하고 있습니다. 좋아요.
9791187168522,8,초보자들이 익히기 쉽게 잘 나온 것 같습니다.
9791155810514,10,오리지널음원은 인터녯 카페에서 다운 받아야합니다. 씨디 인줄 알았는데 더이상 안나오나보네요. 프로 성우가 녹음해서 리스닝 하기 아주 좋네요. 역사도 좋아해도 재미있게 영어공부하기에 좋습니다.
9791155810514,8,각 단어의 어원과 유래 등을 각 문맥에 맞게 상세히 설명함으로서 단어를 완전하게 이해하도록 돕는다. 언어는 단순 암기가 아닌 이해로 다가간다면 더욱 재미있게 공부할 수 있고 기억에도 오래 남으리라 생각된다. 의미가 이어지는 통문장들로 공부하는 것이 단순 암기보다 효율적인 영어공부가 될듯
9788960513327,10,영어로 과학공부를 하는 학생을 위한 도서입니다.
9788965820406,2,"원문과함께 읽고싶어서 분철해서 주문했는데, 분철 퀄리티가 너무 실망스럽네요. 좋은책을 망친것같아서 후회됩니다."
9788965820406,10,내가 가장 힘들 때 나를 지탱해 준 책. 데일 카네기의 너무 뻔하지만 가장 힘있는 얘기들.
9788965820406,10,영문독해와 수준높은 글을 읽는 즐거움까지 함께 얻을 수 있는 책. 워낙 유명해서 말이 필요없네요^^
9788965820406,10,좋아하던 책이고 원어민의 음성파일이 있어 구매하였습니다. 부지런히 읽고 듣고하여 언어 습득에 큰 도움이 될 듯합니다.
9788927702979,10,초등아이들이 힘들어 하지 않으면서 익힐 수 있어요. 문장도 어렵지 않고 어려운 문장도 스스로 읽힐 수 있도록 배려했어요.
9788927702979,10,"행복한 명작 시리즈는 텍스트 뿐 아니라 오디오도 좋아요. 명확하고, 속도가 빠르지 않아서 초보자들에게 아주 좋아요."
9788955661170,8,이 책을 통해서 영어 기사에서 통용되는 약속..  스타일 같은것을 익힐수 있습니다. 영어공부하는 분들에게는 필수인 책이라고 생각합니다.
9788955661170,10,영어전공한 제 동생이 추천한 책이에요.^^ 영자신문을 읽기위한 첫 단추!
9788955661170,10,"영자신문의 전반적인 체계와 공부법이 체계적으로 소개되어 있습니다. EBS무료강의까지 들으니, 더 이해가 되었습니다."
9788955661170,8,학생들에게 영자신문을 이용해서 가르치는 방법을 배워보려고 구입했는데 이 책 괜찮다.
9788955661170,10,어렵게만 생각했던 영자신문 이해하는데 많은 도움이 될것 같아요.
9788955661170,10,너무도 좋은 책이 너무도 늦게 나왔다는 한숨과 그나마 다행이라는 만족감의 하모니~!
9788955661170,10,영자 신문의 체계를 비로소 이해. 신조어도 유익.
9788955661170,10,영자신문을 어디서부터 어떻게 해야하는지 답답했는데 정말 큰 도움이 되었습니다.
9788956054704,8,"라푼젤 매니아라면 소장가치가 있는 책이다.
cd가 디즈니 원작과 다르다는점이 중요하고, 또 중요하다.
라푼젤의 매력인 노래들이 cd에는 담겨있지않았다."
9788956054704,10,"라푼젤 머리를 내려다오~~ 영화를 넘 잼있게 봤었는데, 교재도 좋은 것 같아요. 다만 성우1명이 다 읽기 때문에 CD는 다소 지루해요."
9788956054704,10,영화라푼젤을 못 봐서 영어원서 사봤는데 괜찮네요..재미있습니다.
9788957974650,10,문맥순해를 접하고나서 문장을 보는 눈이 한층 더 성숙해졌음을 느낌니다김영로선생님의 독해법을 체화한다면 그어떤 문장 문맥도 두렵지 않을겁니다
9788957974650,10,독해 한번 제대로 해보려고 구매했습니당. 평이 좋으신걸 보니 의욕이 솟네요 ㅋㅋ 열심히 하겠습니다
9788957974650,10,독해의 바이블!!!!! 최고의 도서
9788957974650,8,"문맥순해가 나왔군요. 그런데 전에 나온 책과 같은 건지, 개정판인지는 아직 모르겠네요"
9788957974650,10,매우 친절한 책은 아니지만 무작정 따라가며 공부하다 보면 독해력이 느는걸 알 수 있는 책입니다.
9788957974650,10,저는 영문 글쓰기에도 큰 도움이 되었습니다~ 좋은 책입니다!
9788957974650,10,독해의 바이블!!!!! 최고의 도서
9788917198966,4,CD가 딸려있는 책이어서 혹시나 오디오가 제공되나 했는데 기계가 읽어주네요. 전자책으로서는 너무나 아쉬워요...
9788917198959,6,어릴땐 몰랐는데..아이때문에 다시 읽어보니...노동의 신성함과 자연의 필요성을 설파한 책인가?ㅋㅋㅋ
9788917198904,10,넘 조항요!! ㅎㅎㅎ 즐거운 영어공부를 만들어준답니다
9788973584420,6,나는 영어를 못한다. 못하는 수준을 벗어나서 갈아엎어야한다. 그런 이유에서 산 책인데 아직까진 도움되는지는 모르겠지만 듣기 파일이 있어서 좋은 건 확실하다.
9788973584420,2,"아이들 들어 보라고 구입했는데 MP3cd 별도 있어야 하는지 몰랐습니다.
자체 구입기가 없으면 무용지물인듯 별 도움 안되네요
어떻게 사용해야 하는지도 모르겠습니다
가격은 저렴하지만.... 일반 CD제작이면 좋았을텐데 아쉬움이 있습니다."
9788973584420,8,명작이라 한권쯤 가지고 싶은 책
9788973584420,8,포켓북에 올컬러에 엠피쓰리까지 정말 깜찍하고 출퇴근시간에 보기 좋아요!!
9788973584420,10,"생각보다 작은사이즈네요. 그래서 더 좋은 것 같아요.
미니CD에 있는 mp3파일까지 이용해서 영어공부 잘 하렵니다."
9788973584420,8,어린왕자의 여러 버전을 갖고 있긴 하지만... CD까지 붙어있는 영한대역 어린왕자도 좋네요~가격도 착하고^^
9788973584420,6,"영문파일이 있어서 좋긴한데,, 한글번역이 기존에 읽었던 어린왕자와 달라 조금 낯선 느낌입니다;;"
9788973584420,10,가격이 정말 싸네... 난 '어린왕자' 미니북을 갖고 있는데 이것도 탐이 나는구나..
9788973584420,10,영어 공부하기 정말 좋은 책...^^
9788973584420,8,인생의 의미를 다시 한 번 생각해보게 하는 책 다시 읽어도 감동적이다
9788973584420,10,작아서 휴대하기 좋은 뒤에 씨디까지 붙어있는 나의 어린왕자
9788973584420,10,나를 길들여봐~ 이 책을 읽음으로써 나의 마음 속에도 별 하나 분양 받을 수 있기를..
9788973584420,6,부담이 없어 좋아여...
9788973584420,10,"작은 사이즈..가방 한구석에 있다가 지하철,친구를 기다리는 카페에서 등장하지요"
9788973584420,10,어린왕자로 영어공부 좀 해보겠다고^^ 좋아요 아주 ^^
9788973584420,10,어릴때 읽었던 어린왕자를 다시..
9788973584420,10,"워낙 어린왕자를 좋아하다보니,,ㅎㅎ
그런데 가격대비해서 좋아요!!"
9788973584420,10,"오 좋아요!!
머리에 쏙쏙들어오네요"
9788973584420,10,아담하고 디자인도 이쁘고 좋네요 영어도 있구 ^^ 싸게 잘사서 만족입니당 ㅎㅎ
9788973584420,10,오른쪽엔 한글..왼쪽 페이지에 영어이구요 책이 아담해서 여행갈때 챙겨다니기 좋아요
9788973584420,10,"책이 아담해서 좋구여....  책도 너무 읽기 좋게 나왔어요
많이들 사서 보세요~~~~~"
9788956054353,10,이상한 나라의 앨리스 영화를 잘 옮겨놓은 책입니다! 특히 cd 맘에 드네요
9788956054353,10,가격도싸구 일단 영화판 앨리스라서 넘넘 기대가 되네요~ 워크북도껴 있어서 좋아욧ㅎ
9788956054353,8,아들에게 선물했더니 기대이상으로 재밌데요..^^
9788956054353,10,"책도 너무이쁘고, 뭔가 잘될거같은느낌!!^^"
9788956054353,10,별도로 워크북이 있어서 원서 읽기가 훨씬 수월하네요.
9788956054100,10,"트와일라잇 읽으려고 구매했는데, 필요한 단어들 책에 있어서따로 안찾아보고 읽을수 있어서 좋았고, 제대로 읽은게 맞는지 테스트 할수 있게 퀴즈도 삽입되있어 확인도 할수 있어서 괜찮아요."
9788956054100,10,사실상 많이 기대는 안했던 책이다.누구든지라는 말은 아니지만 나나 내 주위 사람들은 대부분 트와일라잇을 영화로 접했기에 대사나 궁금했을뿐이다 하지만 즐겁고 가볍고 자유롭게 영어를 볼수있는것같아 좋았다.
9788956054100,10,잘 정리가 되어있는듯합니다
9788956054100,10,원서에 단어장은 필수^^
9788956054100,10,원서를 읽는 데 도움을 줄 단어장
9788956054100,8,단어 뿐만아니라 책에 관련된 퀴즈까지 좋아요^^
9788956054100,10,"트와일라잇원서는 어려운 편은 아니지만
읽기도움이 되고자 구입했습니당 괜찮아요"
9788917198928,6,이야기들 넘 짧아서 아쉬웠지만 영어 원서 입문서로는 그런대로 만족
9788917198928,8,"7개정도의 단편이 실려있다. 들어본이야기도있고, 생소한이야기도 있다. 녹음파일을 다운받아 같이 들었다."
9788917198836,10,영어 공부하기에 좋은 책입니다.^^
9788956053608,10,해리포터 단어장이랑 같이 구매하면 좋아요!
9788963480039,10,작은책이지만 영어의 중요한 부분입니다
9788973584291,10,큰 책을 사려다가 이 책을 발견해서 샀는데 손크기 사이즈라 가지고다니기 편할 것 같아요. 문제집을 풀기보다 좋은 글을 영어로 읽으면서 영어공부 하려고 구매했는데 좋은 선택이었던 것 같네요.
9788973584291,10,울아들이 존경하는 오바마.시디도 있어 영어공부에도 아주 좋더군요.
9788973584291,10,오바마 연설문을 편하게 들고 다닐수 있게 만든 책이예요. 편안함 ^^
9788973584291,6,흔하디 흔한 오바마의 연설문입니다. 그래도 책이작은거에비해 알차보이네요
9788973584291,10,들고다니기 편할것 같다. 좋다. 오른쪽편엔 어려운단어들도 찾아있고 좋다.
9788973584291,8,"MP3가 실황연설이 아니라 조금 실망스러웠지만,
영어공부에는 획기적인 아이템인듯^^"
9788956052977,10,재미있음
9788956052977,10,뮤지컬 영화 좋아한다면 분명 좋아하실거에요!
9788956052977,8,영어 공부를 위해서 챕터북으로 종종 영어를 접하고 있습니다. 특히 미국 내 유명한 드라마를 통해 현지의 영어 사용법도 알수 있어서 학습하는데 유익합니다.
9788956052977,10,그냥유
9788956052977,10,이거랑 ebs 강의 꼭 들으세여! 그리고 스피드 리딩 까페 꼭 가입해요! 두번해용! 새로운 영어 방법의 패러다임 !! 추천머겅!
9788956052977,10,영화로 수없이 많이 봤습니다. 그래서 그런지 아이들이 힘들어 하지 않고 아주 잼있게
9788956052977,8,단어정리가~사전설명도 부가되어있어 좋아요^^
9788956052977,4,약간 지루하네요... 그리고 CD에서 노래 기대했었는데 ㅋㅋ
9788956052977,4,원어민이읽어주는CD가포함되어있어 발음연습엔 조금도움이 될 듯하나 지루하다.
9788956052977,8,뒤에 단어가 잘 정리되어 있어서 좋아요^^ 정말 편하게 넘어가네요!
9788956052977,8,원서 읽기 처음 시작하는 분들에게 권하고 추천하고 싶어요
9788956555492,10,초등학생들이 보기에는 조금 난이도가 있긴한데~그래도 내용은 재미있었던거 같아요.아이들 수업 시간에 많은 도움이 되었습니다.
9788956555492,8,초등학생들이 보기에는 조금 난이도가 있긴한데~그래도 내용은 재미있었던거 같아요.아이들 수업 시간에 많은 도움이 되었습니다.
9788956555492,10,흥미진진한 이야기에 영어라는 것을 느끼지 못하는 것 같습니다.
9788956555454,10,흥미유발....자연스런운 영어배우기...^^
9788965820000,6,데일카네기라니 당연히 내용은 좋을 줄 알지만... 출판사의 편집이 2018년 발행책이라긴 놀랍다. 개인적으로 times new roman 폰트가 문서의 일반적 폰트라고는 생각해도 좀 지루한 느낌이 들고 이 가격의 책에 이런 편집이라니 좀 아쉽다. 어디까지나 개인적 견해다.
9788965820000,10,이렇게만 살면 위인
9788965820000,10,원어민의 음성파일이 있고 한글 번역과 영문이 함께 있어 영어 습득에 많은 도움이 되고 있습니다.
9788965820000,10,"사회생활을 하는 모든 사람이 읽어야 할 책.
영어공부도하고 인간관계도알고-일석이조"
9788992228862,4,YBM의 The Classic House 시리즈 작품들은 문체만 현대 영어로 교체한 것이 아니라 아예 통으로 갈아엎었다고 보는 게 정확하다. 시나리오만 보는 셈이다. 영어 공부하기엔 적절할지도 모르겠다.
9788971724484,8,가격대비 매우 만족합니다. 한글과 영문을 동시에!
9788971724484,10,재밌게 봤습니다 작고 가벼운것도 맘에 드네요
9788971724484,10,예언가 같은 조지오웰... 스탈린과 소비에트의 기만을 쉽게 이해할 수 있을 듯
9788971724484,10,유시민이 책에서 추천한 영원할 고전.
9788971724484,10,도움이 됬어요!!
9788992228206,10,고전을 현대영어로 옮겨 읽기 쉬워요~
9788992228145,10,이 책의 시리즈물을 모두 모으고 있다. 거의 절반정도 모았네요. 아주 좋은 책입니다.
9788959950485,10,600단어기 때문에 책내용이 조금 간략해진건 있지만 그래도 영어공부하기 좋은 책
9788956552941,8,쉽게 영어 배울 수 있어요. 더구나 명작이어서 대부분의 내용을 알고 있고 문장도 쉬워서 영어를 겁내하는 성인들도 큰 어려움 없이 접근 할 수 있어요.
9788956552941,10,명작을 영어로 .. 매우 좋습니다.
9788972557227,8,재미있는 책으로 영어공부하기. 더우기 씨디로 원어민 발음까지 들으면 더 좋습니다.
9788972552420,10,영어를 재미있는 명작으로 공부하는것이 유익하고 좋습니다.
9788972559382,10,역시 좋은 것 같네요
9788972559382,10,영어 원문으로 만들어진 단편모음 동화를 통해 재미와 영어독해력 증강도서
9788972559047,4,영어 공ㅂ에 도움이 될까해서...
9788989847274,10,아들이 원해서 구매한 책 아직 읽기전이네요
9788989847274,2,"그간 저자의 번역본을 볼 때, 저자가 과연 이런 책을 쓸 수 있는 수준인가 의심스러움"
9788989847274,10,번역의 첫 걸음. 우리말다운 번역이 무엇인지 느껴 봅시다.
9788989847274,8,외국어와 국어 사이에서 우리말다운 번역을 고민해본다. 읽어볼만한 책이다.
