ISBN13,rating,review
9788958073710,4,"실망스럽다. 노빈손과 한자학습을 결합한다는 아이디어는 나쁘지 않으나 스토리텔링은 진부하다. 한자를 사용한 말장난과 유머는 별다른 의미가 없고, 제시된 사자성어의 수준도 일정치 않다. 억지설정도 적지 않다"
9788958073710,10,아이가 밤 늦게 까지 읽어 주말에 맞춰 주문을 넣어야했다는 생각을 하는 책입니다. 책 읽기 싫어하는 아이에게 강추!!
9788958073710,10,재밌겠당~ 구매하면 알사탕도 주는데...ㅠㅠ
9788974833091,10,제가 원하던 스타일의 책입니다. 많은양과 그에 얽힌 이야기를간략하게. 필요할때 찾아보기도 쉽네요.
9788974833091,6,많은양을 넣으려다보니 디테일의 퀄리티가 좀 떨어지는 것 같아요. 좋긴한데 아쉬워요.
9788974833091,8,고사성어의 뜻과 유래가 적혀 있어 읽기 부담스럽진 않지만..ㅠ.ㅜ 책이 작고 두꺼워욤 ㅠ.ㅜ 좀더 크고 얇고 글씨두 크게 나왔음 더 좋았을거 같애욤..
9788974833091,8,올해 한자지도사 자격시험에 대비해서 구입한 서적으로 날마다 사자성어를 배우기에 유익하다.
9788974833091,10,고사성어를 잘 정리해 놓은 책이네요.. 연관성을 확실히 알겠고.. 재미있게 적어놓아 이해도 잘되고 잊어버리지도 않을 듯...
9788974833091,10,"전체적으로 구성이 읽기 쉽고, 이해하기 쉽게 되어 있어 틈틈히 보기 아주 좋은 책이였습니다 :)"
9788974833091,10,"아이랑 엄마랑 같이 보아도 좋아요.
어려운 고사성어가 쉽게 다가와요"
9788974833091,10,"시험대비용이 아니라서 더욱 재밌게 볼 것 같아요. 길게 설명되어있고 고사성어의 갯수가 적게 들어있는 일반책보다, 전 이 책이 훨씬 맘에 듭니다^^"
9788974833091,8,우리가  알기도 하고 모르기도 했던 고사성어의 총집합..이해를 도와주는 그림까지 있어서 공부하기 너무 좋습니다..!!
9788974833091,10,책이 두꺼워 안 볼까 걱정했는데 그림과 설명이 재미있어 킥킥거리며 잘 봅니다^^
9788974833091,8,고사성어는 다 모여있는 것 같습니다. 상식과 교양이 늘어나는 책 속 이야기~~
9788974833091,10,가격대비 넘 좋아요~ 두껍고^^ 하나하나 내용을 읽으면서 고사성어 익혀보려합니다~~!
9788974833091,10,와우~ 두껍네요^^~! 좋은 책 저렴히 잘 구입했어요^^~
9788974833091,10,두꺼워요.아이들에게 보여 주려고 구입했는데 저와 함께 보고있어요.매일 조금씩...
9788974833091,10,두껍긴 하지만 쉽고 재미있게 볼 수 있을 듯.
9788974833091,10,하루에 5개씩만 읽어도 도움이 될 것같은!
9788974833091,10,이런 책은 재미와 교양 그리고 실력을 이끌어 준다.
9788974833091,8,"며칠전에 샀는데, 가격이 내려서 아쉽지만 재미있게 읽을 수 있어서 좋아요"
9788974833091,10,언어 영역 고사성어 이걸로 끝!! ㄱㄴ*
9788974833091,6,고사성어 너무 어려워요
9788974833091,10,애기들한테 보여주려고 구매합니다.
9788974833091,10,"초등학생, 아들에게 보여주려고 구입한 건데....중고생들이 읽을 만한 책입니다."
9788974833091,10,"쉽게 잘 안보게되는 고사성어를 재미있게 적은 책입니다.
하나씩 소장해두면 좋을듯"
9788974833091,8,무려 3.5cm의 두께.서두르지 않고 천천히 공부하길 바란다면 초등고학년부터 재미있게
9788974833091,10,"매일 10분씩 보면서 한자, 어휘, 교양을 쌓고 있습니다. 넘겨볼수록 뿌듯해지는 책"
9788974833091,10,아이와  열심히 공부하야겠다.
9788974833091,8,중학생인 동생을 위해 샀는데.. 다른 책들에 비해 훨씬 쉽고 좋아요~!!
9788974833091,8,매우 체계적으로 정리가 잘 되어 있어 많은 도움이 되겠네요 감사 ^ * ^
9788974833091,8,고사성어의 유래등 재미를 느낄수 있고 어느 쪽을 펼쳐도 부담없네요.
9788974833091,10,이야기와 곁들여진 고사성어! 쉽게 외울 수 있어 너무 좋다!
9788974833091,8,괜찮네요.. 고사성어에 얽힌 재미있는 유래담도 나와있고..
9788993460261,8,"4학년 딸아이가 이번 겨울방학에는 고사성어 관련책이 읽고싶다해서 다른책들과 구입해줬는데 적당한 깊이감도있고 재미도 있는 책이라고 하네요.
저도 읽어봐야겠어요*^^*"
9788993460261,10,이야기식으로 되어 있어서 어렵지 않게 고사성어들을 접할 수 있는 것 같네요. 술술 잘 읽혀요~
9788993460261,10,중1 아이방에 슬쩍던져 놓으니 심심풀이 오징어 땅콩 먹듯 쉽게 책장을 넘기네요~
9791127414191,10,정말 알차다. 생략된 역사서술이 많지만 중국사 전체틀 잡기에 알맞다. 그리고 이런 기획을 생각한 일본 편집자한데 박수를 보내고 싶다.
9791127414191,10,제목이 책 내용을 압축하고 있다. 일상에서 흔히 쓰고 있는 고사성어에 중국의 역사적 사실들이 숨어 있다니 흥미롭고 재미있다. 작지만 알찬 인문 교양서.
9788975675706,10,도서관에서 고사성어에 관한 책을 찾다가 이 책이 잘 읽혀서 구매하게 되었습니다. 좋은 책을 내주신 저자분께 감사드립니다.
9791186518458,10,편하게 보기 좋아요.
9791157942060,10,원문을 통해 고사성어의 배경을 잘 알 수 있어서 좋았습니다.
9791157942060,10,고사성어의 정확한 뜻을 알 수 있어서 좋습니다.
9791157942060,10,"성어를 원문으로 읽을 수 있어서 좋았고, 원문 스토리를 읽다보니 성어는 자연스레 알게되네요~! 좋아요~!"
9788934980827,8,깊이 생각해볼 좋은 글귀가 참 많다. 젊은이들에게는 좀 고답적으로 느껴지지 않을까 생각했는데 아래 리뷰들을 읽어보니 그렇지도 않은 것 같다. 근심이 오히려 복으로 가는 길이 된다는 <덕근복당> 같은 말은 나이를 불문하고 누구에게나 힘이 되어줄 정말 좋은 조언이 아닐까 싶다.
9788934980827,10,"옛날이나 지금이나 인간의 권력욕, 재물욕은 끝이 없고 이를 잘 다스려야 군자가 되고 나라도 잘 되는 것 아닐까? 마음 수양에 참 좋다. 마지막 문장이 ‘아!’로 끝나서 웃었다. 곁에 두고 자주 읽어 내 것으로 만들고 싶다."
9788962260540,8,"해설은 그냥저냥, 정보로서 가치가 크다."
