ISBN13,rating,review
9791195435852,10,이거 정발될 줄 몰랐네요. 일판 장바구니에 넣어두고 있었는데 존버한 보람이 있군요.
9791160320558,10,"기능이 많은 클립스튜디오에 복잡한 부분을 잘 해설해준 서적입니다. 만화,일러스트 작업에 도움이 될만한 기능들 위주로 설명을 해주고 있어서 좋습니다."
9791160320558,10,클립 스튜디오 처음 접하시는 분들 보다는최소 6개월이상 쓰고 계신분들에게큰 도움이 될것이라 생각합니다. 개인적으로 강추!
9791127420949,10,덕분에 귀여운 SD를 그릴 수 있게 되어서 너무 기쁩니다!별 5개로도 사실 모자랄 정도로 좋은 책!채색이 없다는 게 좀 아쉽지만 채색 책이 아니니...
9791127420949,10,별 기대 안했는데 생각보다 내용이 알차네요. 두고두고 볼 것 같습니다.
9791160856248,8,대부분 자료위주입니다. 자료용으로 쓴다면 괜찮은 책입니다.
9791160856248,10,"플래툰 컨벤션에서 선행 구매했습니다. 우에다 신 작가님의 극화풍, daito 작가님의 모에화풍. 2중으로 눈이 호강하는 책입니다. 우에다 신 작가님의 작품답게 깨알 정보도 알차고 유용합니다.군복에 관심이 많으신 분이라면 소장할 가치가 있는 책입니다."
9791160071009,4,비추합니다 초보에게는 좋을 것 같단 인식이 있을 수 있는데 작가 그림체도 좀 많이 별로고 근육들도 본인식으로 데포르메 해서 되려 안좋은 버릇 심어줄 수 있습니다 중간에 자잘자잘한 팁이 있는데 그건 핀터레스트 돌아봐도 나올 수준입니다
9791160071009,6,그림체가 제가 지향하는 스타일이 아니라 그렇게 많은 참고가 되지는 않았네요 ㅠㅠ... 그래도 간단한 팁들은 도움이 되었습니다
9791160071009,10,초보자 분들에게 짱 좋아요. 항상 인터넷이나 sns으로 배웠을 때는 이미 도형으로 그려진 몸체만 그리니까 아직 볼 줄 아는 눈도 없고 그냥 따라그리기만 해서 정말 기초 하나도 모르고 보고 따라 그리기 수준이었는데 이건 얼굴 몸 모든 비율 몇 정도인지도 다 알려줘서 정말 좋아요~~!
9791160071009,10,이해하기 쉽고 따라하기 쉽습니다! 초보자에게도 그리기 쉬워요! 저도 이해하고 따라그리는 걸 보니 쉬운겁니다 ㅋㅋㅋ
9791160071009,10,그림을 처음 시작하시는 분들에게 강추합니다! 심플하면서도 알찬 내용 저자분이 초심자의 입장에서 잘 봐라봐준 책입니다 이책만 완벽하게 숙지한다면 인체는 문제없이 그릴수 있을것이라 생각되는 좋은 책입니다.
9791160071009,8,"저자가 독학으로 완성한 간편 인체 해부학 사전. 초보자의 시선에서 바라본, 초보자를 위한 해부학. 저자의 노고에 박수를!!"
9791195739516,6,에반게리온에 대한 오독에서 오는 지극히 주관적 오타쿠폄하론
9791195739516,8,밑에 맞춤법 띄어쓰기 지적이 있어 글 남김. 이 책 읽어봤으나 딱히 오류 못 느낌. 리뷰어의 다른 리뷰도 보니 대부분이 편집 오류가 있네 편집 실수가 보이네 하고 있음. 그런데 근거 제시는 없음. 뭐가 맞기에 출판된 책이 틀리다고 생각하는지 명확하게 제시 바람. 그 책들도 읽어본 책이였음.
9791195739516,6,워크라이프의 다음 책이 기대된다. 일본어투는 그자체로 스타일이라 쳐도 맞춤법 띄어쓰기는 신경써주시길 바랍니다...
9791195739516,8,"˝(세카이계라는)잔치는 끝났소, 모두 집으로 돌아가시오.˝"
9791195739516,8,"가볍게 읽기 좋은 책입니다. 오타쿠와 세카이, 그리고 그런 문화의 흐름에 대해 나오는데. 흥미롭습니다 ㅎ"
9791195739516,10,"남들보다 애니,만화,소설을 조금이라도 더 읽은 분들께 강추하는 책.설마 한국에서 이런 책이 정발될줄 몰랐습니다."
9791195739516,8,너의 이름은 개봉 전 예습. 동아시아 중이병의 양상이 조금 다르니 흥미롭다.
9791195739516,10,세카이계란 키워드로 00년대 일본 서브컬쳐사를 총괄하는 기획. 제목의 인상과 달리 규범적인 정의를 내리기보다 용어를 둘러싼 담론의 변천사를 추적하였다. 한 사람의 참여자였던 마에지마의 주관 시점에서 일본 서브컬쳐 논단의 지형도를 엿볼 수 있다.
9788993195903,10,따라서 그릴 수 있게 만들었어요^^*
9788993195903,8,아이가 따라 그리고 있다.. 그만큼 쉬운 그림
9788993195903,10,따라 그려서 사람들에게 보여주었는데 잘했다고 칭찬 들었어요.^^
9788993195903,10,수현양~  강추!!!
9788993195903,10,아기자기한 손그림 그리기 책으로 좋습니다.
9791136729033,8,"콜렉션 북은 처음이라.. 이쁘긴해요 보관용으로 플라스틱으로 책 잡아주는 것도 있고, 한정으로 주는 것도 예뻐요. 안의 일러 뜯어서 액자에 넣어 전시하는 것도 괜찮을거 같네요"
9791136729033,10,사야할지 모르겠다.. 12월 30일에 받으시면 다들 리뷰 작성해주세요ㅠㅠ 그거보고 결정할까 생각중이라서요 !
9791136729033,10,달천이라 참을 수 없었습니다..
9791136729033,10,사야되는지 고민되네요
9791136729033,6,ㅇㅅㅇ..10점에 내용이 뭐뭐 들었는지 모르는데 또 못사면 후회 할것 같고...
9791136729033,6,음... 작품 소개보면 일러스트 포스터 10점과 코멘트 말고 뭐가 수록되어 있는지 잘 모르겠는데 나중에 후기 같은 거 보고 사야겠네요;; 이런 쪽은 내용물이 어떤 건지도 잘 모르겠는데 우선 사고보라는 것 같아서 별로예요...
9791136729033,10,소리소문없이 나와서 나도 은근슬쩍 구매함
9791196819712,10,재미있는 이야기와 더불어 칸 분할이나 대사의 위치 등만화적 요소가 가지는 다양한 의미를 알려주어  만화읽기의 재미를 돋우는 흥미로운 책
9791196819712,10,만화에 관련된 이야기를 진심 이렇게 잘 풀어주는 책은 없을듯 합니다.잠깐 보기만했을뿐 이지만 만화에 관련된 이야기를 이렇게 잘 풀어준 작품은 없을듯 합니다.감사합니다
9791196819712,10,"전문성 있는 시선으로 다양한 만화, 웹툰에 대한 해석을 읽어볼 수 있어서 좋았습니다 ~"
9791196819712,10,실제로 내 이야기를 들여다보는 듯해 마음에 위로가 되었다. 지금 시대에 필요한 따뜻한 책
9791196819712,10,소통과 관계를 다룬 잔잔한 우리주변의 이야기를 편안한목소리로 작가가 읽어주는듯 한 책
9791160075502,6,사실 그렇게 크게 도움이 되는지는 모르겠다.
9791160075502,10,"여자캐릭터를 그릴때 더 예쁘게 그릴 수 없을까, 많이 고민하게 되는데 다양한 방법과 테크닉이 있단걸 보여주는 책입니다. 모델(?)로 그려진 여캐들이 너무 예뻐서 눈이 한번 더 가게 되네요ㅎ"
9788931460124,8,글레이징 기법을 활용한 채색을 알려주는 책. 저자의 노하우가 담겨있고 브러쉬 퀄리티에도 만족한다.
9788931460124,10,투시와 여러가지 배치조합 채색법등이 잘담겨있어 연습용으로 최고예요
9791160073478,4,저는 음영의 형태에 대한 좀더 원론적인 설명이 필요했는데 설명을 한다기보다는 이렇게 그려보세요~하고 예시를 가득 채워넣은 느낌이라 저에게 필요한 책은 아니었습니다. 응용 가능한 음영에 대한 이론적인 설명이 아니라 오히려 연출과 구도 설명에 가까운 책입니다. 드로잉 참고용으로는 좋습니다
9791160073478,6,"미소녀 그림 좋아하시면 보세요. 생동감있는 선을 표현했다고 하지만 선화들이 지저분하고, 미소녀 그림 참고용으로 구입하시길."
9791160073478,10,초심자분들에게 이 작가분 책은 전부 좋다고 말하고싶어요. 일러스트작법서들은 몇 개의 퀄리티높은 작품을 그리는 과정이 들어있는 책들이 많은데 솔직히 그런 책들은 초심자들에게는 별로 도움이 안됩니다 진심으로.. 이런책들을 사서 보세요..
9791160073478,10,toshi작가가 온라인에 공개했던 많은 그림을 보고 가끔 연습하고는 했었죠. 그런 자료를 무료로 많이 공유해주신 작가님이라 책 내용이 어떻든 은혜 갚는 느낌이랄까요. 무조건 좋게 평가하고 싶네요.
9788960882362,10,얇지만 실속있네요. 인체에 대해 많이 배웠어요
9788960882362,10,정말 쉽게 이해되는책이에요!근데 그림초보자라면 이해가 잘안갈거같아요ㅠㅠㅜ자랑은 아니지만 저는 초보자가 아닌지라 이책이 많이 도움이 된거같아요ㅎㅎ
9788960882362,4,뭔가 트위터 인체팁 st 같은 책이네요. 정식도서가 편집이 이렇게 성의없을줄 몰랐어요.
9788971906606,10,굿...
9791131961063,10,그림예뻐요!!
9791131961063,10,일러스트 생각하면 소장가치 높아요!
9791131961063,10,이미 구매한 지 꽤 되었지만 지인분이 이 책을 받으시고 무척 좋아하시는 것 같습니다 ㅎㅎ 전의 일본판보다 크기도 크고 내용도 풍성해서 소장가치가 높은 책!
9791131961063,10,예판본 받은지 좀됐는데 방금뜯어보니 인쇄랑 종이재질 퀄리티좋아요 사길잘했다능 ㅎㅎ
9791131961063,10,"하...일본판으로 산지 얼마 안되서 정발이...ㅠㅠ초판 부록때문에 다시 구매했는데 생각보다 괜찮네요. 참고로 일본판보다 책크기가 살짝 더 크고 종이 재질이 빤딱빤딱한 그런 재질입니다. 글고 종이재질 차이때문인지 색감이 한국정발이 좀 더 선명하니, 일판 버전 사신분들 참고하세용."
9788960523296,4,구매하고 끝까지 정독했습니다책두께에 비해 내용이 별로입니다 만화작법서를 찾으신다면 다른책을 사세요 뒷편에 다카하시 루미코 단편이 다 입니다다른분 후기가 다 틀린말이 아니더군요
9788960523296,10,만화 작법 서적류 중에서 최고
9788960523296,10,만화 이야기의 발상부터 콘티까지 어떻게 만들어지는지 처음부터 끝까지 하나하나 해설하고 알려주는 책.
9788960523296,6,그냥 이런 것도 있구나 하고 읽어보기에 좋을 것 같네요.너무 올드해요 나이드신 분이니 당연하겠지만..뒤쪽에 참고자료로 쓰인 단편 하나는 70년대 성인만화책인지 이상하고 왜 이걸 봐야하는지 모르겠더라구요
9788960523296,6,"음...너무 기술적으로 가지 않나,,그리고 예시 작품들이 너무 오래된 연출방식."
9788960523296,8,많이 구체적이고 저자의 견해도 반복해서 기술하는 부분이 조금 질리는데. 끝에 실어 준 만화 덕에 별하나를 더 더한다.
9788960523296,10,20세기 드라마투르기의 정체
9791160070224,8,굉장히 자연스러운 동작들을 따라그릴수있게 만든 책은 맞아요다만 제가 그림그리기에 흥미를 잃어서인지 봐도 잘안되더라구요다음에 기회되면 열심히 따라그려봐야 겠어요
9791160070224,10,이것이야 말로 진정한 캐릭터&미술 입문서!! 초보자들이여 이 책을 가장 먼저 읽어야 한다.
9791160070224,10,이 책쓰신분의 그림체가 귀여워서 샀는데 첨삭내용도 알차서 좋네요.다만 여자만 있다는게 가장큰 단점이긴합니다
9791160070224,8,"여기서 산건아니고 서점에서 내용을 직접 확인하고 샀습니다. 평소에 궁금했던거랑 익히고 싶었던걸 많이 다뤄줘서 꽤 좋은 책이라고 생각합니다. 다만 남자인체에 대한 설명이 없다시피한게 아쉽고, 제가 공간지각능력이 부족해서 그런건지 무게중심은 아무리 봐도 이해하기 힘드네요ㅠ 중~상급자추천"
9788968313165,10,지브리팬이라면 재미있는책. 이책읽고 다시 애니 보니 느낌이 많이 다름.ㅋ
9788925889399,8,유익한 내용이 많았어요
9788925889399,10,ㅋㅋㅋ..진짜 옷주름하나는 확실할듯 ㄷㄷ...
9788925889399,10,주름 ㅡㅡ그리는게 진짜 감도 못잡겠던데 이렇게 책으로 나와서 디행ㅠㅜ
9788972216018,8,서점에서도 보고 직접 사서 보기도 했는데 드로잉 북 중에 단연 최고인 것 같아요~
9788972216018,8,재미있는 것 같습니다.
9788972216018,8,"집에서 독학으로 해볼려고 구매한 책이기도 한데, 괜찮아요ㅎ"
9788972216018,8,쉽고 친절한 설명 풍부한 예제
9788972216018,10,모두 그림 초보 탈출합시다!
9788972216018,10,정말 여기에 나와있는 대로 따라하니까 실력이 느는 것 같습니다. 그림 그리기 이제 막 시작하려는 분들께 강력 추천합니다!
9788972216018,8,김충원 이라는 이름으로도 듬직한 책입니다~
9788972216018,10,요즘 그림을 그리고 싶은데....
9788972216018,6,재미나네요 도움이 많이 됩니다
9788972216018,10,점 선면을사용하는법이구체적이어서좋다따라가며그려보는여러가지이미지들에놀라며 나도화가일수있구나라며뿌듯해한다매일조금씩해보니재미도있고그림한점벽에거는것이목표가되버렸다 혼자서도할수있다는게장점 ..
9788972216018,10,여러 사물을 단순한 선만을 이용해 그리는 일러스트 드로잉을 쉽게 가르쳐 주네요.
9791136727657,10,이뻐요. 집 인테리어랑도 잘 어울려요♡하얀액자랑 잘 어울려요♡
9791136727657,10,잘받았어요. 엄청 크네요! 이렇게 큰줄 몰랐는데 아주아주 마음에 듭니다! 한장한장 너무 좋습니다. 아름답고 시원하고 섬세한 그림들이에요. 거대인쇄물로 보는 그림들이 너무 좋네요. 와. 이건 인쇄를 해야만 표현되는 거겠어요. 정말 보통정도 크기였우도 좋았을텐데 큼직하니까 진짜 너무 좋아요.
9791136727657,10,한 번 쓱 훑어보고 아까워서 꺼내놓지도 못하고 있어요ㅠㅠㅠ
9791136727657,10,액자부터 사 놓았습니다^^ 크리스마스 다음날 도착 예정이던데 받으면 정말 기분 좋을 것 같아요!
9791136727657,10,작가님 콜렉션북 내주셔서 감사합니다ㅜㅜㅜ 사실 요렇게 따로 내주실 거라 생각치 못했는데 넘 기쁘구 작품 완전 재밌으니까 안보신 분들은 꼭 봐주셨으면 좋겠습니다ㅜㅜㅜㅜㅜ
9791136727657,10,작가님 ㅜㅜ 콜렉션 북 진짜 기다렸어요ㅠㅠ 하나만 가지면 아쉬울 것 같아서 두권 샀습니다ㅠㅠ 진짜 정설화작가님 그림 너무너무 좋아하는데 이런 기회가 생겨서 정말 기뻐요ㅠㅠㅠㅠㅠㅠ
9791136727657,10,A3크기 포스터 열장이니까 한 장에 3000원 정도라고 치면 아트 포스터로서 전 괜찮은 것 같아요. 작가님 예쁜 일러스트 넘 감사해요. 인쇄 잘 나왔으면 좋겠어요.
9791136727657,4,21페지에 정가 32000원... 크기가 크다 쳐도 너무 비싸요 옆나라랑은 물론 출판업계 사정이 다르지만 저쪽은 이정도 크기에 최소50점 이상 일러스트여야 이정도 가격인데... 차라리 모든 일러를 다 넣으시지 굳이 콜렉션북으로 만든 이유를 모르겠어요 부록때문에 사는데 조금 호구된 기분입니다
9791187939474,10,얇지만 그래도 anmi님의 러프와 일러스트들을 감상할 수 있어서 너무 기쁘네요.
9791187939474,10,"32쪽 즉 16장 짜리.빳빳한 종이로, 예쁘긴 한...만원..."
9791160075151,10,인쇄도 잘 됐고 훌륭하네요. 모든 일러스트가 짤림이 없이 한 면 가득하게 인쇄되어서 안도의 한숨을 쉬었습니다. WLOP 를 시작으로 다른 작가분들의 일러스트 화보도 많이 만나볼 수 있으면 좋겠네요.
9791136237866,10,흥행한 너의 이름은도 안 해주더니.. 뜬금없네.  이미 원서로 사버렸는데
9791136237866,10,날씨의 아이 미술화집이 정발을 하는군요. 멋진 풍경 일러스트집에 반해서 구매합니다. 도쿄를 9번 방문했지만 실제 도쿄를 멋지게 잘 표현한 일러스트에 빠져듭니다.
9791187886495,10,트위터에서 보고 왔습니다. 기대되네요~
9791187886495,10,내가 원하던 책!
9791127432034,10,앞쪽은 구도에 대한 이론적인 설명이 16장 반 정도 할애되어 있고 뒷부분은 1명부터 다수가 나오는 구도까지 참고 포즈 자료들이 실려 있습니다. 액션신이나 여러명이 함께있는 구도는 어려웠는데 그림 공부하는데 도움이 될것 같습니다.
9791127432034,8,"웹툰 작가, 일러스트 작가를 꿈꾸는 사람이라면, 해당 지식을 얻기 위해 읽으면 도움이 되는 책인 것 같다. 역시 세상은 넓고 전문분야는 많은 것 같다."
9788979293043,10,책 한권에 아주 많은 내용을 담은 작법서로 그림체가 마음에 들면 구매하길 권함. 단 손그림 느낌이라(해칭 표현 등) 참고.
9788979293043,10,"얼굴을 잘 못그려서 고민이었는데 정말 많은 도움이 되었습니다. 책 분량의 절반이 얼굴, 머리카락입니다."
9788979293043,10,"그림 왕초보들의 자세한부분은 좀부족한거같고그림체가 참 마음에 들어서 구입했어요일단 만족입니다. 따라그리는데  머리카락 그리는게 많이 늘었어요.  여자먼 자세히 나와서 남자그리기도 나왔으면 좋겠네요, 캐릭터을 다양한 부분이 부족.하지만 그림실력이 올라감."
9791127428730,8,마이너 문화를 소개하는 책 답게 자유분방한 내용과 구성이 보는 즐거움을 더 했다. 굿~~~! ㅎㅎ
9791127428730,10,"오타쿠 문화에 대해서 심층적으로 알 수 있어서 좋았다. 나름 신선하고, 흥미로운 주제였던 것 같다."
9788960882652,10,작가의 그림이 마음에 들면 구매 권장. 완전 생초보보단 어느정도 그림 입문 된 사람한테 괜찮을 듯
9788960882652,10,입문자분들 도움됨 기본적으로 좋은 팁들이있음 물론 다른 작법서에서도 볼수있지만 그래도 기본기도 좋으시고 설명도 좋게 알려주시고있음 고수분들은 이 책 필요없을듯요 입문자들은 사셔도 좋음
9788960882652,10,입문자에게 권장
9788960882652,8,"내용은 다른 책과 동일하지만, 특유의 그림체와 여러가지 참고할만한 포즈가 많이 있고, 첨언도 많이 해줬으므로 다른 영양가 없는 책보다는 평균 이상은 간다는 느낌의 작법서입니다."
9788960882652,10,조씁니다 쪼아요
9788960882652,10,잘 정리된 작법서 같습니다.
9791196702601,8,그림그릴 때 포토샵 응용하는 꿀팁이 알차고 좋아요. 근데 작가님들 튜토리얼 부분이 소야님 부분은 그래도 도전해볼만 해 보이는데 다른분들건 난이도가 너무 높아서 초보자한테는 추천하고 싶지 않아요
9791196702601,10,넘 좋아요! 나온지 좀 됬을때 샀지만 그래도 리뷰 남깁니다
9791196702601,10,작법서는 살면서 처음 사봤는데 너무 만족스러워요 ! 그림초보라 어려울줄알았는데 설명이 쉽게되어있어서 이해하기도 쉽고 따라하기도 쉬웠어요 네오아카데미에서 나오는 다른 책들도 구매해서 보려구요 ~! 아직 중간까지밖에 못봤는데 얼른 뒷부분도 봐야겠어요 ㅎㅁㅎ
9791196702601,8,책은 완전 좋아요 다만 초중급자에게 매우매우유익할거같아요저는 선도잘 못그리는 왕초보라서 일단은 책장에 꽂아두는데 금방 볼 수 있을거 같아요 내용도이해하기쉽고 여러꿀팁들이 다수있어서 막시작하는 저같은 초보자에게 완전 추천드러요
9791196702601,10,"책을 읽어봤던 사람인데 포토샵관련 내용도 엄청 세세하게 잘 담겨있고 채색 방법, 묘사 등이 꼼꼼하게 잘 담겨있어서포토샵을 안 하는 저도 포토샵을 다운받게 되는 대단한 책이 였습니다. 이 책을 만들어주셔서 정말 감사합니다:)"
9791196702601,10,와아앙 이벤트도 하고 해서 사봤는데 진짜 그림 순서 다 나와있고 너무 좋음...이거 그냥 학원책이라고 별점 1개 주는 사람들 진짜 이해안됨네오갓카데미도 어차피 학원인데 당연히 학원에서 나온 작법서지 뭘 더 바래...이렇게 더 잘 나와 있는데 ㅠㅠ 진짜 소야쌤 것도 나왔고 제이네임 원장님도.
9791196702601,10,클립스튜디오 작법서도 잘 보고 있었는데 또 새로운 책이 나왔네요 왜이걸 지금 알았을까 ㅠㅠ 책 나온거 알고 바로질렀습니다! 네오아카데미 화이팅!
9791196702601,10,작법서 몇권 있는데 매우 만족이었습니다. 믿고보는 네오아카데미 선생님들 이번에도 알찬 내용일거라 기대해봅니다!!
9791196702601,10,기대평-넘 좋은 책이네요. 칼라는 그냥 대충 칠했는데 공부해보고 싶습니다.
9791196702601,10,기대평 - 현재 그림을 그리고 있는데  이런 책이 나와서 너무 좋아요!!
9791127408268,8,;;부록은 서비스 같은거겠지 싶어서 그냥 전자로 책만 봐야겠다 하고 샀는데내용이 전부 CD 내용 기반이잖아요.. 이러면 CD 부록을 제외하고 파는 것 자체가.. 메리트가 너무 떨어지는데요 ㅠㅠ 내용이 거의 관계가 없으면 그러려니 하는데..그게 많이 아쉬워요.
9791127408268,6,책은 좋지만 이북은 CD내용이 미포함입니다. 꼭 책으로 구입하세요..이북으로 샀는데 CD내용이 포함되지 않아 별 3개입니다.
9791127408268,8,보기 편하게 되어 있네요!!
9791127408268,10,여성에 비해서 근육이 많은 남성을 그리는 것은 상대적으로 어려움을 겪었던 터라 남성의 근육을 공부하는데 있어 도움이 많이 될 것 같습니다.
9791160501537,10,보기쉽고 따라하기 좋게 설명이 잘 되어있어요
9791160501537,10,웹툰이 어떻게 만들어지는지 알 수 있는 기회가 많지 않은데 이렇게 일러줘서 좋네요
9791160501537,10,웹툰 제작의 시작부터 차분하게 알고 싶다면 이 책이 큰 도움이 될 것이다.
9791160501537,10,웹툰을 이해하고 더욱더 재미있게 즐길수 있어서 초보작가나 웹툰팬들이 읽어보면 좋겠어요.
9791160501537,10,웹툰에 빠져살다보니 자연스럽게 웹툰 제작에도 관심을 가지게 되었어요. 처음 시작하는 웹툰 작가를 위한이라는 부제가 마음에 들어서 구입했답니다.비교적 쉬운 내용이라 부담없어서 좋아요.
9791160501537,10,쉽게 따라할 수 있고 기초를 배울 수 있어 좋아요
9791160501537,10,실제 웹툰 작가가 직접 경험하고 터득한 노하우를 통해 웹툰 제작에 필요한 방법들을 배우고 도전해 볼 수 있는 좋은 기회가 도리것 같아서 기대됩니다
9791160501537,10,"웹툰은 이제 제 생활에서 뗄수 없는 존재인데, 그런 웹툰이 어떻게 만들어지는지 방법을 배울수 있는 책입니다. 웹툰을 제작할때 필요한 프로그램부터 시작해서 컷 나누기, 색 입히기 등등 기술적인부분과, 어떻게 하면 웹툰 작가로 데뷔할수 있는지도 자세하게 알려주고 있습니다."
9791160501537,10,"웹툰이 활성화 되면서 관심도가 매우 높아지는데, 제작하는 방법에 대한 안내가 잘 되어있어서 기대되네요."
9791160501537,10,요즘은 컴퓨터만 있으면 누구나 만화가의 문을 두드릴수 있다죠. 끈기와 열정을 가진 초보 웹툰 작가를 위한 훌륭한 가이드입니다.
9791160501537,10,웹툰을 그려보고 싶은 초심자들에게 제작 노하우를 차근차근 알려주는 유용한 책이네요.
9791160501537,10,웹툰 초보자들에게 활용도가 높은 제작 노하우를 웹툰 작가에세 배워볼수 있는 유용한 책이라 관심을 가지게 되네요.
9791160501537,10,직접 웹툰 제작을 하는데 있어서 차근차근 배워 나갈수 있기 때문에 흥미로운 책입니다.
9791160501537,10,"웹툰의 완성도, 그 차이는 대체 어디서 오는 것일까. 이 책은 단순히 웹툰의 제작 기법만 알려주는 게 아니라, 보다 완성도 높은 웹툰을 만들 수 있는 노하우를 알려준다. 막상 웹툰을 시작하려 해도 갈피를 잡지 못하고 헤메기 일쑤인 입문자에게 자신의 한계를 뛰어넘는 성취감을 제공해 줄 것이다."
9791160501537,10,만화와 그림그리기를 좋아하여 취미삼아 해볼까하여 구매했습니다 가장 기본적인 스케치에 대한 설명과 제작과정에 대한 단계적인 설명이 초보자들에게는 안성맞춤인 책인것 같아서 추천합니다
9791160501537,10,"웹툰 제작 시작의 고충을 처음부터 차근차근 집어주고, 노하우 까지 함께 알려주는 알찬 구성으로 작업의 편의성과 능률을 올려줄 것 같네요."
9791160501537,10,"웹툰을 워낙 좋아하기에 만드는 제작과정도 궁금하여 읽어봤는데 가장 기본이 되는 스케치 부터 채색, 배경과정까지 조금씩 따라하다 보니 꽤 재미있네요점점 전문과정으로 들어갈수록 어렵지만 초보들이 보기에는 좋은 책 같아요"
9791160501537,10,초보 웹툰 작가들에게 많은 도움이 될 것 같아요
9791160501537,10,웹툰 제작 과정에 관한 전반적인 내용이 있어 웹툰을 좋아하시는 분들이나 웹툰작가를 희망하시는 분들에게 추천하고픈 책입니다
