ISBN13,rating,review
9788959755950,10,일러스트에관해서 자세하게 나와있구요 비전공자가 보아도 어려움이 없습니다 ^^
9788968318696,10,센과 치히로를 좋아하신다면 구매 추천추천!가오나시의 초기설정이 그렇게 화려할 줄은 몰랐습니다.ㅋㅋ
9788968318696,10,ㅎㅇㅎㅇㅎㅇ 날가져요 지브리
9788968318696,8,"책의 내용은 너무 좋았으나, 윗부분이 전체적으로 구겨져 있고 겉 표지 또한 구겨져 있던군요.."
9788968318696,10,수채화 느낌이 너무 좋아서 결국 구입.
9788959754809,8,"굉장히 사실적이고, 그림은 펜선이 조금 지저분한편입니다.. 주름이 생기는 원리에 대해 자세하게 설명해두었기때문에 이해되고나면 자신만의 주름을 그리는 방법을 터특해야할 것 같습니다"
9788959754809,10,사진과 일러스트를 비교해서 싣고 있다고 해서 읽어보고 싶습니다.
9788959754809,10,한스미디어 책을 많이도 샀는데 옷주름 그리는 법도 올타구나 하고 사서 잘 보고 있습니다 ㅎㅎ
9788959754809,10,실젳사진이 있어서 그림과 비교가 되고. 사람의 움직임에따라. 옷의 질감에 따라 옷주름이 상세하게 표현되여져 있숩니다
9788959754809,8,만족합니다근데 약간 보기힘들었어요그림실력과 무관하게선이많아조금 그렇지않았나싶어요근데이부분은 또 어떻게보면 정말 좋은부분인데트레이닝복에비중이 많지않았나싶어요다른 다양한옷과포즈잡을때 응용가능한포즈는 좀 적었던것같습니다
9788959754809,10,"기대했던 거랑은 약간 다름.. 인체책들처럼 주름의 원리나 구조 같은걸 좀더 설명해 줄줄 알았는데(그래야 가상의구도랑 포즈에도 적용시키지)일상생활 사진 포즈집에 더 가까움. 그래도 설명이 아예 없는것도 아니고,이 주름이 왜 생기는지 구석구석 알려줌. 포즈가 다양해서 응용할것도 많고"
9788959754809,8,주름에 대해 체계적으로 설명하고 사진과 그림을 비교해서 보여준다.
9788959752249,8,"기본에 충실하고, 그 위쪽을 바라보시는분은 다른 데생 자료들을 따라그리는게 좋을것 같네요"
9788959752249,8,초보자에게는 조금 어렵고 인체를 어느정도 아시는 중급자분들이 쓰시면 좋을것 같아요!
9788959752249,10,캐릭터의 동작을 그릴때 참고하려고 주문했는데 유용하게 잘보고있습니다.매일 이책으로 연습하면 동작들이 많이 늘것 같아요 ㅎㅎ
9788959752249,10,기초서로 좋아요
9788959752249,10,그림그리기 너무 좋아요
9788959752249,10,매번 만화책만보며 따라그렸는데 이제는 제대로 배워볼려고합니다
9788959752249,10,만화캐릭터 그리는 방법을 보다 쉽고 재미있게 배울수 있어 좋네요.
9788959752249,10,만화캐릭터를 보다 쉽게 그리는법을 배울수 있습니다.
9788959752249,10,만화 캐릭터 그리는 법과 그 과정을 소개한 책이라고 해서 읽어보고 싶습니다.
9788959752249,6,초보자가 배우기 좋네요 전 완전 생초보중에 초보라 조금더 설명 자세하게 나왔으면 좋았을텐데
9788959752249,8,"그림을 전혀 안그리는 사람한테는 조금은 어려울 수 있지만 인체구조부터 표정, 포즈 등 전반적인 것을 다루고 있는 좋은 책인것 같습니다.하나씩 따라하다보면 어느새 잘그릴 수 있을것 같은 기분이 듭니다!작가의 그림체대로 처음엔 따라하게 되겠지만...나중엔 나만의 그림을 그리고 싶어요 도전!"
9788959752249,10,만화 캐릭터 그리는 법이 기초부터 자세히 나와있어서 캐릭터 그리는데 많은 도움이 될 것 같아요
9788959752249,10,애니관련 꿈을 가지고있는 학생들에게 좋은것 같습니다. 저도 여러 그림그리는 꿀팁들알고 갑니다
9788959752249,8,다양한 표정표현이나 포즈등이 들어있어 참고하기에 좋은책이었던것 같습니다.
9788959752249,10,초보자도 쉽게 따라그릴수있게 잘 되어있어요 저는 중급자이지만  체계부터 차근차근 다시한번 배워보고자 구매했습니다 감사합니다
9788959752249,8,이책과 다른 세부적으로 설명한 책 병행하면 많은 도움될듯합니다!개인적인 자세한 리뷰는http://m.blog.naver.com/PostView.nhn?blogId=qorudtnr123&logNo=220411723778여기로!
9788959752249,6,초보용으로는 상당히 어려운 책입니다.전 이 책 사고 거의 도움을 받지 못해 다른 책을 여러권 사고 나서야 그림 실력이 올라 다시 이 책을 들여다보고 있습니다.완전 초보분들은 이거 말고 옷주름이랑 몸 구도 먼저 연습하고 이 채글 잡으시면 도움이 될것 같습니다
9788959752249,10,그림그리면서 많은 도움이되는 책!
9788959752249,8,초등생 딸아이의 선택으로 구입했다. 매일 보며 따라그리는데  솜씨가 일취월장함을 느낀다아이가 만족해서 사준 보람이 있다
9788959752249,8,기초실력이 없다면 어려울 수 있는 책. 그래도 좋음
9788959752249,10,좋네요. 그림을 그리고는 있지만 일러스트쪽에 관심이있어서 구입했어요. 이런그림은 잘 못그려서.. 잘샀다는생각이 듭니다.맨앞에  채색법이 간단하게 나와있는점도 맘에 들구요
9788959752249,10,"딸아이가 만화책에 빠져 캐릭터 그리기를 열심히 하더니 문화상품권하나 생겼다고 구입했네요. 보고 열심히 연습하더니 많이 늘었어요. 기특하네요.
뭐든 열심히 하면 좋은 거죠. 도움이 많이 되어서 사주길 잘 한것 같아요."
9788959752249,10,처음 시작할 때에 부담없이 기초부터 알려줘서 좋습니다. 그리고 흐릿하게 처음에는 따라 그릴 수 있도록 그림도 마련한 것이 마음에 들었던 책. 아쉽다면 그 따라 그리는 칸이 너무 작았다는 것일까요.
9788959752249,8,독특하기 때문
9788959752249,10,만화캐릭터를 그릴때에 참고가 될까봐..
9788959752249,10,"여러가지 포즈나, 채색 방법 등등.. 여러가지가 자세히 나와있고 많은 사람들이 인체그리기(만화) 처음 시작할때 참고하는 책인 것 같습니다."
9788959752249,10,"남,여 그리는법이 균형적으로 나와서 마음에 들어요"
9788959752249,8,참고하면서 그리고 있어요. 만화를 그리는 폭이 넓어진 것 같아용
9788959752249,8,"기본적인 캐럭터 데생을 연습하는데 도움이 되는 책입니다. 하지만 구체적인 설명과 방법이 부족하기 때문에 어느정도 실력이 있는 사람을 제외하고, 데생을 시작하려는 사람에겐 조금 무리가 있을 수 있는 책입니다"
9788959752249,10,이 시리즈중에 제일 괜찮은책입니다 강추!!
9788959752249,10,상당히 꼼꼼하고 조화로운 바이블 참고서 같은 느낌이였습니다. 이제 꾸준한 노력과 열정만 있으면 되겠군요.
9788959752249,10,내용도 알차고 그리기 연습도 할 수 있게 돼있어서 도움이 많이 될 거 같아요
9788959752249,10,"제가 원하던 책이네요 
게임그래픽쪽 공부하지만 이책이 많이 도움 될거 같습니다.
꼭 사세요 두번사세요"
9788959752249,10,잘받앗습니다 감사요
9788959752249,10,자세하고 내용도 잘 나와있어서 좋아요!ㅎ
9788959752249,6,딴거필요없어요 무지자세합니다
9788959752249,10,★자세한 설명과 그리기에 기초부터 응용까지 큰 도움이 되는 책이기에 강추합니다~!
9788959752249,10,"모든 만화가, 캐릭터 디자이너, 일러스트레이터 들이 한번쯤은 거쳐가는 책!! 당신의 동인지 부터 내일 그려내야할 입시작품 까지 폭넓은 도움을 드릴 강력한 캐릭터 바이블!!"
9788959752249,10,"난,산다,이,책"
9788959752249,10,친구꺼 봤는데 확실한 정보 많더라구요~!! 그림 그리는데 많은 도움이 되겠어요!
9788959752249,10,만족해요 ㅋㅋㅋㅋ엄마가사주셨는데 ㅎㅎㅎ
9788959752249,10,만족~
9788959752249,10,쓸모가 많은 책입니다. 겉표지보다 속이 더 대단함
9788959752249,10,초보를 위해 배려가 많이 된 책..
9788959752249,10,이거 꽤 괜찮네요
9788959752249,8,처음부터 다시 해볼려고 구입햇는데 괜찮은거 같네요~
9788959752249,8,딸이만화그리기를좋아하는데도움이많이된다고해서좋네요^^v
9788959752249,8,나름만족합니다^^
9788959752249,10,정말 자세하게 나와있네요..ㅎㅎ
9788959752249,6,초보를 위한 것?
9788959752249,10,몸 그리기가 어려웠는데 덕분에 잘그릴수 있을거 같네요 ^^.
9788959752249,10,일단 그림체가 깔끔하고 알기 어려운 근육이나 뼈의 구조도 비교적 간단해서 보기쉽다
9788959752249,10,제가 딱 찾던 그 스타일 이더군요.이 책은 정말 값보다 더 톡톡히 해주는것 같네요.
9788959752249,10,좋네요. 한동안 슬럼프에 빠져있었는데 꽤 도움이 되었습니다.
9788925289229,10,나루토 펜북 소장하려고 구매해네요 . 역시좋다 는 ^^
9788925289229,10,나루토의 팬이시라면 만족할 만한 퀄리티의 데이타 북입니다. ^^ 짱이네요~!!
9788925289229,10,나루토의 매력을 팬북으로 다시한번 느낄 수 있는 팬북이다!!
9788998697891,10,알찬구성으로 다꾸 좋아하시는 분들이라면 너무 좋아할 것 같아요
9791136249753,10,매년 사고 주변에도 추천하고 있어요.
9791136249753,10,4년전인가 부터인가 냥이 좋아하는데 넘 귀여워 구매하게되었어요 까먹는 일정두 적기 편하구 좋아요 매년 삽니다 ㅎㅎ
9791136249753,10,탁상달력의 그림들은 해가 지나면 따로 보관을 해요. 나를 위로하는 유일한 할배..
9791136249753,8,그림이 너무 좋아 2018년부터 사게 된 달력. 보통 달력을 사는게 아깝다고 생각했는데 이 일러스트북 달력은 만족스럽다. 특히 1년 365일 보면서 기분이 좋다.
9791136249753,10,2021년 캘린더를 미리 준비하면서 모처럼 즐거웠다. 일러스트가 재밌다.
9791136249753,10,매년 구매합니다..너무 기분 좋은 달력이에요~^^
9791186745502,10,코로나로 가정보육중인 딸이랑 덕분에 행복한 시간 보내고닜어요~ 아이가 그려달라는 그림 찾아서 막힘없이 간단히 그려주고 같이 색칠하고 오려서 놀아요!^^ 오늘은 클레이로 그림도 그려보았어요! 정말 쉽고 재미있어서 강추합니다!
9791186745502,10,이게 바로 제곧내! 제목처럼 1분이면 귀염뽀짝한 일러스트를 그릴 수 있어요!! 다양한 테마로 2000개가 넘는 손그림들이 책을 가득 채우고 있어서 뭘 그릴지 고민을 하게 만들어요♡ 특히 맛있는 음식 그림들 페이지에서 다음 장으로 안 넘어가는거 나만 그래요??ㅋㅋ 강력 추천입니다!
9791186745502,10,2000개나 되는 일러스트가 들어가있어서 이거 한권 있으면 다양하게 그릴 수 있겠어요. 평상시 잘 안 그리는 것도 보면서 그리니까 잘 되고 변화를 주는 것도 재미있어요. 집콕 아이템으로 완전히 좋네요!
9788978496186,4,앞부분빼고 내용이 너무 적음.....
9788978496186,10,책안 내용이 실제 피규어 크기와 표현된 그림이 비율이 같아 그림을 그리는데 많은 도움이 되었습니다근육표현과 함께 다양한 구도와 모작하는데도 참고가 많이 되었습니다https://m.blog.naver.com/zzbnfs89/221968669179책을 구매하시는데 도움되었으면 합니다
9788978496186,10,번역되길 바랬던 책이였는데 출간이 반가워서 바로 구입했어요. 관절인형을 베이스로 남녀 캐릭터가 함께있는 포즈와 구도를 공부할 수 있어서 좋은 것 같습니다
9791127430801,8,비율은 자신이 다시 생각해서 그려야할 포즈집
9791127430801,8,미묘한 5등신
9791160074628,10,디지털 드로잉을 배워보고싶어서 무턱대고 아이패드와 펜슬은 샀는데 기본적으로 프로크리에이터를 쓰는 방법을 모르니 드라마만 봤는데 프로크리에이터 사용법부터 차근차근 알려주는 쉬운책이 나와서 너무 좋네요 앞으로 더욱 많은 책 기대할게요
9791160074628,10,영상으로 할지 고민하고있었는데  책이나오자마자 구입했어요  뒤에 영상도 있고 팔레트며 다있어서 생각보다 하기 편했어요
9791160074628,10,"이번에 아이패드를 사면서, 디지털 드로잉을 배우고 싶어서 책을 샀어요. 처음 해보는 디지털 드로잉이어서 걱정했는데, 책이랑 영상 같이 보니깐 옆에서 선생님이 알려주시는 것 처럼 혼자서도 할 수 있어요. 특히 스케치가 제공이 되니깐 좋아요. 아주 귀여운 선인장 하나 완성했답니다. 감사합니당"
9791160074628,4,출판 날까지 기다리면서 다른 책은 거들떠도 안보고 기다렸는데... 초보가 하기엔 너무 성의 없이 느껴지는 책이에요... 어느정도 하시는 분들이 알아들을 수 있을듯요... 일러스트도 많을줄 알았는데 ㅠㅠ 실망이에요 다른책 다시 샀네요 ㅠㅠ
9791186921838,10,그가 죽고 그의 대담집을 읽으니 가슴이 쓰려온다. 그의 새 만화를 읽지 못하는 아픔.
9791186921838,10,"이제 더는 다니구치 지로 선생의 만화를 새 만화를 볼 수 없지만, 이렇게 흔적을 따라가면 또 위안을 받을 수 있을 거 같네요."
9791160859072,10,완벽하게 따라하려하지 마세요책의 과정에 자신의 편한 스타일을 넣으세요그림은 즐기는법니다
9788978496018,4,테크닉을 가르쳐주는 작법서가 아니라 그냥 본인이 좋아하는 캐릭터 그려놓고 자기 그림 자랑하는 책. 실망 그자체. 입문자는 절대 사지말것
9788978496018,4,구매해서 배우려고 하면 엄청나게 내용이있는 느낌이 아님 걍 그래요
9788978496018,2,흑백화의 매력은 선화에서 나온다고 생각하는데 선화에 도움이 되는 내용은 없다. 굳이 따지자면 면표현? 그것도 테크닉에 대한 설명은 거의 없어서 읽고 내 실력이 향상된다라는 기분은 느껴지지 않는다 그냥 그려놓은것 전시 및 나열뿐이라 도움이 되지 않았다. 그림체도 호불호가 좀 있을 것 같다.
9788978496018,4,"흑백일러스트라는 주제는 좋았으나 상세설명이 매우 부족하고,  예제를 하는 작가의 흑백일러스트 실력이이 그닥 좋아보이진 않는다..."
9788978496018,4,직접적인 참고가 되지 않는 추상적인 설명이 많고 (쌀쌀맞은 캐릭터는 눈빛이 차갑습니다 같은) 전반적인 책 내용이 흔히 말하는 밥 로스식의 ‘이러이렇게 하세요. 참 쉽죠?‘ 설명이라 입문자가 보기에도 좀 애매한 느낌입니다. 그리고 남자 캐릭터의 예시가 많이 부족한 점도 아쉽습니다.
9788978496018,10,지름신이 강림해서 구매했습니다 그림체 너무 마음에 들구 느낌있어서 좋네요 간단한 노하우도 있어서 참고용으로 소장하기 좋네요
9788978496018,10,작법서 수집 취미가 잇는데 이건 바로 장바구니에 넣어버렷네 ㅎ
9791160320589,8,"평소 판타지 의상에 대해 고민이 많았는데 이 책 덕분에 많은 도움을 받았습니다.판타지 의상을 어떻게 그릴지 막막한 분들이시라면 꽤 괜찮은 책일 것 같습니다. 작가가 패션관련된 전문학교를 다녀서 그런지 신경을 많이 쓴 것 같았으며, 읽는데 불편하거나 그런 점 또한 전혀 없었습니다."
9791185653549,10,전문가의 관점에서 가르쳐주는 책이네요. 쉽게 잘 설명되어 있어요. 참고할 작품도 많이 들어있네요.
9791185653549,6,접근방식과 이론은 좋은데 내용이 빈약하네요
9791195739554,6,"일본 특유의 유형성숙으로서의 오타쿠 문화에 대한 분석이 흥미롭다가, 그 범위가 아이돌까지 가버려서 좀 질리는 느낌"
9791195739554,10,개별 작품만 놓고 봤을때는 헤아릴수 없었던 의미들을 시대의 흐름상에서 파악했을때 나타나는 다채로움에 아주 흥미진진하게 읽었습니다.
9791127418199,10,제가 찾던 책이네요 너무좋아요 보니까 입문자용은 아니고 해부학지식을 어느정도 갖고있는 사람들이 사시길 추천합니다
9791127418199,10,추천받아서 구매했는데 매우 만족합니다!
9791127418199,10,아직 연습중.. 도움이 많이 됩니다.
9791127418199,8,간과하고 있는부분부분 참고하기 좋았음. 어느정도 인체파악은 하고있어야 도움이 될만한 책
9791127418199,4,따라 그리면 좋지만 역동적인 자세도 좋으나 초보자가 입문하기는 어려운 설명도 있고 그외 인체 설명이 너무 대충있다는점이 아쉬워요
9791160073027,8,"일본도 웹으로 제공하는 만화가 많이 늘고 있는데, 분명히 관점이나 표현 방식에 차이도 있을 테고, 유사한 부분도 있겠죠. 출판만화의 대국인 일본의 웹서비스 만화는 어떤 식으로 이뤄지고 있는지 확인해볼 좋은 기회일지도 모르겠어요. 업계관계자들이 봐도 좋은 내용."
9791160072471,10,표정 예제 일러스트들이 마음에 들어요. 표정 연구할 때 요긴하게 참고할 수 있을 것 같습니다.
9791160072471,10,이거랑 남자 헤어스타일 250은 구매해두면 요긴하게 쓰일 만한 책입니다. 물론 예제로 나오는 스타일을 시험해 보려면 그림 공부도 더 해야할 듯;;
9791160072211,10,설명과 이미지가 크고 시원시원하고 좋습니다. 기초부터 알고싶은 분들은 이 책을 권합니다.
9791160072211,8,"내용 자체는 유익하나, 아예 그림 프로그램을 처음 다뤄보시는 분들이 보기에 좋을거 같아요. 기존에 다른 프로그램을 쓰시던 분들은 좀 더 심화내용을 다룬 책을 보시는게 더 유용할 것 같습니다."
9791160072211,8,구매합니다.
9788962592528,2,만화그리는 방법의 밑바닥 이론부터 알고싶었는데 그정돈 아니구요.어느정도 기초의 기초이론은 갖추신 분들이 보시면 될것같습니다
9788962592528,10,아주 실제적인 이야기들로 이루어져있습니다. 실제 만화 작업을 위한 구체적인 예시와 저자가 가르친 학생들의 콘티를 보다보면 절로 동기부여를 받아 당장이라도 작업에 들어가고 싶어지는 책입니다. 강추합니다.
9791133467204,10,일본판도 있는데 한국판도 샀어요. 사이즈도 똑같네요ㅋ
9791133467204,10,초판은 이미 끝난줄 알고 샀는데 잉? 초판이네 ㅋㅋㅋㅋㅋㅋㅋㅋㅋ으아 사스가 갓-라딘 ㄷㄷ 특전 잘 받았습니다~
9791133467204,10,아1!!!오늘 학교마치고 살려했는데  임시품절이라닝 ㅜㅜ
9791133467204,10,화집도 최고이고 특전도 최고에요!
9791133467204,10,넘나 예쁜 것초판 특전도 좋아요
9791133467204,10,좋아요!
9791133467204,10,좋은구성이에용!
9791133467204,10,원서 있지만 특전이 너무 매력적이라서 구입합니다 ^^
9791133467204,10,주문토끼 팬으로써 아침부터 주문햇습니다.
9791133467204,10,일본 원서 보유중인데 한국정발이라니!이런건 동시발매 좀 하자ㅠ
9791133467204,10,바로 구매!설마 초판이 아니라던가 하는 불상사는 없겠...죠?
9791133467204,10,사는순간 뿅뿅뿅하겠네요...우리나라는 가상의 2D인권도 보호 해주니까...
9791133467204,10,화집!!! 무조껀 구매합리다!!!초판한정이 오길 바라며!!!
9791133467204,10,코코로 뿅뿅할 시간이 왔다!!
9791133467204,10,읔.. 사고싶다
9788934978329,6,이분 책은 올컬러로 나와야.
9791133455317,6,신카이 마코토 전시회 다녀와서 감동 받아 샀습니다. 근데 대원은 랩핑을 해도 띠지랑 귀퉁이를 찌그러뜨리나요? 한 십 여 페이지 밑이 찌부러져 있어서 볼 때마다 기분 상합니다. 어쩔 수 없이 킵하긴 하지만 속쓰립니다. 책 내용은 좋아요. 대원 더 신경써주길 바랍니다.
9791133455317,8,신카이 마코토 감독의 팬이라면 당연히 구매해야죠.너의 이름은 비쥬얼 가이드보다 판형은 작은데 작가의 모든 작품에 대한 발자취랄까 읽을 맛이 있는 서적입니다.가격도 퀄러티에 비해서 저렴한 편이고 ..작가의 팬이라면 정말 소장가치가 있는 서적입니다.
9791160851182,10,아 나도 이거 원서 삿는데 정발됫네 ㅋㅋㅋㅋㅋㅋㅋㅋㅋㅋㅋㅋㅋㅋㅋㅋㅋㅋ
9791160851182,10,으앜ㅋㅋㅋㅋㅋㅋㅋㅋㅋㅋㅋ 난 이거 일본직구로 구매해서 공부했는뎈ㅋㅋㅋㅋㅋㅋㅋㅋㅋㅋㅋㅋㅋㅋㅋㅋ
9791160071207,10,입문자에게 무척 좋은 책
9791160071207,10,다양한 스타일의 채색법을 보고 자신만의 스타일을 찾아보면 좋을 듯.
9791160071108,8,처음 접하는 입장에서 나쁘진 않은데 부분 표현이다보니 호불호가 갈릴듯 싶습니다.안의 그림이나 손발 그림은 도움은 된다고 생각합니다.  뭐...그림을 책으로 보며 도움얻는다는게 쉽진 않은거 같습니다.
9791160071108,8,여러 구도의 손과 다리 등의 자료들이 있어서 유용합니다. 다만 인체를 이해한 사람들의 한에서 꽤 유용하다고 느낀다. 입문 단계에선 인체 원리 설명이 다소 미흡하다 생각된다.
9791160071108,10,"손, 발 뿐 아니라 다양한 연출과 구도들이 한 데 모아져 있어서 아이디어 짜기에도 좋아요. 표지 제목이 좀 아쉽습니다ㅠㅠ"
9791160071108,8,여러가지 구도로 구성되어있고 딱히 BL에만 한정되어있지 않은것 같다 ) 일러가 너무 예쁘다
9791160071108,8,내용물은 괜찮으나 제목의 영향으로 집에서도 맘 놓고 보기 힘들다.하하하.
9791160071108,10,학교에서 만화를 가르치는 선생 입니다 참고자료로 사고싶은데 제목때문에 못사겠어요 ㅠㅠ 진짜 이름좀 바꿔줬으면 좋겠습니다 ㅠㅠ
9791160071108,10,"BL이라는 선입견은 NO, NO! 매력적인 로맨스 장면을 연출하려면 꼭 한번 읽어보길 바란다."
9791160071108,10,굉장히 자연스럽고 최신책인만큼 포즈도 올드하지 않아서 좋아요. 그림체가 예쁘고 가장 보편화 된 스타일이라서 보기도 편안했던 것 같네요~
9791160071108,10,난 비엘은 안 그리지만 왠지 사야할 것만 같아
9788994199467,10,예쁜 책. 대충 훑어 봐도 그림도 이쁘고 색감도 좋다. 책이 비닐에 꽁꽁 싸여서 왔는데 엽서 때문에 그런듯. 엽서가 마음에 쏙 들었다. 책 자체가 예뻐서 그냥 들여다 봐도 기분이 좋아진다. 내용도 알차다.
9791127401313,8,그림으로 설명된 부분은 좋으나 사진부분이 전부 흑백인데다 어두운 색 옷을 입고 찍었고 사진 크기도 작아서 보기가 어렵습니다. 참고용으로는 좋습니다.
9791127401313,10,추천합니다! 도움 많이 되었어요! 슈트의 각종 부위들을 용어로 해설해준 부분이 좋았어요. 나중에 구글서치할때 도움이 될듯 합니다. 하지만 그렇기에 영단어도 적어주셨으면 좋았을거란 아쉬움도 조금 있었어요ㅋ 단순히 현실의 슈트설명뿐만 아니라 만화창작을 위한 설명도 포함돼있어 유용합니다
9788960525801,4,제가 2D형 인간인건지모델이 별로인건지;;;;뭔가 확 설렌다거나 그런게 없네요생각보다... 음.. 별로였어요;;;
9788971905135,10,인체를 잘 그리고 싶다면 강력추천합니다. 기본원리를 알기쉽게 잘 설명해두었습니다. 그동안 드로잉 책을 보고도 어려웠다면 덜컥 해부학 책을 살게 아니라 이책에 정리된 기본이 도움이 될것입니다. 겁먹지 말고 실력이 느는 감동을 소중히 하라는 작가님의 격려도 많은 힘이 됩니다.
9788971905135,10,"그림을 오래 그려도 인체가 너무 어렵게만 느껴진다면, 이 책 정말 강추예요. 무턱대고 따라그리는 게 아니라 어떤 생각을 하며 그림을 그려야 하는지부터 알려주고, 인체 그리는 법도 가장 효율적인 방법이라 배우고 써먹으면 바로 그럴 듯한 결과물이 나옵니다."
9788971905135,10,먼저 픽시브를 통해 알게돼서 혹시 번역서가있나해서 찾아보니 있어서 감사히 구매했습니다.표지디자인이 유치해서 지나치기쉽지만 훌륭한 교재입니다.
9788971905135,10,그림 그리는데에 도움이 되었습니다. 추천합니다.
9788971905135,10,오... 내가 원하던 책... 역시 만화는 쪽빠리 새끼들헌테 안대지~
9791170242833,6,그림이 접혀있어서 쫙 펴도 불편하네요 아쉽습니다. 그림을 반 잘라서 배치를 했으면 좀 더 보기 편했을텐데...
9791170242833,8,19세기 의상이 주였습니다. 의상 명칭에 대해 자세하게 나올 줄 알았는데 기대했던 것 보다는 덜합니다. 종종 ‘집을 나오는 농부이다‘로 설명이 끝나는 경우도 있구요.ㅠㅠ 책표지의 사진과 같이 치렁치렁한 의상에 대해 더 알고 싶어서 구매했기 때문에 아쉬웠어요.
9788960524729,10,여러 체형의 모델이 아니고 전신도 많지 않아서 실망스럽지만 사진의 수가 많지 않아서 부담스럽지 않게 손풀기용으로 책떼기 하기에는 좋음.
