ISBN13,rating,review
9788952774767,10,젠장할 모에로 떡칠된 일본 망가를 읽느니 이런 작품을 읽어야만 합니다. 이 만화를 보고 느낀 점이 많습니다. 진정한 페미니즘에 대해 다시 긍정적으로 생각해 됐고 우리 시대의 작품을 읽는 재미도 다시 느끼게 됐죠. 부디 이 작품이 저와 함께 늙어가길 바랍니다. 사가에 대한 저작군 문제가 없기를
9788952774767,4,궁금해 하지 않아도 될 뻔한...........
9788952774767,10,막 나감의 미학. 쿨이든 힙이든 그런 류의 형용사 백 개를 붙여 놔도 반찍반짝 빛날 듯한 작품.  2권 바로 주문.
9788952774767,6,음.. 포인트를 잘 못잡겠다. 2권까지 보면 달라지려나......
9788952774767,10,그래픽노블은 여전히 내게 낯설지만 그래도 좋은 작품은 알 수 있다.
9788952774767,10,빨려들어가듯 단숨에 볼 수 있다.
9788952774767,10,"사람들이 많이 추천을 해주고 아이즈너상도 수상해서 샀는데 너무 좋아요! 빨려 들어갈 거 같아요. DC나 마블말고 처음 사 본 미국 만화인데 명작이에요. 1, 2권 같이 주문하기를 정말 잘 한거 같아요. 빨리 시공사가 3권을 내주었으면 좋겠어요. 꼭 사세요! 여러분!"
9788952774767,10,"몇 년 전부터 기다리던 사가가 드디어 정발되었군요. 1,2권 동시 정발이라 더 기쁘네요 바로 구입하여 읽었고 다음권도 빨리 만나봤으면 좋겠습니다. 정발해주어서 감사합니다!"
9788952774767,10,탄탄한 스토리. 독창적인 배경. 깊이있는 주제. 어른들을 위한 SF 오페라!
9788952774767,10,그래픽노블은 마블만 샀었는데 사가도 엄청 재밌네요!! 영화화도 기대됩니다!!
9788952774767,10,"스페이스 오페라 버전의 로미오와 줄리엣! 그래픽 노블은 처음인데 생각보다 전개가 빠르고 시원해 재미있다. 1, 2권을 읽었는데 아직도 풀어나갈 설정과 이야기들이 가득한 느낌이라 정발될 나머지 권들도 기대된다."
9788952774767,10,캐릭터가 다들 매력넘치고 이야기 전개도 독특하고 재미있습니다. 빨리 다음권을 읽고싶어요
9788952774767,10,오랜만에 그래픽 노블을 끝까지 읽었다. 지적 자극적 성적 매력적
9788952774767,10,등장인물들은 다른 이미지 코믹스 캐릭터들보다 윤리적이고 도덕적이어서 살짝 흥이 깨진부분이 있지만 재밌으니 된걸로 치자.
9788952774767,10,사가 정발되기전부터 기대하고 있었는데 잘읽겠습니당
9788952774767,10,페이블즈랑 이거중 뭐살까 고민하다 이거 먼저 샀습니다. 후회 안되네요^^
9788952774767,10,배송속도에 놀라고 책도 재미있어서 놀랐습니다사가를 예전부터 한번 보고싶었는데 이번에 정식으로나와서 너무 좋습니다!
9788952774767,10,당일배송이 일단 마음에 들고 사가가 정발했다는데 읽어봐야지
9788952774767,10,꿀잼 꿀잼 개꿀잼
9788952774767,10,[와이:더 라스트 맨]의 믿고 보는 브라이언 K. 본 + 피오나 스테이플스의 작화 또한 훌륭하다. 성공적.
9788952774767,10,배트맨 코믹스를 시작으로 미국만화를 입문했는데 사가가 꿀잼이라 샀습니다 인고의 시간을 거쳐서 좋은 타이밍에 내주셔서 감사감사요ㅋㅋ
9788952774767,10,"수많은 극찬에는 다 이유가 있습니다. 세계관, 캐릭터, 작화 모두 훌륭합니다. 고어나 성적인 묘사에 크게 민감하지 않으시다면 꼭 보세요!(특유의 분위기 덕분에 저는 크게 불편하진 않았지만 묘사가 꽤 적나라하기 때문에 참고하시길 바랍니다.)"
9788952774767,10,드디어 나왔네요. 기다린 보람이 있습니다
9788952774767,10,잘 만든 만화을 보는 기분.정말 재미있다.
9788952774767,10,재미있어요!
9788952774767,10,마블과 디씨 코믹스에서는 볼 수 없었던 만화. 앞으로 이미지코믹스에서 나올 그래픽노블들을 눈여겨 볼만하다.
9788952774767,10,사실 처음엔 별 관심없었지만 정발 연기로 인해 알게되어 구매했는데 몰입도가 장난 아니다..어디선가 본듯한 소재지만 이런 뻔한 내용을 이렇게 흥미로운 내용으로 가다듬은 작가가 정말 대단한듯 ㄷㄷ
9788952774767,10,최고의 si-fi 드라마
9788952774767,10,근래 본 그래픽노블 중 가장 흡입력 있었다....
9788952774767,10,유려한 그림체 속에 담긴 흡입력있는 이야기에 시간가는줄 모르고 집중해서 보게된다
9788952774767,10,새롭고 완벽하게 시작을 끊었다. 비주류임에도 불구하고 베스트셀러가 된 이유는 분명히 있다.
9788952774767,10,사가 만세
9788952774767,10,지금까지해온 온갖상상의 집결체를 보는느낌보는 두눈  종이를 만지는 두손이  즐겁다빨리 3편도 내주세요
9788952774767,10,이자벨이 너무 귀여워요
9788952774767,10,이전에도 익히 재밌다는 소문을 들어 정발 나오자마자 질렀습니다. 이제 재미있게 읽으러 갑니다.
9788952774767,10,괜찮다고 하길래 다른 책들 사면서 같이 산건데 이게 제일 재미있네요
9788952774767,10,원서로 너무나 인상 깊게 읽어 한국에서 못 읽으신 분들한테도 추천하고 싶어 나오자마자 구매했습니다.
9788952774767,10,매력있는 주인공들과 다양한 우주 종족들로 읽는즐거움은 물론 보는 즐거움까지 완벽하다. 개성있는 성격들로 스토리를 더욱 흥미롭게 만드는 캐릭터들이 맘에듦
9788952774767,10,재기발랄하고 환상적인 대서사시!
9788952774767,10,취향에 딱 맞는 책
9788952774767,10,최고입니다
9788952774767,10,겨우 2권 끝났는데 캐릭터들이 너무 확실하다.특히 ‘더 윌‘은 내 기준사가를 계속 보고싶게 만든 캐릭터
9788952774767,10,"매튜 본, 혹은 사우스파크 제작진이 스페이스 오페라를 만들었으면 이런 느낌이었을까? 벌써부터 다음권이 기대되는 코믹북은 정말 오랜만인듯 하다."
9788952774767,10,응모 땜에 적으러 왔는데 여기 적는게 맞는진 모르겠네. 빵빵 터지면서 스무스하게 넘어갑니다 브라이언 형 사랑해!
9788952774767,10,작년에 정발한다고해서 두근거리며 기다렸다가올해! 드디어 나왔고! 1년 더 기다렸음에도!역시 사가! 이걸 한국어로! 정말 재밌었습니다...사이가 좋지않은 두 집단사이에 서로를 사랑하며 그 사랑의 열매까지 갖게된 주인공들...비슷한 사랑인 로미오와 줄리엣은 비극이였지만 사가는 희극이기를
9788952774767,10,"이 책은 한번 잡으면 끝까지 보게 만들고, 스타워즈 속 다른별 이야기를 보는 듯한 착각에 빠지게 되며, 보는 내내 두근 거림을 느끼고, 다음이 기다려지게 만드는 스토리와 사실감 넘치는 그림에 빠져 버리게 된다...  이런 걸 기다렸다. 내 인생 만화가 나왔다."
9788952774767,10,해리포터와 스타워즈를동시에보는듯한 몰입감 과 이야기전개속에 로미오와줄리엣의부드러움이 녹아있다.
9788952774767,10,무지개 가족의 기묘한 모험.
9788952774767,10,브라이언 K. 본의 작품은 실망시키지 않는다. Y: 더라스트맨과 엑스 마키나도 매우 좋았고 이번 사가는 말그대로 명불허전이다. 세련되고 재미있고 막나가며(?) 환상적이다. 끊기지 않고 계속 발매되었으면 좋겠다. 그리고 난 계속 사겠지... -_-;; 다 좋은데 책 표지에 추천평만 안박았으면 좋겠다.
9788952774767,10,"근래에 보았던 어떠한 그래픽노블보다 장엄하다 그리고 거대하다 책을 읽으면서 설레는 감정을 느끼는건 언제라도 좋다 정말 인터넷,게임 말고도흥분되는 감정을 느끼고싶다면 이 책을 구입해라"
9788952774767,10,"1권 핀 그 자리에서 2권까지 정신없이 읽었다. 빨리 3,4권 정발 됐으면 좋겠다."
9788952774767,10,우주배경의 완성도 높은 아침드라마를 보는 기분
9788952774767,8,세련됐다 동시에 고전적이다
9788952774767,6,아직 시작이기 때문에 별 세 개(난 무지 별이 짠 사람이다). 그러나 굉장히 정신없는 와당탕탕 가족 우주 활극의 시작이라는 건 알겠다.
9788952774767,10,책 표지에 무슨 짓을 한거지... 왜 책과 관련없는 박찬욱 허지웅의 글이 앞표지에 있는지 모르겠네요3권부터는 그딴 평 필요없으니 빼주셨으면 합니다
9788952777492,8,그동안 본 작품들과 느낌이 많이 다르네요.
9788952777492,8,기대는 안했는데 꽤 재밌다. 이제까지의 배트맨 런을 읽었으면 아! 하는 장면이 많다. 다만 스나이더의 애매한 기승전결은 또다시 애매하다. 배트맨이 상징하는 것은 무엇일까? 과거의 상처에서 회복되는 것이 가능할까? 카풀로의 세밀한 그림보다는 회상편에 나온 조크의 거친 그림이 더 마음에 든다.
9788952776877,10,선물하고 나도 보고닐 게이먼 그래픽 노블은 너무 마음에 든다
9788959198528,10,"가족간의 갈등, 그리고 화해에 이르는 아슬아슬하고도 복잡미묘한 길. 로드무비 같기도 하고. 마음이 조금 무거워질 수도 있는 이야기를 깔끔하게 연출했다."
9788959198528,10,비슷하면서도 똑같이 다른 우리 가족 이야기.
9788959198528,10,"이번 부산국제영화제에서 꼭 보고 싶었던 영화는 <환절기>였는데, <니나 내나>도 꼭 영화가 됐음 좋겠다. 혼자 상상해보는 배우 캐스팅 :)"
9791186921241,8,예전엔 TV코미디에서 이런 꽁트를 종종 봤는데 이젠 시대가 더 거꾸로 가는 거같다. 우리나라 현실이 만화보다 더 코메디라 (뉴스만 봐도) 그게 씁쓸.
9788998282790,6,내용은 좋은데 번역과 편집이 아쉽다.
9788998282790,8,그림이 무척 마음에 듬. 텍스트가 조금 산만하게 배치되어 있긴 하지만 그래도 설명은 이해하기 쉬운 편이다.
9788998282790,10,트라우마와 신체에 대해서 알기 쉽게 설명하고 있다.  트라우마를 겪었거나 다루고 있는 이들에게 도움이 될 듯.
9788952776433,10,재미잇음. 근데 끝에.아~ 할리퀸. 이런느낌으로 끝남.ㅠㅠㅜㅜ
9788952776433,10,할리퀸 매력적이네요
9788930105194,8,다니구치 지로의 만화를 큰 판형으로 볼 수 있는 드문 기회
9788930105194,10,역시나 믿고 사는 다니구치지로의 작품입니다.
9788930105194,10,작년에 일본 서점에서 552엔  책을 구입했는데 그 번역본  책값이 왜 그리 비싼가 생각했더니 번역본은 A4  크기에 완전 칼라네요!! 우리나라에 번역된 다니구치 지로의 책  중 올칼라는 이 책뿐! 역시 지로의 그림 때문에 루브르  만화는 칼라가 좋아요! 루브르 박물관에 또 다시 가고 싶어집니다.
9788952781895,8,"조커, 배트맨. 뉴52에서의 최종 결착점 이라고 할수있다. 엄청난 스케일의 사건을 몰고 온 조커와 다시 한번 그를 막으려는 배트맨. 그리고 처음과 끝을 잇는 메시지 까지."
9788952781895,10,악당인데도 최고 매력적인 악당의 탄생. 배트맨에서 조커를 빼면 아쉬워집니다.
9788952781895,10,중간중간 있는 일러스트 최고!
9788952781895,10,말그대로 최고네요
9788952781895,10,역시 배트맨역시 조커스토리도 쩔었고 그림도 최고
9788952781895,4,"이번 아크에는 과유불급이라는 부제를 달고 싶다. 조커는 너무나 거대해졌고, 독자는 한시도 쉴 수 없다. 스토리의 강약은 물론 캐릭터의 강약조절도 실패했다는 평가를 내리겠다. 읽는 내내 ｀그래서 대체 이 지긋지긋하고 고통스러운 싸움은 언제 끝나는 건데?｀ 라는 생각만 들 뿐이다."
9788952781895,10,"역대 배트맨시리즈중 최고!  최악 최고의 라이벌전 배트맨 vs 조커, 조커 vs 배트맨"
9788952781895,10,"우와 진짜 역대급 스케일, 최고의 스토리와 그림체! 정발된 배트맨 시리즈중 최고로 재밌게 읽었음  진짜 가족의 죽음에서도 조커는 무서웠지만 이번에 돌아온 조커는 훨씬 악랄하고 섬뜩함 다른 수많은 빌런들조차도 어쨰서 조커만은 피하고두려워하는지 알것 같았던 배트맨시리즈 사상 초대형 이벤트"
9788952781895,10,감히 스콧 스나이더와 카풀로의 New 52 배트맨의 하이라이트이자 클라이막스라고 할수있습니다.  개인적으로 지금까지 정발됬던 그어떤 세미콜론/시공사에서 정발된 배트맨 작품보다도 거대한 스케일과 긴장감 재미를 보장하네요.  어째서 조커가 최고 최악의 악당인지 알수있습니다.
9788952781895,6,출판사는 왜 바뀐거유?
9788952775733,10,스파이더맨이 한가득인 이벤트 너무 좋다
9788952775733,10,스파이더맨을 책으로 볼 수 있어서 정말 좋았다
9788952775740,10,생각보다는 분량이 좀 있네요
9788952775740,10,정말 최고의 만화
9788952775740,10,할리 귀여워요!조커랑 같이다니던 때보다 더 좋아보이네요
9788952775740,10,할리퀸 정말 매력이 넘치네요.
9788952775740,8,사랑스러운 할리퀸
9788952775740,8,발랄해보여서 읽어보고 싶어서요.
9788952775566,10,역시 데드풀 신선하고 재밋고 유쾌하며 웃음이 절로나오는 흥미로운 만화책 이었습니다 재미재미 아주재밋습니다
9788952775566,6,황당하고 잔혹하다. 결말은 마음에 든다.
9788952775566,10,어떤 이야기가 펼쳐질지 두근거리네요
9788952775566,10,"믿고 보는 마블의 신작, 기대됩니다!"
9788952775566,10,마블의 새로운 이야기가 기대됩니다
9788952775566,10,마블 팬으로서 매우 기대됩니다. 벌써부터 가슴이 뛰네요.
9788952775566,10,마블의 이야기는 끝없이 진화할 듯 합니다. 팬들이 식상하지 않게 자꾸만 캐릭터를 만드는 능력이 놀라워요. 데드풀의 광기를 만화로 풀었지만 끔직하군요.
9788952775566,10,데드풀 영화가 나오면서 이번에 출간되니까 다시 한번 데드풀의 스토리에 관심이 가는데 이번 스토리에서도 데드풀에 대한 자세한 스토리가 첨부되어 있어서 좋은 것 같습니다.
9788952775566,10,데드풀이 영화가 나오면서 정발이 되니 기대됩니다.
9788952775566,10,마블 히어로 좋아하는 사람이라면 그냥 지나치기가 어려울 것 같아요
9788952775566,10,"영화를 보고나서 데드풀의 캐릭터가 매우 매력적이라고 생각했는데, 마침 이 책을 보게 되어 매우 반갑네요."
9788952775566,10,데드풀 영화를 보고 나니 더욱 관심이 생기네요.
9788952775566,10,한 명도 평범하지 않은 마블 캐릭터! 그런데 그 중에서도 가장 독특해보이는 안티 히어로 데드풀!! 요즘 인기를 끌 법한 매력적인 캐릭터네요. 관심이 막막 갑니다.
9788952775566,10,영화도 좋지만 이렇게 소장하는것도 너무 좋네요
9788952775566,10,데드풀이 사실 한국에서 그렇게 유명한 마블 캐릭터는 아니었는데 이번 영화를 계기로 저도 물론이고 많은 사람들의 관심을 얻게 되었네요. 사실 데드풀을 영화로만 이해하기에는 아쉽죠. 이렇게 데드풀에 관련된 도서가 출간되어 설레요.현재 헐크 그래픽 노블을 읽고 있는데 다음에는 데드풀로 도전!
9788952775566,10,영화를 보고 검색해봤는데 이런 책이 나온줄 몰랐었네요.영화만큼 독특한 캐릭터의 활약이 기대됩니다.
9788952775566,10,영화로 보고나서 책도 읽어보고싶어져서 사봤는데 잘산거같아요. 가격도 별로 비싸지않고 대신좀 얇은데 딱 짧고굵네요 진짜 데드풀이라서 가능한 스토리ㅋㅋㅋㅋ참신하고 좋았어요 마블캐릭터들이 많이 등장해서 다른히어로책들도 읽어보고싶은 생각이드네요
9788952775566,8,마블 유니버스의 슈퍼 히어로가 차례차례 등장한다니 흥미롭고 재미있을 것 같아요
9788952775566,8,"마블 계보의 히어로들에 대해 쭉 정리해보는 계기가 될것같아서 매우 흥미로운 책이란 생각이 듭니다. 캐릭터의 힘이 무엇보다 크다는걸 느껴요,그리고 서로의 콜라보로 시너지를 발산한다는걸 최근 <데드풀>을 통해 확인했답니다. ^^"
9788952775566,10,데드풀 영화를 보고 나서 원작을 정말 보고 싶어졌는데 이런 꿀템이 나오다니 당장 사서 봐야 할 것 같아요. 영화에서도 데드풀만의 유머가 넘쳤는데 그래픽노블에서는 더 장난 아닐것 같네요. 킬러 본능만 살아있는 데드풀의 모습을 직접 눈에 담고 싶다!! 강추!!!
9788952775566,10,역시 데드풀처럼 대사가 많은 캐릭터는 원서보다 정발로 보는것이 정신건강에 이롭다. 데드풀의 가장 큰 특징이라 할 수 있는 설정을 가장 잘 풀어낸 작품.
9788952775566,10,<데드풀> 영화 보고 왔습니다. 원작과 비교해보고 싶어요. 영화보다 재밌겠죠?
9788952775566,10,데드풀의 위한 데드풀에 의한 데드풀을 위한 만화
9788952775566,10,평소의 장난스럽고 우스꽝스러운 데드풀의 모습을 기대한 거라면   ㄷ ㅏ 메데스~~>_<제목과 같이 킬러의 모습만 남은 데드풀을 볼 수 있기에  모~ 야메롱!! ㅠ_ㅠ
9788952775566,10,데드풀을 정말 재미있게 봤는데 영화를 보고난뒤 이 책을 읽으면 재미가 두배가 될거 같아 기대됩니다
9788952775566,8,영화예고편으로 이렇게 유쾌한 영웅이 있었나 싶었는데~ 참 재미있네요!
9788952775566,10,데드풀 정말 미친듯하네요 ㅋㅋㅋ
9788952775566,10,데드풀 영화도 보고 왔는데 정말 재밌었습니다 만화도 기대되네요
9788952775566,10,데드풀 영화도 보려는 중인데 매우 기대됩니다
9788952775566,10,마블에서 제가 가장 좋아하는 캐릭터라 애착 갖고 보고 있습니다. 재미있어요.
9788952775566,10,마블에서 가장 매력적인 캐릭터! 데드풀 만화의 내용도 너무 기대됩니다.
9788952775566,8,어제 유료시사회를 보고왔습니다. 정말 19금스러운 영화더군요^^ 그래픽노블로는 처음 보는 것이라 기대가 됩니다.
9788952775566,10,똘끼있고 귀엽지만 암살자이고 안티히어로이고 농담을 멈추지 않는 떠버리 재생 능력 갖춘 인문 데드풀. 그는 세상을 향해 무슨 말을 할까 궁금해집니다. 데드풀 당신은 무슨 길을 갈 것인가요?
9788952775566,10,오호~정말 궁금해지는 읽고 싶어지는 책. 이 책을 읽고 영화를 봐야겠네요. 정말 궁금합니다. 소개글자체도 너무 재미있어요~~~~
9788952775566,10,데드풀! 마블 최고의 풍운아! 다른 데드풀의 에피소드보다 이책만큼 데드풀의 이미지를 잘 나타낸 책은 없습니다! 무조건 추천!국내에는 다른 캐릭터들에 비해 인지도가 낮지만 이작품과 영화화를 통해 더욱 널리 알려지고 소개되는 계기가 되었으면 좋겠습니다.
9788952775566,10,"영화 개봉을 기다리고 있었는데, 이 책에서는 데드풀이 어떻게 그려지고 있을지 궁금하고 기대됩니다."
9788952775566,10,이번에 나오는 영화도 예매했습니다!데드풀 정말 기대돼요 ㅎㅎ 정말 웃긴 히어로네요
9788952775566,10,데드풀이라는 캐릭터에게 매우 끌리는군요. 특히 데드풀의 광기가 정점으로 치달을 때 벌어질 상황이라니 정말 재밌을것 같습니다! 매우 기대됩니다!
9788952775566,10,"제게는 아직 낯선 데드풀이라는 캐릭터를 이해하기에 가장 적합한 책이라고 생각합니다. 데드풀이라는 캐릭터가 가진 매력과 재미, 개성을 이 책으로 정말 잘 느낄 수 있을 것 같아요. 무척 재미있을 것 같습니다."
9788952775566,10,데드풀 ㅋㅋㅋ 재밌는캐릭터조 개인적으론 영화보단 책으로 데드풀을 만나는게 더 매력적일거 같습니다.
9788952775566,10,데드풀의 특성을 만끽할 수 있는 작품
9788952775566,10,"아이들에게 선물해준다면 엄청나게 재미있어하겠네요! 흥미도 보장되고 재미도 보장되고 감동까지! 이렇게 풍성한 작품은 아이들에게도, 청소년에게도, 심지어 어른들에게도 유익하겠죠! 필독!"
9788952775566,10,데드풀 와.... 이게 나왔다니 .... 감격입니다 !!
9788952775566,10,광기가 정점을 찍어 치닫게 되는 상황이라 캐릭터의 개성은 확연하게 드러나고 흥미로 이끄는 부분이 많아 조금 충격적인 것들도 있기도 하지만...그래도 그것을 흥미로운 부분들로 상쇄할 수 있을 정도라 읽기에 큰 부담은 없습니다. 다중인격이라는 부분이 큰 흥미로운 부분이었는데
9788952775566,6,우리 아이가 좋아하는 마블코믹스. 데드풀도 나왔다니 꼭 보고 싶어하네요.
9788952775566,4,두번째로 나온 데드풀 만화 치고는 지나치게 어두운 책이 아니었나 싶네요. 아직 한국에 데드풀에 대해서 모르는 사람도 있었을텐데 말이에요. 영화와 콜레보를 할 거였다면 좀 더 발랄한 책이 나왔으면 합니다.
9788952775566,10,데드풀도 진지해지면쎄군요영화에서는?
9791185967745,10,"지식 전집 사주지 마시고, 이런 책 사주세요. 초4 아들 이 책 아빠와 읽으면서 이야기 꽃을 피웁니다^^"
9791185967745,10,다섯살 우리 아들! 경주용차보다 큰 이층버스가 더 빠르다며 커서 이층버스를 살 거랍니다~어떻게 설명을 해줘야할지...
9791185967738,10,"소설 원작의 만화인데, 이야기톤은 고전적인 리얼리즘 느낌입니다. 쓰여진 의의에 큰 가치가 있는 책이에요."
9788998282325,8,정책으로 접근해야하는 상황에 도달한 기후변화 대응의 한 단면. 만화로 보는 기후변화의 거의 모든것과 맥락이 닿아있다.
9791185967677,10,따듯해. 그리고 윈디 사랑해.
9791185967677,10,"누구나 마음 속에 그 시절 ｀아와고 비치｀가 있다.  여름을 지나온 이들에게도, 한창 여름을 보내는 중인 이들에게도."
9788961671842,8,형제 자매가 없는 요즘 아이들에게 신선한 이야기. 동생보다는 언니 입장에서 그린 에피소드.
9791185967158,4,두 작가분의 다른 책들은 괜찮았는데 이건 좀.. 수영장에 몰래 들어가서 옷만 벗고 수영하는 에피는 너무하단 생각; 냇가도 아니고..공공장소에서; 더러웠어요
9791185967158,2,"그저 기대한 바가 있었다는 이유로 불편했다. 나는 다니구치 지로의 작품과는 안 맞는구나, 하고 덮었다"
9791185967158,6,말없음을 그려낼 수 있다는게 만화의 큰 힘. 문학에선 말(=글)이 끊길 수 없으니... 침묵이 곧 사고인 라디오에서 기를 쓰고 대화를 이어가다보니 느끼게 되는 피로와 비슷하달까.
9791185967158,10,잔잔한 느낌으로 다가오는 좋은 책. 드문드문 느닷없는 주인공의 행동에 당황스러울 때도 있지만 작가의 후기를 일으며 고개를 끄덕이게 되었네요.
9791185967158,6,만화로 써낸 서정시. 담백하고 부드럽고 따뜻하다.
9791185967158,10,다니구치 지로의 책은 잔잔하면서도 책을 덮고나면 뭔가 따뜻함이 느껴져서 항상 책상앞에 두게 됩니다. 산책이라는 말처럼 골목골목 같이 다니는 기분이라고 할까요? 예전에 느껴지던 작은 골목길의 감동이 눈앞에 펼쳐져서 잠시라도 힐링이 되더군요
9791185967158,10,이 책을 보고 내가 사는 곳을 산책하게 됐다.예사로 보고 지나가던 곳들이 특별해진다. 이 책의 힘이다
9791185967158,10,중년의 만화가 좋네요
9791185967158,10,요거죠 요거
9791185967158,10,요런 책 좋아요^^작고 소소한 일상 속 행복..
9791185967158,8,다나구치 지로 작가의 책은 믿고 볼 수 있는거 같습니다.
9791185967158,10,잔잔한 일상의 감동을 놀라운 작화로 표현하고 있습니다.
9791185967158,10,때로는 아무 생각없이 걷고 싶어질 때가 있다.
9791185967158,10,작가의 섬세함이 돋보이는 책 대화나 지문 보다는 사실적인 그림으로 우리의 상상력을 자극하는아름다운 책
9791185967158,10,산책하며 읽으면 좋을 책
9791185967158,10,재미있어요! 그림도 좋구요
9791185967158,10,재밌어보여요
9791185967158,8,"기대하고 보진 않았지만, 의외로 재미있네요"
9791185967158,10,다니구치 지로의 명작중 하나입니다.
9791185967158,10,개와 함께하는 산책
9791185967158,8,다니구치 지로의 잔잔한 느낌의 만화...별다른 내용이 없지만 그냥 편하게 지켜보는 느낌이다.
9791185967158,10,다니구치 지로의 작품 중 가장 수작
9791185967158,10,유일하게 읽었다 ㅠ
9791185967158,10,잔잔한 재미
9791185967158,10,소소한 일상이야기가 정말 재밌어요.
9791185967158,10,올해 본 최고의 만화 단행본이였습니다.
9791185967158,10,읽던 책마저 덮고 산책에 나서고 싶어지는....
9791185967158,10,산책은 언제나 즐거워요!
