ISBN13,rating,review
9788997381678,10,"지적 허세와 가르치려드는 자세로 혀에 힘 주지 않는, 물 같이 편안한 그림. 잠 들기 직전 웅얼거리는 말처럼 몽환적인데 마음에 평화를 주는 글. 꾸미지 않아서 더 좋은 책."
9788997381678,10,내겐 21세기 어린왕자.
9788997381678,10,그림을 보다가 문장을 읽다가 갑자기 뭉클 뭉클... 천천히 읽고 보고 또 보다가 책을 가만히 꼬옥 안아보았다. 왜 이러지 ...
9788997381678,10,"삶이 힘들 때, 두려움이 몰려올 때, 친구가 그리울 때마다 다시 꺼내서 읽고 싶은 책이에요."
9788997381678,10,우연히 브런치에서 리뷰를 읽고는 그 자리에서 바로 구매해 버렸다.내용과 그림이 묘하게 어울리는 책이다.나를 되돌아보게 하는 내용...교재로 써도 될법한 문장들이 꽤나 있다.
9788997381678,10,지금 bbc에 오디오북 올라왔어요...20일정도 남았네요. https://www.bbc.co.uk/sounds/play/m000r630
9788997381678,10,머리말에서 안녕으로 시작하는 작가의 인사말이 정답고 이 책을 통해 독자 자신을 더욱 사랑하기를 바라는 작가의 마음이 고스란히 느껴집니다.이 그림책은 우연히 펼쳐지는 그 곳의 뜻을 음미하게 되고 언제나 따뜻하게 안아주는 듯 다가오는 글귀들이 힐링하게 합니다.
9788997381678,10,이 책을 읽고 눈물을 흘렸다면 이루지 못한잊혀진 꿈이 있었기 때문 아닐까
9788997381678,10,사놓고 벌써 여러 번 펼쳐 본 책.동화지만 울림이 깊은 책.그림도 글씨도 너무나 아름다운 책.글씨 보고 싶어서 영어 원서를 사볼까 생각중
9788997381678,10,"선물 받은 책이었는데, 잔잔한 감동이 넘칩니다. 제가 사랑하는 모든 사람들에게 주고 싶은 책이에요!:-)"
9788997381678,10,그림이 궁금해서 샀는데 생각한 것보다 훨씬 좋아요. 내용도 그림도 좋아서 친구에게 선물하려고  재주문했어요.
9788997381678,10,다양한 재미와 에피소드가 잘 저술되어 있는 것 같습니다.
9788997381678,10,마음이 따뜻해지는 책이네요. 조카들에게도 사주고싶어요
9788997381678,10,"책을 읽다 보면 선물해 주고 싶은 사람이 저절로 떠오를 때가 있는데,  이 책은 올해 대학을 졸업해 사회 생활에 첫 발을 내딛는 조카에게 주고 싶네요. 삶이 힘들어질 때 차분히 자신을 돌아보면서 음미하다보면 삶이 우리에게 주는 메시지를 찾을 수 있을 거 같아요."
9788997381678,8,여운이 있는 책이네요두더지의 케이크에 대해서 좀 더 생각해보아야겠습니다.하하.
9791165794279,10,한정판 이슈라니 !!!이건 못참지 ㅋㅋ는 네이버 쇼핑라이브때 구매해버렸네요.스펙태큘러 스파이더맨 충분히 재밌으니 도전해보시는걸 추천드립니다
9791165794057,10,시크릿 식스가 정발될 줄이야 ㅎㅎ
9788955824933,8,아...실존이란...
9788955824933,10,볼 때마다 새로운 생각을 하게 만드는 명작
9788955824933,10,"무조건 소장. 합본판이여서 좋고, 내용이야 말할 것도 없고."
9788955824933,10,이게 책입니다. 인생과 역사.편집에서의 아쉬운 부분이 중간중간 있지만 책 내용 퀄리티는 아주 좋습니다. 오랜만에 즐겁게 봤어요.
9788955824933,10,최고의 그래픽노블
9788955824933,8,"며칠밤을, 뒤척이며 생각이 나는 책."
9788955824933,10,홀로코스트를 바라보는 후세대의 객관적 시선.  절망의 공명은 계속 이어져야 한다.
9788955824933,10,어정쩡하게 만나서 가슴에 손을 얹고 헤어지는 책
9788955824933,8,작품 자체는 문제가 없으나 제본 방식이 마음에 들지 않아 별 하나 뺍니다. 이 책을 예전에 구매했다가 2권만 잃어버려 할 수 없이 합본으로 구매하는데 종이 질이 너무 맨질거려 책 넘김이 좋지않네요.
9788955824933,10,그야말로 대단한 명작이다. 반드시 집에 소장해 놓고 아이들에게도 읽혀야할 책이다. 이 책을 읽다보니 영화 <피아니스트>가 생각났다. 다시 한번 봐야겠다.
9788955824933,10,"아우슈비츠란 최악의 비극을 겪은 아버지, 그 아버지로 부터 비극을 겪는 아들. 아들쥐 부부가 흑인을 차에 태웠을 때 아버지 쥐의 혐오는 많은것을 생각하게 한다."
9788955824933,10,첫째아이가 (6학년) 예전에 읽고는 또 보고 싶어했는데 집 근처 도서관에서는 찾을 수가 없어서 구매한다. 2차 세계대전 이야기를 나누다가 이 책얘기가 나와서 말 나온김에 바로 구매.소장해도 충분히 좋을 책이라고 생각한다.
9788955824933,10,세월이 지날수록 아우슈비츠가 잊혀지는거같다
9788955824933,8,주인공이 아버지와의 갈등을 해결하고자 하는 것이 주된 흐름이라는 점에서 전쟁 또는 이와 유사한 비극이 후세대에 남기는 것들에 대해 생각해 봅니다..
9788955824933,8,아우슈비츠에 대해 더 자세히 알고 싶어진다.
9788955824933,10,쥐를 통해 대면한 역사의 진솔한 진실
9788955824933,10,"생생하게 전해듣는 나치의 잔혹한 만행들. 특히나 제 3의 시선으로 너무 넓게 보지 않고 한 가족의, 한 남자의 이야기로 그려지니 더욱 와닿았다."
9788955824933,10,읽고 싶었던 책인데 합본호로 나와서 한번에 다 읽을수있게 되었네요 내용이 좀 심오하고 그림이 어두워서 초등아이가 읽기엔 아직 무리일꺼 같고 제가 읽고 소장했다가 나중에 크면 읽을수 있게 하려합니다.
9788955824933,10,영원히 기억되어야 할 만화 그리고 소장 필수
9788955824933,8,어떤 면에선 하나의 원전격인 만화다. 영향을 받은 그래픽 노블이 허다한 걸 보면 대단하다. 유대인 대학살의 내용과 아버지와 아들의 에피소드 기쁨과 슬픔이 섞여 참 묘한 감동을 받았다.
9788955824933,10,언제봐도 정말 좋은 만화이다
9788955824933,10,자신이 힘든 처지에 있어서 뭔가를 포기해야겠다고 생각하시는 분들은 꼭 읽어보시길 바랍니다
9788955824933,10,홀로코스트에 대해 한 번이라도 들어 본 사람이라면관심을 가지고 읽어봐도 좋을 만한 만화다.만화책답게 가볍게 시작하지만 묵직한 책이다.
9788955824933,10,합본이네~눈 도장 팍팍~
9788955824933,10,합본이 나왔었네. 명작.
9788955824933,10,잔혹한 그 시대
9788955824933,10,양장이라 소장가치가 올라갔음.
9788955824933,10,경험해보지 못한 고통에 괴로워하게 만들어주는 책
9788955824933,10,풍자란 이렇게 하는것이다를 보여준 작품
9788955824933,10,달리 말이 필요없는 걸작
9788955824933,10,유태인 학살을 다룬 전설적인 명저
9788955824933,8,만화의 수준높은 솜씨
9788955824933,10,만화의 정점!
9788955824933,10,크라코프에 가보고 싶어졌다.
9788955824933,10,역사에 남을 걸작
9788955824933,10,귀여운 그림과 만화로 밖에 표현할 수 없는 재치있는 연출과 유머. 그래서 더 슬프다. 글로도 영상으로도 표현할 수 없는 무게가 담겨 있다.
9788955824933,10,처음 가본 국립중앙도서관에서 완독한 첫 책.카툰으로 보는 아우슈비츠에서 살아남은 아버지의 이야기마지막 장을 넘길 때의 그 먹먹함과 허한 감정은 아직도 가슴깊이 남아있다.
9788955824933,10,사람이 살아가는 한 언제나 분쟁은 계속될 것이다. 하지만 과거를 돌이켜보고 학습하며 더 나은 미래를 추구하는 것 역시 인간이기에 할 수 있는 것이다.
9788955824933,10,우리가 잊어서는 안 될 역사.아유슈비츠를 기억하라!
9788955824933,10,만화라서 쉽게 읽을 수 있지만내용은...
9788955824933,10,꼭 챙겨볼 만한 명작 그래픽노블이다. 합본판이 나온 지금이 바로 그 시점이 아닐까.
9788961707992,10,읽고나니 가슴이 먹먹해요...
9791160802672,8,"반성과 회복, 치유의 시간을 주는 가족의 힘"
9791160802672,10,꼭 읽어야할 책인생책아들 딸에게도 물려줘야하는 책
9791160802672,8,"어느 곳, 어느 때나 완성되는 삶의 이야기"
9791160802672,10,저자도 대단하지만 저자의 부모와 할머니가 참 멋있었다. 세상의 모든 딸들에게 저런 부모님과 할머니가 있다면 여자들의 삶이 한결 수월하고 편안할 것 같다.
9791160802672,8,"2만8천원이 크게 느껴진다면 안 사도 됩니다. 분명 새로운 경험이자 내용이긴 하지만, 조금 두서없기도 해서 완성도가 높다기보단 새로운 날것입니다."
9791160802672,10,‘내 어머니 이야기‘와 함께 읽으면 좋다
9791160802672,10,도서전시전에서 재출간 된 걸 알고 감격해서 다시 구입했습니다.
9791160802672,10,좋은 집안에서 태어나서 유학보내놓으면 착하고 바르게만 살아야하나? 역사적 사실과 맞물려 한 사람의 인간으로서 격는 고뇌와 트라우마에는 관심이 없나? 좋은 집안에서 태어났어도 방황할수있고 아파할수있고 갈등있을 수 있고 나쁠수있다. 우리는 모두 나은 사람이 되어가는 과정에 있다.
9791160802672,10,새 만화책 버전이 더 예쁘긴 했지만 완전판이라니 구매욕구를 자극합니다. 페르세폴리스는 어느 여성에게나 인생 책이죠
9791160802672,2,"인성이 나쁜 작가의 족보 자랑 & 환경 탓, 남 탓 얘기. 자기 성찰은 없다.좋은 집안에서 태어나 전쟁 피해 유학 보내놨더니 마약에 찌들어 살다 귀국하고 적응을 못해 다시 프랑스로 이민.오스트리아 유학 & 정키 시절, 하숙집 여주인에 대한 험담은 실소를 금할 수 없다."
9791160802672,10,정말 좋은 책이에요. 저는 예전 출판사 책으로 읽었는데 절판된지도 모르고 있었네요. 종교를 떠나 이 세상 모든 여성들이 꼭 읽어봤으면 하는 책이에요. 최고의 그래픽노블이라고 생각해요!
9791160802672,10,이책이 재출간되었군요! 정말 심금을 울리는 좋은만화입니다. 이란이 악의축이라고 생각하시는분들에게 경종을 울릴수있는 좋은책입니다! 참 짠하기도하고. 과거의 이란과 현재의 이란을 바라보며 이책을 보면 좋을것같습니다. 만화도 완벽합니다!
9791165794040,10,할린/댐드와 같은 크기의 판형 !거대하지만 그만큼 값어치가 있는 그래픽 노블.제프 르미어의 스토리텔링은 역시 믿고볼만하다
9791155352489,10,"누구보다도 용맹하고 뛰어난 기사, 돈키호테. 그럼 ‘안녕히!‘"
9791155352489,10,세상을 향해 미친놈이길 자처했던 돈키호테. 그의 행보에 응원 한 가득 보내고 싶다.
9791155352489,10,너무 재밌게 읽은 새롭게 알게된 돈키호테 이야기.
9791155352489,10,"그림체가 너무 마음에 듭니다, 책으로 읽는것보다 그래픽노블로 보니깐 더 재미있게 다가오고 눈도 행복하네요"
9791155352489,10,그림으로 만나볼 수 있는 돈키호테약 290페이지로 부담 없이 즐길 수 있는 돈키호테책 크기도 보통 책들보다 커서 그림과 글씨 둘 다 잡은 책이라 할 수 있다.다만 캐릭터들을 미리 알고 읽으며 더 재미있게 몰입할 수 있을 것이다.모험을 떠나보세요
9791155352489,10,아직 돈키호테를 읽어보지 않은 사람이라면 그래픽 노블로 접해보는 것도 좋을 듯합니다
9791155352489,10,420년 전의 책이네요. 지금 읽어도 전혀 촌스럽지 않다는게 역시 고전입니다. 그래픽 노블인 덕분에 완독할 수 있었어요. 감사합니다.
9791155352489,10,"캐릭터의 특징을 잘 살려낸 그래픽 노블인것같고 그림체도 흥미로워서 더 재밌게 몰입해서 읽게 되었어요.만약 미메시스의 그래픽 노블이 아니였다면, 평생 돈키호테를 읽지 못했을것같아요.그 동안 돈키호테를 읽기가 부담스러우셨다면,그래픽 노블, <돈키호테>를 읽어보시기를 추천드립니다.​"
9791155352489,10,"별나고 다른 사람들은 정신이상자라 여기지만자기만의 세계 속에 있을 때 가장 행복했을 돈키호테와그런 돈키호테를 믿어주는 친구 같은 동반자 산초.​그래픽노블 돈키호테를 읽은 뒤 어린 시절, 처음 돈키호테를 읽었을 때 나의 생각이 궁금해진다."
9788949135113,10,이 책을 선물하면서 굿즈랑 함께~재밌어 보여서 보관함에 담아 둠.
9788949135113,6,원작을 봐야겠다 원작을!!!!! 만화는 나중에 아이에게 보여줘야겠다!!!
9788949135113,10,아무 선입견없이 읽기 시작했다가 밤에 잠도 못자고 계속 읽었네요. 중간에 내려놓을수가 없었습니다.  빨리 파랑채집가 읽고 메신저. 태양의 아들 읽으려구요.
9788949135113,10,소설읽고 한 번 더봤는데 섬세하고 내 상상과 맞아서 좋았다. 애니메이션을 보는 듯한 느낌
9788949135113,10,깨달음과 함께 조너스가 바라보는 시각적 모습의 변화가 그림에 잘 나타나 원작을 먼저 봤음에도 따분하지않고 흥미진진했다.
9788949135113,10,원작 소설을 훼손하지 않고 감각적으로 그래픽 노블로 살려내었다. 다 읽고 난 후 마지막에 소설가와 만화가의 인터뷰까지 퍼펙트하다.
9788949135113,10,원작자 로이스 로리  인터뷰와 러셀 인터뷰 너무 좋음 꼭 봐야 함
9791158888343,10,"중간중간 번역투가 느껴진게 조금 아쉽긴 하지만작품 자체만으로도 좋네요. 2권, 3권 기대하겠습니다"
9791158888343,10,기대합니다
9791158888343,8,3권으로 완결짓는다는 것이 우선 다행입니다. 원작 분량이 방대하니까 분량을 어떻게 했을까가 의문이었는데 3권 분량이면 그렇게 늦지 않게 완간되겠네요.
9791163141532,10,중대재해기업 처벌법을 다시 한번 생각해 보는데 이 만화 만한 설득력을 본 적이 없다. 두 작가의 연출도 더욱 짜임새가 높아졌다. 대단한 작가들이다.
9791163141532,10,"이제 막 활동가로서 삶을 시작한 분들, 오랜시간 활동을 이어오는 분들의 이야기를 구체적으로 접할 수 있어서 좋았습니다. ˝필요한 곳에 내가 있기를. 내 할 일을 해내기를˝. 읽는 내내 이야기와 그림에 몰입했어요. 산업재해 피해자들의 삶과 연대의 이야기가 또 다른 책으로 나오길 기대하게 됩니다"
9791163141532,10,"책을 읽고 가장 기억에 남는 말은 ‘영향이 미치는 곳에 책임도 함께 따른다는 것입니다‘이 책은 산업재해를 입어도 책임을 서로에게 미룰 수 있는 구조 안에서는 생명과 안전이 보장되지 않는 노동현실 보여주고, 변화의 필요성을 이야기합니다. 이 사회 구성원으로 책임감을 느끼게 하는 책입니다"
9791163141532,10,"‘아픈 사람이 더 생각한다. 자기 몸으로 겪은 그 고통을 누구도 겪지 않기를.‘(149쪽) 그 사람의 현실로 들어가 그 심경과 용기어린 투쟁을 마주 보여주는, 소중한 이야기입니다. 기사 몇줄, 숫자 몇개로 요약될 수 없는 사람의 마음과 연대를 그려주셔서 누구나의 문제인 ‘직업병‘을 돌아보게 됩니다."
9791196830120,10,"난, 왠만한 그래픽노블은 다 좋아한다. 특히 깔끔한 구성으로 굵직한 인물의 삶과 작품을 담아낸 노블이라면 더욱더 그러하다."
9791196830120,6,조지 오웰 입문서라거나 덕심으로 소장할 도서정도다. 조지 오웰을 더 잘 이해하기엔 <영국식 살인의 쇠퇴>를 슬쩍 추천해본다.
9791196830120,10,펀딩에 참여해 받아본 책. 그림도 예쁘고 참 좋네요.아직 안읽어본 오웰의 다른 책들도 다 읽어보고싶게 만드는 힘이 있습니다.
9791196830120,10,코로나19로 인한 혼란의 시기에 넘쳐나는 거짓 뉴스와 가짜 정치인들의 놀음으로부터 자유로운 시민이 되기 위해 우리는  조지 오웰의 삶과 소설에 녹아있는 정치적 성찰과 비판 정신을 계승해야할 것이다.
9791196830120,8,"오웰의 삶과 일대기를 만화로 잘 표현했다. 암울한 시대에 건강한 한 시민으로, 삶의 체험를 통해 사상의 모순을 끄집어내는 비판적 정신~ 권력과 사회의 모순을 풍자적으로 이끌어낸 오웰의 삶속에서 많은것을 배운다."
9791196830120,10,조지 오웰에 대해 개괄적으로 알 수 있는 좋은 책이에요. 그림도 멋지고 판형도 커서 아주 맘에 듭니다 ^^
9791196830120,10,"이름만 들어도 벅차오르는 작가 조지 오웰. 펀딩할 수 있다는 것 자체가 기뻤고 책을 받아보니 기대 이상이라 표지만 바라봐도 행복하다. 1984, 동물농장 등등 그가 쓴 작품들 옆에 꽂아두고 평생 소중히 간직할 생각을 하니 또 한 번 설렘."
9791196830120,8,"조지 오웰의 여러 작품을 좋아하는 독자로서, 오웰을 좀 더 이해하는 데 도움이 되는 책이었다. 깊이있게 찾아보기에는 게을렀던 나에게 좀 더 찾아보겠다는 의욕을 불러일으켜 주었다."
9791196830120,6,그래픽전기 라는 특성상 보는 재미는 있습니다 하지만 그에 비해 내용면에서는 역시나 부실하다고밖에는 ....너무나 간략한 내용에 조금 더 자세히 조지오웰이라는 인물에 대해 알고 싶었던 나로서는 아쉬움이 많습니다.
9791196830120,8,"누구보다 치열한 삶을 살았던 사람의 인생을, 오히려 담담하게 그려내어 울림이 있다. 그가 자서전을 썼다면 이런 투로 쓰지 않았을까 싶을 정도. 종교든 이데올로기든 무비판적으로 빠져버리면 정작 중요한 정신적인 자유를 잃음을 경고한, 진정한 ˝지식인˝의 삶이 주는 感動, 마음의 움직임이 있다."
9791196830120,10,천재작가 조지 오웰의 전기를 그린 작품을 소장하게 되어 무척 기쁩니다. 책 사이즈와 디자인에 또 한번 놀라고 읽기가 아까워 천천히 읽어요.
9791196830120,10,소설과 작가의 삶이 같은 곳을 공유할 거라는 생각은 대개 착각이었는데 오웰은 소설 속으로 들어갔다.
9791196830120,8,"무엇보다 조지오웰의 얼굴을 사실 그대로 표현한 그림체가 좋았어요. 마치 한 작가에 대한 전기 영화를 보는 기분이었습니다.그리고 중간 중간 그의 에세이나 소설의 일부를 발췌해 그림과 함께 실어주었는데,마치 영화의 교차편집 같았어요.오래 기다린 보람이 있었습니다^^"
9791196830120,10,"펀딩 의의가 시의적절하며, 책의 제조품질 또한 우수합니다."
9791196830120,10,"책 제본 상태는 썩 마음에 들지 않지만, 펀딩을 후회하지는 않을 양질의 내용이네요. 조지오웰에 대한 이해를 하고 그의 작품을 다시 읽으니 새로운 이면들을 찾아볼 기회가 되었습니다."
9791196830120,10,"조지 오웰의 팬들에게 의미 있는 굿즈입니다. 이미 알고 있는 이야기지만, 밑바닥으로 걸어 들어가는 장면에서 한 번, 국토방위군으로 지원하는 장면에서 또 한 번 울컥했네요. 야만의 한 가운데에 있는 그가 참 부러우면서도 감동적이었어요. 우리는 신어가 지배한 세상에 살고 있으니까요."
9791196830120,10,조지오웰를 좋아한다면 소장용으로라도 사야할 책인데 책을 받아보면 내용과 모양도 훌륭하다그림이 사실적이라 따라 그리고 싶을정도..조지오웰의 전기와 작품 배경을 한눈에 알수 있어 그를 알고 싶다면 분명 좋아할만하다이 책을 읽고 그가 어릴때 읽었던 웰스의 타임머신을 읽어보려 한다.
9791196830120,8,"조지 오웰, 그의 삶 자체가 혁명적이고 그의 삶이 프롤레타리아라는 생각을 하게 된다."
9791196830120,8,"대단한 책, 조지 오웰의 팬이라면 누구나 시도할만 합니다"
9791196830120,8,1984를 다시 읽던 중에 배송이 되어 잘보았네요우선 생각보다 책이 커서 깜짝 놀랐네요양은 그리 먾지 않아서 금새 다 읽었네요조지 오웰이 본명이 아닐줄은 몰랐었네요스페인내전 참전..빗발치는 총알을 뚫고 이 잡겠다고 물에 뛰어드는 장면은 놀라울 정도네요
9791196830120,8,"생각만큼 대단한 명작은 아니었고, 설명이 너무 빈약한 면이 있습니다. 조지오웰의 생애를 간단하게 정리하여 보기에는 좋네요."
9791196830120,8,"좌지 오웰은, 자고로 김대중 선생님께서 찰진 발음으로 좌지 오웰~ 이라고 해주시는 그 발음만이진실합니다. 그의 legacy를 이어 받아 금번 새로나오는 좌지오웰의 책은 살 수 밖에 없었습니다. 물론 출간 지연 등의 사소한 이슈도 있었지만. 기다림의 미학이랄까, 책이 더 잘 빠진 상태로 배송되었다"
9791196830120,10,"한 컷 한 컷, 멈춰 바라보게 한다. 한참 들여다보고 있으면 마침내 컷 안의 거리와 풍경, 인물이 살아나 움직인다. 그렇게 컷을 따라가다보면 오웰이 옆에서 함께 걷고 있다는 착각에 빠지게 된다."
9791196830120,10,좋은책.북펀딩 감사합니다
9791196830120,8,좋았던점1 조지오웰의 인간적인 면이 잘 표현되어있다2 조지오웰의 책에서 땨온내용은 타이프서체로 구분되어서 좋았다 아쉬운점: 일대기를 다루었지만 포인트만 있어서인지 짧게느껴짐. 책장을 덮었을때 뭔가 책이 완성되다말았다는 느낌ㅜㅜ결론: 조지오웰을 모르는 사람이 보기에 적합함!!
9791196830120,8,오웰의 전기를 읽는다는 기대를 접고 본다면.... 페이지마다 공 들인 그림들을 감상하는 재미가 있다. 책의 만듦새도 훌륭하다.
9791196830120,10,북펀드 처음 했는데 너무 의미가 깊고 소장가치  100% 입니다 잘받고  너무 기쁩니다
9791196830120,10,조지오웰에 대해 깊이 알 수 있는 책을 펀딩해서 받아보니 뜻깊습니다.
9791196830120,10,재미있습니다.
9791196830120,10,펀딩하고 잊고 있었는데 이름까지 새겨진 책 받아보니 행복했습니다.선착순에 들어서도 뿌듯했구요. 펀딩으로도 책을 만든것 같은 대리만족이 됩니다. 감사히 잘 받았습니다. 딸들도 고급지다며...책의 겉모습만이 미래를 앞선 조지오웰의 책이라 더욱 고급집니다.
9791196830120,8,펀딩을 하는  건 처음이었지만 제가 좋아하는 조지오웰  전기에 할수있어서 영광이었습니다 아이들을 가르치고 있는데 동물농장하면서 함께보여주고이런문화도 있다는걸 보여주었습니다 ^^ 다만 오웰에 대해 잘 알아야 이해할 수있는부분들이 있었습니다 (어색한부분) 그래서 보충설명을 해주어야했
9791196830120,8,그림도 재밌고 내용도 괜찮은데 가독성이 조금 떨어져요
9791196830120,8,멀게만 느껴졌던 시간과 공간을 넘어 붉디붉은 사상의 에릭아서 블래어를 제주의 4.3을 다룬 동백꽃지다-를 만나 듯 35년 전 암울한 시대 80년대로 흘러 들어갔다.체제 속으로 들어가 체득하고자하는 마음이 강렬하게 와 닿아한 번 더 “나 때는 말야!” 하고픈 오지랖 꼰대짓이 스멀거렸다.너네 !
9791196830120,8,오랜만에 더 비싸도 괜찮다고 생각한 훌륭한 만듦새와 꽉찬 내용의 도서. 조지 오웰을 가장 생생하게 만나는 방법.
9791196830120,10,펀딩은 처음으로 했는데 책을 받아보고 아주 만족했습니다 책의 크기며 질감 내용까지 뭐 하나 빠뜨릴게 없습니다 이런 하드커버 시리즈로 계속 만들어진다면 펀딩책들 다 수집해보고 싶은 욕심도 생기네요
9791196830120,8,펀딩한 책을 받았을 때 느낀점1. 아니 책이 왜 이렇게 크지?    ㅡ 가지고 다니기 불편함.2. 책의 겉모습이 너무 고급스럽잖아.    ㅡ 불필요한 점에 돈이 많이 들어간 점.3. 어? 이런 ㅠ. 만화네.    ㅡ 보다보니 재밌네. ㅋ
9791196830120,10,기대했던것보다 훨씬 좋았습니다.
9791196830120,10,"오웰의 글을 먼저 접한 뒤 그의 생애를 전반으로 볼수 있다. 그래픽 노블을 통해 다시 만나도 좋다. 책의 품질이 좋고, 펀딩하고 오래 기다린 보람이 있었다 :)"
9791196830120,10,그림도 좋고 칼라 페이지 흑백 페이지 구성도 좋아요
9791196830120,10,알라딘 북펀딩을 통해 조지오웰의 일생을 재미있게 볼 수 있어 좋았다.  책도 깔끔하고 구성도 좋아 만족스럽다.
9791196830120,10,드디어 도착한 조지오웰의 만화책 그림체도 너무 좋고 무엇보다 평소의 잘 몰랐던 조지오웰의 모습의 내용이  좋았습니다. 계속 소장하며 심심할때마다 읽어도 좋을것 같습니다^^
