ISBN13,rating,review
9788952764416,10,"NEW52가 시작되기 이전,무겁고 진중한 분위기의 모던에이지 DC코믹스 작품을 읽고 싶으신 분들이라면 적극 추천. 실버에이지 시절 연재분을 즐기시는 분들께는 강력 비추천."
9788952764416,10,히어로 가족이 죽었을 때 이득을 보는 건 누구인가.
9788952764416,10,지금까지 구입한 100권에 가까운 그래픽 노블 중 최고에 가까운 책. 히어로 물로만 따진다면 단연 최고.
9788952764416,10,와...마지막장 덮고나서 그냥 말이 안나오네요. 범인의 정체는 정말 충격이었습니다. 생각도 못한 반전이었네요... 히어로의 가족들이 공격 당하면 누가 이득인가? 이 질문에 대한 답이 정말로 씁쓸하군요.
9788952764416,10,국내 정발된 DC 코믹스 중 가장 멋진 책. 충격적 내용과 인상적인 장면들로 가득하다.
9788952764416,10,충격적인 내용이지요. 미성년자에겐 비추. 하지만 역시 수준은 높네요.
9788952764416,10,정발 내주셔서 감사합니다 ㅜㅜㅜㅜ
9788990641519,10,"깊은 여운과 감동

어느 책보다 애잔하고 아련한 감정을 전해주는 책

그래픽 노블의 격을 높여주는 훌륭한 책"
9788990641519,8,"만화로 쓴 연대기. 사람이야말로 모든 이야기의 처음이자 끝이 아니던가. 우리에게 익숙해진 세련된 그림체와 몰입도 높은 전개는 아니지만, 사람의 이야기라는 본질에 충실하다는 점에서 그 가치를 부인할 수 없다."
9788990641519,8,대단한 이야기 한편이 만화로!
9788990641519,6,"평이 무척 좋아서 챙겨봤는데, 아쉽게도 별 감흥이 없다. 인물들의 얽히고설킨 이야기가 흥미를 끌긴 했지만 그 방식이나 그림체가 다소 어둡고 난해하게 느껴진다."
9788990641519,8,캐나다 시골의 고독과 외로움이 태평양 건너에도 전해져온다. 가슴 먹먹한 가족 이야기들. 문학적 성취가 있는 그래픽노블
9788990641519,8,"가슴 울컥하는 순간, 이미지의 힘!"
9788990641519,10,"<지미 코리건>보다, <아스테리오스 폴립>보다 더 감동이었음. 읽고나면 찬바람이 가슴 속을 슝~하고 지나간 느낌."
9788990641519,8,이 두꺼운 만화책은 잡자마자 금방 읽을 수 있지만 여운은 아직도 남아 있다. 강추!
9788990641519,10,세 편의 독립적인 만화가 이렇게 잘 엮이다니! 감동.
9788990641519,10,15일까지 기다려주마
9788990641519,10,내용이 어떨지 잘 모르겠는데 일단 구입하고 봅니다
9791165793975,10,“누구인가?”이슈 너무 좋네요 ㅋㅋ꿀잼입니다 다음 편도 기대돼요
9791165793975,10,너무 꿀잼이고 증정품도 잘받았습니다
9791165793784,10,"아니 종이질 실화?? 왜이렇게 종이 퀄리티가 좋음요 ㅋㅋㅋㅋ 원서생각하면 정발본 가격이 싼편인데, 종이질은 더 좋은 기이한 현상..감사합니다 압도적 감사이대로만 상승세 타즈아  데스메탈... 주륵.."
9791197269806,10,"2000년대, 모두가 다른 유년기를 보냈지만 공감할만한 이야기가 담겨있습니다. 그 시절을 디테일하게 그려냈고 소재 하나하나 신경 써서 묘사하려고 노력한 게 엿보입니다. 많은 생각이 들게 해주는 좋은 책입니다. 추천합니다."
9788950989590,6,여전한 하드 보일드. 무표정한 인물들이 전해주는 무표정할 수 없는 이야기.
9791186843642,10,우리 나라 사람이라면 직시하고 알아야 할 역사를 다룬 작품.
9791186843642,10,한국현대사에서 가장 참혹한 이승만 정권의 학살 사건. 반드시 진실을 밝혀야 한다.
9791165793067,10,"데드풀의 마블유니버스죽이기의 후속편으로, 오랜 기다림끝에 출간된 만화입니다. 96페이지로 짧게 보일지는 모르겠지만, 적절한 대사분량으로 인해 짧게 느껴지진 않네요. 저는 개인적으로 마블유니버스 죽이기보다는 재밌었습니다. 강추합니다. 11월 정발작중 필구작!"
9791165792565,4,스파이더 버스 만큼 재밌진않네요;;;
9791165792565,10,스파이더버스를 읽었다면 더 좋은!
9791165792602,10,스파이더맨 입문으로도 좋은 책!
9791165791506,10,"황량한 풍경과 특이한 변주. 아주 좋네요. 배트맨 코믹스를 많이 보지 않았어도 볼 만 하고, 많이 봤다면 또 다른 재미가 있습니다."
9791165791506,10,뉴52 배트맨 10권에서 조금은 이어지는 부분이 있어뉴52 전권 읽고 있어도 좋고라스트 나이트 온 어스 단권으로 읽어도 좋다고 합니다.기대됩니다!!
9791165791582,10,미국 만화에 진입장벽을 느끼는 분들에게도쉽게 소개할 수 있는 만화.다중인격의 주인공이 페이지를 끝장까지 휩쓸어버린다. 다음권을 기다리게되는 꿀잼작
9788930106849,10,우와 진짜 7권이 나오다니... 진짜 열화당 감사합니다. 앞으로도 잘 부탁드립니다.
9788930106849,10,열화당 이 책을 포기 않고 계속 내주셔서 감사해요! 평생 걸쳐라도 다 만나고 싶은 소중한 책!! 이제서야 7권 나온걸 보고 급히 주문합니다.
9788930106849,10,추천마법사에 이 책이 올라온걸 보고 제 눈을 의심! 몇년만인가요!!
9788930106849,10,6권나온지 6년만에 7권이 나왔어요!! 대박 열화당 화이팅! 내 생애에 다 볼 수 있을까!!
9791165791209,10,"ㅗㅜㅑ... 역시 닐게이먼이다...1602 보다, 닐게이먼 이라는 글자가 더 크게 작성된 이유가 있었다..그림체는 솔직히 호불호 갈리긴하는데, 내용 자체가 흡입력 있고 신선해서그런거 신경안쓰임. 근데 진짜 재밌음"
9791165791292,10,이 재밌는걸 정발 해주다니..더 많이 팔려서 여러 이야기들이 나와줬으면 하는 바람입니다
9791165790837,10,"통통튀는 아이들을 볼 수 있어서 재밌었어요.가격이 쎄지만, 막상 받아보니 가격 이상의 품질이라 만족합니다"
9788998508272,6,중간에 잠깐씩 나오는 배경의 그림과 묘사가 좋았다.
9788998508272,6,"1950년 12월 24일 전쟁 183일차, 흥남지구 완전 철수.총 14시간 이틀에 걸쳐 14,000여 명의 피란민을 태우고 부산으로 떠나는 피난길.단 하나의 기적이 하늘에 닿아 가족이 둥그러니 모여앉아 밥을 먹을수 있기를 기"
9788998508272,10,"한국전쟁이 빚어낸 어두운 기억과 외상 그 너머를 응시하게 만드는 작품. 그리움, 애닯음, 고향집, 하얀 꽃송이, 떡국, 햇살, 냄새, 사탕, 나무, 청보리밭, 망챙이, 크리스마스, 생명의 우물..이런 이미지들과 말들이 이 책에 충만히 담겨있다. 섬세하고 집요하고 깊은 작가정신이 느껴지는 수작!"
9788998508272,10,일러스트와 애니메이션 배경을 그린다는 작가의 이력이 빛난다. 지면 위에 펼쳐지는 수묵화의 붓 놀림에서 전쟁이 생생하게 그려지고 있었다. 윗 세대들의 어린 시절을 아래 세대에 다정하게 전해주는 친절한 화자는 우리도 잘 몰랐던 흥남철수를 좀 더 내밀하고 감성적으로 접근할 수 있게 해준다.
9788998508272,10,사람은 본능적으로 괴로운 일은 망각하도록 설계되어 있는걸까요? 동시간대 다른 땅에서 혹은 불과 몇년전에 이 땅에서 벌어진 전쟁이란 것에 완전히 “남의 일”이라고 생각하는 듯 합니다. 가슴 졸이며 읽었어요.
9788998508272,10,전쟁의 상흔은 직접 겪은 세대는 물론 그 후손들의 무의식 속에도 여전히 침전되어 있는 것은 아닐까
9791186921821,10,복합적 디자인이 등장하게 되는 사회 맥락들을 만화형식으로 재미있고 쉽게 설명해주고 있어 어렵지 않게 읽을 수 있다. https://blog.naver.com/dnotecom/222010629890
9791186921821,10,손에 잡자마자 단숨에 읽히는 책입니다. 디자인에 대해 알기쉽게 설명되어있어요
9791186921821,10,"이봉섭 작가님 그림 너무 멋져요. 디자인의 개념과 역사에 대한 흐름을 알게되어 유익했고, 특히 디자인이 앞으로 나아가야할 방향, 마지막 부분 읽고 많은 생각을 하게 되었습니다. 그리고 틈틈이 깨알 같은 재미가 있어서 많은 사람들에게사랑받는 책이 될 것같아요.좋은 책 만들어주셔서감사합니다"
9791186921821,10,현대 사회에 필수 요소중 한가지인 디자인에 대해아빠와 아이가 같이 책을 읽으며 아빠의 입장에서아이에게 친절히 설명해 줄 수 있는 좋은 책입니다.아이가 미술과 디자인에 관심이 있는 아빠라면필독서입니다.
9791196874902,8,남자가 없는 평화로운 세상과 시대의 피식피식 소소한 유머들.
9791196874902,10,"탁월한 풍자로, 남자를 모르는 다음세대들에게 설명할때 마다 부끄러운 경우가 많다."
9791196874902,10,"짧은 듯하면서도 그렇지 않은 이야기들을 보며 푹 빠져들었습니다. 이런 세상에서 살고 싶다는 생각을 했어요. 작가의 재치와 유머, 상상력이 반짝이는 멋진 세상입니다."
9791196874902,10,짧은 대사와 심플한 그림체에서도 전해지는 의미가 상당합니다. 여성만 남은 현실이 마냥 유토피아로 그려지지는 않는 현실과 일상을 담은 책이지만 누군가 우먼월드에 갈거냐고 물으면 전 가겠습니다..
9791196874902,10,우먼파워시대. 기대가 큰 책입니다.후기 꼭 남기겠습니다..^^
9791196874902,10,전혀 가능할 법한 이야기는 아니지만... 이런 세상을 상상하는 발상 자체가 놀라울 따름이다. 대단한 이야기가 아니라 너무나도 소소해서 나도 모르게 우먼월드를 상상하고 있다. 같은 맥락에서 남자세상도 궁금해진다.
9791196874902,10,"‘유전적 이상으로 남성이 모두 소멸된 지구, 문명의 잿더미에서 여성들만의 세계가 새로이 생겨났다.‘남자 없는 세계와 여자 없는 세계... 둘 다 약간은 불행한 세계임에는 틀림없는데, 과연...^^"
9791195762484,10,도널드 우즈 위니캇 이라는 대상관계 이론 개척자가 궁금했다. 처음엔 그가 뭔말을 하는 건지 이해가 안갔다. 엄마와 아이들의 관계에서 참 위로가 됐다. 왜? 제목을 이렇게 선정적으로 했을까??
9791195762484,8,<펀 홈>에서 어쩌면 가장 안타깝고 연민이 가던 인물이 앨리슨의 엄마였다. 게이인 남편과 살며 세 아이를  키우며 살아간다는 건 어떤 심정일까. 여기서 그 이야기가 펼쳐진다. 엄마에 대한 이야기이면서도 앨리슨 그녀의 자아찾기. 딸과 엄마 그 애증의 관계에 대한 치열한 정신분석학적 접근.
9791195762484,10,"<펀 홈>에서 궁금했던 그녀, 엄마의 이야기. 앨리슨 벡델처럼 이렇게 자기 내면의 바닥까지 박박 긁어내어 분석한 작가가 또 있을까. 자기 분석의 깊은 고통을 감내하며 작품으로 엮어낸 용기와 끈기, 그리고 멋진 작품에 감탄과 박수를 보낸다."
9791195762484,10,"너무 멋있는 책이다. 작가에게 축하를 보내고 싶다. 그 어려운 걸 해내다니. 책에 다 담기지 못한 눈물과 고통의 시간을 감히 짐작해본다ㅠ 덕분에 나도 밀쳐두었던 문제가 다시 떠올라 맘이 좀 그러네, 난 아직 대상을 파괴하지 못한듯하다..."
9788954658621,8,생각보다 어린 아이들도 잘 볼 수 있는 책입니다. 다만 글자가 작아서 아쉽게 느껴지지만 그래도 그림을 잘 살릴 수 있다는 점에서 위안을 삼아 봅니다.
9788954658621,10,최고다! 몹시 흥분될 정도로 환상적이다.
9788954658621,10,소설은 예전부터 봐야지하다가 못 보고. 결국 그래픽에 반해 읽게 되었네요. 이름과 용어 따라가기가 힘들었지만^^모든 장면장면이 판타스틱합니다.
9788954658621,10,한편의 애니메이션 영화를 본 듯한 기분
9788954658614,8,책이라는 매개체를통한 다양한 상상력을 이끌어내는것에 놀라움이 있는책이다
9788954658614,8,그림이 애니메이션을 보는 듯하다. 내용은 판타지라 그런지 잘 몰입이 안되었음.
9788954658614,8,다 좋은데.. 한권으로 내지..
9788954658614,10,와..그림 장난아니다
9788954658614,10,저는 원작소설 안 읽어보고 순전히 표지에 끌려서 구입했는데 장면 장면 작화 퀄리티가 멋져요. 색채 자체가 신비스럽고 빈티지풍이라 고서적 읽는 느낌에 모험하는 느낌도 드네요ㅎㅎ
9788954658614,10,새 판본이 나왔네요~예전에 구입해서 가지고 있는데 정말 재밌는 책입니다. 꼭 읽어보세요!
9788954658614,10,"도서관에서 빌려 읽은 소설인데, 이렇게 다시 나오다니~!!! 이렇게 다시 만날 운명이었던 거지... 글로만 읽고 열심히 상상하면서 기이하면서 흥미진진한 세계로 떠났던 기억이 난다. 머릿속으로만 하던 상상을 일렇게 구현된 그림으로 볼 수 있다니 정말 멋진 세상이다."
9788954658614,10,진짜진짜 재밌게 읽었는데 새로 다시 나온거 보니까 엄청 반갑다ㅠㅠㅠㅠ딴말 필요없고 진짜 재밌음ㅠㅠ책두꺼운데도 그냥 재밌어서 후루룩 읽었음ㅠㅠ
9788952739131,8,위선이 없는 코미디언은 정말로 흥미로운 캐릭터다. 로어솈의 이야기는 다소 아쉽지만 코미디언의 이야기만으로도 훌륭한 왓치맨 프리퀄이다. 영화 오프닝에 등장했던 코미디언의 장면과 책의 내용을 비교해보는것도 하나의 포인트.
9788952738752,6,그림 보는 재미는 있었다. 내용적인 재미는 글쎄...
9788961707404,8,라이카는 동화나 낭만이 아니다. 뒷맛이 씁쓸한 냉정시대의 잔혹한 현실을 보여주는 일화다.
9791196765828,8,미생물과 전쟁이야기를 쉽게 설명해서 좋았다 묘한 전쟁이란단어를 동시에 해서 좋았다
9791196765828,10,"별 6개, 7개도 줄 수 있다. 아주 모범적인 그래픽 노블. 역사와 과학을 담은 스토리텔링을 멋진 그림으로 표현. 이 시리즈, 기대된다."
9788952735782,10,올해는 5권 까지만 출간되는데 많이 팔렸으면 좋겠네요.
9791189519032,10,영화를 보는 것 처럼 몰입이 정말 잘 되는 책이라 생각되네요
9791189519032,10,리버스 에지에 이어서 구매를 해봤는데 이 책 또한 좋네요
9791189519032,8,"하와이도 알로하 티셔츠만 입고 다니는 천국은 아니었다. 똑같은 도시 뒷골목, 방황하는 청춘이 있는 사람사는 곳. 다크한 하와이 청춘물."
9791189519032,10,아주아주아주아주 귿임!! 짱짱짱!! 강추!!!
9791189519032,10,실패할지도 모른다는 두려움을 알면서도 나와 주변을 이야기하고 싶은 건 누구나 가진 마음. 긴 시간 준비한 그의 데뷔작을 오랜 시간이 지나 한국어로 본다.
9791189519032,10,<디센던트>의 만화판/유스편... 만화에서 보기 힘든 영화적 연출이 돋보임. 천천히 읽는 편이 좋다.
9791160801613,10,간결한 핵심에 유머도 가끔. 만화의 미덕이 고스란한 교양과학서.
9791160801613,10,세상 만사 오래된 일들에는 모두 역사라는 게 존재합니다. 과학은 잘 모른다고 해도 과학에 대한 역사는 흥미롭게 읽을 수 있죠. 그런 과학자들의 역사를 깨알같은 대화를 곁들여 재미있고 유익하게 펼쳐준 이 책도 그 트릴로지를 마감했습니다. 끝까지 재미있고 읽기 쉽다는 미덕을 잃지 않았네요.
9791160801606,10,삼위일체(간결+유머+지식)양서. 키득키득하면서 교양인이 될 수(도) 있음.
9791160801606,10,"고대와 중세의 과학자들을 많이 다뤘던 1권에 이어, 시간 순서대로 이번 2권에서는 근대와 현대의 과학자들을 많이 다룹니다. 2권에서 아인슈타인까지 진출했네요. 아마 3권에서는 더더욱 최신 현대 과학자들이 등장하겠죠. 정보전달도 뛰어나지만 대화로 표현되는 작가의 유머감각도 빛을 발합니다."
9788961706704,8,어찌보면 잔혹 동화. 소녀의 연대를 위하여!
9788961706704,6,"결국 폭력과 가스라이팅에서 벗어나는 독립과 해방, 자유의 이야기이지만,시작부터 인어 ‘소녀‘와 ‘아저씨‘가 나와서 끝까지 읽기가 너무 힘들었다.몰입 진짜 너무 안되고 계속 ‘이 아저씨는 이 소녀의 이 모습을 계속 보고있단 말인가‘ 하면서 토할것 같음.아저씨 나오는 줄 알았으면 안샀을것을.."
9788961706704,10,보이지 않는 폭력으로부터 자신을 지키고 진실을 향해 나아가는 인어소녀의 이야기. 몽환적이고 아름다운 그래픽노블.
9788961706704,10,단숨에 빠져들어 읽었다. 데이비드 위즈너의 왕성한  창작 활동에 감탄하고 감사한다.이 책의 그루밍에 분노한다면 어린왕자 속 모럴 해러스먼트를 지적한 <누가 어린왕자를 죽였는가>도 심화편으로 읽어볼만 하겠다. 넵튠은 실체가 드러났지만 장미는 아직도 많은 사람이 왜곡해 보고 있는 것같다.
9791196155643,2,진짜 내 스타일은 아님. 폭력적이고 그림도 마음에 안 든다... 누가 좀 설명해줄 사람 없나;
9791196155643,8,이해할수 없고 가까이 하고 싶지 않은 어느 젊은 연인.
9791196155643,10,"원작과 드라마의 해석이 충돌되지 않고 굉장한 시너지를 느낄 수 있었어요. 그림도 설렁하고 이야기가 휙휙 지나가는듯해도, 주인공들의 감정을 정확하게 짚어주고 있기때문에 드라마로 구현해도 흔들림이 없네요. 원작에서만 볼 수 있는 스토리가 있답니다 http://www.podbbang.com/ch/10025?e=22735"
9791160071474,8,"테트리스를 둘러싼 흥미로운 역사들. 냉전, 비즈니스, 게임, 예술 - 창작자 등 여러 일화들이 넘치고 재밌다."
9788974838423,6,번역이 너무 아쉽습니다....
9788974838423,6,참호에 갇힌 어느 프랑스 병사의 눈으로 바라본 제1 차 세계 대전이라는 이름의 지옥.
9788974838423,10,전선에서 사병으로 싸우며 온갖 비참함에 노출될 수 밖에 없었던 프랑스 선반공이 화자이다. 담담하지만 있는 그대로 전쟁의 모순을 드러내고 있다. 두리뭉실한 만화 그림이 잔인함을 조금 완화한다. 연도 별로 진행되지만 전쟁의 자세한 전황이 나오는 것은 아니다. 뒤에 글로 된 보충 설명이 있다.
9788974838423,10,정말 사실적이어서 좋습니다. 특히 실제 병사들의 참호생활을 볼 수 있어서 좋아요.
9788974837839,8,파리코뮌의 며칠 동안 수천명의 사람들이 죽이고 죽임을 당했다. 파리 사람들이 그런 역사를 갖고 있어서 그래서 그렇구나 하는 끄덕임. 광주 민주 항쟁이 오버랩 된다.
9788974837839,10,"꼴랑 투표 한 번으로 우린 너무 많은 것을 기대하는 건 아닌가.. 혁명의 혁명을 거치며 수도 없는 사람들이 그 자유때문에 무고하게 죽어나간 그 곳 프랑스, 빠리를 생각하면 이 곳 5,18 광주의 영혼들이 떠오르고 그 댓가로 오만하게 살고 있는 오늘은 늘 죄스럽다."
9788974837839,8,반가운 책이다. 파리코뮌을 만화로 읽어보자. 그림도 좋고 홍세화 샘 번역도 좋은 듯.
9788974837839,10,"자유, 평등, 우애의 깃발은 여전히 유효하다는 생각. 전세계적으로 세련된 자본의 승리가 확실시되고 있는 시대이므로 오히려 박해받는 자들은 더 많이 양산되고 있다. 두 개의 날개로 날기보다는 커다랗고 강한 하나의 날개만으로 날고 있는 것 같은 현실이다."
9788952775542,10,정말 재밌어요!!! 마블 나우만 보려 했는데 스파이더맨 시리즈를 다 봐야겠네욯ㅎ
9788952775542,10,원래 이슈로 모으는게좋은거야!!!!
9788952775542,4,"정말 ｀이슈｀ 모은게 짜증나요..ㅠ.ㅠ이제 절대 ｀이슈｀ 안 모을거예요.이슈로 모으는것이 좋다고 하지만, 그렇다고 이슈로 완간하지는 않잖아요.이슈 나오다가 이슈로 다 완간하지 않고, 합본으로 발행해서, 스토리를 완성시키는것이 더 짜증납니다."
9788952775542,10,이슈모은게 후회되는 순간 ㅠㅠ
9788998282752,10,집에 놓아둔 몇 권의 책을 랑딸이 보기 시작하더니 이제 본격적으로 공부!를 하는군요. 덕분에 저도 남자가 아니라 사람이 되려나 봅니다. ^^;;
9788998282752,8,씁쓸하게도 그림은 내 일상의 부분을 보는 것 같아 새롭지는 않았다. 그림보다도 책의 뒷부분에 실린 전략과 글들이 마음을 울린다. 악어 앞에서도 우리는 두려움을 보이지 않으며 존재하고 연대할 것.
9788998282752,10,만화로 쉽게 표현되어있어서 좋았고 읽기 쉬운 페미니즘 입문서입니다. 나라에 상관없이 여성들은 성희롱과 성폭력에 노출되어있다는 것을 쉽게 알 수 있습니다.
9788998282752,10,오빠는 이 책을 보고는 이렇게 말했다. 해외는 저런 범죄가 많지만 한국에는 저런 범죄가 없다고. 여성의 범죄를 왜 남자가 평가하는 가?
9788998282752,8,상당히 적나라해서 성폭력이 뭔지 정확하게 알고 자주 피해자 입장에 처하는 사람이라면 스트레스나 트리거요소가 될 수 있다. 이런 것도 성폭력인가?하는 생각이 드는 사람에게는 추천. 성폭력이 뭔지 전혀 모르는 사람에게도 추천하고 싶지만 그들은 페미니즘을 외면하지..
9788998282752,8,우연히 매장에 들렀다가 발견한 책인데 괜찮은 책을 고른 것 같아 기분이 좋다.
9788998282752,10,성폭력에 대해 무관심했던 사람들까지 성폭력이 어떤 것인지 실감할 수 있게 한다. 성폭력에 대처하는 방법들까지 구체적으로 제시했다. 이 모든 것은 악어를 다시 인간으로 돌려놓고 함께 살아가기 위한 것이다.
9788998282752,6,"겪은 이야기, 들은 이야기, 나에게는 그런 이야기이나, 남성들에게는 아니겠지.. 괜히 악어에 감정이입해 일반화니 뭐니 광광대지 말고 사람에게 감정이입해서 보시길 권함."
9788998282752,10,여자들의 성희롱 경험담이 거짓이며 믿지 못하는 남자들의 공감력 향상을 위해 보여주고 싶은 책.. 더불어 악어에 대항하기 위해 어떻게 대응해야하는지 방법을 알려줌
9788998282752,10,더러워ㅜㅜ
9788998282752,8,만일 당신이 남자라면 이 책을 읽어보고 이해를 해보도록 하자. 이렇게까지 그림과 글로 떠먹여주는데 이해하지 못한다는것은 지능의 문제다.
9788998282752,10,한공주를 보고 느낀 징그러움이 이 책에서 고스란히 느껴진다대처법이 자세해서 좋았음
9788998282752,10,본격 혐오 체험하기
9788998282752,8,여성이 아니면 알 수 없는 이야기들. 물론 실제론 악어와 인간은 혼재함.(˝요즘시대에도 여성이 차별받나요?˝라는 ‘팩트주의자‘들은 이 책을 보길)
9788998282752,10,오늘도 득시글한 악어들과 살아가기. 세상의 모든 남자들에게 권하고 싶은데. 책장을 넘기며 고개를 까닥까닥 흔들며 그들은 말하겠자. 너희들은 종종 개인의 극단적 체험과 피해의식을 이렇게 과장한다고.
9788998282752,10,솔직히 여자인 내가 보기에도 아프고 충격적이고 불편하네요. 그래서 더 중요한 책이네요. 여자도 남자도 진심으로 사랑에 도달하기 위해 그래서 행복하게 살기 위해 많이 읽었으면 좋겠어요. 결과적으로 참 좋은 책입니다.
9788998282752,10,제1세계에 어쩐지 깨어있을 것 같은 프랑스에서 벌어지는 성편견 성폭력등을만화로 아주 쉽게 알려줍니다. 페미니즘이 왜 필요함 이라고 묻는 빡대가리 여러분에게 이건 이렇게해서 이렇다고 친절히 설명해줄게 아니라 이 책을 권해주어 가나다라마바사아 부터 알려주는 친절한 사람이 되어봅시다
9788998282752,8,설명이나 이론보다는 사례 모음이어서 의외였다.대처법 등이 있는 뒷부분은 유용
9788998282752,10,여자로 살면서 한 번쯤은 경험해보는 성폭력을 다양한 입장에서 풀어놓았고 읽으면서 내가 잘못한 건 없었구나 라는 사실을 다시 한 번 깨닫게 해주며 위로가 되는 책. 잘 읽었습니다.
9788998282752,6,"남자입장에서 살짝 기분은 나쁠 수 있겠지만외면할 수 없는 현실, 그 현실속에서 하루종일 시달리는 성편견과 폭력에 대해디테일하게 그려냈습니다.남녀가 평화롭게 공존하기 위해서는 먼저 남성들부터 왜곡된 시선을 바로잡아야 하지 않을까요.하지만 나부터도 생각은 그렇지만쉽지 않은 거 같습니다. 통감하네요ㅠ.ㅠ이 책이 신선하게 다가온 이유는여자의 몸이 되어 한평생 살아가는 나를 상상하게 해줬습니다. 좀 야릇야릇하기도 하고,허접한 남성들의 추태시전에 열받을 일이 많이 생길꺼 같습니다.생각해보니 징글징글하네요ㅎ(만화책이라 더욱 더 실감났습니다~)남녀가 화합하고 서로의 부족한 부분을 채워주는날들을 기약해봅니다."
