ISBN13,rating,review
9788972979609,10,"대학입학후 친구에게 선물받은 책이다 어떤 페이지는 1페이지 전체를 외우고 싶을정도로 감동받았고 전율했다 군에서 이병주의 지리산, 이태의 남부군을 읽고 제대후 한국전쟁사를 수강하면서 아리랑을 또 읽었다 감동은 배가되었고 그후로 다큐도 보았다 평생 감동을 주는책3권만 있으면 행복하다고.."
9788972979609,10,"독립운동의 역사를 우린 절반의 절반 정도만 배운 것 같다. 절반은 공산주의계열 독립운동이요, 나머지는 민족주의내에서 언급되지 않는 분들일 것이다. 이책은 그 일부인 공산주의 계열 독립운동가를 소개한다. 그"
9788972979609,10,"사람이 역사다. 김산, 그가 역사다."
9788972979609,10,지금 읽고 있어요 . 책에 비해선 많이 생략된 감이 있긴 하지만 나이불문하고 모두가 읽기에 적합하다고 생각합니다. 작가님 표현력도 너무 좋아요 . 페이지를 넘기면서 가슴이 쿵! 하는 순간들이 많아요
9788972979609,10,오늘 현재 우리들이 존재할 수 있는 이유가 되는 분! 이러한 분을 알 수 있어 가슴 벅찬 하루입니다. 역사의 어두운 곳에 묻혀 후손들이 알지 못하는 독립운동가가 더 이상 없을때까지 이러한 기회가 많았으면 합니다.
9788972979609,10,과거의 위인은 독재에 도움이 되기위해일부러 치켜세운 지워야할 사람도 많지요.바뀐 세상 이제 새로운 진정한 위인들을읽고 배워야하겠지요.. 고맙습니다 김산!!
9788972979609,10,다시 한번더 대한 민국이라는 나라를 어떻게 지켜왔는지 다시금 알게금 해주는 계기가 될것같네요
9788972979609,10,"대학 1학년 때, <아리랑> 독후감을 제출하라는 과제를 받은 적이 있다. 그때만 해도 이 책은 구하기 어려워 서점이란 서점은 다 뒤지고 다녔다. 결국 구입에 실패하고 시립도서실에서 빌려본 이 책은...힘들었다. 번역이 부드럽지 않아서였을 것이다. 박건웅! 그라면 김산의 삶은 되살아날 것이다."
9788972979609,10,20대 시절을 함께 했던 <아리랑>을 이제는 아이들과 함께 나누기 위해 다시 봅니다. 책으로 보았던 가슴떨림도 좋았지만 그래픽 노블로 만날 수 있다니 더욱 설레입니다. 김산같은 독립운동가들덕분에 독립된 국가에서 오늘 하루를 보낼 수 있음에 감사드립니다.
9788972979609,10,"인상깊게 읽었던 책이 다른 방식으로 멋있게 재탄생한 것을 보게 되어 기쁩니다. 기록으로 남지 않지 않은 채 스러져갔을 당대의 수많은 독립운동가, 혁명가 분들을 기리는 느낌이 드는 기록입니다."
9788972979609,10,"혁명이 사라진 시대, 혁명이 조롱거리로 전락한 시대, 고귀한 신념이 낡은 아집으로 취급 받는 시대에도 여전히 그 현재성을 잃어버리지 않는 싱그러운 생명의 약동을 느끼게 하는 김산!"
9788972979609,10,"학생 때 <아리랑>를 읽고 느꼈던 그 여운과 감동을 잊을 수가 없습니다. 불꽃같이 치열했던 김산의 삶, 박건웅 작가님의 그래픽 노블로 다시 만나보고 싶습니다..."
9788972979609,10,“정신이 문득 소스라치면서 또 하나의 새로운 각성에 이르던 순간들을 기억할 것이다”(황현산) 라는 말처럼 스무살 청년이 노란색 책 표지의 님웨일지 아리랑을 읽으며 전율했던 순간들이 떠오릅니다.
9788972979609,8,오래전 대학 신입생시절에 읽었던 아리랑을이제 다시 손에 집게 되니 그시절의 추억도같이 소환되는 듯 합니다.
9788972979609,8,위대한 이야기가 그래픽노블로 만들어지는 건 굉장히 가치있는 일입니다. 혁명가 김산을 꼭 만나고 싶습니다.
9788972979609,10,관심있는 책이네요
9788972979609,10,"읽어도 읽어도 부족한 우리나라의 역사, 조선인 독립혁명가의 발자취를 하루빨리 책으로 읽어보고 싶다."
9788972979609,10,보자마자 사고 싶었던 책 나오려면 한참 기다려야하지만 그만큼 기대가 크기 때문에 기쁜 마음으로 기다리겠다
9788952761804,8,책 만듬새는 좋습니다. 다만 코팅표지가 아니라서 먼지나 손기름이 묻기 쉬운 재질입니다. 손에 땀이 많거나 기름기가 많은 분은 책표지에 지문 같은 것이 남은 것이 보일테니 따로 책커버가 있는 편이 좋을 거에요.
9788974830120,8,우리 역사 속에 시대를 앞서간 그녀들의 삶은 계속 발굴되어야 한다.
9788974830120,10,"김 알렉산드라는 왜 오랫동안 이토록 지독하게 잊혀졌는가? 그와 반대에 서서 자신의 출세와 욕망을 위해서는 조국도 민족도 가족도 이웃도 다 배반하고 일제에게 팔아버렸던 자들, 간도특설대 출신들이 이 세상을 장악해버렸기 때문이다. 이 사실을 각성하지 못하면 당신은 현상을 처음부터 잘못 보는것이다"
9788974830120,10,"우수리(스크)의 한인회관에 가면 러시아로 들어가서 활동하였기에 잊혀져야했던 수많은 선덕여왕, 김유신, 장보고 장군이나 세종대왕,  신사임당, 이순신들이 존재한다. 그분들은 단지 독립과 민족을 위해 일평생을 멈추지 않고 싸웠건만, 러시아라는 공산국가의 잔재로 인해 잊혀져야했던 분들이다."
9788974830120,10,볼셰비키 간부이기 이전에 조국의 독립을 열망하는 조선인이었던 그녀는 죽음 앞에서도 당당했다. 우리는 그녀가 마지막 순간에 내디딘 열세 걸음이 있었기에 오늘날의 우리가 있음을 잊지 말아야 한다.
9788974830120,10,조선인이 어떻게 시베리아의 딸이 되고 평등한 세상을 꿈꾸는 혁명가가 되었는 가 궁금해지는 도서다.
9788974830120,10,"꽃같은 자식들을 뒤로하고 우랄을 향해가는 그녀의 발자국에 마음이 짠하다. 볼셰비키 혁명과 노동자 해방을 위해 자신의 삶을 파랗게 불태운 그녀의 이름을 잊을 수 없을 것 같다. 혁명가, 김알렉산드라."
9788974830120,10,아직도 알려지지 않은 독립운동가분들이 많다는 것에 아쉬움이 남습니다. 시대의 아픔을 넘어서기 위한 노력과 무엇을 위해 자신의 삶을 바쳤는지에 대해 알아보고 기억하는 시간이 되었으면 좋겠습니다.
9788974830120,10,"시베리아의 조선인 고명딸이여, 2020년 한국은 보시기에 어떻습니까."
9788974830120,10,"조선에 없던 볼셰비키 혁명가 김알렉산드라, 아마도 낯설고 새로운 이름일테지요. 모두가 평등한 세상을 꿈꿨던 그녀의 삶을 함께 만나봅시다."
9788974830120,10,혁명이라는 꿈을 꾸는 사람의 일생은 늘 목마르고 고단하다. 격동하는 시대의 소용돌이 속에 휩쓸리지 않기 위하여 수십 년이나 먼저 세상의 통념에 정면으로 맞설 줄 알았던 그녀의 삶을 만날 때 헛헛함이 더한다.
9788974830120,10,세상의 바꾸겠다는 불타는 의지가 나의 무기력을 반성케 했다 그녀의 멋진 반항은 나를 움직이게 했다
9788974830120,10,"첫 감상을 할 땐, 투박한 필체가 압박감을 줄지도 모른다. 하지만 자세히 보자, 김금숙 작가가 그린 주인공 알렉산드라의 얼굴은 쟁쟁한 투쟁의 빛 아래 부드러움이 느껴졌다."
9788974830120,10,"작년 시베리아 횡단 열차를 타고 블라디보스톡, 우수리스크, 하바롭스크, 울란우데, 이르쿠츠크 등 한인의 역사와 한이 새겨진 장소를 여행한 경험을 반추하는 책 추천합니다."
9788974830120,8,사회주의 혁명가 김 알렉산드리아의 삶은 식민지에서 태어나 사회주의 운동으로 극우세력에 의해 희생되었다는 점에서 로쟈 룩셈부르크를 연상시킨다.  이 책은 우리에게 잊혀진 조선의 로쟈를 알려준다.
9788974830120,10,볼셰비키가 된 조선 여성
9788974830120,10,"이와 같은 사람, 김알렉산드라와 같은 사람이 있었기에 오늘이 있는 것이다. 1900년대 초반 러시아 이주 한인들의 삶과 혁명기 격동적 상황이 잘 그려져(그래픽 노블)있다."
9788974830120,10,2020년에 어울리는 시대정신으로 격동의 1900년대를 불꽃 같이 살다간 한국인이자 러시아인 여성의 이야기
9788974830120,10,우리가 몰랐거나 우리가 배척했던 진정한 혁명가 이야기추천합니다
9788974830120,10,김알렉산드라 언니의 삶과 투쟁은 이야기 첫페이지만 넘겨도 느낌표 수백개가 화살이 되어 나의 무딘 가슴에 팍팍 박히는구나!!
9788974830120,10,그 격동의 시대으 인물들 중 어찌 남성들만 있었겠습니까! 유관순 열사 이외에도 수많은 여성의 이야기가 있었을겁니다. 이 책의 김알렉산드라 또한 그 한명이죠.
9788974830120,10,좋아요 자주보고싶어요
9788974830120,10,소심하고 용기가 부족한 나에게 주인공 알렉산드라는 자신의 인생을 남에게 의지하지 않고 당당하게 앞으로 앞으로 스스로 헤쳐 나아가는 장면들이 뭉클했고 큰 힘이 되었다.
9788974830120,8,김알렉산드라... 책을 읽으면서 여성이전에 한 인간으로 먼저 다가왔다. 자기에게 주어진 시대에 정면으로 맞선 지식인. 마음이 뜨거운 사람. 사람을 사랑하고 조국을 사랑한 정열적인 사람. 당신이 있어 이땅에 노동자로 여성으로 살아가는 모든 사람이 용기를 낼 수 있다고 생각합니다. 감사합니다.
9788974830120,10,존경스럽다. 백년 전에 살다간 우리의 자랑스러운 어머니. 그 시대의 험난한 세상에서 보다 나은 세상을 물려주고자 했던 분. 새롭게 알게 되서 기쁘다
9788974830120,10,"이 나라가 역사책에서 이름을 지우고 싶었을 요건을 두루 갖추었기에 이제서야 그분의 이야기를 듣게되었네요. 놀랍고 비통하고 감격스럽고, 많은 감정을 느꼈습니다. 더 많이 더 널리 읽히고 기억되길 바랍니다."
9788974830120,8,여러가지 이유로 잘 알려지지않은 독립운동가에 대한이야기를 만화로 쉽게 접하게 되어 좋았다
9788974830120,10,"알려지지 않은 여성들이 더, 더 많이 세상 밖으로 나왔으면 하는 마음으로 펀딩에 참여했고 앞으로도 계속 참여할 것이다. 시리즈로 몇 권 더 출간되길 바란다."
9788974830120,8,김알렉산드라 선생의 불꽃같은 인생 고맙게 잘 보았습니다. 너무 함축적이라 아쉬운 마음에 언젠가 긴 이야기로도 만나보고 싶네요.
9788974830120,10,세상에 알려지지 않았다고 하여 존재하지 않았던 것은 아니다. 그런데 우리는 그동안 그녀를 알지 못했다는 이유로 그녀의 생애를 들여다 볼 기회를 갖지 못했다. 지금이라도 알 수 있어 참 다행이다.
9788974830120,10,올해는 임시정부 수립 101주년입니다. 역사를 바로잡아  독립운동한것마냥 거짓훈장받은 매국노는 처단하고 잊혀진 독립운동가를 찾아 기억합시다.
9788974830120,8,"김알렉산드라, 그녀의 어떤 것에도 곁눈질하지 않는 단단함과 뚜렷한 목표에 삶을 헌신하였던 의지에 매료되었다. 쉽게 잠들지 못하고 나의 부끄러운 시간들을 반추하며 밤을 지새웠다."
9788974830120,10,만화로 구성되어 있어서 부담없이 읽기 좋아요
9788974830120,10,아직까지 많은 사람들에게 생소한 여성 독립운동가인 김알렉산드라님을 재조명하여 그분의 숭고한 뜻과 넋을 기릴 수 있는 기회를 준 고마운 책이라고 생각합니다
9788974830120,10,"혁명의 딸,로만 치부하기엔 그의 젊음과 변화에 뜨거운 열정이 오히려 돋보인다. 김금숙의 카툰도 고전스럽고 원작을 살렸다"
9788974830120,10,"조선의 여성 혁명가에게 스포트라이트를 줄 수 있는 시대가 찾아와 감격스러우면서 씁쓸하기도 하고 하는 복잡한 감정이 작품에 대한 감상을 앞섭니다. 사회주의자로 어떤 삶을 살아가야 하는지, 판화와 같은 인상적인 그림체로 한 권 가득 펼쳐낸 김알렉산드라의 삶이 오래 뇌리에 남을 것 같아요"
9788974830120,10,"한번도 생각해 보지  않았던  부분에 대해서 읽고 생각을 할 수 있는 좋은 기회가 되었고,  제가 읽고 있으니 ,초5학년 된 제 딸도 궁금 한지 읽었습니다. 아직은 어려워서  무슨 내용인지는 이해를 잘 못 하겠다고 , 다음에  또 읽어보고 싶다고 하네요.  다른분들도 읽어 보시면  좋을거 같습니다."
9788974830120,10,빠른 배송으로 잘 받았습니다.
9788974830120,10,"그동안 우리가 관심두지 않았던 역사를 알게 되어서 정말 기뻤다. 한반도에서 벌어진 일이 아니라고 해서 우리의 역사가 아닌 것은 아니다. 한 명의 영웅의 이야기가 아니라 우리 중 한 명의 이야기이며, 우리 모두가 그렇게 될 필요도 없지만 우리 모두가 그 한 명처럼 될 수 있어야만 한다."
9788974830120,10,우리가 알지 못했던 중요한 인물에 대한 발견과 깊은 배움
9788974830120,8,개인적으로 그림체가 김알렉산드라의 극적인 삶과 어울린다고 생각했습니다. 아무래도 일러스트 형식이다보니 빠르게 읽힙니다. 하루만에 다 봤어요.
9788974830120,10,"재작년 가을 아무르강변을 찾았다. 김알렉산드라가 처형된 곳이라는데 흔적을 찾아볼 수 없어 씁쓸했다. 공산주의자란 이유로 우리에겐 잊혀진 이름이지만 언젠가 완전히 복권될 날이 오리라 생각한다. 이 책은 그 날까지의 교두보 같은 책이랄까. 참 고마운 책이다,"
9788974830120,10,시베리아는 그냥 먼 동토라고만 여겼고 별 관계없는 지역이라고만 생각했는데 우린 너무 몰랐구나.거기도 여기 반도땅의 역사와 다르지 않은 뜨거운 피와 눈물이 흐른 곳이라는것을 이제서야 알게되다니.
9788974830120,10,알라딘 펀딩을 첨 해봤어요. 책이 출판되는데 내가 보탬이 되었다는 즐거움도 있고 예약된 책이 딱 맞게 배송되는 것도 좋네요. 김알렉산드라라는 인물을 처음 알았어요. 이렇게 시대를 앞서 보고 시대의 문제를 개선하려고 노력하고 별처럼 살다간 멋진 여성이 있었다니 정말 감동적으로 읽었습니다
9788974830120,10,"시베리아의 딸을 내 딸에게 읽어주고 싶다. 아니, 모든 사람이 읽었으면 좋겠다. 지금 누리고 있는 이 시간을 고마워 할 사람이 필요하다면 그녀도 그 중 한명일 것이다."
9788974830120,10,시대를 앞서 나아 살아간 여성의 이야기를 생동감있는 그래픽노블로 재창조해낸 수작.
9788974830120,10,몰랐던 한 독립운동가의 이름을 알게된 좋은 시간이었습니다 금발 다 읽고 주위사람들에게 읽어보라고  권하는 중입니다 조금은 생소한 러시아의 독립운동가를 알게되어 다행이라거 생각합니다
9788974830120,10,매서운 칼바람이 불어오는 듯하다. 얼마나 많은 이름 없는 자들이 있었을까? 김금숙 작가의 뚝심있는 작품을 또 보고싶다.
9788974830120,10,실존 인물의 이야기라는 게 새삼 가슴을 울립니다. 많이 읽혔으면 좋겠습니다.
9788974830120,10,이 책을 통해 김알렉산드리아라는 인물을 처음 알게 되었습니다. 한 인간의 생애를 보면서 나의 삶을 반성해보고 부족한 점을 배웁니다.
9788974830120,8,"내심 자식들 곁에 있지 왜 우랄로 떠나갈까.. 부모에 빙의되어 보다가, 더 좋은세상을 만들어 줄테니 조금만 늦게 자라라는 말에 울컥해 버렸다."
9788974830120,10,"왠지 모르게 가슴이 뛰었다. 책 제목과 그림에서 느껴지는 서늘함이 심장을 할퀴는 느낌이었다. ‘시베리아의 딸, 김알렉산드라‘. 건국훈장 애국장에 추서된 실존 인물임에도 낯선 여성독립운동가였던 그.  차별받지 않는 세상을 꿈꾼 여성혁명가의 말, ˝잊지 마세요. 오늘의 분노를...˝"
9788974830120,10,"김알렉산드라이 이름을 아는 사람이 얼마나 될까,,,김구는 알아도....이주민이자 한국인으로 최초의 여성 볼셰비키.노동자를 위해 일생을 바친,,,이념과 사상을 떠나서인간애로 볼셰비키 혁명을 주도한 여인,,펀딩 참여했더니이름까지 똬악!인쇄되어 책이 왔네요,감동입니다"
9788974830120,10,인간의 신념은 어디서 오는가. 숭고한 결단을 실행할 그 용기는 과연 무엇일까. 김알렉산드라는 말한다. 내 동료 내 가족 모두 평등한 세상을 살아야 할 존재들이다. 차별받고 억압당한 주변인들에 대한 연민. 그것이 그녀의 이념이자 사상이 된다. 평등주의! 그녀가 꿈꾼 세상...
9788974830120,10,나는 어땠을까 곱씹어보게 된다
9788974830120,10,이 번 펀딩을 통해 그 동안 몰랐던 김알렉산드라를 알게된 1인 입니다. 평소그래픽노블에 관심 있었는데. 그녀를 그래픽노블로 표현하여 더 생생하게 다가왔습니다. 앞으로 다양한 그래픽노블이 출간되길 바라고 알라딘 펀딩 계속 응원할게요!
9788974830120,10,해방이후 남북으로 나눠진 뒤로 사회주의 계열 독립운동에 관한 부분이 등한시 된 것이 사실인데 김알렉산드리아를 제대로 알릴 수 있는 좋은 작품이라 생각된다.
9788974830120,10,"너무나도 오래 만나지 못했던 분, 이제사 반갑게 만나게 되어 한없이 기쁩니다 ! 출간을 환영합니다 , 주위 분들에게 권하니 호평이 좋습니다"
9788974830120,10,다시 사회주의를 꿈꾸며....
9788974830120,10,책을 받아보았습니다. 생각보다 멋지게 나왔어요. 함께 보내주신 노트와 마스킹 테이프도 훌륭합니다. 좋은 책이 널리 많은 사람에게 읽혔으면 좋겠어요!
9788974830120,10,과감하면서도 담담한 붓터치로 그려진 혁명가 김알렉산드라의 생애를 보면서 한편으로는 가슴이 뛰고 한편으로는 두려움을 느꼈다. 단지 옛날 이야기라고만 할 수 없는 현실 때문이고 그녀의 용기와 기백에 못 미치는 나의 소시민성 때문이다. 그럼에도 그녀를 기억하는 것이 우리의 의무다.
9788974830120,10,"어린시절 러시아로 이주 후 철도 건설 현장을 전전하며 열악한 조.중 노동자들의 현실을 보고 일생동안 노동자의 권리를 위해, 평등한 사회를 만들기 위해 힘쓴 운동가"
9788974830120,8,"이런 분들이 있었기에 세상은 점점 더 살기 좋아진다. 내가 그 시대 살았더라면, 난 이런 삶을 살지 못했을 것 같다."
9788974830120,8,"영화 <암살> 등을 통해 대중에게 김원봉이 대중에게 더 알려졌던 것처럼, 하바롭스크에서 조차 잊혀진 최초의 조선인 볼셰비키 혁명가 김알렉산드라에 대해 새롭게 알게 되는 계기가 되리라 생각합니다.^^"
9788974830120,10,박시백 화백님의 역사만화 35년을 보고 처음 알게된 독립운동가.. 이 책을 통해 더 자세히 알고싶다.
9788974830120,8,언제나 여러분을 기억하겠습니다.
9788974830120,10,끝까지 당당했던 혁명가의 모습이 인상적이었다. 재판정의 풍경은 많은 생각을 하게 만들었다.
9788974830120,8,가슴아픈 여운으로 남는 한 여인 불굴의 의지를 보았다.우린 누구를 존경할 것인가?김알렉산드리아
9788974830120,10,생사의 갈림길에서 조국을 떠날 수밖에 없었던 민중과 역사를 만든 사람. 사랑과 혁명에 눈돌리지 않고 힘겨운 전진을 마다하지 않은 당신.
9788974830120,10,"작년 여름, 김알렉산드라 선생과 동지들의 인류애를 배우고자 떠났던 시베리아 기행이 책을 읽는 내내 생생하게 기억되었습니다. 김 알렉산드라 선생이 목숨을 걸고 실천하고자 했던 ‘모두가 평등한 세상‘을 위해 배우고 노력하겠습니다."
9788974830120,10,아직도 알려지지 않은 독립운동가분들이 많은데 이런 의미있는 책에 북펀딩을 참여하게 되어 좋았습니다.
9788974830120,8,"역사가 민주정으로 넘어가던 시기, 너무나 가난했고 나라마저 식민지가 되어 자신의 기본적 존엄마저 지킬 수 없어서 왕정 체제하에서 다시는 자신의 아이들이 사는 세상 만큼은 평등한 사회로 바꾸고 싶다는 신념을 실현하기 위해 애쓴 우리 모두의 엄마이자 여성 운동가를 우린 기억해야 한다."
9788974830120,10,상상보다 더 아름다웠던 책.굵직하고 분방한 선들이 김알렉산드라의 삶을 강인하게 그렸다. 노동자로서 페미니스트로서 자신이 옳다고 생각한 그 길로 올곧게 걸어가는 그녀의 모습은 너무도 찬란했다.
9788974830120,10,입체적으로 한 혁명가의 삶을 그려냈다. 그간 만화나 영화 등의 미디어에서 여성 혁명가들은 이성관계가 복잡한 팜파탈 내지는 다사다난한 인생노정으로 혁명가로 화한 복수귀 쯤으로 묘사되었다. 그러나 이 작품은 해당 인물을 탄탄한 사상적 기반을 토대로 활동한 지식인으로 조명하고 있다.
9788974830120,8,모 방송사에서 ‘표트르 김’을 소개했는데 그의 딸이 낯선 시베리아에서 이와같은 활동을 했다는게 감동스러웠다. 어렵지 않게 읽을 수 있다는게 매우 큰 장점인듯 싶다.
9788974830120,10,분노가 넘치는 시대에 살다보니 진짜 분노가 무엇인지 잊고 있었다. 우리는 김알렉산드라의 분노에 부끄러워져야 한다.
9788974830120,10,책 속에는 김용균처럼 희생된 중국인 노동자 '장가'가 등장하고 김알렉산드라에게서 전태일의 아우라가 느껴진다. 이제 한국 노동운동사는 김알렉산드라부터 쓰여져야 한다.
9788974830120,10,"지금까지 주목받지 못했던 러시아, 중앙아시아의 독립 운동가분들에 대해 알 수 있는 기회."
9788974830120,10,첫펀딩. 탁월한 선택이었다. 코로나로 몸은 묶였지만 정신은 드넓은 시베리아를 누볐다.
9788974830120,10,"박시백 화백의 35년에서 처음 김일렉산드라의 존재를 접하고 그 삶이 궁금했던 차에 북펀드 소식을 접하고 고민없이 참여했는데, 33년의 삶이 100년 처럼 묵직하게 다가온다."
9788974830120,2,"김금숙 작가의 이전 책들을 좋아하고 ,펀딩에도 참여했지만. 정작 책을 읽어보니 실망스럽다. 김금숙작가답지 않은 수준이다."
9788974830120,10,북펀딩에 처음 참여하게 되었는데 알지못했던 여성독립운동가에 관한 책에 참여하게 되어 더욱 의미가 있는 듯합니다. 책 또한 많이 기대하고 있습니다.
9788974830120,10,기대됩니다
9788974830120,10,불꽃처럼 살다간 김알렉산드라의 삶을재조명한 그래픽노블 출간에 박수를 보냅니다.
9788974830120,10,아직 알려지지 않은 수많은 독립운동가들이 있습니다. 경외하는 마음으로 더더욱 관심 가지고 싶어요.
9788974830120,10,내게 김알렉산드리아 라는 이름은 낯설다. 그의 이름을 이제서야 부르는 이유는 그의 존재를 다시 느끼고 현재 우리 사회를 고찰해보기 위해서일 것이다.
9788974830120,10,"기대하고 있습니다. 잘 알지 못하는 지역에서 노동 인권과 독립운동을 위해 힘쓴 분이 어떻게 살아왔는지, 그래픽노블로 볼 수 있게 되어 고마울 따름입니다."
9788974830120,10,문체와 그림체가 서로 알맞은 것 같아요거칠고 황량한 마음과 거칠고 황량한 산
9788974830120,8,두고 두고 잊지 못할 첫 펀딩~^^
9788974830120,10,제 인생 첫 북펀딩이라그런지 더 기다려지고 애착이 갑니다.빨리 읽고 싶어요!!
9788974830120,10,《지슬》과 《준이오빠》를 통해 김금숙 작가를 알게 되었습니다. 작가님의 시선을 마음깊이 공감하고 응원합니다. 펀딩 소식 보자마자 믿고 신청했습니다. 좋은 작품 기다립니다~~~
9788974830120,10,모 방송사의 **펀딩을 보며 독립운동가에 대해서 다시한번  깊이있게 생각하게 된 1인입니다.  미처 존재를 알지 못하고 있었던 여성독립운동가를 새로이 알게 되고 가치있는 펀딩에 동참하는거 같아 감회가 새롭네요. 출간되는 책을 직접 만나보는 순간을 기대하며 기쁜 맘으로 기다리겠습니다.
9788974830120,10,감사합니다
9788974830120,10,"기억해야될 여성독립운동가.이제야 읽는건 부끄럽지만, 함께하는제가 자랑스럽습니다.김금숙 작가의 그래픽노블로이니 더더욱 기쁘고 기다려집니다."
9788974830120,10,나라를 위해 뜨거운 삶을 살았던 김알렉산드라!그래픽노블로 형상화된 모습이 무척 기다려집니다.
