ISBN13,rating,review
9791160858563,10,재밌는데 한권으로 끝나서 여운이 많이 남네요
9791127849634,10,보는내내 행복했네요. 원작보다 훨씬 재밌게 봄
9791127849634,10,"우타하만을 위한, 우타하 팬들을 위한 작품이 대단원의 막을 내렸습니다. 역대급 팬서비스인 작품이자 사람에 따라서는 본편을 능가하는 작품이기도 할 겁니다. 게다가 생각보다 진지하게 작품 창작에 따른 크리에이터들의 고뇌와 현실적인 어려움도 생생히 묘사해서 수준있는 작품이 됐던 것 같습니다"
9791127849634,10,진짜 했네 했어가 실현됐다
9791127849627,10,"대학에 들어가고, 애니메이션도 성공적으로 시작되고...다음 권이 마지막이라 그런지 슬슬 이야기가 정리되는 느낌이 강한 9권이었습니다. 이제 마무리 해야될 건 하나뿐이죠. 우타하 팬들이 바라마지 않던 꿈의 실현이 다음 권에서 결실을 맺을 것 같습니다."
9788966072941,10,"곰돌이푸나 빨강머리앤보다, 보노보노가 짱!"
9788966072941,10,산으로강으로바다로동시대를 살아가는 청년의 멘토˝보노보노 깔깔이 선배개똥철학이 마음에 와닫는 순간깔깔이 보노보노 선배마음 따뜻한 한줄
9788966072941,8,보노보노의 말에서 진심 위로 받았다.심각한 세상에 기댈 어깨를 내어준 보노보노..땡큐다!!
9791163891987,10,이모티콘이 너무 예뻐서 찾아 들어와 책 소식 보고 갑니다!! 보노보노를 뛰어넘는 귀여움이 대박!!
9791163891987,10,"‘타누키와 키츠네‘ 아주아주 귀여운 캐릭터들입니다. 보고나면 마음에 여유가 생기고, 아기자기한 캐릭터에 빠져들 수 있어요~~~~."
9791155641798,10,표지는 페퍼민트 패티.(패티가 아닙니다!) 1950년에 시작한 연재가 벌써 80년대에 가까워지고 있습니다. 그 긴 세월동안 주옥같은 연재를 이어오면서 동시에 새로운 캐릭터들도 부지런히 탄생시키는 거 보면 레전드는 레전드인 것 같습니다. 이제 11권 남은 정발이 무사히 완료될 수 있기를!
9791155641798,10,한분이 꾸준히 번역해 주셔서 더 믿음이 감
9791155641798,10,완소템!
9791155641798,10,신간 나오기만을 항상 기다리고있습니다~!^^*
9791131989869,10,소설로 처음에 만났었습니다. 만화로 보니 느낌이 확 다르네요! 모두 귀엽고 만족합니다!
9791131989869,10,정발이라니 생각도못했는데! 특전 일러도 예쁘네옴
9788960520721,10,제발 4권좀!!!
9788960520721,2,출판사가 일을 안해서 다음권이 안나옴
9788960520721,10,이거 4권이랑 하쿠메이 7권 기다립니다...
9788960520721,10,제발 4권도 좀 ㅠㅠ
9788960520721,8,오랫동안 기다린끝에 발매된 3권입니다.화려한 외모지만 마음착하고 순진한 여주인공의 매력이 정말 넘치는 작품입니다.애니도 정말 재미있게 보았는데 2기는 안나오려는지 아쉽네요.가격이 좀 비싼듯 싶지만 종이질이 정말 좋고 칼라 페이지로 만들어져 있습니다.개인적인 강추작입니다.애이도 필견!
9788960520721,10,정말정말 기다렸습니다! 정발 해주신 분들과 번역해주신 모든 분들께 감사합니다!!
9788960520721,10,오오.. 드디어 3권이 2권 구입해서 ㅣ재미있겠읽었는데 3권 감사합니다..ㅎㅎ
9788960520721,10,"정발 속도가 좀 끝내주는게 문제지만, 2권에서 문제였던 속지 만화 눈뽕같은건 사라졌네요. 칼라플한 만화다보니 전에도 그랬지만 잉크번짐같은건 좀 있지만 역시 재미 있습니다. 문제는 다음권은 언제..."
9791155641774,10,표지 모델은 프리다. 이제 유명 캐릭터들은 다 등장한 상태이고 이때부터 연재가 끝날 때까지 피너츠는 단순한 인기 만화가 아니라 레전드의 지위에 올라서 내려오지를 않았습니다. 변함없이 재미있네요. 그리고 국내 정발도 드디어 반환점을 돌았습니다. 앞으로 남은 12권도 무사히 잘 나오길!
9791160856149,10,오호! 기다렸어요. 구매합니다.
9791155641729,6,전편들과 달라진 구성이 없는데 3천원이나 올리다니 출판사가 너무하는군요
9791155641729,10,"표지는 우드스톡. 이때부터 연재종료시까지 피너츠는 매년 전설적인 에피소드들을 만들어냈고, 이번 권도 마찬가지죠. 찰리 브라운의 봉투 에피소드가 참 인상적입니다. 정식발매가 순조롭게 진행되어 다행일 따름입니다. 앞으로 남은 13권도 잘 나오기를."
9791155641729,2,페이지 구성은 똑같은데 가격만 3천원 올려받네. 몰상식한 출판사.
9791196400118,10,돈 주고 볼 가치있는 책.
9791133482566,10,기다린지 어언 3년... 일상으로 시작했고 일상으로 끝내는구나
9791133482566,10,꼭 보고 싶었는데 드디어 나왔다 ㅜㅜ
9791133482566,10,이제야 나오네..
9788959199631,10,13권이 아직 품절이라 슬프지만 그래도 이번권도 잔잔해서 조용하게 읽기 좋아요
9788959199631,10,항상 재밌게 보고있어요^.^*일상의 소소한 재미들을 섬세하게 그려낸 만화!
9788959199631,10,12권째 사는데도 질리지 않는 난다작가의 섬세한 시선과 재치있는 이야기에 매번 선뜻 주문하게 됩니다.
9788959199631,10,"크크크 소리내서 웃게되고, 또 인생에 대한 통찰에 놀라게 되는 따뜻한 만화. 쌀이가 있어 더 풍부해진 삶처럼, 더 재있고 풍부한 이야기에 뭔가 흐뭇해진달까?"
9788959199631,10,맥주잔과 함께라 더 좋은 책.ㅋㅋ 사실 책 그 자체로도 정말 좋다. 예전부터 팬이었는데 드디어 하나씩 소장해가니 정말 기쁩니다:-)
9788959199631,10,벌써 12권이네요. 항상 즐겁습니다.
9788959199631,10,한권한권 모으는 재미가 있는 어쿠스틱라이프! 원래 다른책 구입할때 한권씩 야금야금 모았는데 맥주잔때문에 세권 한꺼번에 주문했네요ㅎㅎ 드디어 12권 채웠어요! 역시 재미나요
9788959199631,10,사회초년생때 알게된 어쿠스틱라이프.˝나도 나중에 이런 연애와 이런 결혼생활 해야지˝하며 보고있습니다.이번에 기획된 맥주잔도 너무 예뻐요. 잘 보관했다가 결혼하면 쓰려고 합니다ㅋㅋㅋ그때까지 오래도록 연재해주세요~!!
9788959199631,10,웹툰으로 읽고 또 읽었지만 책으로 보면 또 새로운 어쿠스틱 라이프. 항상 위로받고 있어요. 새 시즌도 감사합니다 ㅋㅋ
9788959199631,10,기다렸습니다 ㅠㅠ!! 신간알리미 받자마자 들어왔어요! 미리 별5점 드려요!! 꺄!
9788971906460,10,너무 재밌어요. 추억의 스머프!!
9788971906460,10,랄랄라 랄랄라 랄라라라라 ㅎㅎ
9788971906453,10,추억의 만화. 스머프 마을 속으로.
9788971906453,10,드디어 스머프들이 (오랜만에 또) 나왔다. 정말 반갑다!
9788971906453,10,와 다시 보게될지 몰랐어요. 너무 반갑네요.
9788971906453,10,"작가 페요가 조무사 면접에 지각하지 않았다면, 어쩌면 스머프는 탄생하지 않았을지도...샌프란시스코 유학 시절에 읽었던 그래픽 노블 스머프."
9788971906453,10,영원한 고전
9791127844141,10,1권 구매
9791127844141,10,꿀잼!
9791133473847,10,일본 서브컬쳐에 대한 이해가 없으면 이해하기 힘들수도 있습니다. 데드풀처럼요
9791133473847,2,초판스티커 없음;; 제가 받은건 2쇄네요 .. 딴데서 살걸
9791133473847,10,마음을 비우고 웃게 해주는 훌륭한 작품입니다.
9791133473847,10,내가 감당할 수 없는 개쓰레기만화다 5번이나 읽었으니까 별 5개드립니다
9791133473847,4,이해하기 힘든 일본식 개그물. 이모티콘으로는 쓸만하다
9791133473847,10,스티커를 사면 책이 공짜
9791133473847,6,전범기가 그려져있는데...?
9791133473847,4,만화책이랑 애니랑 내용이 같은데(순서만 다름).. 애니쪽이 훨씬더 재미있게 표현했다.
9791133473847,4,딱 한마디로 평하자면 ‘김케장 만화‘같은 느낌의 작품입니다. 짤이나 패러디로 만났을 때는 재미있었지만 실제 만화의 재미는 그닥이네요. 물론 김케장 단편선도 가지고 있는 저로써 소장이야 하겠지만 두번은 못 펼칠 작품이네요. 짤방에 호감을 가지시고 반가운 마음에 구매하실려면 주의하시길
9791133473847,10,책 사이에 책 띠지 쪼가리가 있었지만 괜찮아요 좋네요
9791133473847,2,37 페이지 욱일기 있습니다.
9791133473847,10,스티커 잘쓰겠습니다 무료배송 감사합니다
9791133473847,10,스티커가 7500원이라니.책은 덤이죠?
9791133473847,10,아름다운 중지에 이끌려왔습니다.
9791133473847,10,이딴 쓰레기 책이 정발되네요. 제가 먼저 읽어봐야겠습니다.
9791133473847,10,이런 쓰레기 만화는 사서 읽어야합니다
9791133473847,10,스티커를 사면 책을 공짜로 줍니다.
9791133473847,10,신자입니다
9791133473847,10,이런 쿠소망가는 버리고 어서 스티커를 랩탑에!
9791133473847,10,핫산이 미쳐버린 정발본
9791133473847,6,애니 안봤으면 당할뻔..예습 하고 사시오.
9791133473847,10,이딴 쓰레기같은 책은 당장 사서 읽어야겠다
9791133473847,10,전 신자입니다.
9791133473847,10,드디어 샀다!! 팝 팀 에픽 챙겨보면서 만화도 사고 싶었는데 드디어 나왔군요. 배송일까지 두근대며 기다리겠습니닷!
9791133473847,10,쿳-소 망가에다가 초월번역 지렸고요
9791133473847,10,이런 쓰레기 책은 사서 읽어 없애버려야 합니다(정론)
9791133473847,10,초월번역 쓰레기 만화
9791133473847,10,이 만화는 더이상 이 세상 만화가 아니다
9791133473847,10,애니로도 재밌게 보고 있는지라 원작은 어떨지 궁금해 예약 주문 넣었습니다! (초월번역이라길래 기대중)
9791133473847,10,아직 인류가 읽기에는 일렀던 책이 번역되다니....
9791133473847,10,이 저세상 만화를....
9791133473847,10,이건 내가 꼭산다 퉷~~
9791133473847,10,인류는 아직 이 만화를 이해할만큼 충분히 진화하지 못했다!
9791133473847,10,.... 드디어 올 것이 왔군...ㅋㅋㅋㅋㅋ 이런 기대감은 처음이야 ㅋㅋㅋ
9791133473847,10,사..사고말거다..
9791133473847,10,출고일이 내 군입대 날짜랑 겹친다. 실화냐?
9791133473847,10,팝 팀 에픽......이런 쓰레기 책은 당장 질러서 읽어야 한다.
9791133473847,10,약빤듯한 만화가 드디어 출시....  초회한정 부록때문에 두권사야징 히히
9791133473847,10,대략 정신이 멍해진다..
9791127843922,10,https://youtu.be/Z9Jva97hOyU 이번에 공식 채널에서 나온 에피소드가 실려있는 책의 정발본입니다. 이 시리즈도 꾸준히 번역되서 출간되었으면 하는 바람입니다.
9791127843922,10,"오랜만에 뮤즈를 만날 수 있어서 너무 행복했습니다. 사실, 러브 라이브 시리즈는 반은 팬심으로 그냥 지르는데, 그러고 좀 방치해버리곤 합니다. 그러다가 문득 생각이 날 때 펼쳐서 읽어나가고 있으면 추억이랄까, 그런게 흘러넘친달까요. 뒷장의 일러스트들을 볼 때도, 아 얘네 이러고 있겠지~하면서...... 계절 시리즈 마지막 권은 소설도 결국 무기한으로 연기되었었던 것 같은데, 코믹 나오면서 그쪽도 나오기를 기대해봅니다."
9791127843922,10,"정해진 수순대로 SID 시리즈의 세컨드 시즌도 코믹화되어서 나왔고, 역시나 정발되었습니다. 타이틀이 바뀔 때마다 작화가도 바뀌어서 그런지 캐릭터들의 조금씩 다른 작화를 보는 맛도 좋네요. 이제 더이상 뮤즈의 새로운 음반이나 애니메이션을 기대하긴 힘든만큼, 만화라도 쭉 나오기를 바랍니다."
9791127843922,10,갓갓... 드디어 정발 ㅠㅠ 감사합니다
9791127843922,10,너무 보고싶었던 책인데 드디어 정발 ㅠㅠㅠ
9791131972298,10,원작이 비극적인 세계관이라 그런가...또다른 세계의 평화로운 모습이 두드러져 보이네요. 현실의 삶이 각박해서 그런지 저는 이쪽이 더 좋습니다.
9791131972298,2,마토신지가 좀 안나왔으면 합니다.
9791131972298,10,애니와 함께 재미나게 보고 있습니다! 이런 치유계 좋죠~
9791131972298,10,단행본 정발한다는 소식듣고 살까말까하다가 샀는데 매우 만족합니다! 발매일보다 조금 늦게샀는데 부록 카드까지 와서 넘 좋아요 :D!!
9791131972298,10,배고프다~~~
9791131972298,10,웃으며 볼 수 있는 책 입니다
9791131972298,10,그림체도 이쁘고 분위기도 따뜻해서 보는내내 기분이 좋아지는 작품입니다
9791131972298,10,그림체가 참 좋아요.
9791131972298,8,귀엽고 아기자기하게 전성향으로 잘 풀었더군요. 페이트외전중 최상.다만 번역이 엉망. 다들 지적하시는 할아버지는 되려 맞는 번역으로 알고…카키아게와 튀김같이 한국어 대체어가 있는 단어가 일어 그대로. 송송썰기 듬성썰기 등…한국인이 읽으라고 쓴게 아닌듯. 챠항이 중식인것도 주석필요할텐데
9791131972298,10,기존의 싸우기 만하는 페이트 세계관에서 모두가 사이좋게 지내는 일상물에 요리까지 합쳐진 재미난 혼종입니다. 요리 레시피가 은근히 자세하게 나와 있어서 여차할때 도움이 될지도 모르겠네요.
9791131972298,8,책 정말 잘 봤습니다. 요리 레시피의 경우에는 한 에피소드 끝나고나서 간단명료하게 나와서 좋네요. 근데 뒷면에 2쇄라고 되어 있음에도 불구하고 '아버지'를 '할아버지'라 되어있네요. 다음 인쇄때는 번역수정하세요
9791131972298,10,책의 내용이야 말할 것도 없이 좋지만 분명 비닐 포장이 되어 온 새 상품인데 한쪽 모서리가 시커멓게 긁혀 있네요. 구겨진 모서리도 있고. 긴급 증쇄의 결과물인지...
9791131972298,8,다음권도 빨리 나오게 해주세요. 현기증이 나요.
9791131972298,10,사실 원작내용도 잘 모르는상태로(친구가 좋아해서 캐릭터이름만 알고있습니다) 그림이 예뻐서 주문했는데 생각보다 유용한 요리법이 많이 소개되어있고 예쁜 특전도 많이 들어있어 출판사의 정성과 따스함을 느꼈습니다! 귀여운 내용의 힐링되는 요리만화입니다.
9791131972298,10,배송이 조금 늦어지고 (지역차이 같습니다)초판한정 일러스트 카드 3장 중 세이버 카드도동봉되지 않아 아쉬웠습니다ㅠㅠ
9791131972298,10,"카드와 레시피북 모두 잘 받았구요, 앞 페이지 몇쪽에 인쇄가 살짝 겹쳤는데 그냥 그냥 넘어갑니다~앞으로도 계속 완결까지 구입예정!"
9791131972298,10,저도 일러스트 카드 3개 중에 이리야 카드 1개가 안왔어요 누락된 것 같은데 받을 수 있는 방법 없나요?
9791131972298,8,상당히 재밌게 읽었어요ㅋㅋ애들이 평화롭게 먹방 찍어서 좋네요ㅠ 배송 불량으로 책이 망가져서 와서 교환받은 거랑 오역 하나 빼곤 다 괜찮았어요. 키리츠구가 왜 할아버지죠?
9791131972298,8,내용은 재미있고 번역이나 부록도 퀄리티는 좋은데왜 정작 책 종이질만 별로일까나 orz
9791131972298,10,책은 좋은데.. 번역이 개판;에미야가 왜 키리츠쿠보고 할아버지라고 함;;
9791131972298,10,"특전 진짜bb 책팔줄아는사람들,,"
9791131972298,10,원서는 나온거 봤는데 애니 보니까 급 사고싶어진 작품ㅠㅠ 따수워요 거기다 특전까지ㅜㅜ 진짜 팬심자극하네요
9791131972298,10,애니 보고나서 얘들(?)이 넘 예뻐서 구매했어요!
9791131972298,10,이건 지나칠 수가 없다. 구매합니다!
9791131972298,10,바로 구매합니다. 애니도 따뜻하니 좋아요ㅜㅠ
9791131972274,8,걸즈 & 판처 리틀 아미 2부 3 - 이걸로 완결이란게 너무 아쉽다. T_T
9791155641538,10,표지는 바이올렛. 한동안 후속권이 출간이 안 되길래 혹시 중단되었나 하는 걱정이 있었는데 되려 10권이랑 같이 나와서 반가울 따름입니다. 초반부터 화끈하게 레드 배론을 쫓는 스누피의 모습이 매우 익숙합니다. 슬슬 25권 전권 완간이 꿈이 아닌 현실로 다가오는 것 같아 기쁩니다.
9791160266405,8,귀여움 보고있으면 힐링됨.ㅋ
9791160266405,6,1권 2권에 비하면 현실적 주제를 다뤄서인지 연재가 끝난건가 생각했는데 4권부터 코믹화가 다른 작가였다.
9791160266405,10,"그동안 무민 그림책을 보았는데, 만화책으로 만나니 새롭습니다."
9791160266405,10,생각보다 소소한 재미를 많이 가져다 주네요 ㅎㅎ
9791131965825,10,걸판팬이라면 꼭 보시길 스핀오프 작품이라  원작캐릭터도 간간히 등장해서 재밌습니다. 여기서도 각각 캐릭터들이 너무 다 개성있어서 캐릭터 하나하나 감상하는게 즐겁습니다 걸판팬은 필구!
9791131965825,10,걸즈 & 판처 리틀 아미 2 (1)권 - 걸판은 사람입니다. 감동입니다. 생명입니다.
9791131965825,10,기다렸습니다
9791127842529,10,역시 재밌네요!
9791160400779,8,유머스러운 말들과 귀여운 케릭터가 인상적임
9791160400779,8,왠만한 여행서는 찜쪄먹는 디테일 + 아기자기함
9791160400779,10,매번 웹으로만 보다가 늘 곁에두고 읽고 싶어서 책으로 구매하게 되었습니다. 결혼 5년차로 살다보면 신혼 때의 달콤했던 꿈과 앞으로 이렇게 살아가겠다는 마음가짐들이 흔들릴때가 많은데 그럴때마다 마음을 잡아주게 되더라구요. 더불어 크로아티아 여행도 꿈꾸게 됩니다. 언젠가 기회가 오겠죠?
9791160400779,8,"좋아라 하는 낢 의  신혼여행기, 가보고 싶은 나라 크로아티아라서 더욱 재미나게 읽었다. 여행정보도 솔찬히 들어있고 낢과 이과장이 이제는 부부로 알콩달통 살아가는 장면들이 재미났다."
9791160400779,10,만화와 에피소드가 책으로 있어서 읽기 수월하고 몹시 재미있습니다.
9791131961247,8,걸즈 & 판처 리틀 아미Ⅰ 2 - 1권 평가에서도 한 말이지만.. 해당 작품은 놀라울 정도로 독립적인 이야기지만 결국 원작의 이야기에 감정선을 기대고 있다. 이게 참 아쉬운 것이 결국 독립적으로 존재하긴 미묘한 결론이 나와서.. 그래도 무척 재미있는 작품
9791131961230,8,걸즈 & 판처 리틀 아미Ⅰ 1 - 훌륭한 작품이고 오리지널이라고 할 수 있지만 작품 자체의 감정선을 결국 원작에 기대고 있는 것이 아쉽다.
9791133452637,10,5권 언제나와요ㅠㅠㅜㅠ
9791133452637,10,역시 귀엽네요! 이런 여동생 없나 ㅠ
9791133452422,6,만화신간을 매일 체크하는데 꾸준히 발매가되길래 궁금해서 사봤지만 별거없는내용. 먹는거 좋아하는 허술한 육덕 여고생이 팬티보여주는 만화를 좋게 보기엔 나이를 너무 먹어버렸다.
9791133452422,10,만화책 신간 구매할게 많네요. 구매합니다.
9788966071630,10,어린이지만 어른이 된 것 같았습니다
9788966071630,10,마음의 여유를 가질 수 있게 하는 책이며 아이들과 대화공통주제로 만들 수 있어서 좋았어요
9788966071630,6,솔직히 매우 심심하다. 뭐랄까 어이없는 개그. 애니의 재미를 기대하고 구입하면 실망 할수있다. 그리고 그게 바로 나다. ㅠㅠ
9788966071630,10,김신회 작가님의 보노보노지만 괜찮아 라는 책을 읽고나서 보노보노만의 매력에 빠진 1인으로서 구입한거 절대 후회안합니다. 예약구매자 사은품으로 온 에코백이랑 가방걸이용 인형도 귀엽고 이쁘네요^^
9788966071630,10,이렇게 귀여울수가 있나요ㅠㅠ 천천히 읽고 있어요 제가 읽어본 책 중에 제일 귀여워요 보노보노
9788966071630,10,보노보노가 됐다고 생각하고 보면 좋아요.에코백 정말 이뻐요.ㅎ
9788966071630,10,애니보고 좋아서 구입했는데. . .전 별로에요. 선물에 혹해서 주문했는데. . .보노보노 인형은 다람쥐 같고. . .에코백도 그냥. . .기대가 커서 실망
9788966071630,10,"제가 보려고 주문했는데,초1아들이 더 좋아합니다. 보노보노가 너무 귀엽고, 책도 재미있다고 하네요.아들과 함께 할 수 있어서 좋습니다.^^"
9788966071630,10,보노보노 어릴때부터 진짜 좋아했는데 책으로 나와서 너무 좋아요 ㅠㅠ 엽서도 너무 예뻐요
9788966071630,10,출간해주셔서 고맙습니다! 정말 읽고 싶었어요
9788966071630,10,천천히 조금씩 ...보노보노가 책을 읽는다면 할 법한 독서법으로 읽고 있는데 어릴 적 느꼈던 감정과는 사뭇 다른 감회가 생깁니다. 모든 것의 근본 원인에 대한 질문으로 끌고 가는 보노보노의 힘. 재밌습니다.
9788966071630,10,잔잔한 재미와 교훈을 주는 보노보노! 어릴적 한두권 산것이 낡아서 없어진 페이지도 있는데 이렇게 다시 모을수있어서 기쁘네요:)
9788966071630,6,책 잘 받았어요~~번역 감사합니다!!
9788966071630,10,좋아요! 이게 언제적 나온건데 지금에서야 만화책으로 만져보겠군요.
9788966071630,10,보노보노가 서울문화사에서 탈출했군요 ㅠㅠ 이대로 쭉 최신권까지 무사히 정발기원합니다!!
9788966071630,10,보노보노 전 권을 사고 싶어서 돌아다니던 중에 매우 기쁜 소식이네요! 기왕이면 모든 책이 쭉 출판되었으면 좋겠습니다ㅠㅠ
9788950968687,8,가볍게 읽을 수 있지만 재미와 쉼이 함께 느껴진다.다카기 나오코 특유의 위트있는 성격이 잘 표현되어져서 오늘 나도 뭔가 나만의 메뉴를 만들어 먹고 싶은 마음이 들게하는 책이다.
9788950968687,10,"<오늘 뭐 먹지?> 다카기 나오코 ㅡㅡㅡㅡㅡㅡㅡㅡㅡㅡㅡㅡㅡㅡ4계절로 나눠서 봄,여름,가을,겨울 음식소개가 인상 깊었어요.봄에는 잼 요구르트! 여름에는 우메보시! 가을에는 닭가슴살! 겨울에는 나베요리! 일본음식의 대해 많이 알수있어서 좋았고 조리법도 따라해보고 싶었어요!"
9788950968687,10,나오코짱! 축하해요~ 가정적인 나오코사마
9788950968687,10,항상 정감 넘치는 아기자기 재밌는 만화를 그리는 작가!
9788950968687,8,"귀엽고 정감가는 캐릭터와 알록달록한 컬러 일러스트, 웃음 머금게 하는 소소한 에피소드가 왠지 정이가는 나오코상의 만화. 스포일러같지만 이 책 후반 에필로그 보면 저자의 결혼 커밍아웃 소식이 나온다. 축하할 일이긴 한데 왠지 홀로사는 즐거움을 아는 친구한명을 잃은것같은 허전함이!"
9788959198771,10,이 재미있는 책이! 이 엄청난 책이 왜 더 안나오는건가. 들개이빨님. 전권 다 사고 지금 2부 완결된거 알고 기다리는데 조용하네요.기다리고 있어요~!!!!
9788959198764,10,기다렸던 만화책~~~!!!!
9791133437504,8,자칫하면 뻔히보일수도있는 소재를 볼만한 내용으로 잘 뽑았단 생각이 듭니다. 그림도 친근감있고 좋네요
9791133437504,10,구매합니다. 기대!
9791133437504,10,이것도 정발됐었네요? 친구들 주려고 일어판으로 10권 사왔는데...허...
9791133434619,10,너무 너무 귀여워라. 예전에 개 키우던 기억이 새록새록 쏟아났다. 다시 개 키우고 싶다..
9791133434619,8,"개가 있는 사람이라면 누구나 공감할 이야기입니다. 단편으로 이루어져 있으며, 그림체가 무척 귀엽습니다.주인공 ˝주인˝이 보는 개의 모습을 사실적으로 표현했고, 세심하게 묘사해서 보기 즐거웠습니다."
9791133434619,10,공감 100퍼센트의 책. 다 보고 나면 저절로 강아지에게 가게 된다는. ㅋ~ 짧은게 그저 아쉬울 뿐...^^
9791133434619,10,너무 귀여워서 읽는 내내 끙끙 앓고 말았다...멍멍이 귀여워ㅜㅜㅜㅜㅜㅜㅠ강아지에게 얼마나 큰 애정을 가지고 관찰했는지 알 수 있을만큼 너무 사랑스러운 책
9791133434619,8,예전에 개를 키웠던 추억이 생각나네요. 우리집 강아지랑 너무 비슷해~^^
9791133434619,10,강아지를 키우는 사람이라면 엄마 미소를 띠며 읽을 수 있는 책이네요~금방 읽을 수 있을 정도로 두껍지 않은 책이라서 아쉽긴 하지만 공감이 너무 되어서 다 읽고 우리 집 강아지를 꼬옥 안아주었네요~!
9791133434619,8,강아지를 키우는 사람이라면 정말 공감할 에피들. ^^마당에서 사는 이누짱인데 귀엽기까지 하다. 애정이 담긴 만화.
9791133434619,10,풍산개를 키우고 있어서 많이 공감하면서 즐겁게 읽었어요.
9791133434619,10,강아지에 대한 작가의 사랑이 느껴지는 책❤ 우리집 애기들 생각난다😍
9791127838645,10,재밌어요 ㅎ
9791125658504,10,캐릭터들이 고백하는 장면들이 다 달라서 재미있었어요
9791125658504,10,인터넷 연재 때부터 좋아하던 작품.
9791125658504,10,검색해도 안놔와서 왜 그러나 했더니 심신한 칠드런이라니...
9791125658504,10,정발되기만을 기다렸던 작품!!
