ISBN13,rating,review
9791161903255,8,여성인줄 알고 샀는데남성이더라구요ㅋㅋㅋㅋㅋㅋ여기에 여체로 그리면 되겠지...하고있습니다.
9791161903255,10,조흐네요...^^ (휘파람 휙~~휘익~~~)
9791161903255,10,책은 고사하고 길바닥에도 판치는 온갖 여성 성상품화 오지는 이미지들에 여성 성상품화 오진다고 말하는 남성 인간은 한번도 본 적이 없는데 왜 이런데는 저런 인간들이 꼭 달라붙는지 의문이네요.
9791161903255,10,"당장 작법서랍시고 팬티 그리는 법, 속옷 그리는 법(그리고 전부 여자가 벗고 있다) 이딴게 판을 치는데 슬슬 이런 책도 나올만 하지"
9791161903255,10,한국어버전으로 내주시다니ㅠㅠㅜㅜㅜㅠㅠㅠ 감사합니다ㅠㅠㅜㅠㅠㅠㅠㅠㅜㅜ
9791161903255,10,헠헠 기다리는거너무힘드네요 18일 빨리왔으면ㅜ
9791160071962,6,400여 가지의 포즈가 있단 타이틀에 비해 실제로 바로 응용하여 쓸 수 있는 포즈는 그 절반정도이다. 초반부 해부학적 지식의 설명은 초심자가 보기엔 너무 간략한 감이 있다. 포즈만 참고하여 자신만의 데포르메와 해부학적지식으로 응용가능한 사람이 보기엔 좋을거같다.
9791160071962,2,포즈와 구도 관련해서 도움되는 부분은 끝의 10~15퍼센트의 내용이고(이게 전부 샘플 페이지로 올라옴) 앞은 인체나 배경에 대한 내용이 나오는데 여러 저자가 함께 작업한 책이라 그런지... 썩 퀄리티가 좋지 않습니다. 작법서인데 못 그린 그림이 너무 많고 정말 후반만 제목과 맞는 내용이에요.
9791160071962,8,"인체만 그리다가 이제 일러스트도 좀 그려볼까라고 생각하시는 분들께 적합한 책입니다. 기초적인 내용의 비율이 높아서, 난 이제 초보가 아니야라고 생각하시는 분들께는 내용이 만족스럽지 않을 수 있습니다. 무작정 그리기보다는 기본적인 지식은 알고 싶은 분들께는 나쁘지 않은 선택이겠네요."
9791160071962,4,밑의 리뷰를 먼저 보고 샀으면 좋았을텐데. 구도와 포즈에 대한 내용은 끝부분에 조금 할애하고 나머지는 인체에 대한 내용입니다.
9791160071962,4,구도와 포즈를 중점적으로 공부하실분들에게는 비추입니다.샘플화면에 있는 내용들이 사실상 전부이고 나머지는 우리가 흔히 아는투시와 인체근육에 대한 기본지식들로 채워져 있습니다. 사실상 구도와포즈는겉다리 형식일 뿐이기에 차라리 다른 서적을 보시는걸 추천드립니다.
9791196203108,10,초보 입문자한테 쓸만해요
9791160853216,8,동방 좋아 하시면 살만한데 아니면 안사시는걸 추천합니다. 다른 구도포즈 참고자료가 더 좋음
9791187824053,10,"마블코믹스를 살린것이 ‘스파이더맨‘  덕분이었군요. 한 캐릭터의 백과사전에 특별한게 있을까?했는데, 스파이더맨의 역사가 있는만큼, 알차게 읽었습니다."
9791187824053,10,코믹스를 읽지 않았었는데 백과사전에 자세히 잘 정리 되있어서 좋았어요
9791187824053,10,좋습니대스파이다맨 팬이라면 갖고있을만한. 내용도 알차고 좋네요 ㅠ
9791187824053,10,스파이더맨이라면 무조건 소장각이다. 내용이 정말 알차다.
9791160071573,8,"게임 원화같은 고퀄리티 그림이 아니라 효율적으로 그리는 방법을 알려주는 도서입니다. 그리는 시간이 너무 오래 걸리거나, 그림 과정을 헤메는 분들께 추천합니다."
9791160071573,10,브러쉬 다운 비밀번호가 어려워서 헤매고 있다...
9791160071573,10,"흠..... 일단 읽어보니 아랫분과 반대로 포토샵 주요 용어라던지 면으로 파악, 투시도 그리기, 구름그리기, 꽃 그리기 등 정말 도움되는 것이 많았어요(곱씹어보면 좋음). 그리고 퀄리티는 배경을 그리는지라 선이 아닌 무테로 채색하기 때문에 지저분해 보일 수 있으나, 전혀 그런기분 안들고 깔끔함."
9791160071573,4,퀄리티가 좋아보이지만 가까이서보면 너무 완성도가 낮아요..너무 그림체가 지저분 합니다 선명도가 낮아요 틀도 대충 하시고 별로 학습하기 좋은 책은 아닙니다
9791160071573,8,처음그림그려보는데 도움이될까요? 일단 사볼게요
9791160071573,10,배경 그리는 것과 더불어 포토샵 사용법이나 명암의 관한 개념 정리도 같이 되어 있어 상당히 좋은 책입니다. 특히 중간중간 알려주는 tip 부분은 실무에서도 매우 유용하게 사용할 수 있어 완성도를 높이는데 큰 도움이 됩니다. 추천합니다.
9791160071573,8,일본 원서를 사버리고 나니 번역서가 나오다니..... 책은 좋으나 슬퍼서 별하나 뺍니다.
9788967540838,8,출판사 제공 정보가 부정확합니다. 이 책의 핵심 포인트는 여성 캐릭터를 그릴 때 어느 부분은 어떻게 그려야 여성 특유의 느낌이 강해지는지 배울 수 있습니다. 그리는 법이 아니라 어떻게 더 매력적으로 표현할 수 있는지를 집중적으로 소개합니다.
9791127405069,10,조와요
9791127405069,10,이 책은 다른 책들과 다르게 레트로카툰체와 유사한 그림체라는 점에서 좋습니다.레트로카툰체쪽으로 공부 할 생각이면 추천드립니다.그리고 포즈도 다양하고 많아서 포즈공부에도 큰 도움을 줍니다.
9791127405069,8,아 이거 나왔네..원서로 샀는데 괜찮은 책입니다 포즈도 많고...
9791127404277,4,크로키를 시작하면서 알면 좋은 팁들이나 그리는 과정을 세세하게 다 보여줘서 좋은데 예시가 여자밖에 없어서 실망스럽습니다. 이럴거면 책 제목을 ‘인물 크로키의 기본‘이 아니고 ‘여체 크로키의 기본‘이라고 적어놓는게 나았을 듯 싶습니다남체를 참고 할 예시가 없어서 실망스럽습니다.
9791160070606,2,"도구바, 툴박스가 잘 보이지 않습니다. 이미지가 너무 작아서 눈이 아픕니다. 전... 비추천."
9791160070606,10,원했던 출판 만화 양식에 대한 정보를 얻을 수 있어서 좋습니다.
9791160070606,8,책이 생각보다 두껍고 어려운데 공부 할만 해요
9791160070606,8,클립스튜디오에 기능을 설명해주는 책이나 핵심은 출판만화 제작방법을 알려주기에 웹툰이나 일러스트를 생각하는 분들에게는 큰 도움이 되지 않습니다. 마지막 일러파트도 인터넷에서 충분히 찾을 수 있는 내용들입니다.
9791160070606,10,공식 매뉴얼보다 방대한 클립 스튜디오 페인트의 백과사전. 소프트웨어 제조사에서 공인한 이유가 있는 책. 클립 스튜디오의 A to Z.
9791160070606,10,근데 흑백만화 그리는법만 계속 나와서 약간 별로
9791160070606,10,﻿무겁다. 당연하게도 두텁기때문. 두터운만큼 진짜 기초스런부분부터 잡다하게 많이 설명해준다. 이런점에 무거운것은 좋다고 본다. 클립스튜디오 입문하는사람에게 이 책을 적극추천한다. 그 국내클립스튜디오카페(코믹스튜디오)의 회원장(?)이 쓴 책도 좋긴한데 이것도 좋다. 둘다 사자.
9791127402440,10,"쉽게 이해하고 참고하기 좋아요자료 진짜 많고 레이어 따로 있는 파일들도 좋고일본 초등학교~대학교, 양호실 체육관 등등 다 있어요대박임"
9791127402440,10,판타지 배경 작업중이라 그대로 갖다 쓰지는 못합니다만 큰 도움 받고 있습니다. Psd선화파일이 좀 더 많았더라면 좋겠지만요.
9791158950323,10,"내용이 알차서, 사놓고 오래동안 참고용으로 볼 수 있을 것 같습니다."
9791170249962,8,군복 고증 참고할때 좋아요 자료도 세세해요
9791170249962,2,겉표지에 낚였어요
9791170249962,10,군복 마니아로서 정말 최고의 책입니다. 물론 그림그릴 때 오류사항도 콕 찝어줘서 앞으로 즐겁게 그릴 수 있을 것 같습니다.
9791170249047,10,본 인체 책중에 가장 좋았어요 자세하지만 군더더기는 없고 알기 쉬워요!!
9791170249047,10,자세하고 좋네요 ㅎ
9791170249023,8,참고 서적입니다!!!
9788958629054,10,이 한권은 80년대 문방구에서 프라모델을 찾아서 해매던 나의 국민학교 때의 추억을 아련히 복원해 주었습니다. 비록 당시 내가 수집한 프라모델이 이제는 없어도  이책의 칼라사진으로 언제든 볼 수 있어 감사한 마음입니다!
9788958629054,10,너무나도 소중한 추억을 되살려주는 책입니다알찬 내용이 돋보입니다
9788958629054,10,어릴적 조립했던 기억들이 새록새록 떠올라서 기분이 좋네요~소장용으로 추천합니다.
9788958629054,10,일본에 오랬동안 살면서 수많은 취미책들을 보았습니다.한국만의 로컬취미를 다룬 책이 한국에는 왜 없을까했는데 이책이 나왔군요. 감사합니다.
9788959130085,10,내가 생각하는 멋진 장면과 작가의 시선이 달라서 기대했던 컷들이 적은 것이 아쉽다.
9788959130085,10,스퍼맨은요 ㅎㅎ
9788959130085,10,갓일권
9788959130085,10,가격때문에 약간 주춤하지만 ... 하일권님 진짜 정말좋아하는 작가님중 한분이라 없는돈 긁어모아 사야할듯합니다..^^
9788959130085,10,믿고보는 하일권이라 알람이 뜨자마자 저도 모르게 구매해버렸네요. 내용은 어떨지 모르겠지만 기대중입니다. 2014년에 있었던 전시회를 못 가서 너무 아쉬웠는데 이렇게 아트북으로나마 풀 수 있어서 좋아요.
9788997125944,10,오~ 기대되네요!
9791195557189,10,"너무 너무 좋습니다.이걸보고 만일 딸이 생기면 이거 꼭 보여주고 싶고 일본의 학교로 보내주고 싶은 마음과 제가 일본여자로 다시 태어나고 싶은 마음이 너무 강하네요. 그런데 한국에서는 그게 안된다는 게 너무 슬픈 현실ㅠㅠ일본 만화나 애니메이션, 게임을 좋아하는 분들에게도 강추합니다."
9791195557189,10,ㅡ아ㅡ주ㅡ좋ㅡ음ㅡ
9791195557189,10,"참고용 자료로서 정말 좋네요.이 책을 읽기전에는 다 같은 교복인줄 알았는데, 막상 보니 다 차이점이 있던...책의 구성은 4계절 교복이 소개되고 상반신과 하반신으로 나누어져 있습니다."
9791195557189,6,제목그대로 (여자)교복에 대한 책이다.이런류의 책은 보통 여러 일러스트레이터가 참여하는 경우가 많은데 이책은 저자가 한명이라 통일감이 느껴져서 좋았다. (표지의 그림체가 쭈욱 지속) 일러스트북이라기보단 교복과 관련 아이템에 대한 설명 비중이 많은편. 별 3개...
9791195557189,10,"역시 일본 책이라 그런지 일본의 교복만 나오네요.일본풍으로 그리실 거라면 자료용으로는 좋지만, 한국을 배경으로 한 그림을 그리실 거라면다른 책을 추천드립니다."
9791195557189,8,혹시나 출판사가 ㅁㅅㄴ일까 해서 봤는데 역시군요. 그래서 샀습니다.참고로 남학생 제복은 안나오네요.
9791195557189,10,검은색이 너무 진하게 인쇄돼서 보기힘들다는것만 제외하면 참고자료로 좋습니다.
9791195557189,10,한번 구입해봅니다~
9788971905128,10,"다른책들과 달리 만화그리기 위해 외울부분의 핵심만 짚어주고, 그 이유와 근거를 풀어나가는 좋은 책이였습니다. 책 후미에 3권이 발간예정이라했지만 아직 소식이 없는게 아쉬울 뿐입니다. 아오리 후캉 등 일본어로 봤을때 아리송한 용어를 한국어로 쉽게 이해하며 읽을수 있어 좋았습니다."
9788971905128,10,취미로 그림 입문하는데 큰 도움이 됐습니다. 사람을 사람처럼 그릴 수 있게 해준 책이네요ㅠ
9788971905128,10,그림 그리는데에 도움이 되었습니다. 추천합니다.
9788971905128,10,이론 설명이 매우 자세. 빨랑 웹툰 그리구 싶넹 !!!!!!!!!!!!
9788971905128,10,크 내가 원했던 책이당. 이 책 일본에서 밨는디.. 오늘 산다
9788959759385,10,포토샵이 있고 색조합을 헤메는 사람에게 도움될거같아요~!전 개인적으로 좋았습니다
9788959759385,10,"말그대로 채색과 레이어 테크닉에 대해 서술한 책.서론에서는 색깔에 대해 설명이 되어있고,디지털작업의 여러 기법이 서술되어있는데, 그 작업과정이 자세히 설명되어있습니다.포토샵 입문중에 TCG 일러스트 작법서랑 같이 보고있는 책.자기 스타일과 맞는 기법을 보면 되니 편합니다."
9788959759385,10,도움이 많이 됐어요 ㅎㅎ 생각보다 포토샵 어렵게 쓰지않고 단순하게 사용하는듯합니다 초보도 따라하면 멋있는 그림을 충분히 만들 수 있을 것 같아요
9788959759385,8,"포토샵을 어느 정도 다루고 채색도 가능한 사람에게 맞는 책으로 초보자 용은 아닙니다.그런 시점에서 읽으면 색감과 분위기, 채색방법에 대해서 확실히 도움이 됩니다. 뭔가 막연~하게 알고 있는 부분에 대해 글로 알게 해준달까요?원서가 두배에 달하는 가격이라는 것을 볼때 한번 읽어볼만 합니다"
9788959759385,10,"색 고르는걸 잘 못해서 언제나 그림 그릴때 마다 색깔고민을 많이 하는데 참고도 많이 할 수있는거 같고, 책 안에 일러스트도 엄청 예뻐서 계속 눈이 가게 되고, 물질의 질감도 한눈에 볼 수 있어 좋아요!!"
9788994796567,6,쉽게 따라그릴 수 있는 다이어리용 손그림
9788994796567,10,유튜브에서 처음 스기님을 알게되었는데책도 출간하셨다는 걸 듣고 2년이 다되가는 책이지만 재고 찾아 구매했습니다:) 이쁘게 다이어리 꾸며볼게요^_^
9788994796567,10,예쁜 그림으로 다이어리를 장식하고 싶네요
9788994796567,10,귀여운 그림을 내 손으로 그리는 재미가 있어보여 그려보고 싶어요
9788994796567,10,그리고 싶은 생각이 들게 하는 신기한 책
9788994796567,10,너무 예쁘고 귀여운 감성 넘치는 그림들이 마음을 따뜻하고 기분좋게 해주네요^^깜찍하고도 세련되게 나만의 다이어리를 꾸밀수 있도록 도움이 될꺼같아요.완젼 추천합니다
9788994796567,10,이 책을 통해서 따라서 그려봐도 소기의 성과를 거둘 수 있을 것 같다
9788994796567,10,스기의 달달 손그림 책! 예상보다 두꺼운 책으로 안에 아기자기한 그림들이 가득해서 마음에 들어요. 각 달별로 행사에 어울리는 손그림들이 있어서 다이어리 쓸때 참고해서 활용할 그림들이 있어 유용하네요. 특히 단계별로 그리는 과정을 알수 있어서 초보자도 따라그리기 좋아요.
9788994796567,8,수첩 이쁘게 꾸미기 딱 좋은 그림이네요. 단순하면서 손많이 안가고 캐릭터는 확실하구요. 따라 그리기 쉽구요. 요즘 컬러링 책 칠하면서 색연필 그림 그려보고 싶다는 생각을 했었는데 난이도가 높지 않아서 딱이네요. 그러면서 그림이 포인트는 딱딱 짚어주는 감이 있구요. 귀여운 그림이 많아 좋음
9788994796567,10,"점점 각지고, 딱딱함이 묻어난 디지털 세상에서.. 굳어있는 마음을 포근하고 따스하게 감사주는 것 같은 느낌이 들어 아주 좋네요.그래서 인가요??가끔 직접 쓴 손글씨를 보면 그렇게 좋은가 봅니다.^^표현 못하는 저 이지만 손그림을 따라하다 보면 그 순간만은 행복으로 가득 찰 것 같습니다."
9788994796567,10,으 손그림이나 글씨 이쁘게 쓰는 사람들이 참 부럽던데 이 책으로 좀 도움을 받을 수 있을듯하네요
9788994796567,8,현재 저에게 딱맞는 책인거 같아요 창작캐릭터를 그리고 싶은데 어디서부터 시작해야할지 감조차 안잡혀서 문제였거든요.. 이책을 읽고 가벼운 손그림부터 시작해볼까 합니다ㅎㅎ
9788994796567,10,"저 요런거 너무 좋아해요, 다이어리에 저도 이렇게 귀여운 캐릭터 그리고 싶은데 어렵거든요, 그런데 스기의 달달 그림책 보면 쉽게 따라 그릴 수 있을거 같아요, 어려운 동작도 여러가지 소품들도 정말 쉽게 따라 그릴 수 있는 책^^"
9788994796567,10,잘 정리되고 예쁘게 꾸며진 다이어리를 보면 나도 저렇게 해야야지 마음으로만 항상 다짐해왔었는 데 방법을 알려주는 책이 있다니 볼 때마다 기분이 좋아질 것 같아요!
9788994796567,10,"그림을 배우고 싶었는데, 용기내지 못했습니다. 지금은 오히려 내 맘대로 그리면 되니까 용기를 내보자 생각하고 있지요. 어차피 그림은 나만 보는 것이고, 내가 즐거운 일이니까요. 귀여운 손그림 좋은 참고가 될 것 같습니다."
9788994796567,10,"손그림 넘 귀엽네요. 제일 못하는 게 손그림인데, 스기의 달달 손그림 보고 따라하면 어렵지 않을 것 같네요. 기대됩니다~"
9788994796567,10,손재주는 없지만 캘리그라피 강좌도 듣고 다이어리에 그림도 그려넣곤 하는데 이 책이 아기자기한 팁을 얻는데 큰 도움이 되겠네요. 기대합니다.
9788994796567,10,손재주가 없어서 그림이든 만들기는 어렵다고만 생각하고 있었는데 달달하고 아기자기한 그림들보니 희망이 생깁니다 늘 바쁜 일상속에서 답답한 마음을 가진터라 이렇게 힐링하고 재미있는 그림들 그리면 즐거워질것 같아요 따라하며 열심히 그려보고 싶어지네요
9788994796567,10,다이어리 꾸미는 게 정말 너무 힘들었는데 스기님 책 따라하면 그냥 귀여운 낙서하는 거 같아서 기분이 좋아요! 동물캐릭터도 귀엽고 악세사리들도 귀엽고 ㅠㅠ 내 다이어리가 귀여워 지는게 너무 좋습니다!
9788994796567,10,꾸밈에 자신이 없었던 사람도 이 책을 보면 마구마구 의욕이 솟아나서 따라 그려보게 될 것 같아요! 자그마한 그림도 순서대로 그려지는 과정이 나와 있어서 중간에 포기하지 않고 따라할 수 있다는 점이 제일 마음에 듭니다. 사소한 포인트도 놓치지 않고 설명되어 있는 세심함에도 감동했어요!
9788994796567,10,"아 그림이 너무 귀엽고 깜찍해요! 정밀화처럼 세밀하게 잘그리고싶은 욕망도있지만 이렇게 깜찍하게 잘 그리고픈 욕망도 항시있어서 이 책을본다면 그 꿈을 이룰수있을것같아요.특히나 꼼꼼한 팁과 설명들, 다양한소재들로 정말이지 1년내내 알차게 잘배우게 될것같습니다. 어서 그림을 그리고싶어요!"
9788994796567,10,"너무나 깜찍한 그림체 :) 꾸미는 걸 좋아하는 사람이라면 당연히, 그리고 손재주 없는 사람들도 도전해보고싶게 만드는 것 같아요~"
9788994796567,10,"달별 이벤트도 있고 간단하면서도 유쾌하게 일상을 그려낼수 있어 좋네요.다섯살 아이가 요즘 자동차,인형들 그려달라는게 많은데..쉽게 배워가며 아이에게 기분 좋은 손그림 선물해줘야겠습니다~~^^"
9788994796567,10,무미건조했던 노트와 다이어리가 생기발랄해지겠어요~
9788994796567,10,다이어리를 예쁘게 꾸밀수있어 유용하네요.
9788994796567,10,다이어리 꾸미기를 배울수 있어 흥미롭네요.
9788994796567,10,손과 관련된거는 정말 잼병이라 교과서에 간단히 낙서 그리는건 포기하고 필기만 열심히 했는데 청소년시절의 마지막 년은 남한테 보여줘도 부끄럼 없는 조그마한 낙서를 할 수 있을거 같습니다.
9788994796567,10,제가 정말 원하던 거였어요! 매번 스티커로는 뭔가 2% 부족했는데 요런 그림 정말 너무 좋아요
9788994796567,10,어렸을적부터 꿈꿔왔던 다이어리 꾸미기. 따라하다보니 오히려 그림만 잔뜩 그리는 연습장이 되었네요 ㅎ
9788994796567,10,다이어리를 이렇게 꾸밀 수 있다면 다이어리 쓰는 재미가 솔솔 할 것 같아요. 작은 일러스트지만 무척 사랑스럽네요.
9788994796567,10,앙증맞은 손그림이 아이들이 좋아할 그림입니다. 그림을 따라 그려보는 재미가 있는 일러스트 수업이 흥미롭습니다.
9788994796567,10,가끔 보면 정말 저렇게 꾸미는분들이 신기했는데 따라해봐야겠어요
9788994796567,8,귀여운 손그림으로 다이어리를 보다 풍성하게~ 스티커와는 색다른 매력이 있네요
9788994796567,10,그림들이 너무 귀여워요!
9788994796567,10,"글로 모든 감정을 다 표현하기 힘들 때, 그림이 그 부족함을 채워준다는 게 참 고맙다고 느낄 때가 많습니다. 책에서 제공하는 상세한 정보와 함께 그림들의 색을 채워가며 마음의 평안을 얻을 수 있을 것 같습니다."
9788994796567,10,보기만 해도 ˝꺄아~˝소리가 절로 나는 손그림들! 1월에 마련해둔 다이어리와 공책이 점점 허허벌판이 되어가고 있는데 이 손그림이 올해의 다이어리들을 구원할 것 같다. 올해는 12월까지 끝까지 한 권을 다 써보고 싶다! 이 앙증맞은 손그림들과 함께!
9788994796567,10,초보자도 따라하기에 그리 어렵지 않게 잘 쓰여진 책이네요. 여러가지 재미난 그림들이 많아서 아무페이지나 펴놓고 바로 그리기 할수있을듯하네요~~
9788994796567,10,자유로운 표현이 가능한 손그림에 관심을 가지고 있었던 차에 딱 맞는 도움책을 발견했습니다. 쉽고 재밌게 표현된 내용이 무척 흥미롭습니다. 기대합니다.
9788994796567,10,"월별로 필요한 그림테마가 나뉘어 있고, 그릴 때 포인트를 줘야할 부분을 알려줘서 초보자도 쉽고 예쁘게 다이어리를 꾸밀 수 있게 하는 책! 심플하고 직관적인 그림을 원한다면 <스기의 달달손그림> 추천!"
9788994796567,10,손그림을 정말 좋아하는 사람인데요 그림이 하나하나 너무 귀엽고 개성 있어서 따라하기 쉽게 설명이 잘되어있어서 좋은것 같습니다! 특히 좋은팁들이 많아 아이들과 함께 그림을 그릴때 더욱 좋을것 같습니다!매우 기대됩니다!
9788994796567,10,캘리그라피와 함께 관심있는 것이 이런 아기자기한 그림을 그리는것인데 글씨는 조금 정성을 들이면 또박또박 쓰는것도 가능한데 그림은 참 그리기가 어렵다. 화려하고 정밀한 그림이 아니라 재치있는 그림을 하나하나 그림을 그려넣은 팁이있어 추억들을 그날의 기분을 시각적으로 표현할 수 있어좋다
9788994796567,10,"아이와 요즘 손그림 열심히 그려보고 있는데 쉽지 않더라구요. 이 책이 팁이 많고, 그림도 다양하게 구입하려고 왔어요. 아이와 열심히 그리고 후기도 올릴께요 ^^"
9788994796567,10,"정말 따라만 하면 나도 어느새 일러스트가 된 것만같은 착각을 불러일으키케만드네요그림체가 너무 귀여워서 다이어리 꾸미기에도 딱이고편지지도 직접만들어서 선물하면 모두 좋아할 것 같아요, 정말 제목그대로 달달한 손그림이네요 ^^"
9788994796567,10,손그림이 그리는 게 막상 쉬워 보여도 제가 그리고 나면 형편없더라구요. 이 책은 다양한 손그림 그리는 법이 나와있어서 상황에 맞는 그림을 그릴 수 있어서 좋네요ㅎㅎ 저같은 손그림 초보자도 쉽게 따라할 수 있을 것 같아요 ~
9788994796567,10,2016년 다이어리를 쓰기로했는데 이쁘게 쓰고싶은데 어떻게 써야할지 감이 안잡혔는데 이책보고 다이어리 잘쓸수있게 됐어요ㅜㅜ  짱짱! 다이어리 월별 어떤 일러스트로 어떤 느낌으로 꾸며야할지 자세히 나오네요 넘나 고마운것..♥ 잘꾸밀게요 ! #2016다이어리
9788994796567,10,기억에 남는 소중한 순간을 글로 남기면 어딘가 사무적인 느낌이 돼버리곤 하는데 포인트만 잡아서 간략하게 그려두면 기억을 되살릴 때 그때의 기분까지 떠오를 것 같네요
9788994796567,8,"손그림이 너무 예쁘고 사랑스럽습니다. 아기자기한 그림들을 쉽게 배우고 따라 그려서 활용할 수 있을 것 같아요. 늘 밋밋한 다이어리를 어떻게 꾸밀 수 있을지 고민이었는데, 이 책에 나온 손그림을 열심히 연습해서 다이어리를 예쁘게 꾸며보고 싶습니다."
9788994796567,10,너무 이쁘고 귀엽고 사랑스러운 손그림이 나를 설레게 만드네요~~ 참으로 기분 좋은 책입니다`~
9788994796567,10,다양한 월별 테마로 나뉘어져 있고 따라 그리기 쉬운 그림들이라 다이어리 쓸 때 특히 요긴하게 쓰일 책인 것 같아요. 그리는 과정도 친절하고 무엇보다 그림이 아기자기하고 정말 귀여워서 좋았습니다! 그림 그리는 것과 더불어서 색 조합하는 감각도 익힐 수 있을 것 같았어요!
9788994796567,10,스티커대신 깜찍한 손그림으로 다이어리를 꾸밀수 있게되어서너무 좋네요. 책에서 배운대로 하니 어렵지않게 그릴수있네요.
