ISBN13,rating,review
9788959197309,8,출판업에 종사하는 사람으로서 매우 기대하고 있는 책입니다.
9788959197309,8,"오호.....중쇄 = 증쇄....정말 바라는 책들이 많아요그 마음을 대신 풀어주는 작품이 되었으면 좋겠어요..절판, 품절이라는 단어가 없는 행복한 세상 늘~~ 꿈꿉니다."
9788959197309,10,작품 소개 내용이 눈길을 끄는 만화네요..스토리가 책이 되는 시작부터 중간 그리고 끝 드디어 ｀책｀이 나오는 과정을 유쾌하게 이해하며 볼 수 있을것 같네요
9788959197309,10,그녀의 뜨거운 업무열전이 책을 통해 전해져 오는 것 같습니다. 궁금했던 만화편집부도 엿볼 수 있었습니다. 재미있네요:)
9788959197309,10,접하기 쉽지 않은 만화제작과정의 에피소드들이 실감나게 그려져 있습니다. 소소한 그들의 이야기가 재미있습니다.
9788959197309,10,해당 업무에 대해서 쉽게 알 수 있게 되어있어 기대되네요.
9788959197309,10,특이한내용의 만화책이라 생각됩니다그림체도 귀여우니깐 재미있을거같군요나중에 와카코와술을사면서 같이사는걸 고려해봐야죠
9788959197309,10,너무너무 기대되는 만화에요!
9788959197309,10,제목 때문에 삽니다. 왠지 중쇄 찍는 걸 보고 싶네요.
9788959197309,10,소개글만 봐도 흥미진진하네요
9788959197309,8,제목에 끌려 충동구매.. 재밌을것 같아요
9788959197309,10,｀팔린｀ 게 아니야. 우리가 판 거다!!! 바쿠만 같은 만화 편집이 아니라 미생 같은 영업 만화. 운을 어떻게 사용해야 하는지 배울 수 있다!
9788959197309,10,받금 배송받아서 앉은 자리에서 다 읽었네요. 생각보다 더 재미있었습니다. 선이 굵은 그림체로 시원시원한 표현 방식이 좋네요. 만화 편집부 이야기가 흥미로왔고 보는 내내 불황이라고는 하지만 아직 큰 일본 만화시장이 무지 부러웠습니다. 3권이 빨리 나왔으면 좋겠네요.
9788959197309,10,색다른 소재에 독특한 주인공이 나오는 것 같아서 굉장히 궁금하고 기대가 되는 책입니다.
9788959197309,10,이 책 정말 재밌어요! 다음 권들도 일본에서는 출간 되었는데 우리나라는 언제 나오나요? 출판사나 만화 쪽을 꿈꾸는 분이라면 더욱 재밌게 볼 수 있을거에요~
9788959197309,8,이 작품속으; 만화편집부는 사회의 모습을 아주 잘 반영시켜 주인공에게 감정이입이 되네요
9788959197309,10,만화가가 꿈인 저에게는 참 필요한 책입니다. 편집부에 관한 내용도 들어보고 싶네요.
9788959197309,10,책을 좋아하는 사람은 직접 만들어보고싶기도 하지요. 그런 것을 대리만족시켜준다고나 할까요. 재미난 내용의 책입니다^^
9788959197309,8,제목이 너무 독특해요. 일본만화 다운 제목과 소재랄까 아직 보진 못했지만 후기를 보니 출판사에서 일하시는 분들은 대박 공감하시더라구요. 이런 소소한 생활 만화가 좋아요~ 출판업 종사자분들 모드 중쇄찍는 그날까지~!!
9788959197309,10,단순한 재미를 위한 만화가 아니라 ｀중쇄｀라는 특별한 내용으로 재밌게 진행되는 좋은 책이네요.
9788959197309,10,중쇄! 이게 얼마나 중요한 단어인지!보고싶던 책이 중쇄될때 그기분은 정말 더할 나위없습니다. 이책 꼭 중쇄되길 바래봅니다
9788959197309,10,책을 좋아하는 분이라면 공감가는 이야기가 많을거 같아요. 5권까지 쭉쭉 중쇄되길~
9788959197309,10,너무 유쾌하고 통괘하고 속이 뻥~뚫리네요. 책장이 술술 넘어가요!
9788959197309,8,난동부리는 청소아저씨를 업어치기로 제압하는 코코로가 굉장히 멋지게 느껴지네요. 엉뚱한 사장님과 함께 일하면서 겪게될 직장인의 기쁨과 애환들이 무척 궁금해집니다. 출판업계의 에피소드들을 많이 접할 수 있을 것 같아 궁금증이 더해지네요. 업무만화1위라니 직장인 친구에게 선물해줘야겠어요.
9788959197309,10,일본 출판계가 어떤 일을 하고 만화편집부서에서는 또 어떤 일을 하는지 알 수 가 있는 흥미로운 만화입니다. 이야기 구성도 흥미롭고 재미있어 책장이 술술 넘어갑니다
9788959197309,10,기발한 책제목 못지않게 참신한 이야기들. 한권의 책이 어떻게 만들어지고 독자들에게 전달되는지를 잘 보여주는 책입니다.
9788959197309,10,"초판이 다 팔린다는 건, 편집부의 안목이 적확하고, 디자이너의 감각이 출중하고, 영업부의 집중이 적절했으며, 서점담당자의 선택이 탁월하다는 것을 의미할 것이다. 모든 직업의 일이 다 다르지만, 하나의 성취를 얻는 길은 비슷한 경로를 따를지도 모른다. 뜨거운 만화다. 보는 내내 기분이 좋다."
9788959197309,10,책 한 권 내는 데 이렇게 많은 노력과 열정이 필요하다니...새삼 책의 중요성을 깨닫는다.
9788959197309,10,한 권의 책이 나와 독자에게 팔리기까지의 모든 순간을 함께 느끼고 같이 하고싶어요.
9788959197309,10,여자 유도선수 출신의 새로운 꿈을 향한 이야기 줄거리만봐도 흥미진진
9788959197309,10,즐겨보던 만화가 어떻게 나오는지 알수 있을것같아 흥미롭네요 캐릭터도 귀엽고
9788959197309,10,나의 20번째 소장만화로 이 책을 선정하였다~!!
9788959197309,10,귀여운게 재밌어보여요
9788959197309,10,"만화에 대한 재미있는 만화, 이 책도 꼭 중쇄를 찍었으면 좋겠습니다."
9788959197309,10,사실감있고 재미있고 감동도 있는 만화네요. 책을 좋아하기에 책 한권이 나오기까지의 스토리가 흥미롭고 가슴에 와닿습니다. 소재도 독특하고 매우 흥미로운 책인 것 같아요.
9788959197309,10,"인생을 바꿀 수도 있는 책.생각하지 못했던, 일본 출판계의 책이 출판되기까지 면면을 만화로 쉽고 재미있게 그려가고 있는데 유도선수 출신이 출판업계로 뛰어든것도 재미있었다, 에피소드 속에 치열하지만 열정 보기도 하고, 한편으로는 유쾌하다.˝팔린게 아니라 내가 판거다˝ 이런 감동이라니."
9788959197309,10,"방심하다 몇 군데에서 울컥하고 말았다. 일이 뭔지, 사람이 뭔지 깨닫게 해주는 만화. 아무큰 눈물주의보 발령!"
9788959197309,10,재미있어 보이네요. 한 번 읽어보고 싶습니다.
9788959197309,10,공감대를 키울수 있는 좋은 책인것 같습니다. 정말 좋네요!
9788959197309,10,"어떤 마음으로 책을 만들고, 나아가서는 어떤 마음으로 일을 하고, 어떤 마음으로 살아가야 하는지를 돌아보게 만드는 책. 책을 덮고 판권에 적힌 이름들을 하나하나 읽어 간다. 원기옥처럼 운을 모아야지. 그리고 그 운을 어떻게 써야 하는지도 제대로 결정해야지."
9788959197309,10,유도선수 출신이 만반의 준비로 출판사 면접을 보는데 한 남자에게 한눈에 조직에 가장 적합하지 않은 타입리라고 들켜서 불합격받는 씬으로 시작하는데... 흥미있네요. 그림체도 수채화를 입히면 분위기가 참 고상스럽고 그림도 시원시원하고 괜찮네요.
9788959197309,8,정말 신선합니다
9788959197309,10,대형출판사 만화편집부에서 벌어지는 인생과 열정. 만화라서 더 재미있게 읽을 수 있는 책
9788959197309,10,한국과 많이차이가나는거같내요
9788959197309,8,일본 책 문화의 규모는 단지 인구수에 비례하는 정도가 아니라 그 이상으로 많이 차이나는 듯...
9788959197309,10,꼭읽어보고싶네요
9788959197309,8,읽어보고 싶네요..
9788959197309,10,처음 주인공이 회사에 들어가게 되는 계기부터 재밌네요
9788959197309,10,"주로 일서읽는 분들에게 일본출판계 취업~업무등을 볼 수 있는 만화입니다. 물론 모든 일본 출판사가 이 만화와 반드시 동일하지 않지만, 일본의 책 마케팅/엽업에 대해 조금이나마 알 수 있습니다"
9788959197309,8,소개글만 봐도 기대되네요 재밌을것 같습니다
9788959197309,10,만화에 대해 관심이 많은 아이와 함께 읽는 책이 된 [중쇄를 찍자] 일본 만화지만 한국의 출판계도 마찬가지일 것 같습니다.
9788959197309,8,제목이 뭔가 했는데 너무 재미있어보이네요. ^^
9788959197309,10,재밌는 설정   책 좋아하는 사람이라면 누구나 관심가지는 ｀책 자체｀에 관한 이야기. 사람의 흥미를 끌 수 밖에 없는 책이네요.
9788959197309,10,출판사 만화편집부라는 공간이 궁금해지는 책입니다. 빨리 보고 싶네요. 기대됩니다><출판사에 일하는 친구에게 추천해주고 싶은 책입니다.
9788959197309,10,만화라서 더 재미있게 읽을 수 있을 거 같아요
9788959197309,10,"아내가 요즘 이 만화가 핫하다고 해서 어제 퇴근 후에 1,2권 내리 읽었습니다. 재미있네요, 진짜. 주변에도 권하고 싶은 책이었습니다. (3권은 언제?)"
9788959197309,10,만화인데도 약간의 감동과 교훈이 있다.빨리 다음책이 보고싶다.
9788959197309,8,"여자 유도선수 출신 주인공이 출판사 만화편집부에 들어가면서 겪게 되는, 어엿한 편집자가 되기위한 그녀의 뜨거운 업무열전을보여주는 만화."
9788959197309,10,책이 유쾌하면서 흥미진진한 이야기로 웃음을 줍니다~!! 편집부 이야기라 기대됩니다.^^
9788959197309,10,한 권의 책이 어떤 과정을 거쳐서 독자에게 도착하는지 보여주는 책이네. 게다가 재미있는 사건사고들로 웃음이 납니다! 앞으로가 기대되는 책이네요.
9788959197309,10,책을 좋아하는 사람에게 책을 만드는것에 대한 책은 또다른 신선한 재미를 주죠. 기대되네요
9788959197309,10,"웃음 , 현실감 두마리의 토끼를 잡았네요. 기대되는 책!"
9788959197309,10,꼭 중쇄를 찍어주세요!
9788959197309,10,유도선수출신인 주인공이 만화편집부에 취직하다니... 뭔가 사연이 있는거겠지요?ㅋㅋㅋㅋ소개글이 굉장히 유쾌합니다!
9788959197309,10,만화편집부에 배치된 주인공에게 예상밖의 일이 벌어지는 스토리입니다. 정말 흥미롭고 출판사에 관심 있는 모두가 읽어볼 만한 책이에요
9788959197309,10,줄거리부터 굉장히 흥미롭네요 만화 편집부의 일상이 과연 어떨까 궁금합니다. 그들이 어떤 일을 하고 어떤 생각을 하고 사는지 마치 들여다보는것과 같은 느낌을 받을 수 있겠지요
9788959197309,10,만화를 볼때마다 만화가도 대단하지만 편집부에 일상도 궁금했는데 편집부를 소재로 해서 좋을것 같에요. 꼭 구매하겠습니다
9788959197309,10,한국이였으면 고소감이였는데 (쓸데없이 자존심만 높음) 일본의 인재 발굴 정신 부분에서는 본 받아줄 합니다.(정치가 하류인건 변함 없음)
9788959197309,10,일본 만화의 소재는 정말 생각지도 못한 걸 만화로 만든다는 느낌이 있는데 이 만화가 바로 그러합니다. 유도선수 출신의 주인공이 만화 편집부에 입사해 벌어지는 에피소드들이 유쾌하면서 눈물나는데 뭔가 열정적이고 격렬하다라는 느낌도 받았습니다.
9788959197309,10,간만에 볼만한 만화책이네요~ 직장인들에게 추천합니다!
9788959197309,10,올해의 만화책
9788959197309,10,중쇄를 찍을 수 있다는 것은 읽히는 책을 출판했다는 것이다. 책이 대중에게 호소력이 있으려면 물론 텍스트의 매력이 기본이지만 그 외에도 많은 사람들의 땀과 열정이 필요하다. 이 책은 만화제작 과정을 통하여 이를 실감나게 그려낸다.
9788959197309,10,치열한 직장인의 이야기를 들을 수 있겠네요...
9788959197309,10,사람이 세상을 바꾼다! 정말 명언이군요. 직장인이나 취준생에게 꼭 읽어봐야할 책이에요.
9788959197309,10,출판사라는 배경을 통해 인간을 알아가는 만화? 지루할 것 같지만 지루하지 않을 것 같은 기대를 하게 만드는 책이네요
9788959197309,10,무엇과도 바꿀 수 없는 한 인간의 삶의 이야기네요.
9788959197309,10,"사람이 세상을 바꾼다,  출판사의 배경으로 했지만  사람이 사람을 바꾼다는 내면의 가치를 알게 해주는 만화일 것 같네요"
9788959197309,10,출판사업계에 대해서 조금이나마 간접적으로 경험해 볼 수 있는 책인 것 같아요. 또한 직장인들의 애환도 엿볼 수 있을 것 같습니다.
9788959197309,10,어릴 때부터 좋아하는 만화. 게다가 출판사를 배경으로 하는 이야기. 게다가 만화편집부라니 쭈욱 완간까지 얼른 다 나오면 좋겠어요. 일본만화지만 직장인들의 힘든 모습들과 삶의 현장을 생생하게 볼 수 있는 책이라 더 반갑네요.
9788959197309,8,한때 만화를 공부한 사람이라 더욱 흥미가 가는 책입니다.실제의 만화 편집부와 비교해 가면서 봐도 좋을 것 같고.책이 만들어지는 과정도 같이 볼 수 있어서 더 좋을 것 같네요.
9788959197309,10,요즘 출판업계 경기가 않좋은데 이 책을 통해 출판에 대해 배우는 계기가 될듯 하네요
9788959197309,8,출판계가 다소 미화된 듯하지만 재미는 있습니다. 표지 캐릭터가 귀여워서 순정만화라고 생각하고 책장을 펼친 후 접한 그림체에 놀라서 하나 감점입니다.상관은 없지만 이책은 나온지 얼마안된 만화인데도 무슨 100자 리뷰가 이렇게 달린 것인지..깜짝 놀랐습니다.
9788959197309,10,출판업계의 전반적인 모든것을 알수있네요..너무 재미있을듯 합니다.
9788959197309,10,소개글만 봐도 흥미진진할거같은 스토리네요~만화라서 더 기대가 됩니다.
9788959197309,10,책의 인기 여부를 가늠하는 중쇄(추가인쇄)는 작가의 인기수명과 아주 밀접한 관계가 있다고 생각됩니다.
9788959197309,10,마치 현장에 와 있는 듯한 느낌이 생생하게 전달되네요. 흥미로워요
9788959197309,10,많은 사람들이 공감할 수도 있는 내용으로 흥미진진하게 이야기가 전개될 것 같아요 자신이 했던 분야와 전혀 다른 분야에서 새로운 도전을 하는 모습에 대한 책같아서 꼭 읽어보고 싶습니다!
9788959197309,10,"만화출판업계에 대한 지독한 일상을 그려내고 있는데, 너무 진지하지도 않고 신선합니다."
9788959197309,10,"궁금증을 자아내게 하는 책이네요.만화에 대한 만화, 기대됩니다."
9788959197309,10,좀처럼 보지 못한 소재를 가지고 참 재밌게도 그렸네요. 재밌어요.
9788959197309,10,만화 출판에 관한 만화라니 신기하네요. 중쇄를 찍길 바랍니다!
9788959197309,10,만화로 보는 출판기인것 같네요. 일본만화는 정말 소소한 소재을 어쩜 그렇게 맛깔스럽게 엮어내는지 읽을때마다 감탄하게 됩니다. 만화를 좋아하는 저로서는 꼭 읽어보고 싶은 책입니다.
9788959197309,10,책이 어떻게 출간이 되는지 전반적인 모든것들을 체험할수 있어서 좋네요
9788959197309,10,일본책은 독특한 매력이 있는것 같습니다. 일상의 소재를 특유의 유머를 섞어 잘 풀어낸는것 같아요. 한권의 책이 만들어져서 독자의 손에 전달되기까지의 일련의 과정을 어떻게 만화로 표현되었는지 정말 궁금합니다.
9788959197309,10,유도선수 출신의 출판사 업무열전! 강렬하고 재밌을 듯 해요!!
9788959197309,10,출판업계에 관해 알게되어서 좋았는 책입니다.
9788959197309,6,"9/1, 9/2 사이에 갑자기 많은 100자평이 올라왔군요. 이유는? 책은 재미있을 수 있겠지만."
9788959197309,10,만화편집부에서 일어나는 일들과 그 안의 사람들의 이야기가 유쾌하네요
9788959197309,10,한권의 책이 나오기까지를 유쾌하게 그려낸 책이다. ㅎㅎ
9788959197309,10,"유쾌하네요. 최근 청년실업이 시대의 화두가 되었는데, 너무 심각하지도 불편하지도 않게 이야기를 잘 구성한 것 같습니다. 기대됩니다."
9788959197309,10,"저는 작년까지 출판사에서 근무했습니다 ㅎㅎ 저에겐 정말로 흥미가 유발되는 책입니다. 얼마나 많은 내용이 공감이 될지, 정말정말 기대됩니다!"
9788959197309,10,상당히 유쾌할것 같은 내용의 책인것 같아요 여주인공이 유도선수인것만 해도 상당히 색다르네요~~
9788959197309,8,제목부터 흥미롭습니다.
9788959197309,10,만화 속에 내용이 읽을 거리가 있어서 재미있겠어요.
9788959197309,10,만화편집부의 일상이 고스란히 녹아있어 무척 흥미롭습니다.
9788959197309,10,유쾌한 이야기 기대됩니다.
9788959197309,10,책이 한 사람의 손에 떨어지기까지 거치는 무수한 과정들과 그일에 투입된 수많은 사람들이 보여주는 치열함이 어떤것인지 보여주는 책인거 같아요
9788959197309,8,특이한 소재인 것 같은데 몰입도와 구성이 상당히 좋은것 같습니다.
9788959197309,10,만화편집부에서의 고군분투기 무척 흥미롭습니다
9788959197309,8,만화책이 만들어지고 출판되어 소비자에게 도달하기 까지의 과정이 흥미롭게 전개 되네요.
9788959197309,10,"이 세상엔 내가 모르는 장소에서 더 유용하고, 어려운 일을 하는 사람이 많다는 것을 일깨워 준 교훈적인 만화였습니다. 웃긴 이야기 전개에 많이 웃게되는 것은 덤입니다."
9788959197309,10,새로운 주제로 시작되는 새로운 이야기! 정말 재미있겠습니다!
9788959197309,10,만화 출판이라는 독특한 소재를 진지함을 잃지 않으면서 또 재미있게 잘 표현한 것 같다. 이런 것도 만화의 소재가 될 수 있다는 그 자체도 신기할 따름.
9788959197309,8,만화 출판에 얽힌 뒷 얘기들이 재미있는 만화로 나왔군요. 기대됩니다.
9788959197309,10,독자의 입장에서 책은 어떻게 만들어지고 유통되는 지 궁금했는데 재미있게 그 사실을 접할 수 있겠네요.
9788959197309,10,재밌네요. 1판 10쇄 이런거 책 뒤에 있는걸 많이 봤는데 그게 중쇄 였군요.
9788959197309,10,진짜 중쇄 찍고 싶어요.
9788959197309,8,실제책을만드는출판사이야기 사실감넘쳐서그속사정궁금하네요
9788959197309,10,"업어치기 한판과 합격통보, 뭔가 생각지못한 유쾌한 연관. 그속에 만화 만드는 이야기가 어떻게 나올지 기대됩니다."
9788959197309,10,"유도선수의 출판사 출근이야기라니, 생각 외의 조합입니다. 줄거리를 보자마자 웃음부터 나오지만 치열한 현장의 뜨거운 업무열전이라니, 현재의 우리와 다를바 없는 직장인의 모습을 그리고 있을 것 같습니다."
9788959197309,10,출판사에 출근하게 된 주인공의 고군분투기.일독을 권합니다.
9788959197309,8,출판사의 일에 대해서 재밌게 알 수 있을 것 같습니다.
9788959197309,10,작가 본인이 겪거나 들었던 이야기를 재구성했다는 느낌도 들어서 흥미진진하게 볼 수 있었습니다. 치열하면서도 유머러스한 ｀중쇄｀전쟁... 매우 흥미롭네요!
9788959197309,10,직장인들에게 아주 유익한 도서가 될듯합니다.출근길에 읽으면 좋을것 같네요
9788959197309,10,출간 예고 떴을 때부터 기대가 컸는데 기대한 것 그 이상으로 좋습니다. 한 권의 책(정확히는 만화)이 제작되는 과정을 이렇게 박진감 넘치게 그려낼 수 있다니 놀라워요. 오랜만에 뒷맛이 개운한 만화를 보았습니다. 부디 많은 분들이 보셨으면!
9788959197309,10,"웃을 준비를 하고 봤는데, 슬쩍 슬쩍 눈물이 -.ㅜ만화를 만드는 사람들에 대한 만화까지, 이렇게 다양한 소재를 다룰 수 있고 또 그게 충분히 팔릴 수 있는 토양이 부러워졌다. 어쨌든 국적불문 좋은 책이니 국내판도 어서 중쇄를 찍읍시다!"
9788959197309,10,"아... 이거 그냥 재밌기만 한 책이 아니잖아!! 책만드는 사람들이기 전에 한 명의 독자, 한 명의 책덕후인 이들과 상품인 동시에 그들의 ｀마음｀이기도 한 책.. 책을 대하는 태도에 관한 이야기. (다 읽을 때까지 감동이 몰려와 몇 번이나 숨을 골랐는지 모름) 강력추천!"
9788959197309,10,"일하는 사람들의 이야기는 역시나 흥미진진하다. 역동적인 인물들의 모습에 나도 모르게 힘이 불끈 솟는다. 출판뿐만 아니라 모든 신입이라면, 아니 모든 일하는 사람이라면 가슴에 ｀한 방｀을 맞게 될 작품."
9788959197309,10,"국내판은 중쇄를 며칠만에 찍을지, 관전 포인트! 명대사가 넘친다!"
9788959139484,8,생활툰을 그리는 작가 직업은 어떨까 생각해봤다. 출퇴근 안해도 되고(왕부럽) 하루하루가 만화로 기억되니 참 좋겠다. 나와 주위 사람이 귀여운 이모티콘도 되고 재밌겠다. 근데 별일 없는 하루를 보내면 만화 소재가 없다는 생각에 잠들 때 괴로울 것 같기도 하다. 진작가님을 보며 해본 허튼 생각ㅎ
9788959139484,10,웹툰으로보다가~~소장하고싶어서~~구매했습니다~ㅋㅋㅋ 넘넘 잼나고~~즐거운내용~~우울한날에보면 힐링도 되고~~^^ 아주아주 좋습니다~^^
9788959139484,4,재미도 없고 감동도 없는 너무나 개인적인 내용들로 엮임딱 무료 웹툰정도의 내용구매하고 되게 오랜만에 실망감을 안겨 준 책
9788959139484,10,처음으로 김진 작가님 책을 샀는데 책의 질과 내용이 너무 좋았습니다 중간중간 웹툰에는 없는 내용이 추가로 있었는데 그 부분에는 김진작가님의 섬세한 독자에 대한 마음이 있었는데 같습니다다른사람에게도 이 책을 꼭 추천하고싶네요
9788959139484,10,김진작가님 웹툰 보면서는 꼭 먹는게 당기는 그런맛이랄까요 무튼 그런게 있어요 ㅋㅋㅋ 전부터  다른 작품을 보고 또보고 필랭님이랑 나래님이랑 몽고 가셨던 기행? 만화도 잘봤구요 이번에 이것도 많이 기대되요!
9788959197187,8,"이 역시 익숙해진다. 다소 지루하게 늘어지고 있다. 작가에게 큰 변화이고 중요한 일인 것은 충분히 인정. 그러나 이제 출산으로 이어지니, 다시 기대할 수 있겠지."
9788959197187,10,어쿠스틱 라이프 보면 마음이 따뜻해지는 것 같아요~쌀이도 너무 귀엽구요 ㅎ전권 소장을 목표로 구입하고 있어요 ^0^대충 그린 그림 같은데 막상 따라 그릴려면 어려워요 ㅎ 다음 웹툰에 연재하고 있으니 참고하세요~
9788959197187,6,마찬가지 편하고 쉽게
9788959197187,10,난다님 어쿠스틱 라이프. 웹툰으로 즐겨보고 있어요.  항상 단행본 나오길 기다립니다.
9788959197187,10,난다님! 언제나 즐겁게 보고있어요 ^~^
9788959197187,10,그냥 좋아요
9788959197187,10,"한군, 난다, 쌀이가 계속 행복하길 바랍니다. 랜선이모드림."
9788959197187,10,어쿠스틱 라이프1권부터 읽어왔는데 역시 생활만화는 이만한게 없는 것 같아요. 매우 공감되면서 소소한 웃음거리가 가득실려 있어서 너무 즐겁게 읽었습니다.
9788959197187,10,넓고 외로운 세상에서 혼자가 아닌가 하는 생각을 하게 해주는 것 같아요.사소한 에피소드들이 너무 비슷해서 누가 우리집에 씨씨티비 달았나 싶을 정도입니다.사람사는 건 다 같은가 보다 그런생각을 들게 해주니까 마음이 따뜻해지는 것 같아요
9788959197187,10,유쾌한 부부의 평범한 이야기
9788959197187,10,내 이야기를 쓴 것과 같은 자연스러움
9788959197187,10,난다님을 다이스키하기때문에^0^~!~!~!~!~!`21`
9788959197187,10,따스하게 웃겨요. 이런 결혼생활을 하고 싶어요.
9788959197187,10,따뜻하고 좋아요!
9788959197187,8,깨알같은 삶의 재미를 일깨워준달까.. 좋은 느낌의 만화입니다.
9788959197187,10,말이 필요없게 재미있는책~
9788959197187,10,공감을 느끼게하고 소소한 감동을 주는 책이다.
9788959197187,10,소박하게 재미있으면서 여러 가지 생각을 하게 합니다. 일단 결혼장려만화라는 점에서 강추.
9788959197187,10,귀여운캐릭터들과 순수한 마음들이 들리는책
9788959197187,10,재미있고 공감이 많이 되는 만화에요
9788959197187,10,잔잔하면서도 일상속에서 행복을 얻을 수 있다.보고나면 내 주변들이 소중해진다.
9788959197187,10,마음이..따뜻해져
9788959197187,10,따뜻해요~ ^^ 즐겁게 보고 있습니다. 작가님 화이팅!
9788959197187,10,팬입니다
9788959197187,10,"난다 작가님은 언제나 시크한 척 하지만, 사실은 대단히 감성적이다.그 감성은 만화 여기저기에서 쉴 새 없이 튀어나오는데,그게 항상 공감이 가면서도, 한 편으로는 그것을 '쿨하게, 아무렇지 않은 척' 표현할 수 있는 묘사의 디테일함이 언제나 부럽다."
