ISBN13,rating,review
9788974574352,6,영어문법 공부하는 데 도움되는 것 같아요. 학년별로 볼 수 있어서 좋아요.
9788974574352,8,"문법이 쓰기다, 이렇게 생각해본 적이 없었는데, 흥미롭네요"
9788974574352,10,영어 쓰기를 통해서 문법을 익힐 수 있다니 그 공부방법이 참 효과적이라고 봅니다. 이 책을 꼭 한번 보라고 추천하고 있습니다.
9788974574352,10,문법을 체계적으로 익히는데 도움이 되겠어요
9788974574352,10,개념과 규칙 습득부터 서술형 문제 풀이까지 체계적으로 학습할 수 있어서 좋아요.
9788974574352,10,공부공부
9788974574352,10,진짜 중학 영문법!! 공부에 많은 도움이 될 듯 합니다..기대됩니다~~
9788974574352,10,중학교 영문법 공부에 도움이 잘 됩니다
9788974574352,10,한국어도 그렇고 영어도 그렇고 문법이란게 배우기 어려운데 알기 쉽게 나와있네요.
9788974574352,10,영문법이 영어문장을 구성하고 있고 쓸 때도 영문법이 필요학 때문에 배워두면 나중에 도움이 될 것이라고 생각합니다.
9788974574352,10,중등 문법에 대한 책입니다. 생각보다 매우 어렸고 힘듭니다.
9788974574352,10,영어의 기본인 영문법을 제대로 배우는 시간이 될  것 같습니다.
9788974574352,10,중학교 2학년 학생들에게 필수적인 영문법을 익힐 수 있게 하여 영어 실력을 상승시키는게 도움을 주는 책같아 기대됩니다.
9791162401651,10,꼭 알아야 하는 핵심적인 것들을 연습하기 좋은 책.풀이 설명도 구체적이라 좋네요.
9788928326624,8,적립금 사용을 하게 해 주어서 고맙습니다.
9788959904525,10,개념 설명이 잘되어있고 문제들을 많이 풀어보며 체크할수 있어서 좋았어요. 만족스러운 교재예요.
9788959904525,10,중학국어 문법을 체계적으로 학습해보며 다양한 문제 풀이를 통해 실력을 키워볼 수 있어 좋았습니다.
9791125312352,8,"이제 시대가 많이 바뀌어서, 영어를 이해하는 데에 많은 머리를 쓰지 않고 언어를 이해하게 만드는 기술이 필요하게 되었다. 언어는, 내 생각에는, 생각에서 만들어지는 것 같은데."
9791125312352,10,쉽게 설명되어 있습니다
9788959902705,10,단계별 학습 시스템으로 중3 국어 교과서 필수 어휘 375개를 25일에 완성할 수 있어요표제어를 학습하고 다양한 유형의 확인 문제를 통해 반복하면서 학습해요개념어 적용 문제로 국어 시험 맛보기를 하면서 내신대비는 물론 수능까지 연결돼요마지막으로 5분 테스트북으로 확인해요
9788959902705,10,중학국어 어휘 실력을 단계별로 알차게 학습해볼 수 있게 도와줍니다.
9788959902705,10,감사합니다.
9791125941255,10,아이가 과학에서 물리영역을 어려워해 고민중이었는데  주변에서 esc를 추천해주더라구요. 문제집을 받아보고 저도 주변에 추천중입니다
9791125941255,10,학년구분없이 중학 과학을 4개영역별로 각각 한권으로 핵심개념과 다양한문제를 쉽고 빠르게 공부할 수 있도록 구성되어 중학교 1~3학년과 고등학생까지도 단기간 과학을 빠르게 공부하고 싶은 학생들에게 강추^^
9788968061066,10,천일문과 함께 활용하고 있습니다.천일문도 워크북이 따로 있어 충분한 문제활용이 되지만 거침없이라이팅으로 서술형을 따로 공부할 수있어 탄탄한 중등영어의 기초가 됩니다.
9788992476041,4,기초없는 학생이 혼자 공부하기에는 별로네요.강의를 무료로 볼수 있을지 알았는데 강의가 12만원이란걸 알고 헉했어요.단순 문장구조 암기하는 문제집인듯해요.
9788992476041,10,지인 소개로 구매합니다. 아직 풀어보진 않았지만 좋을거 같아요.
9788992476041,10,방학때 문법 다지기로 활용할 계획입니다. 문장 외우기와 문법을 함께 좋습니다.
9788992476041,10,공부할려고 샀는데 배송도 빨리오고 책상태도 깨끗해서 맘에 듭니다~~
9788992476041,8,천문장임
9788992476041,10,영작도 연습할 수 있고 mp3 파일도 무료로 제공돼서 공부하기 좋은 책이다. 중등부터 기초를 다지고자하는 고입 전 학생까지 골고루 쓸 수 있는 책.
9788992476041,8,열심히 공부해 보자
9788992476041,10,기초를 다지기에 좋은 책입니다
9788992476041,10,1001개의 문장만 알아도  문법이 저절로 되는 책 같네요 쉬우면서 이해가 잘되네요......
9788992476041,8,영어에 기본으로는 아주 좋아요.. 적금추천합니다.
9788992476041,10,넘 좋아요. 아이들이 문법 이해하는데 쉽게 다가갈수 있도록 도움이되는 책
9788992476041,10,"문장 하나하나 공부하는게 어렵지 않고, 꾸준히 한다면 참 좋은 교재같아요^^"
9788992476041,10,"간단한 문장이지만 꼭 필요한 내용만 담았어요.
기초를 다지기에 좋습니다~~"
9788992476041,10,학생 과외용으로 구입했습니다. 예문으로 하는 영어공부! 아주 마음에 드는 책입니다.
9788992476041,6,대표 문장을 외우면 쉽게 문법을 익힐 수 있어서 좋아요.
9788992476041,10,항상 영어가 어렵게 느껴지는데 기초를 잡아서 한단계 업그레이드 하고 싶네요
9788992476041,10,영어 기초를 잡기에 좋은 책인것 같습니다. 천일문 사길 잘했네요^^*
9788992476041,10,중학생 과외 수업용으로 샀어요. 정리가 명확하게 되있고 개인적으로 강추에요
9788992476041,10,천일문 소문이 자자하던데.. 열공해보려구요!
9788992476041,10,하기 쉽고 기초하기에는 좋은책인거 같아요.
9788992476041,10,이거 저도 삽니다. 너무너무 좋다는 소문이 계속 돌아요
9788992476041,10,좋은거 잘 모르겠던데. 일반 시중 문제집이랑 비슷한듯.
9788992476041,8,열공하기좋은 서적예요
9788992476041,8,정말 좋다~
9788992476041,10,좋단 얘기만 들었지 막상 공부해보니 영어정복한 느낌?!
9788992476041,10,쉽게쓰여져서 혼자 공부하기에좋네요 문법처음접하는 초중에게 좋을듯.....
9788992476041,10,"역시 김기훈샘 강의 교재 !
쉽게 잘 되어 있네요 ."
9788992476041,10,책 내용이 좋음
9788928328826,10,국어의 어원과 훈민정음의 창제원리를 이해하고 문법을 이해하며 공부할 수 있게 도와줘서 좋아요.
9788928328826,10,문법이론에 대한 자기주도학습에 용이하다.
9788928328826,10,어려운 문법을 아이들이 보다 재미있게 배우네요
9788928328826,10,국어 문제집 풀기도 바쁜 아이들에게 국어 문법 문제집까지 풀라고 하기에는 너무 버겁지 않을까 했는데 하루 분량이 많지 않아서 쉬어가는 타임에 풀기 좋고 문법 하면 어려울것 같고 좀 지겨운 느낌이지만 구성과 해답의 친절한 설명으로 쉽게 다가갈 수 있을것 같아요.
9791162400531,10,다른 좋고 유명한 것들 많지만 이 책의 장점은 내용이 자연스럽고 지면 구성이 눈에 편하다. 너무 빽빽한 책은 특히 중학생에게 보기 힘들 수 있다. 가능하면 3학년까지 같이 구비해 두길 추천한다. 전체적인 내용을 보는게 중요하다. 사실 문법은 중학과정에서 거의 끝난다.
9788968061059,10,영어 문법을 분석적으로 접근하여 빈틈을 매꿔준다
9791125924425,10,유형 해결의 법칙 중학 수학 1-1 교재는 낮은 계단으로 출발하여 계단의 높이가 높아지면서 학습 근육의 힘을 키울 수 있어요. 성취감의 크기도 함께 키워지니 스스로 학습의 기본을 단단히 해준다고 생각해요. 중학교 학습교재로 추천합니다
9788968060533,10,신속 정확한 배달 감사합니다.
9791164743971,10,"수능맛보기 교재라, 더 궁금하고 빨리 수업하고 싶었습니다.리더스뱅크 시리즈를 늘 만족해하는 학생들에게,역시나 수능맛보기도 성공적이였어요^^적정수준의 난이도에,더욱 업그레이드된 지문과  다양한 문제유형까지~학생들이 더 만족해하는 교재입니다^^"
9788928328802,10,"이번에 어떠한 계기로인하여 신청하여몇달동안 해본결과실제로 학업성적에 도움이 되었다취약한부분을 보조해주는 역할과문제를 보기보다 쉽게 접근하기 쉽게해주어거리낌없이 이용할 수 있었다솔직히 내 입장에선 아직 어려운부분이많아""아, 많이 어렵겠구나 ""이런생각이 먼저 나왔지만위에 하였던 말과같이 직접 풀어보면서차근차근 도와주는 느낌을 받았었다초반엔 약간 어렵다 생각할수도 있지만풀다보면 확실히 늘어나는 느낌이든다"
9788928328802,10,비문학 독해 공부의 스킬을 배울 수 있네요
9788959904853,10,"중학수학 개념을 제대로 배울수 있는 교재예요. Q&A스토리텔링 수학학습으로 재미나게 개념을 익히고 다양한 자료들, 문제들을 통해 수학 실력을 향상하는데 도움이 되는 교재라 매우 만족스럽습니다."
9788959904853,10,"중1 때부터 개념서로 책읽듯이 계속적 반복으로 개념익히기에 좋은 교재입니다. 개념서이긴 하나 기본 수준이 아니라 수학적 감이 조금이나마 있는 아이들이,초등 고학년에서 심화서 접한 친구들이거나 독서틀이 잡힌 아이라면 괜찮은 참고서지요. 문제는 기초수준은 아니니 교재구성을 본 후 구입권합"
9791157523658,10,"설명이 간단하게 되어있지는 않아서 초보자분들은 접근하기 어렵겠습니다만, 말 그대로 중급용으로는 참고하기 정말 좋습니다! 예문도 많이 있구요! 영어는 아무리 이론을 알고 있어도 예문으로 공부하지 않으면 금방 잊어버리는데 거의 대부분의 이론관련 예문이 있어서 좋습니다!!"
9791157523658,6,학원구매용으로 샀어요
9791157523658,6,친구가 추천했어요. 설명이 쉬웠으면 좋겠어요.
9791157523658,10,마무리단계로 구입합니다.
9788900454499,10,"기존의 다른 내신대비 문제집과 콘텐츠 구성은 유사합니다. 장점이자면 장점이고, 단점이자면 단점이라고 할 수 있겠네요. 문제수는 적지 않는 편입니다. 디자인이나 배열부분이 아주 좋습니다."
9788900454499,10,특급기출 중학 영어 3-1 (이병민) 은 내신대비를 위해 구입했습니다. 교과서와 동일한 출판사에서 나온 교재라 더욱 믿음이 갑니다. 단어부터 본문에 이르기까지 충분히 연습할 수 있도록 구성되어 있으며 시험 대비 문제량도 많아서 좋습니다.
9788900454499,10,단어 학습후 테스트 하게 연습문제가 있고 그 후에 단어 이용 실전 문제를 풀어 보게 함.주요 문장반복적으로 강조 해주는 표현을 요약해 놓았고 빈칸 이용 학습후 실전 문제 풀이 함. 단원에서 다루는 문법을 정리한후문제풀고 중학시험 대비 가능하게 함
9788900434989,10,"무엇보다도 책의 크기가 아주 딱맞는거 같아요! 개념도 상세히 나와있고 사진이 큼직하고 보기 쉽게되어 있는 점 아주 좋구요 1,2학기분량이 한번에 있는게 가장 좋은거 같아요!"
9788900434989,8,"개념 설명부터 심화 문제까지 단계적으로 구성된 문제집입니다. 1,2학기 내용을 담고 있고 문제 자체도 많다보니 과학은 싸플 한권이면 충분히 대비할 수 있을 것 같습니다. 문제도 서술형 문제부터 개념을 변용시킨 다양한 문제들과 시험대비서까지 있어서 든든합니다."
9791162275702,8,선행용으로 가볍게 풀어보기용 좋아서 아이들이 큰 부담없이 접할수 있어요. 연산관련 문제집과 병행하는게 좋을듯하네요
9788928329823,10,초등학생이 중등선행할 때 꼭 추천해주고 싶은 책!베이직쎈은 중학교 기본 연산   개념   그리고 쎈에서 심도있고 다루고자 하는 기본 유형을 모두 만나볼 수 있어요. 이것 저것 여러 문제집 사 보신 분들은 아마 베이직쎈 구성보고 놀라실 것 같은데요.저도 시행착오 끝에 베이직 쎈 정착합니다!
9788928329823,10,"개념에 대한 설명이 아주 쉽게 되어 있고, 반복해서 문제를 풀면서 개념을 잡을 수 있습니다.문제가 단계별로 구성되어 있어 개념을 잡고 문제를 응용하기까지 체계적으로 습득이 가능합니다."
9788900442595,10,강남인강 교재이고 내신대비용으로 좋습니다
9788900442595,8,잘받았습니다. 수업전에 쉽게 풀고 이해하는데 도움이 될 거 같아요잘받았습니다. 수업전에 쉽게 풀고 이해하는데 도움이 될 거 같아요
9791162401668,10,고등학교 올라가기 전 기초 베이스를 만들기에 적절합니다. 유형별로 나눠져 있어서 독해를 좀더 디테일하게 연습할 수 있을 것 같아요.
9788926155356,10,집에서 혼자 공부하는데 개념 설명이 잘 돼 있어서 아이가 좋아해요. 개념탑이랑 개념익힘탑으로 나뉘어 있어서 더 확실히 개념 잡을 수 있구요. 한번에 두권 완북하는 기분이 드는지 그것도 좋아하네요. 문제량이 딱 적당한듯요~
9788926155356,10,투탑수학은 개념북과 개념익힘북으로 나누어져 있어서 공부하기도 편리하네요. 중학수학의 개념을 개념북에서 한 번 공부하고 개념익힘북에서 한 번 더 잡아주니 개념을 탄탄히 해주는 교재입니다.간단하게 유형문제
9788926155356,10,"개념설명이 잘 되어 있어서 연산끝내고 개념서로 학습하기에 너무 좋은 교재에요. 문제유형도 다양하고, 문제를 풀다보면 개념을 다시 한번 익힐 수가 있더라고요."
9788926155356,10,이번 겨울방학때부터  풀고 있는데 개념별로 정리가 잘 되어 있어서 홈스쿨링 하는데 좋습니다.
9788926155356,10,중학수학 개념서로 딱이예요 ~ 개념설명이 잘되어 있어 개념 이해도 잘되고익힘탑이 따로 분리되어 있어 문제도 충분히 풀어볼 수 있어 좋더라구요
9788926155356,10,중등 개념서로 딱인것 같아요.자세하면서도 간단하게 한눈에 들어오는 교재네요중간중간 개념특강에서 한번씩 더 짚어주어 좋네요풀이집도 자세하게 나와있어서 혼자 또는 엄마랑 공부하기 좋은것 같아요
9788926155356,10,디딤돌 투탑 2-1 을 가지고 처음으로 학습해보았는데요..개념설명도 쉽게 되어 있어서 이해하기도 쉽고 다양한 문제로 부담없는 문제분량으로 접할 수 있어서 편하게 접할 수 있는 교재로 차근차근 공부하며 수학 개념도 잡고.. 실력도 쌓을 수 있을 것 같아요
9788928320516,8,깔끔한 구성과 명확한 설명 적당한 양의 문제까지 전체적으로 아주 만족스럽습니다. 특히 서술형대비에 많은 도움이 될것 같습니다.
9788928320516,10,체계적으로 배열된 문제들이 인상깊네요.핵심개념을 보다 빠르게 알 수 있을것 같습니다.
9788928328741,10,"책 구성이 좋아서 엄마가 따로 규칙을 정할필요없이    그냥  바로 아이이게  적용할 수 있어요.  저녁에 단어25개를 외었나 검사만 하면  돼요.  25단어 뒤에 있는  데일리 테스트를 이용해도 되고, 그냥 흰종이에  단어시험쳐도 되고요.  우리 예비중1에게  들어보니 안 지루해서 좋대요.  강추합니다."
9788928328741,10,고학년에게 필수품이 된 영단어책입니다.빈출도순으로 마스터하는 초빈출영단어 중학기본빈출도1순위 300단어-단골단어빈출도2순위 500단어-필수단어빈출도3순위 150단어-확장단어나만의 38일 학습 플래너로 목표와 계획을 세우며 즐거운 영단어 공부가 돼요.미니북과 mp3까지 활용도 최고
9788928328741,10,초등고학년부터 중등친구들에게 유익한 영단어교재입니다.단어연상과 이해에 도움이 되는 그림이 삽입되어 있고 미니븍과 본북 표지에 QR코드가 있어 단어듣기가 가능합니다. 특히나 미니북이 있어 짜투리시간 활용에 더할나위없이 좋네요. 계획표에 맞춰 실천만 하면 어휘실력 쑥쑥 성장할것 같아요
9788928328741,10,영어를 배우면서 다양하고 많은 단어를 접하면 좋겠지만 고학년으로 갈 수록우리 아이들 시간이 없쟎아요? 그러니 빠른시간 내에 꼭 필요한 핵심단어를 외울 수 있는 교재가 당연히 필요하겠죠 초빈출영단어가 딱입니다위 도서를 추천하면서 좋은책신사고로부터 도서를 지원받아 작성하였습니다‘
9788928328741,10,"발음기호와 우리말로 발음이 적혀 있어 자신감을 가지고 공부 할 수 있어요 하루 25단어씩 38일 과정으로 빠른 시간내에 핵심단어를  익힐수 있게 구성되어 있어요. 예문과 유의어, 반의어 그리고 꿀팁과 그림으로 단어 이해도와  연상암기를 높였습니다."
9788928328741,10,"빈도수가 높은 단어순서로 되어있어서(그래서 이미 익숙한 단어들이라 난이도가 어렵지 않기도 해서)잘 나오지도 않고 어렵기만한 단어들 외우느라 힘빼다 초반에 포기해버리지 않을 것 같습니다.보기 쉽게 만든 사전같은 디자인이라 눈도 편하고, 뻔하지 않은 예문들이 이해에 도움됩니다."
9788928328741,10,아이가 어학원을 다니긴하지만 회화나 리딩위주의 학습으로 중학교 학습과는 조금 다른것이 아닌가 하는 불안감이 있었어요. 감으로 단어를 익히고 뜻을 알던 아이에게 복습겸 다지기 형태로 활용하기 좋은거 같습니다. '위 도서를 추천하면서 좋은책신사고로부터 도서를 지원받아 작성하였습니다'
9788928328741,10,"초등고학년부터 중등까지 딱 알맞은 단어장입니다.  단어장내에 단골,필수,확장단어로 구분되어있고 곳곳에 귀여운 이미지들이 쉽게 단어의미를  설명해서 아이가 지루하지 않게  단어암기 할 수 있을 것 같네요~ 강추입니다^^"
9788928328741,10,초5올라가는데 빈출도 보더니 역시 아는 단어가 좀 나온다며 중학 기본이라는 제목에 부담을 느끼지 않고 외워보겠다고 다짐하네요!‘저는 위 도서를 추천하면서 좋은책신사고로부터 도서를 지원받아 작성하였습니다‘
9788928328741,10,중학교 1학년   하루 25단어씩 하면 되는 영어 단어   38일만에 950단어 암기일단 단어가 어렵지 않아서  괜찮았어요  *저는 위 도서를 추천하면서  좋은책 신사고로 부터 도서를 지원받아 작성하였습니다. ˝
9788928328741,10,초빈출 책을 접하고 하나하나 꼼꼼히 책을 살펴보았습니다.첫장을 펼치면 미니단어장이 나옵니다.들고 다니며 암기해도 좋을듯하네요.QR코드가 있어서 듣기도 할수있고 괜찮습니다.38일 플랜으로 자기 주도적 학습도 할수 있을것 같아 좋습니다.‘ 좋은책 신사고에서 책을 제공받아 작성했습니다.‘
9788928328741,10,빈출도 높았던 단어들 보니 초등에서도 배웠던 기본단어들~다시 다지고 넘어 갈 수 있어서 새로운 교제여도 아이가 부담을 덜 느끼며 자연스럽게 시작했어요 매일 할 수있게 분량이 나뉘어 있어서 자기주도 안돼는 아이들에겐 목표 잡기에 딱이예요 저는 위도서를 추천하면서 좋은책 신사고에서 지원
9788928328741,10,우선 책이 3단계로 나뉘어져 있어 아이가 한 권 끝낼 때마다 성취감을 느낄 수 있어서 좋아요. 단어 밑에 발음기호가 나와 있고 그 옆에는 예문이 나와 있어 소리내어 읽으며 단어 공부하기 좋고 QR 코드가 교재 및 부록으로 딸린 암기장에도 있어 이동시 듣기 공부도 할 수 있어 실용적입니다.
9788928328741,10,큐알 코드로 군더더기 없이 단어의 정확한 발음을 들으며 학습할 수 있는 점이 너무 좋아요^^외울때도 듣고 외우고 확인때도 발음 들으며 받아쓰기^^  하며 마무리 가능합시다.책 안쪽에 소책자로 간편히 들고 다닐 수 있게 만들어주시고단어 가름판까지~~ 작은 것까지 신경쓴게 느껴지는 교재네요
9788928328741,10,중학교 올라기기전 영단어 정리하기에 너무  좋은 책입니다. 40일  남짓 투자하면  중학기본 영단어를 머릿속으로 다지고  정리하기에 알차게 짜여져 있습니다. QR코드로 어휘듣기가 가능해  편하고 영단어 미니북에  같이 들어있어  휴대용으로 가지고 다닐수 있게  되어있어 아이도 저도 만족합니다.
9788928328741,10,"예비중이고 엄마표영어로 듣기,읽기만 쭉 해온 아이여서 단어공부를 따로 시키진않았는데 초빈출이라  초등때부터 많이 본 단어들이고 쉽지만 뜻이 여러개인 단어들도 있어서 처음 영어단어공부하는 아이들에겐 좋은 교재인것같습니다. 매일아이 만족도 좋네요."
9788928328741,10,"중1영어교과서 전 종, 듣기평가 5개년 기출.빈출어휘 950개 엄선!하루 25단어. 38일 완성!이렇게 좋은책이 있네요. 이대로 따라해보면 중1올라가는 우리아이 걱정없겠어요.편집이 단어가 눈에 들어오게 깔끔해서 우리아이가 좋아하더라구요.예문과 꿀팁까지!친절한 영단어책이예요.데일리테스트로한번 헷갈리는 단어 체크해주고또 반복해서 외워주는 우리아이.이 단어장이 고마운 단어장이예요.휴대성 너무좋아 가방등 어디에도 쏙넣을 수 있고 외우고 또외우게 해주죠신사고의 초빈출단어정리잘된 영단어장이라 정말 만족합니다.*위 도서를 추천하면서 좋은책 신사고에서 제공받아 작성하였습니다*"
9788928328741,10,책안에 미니북이 따로 있어서 편하고 빠르게 단어를 복습 할 수 있어서 정말 좋아요^^ 빈출도순으로 영어단어가 배열되어 있어 중요한단어가 무엇인지 쉽게 알수 있어서 순서대로 공부하면되니까 좋아요!‘저는 위 도서를 추천하면서 좋은책신사고로부터 도서를 지원받아 작성받아작성하였였습니다‘
9788928328741,10,예비중학생인 아이에게 너무 필요한 책이네요. 교과서에 나온 단어들이라 학교영어에도 도움이 될것같고 qr코드로 매번 어휘듣기를 쉽게 접할 수 있으니 부록으로 들어있는 암기장과 핸드폰 하나면 어디서든 단어공부가 가능하더라구요.흘려듣기로 반복해서 틀어주니 하루25단어가 술술 외워진대요.
9788928328741,10,"QR코드로 좋아요 편해요 ㆍ순서를 따져ㆍ신사고♡ 하루25/38일단어], [단어 뜻], [단어 뜻 예문]으로 구성된 3가지 버전의 MP3 어휘 암기장ㆍ 제공 듣기펑가5개년 기출영단어북!중학기본ㆍ꼬옥외워야하는!‘저는 위 도서를 추천하면서 촣은책신사고로부터 도서를 지원받아 작성받아작성하였였습니다‘"
9788960764583,10,심화용 문제집 처음 사보는데 중3마지막 학기 블랙라벨로 마무리 시키려고 구입해봅니다. 워낙 유명한 문제집이라서 기대중입니다.
9788926157893,10,개념서로 공부한뒤 연산문제집으로 여러가지 유형들을 꼼꼼하게 공부할수 있어서 정말 좋아요.
9788926157893,10,아이가 집에서 예습용 연산교재로 쓰고 있어요 개념을 눈으로 보고 머리로 이해가되게 해놓아서 어렵지 않게 한답니다 쉽게 접근하기 최고예요~~
9788926157893,10,연산문제집이지만 개념이 충분히~ 자세히~ 녹아있네요~ 선행으로 개념과 연산을 준비하기에 딱 좋은 교재에요~
9788900443998,10,"중등 9종 교과서 지문을 바탕으로 단답형, 서술형, 논술형의 다양한 문제가 있어요서술형 답안 작성 능력 기르기에 자신감이 생길듯 합니다.점점 더 강화되는 내신 서술형 평가 대비에 도움되도록 빠작 서술형쓰기로 선택했어요~~"
9788900443998,8,2% 부족한 학생에게 딱 맞는 교재인 것 같아요. 서술형을 잘 못 쓰는 친구들의 특징이  공부를 하기는 하는데 내용을 정확하게 이해하고 넘어가지 않아서 입니다. 교재를 통해 지문 내용을 꼼꼼히 분석하고 문제의 의도를 알아내는 연습을 할 수 있습니다
9791129704863,10,정말 2학년이 되면서 챙겨야 될께 많아졌어요~ㅠㅠ자유학년제>시험 시험을 보면서 제일 조마조마한건 바로 “문법”문장간 법칙을 알아야하는데 알지못하니 풀수있나요 ㅜㅜ 하지만! 중학교 들어가기전 메가 스터
9791129704863,10,예비 중2인데 1단계 하고 2단계 구입했네요~평소 소설은 많이 읽는 편이지만 비문학은 잘 접하기 힘드기에 이렇게 비문학 독해를 꾸준히 하는게 많이 도움이 됩니다. 책 내용도 주제가 다양해 재미도 있으면서 유익하네요
9791125324768,10,서술형 대비에 최적화된 교재
9788928324187,8,선행으로 가볍게 풀어보는데 큰 부담없이 접할수 있어서 선택한 눈제집입니다. 난이도가 낮은편이고 문제의 양이 많지않은편이라 선행용으로 적당한듯해요
