ISBN13,rating,review
9788974574345,10,개념과 규칙을 시각적으로 쉽게 파악할 수 있어 직접 다양하게 변화시켜 보면서 서술형 문제에 대비할 수 있겠네요
9788974574345,10,도움이 되는 내용이네요~기대됩니다^^
9788974574345,10,서술형문제가 요즘 대세라지요문법쓰기 능력도 키운다면 영어에 대한 자신감을 갖을수 있겠네요!!!
9788974574345,10,방법을 알아야 산다.
9788974574345,8,디자인도 예쁘고 참 깔끔하네요.아이들이 공부하기 좋을 것 같아요.
9788974574345,10,어려운 공부 문법이 쓰기다 시리즈로 도움을 받으면 좋을거 같습니다. 기대합니다.
9788974574345,10,쓰면서 읽히면 훨씬 기억이 잘 날 것 같네요 기대됩니다.
9788974574345,10,문법이 쓰기다 !! 1학년꺼부터 기초를 탄탄히 고고!!
9788974574345,10,"도식화, 도표, 문장에서의 오류 등 시각적인 자료들을 통해 문법을 효과적으로 이해하고 활용하는 방법을 배울 수 있을 듯 하여 기대합니다."
9788974574345,10,중학생때 문법 기초를 탄탄히 해두면 정말 좋아요!
9788974574345,8,"개념을 구체적으로 쪼개서 알려주고, 시각화까지 되어있다고 하니, 흥미 있게 문법 공부를 할 수 있겠어요"
9788974574345,8,어릴 때부터 좋은 문법 공부법을 잡아주는 것이 나중에 큰 도움이 될 것 같아요
9788974574345,10,토익은 어느정도해도 쓰기는 어렵더라구요
9788974574345,10,영어 쓰기를 통해서 문법을 익히고 영어의 전반적인 눈을 뜨게 하는 아주 효율적인 공부 방법이 소개되어 있는 책이라고 봅니다.
9788974574345,10,갓 중학생이 된 아이에게 도움이 되겠어요
9788974574345,10,초등학교에서 중학교로 넘어와서 처음 시작하는 영어 문법책이니만큼 기초에 충실한 탄탄한 구성이 마음에 듭니다.
9788974574345,10,중학 서술형을 대비하기 위해서는  문법의 논리적이고 체계적인 정리가 매우 중요하므로 제대로 된 문장 구성력을 위해 필요한 책입니다.
9788974574345,10,중학 영문법 문법이 쓰기다..다양한 문법 활용 공부에 많은 도움이 되겠네요..기대됩니다~~
9788974574345,10,쓰는것이 무엇보다 중요한데 기초부터 쓰기를 중요하게 배우면 많은 도움이될것 같아요
9788974574345,10,중학교 시절을 좋은 작문책으로 시작하는게 얼마나 중요한지 생각했을 때 읽어볼만한 책입니다. 기초를 다지기에 알맞은듯합니다.
9788974574345,10,영문법의 기초를 다질 수 있어서 좋은 것 같아요
9788974574345,10,영문법은 많이 써야 체화되는거 같아요.
9788974574345,10,1학년 때부터 문법에 힘을 줘야 될 거 같아요
9788974574345,10,기초부터 배울 수 있어서 영어 초심자들에게 도움이 된다고 생각합니다.
9788974574345,10,학교 교과서랑 같이 보면 더 효과적으로 공부할 수 있을 것 같아요.
9788974574345,10,중학교 영문법 제대로 배워 영어실력 크게 향상되면 좋겠습니다.
9788974574345,10,"3단계 문제 시스템을 통해 기본도 다지고, 실전에도 바로 쓸 수 있어서 좋습니다."
9788974574345,10,책 구성도 좋고 내용이 알찬것 같아서 추천합니다!
9788974574345,10,문장쓰기에 목표를 둔 문법공부라 더 체계적이네요.
9791125948315,10,아이가 이해하기 쉽게 깔끔하게 개념 설명이 잘되어있고  단원이 끝날때마다 ‘대단원의 핵심 체크‘라고 한번더 짚고 넘어갈수있어 좋습니다
9791162401552,10,기초 준비하기에 좋은 문제집입니다. 개념서로 공부할 때 이해가 안 되는 부분이 많았는데 수력충전하면서 이해도 잘 되고 쉬운 유형 풀이로 시작하니까 잘 할 수 있을 것 같아요.
9791162401552,8,잘받았습니다. 수업전에 쉽게 풀고 이해하는데 도움이 될 거 같아요잘받았습니다. 수업전에 쉽게 풀고 이해하는데 도움이 될 거 같아요
9791125317562,10,기초 다지기에 최적의 교재
9788928324125,10,다양한 실전문제들을 풀어볼 수 있으며 해석 또한 자세하게 설명되어 있어요
9788928324125,10,중1 예습을 위한 기본 개념서로 샀습니다. 개념이 상세한 설명과 함께 실려있어서 엄마와 집에서 함께하는 예습용으로 만족스럽네요
9791164742479,10,"내용도,구성도 알차요^^  초등아이가 독해공부가 잼있다고 하니 뿌듯합니다^^"
9788928327980,10,일요일 전날 시켜서 월요일 낮 도착...배송 엄청 빠르네요...감사합니다
9788928327980,10,"무척 맘에 들어요. 아이에게 연산속도를 높이고자 여기저기 찾아보다가 발견한 책인데 잘 선택했다는 마음이 들어요. 교과과정에 맞는 구성으로 무리없이 할 수 있구요,아이가 연산속도가 빨라졌다고 좋아하네요. 쎈연산 중학 강추입니다."
9788928327980,8,수학문제 푸는 속도가 느리고 잔실수들이 많아서 고민이었는데 쎈연산을 풀고 나니 안심이 되어요! 사실 문제집에 문제들이 단순한 계산 문제 난이도여서 너무 쉬웠어요ㅠㅠ그래서 별 하나 깠어요 조금만 더 난이도 있었으면 좋겠네요!! 다른 건 다 만족해요 특히 앞부분에 있는 학습플래너는 짱짱ㅎㅎ
9788928327980,10,중학 연산.무척 반가워요수학의 가장 기본인 연산초등 연산은 많은데중학교부터 찾아봐도 찾기 어려운데좋은책 신사고에서연산교재가 나왔네요
9791164743957,10,선물하기 좋은 책입니다
9791164743957,10,교재가 구성이 너무알차요.단어미니북도 손안에 쏘옥~들어오고~원어민지문읽어주는 QR코드는 기대이상입니다^^
9791164743988,10,지문이 잼있고 흥미로워요. 독해공부가 하고싶어집니다~^^
9791125312369,10,설명없는 워크북을 찾았는데 만족해요
9791125312369,2,문법 설명이 적어서 전 별로 였습니다....
9791162723937,10,중학 워크북 본책으로는 조금 부족한것을 채워준달까 고마운 책이에요 설명은 없고 문제만 있어요 다들 이책사서 100점맞아봐요~
9791162723937,10,﻿중학영문법 3800제 본책에 이은 워크북기대도 안 했는데 선물같은 워크북이 있었다.본책으로 배운 개념들을 실전에 충분히 적용 해 볼 수 있는 워크북.중간중간 잊어버린 개념들을 다시 찾아보면서 문제를 풀게 되니처음보다 오답률이 줄어드는 것 같다.이 책도 두 번 이상 풀어봐야겠다.
9791129700254,10,바뀐과정 반영되있어서 좋아요. 장풍쌤 역시 1타강사!! ㅋㅋ
9791129700254,10,"5종교과서 분석잘되있고, 개정교육과정 반영이라 좋네요"
9788900454611,10,시험대비에 좋아요. 필수 기출부터 시작해서 실전 모의고사로 마무리까지 해주니 빠지는  문제없이 다뤄줘요
9788900454611,10,중2 중간고사 걱정되었는데 이 책 문제를 풀어보니까 모르는 부분이 보이고 정말 열심히 공부해야겠다는 생각이 들었어요!!
9788900454611,10,중학교 내신대비를 위한 기출예상문제로 학교시험 준비까지 완벽하게 대비해 주니 부담감을 줄일 수 있네요.
9788900454611,10,중학내신대비를 위해서 최신 기출문제를 반영한 유형별 문제들로 중간고사준비하기에 좋은 교재네요
9788900454611,10,10종 교과서와 전국 학교 시험을 분석한 최신 기출로 중간고사를 유형별로 완벽히 준비가능!
9788900454611,10,이제 처음으로 중학교 내신 대비를 해야 하는데 최신 기출 문제로 구성된 이 책이 많이 도움이 될것 같아요. 특히 모의고사 5회는 실전 대비에 아주 유용하게 풀이될것같아 기대됩니다.  ^^
9791125319689,10,좋습니다
9788926157107,10,이미지로 실수할 수 있는 부분이나 궁금할 법한 부분을 짚어주니 쉽게 이해하며 아이 혼자서도 시작할 수 있는 지루하지 않은 중학연산교재예요
9788926157107,10,개념서와 함께 풀기 너무 좋은 문제집이에요. 중학 수학 시작하면서 어려웠던 부분을 디딤돌 연산으로 잘 했네요~~^^
9788926157107,10,"중학수학을 처음 접할때, 학년, 학기, 개념을 처음 공부할때 좋아요. 예비중등 멋모르고 예습했다 수포자 될뻔, 중학연산이 잡아줬어요."
9788926157107,10,중학연산 기본교재로 아주 좋아요
9788926157107,8,초3을 위해 산건데도 아이가 이해하기 쉽게 내용이 구성되어 있습니다. 교과와 병행보다는 선행수업을 위한 연산에 더 알맞아 보입니다. 너무 지루하도록 많은 연산문제가 들어있지는 않습니다.
9788967700591,10,난이도에 맞게 풀면 도움이 될 듯 샆어요..
9788967700454,10,많은 도움이 되어 수학 100점 맞고 행복합니다.  다음에도 또 구매해서 열심히 공부하렵니다 에이급 수학 짱짱 짱 땡큐예요 담사합니다~
9788960764408,10,믿고 쓰는 블랙라벨~중학과정도 나와서 너무 좋아요!심화서의 기본이죠~
9791164743940,10,"표지뿐만이 아니라, 내용도 최신트렌드 지문으로 업그레이드되었내요. 역시 리더스뱅크는 최고입니다^^"
9791164743940,10,중학생 딸에게 꾸준히 풀리고 있는데 아주 좋아요
9788926153017,10,중학수학 개념서로 선택한교재인데요. 개념설명이 아주 꼼꼼하여 놓치는 부분이 없도록 체계적으로 잘 정리되어있어 좋았어요. 익힘탑으로 다양한 문제까지 충분히 복습할 수 있어 개념잡기에 딱인것 같아요.
9788926153017,10,"투탑수학은 개념서인데요최상위 문제도 좋지만 개념을 탄탄히 하는 게 중요하잖아요~투탑수학으로 개념을 다지고, 디딤돌 중학 연산으로 연산도 꾸준히 하는 걸로 했답니다 개념서, 익힘책, 정답지는 각각 분리가 되"
9788926153017,10,"중학수학 개념서로 가장 괜찮은 문제집이에요.초등 고학년 선행용으로도 너무 좋고, 진도에 맞추어 공부하기에도 최고네요^^그리고 강남인강 강의까지 있어서 너무 마음에 들어요~"
9788926153017,10,개념탑과 개념익힘탑으로 나뉘어있어서 개념 익힌후 유형까지 공부하기에 좋습니다~ 개념익힘탑 문제는 난이도가 있어 상위원아이들에게 좋아요!!
9788926153017,10,중등교재도 디딤돌로 쭉 하고 싶어 투탑을시작했는데 여유로운 편집과 개념 설명이 잘 되있어 적응을 잘하고 있는 교재가 되었어요
9788926153017,10,예비중1 예습용 교재로 활용하고 있어요. 중등수학 개념을 탄탄하게 다져야 하는데 딱! 맞는 교재네요.
9788926153017,10,중1아이 학교가기전에 풀어보는 교재로 진행중인데 기본서로 너무 좋네요. 하나하나 개념짚어가기 자세히 나와있는 교재예요~ 강추강추
9788926153017,10,"예비 중등 예습서로 공부하고 있는데 이미지화 된 개념설명을눈으로 익히고, 손으로 풀면서 개념을 확실히 내것으로 만들고 있어요~"
9788926153017,10,"6학년 선행 교재로 투탑 좋네요. 개념설명이 잘 되어있어요. 문제풀이는 2권으로 구성,  개념풀이 익힘풀이로 개념과 실력 함께 쌓을 수 있어요."
9788926153017,10,초등6학년인데 선행하기 위해 선택한 문제집이에요. 다른 출판사의 1-1학기 문제집은 힘들어서 포기하더니투탑은 꾸준히 풀더라고요!! 기본서로 좋은 것 같아요.
9788926153017,10,"초등과 중등으로 나누어 비교해서 설명해주니 아이가 이해를 잘 하더라고요,"
9788926153017,10,6학년때 중학수학 기본개념서로 선행하기 좋은 교재에요
9788926153017,10,중학수학 개념은 제대로 익힐수 있는 수학문제집
9788926153017,10,초등아이가 중학수학 선행하기에 딱 좋은교재예요. 설명이 간단하고 쉽게 되어있어서 아이가 이해하기 쉽게 되어있어요
9788926153017,10,중학교 기초개념부터 잡을 수 있으니 너무 좋네요. 수학자신감을 팍팍 키워준답니다.
9788926153017,10,중학선행으로 진행하기 좋아요~~ 개념 설명이 쉽고 초등수학연계된 부분이 나와있어 아이들이 중학수학은 어렵다는 선입견 없이 도전 할 수 있도록 되어 있어요~~ 기본서 개념서로 공부하기 좋아요 ^^
9788926153017,10,중학수학 개념을 차분차분 제대로 익혀나가기 짱이네요
9788926153017,10,6학년인데 중등수학 예습하려고 샀습니다.초등과 연계되게 개념 정리가 잘 되어 있어서 혼자 공부하기에도 문제없네요.
9788926153017,10,중학 수학을 개념으로 하나씩 만날 수 있어 기대됩니다
9788926153017,10,기본개념서로 주제에 따른  다양한 문제를 풀어보면서 실력 향상에 도움 되네요. 부록으로 문제집만 따로 있다보니 한 권으로 알차게 공부할 수 있어요.
9788926153017,10,기본서로 좋아요
9788926153017,10,"개념학습을 스스로 하기에 충분히 좋은교재네요, 문제도 다양하게 접할수 있어 시험대비도 되고요 일단은 개념을 보기 쉽게 정리한점이 가장 좋으거 같아요."
9788926153017,10,학교진도에 맞게 예습과 복습을 하고 있어요~개념이 잘되어 쉽게 설명이 되어 있어서 아이 혼자서 학습하기 좋은 것 같아요~
9788926153017,10,중학교 수학 개념을 다지면서 처음 접할때 활용하기 좋아요~~ 기초가 튼튼해야 한다고 생각하기에 개념서 투탑수학 추천해요~
9788926153017,10,중등선행이나 처음 주학수학을 시작하기에 개념 설명이 쉽고 한눈에 잘들어와 아이들이 혼자서도 개념과 문제를 잘 해결해 나갈 수 있도록 되어있어 기본 개념서로 딱이네요~
9791125949787,10,교과과정을 따르면서도 비문학 지문의 감을 얻을 수 있습니다.
9791125949787,10,"이것저것 담은 책이 아니라, 독해력 기르기에 꼭 필요한 내용만 체계적으로 모아 놓은 느낌입니다."
9791125949787,10,시중에 나온 독해서 중에 젤 괜찮은 것 같아요. 꾸준히 풀리면 독해력도 기르고 배경지식도 쌓을 수 있을 거라 기대합니다.
9791125949787,10,구성이 알차서 좋아요.
9788900420272,10,중학생 교과 문제집으로 주문 배송 빠릅니다
9788900420272,8,중학교 처음 수학 문제집을 살 때 최적일 것 같아요. 특별한 부록에 교과서에서 쏙 빼온 문제? 교과서 유형 익히기에 정말 마음에 드네요.
9791164743933,10,공부방 교재로 사용하고 있어요. 학생들도 만족도가 높은교재입니다^^
9791164743933,10,소재도 그림도 재밌다고 아이들이 좋아하네요. 중등 첫 독해책으로 좋습니다.
9791129704856,10,예비중등 아들을 위해 여기저기 검색해 보고 메가스터디 중학국어 미문학 독해를 알게됐어요독해의 원리를 깨우치는 가장 좋은 독해 연습책이라는 수식어처럼 아이가 이책을 통해 원리를 깨우치고 어려워하지 않았으면 좋겠네요기대됩니다
9791129704856,10,중학교 올라와서 이 책으로 국어를 만점 받았으면 좋겠고 지문이 다양하여 내용이 많아 좋고매번 다른 주제에 지문으로 색다른 느낌이 있다.
9791162400470,8,중등 개념 수업후 반복 연산과 연습하게 좋은 책
9791187370222,10,영어는 학원에서 선행을 하고 있는 초등학교 5학년인데요수학은 학원을 다니지 않고 집에서 쭈욱 진행할려고수학연산문제집 찾던중에 접했는데책 내용이 어렵지 않고 단순하게 연산을 잡고 올라갈수 있게 되어 있어서초등고학년과 중학생들이 빠르게 수학기초를 잡을수 있는 교재 인거 같습니다.
9791187370222,10,방학때 중학교 준비하려고요^^
9788974574581,10,초등 기본 문법책을 어느정도 마스터했다면 구문으로넘어가야할텐데 아주 안성마춤인 교재입니다
9788928329809,10,영재반 수업을 하면서 수학에 흥미가 아주 높아진 아이라 플라토.센수학.핀란드수학.개념원리.디딤돌 등 다양한 수학문제집을 풀어봤었어요. 선행이라는 개념보다는 아이의 수준에 맞게 진도를 따로 나가는 중인데 학원을 싫어하는 아이라 자기주도학습을 하기에 적합한 교재로 택했답니다~ 베이직답게 개념에 대해 확실히 알수 있도록 간단하고 자세한 설명과 핵심적인 문제들로 구성되어 있어 바쁜 중학생이나 개념을 빠르게 훓고 지나갈 5.6학년 아이들이 접하기에도 너무 좋은것 같아요!!! 혼자 개념정리를 하며 풀이를 보며 스스로 해내가는 모습을 보니 역시 잘 만든 문제집이 자기주도학습을 끌어내는구나 싶었어요 추천합니다 별 백만개요^^
9791125948230,2,세계사밖에 없어요ㅠㅠ제가 필요한건 중2 1년동안 사용할 교재인데ㅠㅠ
9788928328796,10,"우공비 중학 국어 체험단으로 받은 비문학 독해1권.본문에서 중심문장을 찾는 방법과 한번 더 본문의 내용을 정리할 수 있는 문제들, 3개의 문제 중 서술형 문제도 있고,2장을 풀고 나면 심화된 문제도 풀 수 있어서 알찬 중학교 국어공부를 할 수 있다"
9788928328796,10,관심이 있을만한 주제를 체계적으로 학습할수 있는것 같인요.목차를 보면 구성이 탄탄한게 느껴지고내용도 쉽게 접근하면서 차근차근 익힐수있게 되어있어서 좋습니다.예비중아이가 만만하게 쉬운스토리부터 접근이 가능하네요.
9788928328796,10,독해 원리를 통해 체계적인 학습이 가능해서 독해의 기본을 익히는데 도움이 많이 되네요. 쉽고 재미있게 어휘력과 배경지식을 강화할 수 있는 교재입니다.
9788928328796,10,짧은 시간에 비문학 지문의 유형을 학습하는데 있어 아주 좋습니다.
9788928328796,10,비문학 독해를 하는데 있어서 많은 도움이 되는 책입니다.
9788928328796,10,쉽고 재미있게 어휘력과 배경지식을 넓힐 수 있을 것 같아 기대됩니다.
9788928328796,10,기초부터 단계를 밟아 나가 차근차근 어휘력을 쌓을 수 있어서 좋습니다. 문법 공부도 한꺼번에 할 수 있어서 좋네요.
9788928328796,10,비문학 독해 공부에 큰 도움이 되네요
9788928328796,10,독해 원리를 반복적으로 익히고 훈련할 수 있도록 짜여져 있어서 학습효율성이 아주 높네요.
9788928328796,10,스스로 체계적으로 공부할 수 있어서 국어학습의 기초를 다지는데 아주 좋은 것 같습니다.
9788928328796,10,학교 국어 시험이 점점 어려워져요. 교과서 지문만 나오는게 아니고 외부 지문도 같이 나오니 기본 글 해석 능력이 있어야 시간에 풀 수 있다고 하네요..교재를 처음 받아서 풀어봤는데  지문도 적당하고 어려운 단어도 암기 할 수 있도록  문제를 풀 수 있어서 딱딱하지 않고 지루하지도 않네요
9788928326686,8,아직 안받았는데 학원에서 추천해서 구매합니다. 모바일 앱으로 알라딘에서 저렴한 가격에 구매합니다. ...
9788959269631,10,기본 개념 공부하면서 유형 연습하기 좋습니다. 설명이 쉬워서 이해가 잘 돼요^^
9788966865550,10,역시 내옆의 선생님 완자인듯 합니다 ^^
9791162400548,10,중2 올라가기전 반드시 학습해야할 교재임. 그래야 수능까지의 영문법 기초가 잡게될 교재인것같다
9791164743964,10,"개정판이 되면서 레벨도 더 다양해지고, 내용이 더 잼있어지고구성도 최고입니다.  리더스뱅크는 시리즈로 공부하기에 너무좋아요. 독해교재로 강력추천합니다^^"
9788959904907,10,수학을 가르쳤던 선생님이자 엄마인 제가 모든 수학문제집 살펴본 봐로는~ 설명이 제일 자세히 잘되어있어서~ 딸에게 사주었습니다~ 혼공하는 중학생들에게는 이만한 개념문제서가 또 있을까요~ 개념문제서로는 단연 숨마쿰라우데 강추합니다~!
9791162400555,10,영문법을 알기 쉽게 총정리한 책입니다. 설명이 지루하지 않고 포인트 있게 나왔어요. 바로 풀어볼 수 있는 문제들도 적절하고요.
9788959904594,10,숨마쿰라우데 중학수학 개념 기본서 덕문에 중학수학에 대한 두려움이 사라졌어요. 친절한 교재입니다. 만족스러워요.
9788974574352,10,문법에 대한 기초와 어렵지 않고 재미있게 할수 있는 방법이 잘 저술되어 있어서 문제를 적용하고 풀어보는 것이 좋고 답안에 대한 해석이 잘되어 있어서 좋은 것 같습니다.
9788974574352,10,문법에 대한 기초를 탄탄히 할수 있도록 도와주는 책이기때문에 구입하고 싶어요.
9788974574352,10,2학년 문법 쓰기 공부에 좋습니다
9788974574352,10,개념과 규칙을 시각적으로 쉽게 파악할 수 있어 직접 다양하게 변화시켜 보면서 서술형 문제에 대비할 수 있겠네요
9788974574352,10,"중학 내신에서 서술형의 비중이 점점 높아지고, 내신 등급의 차이가 서술형 평가에 좌우되는 경향에 따라, 문법 항목과 관련하여 출제 가능한 서술형 문제를 엄선해 수록하였다. 이 책을 마스터하고 신학기를 출발한다면 다가오는 어떤 유형의 시험에도 문제가 없도록 거뜬한 자신감을 키워줄 것이다."
9788974574352,10,영어 문법을 배워도 막상 문장 한 줄 쓰려면 애를 먹는 아이들에게 큰 도움이 될 것 같아요. 이런 책이 빨리 나왔으면 더 좋았을텐데 싶은 생각도 드네요.
9788974574352,10,"중학교 기출문제를 분석하여 문제유형을 학습하도록 짜놓았다고 하니, 문법과 쓰기에도 강한 아이가 될 수 있을 것 같네요."
9788974574352,10,교과서에 수록된 문법 위주라는 점이 좋습니다. 문법에 강해지는 3단계 개념 쪼개기 방법에 대한 공부방법도 신선하네요.
9788974574352,10,필요한 문법을 쉽고 재미있게 설명해 주고 있네요. 기초를 세우는데 있어서 도움이 될 것 같습니다.
9788974574352,10,문법을 깔끔하게 잘 정리해놓았어요. 중학교 2학년이 공부하기에 적당한 것 같아요~ <미국교과서 읽는 리딩> 책이 참 괜찮아서 눈 여겨봤는데요. 쓰기까지 할 수 있도록 문장을 익히게 해주는 부분이 장점이에요!
9788974574352,10,꼭 필요한 문제 유형들로 구성되어있어서  문법을 효과적으로 확인하고 연습할 수 있네요
9788974574352,10,어려운 영어공부 문법이 쓰기다로 영어에 대한 두려움을 해결해주고 좀 더 친근하게 영어에 다가갈 수 있도록 도움을 줄 책인거 같습니다.
9788974574352,10,영어 단어를 외우고 문법을 외우는 것으로 영어 실력을 높히기는 쉽지 않기에 이러한 책을 통해 영어문장을 직접 쓰고 알고 있는 영어의 지식을 실제로 사용하며 연습하는 것이 좋은 방법이라고 생각합니다. 중학교 교과과정을 바탕으로 이루어진 학습서이기에 알맞은 난이도로 공부할 수 있어 좋네요.
9788974574352,10,복잡하지 않고 최대한 간략하게 설명이 되있어서 아이들이 헷갈리지 않고 학습하는데 좋을것 같아요.
9788974574352,10,쓸수 있어야 진짜 영문법이란 말이 맞죠. 많은 영문법책이 있지만 이 책은 학년에 맞춰서 원리까지 잘 알려줘서 공부하기 좋은 책입니다.
9788974574352,10,영문법이 영어문장을 구성하고 있고 쓸 때도 영문법이 필요학 때문에 배워두면 나중에 도움이 될 것이라고 생각합니다.
9788974574352,10,요즘은 영어가 필수인 시대라 어렸을 때 부터 좋은 교재를 선택하는 것이 중요할 것 같습니다
9788974574352,10,지금이라도 기초다지기용으로 보면 좋을 거 같네요
9788974574352,10,문법을 실전처럼 공부할 수 있는 좋은 책
9788974574352,10,쉽게 쉽게 문법을 이해할 수 있는 교재입니다.
9788974574352,10,문법에 대해 자세히 나와 있어요
9788974574352,8,쓰기도 말하기도 읽기도 문법을 빼놓고는 얘기할 수 없죠. 문법은 항상 기본!
9788974574352,10,목차의 수동태부터 많이 어려워하는 것 같아요! 기초를 튼튼히 해야 나중에 헷갈려하거나 실수 하지 않으니까 미리 아이가 학습해 볼 수 있게 하고 자주 복습하면서 기본기를 잘 쌓는데 도움을 얻어야겠어요 !
9788974574352,10,영문법의 기초를 다지고 싶습니다 이번에는 기필코 ㅜㅜ
9788974574352,10,영문법의 기초를 중2부터 확실히!
9788974574352,10,문법도 잡고 영작도 늘고 일석이조네요.
9788974574352,8,중2영문법이 가장 핵심. 쓰기로 다시 배우는 문법으로 기본기 확실히 다지자.
9788974574352,10,학년별로 적합하게 영어문법 공부할 수 있게 체계적으로 잘 되어 있는 것 같아요
9788974574352,8,"쓰면서 눈으로도 읽게되고, 여러모로 공부가 확실히 되겠습니다"
9788974574352,10,서술형 쓰기를 통해 문법을 익힐 수 있도록 체계적으로 구성되어 유익합니다.
