ISBN13,rating,review
9791125312796,8,워드마스터랑 같이 공부하면 좋네요
9788928330478,10,"우공비 중학 국어 문학은 현대시,고전시가,현대소설,희곡,시나리오,현대수필,고전수필등 정말 필요한것만 모아놓은 보물창고 같았습니다. 중학교 입학하고 국어 때문에 멘붕이였는데 문학 작품을 감상하는 방법을 쉽게 이해할수 있도록 도와주어서 아이가 쉽게 다가갈수 있어서 좋았습니다."
9788900454697,10,"최신경향에 맞게 기출문제가 유형별, 서술형 등 시험 실전대비용으로 너무 잘 나왔어요. 시험치기 직전에는 이 책으로 마무리용으로 활용하면 좋을 것 같아요."
9788900454697,10,개념이 안 잡히니 어려운 문제도 잘 안 풀렸는데 특급기출 문제집으로 개념을 잡을 수 있었어요 그리고 내가 어디가 부족한지 잘 알 수 있는 문제집이라 좋았습니다
9788900454697,10,중학교 내신을 완벽하게 대비하고싶은 학생들에게 추천합니다. 특급기출한권이면 고난도 문제 대비도 충분합니다.
9788900454697,10,시험 실전내신대비서 특급기출 수학문제집 강추합니다. 현직쌤들의 기출문제집으로 모의고사는 시험전필수죠 ^^ 미리미리 준비하세요 ~~
9788900454697,10,"동아출판 특급기출 중간 기출예상문제집이 중학교 수학 10종 교과서 및  전국학교시험 문제를 유형별, 서술형, 교과서 특이문제까지 분석해 놓아서 특급기출로 내신대비를 확실히 할 수 있을것 같아요."
9788905048310,2,저는 알라딘 당일배송 속임수에 항의하고 싶어요.배송확률까지 앞세우며 당연한 기대감으로 주문을 하면 영락없이 이틀은 지나야 받게되더군요. 항의를 하니 배송사 책임으로 전가를 하며 취소하고 싶으면 취소하라고 하는 메세지만 돌아옵니다.구매자분들 알라딘 배송 상황을 믿지 마세요.
9791125937777,10,"2학년 수학예습을 위해 유형문제집 알아보다 유형해결의 법칙으로 공부하고 있어요.개념도 잘 나와 있고 유형문제가 많아서 아이가 재밌게 진도 쭉쭉 빼고 있어요. 한권으로 개념, 유형,내신까지 다 학습 할 수 있어 너무 유용한 교재입니다.추천 합니다~"
9788959904532,10,중학수학 처음 시작하는 학생들에게 많이 추천하고 싶은 책입니다. 개념기본서로서 갖춰야할 모든걸 다 갖춘 최고의 책이 아닐까 싶어요. 유명한데는 다 이유가 있겠죠? ^^
9788959904532,10,"초등에서 제대로 몰랐거나 놓치고 지나갔던 부분들까지도 QA를 통한 스토리텔링 강의로 알려주기 때문에 아, 이 교재 참 괜찮다. 라는 생각이 들었어요."
9791162271346,8,예전에 학교다닐때 완자로 공부했던 생각이 나서 동생에게 추천해주었습니다. 요즘 중1은 자율학기제라 그런지 옛날에 보던 그 자세한 느낌은 좀 덜하더라구요. 뭐 1학년 문제집은 요새 다 그런것 같아서...어쨌던 이번에 동생 시험은 잘 본것같아 후회는 없네요!
9788968060526,10,배송이 감동 입니다.오늘은 토요일~오전11:53에 주문해서  오후 2:50에 받은거 실화 인가요???관계자분들 노고에 감사드립니다.
9788968060526,10,우리 애가 보고 있어요^^
9791125949794,10,"서점에서 문제집 찾아보다가 구성도 깔끔하고, 어휘 부록같은게 있어서 들고다니면서 짬짬히 공부하기 좋을거같아서 구매해서 보고 있어요~ 아직 끝까지는 다 못보고 한번 훑어봤는데 정말 좋아서 리뷰 남기게 되었습니다~~"
9791161652054,10,이거 구매할때 출판사 잘 확인하고 사야 합니다.
9788900421453,6,개념정리가 핵심만 잡고있어 가독성이 좋습니다.유닛1개에 개념정ㄹㅣ 반쪽 문제풀이 반쪽이라 구성이 깔끔해보이네요. 뒤에 워크북이 활용도가 높을거 같습니다.다만 시중여타교재들과의 차별성이 있어보이지 않아 아쉽습니다.
9788900421453,8,"제가 수업 시작할때 품사의 개념부터 잡고 시작하는데, 이책도 그렇게 시작합니다. 그래서 아이들이 좀더 쉽게 문장을 이해할수 있게 되고, chapter당 문제가 충분해서 문제풀고 개념잡고 그 다음 단원으로 넘어가기 좋습니다. 저는 이 책 구성이 마음에 들어서 방학특강 교재로 선정했습니다. ^^"
9791157523634,8,나의 개인 영어 선생님이 저에게 추천해준 책입니다.열심히 익히고 공부해서 영어 울렁증 극복하고 싶습니다.영어로 인한 좌절감 패배감 이제는 정말 벗어 나고 싶어요.아직은 불확실한데 희미하게 나마 무언가 잡힐거 같아 즐거움 조금씩 느낍니다.
9788926156964,10,잘받았습니다. 수업전에 쉽게 풀고 이해하는데 도움이 될 거 같아요잘받았습니다. 수업전에 쉽게 풀고 이해하는데 도움이 될 거 같아요
9788968061424,10,잘풀리는영문법은 각학년별 영문법에 대한 기본적인 내용을 이해한 학생이 내용확인과 기출문제의 유형 그리고 실전감각을 익히기 위해서 봐야할 must-item이라고 확신합니다.
9788900430639,8,쎈보다 쉬운 문제집입니다. 기초 다진 후 풀기 딱 좋아요.
9791157523665,8,친구가 추천해줬어요. 제게도 도움이 많이 되었으면...
9788900454413,10,"아이랑 직접 학습해 보핬는데 문제수가 정말 많아서 좋았어요. 단어, 듣기및 말하기, 문법 파트로 나눠저서 핵심노트-만점노트-연습분제-실전테스트까지,충분한 문제양이 있어서 확실히 학습 할수 있을 것 같아요.단원별 평가문제가 4회나 제공되어서 중간고사 대비 아주 좋은 문제집이예요."
9791162335444,10,문제가 많이 수록되어 있어서 실전력 강화에 도움이 될 것 같아요!!! 시험 직전에 풀면 딱인 교재네요 :)
9788927708100,10,정말 알차고 너무 좋은책!!
9788905051419,10,중1 딸의 국어문제집을 알아보고는 중  지학사 <중학 비문학 독해연습> 입문편을 만나 풀어보기로 했어요. 다른 교재와 달리 독해 원리부분 내용이 지루하지 않고 실전 독해 연습부분의 5가지 영역 주제가 마음에 들어요. 국어를 어려워하는 친구들도 잘 풀 수 있을것 같아요.
9788905051419,10,"비문학 비문학 하는데 무턱대고 비문학 독해를 접하게 하면 오히려 아이에게 어려운 어휘뜻의 이해도 떨어지고 문제를 풀이어려워하는데 ˝중학 비문학 독해연습˝은 글읽기의 기본으로 어휘,문장이해, 문단이해,글"
9791164429790,10,신 수학의 바이블 개념 중학 중학교 입학을 앞둔 아이 개념을 위해서 선택했어요  중단원 테스트 대단원 테스트로 학업성취도 테스트로 워크북으로 이루어진 교재는 핵심을 쉽고 빠른시간에 이해할수있어요   본교재 / 워크북/ 정답과 풀이로 3권으로 분리해서 사용할수 있는점도 편리합니있어
9788905048297,10,어려운 비문학 독해를 시작하기전에 지문을 어떻게 읽고 지문에서 무엇을 어떻게 찾고 이해를 할지 독해기술을 먼저 학습하는게 이 책의 특징이네요보충설명이 정말 꼼꼼하게 잘 되어 있어서 이해하기 쉽더라구요.지학사 중학 비문학 독해 연습 기본편 적극 추천합니다~~!!^^
9788905048297,10,언어영역을 힘들어하는 중학교3학년 제자에게 이번 겨울방학 동안 공부해 보라고 추천해 주었는데 혼자서 공부하기에 너무 좋다고 하네요. 고등학교 올라가기 전에 한 번 풀어보면 매우 유익할 것 같아요. 강추합니다:>
9788905048297,10,"중2 조카한테 기본편부터 가르쳤는데 괜찮더라구요, 지문이 재밌고 정리가 잘 되어 슬슬 문제까지 알아서 잘 풀어요. 수능 비문학 기출문제나 고등용 독해집은 너무 어려워서 가르치기도 힘들었는데, 독해 스킬까지 제공해 줘서 중학생용으로 딱인 것 같습니다."
9791188612000,10,예비중 아이 지금 예습시키고 있어요. 너무 만족한 중학연산 추천해요!
9788974574949,6,책이찢어져서왔네요 다음엔 더꼼꼼히 검수해주세요
9788974574949,10,단어 공부도 병행해야 하는 듯요학원을 안 다녀서 집에서 하지만요좋은 교재가 요즘에는 참 많네요잘 활용해야지요
9788926158616,10,"1단원 도형의 기초인데요점, 선, 면, 각 기본 도형에 관한 핵심 개념을 이미지로 쉽고 간단하게 설명해 줍니다​중학교 수학은 초등학교 때와는 다르게 개념적이고 추상적이어서 개념에 대한 정확한 이해가 중요한 시기에 필요한 연산서입니다"
9788926158616,8,중학교 1학년생 에게 맞는 수학책입니다. 수학은 디딤돌이라고해서 구매했어요.
9791189719463,6,지문을 직접 독해해서 푸는 방식입니다. 장점은 정확한 해석을 할 수 있게 도와주지만 단점은 마치 깜지 형식처럼 쓰기 때문에 부담이 될 수 있습니다. 특히 빠른 독해하기를 원하는 사람에게는 맞지 않을 수 있습니다. 영어의 기본적인 틀에 아직 서투른 사람에게는 맞는 책인 듯 싶습니다.
9788900421460,10,학교 공부 및 시험에 도움이 됩니다.이 시기에는 꾸준히 공부하는것이 중요한데내용과 수준이 도움이 됩니다.
9788900421460,8,"저는 영문법 클리어 이책의 문법기초다지기 이코너가 마음에 듭니다. 본론으로 들어가기전에 전체적인 문장에 대한 큰그림을 그려주고 한 단원씩 시작하고, 그리고 그 개념을 익히기에 충분한 문제들까지...구성되어 있어서 좋은것 같습니다."
9788928309191,8,해설이 좋고 읽기 쉽게 되 있는 것 같아요! 추천합니다~
9788928330492,10,공부하기 매우 좋은 책이라고 생각합니다. 공부를 시작한지는 오래되지 않았지만 요점정리가 매우 잘되어 있어 보기에 편하고 머리에도 잘들어옵니다
9788928330492,10,문학시ㆍ소설ㆍ극ㆍ수필/ 큰 주제속에서 (인물파악하기/소재/배경/서술파악하기)수능으로 가는 꾸준한 열쇠같은 비법 개념서 ♡♡♡ 아들딸 아이 방학동안 한권 끝내보려합니다ㆍ고전ㆍ현대/ 문학 잘 정리되는 느낌이라 합니다. 개인적으로 추천합니다
9788926157909,10,"한문제 두문제 풀다보면 개념을 깨치고, 개념을 익힐 수 있는 가장 기본이 되는 책이에요. 새학기 수학을 시작한다면 <중학연산>으로 시작한답니다."
9788926157909,10,개념이 들어간 연산 문제집이라서 중학수학 첫 문제집으로 선택했는데 아이가 만족해하네요. 중학연산을 풀면 그 다음 문제집이 쉽다면서 지금은 무조건 중학연산부터 공부하려고 해요. 스스로 학습하기 좋습니다~
9788928328819,10,독해 원리를 통해 체계적인 학습이 가능해서 독해의 기본을 익히는데 도움이 많이 되네요. 쉽고 재미있게 어휘력과 배경지식을 강화할 수 있는 교재입니다.
9788928328819,10,"학년이 올라갈수록 어려워진다는 국어특히나 어려운 어휘가 많아 더욱 어려워하는데 독해력와 어휘력을 함께 기를 수 있는 교재라서 그런지 만족스러워요 !! 인문, 사회, 과학, 기술, 예술, 융합 같은 다양한 영역에"
9791125930860,10,체계적으로 정리한 개념을 다양한 유형의 문제로 점검해서 실력이 쑥쑥 오릅니다.
9788900421484,10,문법과 쓰기 그리고 서술형 대비 완벽한 교재!!!방학특강용으로 활용하면 좋을 것 같습니다
9788900421484,8,"요즘 서술형 때문에 힘들어 하는 아이가 있어서, 겨울방학 특강 교재로 샀습니다. 다른 영문법 클리어 교재가 좋아서, 이 책도 같은 기대감으로 주문했는데, 조금씩 문장의구성과 쓰기가 변형된 형태라 아이들이 연습하고, 영어 글쓰기에 감을 가지기에 좋을 것 같습니다.!!"
9788900421484,8,"요즘 서술형 문제 많이 나오는데, 시험 서술형 대비에 좋을 것 같은 교재입니다."
9788900421484,10,문법 요소를 가지고 바로 문장을 작문할 수 있기 때문에 응용력을 기를 수 있습니다. 생각을 문장을 표현하는 연습이 말하기의 기본이 된다고 생각하기 때문에 수업하기에 아주 좋은 교재입니다.
9791161233369,10,문법의 기초를 배우는데 아주 좋은 책입니다.숨마 영어문장해석 문제집이나 다른 영어 문장해석 문제집과도 병행해서 풀기에도 좋습니다.
9791125312772,10,중2가 되고 리딩튜터 주니어4를 하고 난뒤 좀더재미나게 고딩책을 고르고 싶어서 골라본책 아이가 양은 많지만 재밌다고 하면서 즐거워 하네요 문제패턴도 다르고 어휘 문법 등등 보기도 더 쉽네요!
9788968060625,6,중학생용이고 교과서를 같이 이용해야 합니다 그냥 문제집이에요 따로 설명이 더 없고 예문같은거도 없습니다 영어 공부 다시해보실려는 성인 분들한테는 비추천입니다..
9788928328758,10,"빈출도에 따라 구성한 단어를 통해 중학 필수 영단어 책입니다. 휴대용 미니북과 QR코드(3가지 버전의 어휘 듣기, 모르는 단어를 모아 학습가능한 어휘암기장)를 제공하여 단어를 마스터할 수 있도록 구성되어 있어요. 초빈출 영단어 3권(기본, 발전, 고난도)이면 아이 영단어 고민은 해결될거 같네요."
9788928328758,10,중2~3영어 교과서에 많이 나오는 순으로 정리되어있어서 공부할때 유용해요. 초등단어 외우고 그 다음에 하기 좋은 책인듯해요. 하루 30개 단어라 부담되지 않아요. 38일이라 지루하지 않아 하네요. 미니북은 들고 다니기 좋네요.
9788928328758,10,"우선 중학교 아이들에게 아주 적응하기 좋게 만든 책 입니다.초빈출 단어라서 아이들이 보다 편안하게 단어를 외울 수 있습니다.38일 구성으로 아이 방학동안 끝내기 딱 좋은 단어북이라고 생각 합니다아이들이 중학교 교과 공부할때 필수단어,단골단어등으로 외우면서 아이도 자신감 업!!!"
9788928328758,10,영어 외우는 거 힘들어 하는 아이에게 딱 입니다.빈출단어순이라 더욱 유용하구요.QR코드로 들어가서 영단어 발음 들을수 있어 발음 모를때 아주 편리하고 단어를 숨기거나 뜻을 숨길수 있어 자유 자재로 테스트 가능하고 모르는 단어는 암기장에 저장해서 다시 확인 가능하니 진짜 좋습니다.
9788928328758,10,"초등고학년부터 중등까지 단계별 단어대비에 똭!입니다. 단골단어, 필수단어,확장단어로 구분해 놓은 것도 맘에 들고,  곳곳에 귀여운이미지들이 들어가 있어 가독성도 뛰어납니다. 아이가 지루해하지 않고 즐겁게 단어공부할 수 있을 것 같아 강추합니다!!"
9788928328758,10,"빈출도순으로 되어있어서 우선적으로 외워야할것과 그렇지 않아도 될것으로 분류해서 공부할수있고 , 평소 알고있지만 확실하게는 몰랐던 단어들을 정확히 짚고넘어갈수있어서 좋은것같아요 ! 정말로 추천합니다-저는 위 도서를 추천하면서 좋은책신사고로부터 도서를 지원받아 작성하였습니다"
9788928328758,10,책의 구성도가 좋습니다. 교과서에 많이 나오는 빈출도순으로 나오다보니 눈에 많이 익었던 단어들이 처음에 나와 공부하는데 부담감을 많이 갖지 않았고 하루 단어가 끝나면 테스트도 할 수 있는데 문장구성으로 답을 쓰는 부분들이 맘에 들었습니다. mp3로 들을 수 있어서 쉽게 외울수 있습니다.
9788928328758,10,학습하는데먼저 목표와꿈을 계획하고 학습들어갑니다. 한장한장 정성과 정보가 가득하네요!  꾸준히학습학로 마음먹고 실천하겠습니다.
9788928328758,10,책의 구성이 매우 알차네요. 매일 부담없는 30단어를 38일에 완성하는걸 목표로 하는 책이네요.회차별 테스트가 있어서 더욱 맘에 쏙 드는 책입니다.
9791164422777,10,책이 본교재와 워크북으로 이루어져 있어서 더 많은 문제를 풀 수 있다는 장점이 있었어요! 또 문제간의 간격도 넓고 글자의 크기가 적당해서 문제를 푸는데 보기에도 좋았습니다. 마지막으로 워크북으로 실력을 알 수 있어서 좋았던 것 같아요
9791164422777,10,아이가 직접 고른 책이니만큼 수학에 흥미를 가지게되는 책이 되길 바래요
9791164060412,10,고등과 연결되는 기하파트인만큼 기적의 중학 도형에서 차근차근히 공부할 수 있어서 좋았어요공식이 어떻게해서 나왔는지 무조건 암기하는 게 아니라 과정을 통해서자연스레 이해하게 되니 좋더라고요도형을 어려워하는 아이들에게 추천해요^^
9788926156827,10,투탑 2-2 개념탑과 개념익힘탑으로 나뉘어져 있어서개념탑으로 개념을 잡아가며 한 단원을 마무리 지으면개념익힘탑으로 다시 그 단원을 복습할수있어 부담없이 학습할수 있어요.
9788926156827,10,수학 원리와 수학개념의 연결관계를 잘 이어서 설명해줘서 개념잡는데 도움이 됬어요. 개념익힘탑에서는 응용문제들을 개념설명 없이 풀면서 어느 부분이 부족한지 확실하게 확인하는데 도움이 되었어요. 혼자 공부하거나 인강들으며 공부하는 교재로 좋아요.
9788926156827,10,투탑수학 처음인데 기본 개념서로 좋네요. 개념익힘탑으로 더 꼼꼼하게 공부할수있어 기본기약한 친구들에게 추천합니다.
9788926156827,10,"내용이나 구성이 기본 개념서로 정말 좋은 교재에요. 단원도입시 도식화를 통해 한 눈에 그 내용들을 유추할 수 있어 좋고, 마무리에 정리할 수 있는 페이지가 있는 것도 좋아요. 또한 익힘탑으로 문제유형을 추가적으로 학습할 수 있어 좋았던 교재입니다. 추천해요."
9788926156827,10,투탑수학 개념서로 예습 제대로 하고 있어요. 개념탑과 익힘탑 두권이 만나 투탑인가바요.^^ 문제양도 넉넉하고 주제별로 문제가 되어있다보니 제대로 공부하는 느낌이네요. 친절한 개념교재. 투탑중학수학 추천합니다.
9788926156827,10,"개념을 익히는데 적합한것 같고, 스페셜 개념특강으로 깊이 있는 생각을 해볼 수 있다는게 좋다."
9788926156827,10,기본기 쌓기에 안성맞춤인 교재로 설명이 친절한 교재입니다.
9791162400678,10,"시험대비로 유용하게 잘 사용하고 있고, 다음학년에도 구매할께요~!!"
9788926154434,10,"개념탑에서는 개념과 기본문제를 학습할 수 있어 좋고, 익힘탑에서는 다양한 응용문제들을 풀 수 있어 좋아요."
9788926154434,10,중학교육과정에 맞춘 디딤돌의 투탑수학 체계적입니다.
9788926154434,10,개념설명이 잘 되어 있는 투탑이라 2학기 수학 예습용으로 사용하고 있습니다. 엄마 도움없이도 스스로 자학학습하기에 딱 알맞는 문제집인 것 같아요. 개념책과 개념익힘책이 함께 있어서 더 잘 공부할 수 있는 것 같아요.
9788926154434,10,개념부터 차근차근 쌓아가기 좋은 교재입니다.
9788926154434,10,예비중에게 꼭 필요한 기본개념수학 교재인거 같아요! 강추입니다.
9788926154434,10,중학개념서로 구성이 알차게 되어 있어요. 미리미리 예습하기에 좋아요. 투탑수학 강추합니다.
9788926154434,10,개념을 꼼꼼히 잘 잡아주는 것 같아요 기본 개념서로 우리 아이에겐 필수교재가 되었어요. 개념 꼼꼼히 잡아줘서 예습하기 좋아요~
9788926154434,10,"중1 아이랑 투탑수학 1-1을 써보고, 2학기 중등수학 선행개념서로 pick한 투탑수학!!!2학기 수학이 개념이 확실하고, 다양하게 적용할 수 있는 도형파트라 개념이 더욱 중요한데,개념을 확실히 잡아줄 수 있는 투탑수학으로 2학기 개념도 확실하게 잡고 갑니다. 투탑수학 짱!!!"
9791162270165,8,예전에 학교다닐때 완자로 공부했던 생각이 나서 동생에게 추천해주었습니다. 요즘 중1은 자율학기제라 그런지 옛날에 보던 그 자세한 느낌은 좀 덜하더라구요. 뭐 1학년 문제집은 요새 다 그런것 같아서...어쨌던 이번에 동생 시험은 잘 본것같아 후회는 없네요!
9788974574369,10,써보는 과정속에서 문법이 체화되는 과정을 느낄 수 있을 것입니다.
9788974574369,10,여기서 배운 문법실력이 작문으로 이어질 수도 있을 것 같군요
9788974574369,10,머릿속으로만 이해하는 문법이 아니라 실제 쓰는 연습을 통해 문법실력이 향상됨을 느낄 수 있습니다.
9788974574369,10,"변화규칙이해하고, 써보면서 깨치고, 서술형으로 쓰다보면 실력이 쌓이네요."
9788974574369,10,영어 문법에 대해 정리할수 있어 좋네요.
9788974574369,10,문법에 대한 기초와 어렵지 않고 재미있게 할수 있는 방법이 잘 저술되어 있어서 문제를 적용하고 풀어보는 것이 좋고 답안에 대한 해석이 잘되어 있어서 좋은 것 같습니다.
9788974574369,8,문법공부를 차근차근할 수 있게 탄탄하게 구성되어 있어서 공부하는 입장에서 볼때 최고의 책입니다
9788974574369,10,아이가 문법에 약하고 공부하기 막히면 접어버리기 쉽상인데 이책은 기초부터 쉽게 가르쳐줘 관심을 갖고 하게되네요
9788974574369,10,문법에 대한 기초를 탄탄히 할수 있도록 도와주는 책이라서 읽어보면 좋겠어요.
9788974574369,10,쉽게 혼자서도 공부할 수있게 구성되어있고 활용문장을 많아 수록해놓아 좋습니다.
9788974574369,10,책에서만 있는 문법이 아닌 실제로 쓰기에 적합한 문법 이야기라서 참 실용적이고 괜찮은 책이네요. 영어를 기본부터 익힐수있게 하는 책입니다~~
9788974574369,10,3년 문법 공부에 아주 좋아요
9788974574369,10,아직 문법에 약한 중학생들에게 너무나 좋은 책인 것 같아요. 특히 문법을 토대로 자기가 원하는 문장을 쓸 수 있도록 한다는 점이 마음에 드네요.
9788974574369,10,점점 더 어려워지는 문법 때문에 고민하고 있는 아이에게 1학년부터 3학년까지 차근차근 되짚어 볼 수 있는 좋은 교재가 나와 반갑네요.
9788974574369,10,매번 배워도 매번 헷갈리기 쉬운 문법을 쉽게 정리해주어서 좋습니다
9788974574369,10,문법을 이해하고 활용해서 문장을 쓰는 서술형 평가를 대비하고 중학 문법의 핵심을 익힐수있는 좋은 기회네요
9788974574369,10,"중학교 1학년때부터 문법을 확실히 잡아가는 것이 중요한데요, 3학년때에는 거의 완성 단계라서 기초를 튼튼히하는 노력이 필요합니다. 이 시리즈로 탄탄하게 잡아간다면 아이들의 기초가 전혀 흔들리지 않는답니다. 믿고 보는 시리즈라서 주변에도 추천하곤 했어요.이 시리즈로 쭈욱 가자구요."
9788974574369,10,서술형을 쓰는데 있어서 맞춤법이나 문장의 자연스러움을 이끌어내기 위해 훈련하기 아주 좋은 책 같아서 많은 중학생분들이 이책을 통해서 문장력을 키우고 자신만의 좋은 문체를 가질 수 있었으면 좋겠다는 생각이듭니다.추천합니다.!
9788974574369,10,어려운 영어 문법에 대해서 수준별로 공부할 수 있도록 공부에 도움을 주는 책입니다.
9788974574369,10,영문번에서 무조건 많이 쓴다고 문법이 완성되는 것은 아니죠. 그래서 체계적인 학습법이 필요합니다. 그런 체계적인 학습법을 이 책을 통해서 배우면 정말 도움이 될 것 같습니다.
9788974574369,10,간략한 영어문법 설명이 학년별로 나뉘어 있어서 쉽고 체계적으로 영어문법을 공부할 수 있을것 같아요.
9788974574369,10,수준에 맞춰 문법에 보다 쉽게 접근할 수 있는 좋은 책입니다
9788974574369,10,내신에 대비해서 꼼꼼하게 학습할 수 있도록 단계별 구성이 잘 되어있어 차근차근 공부하기 좋은 책입니다.
9788974574369,10,중학교 영문법도 생각보다 어려운데 보다 쉽게 배울 수 있을 것 같아요.
9788974574369,10,영문법을 쉽고 재미있게 머리에 쏙쏙 박히게 알려주고 있어서 큰도움이 되네요
9788974574369,10,문법에 대한 바람직한 길을 보여주는 바람직한 책이라 생각되네요
9788974574369,10,개념과 규칙을 시각적으로 쉽게 파악할 수 있어 직접 다양하게 변화시켜 보면서 서술형 문제에 대비할 수 있겠네요
9788974574369,10,"문법을 잡아야 영어학습을 제대로 할 수 있는데, 쉽게 이해할 수 있도록 구성되어 쉽고 꼼꼼하게 학습하기  좋을것 같습니다."
9788974574369,10,고등학교 들어가지전에 알아야할 모든 문법이 있어요
9788974574369,8,중3 영문법은 이 한권으로 충분해요..좋은 도서네요!!!!
9788974574369,10,학생들이 쉽고 재미있게 공부할 수 있도록 구성했어요.
