ISBN13,rating,review
9791185933283,10,캘리그라피 열심히 연습해도 꾸미는 센스가 없으면 제대로 활용되지 못하는 것 같아 아쉬웠는데 이 책 보고 따라하면 잘 써먹을 수(?) 있을 것 같아요 ㅎㅎ
9791185933283,10,"컬러링북에 이어 캘리그라피까지. 정말 글씨만 잘 써도 예술이잖아요. 저도 배우고, 뭔가를 써서 만들어보고 싶어요."
9791185933283,10,캘리그라피 배워서 특별한 날에 꼭 써봐야겠어요
9791185933283,10,기다리고 있던 책. 도전해보고 싶습니다.
9791185933283,10,배워보고 싶었지만 어떻게 시작해야 할지 몰랐는데 쉽게 배울 수 있는 책인 것 같습니다.
9791185933283,10,"정말 특별한날 좋은 선물이 될것 같아요. 이쁜 손글씨도 배우고, 선물도 줄수 있고..^^"
9791185933283,10,특별한 날 늘 인터넷에서 찾아 프린트로만 찾아 사용해야해서 배우고 싶었는데 배우고 싶은 욕구가 가득한 저에게 도움이 될것 같은 책입니다.
9791185933283,10,진정 아름답게 쓰고 글을 쓰고 싶다. 점점 타자로 치고 프린터로 뽑는 내가 씁쓸해질 때 유난히 눈길이 가는 책. 한권쯤 소장해도 좋겠다 싶은 책. 손편지에 소소한 아름다움을 남길 자신감을 심어주는 책 :)
9791185933283,10,특별한 날의 캘리그라피! 전 글씨를 그닥 잘 쓰는 편은 정말 아니에요. 개발괴발 쓰는 편인데 그래도 특별한 날만큼은 멋진 글씨를 써서 선물을 하고 싶습니다. 아니면 마음 담은 편지를 쓰고 싶기도 하네요. 도움이 되겠습니다.
9791185933283,8,영문 캘리그라피라 더 좋은거같아요! 영문이라  특별한 느낌이 더 나나서 활용하기 좋네요~
9791185933283,8,오~이런 도서가 있는지 몰랐는데 너무 신기하고 재밌네요~이쪽 관심이 있으시면 많은 도움이 되겠어요~^^
9791185933283,10,캘리그라피에 대해서 관심이 있는데 이 책을 읽어보면 되겠습니다.
9791185933283,8,특별한날만드는나만의특별한 캘리그라피 매력적이고아름답네요
9791185933283,8,"캘리그라피는 눈길을 확잡아끄는 멋진 매력을 가지고 있어요, 잘 하는분들 보면 너무 부러웠는데 이걸로 연습을 한번 해봐야겠습니다"
9791185933283,10,요즘 캘리그라피가 대세이기에 끌린 책입니다. 더구나 영문 캘리그라피라서 더욱 멋있어요. 영문의 다양한 필체를 접할 수 있었던 책이기도 하고요. 가끔 영문을 쓸 일도 있기에 좋은 참고가 될 책입니다.
9791185933283,10,"특별한 날, 좋은 사람에게 켈리그라피를 선물해보고 싶네요~ 혼자 하는 취미고 제격!"
9791185933283,10,악필과 예술의 차이가 무엇인 지 알 수 있게 만들어 준 책이었다... 그리고 쉽게 나아지진 않겠지만 적어도 이 책을 보면서 한 번 해보자라는 마음가짐을 가질 수 있었다.
9791185933283,10,특별한 날이나 선물로 켈리그라피 엽서나 편지는 정말 좋은 것 같아요
9791185933283,10,한글보다 좀 더 이쁘게 연출되는 영어로..캘리그라피를 하면더욱 멋스럽네요..생일카드를  꾸며서 나만의 특별한 카드도 만들고선물도 줄 수 있고 너무 좋을 꺼 같아요^**^악필도 나름대로 멋스러운 고급체로 변하는 누구에게나 희망을 주는 책 같아요..보는 것만도 이쁘게 좋아요♡♡
9791185933283,10,"캘리그라피를 배우고 싶은데, 시간이 나지 않아서 망설이고 있었는데요. 이렇게 책으로 배울 수 있다니 감동적이네요. 바로 주문해야겠어요. 예쁘게 써서 지인들에게 감사편지 꼭 보내야겠어요 ^^"
9791185933283,10,"캘리그라피는 예쁜 손글씨를 쓴다는 단순한 취미의 목적을 넘어서 치유의 목적 또한 가질 수 있는 것 같아요. 마음을 정리하고, 흥분을 가라앉히기에도 좋다는 생각이 드네요. 무엇보다 내 손으로 그려낸 창작물을 누군가에게 선물한다는 것, 그 멋있고 두근대는 일에 이 책을 참고하면 좋겠어요"
9791185933283,10,특별한 날에 손글씨로 편지나 카드를 써보낼 때 꼭 이 책을 통해서 배운 캘리그래피로 예쁘게 만들고 싶네요.
9791185933283,10,캘리그라피에 관심을 가지고 있었는데 붓펜 말고도 다양한 펜을 쓸 수 있는 방법을 알려주어서 정말 좋습니다!! 두고두고 연습하려고 합니다~~ 글씨를 잘 못쓰는 사람들에게 강추!!
9791185933283,10,잘 연습해 두었다가 기념일에 예쁘게 글씨 써 주면 좋겠네요.
9791185933283,10,캘리그라피 독학 할 때 많은 도움이 될 거 같아요.
9791185933283,10,"계속 캘리그라피를 배우고 싶었지만, 아이가 있어 배우기 어려웠었습니다. 이번 기회에 혼자서 한번 터득해보려고요^^"
9791185933283,10,"특별한 나를 더욱 특별하게 만들어주는 캘리그라피, 쉽게 따라할수 있어 무척 유용합니다."
9791185933283,10,캘리그라피 팬을 사서 연습을 해보고 있지만 아직 부족한 것 같아요 이 책을 보면서 한 자 한 자 따라해보면서 연습을 더 해야겠다는 생각이 드네요
9791185933283,10,손글씨가 부족하고 장식이 서투른 사람들특별하고 소중한 선물장식을 한번쯤 해보고 싶은 사람들 을 위한캘리그라피 연습을 해보고싶어요
9791185933283,10,기본적인 철자부터 하나하나씩 연습 할 수 있도록 되어 있어 좋습니다.  캘리그라피틑 연습으로 이쁘게 쓸 수 있어 편지 보낼때 활용하기 좋을 것같아요
9791185933283,8,"나를 나타내고 싶을때, 돈보다는 정성를 쏟고 싶을때, 센스있다는 이야기를 듣고 싶을때, 이모든 이야기를 만족시킬수있는 요건을 가지게 만들수 있는 책은 바로 요것 !!!"
9791185933283,10,기념일에 직접 쓴 캘리그라피 편지를 선물하고 싶은 분께 좋은 책이네요. 선물은 정성이 중요한데 이 캘리그라피 연습을 통해서 정성을 조금 더 솔직하게 전달 할 수 있을 것 같습니다. 책을 보고 차근차근 배워가면 생각만큼 어렵지 않고 나름의 재미를 붙일 수도 있어서 더욱 좋은 것 같아요.
9791185933283,10,마치 처음 글쓰기를 배우듯이 생소하고 미적 감각 없는 사람들도 따라서 천천히 연습한다면 멋진 캘리그라피를 통해 표현할 수 있을 것 같다.
9791185933283,10,캘리그라피 강좌 같은거 들으려고 해도 시간이 맞지않아 힘들었는데책을 보면서 천천히 배워보고 싶네요 사용된 펜들도 비교적 쉽게 쓸 수 있을 거 같아요
9791185933283,10,캘리그라피를 꼭 한 번 배워보고 싶었는데 이 책을 보니 쉽게 따라할 수 있을 것 같아요. 예쁘게 꾸민 엽서를 사람들에게 나누어주기 위해서도 꼭 따라서 연습해봐야겠어요.
9791185933283,10,저같은 악필도 캘리그라피를 할 수 있다는 한줄기 희망을 내려줄까요? ㅎㅎ구매해야겠습니다!
9788970416618,6,"레트로 개념에 대한 논의는 거의 없다. 거의 디자인 현상에 집중하고 있을 뿐. 기대했던 부분을 찾지 못했지만, 몰랐던 내용을 알게 되었으니, 충분하다."
9788972977421,8,디자인하는 과정에 대해 배울 수 있었다.
9788972977421,10,책 디자인도 역시 예쁘구 디자인이 세상에 어떻게 나오는지 알게되니 좀더 디자인에 관심을 가지게 되네요
9788972977421,10,사람이 디자인이라는 문구에서 열정을 볼수있었네요 기대됩니다
9788972977421,10,디자인이 쉽게 나오지 않는다는걸 알게되었습니다
9788972977421,10,30년간 디자인에 몸담은 분들의 이야기 흥미롭습니다.
9788972977421,10,디자인을 잘하지 못하지만 그들의 열정을 응원하고 싶어집니다
9788972977421,10,디자인에 대한 열정을 느낄 수있었습니다. 흥미롭네요
9788972977421,8,디자인이라는 게 원하는 대로 바로바로 나올 수 있는 쉬운 게 아닌데. 하나의 작품을 만들기 위해 노력 하는 그들의 어려운 점에 대해 잘 알 수 있을 것 같습니다.
9788972977421,10,디자이너들의 열정을 본받을수있는 책입니다.
9788972977421,8,예전에 디자인을 공부하고 일을 했던 사람으로써 공감도 가고 예전 생각도 나는 흥미로운 책이네요.
9788972977421,10,아트디렉터들의 어려운 점은 어떤 이론서보다 더 생동감있네요.
9788972977421,10,디자이너들의 힘든 일상과 고뇌를 알수있었네요. 그들의 마음가짐에서 배워갑니다
9788972977421,10,아트디렉터가 말하는 디자인에 대해 알수있었다.
9788972977421,10,디자인의 고충을 알수있는 계기가 된 책이라서 흥미진진했네요
9788972977421,10,디자인이 힘든작업이라는것을 조금이나마 이해하게 되었습니다.
9788972977421,10,디자인에 대한 이야기를 엿볼수있고 작가들의 생각을 들을수있어서 흥미로웠습니다
9788972977421,10,아트디렉터가 말하는 디자인이 어떤건지 이야기를 알수있네요.
9788972977421,8,아트 디렉터가 말하는 디자인에 대한 생각을 들을 수 있어서 좋고 디자인은 역시 평범한 사람은 할 수 없는 어려운 작업이구나 라는 생각이 들어 부럽기도 하고 흥미로운 책이었네요.
9788972977421,10,아트디렉터의 디자인에 대한 정의와 그것이 무엇일까 하는 작가의 물음과 답이 디자인에 대하여 잘 모르는 일반인에게 유익하고 흥미롭게 전달될 수가 있어서 좋고 기대됩니다.
9788972977421,8,디자인이라는 창조적인 작업을 위해 열심히 노력하는 모습을 생생하게 볼 수 있는 점이 좋습니다.디자이너를 꿈꾸꺼나 디자인에 대한 관심이 많은 사람들이 보면 좋을 것 같네요.
9788972977421,10,디자인에 대해 알 수 있어서 좋았습니다 저같은 문외한에게도 참 흥미로운 책이네요
9788972977421,10,디자인에 관심이 많은 분들이 읽으시면 좋을 것 같아요
9788972977421,10,디자이너의 일을 잘 알려주는 책..
9788972977421,8,디자이너가 참 쉽지가 않은데 그 삶을 재미나게 잘 펼쳐서 흥미로울꺼 같네요~
9788972977421,8,"디자이너, 어쩌면 멀고도 먼 그 안을 살짝 구경할수 있을 것 같네요"
9788972977421,10,디자인하시는 분들 참 대단하다고 생각했는데 어떤 이야기가 담겨있을지 궁금하네요
9788972977421,10,아트디렉터란 직업을 생생하게 느낄수 있었던 책이었습니다
9788972977421,10,예술가들의 삶에 대해 잘 알 수 있어서 흥미롭습니다.
9788972977421,10,삽화도 예쁘고 내용도 마음에 듭니다
9788972977421,10,"평소 디자인을 잘하는 사람들을 보면 부러웠었는데, 아트디렉터인 홍동원 디자이너의 과거, 현재의 작업물들을 만나볼 수 있어서 좋았습니다."
9788972977421,10,사람이 디자인이다 라는 문구로 관심이 가는 책이네요. 생각에서 출발하는 디자인! 기대됩니다.
9788972977421,10,책도이쁘고디자인에대해많이알수있어좋습니다
9788972977421,10,사람이 디자인이다 라는 말이 멋있네요디자인 쪽 일하는 친구에게 선물하고 싶은 책입니다
9788972977421,10,삽화도 글도 재미잇겠습니다.
9788972977421,10,주변에서 바라 볼 수 있는 모습을 글로 다루어지니까 색 다르네요
9788972977421,10,사람이 디자인이다 라는 글귀가 시선을 사로잡네요아트디렉터 홍동원의 디자인 노하우를 알 수 있다니 기대가됩니다
9788972977421,10,실제 편집 디자인이 세상에 나오기까지 어떤 과정을 거쳐서 나오는 지 궁금했었는데 디자이너가 직접 쓴 생생한 경험담을 담은 책이라 기대됩니다. 많은 시각적인 물건들 중에서 더 돋보일 수 있도록 도와주는 디자인을 창조하기 위해 많은 노력이 필요할 것 같네요. 디자인에 관한 내용이 기대됩니다.
9788972977421,10,사진이 접목되어 시각적 재미가 더해지네요
9788972977421,8,일단 책자체의 디자인도 너무 이뿐 것 같네요. 디자이너의 고민이 잘 묻어나는 책인 것 같아 흥미로워보입니다.
9788972977421,10,힘든 창작과장에서 그들이 느끼는 직업에 대한 생각과 고뇌를 알 수 있어 좋았어요.
9788972977421,10,디자이너의 일상을 솔직하게 엿볼 수 있어 재미있으면서 신선한 느낌이 듭니다.
9788972977421,10,디자이너의 겉모습과는 달리 숨은 노력과 열정이 돋보이는 책입니다.
9788972977421,10,사람이 디자인이라는 말이 참 인상적입니다..일반인과 다른 사람같은 분의 책이지만 읽다보면그들의 삶과 생각을 알수있고 전공자라면 디자인을 하는 자세와 마음가짐을 같이 배울수 있는 책같아 기대가 되고 흥미롭네요
9788972977421,10,"광고, 디자인 모두 창작이 힘들지만 그작업을 하는 디자이너분들의 이야기를 볼 수 있을듯."
9788972977421,10,광고주님과 디자이너와 아트디렉터의 삼각관계를 잘 보여주는 책이라 생각이 듭니다. 디자인은 해가져야 일이 시작된다는 말이 공감이 가네요. 남들은 다 퇴근하는데 혼자 책상에 앉아서 뭘 하고 있는지 모를 때가 많았던 그 기억들이 생각납니다. 정말 기대됩니다!!
9788972977421,10,하나의 멋진 작품이 완성되기까지의 고뇌와 노력이 잘 보여서 좋은 듯 합니다. 재밌게 읽을 수 있어요.
9788972977421,10,디자인이 얼마나 힘든 작업인지 알게되었네요. 쉽게 나오는 작품이 아니라는점 깨달았습니다
9788972977421,10,디자이너에 대한 이야기를 알 수 있어서 좋은 책이네요.
9788972977421,10,디자인 그 골치아픔에 대하여
9788972977421,8,논리적이지 않은것. 결코 글로써 설명할 수 없는것. 알고 싶네요... 어쩌면 빠르게 흘러가는 지금 시대에 디자인이라는 것이 말보다 한장의 무언가로 표현된다면 그게 바로 정확한 대화고 의사소통이 될 수 있을거 같네요..
9788972977421,10,디자이너 삶에 관한 이야기를 생생하게 볼수있네요.
9788972977421,10,디자이너의 이야기를 들어볼 수 있을것 같아 꼭 읽어보고싶네요
9788972977421,10,뭔가 오래 알고 지낸 대선배 디자이너와 카페에서 편하게 대화를 나눈 기분이랄까. 재미있는 어투와 이야기들이 가득했다.
9788972977421,10,꼭 한번 읽어보고 싶어지는 책이네요
9788972977421,10,디자이너의 고달픔을 느낄수 있네요
9788972977421,8,창작의 삶이 힘들지만 타인에게는 위안을 주고 힘을 주기도 하죠
9788972977421,10,디자인에 대하여 다시 한 번 생각해 볼 수 있는 책일 것 같네요. 기대됩니다.
9788972977421,10,디자이너의 삶을 조금 엿볼수있을것같아요
9788972977421,8,한 명의 사람으로서 그리고 디자이너로서 어떤 삶을 살아왔는지 잘 드러나 있을 거 같네요.
9788972977421,8,"아트디렉터라는 직업에 대해서 알 수 있을 것 같고, 디자이너들이 어떻게 영감을 얻는지가 무척이나 궁금했는데 그 궁금증을 풀 수 있을 것 같아요."
9788972977421,10,디자이너의 작업물을 엮은 책 한 번 보고싶은 그런 책인 것 같아요
9788972977421,10,"디자이너는 말만 들어도 신비롭게 느껴집니다. 작품이 탄생하기까지의 과정이 담겨있으니, 흥미롭게 볼 수 있을 것 같습니다. 항상 궁금했거든요. 디자이너의 생각이 말이죠."
9788972977421,10,디자이너의 삶과 철학을 만날수 있는 책.
9788972977421,10,이런 낙서같은거 좋아하는 저에게는 굉장히 공감되고 재미있을 것 같은 책이에요. 디자이너의 이야기를 들어보고 싶습니다.
9788972977421,8,따뜻함이 묻어있는 디자인에 대한 책이네요
9788972977421,10,나도 학창시절 디자인 쪽에 꿈을 그렸던 적이 있었는데 한번 디자이너의 이야기를 체험해보고 싶다는 생각이 드는군요.
9788972977421,10,아트 디렉터라는 직업에 관해 조금더 깊이 알것같은 기대감이 듭니다. 저자도 멋지시네요~ 어떤이야기가 들어있을지 궁금하네요
9788972977421,10,아트디렉터의 책인 만큼 시각적으로 볼거리가 많은 책이라 좋네요.
9788972977421,10,유용한 정보가 많아서 도움이 되겠어요 기대됩니다^^
9788972977421,8,"｀사람이 디자인이다｀라,, 일을 하면서 디자인이 필요해질 때가 있어 디자이너분들과 미팅을 하게 되면 어쩜 그렇게 샘솟는 아이디어를 가지고 계실까 궁금했는데 삶이 그런 아이디어의 원천이었군요."
9788972977421,10,일단 저도 디자인을 배우고 있는 학생으로서 내용이 궁금하기도 하고 책표지가 정말 한 밤중에 일어나는 어떤 사건! 같은 느낌이라 구매해봤습니다. 읽으면서 씁쓸하면서도.. 공감이 가더라구요..
9788972977421,10,디자인에 대해 많은 것을 배울 수 있었습니다.
9788972977421,10,직접 잡지 표지를 디자인 하는 것처럼 생생함이 전해져오네요. 어떻게 만들어지는지 작업과정이 궁금했었는데 정말 좋아요.
9788972977421,8,디자인. 디자인. 그리고 디자인. 디자이너에 대한 책
9788972977421,10,디자인을 위한 삶이 엿보이는 책입니다. 기대하겠습니다.
9788972977421,10,작가의 작업실이 한눈에 그려지네요.
9788972977421,10,디자이너를 지원하는 분들에게 한번 권하고 싶습니다
9788972977421,10,디자인라는 예술분야에서 얼마나 많은 노력으로 작움이 나오는지 다시한번 느끼게 되네요.
9788972977421,10,"본인이 가장 좋아하는 일, 그리고 제대로 할 줄 아는 일에 몰두하는 저자의 모습에서 은은한 감동을 느끼며, 자기반성을 하게 됩니다."
9788972977421,10,"디자인을 공부하는 사람이라면 추천해주고 싶은 책이다. 흔한 디자인 이론서가 아니라 사람과 삶으로부터 창조되는 디자인을 글과 그림으로 나타내었다고 하고, 영감을 얻는 방법과 디자이너의 고뇌 등을 알 수 있어 읽어보면 많은 도움이될 것 같습니다."
9788972977421,8,묵묵하게 자기일에 빠져있고 돈벌이에 연연하지 않는 모습에 감동을 받네요
9788972977421,10,작가의 삶이 묻어나는 책이다. 배울 점이 참 많다.
9788972977421,10,한 번 읽어보고 싶습니다.
9788972977421,10,처음에는 몰랐는데 다시금 살피니 부제가 노랫말이었네요. 참 탐나는 책입니다. 이런 책은 친필 싸인이 들어있어야 제맛인데.
9788972977421,10,정말 주변의 모든 것이 디자인이라는 사실을 인식하지 못하고 있었던 것 같네요. 디자인 과정을 볼 수 있었던 것도 좋았지만 저자의 고집스러운 디자인 철학을 만나 많이 배우는 기회가 됐습니다.
9788972977421,10,디자이너들이 디자인을 하는 과정은 어떨지 궁금했는데 이 책으로 알 수 있을 것 같아요. 그리고 디자이너의 솔직한 생각과 일상을 엿본 것 같아서 더욱 흥미롭습니다. 디자인에 대한 제 꿈을 더욱 키워주는 책이네요.
9788972977421,10,사볼 가치가 충분한 책이네요. 정말 멋집니다.
9788972977421,10,한번 도전해보고 싶은 분야다...
9788972977421,10,따뜻함이 묻어있는 디자인에 대한 책이네요. 이론이 아닌 실제 삶을 이야기한 책이라 더 공감이 가는 것 같습니다.
9788972977421,10,살아 숨쉬는 디자인 창조 과정과 디자인의 세계에 대한 이해
9788972977421,10,"항상 최종 완성된 디자인을 무심하게 보고 지나쳤는데, 이렇게 익숙하게 지나쳤던 디자인의 창조과정을 보니 정말 신기하고 사물이 달라보이는 것 같아요."
9788972977421,8,"사람이 디자인이고, 디자인이 삶 인 아트디렉터 홍동원의 멋진 디자인들과 디자인 노하우가 담긴 흥미로운 책."
9788972977421,10,부제가 재미있네요. 어찌보면 저 업계의 만상을 한 문장에 담아낸 말 같기도 ^^
9788972977421,10,디자인이 탄생하는 삼거리 작업실에서의 이야기들
9788972977421,10,디자인의 세계를 잘 보여주는 책인것 같네요
9788972977421,10,"디자인에 대한 개인의 아카이브를 선뜻 보여주다니, 즐거운 마음으로 볼 수 있는 책인 것 같습니다. 우리나라에도 이런 책이 많았으면 합니다."
9788972977421,10,디자인의 세계에 대해 더 잘 알수 있겠습니다.
9788972977421,10,디자이너의 세계를 알려주는 것이 참 좋네요 현실은 녹녹치 않지만 그래도 이 책을 읽고 디자이너에 대해 자세히 알수 있어서 좋다고 생각
9788972977421,10,표지 디자인등 다양하게 작업하시는 모습을 옆에서 지켜보는듯한생생함이 전해지네요. 디자이너의 삶을 엿볼수 있을것 같아요.
9788972977421,10,디자인을 어떻게 하는지 궁금했는데 한번 디자이너의 이야기를 살펴보고 싶네요. 재미있을 것 같아요.
9788965820901,10,이건 정말 재밌을것 같은 보다 시리즈 입니다. 시각 자료도 많고 해서 보기 좋을 것 같아요!
9788965820901,10,5월에 다녀온 공주박물관을 생각하며 읽을 수 있어서 더 좋았어요.
9788965820901,10,서양의 아름다움 못지않은 한국의 미술문화에 대해 알 수 있을 것 같습니다.
9788965820901,10,스토리형식으로 보는 책 강추
9788965820901,8,찬란한 삼국시대부터 조선 그리고 현대까지..서양미술 못지않은 풍부한 한국 미술문화를 볼수 있을듯하다.서양미술작품만 접한 나 자신을 반성하며
9788965820901,10,"최고의 스토리텔링으로 맛보는 한국미술사 이야기를 통해, 진정한 한국문화의 숨결을 느낄 수 있습니다"
9788965820901,10,어렵게 생각되는 한국미술사를 풍부한 화보와 함께 볼수 있다니 흥미롭네요..더구나 장르별로 있어서 원하는 분야부터 볼수있다니 웬지 마음이 편합니다..소박한 밥그릇도 화려한 금관도 한국의 아름다움을 나타내고 발견할수 있다는 점이 끌리네요
9788965820901,10,막연히 궁금해만 했던 미술사에 대해서 자세히 알 수 있게 해 주는 책입니다.
9788965820901,10,잘 모르는 한국미술에 대해 알 수 있는 기회네요.
9788965820901,10,난해하게만 느껴졌던 미술사를 이책을 통해 쉽게 배울수 있을것 같아요..분야별로 되어있어 관심있는 분야부터 볼수 있으니 부담도 덜하네요..좋은책 감사합니다
9788965820901,10,박물관에 온 것 같은 자세한 사진과 설명이 이해하기 쉬워진다
9788965820901,10,사진들이 많이 있어서 더 좋아요
9788965820901,10,한국미술에 대해 기본적인 지식밖에 없었는데 보다 자세히 알수있어 유용한 책이 될것같아요.
9788965820901,10,한국 미술에 숨어있는 미학과 조상들의 의식 그리고 미처 알지 못했던 문화를 알수 있는 좋은 자료라 생각합니다. 특히 ｀생각해 보세요｀코너에 유익한 정보가 많을 것 같아요.
9788965820901,10,그림과 더불어 재미있게 풀어써서 한국미술사를 흥미롭게 읽을수 있겠어요.
9788965820901,10,"미술품 얘기라 하면 딱딱할 거라는 편견이 있는데, 재미있는 이야기로 풀어준다니 편하게 접근이 가능할 듯 싶습니다."
9788965820901,10,도판이 다채롭워 흥미롭게 한국 미술을 배울 수 있을 듯합니다.
9788965820901,10,한국사를 사진과 간단한 배경내용과 함께 읽을 수 있어서 좋다
9788965820901,10,한국미술사에 대해 알고싶은 분들께 도움이 되는 책입니다
9788965820901,10,한국미술사에 대해 자세하고 기록되어 있어서 너무 좋습니다.
9788965820901,8,흔히 유럽으로 대표되는 서양문물의 우수성을 호도하지만 한국의 예술을 다시 바라볼 수 있는 이런 책도 매우 중요하다고 생각됩니다.
9788965820901,10,한국의 미술사들은 무척이나 아름답죠. 그 아름다움들을 책으로 만나볼 수 있다니 너무 좋습니다.
9788965820901,10,한국미술사를 간단하고 간결하게 정리한 책. 미술과 예술에 관심이 있다면 아주 유용한 책이 될 듯.
9788965820901,10,보통 장황히 서술만 길기 마련인데 이번 ｀한국 미술사를 보다｀는 설명과 사진 자료가 함께라서 좋네요. 교양과 기타 시험준비에도 좋을 듯해요.
9788965820901,10,"보다 시리즈에서 가장 좋은 점이 스토리텔링인 것 같아요. 보다 시리즈의 다른 책들도 읽어 봤지만, 나이 상관 없이 읽을 수 있게 되어 있는 점이 가장 맘에 들어요. 한국미술사를 보다는 흐름과 분야별로 되어 있어서 한국미술에 대해 쉽고 잘 이해할 수 있게 도와주는 것 같아요."
9788965820901,10,한국미술사를 보기 쉽게 알수있어서 흥미롭네요
9788965820901,10,우리나라 미술사와 문화재에 대해 쉽게 이해할 수 있을 것같아요. 큼지막한 사진과 함께라서 더 보기좋습니다.
