ISBN13,rating,review
9788932905969,10,아름다움이란 무엇인지. 인간은 왜 아름다움을 그토록 추구하는지근본적인 본질을 이해할수 있어서 좋았습니다.
9788932905969,10,그리스의 미에 대해 알수있어서 좋아요.본질적인 미에 대해 다시 생각해볼수 있어서더욱 더 좋았습니다.
9788932905969,8,"움베르토 에코의 해박한 지식을 알수 있는 책이다. 문학, 회화, 음악등을 넘나들며 이런 지식을 가지고 있다는 것이 부러울뿐이다."
9788932905969,10,미의 역사를 아름다운 볼거리 사진 중심으로 서술했기 때문에 가벼운 마음으로 일별할 수 있음
9788932905969,4,도판을 제외하고 읽는다면 굉장히 얄팍해서 실망스러운 책이다.
9788932905969,8,흥미롭습니다.
9788932905969,10,미학에 대해 깔끔하게 정리하고 있다.
9788932905969,10,"움베르토 에코.
끝."
9788932905969,10,아름다움이란 결코 불변하는 것이 아니라 시대와 문화에 따라 다른 면모를 지니고 있다
9788932905969,10,활자에서 전해지는 지적 쾌감이 너무 좋은 책
9788932905969,10,"오늘 , 세트로 구매했는데 그야말로 환상 ^^"
9788932905969,8,좋은 책을 즐거운 교재로 황용하도록 하겟습니다
9788932905969,8,멋진 책. 그림과 글이 참 좋습니다.
9788986353785,6,"“美란 무엇인가?”

“美가 객관적으로 실존 하느냐?”"
9788976680259,8,나라와 나라 사이의 해법인 서로간의 호의라는 기본 개념과 그것의 방편으로 등장하는 조선의 예술의 파악이 부수적으로 우러나오는 개인 에세이와 미학의 명저. 도서관에 마침 있기에 읽다가 이틀 후에 아예 사버렸다
9788963247250,10,알기쉽게되어있고 유익한 내용들이었어요!
9791165393243,8,"오늘 택배를 수령하고 난 뒤 책의 상태를 살펴보니 흠집이나찍힌 자국 등 외관상으로 깨끗해 보이고, 내용 면지도 그런대로 깨끗해 이 부분은 만족해요~^^그러나 내용면에서 글자 오타나 맞춤법에 이상이 있는지 없는지는 정독하면서 확인해 봐야 알것 같아요~아무튼 열심히 공부해야 겠어요~~"
9788950988722,8,"대상에 대한 전문적이며 객관적인 지식, 소재를 향한 넉넉한 사랑과 관심과 호기심, 유연하고 부드러운 태도에 훌륭한 글솜씨까지. 기획의도에 부합하는 최적의 저자 선정이 이렇게 중요하다. 다만 페르메이르가 워낙 제대로 알려진 게 없는 작가라 확신이 없는 목소리는 어쩔 수 없이 아쉽다."
9788950988722,10,몇 백 년간 잊힌 화가 페르메이르를 따라가는 여정은 마치 한편의 소설을 읽는 것 같았다. 올해 읽은 미술책 중 가장 아름다운 책.
9788950988722,10,<진주귀걸이 소녀>로 유명한 베르메르를 이제 페르메이르로 읽네요. 잘 알려지지 않았던 작가의 삶을 따라가는 여정이 재미있게 씌여있어요
9788930662192,10,<미적 판단력 비판>은 칸트의 제3 비판서 <<판단력비판>>의 1부 제목입니다. 2부는 <목적론적 판단력 비판>이죠. 따라서 이 입문서의 제목은 역자나 저자가 멋대로 정한 것이 아니랍니다. 게다가 책 설명에도 판단력비판의 1부 내용을 다루고 있다고 되어있습니다.
9788946066885,10,여성학 관심있다면 추천합니다.
9788946066885,6,44000원에 구매했는데 왜 가격이 내려..갔을까요..
9788935663385,10,예술관련 책을 종종 읽는 편이지만.이 책은 두루두루 읽을만하다. 두번도 읽을만하다. 보석하나를 또 얻었다.
9788931021097,2,벤야민 인용 횟수 세다가 덮어버림
9788931021097,8,"이 책은 소비를 11 키워드로 분류한다. 소비를 이해할 수 있는 개념으로 “구별짓기”와 “기호가치”라는데 동의하나, 각론에서는 논쟁이 필요하다. 끝으로 나는 그동안 어떻게 소비했는지 곰곰히 되새겨본다."
9791190413008,4,"책의 전반부는 이해 할 수 있으나...후반부에는 조영남 사건에 대한 반대 의견자들에 대한 실랄한 비판/비난..최근의 작가 모습과 언행이 책에..투영되어 있는 듯한 느낌, 조영남 사건 보고서 같은 느낌, 기존의 저자의 책과는 다소 다르다고 느껴짐.."
9791190413008,10,"단지 조영남 사건에 대해서만 다루지 않기 때문에, 현대미술의 개념(혹은 양상)을 이해하기에도 좋은 책이다.  확실히 글을 쉽게 읽히게 하는 재주가 있다. (진중권 씨는 정치에 대한 이야기는 그만 하시고, 미학, 미술에 대해서만 이야기하셨으면 좋겠다. 이렇게 들려줄 이야기가 많으신데..)"
9791190413008,10,"역시 기대했던 책이고,  기대한 것 이상입니다"
9791190413008,2,걍 읽기가 싫네요. 저자의 이름만 봐도
9791190413008,10,"1-9장까지 미술사 전개가 꽤 흥미로웠다.  미켈란젤로, 렘브란트, 루벤스, 들라크루아의 그림 이야기는 놀라웠다. 이후 낭만주의에 이은 20세기 미술사는 파노라마였다. 예술작품보다 작품의 창조과정에서  드러난 예술사의 커튼이 열리는 느낌이었다. 정말 유익했다."
9791190413008,2,현대 미술에 대한 몰이해. 라고 하지만 정당성 없는 조국에 대한 수사에 대해 민주적으로 항의하는것을 조국기부대라고 표현하는 분은. 지금 벌어지는 사실조차 판단할수 없는 사람이. 자기가 읽은것에 대해서 몰이해라고 하는 식의 얘기하는 수준이면 더 읽어서 뭐할까요. 당장 사실판단도 모자란분이
9791190413008,10,"제목스러운 책색감 좋아요. 조영남 사건에 관하여 부터 읽는데, 인문학적 소양의 무지를 또한번 절감합니다. 대중적 글쓰기로 확 와닿아서 저같은 비전문가에게도 쉽게 읽힙니다. 귀한 책 감사합니디ㅡ"
9788961952194,10,한국미술계와 미술비평에 관한 16개의 인터뷰.
9791128814303,10,"방탄소년단에게 ‘아미‘란 그냥 팬이라는 의미라고 두기에는 아쉽다고 생각했는데, 이 책은 방탄과 아미와의 관계를 재밌고 알기 쉽게 잘 설명한것 같아요."
9791128814303,10,이 책을 읽고 왜 방탄이 무대마다 그토록 아미를 부르며 감사와 찬사를 보내는지 제대로 이해할 수 있게 되었어요. 감동적인 그들의 관계가 전대미문의 새로운 역사가 되고 있는 현장을 한국인으로서 가장 가깝게 지켜볼 수 있게되어 영광입니다. 통찰력을 가지고 깊이 있게 쓴 에세이 잘 읽었습니다.
9791128814303,10,입덕 후 제 행적을 마치 본것마냥 ㅎㅎ BTS 와 또 아미와 함께 울고 분노하고 기뻐하고 행복했던 행적들을 일기처럼 정리 해 놓은 듯한 책이네요보면서 그래.. 이런일도 있었지 그래그래 지금은 지나왔으니 웃으며 얘기 할 수 있지.. 아 이때 정말 좋았는데.. 하면서 읽었어요
9791128814303,10,아직배송이되진않았지만너무기대가되네요얼른왔으면좋겠어요이렇게방탄소년단에대하여더잘알아가고싶어요방탄소년단화이팅
9791128814303,10,아미가 되고 나서 겪은 일련의 사건들...글자로 마주하니 생경하기도 하고 어떻게 헤쳐 왔는지 추억하면서 가만히 숨을 내뱉는 시간이었습니다. 또한 어떤 위로를 받았고 어떤 마음으로 아미가 되었는지 다시 생각해볼 수 있는 시간이었습니다.  좋은 책 감사합니다.
9791128814303,10,지금 왜 세계적으로 방탄이 인기가 있는지 궁금한 중장년세대분들은 이책 하나만 읽어보면 알 수 있을거 같습니다저또한 같은 의문으로 보기시작한 영상으로 입덕을 했고 저자와 비슷한 경로를 걸은것 같습니다아미시지만 아미의 관점이 아닌 일반인의 관점으로 잘 정리해주셔서 재밌게 읽었읍니다
9791128814303,10,청소년들은 누군가를 통해 배우고 자신을 확장하는 시기에 방탄과 아미들 자체가 청소년들에게 표상이 된 것 같다. 책의 앞을 몇장을 넘기면서˝ 다녀와야 할 곳이면 다녀오면 되고 우린 그동안 기다리면 된다.”는 팬텀의 반응에서 나에게 이 책을 빨리 읽고 싶게 한다.
9791128814303,10,"저의 1년반 남짓의 아미 기록을 읽은 것 같은 느낌이어서 친근했습니다~ 어머니께서도 예전부터 아미의 원동력에 대해 궁금해 하셨어서, 책에서 몇단락 발췌해서 읽어드렸어요. ˝요즘 애들˝에 관심이 많은 어머니 지인분도 궁금해하신다고 하셔서 그분께 드리는 선물로 한 권 더 구매합니다~^^"
9791128814303,10,비아미인 사람도 쉽게 팬덤아미에대해 이해할 수 있도록 잘 정리한 책입니다. 저자도 아미인데 불구하고 최대한 객관적으로 작성한 글들이 너무 마음에 들고 앞으로 아미가 나아가야할길에 대한 내용도 너무 좋았습니다.
9791128814303,6,방탄소년단을 메이저언론이 특집으로 다룬 것은 수년전 월간조선입니다. 당시 국내에선 BTS라는 말도 생소했고 전혀 이슈화되지 않았죠. 빌보드1위를 하니까 그제서야 너도나도 BTS코인탑승에 급급한 꼴이 가관이죠. 연예이슈를 넘어 이 기현상이 의미하는 사회적 의미를 깊이 통찰할 필요가 있습니다.
9791128814303,10,"BTS의 거대한 날개가 되어준 아미, 그 날개로 세계적인 팝 아티스트로 날아오른 BTS. 가장 현대적이고 대중적인 팝 문화가 어떻게 만들어지고 발전했는가를 볼 수 있어서 크나큰 감동으로 다가오네요. ˝본 리뷰는 출판사 경품 이벤트 응모용으로 작성하였습니다.˝"
9791128814303,10,방탄소년단의 인기에 세계가 그들의 인기 원인을 분석하고자 많은 노력을 합니다. 복잡한 접근의 원인보다는 어쩌면 그들의 인기의 시작은 원초적이고 가장 기본적인 것일지도 모릅니다. 바로 방탄소년과 아미 입니다. 이 책은 바로 여기서부터 시작합니다. 방탄소년단과 그리고 그들의 아미.
9791128814303,10,"늦덕이라 bts에 대해 데뷔초부터 지금까지 어떻게 올라왔는지 잘은 모르지만 그들의 진실성,추구성,열정은 이미 다 알아버렸다 그리고 무엇보다 팬을 제일로 생각하는 부분이, 그래서 bts가 좋은 이유이다"
9791128814303,10,책사이즈 한손에 잡히게 좋구요. 제가 늦덕이라 아미로서 궁금해서 읽어 본건데 해외아미노력에 감동받았고 ㅜㅜ 잘 몰랐던 숨은이슈들도 알고갑니다.
9791128814303,10,아카-팬으로 쓸 수 있는 BTS 팬덤 분석이 기대됩니다. 아티스트 BTS와 팬 A.R.M.Y.의 긍정적 상호관계에 대해 더욱 깊이 알 수 있을 것 같아요:)
9791128814303,10,방탄의 드러난 혹은 드러나지 않은 수많은 아미들을 위한 책이라는 생각이 드네요..   한국을 넘어 전세계적인 방탄신드롬을 불러일으키고  k-pop의 위상을 상상하지 못했던 수준으로 끌어올린 아미들의 저력과 그 결속력의 비밀과  선한 영향력을 속속들이 이해할 수 있기를 기대합니다.
9788963652580,10,"이 책의 여러가지 문제들에도 불구하고 난 여러 번 이 책을 추천해 왔다. 그것은 이 책의 예술에 대한 정의(어쩌면 주장이나 권유에 가까운)가 분명하기 때문이다. ˝민중 예술˝, 그리고 그 정의는 여타의 것들과 구분되고 신선하면서 동시에 지금의 나의 관점과도 충돌해 많은 것을 느끼게 한다."
9791187050704,8,[장르 오타쿠 듀나의 수다]▷아무래도 듀나의 시선과 취향이 묻어나는 글이다. 본인 말따마나 글은 조금씩 모순되기도 한다. 내가 볼때는 폭주하는 경우도 있고 다소 편협한 시선이 보이는 경우도 있다. 그럼에도 듀나의 글은 재미있다. 자기가 좋아하는 것에 대해 말하는 오타쿠의 수다는 전문성과 식견이 뒷받침되는 순간 매력적인 이야기가 된다. 술술 읽히는 문장을 따라 장르를 한번 휘익 떠돌기 좋은 책이다.
9791187050704,8,매우 유익하다.!!
9791187050704,8,내용도 재미있지만 작가의 말투가 묻어나는 문장을 읽는 재미가 더 크다
9791187050704,10,장르의 ‘장‘도 모르는 독자입니다. 막연히 알고 있었던 듀나 작가님을 이 책으로 처음 만났어요. 이제 작가님의 소설을 하나씩 읽어볼 참입니다.
9791187050704,10,"장르 소설 좋아한다고 하면 그게 소설이냐는 무시를 받을 때가 많아서 서러웠는데, 이 책을 통해서 장르 소설이 이렇게 재밌고 유익한 소설이라는 걸 느끼면서 상처받은 마음을 달랠 수 있을 것 같아요."
9791187050704,8,"장르를 바라보는, 장르를 이해하는 방식의 맹점을 밝힌다."
9791187050704,8,책 예뻐요. ‘장르 세계를 떠돌아’줘서 고맙습니다.
9791187050704,8,"출판사 소개처럼 장르 입덕 가이드가 될... 수도 있겠지만, 그보다는 원래부터 장르에 익숙하던 독자들이 더 즐거워할 책일 듯. 내용도 좋지만 늘 그렇듯 듀나의 서늘하고 상쾌한 문장을 읽는 일이 즐겁습니다. 에세이 더 많이 써주셨으면."
9791187050704,10,듀나의 가이드에 따라서 읽다보면 여행하는 기분도 들고 할것같아요
9791187050704,10,듀나의 탐사기를 보며 여행하는 기분이 들것같아요
9791187050704,10,듀나는 신이야!
9791187050704,10,다양한 작품들을 감상하면서 개성적인 장르가 표현해 내는 독특한 특징들을 제대로 알고 접근해 보면 더욱 좋을 것 같다는 생각이 들었는데 건축물의 뼈대와도 같은 작품의 장르를 공부하고 작품을 감상하면 더욱 큰 재미와 감동을 느낄 수 있을 것 같아요.
9791187050704,10,"듀나가 안내하는 장르 세계 입덕 가이드. SF 호러 추리 미스터리 등 다양한 장르를 넘나들며 장르적 특성을 설명하고 작가와 작품을 바라보는 관점을 보여주는 이책은 거장의 작품에서부터 역사의 뒤안길로 사라진 작품까지 각각의 장르가 어떤 식으로 발전해서 어떤 소용돌이를 거쳐 꿈틀대고 있는지 흥미진진하게 들려준다. 계보에 대한 해박한 지식, 작품의 상징성을 포착하는 통찰과 함께 앞으로 다양한 책을 읽고 싶어하는 독자들을 위한 훌륭한 길잡이가 될것이다"
9788952120571,10,"당신의 창작 열차가 잠시 멈췄다면, 이 책은 다시 열차를 달리게 할 좋은 연료!"
9791195739554,6,"일본 특유의 유형성숙으로서의 오타쿠 문화에 대한 분석이 흥미롭다가, 그 범위가 아이돌까지 가버려서 좀 질리는 느낌"
9791195739554,10,개별 작품만 놓고 봤을때는 헤아릴수 없었던 의미들을 시대의 흐름상에서 파악했을때 나타나는 다채로움에 아주 흥미진진하게 읽었습니다.
9788997128419,8,백남준의 진짜 본질은 비디오 아티스트니 뭐니가 아니라 ‘ 재담가 ‘ 이다.
9788958721611,10,건축가의 눈과 예술적인 공간에 대한 고찰..건축으로만 보는 철학적인 건축예술이 아닌 사람과 가장 밀접한 관련인 건축을 문이라는 새로운 차원의  작품 해석이 이해하기 쉽게 설명한 책이라 공간을 다시보게 되는 책입니다.
9788959064984,10,"광화문 광장에서 불린 노래들, 광화문 광장을 담은 영화에 관한 책인데, 읽다보면 광화문(광장)이라는 곳에 경외의 시선을 보내게 된다. 그곳에서 한번이라도 촛불을 들어본 사람이라면 감회가 남다를 듯."
9791196222604,10,"70년대 후반에서 80년대생인 사람이라면 누구나 어렴풋이나마 관련 추억을 가지고 있을 게임과 관련된 이야기를 여러가지 사회학적, 인문학적인 관점에서 쉽고 재미있게 풀어낸 책입니다. 옛 추억과 동시에 세상물정에 대한 여러 인식도 함께 접해볼 수 있는, 즐겁고 알찬 경험을 하게 해주는 책."
9788984117105,10,"대중서가 아니라 본격적인 예술 철학 입문서이다. 여러 철학자들의 견해를 비집고 들어가 적절하게 대조하고, 적절하게 다시 연결시키고 있다. 그러면서 헤매지 않는다. 저자 자신이 중심을 잡고 있기 때문이다. 명확한 규정과 명확한 대비, 그리고 새로운 연결 모색까지 탁월하다!"
9788984117105,4,1장 2장 읽었는데 어렵다 3장부터 쉬워질려나? 용어부터 너무 생소해서 입문용은 아닌듯합니다.
9788984116962,10,판단력 비판에 대한 믿을만한 길잡이. 단순한 개론서가 아니라 판단력 비판의 서두인 1-22절의 본문을 싣고 이에 대한 저자의 해석과 해설을 제시한다. 마치 학부시절 원전 강독을 수업에 앉아있는 기분. 판단력 비판의 완독에 도전하는 모든 분들에게 추천.
9788949716060,10,예술이 어떻게 발전되었는지 알 수 있었다.
9788961962889,10,노 미술가가 쓴 현대철학에 대한 글. 저자는 쉽게 이야기하려는 듯 하지만 기본을 깔고 읽는 편이 좋을 듯^^
9788994054988,8,에술은 어디에서 왓고 예술은 무엇인가.진화생물학을 중심뼈대로 예술의 본질을 설명해준다.기본의 사적인 예술사나 관념론적인 미학에서 찾을 수없는 종교학적 인류학적 시초와 함께 새로운 예술의 정의를 읽어볼수잇다.마지막챕터7은 무릎을 치면서 읽엇다.
9788931578751,10,"우리나라 대중음악의 기원은 외래음악의 단순한 이식이나 전통음악의 맹목적 계승이라 보는 것은 편협할 수 있다. 책 그 자체가 대중음악사의 과거 진귀한 사료(史料)의 발굴과 수집, 정리이자 현재까지 일어났던 대중음악사 가운데 남겨진 위대한 족적을 객관적으로 정리해 요약한 책이다."
9788984114654,10,'현대예술의 이해'에 꼭 필요한 책이다. 쉽게 읽히지 않지만 풍부한 사유를 유발시킨다. 더 나아가 그 후를 생각케한다.
9788984114654,8,"번역 괜찮은 편이고, 잘 읽었습니다. 잘 이해가 안 된다면, 뒤에 옮긴이 글 읽어보고 재시도하길 권합니다."
9788967351038,8,김봉현의 REAL 힙합 예찬기.
9788967351038,10,힙합에 대해 거의 몰랐는데 많이 배웠습니다
9788967351038,10,흑형은 위대하다☆반★박☆불★가☆
9788967351038,8,한국에서 날로 인기가 커져가는 힙합을 하나의 문화적 코드로 이해하고 싶은 분이라면 이 책과 함께하시길 바랍니다.
9788967351038,8,힙합이란 하나의 음악장르 이상의 문화이자 삶의 양식임을 랩 가사에 얹어 명쾌하게 설명한 책. 힙합을 향한 선입견과 피상적 이해를 불식시키는 데 큰 도움이 된다. 허나 인터뷰를 비롯한 다양한 자료를 참고하였음에도 전혀 출처를 표시하지 않은 점은 저자가 바라는 힙합의 올바른 이해를 방해한다.
9788997023226,6,만화로 보니 더 재미있어요. 눈호강합니다 ~ 이거 읽고 패션의 탄생도 읽어보세요. 아이콘의 탄생과 패션의 연관관계도 알 수 있어요
9788997023226,10,"패션을 단순히 옷이라고 생각했습니다. 그러나 책을 통해 트렌드의 한 축이자, 문화의 한 부분이라는 것을 알게되어 기뻤습니다."
9788997023226,10,"단순히 외모의 아름다움 뿐 아니라 시대를 앞서간 여성들, 셀러브레이터, 한 시대의 아이콘이라 불리우는 여성의 삶과 패션을 만나는 즐거움을 누릴 수 있는 책"
9788997023226,10,패션에 대한 이해가 단순히 옷을 잘입는것에 그치지 않고 역사를 이해하고 트랜드를 분석하고 적용하는 힘을 키우기에 좋은 책이란 생각이 들어요
9788997023226,10,"패션을 단순한 치장으로만 보자면 그럴 수도 있겠지만, 그것이 사회에 미치는 파장을 고려한다면 그 이상의 가치가 있다고 봅니다. 시대별 여성들의 동경의 대상이자 일명 ｀패션아이콘｀으로 불리었던 여성들의 이야기를 즐겁게 만화로 풀어내어 재밌게 읽었던 기억이 나네요."
9788997023226,10,패션사와 문화에 강한존재를 남겼던 패션 아이콘들과 스타일의 히스토리를 담은 책이란 주제만으로도 시선을 사로잡습니다. 더군다나 이렇게나 예쁘고 눈을 황홀하게하는 만화라뇨~!! 그저 가십거리가아닌 패션사의 흐름을 알차게 공부할수있도록 많은 이야기를 깊이있게 다룬것에 감사함을 느낍니다.
9788997023226,10,"<아이콘의 탄생>을 읽어보고싶네요. 시대를 앞서가는 아이콘들이 누구였는지, 그녀들의 패션감각도 사진으로 만나보고싶어요~"
9788997023226,10,패션의 부흥을 이끌었던 중요 인물들의 모습을 통해 그 시절을 회고하며 현재의 트렌드와 비교하는 재미가 있다.
9788997023226,10,패션이나 스타일과 관련된 TV 프로그램을 보면서 한 시대를 풍미하는 유명한 패션 아이콘들에 대해서 알게 되었는데 이렇게 패션 아이콘들에 관한 책이 출판되어 무척 관심이 갑니다. 자세히 알지 못했던 그들의 이야기를 통해 패션의 역사에 대해서도 알 수 있게 될 것이라고 생각합니다. 기대되네요.
9788997023226,10,스타일에 대해 관심이 많은데 제가 좋아하는 만화로 설명해주어서 즐겁고 재밌게 읽을 수 있어서 더 좋은것 같습니다. 특히 아이콘에 대해 세세히 얘기해주어서 도움이 많이 됬고 매우 기대됩니다!
9788997023226,10,각시대의 패션아이콘에 대한 책이라 재미있게 읽었네요. 재미있게 패션에 대해 공부한 기분입니다.
9788997023226,10,오드리햅번을 정말 좋아합니다.세기의 아이콘들을 예쁜 그림으로 표현해서 더 호감이 갑니다.자세한 글들도 얼른 읽어보고 싶어요!
9788997023226,10,패션 문외한에게 즐거움을 주다니!!
9788997023226,10,참 아름다운 책이에요.
9788997023226,8,유머와 그림이 패션사와 어울어져 즐거움을 준 책.
9788997023226,10,개인적으로 내가 좋아하는 종류의 책 쉽고 빠르고 이해력이 쉽게 읽을 수 있다 현대와 과거의 패션아이콘들을 보고싶다면 한번쯤 읽어볼만한 책
9788997023226,10,놀랄 일이다. 너무 훌륭하다. 참 재밌게 읽었다.
9788997023226,8,유명 아이콘을 한번에 쉽게 볼 수 있는책~ 전편 패션의 탄생에 이어 구매했다
9788997023226,8,이건 패션뷰티계의 바이블이 될듯 나도 메이컵 배울때 트랜드를 반영한 당대에 아이콘으로 많이 배우는데 재미있어 읽는데 오랜시간이 걸리지않아 쉽게 읽기 편하다 정말 멋진그림들이다
9788997023226,8,전작 <패션의 탄생>과 마찬가지로 내용도 충실하고 그림도 괜찮음. 근데 메인으로 다뤄진 인물들이 죄다 여자뿐이라는 게 흠이라면 흠. 뒷쪽에서 짤막하게만 언급하고 지나간 남자들 중에도 메인으로 다룰 만한 인물이 있었을 텐데 말입니다. 엘비스 프레슬리나 마이클 잭슨이나...
9788997023226,8,"오탈자가 많아서, 인물에 대한 미화가 많아서 별 한개 뺌. 
스토리도 재밌고 그림도 여전히 끝~~~~내줌. 소장가치 100%"
9788997023226,10,따라하고싶은 패션과 스타일을 보여주는 시대의 워너비들이 일목요연하게 정리되어 있다. 게다가 그네들이 만화체로 그려져 있으니 왤케 웃긴지 (지방시에게 가서 헤헤 봉쥬르 무슈 하는 오드리 햅번 ㅎㅎ  초생달 눈을 하고 내가 도와줄 거라도? 하는 안나 ㅎㅎ) 걍 패션 모르고 읽어도 재밌다!
9788997023226,10,"그냥 옷을 좋아는 사람들에게 강추 합니다......개인적으로 오드리 햅번, 트위기 좋아하는데
그들의 얘기도 나오고 참 술술 넘어가는 책이라 좋네요."
9788997023226,10,이 책은 큰조카한테 주고싶당~
9788991706491,10,독일 초기 낭만주의의 ‘예술비평‘이라는 개념에 대해 발터 벤야민이 사상적 배경과 근본특성에 대해 밝히고 있는 책이다. 학술적 성격의 글이고 벤야민의 글이라 쉽지만은 않지만 옮긴이 해제를 먼저 읽고 본문을 읽으니 정리가 된다.
9788991706491,10,벤야민은 독일 낭만주의에서 ｀비평｀이라는 분야가 어떻게 융합되어 있는지를 이 글을 통해 설명한다. 슐레겔 노발리스를 비롯한 초기 낭만주의를 한정하여 설명하고 있어서 매우 간결하고 명확하다는 인상을 받게 되었다. 벤야민의 첫 논문이기도한 이 논문은 참 의미깊은 책이다.
9788991706491,10,<괴테의 친화력>의 서문과같은 학위논문. 동시에 그의 언어철학 등과 연결되는 초기 철학의 핵심적인 글. 낭만주의 비평에 대한 예찬. 독일 관념론에 대한 관심을 불러일으키는 유용한 핸디북.
9788991706491,10,예술의 자기인식이라는 것이 무슨 의미인지를 깨닫게 해주는 책!!
9788994054254,8,다른 인터넷서점에 비교하여 책의 범위도 넓고 많아서 좋습니다만배달이 늦은 것이 단점인듯 합니다.
