ISBN13,rating,review
9788997714025,8,캘리그라피는 ｀틀｀을 깨는 것이다. 하지만 틀조차 제대로 알지 못한다면 그 안에서 아무것도 할 수 없다. ｀틀｀이 어떤 것인지 제대로 알자. 그래야 캘리그라피를 사랑할 수 있다!I♥Calligraphy
9788997714025,10,캘리그라피 수업에 사용할 교재용으로  구입했네요.머리말 내용이 참 맘에 들었구요...그래서  읽고나면  많이 발전해 있을 나의 캘리 솜씨를  미리  상상해 봅니다 ^^˝연습만이 살 길이다.˝  라는  말을 항상  되내이며   열심히 하려구요^----^여러분도 화이팅 ㅡㅡ
9788997714025,10,즐거운  손놀이 시간이 흐르듯 멈춘 듯 가는 줄도 모르고 밤새게 생겼다  재미있다 그리고 좋다
9788997714025,8,캘리 초보자들에게 좋은 책
9788997714025,10,"글씨의 나열, 글씨의 배치 이런 내용이 아닌글씨를 쓰는 방법의 설명의 캘리그라피책"
9788997714025,8,연습에 도움이 많이 되네요.
9788997714025,8,완전 기초부터 하나씩 배워서 캘리그라피와 한글을 알아가는 책이여서 좋습니다!
9788958950950,6,좋습니다.
9788930100489,10,"한국 복식에 관심이 있는 분이라면 빚을 내서라도 소장해야할 책. 세부사진, 도면, 해설 모두 끝판왕"
9788930100489,10,사진과 그림이 이해를 돕습니다. 소장가치로 굿입니다.
9788930100489,10,참고하기 정말 좋은 책! 설명도 자세히 돼있고 무엇보다 그림으로 정리가 정말 되어 있다!  참고용으로 사려는 분들께 강력추천한다
9788930100489,10,비싸기는 해도 소장용으로 두고두고 읽으면 좋을 책입니다.  우리것을 사랑합시다.
9788973632121,10,"단순하게 따라 그릴 수 있는 그림들이 있어 좋습니다. 
아이들과 그림놀이 할때 좋네요 ㅎ"
9791160403978,10,이 책을 보고 브랜딩은 기업의 가치를 전달하는 일이라는 생각이 들었습니다. 마르쉐 사례에서도 동의했습니다. 일반적으론 브랜딩을 해도 마케팅을 해도 팔리지 않으면 사업주의 문제로 보지만 마르쉐처럼 시장공동체 역할로 돌려버린 부분이 인상깊었습니다. 공생하는 삶에 깊이 배우고 갑니다
9791160403978,10,참여하는 모두가 건강하게 성장하는 브랜딩은 어떻게 만들어 지는지? 좋은 세상을 향한 믿음으로 함께 살아남는 브랜딩에 관한 저자의 경험을 친절하게 이야기 해주는 글이라 쉽고 재밌게 읽었습니다. 마케터나 디자이너 뿐 아니라 더 나은 미래를 꿈꾸는 다음 세대에게 추천하고 싶은 책입니다.^^
9791160403978,10,브랜딩이라는 거창하다고 느끼는 개념에 대하여 막연한 이미지만 갖고 있던 일반인도 부담없이 브랜딩 전문가가 되어 함께 할 수 있었던 소소하지만 진심이 꾹꾹 담겨있는 즐거운 여행이였습니다.작가님의 진심이 또 다른이들이게 긍정적인 영향력으로 전달 될 수 있기를 응원합니다.
9791188314416,10,브랜드 경험이란 분야에 처음 들어오는 사람에게 유용할 듯. 개인적으론 업무 기획에 많은 도움을 받았습니다.
9791188314416,10,"브랜드 경험을 개발하는 과정과 방법들을 안내하는 책인데, 관련 프로젝트에 도움이 많이 되었습니다."
9791186921821,10,복합적 디자인이 등장하게 되는 사회 맥락들을 만화형식으로 재미있고 쉽게 설명해주고 있어 어렵지 않게 읽을 수 있다. https://blog.naver.com/dnotecom/222010629890
9791186921821,10,손에 잡자마자 단숨에 읽히는 책입니다. 디자인에 대해 알기쉽게 설명되어있어요
9791186921821,10,"이봉섭 작가님 그림 너무 멋져요. 디자인의 개념과 역사에 대한 흐름을 알게되어 유익했고, 특히 디자인이 앞으로 나아가야할 방향, 마지막 부분 읽고 많은 생각을 하게 되었습니다. 그리고 틈틈이 깨알 같은 재미가 있어서 많은 사람들에게사랑받는 책이 될 것같아요.좋은 책 만들어주셔서감사합니다"
9791186921821,10,현대 사회에 필수 요소중 한가지인 디자인에 대해아빠와 아이가 같이 책을 읽으며 아빠의 입장에서아이에게 친절히 설명해 줄 수 있는 좋은 책입니다.아이가 미술과 디자인에 관심이 있는 아빠라면필독서입니다.
9788931461527,10,"스케치를 직접 하기보다 많은 스케치를 보고 싶었는데, 딱 맞는 도서가 나와서 구입했습니다 :)"
9791185954530,8,디자인 트렌드를 알 수 있는 책. 풍부한 사례로 도움이 된다. 비전공자는 특히나
9791185954530,6,외양적인 아름다움을 추구하는 디자인에서 사람과 환경을 배려하는 착한 디자인이 많은 사회를 원합니다.
9791185954530,8,"디자인에 대한 편견을 잠시 뒤로 하고,가치를 지닌 아름다움에 대해 생각하는 시간이었다"
9791185954530,10,지금 이시대 진정한 배려가 무엇인지 알려주는 책입니다.많은 사람들이 모두가 읽어보면 좋겠어요.이런 관점이 필요해 라는 생각을 하게 합니다.
9791186900901,4,아이디어가 고갈 됐을따 보면 더 화나는 책. 뭐지 이게?
9791189620295,10,오옷!!!버들글씨 시리즈?를 모두 소장하게 되는군요. 연습할 시간이 참 부족한데 보고만 있어도 할 수 있을것 같은 묘한^^의지를 주네요.작가의 말  하단에 있는 말씀이 마음에 콕 박힙니다!!이 책은 저같은 사람에게 분명 ˝단비˝와 ˝선물˝이 되고 있으니까요.
9791189620295,10,캘리그라피 할때 매우 유용하고 도움이 많이 되는것 같아요
9791189620295,10,"한글 캘리그라피를 연습해보려고 관련 서적을 여러가지 살펴봤는데 그 중에 ˝버들글씨˝가 가장 돋보여서 시리즈로 모두 다 구매했어요~! 간결하면서도 정돈된 작가님의 글씨가 정말 매력적인 것 같습니다 이 체본노트 역시 포인트를 살린 깔끔한 설명과 이미지가 포인트네요 좋은 책, 감사합니다~!"
9791189620295,10,버들글씨 선생님의 체본노트2스프링노트라 보기도 편하고원하는 글귀 찾아보기도 쉽고거기다 일러스트까지...하나하나 정성이 깃든 매력만점 체본집!!!그 매력에 빠져빠져 제 의욕도 활활 타오릅니다!!!
9791189620295,10,버들글씨 작가님책이 또 나왔다고 해서 바로구입했어요.너그럽고속이깊은버들글씨책 보고 완전 반했거든요.이번에 체본노트도 받아보고 역시..했답니다.귀엽고 깜찍한 일러스트와 어울리는 글씨..또 다양한구조와 글씨체로 연습할수있도록..만들어주신 체본연습노트..넘나 잘활용할것같아요.정말좋아요
9791189620295,10,"컬러있는 체본노트라 더욱 보는재미도 있네요, 스프링 책이라 보기도 참 좋은것 같아요^^"
9788962852257,10,시간 걸려서 만들어야하는 복잡한 지오메트리들 정말 간단하게 만들 수 있는 방법들이 간단하고 깔끔하게 정리되어 있어요 하나하나 잘 익혀보려고 합니다
9791189356170,10,굿 옷을 잘입는 다는 기준을 바로잡아줌
9791188314119,10,서비스 디자인에 대해선 가장 유명한 책이라 보게 되었는데 호흡이 좀 긴 느낌을 제외하곤 훌륭한 내용이었습니다. 특히 디자인 경영의 관점에선..
9791188314119,10,서비스 디자인을 가장 제대로 설명하고 있는 책. 고객 경험 공부하는 분께 추천.
9791160261165,10,실용주의적이며 멋진 패션을 만들어낸 가브리엘 보뇌르 샤넬의 전기. 단번에 읽게되는 재미있고 감동적인 책이었다.
9791162994016,8,"기초부터 목업제작까지의 과정이 소개되어 있습니다. 관련 전공을 배울때, 강의와 함께 참고하면 과제수행에 있어 도움이 될것이라 생각합니다."
9788997252350,10,진짜진짜 가지고 싶던 책이에요! 간단하게 누비로 만들 수 있는 소품들이랑 방법도 적혀있고 누비에 대한 설명까지도 알차게 들어있습니다. 만드는거 좋아하시는 분이라면 하나 구매하셔도 좋을 것 같아요!
9791188285235,8,"좋아하는 아티스트들의 앨범 커버가 어떻게 나왔는지를 알 수 있다니, 정말 반갑다~~처음보는 앨범 커버들이 흥미롭다~~다만 책이 두꺼워 이해는 하지만, 책 값이 부담되네 ㅠ"
9791188285235,8,"종이의 재질이나 컬러 사진이 많이 삽입된 걸 감안하더라도 조금 비싼 감이 있다.책값만 감수한다면 소장용으로나 책의 구성,취지 등 여러가지로 커버 아트 좋아하는 사람으로서 만족할만한 책이다. 영화포스터나 60~70년대 LP전성기 때의 전체적인 앨범커버아트를 다루는 책도 발간되길 소망한다."
9791188285235,8,배철수음악캠프듣다가궁금해서~역시나가격은
9791185330464,10,일본 도자기를 바라보는 눈을 더욱 깊게 만들어주는 책. 저자의 식견과 혜안이 놀랍다.
9791185330464,10,"지금도 별로 달라진건 없죠 한복에서 양복을 입었고, 명문가는 사라지고, 이속을 챙기는 장사꾼들이 정치를 해나가고 있고, 서민들은 가난한건 똑같죠 결국이 이게 기술적 진보를 가로막고 명인들을 인재들을 해외로 유출 시키는겁니다."
9791185330464,6,그리고 맺음글에서 저자분이 희망하는 것이 이뤄질 수 없는 이유가 있습니다. 예쁜 그릇을 쓰면 다 훔쳐가거든요. 홍석천이 티비에서 한 말등 그런 이유가 크기 때문에 저자분의 소망은 이뤄지기 요원하지 않을까 싶습니다. ‘상차림에 최소한 예의’ 말이죠. 도둑놈 근성이 먼저 없어져야 하는게 순리
9788967540845,8,색 관련 책이 워낙 없어서 일단 사고 봅니다....
9788994207797,8,"시시한 말에는 흥미로운 그래픽이 필요하다. 하지만 말이 주목할 만하다면, 그래픽은 단순해야 한다. 가장 중요한 건 말과 그래픽이 서로 경쟁하지 말아야 한다는 점이다. p.57"
9791155811122,8,"이분처럼그림을잘그리면,마라톤대회에출전하여달리면서도,베니스와같은멋진여행지에서도,사진대신그림을남길수있다.부러운재능이다.더부러운점은,<모든것이좋을때방향을바꾸라,내실력에집중하고작업환경을좋게만들고생각하고실험할시간을갖고나머지는운에맡겨야한다.>를실천하는힘이다."
9791155811122,10,꿈을 꿨다. 물건들이 날뛰는 꿈을.. 아무래도 이 책 때문인 것 같다. 재미있다. 과감하고 예민하다. 바나나가 말 엉덩이라니! 그것도 샛노란! 잘 익은!
9788937433924,10,역사의 흐름이 연표로 되어 있어  이해하기 좋았고 디자인에 정점에 흐름을 알수 있었다~
9788937433924,10,디자이너 시각에서 본 세계사라 흥미롭고 무엇보다 세계사의 큰 흐름을 한 눈에 볼수있는 역사연표가 아주 인상적이고 좋았습니다!
9788965703730,10,새로운 시대에 필요한 새로운 디자인 혁신전략에 대한 다양한 제시가 우리가 살 미래를 어떻게 준비하고 어떻게 살아내야할지를 다양한 사례를 풀어낸 책이다..다시한번 우리의 미래를 어떤 디자인으로 설계할것인가를 생각하게 하는 책이다.
9788965703730,10,4차 산업혁명 발전과 기술에 발맞추어 창의적이고 실용적인 디자인을 하려면 어떤 흐름으로 생각하고 추구해야 하는지 생각해 보게 하는 미래지향적인 디자인 도서네요.
9791158461225,2,음...예상과 달라요. ˝시작 노트˝라길래 선긋기 부터 나오는 줄 알았는데 거의 작품집이에요. 워크북은 맨 뒤에 조금 있어요.
9791158461225,10,쉽고 친절하게 잘 설명되어 있어요. 입문자에게 좋을 듯!
9788959524846,10,다음권도 기대합니다. ㅋㅋ 추억이 많이 생각나네요.
9788959524846,10,가슴이 시키는 트럴
9788959524846,10,다음 권도 기대하겠습니다
9788959524846,10,"흠...나름 알라딘 10년차 고객에 깐깐한 성격탓에 기피고객이 아닐까 생각될 정도로 교환을 많이 해보았지만, 밑에 분들처럼 하자품이 올 경우에 알라딘만큼 바로바로 교환, 환불 해주는 경우는 흔치 않던데욥."
9788959524846,8,배송은 잘옴 내용은 오랜만에 추억 돋는 내용
9788959524846,10,알라진 중고서점에 영판 들어와있는거 보고 살까 말까 완전 고민했는데 ㅜㅜ
9788997714667,10,전각에 대한 전반적인 이론과 실제 각 파는 방법이 나와있어 아주 유용합니다
9788997714667,8,"서예를 배우는 사람입니다.서예,전각,그림은 다른게 아니고 하나 라고 해서 뱌우고 싶었습니다.중국 번역서는 어려웠는데 쉽게 써서 좋았습니다."
9788997714667,6,책이 정말 작고 얇네요 ㅎㅎ초보들에겐 좋습니다. 칼 잡는 법 부터 탁본 까지 속성으로 읽기에 좋습니다.
9788997125913,8,아직 실행을 해 보지 못했다.마음을 아직 다 잡지 못한 것 같다.하지만 기본적인 서예에서 시작하여 자신의 스타일을 찾아 캘리그라피를 하는데 도움이 되리라고 생각이 든다.
9788997125913,8,독학으로 첨 시작하기 좋은 기초 책입니다.
9788997125913,10,정말정말 멋진책입니다. 인고의 시간이 고스란히 담긴 정성가득한 책입니다.구성면에서 최고입니다.강추!
9788997125913,10,캘리그라피 독학하려고 하는데 가장 쉽고 자세하게 나와있는 것 같아요!
9791185330310,10,3부작 유럽 도자기 여행중 하나... 저자의 내공이 대단한 역작... 강추
9791185330310,10,도예 강의를 등록하게 만드는 책. 내용도 알차다
9791185330310,8,"도자기 그릇도 사고 싶어지고, 유럽 여행까지 가고 싶어지게 만드는 여러모로 위험한 책 :D"
9791185330310,10,도자기에 대한 전문적 식견과 더불어 유럽 곳곳을 여행하는 즐거움까지..과연 역작이다.  모든 시리 즈를 소장하리라!!
9791185330310,8,유럽의 문화사 및 예쁜 도자기들~~한번 읽어볼만합니다.
9791195040452,10,개정판 간격을 보면 새 판이 나올 시점이라 쉽사리 사질 못하겠음.....
9788994158693,10,"결국은 열심히 노력해서 듣고, 보고, 생각해야한다는 기본의 중요성을 쉽게 이야기 해주는 책. 얄팍함 보다는 진지함이 여전히 중요하다고 말해주는 것 같아 든든했다. 요즘같이 수많은 자극적인 정보가 가득한 시대에 더욱 더 필요한 책이다. 덧붙여 책 자체가 가벼워 읽고, 들고다니기에 좋다! 강추"
9788994158693,4,읽고보니 뻔한 이야기. 국내에 적용되지 않는 사례들도 많다.
9788994158693,4,특별한 인사이트라는 게 없다. 센스가 지식의 축적으로부터 나온다는 역발상 하나 인상에 남았다.
9788994158693,8,‘크리에이티브’에 대한 그동안의 모호함이 이 책을 통해 다소 정리된 느낌이다.
9788994158693,6,내용에 100% 공감. 그런데 이 책의 서체와 편집 센스는 그닥.
9788994158693,8,"센스는 타고남이 아니라, 노력해서 얻을 수 있다. 좋고 나쁨의 기준은 평범함을 앎으로서 나눌 수 있으며, 이는 지식을 쌓아야 알 수 있다. 어떤 분야에서도 독보적인 천재는 없을 것이다. 책을 읽는 내내 나의 불성실성을 탓했고, 노력없는 기대란 꿈도 꾸지 않겠단 다짐을 하였다."
9788994158693,8,일본분이 쓰신거고 타이틀 홍보에 나오는 캐릭터는 한국사람은 특히 나는 모르는거지만 어쨋든 생각을 나누는데 있어서 자기의 경험이 많이 녹아있어서 좋다. 나는 어떻게 하고 있었는가 한번쯤 생각하게 만드는 책.
9788994158693,10,"｀양보다 질｀을 중시하는 세상이지만, 양보다 나은 질을 만들기 위해서는 막대한 양의 공부와 치열한 연구가 선행되어야 한다는 저자의 가르침에 정신이 번쩍 나는 듯 하다. 그야말로 센스의 ｀재발견｀이다."
9788994158693,6,에코백은 정말 작으니까 이걸 위해 구입은 하지 마세요. 내용은 읽는중인데 괜찮네요. :)
9788994158693,10,앞으로 살아가는데에 여러모로 도움이 되어 줄 책!
9788994158693,8,센스의 재발견~ 내 주위 익숙한 모든 것들의 재발견이 곧 센스가 아닐까?
9788994158693,8,기대기대중 어떤 센스가 좋은 센스인가? 나에게 더 필요한 센스는?
9791125413950,10,아이랑 같이 만들어볼게요
9791125413950,6,"지금까지 나와 있었던 책들과 다르게 실제 활용성이 아주 높다고 생각을 해 책을 구입했으나, 책에 구체적인 독서 내용이 생각했던 것 보다 구체적이지 않아 조금 실망을 했습니다."
9791125413950,8,조카들에게 꼭 선물하고 싶은 책이에요. 같이 놀아주기에 정말 좋을 것 같네요.
9791125413950,10,너무너무 좋아요~! 아이 있는 집은 필수로 사보시길 강추합니다~
9791125413950,10,책읽기 좋아하고~ 그리고 만들기 좋아하는 우리 큰따님에게 최고의 선물이었어요.
9791125413950,10,전부터 맘에 들어서 잘 보던 사이트에서 책 냈다고 해서 구매...
9791185330204,10,"요리를 하면서 내가 요리를 매우 좋아하지 않는다고 느낄때가 그릇욕심이 없다는것이었는데, 이 책을 읽으니 욕심이 스멀스멀 기어오르는것을 느꼈어요.^^ 세상의 모든 이쁜 도자기들을 가질수 없으니 대신 이 한권의 책이 제 도자기 컬렉션장이 될것 같아요. ㅋㅋ"
9791185330204,10,매우 충실한 사진 및 텍스트 자료 짜임새 있는 구성. 작가의 노력과 수고에 감사합니다. 아쉽다면 좋이 지질이 동유럽보다는 좋아졌지만 역시 안타까운 부분.
9791185330204,8,뽐뿌 책임. 주의
9791155350362,10,서점에서 우연히 보게되었는데 재밌게보였습니다!
9791155350287,10,"최근 일본에 관심을 갖기 시작하면서 일본 제품도 눈여겨 보는데 일본디자인제품에 관한 책이 나왔다고 해서 주저없이 구매했습니다.자국에 대한 자긍심이 높은 작가라 그런지 작품선정도 일본의 장인정신,문화에 대한 언급이 많네요!훌륭한 아이디어도 많고,제품을 대하는 정신도 훌륭하다 느꼈습니다"
9791155350287,8,"일본은 정말 기가막힌 아이디어의 제품즐을 잘 만들어내는데,,,물론 뭐 이런걸....하는 제품들도 많이 있지만...예쁜 제품들이 많아 볼만합니다."
9788970597256,6,"선적인, 텅빈 공간 감각 등 일본의 디자인에 대한 일견"
9788970597256,8,"제품은사람의욕망이라는토양에서거둔수확물이므로좋은제품을낳으려면높은수준의욕망,미의식을가져야하고,만들기못지않게헤아리기속에도디자인의본령이있다.세계에서｀인정｀받는것이아니라세계에서｀기능｀한다는주체성을갖는것,디자인외다른분야에서도똑같이적용될수있다.｀인정｀받는것은안이한수동태!"
9788970597256,6,『디자인의 디자인』이나『마카로니 구멍의 비밀』이나 더 읽어봐야겠다. 『백』에는 한참 못 미치네...
9791156755036,8,뉴욕의 하이라인공원은 옛 유산을 현대적으로 잘 활용한 사례로 많은 사람들이 연수를 갔을 것이다. 그것이 시장의 아이디어였는지 건축가의 제안이었는지 궁금했는데 그 과정을 알려준다. 우리의 도시공간 그리고 사회는 이용자의 애정과 관심 그리고 적극적인 참여를 통해서 변화가능한다.
9788997023226,6,만화로 보니 더 재미있어요. 눈호강합니다 ~ 이거 읽고 패션의 탄생도 읽어보세요. 아이콘의 탄생과 패션의 연관관계도 알 수 있어요
9788997023226,10,"패션을 단순히 옷이라고 생각했습니다. 그러나 책을 통해 트렌드의 한 축이자, 문화의 한 부분이라는 것을 알게되어 기뻤습니다."
9788997023226,10,"단순히 외모의 아름다움 뿐 아니라 시대를 앞서간 여성들, 셀러브레이터, 한 시대의 아이콘이라 불리우는 여성의 삶과 패션을 만나는 즐거움을 누릴 수 있는 책"
9788997023226,10,패션에 대한 이해가 단순히 옷을 잘입는것에 그치지 않고 역사를 이해하고 트랜드를 분석하고 적용하는 힘을 키우기에 좋은 책이란 생각이 들어요
9788997023226,10,"패션을 단순한 치장으로만 보자면 그럴 수도 있겠지만, 그것이 사회에 미치는 파장을 고려한다면 그 이상의 가치가 있다고 봅니다. 시대별 여성들의 동경의 대상이자 일명 ｀패션아이콘｀으로 불리었던 여성들의 이야기를 즐겁게 만화로 풀어내어 재밌게 읽었던 기억이 나네요."
9788997023226,10,패션사와 문화에 강한존재를 남겼던 패션 아이콘들과 스타일의 히스토리를 담은 책이란 주제만으로도 시선을 사로잡습니다. 더군다나 이렇게나 예쁘고 눈을 황홀하게하는 만화라뇨~!! 그저 가십거리가아닌 패션사의 흐름을 알차게 공부할수있도록 많은 이야기를 깊이있게 다룬것에 감사함을 느낍니다.
9788997023226,10,"<아이콘의 탄생>을 읽어보고싶네요. 시대를 앞서가는 아이콘들이 누구였는지, 그녀들의 패션감각도 사진으로 만나보고싶어요~"
9788997023226,10,패션의 부흥을 이끌었던 중요 인물들의 모습을 통해 그 시절을 회고하며 현재의 트렌드와 비교하는 재미가 있다.
9788997023226,10,패션이나 스타일과 관련된 TV 프로그램을 보면서 한 시대를 풍미하는 유명한 패션 아이콘들에 대해서 알게 되었는데 이렇게 패션 아이콘들에 관한 책이 출판되어 무척 관심이 갑니다. 자세히 알지 못했던 그들의 이야기를 통해 패션의 역사에 대해서도 알 수 있게 될 것이라고 생각합니다. 기대되네요.
9788997023226,10,스타일에 대해 관심이 많은데 제가 좋아하는 만화로 설명해주어서 즐겁고 재밌게 읽을 수 있어서 더 좋은것 같습니다. 특히 아이콘에 대해 세세히 얘기해주어서 도움이 많이 됬고 매우 기대됩니다!
9788997023226,10,각시대의 패션아이콘에 대한 책이라 재미있게 읽었네요. 재미있게 패션에 대해 공부한 기분입니다.
9788997023226,10,오드리햅번을 정말 좋아합니다.세기의 아이콘들을 예쁜 그림으로 표현해서 더 호감이 갑니다.자세한 글들도 얼른 읽어보고 싶어요!
9788997023226,10,패션 문외한에게 즐거움을 주다니!!
9788997023226,10,참 아름다운 책이에요.
9788997023226,8,유머와 그림이 패션사와 어울어져 즐거움을 준 책.
9788997023226,10,개인적으로 내가 좋아하는 종류의 책 쉽고 빠르고 이해력이 쉽게 읽을 수 있다 현대와 과거의 패션아이콘들을 보고싶다면 한번쯤 읽어볼만한 책
9788997023226,10,놀랄 일이다. 너무 훌륭하다. 참 재밌게 읽었다.
9788997023226,8,유명 아이콘을 한번에 쉽게 볼 수 있는책~ 전편 패션의 탄생에 이어 구매했다
9788997023226,8,이건 패션뷰티계의 바이블이 될듯 나도 메이컵 배울때 트랜드를 반영한 당대에 아이콘으로 많이 배우는데 재미있어 읽는데 오랜시간이 걸리지않아 쉽게 읽기 편하다 정말 멋진그림들이다
9788997023226,8,전작 <패션의 탄생>과 마찬가지로 내용도 충실하고 그림도 괜찮음. 근데 메인으로 다뤄진 인물들이 죄다 여자뿐이라는 게 흠이라면 흠. 뒷쪽에서 짤막하게만 언급하고 지나간 남자들 중에도 메인으로 다룰 만한 인물이 있었을 텐데 말입니다. 엘비스 프레슬리나 마이클 잭슨이나...
9788997023226,8,"오탈자가 많아서, 인물에 대한 미화가 많아서 별 한개 뺌. 
스토리도 재밌고 그림도 여전히 끝~~~~내줌. 소장가치 100%"
9788997023226,10,따라하고싶은 패션과 스타일을 보여주는 시대의 워너비들이 일목요연하게 정리되어 있다. 게다가 그네들이 만화체로 그려져 있으니 왤케 웃긴지 (지방시에게 가서 헤헤 봉쥬르 무슈 하는 오드리 햅번 ㅎㅎ  초생달 눈을 하고 내가 도와줄 거라도? 하는 안나 ㅎㅎ) 걍 패션 모르고 읽어도 재밌다!
9788997023226,10,"그냥 옷을 좋아는 사람들에게 강추 합니다......개인적으로 오드리 햅번, 트위기 좋아하는데
그들의 얘기도 나오고 참 술술 넘어가는 책이라 좋네요."
9788997023226,10,이 책은 큰조카한테 주고싶당~
9788997776849,8,다양한 마감재를 사용한 나만의 물건으로 쉼게 표현할수있고 어렵고 고 난이도의 기술을 보여줍니다
9788997776849,10,목재마감이라는건 목재로 가구를 다 만든 다음에 가구에 미적감각을 더해주고 아울러 목재를 보호하는 기능을 더해주는 일석이조의 효과를 만드는 작업이다. 따라서 목재의 특성을 잘 파악해서 잘 어울리는 매칭의 마감을 해야하는 아주 난이도가 높은 ˝화룡정점˝ 같은 작업이다.
9788997776825,10,목공을 배우려면 반듯이 거쳐가야하는 기본서입니다
