ISBN13,rating,review
9791190118033,10,다이애나 영화에서 다이애나가 남자 주인공 분과 다른분들이 알아보지 못하게 분장을 하고 작은 째즈바를 방문하여 째즈 음악을 처음 듣는다며 음악에 반한 장면이 떠오르네요책이 만화로 되어있어서 박시백의 조선왕조실록처럼 쉽고 잘 알아들을 수 있을거 같아요 추천합니다
9791190118033,10,누구나 재즈의 매력에 빠져들게 할 수 있는 재미있는 음악 만화이네요~ 다양한 추천곡들과 일상의 에피소드가 정말 좋습니다
9791190118033,10,"남무성 작가의 전작 <재즈 잇 업>을 재밌게 읽었는데 신작이 나오다니 너무나 반갑습니다. 재즈에 관심은 있지만 정식으로 입문하지는 못한 문외한인데, 이 책을 통해 본격적으로 재즈에 입문해볼까 합니다. 재즈에 관해 쉽고 재미있게 설명한 책이길 기대해 봅니다."
9791190118033,10,재즈를 이해하고 재즈의 세계를 살펴보는데 재밌는 시선과 다양한 사실들로 더욱 즐겁게 읽어볼수 있는 좋은책인것 같아요..
9791190118033,10,익숙하지 않은 재즈에 대하여 만화로 이야기를 들려주고 흥미를 가지게 만들어서 초보자들 입문용으로도 좋은 책입니다
9791190118033,10,재즈 입문서로 딱 좋은 것 같습니다. 재미와 지식 두마리 토끼를 잡을 수 있는 책이 아닌가 싶습니다.
9791190118033,10,재즈의 매력에 푹 빠질 수 있을 것 같습니다. 만화로 되어 있어서 더 쏙쏙 들어오는 것 같아요.
9791190118033,10,"아직 재즈음악은 제게 어려운 장르인데요 재즈의 역사,음반의 흐름과 특성을 재미있게 구성한 책이라서 읽어보고 싶습니다. 재즈 라이프를 읽고 재즈에 한발짝 다가선다면 좀 더 재즈를 쉽고 편안하게 즐길 수 있을 것 같습니다."
9791190118033,10,"다가가기 어렵고, 조금 낯설게 느껴지는 재즈를 만화로 만든 책. 너무 기대가 됩니다! 이 책을 통해 재밌게 재즈에 대해 배우고, 관심을 가질 수 있게 될 것 같아요! 꼭 읽어보고 싶어요^^"
9791190118033,10,"만화로 풀어내는 그의 재즈 이야기는 항상 재밌고, 또유익하다. 유튜브와 함께 보는 이번 책도 기대된다!^^"
9791190118033,10,"수많은 명연주를 들어온 그가 엄선한 재즈가 글과 그림과 함께 멋스러운 하모니를 이루며 재즈 마니아를 감탄케 하고 동시에 입문자를 따뜻하게 맞아준다. 그의 그림 속에는 수십 년 동안 재즈를 들어온 사람만이 표현 가능한 독특한 음악의 빛깔이 개성 있게 녹아 있다. 우리는 책장을 한 장 한 장 넘기면서, 바로 옆에서 재즈 음악이 흐르는 듯한 착각에 빠져들 것이다"
9791190118033,10,어찌보면 좀 어렵다고 할 재즈를 만화라는 형식을 통해서 좀더 쉽고 재미있게 이해할수있게 만든 책인데 실제로 재즈 초심자가 봐도 이해하기 쉽게 잘 만들어진 책이네요
9791190118033,8,만화로 보는 록에서의 인연이 결국 재즈로 까지 나를 인도했다.
9791190118033,10,만화라 더 쉬워요
9791190118033,10,만화로 재즈 음악을 접할 수 있어 보다 이해하기 쉬울 것 같습니다. 기대됩니다.
9791190118033,10,일반적인 재즈 관련 도서와는 다른 접근으로 재즈에 대해서 알 수 있는 책이네요.만화라 더 재밌고 가볍게 볼 수 있지만 재즈에 더 깊게 빠져들 수 있을 것 같습니다.
9791190118033,10,만화로 더 재밌고 흥미있게 읽을수 있는 재즈라니! 재밌게 읽고 주변에게 추천하기에 너무 좋은 책입니다.
9791190118033,10,"도대체 왜 듣는 거야, 하다가 어느새 푹 빠져들고 마는 재즈의 매력을 다시 한번 책으로 되새기게 되네요."
9791190118033,10,만화로 보는 재즈 너무 재미있을 것같아요~~^^ 쉽게 이해될 수 있을 것 같아요~~~^^
9791190118033,10,"남무성 작가의 페인트잇락, 재즈잇업으로 쉽고 재미있게 음악 정보를 얻었습니다. 재즈 라이프도 재즈음악과 아티스트,음반을 즐길 수 있게 해 주는 훌륭한 길잡이가 되어 줄 거라 확신해요! 한여름밤 좋은 재즈 음악을 들으면서 재즈 라이프를 즐기면 좋은 피서가 될 것 같아요."
9791190118033,10,두툼하고 풍성한 내용이 만화로 구현되면서 더욱 재미있습니다.
9791190118033,10,째즈 음악의 감상표현은 어렵더라도 이 책을 충분히 재미있게 볼수 있습니다.
9791190118033,10,재즈 음악의 세계를 재미있는 대화로 구성된 만화 작품으로 만나보니 무척 신선하고 흥미롭네요. 누구나 재즈 음악의 매력에 공감할 수 있는 좋은 작품인 것 같아요. 남무성 작가님이 소개하는 재즈 음악을 보며 재즈를 조금씩 알아가는 재미를 느낄 수 있어요.
9791190118033,10,"오!! 재즈 음악을 더 가까이 이해할 수 있고, 더 가슴에 와 닿게 들을 수 있을 것 같아요또한, 그냥 글로 설명하는 것보다 만화로 읽는 것이 재즈에 대하여 가까이 다가가기에 좋은 것 같아요"
9791190118033,10,재즈에 대해서는 잘 몰랐는데 흥미롭네요.
9791190118033,10,"재즈가 만화와 만나다니, 상상도 못했던 일이네요. 만화 책읽으며 재즈를 들을 수 있다는 것만으로도 10점 드립니다! 눈 호강, 귀 호강 한번에 할 수 있는 재미가 있어요~"
9791190118033,10,"재즈와 관련된 이야기를 만화로 엮어 내어 쉽게 만날 수 있는 장이 열려 좋습니다.만화를 눈으로 읽는 재미와, 재즈 음악을 듣는 즐거움의 콜라보! 한 곡 한 곡이 즐거움입니다."
9791190118033,10,"재즈음악을 정말 좋아합니다! 제일 좋아하는 국내 뮤지션은 웅산, 말로에 평소에 천년동안도, 올댓재즈 등에 자주 가서 재즈 라이브를 듣습니다 ㅎ 하지만 귀는 열려있으되 관련 지식이 없어 목말라하던 차에 이 책을 읽으면 그 갈증이 정말 시원하게 해소될 것 같다는 기대가 듭니다!"
9791190118033,10,일상의 재밌는 에피소드 속에서 재즈 음악을 한 곡 한곡씩 꼬리물기 형식으로 소개해 주는 만화 재즈가이드북이에요. 재즈에 관심있는 이들과 재즈를 잘 알지 못하는 이들에게 재즈 음악의 매력을 쉽게 알려줄 것 같아요.
9791162730263,10,"완독.물론 훌륭한 음악가임에는 의심의 여지가 없지만,휼륭한 위인인지는 ....베토벤을 다양한 관점으로 설명한 부분이 좋았다."
9791162730263,10,"운명, 비창, 영웅... 사실 베토벤에 대해서 꽤 안다고 생각했다. 하지만 이 책으로  베토벤의 작품들이  왜 음악적으로 위대한지 새삼 배우게 됐다. 단순한 음악가의 비하인드스토리가 아니라 그 사람의 음악에 대해 잘 집어 주는 보기 드문 클래식 책! 다른 음악가 편도 궁금하다."
9788966854615,10,난이도별로 잘 짜여진 구성이 지도에 잘 적용될 것 같아서 좋아요~
9788967211745,10,좋아요 벌써 휘리릭 다 살펴보고. 한곡한곡 정복해나가는중.
9788967211745,8,"수록곡들 중 몇곡들은 이미 가지고있지만 1,2권을 사면서 그냥 3권도 구매. 전권 모두 열심히 한번 정복할꺼닷~!!! 의욕활활~!!!"
9788967211745,8,유튜브에서 연주하신 걸 듣고 구입해서 열심히 연습하고 있는데 많이 어렵네요;; 안 친지 오래라 덧줄이 많은 경우 힘들더라구요.. 좀 더 많은 사람들이 레이나님의 악보에 쉽게 접근하기 위해서는 높은 음자리표와
9788967211745,10,"유튜브에서 아리랑랩소디듣고 반해서 악보집 샀어요! 어려운데 어제, 그저께 보다 계속 계속 나아져서 뿌듯해요. 1권도 사서 잘 치고 있는데 벌써 4권이 기다려지네요ㅎㅎ"
9788967211745,10,유튜브에서 제가 좋아하는 아이돌 노래를 많이 연주해주셔서 레이나님의 팬이 되었습니다! 제가 좋아하는 카드캡터 체리 노래도 있어서 더욱 기대되는 3권입니다.
9788967211745,10,추천합니다!
9788967211745,10,정말 매력적인 악보집입니다!
9788967211745,10,세련된 편곡과 짙은 감성에 믿고 듣습니다
9788967211745,10,"대중적 인기 곡들을 세련된 편곡과 깔끔한 악보, 그리고 QR코드 동영상을 감상할 수 있는 악보집! 정말 마음에 드네요."
9788967211745,10,이번 피아노노트3도 가요부터 애니ost까지 다양한 곡들로 채우셔서 듣는 귀가 행복합니다. 쉬지않고 곡작업을 하는 레이나님~ 늘 응원합니다. 피아노 치는것은 익숙치않지만 레이나님 곡 들으면 피아노를 다시 시작해보고 싶은 의욕이 활활~ 타오르네요.
9788967211745,10,감수성 짙은 OST를 레이나만의 매력이 넘치는 깔끔한 편곡과 보기 쉬운 피아노 악보가 정말 매력적이네요.
9788967211745,10,레이나의 감성이 잘 담겨있는 멋진 편곡의 피아노 연주를 만나서 정말 좋아요.
9788967211745,8,팬이라서  기대됩니다~^^
9788967211745,10,레이나가 편곡한 독특하고 감수성 넘치는 ost 곡들을 직접 연주할 수 있는 악보집이라 소장가치가 높네요. QR코드로 레이나의 연주 영상을 먼저 감상할 수 있어서 좋습니다.
9788967211745,10,정말 팬입니다ㅎㅎ1권 나올때부터 바로 구매했었는데 벌써 2년이 지나 3권이 나왔네요아직 배송 오지도 않았는데 감성돋는 곡들 너무 기대돼네요ㅎㅎ
9788967211745,10,독특하고 감수성 넘치는 레이나 스타일의 편곡이 너무 마음에 들어서 구독하고 있는 구독자입니다. 인기곡을 매력적으로 편곡한 악보가 실려있고 레이나의 동영상까지 QR 코드로 바로 볼 수 있다는 점에서 매우 기대되는 책입니다! 취미생활에 활력을 불어넣어줄 것 같은 책이라서 너무너무 기대돼요!!
9788967211745,10,베스트 중의 베스트 피아노 곡집입니다. 알짜배기 좋은 곡들만 제대로 리스트를 뽑았습니다.
9788967211745,10,"레이나의 매력이 넘치는 피아노 노트가 벌써 3권이 나왔네요.  감수성을 흠뻑 자극해 줄 레이나의 OST 피아노 편곡들을 직접 연주해보고, 또 유튜브나 QR코드를 통해 직접 들어볼 수 있어서 만족스럽습니다."
9788967211745,10,기대되는 피아노 곡집입니다.
9788967211745,10,좋아하는 곡들이 많고 악보집이 깔끔하네요.
9788967211745,10,아름다운 OST곡을 피아노로 연주 할 수 있게 악보가 수록되어 있어서 기대되네요.
9788967211745,10,다양한 곡이 수록되어 있고 재미있게 칠 수 있는 노래의 악보라서 좋은 것 같습니다.
9788967211745,10,"좋아하는 곡이 수록되어 있고, QR코드로 직접 연주를 할 수 있어서 정말 좋습니다."
9788967211745,10,QR코드로 편곡 감상하기 좋을 것 같아요.
9788967211745,10,영화부터 게임 BGM까지 좋은 곡들이 가득 담겨있네요. 저번 1권 2권도 정말 좋았는데 이번도 믿고 구매해도 될것 같습니다.
9788967211745,6,ost 악보라고 해서 ost만 있는줄 알았는데 가요도 있고 게임 음악도 있고 좀 더 다양하군요. 피아노 특유의 서정성을 강조한 편곡이다 싶었어요. 그래도 초보자가 치긴 어렵겠지만 아주 난이도가 높진 않아 보이네요. QR코드 있어서 완곡 들어보고 연습할 수 있는 것도 좋은 것 같군요.
9788967211745,10,내가 좋아했던 곡들이라도 악보를 알 수 없어 아쉬웠는데 이 책으로 그 아쉬움을 풀게되네요.
9788967211745,10,좋아하는 곡들을 편곡을 통해 피아노 연주곡으로 만들어져있어 직접 연주해볼 수있어서 좋아요.
9788967211745,10,대중들에게 인기 있는 다양한 장르의 선곡을 편곡 버전 그대로 연주해볼수 있어서 좋아요
9788967211745,10,다양한 장르의 곡들을 엄선하여 즐길 수 있게 정리를 잘한 것 같고 추억도 되새기며 연습할 수 있을 것 같아 너무 좋네요^^
9788967211745,10,다양한 장르의 피아노 연주곡을 만날 수 있기 때문에 정말 기대가 됩니다.
9788967211745,10,재밌게 봤던 애니메이션의 OST들이 많아서 연주하면서 즐거움을 느낄 수 있을 것 같아요. 악보도 어렵지 않아서 마음에 드네요.
9788967211745,10,수록된 곡들의 목록을 보니 감성 넘치는 곡들로 구성되어 있어서 기대되네요. 디지털 시대에 발맞춰 QR코드를 통해 동영상 연동까지 되니 독학하기 아주 좋을 것 같네요~ 추억의 곡들을 듣기만 하지 않고 직접 연주할 수 있으면 감회가 새로울 것 같아서 의미있는 책이라고 생각합니다!
9788967211745,10,평소에 구독해서 올라오는 연주 영상들을 행복하게 듣고 있는데 이렇게 세번째 책이 나와서 좋은 편곡들을 악보로 소장할 수있다니 정말 반갑네요. 정말 다양한 장르에 다양한 곡들을 담고 있어서 레이나 님의 감성을 좋아하는 분들은 만족할 책이라고 생각해요.
9788967211745,10,좋아하는 곡들이 많네요. 유튜브에서 실제 연주 영상도 볼 수 있는 점이 좋네요.
9788967211745,10,아이가 치고싶은 곡들이 모두 들어있네요. 너무 좋은 곡들이에요
9788967211745,10,"유치원 대문도 못 넘어 본 대신 여섯 살부터 피아노집 문턱이 닳도록 오갔지요.서점에서 신간 피아노책 찾는게 취미인 저로서는 레이나 노트Ⅲ은 first kiss를 서두로 하여 봄날의 입맞춤 같은 곡들로 무장한,정말 레이나 노트의 best of best였슴다.레이나노트Ⅳ에 오를 명곡들을 진심으로 기대합니다"
9788967211745,10,"누구나 한번쯤 들어봤을 유명한 곡부터 영화, 게임 BGM까지 다양한 장르의 음악들을 소개해주고 그것에 대한 교본까지 큐알코드로 찍으면 영상으로 볼 수 있어서 참 좋더라고요. 영상도 차근 차근 교본처럼 쳐주셔서 확실한 도움도 받을 수 있어서 좋아요. 레이나의 피아노 노트 4도 벌써 기대 됩니다"
9788967211745,10,<레이나의 피아노 노트3> 를 통해 좋아하는 곡들을 혼자서 마스터 할 수 있을 것 같아요. 특히 악보를 보고 모르는 부분은 레이나의 강의로 바로 볼 수 있다는 점이 최고인 것 같아요! 센스 있는 선곡들도 너무 마음에 들어요. 얼른 만나보고 싶습니다!
9788967211745,10,너무나도 유명하고 멋진 ost 곡들을 피아노 연주로 쳐 볼 수 있는 시간이 될 것 같아 너무 기대됩니다.
9788967211745,10,"그 누구의 음악과도 다른, 레이나의 감성이 고스란히 담겨있는 피아노 선율♬ 피아노 노트2에 수록된˝시간을 넘어서˝는 오늘처럼 빗소리 들리는 날 촉촉히 마음을 적셔 주지요. Reynah채널에서 곡과 함께 올리는 글에선 한없는 겸손함까지 어쩌면 피아노 연주는 심성에서 시작되는 것 같은 느낌을 받습니다. 악보로 연습해서 저만의 곡으로 만들어가고 싶네요."
9788967211745,10,곡들이 너무 예뻐요  소장하고 두고두고 볼 것 같네요
9788967211745,10,레이나님~ 유튭 진짜 잘 보고 있습니당~~^^항상 들으면서 진짜 감동받고 있습니다~~^^ 더 좋은 음악 항상 부탁드립니다~~^^ 가장 기대 되는 것은 말할 수 없는 비밀 fitst kiss 입니다~~진짜 재밌게 본 영화예요~~^^완전 기대합니다~~책도 기대할꼐용~~^^
9788967211745,10,유튜브에서 동영상으로 보면서 편곡 느낌이 좋아서 자주 들었는데 곡들이 대체로 제가 좋아하는 곡들이라 악보집도 소장하고 싶어 구매했어요
9788967211745,10,"수록된 곡 모두 좋아하는 곡이네요. 레이나의 깔끔한 편곡이 마음에 들어 구입했어요. 4, 5권도 계속 나왔으면 좋겠어요."
9788967211745,10,다양한 장르의 곡들이 담겨져 있어서 너무 좋습니다. 저자의 연주 동영상을 볼 수 있다는 점도 마음에 들어요.
9788967211745,8,수록곡 리스트를 쭉 봤더니 평소에 좋아하던 곡들이더라고요 피아노로 연주할 수 있는 좋은 기회인데다가 저자의 편곡버전도 감상 가능하다니 빨리 구매해야겠어요
9788967211745,10,"유투브의 레이나님의 연주곡을 듣고 다시 피아노에 흥미를 느끼게 된 울 따님을 위해 1,2권에 이어 3권도 구매각입니다 ~~ㅎ"
9788967211745,10,피아노라는 악기가 주는 신비로움이 있다. 서툴지만 악보를 보며 한음한음 만들어가는 행복한 시간이 될 거라 생각한다.
9788967211745,10,어느새 3권이네요! 처음 레이나님 유튜브 채널을 접한 것이 아리랑 랩소디였는데 말로 표현하기 힘든 감동을 느꼈던 게 기억납니다. 이번 3권에 그 아리랑랩소디가 실렸다는 걸 보고 다시 한 번 피아노 연습의 의지를 불태우고 있어요. 스케일연습하며 기다릴게요!
9788967211745,10,"악보집이 이렇게 감성적일 수 있을까. 레이나 채널의 구독자로서 전권 모두 소장했고, 새로운 권이 왔다. 잔잔하게 비 오는 날 따뜻한 코코아 마시는 느낌의 책. 촉촉한 감수성이 좋아 하나씩 하나씩 아껴서 친다."
9788967211745,10,평소에 동영상으로만 연주를 들었었는데 이제 제가 직접 연주해 볼 수 있다니 너무 좋습니다.
9788967211745,10,영화나 애니메이션 등 우리들에게 인기 있는 선곡과 각 악보마다 저자가 연주한 QR코드 동영상을 첨부하여 편곡 버전 그대로 연주할 수 있게 하여 흥미로운 피아노책이라 기대가 되는군요.
9788967211745,10,"유튜브 Reynah채널의 피아노곡들 중에 감미롭고 개성있는 베스트 20곡을 피아노곡집으로 만나보게 되어 반갑네요. 다양한 장르별 악보들을 깔끔하게 수록하고 있어 피아노로 직접 연주해볼 수 있고, 각 곡마다 QR코드도 수록되어 있어서 레이나가 연주한 곡들을 직접 감상하며 힐링할 수 있어 좋아요."
9788967211745,10,다양한 ost 음악이 피아노 노트안에 들어가 있어서 좋은 것 같아요. 직접 연주해보고 싶네요~!
9788967211745,10,제가 좋아하는 애니메이션 음악들을 편곡된 버전으로 새롭게 연주해 볼 수 있어서 너무 좋았습니다.
9788967211745,10,깔끔한 악보 스타일이 인상적입니다. 그만큼 누구나 쉽고 즐겁게 피아노 연주를 도전할 수 있을 것 같아 매우 기대됩니다. 또한 많은 사랑을 받는 OST를 레이나님의 편곡 버전으로 배울 수 있다는 점이 정말 좋네요! :)
9788967211745,10,악기 중에서 피아노를 가장 좋아해서 피아노곡을 자주 듣는데 우리에게 익숙한 곡들을 피아노로 연주해서 들을 수 있으니 귀가 즐거워요
9788967211745,10,벌써 음악의 선율이 들리는 것 같은 착각이 드네요. 우리 귀에 익숙한 OST를 엄선하여 담아 소장할 만합니다. 피아노 연주를 취미로 하는 동생에게 선물로 주면 좋을 것 같아요.
9788967211745,10,주옥같은 OST 명곡들이 모여있네요. 레이나님의 감성적인 편곡이라 더 좋은 것 같습니다. QR 코드를 통해 감상할 수도 있는 점도 참 만족스럽습니다. 추천할 만한 악보집이라 생각합니다.
9788967211745,10,레이나의 아름다운 ost 명곡들을 악보집으로 만날 수 있어서 좋네요. 서툰 솜씨나마 얼른 연주해보고 싶습니다
9788967211745,10,레이나님 유튜브 채널을 구독자 20만명 정도일 때 알고 그 때부터 레이나님 한 영상을 정말 몇 십번 돌려볼 정도로 자주 보는데 레이나님 피아노 노트3 도 나온다니요... 2도 샀는데 3도 무조건 사야겠습니다 ㅎㅎ 레이나님 항상 화이팅하세요!
9788967211745,10,레이나의 악보집은 너무 쉽지도 너무 어렵지도 않게 최대한 원곡의 분위기를 맞추면서 세련되게 연주할수 있게 만드는 것에 편곡의 초점을 두고 있습니다. 때문에 대부분의 사람들이 바라마지 않는 명곡들을 예쁘게 치고 싶다라는 간단하면서 소박한 바람을 이루는데 큰 도움이 되어줄 것 같네요. 함께 수록된 QR코드 동영상을 통해 실력이 더욱 일취월장 하기를 기대합니다.
9788967211745,10,음악도서 판매 1위 축하합니다~ 레이나의 편곡으로 기존의 노래들이 새로운 생명으로 재탄생하는 것을 보면 괜히 베스트셀러가 아니구나 하는 생각이 들더라고요. 악보도 보기 쉽고 동영상 코드도 있어서 연습하기에 아주 좋은 것 같아요.
9788967211745,10,와우 너무너무 기대가 되는 악보집이에요 ㅜㅜ 백옥같은 레이나님의 손에서 나오는 선율을 따라서 쳐보고 싶어요~
9788967211745,10,구독자수가 보증합니다.시리즈 3편의 위엄 ㄷㄷ
9788967211745,10,갖고싶은 핫 아이템이 될것같습니다. 피아노 배우고 싶게 만드네요
9788967211745,10,레이나님의 커버 음원을 들으며 잠에 들곤 해요.연주를 듣고 있으면 레이나님처럼 좋아하는 노래를 피아노로 치고 싶다는 생각이 많이 들어요.어렸을 때 그만둔 게 미련이 남아서 그런 것도 있는것같구요.ㅎㅎ그때는 좋아하는 음악을 하지 못했으니까요.이제라도 천천히 즐기면서 해보려고 구매합니다.
9788967211745,10,"항상 바쁜 생활에 쫓기다가도 레이나님 커버 영상 보면 없는 힘도 솟아나는 기분이에요. 바쁘다고 피아노에 완전 손 놓고 있었는데, 레이나님의 피아노 노트 1,2권 덕분에 열심히 연습하고 있답니다! 얼른 3권도 받아서 한 곡씩 도전해보고 싶어요. 항상 감사하고 정말 좋아하고 있어요:)!"
9788967211745,10,나올때마다 늘 구매하게 되는 유일한 피아노 베스트곡집. 수록곡들이 너무 너무 베스트 굿입니다.
9788967211745,10,"유튜브로 2년 전부터 봐왔고,  1,2권을 소장중이기에 이번 3권도 기대하고 사겠습니다."
9788967211745,10,기대됩니다
9788967211745,10,"레이나님 악보집 1,2도 구매해서 정말 재밌게 연주하고있었는데 악보집3도 나온다는 소식에 한달동안 두근두근했어요!ㅎㅎ 빨리 악보집3도 연주하고싶네요"
9788967211745,10,"처음 유튜브에서 피아노 연주를 들었을 때는 저렇게 연주해 보고 싶다는 생각이 가득했어요 그래서 악보집을 만났을 때는 너무 기뻤고, 2번째 악보집까지 나왔을 때는 몰랐지만 3번째 악보집이 나온걸 보니 왠지 앞으로도 악보집이 더 나올 수 있다는 생각에 설렙니다"
9788967211745,10,"헐 메이플스토리랑 바다가 보이는 마을, 이웃집 토토로 ost.... 다 제가 좋아하는 음악밖에 없어요ㅠㅠㅠㅠㅠㅠ넘 좋아요 진짜 구매해야겠어요 레이나님 유튜브 채널도 구경가야겠어요!!!"
9788967211745,10,레이나님 채널 너무 좋아해요~~ 빨리 피아노로 쳐보고 싶네요. 기대되네요.
9788967211745,10,피아노는 못치나 피아노 연주 듣는거 좋아합니다
9788967211745,10,아름다운 음악들을 피아노를 통해 만나볼 수 있게 도와주는 유튜브의 연주를 악보집을 통해 편곡 감상도 하고 직접 연주도 해 볼 수 있을 것 같아 기대되는 책입니다.
9788967211745,10,"레이나의 유투브  연주를 보면서 깔끔하게 연주하고 좋은 음률에 몇 번씩 듣고 했었는데, 이번에 책으로 나온 소식과 QR코드로 찍어서 들을 수 있을 듯 싶어 더 좋아진것 같아요."
9788967211745,10,내가 치는 건반이 이렇게 아름다운 소리를 낼 수 있다는 것을 다시금 깨닫게 해주는 책을 기대한다.
9788967211745,10,"유투브로도 많이 듣고, 조카 태교 음악으로도 많이 들었었는데요. 악보집으로 나온다니 정말 기대됩니다! QR 코드까지 있는 건 신의 한수입니다! 짱짱!"
9788967211745,10,유튜브로 자주 들었는데 악보집으로 만나보게 되어 반갑네요. 기대됩니다.
9788967211745,10,음색이 정말 너무 이쁘네요 곡들이 하나같이 정말 아름다워서 듣고있으면 정말 스르르 미소가 드는듯한 감각이 드네요~하나 구입하면 정말 감수성있게 감상하면서 커피한잔 내려서 마시면 기분이 좋을것 같아요~ 꼭 한 번 구매하고 싶네요~
9788967211745,10,악보가 언제 나오나 계속 기다렸어요~  이번 악보는 특히 제가 좋아하는 곡들이 많아서 너무 기대됩니다~!!
9788967211745,8,그동안 다양한 미디어를 통해 듣던 명곡을 피아노로 연주해볼 수 있어서 기대되고 누구나 다 아는 친숙한 곡이라 지인에게 들려주기에도 좋을 것 같아요.
9788967211745,10,악보와 함께 공감할수 있어 더 흥미로운듯 합니다
9788967211745,10,악보와 함께 실제 연주 영상을 함께 보면 아주 좋을 것 같아요 수록곡도 너무 좋네요 추천합니다.
9788967211745,10,좋아하는 곡이 많이 수록되어있어서 기대됩니다. 큐알코드로 바로 음악도 들을 수 있어서 더욱 좋은 것 같아요.
