ISBN13,rating,review
9788934931843,10,아도르노와 벤야민을 쉽게 설명하고 있어요. 그들 사상의 전체를 드러내기보다는 비교에 초점을 맞추어 끝까지 일관되게 밀고간 점이 이 책의 장점이면서 단점이죠. 하지만 그런 단점이 없는 책은 없다는 사실. 초점을 맞추면 사라지는 의미는 반드시 있기 때문에..
9788934931843,10,간명하고 정확하게 벤야민의 이론을 기술합니다 ‘입문서‘로 좋습니다
9788934931843,6,전반적인 개념을 단순하게 도식화 할 수 있는데는 괜찮다.
9788934931843,10,생각해볼 여지를 많이 던져주는 책
9788934931843,8,"맑스의 토대를 둔 사적유물론의 호르크하이머의 비판, 후기 호르크하이머의 아도르노의 계승, 그리고 벤야민에게서 만개한 비판이론에 대해서 일목요연하게 잘 정리 되어 있습니다. 단, 벤야민과 아도르노의 사상이 이 책에서 말한 것이 전부이자 절대라고만 생각치 않는다면 좋은 입문서가 확실합니다"
9788934931843,10,"벤야민과 아도르노를 꼼꼼히 비교한 책이다. 데카르트, 칸트, 맑스에 이르는 사상의 변화를 추적하며 프랑크푸르트 학파 또는 비판이론의 탄생과정을 설명한다. 아도르노를 먼저 소개하고 벤야민을 소개하며 그 차이를 밝히고 마지막으로 아도르노의 문화산업론에대한 ｀문화연구｀의 비판을 싣고 있다."
9788934931843,2,벤야민이 대중을 긍정하지 않은 만큼 아도르노도 엘리트주의자가 아니다. 사유해야 할 지점에서 사유를 정지시키는 이분법의 기만.
9788934931843,8,좋네요
9788934931843,8,대중문화와 고급문화의 상투적인 구별을 듣고 자라난 세대가 읽어볼만한 해설서
9788932908397,8,너무 비싸....
9788932908397,6,작은 글씨는 눈이 아파서 못보겠다. 에코가 말하는 키치에 제일 끌리는 난 뭐냐...
9788932908397,10,추의 역사는 고대 시대부터 있었다. 추의 이론과 역사에대해 풍부한 도판과 예로 이해할 수 있는 책. 추에 미학에 관하여 거시적으로 살필 수 있다. 도판이 함께 있어 중고생부터 대학생까지 두루 읽을 수 있는 책.
9788932908397,8,미에 대한 역사는 많이 있지만 추에 대한 역사는 별로 없는 것 같다. 움베르토 에코이기 때문에 쓸수 있는 책인것 같다.
9788932908397,10,"에코의 시각은 넓다.  보는 눈도 나쁘지 않다 - 전혀!!!좋은 책이긴 하지만, 보다 많은 사람이 볼 수 있게 저렴하게 나왔으면 더 좋았을 책이다.하지만.... 이 가격에도 전혀 후회하지 않을 명작임에는 틀림없다 - 일독을 권한다."
9788932908397,10,움베르토 에코의 책 중에서 가장 좋아하는 책이에요. 정말 돈 생각은 안납니다.
9788932908397,10,책값이 아깝지 않은 좋은 책입니다.
9788932908397,8,자꾸 자꾸 보게 되는 매력적인 책.^^*
9788932908397,2,중간중간 그림이랑 부가설명이많아서 지문만 그대로 읽긴 좀 힘드네요
9791190749046,10,판타지에 대한 전반적인 부분이 많이 나와있다. 판타지 장르볼때 큰 도움됨
9791190749046,8,"직업별 연봉과 자격요건이 인상적이에요ㅋㅋㅋ 주요 직업은 테크트리나 관련 내용이 같이 있구요, 직업별로 세세한 설정보다는 전체적인 개요 파악에 좋아요 참고하기도 좋고 흥미삼아 읽기도 좋을듯"
9791190749046,10,이런 책이 나오다니!! 좋으네요!
9791196166076,10,솔직히 표지가 예뻐서 샀아요...
9791196166076,6,여기에서 제시된 이야기들을 09-10년도 당시에 접했다면 어땠을까.
9791196166076,10,저자가 우울증으로 떠났다. 계몽의 변증법만큼 우울한 책
9791196166076,10,"북토크에서 번역자분의 지나칠만큼 겸손하신 태도를 보고(일반적인 지식인들과는 너무나도 다른!) 굉장히 성실한 번역이라고 짐작했는데 아니나다를까 번역자 분의 각고의 노력이 빛나는 책. 원작자의 생각을 투명하게 전달해주셔서, 또 머뭇거리시며(부끄부끄하며;;;) 해주신 사인 감사합니다."
9791196166076,10,전방위에 만연한 무기력과 우울에 대한 접근이 탁월합니다. 개념어 번역이 적확하고 문장도 나무랄 데가 없어서 마크 피셔의 다른 책도 이 역자의 번역으로 읽고 싶습니다.
9791196166076,10,실패의 필요성
9791196166076,10,"˝자본주의의 종말보다 세계의 종말을 상상하는 것이 더 쉬운˝ 우리 시대에 대한 간결하면서도 날카로운 비평이다. 문화비평이 당혹스러울 정도로 평범해진 지금 시대에, 그리고 지젝식의 자본주의 비판이 이제는 심드렁해진 이들을 향해 ‘더 낫게 실패하기‘ 위한 반복의 제스처가 이 책에 담겨 있다."
9791196166076,10,꼼꼼하고 매끄러운 번역과 시의적절한 내용.문화비평이 죽고 문화연구만 남은 시기에 비평이 나아갈 방향이 무엇인지 보여주는 책. 동시에 변증법적 비평이 무엇인지 증명하는 책!
9791196166076,10,책 겉표지면이 너무나 마음에 들어서 그냥 지나칠수가 없었습니다. 책 내용까지도 궁금하게 만드는 디자인인 것 같습니다. 기대가됩니다.
9791162203132,10,책 자체가 이쁘게 잘 나왔다. 벤야민의 사진에 대한 글들을 단순히 모은 것에 그치지 않고 편집자의 긴 서문과 함께 각각의 글 앞에 편집자가 소개글을 덧붙이고 있다. 변역도 무난함.
9791162203132,10,벤야민의 사진 이론은 어떨지 궁금했는데 천천히 읽어봐야겠어요. 무엇보다 디자인이 정말 예쁘네요.
9791162203132,10,작년에 출간 알림 신청했는데 알림 떠서 반가웠어요. 읽기 시작했는데 앞부분부터 좋네요.
9791162203132,10,"디자인 예뻐요. 선물받아서 제것은 있고, 사진 좋아하는 친구에게도 선물로 보내줬어요. 천천히 읽고 있는데 생각보다 어렵지 않은 것 같아요. 꼼꼼한 번역 덕 같기도 하고. 위즈덤하우스에서 인문서도 나오는 지 몰랐는데, 출판사가 위즈덤하우스네요.^^ 다 읽고 나서 다시 리뷰 올리려구요."
9788956605944,10,이 책에서 배운게 너무 많다 깊이 느끼고 작가들의 생각을 체화하고 싶어서 일부러 천천히 읽었다
9788956605944,10,"저자가 팟캐스트에 출연해서 차분하게 말하는 것을듣고 5권 다 읽었다.  프랑스, 벨기에 불어권을 취재하면서 제2외국어의 중요성을 깨달으며, 그림책이 어른에게도 메시지를 준다는 것을 느낌.  그림책은 자기 철학이 있는 사람이 해야 한다는 것도."
9788956605944,10,좋은책이에요
9788956605944,10,몰입과 감동을 주는 책입니다. 그림책에 대한 정보 이상의 삶에 대한 태도에 대해 생각해보는 시간을 가졌습니다. 더불어 그들의 삶을 과정을 보며 내 아이를 어떤 마음가짐으로 키워야할지에 대한 해답을 얻을 수 있었습니다. 도서관에서 빌려읽고 소장하기위해 구입합니다.
9788956605944,10,막연한 동경을 가지고 있던 작가라는 직업에 대해서 구체적으로 또 진지하게 생각을 할 수 있는 기회를 준 책입니다. 또한 공감되지도 않는 말 보다는 한국인이라면 충분히 가질 수 있는 질문들로 구성이 되어 있어 알차다고 생각합니다. 육아를 위한 서적일 수도 있으며 답답할 때 읽어도 좋습니다.
9788956605944,8,‘리틀 빅북‘과 함께 읽으니 더 재미있는것 같아요. 그림 작가들의 서재와 작업공간을 보는 재미도 쏠쏠해요. 다음에 도서관에 가게되면 책속의 그림작가들의 책들을 찾아봐야할것 같습니다.
9788956605944,10,작가를 알게 되어 더 없이 좋아요! 그림책도 더 알아가는 재미를 더해줍니다~ 그림책 공부하는 엄마에게 꼭 봐야할 책
9788956605944,10,"작가들이 말하는 인간적이고 평범한 모습들이 위안으로 다가오네요. 엄청 창의적이고 기발할 것 같은 작가들의 신조(?)가 심심함, 궁금해하기, 관찰하기처럼 평범하다는 것도 신기하고요. 짬내서 볼 때마다 감동받습니다!"
9788934973317,8,"삼성가의 미술품에 관한 이야기를 얻을 수 있는 기회. 그러나 도판이 오래된 것들이 여럿 있고, 소장 경유에 관한 불명확함과, 자신을 포함한 주변에 대한 평과 그 테두리를 벗어난 것에 대한 그것의 균형이 부족한 것은 아쉽다."
9788981055974,8,조금 오류는 있지만 관련 서적이 드문 국내에서 이런 좋은 책을 엮어주심에 감사하다.
9788980389391,6,"존버거의 ‘여기 우리가 만나는 곳’ 소설을 읽고 좋아서 이 책까지 구매했습니다. ‘본다는 것의 의미’는 여러 작가, 수필가들에게도 자주 인용되어 기대가 컸었어요. 하지만, 번역이 아쉽습니다. 한 장 한 장 읽어내기가 쉽지 않네요..."
9788932036052,8,"매체가 어떻게 변화하며 발달해왔는지 차근차근 설명해줍니다. 다만, 100% 서양, 그것도 유럽 중심의 관점만을 반영하는 것이 조금 아쉽긴 합니다."
9788932036052,8,매체 이론과 역사의 첫 숟가락으로 알맞은 책
9788997066438,10,제목은 딱딱하지만 내용은 아주 흥미롭고 재밌습니다
9791195952700,6,"확실히 번역 문제가 좀 있는 것 같습니다. 원문이 그런건지 모르겠으나, 디디 위베르만의 다른 책에선 난삽함을 느낀 적은 별로 없는데, 이 책은 유독 좀 난삽하게 느껴지네요. 핵심에 접근하기가 어렵습니다. 무슨 말을 하려는 건지도 잘 안 잡히구요."
9791195952700,10,"조르주 디디-위베르만의 이 책은 고전의 반열에 오를 것이다. 그러나 번역 문제가 크다. 아카이브를 자료라고 하거나, 인간형태론을 신인동형론으로 옮긴 것 등은 디디-위베르만 전반에 대한 이해가 부족함을 드러낸다. 한 문장에 동일한 주어를 두 번씩 반복하는데, 이는 자연스러운 한국어가 아니다."
9791195952700,10,"1부는 화염덩어리의 열기로, 2부는 논쟁의 열기로 뜨겁다. 재현할 수 없는 것, 상상할 수 없는 것에 대해 논할 때 교본으로 삼을 만한 책이다."
9791195952700,8,번역이 문제인지 아님 원래 글을 좀 어렵게 썼는지.. 어렵다기보단 비문이 많아서요. 요즘 누구 때문에 비문을 많이 접하다보니... 비문이 많으면 머리가 어지럽네요. 잘 팔리는 책이 아닌지라 번역 출간에 감사합니다. 다만 읽기는 버겁네요. 그래도 계속 읽어봐야죠.
9791195952700,6,"1부까지 읽은 소감은, 큰 무리는 없지만 역시 번역이 조금 안타깝다는 느낌. 물론 쉽지 않은 책임엔 분명하지만 이미 번역된 <반딧불의 잔존>에 비한다면 많은 부분이 걸려요. 이미 번역이 된 많은 문헌들-레비,아감벤, 벤야민 등-을 참조했다면 훨씬 깔끔하게 번역되었을텐데 하는 아쉬움도 드네요."
9791195952700,10,"역자의 이전 번역에 대한 비판은 그 책 판매란에 가서 하면 되지 않을까요?책이 한 번 나오면 재번역은 역자가 아니라,출판사에게 최종 권한이 있습니다,역자가 원한다 해도.여하튼 귀하고 힘든 책이 번역된 것 같아 기쁘고,역자의 노고에 감사드립니다.일단 정독하겠습니다."
9788961471893,8,"내용이 충실하고 흥미롭고 논문 요약본 같은 느낌으로 쭉 훑어보기 좋아요. 다만, 번역가의 번역에서 다소 미흡한 점(컴마를 살려야 하는 부분에서 컴마가 빠진 부분이 많음, 맥락을 살리지 못하는 대명사 번역)으로 인해 별 한개 깎습니다"
9788961471893,10,이 책 좋다. 교과서처럼 매일 한챕터씩 읽으면서 독학 중이다. 문화사회학 이론을 향하여(앨런 스웬지우드)와 함께 읽으면 더 좋겠다.
9788963247229,10,"케이팝 성공의 요인을 풍부한 자료와 해석을 근거로 알고 싶은 사람, 원론적이며 이론적인 것 보다 구체적이며 가장 최신버전의 분석으로 알고 싶은 사람, 문화와 미래기술, 컨텐츠와 기획력, 프로슈머 아이덴슈머가 되길 원하는 사람,  <케이팝 인사이트> 강추 !"
9791190030281,10,오종우교수님의 <예술수업> 감명깊게 읽고 예술친구들과 북토크도 했어요. <예술적 상상력> 읽고 있는데 역시 친구들에게 추천하고 싶어요.
9791190030281,6,딱 맥주 거품만큼의 유익함.
9791190030281,10,호기심에 집어들었는데 꽤 내용이 흥미진진하다.
9791190030281,2,ㆍㆍㆍㆍ두서없다
9791190030281,10,역시 오종우 교수님. <예술수업>에 이어 이 책을 통해 귀한 강의를 듣습니다. 인간이란 예술가란 무엇인지 다시 깨닫게 해주는 명작입니다.
9791187886419,10,좋다. 굳이 트집을 잡자면 글이 멀게 느껴진다는 것.
9791187886419,4,변역이 너무 안 좋다. 제발 번역을 좀 더 신경써줬으면 좋겠다..
9791187886419,6,문장 자체도 어렵고 내용도 이해를 위해서 상당한 사전 지식이 필요하다. 소화하기가 쉽지 않다. 개별작품들을 통해 보편적인 법칙을 유추해낸다기 보다는 한 평론가의 개별작품 분석에 가깝다.
9791187886419,4,파티장을 잘못 찾은 느낌? 여긴 어디 나는 누구. 그래도 영화 이야기는 좋았다.
9791187886419,10,"아 좋다. 백상현 <악마의 미학>과 함께 읽었는데, 연결고리가 있다. 기이한 것과 으스스한 것에 끌리고 필연적으로 그렇게 되는 것은... 세상이 부여한 가치와 욕망을 깨고 숨겨진 진리를 찾고자 함이다. 행잉록의 소녀들은 어디로 갔을까."
9791187886419,10,와 표지 제목이랑 너무 잘 어울린다... 주문했습니다.
9788954650892,8,예술이 높은 곳에 고고하게 있지 않고 낮은 곳에 임하며 우리와 같이 살아 숨쉬기를 바란다.
9788954650892,8,미술에 대한 새로운 시각. 그러나 ‘방법론‘편과 ‘정치‘편 일부를 제외하고는 나머지는 사족처럼 느껴졌다.
9788954650892,10,좋은 책입니다. 이분 소설은 취향이 아니었는데 사상 재밌네요
9788954650892,10,갖고 싶어요  ..
9788965642138,10,통렬한 ‘동시대‘ 담론 비판!!!
9788965642138,10,동시대 시각문화를 다루는 뛰어난 통찰력과 비판력
9788965642138,10,동시대에 대하여 뼈가 있는 질문들
9791185954363,10,"고대에서 근대, 현대에 이르기까지 미학의 흐름이 잘 정리되어있다. 현대 미학의 주요 흐름인 존재론, 생철학, 현상학, 표현론, 정신분석학, 기호학적 미학등을 통해 인간과 삶을 대하는 관점의 변화에 주의를 기울이고 있다."
9791185954363,6,핵심내용만 쉽게 풀어놔서 잘 읽었어요
9788997379590,6,"생각보다 내용이 추상적이며, 예를 들어 예술작품을 설명해주는 횟수가 적었습니다."
9788997379590,8,즐겁게 수업 잘 받았습니다.
9788997379590,8,예술이 우리의 일상과는 별개의 영역이 아니라는 깨달음을 다시 한 번 심어주는 책입니다. 물론 그 수업 내용을 삶과 온전히 결합하기엔 더 많은 연습이 필요하겠지만요.
9788997379590,6,예술관련 입문서로는 비추합니다. 하지만 구성이 알차고 좋은 자료수록이 많습니다.
9788997379590,10,알아듣기 쉽게 설명되어 있습니다.
9788997379590,10,"창조가 얼마나 어려운지, 또 그 과정이 얼마나 험난한지를 보여준다."
9788997379590,10,"문학, 음악, 미술, 영화에 대한 해석을 통해 예술이 좀 더 쉽고 가까운 것이라고 이야기하고 있는 책...술술 잘 읽힌다는 것도 이 책의 장점"
9788997379590,10,"좋다. 어렵지 않아서 좋고, 알게 되는 것이 많아서 좋다. 조금, 아주 조금 아쉽다면, 저자가 러시아 문학을 전공해서 그쪽으로 치우친...그래도 좋다.ㅋ"
9788997379590,10,일상에서 예술을 온전히 누리지 못하고 사는 삶이란 얼마나 불행한지! 이 책을 읽으며 내내 생각했던 것.
9788997379590,10,재밌게 읽었기 때문에 올해의 책으로 선정합니다.
9788997379590,10,마치 강의를 듣는 듯한 감상(비싼 강의 듣는 것만큼의 만족) 그리고 강의가 끝난 후 조금 다르게 보이는 세상의 경험. 이것이 예술이구나!
9788997379590,10,예술이란?
9788997379590,10,"책 내용이 매우 좋고, 단순한 수필 수준이 아니라 철학을 같이 생각하게 한다."
9788997379590,10,그림과 함께 자세한 설명 이해 쉽고 술술 페이지 넘어갑니다^^유익해요
9788997379590,10,무언가 대단한 것을 접하면 인간의 이성은 마비되고 감성이 폭발한다. 나중에야 그 감성을 분석하려 노력함.
9788997379590,10,일상어 갇혀서 굳어버린 나의 예술성에 대해서 다른 시각으로 바라볼 수 있도록 해줄 수 있는 책인 것 같아요. 기대되네요.
9788997379590,10,예술의 진정한 힘에 대해서 배워볼 수 있는 시간을 이 책을 통해 얻게 된 것 같네요.
9788997379590,10,"다양한 예술 작품을 만날수 있어서 좋습니다. 예술에 대해 생각하고, 조금 더 친해질수 있기를 기대해봅니다."
9788997379590,10,예술에 대한 깊은 이해
9788997379590,10,다가가기 어려운 예술을 다가가고 싶은 예술로 풀어쓰기
9788997379590,10,올해 내 삶을 좀더 풍요롭게 꾸릴 수 있었던 건 모두 이 책 덕분이다
9788997379590,10,다양한 분야의 예술을 엮어서 이해하고 감상할 수 있는 방법에 대하여 이해도를 높이고 즐길 수 있는 계기를 제공해주었기에 올해는 예술을 좀더 즐길 수 있는 해가 되었다.
9788997379590,10,"""인간이 자신이 처한 삶과 환경에 의미를 부여하는 행위가 곧 예술이라는 점이죠."" 어렵고 먼 예술을 생활 가까이로 어느정도는 끌어다준, 내가 보지 못하는 것을 작가의 눈으로 들여다 볼 수 있는 것 만으로도 즐거운 시간이었다."
9788997379590,10,˝같은 시대를 살면서 그 속에서 노예인지도 모르고 노예처럼 사는 사람과 자기 삶의 주인이 되는 사람이 풍기는 향기는 다릅니다. 삶의 질도 달라집니다. 이런 사람들이 많아지면 사회의 질도 달라질 것입니다.˝ 흔지 않은 세상을 바꾸는 책일 겁니다. 실질세계와 여분세계라는 개념에 엄청나게 동감!
9788954624879,8,저자의 지적 노고가 담긴 책입니다. 영화 이미지의 긴 모험을 만끽할 수 있겠네요.
9788954624879,10,영화를 이미지로 접근하는 관점으로 바라볼수 있었다
9788954624879,10,이 책이라면!
9788954624879,10,조금 어렵지만 계속 곁에 두고 읽고 싶은 책
9788954624879,10,영화에 대해 더 많은 것을 알 수 있었던 책인 것 같다.
9788954624879,10,영화를 꿈꾸는자 읽어야한다.
9788954624879,8,내용이 좋아요
9788954624879,10,"영화 이미지에 대한 사유의 흐름을 초기부터 최근까지 조망하는 책. 빈약한 국내 영화학계에서 이 정도의 규모와 깊이의 책이 나왔다는 자체가 놀랍다! 저자의 가독성높은 문장도 큰 장점. 베르그송과 들뢰즈에 관한 설명도 흥미롭지만 엡슈타인, 파졸리니, 바르트에 관한 글이 특히 인상적이다."
9788954624879,10,"<키노>의 휴간 이후 영화를 철학적으로 진지하게 다루는 대중지는 사라졌다(<씨네21>에게는 미안한 말이지만). 영화평론가 정성일의 표현을 빌자면, 이제 영화가 ｀경험｀이 아니라 ｀정보｀로 받아들여지는 시대에, 더욱 더 이론과 매체가, 이론과 독자 대중이 만나야 하지 않을까?"
9788997382163,10,"미술은 화학에서 태어나 화학을 먹고사는 예술이다! 와우! 제 흥미를 팍팍 자극하는 책입니다. 화학자의 눈에 비친 미술, 궁금하네요^^"
9788997382163,10,화학을 어떻게 미술과 연계해서 책으로  출간하였는지 기대해봅니다
9788997382163,10,명화를 보는 즐거움과 과학적 지식을 함께 얻는 기쁨이 있을 것이라 예상합니다^^
9788997382163,10,화학자가 보는 미술은 또 어떻게 다를까 궁금해지는 책이에요. 아이와 함께 봐도 좋을듯해 기대가 됩니다.^^
9788997382163,10,미술에 통 무뇌한 저에게 미술 속에 담겨있는 화학의 색체의 신비한 원리를 어떻게 담았을지 궁금하네요~~
9788997382163,10,화학자는 미술작품을 어떤 시각으로 바라볼까?사실 화학은 미술과는 꽤 관련이 깊은 학문이지 않을까 생각해본다. 물감의 발색이나 성분조합 등이 화학과 밀접한 관계가 있을테니..이 책에서는 어떤 이야기들이 펼쳐질까 궁금하다.
9788997382163,10,미술을 감상하며 어떻게 화학적 지식으로 풀어냈을지 무척 궁금합니다. 아이들에게도 통합교육을 중요시하는데 저도 통합교육을 이책을 통해 시작해야겠어요
9788997382163,10,안어울릴 것 같은 조합의 제목이 주는 호기심에  내용이 보고 싶어지는 마음입니다.
9788997382163,10,미술에 관한 지식도 화학에 관한 지식도 어중간한 제게는 좋은 책이었습니다. 선물로 받은 분도 좋아하시더군요... 다만 글쓴이가 과학자이면서도 하느님과 예수를 믿어서 관련 종교를 가진 분께 더 가깝게 다가가는 듯 합니다. 저는 그 부분에선 이질감을 느꼈네요...
9788997382163,10,그림과 화학을 연결시켜 재미있게 읽었고 그림의 인쇄질도 만족함실제로 화학과 물리 이야기가 반반 섞인 내용이 꽤 수준높은 설명임
9788997382163,6,미술사에 과학이 조금 곁들여진 정도라 아쉬웠다. 과학 용어나 이론에 대한 설명이 좀 더 자세했으면 했다.
9788997382163,6,화학분야의 책을 읽고 싶었다면 조금 예상을 어긋남. 미술책이라고 해야할 것 같다. 화학적인 지식을 많이 가지신 분이 미술을 감상한 책이라고 해야할 듯.
9788997382163,6,독자를 너무 배려해 가끔은 제목을 스스로 잊기도 한다.
9788997382163,10,미술 선생님은 가르쳐 주지 않았던 것을 가르쳐 주네요. 왜 이 그림이 중요한 것인지 왜 명화라고 부르게 된 것인지를 알게 되었어요. 중고생들이 읽으면 넘 넘 좋은 책입니다.강추.
9788997382163,8,"아직 읽어 보지는 못 했지만...
다들 추천했던 책이여서 기억하고 있어서...
많은 사람들이 추천하는 이유가 있는 것 처럼..
저한테도 이책을 추천하시는 분이 많아서..
읽지는 않았지만.. 추천합니다 ㅎㅎ"
9788997382163,8,"미술관에 간 화학자 제목이 특이하고 
미술은 다른 관점에서도 볼 수 있다는 점에서 좋다^^"
9788997382163,8,가장 많은 대중들이 미술에 관심을 가지고 이해하기 쉽게 미술에 접근을 한 것 같다. 추상적인 감상법이 아니라 현대인이 이해하기 쉬운 과학적 감상방법을 알려주며 지루하지 않고 재미있다.
9788997382163,6,너무 좋아요 흥미진진
9788997382163,10,"명화이야기를 학교교양으로 수강중인데, 이책을 참고했었습니다."
9788997382163,10,통섭이 화두가 된 이 시점에서 아주 흥미롭게 읽을 수 있는 책입니다.
9788954675079,10,"대단하고 놀랍다. 이런 좋은 책이 설마 일본에서,그것도 무려 이십여년전에 나오다니?!"
9788954675079,10,"재밌었어요. 악의 무리들이 정의의 무리들보다 여권이 높다(왜냐하면 간부층에 여자가 많아서) 라던가, 애니메이션에서 그리는 창녀와 성녀 구분이라던가.. 다 알고있는 내용이었음에도 정리된 것으로 보니 좋았어요."
9791190665001,8,저렇게 하면 잘찍히겠다 라고 알긴알겠지만 실천은 잘안되네요
9791157235544,6,결국은 여자들이 읽는 책.
9791157235544,10,‘깨어 있는 남성’이라고 착각했던 지난날을 반성했다는 작가 소개에서 진솔함을 느꼈다. 남성이 쓴 페미니즘 이야기라는 점이 가장 흥미로웠다. 과거의 사례가 아닌 현재진행중인 깨어 있는 일들을 다루고 있는 책이다.
9791157235544,8,저자가 남성이다보니 아무래도 결론이 약하고 내용이 평면적이다. 동시에 같은 이유로 우리에게 시사하는 바가 있다. 더 많은 남성들이 더욱 경계하는 삶을 살기를.
9791157235544,10,나조차 당연하게 여겼던 일들이 여혐이었음을 이 책을 읽으며 깨달았다. 그만큼 성차별의 문제는 공기처럼 일상에 자연스럽게 스며있다는 말이겠지. 특히 남자분들께 권하고 싶다.
9791157235544,10,분명 남성성이라는 프레임이 남성을 고립시키고 있다는 생각이 들었구요. 결국은  스스로가 객관화하고 깨부숴야 자신으로써 행복을 찾을 수 있다고 말하고 싶습니다. 방법은 바로 남성 페미니스트가 설명해주고 있습니다.
9791157235544,8,몰라도 되는 사람은 없다.
