ISBN13,rating,review
9788994796666,8,화나는 마음 글을 스면서 차분히 마음을 다스리는 캘리그라피를 연습하는데 좋은
9788994796666,10,글씨체 연습하는데 많은 도움이 되어 준 도서
9788994796666,10,글을 쓰면서 마음을 위로할 수 있는 것이 캘리그라피의 매력이 아닌가 싶어요. 다양하고 울림있는 글귀연습에 욕심이 납니다.
9788994796666,10,저도 다른 사람들의 손글씨를 보면서 자신만의 글씨체를 만들어보려고했는데 캘리그라피라는 것이 있다는 것을 알게 됬네요.
9788994796666,10,다양한 형태로 캘리그라피를 연습할 수 있어서 좋네요. 초심자도 쉽게 따라 할 수 있을 것 같습니다^^~
9788994796666,10,글씨체를 교정할 필요를 느끼고 있었는데 붓펜 하나로도 캘리그라피를 배울 수 있다니 시간을 내서 한 번 해봐야겠어요.
9788994796666,10,캘리그라피 배워보고 싶은데 책이 많은 도움이 될 것 같네요~기대됩니다^^
9788994796666,10,붓펜으로 배워보는 캘리그라피라 여러가지에 활용할 수 있을것 같아서 기대되는책입니다.
9788994796666,10,붓펜으로 시작하는 캘리그래프를 배우는데 있어 많은 도움이 되는 책인것 같습니다
9791185933276,2,책이 좀 구겨져서 왔어요. 표지는 약간 구겨지고 책 안 중간정도 페이지도 여러장 구겨져 있어서 새책이 맞나 싶은 생각이 드네요. 실망입니다.
9791185933276,10,"친구가 캘리그라피를 연습하는 것을 보고 캘리그라피에 관심을 가지게 되었는데, 이렇게 혼자서도 연습해보며 배울 수있도록 도와주는 책이 있다니 이번 겨울방학에는 캘리그라피를 연습해서 저만의 독특한 글씨를 적어봐야겠네요."
9791185933276,10,마음에 드는 글귀를 적기 위해 만년필을 들 수 있게 만들어주는 책.
9791185933276,10,영뭉 캘리그라피는 처음이지만 다양한 필체가 마음에 들엇어요. 덕분에 아름다운 서체에 도전하고 싶은 욕심이 생겼어요.
9791185933276,10,청년 시절 글씨를 잘 쓰는 사람들이 부러워서 밤낮을 가리지 않고 필기체를 연습했었던 기억이 떠오릅니다. 요즘에는 캘리그라피라는 글쓰기 장르가 점점 그 인기가 확대되는 추세로 보여집니다. 좋은 글씨는 사람의 좋은 마음을 이야기한다는 점에서 참으로 좋은 책이라고 칭하고 싶습니다.
9791185933276,10,"만년필에 관심이많아서 캘리그래피에 대한 책들을 많이 읽어왔는데,이 책은 만년필뿐만 아니라 붓으로 그리는 것 등 새로운 것들을 알게 될것같아요.이 책을 읽고 더욱더 예쁜 글씨체를 그릴 수 있었으면 좋겠습니다."
9791185933276,10,누군가의 도움을 받지 않고 이렇게 책을 통해서만 하나의 취미내지 특기를 완성할 수 있다는 것이 뿌듯하고도 기뻐요.
9791185933276,10,남들과 다른 것을 시도해 보는 것도 좋을 것 같습니다. 영문으로 약간 부드러운 서체를 표현할 수도 있을 것 같구요.
9791185933276,10,"캘리그라피에 대한 관심이 높아지는 요즘, 영문으로 배우는 것도 특이하니 새롭네요."
9791185933276,8,배워두면 멋지게 쓸수있을거 같아서 기대되네요
9791185933276,10,캘리그라피에 관심이 많았는데 이렇게 영문으로 된 책도 나와서 너무 좋습니다. 이책으로 일단 독학을 열심히 해봐야 겠어요.
9791185933276,10,얼마전 캘리 그라피에 관심을 가지고 혼자 배워보려고 비교적 저렴한 다른 책을 구입했었습니다. 기초적인 가이드가 없는 연습장이더군요 ㅠ 그래서 이번에는 인터넷으로 열심히 조사한 끝에 이책으로 결정하여 주문하였습니다.기초부터 배워나갈수 있을 것 같아요
9791185933276,10,여러 서체들이 있어서 유용하고 좋은 것 같다
9791185933276,10,캘리그라피 입문을 하는 초보자들에게 정말 친절한 책인 것 같아요. 설명이 정말 잘 되어있는 것 같네요.
9791185933276,10,"개인적으로 캘리그라피의 새로운 매력에 흠뻑 빠져서 지내온 시절을 겪었던 한 사람으로써,특히 이책의 캘리그래피의 퀄리티는 다른 책들과 비교가 불가할 정도로 가치있다고 생각됩니다.무엇보다 처음입문하는 사람들 부터, 접근성이 좋아, 쉽게 실력과 감각을 키워갈 수있는 부분이 특히그렇네요."
9791185933276,10,다양한 서체가 가득해서 자신의 취향에 맞게 따라할수 있는점이 정말 좋습니다
9791185933276,10,캘리에 처음 입문하는분에게 가장 어울립니다.
9791185933276,10,따라하다보면 정말 저도 멋지게 글을 쓸수있어요
9791185933276,10,검은 잉크 하나만으로도 힘의 강약에 따라 선의 굵기가 다이내믹하게 움직이며 컬러 못지 않게 표현되는 걸 보면 정말 신기합니다. 받침이 없어서 한글에 비해 쉬울 것 같은데 이참에 한 번 도전해봐야겠네요.
9791185933276,10,"펜촉의 종류와 사용법부터 제시되어 있어서 기초부터 배울 수 있다는 장점이 있는 책이네요. 캘리그라피를 배우려는 생각을 가졌을 때, 문화센터같은 곳에서 배워야 하나, 책으로 독학이 가능할까 고민을 많이 했었는데, 그 고민을 해결해 주고, 초보자가 걱정하는 것들을 상세히 설명해 줘서 좋네요!"
9791185933276,10,캘리그라피를 처음 시작하는 사람들을 위한 친절한 소개와 설명이 있어서 평소에 캘리그라피에 대해 관심있던 사람들이 시작하기에 딱 좋은 책이에요
9791185933276,10,캘리그라피 초보가 기본에 대해 쉽게 자세하게 배울 수 있어 좋은 거 같아요!
9791185933276,8,보통은 멋들어진 글씨를 보여주며 열심히 연습하면 이렇게 쓸 수 있습니다! 라고 말해서 사람을 맥 빠지게 하는데 이 책은 기초를 탄탄히 쌓을 수 있게 도와줘서 참 좋은 것 같아요.
9791185933276,10,"말로만 듣던 캘리그라피를 시작할 수 있다는 것만으로도 설렘을 갖게 됩니다. 캘리그라피에대한 전반적인 설명은 물론 순서에 서체별 가이드,그리고 유용하게 활용할 수 있는 한글서체를 비롯한 필체까지 알려주고 있어 처음 시작하는 저에게 길잡이 역할을 해준답니다. 글씨를 쓰며 전해져오는 행복함으로 마음이 따뜻해지는......."
9791185933276,10,기초부터 차근차근 알려주어 좋은 것 같아요 항상 시작했다 곧 흥미를 잃고마는데 이 책과 함께하면 지루해지진 않을 것 같네요
9791185933276,8,책 한 권에 내용이 상세하게 담겨있고 어렵지도 않은 것 같아 너무 좋아요.^^
9791185933276,10,캘리그라피 연습을 하고 있는데 뜻대로 되지 않네요. 이 책으로 제대로 된 캘리그라피 법을 배워서 저도 예쁜 글씨를 쓰고 싶습니다. 재미있을 것 같아요. 힘내서 해봐야지요.
9791185933276,10,너무 예뻐요!
9791185933276,10,우리 중학교 때 영어선생님께 배웠던 반의 아이들은 영어 필기체를 쓸 수 있어요. 선생님이 부족했던 탓에 저희는 가정선생님께 배웠는데 영어필기체를못쓰게 했는데 필기체는 못씁니다 .이 책보고 멋있는 문장 완성해 보고 싶어요.
9791185933276,10,자신만의 개성과 세상에 하나 뿐인 나만의 글씨를 가지고 싶다면 꼭 한 번 도전해 보고 싶습니다.
9791185933276,10,캘리그리피라는 말을 여기에서 처음들을 정도로 세상을 매우 바쁘게 살고 있는 것 같습니다. 그리고 배울려고 하기에 너무나 어렵습니다. 자신에게 파이팅
9791185933276,10,기다리던 책입니다. 꼭 도전해보고 싶네요.
9791185933276,10,영문 캘리그라피 왠지 멋져보이네요저도 이책으로 연습하면 잘 쓸 수 있겠죠?
9791185933276,10,"친구가 캘리그라피를 배우는데 정말 글씨가 작품이 되더라고요. 저도 이번 기회에 책을 통해서 우선 따라 해 보려고 합니다. 블로그, 카페에도 제 글씨체로 메인을 하는 그 날까지! 많이 도와주세요^^"
9791185933276,10,영문 캘리그라피를 기초적인 것부터 시작할수 있을거 같아서 관심이 가는 책이네요. 캘리그라피를 보면 한번 따라해보고 싶었는데 이책이 유용할거 같아요 기대됩니다
9791185933276,10,초보자들도 쉽게 배울수 있는 영문 캘리그라피인거 같아서 정말 좋네요. 상세한 설명과 함께 글씨 연습을 할수 있게 나온거 같아서 기대됩니다.
9791185933276,10,영문 잘 쓰고 싶었는데 많은 도움이 될 것 같네요~
9791185933276,8,관심은 있으나 시작하기가 어려운 캘리그라피 초보자에게 꼭 필요한 책이네요
9791185933276,8,캐리그라피 필기구에대한 정보에서부터 기본적인 영문 서체에대한 자세한 설명은 처음으로 캘리그라피를 접한 사람들이 쉽게 따라할 수 있게해주네요.
9791185933276,10,고딕체 소문자와 대문자 부터 차근차근 시작해서  일곱 가지 영문 서체의 특징과 알파벳 한 획 한 획에 대한 설명이 구체적이여서 영문서체의 기본을 탄탄하게 다질수 있습니다.  필기구의 종류와 사용법도 알려주니 다양한 펜촉으로 멋지게 자신만의 영문 손글씨를 써봅시다.
9791185933276,10,저는 영문 캘리그라피에 관심이 많았습니다. 친구들 보면 정말 이쁘더라고요.그래서 이 책을 읽어보았는데 정말 비싼학원 안다니고도 많은 도움이 됐습니다. 추천합니다.
9791185933276,8,혼자서도충분한 캘리그라피 이책한권으로 뚝딱
9791185933276,10,"저도 멋지게 영문으로 켈리그라피 쓰고 싶습니다. 하지만 도무지 어떻게 해야 되는건지, 뭘 사용해야 할지 몰라서 걱정했는데 이 책을 통해 처음부터 천천히 배워나가면 되겠네요"
9791185933276,10,정말 혼자 배울 수 있는 캘리그라피!관련 강좌를 오프라인에서 들어볼까도 했는데 이 책으로 충분한것같아요^^
9791185933276,10,특별한 날에 선물이 될만한 캘리그라피 활용법이 소개되어 있어 좋은 선물이 될 것 같아요
9791185933276,10,캘리그라피를 처음 시작하는 사람을 위해 기초부터 상세하게 설명되어 있어 캘리크라피 입문서로 강력 추천합니다
9791185933276,10,캘리그라피를 어렵게만 생각했는데 《혼자 배우는 영문 캘리그라피》에 나와있는 방법대로 차근차근 따라하다보면 멋진 캘리그라피 솜씨를 뽐낼 수 있을 것 같아요
9791185933276,10,캘리그라피에 대해서 관심이 있는데 이 책을 읽어보면 되겠습니다.
9791185933276,8,요즘은 손글씨보다는 스마트폰이나 컴퓨터 자판을 통해 글씨를 쓰기 때문에 손의 힘도 약해지고 글씨도 못쓰는 사람들이 많아졌죠. 손글씨 쓰는게 점점 귀찮아지기도 하구요. 캘리그라피에 대해서 잘 모르는데 이렇게 기본 획긋는 것부터 꾸미기까지 차근차근하면 정말 예쁜 서체를 쓰게 될것 같아요
9791185933276,10,"와, 캘리그라피를 혼자서도 배울 수 있는 책이 있군요! 제 동생이 캘리그라피를 하는데 항상 너무 예쁘게 카드를 만들어서 주곤합니다. 어찌나 부럽던지. 회사생활이 너무 바쁘고 아이들 뒤치닥거리도 해야 하는지라 배울 엄두를 못내고 있었어요. 정말 좋네요."
9791185933276,10,"켈리그라피에 관심이 많아요. 손글씨만의 독특한 매력을 가진다는 것, 그것을 다른 이와 나눌 수 있다는 것이 좋습니다. 게다가 영문이라니. 전 한글보다 영어쓰기가 어렵더라고요. 제게 도움이 되겠어요!!! ^^"
9791185933276,10,영문 캘리그래피에 대해 관심이 많았는데 잘 정리되어 가르쳐주는 책이 나와서 기뻐요! 무엇보다 영문 - 알파벳이기 때문에 다른 언어의 서체에도 적용할 수 있는 것이라 무궁무진한 쓰임새 높은 책이라고 생각합니다. 각종 도구들에 대해 상세하게 담았다는 점에서도 더할 나위없네요!
9791185933276,10,예전에 잠깐 POP는 배운적이 있는데 캘리 그라피는 더 글씨가 감성적인것같고 예뻐요!!기초부터 상세하게 설명되어 있다니 책보고 혼자서도 할수 있을것같아 더 좋네요~~티애 콩알체와 티애 의지체가 어떤건지 궁금합니다 !!
9791185933276,10,"캘리그라피를 배우고 싶은데, 시간이 나지 않아서 망설이고 있었는데요. 이렇게 책으로 배울 수 있다니 감동적이네요. 바로 주문해야겠어요. 영문 손글씨 멋지게 쓰고 싶네요 ^^"
9791185933276,10,영문 캘리그라피를 상세하게 배울 수 있는 좋은 기회다. 기초부터 차근차근 배워서 응용까지 할 수 있다. 한글과 영문을 함께 연습할 수 있어서 좋다.
9791185933276,8,요즘 캘리그라피에 관심이 많이 생기는데 너무 좋을거같네요!
9791185933276,10,나도 캘리그라퍼가 되고싶어요!
9791185933276,10,켈라그라피에 관심이 있었는데 마침 이 책을 만나다니.. 정말 좋아요!
9791185933276,10,이곳저곳에 영문 손글씨를 멋스럽게 그릴 수 있다면 얼마나 좋을까요 독학을 위한 책이 나와 반갑습니다
9791185933276,10,혼자서도 배울수 있게끔 정말 잘 설명된 책입니다.
9791185933276,10,손글씨에 관심이 있었는데 자세한 설명이 되어 있는 걸 보니 꼭 구매해 보고 싶은 책이에요
9791185933276,10,"켈리그라피에 관심이 있었지만, 시간도 돈도 없는 저에게 정말 안성맞춤인 책입니다!!"
9791185933276,10,"혼자서도 캘리그라피를 배울 수 있게끔 도와주는 책이 있다니, 왜 이제서야 알았을까 싶네요~ 기본부터 알려줘서 쉽게 배울 수 있을 것 같네요"
9791185933276,10,특이하면서도 따뜻한 느낌이 나는 글씨를 써보고 싶었는데 이 책이 딱이네요~~~
9791185933276,10,"다양한 영문 글씨체를 배울 수 있는 기회, 혼자서도 쉽게 할 수 있는 영문 캘리그라피 열심히 연습해서 멋지게 써보고 싶어요."
9791185933276,10,영문 캘리그라피 입문서로 제격입니다부연설명이 필요없네요
9791185933276,10,무척 재미있어 보이네요. 취미로 좋을 것 같습니다.
9791185933276,10,요즘 캘리그라피를 독학으로 하고 있는데 한글도 쓰기 어려워서 영문은 반쯤 포기하고 있었는데 이 책 덕분에 앞으로 영문에도 도전 할 수 있을거 같아요.
9791185933276,10,기본부터 차근차근 알려줘서 좋네요!
9791185933276,10,캘리그라피를 배우고 있습니다. 큰 도움이 될 것 같습니다.
9791185933276,10,고딕체 쓰는법을 배우려고 강의를 보기에는 시간적 여유가 없어서 책으로 공부해보려고 구매했어요혼자 글씨체 출력해서 따라쓰기만 했는데 펜 종류도 자세히 알려주고 큰 도움이 될 것 같네요설명도 자세하고ㅎ 열심히 보고 따라해보려구요 ㅎㅎ
9791185933276,10,한글과 또다른 멋과 재미가 있어 따라해보고싶네요. 이렇게 멋진 캘리그라피라면 절대 포기하지 않을것같아요
9791185933276,10,캘리그리피에 대해 처음 배울때 무척 유용하겠어요.
9791185933276,10,혼자서 공부할려면 세세한 설명이 있어야 하는데 그런 점에서 꼭 좋네요.
9791185933276,10,영어 알파벳을 처음 배우던 때가 생각나네요.. 한글자씩 차근차근 따라하다 보면 멋진 영문 캘리그라피가 완성될 것 같은 느낌입니다. 더 좋은 건 한글도 알려주신다니까 굿굿굿! 영어 글쓰기와 한글 글쓰기를 비교하며 익히는 즐거움은 덤이네요! ^^
9791185933276,10,특별한날에 이 책으로 연습한 캘리그라피로 소중한 추억을 장식한다면 더없는 선물이 될것같습니다.
9791185933276,10,정말 다양한 캘라그라피가 있네요 책을 보니 배워보고 싶은 생각이 드네요
9791185933276,10,"캘리그라피가 늘 배우고 싶었는데 지역도 외지고, 또 너무 어려운 펜 종류들 때문에 겁 먹고 시작하지 못했어요. 그런데 이 책에서는 펜 등 도구에 대한 설명이 자세하네요. 영문 캘리그라피라 어려울가 싶었는데, 오히려 더 쉬운 면이 있어서 처음 시작하는 책으로 참 좋은 것 같습니다. 추천합니다."
9791185933276,10,영문 캘리가 굉장히 멋스러워 기대되네요
9791185933276,10,멋지고 화려한 캘리그라피를 배워봐요~~
9791185933276,10,정말 배우고 싶었던 캘리그라피였는데 ㅎㅎ
9791185933276,10,"요즘 캘리그라피에 관심이 많은데, 보통은 한글이 많아서 아쉽다 생각했어요. 영문 캘리그라피가 나와서 참 좋았습니다."
9791185933276,10,기초부터 차근차근 잘 알려주는 책이네요.영문 쓰는거 재미있는데캘리그라피를 이책으로 한번 배워보면 좋을것 같아요.
9791185933276,10,캘리그라피 포스팅을 보고 따라해봤지만 매번 실패했는데 이 책을 보면서 따라하면 더 도움이 많이 될 것 같아요. 기대 정말 많이 되는 책이네요!
9791185933276,10,캘리그라피를 꼭 한 번 배워보고 싶었는데 이 책을 보니 쉽게 따라할 수 있을 것 같아요. 예쁘게 꾸민 엽서를 사람들에게 나누어주기 위해서도 꼭 따라서 연습해봐야겠어요.
9791185933276,10,혼자서 배우는 영문 캘리크라피. 요즘 이분야에 관심이 가서 배워 보고 싶었는데시간이 나질 않아 미루고 있었는데 이책 한권이면 혼자서도 문제없어 보여요.
9791186659007,6,전체적으로 편집이 깔끔하여 읽기 편합니다. 사진이나 도면과 같은 시각화 자료가 풍부하여 지루하지 않고 흥미롭게 정독이 가능합니다. 다소 아쉬운 부분은 제목에 ｀좋아 보이는 것들의 비밀｀ 이라는 문구를 삽입했다면 그 비밀을 좀더 논리적이고 이론적으로 다루었으면 어땠을까 생각해봅니다.
9791186659007,10,제 디자인경험에 도움이 많이됬으면 합니다
9788970597232,10,안읽어 봤으면 모르는 이책만의 매력
9788970597232,10,ㄲ ㅑ!! 엄청 큰 박스에 아서 뭔가 했더니 안그라픽스 아티스트 캘린터!!! 지관통에 잘 보관되어 왔네요!! 제가 마지막이엿나봐요~ 행사가 없어졌네요^^
9788966183296,8,옷을 살 때도 이성의 아름다움을 느낄 때도 우리는 뭔가 좋은 것에 익숙해 있다. 무턱대고 옷을 사거나 눈길이 가는 것이 아니다. 거기에는 효용이 매겨져 있고 자신의 생활 스타일이 자리잡고 있을 것이다. 소비로 빛나거나 감각에 충만한 뭔가 좋은 것.
9788993941562,10,디자인을 좋아한다면~ 추천!
9788993941562,8,"존 버거의 ways of seeing을 언급하며 시작한 점, 멋진 디자인의 상품들을 소개해서 호기심을 자극한 점은 좋았다. 헌데 5개의 키워드는 평범했고, 그로인한 통찰은 임팩트 있진 않았다."
9788993941562,10,꽤 흥미로운 책.
9788961960564,8,무언가를 만들어나간다는 목적이 충만한 글들이 가득하다. 목표를 이류고 싶다는 순수한 열정은 목도하는 것으로도 사람을 들뜨게 한다.
9788961960564,8,무엇을 하든 생각.이 중요하다
9788961960564,8,리사이클링 샵과 카페 레스토랑 디자인 업체등을 운영하는 나가오카 겐메이의 일기같은 블로그. 사업을 시작하려거나 자신의 샵을 갖고 싶은 사람이 읽어볼만한 책
9788970594156,10,한글 마이크로 타이포그래피 수업 주교재인데 기본부터 레퍼런스까지 완전 잘 나와있어요!
9788970594156,8,진짜 교과서였다... ｀속공간｀의 중요성은 확실히 알았네
9788970594156,10,"개정판으로 재구매합니다!!
영문 타이포에 관한 책은 많은데...이런 책이 더 많이 기획되고 나왔으면 좋겠어요!!"
9788970594156,8,"뒷부분에 이용제 선생님의 세로쓰기 폰트 ""꽃길"" 디자인배경에 관해 자세히 나옵니다."
9788970594156,8,한글에 대해서 다시한번 생각해 볼 수 있는 책인것 같아요
9788970594095,10,완전갖고싶던 책. 한권의 철학서나 진배없음. 책 자체도 멋진 포스. 하라켄야 멋짐
9788970593913,10,북디자인의 기본을 알고 싶은 분께 추천합니다.
9788970593913,10,학교 주교재로 사용하는 책인데 빨리 책 준비해주시고 배송도 예상보다 빨리 해주셔서 갑사해요 ^^ 이책은 진짜 북디자인이나 편집디자인에 꼭 필요로하는책!
9788970593913,10,진짜 교과서. 좀 비싸지만 좋은 책입니다.
9788970593913,10,두고두고 도움이 되는 책^^ 기획자에게도 디자이너에게도 필수!!
9788970593913,10,내게 꼭 필요했던 책...을 위한 책ㅋㅋ
9788970593913,8,편집자에게도 디자인을 볼 줄 아는 능력은 필수죠. 곁에 두고 참고하고 있습니다
9788970593913,10,전문가라면 꼭 읽어보고 소장해야될책.
9788970593913,10,"디자인의 기초적인 내용부터 시작해서 깊이있게 파고들어가는 말 그대로의 ""교과서"""
9788970593913,10,"현재 혹은 앞으로 편집디자인을 하고싶은 사람들을 위한
좋은 지침서.. 강추!!"
9788970412979,6,음 ... 사실 좀 뻔한이야기를 하고 있는것 같네요. 다른 이런 분류의 책들과 별 다른 ㅣ 느낌이 없었어요
9788970412979,6,만족스러워요~
9788970412979,4,책받았는데요 칼집이있네요 .좀 깨끗한걸로 갖다 주시지..어쨋든 잘 받았습니다.
9788970412979,8,잘 정리된 책
9791190434102,10,˝그래서인지 누렇게 변해버린 그 책은 저자가 선별한 여러 글을 꺾어 삽화(揷花)한 채로 자신 가까이에 두고 감상하던 꽃 뭉치처럼 여겨진다.˝
9791188314508,10,요즘같은 시대 젊은이들에게 자기계발에 대해 좋은 양식이 될것 같습니다.잘 읽었습니다.
9791188314508,10,집에서 있는동안 가볍게 읽어보려고 구입했는데^^읽는 동안 몰입했어요~복잡하게 생각하고 복잡하게 사는 현대인의 바쁜생활 단순함에서 오는 미학을 생각하게 만들어준 책이었습니다^^
9791188314508,10,화려한 것 보다는 단순한 디자인이 더 어려웠는데 도움이 된 것 같아요~ 생각도 변화되는 듯하구요ㅋㅋ
9791188314508,10,예전엔 화려하고 스킬적으로 멋진 디자인들이 유행이였는데 요즘은 단순한게 유행이잖아요. 그걸 어떻게 표현해야할지 너무 막막했는데 도움이 된거같아요..!! 비워내기..!!!
9791188314508,10,현재 시대같이 복잡한것이 만연하다고 느낄때 읽으면 도움이 많이 되는거같습니다. 단순함을 추구하시는 분들에게 추천합니다.
9791196484927,10,워크북 있는 줄 모르고 책만 샀는데 너무 마음에 들어서 재구매할려고 들어왔어요 실강듣기는 여건이 안돼서....ㅜ우선 책으로 친구랑 같이 연습해볼라고합니다. 독학이 진짜 될지모르겠지만..지금은 자신감뿜뿜이네요! 아직은 어렵지만.. 빨리 잘쓰고싶네요ㅎㅎ추천합니다
9791196484927,10,캘리를 단계별로 연습할 수 있어서 너무 좋아요!!무조건 따라쓰는게 아니라 포인트를 집어 주고 반복해서 쓸수 있는 것도 좋구요. 글씨체만 배우는게 아니라 원리를 배우니까 책에 없는 글 쓸때도 응용할 수 있어요. 캘리초보인데 중상급수준까지 마스터할 수 있을거 같습니당캘리책 중 가장 실한듯.
9788970599946,8,"국내 디자인 관련 전문가분들의 바우하우스에 대한 견해와 바우하우스의 상세한 이야기 등, 풍부한 내용이 있지만, 참고 사진이 너무 적다. 예를 들어 내용 중에 ‘암 호른 주택‘이 언급되는데 사진이 없어서 아쉽다."
9788970598697,8,트렌드를 글로 배우고 있는 상사 아재들에게 추천하고픈 책이다.
9788970598697,2,책을 이미 구매한 후에 플러스엑스 대표의 사이버불링 사태를 알게 되었다. 통찰력이 느껴지는 진솔한 글임에도 완전한 신뢰를 보내기 어렵게 되었다. 책장이 더 넘어가지 않는다. 당신들은 한껏 아름답고 비열하다.
9788970598697,10,브랜드에 대한 관심 내지 무관심 속에서 적당히 버무려져 키워진 갖가지 인식들을 편안하고 쉽게 본질에 충실한 어조로 들려주니 브랜드에 대한 가치가 새로운 공감으로 다가왔다.
9788970598697,8,브랜드 입장에서는 참으로 고마운 책이지 않을까.한 없이 어려울수 있는 브랜드를 삶의 일상에서 풀어내어 쉽게읽히지만 가볍지 않은 책이 되었다.김연수 작가의 '소설가의 일'의 브랜드 버전 이라고 소개하고싶다.
9788997716739,10,"보색과 채도,명도를 쉽게 설명해준다.색상환을  어떻게 쓰는건지 가르쳐준다.어울리는 색을 어떻게 만드는지 가르쳐준다.미니어처 페인팅을 하다가 구입했는데 도움이 된다.기본적으로 실기가 되어야 하기에 그에 대한 훈련과 과정도 잘 설명해준다."
