ISBN13,rating,review
9791157802272,10,정말 예매반주에 바로 적용 가능한 꿀팁만 모은 듯 하네요. 실제로 많이 불리는 CCM을 선정한 것과 건반 반주 독주나 다른 악기와의 조화를 모두 고려한 것이 정말 마음에 듭니다^^
9791157802272,10,멜로디만으로도 은혜로운 경험을 하게 되는 적도 적지않아 기대됩니다. CCM 반주 직접 해보고 싶어지네요.
9791157802272,10,자꾸 자꾸 연주하고싶어지는 책~! 표지도 너무 이쁘고 자꾸 자꾸 보고싶게 만들어졌어요!!
9791162730256,10,아주 쉽게 술술 읽히네요. 그동안 모차르트에 대해 정말 잘 모르고 있었다는 생각이 듭니다 ㅎㅎ
9791162730256,10,"입문자, 클래식 알못과 역시 알못에게 모두 추천하고 싶은 책이었습니다ㅎㅎ"
9791162730256,10,이해하기도 쉽고 클래식 초보가 읽기에 정말 좋아요교향곡 협주곡 오페라 레퀴엠 잘 몰랐는데 개념 잡기도 좋아서 강추!
9791162730256,10,초등학교 때 이후 음악과는 담을 쌓은 사람이라도 이해할 수 있도록 하나하나 떠 먹여 주는 친절한 클래식 입문서. 클래식 음악 작품 자체와 배경 지식 모두 균형 있게 다루고 있다. 분량이 생각보다 적다는 게 유일하게 아쉬운 점.
9791162730256,10,난처한 미술 시리즈 만큼 알차고 유익한 책.  모짜르트의 세계에 입문해보자
9791162730256,10,이런책 써주셔서 넘 감사드립니다!!!! 앞으로도 꾸준히 써주세여~~~^^
9791162730256,10,너무 재미있어요. 모차르트의 삶과 더불어 음악 기초 상식 등 풍부하면서도 재밌게 정리된 점이 좋습니다. 난처한 시리즈 다양한 분야로 앞으로도 계속 나오면 좋겠어요.
9791162730256,10,학생때 싫어했던 과목이 음악이었다. 아무런 배경없이 c=도. 7음계 옥타브 외워. 이런식이었다. 모짜르트 아버지같은 아니 작가같은 선생님만 만난다해도 얼마나 보는 시야가 커졌었을까. 성인이되어 이해하게되는 음악세계에 빠져든다. 특히 천재란 무엇인지 아땋게 살아야의미있을지 생각하게된다.
9791162730256,10,난처한 미술 시리즈만큼 충실한 내용과 만듦새로 완성되기를!
9791157801213,6,쉽긴한데 느낌이 잘 안사는거같기두 ㅋ
9791157801213,8,체르니 100 수준에 딱 좋은거같아요~제가 체르니 100-30 사이를 쳤었는데 딱 너무 어렵지도 않으니 괜찮더라구요 ㅎ 근데 그만큼 조금 쉬운만큼 화려하게 칠 수는 없어서 화려한 걸 원하시는 분은 상급 사시는 게 좋을 거 같아요~
9788932635859,10,체르니 100번 다른책과 다른순서가 좋았어요 조금더 쉬운거 먼저하고 어려워지는 게 더 좋을거라 생각했는데 딱 그렇게 되어있어서 좋네요 디자인도 예뻐서 학생이 좋아해요 잘 산 것 같아요 배송도빨랐구요 만족합니다!
9788932635033,10,아이 피아노 교재인데 좋아요
9788989571858,10,"연예인지망생으로써 했던 수많은 고민들이 아주 디테일하게 적혀있어서 책을 읽으면서 많이 공감되고, 또 나의 길을 어떻게 나아가야할지 더 깊게 생각할 수 있었습니다! 너무 좋은책, 추천합니다!!"
9788993794281,8,좋아요
9788932626451,10,플루트 처음 배우는 초3 딸을 위해 구입했어요. 스프링타입이라 책장 넘어가지도 않고 좋습니다.
9788932626451,10,처음 플룻 배우는 딸의 교재로 샀어요. 스프링으로 되어 있어 악보 넘기기가 편하다고 딸아이가  넘 좋아합니다.
9788932626451,8,초보자가 입문용으로 보기에 좋습니다.^^ 지금 중간정도 보는데 만족합니다. 스프링이라 보기에 편하고 좋습니다.
9788932626451,10,처음 플루트를 배우는 딸의 교재를 구입했어요. 초보자에게 좋은 좋은 책이라 추천합니다.
9788932626451,8,"아내가 플룻을 배우기 시작했는데, 
플루트 초보자에게 알맞는 책, 문화센타에서 권유하여 구매"
9788932626451,10,"교재가 초보자들이 알기쉽게 구성되어있고요, 스프링처리가 되어서 책장넘길때에 너무"
9788932626451,10,스프링으로 되어 있어서 편리해요.
9788932626451,10,"스프링이라 너무 좋아요.
책 받고 열심히 연습하려는 딸!!"
9788932626451,10,개정판이고스프링이있는이책은알라딘에만있군요거기다당일무료배송까지역시알라딘이짱
9788932626451,10,"배송 정말 빠르네요...용인인데 어제 오후에 주문한게 오늘 오후에 도착, 참 빠르"
9788932626451,8,보기도 편하구요 연습하기 좋아요. 플룻선생님이 고음연습부분이좀적다고하시는네요
9788932626451,10,빠른배송땜에 선택했어요  다른데는 값은 15%정도 해주시던데 배송이 느리더라구요
9788932626451,10,초보자부터 사용할수 있도록 단계별로 쓰여져 있고 스프링으로 되어 있어 아주 편리함
9788972262374,10,배송무지빨라 만족. 연습곡집이라 단계별로 연습할예정.돗자우어 1권은 파는데가 아주많진  않아서  인터넷구입이 역시편리하네요
9788972262374,10,첼로를 위한 기본 활쓰기 등의 연습에 넘 좋아요. 연습곡이라도 지루하지 않게 느린곡과 빠른 곡이 다양하게 있어 실력향상에 도움이 됩니다
9788972262374,10,스즈키3권을 하던 중에 돗자우어를 시작했습니다. 4포지션까지 익힌 다음에 시작하면 좋은 연습곡집입니다.
9788972262374,10,초짜에게는 너무 힘든 첼로.. ㅠㅠ 그래도 화이팅이예요 걸음마 첼리스트들!
9788932624242,8,매우 쉬운책이어서 강추합니다.
9788932624242,10,매우쉽게 나온 반주책이에여.. 느린아이들의 교재선택시 추천!
9788932624242,6,전체적인 곡의 구성이나 반주법이 적절하게 잘 배분되어 구성되어있는 것 같습니다
9788903414124,10,꾸준한 연습만이 살길..
9788903414124,10,활을 잘써야 소리가 예쁘게 나닌깐 꼭 필여한 연습용 책입니다
9788903311416,6,"학원에서 할땐 좋은책이네요... 

바이엘을 배우신다면 이책으로도 배우면 좋긴한데

그렇게 추천하진않습니다.!!

하지만 선생님이나.. 피아노 잘치는 사람이랑

같이 배울떈 이책 추천합니다.!"
9788903311416,6,독학용으로 샀는데 교재용이네요. 설명이 필요한 부분이 많아 보입니다.
9788903311416,8,"피아노를 배워 보셨다면 추천.
아니라면, 학원을 추천."
9788903311416,10,초보가 보고 연습하기에 좋아요 ^^
9788932609584,8,생각보다 얇습니다. 깨끗하고요....잘 사용하겠습니다~
9788932609584,10,상태 양호! 이 가격에 팔아도 되나요?^^ 잘 보겠습니다.
9788903171126,10,"건반화성 수업을 위해서 사게 되었는데, 상태도 깨끗하고, 와서 좋았습니다. 건반화성 수업위해 필요하거나 서울대 작곡부문 수시 2차 시험을 보시는 분을 위해 강추합니다."
9788903171126,10,건반화성 교재로 사게되었습니다~
9788934989424,10,"예전 동물원 멤버였지만 지금은 소아청소년 정신과 의사인 김창기님의 책이다.⠀노래 한 곡과그 노래에 얽힌 추억과또 의사로서의 정신분석학적 멘트까지...⠀우리나라 음악도 있고, 외국 팝송도 있다..최신곡도 있고"
9791195794157,10,"개인적으로는 만족한다. 이런 교과서같은 책에서 담백한 말투와 유튜브 특유의 정서를 느끼며 공부해 볼 수 있다는 것에도 큰 만족감을 느꼈다. 주 차별로 나눠진 깔끔한 정리에, 놀랐다. 사실 유튜브로 보다보면 어딘가 중구난방인 경우가 많은데 저 특유의 말투로 이런 깔끔한 구성이라면 환영이다."
9791195794157,2,"유튜브 영상을 보고서 책 구입을 결정했다. 저자님의 천재적인 즉흥과 연주가 마음에 들었는데 본인이 잘 치는 것과 잘 가르치는 것은 다르고, 잘 가르치는 것과 좋은 독학 책을 쓰는 것은 다르다. 설명방식은 좋으나 사전과 다른 점을 못찾겠다."
9788972979692,10,"기존에 많이 보아 온 음악 해설서가 아닌, 두 작품을 테마별로 비교해 가며 흥미진진하게 글을 전개시킵니다. 한 순간도 눈을 뗄 수가 없이 몰입이 되었습니다. 작품에 대한 친절하고 상세한 설명과 검색어를 통한 유튜브 찾기가 특히 맘에 듭니다. 초보자보단 어느 정도 음악에 빠진 이에게 강추해요."
9788972979692,10,"클래식에 관심 많으신 분들이나, 이미 클래식 지식이 있는 분들도 모두 만족할만한 책 입니다.저자의 글과, 글의 이해를 돕기 위해 정리된 음악은 스마트폰으로 바로 들을 수 있어 쉽게 이해를 도모할 뿐만 아니라 저자가 공들여 준비한 음악 감상까지 할 수 있어서 일거양득 입니다 강력 추천 합니다"
9791189865603,10,이 가격에 사도 되나 싶을정도로 좋은 악보집이네요인터뷰도 좋고 사은품으로 껴있는 브로마이드도 괜찮네요! 싸인도 들어있고 ㅎㅎ 열심히 연습해볼게요~
9791189865603,10,임동혁님의 레퍼토리~기대되요~
9788983779199,6,다른 초급용 소곡집이랑 비교하면 쬐끔 어려운편인거같아요. 다른책의 같은 곡이 이책은 더 어려운 코드로 되어있고 더 많은 양을 담기 위해서 4분의3박자 대신 8분의6박자로 되어있는둥 그래요. 그래도 많은 곡이 담겨있어 좋아요!
9791196460747,10,드뷔시 음악을 더 잘 이해할 수 있어서 행복하다
9791196460747,10,"천재적인 예술가가 많았던 파리라는 대도시에서 드뷔시의 창작에 영향을 주었던 것들은 무엇이었을지, 궁금합니다. 음악은 잘 모르지만, 드뷔시의 음악에 대해 조금이라도 이해하고 싶어서 구매했습니다. 책 덕분에 드뷔시의 연주곡들도 다시 들어보게 되었습니다. 힐링 되는 도서가 될 것 같습니다."
9788932637594,10,피아노 학원을 일주일 다니고 못가는 상황이 되어 아쉬워 하는 아이를 위해 구입해 주었어요. 책만 있으면 아이가 쉽게 연주 가능합니다. 피아노도 잘 모르는데 겨울왕국 노래를 연주한다는 성취감을 느끼게 할 수 있는 책.
9791189598006,10,여기저기 좋다는 이야기를 듣고 구매해봤습니다~^^평소에 작곡에 관심이 많아서 기대함으로 사봤는데 역시나 기대만큼 좋더라구요! 저자가 작곡 분야에서는 25년동안 활동했고 히트곡도 어마어마하니 당연히 내용은 유익한 내용이 가득했어요ㅎㅎ 작곡에 관심있는 분이라면 꼭 가지고 있어야합니다.
9791189598006,6,오늘 아침에 받아서 3분의 일정도 읽었는데 책 내용은 작곡애 흥미가 있는 일반인이 읽어도 무리가 없을 정도로 쉽고 재밌습니다. 하지만 배송왔을 때 책 밑부분이 다 찌그러져 있었어서 맘이 많이 아팠네요 ㅜㅜ 다음부터는 오프라인으로 사야겠어요 ^^
9791189598006,10,저자인 김도훈은 내가 아는 한 국내 가요계에서 대중성으로 정평이 나 있는 작곡가이다.  그이 책이 그저 장사 하려고 낸 책은 아니구나 하는 느낌이 강하다.  내용이 진지하고 솔직하다.  대중가요 작곡에 관한 한 이정도면 엄지척이다.
9788967521028,10,성인용 피아노 개인레슨 교재로 너무 좋습니다. ^^ 고등학생에게도 유용하게 사용하고 있습니다.
9788967521028,10,7월에 시작해서 4개월만에 떼다. 2권으로 고고!
9791157801206,4,여기 올라와있는 수록곡이랑 실제 책에 들어있는 수록곡이랑 다르네요ㅡ.ㅡ 책은 몇 곡 빠져있음
9788967211578,8,음...곡의 쟝르가 정말 다양한듯... 1권과는 좀 다른 느낌이랄까... 그래도 그냥 구매. 왜냐면 그래도 이 책만큼 요즘 칠만한 파퓰러한 책은 없는듯~!
9788967211578,10,"쉽지 않지만, 어렵지만 깔끔하고 마음에 듭니다."
9788967211578,10,유튜브로 들으면서 내가 좋아했던 곡들을 칠 수 있어서 좋았다.
9788967211578,2,구매 댓글이 왤케 없어여? 여기 다 알바아닌가
9788967211578,6,"음...악보가 수정이 필요한 것 같아요...천사소녀네티 ost좋아서 치려고 봤더니 82, 87페이지에 오류가 있네요...ㅠㅠ(영상과 다르더라구요)그리고 페달이나 이런것도 없어 그다지 친절한 악보는 아니라는 생각이..ㅠㅠ"
9788967211578,10,너무좋아요 ㅎㅎ 유튜브 구독자로써 잘보고있어요 ㅎㅎ 책 재질도 일반 종이가아니라 약간 코팅되있는(?)재질이예요 만족!!!!!!
9788967211578,10,다양한 장르의 인기곡들을 담은 악보집이어서 너무 좋습니다. 소장가치도 큼니다.
9788967211578,10,명곡들과 제가 함께할 수 있다는 점에서 환상적인 느낌이 들었습니다. 꼭 직접 연주해보세요.
9788967211578,8,특별한 선곡들로 이루어져있다 하니 기대되네요
9788967211578,10,제 새로운 취미로 피아노연주를 하다가 알게 되었어요. 곡들이 참 아름답네요.
9788967211578,10,피아노 악보와 유투브 영상의 조합에서 시너지가 폭발하네요.
9788967211578,10,아름다운 선율이 오롯이 담긴 책 같아요
9788967211578,8,수록곡 리스트를 쭉 봤더니 평소에 좋아하던 곡들이더라고요. 피아노로 연주할 수 있는 좋은 기회인데다가 저자의 편곡버전도 감상 가능하다니 빨리 구매해야겠어요.
9788967211578,10,피아노에 문외한인 사람조차도 피아노에 도전해 보고 싶을만큼 여러모로 매력적인 피아노 노트.
9788967211578,10,"선곡이 취향저격이라 마음에 들고, 레이나의 감성이 잘 담겨있는 멋진 편곡의 피아노 연주를 경험할 수 있어서 정말 좋습니다."
9788967211578,10,많은 곡들이 있어서 좋고 사진과 같이 내용들이 잘 참고되어 있어서 좋은 것 같습니다.
9788967211578,10,큐알코드로 연주 영상까지 들어볼 수 있어서 교재로 딱인것 같아요.
9788967211578,10,"영화 ost, 게임, 애니메이션 등 다양한 장르의 인기 곡들을 레이나의 특별한 편곡으로 만나볼 수 있습니다. 난이도별로 순서대로 배치되어 있고, 각 악보마다 QR코드 동영상이 첨부되어 있어서 각자의 기량에 맞춰서 연주할 수 있습니다. 특히 스프링 제본이라서 책을 펼치기가 편하네요."
9788967211578,10,악보에 적응하니 편하게 칠 수 있어요. 조금 수정이 필요하지만요
9788967211578,10,동영상을 참조할 수 있어 더 잘 활용할 수 있어요.
9788967211578,10,대중들에게 인기 있는 다양한 장르의 선곡을 만나보고 동영상을 통해 편곡 버전 그대로 연주해볼수 있을것 같아요
9788967211578,10,세련된 편곡 그 이유때문에 이 책을 기다리게 된다.
9788967211578,10,친숙하고 좋은 곡들로 가득 차서 기대가 됩니다.
9788967211578,10,레이나의 아름다운 피아노 선율에 무더위도 잊게 만드네요.너무 좋아요.
9788967211578,10,영화부터 게임 BGM까지 좋은 곡들이 가득 담겨있네요. 저번 1편도 정말 좋았는데 이번도 믿고 구매해도 될것 같습니다.
9788967211578,10,레이나님 유튜브는 제가 좋아하는 가수의 곡을 아름답게 편곡해서 올려주신 영상으로 알게되었는데 그 후로 매 영상 너무나 행복하게 즐겨 듣고 보는 채널이에요. 그런 레이나님의 피아노 노트2권이 나와서 너무 반갑고 축하드립니다!!
9788967211578,10,아름다운 피아노 선율을 통해서 이번 연말에는 사랑하는 누군가에게 멋지게 보여줄수 있으면 좋겠습니다.
9788967211578,10,아름다운 피아노 선율을 연주할 수 있는 익숙하고 친근한 곡들의 악보가 담겨 있어서 정말 기대됩니다.
9788967211578,10,"레이나의 피아노 노트 2, 기대되는 피아노 곡집입니다."
9788967211578,10,다양한 장르의 곡과 QR코드 동영상으로 레이나의 피아노 연주를 감상할 수 있어서 마음에 들어요.
9788967211578,10,흔한 피아노 연주곡들이 아니라 친근감있는 곡들이라 신나게 따라서 연주할 수 있을 것 같아요.
9788967211578,10,다양한 음악들을 피아노곡으로 들으니 새롭고 좋네요피아노로 직접 연주하면서  QR코드로 레이나의 연주 동영상과 비교할수 있어 도움이 됩니다
9788967211578,10,연주해보고 싶어지는 피아노 곡집이네요.
9788967211578,10,15. 천사소녀 네티 테마!!!!! 꼭 연주해보고싶어요!!!!!
9788967211578,10,좋은 음악이 한가득
9788967211578,10,아름다운 OST곡을 피아노로 연주 할 수 있게 악보가 수록되어 있어서 정말 기대가 됩니다.
9788967211578,8,그동안 드라마나 애니를 통해 듣던 명곡을 피아노로 연주해볼 수 있어서 기대되고 누구나 다 아는 친숙한 곡이라 지인에게 들려주기에도 좋을거 같아요.
9788967211578,10,qr코드를 통해 유튜브에서 연주를 들을 수있어서 더욱 좋아요. 피아노곡으로 편집된 곡들의 리스트가 좋네요.
9788967211578,10,익숙하고 좋았던 ost들을 피아노 곡으로 편집해놓아 직접 연주해볼수있어서 좋습니다.
9788967211578,8,이 여름 무더위에 잠이 잘 안오는 날들이 많은데 그밤에 듣기 좋은 곡들이 너무 많네요 소리만 듣는게 아니고 책으로 음표도 귀에 음악이 들리는듯한 이명같은 느낌도 너무 좋아요
9788967211578,10,"다양한 장르의 대중적 인기 곡들을 세련된 편곡과 깔끔한 악보, 그리고 QR코드 동영상을 감상할 수 있는 악보집! 정말 마음에드네요."
9788967211578,10,다양한 곡들의 구성이 마음에 드네요 좋아하는 곡들이 많이 있는데다가 편곡이 좋아서 피아노 치는 분들이라면 좋아하실듯 합니다
9788967211578,10,1권 나왔을 때도 사서 열심히 쳤는데 2권 나온다는 거 알고 기대하면서 기다렸어요! 그리고 첫 곡부터 열심히 연습하는 중입니다! 역시 기대한만큼 곡들이 다 좋아요..! 영상으로도 좋아서 여러번 듣던 곡이 대부분이라 만족스럽습니다!!
9788967211578,10,피아노 ost는 역시 레이나님이죠
9788967211578,10,피아노 치는 사람들이라면 한 번쯤 갖고 싶은 책이네요
9788967211578,10,그동안 정말 치고 싶었던 명곡들이 다 모여있어요. 비오는 날 딱 어울릴듯 하네요.
9788967211578,10,레이나님 영상본 이후부터 지금까지 곡들은 물론 악보도 잘쓰고있어요~노트1 때는 수록곡에있는 악보를 구매한게 몇가지되서 고민하다가 이번에 수록곡들이너무너무좋더라구요..출간일도 생일이랑 거의겹쳐서 이번에 동생한테 선물로 받게됬어여 항상 좋은곡 덕분에 잘듣고있습니다~ 책 잘쓸께용
9788967211578,10,"화제가 되었던 영화, 애니, 게임 등 다양한 분야에 곡들을 깔끔한 편곡과 보기 쉬운 악보를 통해 연주하는 즐거움 기대되네요."
9788967211578,10,다양한 곡들이 많아서 귀가 즐거워질 악보들이네요
9788967211578,10,평소에 좋아했던 음악이 이 피아노곡집에 수록되있어서 무척 기대됩니다.
9788967211578,10,"영화ost, 게임, 애니 등 여러가지 음악들을 피아노 악보로 담은 책 너무 기대가 됩니다~^^ 레이나님의 연주영상을 참고하면서 악보를 연주하면 참 좋을 것 같아요! 좋아하는 곡들이 많이 담겨있는 피아노곡집 꼭 사서 연습해야겠어요!"
9788967211578,10,"너무 좋았던 영화, 드라마 ost 곡들을 멋진 피아노 선율로 들을 수 있게 해주는 악보집이라서 꼭 사고 싶네요."
9788967211578,10,멋진 피아노 연주곡으로 편곡한 곡들. 저도 쳐보고 싶어요
9788967211578,10,초보자가 마스터하긴 초큼 어려울것 같아요. 그렇지만 레이나님덕분에 듣는것만으로도 행복합니다. 다양한 선곡이라 듣는귀도 지루할틈없이 즐겁습니다. 두번째 피아노 노트 역시 응원하겠습니다.
9788967211578,10,제가 좋아하는 곡들이 많이 들어있어 피아노로 조금씩 연습해보는게 즐거워요. 여러 장르의 곡들이 있어 다양하게 연주할 수 있어요
9788967211578,10,늘 유투브에서만 보다가 출간되었다는 소식 듣고 홀린듯 결제했어요 곡 리스트도 정말 잘 뽑으신 것 같아요 특히 깔끔한 편곡이 탐나서 계속 동영상 찾으러 들어가게돼요 레이나의 피아노노트192874권까지 출간해주세요ㅠㅠㅠㅠㅠ 레이나님 짱이에요ㅠㅜㅠㅜㅠ 늘 잘 보고 듣고 있습니다!!
9788967211578,8,O생각했던 것보다 ost가 굉장히 다양하네요.클래식부터 가요까지 젊은  신세대들이 좋아할만하게 다양한 곡을 수록했네요가한번 스쳐지나가는 곡들이 대세인 요즘 때론 이런 고전적인 피아노 선율이 마음을 파고듭니다.
9788967211578,10,레이나의 피아노 노트 2 기대됩니다
9788967211578,10,다들 조금씩 들어본 곡인거 같아서 좋네요. 많은 사람들이 사랑하는 곡들로 잘 편곡햇는데 연주가 참 좋네요. 이 악보집으로 따라서 연주할수있을꺼 같아서 여러모로 기대가 됩니다.
9788967211578,10,다양한 장르의 곡들을 모은 작품집이라 레이나님의 다양한 음악적 견해를 들어볼수 있어 좋네요. 항상 즐겨듣습니다
9788967211578,10,레이나님 연주는 유튜브에서 믿고 듣고 있어요. 이번 곡집도 하나같이 좋은 곡들로 구성되어 있어서 기대돼요!
9788967211578,10,"얼마 전 인터스텔라 커버영상을 보고는 저도모르게 레이나님 곡들을 전부 들어버렸어요. 마침 타이밍좋게도 새 악보집이 곧 출간될 예정이라 하셔서 또 홀린듯이 알라딘에서 작가알림?까지 켜놓고 기다렸네요ㅠ 신간알림문자 오자마자 1,2 한번에구매했어요. 곡도 다 좋고 편집도깔끔해요 감사합니다♡"
9788967211578,10,곡들이 다 너무 좋아요. 유튜브에 영상도 있어서 혼자서 연습할 때 도움이 많이되요.
9788967211578,10,"유투부 영상으로 피아노곡을 찾다가 우연히 봤는데요. 넘 멋지더라구요.딸아이가 계속 피아노를 배우고 있어서 둘이서 유투브영상을 자주 찾아본답니다. 기교만 있는것이 아니라, 진짜 음악을 들려주는 느낌이 들어서 좋아요. 레이나님의 멋진 연주를 앞으로도 계속 응원할께요."
9788967211578,10,피아노 연습에 좋을 것 같아요~좋아하는 노래가 담겨있어 꼭 연주해보고 싶네요~^^
9788967211578,10,"1권 사서 잘 치고 있어요! (연주X 치는거O)유투브에서 연주만 듣고 있었는데 어느순간 신규 동영상이 마구마구 업데이트되길래 뭔사 하고 봤더니 2권이 출간예정이라고..! 1초 정도 고민하고 예약구매를 신청했습니다 second run, 라라랜드 ost 등 기대되는 곡들이 너무 많네요♡♡"
9788967211578,10,"피아노를 배울 때, 많은 도움을 주었던 책, 다양한 장르의 곡들이 모음집의 형태로 되어 있어서, 매우 유용했던 책입니다."
9788967211578,10,2권이나 나왔네요. 자세한 사진과 악보 그리고 유투브 영상까지 피아노를 배우는 사람에게 좋은 교본이 될 것 같습니다.
9788967211578,10,드디어 2권이 나왔네요ㅜㅜㅜㅜ 도전해볼건데 많이 어려워 보이지만 ㅎ.. 예전부터 좋아한 분이라 이번에도 기대되고 응원하고 있어요! 꼭 많은 분들이 구입하셔서 연주해보셨으면 좋겠늡니다ㅎㅎ
9788967211578,10,다양한 장르의 음악들이 한 권으로 묶여 있다는 것에 무척 신기함을 느꼈고 피아노를 연습하는 사람들에게 많은 도움이 될 것 같습니다.
9788967211578,10,좋은 곡 가득
9788967211578,10,유투브에서 항상 좋은 음악 듣고 있었는데 이렇게 추가로 악보를 내주셔서 감사합니다. 너무 기대됩니다.
9788967211578,10,레이나의 연주와 편곡을 좋아하는 독자로서 꼭 소장해야 하는 악보집이네요. 악보가 보기 쉽게 정리되어 있어 초보자도 이해하기가 쉬워 좋습니다.
9788967211578,10,QR코드를 통해서 레이나의 연주를 쉽게 감상할 수 있도록 되어 있어 연주에 도움이 되네요.
9788967211578,10,평소에 좋아했던 음악이 수록되어 있어 직접 연주해볼 수 있습니다. 직접 연주해보며 느끼는 또다른 행복이 있네요.
9788967211578,10,아리에티 송이 있어서 너무 좋아요. 예약구매했어요~
9788967211578,10,"1권을 되게 늦게 주문했는데 그 옆에 2권있길래 미리 예약주문 해놨습니다ㅠㅜ유튜브에 뜨기도 전에 예약주문 발견한거라서 더 행복했어요 진짜!!빨리 1,2권이 도착했으면 좋겠어요♥♥요즘정말 택배오는날만 기다리고 있습니다..ㅜㅜ레이나님 정말 좋은 노래 올려주시고 악보집도 내주셔서 감사해요♥"
9788967211578,10,두번째 악보집도 출간되어서 정말 좋아요. 올라오는 영상 항상 잘보고있습니다. 이번에 출간될 악보집 수령하자마자 바로 쳐봐야겠어요. 기대됩니다!
