ISBN13,rating,review
9788992456104,10,잘 받았습니다.
9788992456104,8,1보다 업그레이드榮? 좀 리듬이 복잡해짐
9788992456050,10,지금까지 접해온 기타 교재 중 제일 좋다... 다만 초보자에겐 어렵게 느껴질수도...
9788992456050,8,속주를 좋아하는 연주자에겐 정말 추천할 만한 책이다!
9788992456050,10,책을 받았습니다. 표지에서 뿜어져나오는 아우라에 현기증이 아ㅋㅋㅋ아어려pㅋㅋㅋ
9788992456050,8,지옥의 끝은 천국이다.
9788903124016,10,사용하던 거라... 내용이 편해요..좋아요..
9788903124016,10,"아이들이 좋아해요~
스티커도 있고 가겨도 좋구요~
굿입니다."
9788903124016,10,아주 좋아요^^
9788932626031,10,이 시리즈는 다 좋은 것 같네요 생각보다 해설이나 설명이 많지 않다는 점은 아쉽습니다스프링이라 편하지만 넘기다 보면 잘 찢어지기도 해서장단점이 있음
9788932626031,10,스프링으로 되어있어서 넘 좋아요 악보보기도 좋구요. 9살짜리 아들이 대만족!!
9788932626031,10,스프링이라서 쓰기 좋아용^^
9788932624808,10,"아이들 피아노를 가르치면서 벌써 두번째 구입하는 책....
아이들 가르치기좋아요~"
9788948310627,8,좋아요
9788932624280,10,"아이들에게 반주 기초를 가르치기에 좋습니다. 멜로디(오른손)와 반주(왼손) 주법을 익히기에 좋아요. 양손에 반주를 나눠서 하는 것이 5권 끝부분에 조금 나오고 끝납니다만, 여기까지 충실해 해두었다면 양손 반주를 하는데도 큰 어려움이 없을겁니다."
9788932624280,8,아이들이 좋아하는 곡으로 구성되어있어 좋아요~~~
9788990939272,8,나의 첫 번째 스케일북보다는 어렵네요. 완전 초보자입장에선 하농 스캐일보다 편집이 더 깔끔해서 이 책이 더 맘에 드네요.
9788990939272,6,개인적으로는 하논 뒤편에 붙은 스케일이 더 나은 듯...어린이용으로좋겠어요
9788990939272,10,중요한 스케일을 쉽게  체계적으로 정리해놓은 아주 괜찮은 교재
9788990939272,8,정석이네요.. 얇아서 부담은 적습니다.
9788981054359,6,"엄청 초보라서 얇은책만 사용했는대, 이 책은 스프링 제본도 있길래....갸우뚱했는데 받아보니 두꺼운책이라서 그랬네요. 다시 산다면 스푸링으로 사고싶어요."
9788981054359,10,"악보도 여러종류가 있는데요, 어떤 악보는 음표가 눈에 잘 들어오지 않는 것도 있더라구요. 이 책은 기본서중의 기본서이니 눈에 쏙쏙 잘들어와야겠죠. 추천합니다."
9788981054359,8,악보가 커서 좋아요..
9788981054359,8,서점에서 이것저것 비교해 보고 골랐습니다. 큰 보표에 깔끔한 배열이 장점입니다.
9788981054359,10,예쁘고 저렴합니다~~ 스프링이라 편하구요~~
9788989359005,8,"깔끔해서 좋았습니다. 하지만 책에 하자같은게 있더군요. 두 장의 중간에서 끝부분까지 붙어져 있어서 직접 가위로 잘랐고, 결국 새 책의 깔끔함을 좋아하던 저로서는 훼손이 되어 아쉬웠습니다. 그래도 돈 주고 산건데, 그냥 써야죠. 하자만 빼면 만족입니다."
9788989359005,10,피아노연습곡으로 추천받고 구매.
9788989359005,10,"배송도 빠르고, 어렸을 때, 쳤던  그 하농책이 맞네요.가격도 정직하고 대만족입니"
9788913001604,8,빠른배송 좋네요 ㅋㅋㅋ
9788913001604,10,주소 오류등 배송에 여러가지 문제가 있었음애도 친절하게   잘 해 주셔서 감사합니다
9788913001604,10,실제로 서점 여러군데 돌아다녀도 절판되어서 찾기 힘들었는데 다행이네요~
9788903317012,10,딸아이가 드디어 소나타를 치게 되어서 구입했어요...
9788903313199,8,연습후 남는 뿌듯함!!
9788976631152,10,좋아요~~ 연습용으로 치고있음 ㅋㅋ
9788903422136,10,한줄이 한페이지!
9788903422136,8,선생님이 사라셔서 샀는데 첼로 스케일 연습하기 아주 좋은 책. 두껍기까지 해서 더좋
9788903422136,8,"선배의 강요로 산 이 책...
나름 괜찮은듯~;ㅋ"
9788903412021,8,좋아요 역시 바이올린엔 이게 대세
9788930035286,10,컬러판으로 되어 있어 지루하지 않게 공부할 수 있어요
9788903531821,10,뒤늦게 와이프히메께서 성악을 해보시겠다고... 뭐 꼭 필요한거라더군요..^^
9791191118124,10,책만보고 독학가능할 정도로 세세한 설명에 동영상 강의까지 들을수 있네요 굿입니다^^
9788983779564,10,잘샀어요  ^^ 쉽게되어있어요
9788959168675,10,아주 유익한 교재입니다. 많이 추천하고싶네요.
9791191118049,10,해마다 크리스마스 시즌마다 듣던 곡의 악보를 구입하게 되었네요. 소확행! ✨피아노 혼자 치려니 밴드가 필요한 마음에 아쉽지만 코로나19시대에 집콕하며 연주하며 겨울 느낌 물씬입니다.
9791191118049,10,크리스마스 오리지널 사운드 트랙 모든 곡을 그대로 피아노 악보로 만나보고 새로운 크리스마스의 추억을 만들어보면 좋을것 같아서 기대됩니다
9791191118049,10,크리스마스라는이유로 설레이는12월에 캐롤을피아노연주로듣는다는생각만으로도 너무좋네요~ 코로나로힘든한해였는데 가족끼리집에서한해를마무리하며연주해보는것도좋겠습니다~!!^---^)♡
9791191118049,10,갈수록 나빠지는 코로나 상황에 우울해지는 나날이지만 그동안 경험했던 크리스마스의 즐거움과 행복의 메시지를 크리스마스 캐롤을 연주하고 들을 때만큼은 다시 느끼는 그런 시간이 되었으면 합니다.
9791191118049,10,크리스마스 오리지널 사운드 트랙 모든 곡을  피아노 악보로 만나 볼 수  있다고하니 정말 좋은 것 같습니다. 지친 우리들에게 위안이  될 것 같습니다.
9791162731154,10,기다리고 기다리던 클래식 수업 3권 바흐의 세계로 떠나보자
9791162731154,10,"1,2편부터 쭉 읽고 있습니다. 소장가치 있어요. 우리 아이들에게도 나중에 읽으라고 하고싶은책.  클알못이었는데 조금씩 배워가고 있어요"
9791162731154,10,"내용이 그렇게 많지 않아서 아쉬웠던 1, 2권에 비해 배경지식 부분이 많이 보강되어 읽을거리가 풍성해졌다.  이 책을 통해 누구보다 성실하고 치밀하게 음악을 만들어냈던 바흐라는 인간과, 그의 깊은 음악 세계를 알 수 있게 된 것은 큰 수확이다."
9791162731154,10,"시리즈 네 권을 다 봤어요. 소장가치 충분하고 정말 많이 배웠습니다. 쇼팽, 리스트도 나온다는데 기다리고 있겠습니다."
9791162731154,10,쉽게 읽히면서도 내용은 가볍지 않은 책이예요. 음악가들의 생애나 역사 등 배경 지식에 대해서 다룬 책들은 많지만 음악 전공 공부를 하듯 작품을 바로 들으며 (QR코드 정말 좋아요)해석할 수 있게 출판한 책은 이 책이 유일할 것 같습니다. 바흐 음악을 좋아하는 분들은 꼭 소장하시라고 하고 싶어요
9791162731154,10,쉽게 쓴 책이다. 관련 자료가 많이 있어서 재미 있게 볼 수 있다.
9791162731154,10,구매할겁니다. 제가 모짜르트 베토벤 둘다 구매했는데 왜 음악의 아버지가 나오지 않았는지 의아해서 작년 여름에 출판사에 전화했던 기억이 나네요. 그땐 가을에 출판예정인데 어떤 음악가가 출시될지 비밀이라고 말씀해주시지 않았는데 작년에 안나오고 올해 여름에 나왔네요.ㅠ
9791157802777,8,이런 소재로도 두툼한 책한권이 나오다니 LP가 부활한게 맞나보다.
9791157802777,10,이거이거 완전 추억 돋네요. 재밌는 책일 거 같아 기대돼요.
9791195949991,10,피아노는 치지 않고 피아노 관련된 책들만 주구장창 읽는 중. 그게 더 재미있는 걸.
9791195949991,10,글을 읽고 있는데 신기하게 눈 앞에 영상처럼 펼쳐지는 책이 종종 있다. 나무가 최고의 피아노가 되기 까지의 여정. 이것은 단순히 피아노의 이야기가 아니다. 사람의 이야기이고 삶의 태도에 대한 이야기이다.
9791195949991,10,호기심으로 사봤다가 기대 이상으로 재미있어서 술술 읽는 중.
9788967212049,10,진짜 구성요소 부터 짱… 상세 하게 알려주고 있어서 너무 좋다
9788967212049,10,진짜 리뷰들처럼 포토카드랑 스트로크붙은거 조심해서 떼도 울어요ㅠ근데 책 자체는 초보자가 독학하기에 너무나도 좋은 것 같네요! 차근차근하고 있는데 유튜브로 설명도 해주시니까 되게 쉬워요ㅋㅋ
9788903325505,10,아카데미아는 사랑입니다♡
9791189346089,10,비엔나커피 비엔나소세지 비엔나회담 우리 곁에는 무수한 비엔나들이 존재해왔죠. 그 매력적인 도시에 관해 파고들고픈 학구열에 목말랐지만 이름이 가지고 있는 유명세에 비해 부실한 자료들에 실망하고 있을무렵 박종호 선생님께서 풍월당 시리즈로 지저스 크라이스트처럼 찬란하게 나타나주셨네요.
9791189865160,10,"리뷰가없어서 별 기대 안하고샀는데,책 두껍고 굉장히 도움이많이되고 공부 열심히 하고있습니다.디테일하게 이것저것 정보가많고 맨뒤쪽에는 모의고사도있어 좋습니다.답지없어서 당황했는데 사이트들가서 다운받아서했습니다"
9788968571213,10,거장들의 진짜 내밀한 이야기입니다. 누군가의 클래식 노트를 훔쳐보는 기분이 들었어요. 내공이 쌓인 작가의 필력이 매력입니다. 클래식을 이 맛에 듣게 됩니다.  클래식을 즐기거나 관심있는 분들을 꼭! 구입하세요. 강추합니다!!!
9791157802432,10,원래 비닐 포장이 되어있네요 흰색 표지라 걱정했는데ㅎㅎ재미있게 치고 있습니다~
9791189346065,8,"“나는 지워지면서 현존하는 법을 배웠다. 너무 환한 빛 아래 있지도 않고, 바라봐주는 눈길도 없이 연주하는 법을.”"
9791189346065,10,타로는 피아노도 잘쳐 글도 잘써...저같은 일반인은 이런 보물같은 책 찾아서 내준 게 그저 감사할 뿐..
9791189346065,10,"책소개 글에 끌려서 주문했다. 읽고 나니 소개 글이 더 와닿는다. 이런 글을 쓸 수 있는 피아니스트라니.. 그가 유명하고 말고를 떠나서 존재 자체가 놀랍다. 두번째로 놀라운 점은, 당연히 처음부터 알고있었지만, 번역서라는 것! 알렉상드르 타로와 함께 기억할 이름, 백선희(옮긴이)."
9791189346065,10,예민하면서도 천재적인 예술의 향기가 글에서 묻어나온다. 그의 연주같이 섬세하면서도 상상력을 자극하는 문체. 그가 연주자로서 어떤 생활을 하고 무슨 생각을 하는지 함께 느낄 수 있어서 재밌게읽었다. 피아니스트에게 손은 전부라했던가. 타로는 이책을 통해 우리에게 그의손을 보여주고있다.
9791189346065,10,피아니스트가 쓴 글이라는 게 믿어지지 않을 정도로 글이 아름답습니다.놀라운 책입니다.
9791189346065,8,"알렉상드르 타로를 ‘어느‘ 피아니스트 라고 소개하기에는.. 프랑스를 대표하는 피아니스트 중 한 명이기에 좀 아쉽습니다. 아직 책을 본 것은 아니니, 기대해봅니다."
9791189346065,10,"숨겨 놓은 감정을 나열된 건반처럼 따박따박 써내려간 그의 글 앞에, 연주하는 그의 손이 휘젓듯이 가슴이 출렁거린다. 피아노도 없이, 그는 영혼의 빛깔마저 연주한다. 음악가가 쓴 글이라기에 너무한 표현과 순간 포착들이 숨도 못쉬게 몰입 시킨다."
9788931588132,10,스프링 형태가 편합니다!
9791157802289,10,다른 악기들과도 잘 어울리게 반주하는 팁을 배울 수 있어 너무 좋은 것 같습니다
9791157802289,10,교회 반주에 바로 활용할수있게 어렵지 않게 잘 설명된 책이라서 CCM 연주에 많은 도움이 될 책이네요  동영상으로 직접 연주하는 법도 있어서 더 쉽게 따라할수있을꺼 같아요
9791157802289,8,종교를 떠나서 잔잔한 연주를 원하는 이들에게 안성맞춤인 책이네요
9791157802289,10,기대됩니다
9791157802289,10,"CCM을 풍성하게 수록하였으며, 다른 악기들과 조화를 이루면서 건반 반주의 세련되고 색깔 있는 연주를 구현하는 데 도움을 준다."
9791157802289,10,은혜받았던 곡들이 많아 기대됩니다. 열심히 연주법을 연습해 다른 CCM들도 연주해보고 싶습니다.
9791196976125,10,피아노연주에 능숙하지 않은 사람들을 위해 난이도별 버전까지 넣은 센스! 꼭 아미가 아니더라도 연주해보고 싶은 곡들모음으로 색다른 즐거움을 느낄수 있는 방탄의 최신커버 피아노곡집이네요. 잘 치지못해 아쉽지만 1곡 정도는 마스터해 보려고 합니다.
9791196976125,10,피아노 편곡으로 방탄의 앨범을 새롭게 감상할 수 있는 기회가 생겨서 좋아요.
9791196976125,10,BTS의 음악적인 매력을 충분히 느낄 수 있게 알찬 구성으로 되어 있어서 인상적이에요.
9791196976125,10,방탄소년단의 최신 앨범을 피아노를 통해 새롭게 즐길 수 있어서 참 좋아요.
9791196976125,10,단순한 보이그룹을 넘어서 한국문화를 전세계에 알리는 문화사절단으로의 의미도 갖게된 방탄의 음악을 응원하는 1인입니다^^. 방탄 특유의 일렉트로닉하고 트렌디한 음악을 피아노로만 연주해보는 신선한 즐거움이 있네요. 즐겁게 피아노를 만날수 있는 좋은 기회가 될듯합니다.
9791196976125,10,"방탄소년단이 춤도 멋지지만, 노래도 좋더라구요 따라 부르고 싶은데 40대가 따라 부르기에는 좀 어렵더라구요 대신 피아노로 방탄의 곡을 연주할수 있다면 정말 좋겠죠 방탄의 신곡 맵오브더솔 페르소나 전곡 악보가 실려 있어 굿입니다"
9791196976125,10,BTS Map of the soul: persona 앨범 전곡이 모두 들어가있습니다. 연주하는 커버 영상까지 QR코드로 만나볼 수 있어서 연주하는데 크게 도움 받을 수 있는 장점이 있습니다.
9791196976125,10,"단순히 두 귀로 듣는 걸 넘어서, 나의 두 손으로 BTS의 선율과 함께한다는 것은 그들과 함께 호흡한다는 것이겠지요. 이 땅의 많은 아미님들, 이 책을 귀댁 피아노에 들이셔야 합니다!"
9791196976125,10,정말 기대됩니다
9791196976125,10,난이도별로 악보가 준비되어 있어서 피아노 초보자도 얼마든지 연주할 수 있다는 점이 마음에 들어요. 가사 엽서집도 예쁘네요.
9791196976125,10,BTS의 곡을 피아노 연주로 새롭게 만나게 되어 무척 흥미롭습니다.
9791196976125,10,이제 세계적으로 너무 커버린 방탄.이라 가까이 가기엔 먼 존재로 느껴지지만 그래도 이렇게 팬들에게 다양한 즐길거리를 제공함으로 인해서 아미들은 항상 덕질을 쉴 틈이 없다. 내 손으로 피아노 연주를 하면서 참여할 수 있다는 점이 더욱 더 방탄 덕질을 끊지 못하게 하는 게 아닐까?
9791196976125,10,"뷔,지민의 자작곡까지 방탄덕후라면 꼭 소장해야 할 악보네요~클래식과 K-POP의 콜라보가 너무나 기대됩니다."
9791196976125,10,BTS 노래 좋아하는 곡들 꽤 있는데 여기에 다 속해있네요.ㅎㅎ. 피아노로 연주했다니 어떤 식으로 들릴지 기대됩니다. 오랜만에 듣는 피아노 연주를 BTS 노래로 들을 수 있다니 더 좋네요.
9791196976125,10,좋아하는 가수의 곡을 피아노를 연주해 볼 수 있는 점. 참 좋은 것 같습니다. 보다 연주하기 편하게 편곡되어있지만 원곡을 크게 벗어나지 않는 다는 점이 마음에 들어요.
9791196976125,10,방탄소년단의 명곡이 정리되어있어요! 피아노를 취미로 즐기는 분들에게 추천합니다.
9791196976125,10,이번 앨범 전곡이 수록되어있어서 더 좋은 것 같아요 이지버전 오리지널버전 악보 둘 다 있어서 저같은 초보자들도 따라할 수 있겠네요 ㅋㅋ
9791196976125,10,"세계 무대에서 활동하는 방탄소년단 악보집이라니 너무 기대됩니다. 듣는 것도, 연주하는 것도 다 기대 이상입니다."
9791196976125,10,방탄소년단의 노래를 피아노로 연주할수 있게 쉽게 구성되어 있는 것 같아서 기대되네요.
9791196976125,10,"난이도를 조절한 BTS의 MAP OF THE SOUL - PERSONA 피아노 연주곡집으로 누구나 쉽게 연주할 수 있고, 모범연주 QR코드와 BTS 가사 엽서집으로 풍성하네요."
9791196976125,10,원곡 버전은 물론 쉬운 버전도 있어서 피아노 초보들도 즐기 수 있는 연주곡집이라 마음에 들어요. 방탄소년단의 가사를 감성적 디자인의 엽서로 소장할 수 있는 것도 매력적입니다.
9791196976125,10,BTS의 컴백 앨범 PERSONA 전곡에 대한 피아노 연주곡집으로 난이도별 세련된 편집과 QR코드를 통한 모범연주는 물론 풍성한 64곡의 가사집까지 정말 좋네요.
9791196976125,10,"쉬운 버전, 원곡 버전 2가지 난이도로 곡을 소개해서 팬이라면 한번 연주해보고 싶게 만드는 힘을 가진 악보집이네요."
9791196976125,10,쉬운 버전과 원곡 버전의 난이도로 편곡된 BTS의 곡을 누구나 도전해 볼수 있을것 같아요
9791196976125,10,여러가지 곡들을 피아노로 칠 수 있어 기대됩니다.
9791196976125,8,수록곡 리스트를 쭉 봤더니 평소에도 좋아하던 곡들이에요. 피아노로 연주할 수 있는 좋은 기회인데다가 다양한 버전으로 악보가 있어서 마음에 들어요.
9791196976125,10,BTS의 피아노 연주곡집이란 것만으로도 소장가치 충분한데 난이도도 조절해서 연습할수 있고 저자의 연주영상 QR코드까지 포함되어있어 연습하기에 더없이 좋은 연주곡집인듯 합니다
9791196976125,10,방탄소년단의 명곡들만 모아놓은 음반이어서 매우 좋습니다. 이번에 빌보드에서 상도 받아서 너무 너무 대한민국 국민으로서도 좋습니다.
9791196976125,10,축하드려요.빌보드 시상식 라이브방송 함께했어요. 그런 대단한 가수 방탄소년단의 피아노 악보집이라니. 그저 감사할뿐이죠. 아이들 또래에서는 필수입니다. BTS는 아이. 어른 한가족이 함께할수있는 음악이라서 더 소중한 PERSONA 연주곡집입니다. 소중한 소장아이템 만들어주셔서 감사드려요
9791196976125,10,피아노로 재해석한 BTS의 그 멋진 곡들... 기대됩니다.
9791196976125,10,유명한 노래는 곡도 악보도 좋습니다.
9791196976125,10,제가 너무 좋아하는 bts곡들을 피아노연주로 만날 수 있다니 너무 좋아요. 피아노로 만나는 곡들이 또 새로운 느낌이라서 귀가 즐거울거 같아요
9791196976125,10,BTS의 곡들을 피아노로 다시 만나볼 기회! QR코드도 있어 어렵지않게 즐길수 있다.
9791196976125,10,방탄소년단의 인기 명곡들을 다시한번 한번에 감상할수 있는 기회여서 매우 좋습니다.그리고 소장가치 있는 의미있는 음반으로 생각됩니다.앞으로 더 세계로 세계로 뻣어나가는 BTS가 되길 바랍니다. 응원합니다.
9791196976125,10,방탄소년단의 곡을 더 감성적으로 느낄 수 있도록 가사집도 함께 수록되어 있어 좋네요.
9791196976125,10,방탄소년단의 인기곡을 원곡의 느낌을 살려 피아노로 연주할 있도록 악보가 수록되어 있어 유용해요.
9791196976125,10,팬들한테 정말 좋을 것 같네요.ㅎㅎ
9791196976125,10,인기많은 방탄소년단의 음악들을 피아노로 연주할 수 있는 악보집 너무 기대됩니다. 솜씨없는 피아노 초보이지만 천천히 잘 배워보고 싶어집니다. 기대됩니다.
9791196976125,10,원곡의 분위기를 그대로 살려서 피아노 악보로 편곡되어있어 자신의 감성으로 즐길수있어요.
9791196976125,10,쉬운버전으로 연습해보고 원곡버전으로도 치고 구성이 아주 좋아요!
9791196976125,10,"BTS의 뮤직비디오를 감상할때마다 마치 케이팝에 새로운 색을 덧칠한 듯한 그 특유의 감성이 좋았는데, 이렇게 직접 연주해 볼 수 있는 근사한 악보집을 만날 수 있다니 더없이 반갑네요. 드문드문 나도는 영상을 보고 어떻게 악보로 바꿀수 있나 알아봐야지 해놓고 막상 못하고 있었는데, 이번 만남을 통해 앞으로도 피아노 악보집을 계속해서 만날 수 있기를 바랍니다."
9791196976125,10,아미는 사랑이고 애정이죠 이건 꼭 소장해야하는 아미 필수템입니다^^bbb 정말 기대돼요!! 좋은 곡들만 수록한 것 같아서 집에서 내 손으로 아미를 즐길수 있다는 점에서 소장가치 만점이에요!!
9791196976125,8,팬이라면 소장해도 좋지 않을까...
9791196976125,10,그동안 잊고 있었던 피아노 선율에 대한 열정을 좋아하는 BTS 노래 연주곡들로 이어갈 수 있어서 좋을 것 같습니다. BTS 팬으로서 반드시 소장해야 할 악보집이 아닌가 생각합니다.
9791196976125,10,주옥같은 BTS의 곡들이 모여있네요. 무엇보다 쉽게 활용할 수 있는편곡이라 더 좋은 것 같습니다. QR 코드를 통해 감상할 수도 있는 점도 참 만족스럽습니다. 추천할 만한 악보집이라 생각합니다.
9791196976125,10,영상 큐알코드도 있고 쉬운버전도 있다하니 초급연주자에게 도움이 되겠네요 또 스프링제본을 선호하는 분께 좋을것 같아요
9791196976125,10,엽서도 수록되어있다니~ 정말 알찬 구성이네요! 기대됩니다
9791196976125,10,방탄소년단 노래가 기본멜로디가 좋은게 많은데 이렇게 악보집으로 나온 덕분에 피아노로 연주가능해져서 너무 기쁘네요. 음따기가 어려운 저같은 막귀한텐 꼭 필요해요. 그리고 외국인 친구에게 선물하기도 좋을것같아요!
9791196976125,10,BTS의 전곡을 피아노악보로 만날 수 있는 데다가 모범연주 영상까지 볼 수 있다니 더욱 활용도가 높아보입니다. 맘에 들어요
9791196976125,10,방탄소년단의 최신앨범 수록곡들을 피아노 악보로 만나볼 수 있어서 무척 설레고 감동적이에요. 피아노 연주로 더욱 다채로운 매력을 느낄 수 있는 곡들이 된 것 같아 더욱 신나고 재미있어요.
9791196976125,10,방탄소년단의 노래도 좋지만 이야기도 너무 좋죠 즐겁게 들었습니다
9791196976125,10,나를 긍정해주는 아름다운 멜로디를 직접 내 손으로 연주해볼 수 있다니 벌써부터 설레네요!
9791196976125,10,이번 앨범 악보에 가사 엽서까지 선물같은 책이네요.연주 따라해보면서 노래 들으면 더 좋을 것 같습니다~
9791196976125,10,이 책은 엮은 저자가 보헤미안 랩소디나 워너원 곡등 다양한 피아노 스코어 집을 낸 분이라 더욱 기대됩니다.  두가지의 버전으로 만나보는 BTS곡은 어떤 느낌 일지도 궁금하고 흥미롭습니다.
9791196976125,10,페르소나의 모든 곡을 쉬운 버젼과 원곡 버젼으로 모두 연습 할수 있어서 좋은것 같아요. 전 무조건 쉬운 것 보다 혼합해서 연주하는 것을 좋아하는 타입이라 더욱 기대되는 연주곡집이예요. 또한 랩 부분이 연주하게 편하게 표현했고 동영상 통해서 피아노 연주 느낌도 들을 수 있어서 좋아요.
9791196976125,10,아미는 애정입니다!
9791196976125,10,스스로를 사랑하는 법 BTS의 음악으로 배울 수 있어 좋습니다.
9791196976125,10,이건 필구한다음 오지게 연습해야 할 각입니다!!!!
9791196976125,10,"BTS의 최신 앨범 곡들을 피아노로 연주 할 수 있도록 구성된 피아노 연주곡집 입니다. 앨범 발매와 거의 동시에 출간되어, 누구보다도 BTS의 최신곡들을 피아노 연주로 커버하고 싶은 분들에게 꼭 추천하고 싶네요."
9791196976125,10,와...피아노 곡집이 나오다니 ㅠㅠ 너무 감격스럽습니다~~~!! 너무 감사합니다!! 열심히 연습하겠습니다~!!!
9791196976125,10,국내 아이돌 그룹 최고 기록을 자체 경신하고 있는 방탄소년단의 새 앨범 수록곡들의 피아노 편곡으로 구성된 연주곡집이라니 무척이나 기대됩니다. 쉬운 버전과 원곡 버전을 수록해 난이도 선택이 가능하고 QR코드를 통해 전곡 모범연주를 영상으로 감상도 가능해서 연주하는데 큰 도움이 기대됩니다.
9791196976125,10,BTS의 새 앨범 뿐만 아니라 풍경과 약속까지 포함되어 있어 정말 좋네요~ 거기다 원곡을 피아노에 어울리게 편곡해서 최고입니다~
9788967211905,10,"BTS의 MAP OF THE SOUL - PERSONA 피아노 연주곡집으로 직접 연주해보는 기쁨에 알찬 스티커, 멋지게 변화된 재즈 버젼곡 까지 함께 있어서 멋지네요."
