ISBN13,rating,review
9791190052016,2,평이 좋아서 기대가 너무 컸던 것 같아요. 이론에 대한 설명이 다소 부족한 것 같습니다. 무엇보다 이 책에서 제시한 ‘4막 24블록‘ 자체가 다소 어렵고 어떻게 적용해야할 지 감이 안오네요.
9791190052016,10,접근하기 어렵던 스토리텔링에 대한 생각과 지식들을 다양한 방법과 예시로 쉽게 설명 해준다. 나만 알고 싶은 책이면서 강력 추천하는 책이다.
9791190052016,10,"사람은 누구나 이야기를 하고싶어 하는것 같다. 나또한 그렇고. 이야기를 창의적으로 잘 이끌어가고 소통을 한다는건 특별한 능력이다. 스토리텔링을 하는 사람은 단순히 정보만을 전달하는 사람이 아니기에 더 특별하다고 생각이 된다. 이 책, 굉장히 매력적이다. 나도 스토리를 만들고 싶어 졌다.."
9791190052016,10,"처음 스토리텔링을 접하는 사람에겐 신세계를 보여주고, 어느정도 스토리텔링을 안다고 생각하는 사람에겐 뒷통수를 한방 세게 때려주고, 스토리텔링을 잘 하는 사람에겐 다시금 자신을 돌아볼 수 있게 만드는 책."
9791190052016,10,"작법책인줄 알고 샀는데, (작법에 관한 내용도 물론좋지만) 스토리를 창작하는 작가로서의 근본적인 태도나 마음가짐, 재미있는 스토리의 본질적인 조건 등, 작가를 위한 인문학적 교양도서로서도 손색이 없네요! 강추합니다!"
9791190052016,10,혼자만 알고 싶은 책이네요. 명확한 플롯구조와 이야기의 본질이 무엇인지에 대해 이해 할수 있는 내용들 좋아요
9791190052016,8,멋진 스토리텔링은 흥행의 보증수표이다. 그러다보니 이곳저곳 스토리풍년이다. 물건 하나를 팔기 위해서도 스토리를 생각해야하는 요즈음이다. 수십 년간 드라마제작 일을 하며 상상을 눈앞에 구체화시킨 저자가 전해주는 스토리텔링의 모든 것.
9788995651308,10,잘 보고 있어요. 도움이 많이 되네요.~~~^^
9788995651308,10,작가들에게 많은 지식을 주는 책
9788995651308,10,이제 본격적으로 드라마작가의 꿈을 키울수 있겠네요 ^^
9788995651308,10,유명한 작가들이 참여한 프로젝트인 만큼..만족. 딱떨어지는 깔끔한 책입니다.
9788995651308,10,스폰지 포장으로 흠집하나 없이 깨끗하게 도착했습니다. 기대한 것만큼 만족함
9788995651308,2,"별점을 줘야 하는게 안타깝다.
노인 냄새 나는 작가들의 자위질 구경 놀이"
9788995651308,10,"정리가 잘 되어있고, 읽으면 읽을수록 많은 도움이 되는 책!"
9788995651308,10,"드라마를 좋아하고 관심이 있다면 한번은 꼭 읽어볼만한 책!
똑부러지는 책이다"
9788995651308,8,잘 읽히고 따뜻한 격려도 있다. 단막극 위주의 작법 설명이 좀 아쉬움.
9788995651308,6,유익한 책입니다.
9791156344360,10,목소리로 자기를 표현하고자 하는 분들이 꼭 읽으면 도움이 많이 되실거 같아요. 마음가짐부터 실용적인 조언까지...
9788936317607,10,예능프로그램 제작노트라고 해도 과언이 아니다. 쳅터에 따라선 큐시트도 일부 소개되어 있고 한중 푸로그램제작 사례도 비교적 자세하다. 예능PD를 꿈꾸는 분들에게 좋은 교과서가 될 수 있으리라 본다.
9788995957097,4,생각보다 주관적인 기록들...
9788995957097,6,"드라마폐인이라면, 흥미롭게 읽을 만한!"
9788995957097,10,드라마를 쉽게만 보고싶지 않은 분들에게 추천.
9788995957097,8,작가 지망생들에겐 필독서!
9788995957097,10,"받았다. 재밌군요. 드라마를 보지는 않지만, 덕분에 드라마에 대한 생각이 바뀌었네요"
9788985989626,6,굿굿! 오늘 받았네요ㅎㅎ
9788934972068,10,셜록 영어판읽고 한글판읽으니 재밌어요 한글판읋 보는게 훨씬 쉽기는하지만 영어로 된거랑은 느낌이 좀 다른거 같아요
9788934972068,4,시즌 4는 망작에 가깝다
9788934972068,10,"셜록 등장인물들의 정보들이 다 나와있어서 좋았고, 드라마를 찍으면서 있었던 에피소드들과 사진들이 지루하지 않게 나와있어서 좋았다. 이 책을 읽고 셜록에 대해 더 많은 것을 알게 된 것 같다."
9788934972068,10,셜덕이라면 반드시 구매해야 하는 책입니다. 소장가치 200% 충족시켜 주는 덕후들을 위한 책!! 볼때마다 행복합니다.
9788934972068,10,"셜록의 광팬으로써 당연히 구입해야할 책이네요제작에 관련된 이야기, 명장면의 사진들, 원작과 각색본 등 놓칠게 하나도 없습니다"
9788934972068,10,최고의미드 베네딕트컴버비치가 너무 유명해져서 아쉽지만  팬들에게 200프로의 감동의 선물이될 책이네요  기대됩니다.
9788934972068,10,"셜록에 나오는 인물들의 초점이나 장소, 촬영기법 등이 세세히 적혀있는 매우 유익한 책입니다! 셜록을 너무나 사랑하는 저에게 이런 방법까지도 알려주신것이 감사할 따름이고 소장가치가 매우 높은 책이네요! 추천합니다."
9788934972068,10,읽고 또 읽어도 읽을 때마다 새롭고 셜록 팬한테 꼭 추천해주고 싶은 책입니다
9788934972068,10,한번보고 두번보고 세번보아도 놓치는 곳이 있는 셜록의 깨알같은 디테일들. 소품하나 하나의 의미까지도 다시 찾아볼 수 있는 도서. 빠른 번역본에 감사할 뿐 ^^
9788934972068,10,셜록을 너무 좋아하는 저에게 딱 맞는 책 같아요.
9788934972068,10,셜록 팬을 위한 가이드북입니다
9788934972068,10,셜록 케이스북보다 읽을거리가 많다.
9788934972068,10,앓다 죽을 셜록입니다...ㅜㅜ
9788934972068,10,"너무 사랑하는 책.... 셜록 덕후들에게 필수품이고, 소장가치 만땅있는 책입니다 ^^ 두께에 놀라고, 맨 뒤에 스티커가 너무 예뻐서 놀랐어요♡♡ 셜록시즌4를 기다리며 볼 수 있는 소중한 책 ♡"
9788934972068,10,셜록 처음부터 끝까지의 내용이라니.. 기대됩니다!!
9788934972068,10,탐정하면 셜록이고 셜록하면 진리지.
9788934972068,10,원래 좋아하고 비채에서 나오는 책은 늘 기대된다.
9788934972068,10,드라마의 인기와 더불어
9788934972068,10,재밌습니다
9788934972068,10,역시 셜록..........
9788934972068,10,좋아요~^^
9788934972068,10,최고의 드라마
9788934972068,10,치밀한 짜임새와 위트가 몰입도를 최고로 끌어올리기에 충분하다. 두말할 것 없이 최고의 책.
9788934972068,10,"셜록, 말이 필요 한가요?정말정말 재미있고 흥미로운 제 인생 최고의 작품입니다^^"
9788934972068,8,재밌어요~
9788934972068,8,TV 드라마로 본 셜록을 화보와 설명과 함께 잘 풀어놨다. 셜록의 팬이라면 필구... !!
9788934972068,10,좋아요~
9788934972068,10,셜록~~
9788934972068,10,
9788934972068,10,추리소설 매니아입니다
9788934972068,10,셜록에 관련된 책인만큼 재밌네요
9788934972068,10,셜록은 진리이므로
9788934972068,10,셜록 말이필요없는 작품
9788934972068,10,셜록 광팬♡
9788934972068,8,시즌1부터 팬이었던 드라마여서 더 의미가 깊은 책이었다!해석판을 기다리느라 힘들었다는....ㅎㅎㅎ
9788934972068,10,"시즌3까지 재밌게 시청했고 내년에 영화관에서 개봉되는 스페셜도 정말 기대하고 있습니다. 셜록을 제작할 때, 어떤 점을 중점으로 두고 기획했는지 등 제작 이야기가 무척 궁금했는데 이렇게 책으로 발간되니 꼭 읽어보고 싶습니다. 제작 당시의 사진도 함께 실리니 어떤 장면인지 알 수 있어 좋네요."
9788934972068,8,셜록 좋아요
9788934972068,10,셜록은 진리..이책을 보면서 더 세심하게 관찰하게 되고 집중하게 됐다
9788934972068,10,역시 셜록
9788934972068,10,셜록을 너무 좋아합니다!!
9788934972068,10,드라마만 보다가 읽은건데 진짜 재미있었어요
9788934972068,10,ㅠㅠㅠㅠㅠ헉 덕통
9788934972068,10,셜록 재밌어요.
9788934972068,10,주위 사람들이 재밌다고 추천해서
9788934972068,10,너무너무재밌어요
9788934972068,10,소설속 셜록으로는 100프로 욕구를 채우기 힘들었던 팬들에게 200프로의 감동을 선물해준 드라마.
9788934972068,10,셜록을 통해 추리에 대해 관심을 갖게 되었습니다.너무너무 좋은 책입니다!! 강추!
9788934972068,10,기대됩니다 아직 안읽어봤어요
9788934972068,10,셜록이 최고입니다!
9788934972068,10,셜록키언으로서 덕질을 하고 싶어지는....
9788934972068,8,셜록은 사랑이죠..ㅋㅋ
9788934972068,10,기대됩니당
9788934972068,10,"재미있어요, 추천"
9788934972068,10,드라마로 보고 너무 재밌어서 책도 읽어보았는데 역시 흥미진진하네요 ㅎㅎ
9788934972068,10,영드를 재미있게 봐서 책에도 관심이 갑니다.
9788934972068,10,표지는 별 백만개!팬이라면 이 책은 필수입니다.
9788934972068,10,베네딕트 컴버배치! ㅠㅠ 표지에서 별다섯개
9788934972068,10,컴버배치 짱~
9788934972068,6,셜록을 좋아한다면 일독할 가치는 있음.
9788934972068,10,무조건 셜록!
9788934972068,10,셜록홈즈를 좋아하는 사람이라면 선택할 수 밖에 없는 책인 것 같네요ㅠㅠㅠㅠ
9788934972068,10,셜록을 사랑하는 친구에게 선물하기 위해 구매함. 상태는 좋았음.
9788934972068,10,셜록팬으로서 꼭 구비해둬야할책
9788934972068,10,덕질을 안하는 편인데 어느순간 집에서 이 책을 '보고'있는 나를 발견. 이게 다 컴버배치 탓이려니.
9788934972068,10,현대적으로 풀어낸 셜록.
9788934972068,10,BBC공식 가이드 북인 만큼 인물들의 인터뷰를 비롯해서 비하인드 스토리까지 담고 있습니다.실제 사건 기록집 처럼 편집한 센스도 느낄 수 있습니다.아아...셜존(셜록&존)은 사랑이라죠..^^
9788934972068,10,셜록이니까
9788934972068,8,굿
9788934972068,10,셜록 4기를 기원하면서 추첞
9788934972068,10,이야 좋아요
9788934972068,10,탐정물
9788934972068,8,셜록은 재밌어요!
9788934972068,10,셜록은 애정으로 보지요
9788934972068,10,"셜록 굿!,,,"
9788934972068,10,"셜록은 최고의 책이다 과학적으로나 추리,예술 모든면에서 뛰어나다"
9788934972068,10,영드를 재미있게 봐서 관심을 가지게 되었어요.
9788934972068,10,셜록 매니아라면 꼭 읽어야할 Must Have Item!!!!
9788934972068,10,셜록 BBC 영드 팬이면 한번씩 읽어보는 재미도 쏠쏠~
9788934972068,10,와우~~ 셜록 잼있어요 ^6^
9788934972068,10,베네딕트 컴버비치와 셜록은 언제나 옳습니다.무슨 말이 필요하나요.
9788934972068,10,셜록 시리즈 정말 좋아해요!
9788934972068,10,"한국에서 인기몰이를 하고 있는 의 각 회에 대한 공식 가이드북이다. 의 애청자로서, 이 책을 추천한다."
9788934972068,10,고전은 엣사람의 전유물이라는 편견을 깨준 드라마. 뒷이야기가 궁금하다
9788934972068,10,셜록을 좋아함.
9788934972068,10,고전이 고전인 이유를 보여주는.
9788934972068,6,드라마만 봤는데.. 혹시 책도 궁금해져서
9788934972068,10,셜록홈즈가 만약 현대에 태어났다면... 왜 진작 이런 생각을 못했는지. 지금껏 나온 셜록홈즈'들'은 모두 19세기 고전을 무대 삼았다. 아서 코난 도일 경의 원작 셜록홈즈를 그대로 재현해 놓은 그라나다 셜록홈즈도
9788934972068,10,셜록은 말이 필요없다
9788934972068,10,후에 나오는 셜록에 대비한 재밌는 가이드북!!
9788934972068,10,어릴때 브터 읽던 책~~~ 셜록 ~~~~ 자 상상해보라~~~ 누가 범인일까?
9788934972068,10,셜록 드라마를 재미있게 보아서 소설도 재미있을 것 같아서!!! 사고 싶으니깐
9788934972068,10,가끔은 이런 책도 괜찮겠지요?
9788934972068,10,아들이 제일 좋아하는 셜록^^
9788934972068,10,셜록의 비하인드 스토리! 짱짱
9788934972068,10,셜록 정말 팬인데 이거 읽고 몰랐던 것도 알게되고 전에 봤던거 복습도 하고 다음 해에 나오는 시즌4도 보고싶다!!
9788934972068,10,셜록시리즈는 언제나 진리....♥
9788934972068,10,셜록 좋아유ㅠㅠ
9788934972068,8,셜록은 언제나 진리다
9788934972068,10,셜록 정말 명작이죠!
9788934972068,10,셜록 드라마도 재밌고 책도 재미있어요~~
9791185014074,10,셜록의 시즌1의 스토리를 책으로도 볼 수 있어요 드라마내용이 캡쳐되어서 설명되어있는데 약간 어린이용 같은 느낌도 들긴하는데 양장본이고 이중커버라 예뻐요
9791185014074,10,셜록 영어판읽고 한글판읽으니 재밌어요 한글판읋 보는게 훨씬 쉽기는하지만 영어로 된거랑은 느낌이 좀 다른거 같아요
9791185014074,10,"셜록 드라마 시리즈 중 분홍색 연구,눈 먼 은행가, 잔혹한 게임, 벨그레이비어 스캔들, 배스커빌의 사냥개들, 라이헨바흐 폭포를 분석한 책으로 진짜 셜록과 왓슨박사가 의견을 적어놓은 것 같은 포스트잇이 인상깊었다."
9791185014074,10,베네딕트 컴버배치의 셜록 팬이라면 꼭 소장해야하는 아트북입니다.
9791185014074,10,셜록에 대해 알고 싶었던 모든 정보를 철저하고 완벽하게 분석해서 셜록의 매력을 다시한번 발견할수있을 것 같아요
9791185014074,10,셜록을 시즌 4까지 본 셜록 덕후입니다! 셜록이라는 캐릭터는 굉장한 괴짜로 독특하게 나오는데  괴짜이다 보니 시청자인 저희가 그냥 놓치고 간 활약이나 심정들이 안 보일 수도 있는 것들이 있습니다. 그러나 그런것들이 완벽하게 정리되고 분석한 책이라니 매우 매력적인 책이라고 볼수 밖에 없네요
9791185014074,10,셜록 팬이라면 누구든 빠질 수 밖에 없는 책.
9791185014074,10,셜록의 매력을 분석했습니다
9791185014074,10,책의 구성과 독서 흐름에 만점을 주고 싶은 책
9791185014074,10,셜록드라마를 보며 이해가 안된부분들을 세세히 보여주니까 더 좋은것같습니다.
9791185014074,10,기대중이에요!! 셜록 너무좋아요ㅠㅠ
9791185014074,10,셜록ㅠㅠㅠㅠㅜㅜㅠㅜ 기대됨!! 드라마 또 정주행해야겠네요ㅎㅎㅎㅎ
9791185014074,10,책이 아닌 드라마 셜록을 본지 한달도 안된 것 같은데 벌써 셜록이란 드라마의 팬이 되어버렸어요. 이번 책은 드라마의 내용을 좀더 설명해준 케이스북 같은 데 꼭 사서 봐야겠네요 ㅋㅋ 매우 기대됩니다!
9791185014074,10,좋다!사랑한다 BBC!!!!
9791185014074,8,원작을 풀어 다시 설명해 놓은 케이스 북이다. 에피소드 마다의 이야기를 다시 풀어 해석해놓을 것! 원작의 느낌을 많이 살리려고 노력했지만 의역된 부분이라던가는 조금 따라 가지 못한다는게 아쉽긴 하다
9791185014074,10,"사랑합니다 셜록, 셜록은 사랑입니다, 베니는 사랑입니다, 얼굴 긴 오이가 내마음을 이렇게 사로잡을줄 누가 알았겠어"
9791185014074,8,"원작의 글씨체의 느낌을 못 따라가는 것 같아 아쉬웠지만, 에피소드를 다시 되돌아 보고 당시 사건 진행에 대한 셜록과 존의 코멘트들도 다양해서 책 보는 재미가 쏠쏠했어요. 종이도 코팅되어 있어서 사진같은 것들이 훨씬 자세히 보였어요."
9791185014074,10,여러책과함께구매한셜록책이에요 다른책과함께차근히읽어봐야겠네요 표지만보고도설레여지는~~^^
9791185014074,8,"원서와 비교한 뒤 산 거지만, 조금은 아쉬운 점들이 보이네요 그래도 제 책장에 꽂혀있다는 자체로 너무 좋아요 책 상태도 좋습니다"
9791185014074,8,번역이 잘된 편이지만... 원본의 센스를 조금 더 따랐으면...
9791185014074,8,베네딕트에 푹빠진 딸이 엄청 좋아합니다. 시즌3를 기다리다 케이스북을 구입했는데 나름 괜찮습니다.
9791185014074,8,영드｀셜록3｀를 기다리다 지쳐 케이스북으로 갈증을 대신합니다.미드｀한니발｀도 영상집이 나오면 좋을텐데...아름다운 매즈휴를 실컷 감상하게ㅠㅠ
9791185014074,10,"베네딕트와 마틴을 사랑할 수 밖에 없는 영드 셜록+_+ 시즌 1,2가 끝나고 같은 에피소드를 여러번 돌려보기를 반복하다 살짝 지쳤는데요~ㅋ 단비와 같은 케이스북이 나와서 너무 너무 좋아요~ 시즌3가 조만간 나온다고 하니 그 전에 복습 차원에서 꼭 봐야한다는!ㅋ 완전 추천합니다^^"
9791185014074,8,즐겁네요. 시즌 3 기다립니다.
9791185014074,8,번역이 좀 어색한걸 빼고는 괜찮네요 네 번역이 좀...
9791185014074,8,번역이 약간 애매한거 빼고는 다 좋음!!셜록 시즌3이나 얼른 나왔으면 좋겠다
9791185014074,8,해석이 어색한 부분이 조금 보이네요 영문판이랑 표지재질이 다르네요
9791185014074,10,맘에들어요 오자마자 다읽었어요 ㅋㅋ 시즌3 기다리기 힘들었는데 이걸로 힐링하네요
9791185014074,6,"구성은 훌륭하나 해석이 엉망이다.

해석할 시간이 별로 없어 급하게 만들었던지

아마추어를 고용했던지

셜록을 보지 않은 사람이 만들었던지

셋 다던지.

문제가 심각하다.

역자가 맥락을 이해하지 못하고 기계적으로 해석한 문장들이 많아

읽힘성이 몹시 안좋고

서체 역시 유치하기 짝이 없다."
9791185014074,10,받자마자 읽고 낄낄거리다가 다시 시즌 1 블루레이를 틀었습니다. 셜록을 재미있게 본 분이라면 구입할만한 책이라고 생각해요. 생각보다 구성이 꽤 알찹니다.
9791185014074,10,ㅋㅋ 저도 보자마자 생각 안하고 주문했어요ㅋㅋㅋㅋ 근데 저는 키보드 노트패드 못받았네요ㅠㅠ 초판이 엄청 빨리 소진 됐나봐요ㅠㅠㅠㅠㅠㅠ
9791185014074,10,폰트만으로도 구분이 가능했던 원서와는 다르게 셜록이나 존이나.. 심지어는 볼드냐 아니냐의 차이만 있을 뿐 마이크로프트까지.. 너무 비슷한 폰트를 쓰셨네요.. 포스트잇 색상이 아니었다면 구분 안 될.. (한 사람이 펜만 바꿔가며 쓴 느낌;) 그래도 셜록인데 사야죠. 원서랑 나란히 꽂아둬야겠네요.
9791185014074,10,셜록 케이스북이라는  한글이  너무 반갑네요  번역판까지  나오다니  신기하기도해요   셜록 좋아하시는분들이라면  강추~~
9791185014074,10,으악 이게 뭐야..ㅋㅋㅋㅋㅋㅋㅋㅋㅋㅋㅋ사야겠다......
9791185014074,10,드디어 번역판이 나왔구낰ㅋㅋㅋㅋㅋㅋㅋㅋㅋㅋㅋㅋㅋ 행벅♥
9791185014074,10,"지르라 부르는 소리있도다. 셜로기와 조니보이, 마횽이 저를 부릅니다."
9791185006000,10,"방송관련 직업에대한 자료를 찾다가 알게된 책, 다양하고 좋은정보가 많을거같아서 구입합니다!"
9791185006000,10,드라마 PD가 되기 위한 혹은 드라마의 속살을 보고 싶은 독자를 위한 책!
9788964061770,8,라디오 방송 제작에 관심이 있다면 꼭 볼책. 쉽게 친근한 책이다.
9788964061770,10,"라디오키드라면 꼭 읽어야 하는 책. 라디오의 진실과 오해, 그리고 라디오를 만드는 사람들, 라디오를 사랑하는 사람들의 꿈과 열정이 오롯이 담겨 있다. 라디오여, 영원하라~"
9788958623007,10,"정말 감동깊게 읽고 읽었습니다. 요즘에 많은 생각을 하게 하는 책입니다. 오늘날 우리 삶을 돌아보게 합니다. 약간 어려울 수도 있지만, 수업시간에 부교과서로 사용하여 흥미를 가지고 읽었습니다."
9788958623007,8,"맘놓고 보기엔 어렵고, 다잡고 보기엔 복잡하다. 드라마자체가 TV라는 매체에 얽매여있기에, 복잡다난하지 않았을까"
9788958623007,10,드라마에 울고 웃는 사람이라면 일독하면 좋을듯.. 한국드라마화이팅.
9788958623007,10,드라마를 보는 눈이 사뭇 달라질 것 같군요
