ISBN13,rating,review
9788958620334,10,현대예술과 과거의 예술을 잇는 재미라는 코드에 대한 진중권의 입담.
9788958620334,8,자녀를 키우는  주부라면 한번쯤 읽어될것
9788958620334,10,도대체 이런 건 어떻게 생각했을까?
9788958620334,8,주어진 틀에서 넘어서는 천진한 자가 되어라...놈들을 넘어서면서 놀아보자~~
9788958620334,6,놀이와 예술이 서양것에 치중되어 있어 아쉬웠다. 후속편이 필요해 보인다.
9788958620334,10,"'예술적으로, 예술로 놀았던 예술가들'의 기발한 상상력을 구경한다. 유쾌한 책이다."
9788958620334,10,책을 읽는게 아니라 옆에서 이야기를 듣는 듯 너무 편안하고 재미있게 본 책
9788958620334,10,놀이와 예술에 대한 기막킨 논리학!! 잼있게 그러나 촌철살인의 그의 글솜씨는 여전~
9788958620334,8,"제목 그대로였다. 정말 놀면서 예술을 논하며, 책을 읽는 시간동안 뇌가 즐거웠다."
9788958620334,10,"과거 인간이 했던 예술로서의 놀이에 관한 이야기다
예술=놀이라고 생각한다면 필"
9788958620334,10,재밌다. 미학오디세이가 즐거웠다면 이 책도 즐거우리라.
9788958620334,10,즐겁게 논다는 것! 그게 예술의 시작이라는 것!
9788988105597,10,"작품비평을 하는 중후반은 본 게 없어 그냥 스킵했다. 하지만, 자신의 비평철학을 풀어놓은 맨 앞의 두 에세이, 해석에 반대한다랑 스타일에 대하여 는 진짜 한 페이지도 버릴 것이 없다"
9788988105597,10,제 멋대로의 해석은 간혹 타자를 불쾌하게 한다.
9788988105597,8,평론집.대상이 되는 작품들에 대한 지식이 없다면손택의 다른 책들에 비해 덜 매력적으로 느껴질수도...
9788988105597,8,그냥
9788988105597,10,생각해볼 게 많은 책.
9788988105597,8,예술과 문학을 접목시킨 이해가 가능하다.
9788988105597,10,수잔 손택이므로
9788988105597,10,이렇게 쓰고 싶다.
9788988105597,10,아는 분이 무척 좋아하는 작가라길레 대체 어떤 대단한 면을 가진 소설가일까 궁금하여 주문했습니다.^^
9788988105597,10,정말 좋은 책입니다!!! 정말 지적인 탐구가 돋보이는 책
9788952200594,6,핵심은 서구 기준에서 벗어나 상상력이라는 ｀인류｀ 지평에서 ｀우리｀의 사고방식은 뭐고 자체 균형감각은 갖고 있는지를 살피자는 맞는 말씀. 그러나 보통은 ｀우리｀를 ｀학문하기｀가 기술/정서/제도적으로 훨씬 어려우니까 ｀서구｀로 대충 우회하는 것임. 우리/학문하려면 진짜 박터지게 공부해야 합니다.
9788952200594,10,읽어볼만한 책
9788980380152,10,고전문학 연구자라면 당연히 읽어봐야하는 책. 그런데 너무 어려워요.
9788980380152,8,중국의 예술 안에 면면히 흐르는 장자의 도
9788986353266,10,미학의 기본 개념들에 대한 탁월한 정리정돈!
9788986353266,8,웹디자인 수업에서 추천받아 읽었습니다. 기본 개념 익히디에 도움이 되었습니다
9788986353266,10,"기본에 충실한 책, 어려운 용어나 개념들을 소화시키기 좋게 정리해놓아 정말로 입문서로 최고라고 생각되네요."
9788986353266,10,미학의 기본 개념을 익힐수 있어 좋습니다.
9788986353266,10,간단하면서도 풍부한 내용이 매우 마음이 듭니다.
9791190724555,6,그렇게 깊숙한 내용은 없다. 기획을 처음하는 사람에게 유용.
9791190724555,8,괜찮아요. 기획자들은 읽어 볼 만한 책입니다.
9791190292023,8,건드리고만 지나가는 얘기들이 조금 아쉽지만 재밌다. 오쓰카 에이지의 비평서가 더 번역되면 좋을 듯.
9791190292023,6,"오쓰카 에이지의 평소 문제의식이 드러나 있기는 한데, 한국에도 범람하는 감정화된 사회의 문제는 첫글에서만 드러나있다."
9791190292023,6,"문화와 역사의 ‘감정화‘에 대해 논하고 있는 이 책에서, 특히 오에 겐자부로와 무라카미 하루키로 이어지는 세카이적 경향을 짚은 점은 흥미로웠다. ‘내면‘에만 치중하고 ‘사회‘를 은폐하는 경우를 비판적으로 보는 관점에는 동의한다."
9788965642473,10,불어 원전과 대조해서 읽어보았는데 번역이 아주 유려하여 굳이 참고할 필요가 없을 정도였다. 빠르게 읽을 때보다 천천히 읽었을 때 훨씬 더 깊고 풍부하게 읽을 수 있는 책. 책 뒷부분에 번역자 이나라 선생님의 논문이 함께 실려있어 위베르만의 미술론을 따라 가는데 큰 도움이 되었다.
9788965642473,10,터렐을 볼때의 감각 그대로
9788965642473,10,초반의 어려운 독해를 넘어서면 어느순간 위베르만의 리듬이 느껴진다.  한국어로 읽을 수 있다는 것에 감사를. 해제는 매우 효용성이 있다.
9788965642473,10,미니멀리즘의 조형적 논리는 잘 못 이해되어 그저 이쁜 오브제 정도로 소비되는 최근의 경향과 조형적 논리의 극단으로만 환원해내는 미국의 비평의 경향의 우스꽝스러운 간극 바깥에서 터렐의 작품을 보게 해준다. 믿을 수 있는 역자의 번역이고 해제를 통해 위베르만에 대해서도 감을 잡을 수 있다
9788965642473,2,작자가 어떤 이미지를 마주했을 때 척수반사로 머리속에 떠오른 키워드들을 그대로 스캔해서 어떻게든 문장으로 나열한 느낌을 받았다.  그럴듯한 단어들이 뒤죽박죽 나열되어있을 뿐 읽을 수 없는 책이었다
9791189099046,4,"길게 늘여 쓰다 보니까 좀비에 관한 온갖 게임, 책, 영화 소개로 범벅이 되어 버렸다. 정보사회에 따른 유동화때문에 신체성을 상실한 불안이 좀비에게 투영되었고 그것은 모두 신자유주의화때문이라고 주장. 좀비는 무엇이든 싫은 것을 투영할 수 있는 욕받이인 것을."
9791189099046,10,유동성에 빠져 모호해진 경계선상에서 배회하는 존재를  좀비로 가정한 책이다. 90년대 이후의 문화 연구서적들도 함께 소개되어서 현대 사회를 보는 다른 관점을 제시하고 있다.
9791189099046,10,"정신 똑 바로 차리지 않으면 ‘뇌 없고,영혼 털린 인간‘이 될 수 있다.거대자본의 마케팅 스킬과 사이비 언론이 드리운 바늘에 낚인채 오로지 ‘소비적 인간‘으로 소모되는 인간성이라니..항상 ‘떼로 몰려다니는 좀비‘는 뼈를 때리는 메타포다."
9791160801286,10,미학오딧세이에 이어 미술사에 대해 이해하기 쉽게 흐름을 짚을 수 있는 좋은 입문서입니다
9791160801286,10,역시 결코 실망시키지 않는 작가! 인상주의를 사랑하는 이로서 ... 좋은 책 감사드립니다.
9791160801286,10,역시 깔끔하고 세련된 전개와 정리!그리고 다시 한번 느끼는 세상을 바꾼 세가지 사과중 하나인 세잔의 사과가 던지는 은은한 파괴력!
9791160801286,10,인상주의 미술관 여러 곳을 다녀온 느낌. 수많은 그림을 볼 수 있어서 눈이 즐거웠다.
9791160801286,10,기대하던 책입니다.
9791160801286,10,"3권으로 완결된 서양미술사이지만, 작가 말대로 조금 더 보충하기 위해서 나온 책입니다. 하지만 구멍 뚫린 걸 땜질하려는 듯한 뉘앙스가 아니라 마치 처음부터 이렇게 출간될 것을 계획했던 것마냥 자연스러워서 그냥 4권으로 봐도 무리가 없을 듯 합니다. 3권까지 재밌게 보신 분이라면 만족하실 듯."
9791160801286,10,진중권 교수님의 <서양미술사1>(뒤에 [고전예술편]으로 나옴)부터 사서 3권 모두 가지고 있습니다. 오래만에 그 시리즈의 <인상주의편>이 나왔네요. 빨리 사 보고 싶습니다. <19세기편>도 손꼽아 기다립니다.
9788932319162,10,"진정으로 이로운 연구를 오래 해나가려면, 눈과 마음에 따뜻함이 깃들어 있어야 한다는 것을 느꼈습니다. 쉽게 읽히지만 정밀한 분석과 통찰이 담겨 있어 얻은 것이 많습니다. 미학 분야 개관서가 드문 가운데, 훌륭한 책으로 공부를 시작하실 분들이 부럽습니다."
9791155100417,10,옷에 관심이 있어서 구매했는데 재미있네요. 역사와 복식을 연관지어 생각하니 더 재미있네요
9791155100417,10,국내 정발된 디자이너 오귀스트 라시네의 책들 중 하나. 이 정도의 복식사 책을 정발본으로 볼 수 있다니... 발품 팔아가며 어렵게 구한 원서를 끌어안고 되도 않는 불어사전을 뒤적여가며 끙끙거리던 시절을 생각하면 정말 세상 좋아졌다.
9791155100417,10,"수 많은 일러스트가 실려있고, 시대별로 특징 요소를 항목별로 메모해둔 구성이 유용하다. 복식에서 옷감의 재질, 색상,문양,장신구,소품 등을 정확하게 표현하기엔 크나큰 어려움이 있었겠다.이책에서 <중세의 가을>에 묘사된 과장된 의복의 형태를 만나게 되니 재밌다. 책 재질이 더 좋았으면 싶지만"
9791155350652,8,그래도 다 읽었다.
9788991847507,10,20세기를 대표하는 패션 디자이너들의 패션에 대한 제각기 다른 관점이 독자로 하여금 읽는 재미를 더합니다.
9788991847507,10,20세기 패션의 역사 기대되네요.
9788991847507,10,폐션을 통해서 시대상을 볼 수 있어서 좋네요
9788991847507,10,패션아이콘이 궁금합니다
9788976333223,2,"똥이네요.
뭔가 다른 설명을 붙여볼까 했지만 건똥이나 설사나 큰 차이는 없을듯 하여...."
9788976333223,6,제목만 봐서는 그리 어려운 이야기는 아닐 것 같은데 쉬운 이야기를 너무 어렵게 쓴책
9788976333223,8,간단하고 가볍게 잘 정리되어 있습니다.
9788970591483,10,소장용
9788970591483,8,good
9791197286704,10,읽는 내내 설레이며 마음이 따뜻해지는 시간이였습니다.‘함께 한다는 것‘그 하나만으로 유난스럽지 않게 그러나 되짚으며 꼼꼼하게 만들어내는 그의 성격을 나타내고 있지않나 생각합니다.혼자가 아니라 팬과 프로보노들이 함께 작지만 위대한 발걸음을 남기고 계신 그 길을 온 마음으로 응원합니다.
9791197286704,10,5년간의 길스토리의 발자취를 볼수있게되 너무 기대되네요
9788936478285,8,척박한 서부를 실리콘밸리와 할리우드가 공존하는 캘리포니아라는 도시의 시공간을 변모시킨 머이브리지의 나비효과만을 다룬 책이 아니다. 한 인물의 삶뿐만 아니라 그와 같이 걸어왔던 시대의 사회학과 미학까지 리베카 솔닛만의 특별한 스토리 텔링으로 우리를 이끈다.
9791130309798,10,예술을 새로운 관점으로 해석한 흥미로운 책!
9791159301377,10,-문화예술교육을 알고 싶다면 꼭 읽어보세요...!
9788952739148,10,중고책을 시켰는데 새책을 보내주는 이광활한우주점 최고입니다~^^
9788952739148,10,"요즘은 미술작품 해설서가 흔하지만 깊이 없이 얄팍하거나 그림 해설에 그쳐서 사놓고 실망한 적이 많다. 그러나 이 책은 특별하다. 믿고 읽는 저자의 해박한 지식과 도시의 역사적 배경에 대한 해설과 어우러지며, 작품을 넘어 작품이 탄생한 사회와 예술적 토대를 깊이 이해할 수 있게 한다. 강추!!"
9788952739148,10,"깊이있는 유럽문화여행을 집에서 즐겁게 할 수 있는 책. 출장으로 여행으로 갔던 곳을 떠올리니, 읽어보고 갔더라면 더 좋았을텐데 싶네요."
9788952739148,10,"전작을 통해 서양문화사의 순간들을 꼼꼼하게 풀어낸 작가의 이번 저작은 서양문화사에서 빼놓을 수 없는 도시들로의 여행기와 같습니다. 학구적이나 학술적이지 않고, 섬세하나 조잡하지 않게 이번에도 인류 문화사를 예술과 도시라는 씨줄과 날줄로 엮어가고 있습니다. 강력 추천합니다!"
9788952739148,10,반드시 3부작으로 완성되어야할 최고의 교양서. 이 분야 최고의 지식과 경험을 갖춘 저자는 관련분야 학자이자 저널리스트로서 본인이 쌓은 학문적 내공과 경험을 바탕으로 마치 도시에 와있는 듯 생생한 내용을 전해준다. 독서의 시간이 유익하면서도 행복하다. 반드시 3부작으로 완성되어야 할 책!
9788952739148,10,"영국 사람들이 God save the Queen 만큼 애정하는 엘가의 희망과 영광의 나라로 (위풍당당 행진곡) 가 가장 잘 어울리는 곳이 왜 런던인지, 보헤미안의 생활 전경속에서 태어난 라보엠을 들을 때면, 파리 카르티에 라텡이 왜 가고싶어지는지...저자 전원경 선생님과 함께 유럽으로 떠나 보시라."
9788952739148,10,흥미로운 내용으로 가득 찬 아주 좋은 교양서. 서양 예술의 역사가 파노라마처럼 한 눈에 들어오는 책이라고 생각함. 강력히 추천!
9788952739148,10,"다음 여행의 행선지를 전하기 전에 전원경선생님의 도시와 예술에 대한 안내에 마음을 맡겨보는 것은 어떨까?  가장 마음이 끌리는 도시로 당신의 발걸음을 옮겨보면, 선생님의  초대에 공감할 수 있을 것같다."
9788952739148,10,"예술가의 작품은 그 작가가 속한 시간과 공간을 반영할 수밖에 없는데도  현재의 우리들은 그러한 맥락을알지 못한 채 작품을  감상할 수 밖에 없는 것 같다.  전원경선생님은  이 책을 통해 작가들이 숨쉬던 도시로 우리를 초대해, 깊이있는 감상의 세계로 발을 딛게해주신다."
9791187150565,10,와우~ 2편이 나오다뇨! 멋집니다.
9791187150565,10,화학에 관해 2권으로 나누어 놓은 것으로 보니 화학 관련 내용이 많아 기대가 됩니다
9791187150565,10,과학과 미술과 예술의 작용 명화에 숨은 화학적 진리를 찾을 수 있을 것입니다^^
9791187150565,10,서로 교집합이 보이지 않는 화학과 미술이 만나 어떤 이야기를 들려줄지 기대됩니다.
9791187150565,10,화학의 2번째 이야기에는 또 어떤 재미있는 미술속의 화학원리가 숨겨져있을까요? 궁금하네요
9791187150565,10,"화학자는 미술작품을 어떤 시각으로 바라볼까?한 권으로 모자라 2권이 나올정도라니, 역시 화학과 미술은 깊은 관련이 있는 학문이긴 한 듯.어떤 이야기들이 펼쳐질지 기대된다."
9791187150565,10,미술 작품 속의 화학물질? 컬러도 과학이다! 이 책 너무 끌리지 않습니까? 1편으론 부족했다. 2권까지 가보자구욧!!
9791187150565,10,1권이 마음에 들었다면 해당 권도 재밌게 읽으실 수 있을 겁니다. 물론 이어지는 이야기는 아니라서 따로 읽으셔도 됩니다. 책에서 다루는 모든 미술작품을 컬러로 함께 실어서 설명하는 부분과 작품을 비교하며 볼 수 있어 좋았습니다.
9788971998373,8,"미학사에 대해 개괄적인 내용을 이해할 수 있는 서적이다.그러나 용어가 너무나 전문적이였고, 미학자들과의 비교분석이 있었으면 이해하기에 더 쉬울 것 같다.약간의 일본 학자 느낌이 나기도 한다.추후 ‘예술철학-플라톤에서 들뢰즈까지‘를 읽어보고 싶다"
9788994207759,10,"사이먼 레이놀즈의 저서가 번역(개정)된 것에 기쁘며, 알찬 내용에 만족한다"
9788994207759,6,"레트로 문화가 핫하다. 그래서 이 책을 집었다.근현대의 레트로 문화를 대중음악을 통해 설명한다. 다만 그 대중음악이 모두 팝송이라는 것. 팝의 역사에 관심이 많거나 잘 아는경우, 이 책은 좋은 책이 될 수 있다. 하지만 나는 그렇지 않았고 이 책에 공감할 수 있는 부분은 매우 적었다. 힘들었다."
9788955751871,2,‘그/그녀‘라니 아마추어스럽다.
9788955751871,10,기대와 달리 책내용이 너무 허술하다같은문장 같은 내용만을 계속 반복반복~~50쪽이면 충분한 내용을 200쪽으로 늘려놓은책!!!
9788965641797,6,아무래도 번역이...  문장에 주어가 두개거나 영어로는 각기 다른 단어를 모두 같은 단어로 번역하는 등 읽기가 수월하지 않다.
9788936483456,10,전공책으로 샀는데 전반적인 역사를 알 수 있어서 좋았습니다
9788936483456,10,재미있고 특이한 역사서에요. 4권짜리인데 소장해 두고 읽을 만한 책입니다.
9788963571638,2,"논문 같은 책이다. 스토리텔링에 기반한 여러 연구자들의 논문 내용과 의견등을 종합하여 정리하고 자신의 의견을 덧붙이는 구성이다. 표지 그림은 가볍고 재미있어 보이지만 내용은  재미있다 할 수 없다. 학술적으로 스토리텔링의 이해나 정의, 앞으로의 연구등에 관심이 없다면 힘든책이다."
9788958626787,8,"고대부터 근대까지 미학의 흐름을 각 시대의 미술 작품, 플라톤과 아리스토텔레스의 대화, 에셔의 그림을 통해 쉽고 재미있고 명쾌하게 설명한다. 헤겔의 미학 부분이 좀 더 자세하게 설명되었어야 한다는 점, 여혐적인 면이 있다는 점이 아쉽다."
9788958626787,2,다시는 안 산다 당신 책
9788958626787,2,"미학사는 쉽게 설명했지만 철학적으로 큰 가치가 없다고 생각되는게, 1권부터3권까지 철학사의 중요한 가치와 결론에 다다르기 전에, 철학적 이해의 중간에서 조야하게 마무리하고 미결로 남겨놓고는 회의주의적 태도를 보이는 것이 이 책에서 다룬 철학자들조차 소화하고 인용했다고 믿기지 않습니다."
9788958626787,10,아름다운 철학. 믿고읽는 진중권.
9788958626787,8,미학.. 어렵다. 괜히 지은이의 명성에 기대고 지적 허영심에 빠져 이 책을 읽는다면 실망할지도 모르는 일이다. 소실점..시각..구성...으음 이런것이 미학이구나..하는 정도.
9788958626787,10,쉽고 재밌게 이해가 쏙쏙!
9788958626787,8,12/28
9788958626787,6,돌고 돌아 디오니소스
9788958626787,10,아직 다 읽지는 않았지만.... 소장했다는 것만으로도 벌써 즐거운 책
9788958626787,10,읽기 쉽게 알아듣기 쉽게 서양미술사의 처음부터 잘 설명한 책
9788958626787,10,쉽게 책장을 넘길 수는 없지만 그만큼 많은 정보를 담고 있다고 생각합니다.
9788958626787,10,"처음 이 책을 읽은게 10여년 전이었던 것 같다. 얼마 전 다시 읽었는데, 이 책은 아직도 미학이라는 알쏭달쏭한 학문에 대해서 명쾌한 지침서이자 안내서가 되어주었다. 아직 이 책이 가진 생명력은 팔팔하다,"
9788958626787,10,미학에 관심이 생겨서 읽어본 입문서?였는데 내용도 알차고 생각할거리도 많아서 즐겁네요
9788965238980,8,이 책을 읽지 않고 어떻게 보들레르의 모더니즘에 대해 말할 수 있겠는가.
9788961961431,6,첫 장부터 하나님이 말씀으로 세상을 창조했다는 성경구절을 인용하면서. 사물마다 언어가 있고 언어로 본질을 전달한다는 벤야민의 언어철학에서 출발하는데.. 이걸 읽어야 하나 난감하다.
9788998143107,8,자부심과 장인정신에 무게를 두고 읽었다.
9788998143107,8,연필을 어떻게 깎으면 좋을지 어떤 한계에 부딪혀 있었는데 새로운 길을 보여주었습니다. 연필깎기 장인이 되기엔 아직 갈길이 멀구나 다시 한 번 느꼈습니다. 표지가 습기를 먹으면서 휘어지는 현상이 발생해 별점 하나 깎습니다. ㅠㅠ
9788998143107,10,비밀독서단에서 소개하던데 ㅎㅎ 이 책 재미있다. 사진도 상세해서 더 재밌다.
9788998143107,10,데프콘이 연필깍는 모습 보기 좋았다. ㅋ
9788998143107,2,신선하다기보다 돈아깝다
9788998143107,10,이 책으로 아무리 직업이 하찮게 보여도 중요한건 그사람이 얼마나 그일에 노력하는 지라는지 알게되었다.
9788998143107,8,재밋게 읽을 수 있는 책입니다.
9788998143107,10,그냥 멍때리면서 읽은 책. 무언가를 수집하고픈 열망을 불러일으킨다. 저자의 개그코드도 마음에 든다.
9788998143107,6,생각만큼 깊이있는 책은 아니고 진지하게 코미디를 실천하는 정신이 높이 살만하다. 일단 장인은 아닌것은 확실하다.
9788998143107,10,오랜만에 아무 생각없이 유쾌하게 본 책.
9788998143107,10,세상에서 최고로 진지하게 웃기는 작가인 것 같다.
9788998143107,8,누구나 할 수 있는 일이지만 누구나처럼 하지 않으면 된다.
9788998143107,10,예상밖으로 읽으며서 정말 즐거워지는 책. 꼭 소장하고 싶다!
9788998143107,8,매우 유쾌한 책! 내 책장의 새로운 장르~
9788998143107,10,"이책을 사고나서 새로운 취미가 생겼다. 바로 연필깎이. 새로운 취미의 시작점을 제공한 작가에게 감사,,,,."
9788998143107,6,"내용면으로는 좀... 하지만 저자의 장인정신과 자신의 전문분야-연필깎기-에 대한 대단한 신념과 노력,끈기, 그 아이디어에 큰 박수를 보내고 싶다. 폭포속에서 연필깎기 라니... 빵 터졌다."
9788998143107,10,곁에 두고 계속 펼쳐본다. 그리고 연필 한 자루 깎아보고. 엉뚱하고 별나지만 소장 가치는 충분하다. 선물도 했다.
9788998143107,8,"연필을 깎는 방법만으로도 사소한 것의 소중함을 깨닫게 한다. 엉뚱하고 자질구레하며, 필요이상으로 세심하다. 이게 무슨 소용이냐 싶을 수 있지만 이 점이 매력."
9788998143107,10,"헨리 페트로스키의 연필 이후 연필 마니아들을 흥분시키는 책이죠. 연필회사의 역사부터 훑어서 모델별 특징을 꼼꼼하게 정리한 책이 나오거나, 번역됐으면 좋겠군요."
9788998143107,10,참 대단한 책. 연필을 깎는 데는 별 필요가 없는 책이지마는 세상을 잘 사는 데는 필요한 책.
9788998143107,10,"...여태까지 산 책들중에 가장 병맛 실현에 충실한 책.
갖고 다니면서 읽으면 시선집중시킬 수 있을 만한 책."
9788998143107,8,장난처럼 특이한 주제로 쓴 책인줄 알았는데..실제 35달러의 비용으로  이용할 수있는 서비스라는데 놀랐고 생각보다 더욱 프로페셔널한 작가의 이야기에시간가는 줄 모르고 읽게된다..
9788998143107,8,연필깍가 하나에도 이런 다양한 방법이 있다니 참 ~
9788998143107,10,"책으로 할 수 있는 가장 전문적이고 엉뚱한 시도, 올해 최고로 사랑스러운 책."
9788998143107,10,이건 무조건 사야한다. 표지부터 소장욕을 마구마구 불러일으키는 어여쁜 책. 뭣보다 저자의 못말릴 집요함에 경탄이 앞선다. 누구도 흉내낼 수 없을 정도로 완벽하고 독창적이다.
9788971995426,8,노벨문학상을 받은 작가의 글이라고 다 내 마음에 들어야 하는 건 아니지.
9788971995426,10,이론적이고 실천적인 양면 모두 만족할 만한 책
9788971995426,8,"가오싱젠은 발자크와 도스토옙스키를 예로 들어 그들은 정의의 화신이 아니라 현실을 묘사한 리얼리스트라고 말한다. 그가 주창하는 ｀문학과 정치의 분리｀라는 것이, 칼로 자르듯 완벽하게 행해질 수 있을까?"
9788961471640,2,인용문에 한문 병기합시다.
9788961471497,8,"오.. 이 책을 읽어보지는 않았지만.. 아마도 저자의 박사학위논문에 그 근간을 두고 있는 책이 아닌가 합니다. 제 지도교수님께서 저자의 박사학위논문을 주셔서 읽어봤는데, 꽤 좋았습니다."
9788961471497,10,퍼스 기호학을 미술사를 통해 재구성을 시도했군요. 그리고 국내 연구서라 더욱 기대가 됩니다
9788961471497,10,"참 난해한  퍼스 철학, 이 책 보니 감이 잡힌다. 추천~"
9788991706101,2,감각적인 것의 분배를 이야기하는 랑시에르의 아주 중요한 책임에도 번역이 너무 심각하여 읽는 게 너무 힘들다. 너무 안타깝다. 이해에 방해가 되는 번역이다. 번역상 어려움은 물론 이해하지만 이 번역은 랑시에르 자체에 대한 이해가 부족한 상태에서 번역된 듯하다. 이런 식으로 책 만들지 않기를
9788991706101,2,번역 최악
9788991706101,2,좋아용
9788991706101,6,먼가 있어보여서
9788991706101,2,내가 무식해서 이해가 안 가나 했는데 아래아래분도 나와 같은 리뷰... 번역도 창조적인 작업이라는 걸 느낌
9788991706101,2,번역이 정말 최악이다.
9788991706101,8,"개인적으로 ｀감성｀의 분할이라는 표현보다는 ｀지각｀이라는 단어로 번역했으면 어떨까 생각이 들지만, 정치에 대한 경직된 기존의 사고에서 벗어난 자유롭고 아름다운 사유가 담겨 있어서 너무 좋았던 책."
9788991847460,10,고급인문서를 읽는 체험.
9788991847460,10,책 괜찮습니다...
9788952107916,8,처음으로 각 분야 전문가들이 힘을 합쳐서 낸 통사적 책이기 때문...
9788952107916,8,서울대에서 발간한 미학서적. 미학 공부의 기본입니다.
9788952107916,10,"미학, 철학, 심리학, 예술분야의 교양입문역할은 물론 심화된 텍스트읽기역할도 훌륭히 수행할 수 있는 책"
9788932905969,10,"고전, 미, 서양문화 백과사전. 거기에 서사시,철학,문학 까지.. 번역도 맘에 들고 읽기 아까운 책이다..!"
