ISBN13,rating,review
9791190427777,10,"술술 읽히는 책. 펭귄에 대한 애정이 돋보여서 너무 좋았습니다. 저까지 펭귄과 물범에 대한 애정이 샘솟았어요ㅎㅎ 펭귄을 좀더 확실히 구별할 수 있었고, 사진이 정말정말 좋았어요. 포스터도 최고! 남극으로 함께 탐험한 느낌이었습니다:)"
9791190427777,10,사진과 글 한장 한장에서 저자의 펭귄에 대한 애정이 묻어나는 책. 가까이에서 직접 관찰한 사람이 설명해 주는 남극에서 펭귄이 살아가는 모습이 너무 좋다
9791190427777,10,추천사가 펭수여? 신박하네
9791190427777,6,펭귄에 대해 새로운 사실을 알 수 있어서 좋았습니다.사진과 글로 담은 생생한 체험기라서 좋았습니다.남극기지 생활과 왜 현재의 일을 하게 되었는지 등의 내용이 없는 점은 아쉽습니다.
9791190427777,10,사진도 좋구 술술 읽혀요~~ 글 분량도 딱 집중해서 읽을 수 있는 정도에요 ㅎㅎ 펭귄책이지만 기후변화에 대한 경각심도 들었네요 저도 할수있는걸 해야겠다고 생각했습니다~~~!
9791190427777,10,지난 여름에 나왔던 <펭귄의여름>도 구입하고 이번 책도 바로 구입했습니다. 펭귄은 영상으로도 사진으로도 그림으로도 귀엽죠! 여름책이 따뜻한 스케치가 있는 생태학자의 도감 느낌이었다면 이번 책은 좀 더 발랄하고 귀여운 펭귄일지 느낌이 듭니다. 띠지는 펭클럽 지인에게 줬는데 좋아하네요ㅋㅋ
9791190427777,6,진짜 타이밍 기가 막히네.. 펭수가 인기니까 펭수추천한 펭귄이야기라니.. 책 출간도 타이밍이 좋아야 많이 팔리죠. 근데 위에 펭귄 사진 귀엽네요.
9791190427777,10,편안하게 술술 읽혀지는 책이네요. 매 장마다 펭귄사진이 있어서 좋았구요.  글이나 사진에서 박사님의 펭귄에 대한 애정이 느껴졌습니다.
9791190427777,10,펭귄 사진 보면서 힐링하고 싶어요 ㅠ
9791185153292,10,번역이 어렵다는 뒤마의 또 다른 작품을 보게 되어 반가웠습니다. 다양한 에피소드들과 특유의 풍자로 아주 재미있게 읽었습니다
9791195776832,10,생각하지 못한 감정도 담고 있습니다 속상하지만 우리가 알아야 할 것 같아요
9791195776832,10,"지하철 광고판을 보고 우연히 알게 되었고 책을 구매했습니다. 읽는내내 울었고 울면서 책을 덮었습니다. 많은 생각을 하게끔 하는 책입니다. 함께 살아가며 공존하는 삶을 알려주는 책입니다. 부디 보다 더 많은 분들이 읽었으면 하는 바람입니다. 함께 살아요 우리. 동네 캣맘, 캣대디 응원합니다."
9791195776832,10,녹녹치 않은 길에서 치열하게 살아남은 아기냥들과 엄마냥들의 고군분투 이야기가 사진으로 보여 집니다. 작가님의 따뜻한 시선을 느낄수 있었습니다
9791195776832,10,"존경, 그 이상의.한 아이를 살리려면 온 마을이 필요하다.길에서 태어났지만 우리의 이웃입니다."
9791195776832,10,말로 표현하지 않아도 그들의 눈빛으로 전해지는 간절함이 책속에 있습니다.한페이지 한페이지 넘기는 것이 쉽지 않았습니다.길봄이로써 그들의 처절한 삶을 알기에..길고양이가 고양이가 되는 그날까지 함께 할 것입니다.
9791195776832,10,길고양이가 길고양이가 아닌 그냥 고양이가 되었으면 좋겠다는 마음으로 읽으면 좋을 것 같아요. 외적으로 예쁘고 귀여운 아이들은 가벼운 마음으로 편하게 볼 수 있지만 내가 살고있는 공간의 길위의 아이들에게도 따뜻한 눈길을 보내줄 수 있게 만들어줄 책이에요.
9791195776832,10,운 좋게 살아 남았다 난. 이 책을 읽으니... 우리 가까이 있는 길고양이들에 대해 다시 한 번 생각하게 되네요~.
9791195776832,10,마냥 즐겁게만 읽을 수는 없는 책이지만그래도 추천합니다우리 모두 겨우 살아남은 약자들이니까요
9791195776832,10,길냥이들에게 먹을 것을 주면서 늘 “버텨라. 어떻게든 버텨야 한다.”하고 중얼거리는 것이 습관이 되어버렸습니다. 그것은 고양이들에게 하는 말인 동시에 은근 오가는 사람들의 눈치를 봐야하는 저 자신에게 하는 말이기도 합니다. 추운 겨울 작은 생명들이 힘을 내서 잘 버텨주기를 바랍니다.
9791195776832,10,집고양이와 같이 사는 집사로서 길고양이의 처절한 삶을누구보다 잘 아는지라 마음 아파하며 작가님께 감사하며 그렇게 읽어내려가요. 책을 통해 우리나라 고양이에 대한 인식이 많이 나아지길 바래봅니다. 작가님 고맙습니다!
9791195776832,8,"출간기념회도, 부산에서 열리던데기회가 되면 참석하려 합니다.김하연 작가님, 항상 감사드리는 마음 가득합니다.조금이라도 아이들의 삶에 기적이 내릴 수 있기를.. 바래봅니다."
9791195776832,10,도시를 살아가는 현대인들이 한번은 봤으면 하는 훌륭한 책입니다. 닥치는대로 그저 묵묵히 살아가는 길위의 고양이들에게서 큰 가르침을 받을수있는 현장감있는 생생한사진과 글.. 눈물없이 보기힘들었지만 저는 질질짜는데 그치지않고 그 눈물을딛고 그들곁으로 한발더나아가려합니다. 끝으로 김하연작가님께 박수를 보냅니다 오타마저도 사랑스러웠던 유일한책
9791195776832,10,감사히 잘 보겠습니다.사람만이 사는 세상이 아님을.. 가장 가까운 길 위의 생명들...이 책을 보며 많이 가슴아프겠지만 현실이니 꼭 보겠습니다.
9791195776832,10,책을 받고 단숨에 읽으면서 많은 공감과  길고양이에 대한 아픔에 맘이 저렸다..길냥이 삶이 어찌 저리도  힘든지...작가님 항상 응원합니다..
9791195776832,10,"길냥이들을 사진찍어 그네들의 전쟁같은 삶을 여러가지 방법으로 알리고자 하는 사진작가 찰카기님의 신간! 그동안 출간했던 책들이 그러했듯 과장되지 않은 리얼리티가 고스란히 담겨있는 아깽이들의 ‘운 좋은‘ 혹은 그렇지 못함에 눈물은 그렁그렁, 짠한 마음은 아렸다. 우리의 이웃 길고양이들과의 공존하는 세상에 한걸음씩 다가가고자 이 책을 강추한다!"
9791195776832,10,‘우리 같이 견디자.‘우연히 방송을 통해 보게 된 그분이 맞는지는 모르겠지만 저 말한마디에 많은 위로를 받고 길고양이들을 보며 위로 받던 제 모습이 생각나 너무나 기대되는 책입니다. 같은 지구에 살아가는 동반자로써 이번 겨울도 무사히 날 수 있는 아기고양이들이 많기를.. 크리스마스 이브날 간절히 바래봅니다.
9791196174439,10,책이 너무 예쁩니다.. 보고 있으면 마음이 따뜻해져요. 책이 아니라 행복을 산것 같아요
9791196174439,10,‘히끄네 집‘을 통해  야옹서가를 알게 되었고 이 책의 표지를 보는 순간 그냥 읽어야겠다는 생각이 들었습니다  주문한 책이 아직 도착 전이지만 이 떨림과 설렘은 무엇인지^^ 지금 잠시 작가님 sns에 들렀는데 마음이 따뜻해집니다^^ 잘 읽겠습니다
9791196174439,10,"추운 날씨에 따뜻한 사진과 이야기로 힐링할 수 있는 책입니다. 잠든 고양이 옆에서 책장을 펼쳤는데 마지막 장을 넘길때까지 제 고양이가 아주 잘 자고 있었어요. 막힘없이 읽을 수 있는 내용과 순돌꽃비 형제와 작가님의 어머니, 아버지 덕분에 좋은 책을 읽을 수 있었습니다. 감사합니다."
9791196174439,10,"착한 냥이와 같이 늙어가고싶어져요. 주말에 베개를 안고 흑백영화를 볼때의 편안함처럼, 첫째도 두번째 책도 소장 가치를 갖는 이쁜책이예요  :-)"
9791196174439,10,겨울 추위를 녹여줄 따뜻한 이야기...어머님 모습이 저의 엄마를 연상케 해서 괜시리 눈물이 나더라구요. 보고있어도 늘 그리운 엄마의 모습은 딸들에게는 더 감정이입이 되나봅니다.
9788997137329,10,인간과 다른 종에 대한 이해와 사랑. 사람이 사람답게 살기 위헤서 할 수 있는 것들에 대해 생각해 보게 된디.
9788997137329,10,"삼겹살, 족발 가게 앞을 지나칠 때마다 슬플거다. 삼겹살, 족발 접시(뱃살, 다리ㅜㅜ)를 들고 엄지척하는 간판 속 돼지 캐릭터가 에스더 친구들이니까. 과도한 감정 이입일 수도 있다. 하지만 작은 눈으로 눈 웃음짓는 에스더가 자꾸 생각나는데 어쩌냐."
9788997137329,10,"[정말 영리한 돼지. 소중한 생명체]반려견 반려묘를 키울때는 베이컨을 먹는 것이 이상하게 다가오지 않았던 주인공.어느 날 우연히 미니돼지를 입양하게 된다. 하지만 알고보니 에스더는 사육용 돼지였던 것.에스더를 키우며 베이컨을 굽다가 이상함을 느끼며, 어느 날 갑자기 비건이 된다."
9788997137329,10,"크게 죄책감을 불러 일으키지도 않고, 이러니 채식을 해야한다고 강요하지 않는다.  책을 읽는 동안 에스더가 되지 못한, 그래서 그냥 고기가 될 동물들(?)과 육식의 습관을 돌아보게 된다."
9788997137329,10,아기돼지의 입양을 통해 채식과 동물권에 대해 인식이 확장되는 저자들의 이야기가 솔직하고 흥미롭다. 불가능해 보이던 변화를 보며 긍정적인 자극을 받을 수 있는 좋은 책이라고 생각한다.
9791187512301,10,알고 있는 내용들이지만 읽으면서 다시한번 생각해볼수 있는 시간이었습니다
9791187512301,10,#집사 냥송이(@nyangsongi)님의 책나 자신을 사랑할 시간❣️요즘 지쳐있던 나에게 필요한 말많이 들어본 말이지만 나를 위해선 한 적이 없던 위로들로 가득차있는 책 📖 힐링 100퍼센트 #고양이그림 (옆
9791187512301,10,지극히 단순하며 삶의 철학이 담긴 나를 위한 위로와 격려가 전해주는 책..오롯이 당신만의 삶에 집중하세요. 이 삶은  당신것입니다.칭찬은 고래도 춤추게 하지요.자신에게  칭찬을 주세요.사랑한다고~~
9788934982012,10,달리 달숙언니 행복하세요!
9788934982012,10,그냥 달리 귀여운 모습 보고싶어서 샀는데 찡해지는 부분이 많네요 인스타에선 알지 못했던 얘기들이 구체적으로 써있어서 좋아요
9788934982012,10,"울다가 웃다가, 시간 가는 줄 모르고 읽었어요. 책도 예쁘고 내용도 너무 좋아요. 앞으로도 달리와 달숙 언니가 행복하길 바라요!"
9788934982012,10,배송도 아주 빠르고 달리책 빨리 받아보니 좋네요!
9788934982012,8,그냥 보기만 해도 마음이 사르르 녹아 입가에 저절로 미소가 지어지는... 책을 보다가 울 멍멍이한테 달려 갔다는... ㅎ~
9788934982012,10,흑흑 인스타로만 보던 달리를 책으로 만나니 더 감동이에요! 회사에서 지칠 때마다 달리 사진 펴서 보려고요~~~ 심쿵 달리 파이팅!
9788934982012,10,달리의 귀여움이 담긴 책
9788934982012,6,귀여움에 사고야 말았다
9788934982012,10,달리 너무 귀여워요~그래서 이렇게 예약판매 get!!
9791188726196,8,"읽다보면 작가님과 고양이의 동거가 상상이가고 애뜻한마음이 잘 전달되네요~근데 이거 아무것도 모르는 사람이 보면 작가님을 이상하게 생각할거 같아욬ㅋㄱㅋㅋㅋ책 내용은 유치한 면이 있지만 재밌고 잘 읽히고, 힐링되는 그런 책이에요"
9791188726196,6,아리귀여워
9791188726196,2,"어지간하면 리뷰는 잘 안남기는 편이나,어린애 장난치는 듯한 문장에 도저히 1/3읽고 책을 접었다. 나중에 내 딸이 중학생이 되면 재미있다 할지 모르겠다. 정말 유투브로 심심풀이로 봐야 하는것을 책으로까지 낼 필요가 있을까. 심지어 같은 애묘인인 나에게도 유치하단 생각말고는....하.."
9791188726196,10,덕분에 지하철에서 시간이 겁나 빨리갔어요 ㅋㅋ
9791188726196,10,꿀잼!돈주고 사보길 잘했어요!
9791188726196,10,넘나 좋아용~
9791188726196,10,잎으로도 아리님께 열심히 물리는 집사님 기대할게요 ㅎㅎ
9791188726196,10,"책제목에서까지 주인이라고 우기시다니요~~~ 완전기대됩니다, 근데 왠지 책에 피 묻어 있을듯~ㅋ"
9791188726196,10,헐..유튭스타 아리의 책이네요~표지만 봐도 집사의 비명이 들림ㅋㅋ 기대됩니다~~~~~
9791188726196,10,저자 소개가 잘못되었군요! 아리 지음에 애완인간 감수 아닙니까!
9791188476060,8,"저는 얼마전 견주가 되었습니다.안진양 작가님이 얼마나 철수랑 아끼고 사랑하는지지극 정성으로 보살피는지 이 책을 통해 피부로 느낄 수있었습니다.저도 저희 강아지와 언제까지 함께 할 수는 없지만요,더 사랑하고 쓰다듬어줘야겠다는 생각이 들었네요.미국 여행기와 준비과정, 감동입니다."
9791188476060,10,내가 레오&또롱이 다음으로 좋아하는 인스타스타 철수❤ 책이 나왔다고 해서 늘 피드로 보던 철수를 책으로 보기 위해 구입한 #오나의철수 철수와 철수누나의 이야기를 보며 나도 모르게 미소짓게 되는 책이다. 이 책을 보며 나도 레오를 이만큼 생각하며 사는걸까? 하며 뒤돌아보게 하는 마성의 철수누나 .철수팬이어서 보게된 이 책은 날 철수누나팬으로 만드는 힘을 가진 아주 무서운책이다 . 철수누나가 노린게 이걸까? .
9791188476060,10,인스타그램을 통해서 처음 접한 귀요미 개 철수. 너무 사랑스럽게 생긴 강아지라서 철수가 아픔이 많은 강아지라고 생각하지 못했다. 철수 누나랑 철수가 지금처럼 예쁘게 지내셨으면 좋겠다. 그리고 이 세상에 철수처럼 행복한 강아지만 많았으면 좋겠다. 정말로. 철수야 너도 늘 행복하개!!!!!!!!^_^
9791188476060,10,지금읽고있는데 보는내내웃으면서보고잇어요철수가넘이쁘고❤기특하고그렇네요저도반려견 콩이 를 키우면서 되게우울했는데콩이가저한테복덩이거든요ㅎㅎ 사람들이랑관계도맺게해주고 행복해요!이책보면서 저두 콩이랑 오래오래 행복하게살고싶어요ㅠㅠ
9791188476060,10,"저자의 보살핌 속에서 행복한 나날을 보내고 있지만, 어느 순간 표정에서 혹시나 하는 얼굴이 되는 그런 상처 받은건 쉽게 없어지지 않겠죠...앞으로 좋은 주인과 남은 생까지 행복한 시간을 보냈으면 하네요^^"
9791188476060,10,"나에겐 눈물콧물 다 훔쳐가는 철수누나의 감동적인 에세이였다. 반려견을 키우는 같은 입장이지만 철수누나와 많은 반려자에 비하면 출근한 뒤에도 내 방 침대를 내가 돌아올 때까지 지키고 있는 이 작은 친구에게 나는 아직 많이 부족한 사람이구나라는 걸 느꼈고, 너무 미안했다."
9791188476060,8,"서로를 만나 성장하는 견생과 인생. 평소에 인스타, 트위터에서 즐겨보는 철수 이야기를 책으로 볼 수 있어 행복했다! 너무 사랑스러운 철수와 주인 분의 따뜻한 마음이 감동적이다. 글은 조금 아쉽지만 철수 이야기로도 충분한 책."
9791188476060,10,"철수의 행동 하나하나 알아주고 이해해주고 사랑해주는 ""진짜"" 가족을 만난 게 느껴져, 오랜만에 마음이 따뜻해지는 행복한 책을 읽었네요. 철수의 사진들을 보고 있으니 '사랑이 주는 힘'에 대해 다시 생각해 보게 됩니다. '햇볕'같은 철수 누나, 그리고 철수가 오래오래 건강하고 행복하길!"
9791188476060,10,읽는 내내 마음이 찡하고 감동적인거 같아요. 철수가 좋은 누나를 만나서 그런지 페이지를 넘길때마다 점점 철수의 행복하고 웃는모습이 많이 담겨있네요^^ 철수를 알림으로써 많은 사람들의 믹스견과 유기견에 대한 편견이 줄어들고 입양수가 늘어나는걸 느끼니 개를 사랑하는 사람으로서 행복하네요!
9791188476060,10,철수 책 잘 읽었습니다! 철수가 지금의 누나를 만나지 않았더라면 좁은 철장에서 어덯게 됬을 모르겠다는 생각을 하니 지금의 철수는 너무나도 행복한 나날을 보내고 있어서 철수누나한테 제가 다 감사드리네요! 철수누나를 만난 철수의 견생역전! 철수를 만난 철수누나의 행복한 삶을 응원합니다!
9791188476060,2,철수의 견생역전이 아니라 주인의 인생역전으로 보인다. 유기견이었던 철수를 진정 생각한다면 뜨거운 조명이 있는 촬영장과 계속 다른 옷을 입혀서 팔아야 하는 피팅 모델이 아니라 쉼이 있는 삶일 것이다. 이책의 출간 소식은 진정 반려견을 위하는 것이 무엇인지 다시 한 번 돌아보는 계기가 되었다
9788997023530,6,슬쩍 들여다본 글쓴이와 반려견의 일상. 특별할건 없었다.
9788997023530,10,인스타로 알게된 시카. 누렁이의 매력을 알게해준 아이 ^^*책 하루만에 다 읽었어여. 마음 따뜻해지는 책이에여-주위에 마구 마구 추천 중입니다 ㅎㅎㅎ
9788997023530,10,유기견에 대한 이야기를 어둡고 무겁지 않게 그리고 가볍지도 않게 밝게 잘 표현한 책!
9788997023530,10,유사한 다른 반려동물 이야기 책 많이 봤지만 ... 그 중 가장 따뜻하고 재밌고 코찡한 내용 같다. 보다가 소리내서 웃은 페이지가 많닼ㅋㅋㅋㅋ견생역전을 이룬 시카야. 항상 널 응원할게!사랑해~
9788997023530,10,제시카 심순 꺄~~넘나 심쿵...!!!!!!
9788997023530,10,인스타로 시카의 임보과정을 본 시카의 랜선친구(..?)에요.ㅎ 이렇게 시카와 시카언니 봄&루피이야기가 책으로 볼 수 있어서 너무 좋네요! 책을 보다보면 어느 새 입가에 미소가 번지고 또 지나다보면 눈가에는 눈물로 촉촉해집니다.ㅠ 제 애착책이 되어버렸어요^^
9788997023530,10,"너무 귀여운 책이예요.임보 되기 까지의 과정, 입양되는 과정까지 인스타로 봤는데 몰랐던 시카의 속 마음도 알 수 있었고 읽는 내내 너무 귀엽고 사랑스러웠어요."
9788997023530,10,요즘 읽었던 책 중에 가장 마음 따듯해지는 책이에요.잠깐 혹하는 마음으로 쉽게 입양하려하지 않고 오랜 시간 고민해온 임보언니 마음도 느껴지고시카만 아는 슬픈 과거는 다 잊고 새 견생을 시작하는 시카의 행복한 마음도 느껴졌어요.모든 강아지들이 행복해지길!!
9788997023530,10,"귀엽고, 감동적! 사랑할수밖에 없는 책!"
9788997023530,10,사랑할 수밖에 없는 예쁜누렁이 제시카 심순! 누렁이계의 히어로! 누렁이계의 아이콘!
9788997023530,10,너무 예쁘고 사랑스러운 제시카 심순 :) 제대로 힐링되는기분!
9788970656229,10,"제목부터 위트있는 책. 평소 환경에 관심이 많고 녹색연합을 후원하면서 읽게된 책으로 만화그림도 수채화처럼 자연스럽고 귀엽고, 동물의 관점에서 사람에게 환경파괴에 대해유머있게 경각심을 준다. 윤리적 강요나 환경지식정보를 퍼붓는게 아니라 새로운 시각에서 조곤조곤 재미있게 말해줘서좋다."
9791186389126,10,오늘 받았는데 옆구리 찢어진 책이 와서 교환중이라 표지와 안에 잠시 봤는데 인스타로 보다가 인쇄된 책을 받아들으니 성덕이 된 기분입니다. 고양이를 향한 작가님의 따스한 시선이 느껴지고 고양이를 반려하는 사람이 보면 좋을 거 같아요.일상의 평화로운 순간을 빛나게 하는 마법같은 책!!
9791186389126,10,웃다가 울다가 웃다가 울다가.
9791186389126,10,"사진도 그림도 글도 너무 따뜻한 책입니다추운 한겨울에 딱 어울리는 책!고양이와 함께 살고 있는 분이면 더더욱, 함께 살지않는 분에게도 더욱!! 추천 드립니다"
9791186389126,10,"냥이 셋 반려하는 집사로서 충분히 공감하며 따뜻하게 읽고 있어요^_^ 조끔조끔씩 아껴가며, 따뜻한 방바닥에서 엎드려서 귤까먹으면서 읽기에 딱좋아요 👍🏻🐾🐾🐾"
9791186389126,10,"애교냥 순둥이 맏형 째즈가 넘 사랑스러워 인스타에서 팔로우하고 폴이랑 보름이, 그리고 세영이랑 마당냥까지!! 집사님 두 분의 맘으로 아끼고 사랑하고 보듬고 한 가족처럼 지내는 모습이 늘 감동이고 웃음이 절로 나용! 이쁘고 사랑스러운 냥이들과 집사님 두 분 늘 응원합니당! 사랑합니다❤️"
9791186389126,10,많은 집사들이 인생은 고양이를 키우기전과 그 후로 나뉜다고 하죠! 인간에게 참 많은 것을 주는 동물들과 함께 교감하고 살아가는 우리들의 이야기입니다. 힐링 그 자체인 째폴보세 언제나 지켜볼께요!  째즈야 사랑해! :)
9791186389126,10,인스타로 처음알게 된 두집사님과 야옹이 형제들... 그 일상을 담은 책이 나왔다고 해서 정말 기뻤어요 좋은소식과 동시에 맏형 째즈의 부재로 마음이 아팠지만 책을 통해서 째즈를 더 오래 기억할수 있으니 그나마 다행이라 생각합니다. 째즈야 고맙고 사랑해.
9791186389126,10,"오래전부터 사랑스럽게 지켜본 고양이들~! 째즈는 고양이별에 있지만, 그 기억과 추억 간직하려 책 사보려고 들어왔어요. 스티커 욕심도 나구요^.^ 고양이를 사랑하게 된 중요한 존재의 책! 사람! 공간! 감사드려요~!"
9791186389126,10,째즈야 사랑하고 고마웠어 고양이별에서 친구들하고 잘지내고있어~세상 모든 고양이가 행복하길 바라며~
9791186389126,10,고양이가 있는 일상을 잘 담아준 책입니다 오랜 기간 함께 생활하며 고양이들의 엉뚱한 귀여운 모습을 포착해서 인스타그램 통해 자주 보다가 출간 소식 듣고 구매하게 됐어요 마당고양이들의 이야기까지 고양이를 키우진 않지만 덕분에 즐거웠던 순간들 함께 느낄 수 있어 감사했어요
9791186389126,10,"읽기가 아까운 소중한 선물같은 책이에요. 마음속 깊이 새겨두고 싶은 한구절 한구절 따뜻하고 감사한 마음으로 읽고 있어요! 책 내주셔서 진심으로 감사드립니다.  우리 모두에게 오래토록 기억될 그리고 앞으로도 더 많이 사랑받을 째즈야, 고마워!"
9791186389126,10,집사의 일상이 얼마나 행복한지 고양이가 주는 삶의 플러스요소가 얼마나 많은지더욱 더 실감나게 해주는 도서에요 제가 집사라서 너무 자랑스럽고 행복하게 만들어주셨어요^^
9791186389126,10,째즈냥께서 남긴 이 책을 소중히...한장씩 넘겨보며 오래도록 기억할게...째즈야 그곳에서도 매일 지켜봐주길...
9791186389126,10,째즈 행복하고 건강히 잘있다가 집사님 가실때 꼭 마중나와서 예쁜짓 보여줘 랜선집사이모도 덕분에 많이 울고 웃었어 많이 고마워
9791186389126,10,째즈야 고양이별에서 행복해야해!
9791186389126,10,째즈야 사랑해!
9788959135981,10,2020년 일력은 아직인가요?
9788959135981,10,작가님 블로그에서 일력이 있다는 걸 알고 바로 주문했어요 사진을 보기만해도 좋네요
9788959135981,10,사무실에 두고 쓰고 있는데 출근해서 한장한장 넘기는 재미가 있어요.일하면서 기분 나쁠 때 멍하니 고양이 보면서 힐링해요.
9788959135981,10,뜯지 않는 건 좋지만 지지하기 힘듬 것과 잘 안 넘어가요. 그리고 겹치는 사진 책과 명언이 더 많았으면 좋겠네요. 한글로도 표시했으면 월도 영어로 해주시고 영어 위주여서 아쉽 나머지는 너무 좋아요. 너무 이뻐서 찍게되요. 기분 좋고
9788959135981,10,"정말 너무 좋네요, 만년이라 더 좋고 사진도 너무 다양하고 볼때마다 웃음이ㅎㅎ 인위적인 냥이 사진보다 자연스러운 모습이 훨씬 더 사랑스럽네여, 작가님 멘트도 깨알 웃음을 줌:)"
9788959135981,8,길고양이가 다양한줄 알았는데 같은 길고양이에 다른장소로 찍은게 많아서 약간 실망했습니다.그래도 길고양이들은 모두 천사같고 예뻐서 소장하면서 힐링하기에는 좋습니다.
9788959135981,10,이용한님 사진이야 예전부터 좋아했고 만년 일력이라 더 마음에 듭니다
9788959135981,10,사무실에 놓고 하루하루 넘기면서 쓰니 매일매일 힐링하면서 일하는 기분이네요^^
9788959135981,10,"생각보다 커서 놀랬어요;; (대체 어느정도를 생각했길래;;)가격이 좀 비싸지 않나. 생각했지만 받아보고 크기와, 두께와, 사진을 보고음. 그래. 안비싸. 라고 생각함 ㅋㅋ"
9788959135981,8,"Workman Publishing가 매년 내는 고양이 일력에 비하면 종이 질과 인쇄 품질이 뒤떨어지고, 촬영자와 촬영지가 한정적이어서인지 단조로운 느낌이다. Workman의 일력 사진들은 작품급들도 많은데 이 달력은 그런 사진을 감상하는 맛이 없음. 친근한 느낌은 충만하지만."
