ISBN13,rating,review
9791197221972,10,"두 고양이의 집사로, 캣맘으로, 동물권에 대해 고민하고 실천하고자 하는 시민으로서 또 여성으로서, 큰 힘이 되는 책입니다. 저희들의 목소리가 더 커졌으면 좋겠어요! 담백하고 잔잔하게 감동을 불러 일으키는 글도 참 좋아요."
9791197221972,10,누구에게도 쉽지않은 일이었을텐데 먼저 용기내고 이렇게 책도 써주어서 고마울 따름
9791197221972,10,“누군가를 사랑하는 일은 ‘살리는 일’이다.”라는 문구처럼 작은 사랑으로도 우리는 생명을 구할 수 있습니다. 아직도 우리 주변에는 도움을 필요로 하는 아이들이 있습니다. 동물권과 더불어 사회에 대해 이야기하고 세상을 향해 목소리를 낸 작가님이 존경스럽고 저도 용기를 얻을 수 있었습니다.
9791197221972,10,평소 길냥이들에게 관심이 많았어서 관련된 책들도 사서 읽어보려고 했었어요. 좋은 책이 나와서 구매했는데 내용도 따스하고 마음에 울림을 주네요.
9791197221972,10,생명의 소중함과 함께 살아가는것에 대해서 한번씩 나를 돌아보게 되는 이야기입니다. 지나가는 길목에서  힘든 환경안에서 버티는 삶에 한번 더 귀기울여보게 됩니다. 꼭 많은 분들이 읽어보셨으면 좋겠습니다.
9791197221972,10,많은 사람들이 이 책을 보고 주변에 있는 많은 생명들에게 주의깊은 관심을 가지게 되면 좋겠습니다. 동물이 아닌 하나의 소중한 생명으로 바라보면서 인식을 바꿕갈 수 있는 소중한 계기가 될 수 있을 좋은 책입니다.
9791197221972,10,동물들을 돌보면서 이뤄지는 에세이 집이라 눈길이 갔다_개인적으로는 동물들에게 관심을 보이려고 노력하지만 생각보다 눈길을 주지않았던게 사실이고 저 나약한아이들이 저렇게 힘들게 세상을 살아가는지도 몰랐던 나에게 이책은 많은 걸 보게 했다.살아가는 길이 비단 모두에게 비쳐지길 바래본다.
9791197221972,10,누군가를 사랑하는 일은 ‘살리는 일‘이다. 이 말이 마음에 많이 와닿았다. 이 책을 읽으며 마음이 아팠고 슬펐고 세상에 이상한사람도 많다는걸 알게되었다. 캣맘은 쉬운게 아니라고 생각한다. 그래서 작가님은 더 멋있는분 같다. 동물을 좋아하는 많은 분들이 이 책을 읽었으면 좋겠다.
9791197221972,10,"* 올 겨울 “살리는 일”을 읽으며 조금은 따뜻하게 보낼수 있기를,동물학대에 관한 국민청원,뉴스를 보며 사람들의 감정이 매말라간다고 느끼는 지금 어디선가 “살리는 일”을 하고 있는 사람들 그들의 노고에 박수를 보냅니다.언제가 우리모두 동참하고 화합하는 날이 오기를.모든 생명은 소중합니다,��"
9791197221972,10,<살리는 일>이라는 제목이 참 잘 어울리는 책입니다. 평소에 이런 저런 이유로 무심하게 지나쳤었던 작은 생명이라도 다시 한 번 생각할 수 있게 했습니다. 생명을 대하는 태도에 대해 성찰할 수 있어 유익했습니다.
9791197221972,10,"고양이를 키우는 집이라 그런지 더욱 몰입해서 읽은 것 같습니다. 정말 많은 분들이 이 책을 읽어보셨으면 좋을 것 같아요. 다시 한 번 생명의 소중함을 느꼈고, 행동으로도 실천 할 줄 아는 사람이 되겠습니다! 감사합니다."
9791197221972,10,"‘살리는 일‘이라고 하셨지만, 살아가기로 결단하신 작가님의 마음이 곳곳에 서려있음이 느껴졌다.펫맘으로 살아가기, 차별주의적 벌레와 살아가기, 비건으로 살아가기, 예술로 그들을 더욱이 지켜내기. 살아갈 수 있는 환경을 만들기 위해 지켜내는 것, 그 이야기들이 이곳에 담겨 있다."
9791197221972,10,동물에 대해서뿐 아니라 ‘생명을 사랑하는 일‘ 자체를 이야기하는 책이네요. 정말 잘 읽었어요~ 주변에도 추천합니다.
9791197221972,10,동물권에 관심있고 용기가 필요하신 분들께 힘이되는 주변의 이야기입니다.꼭 일독을 권합니다.
9791187824169,10,떼껄룩은 답이다.
9791187824169,10,3000원으로 느낄 수 있는 최고의 행복:)
9791187824169,8,고양이 발페티쉬 환자들을 위한 최고의 힐링책. 가격도 너무 착하........다고 생각했으나 책 받아보니 원래 이게 정가였어야 하는 게 아닌가 싶음 ㅋㅋㅋㅋㅋㅋㅋㅋㅋㅋ 냥 환자들은 커피 한 잔 가격으로 이 책 사서 내내 힐링하세요. 다른 책 구매할 때 끼워사기도 좋다능.
9791187824169,10,아 진짜 사진 장난아냐 개짱 귀여워.ㅋㅋㅋㅋ
9791187824169,10,이 예쁜 책이 가격 재책정이 되다니 감사합니다. ㅜㅜ
9791187824169,10,정말 정말 힐링되는 사진집.냐옹이 발패치인 나를 위한 최적의ㅎㅎㅎ작아서 갖고 다니기에도 좋다. 게다가 엽서도 주고~~부작용이 있다면 냐옹이 발을 실제로 만지고 싶어서 책을 쓰다듬는다는 것?
9788986022285,10,"와우 와우 와우!!! 멋진 생각이다. 멋진 사다리이고,멋진 마을이다.멋지다. 부럽다.와우!"
9788986022285,10,네발 달린 친구들과 함께 행복한 삶을 추구하는 따뜻한 마음이 사진에 담긴 것 같아 책을 읽고 나서 내 마음도 덩달아 따뜻해졌다.
9788986022285,10,사진 한 장 한 장에 담긴 풍경에 여러 이야기를 상상해보았어요. 무척 행복했어요.
9788986022285,10,"귀엽고 사랑스러운 책.. 평범한 주택에 자그마한 사다리가 붙어 있을 뿐인데, 사진으로 보니 근사하다. 색감도 예브고 보면서 힐링"
9791197104992,10,"˝사지말고 입양합시다.˝이 책을 쓴 작가이자, 호두와 마루의 견주분은 처음 호두를 인터넷 카페에서 처음 마주하게 된다.그 후, 호두를 집에 입양해왔지만 눈에 있는 상처로 척출 수술을 받게 된다. 이로 인해 타인의 부정적인 시선으로부터 벗어나 소중한 강아지임을 알리기 위해 쓰인 책이다."
9791197104992,10,반려견을 키우는 분들은 말하지 않아도 느끼는 강아지들이 주는 그 따뜻함과 포근함을 이 책에서도 오롯이 느낄 수 있다.⠀한쪽 눈을 다쳐서 버려진 호두는 믹스견   장애견   유기견이다.⠀책의 곳곳엔 호두랑 마루가
9791196447182,10,하삼님 감사합니다. 삼색이 사랑행
9791196447182,2,생각과는 좀 다른 고양이책이네요
9791196447182,8,유튜브에서 재밌게 보던 고양이들이 책으로 나왔길래 읽어보았다. 고양이의 입장에서 쓰인 이야기는 상당히 재밌었다. 하지만 동영상으로 보는 것이 훨씬 재밌다.
9791196447182,10,삼색이!!
9791196447182,10,책 왜이렇게 잘쓰세요 하저씨?! ㅋㅋㅋㅋㅋㅋ 이렇게 귀여운 말투를 쓰는게 웃김 책 너무너무 재밌어요 감수도 삼색이랑 길막이가 해서 완벽함 ㅋㅋㅋㅋ
9791196447182,10,길막이 삼색이 다 너무 사랑스러워요ㅠㅠㅠㅠ 제 힐링 책입니다ㅠㅠ
9791196447182,10,ㅋㅋㅋㅋㅋ정은 주지않고  책까지 만들어서 팔게 되었다 ㅋㅋ
9791196447182,10,주문했는데 꼼꼼하게 검수하셔서 보내주시면 감사하겠습니다!!
9791196447182,10,"초판본의 인쇄품질이 겉표지 속지 좋지 않아 실망스러웠었습니다. 고대했던 도서였기때문에 더욱요ㅠㅠ 그치만 출판사측에서 발빠르게 대처하여 2쇄를 다시배송해주셔서 오늘 받아봤는데, 처음 기대했던 품질로 아주 깔끔하게 잘 나왔습니다. 더 선명한 사진들 보며 힐링할 수 있겠어요 감사합니다ㅎㅎ"
9791196447182,10,현명한 대처에 앞으로는 퀄리티 믿고 살 수 있을거 같아요. 평소 하x3님께서 냥이들이랑 무슨 생각하면서 노시는지 알 수 있어 흥미로웠습니다. 삼색이 야통이 연님이 마를린 도도까지 시리즈로 내주실 거죠? 기다리고 있겠습니다.
9791196447182,10,문자받고 놀랐는데 책받고 더 좋아진 선명도에 다시 놀람전에 책을 수거하고 보내주는것이 아닌 바로 재인쇄된 책을 보내주고 전에 책 또한 그대로 주문인에게 맡긴 것이 포인트같아요이런 대응 방식이 알라딘 이미지에 더욱 좋은점을부각시킵니다 책이 두권이나 생겨서 좋은구매1인 입니다
9791196447182,10,방금 2쇄 받아보았어요^^ 실은 1쇄도 어디가 이상한건지 잘 모르고 있었는뎁.. 확실히 2쇄 화질이 더 좋네요ㅋㅋ 출판사 임직원분들이 길막님께도 사과드렸대요
9791196447182,10,"2쇄 도착했어요 사과엽서와 함께요~이렇게 사과와 재인쇄로 다시 발송해주는 출판사를 처음 겪으며,죄송스럽고 감사합니다 아이들사진 따스히 잘보입니다 사진도 따스함잘느껴지구요 이번 내지선정은 매우 좋습니다. 이익이 안나실까봐 걱정이되며, 구성과 내용 정말 억지척입니다 ♡길막삼색러버♡"
9791196447182,10,2쇄 수령했습니다. 확실히 초판보다 좋네요... 새로 보내주셔서 감동입니다. 선명하고 인쇄품질도 좋습니다.
9791196447182,10,정말 평가 안달  수 없네요 ㅠㅠ 확실히 두번째 책이 사진 품질이나 편집이 더 눈에 잘 들어옵니다. 읽기에는 두번째가 훨씬 좋네요. 구독자들과 구매자들의 마음을 잘 이해해주셔서 감동이었어요!내용은 사실 유튜브를 완독을 했던 저라서 다 아는 내용이긴했어요. 비밀폴더 더 푸시지!! ㅋㅋㅋ
9791196447182,10,방금 2쇄 수령했습니다. 확실히 1쇄와 사진 퀄리티 차이가 많이 나네요. 잘못을 인정하고 다시 인쇄해 주셔서 감사합니다.
9791196447182,10,처음에 책을 받아보고서는 누런 느낌에 사진 품질이 별로라고 생각했는데.. 많은 분들 요청에따라 출판사에서 다시 만들어 보내주셨네요. 새로 받은 책은 정말 만족스럽습니다. 쉽지않았을텐데 빠른 조치에 감동했습니다.
9791196447182,10,사실 인쇄품질은 불만이였지만 내용은 괜찮아서 그냥 가질려고 그랬는데 다시 책은 주신다니 정말 감사합니다!! 책 내용은 고양이 관점에 써서 재미있습니다. hahaha님의 고양이ㆍ강아지 사랑이 잘 느껴지는 그런 책이에요.
9791196447182,10,며칠전에 받았는데 전 재미있게 잘 봤습니다.파우치도 요밀조밀하게 되어있어서  하찮은(?) 컨셉느낌나서 괜찮았습니다.
9791196447182,10,1쇄 종이재질 문제 인지하시고 곧바로 2쇄 보내주신다니 감동이네요 책 잘 읽겠습니다
9791196447182,10,빨리 받아보고싶어요 기대됩니다^^
9791196447182,10,사고싶고 보고싶어서 예약 구매했습니다.전 유튜브도본적없고 저자에대한지식도 저혀없고 들어본적도없네요ㅎ별책으로라도사진이 더많았으면좋았겠지만 출판재질때문에 다시 새책으로 보내준다니 괜히 미안해지기까지합니다두번배송에 두책까지;먼저책을 폐기하라는알라딘문자ㅜ두책모두소중히간직해야
9791196447182,10,길막♡
9791196447182,10,리콜 채고
9791196447182,6,"인쇄 품질이 너무 안좋습니다 사진첩 수준인데 아쉽네요. 파우치도,,기대이하이고.  가격을,,높이더라도,,질적인 면에 더 신경을 썼음 좋았을텐데 아쉽습니다. 고양이 시점의 글이라 색다르고 좋았습니다.봐왔던 유투브 영상이 머리속에서 재생됨ㅋㅋ"
9791196447182,10,마음이 따뜻해지는 책입니다
9791196447182,10,추운 겨울에 잠시나마 따뜻해지는 사진과 글. 행복하게 잘 읽었습니다 감사합니다 :)
9791196447182,4,1쇄는 인쇄품질이 낮고 특히 내용 중 고양이 얼굴 사진이 알아보기 매우 어렵습니다. 파우치도 잉크가 번졌는지 다 퍼져서 그냥 얼추 알아볼 정도였구요. 인쇄상태 외엔 책을 펼치기가 어렵다는겁니다. 조금만 옆으로 벌리면 다 뜯어질것마냥 펼치기 힘들어서 곤욕이었네요. 2쇄 추가배송 감사합니다.
9791196447182,8,"저도 처음 책 받아보고, 인쇄 질이 조금 낮은것에 대해 리뷰를 남기려고 했는데. 이런 문자를 받았네요. 에세이에 어울리지 않는 품질을 확인하고 2쇄본을 무료로 보내주겠다는 것인데. 우와.. 전 그냥 글만 재미있게 읽자 뭐.. 하는 심정이었는데 문자받고 기분 좋아지네요ㅎㅎ 일단 기다려 봐야겠죠."
9791196447182,10,"아 기대되여 다른 분들이 인쇄 품질이 너무 안좋다고 하셔서 서점 가서 보고 픽 해오려구요 ㅠ.....하님 유튜브 초창기때부터 봐왔다고 생각하는데 더더더 번창하셔서 울 고영희덜,하님,하님가족분덜 맛있는거 많이 사드셔여!!!!!!!!!!!!!!!!!!!!!!!!!!!!!!!!!!!!"
9791196447182,2,내용은 좋은데 인쇄품질이 너무 낮아요 표지도 너무 누렇고 이미지도 다 깨지고..........
9791196447182,8,종이재질이 ㅜㅜ 내용보다 사진이 잘안보임 근데 가격은 안 싸네 참 ..(다시 보내주셔서 별점 수정합니다!! 대처 감사합니다!!)
9791196447182,4,너무 기대했나봅니다.. 책인쇄가... 제가 온 책이 이상한줄 알았는데 원래 그런가보네요.. 누리끼리ㅠㅠ 고화질로 보고싶었는데ㅠ 책은 가벼워서 좋네요.
9791196447182,8,받아본 건 다 좋은데... 표지나 내부 종이 재질은 그닥 좋은 편이 아니라서 이상하게 보이네요.. 내용물이 부실하다는 건 사람 마다 관점이 다르니 이렇다 저렇다 할 말은 없지만... 전 누렇게 보이는 종이가 문제지.. 다른 건 좋아요!
9791196447182,2,이게 뭡니까 이미지 사진하고 너무 다르잖아요받은책은 누리끼리하고 판매하는 이미지는 너무 깔끔한게 뭔가 당한거 같은게 기분만 나빠지네요뭐하는건지 진짜
9791196447182,2,책소개글 보고 구입한건데 이건 불량 수준이네요본문에 소개된 내용에 절반도 못미치는 인쇄 품질들..전체 페이지 전부 누리끼리하고 고양이 털 색상도 제대로 보이지도 않네요하하하님과 고양이들 좋아해서 소식 듣자마자 예약하고엄청 기대했는데 실망이 큽니다..
9791196447182,10,가볍게 호로록 읽히는 글이지만 줄어드는 페이지가 아까워지는 책입니다. 표지를 넘기면 보이는 길막이로 추정되는 고양이의 사인부터 심장을 부여잡게 만드니 하하하님과 고양이들을 좋아하면 구입하지 않을 수 없는 책이라고 자부합니다.
9791196447182,10,아직 책 내용를 읽진 못했지만 안에 사진도 예쁘고 책도 튼튼해보이네요. 종이질감이 코팅되지 않고 거친 느낌이긴 하지만 사진을 생각하면 이쪽이 더 나은것 같아요. 좋은 책 내 주셔서 감사합니다.
9791196447182,4,"책 받았는데 파본인 줄 알았습니다... 다른 분 리뷰를 보니 모든 책이 이렇게 나온 것 같네요책 내용은 고양이들이 직접 쓴 것 같아서 귀엽고 재밌는데, 표지와 내지 모두 종이 재질 때문에 사진이 매우 열화되어 보이는 점이 아쉽습니다 사진 쪽을 더 기대하고 산 거라 그런지 더 아쉽네요"
9791196447182,10,출판사 사장님... 그리고 haha 님... 좀더 커다랗고 반딱반딱한 종이로 보고 싶습니다... 특별판이나 어나더 버전 내주십시오... 꼬옥...!
9791196447182,4,너무 많이 기대를 했나보네요....
9791196447182,6,이런 류의 책을 사는 이유는 첨부된 사진을 실물로 소장할 수 있다는 점이겠지요 그런데 표지의 사진이 노랗게 보이고 안의 사진들도 선명하지가 않네요 제 책만 그런건지는 모르겠습니다만 기대했던만큼의 사진이 아니라서 실망이 드네요...걍 핸드폰으로 사진보는게 더 선명할듯 싶어요
9791196447182,10,길막이. 삼색이.야통이. 빈집이등등.냥님들 넘 사랑스럽다고~~
9791196447182,10,나의 힐링<3
9791196447182,10,사랑해 삼색아 길막아 ㅠㅠㅠㅠㅠ 야통이도 사랑해
9791196447182,10,하저씨 사인에 고양이 책갈피라니 예약 할 수밖에 없다
9791196447182,10,내 고양이 좋아하는 동년배들 다 hahaha님 채널본다.
9791196447182,10,유튜브 알림보자마자 바로 와서 예약했어요 :D 캘린더도 받고 엄청 만족했는데 책은 또 얼마나 좋을지 기대됩니다! ! 다음 책은 삼색이 자서전으로 알고있겠습니다 하저씨!!
9791196447182,10,길막이는 천하와 태평이를 안좋아하는구나 ㅠㅠ 명작 느낌 대박 드네요 ㅎㅎ 하저씨는 꽃길만 걸으시고 우리 양어장 냥이들은 츄르길만 걷길 바랍니다 >3<
9791196447182,10,하하하님 유튜버 구독 좋아요 해주세용 ㅎㅎㅎ
9791196447182,10,기대하고 있습니다. 길막이 삼색이가 감수했다니 귀여워요. 언제나 유튜브 볼때마다 힐링되는기분으로 봤던 고양이들 얘기라니 안 살 수가 없었어요. ㅎㅎ
9791196447182,10,감수는 길막이와 삼색이니 다음은 삼색이 그 다음은 뉴페이스들로 기대합니다.왜 표지만 봐도 빰빠바밤 빠바바밤이 들려오는것같죠?
9791196447182,10,이얏호응!
9791196447182,10,고양이에게 정빼고 다 주시는 하하 하님이 원작이시고 길막이와 삼색이가 감수했다니 더 믿음이 가 예약합니다^^
9791196447182,10,감수 길막이와 삼색이.. 미쳐부러ㅠㅠ
9791164792726,10,애묘인들이 공감할 수 있는 따뜻한 고양이 만화
9791164792726,10,고양이들과의 일상이 세심하고 따뜻하게 그려져 있어요. 너무 귀여워 만화컷 하나하나 유심히 들여다 보게 돼요^^ 고양이를 정말 좋아하는 아이들과 두런두런 이야기하며 읽으면서 동물들과의 ‘반려‘하는 것의 의미를 생각할 수 있었고 고양이 키우려고 준비중이라 실제적으로도 많은 도움이 됐어요~
9791164792726,8,책은 저자가 고양이와 함께 살아가는 이야기를 담고 있다. 묘연을 맺으면서 이들과 함께 겪는 에피소드는 고양이를 좋아하는 이들에겐 한없이 따뜻하게 다가온다.
9791164792726,10,책을 읽는 잠시동안은 냥집사가 된 듯한 기분!
9791164792726,10,"힐링힐링~ 감동감동~ 공감공감~♥♥ 서점에서 일하는 부부가 고양이들을 키우고, 새끼고양이를 만나는 과정이 그려져 있는 만화예요. 너무 큰 행복을 주는 우리 반려동물들과의 생활을 너무나도 예쁘게 담은 만화♥"
9791164792726,10,"앉은 자리에서 긴 흐름으로 쭉 읽어버렸어요.만화라서 잘 읽히고 중간중간 귀여운 고양이 실사들을 보느라 힐링되는 시간이었네요. 한 생명체를 책임진다는 것,함께 공존하다가 때로는 아픈 헤어짐을 경험할지도 모른다는 것..반려묘를 키우는 현실을 보여줌과 동시에 따뜻한 책이었습니다"
9791164792726,10,"어느날 갑자기 우리집에 찾아와 눌러앉게된 고양이 두마리, 새끼도 낳고 집도 나갔다가 새도 잡아오고... 하루도 바람잘 날 없던 우리집 고양이와 크게 다르지 않은 다섯 고양이의 일상이 낯설지가 않았어요. 부담 없이 읽기 좋은 만화책으로 집사들, 집사가 아닌 이들 모두에게 사랑받을 책입니다!"
9791164792726,10,만화로 되어 있어서 읽기가 편했고 반려동물을 키울떄 어떤점을 고려해야하는지 생각해 볼수 있는 책이었습니다.
9791164792726,10,인간과 공존하며 살아가는 반려동물의 존재를 한 번쯤 생각하게 만드는 이야기다.
9791164792726,10,고양이를 키우는 집사 입장으로써 너무 힐링되는 도서였습니다. 시간 가는 줄 모르고 봤어요. 집사들이라면 많이 공감하면서 엄마미소 지으며 읽을 책입니다.
9791164792726,10,고양이 좋아하는 사람들이라면 단숨에 읽을 만화
9791164792726,10,"다섯 마리의 고양이의 각기 다른 모습과 성격,하나같이 너무나 사랑스러운 모습이 담겨있는 고양이 일기.고양이를 사랑하는 사람이라면 누구나 공감하고 몽글몽글한 마음이 들게 될 것 같은 책이다."
9791164792726,10,고양이를 사랑하는 집사 부부의 마음이 고스란히 느껴진다
9791164792726,8,고양이를 마냥 좋아서만이 아닌 실제로 키우며 겪을수있는 즐거운일 슬픈일 마음아픈일 행복한일 등 다양한 일상이 그려저있네요 키우지않는다면 간접경험으로도 좋을거같습니다 마냥 키우고싶어서가 아닌 책임이 따른다는걸요
9791164792726,10,고양이와 함께하는 일상이 다 들어있네요 귀엽고 행복하고 사랑스런 모든게 다 함께 있는 책 그리고 고양이를 키울때의 상식도 다 함께 들어있는 책 마음 따뜻하게 잘 읽었습니다
9791164792726,10,고양이와 함께 살아가는 모습을 편안하게 담아낸 재미있는 만화책입니다.
9791164792726,8,반려동물에 대한 생각을 하게 되는 책. 반려동물과 같이 산다는 것 그리고 (대개) 나보다 짧은 생을 살아가는 그네들의 마지막 모습을 본다는 것... 좋으면서도 한편으로는... 또 한번 반려동물에 대한 마음을 다잡게 하는 글...
9791164792726,10,동물에 대한 사랑을 간접적으로 느낄 수 있고 동물을 키우는 사람들에 대한 존경심을 갖게 하고 동물을 키우는 동질감을 갖게 해준다.
9791190473323,6,따스운 수의사님세상은 이런 사람들 덕분에 살만하다고 느끼겄ㅈ ㅣ동물 학대하는 스레기들 다 디졌으면 ㅜ
9791190473323,10,"응봉동 봉순이, 아니 오드리 엄마입니다. 출장가 있는 동안 기습적으로 아이들이 입양해온 오드리를 처음 만난 날이 생각나네요.  김야옹 선생님과 김부장님, 드러나지 않지만 정말 고양이, 강아지들을 사랑하고, 자기 계산 없이 거두고 돌보는 분들입니다. 이혼은 안 하실거에요~~ ㅎ 응원합니다."
9791190473323,10,김야옹 선생님의 빛나는 유머가 있는 에세이 재미있게 잘 읽었어요~~배경이 병원이라 에피소드마다 아픈 감동이 있어서 울다 웃다 했어요.또 남다르게 열심히 사는 김야옹 선생님과 김부장님~응원합니다~~^^
9791156623052,8,책 내용은 너무나 감동적입니다. 몇번을 읽으면서 눈물 흘렸어요.도서관에서 대출해서 읽다가 소장하고 싶은 마음에 알라딘에서 책을 주문했는데 책 뒷면에 검댕 같은 게 묻어있네요. 출판사의 책 관리가 아쉬워요.
9791156623052,10,집에 개를 3년째 키우고 있어 늘 개에 대한 관심은 많아 우연한 기회에 보게 된 책인데...강아지 치료하며  함께 지내는 이야기가 마치 우리집 이야기인것 같아 정말 공감되었습니다.참 재밌다 보다는 흐뭇해 지는 책이었습니다...~~~
9791156623052,10,그의 관심과 사랑의 대상이 남들과는 다르게 특별하기에 맞닥뜨리게 되는 문제도 있지만 그래도 유쾌하게 풀어낸 점이 보기 좋다.
9791156623052,10,작가의 동물을 사랑하는 마음이 잘 담겨 있고 반려견이 단순한 동물을 떠나 인간에게 어떤 의미를 주는 존재인지 다시 한번 그 중요성에 대해 생각해 보게 됩니다.
9791156623052,10,헤리엇 이야기가 지금 나에게 가장 필요한 이야기가 아닌가 싶다.
9791156623052,10,재임스 헤리엇이 선보인  4부작 시리즈에 실렸던 이야기들 중에서 개에 대한 글들만 따로 엮은 것으로 수의사인 헤리엇의 입장에서 보면 개이야기는 어쩌면 헤리엇과 가장 밀접한 관련을 맺을 수 박에 없을것 같아요. 반려견으로 거듭나는 개와의 교감을 다룬 이야기라 더 좋았습니다.
9791156623052,10,수의사 해리엇님의 따뜻한 마음이 느껴지는 개이야기를 통해 마음의 벗으로 거듭난 반려견에 대한 이야기를 만날 수 있어 좋았습니다. 인간과의 교감이 가장 뛰어나다는 개에 대한 여러가지 이야기들 재미있게 보겠습니다. 기대되는 책입니다.
9791156623052,10,애완견과 인간과의 교감이라는 멋진 이야기라 따듯한 느낌을 많이 받을 수 있는 것 같네요.
9791156623052,10,동물에 대한 애정이 넘치는 가슴 따뜻한 이야기입니다. 애견인이라면 더욱 재미있게 읽을수 있을 것 같아요.
9791156623052,10,반려견들에 대한 애정이 넘치는 이야기들이라 읽으면서 기분이 좋습니다
9791156623052,10,"인간과 동물이 교감하는 방법을 알려주고, 동물을 사랑하는 마음이 진실되게 표현되어서 참 좋은것 같습니다."
9791156623052,10,동물과 사람곽의 교감만큼 큰 힐링이 되는 이야기도 또 없더라고요. 그런 수의사 해리엇의 이야기라서 더욱 좋은것 같아요.
