ISBN13,rating,review
9791190427180,10,바로 주문했습니다ㅜㅜ 시간 왜이리 눈치없냐 알아서 빨리빨리 12월 중순 되어야 하는 거 아니냐ㅠㅠ 똥괭이네 책 너무나 기대됩니다ㅠㅠ
9791190427180,10,유투브 알람 보자 마자 알라딘 접속!
9791190427180,10,"이삼님 덕분에 스물 두마리의 고양이를 볼 수 있고 또한 좋은, 선한 영향력이 더 넓게 퍼져나갈거라 저는 확신합니다. 책이 나온다는 소식에 눈물부터 펑펑 쏟아내게 되네요. 책을 읽는 내내 마음이 얼마나 아플지 얼마나 흐뭇하고 따뜻해질지 기대가 됩니다."
9791190427180,10,기다리고 기다렸던 사랑해요 감사해요 예약합니당
9791190427180,10,"너무 기대됩니다. 책도, 유튜브채널도 모두모두 잘 되시고 이삼님과 똥괭이들이 항상 행복하길 바랍니다~"
9791190427180,10,예약 알림문자 받고 얼른 뛰어 왔습니다! 22똥괭이들 이야기 드디어 책으로 나오는군요.책으로 접하는 똥괭이들의 이야기는 어떤 느낌일지 기대가 많이 됩니다.
9791190427180,10,고대하던 책이 드디어!!! 평소 이삼님의 자막 센스와 스토리텔링 능력 귀여운 똥괭이들의 사진 일러스트 작가님의 몽글몽글한 작화까지 믿고 볼 책이에요! 한 글자 한 글자에 똥괭이들에 대한 이삼님의 애정이 뚝뚝 묻어날 것 같아 더 기다려져요!!
9791190427180,10,22똥괭이들아 이삼 집사님 너무너무 사랑해요!!!❤
9791190427180,10,벌써 눈물 줄줄예약이네요 22똥괭이들과 이삼님 사랑해요 이삼님이 계좌를 안열어주시니 책값이라도 통장에 넣어드려야지요....열심히 구매하고 홍보할게요 행복하세요ㅠㅠㅠㅠㅠ
9791190427180,10,기다렸던 책 드디어 나오는군요 벌써부터 눈물예약입니다ㅜㅜ
9791190427180,10,으악! 요즘 바빠서 유튜브 못보고 있었는데..문자로 알라딘 신간 22똥괭이네... 바로 알라딘 접속 ~ 당연히 사야지요..사랑입니다~~~~~
9791190427180,10,흡 주문하고 아직 읽어보진 못했지만 벌써 눈물 한바가지22똥괭이들 사랑하고 이삼님 사랑해요❤️
9791190427227,8,알라딘에서 우연히 책을 빼들었는데 그자리에서 다 읽어?버렸다. 인생은 짧고 고양이는 귀엽지. 인정.
9791190427227,10,작가님 사진과 글은 따라올자없지길에 태어난 우리의 이웃 길고양이
9791190427227,10,제목부터 절 이끌리게했네요. 사진과 함께 글이 다정하고 따스웠습니다. 이용한작가님 책은 언제나 구매하게 되네요. 이세상 모든 길냥이들이 행복하고 건강했으면 하고 바랍니다:)
9791190427227,10,그저 귀여운 사진집인줄로만 알았다. 중간중간 길지않게 길위에서 태어난고양이들의 이야기가 써져있는데 나는 고양이를 사랑하고 반려하는 집사로써그 짧은 글에 씌여진 아기고양이와 어미고양이에게감정이입되며 무던히도 슬퍼지던지
9791190427227,8,"고양이는 귀엽고 작가의 글은 빛나지. 지구에서 가장 아름다운 생명체 고양이, 그 고양이의 빛나는 한때인 아깽이 시절을 담은 사진을 보고 있으면 저절로 힐링이 된다. 사은품으로 주는 탁상달력과 함께 선물용으로 구입했는데, 앉은자리에서 다 읽음."
9791190427227,10,힘든 삶을 견뎌내야 할 길아가들이지만 마냥 슬프지많은 않은 것은 작가의 따뜻한 시선이 반영된 때문일 것이다. 훌륭한 고양이는 끝까지 살아남는 고양이라는 말이 와닿는다. 끝까지 버텨라 귀요미들아.
9791190427227,10,너무 너무 귀엽다아깽이 달력도 너무 귀엽다정말 인생은 짧고 고양이는 귀엽다!
9791190427227,8,페이지가 프레임이 있는 구조라 사진이 조금 답답해보여요. 그래도 사진에 글씨나 낙서가 없어서 좋네요. 고양이는 무척 귀엽습니다.
9791190427227,6,"책 내용은 좋아요. 사진은 두말 할 것 없구요.문제는 인쇄. 인쇄가... 별 3개를 빼고 싶을 정도입니다책 완성본 받고 저자가 속상하지 않았을까, 라는 생각이 들 정도네요.   사진이 중심인 책인데 값을 올리더라도 사진을 즐길 수 있게 해줘야 하는 건 아닌가요"
9791190305600,10,에세이로 편하게 만난 인생 사부님 말씀 같아요
9791190305600,10,음악에 대한 애정이 느껴지는 글과 그림들
9791190305600,8,스노우캣이 추천하는 음악을 찾아 들으면서 음악추억여행을 같이 하다
9791190305600,10,스노우캣의 매우 강렬한 음악 에세이
9791196174460,10,반려의 의미를 곱씹게 하는 수작.
9791196174460,10,"집사라면 누구나 공감할 수 있는 이야기들이 진솔하게 쓰여있습니다.읽는 동안 감정이입과 동감되는 내용들이 많고 저자만큼 순살탱 가족들을 사랑하게 됩니다.거창한 이야기는 없지만, 생명의 소중함을 다시 한번 일깨워주고,  소소한 일생이 주는 삶의 의미를 생각하게 합니다."
9791196174460,10,"동물을 지금과 다르게 ‘산다‘는 개념으로 받아들였던 그 시절, 그 때 했던 실수로 현재 작가님의 많은 생각과 진심을 담아 적은 책입니다. 있는 그대로 집사의 마음을 느낄 수 있었기에 아직 고양이를 받을 준비가 되지 못하셨던 분에게 추천합니다. 또한 작가님의 ‘삶‘에도 한걸음 다가갔습니다."
9791196174460,10,순살탱들과 집사님 맹렬한 팬입니다!! 인스타에서 순구때부터 열심히 응원해왔어요~ 책이 나오다니 너무 좋네요! 저도 자가면역질환때문에 늘 지치고 우울했는데 집사님 보며 많은 용기와 힘을 얻고있어요~ 집사님 가정과 아가들에게 언제나 행복이 깃들길 바라며! 잘 읽겠습니다♡
9791196174460,10,정말 마음 따뜻해지는 이야기에요집사님 정말존경스러워요!!순살탱 오래오래건강하게 살자!!
9791188200726,10,"오늘 선물 받아서...... 지금 읽고 있는데... 계속 싱글벙글 중 입니다. ^^~! 무료할 떄, 울적할 떄, 내 마음의 자가치유가 필요 할 떄.......책장에서 슥~~ 꺼내... 잡히는대로 아무 페이지를 펼처서 5~10분 읽다보면 행복해질거 같은 책이에요."
9791188200726,6,고양이들이 점원인 서점이라니 상상만해도 너무 귀엽잖아 꺅~~
9791188200726,10,쿠로 시로의 귀여움이 다 해버렸어요...
9791188200726,10,"키득키득거리며 읽다 보니 어느새 마지막 페이지...ㅠㅠ재밌어요. 쿠로도 시로도 넘 귀엽구요. 꼭 보세요, 꼭!!"
9788997137336,10,7살 딸아이와 함께 읽었어요  아름답고 귀여운 그림이 아이의 시선을 사로잡았고요.  따스한 글귀가.. 부드럽게 제 마음을 모두 표현해줘서 위로 받은 기분이 들었어요.  오래오래 소장하면서 마음이 힘들때마다 함께 하고 싶어요.
9788997137336,10,사람이 죽으면 먼저 간 반려동물이 마중나온다는 얘기를 들은적이 있다. 하지만 그 이야기는 내게 너무 막연했다. ‘우주식당에서 만나‘ 이 말은 어찌나 위안이 되는지 모른다. 우리 희동이가 마중나와 기다릴 곳이 우주식당이구나. 진짜로 만날 수 있겠다. 참 다행이야.
9788997137336,10,"우주식당에서 만나,짧지만 긴 여운이 남는 그런 그림책이이예요. 우리가 고양이를 만나서 얼마나 소중한 시간들을 보내고 있는 지 살다보니 잊고 있었던 부분을 생각나게 만들어 줬어요.삽화를 그리신 일러스트 작가님도 고양이집사 이셔서 공감되는 그림, 귀여운 그림 감사합니다."
9788997137336,10,눈물이 또르륵 흐르다가 결국은 굵은 눈물 쏟아내게 만드네요. 우리 모두 “우주식당”에서 만나요.
9788997137336,10,나도 꼭 우주식당에서 만나고 싶은 고양이가 있어요.  이 세상에서 나를 제일 사랑해주었던 나의 고양이. 너무 서툴고 잘 몰라서 잘 해주지 못해서 미안해.
9788997137336,10,"7년차 집사입니다. 고양이와 살면서 변한 내 모습, 동물들을 보며 애정을 보낼 수 있는 사람이 된 것을 책을 보며 다시 깨닫고 공감할 수 있었습니다. 반려인이거나 반려인이었던 분들은 10번 읽으면 10번 다 울 수 있을 그런 따뜻한 책."
9788997137336,10,"반려동물을 가족으로 맞아들이고, 같이 살고, 떠나보낸 사람들이 읽으며 엄청 공감할 책. 그림 안에 따뜻한 마음이 느껴져요. 압축적이고 정제된 글은 한 편의 시같아요. 반려동물과 함께 살지 않는 친구들에게도 선물했어요."
9788997137336,10,작은친구들이 주는 기쁨과 슬픔에 대한 이야기. 그 아이들을 알기전과 알고난 후의 내 삶의 변화를 돌이켜보게 된다. 먼 훗날 나의 소중한 아이들을 우주식당에서 꼭 만나기를 열심히 바래본다.
9791187496878,10,강아지를 10년 키우는 강쥐맘으로도 많이 공감이 되었다 고양이를 먼저 만났다면 나도 그랬을거 같다
9791187496878,10,고양이 이야기는 언제나 진리. 이용한 작가의 글도 진리. 웃다가 울컥하다 짠하다 막 그렇다.
9788934980872,10,기분이 말랑말랑해지는 책.
9788934980872,10,식빵 고양이의 이런 비밀이...!매우 기분 좋은 그림책
9788997137282,10,흑백사진이 좋았다. 윤기도 숱도 적어진 털보다 눈에 더 집중할 수 있어서. 눈을 바라볼 수 있어서. 평소 우리 개한테 '눈이 호수인 우리 금동아'라고 부르는데. 정말이지 개들의 눈망울은 맑은 호수 같다. 나이가 들어도 그렇다.
9791196174408,10,읽고싶어요~^^
9791196174408,8,히끄도 귀엽고 글도 잘쓰시네요 :) 책에서 따듯함이 느껴집니다. 잘봤습니다.
9791196174408,10,고양이를 사랑합니다.  언제고는 고양이와 함께 살고 싶은 꿈을 가지고 있어요. 지금은 히끄의 매력에만 빠져있지만요. 알레르기가 갑자기 사라졌음 좋겠어요.
9791196174408,10,히끄야 고마워!!
9791196174408,10,고양이로 인해 새로운 인생을 살고 있습니다
9791196174408,10,정말 사랑스러운 책입니다 동물과 인간의 바람직한 공존을 보여주는 반가운 책이예요^^
9791196174408,8,길 위의 생명들이 사람과 함께 어우러져 살아갈 수 있는 세상이 오기를...
9791196174408,10,"어떤 존재를 알게 되고, 가까워지고, 사랑하게 되고, 정들고, 그러다가 그 존재가 거의 모든 것이 되는 과정을 히끄를 통해 담담히 보여준다. 히끄 때문에 내내 미소지으면서 읽다가 어느 순간 눈물이 나는 신기한 책. 우리 냥이들과의 첫 만남도 떠오르고 그만큼 책임감도 더 커진다. 히끄야 건강해!"
9791196174408,10,얼마나 많은 고양이들이 얼마나 많은 저마다의 영혼을 구원하고 있는지를 생각하면 이유없이 코끝이 시큰해진다. 이건 한 사람을 구원한 고양이와 그 고양이에게 구원받은 인간의 사랑스러운 이야기이다.
9791196174408,10,최근 들어 읽은 고양이 에세이 중 가장 좋았습니다. 몰입도 최고!
9791196174408,6,아들과 도란도란 함께 읽은 책이란 것만으로 아름답게 기억될테다.
9791196174408,6,"한 권의 책이 사람을 변화시키긴 어렵지만, 한 마리의 고양이가 인생을 바꿀 수는 있습니다. ^^"
9791196174408,10,히끄한테서도 힐링을 받지만 히끄아부지가 쓰신 글도 뭔가 위로를 받는 느낌이에요. 담담하게 써내려가신 글이 뭔가 좋았어요. 등신대도 너무 귀엽고^^
9791196174408,10,역시 소문대로 재밌다. 히끄의 얼굴형이 귀엽고 히끄 자체로도 매력있지만 저자와 히끄가 함께 성장하는 드라마가 있어서 좋다.
9791196174408,10,하루에 조금씩 읽고있습니다. 힐링되어 좋습니다.
9791196174408,10,책을 보면서 계속 미소가 지어진 건 오랜만이네요.읽기만해도 마음이 따뜻해지는 책이었어요 잘 읽었습니다.
9791196174408,10,사진도 이야기도 히끄도 너무 좋아요
9791196174408,10,무한한 매력을 가진 고양이 히끄와 제주도 시골마을의 소박한 풍경이 보기만 해도 마음에 위로와 평안을 주네요
9791196174408,10,고양이를 너무 좋아하지만 사정상 직접 기르지 못해 다양한 고양이 서적으로 대리만족 하고 있는 제게 있어 새로운 보물 같은 책입니다. 고양이 히끄만의 매력도 넘쳐나지만 집사와의 케미도 읽는 사람을 행복하게 만드는 느낌이 넘쳐납니다.
9791196174408,10,범상하지 않은 매력의 소유자 히끄와 그 아부지의 엄마 미소를 부르는 이야기들이 넘쳐납니다. 히끄의 귀엽고 시크한 사진만 봐도 시간 가는줄 모르겠네요.
9791196174408,10,소리없이 소복이 내려앉은 흰눈처럼 히끄도 히끄아부지도 서로에게 그런 존재가 된거 같아요..히끄와 히끄아부지 덕분에 주위를 더 돌아보게 됩니다
9791196174408,10,한장한장 히끄를 사랑하는 사람들의 마음이 절절히 느껴지고 와닿았다 묘연은 정말 존재하는구나 생각했고 히끄로 아부지를 포함한 많은사람들이 행복할수있구나 싶어 나도 더없이 행복해졌다.
9791196174408,10,길냥이 두마리를 기르는 집사로 산뜻한 책을 만났네요
9791196174408,10,히끄와 히끄아부지 이야기. 너무 사랑스러운 책이예요~
9791196174408,10,등신대 받으려고 지금 주문합니다 ㅠㅠㅠㅠㅠㅠㅠ히끄야 ㅠㅠㅠㅠㅠ
9791196174408,10,아이를 키우면서 내가 자라고 내가 더 많이 사랑받음에 가끔 놀라울 때가 있다. 히끄아부지에게 히끄는 그저 지켜주고 싶은 존재가 아니라 서로 얼마나 의지하고 서로에게 좋은 영향을 주고 있는지 그 잔잔한 따뜻함이 이 책의 글과 사진에는 묻어 있다. 마음이 힘들 때 다시 열어보게 될 책이다.
9791196174408,10,사랑둥이 히끄~!~~ 얼른 읽어보고 싶어요
9791196174408,8,히끄에 대한 아부지의 애정이 느껴지는 책
9791196174408,10,히끄는 사랑입니다~~~♥
9788997137220,10,개똥승은 스님과 강아지의 그림일기다. 그림이 귀엽다. 글이 짧고 단어는 어렵지 않다. 하지만 여운은 길고 담긴 뜻은 깊다.
9788997137220,10,개를 키우며 똥을 줍는 스님. 개를 먹이며 삶을 새로 바라보는 사람. 개하고 한집살이를 하며 사랑을 새삼스레 깨닫는 하루. 이야기책 《개.똥.승.》은 시원시원하면서 즐거운 마음결로 뭇목숨을 사랑하려는 따사로운 손길은 어디에서 비롯할 수 있는가 하는 대목을 곱게 잘 짚는다. 어여쁘다.
9788997137220,10,혐오가 아닌 사랑으로 동물을 바라봐주세요
9788997137220,10,마음이 따뜻해 지는 책입니다.동물이아닌 생명을 어떻게 대해야 하는지 삶의 방향은 어떤것인지를 느낄 수 있습니다.
9788984075726,4,번역의 문제인지 특히 부록에 비문이 많아 한 번에 읽히는 책은 아니었습니다. 수록된 정보가 정확한 내용인지 따지는 것보다 가볍게 재미로 보기엔 좋은 것 같네요. 귀여운 책입니다.
9791188862283,10,"연말연시 선물로도 딱인, ‘함께 행복하기’에 대한 책. 귀여움은 덤이다."
9791188862283,6,몇 년 전부터 트위터로 구독하고 있던 참에 한국어판이 나온대서 바로 주문했는데 제본 상태가 너무 실망이네요. 이원영님 추천사랑 저자만 보고 질렀는데 어쩐지 가격이 너무 싸더라ㅠㅠ
9791196688332,10,"나의 최애종 시츄. 물론 개는 종을 가리지 않고 좋아하지만, 굳이 꼽자면 그렇다. 시츄인 우리 희동이 때문이다. 동그랗고 까만 눈과 코, 순둥순둥 성격. 아, 생각만 해도 예뻐라. 태수를 보며 희동이 생각이 났다. 책 속 태수 사진을 쓰다듬으며 '울 애기, 보고싶다'라고 말했다."
9791196688332,10,"앞서 읽은 애완동물에 관한 책보다,,,훨씬 와닿는 책크크소리내면서 웃음이래서 견주들이 집사들이 그랬구나ㅎㅎ10분 순삭ㅎ"
9791196688332,8,모든 에피소드마다 에세이가 달린 건 별로...굳이 같은 내용을 만화로 보고 또 글로 읽을 필요가 있나 싶다. 만화에서 못한 얘기만 중간중간 껴 넣으면 좋을 듯 싶은 건 개인 취향. 그건 그렇고 5년전에 무지개다리 건너간 울 애기가 자꾸 생각나는 에세이툰이다..왜 자꾸 눈물이 나지 ㅠㅠ
9791196688332,10,강아지를 좋아하는 사람이면 누구나 공감할만한 책입니다. 유리컵도 예뻤고 책도 마음에 들어서 한권을 더 사서 선물했어요. 모든 컬러사진에다 책의 내용이 너무 좋아서 돈이 전혀 아깝지 않은 소장용 책입니다!
9791196688332,10,에세이도 있어서 좋았어요~
9791196688332,10,"한 쪽에 잉크가 묻어있어서 교환신청 했는데 아주 빠르게 처리해주셨어요. 워낙 좋아하는 작가님인데 태수컵도 정말 귀여워요. 이 책을 보면 이런저런 걱정, 근심이 사라지고 마음이 편안해져요. 태수에 대한 작가님의 애정, 작가님에 대한 태수의 애정이 고스란히 묻어나서인가봐요."
9791196688332,10,잘 읽겠습니다.컵도 귀여워요.배송진짜 빠르네요. 바로 다음날 도착했습니다.
9788934929994,6,이것도 완독 포기. 레싱 특유의 냉소적인 글쓰기가 조금은 흥미를 끌었지만 아무래도 시간차가 있는 듯 지금의 내게는 다가오는 내용이 별로 없었다.
9788934929994,8,"고양이의, 고양이에 의한, 고양이를 위한 글. 레싱의 글은 담담하다 그런데도 고양이에 대한 애정이 물씬 묻어나온다. 관찰력과 표현력이 얼마나 뛰어난지 눈앞에 야생 고양이들 삶이 그려지는 듯하다. 집사들이라면 공감할 내용들도 많다. ‘고양이와 함께 사는 것은 정말 대단한 호사이다’"
9788934929994,10,고양이를 바라보는 시선에 담긴 사랑을 글로 표현한 책
9788934929994,10,고양이를 키워본 적 없는 사람도 독실한 집사가 된 듯 내 곁에서 기분 좋은 소리를 내는 고양이에 대한 상상을 하게 만드는 책
9788934929994,10,도리스 레싱의 추리소서을 좋아하는데 기대됩니다.
9791186372753,6,잔잔하니 좋은 일기를 본 기분이네요.
9791186372753,10,어지럽고 극단적인 속도 속에서 더없이 그리워지는 정서. 세월이 흐를수록 더 가닿고 싶지만 그럴수록 멀어질까 봐 이러지도 저러지도 못하는 정서가 담겼다면 비약일까. 지금은 없는 일본의 저 정서가 요즘 들어 안타깝게 느껴집니다. 더없이 봄에 어울리는 책.
9791186372753,8,"노라를 기다리면서 쓴 일기들은 특이할 것 없는 일상의 반복이어서 다소 단조롭다는 느낌이 들었지만 쿠르가 햣켄 선생의 마음에 들어오게 되는 과정과 떠나가는 과정이 고양이를 키우는 입장에서 크게 와닿았습니다. 김효은 씨 그림 좋았고요, 햣키엔 수필에서 보여준 죠크를 기대했는데 없었네요."
9791186372753,10,이 책을 보며 당신과 나 사이의 경계가 고양이가 사람에게 스미듯 그랬으면 좋겠다는 얘기를 했다.
9791162143261,10,"읽는 내내 마음이 따스해지고 평화로워지는 느낌이 가득했어요.⁣*^^*아직 다 읽지는 못했지만,⁣두고두고 아껴 읽고픈 건, 어떤 마음일까요??⁣"
9791196714703,10,따스하고 훈훈한 고양이들과 집사들의 이야기. 참 좋다.
9791196714703,10,깊이 생각하지 않고 가볍게 읽을 수 있는책이다. 에피소드 하나 하나 그 누구도 사랑스럽지 않은 이야기가 없다. 소중한 시간을 함께 보낼 책으로 추천한다
9791196714703,10,"고양이라서 고마워.나의 고양이가 되어줘서 고마워!​​​한 편 한 편 냥줍 혹은 입양 에피소드를 읽으며 눈물이 글썽이기도 했고, 사진과 함께 보니 더욱 귀여워 심장 아프기도 했다. ‘우리는 인사를 했고 평생 함께할 거야‘ 는 힐링 도서라고 표현하면 딱 좋을 것 같다. 세상의 모든 고양이들 건강하고 행복하자!"
9791196714703,10,정말 덜컥 사랑에 빠져버린 이야기네요.그 어떤 로맨스 소설보다 더 따뜻하고 포근한 에세이라고 생각해요.일러스트도 너무 귀엽고 안에 사진이며 다들 자신의 고양이를 얼마나 사랑하시는지 알 수 있어서 읽으면서 찡했어요.
9791196714703,10,지금은 가족이된 거리의 작은 생명과 인간의 따뜻한 만남.  고양이처럼 사랑스런 디자인의 예쁜책! 전자책을 선호하지만 이 책은 종이책이라 좋아요.
9791196714703,10,"어느 한 편도 눈물 나지 않는 이야기가 없네요. 기뻐서, 짠해서, 감동적이어서... 아이에게 밤마다 한 편씩 읽어주려구요."
9788969523808,10,비록 집안에서 키우지는 않지만 마당에 길냥이가 어느새 새끼냥이들까지 포함 6마리가되었다 조금씩 정을 주다보니 나도 마치 집사가 된것같다 아무것도 모르고 냥이들에게 법만주는데..홍조는 참말 복받은냥이다 이리 귀여운 집사와함께살다니.두 주인과냥이의 캬미가 찰떡인 생활을 보고싶은분추천!
9788969523808,4,글씨가 진짜 너무 작아요.... 가독성이 많이 떨어집니다
9788969523808,10,아기자기하고 귀여운 책이네요. 요즘 같이 집에서 보내는 시간이 많을 때 읽으니 마음도 편안해지는 것 같아요. ^^
9788969523808,10,"<홍조일기>를 통해 이미 홍조를 만난 사람이라면, 또는 홍조를 모르더라도 애묘인이라면 엄마 미소 지으며 볼 수 있어요. 홍조 만수무강해!"
9788969523808,8,글씨가 느므 깨알같긴 하지만 귀여운 글씨체네요. 읽다보면 꽃도 찻주전자도 사고싶은 욕망이 생기는 한 권이였습니다 ㅎㅎ  77페이지에는 반복되는 문장이 있는데 오자인가요. 홍조는 계속 귀엽네요 ㅎㅎ
9788969523808,6,홍조의 팬으로서 너무 아쉽습니다 책 재질이나 색감은 홍조일기때와 비슷해서 좋은데요 그림과 글씨가 너무 작습니다 이럴거면 폰에서 읽고 말지 굳이 책을 사는 이유가 무엇일까요? 폰에서 보다 그림을 더 크게 감상하고 싶고 소장하고 싶은 욕구가 있지 않을까요?
9788997137398,10,모든 페이지가 한 가지 생각을 하게 합니다. 우리집 냥님들 더 많이 사랑해주자고요.
9791196174453,10,크리스티나 마키바 계정에서 홍보 포스트 보고 주문했습니다.  _  잔뜩 기대중이예요.
9788956253824,10,행복해지는 고양이 그림책! =^.^=
9788956253824,10,"고양이 그림책 중에서 젤 이쁘다 ㅠㅠ<또 고양이>도 글코 이것도 글코, 고양이 한 마리 한 마리가 다 우리 집 고양이 같다!"
9788965708605,10,노견을 키우고있는 나로서는 정말 눈물 없이는 읽을 수없었다. 즐겁고 유쾌하지만 감동적이고 슬픈 책. 두부야 보고싶다.
9791196174446,6,"핸디북의 장점도 있겠지만 크기 자체가 작다보니, 사진도 작고 글씨도 작습니다. 판형을 좀 더 크게 해주셨으면 합니다."
9791196174446,8,이와고 미츠아키님의 전에 나왔던 책이 좋아서 이름을 기억하고 있었어요. 이번 책도 사진이 무척 마음에 듭니다.
9791196174446,10,고양이를 보기 위해 떠나는 여행이란 한편으론 무계획적이고 목적없는 여행일 수 있지만 이 여행은 어느 곳에나 존재하는 고양이의 느긋함과 평화로움을 느낄 수 있다. 고양이들의 삶에 대한 노하우를 가까이 들여다 봐야지 고양이를 찍을 수 있다. 현실에 갇혀 앞만 보며 살아온 현대인들에게 강추.
9791188053667,10,"고양이집사로써 보는내내 계속 맞아맞아, 완전 내 얘기네 하면서 본 책입니다 :) 인스타그램을 그림과 글로 풀어놓은거 같은, 너무나 공감가고 따뜻한 책이였습니다 그림뿐 아니라 사진과 같이 있으니 보는 재미가 더더욱 많은거 같은, 정말이지 소장 가치 충분한 책이라고 추천드립니다"
9791188053667,10,"실제로 고양이를 키우지는 않지만, 보는 내내 공감이 가는 마음 따뜻해지는 시간이였습니다.어찌나 아이들이 귀여운지 보면서 키득키득 거리던게 정말 오랜만이였네요"
9791190427777,10,남극까지 가는 것도 쉬운 일이 아닌데 대단하다....  펭귄의 사진을 보면서 힐링 받으면서 행동의 의미도 알 수 있어서 공부가 되었어요. 지금 코로나 땜에 남극도 못가는데 그 펭귄들은 잘 지내려나...?ㅠㅠㅠ
9791190427777,10,사진이 진짜 좋아서 소장하고 싶다. 그래선지 중고책도 없네;; 직접 펭귄보러 남극가보고 싶다! 나의 버킷리스트 하나 추가!
9791190427777,8,힐링북. 이원영 박사의 ‘펭귄 사진일기‘. 애니메이션 <해피피트>의 실사판이랄까. 침대 맡에 두고 쉼이 필요할 때 언제든 꺼내서 읽고 싶은 책이다. : )
