ISBN13,rating,review
9791164133062,10,찐이 사진 넘넘 이뻐요. 사진들이 정감있고 푸근해요.저희 냥이들도 냥줍한거라 짠하네요. 고양이 학대하시는 분들 이해부탁드려요.  나쁜 동물 아니에요!달력도 잘쓸께요.
9791164133062,10,따뜻한 글과 사진 잘 보았습니다. 길에서 사는 많은 고양이들이 올 겨울도 무사히 살아내길 바라며 인간들과 평화롭게 공존하길 바래봅니다. 다음 책도 느긋하게 기다리겠습니다.
9791164133062,10,마구마구 추천하고 싶은 책~~
9791164133062,10,고양이와 사람이 서로에게 위로와 기쁨이 되는 순간들을 담은 사진과 글들을 보며 세상 곳곳에 그런 모습이 가득하길 바랬다.
9791164133062,10,찐이와 할머님과의 따뜻하고도 슬픈 사연을 알기에 이 책이 너무 반갑네요.작가님의 사진에서는 골목에서 찾아낸 영롱한 빛깔들이길고양이라는 아름다운 생명체들과 어울어져마음에 울림을 줍니다.
9791164133062,10,꼭 보셨음 좋겠어요 사진도 내용도 다 좋았고 ...사라지는 것의 추억과 미안함과 아쉬움이 느껴졌습니다
9791164133062,10,찐이와 할매가 얼마나 따뜻한 시선으로 담겨있는 지 알 수있고 가슴 뭉클한 한편의 스토리도 있는 책이다.  드디어 나왔다.
9791196688301,8,우리들의 올드독 풋코. 언제나 너의 건강을 빌게!
9791196688301,10,대상화를 경계한다는 작가의 인터뷰가 인상깊다.아름다운 해석이나 스토리텔링이 없는데도맑은 여운이 길게 남는다.
9791196688301,10,미쳤다 정말그렇게 책을 사도 리뷰안다는디세페이지 읽다 장바구니에 2권넣고좀더 읽다 리뷰남김반려인은 폭풍공감이고비반려인도 반려인의 삶을 고스란히 느낄듯
9791196688301,10,담담한데 귀엽고 슬프고 웃기고 다 조았어요.
9791196688301,10,개를 입양하고 싶지만 여건이 되지 않아 항상 마음만 간절한 사람입니다. 비록 반려동물과 삶을 함께 나누는 경험은 해보진 않았지만 누구에게나 좋은 에세이툰이라고 생각됩니다. 다른 분들도 잔잔하고 따뜻한 이야기에 매료돼 보시길 바랍니다.
9791196688301,10,노견일기는 반려동물을 만난 후 삶이 달라진 저에게 의미가 있는 작품입니다. 반려동물은 대부분 먼저 세상을 떠납니다. 그렇기 때문에 함께했던 함께하고 있는 삶이 더 귀하고 소중합니다. 이 책은 반려동물을 가족으로 맞이한 사람과 그렇지 않은 사람까지 모두 품을 수 있는 작품이라고 생각합니다.
9791196688301,10,올 7월에 저도 노견을 떠나보냈어요....치매를 앓다가 간...웹툰으로 간간히 보곤 했지만 책은 사놓고 아직 못보고 있네요...슬퍼질까바...
9791196688301,10,지난해 긴 투병생활 끝에 노견을 떠나보낸 저에게 많은 위안을 줬던 웹툰입니다. 세상을 따뜻한 시선으로 바라보시는 작가님의 담담한 글과 그림이 마음에 들었습니다. 펀딩으로 구매했는데 알라딘에서도 두 권 더 사서 선물하려고요.
9791196688301,10,"‘노견‘이란 말이 전해주는 묵직함이 있지만 의외로 유쾌하고 코믹하기까지한 작품.개와 사는 보통의 삶에서 그냥 지나치기 쉬운 순간들을 예리하게 포착해 긴 여운을 남기는, 개와의 추억이 있는 사람에게 최고의 감동을 선사할 작품이다."
9791196688301,10,만약 반려동물과 함께하고 있다면 꼭 읽어야 할 책입니다. 주어진 삶의 길이가 다른 생명체와 함께 삶의 시간을 맞추고 받아들여가는 일상이 담겨있어요.
9791156622901,4,"PDF 파일임을 미리 보지 못한 내 탓이 크다만, 일반적 수의사를 생각하고 읽기엔 가독성이 너무 떨어져서 읽어내야만 하는 책이었다."
9791156622901,10,"시작부터 흥미진진했고, 아직 다 읽진 못했지만 재미있습니다."
9791156622901,6,이전 웅진 출판사 번역가가 번역해서 번역질은 보장.다만... 책 표지나 전체적인 느낌이 대학교 교재st로 제본한 느낌...소장본으로 아쉬운 감이 큼.그리고 300P로 구매할 수 있는 노트 사은품은 구매하지 않을 것을 추천...길 가다 주는 학원 홍보 노트 수준인데... 줄까지 없고 판형도 작음.
9791156622901,8,동물을 키우면서 동물에 대해 더 관심이 생겨서 그런지 ㅇㄺ고 싶네요.
9791156622901,10,직접 저자가 겪은 경험과 느꼈던 생각들이 담긴 글이라 더 공감도 가고 마음에 와닿았던거 같아요. 잔잔하면서 제마음까지 치유되는 느낌이네요
9791156622901,10,1900년대초 젊은 수의사의 활약이 돋보이는 영국의 농촌이야기 모음집이네요. 수의사로서의 기록으로도 큰 가치가 있고 감동이 있어 좋아요.
9791156622901,2,전자책으로 구입했습니다. 레이아웃이 복잡한 것도 아니고 본문에 그림이 있는 것도 아닌데 도대체 왜 파일포맷이 PDF입니까. 텍스트 중심 책이니 당연히 epub인 줄 알고 사서 크레마로 보다가 짜증나서 덮었습니다.
9791156622901,10,수의사가 동물에 대해 어떻게 이야기했는지가 궁금합니다.
9791156622901,10,점점 어께가 좁아드는 겨울의 초입 이라서 그럴까요?따뜻하고 훈훈한 그리고 위트의 젊은 수의사 헤리엇 이야기 ‘이 세상의 모든 크고 작은 생물들‘는 늘 팍팍한 삶을 사는 우리에게 잃어버린 자연의 생명들의 기쁨과 행복 그리고 힐링의 새로운 맛을 주는 멋진 책으로 기대감을 증폭을 시켜 줍니다!.
9791156622901,10,생명의 소중함과 따뜻함을 느낄 수 있는 책이 될 것 같네요!
9791156622901,10,이렇게 따뜻한 이야기가 있다는 것을 알게 되어서 참 다행이란 생각이 들었습니다. 하나하나의 이야기가 모두 가슴에 스며들어서 전권을 읽는데 밤을 새버렸어요. 시카고 트리뷴의 서평에 적극 공감합니다
9791156622901,10,"저자가 번역한 제임스 해리엇의 책 2, 3권만 가지고 있어 나머지 권이 없음이 안타까웠는데 이렇게 시리즈 모두 나오는 듯 해서 너무 좋네요. 영국의 한 수의사의 이야기인데, 인간만큼이나 다양한 성향의 다양한 동물들,그리고 그들과 함께 살아가는 사람들의 이야기가 너무 재밌어요. 마음 따뜻함."
9791156622901,10,과학 만능의 시대이지만 그렇기 때문에 인간의 야망은 스스로 통제하고 자제해 나가지 않으면 안 되는 그 무엇이 되어야 한다. 그래서 인간의 생명 뿐만 아니라 생명 있는 모든 것의 아름다움을 이야기하는 글이 더욱 소중하게 받아들여지는 것이 아닌가 싶다.
9791156622901,10,제임스 헤리엇 출생이 벌써 100주년이라니 세월이란.. 깜짝 놀랐어요. 우연히 도서관에서 낡은 책으로 이 시리즈 한 권을 읽은 후 멈출수 없어 모두 읽고 영상으로까지 보았더랬지요. 이 멋진 책이 재출간되어서 더 많은 새로운 독자와 만날 수 있게 되어서 기존 독자로서도 정말로 기뻐요.
9791156622901,10,세상의 모든 생물들의 생명은 다 같이 소중하다는 생각을 새삼 다시 하게 합니다.
9791156622901,10,지금도 동물을 좋아합니다. 그들은 마음이 있어요. 이 책도 마찬가지입니다. 동물들에 대한 수의사님의 따뜻한 마음을 엿볼 수 있었어요. 매력적입니다.
9791156622901,10,"생명의 존중을 다시 한번 마음속으로 깊이 깨달을수 있고, 아름다운 마음을 느낄수 있어서 좋은 책이네요."
9791156622901,10,강아지를 너무 좋아해서 수의사가 되고 싶었던적이 있었어요 진정한 수의사라면 강아지뿐만 아니라 크고 작은 모든 생물들을 사랑해야 헤리엇처럼 진정한 수의사가 될수 있는것 같아요 동물들과 교감하고 치유하는 수의사라는 직업은 정말 특별하네요~~ 정말 읽어보고 싶은 책이에요 꼭 읽어보겠습니다
9791156622901,10,모든 생명과 조화로운 상생의 길에 대해 생각해본다.
9791156622901,10,그의 관심과 사랑의 대상이 남들과는 다르게 특별하기에 맞닥뜨리게 되는 문제도 있지만 그래도 유쾌하게 풀어낸 점이 보기 좋다.
9791156622901,10,해리엇 작가님의 [조금씩 행복해지는 이야기]를 읽고 마음이 푸근해짐을 느껴이번 책에도 그럴까 하는 호기심이 생기네요
9791156622901,10,수의사라는 직업을 가진 인물이라 소재적으로 흥미롭네요. 재밌을것같은데 현실적이기도 하고 기대됩니다
9791156622901,10,제가 워낙 동물에 관심이 많아서 그런지 흥미가 가네요거기에다 수의사의 생명존중사상과 유머는 덤 ㅎㅎ
9791156622901,10,동물과 사람이 재미있는 스토리가 구성되어 있는 책이라서 좋은 것 같습니다.동화같이 재미있고 따듯하고 감동적인 스토리가 저술되어 있어서 좋은 것 같습니다.
9791156622901,10,너무나 작고 흔하다고 생각해 지나치기 쉬운 소중한 생명들에 대해 다시 한 번 그 고귀함과 아름다움을 일깨워주는 책인 것 같습니다. 우리 주변의 소중한 생물들을 사랑해야겠다는 생각이 드네요. 매우 유익한 책입니다.
9791156622901,10,해리엇이라는 매력적인 사람을 만날 수 있다는 것만으로도 이 책은 가치가 높다고 할 수 있겠군요. 어딘가에서 이런 사람을 만날 수 있을 거란 기대를 하면서 책을 덮을 수 있었습니다
9791156622901,10,제가 동물을 좋아해서 굉장히 관심이 가는 책입니다. ^^* 여러 동물과 헤리엇이 만들어가는 재미있는 이야기가 기대가 됩니다. 헤리엇의 동물에 대한 애정과 관심을 저도 함께 느끼고 싶습니다.
9791156622901,10,"이 세상 모든 사람들이 제임스 해리엇처럼 세상을 따뜻하게 보는 눈과 세상을 포근히 품는 마음을 가진다면 시기와 질투, 폭력과 싸움, 전쟁은 없을 겁니다. 아주 작은 미물에게도 관심을 가지고 돌보는 시골 수의사의 마음이 느껴져 훈훈한 책입니다. 기대해도 좋은 책입니다."
9791156622901,10,동화와도 같은 잔잔하고 따스한 이야기네요. 동물들과의 여러 이야기가 정말 기대됩니다.
9791156622901,10,송아지가 태어나는 과정조차 상세하게 잘 적혀있어 상황이 머릿속에서 그려지는 느낌이 듭니다. 그만큼 동물 이야기가 영상보듯이 나와있어 기대됩니다.
9791156622901,6,크던 작던 모든 생명 위대한 사람이 아니더라도 평범한 모든 인생은 존중받고 사랑받아야합니다.
9791156622901,8,말을 하지 못하지만 아프거나 문제가 있을때 수의사의 입장에서 동물들이 어떤 모습인지 재미있게 잘 써놓은 책같아요 모든 생명은 존중받아야하고 소중하다는 것을 느낄수 있어 좋아요
9791156622901,10,따뜻한 책일 것 같아 기대됩니다. 읽어보고 싶어요.
9791156622901,10,마음이 따스해지면서 감동을 주는 책이라고 말하고 싶네요. 그의 젊은 시절의 따스한 심성과 주변 사람과 동물간의 교류가 정말 부러워요
9791156622901,10,어릴적 꿈이 수의사였을 정도로 동물을 좋아하는 저로서는 너무나 가슴 따뜻한 책이었습니다간만에 좋은 책을 만난것 같네요
9791156622901,10,생명에 대한 경이와 존중을 느낄 수 있는 책이다. 시골 수의사가 전하는 생명체에 대한 사랑에 다뜻해진 책입니다. 기대해도 되는 책입니다.
9791156622901,10,시골에서 수의사로 일하면서 겪은 다양한 사람들과 그들의 동물에 대한 이야기들이 저자의 인간과 동물을 아우르는 살아 있는 모든 생물에 대한 애정과 연민이 느껴져서 더욱 감동적입니다.
9791156622901,10,요즘 동물에 관한 범죄가 심심치않게 일어나는데 마음 따뜻하게 해주는 책이네요. 좋습니다.
9791156622901,10,"요크셔 시골에서의  동물들과의 에피소드들을 통해서 수의사의 따뜻한 마음이 자연스럽게 느껴집니다  건조하고 삭막한 지금, 주변 생물에 대한 애정과 배려에 대해서 생각해보고 웃음과 감동까지 함께여서 좋네요"
9791156622901,10,"작은 생명을 세세히 살피고 보살피는 정성이 느껴지는 책이네요. 실화이야기라서 더 와닿을 책인거 같습니다. 전공을 살려 일을 하는것도 멋지고, 거기서 끝이 아니라 계속 동물 사랑을 진행해온다는것도 멋지네요."
9791156622901,10,"젊은 수의사의 따뜻하고, 즐겁고, 유쾌한 연대기입니다. ^^"
9791156622901,10,잔혹함을 따뜻함으로 위장한 사기꾼의 책 같은 느낌입니다.그래도 많은 오물중에 덮여있는 진주는 참으로 영롱합니다.
9791156622901,10,"동물이 나오는 이야기의 열성팬인데,이 책은 감동과 유머,훈훈함이 모두 있어서 정말 좋아요.실화라 더 매력적입니다."
9791156622901,10,헤리엇 작가의 다른 이야기를 더이상 볼수 없다는 사실이 너무 안타깝게 느껴질 정도로 정말 재미있게 읽었어요. 웃으면서 수의사생활을 같이 보고 있노라면 지금 제가 고민하는 것들이 다 잘될 것처럼 생각이 되네요
9791156622901,10,수의사 헤리엇이 젊은 시절 시골 요크셔에서 만난 크고 작은 동물들과 사람들에 관한 이야기라고 합니다.45년간 1억부 이상 팔리고 꾸준히 많은 사랑을 받고 있는 소설이라니 더욱 기대가 되네요. 헤리엇이 수의사일을 하면서 직접 경험한 에피소드들이 어떤 감동과 재미를 줄 지 궁금해집니다.
9791156622901,10,동물과 자연을 사랑하는 사람들은 마음도 따스한 사람이라고 생각합니다. 더군다나 시골에서 수의사를 한다는 것은 정말 동물을 사랑하지 않고는 힘든 일 같습니다. 도시에서 살면서 여유없이 각박하게 살아가는 가운데 이 책을 읽으면서 여유를 가지는 것도 좋을 것 같은 생각이 듭니다.
9791156622901,10,따스한 이야기가 정말 좋네요~~
9791156622901,10,동물을 사랑하는 사람중에 나쁜인간은 없다고 하는데 유기견버린놈은 나쁜놈임
9791156622901,10,인류는 오래전부터 동물과 함께 해왔죠. 동물에 대한 사랑은 인류사적으로 당연한 것으로 생각됩니다. 그런만큼 수의사가 쓴 동물 이야기가 기대됩니다.
9791156622901,10,뉴스에 나오는 동물 학대 사건을 보면 너무 가슴 아픈데 많은 이들이 이책을 읽으며 생명의 소중함을 느끼면 좋을것 같습니다
9791156622901,8,진짜 동물을 사랑하는 마음이 전해집니다. 생명의 소중함을 알려주고 함께 살아야 하는 따뜻한 메시지.
9791156622901,10,인간의 마음은 어떤것인가 라는 자책과 함께 마음이 따듯해지는 책이네요
9791156622901,10,동물의 생명의 소중함을 느끼게된다
9791156622901,10,어릴적 꿈이 수의사였습니다. 머리가 나빠서 대학에 못가서 그 꿈을 이루진 못했지만요. 지금은 유기견 봉사활동 하고 있습니다. 때가 되면 어쩔 수 없이 저 세상으로 가야하는 아이들을 위해 늘 기도한답니다. 다음 세상에는 상처받고 고통받는 생명이 아닌 것으로 태어나길. 부디.
9791156622901,8,생명의 소중함이 경시되는 지금...좋은 울림을 전하는 책
9791156622901,10,동물을 좋아해서 애완 동물을 키우고 있는데 생명의 존중을 다시 한 번 새길 수 있게 해줄 거 같아서 구매해서 읽어봐야겠습니댜.
9791156622901,8,생명의 존엄성을 중시하는 수의사의 동물 돌보기를 통해 크고 작은 생명체를 소중히 여기는 생활 태도로 공존하는 삶을 꿈꿉니다.
9791156622901,10,수의사로서의 고민과 아름다운 풍경 그리고 수의사로서의 성장까지 정말 아름다운 책이었습니다.
9791156622901,10,정말 기대됩니다. 감사합니다.
9791156622901,10,인간이 아닌 다른 생물들에 대한 작가의 순수한 애정이 깃들어 있는 수의사의 꾸밈없는 모습을 발견할 수 있다.
9791156622901,10,이 세상의 모든 살아있는 생물에 대한 따뜻한 마음을 전하고픈 수의사 해리엇의 이야기가 깊은 감동을 주는 책이네요. 기대됩니다.
9791156622901,10,언어의 장벽을 넘어서 동물과 소통할 수 있는 능력을 지닌 해리엇의 모험담입니다. 감동적이네요
9791156622901,10,"제가 강아지를 키운후부터는 길가의 모든 생명이 참 이쁘다는 생각 많이 했어요. 소중하다는 생각도 하고 보호에 관심도 갖게 되었는데, 이 책 그런 저에게 딱 맞는 책인 것 같아요. 구입해서 갖고과 함께 읽어봐야겠어요 ^^"
9791156622901,10,읽어보고싶은책이네요.
9791156622901,10,수의사 해리엇의 동물에 대한 사랑을 책을 통해 배울 수 있어 기대되는 책입니다.
9791156622901,10,현직 수의사가 경험을 바탕을 각종 생물들과의 만남을 인상적으로 진솔하면서 재미있게 또한 사랑의 마음으로 쓴 글 정말 기대되네요.
9791156622901,8,따뜻함을 느끼고 싶다면 이 책을 들어라~! 추천!!
9791156622901,10,생명을 경시하는 사회가 되가는것같아 슬펐는데 이책을 주변인들에게 권하고싶네요!
9791156622901,10,수의사 헤리엇의 이야기 기대됩니다
9791156622901,10,삭막한 요즘 가슴을 따뜻하게 해줄 책을 찾고있었는데 여기 있었네요!!
9791156622901,10,생명에 대한 감동적이고 따뜻한 이야기들이네요 읽어보고 싶어요
9791156622901,10,동물에 대한 따뜻하고 사랑하는 마음을 느낄수 있어서 기분이 풍요롭게 될 것 같습니다.
9791156622901,10,마음이 따뜻해지는 에피소드들이 담겨있어서 감동적이네요. 진정한 수의사란 이런 사람이 아닐까 하는 생각이 들었습니다. 제목부터 저자의 동물 사랑이 느껴지는듯해요
9791156622901,10,"영국의 시골 마을, 요크셔에서 젊은 수의사 헤리엇이 겪은 동물들과의 이야기는 한편으로는 웃음을 주면서 다른 한편으로는 독자들에게 생각할 거리를 제공해 주는 것 같아요."
9791156622901,10,동물을 사랑하는 마음이 두 눈에 가득 드러나는 수의사의 이야기에 흥미가 이네요. 분명 따뜻하고 사랑스러운 이야기가 될 것 같아서 어떤 에피소드들이 있을지 기대됩니다.
9791156622901,10,동물에 대한 연민과 애정을 가진 수의사의 삶과 체험을 담고 있어요. 생생한 현장에 같이 있는 듯한 느낌을 주는 글이라서 더욱 기대됩니다.
9791156622901,10,요크셔 시골의 수의사가 동물 뿐 아니라 그 주인과 주변의 이야기를 애정어린 따뜻한 시선으로 그리고 있어서 드라마보다 재미있고 감동적입니다.
9791156622901,10,살아가는 모든 생물들에 대한 저자의 순수한 애정이 나타나 있어서 훈훈하고 감동적입니다.
9791156622901,10,사람과 동물에 관한 이야기는 언제 봐도 따스함과 편안함이 느껴져 좋은 것 같습니다요즘처럼 정신적으로 지치는 일들이 많은 시기에 읽으면 더욱더 좋을것 같네요
9791156622901,10,지구라는 공간에서 살고 있는 우리만이 살고 있는게 아니라는 걸 느끼고 갑니다.
9791156622901,10,환경사랑이 동물 사랑이 될지 동물 사랑이 환경 사랑으로 변할지 아무도 모르지만 적어도소중히 여기는 사상 자체가 나쁜 것은 아닙니다. 개인적으로 후손들에게 싱싱한 들판이나농장을 몰려주고 싶습니다.
9791156622901,10,사람과 동물에 관한 따뜻한 이야기가 가득찬 책이네요. 결국 사람과 동물이 조화롭게 평화롭게 잘 살길 바라는 지은이의 여망이 담긴것이 아닌가 하는 생각을 해봅니다.
9791156622901,10,지금 살고 있는 지구촌은 우리들만의 것이 아니다. 대대손손 평화와 번영을 누리며 살아갈 삶의 터전이다. 어느 때보다 환경보전에 대한 결연한 의지를 다시 한번 가다듬어야 할 때이다. 이 책이 자연의 품 안에서 살아가는 이 세상의 모든 생물들에 대한 인식의 지평을 넓히는 계기가 되었으면 한다.
9791156622901,10,조화롭게 어울어 살아감을 느낄 수 있는 그런 책이라 흥미롭게 읽을 수 있을 것 같아요.
9791156622901,10,힐링할 수 있을 것 같네요~책 기대됩니다^^
9791156622901,10,지구에 인간만 사는 게 아니라는 걸 잊어버려요. 지구 위에 사람만 사는게 아니라 많은 동물들이 살아 있다는걸. 단지 말이 통하지 않고 모습이 다를 뿐이지만 지구가 끝날 때까지 함께할 동반자들인데. 이 책으로 동물들에 대해 생각하고 생명의 소중함에 대해 곱씹을 수 있는 시간이 되었으면하네요
9791156622901,10,제임스 헤리엇의 따뜻한 동물 사랑을 느낄 수 있는 값진 책이 나와서 반갑습니다.
9791156622901,10,동물들을 더 사랑하게 되는 책입니다
9791156622901,10,동물들을 사랑하는 마음이 느껴질 것 같은 책이라 좋아요. 수의사의 동물들에대한 배려와 사랑이 기대됩니다.
9791156622901,10,"수의사가 동물들을 돌보는 생생하고 따뜻한 이야기, 기대됩니다."
9791156622901,10,표지부터 너무 귀엽고 맘에드네요
9791156622901,10,온 가족이 읽어봐야 할 가족필독서!
9791156622901,10,요즘 들어 애완동물 키우고싶은 생각이 많이든다. 외로워서 그런가.. 이 책도 한번 읽어봐야겠다
9791156622901,10,작은 동물에서 큰동물까지 모든 생명체를 돌보는 수의사의 이야기가 기대됩니다.
9791156622901,8,동물들을 싫어했던 사람도 내가 왜 이렇게 사랑스러운 동물들을 싫어했지?하고 느낄 수 있을만큼 동물들을 바라보는 시선이 특별합니다
9791156622901,8,동물들을 무서워하는 아이에게 꼭 선물해주고 싶은 책이었어요
9791156622901,8,교감이라는 말로 치유하는 수의사야 말로 위대하다고 생각합니다
9791156622901,6,수의사라는 직업에 대한 이야기는 좋네요./
9791156622901,10,앞에 출판된 책을 샀건만 또다시 신판이 나오는군요. 한두번 겪는일도 아니라 화도 안납니다. 부탁이니 이번에는 제발!제발! 완간 좀 해줘요.
9791156622901,10,여러 생물들에 대해 읽으면서 마음이 치유되고 잔잔해지는 좋은 책이네요.
9791190427753,10,헐 보자마자 구매했습니다.
9791190427753,10,세상에ㅠㅠ 솜구는 사랑입니구
9791196270292,10,책을 읽는데 왜 눈물이 왜 자꾸나지.
9791196270292,10,아직 멀었고 영원히 안 올 거라고 믿고 싶지만 언젠가 올 것을 아는... 떠남을 미리 준비하는 데 도움이 되는 책. 일러스트도 매우 정감이 갑니다.
9791196270292,10,반려동물을 키우는 사람들의 필독서! 이 책을 읽으면서 어릴 적 키우던 강아지가 떠올렸고 그 친구 떠나보내며 얼마나 큰 상처와 아픔을 겪었는지 기억해냈다. 그때 미리 이 책을 읽을 수 있었다면 얼마나 좋았을까... 지은이의 감동적인 울림은 많은 공감을 불러일으킨다.
8809254942867,10,컵이 가지고 싶어서 샀어요. 컵이 튼튼해보여서 마음에 들어요♡다이어리는 안펼쳐봤지만 내부구성이 이쁜거같아요 아마도..
8809254942867,10,"작가님 사랑해요... 출간 된 순간부터 갖고싶었지만 반려동물이 없었던 터라 장바구니에만 담겨있던 다이어리, 이제 저도 구매 할 명분이 생겼습니다! 우리 이쁜 레오 만난 순간부터 소중히 차곡차곡 잘 기록해나갈께요ㅠㅠ! 첫 장부터 마지막 장까지 너무 귀여워서 다이어리이지만 정독했습니다:‘)"
8809254942867,10,한가족이고 행복을 주는 반려동물의 애정을 담은 수첩이군요 이벤트로 머그컵 무릎담요 너무 고급지고 이뻐요 사용 잘하고 있답니다
9791185676456,10,고양이책은 딱히 말이 필요없다. 특히나 사진책은 더더욱! 단순하고 발랄한 고양이사진책! 읽으면 우울했다가도 기운이  쑤욱 솟아납니다.
9788959135110,10,고양이의 깨방정한 모습과 더불어 시골풍경에 그림처럼 어우러진 모습에 기분이 좋아지는 책이었어요. 세상에 저처럼 고양이를 사랑하는 분이 많아서 신이나네요.
9788959135110,10,이용한 작가님의 따뜻한 시선이 느껴지는 사진들과 애정 어린 한마디의 글귀가 너무나 잘어우려져서 늘 손이가게한답니다.
9788959135110,8,글보단 사진이 많은 책고양이 사진만으로도 충분한 책이다. 고양이는 완벽하다
9788959135110,8,"고양이들이 널린 시골에서 함께 살아가는 해피라이프. 고양이를 좋아한다면 마음이 편안해지고, 입꼬리가 올라가게 되는 힐링서다. 고양이의 온갖 사진들이 독자의 눈과 마음을 행복하게 만들어준다."
9788959135110,10,"어쩌지, 고양이라서 너무 귀여운데ㅋㅋㅋ"
