ISBN13,rating,review
9788990364661,10,아이의 친구의 추천을 받아산책 아이가 좋아합니다
9788990364661,10,"어제 책이 도착했다. 침대에서 아들에게 읽어주는데 애가 얼마나 좋아하는지...
아이들이 무척 좋아할만 한 책이네요..."
9788990364661,10,이 책 맛 있겠네... ㅎㅎㅎ 재미있어 보인다
9788990364661,10,아..만족만족.. 다른 시리즈도 정말 사고 싶어요.
9788990364661,8,너무 아이들이 좋아해서 아는 분께 선물로 드렸더니 정말 좋아하십니다. 넘 좋아요~~
9788990364661,10,재미와 감동이 적절히 있어요~~여자아이인데도 공룡이 좋은지 연신 읽어달라고 하네요~~도서관에서 대충 봤을때는 이책이 왜 인기일까 싶었는데 찬찬히 보니까 가슴이 짠해지는 내용이네요~~~
9788990364661,10,아이가재미있다고아빠에게권합니다!!!!
9788990364661,10,"으흐흑~ 초등생 딸내미 보여주려고 샀는데... 엄마인 제가 먼저보고 엄청 울었네요.
나중 티라노가 맛나를 친부모에게 돌려보낼때 정말 사랑하는 자식을 보내는것 같아 마음이 뭉클 했담니다.ㅜㅜ"
9788990364661,8,6세딸아이 엄청좋아해요.친구들 선물로 몇권더 돌렸네요..
9788990364661,10,영화관가서 조카와본적있는데 정말 재밌어하더군요 책으로 나왔다니.
9788990364661,10,"처음엔 기대평에 못 미쳐 살짝 실망했는데, 두 달 동안 6세 우리 아들 열번도 넘게 읽었네요~ 혼자도 잘 읽고~ 읽어주면 더 좋아합니다.. 재치 속에 숨은 감동이 읽을 때마다 색다른 재미로 다가오네요^^"
9788990364661,8,드디어 우리집도 고녀석이 왔네요 ㅎㅎ
9788990364661,10,"재밌네요.. 맛있겠다라는 이름을 가진..ㅋ
맘이 뭉클해지는 책이네요~"
9788990364661,10,공룡에 눈을 뜨기 시작한 아이에게 사줬는데 오히려 제가  재미있게 읽는책이되었어요
9788990364661,10,남자아이라면 누구나 좋아할책. 하지만 엄마는 별로네요^^;;;
9788990364661,10,고녀석 맛나겟다 ㅠ0ㅠ 이책 시리즈 완전 아들이 조아라함 ㅡㅡb
9788990364661,8,영화보고 무척이나 감동해서 구입. 영화 속 성우들의 연기를 떠올리며 읽어봅니다
9788990364661,8,이런 독특한 그림 좋아해요! 글도 간단해서 마음놓고 보기에 아주 좋아요ㅋ
9788990364661,10,요즘 아이가 이 책만 읽어달라고 해요.. 재밋고 가슴이 찡하기도 하고..
9788990364661,10,"우릉우릉 쾅! 하고 읽어주는걸 좋아하는 우리아이(18개월), 잼있는 그림책이예요"
9788990364661,10,'폭풍우 치는 밤에'와 같은 감성이 느껴지는 가슴 짠한 좋은 동화!!
9788990364661,10,이번에 애니로도 제작된 재미있는 책이네여
9788990364661,10,정말 최고예요^^
9788990364661,10,내용이 정말 기발한 책입니다.   작가의 상상력에 한표^^
9788990364661,10,"정말 정말 ,,,잘 산 책인것 같아요^^ 우리 딸들 얼마나 재밌어 하는지.."
9788990364661,10,재미있고 귀엽고.. 감동적이고..아이가 좋아해요.
9788990364661,10,"요즘 공룡을 좋아하는 아들을 위해 구매.
반값인데 안사면 후회해요."
9788990364661,10,마음이 따뜻해지는 따뜻한 동화 상처난 마음에 빨간약을 바른 듯 한 그런 기분의 동화
9788990364661,10,엄마가 읽어주려다 먼저 읽어버리고 진짜 눈물 글썽했던 책! 강추에요!선물하기도좋구
9788990364661,10,공룡을 좋아하는 우리 아들이 너무나 사랑하는 책입니다.
9788990364661,10,조카주려고 샀는데 주기전에 읽어보니 재밌고 흥미롭게 책을보게끔만들었네여 ㅎ
9788990364661,10,진짜 추천해주고 싶은 책이에요. 울 아들 수십번 읽어달래서 줄거리 아예 외웠을정도
9788990364661,10,6살 아들의 눈에 눈물이 그렁그렁. 아빠와 함께 읽으면 더욱 좋답니다.
9788990364661,10,"미야니시 타츠야의 매력이 살아있는 그림책, 그의 팬이라면 후회하지 않는다!"
9788990364661,10,"재미난 책이예요 발상이 너무 귀엽고, 아이도 너무 좋아해요..."
9788990364661,10,이 책 너무 좋아요~>< 아기공룡 안킬로사우르스의 성장 어드벤쳐! ㅋ ㅋ
9788990364661,10,"쌍둥이 두 딸들이 넘넘 좋아하는 책입니다.
저도 좋아하구요~"
9788990364661,8,저희 아이는 너무 슬픈 책이라며 얼굴 굳어졌어요. 그 감정도 소중한 거지요.
9788990364661,10,큰아이 작은아이 모두 좋아하는책. 맛있겠다 소리만 나오면 깔깔깔 웃음을 터뜨리네요
9788955824476,10,"병관이 시리즈에 익숙한 아이, 이번엔 어떤 내용인가 책을 봅니다. 초등2학년인 아이는 1학년 때 자기 이야기 같다네요. 유치원 친구가 그리운, 새친구 사귀던 제 모습 같아서요."
9788949119076,10,그동안 봐왔던 팝업북에 비해서 소박한 느낌이지만 마음에 쏘옥 와닿는 사랑스러움이 있다.
9788949119076,10,매번 소중한 사람에게 꽃처럼 선물할 수 있는 그림책이에요~
9788949119076,8,크기를 보지 않고 구입해 왜 이리 작지? 생각했어요.화려하고 정교하진 않지만 서정적이고 잔잔해요.소품 같은 책.
9788949119076,10,이쁘다 멋지다
9788949119076,10,꽃으로 할 수 있는 멋진 일들이 깔끔한 그림과 함께 펼쳐진다. 여기 저기 꺼내고 흔들고 빼내는 재미가 있어 눈만이 아니라 손으로도 보는 그림책. 번역의 맛도 괜찮다.
9788949119076,10,우아한 화사함과 요란하지 않은 화려함. 주욱- 펼쳐 세워놓는다면 그것만으로 충분한 장식. 무엇보다 노란색 꽃 헤어밴드는 순식간에 사랑스러움을 느끼게 한다. 아이에게도 좋겠지만 하나하나 색들을 만나는 순간을 성인 남자에게 선물하는 것도 끝내줄듯!내 방은 좁아서 놓을 데가 없어..(시무룩)
9788949119076,10,보기만 해도 힐링이 됩니다~
9788949119076,10,아이와 함께 볼 수 있는 아름다운 책
9788901074405,10,도서관<뭉클♥참 다행이다.>
9788901074405,6,모습이 달라도 서로가 의지할수 있다면 좋은 친구
9788901074405,10,감동이 있는 책그림이 예쁜 책아이가 좋아하는 책
9788901074405,10,"아기를 위해 샀다가 읽어주는 엄마가 먼저 울음이 터져버린, 감동적인 책입니다."
9788901074405,10,"고릴라와 고양이~어린이들의 동화지만 어른이 읽어도 다시한번 생각하게 만들어줘요~
배경 구석구석 숨어있는 그림들을 찾아내는 재미도있구요"
9788901074405,10,조카주려고 샀는데 제가 더 재밌게 읽었네요 ㅎㅎ
9788901074405,10,감동적이다. 예쁘고 따뜻하고. ..힘들때 읽었는데 정말 좋았다.
9788901074405,10,역시 앤서니 브라운 그림이 너무 너무 귀엽고 눈을 뗄수 없을 정도로 아이가 좋아합니다. 정말 고릴라를 어쩜 이렇게 사랑스럽게 표현했는딩.....
9788901074405,10,마음이 따뜻해짐을 느꼈어요..
9788901074405,8,유휴와 친구들에서 고릴라가 나온 걸 보고 고릴라를 기억하더라고요. 이 책을 사서 읽어주니 처음엔 무섭다고 하더니 몇번 읽어주니 무서워하지 않고 잘 보더라구요.
9788901074405,10,아주 사랑스러운 책이에요..마음이 따뜻해지는 고릴라와 고양이의 우정
9788901074405,10,고릴라와 고양이의 우정?사랑?이야기책~ 울 아이 고릴라를 살짝 무서워 하지만 그래도 스토리를 참좋아하네요. 하지만 책 크기가 살짝부담스러운 크기네요
9788901074405,6,앤서니의 작품...
9788901074405,8,아이가 너무 좋아해요.
9788901074405,10,점난 야옹이와 마음 따스한 고릴라 이야기 울딸이 넘 좋아하네요.
9788901074405,8,기대되요..울아가 첫책
9788901074405,10,최고 최고!!! 별 100개 아니 1000개 주고싶음!
9788901074405,10,아이와 함께 사랑을 느끼면서 읽을수있는 따뜻하고 짧지만  귀여운 친구같아요
9788901074405,10,앤서니 브라운 팬! 그 이유만으로 구입
9788901074405,8,그림은 좋은데요 내용이 약간 뭔가 아쉽네요.
9788901074405,10,너무너무 재미있는책.. 우리딸 계속계속 내가그랬어요 하며 웃어요 강춥니다~!!
9788901074405,10,우리아이는 앤서니브라운 책마니아랍니다.
9788901074405,10,요즘 구매한 책 중 최고의 책!!!. 초등학교 저학년까지 충분히 읽을 수 있을 듯.
9788901074405,10,아이들에게 읽어주니 반응이 오네요 28개월인데요 고릴라표정이 참 어른스워
9788901074405,8,아가(16개월) 눈에도 고양이가 사랑스러운가봐요. 넘기면서 고양이가 나오면 야
9788901074405,10,디테일한그림에반하고종이재질이라내용이좋아요..적극추천해드려요..
9788901074405,8,고릴라와 예쁜이의 깜찍한 우정..
9788901074405,10,외모로 친구를 사귀는것이아니라 마음으로 친구를 사귀어야 한다는것을 알려주는 책
9788901074405,10,세련되고 섬세한 그림과 따뜻한 이야기~굿~
9788901074405,10,역시 앤서니 브라운이에요
9788901074405,8,친구란 서로를 배려해 주는것 .. 유치원생 이상 강추..
9788901074405,8,"귀여운 책, 가치를 생각하게 하는 책, 마음에 담아야 하는 책"
9788901074405,10,"자기보다 몇 배나 큰 고릴라 친구를 감싸줄 줄 아는 작은 고양이, 완전 감동이예요!"
9788901074405,8,아름다운 그림에 좋은 내용! 하지만 브라운씨 책이라기엔 뭔가 2% 부족?
9788901241371,10,제대로 봄을 느끼게 해주는 예쁜 그림책이네요. 벚꽃 팝콘이 숲 속에 퍼질 때 미소가 절로 지어졌어요. 파스텔톤 화사한 그림도 넘 좋아요.
9791185564227,10,백희나 님께서 쓰신 책은 다 신기하고 재밌다^^ 특히 삐약이 엄마ㅋㅋ
9791185564227,10,벡희나 작가 그림책 중에서 제일 좋아하는 책~~ 삐약이 엄마 시리즈 나왔으면 좋겠다~
9791185564227,10,언제나 믿고 보는 백희나 작가의 책. 바삐 지나가는 길고양이들에게도 재미난 사연이 숨어있는듯 눈여겨 보게 된다
9791185564227,10,못생긴 고양이가 나온다. 읽고나면 조금 사랑스러운 구석을 발견하게 된다. 못생긴 고양이도 좋아할 수 밖에 없다.
9791185564227,8,"작고 약한 동물들을 괴롭히는 못된 고양이가 병아리를 키우며 변화하는 내용이예요. 검정, 노랑 두가지 색만으로 채색된게 맘에 들어 샀습니다. 애기도 잘 보는 편이예요."
9791185564227,8,마지막 장면 너~~~~~~~~~~무 좋다!!!!!!!!!!!!!!!!!!‘루돌프와 많이 있어‘에 나오는 교양있는 고양이가 떠오른 것 왜일까??ㅋㅋ
9791185564227,10,백희나 작가의 다른 책들을 봤는데 너무 재밌어서 조카 선물로 구입합니다~ 기대만땅이에요^^
9791185564227,10,어른이 봐도 감동적입니다 짧지만 강렬합니다.
9791185564227,8,무섭고 악랄하게 생긴 고양이지만 삐약이를 낳으면서 엄마로 성장해가는 과정이 훈훈한 책입니다.  달걀을 먹고 삐약이가 태어나는 설정도 독특하고 날카로우면서도 섬세한 그림체들이 맘에 드네요~
9791185564227,10,"삐약이 엄마가 고양이라니..ㅎㅎ책 읽어주기전, 왜? 어째서? 정말? 을 남발했는데,다 읽고나니, 고양이도 삐약이 엄마가 될 수 있구나..ㅎㅎ 하는 모습을 보니,동화책의 힘은 대단하네요.ㅋㅋ"
9791185564227,10,읽고 마음이 울렁
9791185564227,10,우리 아이가 이렇게 집중해서 보는 책이 드물었다.
9791185564227,8,독특해요.
9788971968413,10,32개월 아들이 책을 좋아해요 ㅎ 이 책은 지금 줄줄 읊을 정도로 많이 읽어줬고 자기전에도 보는 최애 책이랍니다 ㅎ 애들은 똥이 좋은가봐요 ㅎ
9788971968413,10,조카 한글 공부 시키려고 구입한 책.베스트셀러는 다 이유가 있겠지요
9788971968413,10,그림책에도 고전이 있다면 이 책이 그 중 하나일 것 같다.
9788971968413,8,대변가리기 할 때 도움 받았습니다.
9788971968413,10,"이 책은 우리 딸과 볼때마다 낄낄거리며 서로 똥똥똥~거리며 재미나게 보는 책.항상 느끼는거지만, 아이들이 좋아하고 손이 가는 데에는 다아~ 그럴만한 이유가 있다."
9788971968413,10,우리반 아이들이 가장 좋아하는 동화책으로 너무 많이 들어 이제는 똥 박사들이 되어버렸다. 반복되는 부분은 아이들이 말하고 ~~ 너무 재미있고 끝부분에는 통쾌한 복수가 두더지의 미소를 보게 합니다. 참 재미있고 재미있는 책입니다.
9788971968413,10,36개월 아들이 좋아해요 ^^ 특히 똥에 관련한 의성어가 나올때 굉장히 재미있어합니다~ 완전 대박책은 아니지만 즐거워하는 책이에요~
9788971968413,10,아이들에게 정말추천하고픈
9788971968413,10,"어린 아이들이 읽기에도, 상당히 제목부터가 신선한 이끌림이라고 표현하고 싶다. 누군가는 불쾌감을 느낄 수 있는 단어를 재미지게 잘 표현한 책인거 같다. 재밌었다 개인적으로."
9788971968413,10,아이에게 ? 물음표를 가르쳐줄수있는 좋은 책인듯합니다.
9788971968413,10,이책은  명작이다
9788971968413,10,"우리 아들이 좋아합니다
그저 똥이라면 깔깔깔..."
9788971968413,8,봤었는데 기억 안 나네
9788971968413,10,재밌고 기발해서
9788971968413,10,똥이 흥미롭다 누가 똥을쌌을까
9788971968413,6,그르게
9788971968413,10,어린이들의 스테디셀러
9788971968413,10,"재미있는 소재로 어린이의 흥미를 끌어내
아주 재미있게 읽었기 때문입니다."
9788971968413,6,이책 읽었을때 오는 느낌이 좋았습니다.
9788971968413,10,보면 볼수록 다음 내용이 궁금하고 재미있어서 좋게 읽은 책이였기 때문입니다.
9788971968413,8,"어린이들이 읽기에 편리한 구성, 너무 어렵지도 않으면서 재미있는 소재 사용"
9788971968413,10,똥에 대한 과학 상식에 재미와 위트를 더한 책입니다.
9788971968413,10,"우리아들들이 많이 좋아하는 책
두더지아저씨의 소심한 복수가 유쾌하다"
9788971968413,8,"아이들이 저절로 따라하는 ˝누가 내 머리에 똥 쌌어?˝
임펙트로 따라갈 수가 없다!"
9788971968413,10,어렸을때  재밌게봤던 책!
9788971968413,10,똥 이야기...^^작은애가 4살이라 똥에 관심이 많은 나이네요...^^자기에 변기에 싸놓고도 ˝엄마 보여줘.˝ 그럽니다...그래서인지 작은애가 이책을 재미있게 보네요...^^
9788971968413,8,"재치있는 그림도 좋고, 보통의 그림책들처럼 교훈적으로 마무리하려고만 하지않는 신선한 발상때문에 어른인 내 맘에 드는 그림책이다. 물론 아이들은 똥얘기니까 좋아한다는~ㅎㅎㅎ"
9788971968413,10,아이들이 너무 좋아하네요..아가들은 왜 똥얘기를 그리 좋아할까요 ㅋㅋ 아이들이 좋아한다는점에서 강추합니다!
9788971968413,6,똥이야기 좋아하는 아이를 위해 들였는데 생각보다 반응이 폭발적이진 않네요. 똥 모양에 따른 동물을 알려주려는 건지... 왜 베스트셀러일까요? 제목에 낚인걸까요? 더 크면 좋아할까요?
9788971968413,6,재미있게 보았는데.. 아직도 아이들에게 인기있는 것 같아 기쁘다.
9788971968413,10,어린이들은 똥 얘기를 좋아하니까요ㅎㅎ
9788971968413,6,"똥에 호기심 많은 4세 정도 내용.
이 책이 왜 인기가 많은건지,,,잘 모르겠다."
9788971968413,8,아이가 좋아해요 두더지라는것도 이해하고 토끼똥을 제일 좋아해서 항상 토끼똥만 반목반복
9788971968413,10,재밌어요~~^^
9788971968413,10,내가 어렸을 때도 이 책을 보고 자랐다. 지금 읽어도 재미있는 책
9788971968413,10,나는항상어릴때이책을읽어왔었다.지금도친구들과얘기하는도중에장난삼아˝누가내머리에똥쌌어?˝라고말하는친구들을보기도한다.그리고대부분의내친구들은이책을안다.정말신기할정도로말이다.그만큼이책이유명하고많은사람들에게관심과사랑을받기때문이라고생각한다.
9788971968413,8,"뮤지컬을 먼저 보고 책을 구입했는데
저희 아이 공연때가 생각나는지
책도 재미있게 잘 봅니다.
3~4세 아이들에게 적당한 책입니다."
9788971968413,8,아들에게 이 책을 사줬더니 제목을 읽을 때부터 참 재미있어 합니다. 모양과 형태에 대한 묘사가 많아서 참 좋았어요. 실생활에서 쓰는 말들이 많아서 아들의 어휘력도 조금은 나아질 듯합니다. 점점 말문이 트이는 아이들에게 추천 해 주고 싶은 책입니다.
9788971968413,8,그림책의 미덕은 그림이라 생각합니다. 이 책은 그런 점에서 글이 전하는것 이상으로 풍부한 내용을 전달합니다. 그러면서 다양한 연령층의 어린이가 즐기고 생각할 거리를 전해줍니다.
9788971968413,10,친구의 4살짜리 딸아이에게 선물했어요.. 매일밤 읽어준데요.. 아이들이 좋아하나봐요.
9788971968413,10,아기에게 읽어주기엔 예상보다 많은 글밥에 당황한..^^; 내용도 그림도 재미있다.
9788971968413,10,우리 아이와 함께 너무나 신나게 읽었던 책이다. 어찌나 맘에 들었든지 똥이 나오는 모양을 표현한 의태어를 다 외워버렸다^^ 아이가 있는 집이라면 한권정도 구입해도 좋을 듯
9788971968413,10,"누가 내 머리에 똥 샀어? 내용도 재밌고
아이들이 좋아해요^^"
9788971968413,8,"재미있어 보이는데, 왜 손이 안가지?"
9788971968413,10,역시 똥얘기는 인기만점~
9788971968413,6,아이가 이 책만 찾았어요
9788971968413,10,그림도 너무 맘에 들고 세밀한 표현을 보면서 왜 유명하고 사랑받는지 알겠더군요.
9788971968413,6,"제목이 내용의 전부에요...하지만 기발하잖아요^^
아이들에겐 '똥'만 얘기해도 웃음!!"
9788971968413,10,너무나 재미있는..아이가 깔깔대는 책~
9788971968413,10,그림이 정말 예뻐요. 색연필로 섬세하게 그린 느낌. 이야기도 잼나요.
9788971968413,10,똥애기만 나와도 자지러 지는 아이들에게 더 없이 좋은 책
9788971968413,8,누구야 머리위에 똥싼게...ㅎㅎㅎ
9788971968413,8,재밌어요.
9788971968413,10,아이가 정말 좋아하는 책이예요. 어쩜 어른이 봐도 재밌는지 모르겠어요.
9788971968413,10,"아가들은 역시 ""dung""을 좋아해요.^^"
9788971968413,8,아이들이 좋아하는 책~~
9788971968413,10,제목도 흥미진진하잖아요?  똥 소리만 나와도 아이들은 좋아해요. 소장하고싶어사요
9788971968413,10,"똥에 당한 두더지, 똥으로 복수하다.ㅋ~"
9788971968413,8,아이들에게 꼭~ 추천해주고 싶은 책인듯 합니다.
9788971968413,10,베스트 셀러~ 애도 어른도 재밌어요. 동물별로 다른 똥 모양이 인상적
9788971968413,8,생각보다 아이가좋아해여..
9788971968413,10,너무 재미있어요 아이들이 똥이 참 좋아해요..여러 똥이야기 책이있는데 넘버원 입니
9788971968413,10,빵꾸똥꾸
9788971968413,10,동물똥이 어떻게 생겼는지도 알수 있는 과학동화. 재미는 기본!
9788971968413,10,"아기들은 똥, 방구 이런거 너무 좋아하는 것 같아요 ^^"
9788971968413,10,지저분한 똥얘기라도 좋다! 이렇게 영리한 책이라면~
9788971968413,10,조카선물! 시간이 흐를수록 하나하나 더 많은걸 깨닳고 이야기 해요~
9788971968413,10,이름부터 너무 재밌어서 선물했는데 진짜 좋아합니다. 아이디어 굿~!!
9788971968413,10,울 둘째 읽어주려고 샀어요.. 대 만족~~
9788971968413,10,문화센터 수업에서 본 책입니다.읽어주는 저도 듣는 아이도 좋아합니다.
9788971968413,10,어른이읽어도 너무 잼있는책 찢어져 다시 사주었답니다.
9788971968413,8,유아용 영원한 베스트셀러중 하나..
9788971968413,10,아이가 참 좋아해요.
9788971968413,10,"소리내어 읽었더니, 열배쯤 귀여운 책입니다. 
함빡-웃을수 있는 책이에요 ㅎ"
9788971968413,10,딸아이가 너무 너무 좋아합니다~
9788971968413,10,두더지가 나오는 책이라며 무척 좋아합니다
9788971968413,10,아이들이 좋아할만해요 우리 아이도 이책만 보면 까르르~웃거든요
9788971968413,10,명성에 걸맞는다.
9788971968413,10,"애들이 뮤지컬을 봐서 그런지 책을 봐도 너무나 좋아라 하더라구요,,,"
9788971968413,10,재미있네요...아이도 넘 좋아합니다...
9788971968413,10,"ㅎㅎㅎ 재목 만큼이나 우리 아이가 젤로 좋아하는 책이 되었어요. ""아빠! 똥 """
9788971968413,10,언니 한테 선물하고 저도 하나 갖구 싶어서 샀어요 ㅎㅎ 너무 귀엽고 매력넘치는책^^*
9788971968413,10,아이가 예전부터 갖고 싶다고 한 책이라 읽은 책이지만 구입했습니다.
9788971968413,10,커다란 그림이 일단 마음에 들고 애들한테 읽어주니 좋아라 해요
9788971968413,6,"유치원, 초등저학년을 상대로 사고력을 기를수 있는 내용으로 구성되어있습니다."
9788971968413,10,우리아기24개월인데 완전조아라해여.아기들은 재미있나봐여 동물에대해서도배울것같거
9788971968413,10,너무 유명한 책!!  똥이라는 소재로 아이들의 호기심을 자극하는 재밌는 책에요^^
9788971968413,8,똥~! 남자아이들이 가장 좋아하는 거 내 똥이랑 비교하면서 ㅎㅎ
9788971968413,6,"니 똥 내 똥 구분할 줄 알아야 한다? 
보복하는 개념은 좀 아쉽지만요...."
9788971968413,10,똥? 아이들이 참 많이도 관심(?)을 보이는 주제죠?
9788971968413,6,베스트셀러라 조카선물로 샀는데 여자아이라 그런지 썩 좋아진 않더군요
9791186825051,10,엄마에게 사랑한다고 말한적이 있었던가?감사하고 미안한 책이네요
9791186825051,10,유아 분류에 있는 건 공명의 함정입니다. 안구에 파도가 일기 전에 도망치십시오!
9791186825051,10,책표지에 둘러싸인 종이를 여는 순간부터 마음을 찡하게 만들었던 책. 그래서 나에게 소중한 사람들을 다시금 돌아보며 아끼게 만드는 아름다운 책. 예비엄마 그리고 아기들을 돌보느라 애쓰는 많은 ‘엄마‘들에게 꼭 추천하고 싶은 책~
9791186825051,10,"내 곁에 큰 의미, 엄마 이야기다.읽을 때마다 운다."
9791186825051,10,"세상에서 가장 완벽한 단어로 이렇게 멋진 작품을 그려주신 작가에게 감사하다.1학년 아이들과 함께 읽고, 우리 오늘은 엄마에게 더 좋은 아들, 딸이 되자고 약속했다.^^"
9791186825051,10,제목부터 눈물이 핑 돌더니 마지막 책장 덮을 때는 눈물이 펑펑 쏟아지네요
9791186825051,10,"간결한 그림체, 따뜻한 색감, 굳이 말을 많이 적지 않아도 감동이 느껴지는 구성.딸 가진 친구들에게, 엄마에게 꼭 보여주고 싶은 책."
9791186825051,8,아이보다는 내가 보려고 샀는데너무 슬퍼서 보고싶지가 않아지네요...ㅎ
9791186825051,10,처음 본 날도 다시 본 날도 날 울렸던 책... 어른을 위한 진짜 그림책 같아요.: )
9791186825051,10,"엄마, 그 한마디에 담긴 큰 사랑... 깊고 진한 감동이 있는 그림책!"
9788949110097,10,"[문제해결능력, 재치] 치과의사 드소토 선생님과 선생님 못지 않은 용기와 재치가 빛나는 부인의 이야기 입니다. 타고난 작은 몸집을 더 강점으로 활용해 이 치료에 탁월한 능력을 발휘하는 드소토 선생님이 조수인 부인과 함께 음흉한 여우를 치료하게 됩니다. 치료가 끝나고 무사할 수 있는 방법은?"
9788949110097,10,발칙한 여우를 혼내주는 드소토 선생님의 지혜. 재미있게 읽혀요. 글밥도 적당해 6살 아이가 읽기에도 좋아요.
9788949110097,8,치과에 가기 싫어하는 아이들이 한번쯤 읽으면 도움이 될 책입니다
9788949110097,10,치과에 가기 싫어하는 어린이에게 그리고 직업의식과 책임감 위기를 모면하고 남을 배려하는 센스까지 읽을 수 있는 책
9788949110097,8,치과에 검진 갔던 아들이 병원하면 치과를 떠올리길래 검색해서 주문.
9788949110097,10,치카치카에 관심이 많은 두돌이후에 사주면 좋을 책
9788949110097,10,막내가 드소토 선생님에게 딱 반했어요
9788949110097,8,늑대의 꼬임에 넘어가지 않은 우리 씩씩한 치과선생님. ^^
9788949110097,8,투철한 치과의사의 직업정신과 재치가 있는 치과의사 쥐!
9788949110097,10,의사가 알아야 할 지식과 상식을 쉽게 풀어놓은 책.
9788949110097,8,은혜도 모르고 자기 욕심만 채우면 여우처럼 벌 받아요.평생 후회할 벌을.....
9788949110097,8,치과의 두려움을 재미있는 이야기로 극복해 줄수 있는 책입니다.
9791165794019,10,그림책이 한편의 시집이다. 존 클라센의 아름다운 그림과 테드 쿠저의 담담한 문장들이 잘 조화를 이룬다 시간과 변화는 실제 테드 쿠저가 중요한 주제로 다루는 것이기도 하고 이 책의 전반적인 주제이기도 하다. 세월의 흐름과 인간의 일생이 나무와 자연에 담겨있다. 서정적이고 시적이다.
