ISBN13,rating,review
9788949113692,10,"정말 감동적이네요. 딸아이가 사랑을 베풀고 나눌 줄 아는 마음 따뜻한 사람, 용감하게 도전할 줄 아는 사람, 넘어져도 다시 일어나 갈 길을 가는 꿋꿋하고 유연한 사람으로 자라길 바라는데요,이 책에 그런 사랑, 용기, 도전, 배려, 은혜 모든 것이 담겨 있어서 참 따뜻하고 아름다워요~"
9788949113692,10,"책을 읽고 아이들과 독후활동을 했더니 되게 좋아했어요. 배려심, 진짜 용기에 대해 고민해볼 수 있는 작품이었고,. 뒷이야기를 이어썼는데 이야깃거리가 많이 나와 좋았습니다."
9788949113692,6,순수하고 순수한 책입니다. 긴장감도 한편의 영화처럼 느낄 수 있도록 구성되어 있고요. 읽는동안은 세상에서 가장 용감한 소녀를 바로 옆에서 지켜보는듯한 느낌이 드는 책이었던 것 같습니다.
9788949113692,8,"세상에서 제일 용감한 소녀가 아닐지도 모르지만, 가장 따뜻한 인간애를 지닌 소녀인 것은 맞다. 글자 없이도 많은 이야깃거리를 담아둔 책 덕분에 한편의 스톱모션 애니를 보는듯한 느낌이 든다. 이 책을 보고 난 뒤에는 자신이 모험을 무사히 끝낸 것 처럼 뿌듯해하는 아이들이 재미있다."
9788949113692,10,"긴장감의 표현이 너무 좋은 책 , 아이와 나눌 이야기가 너무나 많은 책입니다."
9788949113692,10,이전에 봤던 그림책과는 굉장히 다른 느낌인 것 같아요~ 글이 없어서 신기하기도 하네요 ㅎㅎ 아이에게 색다른 그림책을 보여준것 같아 좋았습니다.
9788949113692,10,더운 여름날에 보기 딱 좋은 시원한 표지인 것 같아요 :) 특히 이야기들과 함께 삽화들이 참 마음에 들었는데요. 책을 보다보면 마치 애니메이션 영화를 한 편 본 것 같답니다!
9791186621707,8,"모두의 정성이 차곡차곡 모여 완성된 맛있는 케이크. 생쥐의 눈물에 가슴이 짠했다. 눈에 보이지 않아도, 손에 잡히지 않아도 가치 있는 것이 있음을 알려주는 마음 고운 책."
9788952784414,10,역시 옐라 마리답게 심플한 그래픽과 심플한 내용. 마지막에 급 끝난다는 느낌을 받는건 나뿐일까.
9788952784414,10,아이가 지금 닭을 좋아해서 구매했어요. 저는 글이 없고 그림만인게 더 맘에 들어요. 항상 이야기가 달라지고..아이도 재미있어 합니다.
9788962478815,10,읽던 것만 읽는 아들이 처음에는 시큰둥하더니 읽어줬더니 그 다음부터는 엄청 좋아하네요한 번 읽으면 4-5번 읽어 달라고 합니다.내용도 간단하면서 아이가 뭔가 깨닫는 것(?)도 있고 특히 마지막장 그림이 재밌네요 (자기랑 증상이 같아서 막 감정이입을 ㅎㅎ)
9788962478815,10,25개월 아이에게 읽어주기 정말 좋은책인거같아요마음이 따뜻해지고 색감이좋아 잠들기전에 읽기 정말좋아요
9788962478815,10,"성인이 읽어도 위로가 되는 책인거 같아요.그림책을 평소에 좋아하는 데, 요 작가님 책은 처음인데 엄마의 위로를 느낄 수 있었어요. ˝특히 엄마 공룡이 아기 공룡 혼내지 않고 배만져준거랑 큰 달똥 싼거^^˝, 야금야금 먹었던 내 욕심, 엄마만은 어루만져주는 현실과 비슷하네요~ 감사해요~"
9788915104884,2,글을 모르는 아들이 티라노가 아니라고 난리에요 ㅠㅠ자세히보니 티라노앞발가락이 3개네요??!!!책 만드신분 최소한 공룡에대해 알고 그리시길요...
9791196075156,10,학생들과 함께 읽고 싶어서 구매했어요~~
9791196075156,10,마음 깊숙하게 울려오는 바닷소리.엄마의 노랫소리.그것으로도 충분히 눈시울이 뜨거워진다.
9791196075156,10,감동적이고 잔잔한 감동을 주는 동화입니다.에바엘버슨의 행복한 작품을 좋아해서 전시관람전에 구매해서 읽어 보았습니다.전시장에서 영상으로 엄마는해녀입니다가 흘러나오는데 눈시울이 적셔질 정도로 감동이었습니다.누구든지 살아내기위해 애쓰고 노력하는것이공감되었습니다.
9791196075156,6,"5세(만3세) 남자 아이인데, 저희 아이가 읽기엔 글이 좀 많은 것 같아요;;; 내용은 참 좋은데 아직 좀 어려워하네요 크면 다시 읽어주려고요~"
9791196075156,10,바다를 사랑한 제주 해녀들의 모습에서 아름다움이 느껴지네요. 따뜻한 그림체가 인상적입니다.
9791196075156,10,소박한 제주 해녀의 숨비소리가 독자들에게 잘 전달되네요.
9791196075156,10,재주 해녀 삼대의 따뜼한 가족애와 해녀의 강인한 삶을 느낄 수 있는 책이네요.
9791196075156,10,딱 네 숨만큼만 살아라.
9791196075156,10,아름답긴 하지만 지루하다
9791196075156,10,할머니 머리색이 노랑이라서 깜놀..ㅎㅎ 예쁜 그림책이에요^^*
9791196075156,8,"에바 알머슨의 그림을 이렇게 만나니 좋아요~그림과 글이 잘 어울리는 책, 쉼이 필요한 날 함께 하기 좋은 책입니다.^^"
9791196075156,10,역시 에바 알머슨 그림이야. 그녀의 그림을 보고 있으면 같이 행복해지는 느낌이 든다. 행복한 미소. 모든걸 안을수 있는 미소 말이다. 마지막 말은 우리 모두에게 하는 말이다. ˝오늘 하루도 욕심내지 말고 딱 너의 숨만큼만 있다 오거라˝
9791186075944,6,그림책은 이야기의힘이 있을 때 더 빛난다.
9788952782847,2,중고책 구입할때마다 환불처리해서 안좋습니다
9788952782847,6,우리애는 크게 재미있어하지 않았어요유명한책이라 샀는데 전 읽어주기엔 글밥이 좀 많더라구요다시 읽어봐야겠어요 ㅎ
9788952782847,10,피튜니아의 깨우침 ˝지혜는 날개 밑에  지니고 다닐 수는 없는 거야. 지혜는 머리와 마음속에 넣어야 해.˝  하지만 그 시작은 일단 날개 밑에 지니고 다니는 것부터 시작이겠죠?  피튜니아 완전 귀요미~
9788952782847,10,책읽기를 싫어하는 아이들에게 추천할 만한 책이예요 나이를 불문하고요
9788952782847,10,"진짜 지혜는 장식용 책이 아니라, 책을 읽고 머리 마음으로 체화시켜야 얻을 수 있지!"
9788955823905,10,아빠를 위한 그림책이라고 강력히 추천하고 싶다.  책을 덮는 순간 잔잔한 미소한 코끝의 찡함을 느낄 수 있다.
9788955823905,8,아들을 가진 아빠라면 두고두고 두면서 읽어도 좋을책...처음에는 장난스럽게 시작하다가 마무리는 어른스럽게....아빠에 대한 멋지고 좋은 기억들을 간직할 수 있게 도와주는 것 같아요.
9788952784896,10,코를 킁킁책 제목이 바뀐 거? 인가 보다.제목이 유명했었는데...
9791158360351,10,무엇이 살면서 중요한 가치인지 깨닫게 해 주는 재밌고도 찡한 동화책입니다.
9791158360351,10,뭐 심각하게 보지않음 재밌네요~ 근데 주인공인 개. . 버림받고 성공하지만 세입자인 인간가족들에게 시달림받는. . 마지막에 개의 선택이란~
9791158360351,8,사람한테서 달콤한 사랑하고 그악스러운 미움을 함께 받은 개 한 마리가 홀로서기를 하려 한다. 스스로 씩씩하게 거듭나서 밑바닥부터 쌓아올려 으리으리한 집을 얻는다. 그러나 겉으로만 으리으리할 뿐 마음은 ‘사람 미워’가 가득한 터라 쓸쓸하다. 사람은? ‘어른 사람’은 얼마나 ‘사람다울’까?
9788952782731,10,"모리스 샌닥이라서, 샀습니다. 어른들의 시각이 아닌, 아이들의 상상력을 통해 이야기가 시작됩니다. 이게 재밌나? 할 내용에도 딸이 여러번 보며 너무 좋아하는 걸 보면 정말 대단한 작가다 싶습니다. 모리스샌닥이라는 이름으로, 계속 책을 구입하고 있어요^^"
9788952782731,10,그림과 함께 상상하며 읽을 수 있어 재미있네요.
9788952782731,8,꼭 이불 같이 포근하고 꿈 같은 이야기다.
9788952782731,8,독특한 그림체와 함께 상상력을 자극하는 이야기가 미소를 짓게 만든다.
9788952782731,10,표지의 세련됨 때문
9788952782731,8,"읽어봤는데 상상력이 풍부하고 그림체도 너무 귀엽더군요!
원서는 라임도 맞췄다는데 원서로도 보고 싶어졌어요///"
9788952782731,10,"재미있는 상상과 따뜻한 그림, 컬러에 반해서 샀는데, 선물용으로도 좋은듯."
9788952782731,10,"유치원 6살 아이가 이 책을 꼭 사야 한다고 해서 샀는데, 정말 재미있게 봅니다. 발간된지 오래된 책인데, 아이들이 공감하고 좋아하는 걸 보니, 좋은 책은 좋은 책이네요."
9788952782731,10,잠자기 전 해보았을 상상을 잘 표현해서 기분좋게 봤네요~^^
9788952782731,10,상상력이 아주 풍부한 동화책 입니다.
9788952782731,8,오자마자 그날 밤 바로 읽어버린책....  단순하지만 재밌어요.
9788952782731,10,모리스 샌닥을 믿고! 본문의 글씨체도 평범하지 않아서 더욱 좋았어요!
9788952782731,8,꿈과 상상
9788952782731,10,역시 작가의 이름을 믿고 산 책답게 풍부한 상상력이 돋보이는 작품
9788952782731,8,상상력이 폴폴 샘솟는 귀엽고 사랑스러운 동화네요~!저도 어릴때 늘 내가 잠들어있는동안 집안에서 무슨일인가가 일어나지않을까하는 귀여운 상상을 하고 했었는데~
9788952782731,8,상상의 힘이란!
9788952782731,8,"빵이 될 뻔한 미키가 밀크를 구해오면서 빵의 공급이 원활해졌다는 꿈 같은 이야기. 다른 방식으로 현실을 말하려는 시도가 인상적이긴 한데, 재미있을 뻔 했다. 느낌을 모르니까."
9788952782731,8,"역시 아쉬운 점은 원어의 느낌이 살아나지 않는다는 것. 상상력 자체는 흥미로운데, 표현이 그것을 뒷받침해주지 못한다."
9788952782731,8,아이들이 상상력을 자극하는 재미있는 동화^^
9788952782731,6,좋긴한데 영어여야 느낄 수 있는 단어 유희를 한글로는 느낄 수 없네요. 아쉬워요.
9788952782731,10,영어버전이있어샀는데테잎이없어아쉽긴하지만정말조카가좋아하네요^^이쁜조카선물
9788952782731,4,우리나라 정서에는 잘 맞지 않는 듯.
9788952782731,8,"잠자기 전 어린아이에게 동화를 들려주고, 아이에게도 당신에게 이야기를 하나 둘 들"
9788952782731,8,좋아요
9788952782731,10,반죽에 밀크를~~노래하며 즐겁게 읽네요^^
9788952782731,10,"재미있고, 맛있고, 보기에도 좋은 책.
아이들이라면 누구나 빠져드는 매력이 있"
9788952782670,8,"단란한 가족 다섯명과 강아지 한마리가 함께 곰 사냥을 떠난다. 우여곡절 끝에 만난 곰이 너무 무서웠는지, 힘들었던 길을 되돌아오는데, 곰은 이 가족이 좋은지 끝까지 따라온다.마지막에 돌아서는 곰의 뒷모습이 쓸쓸해 보이는 건 내 기분탓인가?ㅋ"
9788952782670,10,리듬감을 느낄 수 있게 만드는 반복어구들이 매력있는 책.
9788952782670,8,아이들과 잘 보고 있습니다
9788952782670,10,리듬감이 있어서 읽고 있으면 매력적이 책
9788952782670,10,"리듬감 있는 운율, 다양한 표정, 포즈.. 
이토록 사랑스러운 책이 또 있다니..
작은 아이도, 큰 아이도 모두모두 사랑하는 
우리집의 베스트셀러"
9788952782670,8,"나와는 다르게 최고의 책에 자기가 읽고 있던 책들이 뜨는 걸 보며 하겠다고 옆에 앉아 골랐다.
전반적으로 색상이 차분하고 그림이 예쁘긴 했다.  
 계속 반복되어 나오는 노래를 이렇게 불러 보고, 또 저렇레 불러보면서 힘들었던 기억이 나는데."
9788952782670,10,"반복적으로 나오는 단어들이 아이가 매우 재미있어한다.
상황에 맞게 빠르게 느리게 읽어주면 까르르 까르르 넘어가는 모습을 보면 내가 더욱 즐거워진다. 아이를 즐겁게 나를 즐겁게 해주는 책이다.^^"
9788952782670,6,아이들에게는 다소 무서울 수도 있을 듯합니다.
9788952782670,10,"이 책은 5살 아이도 3살 아이도 좋아합니다.
신나게 읽어주고, 원서 노래도 듣고나면
꼭 곰사냥을 떠나는 놀이를 합니다.
안방 문을 열고 들어가 문을 닫고 이불 속으로 들어가
｀다시는 곰 잡으러 가지 않을테야!｀를 외치고 까르르 웃지요^^"
9788952782670,10,"다양한 소리 표현 방법과
도망가는 긴박감을 느낄 수 있습니다.
아이들이 좋아해요."
9788952782670,8,영어노래와 함께 재미있게 책을 읽을 수 있어서 아이들이 좋아한답니다!
9788952782670,10,"정말 아이들이 좋아하는 책입니다.
어른이 읽어도 재미있지만 어쩡 이렇게 아이 눈높이에 
맞추었는지 신기해하면서 읽어주게 됩니다."
9788952782670,10,"딸과 함께 음율 만들어 읽는데 간단한 내용이지만
곰이 집까지 따라오는 장면에선 스릴넘치고 재밌었어요"
9788952782670,10,뛰어난 운율과 역동적인 그림이 멋진 책입니다 곰사냥을 떠나고 함께 도망오며 주인공에 동화되고 말곤 하죠^^
9788952782670,10,아이들에게 보다 넒은 세사이 있다는걸 알려주고 싶어서~~~
9788952782670,10,아주 어렸을 때 읽었던 책인데 바람이 부는 듯한 삽화가 어린 나이에도 아주 인상 깊게 남았던 기억이 나요. 오랜만에 보니까 정말 좋네요. 곰 사냥만의 어쩐지 선선하면서도 연필의 무늬가 있는 색감이 예뻐요
9788952782670,8,이 책을 간단한 노래로 만들어서 불러줬더니 아들이 정말 좋아라 하네요. 곰사냥을 떠나자~ 큰 곰사냥을 떠나자~ 우린 하나도 안 무서워~~ 라고 내용도 그렇고 의외로 여기저기 떠났다가 곰을 만나 깜짝놀라 돌아와 숨는 것이 재미있었습니다 ^^
9788952782670,10,이 책은 운율에 맞춰서 읽어주면 아주 재밌습니다. 우리 아이 어릴 때 거의 처음으로 산 그림책
9788952782670,10,"두려움과 배움은 함께 춤 출 수 없다를 그림으로 
설명한 책 무시무시한 곰이 어떻게 변하는 지 
이야기속에 서서히 빠져든다."
9788952782670,8,그림도 멋지고 이야기도 좋아요
9788952782670,10,"우와 이책ㅋㅋㅋ 어릴때 학원에서 원서로 봤던 책이네요. 진짜 좋아했어요! we are going on a bear hunt ~~ 그리고 im not scare 하면서 끝나는게 반복되는데, 이게 실제로 노래가 있어요. 멜로디를 지금 8년이 지났는데도 기억하고 있네요 ㅋㅋㅋ"
9788952782670,10,"이 책은 다 읽고나면 우와- 이 책 좋다, 하고 히죽히죽 웃게되는데 ｀왜 좋냐｀ 라고 물어보면 뭐라고 답을 해야할지 모르겠다. 왜 좋은지 모르겠는데 여튼 참 좋다, 이 책."
9788952782670,8,리듬감과 상상력이 좋은 책 곰 잡으러 간단다 노래도 이 동화책에서 나온거라는 생각이 드네요
9788952782670,10,"모험을 좋아하는 남자 아이를 위해서 구매했어요장마다 반복되는 어구가 지루할 법도 한데 약간 과장된 음성으로, 리듬감을 실어서 흥미진진 모드로 읽어주니 아이들이 너무 좋아하네요팝업북도 사고싶어졌어요^^"
9788952782670,10,읽는 리듬감이 좋다.
9788952782670,10,이 책은 오래 전에 읽었던 것인데 소장용으로 구입했어요. 글자의 크기 변화와 반복적인 내용 구성이 리듬감을 주어서 아이들과 즐겁게 읽을 수 있는 책이랍니다.
9788952782670,10,우리아이 5살인데 너무나 좋아합니다 엄청 웃고 내용도 간단하고 쉬워서 그런지 ˝그건 내 조끼야˝완전 비슷하네요 아이와 친해지는 계기가 되어 더욱 만족합니다
9788952782670,10,리듬을 타고 목소리를 크게했다 작게했다 하며 읽으면 더욱 재미있는 책이다. 가족들의 표정도 재미있고 도망가는 모습은 더욱 재미있다. 약간 더 오버해서 읽어주면 정말 곰에게 쫓기든 호들갑을 떠는 아이를 보면 배꼽을 잡게된다
9788952782670,10,리듬감때문인지 아이들이 좋아하죠.
9788952782670,8,"몇 번 읽어줬더니 아이가 외우고 따라 했어요
다양한 표현들도 익힐 수 있습니다
내용은 단순하지만 대단한 책이지요"
9788952782670,10,"문을 열고, 배낭을 챙겨...
얕은 시내를 건너...곰을 잡으러 간다네...
어차피 곰은 없을 테니...
그런데 이런, 진짜 곰이 나타났다네...
멍멍아, 아이야...얼른 도망을 가자꾸나^^"
9788952782670,10,아이가 참 좋아하네요 까르르 넘어갑니다
9788952782670,10,원색과 화려함을 내세운 그림책들 사이에서 오히려 개성을 발하는 책.
9788952782670,10,의성어의태어가 만아서 좋네요.
9788952782670,10,가족과의 모험과 의성의태어에 대한 반복 잘 알 수 있는 책
9788952782670,8,곰사냥을 나가면서 장소의 이동과 그때마다 나오는 의성어에 아이가 귀를 곤두세우는 거 같네여 저는 개인적으로 이 책 참 마음에 들고 몇 번씩 보여주곤 합니다.
9788952782670,6,"아직 아이가 어려서인지 다른 책만큼 관심을 두지 않네요. 상대적으로 단조로운 그림과 색깔 때문일까요.
좀 더 자라면 좋아하겠지 싶어 책장에 잘 꽂아두었답니다."
9788952782670,10,의성어와 후렴처럼 반복되는 문장이 흥을 돋구어 주는 재미있는 책~
9788952782670,10,책 오자 마자 표지보더니 환호성을 지르는 두 아이를 보니 너무 기분이 좋으네요~ 책 읽으란 얘기 하지 않아도 스스로 펼쳐 동생에게 읽어주는 큰아이를 보며 뿌듯해 했답니다. 무섭지 않은데 왜 도망치냐고 하네요^
9788952782670,10,기본이 정말 탄탄한 책입니다 이런 아동도서가 앞으로도 쪽 나오기를...
9788952782670,10,집중해서 잘 보고 아기가 좋아하네요~
9788952782670,8,딸아이와 침대에서 뒹굴며 볼 수 있는책
9788952782670,10,추천해서..
9788952782670,10,워낙 명작이라 말이 필요 없네요. 좋습니다. ^^
9788952782670,10,그림과내용도재미있고소리내어같이읽고행동하기참좋은재미있는동화 어흥흉내내기신나
9788952782670,10,처음에 영어로 샀다가 한글책을 다시 산 유일한 케이스. 번역의 의성어가 재미있다.
9788952782670,6,부모만 좋아하는 동화책? 운율이 있는 것도 아니고 그림도 그렇고 애는 별로라하네요.
9788952782670,10,번역서지만 입말을 살려 읽을 수 있는 책이다. 그림도 너무나 훌륭한..명성 그대로다!
9788952782670,10,말이 필요없는 명저.. 여기저기서 권해준데는 이유가 다 있군요 ^^
9788952782670,10,시처럼 거듭되는 음율이 꼭 시 같아요 전래동화 읽어주는 기분이라 만족
9788952782670,10,"아이들도 줄줄 외어 이야기하는 책이 되었습니다.
반복되지만 변화를 주는 문장!"
9788952782670,6,"반복적인 어휘와 전개내용이 은근 중독되네요. 7살,8살 아이가 너무도 좋아라합니다^^"
9788952782670,8,3살애기한텐 흥미가 안나나봅니다. 책이 무지 커서 큼직합니다.그림이 참 담백합니다
9788952782670,10,제 생각엔 원서가 더 나은것 같지만 한글판도 재밌어요 ~
9788952782670,10,엄마인 제가 좋아해서 원서도~ 이렇게 번역본도~
9788952782670,10,온 가족이 함께 곰 사냥을 떠납니다~ 아이고 곰이다~~~ 다시 집으로 돌아옵니다~
9788952782670,10,처음에는 관심 없더니 지금은 너무나도 좋아하는 책이에요
9788952782670,10,"책도 큼직하고, 글씨도 크고, 아이한테 읽어주기 신이 납니다. 재미있네요^^"
9788952782670,10,글밥이 많아서 너무 일찍 구매한건 아닐까 했는데 아기가 정말 좋아하네요. ^^
9788952782670,10,정말 사랑하는 책이다. 아이들과 행복한 놀이를 할 수 있는 소중한 책.
9788952782670,10,넘 재미있어요.
9788952782670,6,책 크기가 이렇게 큰줄 몰랐네요. 흙백이었다가 칼라였다가..재밌습니다.
9788952782670,6,책이 조금 크지만..아이가 참 조아해요^^
9788952782670,6,울 조카 책을 보고 아들이 넘 좋아라 해서 주문햇는데 참 재밌는 책입니다.
9788952782670,8,돌잔치 선물로 구입했습니다. 아기 엄마가 너무 좋아하더군요.
9788952782670,10,"6살 딸아이가 무척 좋아했어요. 그림도 예쁘고, 글씨크기도 실감나고, 운율있는"
9788952782670,10,너무나 환상적인 곰사냥
9788952782670,10,아주 의성어가 가득한책 노래처럼 읽어주니 아들이 너무좋아해요
9788952782670,10,아이들에게 흉내내기 표현법을 잘 알려줄수 있어 좋고 너무 제미 있어요
9788952782670,10,정신없이 뛰고 싶은 이야기...^^
9788952782670,6,어떻게 읽어주느냐가 중요해요 진짜 곰사냥을 떠나는것처럼 씩씩하게 읽으면 좋아해요
9788952782670,10,아이들에게 읽어주었는데 참 좋아하네요
9788952782670,10,재밌어요. 아들도 좋아하구여
9788952782670,10,오호~ 정말 훌륭한책이예요.. 밤마다 이책읽어주면 바로 잠듭니다ㅎㅎ
9788952782670,10,우리아기3살때가장 좋아한 책중하나예요. 곰이나오면무섭다며숨는우리아기가 귀여워요
9788952782670,10,음악극으로도 많이쓰이는책으로원어책도구입해오디오북을 통해서 영어의 자극도 주자!
9788952782670,10,유아들도 물론 어른들도 좋아할 만한 책이라고 생각되네요^^
9788952782670,10,음률을 살려서 읽으면 더 좋은 책 저는 율동도 해요^^
9788952782670,10,"어릴 때 듣고 자란 자장가처럼 평생을 함께 할 것 같은 상상, 그림, 글."
9788952782670,8,18개월 소피아는 책속에서 베어를 찾는다 .위트있는 유머를 공감하긴 기다려 줘야되
9791155090572,10,남자아이라 정말 좋아하네요 : ) 공룡들도 배울 수 있고 유익해요 ^^
9788983896605,10,"겨울의 문턱에서 아이가 읽고 울컥하고 뭉클하다는, 그림까지 아름다운 그림책입니다. 자연과 나이듦의 아름다움을 시인의 눈으로 볼 수 있었던 소중한 시간이었어요!"
9788983896605,10,시와 그림이 아름다워요
9788961771238,8,"[친구, 소통] 넓은 바다에서 각자 조그만 배를 타고 가다가 만난 피트와 패트. 곧바로 단짝 친구가 됩니다. 그런데 시간이 흐르고 여행이 지루해지면서 크게 싸우고, 엉킨 실타래가 둘을 가로막습니다. 오랜 시간이 걸려 둘은 엉킨 실을 풀어내고 다시 사이가 좋아집니다. 다행이네요. 실이 풀려서요.^"
9788992505529,10,그림이 참 따뜻하다. 동물들도 행복하게 사는 세상이었으면 좋겠다. 찰칵!
9788992505529,10,동화 숲속사진관은 따뜻함이 담뿍 담겨 흐른다. 익살스럽고 개구진 모습의 동물가족들과 마음을 모아 판다의 가족이 되어주는 숲 속의 친구들은 어른인 내게도 아스라한 감정이 들게한다.
9791158360061,10,빵공장이 들썩들썩과 더불어 아이들이 좋아하는 책입니다. 비행기가 부웅부웅 보다 이걸 더 좋아합니다. 말썽을 펴서 ‘펑‘터지는 장면에서 다들 깔깔거리며 좋아합니다. 그림에서 볼 것도 많고 귀여워요. 병아리 시리즈도 소소하게 볼만합니다. 그것도 추천합니다.
9791158360061,10,바퀴달린 것이라면 무엇이나 좋아하는 우리 아들에게 딱 ^^
9791158360061,10,"[친구,유머]무표정한 표정이 압권인 말썽쟁이 8마리 야옹이들의 이야기입니다. 구도 노리코 씨의 글과 그림은 참 기분이 좋아집니다. 기차를 몰래 탄 녀석들 석탄을 신나게 넣고 달립니다. 배가 고파져서 구워 먹으려고 넣은 옥수수들이... 무릎 꿇고 용서비는 녀석들 모습에 푹 터졌습니다.^^"
9791158360061,10,빵공장도 그렇고 4살 아이가 많이 좋아하네요. 일주일에 서너번은 꼭 읽어요.
9791158360061,10,우하하. 이번엔 기차에서 사고친 야옹이들!기다렸어요- 야옹이 시리즈.작가인 구도 노리코의 그림과 이야기가 너무 마음에 든다.
9788901166421,10,글이 없는 그림책. 그래서 더욱더 상상하게 만드는 책. 어느덧 나도 모르게 고개를 숙여 책 속에 빠져있는 나를 발견하게 만드는 책. 수만가지의 이야기가 상상이 되어 처음부터 다시 열어 보게 되는 책.
9788901166421,8,이야기가 없는 그림책입니다.아이들이 마음대로 스토리를 생각하며 상상의 나래를 펼칠 수 있지요.그림동화계의 포스트모더니즘이라고 해야될까요?재미있습니다.
9788901166421,10,상상력 최고~글이 없어도 너무 흥미진진
9788901166421,10,그림이 아주 멋지다. 내 아이에게는 로봇이 안나오는 그림책의 대화를 상상할 만큼은 아니다.
9788901166421,10,엄마의 상상력이 풍부하지 않아서 그런지 재미있게 읽어주진 못했지만 그림을 좋아했어요. 읽어주는 가이드가 있으면 좋겠다는 생각을 했답니다. 4살 아이도 흥미있게 잘 봅니다
9788901166421,10,후속작 ｀퀘스트｀ 도 좀 내주세요
9788901166421,10,"아이가 다음 장면 내용에 대해 걱정하고, 기뻐하고, 궁금해하는 등 책 속에 푹 빠진 모습을 보여줬어요. 충분히 매력있는 책입니다."
