ISBN13,rating,review
9788901163635,8,"저도 요즘 은이처럼 종이가 좋아지고 있습니다. 예쁜 편지지에 글도 써보고, 카드도 만들어보고 있거든요. 은이와 놀아주지 않는 아빠가 종이아빠로 변해서 같이 놀아주는 것 같은데요. 상상력이 뛰어난 것 같아요. 읽으면서 앤서니 브라운의 고릴라도 떠올랐어요. 아빠들은 왜 맨날 바쁠까요~"
9788901163635,10,"그림도 내용도 굉장히 좋은 책이네요. 가족이 함께 읽고 뮤지컬로 즐기기에도 손색이 없겠어요. 아이와 부모 양 쪽에게 즐거움과 교훈을 모두 안겨주는, 올해 그림책 중 단연 최고가 아닐까 생각합니다. 일러스트레이션에서도 깊은 인상을 받았습니다."
9788901163635,10,소중한 시간은 돌아오지 않습니다. 아이들이 크고 나면 후회되는 일이 많아요. 언제 젖어버릴지 모르는 아빠! 가족의 소중함이 상상력이 풍부한 그림책을 통해 느낄수 있습니다.
9788901163635,10,아기 낳으면 보여주고 싶은 책이네요. 추천합니다 추천!~
9788901163635,10,"고작 48쪽에 만원이지만, 종이로 변해버린 아버지의 이야기가 너무 감동이어서 1만원을 더 얹혀 사고싶습니다."
9788901163635,10,종이로 변해버린 아빠! 가정에서 아버지의 위치를 다시 제고함과 동시에 아버지에 대한 자식들의 사랑과 관계성을 부각시키는 감미로운 이야기!
9788901163635,10,"갑자기 종이인형으로 변해버린 아빠 바람에 휩쓸려버리고 아빠를 찾아 떠난 은지, 종이인형 아빠를 찾을수 있을까요?공연에서 직접 페이퍼 아트에 참여할수 있어요."
9788901163635,8,"아빠에게 아이하고만 보내는 시간이 주어진다면 무얼해야하지? 어떤걸 해야하지? 고민이 들때 이 책을 통해서 아빠,아이 모두 재밌게 시간을 보낼수 있지않을까싶습니다.그리고 무엇보다 아이의 정서발달에 좋은 영향을 줄 것 같다는 기대감이 드는 책이네요..^^"
9788901163635,10,상상이 책으로 표현되고 책을 통해 다시 상상을 표현해본다는것만으로..창의력이 대방출될것 같은 느낌입니다.^^ 아빠와 아이가 정말 시간보내기 좋은 것 같습니다.
9788901163635,8,훌륭한 현대 동화입니다.
9788901163635,10,시간내기 힘든 요즘..무엇을 하면서 보낼까 하는 고민을 덜어주는 책인듯 합니다. 아이와 재밌게 시간을 보내기에 딱!! 좋은 책이네요~^^
9788901163635,8,직업 상 시간적 여유가 있어 아이들과 그래도 자주 놀아주는 편이지만 아이들의 입장에서는 충분하지 않다고 느끼겠죠.아이가 바라는 건 대단한 게 아니라 그냥 아빠가 옆에 함께 해 주는 것만으로도 행복해 한다고 생각하는데.이 책을 보며 아이와 더많은 공감대를 나누고 싶다는 생각이 드네요.
9788901163635,10,아이들과 같이 읽으며 소통할수 있었던 좋은 기회였습니다
9788901163635,10,항상 바쁜 아빠지만 이 책으로 아이와 좀더 소통하는 계기가 되기를 바랍니다
9788901163635,6,종이아빠는 아이랑 남편이랑 읽히고 싶네요...
9788901163635,10,마음 한켠이 따뜻해지네요. 정말 재밌어요!
9788901163635,10,아이디어도 너무 참신하고 재밌었습니다.
9788901163635,10,따뜻함이 느껴지는 책이네요~아빠랑 놀고싶은 아이들도 서툰아빠들도 행복하게 해주는 책!!참 좋습니다~~
9788901163635,10,따뜻한 색채로 그려진 그림체가 사랑스럽습니다. 아빠와 아이의 시간이 많아지길 바라며 기대되네요.
9788901163635,10,아빠와 같이있는 시간이 얼마없는 아이를 위한 책이에요. 이 책을 통해 아이와 함께 할수있는 시간이 많아지길 바랍니다
9788901163635,8,작은 감동과 따뜻함이 담겨있는 여러사람들에게 추천해주고 싶은 도서이다~!
9788901163635,10,아빠와 아이가 함께 읽으면서 사이도 좋아지네요. 나중엔 가족끼리 함께 읽어봐야겠어요.
9788901163635,8,정말 사랑스러운 책이네요. 일본에서도 큰 사랑 받기를 바랍니다
9788901163635,10,사랑하는 조카 가족에게 선물하고 싶은 책입니다. 바쁜 삶속에서도 아이와 소통하는 부모가 되어야 할 것 같아요.
9788901163635,10,아이와 놀이를 통해 교감하고 싶지만 항상 바쁘다는 핑계로 소홀했었는데 종이아빠라는 책을 보고 정말 많은 것을 느꼈어요.
9788901163635,10,"좋은 남편은 될 준비가 되어 있지만,좋은 아빠가 될 준비는 덜 된 남자들이라면 꼭 한 번 읽어 볼 것을 추천하고픈 책이다."
9788901163635,10,아버지학교를 다니는것도 좋겠지만. 이런 예쁜그림책을 읽어주며 아이와의 거리감을 좁혀가는것도 좋을것 같네요.
9788901163635,10,아이와 놀아주고 싶은데 뭘해야할지 모르는 아빠들이 읽으면 좋을 그림책입니다.!!
9788901163635,10,삽화와 내용이 너무 마음에 듭니다
9788901163635,10,아이들과 읽다 보니 마음이 따스해지고 교감하기에 좋은 책입니다
9788901163635,10,아빠와의 행복한 시간을 갖기에 정말 좋은 책일 듯 싶어요.
9788901163635,10,아이에게 아빠의 존재의의에 대해 생각해 보게 만드는 책이 아닐런지
9788901163635,10,아빠와 아이의 교감을 위해 더할 나위 없이 좋은 책인 것 같습니다.
9788901163635,8,상상력과 아이의 소망이 만나 만들어진 아름다운 동화.
9788901163635,8,아버지에게 있어 자식과 최고의 커뮤니티를 할수 있는 방법인것 같네요.
9788901163635,8,마음을 따뜻하게 해주는 이야기.
9788901163635,10,육아의 많은 부분을 엄마에게 넘기는 초보아빠들이 읽어보면 좋을 듯 하네요. 아이들에게 읽어주면서 초보아빠들에게도 도움이 되길.
9788901163635,10,아빠가 읽어주면 아이들이 더 좋아할 것 같네요.
9788901163635,10,아빠와 자녀간의 유대감 형성에 좋을 책이네요.
9788901163635,10,그림도 이쁘고 아이와 아빠가 함께 읽으면서 정도 더 도타와질꺼 같네요~~
9788901163635,10,일본에 수출까지 되다니 더 잘됬으면 좋겠어요.
9788901163635,10,아이들을 위한 동화책이 아닌 초보 아빠들을 위한 그림책이네요. 아빠가 읽어주며 아이들도 좋을거 같고 아빠들도  무엇인가를 느낄 수 있을거 같네요.
9788901163635,8,아이와 아빠가 함께 읽으면 좋을 것같아요
9788901163635,8,매우 흥미로운 책이었습니다.
9788901163635,10,아이들이 좋아할 것 같은 내용으로 가득한 책
9788901163635,10,"잠깐 아이와 함께한다고 해서 큰 일이 나는 것도 아닐텐데, 은이와 아빠가 서로에게 서서히 마음을 열어가는 모습을 지켜보면서 가슴 한구석이 찡할 아빠가 적지 않을듯 싶네요. 아이와 놀아 준다는 마음이 앞서기 보다, 나 또한 다시 올 수 없는 소중한 시간을 함께한다는 깨달음을 얻기를 바랍니다."
9788901163635,10,육아에 서툴기만한 남편에게 많은 도움을 줄 수 있는 책인거 같습니다. 항상 아이들과 있을때 어색해하고 거리감을 느끼는거 같았는데 이책을 읽고 많은 노하우를 배울수 있어서 좋습니다.
9788901163635,10,아빠와 아이가 이 책으로 조금더 가까워 지며 좋겠어요.
9788901163635,10,종이로 변해버린 아버지를 통해서 아버지들의 소중함과 가족간의 소중함을 아이들에게 쉽게 일꺠워줄 수 있는 좋은책이라는 생각이들어요 아빠는 나에게 어떠한 존재이고 나는 아빠에게 어떠한 존재인지 아이들이 생각해볼 수 있는 기회가 되었으면 좋겠습니다.
9788901163635,10,"아이가 아빠의 소중함을 깨닫고, 아빠도 아이와 함께 놀아주며 유대감 형성에 그만입니다"
9788901163635,10,아빠랑 놀고싶은 아이들의 마음을 가득 담은 책이라 좋아요!
9788901163635,10,"종이로 변해버린 아빠와, 어떻게 시간을 보낼수 있을지. 아이와 아빠가 같이 읽으면 좋을것 같아요."
9788901163635,10,종이로 된 아빠와 함게 즐거운 시간을 보내는데요. 그런데 위기도 있군요. 종이로 된 아빠가 비를 맞았어요. 과연 어떻게 위기를 해쳐나갈까요? 종이로된 아빠를 통해 가족 사랑과 소중함을 깨닫게 해주는 책이라니 교훈도 있고 기승전결도 있고 재미있을 것 같습니다.
9788901163635,10,아이들에게 쉽고 친근하게 다가갈수 있는 책인듯 하네요~
9788901163635,10,요즘 아빠들은 아이들과 놀아주는 것이 서툴 수 밖에 없죠. 그렇지만 아이와 놀아주고 아이를 이해하는 것은 엄마만의 몫이 아니니까요. 서툰 아빠들에게 힘이 되어줄 수 있는 책이네요.
9788901163635,10,아빠와의 시간이부족한 우리나라 많은 아이들과 공감하면서 재밌게 읽을수있을것같아요
9788901163635,10,아빠도 읽으면 재밋을 책.. 아이와 아빠 관계에 도움이 될거 같습니다
9788901163635,10,아빠와 아이가 함께 읽으면 더욱 좋은 책. 선물해줘야겠어요.
9788901163635,10,아이와 노는게 서툰 아빠가 아이들과 친해질수있는 계기를 만들어 주는 책 ... 정말 좋은 책입니다.
9788901163635,10,늘 바쁘고 어렵기만 한 아빠를 종이인형으로 재탄생 시켜서 아이들에게 친근함과 재미를 줄수 있는 책인듯 하네요~
9788901163635,10,내용도 그림도 아이들이 쉽게 빠져들듯요
9788901163635,10,그림책 정말 재밌어 보이네요. 그림도 정감있고
9788901163635,10,아이들이 좋아할것같아요
9788901163635,10,상상력이 돋아집니다. 아이와 아빠의 유대감도 깊어지구요.
9788901163635,10,이 시대의 아버지들께 헌정하는 동화책!
9788901163635,8,종이 아빠라니. 너무 제목이 슬프지만 아빠의 소중함을 일깨워주는 책.
9788901163635,10,그저 아빠는 돈을 벌어오는 기계로만 생각하는 아이들에게 아빠를 보다 가깝게 느낄 수 있게 해주는 책인 것 같아요
9788901163635,10,재밌는 일러스트와 꼬마아이의 상상력을 재미있게 읽어보고싶네요
9788901163635,10,일본에 수출된 동화책이라니 매력을 알고싶네요. 아빠와의 즐거운 추억이라니 재밌을것 같네요
9788901163635,10,아이들이 너무 좋아해요~ 일본에 수출한다니 정말 축하합니다.
9788901163635,8,종이 아빠 공연에 대한 이야기를 들어서 공연을 보러 가기 전에 읽어주려고 구입했어요.처음 받았는데 와~ 책이 꽤 두툼했어요. 보니 종이 한 장 한 장이 두툼한 종이더라구요! 아빠에게 이 옷 저 옷 입혀주는 장면을 가장 좋아했구요~ 다양하 미술 기법도 볼 수 있는 좋은 책이라는 생각이 드네요
9788901163635,10,아빠와 함께 시간을 많이 보내지 못하는 우리 아이들에게 아빠의 소중함을 일깨워줄 수 있는 좋은 책인 것 같아요
9788901163635,10,우리의 좋은 그림책이 세계로 수출된다는 이야기는 언제나 반가운 소식이네요. 특히 종이인형이라는 책은 아빠와 놀고 싶은 아이들의 마음을 담아낸 책이라 더욱 많은 아이들과 마음을 나눌 수 있을 것 같아요. 이 책을 읽고 아이들과 종이 아빠를 만들어보는 활동은 더 재미있을 것 같습니다.^^
9788901163635,10,"아빠가 종이처럼 변하는 상상력이 가득한 그림책인데, 함께 종이놀이를 하는 기분이 들었습니다. 책이 큰 편이어서 좋았어요."
9788901163635,10,아이들의 눈높이에 딱 맞으면서도 재미있게 볼 수 있는 책인 것 같습니다.
9788901163635,10,"우리나라 창작 동화가 국내외로 인기가 있다는것은 언제나 좋은것 같습니다. 특히 그림책 대부분 엄마에 관한 책들이 많은데, 아빠와의 유대감을 형성하기 위한 그림책을 추천하고 싶네요."
9788901163635,10,아이들에게 창의력과 섬세함을 키워줄수 있을 거 같습니다.
9788997279173,10,나름. 세심함이. 보이는. 동화책이며..  그림 너므. 귀엽다
9788997279173,8,차라면 무조건 좋아하는 3살 아이가 좋아해요~
9788997279173,8,곤충과 기차를 좋아하는 아이가 아주 재미있어 하며 읽네요. ^^
9788997728428,6,"5세지만, 여전히 반복되는 패턴의 그림책을좋아하는 취향이어서곰돌이 팬티 또한 즐겁고 재미있게 잘 보았다.팬티 무늬에 따라 팬티주인을 유추할 수 있어더 재미요소가 있었던 책! ^^"
9788997728428,10,팬티를 입기 싫어하는 32개월 딸과 함께 읽으려고 샀는데 팬티는 여전히 관심이 없고 이 책은 계속 읽어달라는 후기 아닌 후기를 남긴다. 하핫.
9788997728428,10,"아이들에 상상력을 길러 줄 수 있는 책 같아요. 처음에 분면 빨간팬티를 입고 시작했는데,곰돌이 팬티 아동 도서로 적극 추천합니다."
9788997728428,10,유아들에게 웃음과 재미를 주어 책읽기의 흥미를 충분히 끌어낼 수 있는 책
9788949101712,8,"소재의 신선함, 묵화가 적절히 섞인 채색 그림, 동물과 사람의 연결에 관한 메세지"
9788949101712,10,따삐르라는 동물이 실제로 있다는 것이 신기했고 무척 간결한 그림과 이야기로 짜여진 깔끔한 작품이라는 생각이 든다. 약간의 반전도 즐겁고 신선하다.
9788949101712,10,"살금살금 걷는, 조심성 있고 예의바른 따삐르 가족이 인상적이다. 귀엽고 특이한 모양의 그림체도 감각적이고 세련됐는데, 특히 수묵화 스타일과 그림자 그림을 접목한 듯한 공간 묘사는 압권! 자잘한 법규 따윈 우습게 알고 어기는 어른들이 가득한 이 세상에, 따삐르는 참 신선하고 귀한 존재다."
9788997381159,10,책상태가 너무 좋아요 유튜브로 영상을 접하고 책으로 보고 싶었는데 너무 좋네요
9788949112350,8,처음에 받고 펼쳤는데 엥? 책이 잘못온건가? 하고 한참을 봤네요. 너무 얇아서..제 개인적인 생각이지만 확 내용이 끌린다기 보다는 그냥 넘겨보는 재미?가 있는 책인거 같아요가격이 좀 더 저렴했으면 하는 바램이 ㅎㅎ
9788949112350,10,기발한 책.아이들이 읽고 재밌다고 손뼉치는 책이에요.^^
9788949112350,10,"점점 더 큰 동물이 점점 더 작은 책을 읽는데, 책 한 권은 바로 친구 한 명의 이야기. 얇지만 많은 이야기를 담은 책. 그림도 귀엽고 유쾌해요."
9788949112350,8,작은 책을 하나씩 펼쳐보는 재미가 쏠쏠하다.
9788949112350,8,그림이 너무 이쁘구요 점점 작아지는 책 때문에 아이가 책 넘기기를 즐거워 해요~ 특별한 이야기는 담고있지 않지만 그림속의 그림을 보듯이 모두들 모여 거인을 도와준게 귀엽습니다~
9788949112350,8,너무 어린아이가 보기에는 좀 공감이 안갈것 같아요. 4~5세 이상은 되어야 하구요. 좀 더 페이지 수가 많았으면 하는 바램입니다. 좋아요
9788949112350,10,"정말 눈에 확들어오는 그림동화... 아들이 첨보고는 바로 따라서 북아트하자고 자기도 자기만의 책을 만들어보고싶다네요. 색감이 참조아요 그리고 더불어사는 사회, 배려를 배우게하는 예쁜그림동화입니다."
9788965910114,10,아이들에게 가슴으로 환경문제를 생각하게 하는 그림책!
9788965910114,10,권하고 싶은 책!
9788952215659,8,화려한 그림과 반복되는 문구생각처럼 재미있단 느낌보단 뭔가 의도된 느낌을 많이 받는달까요..
9788952215659,10,빨강이의 노래를 듣고 싶네... 그림이 너무 좋은 그림책~
9788954611145,10,아이들 성교육에 도움이 되는 좋은 동화책이네요. 말로 하기 어려운 부분인데 도움많
9788949112060,10,신비한 거울 속 세상. 그리고 상상속 놀이.자유롭게 상상과 현실을 넘나드는 아이들의 세계가 보인다
9788949112060,8,흑백 그림이라 그런지 조금은 무서운 생각이 들게 하는 그림책이네요
9788958283546,10,그림이 따뜻하고 예뻐요.
9788992437240,8,공룡을 좋아하는 아이에게 굿~
9788992437240,8,"아이들이 흥미로워 하네요
주로 알고있는 공룡은 몇개 안되서 아쉽네요"
9788992437240,10,울아들 너무 너무 좋아해여 ^^ 감사합니다.
9788992437240,10,"공룡접기가 좀 어렵지만,,,아이가,,공룡에 관심을 더가지게 되어 좋은것 같아요^^굿"
9788992437240,8,유아들은 비추.초등학생 강추.엄마의 참여가 필요.
9788992437240,10,곤충접기와 함께 사주었습니다... 색종이를 600장이나 사놓고 열공!!!
9788952209481,10,우리아이 어릴때 읽어주고친구의 아이가 우리아이의 나이쯤 되었을때 선물한 책입니다제가 읽어줄 때의 기쁨을 친구도 느끼기를 바라며.....
9788952209481,10,그림이 너무 귀여워서 북파우치도 있네요. 내용도 재미있고 그림도 너무 이뻐요
9788952209481,10,아이와 재미나게 본 책이에요 그림이 참 독특하고 구석구석 재미난 그림들이 있네요~ 수상작이라고 해서 읽어보면 이런책이 수상작이야?하는 책이 더러있었는데 이책은 인정~글과 그림 모두 인정~
9788952209481,10,20개월 아기보다 내가 꼭 갖고 싶었던 책.
9788952209481,10,"아이의 마음을 읽는 책이라고 생각하네요
좋은 책입니다."
9788952209481,10,칼데콧 아너상에 빛나는 모 윌렘스의 감동 그림책. 아이와 어른 모두에게 소중한 이야기.
9788952209481,10,독특한 그림과 아이들의 심리를 알 수 있는 좋은 책이네요
9788952209481,10,아이의 눈높이에 맞춘 이야기가 신선한 아름답고 재미난 책
9788952209481,8,내용이 재밌네요. 아이가 이해하기에는 좀 복잡하긴 하지만 그래도 그림이 좋습니다.
9788952209481,10,다른 느낌. 기존 그림책들과는 또 다른 느낌을 주는 사진과 만화풍의 그림의 만남.
9788952209481,10,4살 조카를 위해 구입합니다
9788952209481,10,사진과 그림의 조화가 새롭다. 부분부분 디테일이 살아있어 미소를 짓게하는 책
9788952209481,10,"꼬므 토끼의 2탄 우리 아기 친근해 하며 잘 보내요 
작가를 보고 선택하게되네요"
9788952209481,10,"아이가 도서관에 가면 늘 빌리는책,,아이심리묘사공감"
9788952209481,8,내토끼어딨어엔 작가의 다른작품에 등장하는 주인공들이 깜짝출연합답니다..
9788952209481,10,"꼬므토끼의 후속편이 단행본으로.
아이가 자라서 유치원에 들어갔네요 너무반가워"
9788952209481,6,토끼를 좋아하는 우리딸을 위해 산 책. 구성은 흥미로운데 배경이 넘 복잡해 주의산
9788952209481,10,저희 아인 4살 남자 아인데요 정말 맘에 듭니다... 좋아요...
9788952209481,10,"아이가 책을 참 좋아하는편이지만
이책은 유독 더 좋아하네요~
강추합니다!^"
9788952209481,10,책 맘에 드네요. 특히 여자유아에게 강추합니다
9788952209481,8,니꺼 내꺼 잘따지는 4살전후 아기들한테 읽어주면 좋을거 같아요.어른이 읽어도 잼
9788954604390,8,"특히, 여자 아이를 둔 부모라면 부모와 함께 꼭 읽어야 할 책..."
9788961700030,8,놀이터에서 노는것을 자꾸 방해하려는 아이에게 재치있게 대응하는 아빠와 아들~^^
9788934923206,10,"책읽는여유가 생각났는데, 결국 먹지말고 읽어라는 교훔을 주는 책"
9788934923206,10,책은 천천히 곱씹어 읽기여전히 책을 가끔 먹기도 한다는 말 다음 나오는 뒷표지에 깜놀!
9788934923206,6,재밌어요.
9788934923206,8,책을 먹으면 똑똑해진다^^ 발상이 참신하고 재밌었어요~ 아직 아기가 어려 말은 못하지만 그림보며 읽어주면 뚫어져라 쳐다보네요ㅎㅎ
9788934923206,10,어디..맛있게 먹어볼까요? 기발한 발상이 아이들 행복하게 하네요. ㅎㅎ
9788934923206,10,아이가 책을 먹으며 똑똑해지는 것을 보며 신기해하고 재미있어 해요.
9788934923206,10,좋아요~ㅋ
9788934923206,10,유아들에게 아주 좋은 책입니다. 꼭 읽어주세요^^
9788934923206,8,발상은 신선! 근데 가격대비 만족은 글쎄...
9788901063027,10,"우리아빠가 최고야, 우리엄마, 우리형까지...명성에 걸맞는 앤서니 브라운의 책"
9788901063027,10,"형이나 오빠를 둔 아이, 투덕대는 형제들이 있을 때 동생에게 읽히면 아주 좋은 책"
9788901063027,8,우리 딸이 재밌어 하며 잘 보고 있습니다
9788955820683,10,8살 7살 딸아이가 좋아하는 지원이와 병관이 시리즈! 아이들의 시선을 사로잡는 리얼한 표정부터 페이지 마다 숨어있는 펭귄을 찾는 재미까지 더해 무척 재미있게 읽은 책입니다. 용돈에 대한 재미있는 아이의 생각을 엿볼 수도 있고 앞으로 우리 아이들 용돈은 어떻게 줘야할지 고민하게 만드는 책!
9788955820683,10,나도 용돈을 모아야 할 것 같다. 그래서 병관이처럼 레고를 사야겠다.
9788955820683,10,"아이들이 심부름 하면서 용돈을 달라고 할 때, 어떻게 하는 게 좋을까? 바람직한 경제교육 지침서로도 훌륭한 그림책! 조건을 내세우는 부모와 아이 모두를 위한 필독도서로 추천합니다!"
9788955820683,8,아이다운 고민이 읽으면서 미소짓게 하네요.초등1학년 울딸에게도 써먹야할듯..
9788955820683,10,우리 아이가 자신과 교감하면서 보는 병관이...또 다른 병관이가 우리집에 있다.
9788955820683,8,"'지하철을 타고서'를 재미있게 본 후..
딸아이가 고른 책..
재미는 조금 떨어지는듯.."
9788955820683,10,그림 구석구석을 살펴보는 재미가 있어요~~!
9788955820683,10,(전부 공짜)로 끝나는 어떤 글귀가 생각나네요. 경제교육도 부모에겐 어려운 숙제네요
9788955820683,10,넘 예쁘고 앙증맞은 그림 애들이 잘봐요. 재미있구요
9788956631035,10,역시 일러스트가 좋네요. 아이들이 차근차근 읽게 도와줘야 겠어요.
9788956631035,10,일러스트가 무척이나 아름다운 동화책입니다. 소장가치 100퍼센트!
9788956631035,10,그림이 느므 느므 맘에 드는 책 반값하길래 바로 질렀어요. 구매해도 후회없는 책
9788956631035,10,반값도서~ 제목부터가 무척 마음에 드는 그림책~!!!!! 표지도 너무 이쁘당~ 정말 나중에 볼 기회가 오면 좋갰당~
9788956631035,8,최근에 이 책을 알게되었어요 엄마인 제 취향인 책인데도 7살 딸아이에게 세트로 강제로 사주었습니다. 글자가 많아서 아이에게 읽어주는데 애먹고 있지만 내용이 잔잔해서 잘때 읽어주기 좋아요. 요즘 선명한 그림책에 길들여져서 그런지 그림이 조금더 선명했으면 좋겠더군요
9788956631035,8,너무 아기자기하고 세밀한 그림으로도 너무 소장하고 싶어 세트로 구입했습니다~
9788956631035,10,"대만족 ! 정말 사랑스러운 들쥐마을이 아닐수 없다. 결혼도 안한 아가씨가 사기엔 너무 이른게 아닌가 싶었지만, 읽는 순간 내가 빠져버렸다. 하루의 스트레스가 눈녹듯 사라지는 따듯함과 사랑스러움^^"
9788956631035,10,질바크렘의 그림도 멋있고 따뜻한 감동을 주는 이야기들도 배리배리 굿! 너무 좋아요
9788991871083,2,딸한테 정해진 역할이 있는건 아니다
9788991871083,8,딸은 진리! 딸을 가졌다는 친구들에게 부러움 가득 느끼며 매번 선물했던 책.
9788991871083,10,처음 샀던 책을 어딘가에서 잃어버리고 몇 년이 지나 다시 구입했다. 내가 소장하고 싶어셔...지인이 딸이 낳는다면 선물하고 싶은 책. 하지만 초등 남자애들에게는 분노를 일으키는 책이다. 그러면 아들은 나쁘다는 건가요? 라며..ㅎㅎ
9788991871083,10,딸을 가진 부모는 물론 딸을 기다리는 부모 아니면 딸인 모든 사람들의 공감을 얻을 만한 그림책이다. 그림을 보면서 내용을 읽어나가다보면 어느새 눈가가 촉촉해짐을 느낀다.
9788991871083,10,"정말 정말 내가 딸을 좋아하는 이유가 다 있다.
나도 울 딸이 이래서 좋다.
그리고 그 좋은 딸의 곁을 언제나 지켜주고 싶다."
9788991871083,10,결혼하며 엄마한테 선물한 책..딸 쌍둥이를 키우고 있는 지금..다시 구매합니다.
9788991871083,10,딸있는 친구에게 선물한 따뜻한 채인선씨의 그림책... 저도 딸을 낳으면 꼭 살거에요
9788991871083,10,그림책이지만 아이를 위한것이라기보다 어른들의 향수를 자극하는 책.딸로서 엄마와 함께 보고싶었다.
9788991871083,10,볼때마다 딸 가진 엄마의 마음을 어쩌면 이리도 잘 표현해냈나 싶다.도서관에서 먼저보고서 소장하고 싶어서 구매했어요~그림도 향수를 불러일으킵니다~
9788991871083,10,"딸이라면 엄마의 모습에서 앞으로 자신이 엄마가 되어야하는 모습을, 엄마라면 딸에게서서 자신의 모습과 엄마의 모습을 보게 되는 신비스러운 책!"
