ISBN13,rating,review
9788990982865,10,『백야행』의 팽팽한 긴장감을 다시 한번 느끼게 하는 한 권. 미후유라는 아름답지만 섬뜩하고 매력적이지만 무서운 캐릭터 때문에 더더 손을 놓을 수 없었음!
9788990982865,10,미후유=유키호? 궁금해서 계속 책장을 넘기지 않을수가 없어요
9788990982865,2,재인 출판사를 먹여 살리는 히가시노 게이고. 개정판인데 가격이 너무하네요.
9788990982865,2,기출간작을 다시 내면서 진짜 가격 너무 올린다. 11000원짜리 책을 17800원으로 올리는 것은 대체 어떤 기준에서인가? 도서정가제가 책값만 하늘 높은 줄 모르고 올려놓았다.
9791160074383,8,"찬호께이 소설은 믿고 봐도 좋을듯. 호러도 수준이 높고 대단한데,다만 13.67이나 기억나지 않음 형사에 비해 캐릭터 성은 별로. 또한 밑의 어느 분 말씀처럼 결말은 약간~그래도 내내 재밌게 볼 순 있다"
9791160074383,2,잔뜩 기대하고 샀는데 중반부부터 뜬금없이 라이트노벨이라는 생각밖에 안 든다ㅠㅠ
9791160074383,10,아주만족합니다
9791160074383,8,"재밌긴 재밌다. 책장이 그냥 술술 넘어감. 읽으면서 갸우뚱 예감이 오긴 했는데, 하이틴(?) 로맨스였다. 다만 시간 배경이 언제인지 중반부나 되어야 나오는데 처음부터 나왔으면 더 좋았을 것 같다. 영 요즘 사람 같지 않아서 초반 몰입이 안됨..."
9791160074383,4,라이트노벨같어 뭔가 일본청춘물? 무섭지가 않았음
9791160074383,8,"등장인물과 사건 배경이 소개되는 첫 100여 페이지를 지나면 나머지 400여 페이지는 순식간에 읽힌다. 결말 부분에서는 공포물이라기보다는 추리물 같은 느낌이 들고 전반적으로 라이트노블이나 일본 애니메이션 같다는 인상이 들지만, 공포감과 긴장감을 결말 전까지 끌고 가는 솜씨가 뛰어나다."
9791160074383,6,"찬호께이인데, 좀 색다른데 하며 읽었지만, 역시 나의 장르가 아닌 관계로 개인적으로는 좀 아쉬웠다."
9791160074383,8,줄거리도 되게 뻔하고 누가 어떻게 될지도 대충 다 보이긴하는데 재밌긴함 그런데 왜 후반부에 급발진해서 라이트노벨이 되는거죠
9791160074383,4,찬호께이 작품중 유일하게 실망한 책. 계속 홈런만 치길 바라는 건 무리일듯.
9791160074383,4,<13.67>의 강렬함이 너무 커서일까. 이후 출간작들은 실망감의 연속이다. 그럼에도 계속 사보는 이유 역시 <13.67> 때문이다.
9791160074383,8,찬호께이 작품 좋아해서 믿고 읽었고 재미도 있습니다. 기본적으로 책을 쥐면 계속 보게하는 힘이 있어요. 그래도 찬호께이의 베스트는 아닌듯! 13.67에 비교하면 아쉬움이 꽤 남아요
9791160074383,4,"기대가 컸나요. 솔직히 그저 그렇네요 시간 떼우기용으로 술술 읽히는데,.개별 에피소드별 재미도 별로 없고, 마지막 반전이라고 주는것도 재미가 없고 유치하네요.찬호께이 소설이 음,, 전체적으로 초반에 흥미를 주는데, 흥미만큼 마무리가 딱히 좋진 않네요.1367빼곤 다 별로였어요"
9791160074383,10,이 책은 홍콩의 대학 기숙사를 배경으로 하고 있어서 3월에 대학교에 입학하면 기숙사 생활을 시작할 작은딸을 떠올리며 친근한 마음으로 읽을 수 있었다~
9791160074383,6,재밌는 호러 소설 한 편을 기대했다면 읽어도 좋을 듯.<13.67>이 작가 스스로 영원히 넘지 못할 벽이 되진 않기를.
9791160074383,10,믿고 보는 찬호께이 기대된다
9791160074383,2,"찬호께이 책은 다 읽어봤는데 이건 정말 실망스럽네요. 읽으면서 다른 작가가 쓴건가 의심했어요. 상투적인 감정, 인물 묘사도 정말 싫지만 작위적인 스토리, 그리고 결말은 진짜 최악이네요. 읽은 시간과 돈이 아까워요."
9791160074383,8,기대를 많이 했는데...그냥 아주 가벼운 마음으로편하게 읽으시면 볼만합니다. 찬호께이니까 믿고 읽었습니다.
9791160074383,10,찬호께이 팬이라면 믿고 보셔도 됩니다. 개인적으로 호러 장르는 즐기지 않는 편인데 찬호께이 작가가 써섯 그런지 정말 쫄깃하고 재밌었어요 떡밥회수를 뛰어넘어 미처 생각지도 못한 부분까지 세심하게 완성하네요!
9791160074383,10,"오컬트 호러물(진짜)로서의 강점을 부각시키면서도 추리로서의 본분에도 충실한 작품이에요. 특히, 종이책 겉표지의 질감이 예술입니다. 책 내용과도 잘 어울리고 심플한 디자인까지!"
9791160074383,10,와~~찬호께이 신작이 나왔다는 소식에 바로 주문합니다.가장 좋아하는 작가의 신작 소식만큼 반가운게 있을까요?얼른 읽고 싶네요.
9791127850104,10,책에 대한 애정이 있는 작가의 책은 항상 재미있다.
9791127850104,8,기묘한 손님들에서 신기한 손님들로. 화자는 바뀌었지만. 분위기는. 외전이라 들었는 데. 1권. 기대.
9791127850104,10,뒤늦게 나온사실 듣고 구매합니다.
9791127850104,10,기타무라 가오루와 미카미 엔은 진짜 작가의 이름만으로 구입하는 작가입니다.특히 비블리아 고서당 사건수첩을 7권까지 한꺼번에 정신없이 읽어 버렸던 거의 하룻밤을 꼬박 새었죠.더군다나 비블리아의 신작이라니 출판알림 메시지를 보고 정말 뛸듯이 기뻣습니다.근래에 읽은 일본 소설중에서는 최고
9791127850104,10,1부 후반에 조금 막장드라마스럽던 모습도 사라지고 감동적인 에피소드만 남은게 맘에드네요. 사실 본편에서 웬만한 떡밥은 다 풀려서 2부는 이 분위기로 진행될것 같은데 그것도 나름 좋습니다.
9791127850104,2,2부 아니에요~~~ 후일담입니다~~ 알고 구매하세여 출판사 수준이 진짜;; 2부라고 하면 사람들 계속 연재되는건지 알잖아요
9791127850104,10,"니시우라 사진관으로 실망하고 난 뒤의 비블리아 제 2부. 조금 추하다는 생각이 안 드는 것도 아니지만, 속아줘야지."
9791127850104,10,미카미엔 작가의 비블리아고서당이 드디어 2부가나온다니 ㅠㅠ 이건 무조건 구입해야됩니다
9791127850104,10,1부도 재미있게 읽었기에 2부 발견하자마자 구입했습니다
9791127850104,10,비블리아 고서당 팬인데 2부라니...정말 기대되네요.
9791127850104,10,2부라니 기대됩니다^^
9788972750093,10,"읽으면서 벼락 맞아 죽을 것들이라는 소리가 저절로 나왔다. 아들, 며느리, 손자 전부 지옥에 가야 할 것들. 하지만 결말은 마음에 든다."
9788972750093,8,"악의 순환 같았다. 무관심이든, 과보호든 한쪽으로 과하게 치우친 사랑은 독이 되고 만다."
9791189015626,10,"그냥 좋다. 러시아 분위기도, 주인공도."
9791189015626,4,딱히 재미는 없었다. 당시(19세기) 러시아의 생활상이라든가 사회 분위기는 매우 섬세하게 묘사해서 꽤 흥미를 끌었지만 추리 소설로서의 흡입력은 별로.
9791189015626,6,3.5 지원해줘라 북플아 이 책은 3.7점이라고!!!! 러시아 추리소설은 처음인데 러시아 느낌 풀풀 나서 재밌었다. 추천추천!!
9791189015626,10,오늘 책 받아서 단숨에 읽었네요. 러시아와 영국을 넘나들며 좌충우돌 사건을 풀어가는 판도린~멋져요! 영미 추리소설과 달리 뭔가 고전적 품격이 느껴지는 러시아 추리소설~~
9791189015626,10,추리소설 많이 내주세요 ㅎㅎ 미스터리도.. 믿음으로 잘 보겠습니다
9791189015626,10,미스테리물이네요.아작의 선택이니 믿어봅니다.
9788998791865,8,열어서는 안되는 방~이제까지 이야기 중 가장 무서운 이야기
9788998791865,10,아 언제 나온것인가... 이제야 보내..눈물점도 주문해야겠다. ㅎㅎ 너무재밌다.
9788998791865,8,이 책을 끝으로 당분간 미시마야 시리즈를 읽을 수 없다고 생각하니 현기증이...ㅋㅋ ㅠㅠ 스토리상 많은 변화가 있었던 터라 다음 시리즈가 더더욱 기대되고 기다려진다. 그 틈을 이용해 모시치 시리즈를 읽는 걸로.ps.  미미 여사는 글을 왜케 잘 쓰는 거야? 내 시간 돌려내요!♡
9788998791865,10,미미여사의 광팬인 저는 항상 기대하고 있습니다.1년에 두 번은 신간이 나왔으면 하고요.금빛눈의 고양이는 그런 기대로 사 본 책입니다.무섭거나 으스스한 이야기보다 감동적인 이야기가 많습니다.
9788998791865,8,이야기는 힘이 세다!!!!
9788998791865,8,미시마야 시즌 6이 기다려진다기대된다
9788998791865,10,드디어 완독~!!!간만에 미미여사 책을 읽어서 그런지 너무 즐겁게 읽었다.다음 신간이 기대된다.
9788998791865,10,"이 시리즈는 무조건 좋다. 그냥 막무가내가 아니라, 읽을수록 좋은 시리즈이다. 미미여사가 미시마야의 괴담시리즈를 100개를 쓴다 하니 이보다 더 좋을 수 없다 싶다. 이번에도 무섭기도 하고 우습기도 하지만 따뜻한 마음이 감도는 다섯 개의 이야기를 읽으며 내내 참 행복했다."
9788998791865,10,"미야베 미유키 특유의 인간미가 전해지는 책,왠지 기다려지는 그녀의 책은 전부 소장각이지요작가의 생각,어른스러움,슬쩍 웃음끼를 띠는 듯 하면서도 왠지 엄격함도 보이는 ..가장 좋아하는 작가분의 신작,너무 행복한 기분으로 읽었어요,강력추천"
9788998791865,8,미시마야 시리즈는 항상 좋더라. 그리고 내가 그럴줄 알았다.
9788998791865,10,오치카 결혼과 함께 사라지다.
9788998791865,10,진짜 미시마야 시리즈는 죽을 때 까지 함께 하겠습니다! 이야기 하나하나가 소중하고 재밌습니다.
9788998791865,10,양장본으로 나오면 좋을텐데 나중에라도 혹시 나올까 몰라 망설임
9788998791865,10,최근 여사님의 책을 읽기 시작했는데 읽다보니 빠져들더군요.그래서 이번 시리즈도 믿고 사봅니다.
9788998791865,8,구매후 아직 읽지는 못했지만 무조건 소장각이죠~~
9788998791865,10,오랜 기다림 끝에 마주한 미시야마시리즈 5번째입니다. 드디어 오치카가 간이치와 혼례를 올리게 되는군요. 거기서 문득.. 미시야마 시리즈가 여기서 끝나는건가? 하는 생각이 스쳤지만 편집후기에서 다음 후속편이 나올것이라는걸 알고 기뻤습니다빨리 읽고싶은 마음 크지만 기다리고 있겠습니다
9788998791865,10,무조건 구매죠 =^.^=
9788998791865,10,오랫만에 만나는 미미여사님의 책입니다.안 살 수가 없네요.
9788998791865,10,"너무너무 오래 기다렸습니다!!두근두근, 잘 읽겠습니다"
9788998791865,10,"아, 저도 어젯밤에 책 주문했는데... 하루만 더 있다 주문할걸.. 아니 걍 이 책만 따로 또 주문해야 하나.."
9788998791865,10,믿고 사는 시리즈. 미미여사의 에도시리즈는 언제나 옳다! 표지도 시리즈답게~
9788998791865,10,미시마야 괴담 시리즈는 무조건 믿고 봅니다!!
9788998791865,10,예정보다 왜이리 늦게 나왔나요 ㅠㅠㅠㅠㅠ 기다리다가 결국 원서로 읽고 있단 말입니다 흑흑 ㅠㅠ
9788998791865,10,ㅠㅠ 어제 책주문했는데 ..... 미미여사의 에도괴담이야기 그것도 흑백의 방인데 좀 더 기다릴걸
9791189571023,2,지루함교훈이 넘침...
9791189571023,8,혹시 시리즈 자체에 문제가 있나 해서 복간되기 전 읽었던 걸 다시 읽었다. 이건 괜찮은데. 『전주곡』은 너무했다.
9791189571023,10,음악과 미스터리의 케미 궁금해요~!
9791189571023,10,작가의 책.. 너무 재밌게 읽었어요. 음악과 관련되어 보이는 이 책 너무 기대됩니다.
9791189571023,10,워낙 유명한 시리즈라니 정말 기대됩니다. 재밌을것 같아요
9791189571023,10,아..처음인데 그냥 기대가 됩니다.독자들이 다 좋아하네요~
9791189571023,10,미스테리 대상수상작이라니 기대됩니다.
9791189571023,10,나카야마 시치리의 작품 미사키 요스케 시리즈라? 음악과 관련된 추리소설인 것 같은데 너무 궁금해지네요.
9791189571023,10,꼭 한번 읽어보고 싶었던 책이었는데.. 이렇게 다시 출판이 되다니!!!! 정말 기대됩니다.나카야마 시치리의 필력을 저도 느껴보고 싶네요.. 어떤 식으로 표현해 나가는 전개를 사용하실지 ^^
9791189571023,10,클래식과 미스터리 추리의 만남. 음악 미스터리라..현대 일본작가의 매력에 빠져보고 싶다.
9791189571023,10,미사키 요스케 시리즈의 첫번째 작품인 드뷔시! 멋진 이야기들을 빨리 만나보고 싶네요~!!
9791189571023,8,피아노 연주에 대한 전문적인 서술이 길었던 점이 문외한이 나에게 다소 지루하게 느껴졌다. 결말이나 복선은 화려하지 않지만 만족스러웠다
9791189571023,6,이 작품은 작가의 초기작이라서 그런지 너무 과한 복선(좋게말해 복선이지 실은 논리붕괴를 우려한 과도한 설명)으로 인해 초반부터 결말이 너무 뻔했다 제발 내 예상이 틀리길 바라며 읽었지만 서프라이즈는 없었고나로서는 도무지 이 결말을 예상못한 독자들이 많았다는것이 오히려 반전이였음
9791189571023,10,"나카야마 시치리 하면 미코시바 레이지 시리즈밖에 몰랐는데, 뒤늦게 이 소설을 읽고 나카야마 시치리의 필력에 새삼 반했습니다. 반전에서 육성으로 헉 소리 냈어요 ㅎㅎ"
9791189571023,8,인간 승리와 음악과 추리의 준수한 결합!
9791189571023,8,왠지 플롯도 결말도 낯익다.  모티브 없는 사건이 범죄로 이어지고 결말의 반전도 괜찮다.  음악을 곁들인 건 정말 좋다. 이렇게 추리소설을 재미를 위해 읽다가 대중가요가 아닌 재즈나 클래식으로 자연스럽게 관심을 가질 수 있는 가능성만 해도.
9791189571023,10,드뷔시를 알았다면 훨씬 재미있게 읽었을 것을. 클래식 무식자라. ㅠㅠ. 반전은 예상 가능했지만 그럼에도 불구하고 글이 참 좋았다.
9791189571023,8,"“개구리 남자”시리즈를 읽고 찾아 읽기 시작한 작가... 더불어 드뷔시의 음악도 찾아 듣는 기회가 되었다. 다음 “잘 자요, 라흐마니노프”도 기대해 본다."
9791189571023,10,"발버둥의 미학피아노 선율에 따른 극의 전개, 따뜻한 위로, 그럼에도 불구하고 해낼 수 있다는 희망"
9791189571023,8,피아노 좀 아시는 분들이 읽으면 더 좋을 들 싶네요.
9791189571023,10,나카야마 시치리 작품은 기대를 저버리지 않는다. just read it
9791189571023,10,역시 나카야마시치리 입니다. 일본 최고의 미스테리 작가!
9791189571023,10,진짜 결말까지 읽고 나서 소름 돋은게 잊혀지지 않네요....
9791189571023,10,역시 나카야마시치리 작가네요 너무 재미있게 읽었습니다^^
9791189571023,10,대작이라고 추천받아 주문 기다리고있습니다!! 기대되는 작품입니다.
9791189571023,10,평점도좋고  너무나 많은분들이 강추하는  유명한 작품이라 꼭 읽고싶었습니다~예약구매하고 기다리는중입니다~!!!  기대 만땅~~!!!!
9791189571023,10,시치리의 데뷔작... 블루홀6의 도서로 만나게 되어 기뻐요.현재 소장중인 모든 시치리의 도서가 모두 블로홀6라서 무조건 읽어보겠다 다짐하고 있어요^^표지도 넘 이쁘고... 너무 갖고 파요^^
9791189571023,10,새롭게 출간되는 안녕 드뷔시가 너~~~무 기대 되요~피아노 음악 유산 살인사건그녀는 도대체 누구인가요~??
9791189571023,10,"시리즈로 나온다니 너무나도 기대됩니다,, 얼른 읽고 싶어요!"
9791189571023,10,처음엔 좀 안타까워 보였는데... 유산에 얽힌 숨은 이야기가 책소개를 끝까지 읽게 만들어주네요.
9791189571023,10,"재출간되는 시치리 작가님의 작품이라니 넘넘 기대됩니다! 음악과 미스테리, 정말 매력이 넘칩니다. 반전에 반전으로 저를 얼마나 놀라게 할지 벌써부터 설렙니다!!"
9791189571023,10,절판되엇던 책의 만남이라 더 반가워요. 나카야마 시치리의 초기작 꼭 소장하고 아껴보렵니다.
9791189571023,10,대박!!! 절판이라 못구하고 있었는데 ㅠㅠ 완전 기대됩니다!!!
9791189571023,10,절판되었던 책이 새롭게 재출간이 되서 나오게 되어 다양한 독자들을 만날 수 있을 것같아요~ 저도 아직 읽어보지 않은 독자로써 이 책을 꼭 읽어보고 싶습니다~ ㅎㅎ
9791189571023,10,중고로 구하려고 했는데 절판이어서 아쉬웠어요. 이번에 새롭게 출간되었다니 너무 기대가 됩니다.
9791189571023,10,나카야마 시치리 작가의 팬인데 절판이라 못읽어서 아쉬웠는데 ㅜ 이렇게 개정판이 나와서 너무 좋아요 ♡ 꼭 읽어보고 싶습니다 ~ 기대됩니다 ^--^
9791189571023,10,절판이라 구하지 못해 아쉬웠는데 개정판이라니 넘나 신나요!!
9791189571023,10,믿고 읽는 나카야마 시치리 작가!!이번엔 음악미스터리~!!! 기대 뿜뿜입니다~
9791189571023,10,아름다운 선율의 음악 소설과 감동의 성장 소설을 읽는 듯한 느낌을 주다가 마지막엔 어김없이 강렬한 대반전! 벌써부터 기대되는 작품! 결국 읽어야하는 작품!
9791189571023,10,나카야마 시치리의 팬이면서도 정작 데뷔작을 못 읽었는데 개정판이 나와줬군요. 기대됩니다.^^
9791189571023,10,믿고 보는 시치리!! 블루홀 식스에서 예쁘게 다시 새단장하고 나온다고 하니 엄청 기대됩니다요~
9791189571023,10,새롭게 출간된다니~~~엄청나게 기대됩니다^^
9791189571023,10,절판되었던 ‘안녕 드뷔시’를 새 모습으로 만나게 되다니 너무 반갑습니다. 나카야마 시치리 작가님을 처음 만났던 작품이라 더없이 애정이 가는 소설인데 그때의 그 감동을 다시 한번 느껴보고 싶네요.
9791189571023,10,피아노 탐정  미사키 요스케 시리즈가 재 출간 되었네요. 나카야마 시치리의 반전의 매력을 다시금 느끼게 될것 같아 기대됩니다. 시리즈가 계속 재출간 되기를 희망합니다.
9791189571023,10,믿고 읽는 작가 시치리의 음악 미스터리!정말 기대됩니다♡
9791189571023,10,지금까지 읽은 시치리님의 책과 다른 느낌의 책이라 더 기대됩니다...
9791189571023,10,"나카야마 시치리님의 책이라면 무조건 GO입니당~^^특히, 이 책은 절판되어 구하지도 못해 읽지 못했는데, 이렇게 새 옷을 입고 출간되어서 넘넘 좋아요~^^‘이 미스터리가 대단하다‘ 대상작이라니 기대기대됩니다~^^"
9791189571023,10,아~~~ 요즘 나카야마 시치리의 미코시바 레이지 변호사 시리즈 읽어보고 완전 반한 작가예요^^<안녕 드뷔시>가 다시 재출간된느군요.. 정말로 기대됩니다^^
9788950979072,8,별 4개반을 주면 좋겠다. 진짜 재밌다. 소네 케이스케는 글 잘쓰는 장인이다!
9788950979072,10,"별 기대없이 읽기 시작했는데...최근에 읽은 범죄 스릴러중최고였어요.개성있는 캐릭터, 시간과 사건이 교차되며 숨가쁘게 전개되는 이야기가 절묘하네요."
9788950979072,8,시간과 인간관계가 교차되며 진행되는 사회파 스릴러! 영화도 딱 원작대로만 나와주면 대박인데
9788950979072,10,헐...꿀잼...!!!!인물관계도 대박임 빨리 영화로도 보고 싶어용
9788950979072,10,사회생활에서 ‘떼려야 뗄 수 없는‘ 돈 경제를가지고 쓴 추리소설인데사람이 엄청 막다른 길 힘든 상황이 다치면어마무시한 힘과 정신력으로 버티고 헤쳐나가고나도 모르는 내가 나온다고든 하는데읽으면서 나라면 어떻게 했을까?라는 생각을 많이 했던 것 같다.
9788934980957,2,밍밍하고 무매력인 소설....
9788934980957,10,말해 무엇하랴
9788934980957,8,"작가의 자의식이 투영된 듯한, 무게 잡는 남자 주인공이 나오는 작품은 별로 안좋아하는데, 15년전 작품이란걸 감안하면 꽤 읽을만하다."
9788934980957,8,모처럼 만나는 이 덤덤한 사내가 반갑다. 사와자키가 결정을 하는 과정을 보는 것만으로 마음이 단단해지는 느낌이다.
9788934980957,8,믿음직한 사와자키.
9788934980957,10,사와자키탐정 2막개막  다음권은 좀 빨리  만나볼수있기를
9788934980957,10,일본 하드보일드의 거장인 작가의 새로운 작품이라니 기대가 되네요. 트릭에 의존하지 않고 정통 하드보일드의 건조하고 비정하고 간결한 문체와 이야기를 만날 수 있을 것 같아요.
9788934980957,10,올만에 하라료 작품이 번역되어 출간되네요. 최근 나온 신작까지 쭉 나오면 좋겠네요.
9788934980957,10,내취향은 아닌데도 이상하게 흠뻑 빠져들며 읽게 되는 소설.시즌2 개막이라니 행복합니다!
9788998791766,10,"이어지지 않은 커플을 별로 좋아하지 않았던 터라, 새로 나타난 인물이 흥미롭다."
9788998791766,10,웃다가 울다가 감동먹다가... 시간가는 줄 모르고 이야기에 빠져들었다.
9788998791766,10,"뭐라고 해야할지... 당대 최고의 이야기꾼이 만든, 다 읽을 때까지 손에서 놓기 어려운 책."
9788998791766,8,히가루가미 귀여웠다. ㅎㅎ
9788998791766,10,미미여사의 이런 이야기기 참 좋다옛 에도시대의 감성에 적절한 호러와 스릴러의 조합이 잘 버무려져 있다 시대와는 상관없는 선악에 대한 고찰도 역시 그대로다 책을 받자마자 순식간에 읽어버려서 아쉬웠다 또 기다려야 하는구나
9788998791766,10,"여름에 서늘하게 읽을 수 있는 괴담집. 제목과 같은 장은 너무나도 서글프고, 오치카가 주인공으로서의 마지막이라는 것이 아쉽다."
9788998791766,8,에도시대는...좀 낯설지만이번 책은 나름 재미있었다.
9788998791766,8,"미시마야 시리즈 앞 이야기를 아직 읽지 않았지만, 내용을 이해하는데는 문제가 없었다. 웃음을 자아내는 이야기와 기묘한 이야기가 어우러져 단숨에 읽어버렸다. 새로운 등장인물 간이치와 미시마야 둘째 도련님의 활약이 앞으로 기대된다."
9788998791766,10,무서운 건 좋아하지 않는데도 귀신이 나오는 책들은 읽게 된다.미미여사의 책은 역시~!!!!!기대를 저버리 않는다.<삼귀> 다 읽었지만 다시 읽어도 질리지 않는다.그래서 다음에 재도전~재미나게즐독했다~
9788998791766,8,"10년만의 미미여사. 마지막 이야기가 많이 아쉽긴 하지만, 전체적으로 참 뭉클하고 재밌게 읽었다. 여름밤, 충분히 권할만 하다."
9788998791766,10,조아하는 미미여사의 신작 기대된당
9788998791766,8,추리소설 아니고 괴담집입니다. 이야기꾼으로서의 미야베 미유키는 시대물을 쓸때 더 빛이 나는 것 같습니다.
9788998791766,10,"흑백의 방에 찾아온 그 증례?수 많큼, 그 사연들, 이야기들 만큼의 인생을 통해서 성숙해지던, 아니 깨달음을 얻어가던...미야베 미유키는 아마도 괴담(백물어)을 차용한 심리 치유에 대한 아이디어를 이 시리즈에서 구현하는 것이 아닐까."
9788998791766,10,전작 <신이 없는 달>에 실망했다면 이번만큼은 실망하지 않을 것! 미시마야 시리즈가 원체 재미있기도 하지만 이번엔 각 이야기마다 볼륨감이 더해진 느낌. 미야베 미유키의 시대극은 바로 이런 맛에 읽는 거였지 하는 기분좋은 느낌을 오랜만에 받았다.
9788998791766,10,이 책으로 미야베 미유키를 처음 접하였습니다. 미망의 여관까지 읽었으니 초반부밖에 읽지 못했지만 정말 재미있네요. 일본소설을 마음속으로 약간 무시하고 있던 제가 어리석었던 것 같습니다. 미야베 미유키의 다른 책들도 사서 읽어볼 것 같습니다.
9788998791766,10,"원서와 번역서를 연달아 읽어 치웠다. 단언컨대 지금까지 나온 미시마야 시리즈 중 최고다. 어쩌면 미야베 월드 제2막 중에서 최고일지도 모르겠다. 사람의 마음을 읽어내는 그 깊이도, 애절함도, 재미도."
9788998791766,10,이건 그냥 사야죠이왕이면 미니북노트 이벤트까지 딸려오면 땡큔대없네요 ㅎ
9788998791766,10,미야베월드에 어서오세요.
9788998791766,8,신이 없는 달까지 읽고 이 작가의 필력에 그만 질려버렸습니다.아 이제 그만이다라고 했었는데 또 장바구니에 담고 마네요. 중독입니다.
9791160072075,10,개인적으로 저는 13.67보다 망내인을 더 기억합니다
9791160072075,8,13.67 만하진 않지만 그래도 재미있게 읽은 책! 시원한 복수를 원하는 분들에겐 강추!
9791160072075,8,협객소설이 사이버펑크와 현대를 조합한 듯.  원래 무협소설의 전통이 있는 나라의 작가라서 그런지 어쩌면 사적인 단죄와 복수에 큰 거부감이 없는 듯.  시원하다.
