ISBN13,rating,review
9791185014517,4,등장인물이 다른 책 보다 많이 등장하는데 후반부까지 인물들이 따로 노는 기분이다. 후반에 가면 이유를 알 수 있지만 그때까지 너무 지루하고 내가 뭘 읽고 있나 후회가 됐음. 결말을 알면 잘 짜여진 내용이지만 매력적인 인물도 없고 그저 그렇다.
9791185014517,10,추리/미스터리소설예전에는 한국 미스터리만 읽었는데 어느 날부터 외국책들을 읽기 시작했다.항상 한국 소설이 먼저였던 것 같다.
9791185014517,8,소설을 읽는 내내 ‘사화파’ 란 단어아 떠올랐다. 여러 인물의 사건들이 개별적으로 펼쳐지며 나중에 만나게 되는 형식에 억지스러움이 없었던 것 같다.
9791185014517,6,식상하지만 그만큼 보장된 재미. 실망하면서도 보게되는 거장의 이름값.
9791185014517,6,여름 친구 히가시노 게이고. 역시 흥미있게 읽었다. 읽으면서 인물 관계도를 그려보고 싶었는데 여기 그려져 있는 걸 보고 사람 생각은 비슷하구나...웃었다. 뭔가 대단한 클라이막스가 있을 것 같았는데 좀 싱거운 결말이 많은 작가인데 이건 중간쯤
9791185014517,6,독특한 소재를 잘 활용하셨다.다만 히가시노게이고 특유의 반전이 없었다
9791185014517,4,특별할 것 없는 내용에 <10년 집필>이란 과장광고로 별 3개에서 별한개 감점
9791185014517,6,책이 술술 읽힌다. 재밌다.
9791185014517,8,예전에는 굉장히 채미있게 읽었는데 오늘 다시 읽으니 왜 이리 밍숭한걸까
9791185014517,8,히가시노 게이고 소설은 역시...
9791185014517,8,처음  접한 히가시노 게이고의 소설~ 신세계였다 억지스럽지 않았고 지루하지않았으며기발했다. 앞으로 한권한권 읽어나갈 생각에 행복하다 ㅋ
9791185014517,4,"청소년문학 같은 느낌이 강하지만, 시의성은 인정할 만 하다: 원전사고 이후의 삶에 대해 묻고, 스스로 선택하진 않았어도 대를 이어 사회적 책임을 다하는 일본인의 자세에서 그 답을 찾음. 물론 문학의 시의성이 이렇게 즉각적으로 추구될 것인가는 의문. 그러니까 또 청소년문학 같다고 하는 거다."
9791185014517,8,일본인들은 선조의 잘못까지도 숙명으로 묵묵히 받아들이고 대를 이어 고치려는 노력이 대단하다. 역사적인 흐름까지 넣으려고 해서 인지 약간은 어색한 부분이 약간있네요.
9791185014517,4,결국 그 꽃은 환상의 꽃이 아니라는거... 꽃  때문에 사람이 죽어나가는거 참...
9791185014517,8,좋다
9791185014517,8,꿀재미
9791185014517,6,노란 나팔꽃의 정체는 이미 제목에 있고범인은 의외지만 처음부터 별로 관심은 안가나읽히기는 잘 읽히는 소설.
9791185014517,6,"결말이 허무허무 빨리 읽히기는 하는데, 필요없는 곁가지도 많았어요"
9791185014517,4,소재는 좋았는데...초반엔 흥미진진했는데 갈수록 뭐랄까 결말이라기보다는 전개나 구성이 뻔해진 느낌이에요. 모르고 읽었다면 히가시노 게이고인줄 전혀 몰랐을거예요.
9791185014517,4,?.. 기나긴 시간과 많은 공만 들인 것은 아닐는지..
9791185014517,6,히가시노 게이고 소설치고 실망
9791185014517,8,최근 읽은 히가시노 책 중엔 추천.요즘 히가시노는 퀄리티 컨트롤이 시급함
9791185014517,4,베스트셀러은 읽어보기전 사는게 아니다. 특히 일본작가의 스릴러는. 특히 히가시노 게이고 소설은.
9791185014517,6,읽기는 쉬웠으나 내용 자체는 별로 였네요.. 히가시노게이고의 작품을 이걸로 접해서 그런지 다른 작품을 접하기가 쪼금 그러네요 ㅠ
9791185014517,10,친절한글... 점점이 뿌려놓았던 떡밥들을 빼놓지않고 회수해서 마지막에 친절하게 풀어준다... 손에 땀은 없어도한번펼치면 손에서 놓을 수 없고 눈을 뗄 수 없게 멈출 수 없게하는 게이고식 미스터리...탁월했다..
9791185014517,10,"역시 히가시노게이고!!!이 사람의 머릿속이 궁금하다..어떻게 나팔꽃이라는 소재로 이런 추리를 할 수 있는지...몰입도, 흡입력 정말 최고다..추천할만한 책이다!"
9791185014517,10,첫페이지부터 강렬한 스토리~빠른전개~~강추합니다
9791185014517,10,전혀 상상할 수 없는 소재로 이토록 재미있는 이야기를 할 수 있다는 것이 놀랍다.
9791185014517,6,"범인이 뜬금 없다기보다는, 왜 죽일 수밖에 없었는지에 대한 이유가 조금 약하지않았나 싶다. 역사물이라고 하기엔 과장이 지나쳐 살짝 접목시켰다고 하는게 좀 더 타당할 것 같고, 식물학을 주제로 한 추리물이라고 보는게 맞을 것 같다. 좋아하는 주제는 아니지만 특유의 가독성으로 끝까지 읽었다."
9791185014517,10,술술 잘넘어거는책이쟈나
9791185014517,10,말이 필요없는 작가 '히가시노 게이고'. 그의 작품들 중 최고의 작품은 아닐지라도 충분히 흥미롭고 충격적이었기에..
9791185014517,10,아름답고도 슬픈 이야기...읽고 나서도 많은 생각이 드는 책
9791185014517,8,저자의 글을 좋아하는 편이라 섬세한 감성과 드라마가 너무나도 조화롭게 이뤄진것 같아서 좋습니다.
9791185014517,10,즐거운맘으로 읽기 편한책...
9791185014517,10,역시 히가시노 게이고
9791185014517,10,저자의 치밀함에 읽어 내려가는 내내 책을 손에서 뗄 수가 없었다.
9791185014517,10,읽을수록 깊게 빠져드는 매력을 가진 작가가 히가시노 게이고다. 한 번 책을 잡으면 끝까지 읽어야 하는 추리 소설의 맛을 한껏 음미할 수 있을 것이다
9791185014517,10,"극을 이끌어 가는 모든 장면들이 각각의 긴장과 묘한 설렘을 주었으며, 반전 또한 전혀 상상하지 않은 방향으로 일어났기 때문에 시간이 가는 줄 모르게 정말 재미있게 읽었습니다."
9791185014517,10,몽환화 : 환각작용을 일으키는 성분을 지닌 단순 잡초나 야생초 등 식물의 총칭노란 나팔꽃을 둘러싼 사건의 내막을 쫒아가는 전형적인 미스테리 추리물로서 히가시노 게이고의 막힘없는 필체에 그저 눈만 고정시키
9791185014517,10,일본책을 좋아해서
9791185014517,10,히가시노 게이고의 소설은 언제나 나를 실망 시키지 않는다
9791185014517,2,습관적으로 읽는 작가
9791185014517,10,끝까지 한 번에 읽었습니다.
9791185014517,10,재밌다.
9791185014517,10,좋음
9791185014517,10,히가시노 게이고 짱짱맨
9791185014517,10,결말이 아쉽지만 스토리가 신선했다
9791185014517,10,좋다..
9791185014517,10,상당히 재미있음
9791185014517,10,간만에 재밌는 소설..
9791185014517,6,잘 읽히지만 그래서?
9791185014517,10,히가시노의  이야기성..반전의 묘미..
9791185014517,8,히가시노 게이고라면 무조건 평균이상이라는 믿음이 있다. 꽤나 긴장감있게 흘러가던 이야기가 범인이 드러나는 장면에서 다소 맥이 빠져버리는 느낌이다. 살인에 당위성이란 단어가 가당키나 하겠냐만 허구의 이야기인 소설이니 그 정도 당위성은 지켜주면 좋겠다는 생각이다.
9791185014517,8,"한 때 저에겐 ｀믿고보는 히가시노 게이고｀였는데, ˝질풍론도˝ 후로는 어쩐지 예측가능한 추리가 이어지는 것 같아 다소 밋밋합니다. 그렇지만 모든 추리가 강력한 반전만 치우치기보단, 가벼웠지만 촘촘히 엮인 스토리라인은 좋았습니다."
9791185014517,6,추리가 가능했다. 그래서 아쉽다. 이번 스토리의 무게는 가벼웠다. ㅜㅜ
9791185014517,10,"개인적으로 게이고 그다지 신뢰 안하지만, 이건 재밌게 읽었어요."
9791185014517,10,공허한 십자가를 읽고 바로 읽었는데 둘다 히가시노 게이고의 이름값을 하는 책인거 같다. 그의 신간 덕분에 재밌는 책을 읽을 수 있어서 좋았다.
9791185014517,10,재밌었다. 요근래 쏟아져 나오는 히가시노게이고 작품들 중 공허한 십자가와 더불어 제일 괜찮았다.
9791185014517,10,정말 오랜만에 진짜 재밌는 게이고의 소설을 읽었다. 모든것이 맘에 들었다. 강력한 한방은 없지만 요즘 나를 납득시킨 소설이 없었는데 몽환화 너무 좋다.
9791185014517,8,"아.. 제목의 뜻을 뒤늦게야 이해하게 되었네요.. 사실 백야행 같은 분위기를 기대했는데,, 약간은 기대가 컸을까요?"
9791185014517,10,흡인력있는 소설. 작고 작은 단서들로 사건을 풀어나가는 날카로움을 보고 있자면 시간 가는 줄 모른다. 최근작답게 일본의 심각한 문제인 원자력에 대한 작가의 견해까지 볼 수 있어서 좋았다.
9791185014517,6,사실 게이고의 작품이 이 정도의 흡인력을 만들어내는 일이야 당연하지. 원자력에 대한 고민도 충분히 깊이 있고. 하지만 역시 예전 작품을 되살리는 일은 쉽지 않군. 아무래도 자연스럽지 못하다.
9791185014517,8,"""세상에는 빚이라는 유산도 있다"" 단순 재미만을 추구하는 추리소설이 아닌 성찰과 의식이 있는 좋은 소설"
9791185014517,6,놀랄만큼 재미있다거나 획기적이거나 그러진않고 그냥저냥 잘읽어지는 정도. 주변사람들에게 추천할 정도는 아니지만 내 지루한 시간 때우기에는 좋은 딱 그정도.
9791185014517,8,"할아버지의 죽음과 노란 나팔꽃의 비밀을 파헤치는 리노와 소타, 자신들도 모르는 사이 서로의 인연은 얼키고 설켜 이제야 그 실타래를 풀어나가게 된다."
9791185014517,6,기대를 많이 해서일까요.. 가독성은 좋은데 결말이 좀 별로입니다. 2/3정도까지는 스토리도 나름 탄탄하고 좋은데 결말을 내기 위해서 억지로 사건을 진행해버리는 듯 한 느낌을 지울수가 없네요....
9791185014517,10,"이런 천재같으니라고. 요술방망이라도 있는 건지, 매 작품마다 어쩜 이렇게 신선하고 재밌는 이야기를 만들어내는지 신기하다. 내용도 다른 왠만한 인기있는 소설들보다 월등히 재밌고 항상 그 만의 사회적 메시지를 전달하고자 하는 소신이 멋지다."
9791185014517,6,십년을 공들인 거 치고는 좀 아쉬웠지만 ( ｀붉은 손가락｀ 6년 구상건을 생각하면 이 말을 액면 그대로 믿기에는 그렇다 ㅋㅋ 마찬가지로 작가의 머릿속에 계속 정체되어 있었을 것이다.)  그런대로 읽은 만 했다.
9791185014517,10,히가시노 게이고의 넘치는 창작력이 아직은 유효하다는 것을 보여주는 능수능란한 장르소설. ˝히가시노 게이고˝라는 이름은 이제 한국독자들에게도 그의 작품을 ˝믿고 보게˝ 만드는 보증수표.
9791185014517,8,스토리전개가 독특
9791185014517,10,일요일을 이 책과 함께 보냈습니다... 빚이라는 유산... 정말 재밌었어요~
9791185014517,8,"적당한 가벼움과 긴장감으로 읽어나가는 힘이 있지만 이전의 게이고 소설을 기대한다면 조금 밍숭맹숭한 기분이 들 수는 있을 것 같습니다. 하지만 책장을 덮을 때 역시 게이고, 하는 감정은 여전합니다."
9791185014517,10,"히가시노게이고 책은 거의다 읽었고 신작도 바로바로 읽는데, 이번 몽환화는 바로 직전 출간된 한여름밤의 방정식보다 더 재밌고 소재도 좋았다. 노란 나팔꽃이 왜 몽환화라고 불리며, 왜 사라져야만 했는지 그 원인과 거기서 초래된 이야기의 흐름이 설득력이 있고, 독자로 하여금 책에 빠져들게한다."
9791185014517,10,"늘 그랬듯, 한 장 한 장 마지막 페이지를 넘길 때 까지 심장이 쪼그라드는 줄 알았음"
9791185014517,6,도입부가인상적이나갈수록흐지부지해진다.｀몽환화｀란제목에서노란나팔꽃의위험이일찍드러나서인지긴장도도떨어진다.후쿠시마원전사고후진로를고민하던소타가사건해결직후바로진로를정하는것도뜨악하다.｀용의자X의헌신｀이그립다.
9791185014517,10,다작이면서도 다양한 소재와 캐릭터가 계속 작가의 책을 보게하네요~ 읽으면 머릿속에 그려져서 재미있게 읽었어요~
9791185014517,10,그의 재능은 어디까지인가
9791185014517,10,히가시노 게이고!! 믿고보는 작품.
9791185014517,10,초반은 놀랄만한 스토리로 놀랐고 마무리는 깔끔해서 좋았다. 히가시노 게이고는 참...ㅎㅎㅎ
9791185014517,10,히가시노 게이고의 신작이라서 망설이지 않고 주문했어요. 10년동안 공들인 작품이란 말에 더욱 기대하며 읽으렵니다.
9791185014517,6,"페이지는 잘 넘어가지만, 갈수록 가벼워지고 갈수록 싱거워지는 게이고...신작이 나올 때마다 기대하며 읽어보지만, 이번에도 실망.다작도 좋지만, <백야행>과 <용의자X의 헌신>이 그리울 뿐이다."
9791185014517,8,히가시노 게이고라면 의심없이
9791185014517,10,섬세하고 짜임새 넘치는 문장들과 놀라운 결말과 반전의 반복.
9791185014517,10,"용의자 x의 헌신을 너무 재미있게 본 독자로서, 이번에도 굉장히 기대됨 (물론 사이에 많은 작품이 나오긴 했지만)"
9791185014517,10,처음부터 끝까지 긴장의 끈을 놓지 못한 채 읽었습니다.
9791185014517,10,"히가시노 게이고,자꾸만 작품 속에 빠져들게 하네요."
9791185014517,8,약간의 아쉬움이 남는 작품이다
9791185014517,8,"몽환화의 정체와 더불어 작품을 통해 던져주는 사회적 메시지가 제법 강렬합니다. 히가시노 게이고 작품들 가운데 빼어난 수작의 범주에 속할 수는 없을지라도 꽤나 읽을만한, 멋진 작품임에는 틀림이 없을 것 같네요."
9791185014517,10,초반부터 휘몰아치는 전개! 어쩔수 없이 중독되는 작가!
9791185014517,10,프롤로그가 너무 강렬하네요. 히게시노 게이고 스타일이 빠르게 변하는군요.읽을수록 맛있네요. 역시 히가시노 게이고였어요..!!추천해봅니다~
9791185014517,10,히가시노 게이고의 추리소설은 언제나 마지막이 아름답다. 올해 가장 재밌게 읽은 책이다~ 메시지도 강렬하군...
9791185014517,4,무려 예약구입까지하며 받은 책이지만 많이 아쉬운 책이다.  히가시노책은 평타는치는데 이번은 아니다 이야기전개가 부자연스럽다
9791185014517,8,"10년이란 시간동안 썼다는 그의 열정과 재능을 확인하는 중이다. 그가 하는 말을 하나도 놓치지 않고 봐야 한다. 제대로 읽고 그 여운을 새길 수 있으면 하고, 바란다."
9791185014517,10,단순 추리 소설이 아닌 사회적인 현상에 대하여 한번더 생각하게 합니다.
9791185014517,10,전형적인 ｀히가시노｀ 스타일의 엔터테인먼트 작품... 인물들의 상관관계가 포인트!!!｀두께가 있으니깐...｀이라 생각하면서 좀 보다가 자려고 누웠다가 그대로 다 읽게 된 책이다... 다시 말해 잘 읽히고 재미있었다.
9791185014517,8,"믿고 읽어보는 히가시노 게이고 작가의 도서라 생각합니다. 오랜기간이 흐른 뒤에 작품이 나오는 게 아닌, 자주 소설을 내주셔서 감사하기도 하지만 작품성을 생각한다면 호불호가 갈리는 것 같습니다. 하지만 히가시노 게이고의 소설을 한권 한권 많아질 때마다 그 작가에 대해서 더 알고 싶습니다!"
9791185014517,10,양장노트 적립금 그리고 무엇보다 히가시노 게이고가 출판한 책이기에 구입합니다.
9791185014517,10,정말 재밋게 읽엇다.역사같운게 나오긴 하지만 지루하지않고 집중하고 읽을 수 잇엇다.
9788990982513,4,히가시노 특유의 잔잔한 휴먼 스토리. 용의자 X의 헌신이나 성녀의 구제와 비교하면 추리소설 본연의 맛은 많이 부족하다.
9788990982513,8,등장인물 유가와의 멋진 결말 나쁘진 않지만 히가시노게이고의 왕팬으로서 조금은 실망..
9788990982513,10,물리학자 유가와의 진면목을 본 도서였다.  그저 자신감넘치고 카리스마 강한 천재를 뛰어넘어 인간적인 혜안에 놀라고 반하고 다시 읽게 되는 책!이제까지 읽은 그 어떤 작품보다 단연 1위로 선정하게 된 도서
9788990982513,10,재밌게 봤습니다.
9788990982513,6,평이한 이야기에 신파 사연팔이. 다른 어떤 단점보다도 범죄를 위해 툭정 인물을 이용하는 대목에서 한숨만 나온다.
9788990982513,8,"“유가와” 어디서 봤던 이름인데, 기억이 가물가물하여 검색해봤다. 역시나 전에 읽었던 소설에서 봤던 이름...이번 소설도 재미있게 읽을 수 있었다. 언제나 믿고 보는 작가."
9788990982513,10,"히가시노 게이고 시리즈 중 가장 재미있었던, 가장 처음에 접했던 책이라 더 인상적이었다. 최고의 작품."
9788990982513,10,히가시노 게이고의 추리소설은 인간미를 내포하고 있다. 범인를 추리하는데 전혀 엉뚱(만화 명탐정 코난처럼)하지 않아서 공감이 되고 왜 그런 사건이 생겼는지에 대해서는 충분한 설명이 있어 동점심이 들기까지 한다. 원래 그랬던 것은 별로 없다. 원인이 있음으로 결과는 발생하기 나름이다.
9788990982513,10,앞으로 히가시노게이고 책 추천해달라고 하면 이건 꼭 포함 할 듯
9788990982513,6,가족이란 무엇인가에 대해서 생각하게끔 한 책이다. 그리고 선의가 악의로 오해할 수 있는 상황들이 생겨나는 것이 이 삶의 의미가 아닌가 싶기도 하고 미필적 고의로 인한 사건을 커버할려고 하는 유가와의 모습이 눈에 띈다.
9788990982513,10,히가시노 게이고의 베스트3로 내 맘대로 꼽은 책 여름에 다시 읽으니 좋구나
9788990982513,6,현실에 있을 법하지않은 전형적인 드라마 내용.
9788990982513,10,책이 두꺼운데 엄청 술술읽힘 히가시노게이고책은 역시 잘읽히는듯
9788990982513,10,"갈릴레오 시리즈라서,  겉표지 디자인에 끌려서 망설임없이 샀던 책.^^유가와랑 어린아이 조합이라 좋다."
9788990982513,8,처음에는 뭐이리 질질 끄나했는데 마지막 모든 진상이 밝혀진 부분에서 애잔함이 밀려온다. 어느 누구도 미워할 수 없었던 소설. 심지어 그 재수없던 유가와도 이번 소설에서는 인간미있는 재수탱이로 나온다. 역시 믿고보는 히가시노 게이고.
9788990982513,10,아 진짜 이작가는 천재인듯.ㅋㅋ 한번에 다 읽는게 아까워서 아껴아껴 읽고 싶게 만드는 책이네요.ㅋㅋ 근데 교수님 아이 싫어하는데 여기서는 꼬마랑 대화를 많이 하죠.ㅋㅋ
9788990982513,6,모르는 척 슬쩍 범인을 덮어주고 싶은 책
9788990982513,8,재미야 말할 필요도 없는데 말이죠. 왜 유카와가 유가와가 되는지 이해가 안 되네요. 읽으면서 계속 눈에 걸림.
9788990982513,10,첫 사건 범인도 반전 두번째사건 실행자도 반전교헤이가 주인공인 다음 소설도 나오려나
9788990982513,10,결말까지 여운을 남기는 책.
9788990982513,8,재미있다
9788990982513,10,국내 번역된 갈릴레오 시리즈의 최근작. 원서는 2012년에 나온 2권이 더 있다.
9788990982513,10,최고 말이 필요 없는 책
9788990982513,10,믿고 구매하는 히가시노 게이고!!그의 신작들은 여전히 흥미롭다~
9788990982513,10,갈릴레오 시리즈를 좋아합니다^^*
9788990982513,10,마지막이 씁쓸하기는 하지만 읽고 있는 내내 여름휴가를 보내고 있는 듯한 생각이 들었다.
9788990982513,10,역시 히가시노 게이고!
9788990982513,2,기억나는 건 십잣말풀이의 본즈. 히가시노 게이고도 본즈를 보는구나.
9788990982513,10,"히가시노 게이고, 말이 필요한가.훌륭한 책!"
9788990982513,10,"일명 탐정 갈릴레오, 유가와 교수를 만날 수 있으니까."
9788990982513,10,갈릴레오 시리즈는 최고입니다.
9788990982513,10,히가시노 게이고의 닳고 닳은 이름에 새로운 기운을 불어 넣어준 갈릴레오 탐정시리즈의 보석이다.
9788990982513,8,휴먼과 미스터리를 결합하는미스터리의 거장의 솜씨가 빛나는 작품
9788990982513,10,어린아이의 순수한 마음과 그걸놀아주는 유카와 그리고 민박집주인의 애기가 재미있었다.
9788990982513,8,이번 히가시노 작품은 굿~~
9788990982513,10,영화도 잼
9788990982513,10,"재미를 위주로 한 소설이지만, 한번 인연을 맺는 것이 우리의 삶에 어떤 영향을 줄 수 있는지에 대해 다시 한번 생각해 볼 수 있는 명작이라고 할 것입니다. 게이고의 책 중에서 재미와 개연성과 추리의 치밀함을 모두 겸비한 작품이라고 할 것입니다."
9788990982513,10,"히가시노게이고의 작품중, 특히나 유가와 교수가 나오는 소설을 좋아하는데오랫만에 만나는 유가와 교수가 나오는 작품이라 무조건 선택...추리소설이지만, 배경이 되는 바닷가 동네의 묘사가 서정적이라아름다운 바닷가 정경이 눈에 그려졌다.휴양지 휴가시 챙겨도 부담없이 읽을 수 있는 소설"
9788990982513,10,유가와 교수 시리즈의 작품들을 읽지 않았기에 걱정이 앞섰다. 하지만 전혀 문제 없었다.처음 읽어도 내용이해에 전혀 문제가 없었고 유가와 교수라는 인물에 대해 애정을 두기에도 문제 없었다. 혹시나 나처럼 고민하는 사람이 있다면 걱정말고 읽기를 바란다.
9788990982513,10,˝인생의 문제들에 대해 해답을 금세 찾지 못한다고 조바심을 낼 필요는 없다. 해답을 찾아내기 위해 성숙해져야 하고 배우고 노력하고 자신을 연마해야 하는 것이다. 그리고 그 문제에 대해서는 함께 고민해 주는 누군가가 있다는 걸 늘 기억해야 한다.˝ 유가와 교수의 따뜻한 조언이 담겨 있는 소설
9788990982513,10,나이들수록 점점 더 좋아지는 히가시노 게이고. 다음 작품이 더 기대되요. 유가와 탐정 또 다른 작품에서 또 봤으면 좋겠어요.
9788990982513,10,올 여름 휴가시즌에 딱 어울리는 작품이죠. 잔잔한 감흥이 밀려드는 히가시노 게이고의 걸작이라는 느낌이 드네요
9788990982513,10,"처음엔 이번에도 이 두께!하고 약간 겁을 집어먹었지만, 그가 누구인가. 천재 이야기꾼 히가시노가 아니던가. 한번 잡으면 단숨에 끝까지 지루하지 않게 읽어버리게 만드는 천부적 능력. 단순추리소설이 아니라 독자로 하여금 사회문제나 현상에 대해 생각할 거리를 던져준다는 점에서 최고다."
9788990982513,10,"오랜만에 좋은 책을 읽엇네요, 군더더기없는 문장과 전개, 그리고 마무리까지! 캬 게이고에 취한다"
9788990982513,10,설레면서 귀 기울이게 되는 인간적인 캐릭터~ 역시 히가시노게이고의 캐릭터중에서 유가와선생님이 몰입도가 가장 좋은것 같습니다! 그 바다가 나도 보고싶습니다.
9788990982513,10,소설을 읽으며 한 문장 단위로 그림이 그려지는 이유가 작가의 재능인 것 같다. 늘 재밋고 고맙게 읽고 있어요~
9788990982513,10,"유가와교수는 여전히 멋있고, 과학과 환경의 끝없는 논쟁을 다시한번 생각하게되네요~ 아이의 순수함과 사건의 미스터리가 번갈아가면서 전개되어 더욱 글을 재미있게 만들어요~역시 히가시노 게이요~"
9788990982513,10,트릭이나 주제의식은 다른 분들이 써 두셨으니 저는 다른 관점에서 씁니다. 유카와 교수님 애들 싫어하신다면서 쿄헤이랑 아주 케미가 넘칩니다 ㅋㅋ꼬맹이랑 꽁냥꽁냥 물로켓 쏘는 귀여운 교수님 보고 싶은 팬들이라면 꼭 보십쇼 ㅋㅋㅋㅋㅋ
9788990982513,10,히가시노게이고의 추리작품은 언제나 항상 생각못한 반전과 마음에 깊은 여운을 주는것 같다.이번 작품역시 실망할 겨를이 없었다
9788990982513,10,"공대 출신 작가답게 늘 과학을 접목시키려는 노력이 과학을 잘 모르는 독자로선 참으로 흥미롭다. 그래서 더더욱 교헤이의 행동과 마음에 공감이 간다. 모든 상황이 그저 그렇게 흘러가야만 했던, 그것만이 최선이라 여기며 살았던 한 가족에게 일어난 한여름의 슬픈 이야기."
9788990982513,10,오랜만에 히가시노게이고 다운 책을본거같다
9788990982513,10,유가와 교수 너무 멋져요 요즘 아이들이 불꽃놀이에 빠져있는데 그 원리를 설명한 내용이 있어서 실생활에도 도움이 되네요 역시 히가시고 게이고 그는 우리를 실망시키지 않아요
9788990982513,10,"집착, 속죄, 그럼에도 불구하고 인간에 대한 희망. 히가시노 게이고 소설의 이 특징을 잘 표현하는 캐릭터로 가가 형사와 유가와 교수를 들 수 있다. 이 책에서 유가와 교수는 더욱 부드럽고 따뜻해졌다. 그것이 이 작품의 장점이면서 단점."
