ISBN13,rating,review
9791160852455,8,책벌레의 하극상 제3부 영주의 양녀 1 - 드디어 주인공에게 권력이 생긱고 있습니다. 진짜 문제임.(...)
9791160852455,10,이다음편 빨리보고싶어요.ㅠㅠ
9791160852455,10,솔직히 나올 줄 몰랐음... 3부 과연 정발될까 싶었는데 다행이네요
9791160852455,8,"안그래도 신분사회에 전혀~ 구애 받지 않는 마인이죠.  엉뚱함에 날개까지 달아버려 더욱 재미있어지는 3부 다시봐도 좋아요. 특히, 진화하는 인쇄와 마인의 장삿속이 빛을 발하는 페슈필 연주회..."
9791160852455,10,이제 재밌어지는 파트네요 :)
9791160852455,10,빨리 보고 싶네요. 으후훗. 바로 구매합니다.
9791160852455,10,알람이 없어서 나온지도 몰랐다. 오피셜팬북 알람보고 줍줍
9791125693635,10,아직은 세상물정에 덜 익숙한 어른이 된 콜과 눈치는 없지만 직감은 제 어미를 빼닮은 뮤리의 기만 모험기입니다. 팬분들께선 새로 탄생한 커플들에게 안녕을 기원하며 죽창을 들어주시면 되겠습니다.
9791125693635,10,에에..?? 에???
9791125693635,10,이제 이 일가의 이야기는 보는것 만으로도 행복하다
9791125693635,10,부부사기단 주니어와 딸내미 늑대의 사기여행이군요..
9791125693635,10,이게 정발될줄은...
9791161902142,10,가이드북은 특정 이벤트나 영화 등에 대한 안내와 설명을 담은 책이나 소책자를 말한다.상술과 상관이 있을까싶네요.
9791161902142,10,공식가이드북 살 바에는 차라리 소설을 사서 읽겠다.
9791161902142,10,이건쫌... 이런 공식가이드북도 좋긴한데 비하인드 스토리 궁궁해서 어쩔수 없이 사게 만들어버리는구만.... 이런 상술 그리 좋아하지는 않습니다 ㅠ
9788926364086,8,근래 판타지계 라이트노벨에서의 먼치킨의 급류에 질색을 표하는 독자분들이라면 충분히 사서 읽어볼만한 도서입니다. 필력도 필력이지만 작가가 생각을 많이하면서 집필하고 있다는게 느껴지며 설정도 탄탄하여 보는 재미가 있습니다.
9788926364086,8,라노벨에서 작가의 이름만으로 구입하는 볓 안되는 작가의 작품입니다.뭐 내용이야 뒤로하고 정말 필력이 뛰어난 작가입니다.벌써부터 다음권이 기대되는 작품이네요.개인적이 강추작입니다.!
9788926364086,10,"[사랑과 전쟁과 혁명의 이야기.]▷아름다우면서도 생생한 문장, 비참함과 애절함의 교차, 독특하고도 사실적인 세계관, 그리고 사랑과 전쟁과 혁명. 그 모든 것이 이 작품 안에 담겨있습니다. 이건 정말로 물건 중의 물건입니다, 여러분. 한 소년이 처절하게 새겨나가는 발자국 속에서 피어나는 운명이란...... 아아, 빨리 다음 권을......"
9788926364086,10,신작 기대해봅니다. 으흠~
9788926364086,10,삽니다~
9788926364086,10,비공사 시리즈 작가님이니 당연 믿고 구매하죠. 더구나 라노벨계 SF물은 쉽게 볼 수 있는게 아니기에 구매합니다.
9788926364086,10,약 3년만의 신작...헠헠헠 이 양반 꺼는 무조건 사야죠!!! 비공사 시리즈 마지막인 서약을 기대했지만 야상곡이 일뽕을 치사량으로 맞은 내용이라...독자가 다수 이탈해서 안 나오는 것 같군요. 혹시 원본샀다가 번역나오는 참사가 싫어서 기다리긴 하지만...아무튼 비공사 세계관으로 보여서 기대
9791131966143,10,형 돌아와....
9791131966143,10,제발 이제 나와주라...ㅠㅠ
9791131966143,10,잘 정리하는것도 창작이지
9791131966143,10,표절도 있지만 너무 억지스럽게 갖다 붙여서 표절이야! 라고 우기는 것도 보이고내가 보기엔 오마주로 보이는것도 있다 다만 확실한건 분명 표절이 엄청 많다는 거다다만 소설이 재밌고 내 가치관도 내 작품이 표절당하더라도 그것이 나의 이익에 큰 문제가 되지 않다면 상관없다는 주의라서 5점★
9791131966143,2,문학적인 수준이 어느 시점부터 확 올랐다고 생각했더니 세계명작을 한권에 다 넣었으니 그럴만도 하지
9791131966143,2,표절 신경 안 쓰는 사람들 지들 물건 누가 허락 안 받고 쓰면 개발악할 거면서 남의 일에는 무신경함 자기가 재밌게 봤으니까 남의 작품 표절해도 신경 안 쓰는 라노벨 독자 수준 자신의 수준 잘 보여줬다고 생각함 그 작가에 그 독자 딱 어울린다.
9791131966143,2,별 하나도 아까운 희대의 표절작. 김훈과 세익스피어 동서양 고전과 현대를 넘나들며 표절해서 돈 버는 솜씨가 거장의 경지에 다다랐다. 이 글을 사서 읽는 개돼지들에게 영광을
9791131966143,10,제발 별점 테러좀 하지마라.다음권이 기대됩니다. 빨리좀 나왔으면....
9791131966143,2,이지경이 되도 옹호하는 분들 덕분에 이 쓰레기를 처분할 수 있었습니다 감사합니다
9791131966143,10,재미있음. 몰입도 굳. 책이 잘되니까 싫어하는사람들도 나오는군 ㅋ. 표절이던 말든 다음권좀..
9791131966143,10,다음권 너무 기대 되는데 1년 정도 걸리려나? ㅠㅠ
9791131966143,10,뛰어넘었다고 나스....
9791131966143,10,구매합니다. 3권과 4권의 연출이 좋았는데 이번에도 기대되네요. 다만 좀 희소성을 위해 아끼기를..
9791131966143,4,"다들 평이 좋은데, 나는 오히려 연출이 너무 과해졌다고 생각함... 이야기의 전개보다는 장면의 자극적인 면만 부각시키는 느낌이라 오히려 몰입에 방해가 됐음."
9791131966143,10,연출.....ㅎㄷㄷ  다음권은 빨리 나오길
9791131966143,10,"검은페이지의 연출.. 좀.. 쓸데없이 책이 길어지는 느낌은 있었지만, 대단했고, 그걸 받아준 편집자님도... (참고.. 흐릿한글.. 굳이 힘들게 읽지 마세요 ㅜㅜ)"
9791131966143,6,다좋다고 생각합니다.연출이라던지 진행흐름이라던지 전에 쓰던것보다 훨씬 나아지셨는데 몰입에 거슬릴정도로 많이 사용되는 욕설때문에 조금 그렇네요. 주인공과 주변 캐릭터특성상 많이 나올수밖에 없다는거는 알다만은 굳이 이렇게까지 말해야 했을까? 싶을정도로 심했던 대사들이 있네요.
9791131966143,10,연출 십오지네
9791131966143,10,연출 ㄹㅇ 미쳤다. 내용 몰입도도 미쳤는데 연출까지 이러니까 소름 돋은게 꺼지려 하면 다시 돋고 다시 돋고 해서 긴장을 못풀겠다.
9791131966143,10,검은 페이지 연출 지렸다. 참신한 시도였음.
9791131966143,10,훔바바 리버풀의 사나이의 편재밌게읽었다. 강추
9791131966143,10,빨리좀 나왓으면
9791131966143,8,마녀의 비중이 다대합니다. 이번권의 테마는 용서가 아닌가 싶습니다. 그런데 작품에 욕설이 너무 많은 듯합니다. 자극적인 말로 몰입에 방해가 됩니다. 다음 권은 조금 일찍 나왔으면 좋겠습니다. 재밌게 잘 읽었습니다.
9791131966143,10,10월 12일 예약이었는데 갑자기 배송되어서 놀랐네요.
9791131966143,10,드뎌 나오네 날짜 조금만 땡겨주면 안되나 ㅠㅠ
9791131966143,10,드뎌 나오긴 나오는구나!!!! 오랜 기다림에 부디 부응하는 명작을 기대하며^^
9791131966143,10,기다렸습니다~^^
9791131966143,10,이 글은 보배인데숭 구매하는데샤아아악
9791131966143,10,드디어 나오넹
9791131966143,10,삽니다~
9791131966143,10,작가레기 거의 1년만에 다음 권 내는데 이제야 돈이 다 떨어졌나봄ㅡㅡ 다른 말 다 필요 없고 어서 내 돈이나 가져가
9791131966143,10,국산판 토가시..
9791131966143,10,드디어 나오내 연휴에 맞춰서
9791131966143,10,빌어먹을 드으럽게 오래걸렸네
9791131966143,10,드...디어....
9791131966143,10,"1년....걸렸다...대체 왜 이렇게 늦어지는걸까,이 작가가 삘받으면 정말 잘쓰고 잘 꼴리는데 이미 쓴 작품을 다시 쓰기엔 힘이 부족한듯"
9791131966143,10,줄거리는 다 까먹은지 오래...다시 읽어야겟네ㅜㅜ
9791131966143,10,드디어 나오는건가요
9788960520172,10,다음권 한참 나왔는데 왜 전자책 안내줘요?빨랑 내줘요 현기증난단 말이에요
9788960520172,10,너무 재미있게 읽고있는 소설입니다.다음편 빨리주세요..ㅠ.ㅠ))) 출판사분들이 포기안하시고 완결까지 끝까지 내주셨음 좋겠어요.
9788960520172,8,2부 마지막 권입니다.여주인공의 고난이 더욱 두드러진다고나 할까.귀여운 여주인공이 나름 구르는 맛에 보고 있습니다.필력도 훌륭하고 분량역시 일반적인 라노벨 보다 두꺼워서 읽는 재미가 잇는 소설입니다.우후죽순 난무하는 이계 진입물중 드물게 보이는 훌륭한 소설입니다.개인적인 강추작입니다
9788960520172,10,몰아서 읽으려고 2부는 랩핑도 안 뜯었는데.. 예판책이랑 같이 배송 선택하니까 기다리는게 힘드네요. 한국에서 정식판으로 완결까지 나올 수 있을까요. 잘 팔려서 출판사에서 포기 안했으면 합니다
9788960520172,10,"항상 흐믓한 미소를 짖게 만드는 마인의 소소한 일상이 너무나 짧아서 무척 아쉽고 가족과의 갑작스런 이별은 몹시 안타까웠던 2부의 마지막 권이었네요.  그리고 1, 2부 보다 더욱더 꿀잼인 3부가 벌써부터 기대되네요.  오타 찾는 재미는 이제는 덤인듯..."
9788960520172,10,필구!! 책벌레들이라면 읽어야 하는 책
9788960520172,8,"아기자기한 재미를 주던 2부 였는데, 앞으로  권력을 등에 업은 마인의 ' 폭주시대 ' 가 기다려지네요.예고 보다 늦은 출간에  여전한 오타들...은  유감."
9788960520172,10,좋아요 읽어보세요.
9788960520172,10,좀만 있으면 포텐터지는 3부네요 ~#
9788960520172,10,핫산 열심히 일하시네요! 허어허허허!
9788960520172,10,크흐! 나왔네요. 구매합니다!!
9791131964026,8,가볍게 읽기 좋았습니다ㅎㅎ 반전도 놀라웠지만 결말이 조금 아쉽네요ㅠ
9791131964026,10,couldn‘t be better
9791131964026,8,일러가 참 좋네요!
9791131964026,10,중2 딸아이가 좋아하네요. 잘읽고 있습니다.
9791131964026,10,"표지, 소개글 읽고 구매!! 필구까지는 아니지만 무난하게 읽을만 합니다."
9791131964026,6,"약간 특이한 설정이 있지만, 무난한 내용, 무난한 등장인물들복선 회수도 깔끔하나, 그리 팍 오는건 없네요.적당히 읽을만한 감동물입니다."
9788926363454,10,읽어보면 후회는 없을듯.
9791157109807,10,나온 지 1년이나 넘었는데도 부록이 있는 거로 나오다니 ㄷㄷ 개이득
9791157109807,8,뭐 던만추 시리즈야 외전이고 할것없이 나오면 무조건 구매죠.오히려 외전이 본편보다 힘이 더 들어가는 듯...!본편 다음권도 빨리 나왔으면 좋겠네요 ^^!
9791157109807,8,"파밀리아 크로니클 episode 류 - 안정적이고 훌륭하고 재미있고, 본편 떡밥도 잘 있어서 매우 좋은 작품. 다만 역시 이런 작품의 한계는 본편 던만추가 없으면 성립이 안 된다는 문제가.. 특히나 중간 중간에 어떻게든 본편 캐릭을 넣으려는 모습이 오히려 아쉽다."
9791157109807,10,기대가 많이 되는 던만추!
9791157109807,10,역자도 더이상 메완이 아니고 부록이 후하니 당연히 구매입니다.
9791157109807,10,원서로 꾸역꾸역 봤는데 드디어 정발 됬네요!
9791157109807,10,오호! 류! 바로 구매합니다.
9791157109807,10,믿고 구매하는 던만추
9791157109807,10,잘보겠습니다 ㅎㅎ
9791157109807,10,류 외전도 나오는군요!
9791127841935,8,책을 받은뒤 다음날에 읽기시작해 총 이틀걸렸습니다.책상태는 좋았고마지막장인 마계의4기사 나오는부분이 좀 루즈하네요뭐 할때마다 남자주인공이 용족힘 개방했는데도 이정도로 적이 강하다니 이러면서 결국엔 [스포 ] 고...일상적인 부분이나 여캐들 만날때 전개는어느정도 필력이 있다고봐요
9791127841935,10,요즘같은 이세계 먼치키물 홍수속에 이게 왜 안나오나 했네요. ㅋ
9791127841935,10,와우 이게 나오네 무조건 산다
9791127841935,10,만화책으로 봣는데 재밋어서 함 사봐요~
9791127841935,10,"으흠~ 개인적으로 용이 나오는 걸 너무 좋아하기 때문에 기대됩니다만, 과연 어떨지요. 신작 구매합니다."
9791161450223,10,"한국작가 라이트 노벨은 좀.. 이라는 생각을 가지고 있다 구매해봤는데, 주인공 데지르의 응용력과 연산능력을 활용한 배틀들, 전생물이지만 이세계가 아닌 판타지에서 판타지 전생물인점, 그림자세계는 게임같은 퀘스트라는 점 등 여러가지가 재미있었습니다. 일러스트도 좋고 3권까지 바로 구매하러!"
9791131957325,10,"솔직히 구입할때는 친구가 ‘장기두는 라노벨이다‘라고 해서 조금 꺼려졌는데, 표지에 나온 저 캐릭터가 너무 취향저격이라 그냥 질러버렸다. 읽어보니 생각보다 재미있다. 아니 꿀잼이다!! 근데 장기 용어가 많이 나와서 장기에 대해 모르는 사람은 이해가 어려울수 있는점을 감안해야하는게 단점..."
9791131957325,8,뭔가 새롭고 신기하고 장기라는것도 은근 재미있게 느껴졌고 장기 하나하나 둘때 정말 많으 수를 생각하고 두고 하나의 기를 두기 위해 얼마나 많은 연습을 했고 공부를 한 걸 느꼈습니다. 그리고 이 용왕은 쓰레기입니다 로리콘에
9791131957325,10,이정도면 충분히 읽은 만함.지나치게 장기내용만 다루면 장기를 모르는 독자들이 이탈했을지도 모르지만..적절하게 장기소재를 다뤄서 장기를 모르는 독자도 충분히 읽을 수 있음.
9791131957325,8,2권이 벌써나왔네요
9791131957325,8,"용왕의 하루, 재밌네요!"
9791131957325,10,표지가 영~ 이랬는데 보다보니 엄청 몰입해서 봤네요. 고스트 바둑왕보는줄 ㅎㅎ
9791131957325,10,재미있어요!
9791131957325,10,일본장기판 로큐브? 한국에서는 생소한 장기(일본)도제인 탓에 익숙하면서도 신선한 느낌이었음. 해당 내용이 실재한다면 발생할 막장성(?)은 둘째치고 기본 설정은 리얼리티 쪽으로 가는 듯 했지만 후반에 생각지도 못한 만화 요소(?)가 등장해서 이야기의 맥이 살짝 끊김.다음권은 라이벌 등장?
9791131957325,2,용왕질을 하고 싶은건지 로리질을 하고 싶은건지 이해가 안된다
9791131957325,4,별로
9791131957325,10,"이 노벨은 정말 스고이!!,랭킹작이며 믿고보는 작가@!ㅎ"
9791131957325,10,용왕이 하는 일! 1 - 시라토리 시로의 장점이 너무도 강하게 잘 어울리는 작품. 정말 감동할 수 밖에 없다!!!!!
9791131957325,10,구매완료 기대되네요 ㅎㅎ
9791131957325,10,아래 랭킹작이라는 소문에 구매해봅니다
9791131957325,10,이 라이트노벨이 굉장해! 2017년의 1위 랭킹작 아니던가...
9791131957325,10,나름 괜찮을..려나?마도소대 사는김에.함 사봐야지..
9791131957325,10,로리네 밥벌레보다는 이게 낫겠군..ㅎ
9791131957325,10,신작 구매합니다!
9788960520141,8,마인의 행동 하나하나가 다 귀엽습니다 ㅎㅎ
9788960520141,10,오탈자가 조금 있지만 묘사같은게 더 추가된건지 다시봐도 새롭네요
9788960520141,10,책벌레 너무 좋아♥
9788960520141,6,책벌레의 하극상 제2부 신전의 견습무녀 1 - 이전작을 봤으면 계속 추천하고 싶은 작품이지만 내용은 더 방대해지고 있지만 깊이나 진행에 있어서 1부에 비해서 열화된 느낌. 특히나 주인공에게 주는 세계의 압박이 희미해지고 있는 느낌.
9788960520141,8,요 근래에 진짜 비싼값을 하는 소설입니다.동이 아깝지 않은 작품이죠.여주인공 물 치고는 진짜 주인공도 마음에 들고 내용도 세계관이 나름 치밀하달까 정말 요 근래에 최고로 마음에 드는 소설입니다.개인적인 초강추 작입니다.
9788960520141,10,마인에게 축복을! 꺄!!!! ......출판속도좀 올려줬으면 좋겠따... ㅠ ss도 팍팍 번역해줬으면 좋게따...
9788960520141,10,빨리 나와서 다행이에요ㅎㅎ
9788960520141,4,별롭니다
9788960520141,10,아싸♡
9788960520141,10,흐흣. 바로 구매합니다.
9788960520141,10,헐!! 웬일이래!!! 바로 구매합니다!!
9788960520141,10,와아아아아아 생각보다 빠른 2부 돌입
9788960520141,10,떴다아아아아아 구매합니다
9791161450100,2,오버로드깉은 느낌인줄 알고 봤는데 필력이 으음..
9791161450100,10,재밌어요!!
9791161450100,10,던디를 먼저 봤어서 그런가 웹판 던디랑 비교해서 던디보단 덜 하드한 던디느낌?재밌음
9791161450100,10,구매하였습니다
9791161450100,10,호기심으로구매했는데 레나가귀엽네요
9791161450100,8,처음엔 그냥저냥이었는데 중반부턴 꽤 재밌었음
9791161450100,10,지금까지 나온 김치노벨중에선 볼만한 작품인듯
9791161450100,8,일본의 오x로드랑 좀 많이 비슷한 내용의 책 다만 추구하는 목표가 다른것
9791161450100,10,카카오페이지에 있어요
9791161450100,6,"재미 없는건 아닌데 딱히 재밌지도 않은 작품이네요, 스토리도 어디서 많이 보던 전개로..."
9791161450100,10,귀여운 레네를 보기 위해 얼른 사버렸습니다. 기다리고 기다렸던 출간 꿀잼!
9791161450100,8,흠 이거 조아라에서 봤던것같은데.. 출간됬나보네요?
9791161450100,8,음 호불호가 있다고 그래서 카페 분들 리뷰좀 보고 결정해야 할듯 시드는 그래도 완결까지 내주니 그럭저럭 좋은데 정발이 느리다는..
9791160850628,10,"홍대 ㅂㅅㅌ에서 실물 종이책 영접하고 발을 못 떼었던 작품.. Nㅅㄹㅈ에서 백복치, 중혁과 독자, 납골당의 겨울이 이야기를 돌아가면서 정말 부지런히 봤었는데 이제 대부분 완결이 나서 읽을게 없어 슬픕니다... 그리고 제목과 표지도 처음 본 순간 강렬한 인상을 남겼던.."
9791160850628,10,두근두근. 언제나 가지고싶던 납골당의 어린왕자가 오프라인으로 떳다! 한 명의 작가로 보기에 충분한 퉁구스카님의 고증 충만한 혐실세계를 들여다보자. 오타 아니다.
9791160850628,10,암담한 현실에 마음이 짠하고 해피해피하기 만을 원하는데 그렇지 못할거라 더 짠하네요
9791160850628,10,"기다리고 기다렸는데 개강에 치여서 구매하지 못한 1권, 2권이랑 종강맞이 선물로 구매합니다.살아오면서 본 수천권 책 중에 가장 맘에 드는 문체를 종이책 활자로 본다고 생각하니 두근대서 견딜 수가 없네요..!!퉁구스카님이 보시고 흡족해하시며 동심이 차오르시길 충심으로 기원합니다"
9791160850628,10,퉁구스카님의 동심어린 책을 지를수밖에 없었습니다.
9791160850628,10,책으로 나오다니 ㄷㄷ 무조건 사야겠네요
9791160850628,10,책으로 나오길 손꼽아 기다리고있었어요 드디어 나오네요:)
9791160850628,10,우와 이게 드디어 출판이시군요 퉁구스카님ㅋㅋㅋ 할케기니아잘봤었습니다 납골당은 조아라 결제를 안해서 못봤지만 책은 소장가치가 있지요! // 이미 필력은 할케기니아로 인증하셨으니 남은건 믿고사는거죠
9791160850628,10,조아라에서 재미있게 보고 있습니다. 소장가치 짱짱!!
9788926361443,10,사길 잘했어요
9788926361443,10,이제서야 히로아카 눈떠서 책을샀습니당 ㅠ너무 행복합니당ㅜㅜ히로아카의 등장인물들의 그 외의 이야기 ㅜㅜ진짜 팬이신분은 사시길 ㅎ일러스트도 있구 그외의 면모들이 많아용 ㅎㅎ
9788926361443,10,원작이나 애니에서 보지 못한 외전 같은 이야기들을 볼 수 있어서 좋았어요!
9788926361443,10,히로아카 팬이라 샀는데 오리지널 내용인데도 괜찮고 읽을만 하네요!!! 특히 본편 사이사이 이야기들이 나와 더 만족스러운 것 같아요!!
9788926361443,6,괜찮았어요! 크게 좋지도 나쁘지도 않았습니다. 음 가장 좋았던 점은 만화책과는 다르게 일상을 볼수 있었단 거에요! 주인공외의 다른 아이들의 일상도 함께 볼 수 있어서 재밌었습니당.
9788926361443,10,고퀄리티를 자랑하는 데쿠 카드가 포함된 유에이 백서 1권 초판!만화도 재밌고 소설도 재밌으면 어떻게 합니까소설은 포근한 일상얘기와 캐릭터의 다른 면모를 볼 수 있는 좋은 책이었습니다특히 슥슥 그린듯한 일러스트가 중간중간 끼어있어서 눈도 즐겁고 완벽합니다빨리 2권 나왔으면 좋겠어요
9791131955222,10,도쿄사이드키친과 선술집 바가지 다음으로 읽었는데 그나마 위의 2개보다는 낳은것 같아요솔직히 별 대단한 내용은 없지만 구성이 무난하고 무엇보다 캐릭터의 개성이 매력적이었습니다선술집 바가지는 도코사이드키친보다 나았지만 약간 아쉬운 구성이 많았고 먹빵 힐링으로는 주점노부가 더 낳네요
8809106468484,2,퍼즐만 팔아제낄 생각인듯
9791127840211,10,너무 좋아요 좋습니다 살천 덕후분들 소설도 사시면 좋겠어요ㅜㅠ캐릭터들 감정선과 만화.애니보다 풍부한 속마음까지ㅠㅜ아직 앞부분밖에 못읽었지만 심장을 광광 때려버려서 심장 부여잡고 읽었어요ㅜㅜㅜ한 줄 읽고서 아 너네 이런 생각했냐구ㅠ하면서 감동받고 읽고 감동받기 반복했죠ㅜ최고ㅜㅜ♡
9791127840211,10,품질이 걱정됐는데 거의 새책이나 다름없고 배송도 빨라서 정말 만족스러웠어요
9791127840211,10,원작이 게임이라 번역쪽에 꽤 걱정을 했습니다.하지만 책을읽고 나서는 몰입감이 정말로 좋았고만화 전에 소설을 보길 잘 했다는 생각이 드네요ㅎ^ㅎ
9791127840211,10,정말 소설 꼭 읽어보세요!! 게임에서도 코믹스에서도 안나왔던 디테일함과 어렸을적의 잭 이야기도 나오고 레이와 잭의 각자의 속마음과 생각 등 너무 잘표현되어서 읽는내내 둘이 너무 귀여웠어요ㅠㅠㅠ
9791131953181,10,아카네가 점점 먼치킨이 되는거 같다.ㅋㅋㅋ
9791131953181,10,역시 재밌네요ㅎㅎ
9791131953181,10,굉장히 몰입도 좋은책. 의외라고 느낄정도로 묘사가 자세해서 몰입 잘되었습니다. 애니메이션을 보셨다면 이것도 꼭 읽어보시는걸 추천합니다. 분위기나 묘사에서 애니메이션보다 소설이 더 재밌었어요.
9791131953181,10,상하권 세트와 함께 구매합니다.
9791131953181,10,글은 이렇게 쓰는 겁니다. 몰입력 좋은 책.
9791131953181,10,사이코패스는 무조건 구매~ㅎㅎ
9791131953181,8,사이코패스의 팬이라면 반드시 구매해야 될 작품입니다.원작 애니도 정말 좋아하고 팬이지만 소설역시 애니 못지않게 읽을만 합니다.애니 원작 소설은 퀄이 떨어질때가 많으네 이 작품은 그렇지가 않아서 좋네요.구매에 후회가 없는 작품입니다.
9791131953181,10,애니에서 언급만 되던 코가미 검사관시절 이야기앞선 사이코패스를 구입하신 분에겐 최고의 선물
9791131953181,10,재미있겠네요.싸이코패스
9791131953181,10,PSYCHO PASS 에고이스트를통해 접한 명작애니  돈생기면 바로지르겠습니다.
9791133437900,10,Good.
9791133437900,2,영화를 재밌게봐서 샀는데 그냥 캐릭터별비하인드를 수록한 라노벨입니다. 저는 취향이 아니라 읽히질 않았네요.
9791133437900,10,‘너의 이름은‘을 보고 이 책을 본다면 새로운 눈을 뜨게 될 것.
9791133437900,2,끔찍하다
9791133437900,10,처음에 책굵기보고 좀아닌거 같다라고 생각했으나 일러굳
9791133437900,10,없어도 스토리에 빈부분은 없습니다.그렇지만 아이스크림 먹다 걸린 요츠하 일러가 너무 귀여우니 지르세요!
9791133437900,10,어쩌면 영화속의 편견을 깨는 책이 아닌가 싶다(너의이름은 팬은 오열합니다 ㅠㅠㅠ)
9791133437900,10,어쨌든 이 사이드 스토리는 다른 관점을 말해주거나 에필로그 형식이 아닌...최소한의 고려로 추가된 다른 인물들의 사연과 사정을 그리고 원작에서 왠지 신경 쓰이던 부족했던 설명에 대해서 답해주고 있었다.
9791133437900,8,‘너의 이름은‘의 보충 교재 같은 그런... 두 권이 하나가 되어야 진정한 ‘너의 이름은‘이 아닐까 하는...
9791133437900,10,영화에 다 담지 못한 빠진 부분 뭔가 허전한 부분을 채워주는 느낌 결론 꿀잼!!
9791133437900,10,"영화 내에서는 알 수 없는 주,조연들의 이야기를 알 수 있습니다! 타키와 미츠하가 몸이 바뀌었을 때의 묘사라던가, 요츠하의 시점이라던가, 미츠하 부모님들의 만남... 너의 이름은을 재밌게 보신 분은 이 책 또한 즐기실 수 있을겁니다."
9791133437900,10,영화에서는 보지못하고 막연히 상상했던 부분들을 보게 되어 무척 좋습니다.
9791133437900,10,너무 좋다.. 이것 또한 무스비
