ISBN13,rating,review
9788990982667,4,과거의 명성만큼 작품성이나 재미가 유지되기는 어려운 건지.  일정한 수준의 재미를 보장하는 편인 작가지만 이 소설은 그냥 그랬다.
9788990982667,10,"영화로도 나온 천공의 벌, 원전 문제를 두고 다시금 생각해보는 계기를 준 좋은 작품👍"
9788990982667,6,반전 없는 추리소설.
9788990982667,8,“천공의 별”로 잘못 읽었던 소설이다. 현실에서 벌어지면 안 되는 일.. 살인사건이 나오지 않은 또 하나의 히가시노 게이고의 소설. ㅎㅎㅎ
9788990982667,2,그냥 원전에 대한 내용만 있음...히가시노게이고 책 중에 질풍론도가 제일 재미없었는데 이게 더 재미없음
9788990982667,10,"현실세계에 ˝절대˝, ˝100%˝라는 것은 없다. 라는 생각에서부터 출발한 이야기. 원전이라는 게 그렇게 간단히 이 세상에서 사라질 수는 없지만, 그래도 원전이 없다면 우리 사회가 또 다른 도박을 하지 않고도 유지될 수 있을 것 같다."
9788990982667,10,원자력발전의 원리와 문제점에 대해 충실하게 설명하고 있는 역저입니다. 다만 게이고의 다른 작품과 달리 흥미는 좀 떨어집니다. 원자력발전에 대해서도 관심있는 분에게 더없이 좋은 선물이 될 것 같습니다. 치밀한 묘사와 세밀한 상황설정에 감탄을 거듭하게 합니다.
9788990982667,8,원전에 대한 새로운 관점을 보여주었다.
9788990982667,8,영화도 있던데 보고싶어졌다벌에 쏘인듯 당분간은 원전 때문에 쓰라릴듯하다
9788990982667,4,작가의 책 중에서는 드물게 중도에 읽기를 포기한 책
9788990982667,8,원자력 발전의 두 가지 종류와 헬기에 대한 상세한 지식을 바탕으로 한 저자의 치밀함이 보이고 동일본대지진 이전에 발표된 점이 미미여사의 ˝화차˝를 생각나게끔 한다. 자신이 밟고 있는 그 땅이 그 사람의 색깔이라고 저자가 말하는 부분에서 지금의 나의 색깔은? 회색 아니 무채색일까 싶다.
9788990982667,2,나름 히가시노 게이고 팬인데이 책에서 히가시노 게이고 특유의 긴장감을 거의 느낄 수 없다. 한마디로 재미없다.1995년 작품이 이제야 번역된 이유는 그 때문 같다.
9788990982667,6,왠지 긴장감이 덜하다. 그래서 결국 무슨 말을 하겠다는 건지도 흐릿하다. 한마디로 긴 것만큼 재민 없다.
9788990982667,8,"양을 줄였다면 좋았을 소설, 쓸데없는 내용이 너무 많다고 생각.."
9788990982667,8,˝어린아이는 벌에 쏘이고 나서야 벌의 무서움을 안다˝ 지진과 원전에서 자유롭지 못한 현재 우리에게도 유효한 공익소설. 두께가 무색하게 재미있다
9788990982667,6,왜 난 허무하지 ㅠㅠ 슬픈데.......   허무해 ㅠㅠㅠ
9788990982667,8,원자력 발전소 상공에 떠있는 거대한 군용 헬기. 헬기를 원자력 발전소에 추락시키겠다며 정부를 협박하는데...긴박감이 잘 느껴지는 멋진 소설
9788990982667,10,믿고보는 히가시노게이고. 넘나 두껍지만 다 읽어갈때쯤엔 끝나는게 아쉬운 책.쉬지않고 앉은자리에서 끝까지 읽어내려가게 만들어요
9788990982667,8,긴 분량에 녹초가 된 독자를 마지막까지 이끌고 가는 히가시노게이고의 하드캐리 소설.그러나 재미보장
9788990982667,10,"최근 우리가 처한 현실에 의미심장한 메시지를 던지고 있습니다. 한국도 지진 안전지대가 아니라는 사실이 밝혀진 시점에, 원전 안전 신화에 근본적인 의문을 제기하는 히가시노의 문제의식이 새삼 피부에 와 닿네요. 더구나 사드 배치와 관련한 국론분열에도 시사하는 바가 많습니다. 명불허전입니다."
9788990982667,8,"이번엔 원전사고를 다룬 소설이군요. 히가시노의 책을 읽으면 때로는 왠만한 자기계발서나, 경영서, 사회비평서 못지 않은 것 같습니다. 사회문제를 다루는 점도 그렇고, 생각해보지 못한 부분을 소재로 책을 쓰는 점도 그렇습니다. 기대되네요^^"
9788972757849,8,시리즈 첫 권이라 그런지 생각보다 서론이 길다. 그리고 코지 미스터리 답게 수사는 상당히 여유있고 부드럽게 흘러간다. 아직은 주인공이 많이 답답하고 매력이 드러나지 않았지만 차차 괜찮아지겠지.
9788972757849,8,낯선 마을로 모여든 사람들. 곧 일어나는 살인 사건. 알고 보니 저마다 나름의 살인 동기는 있고... 일견 무능력해 보이는 주인공 맥베스 순경. 점점 밝혀지는 비밀 등등 추리 소설의 공식을 충실히 따라간다. 쉽게 범인을 알아차릴 수 있는 싱거운 이야기지만 이 시리즈의 매력은 거기에 있을 듯.
9788972757849,8,소소한 할머니 옛날이야기 듣는 기분
9788972757849,10,"스릴/미스터리 장르 소설을 좋아한다. 우선 1번째 책을 구매해서 읽은 후 , 계속 구매할지 결정해야되겠다."
9788972757849,8,시리즈 다 모을 것 같다
9788972757849,8,추리라고 하기에도 애매한 코지 미스테리지만 이렇게 신랄한 위트로 글 쓰는 사람은 좋다. 한권 더 읽어보고 이 시리즈를 계속 읽을지 말지 결정할 듯.
9788972757849,6,가볍게 읽기 좋다. 다만 트릭이 조악하고 실마리를 풀어가는 과정이 좀 불친절함. 재미는 있다.
9788972757849,6,새로운 형사? 아니 시골 순경의 등장아무것도 하지않지만 무엇이든 하고 있는 것이 해미시 맥베스의 매력이 아닐까?사건보다는 배경이나 등장인물의 묘사가 더 재미있다심심하고 담백하지만 끌리는 맛
9788972757849,8,"여러 사람이 등장하는데, 그냥 주변에서 흔히 볼 수 있는 사람들이라고 여겨진다. 해미시 맥베스 순경 시리즈 첫번째 책으로 이 순경이 아주 코믹한 인물이다. 밀렵에 얻어먹기 좋아하고, 뚱뚱하고 게으르고..그런데도 낚시바늘에 사람이 올라오고 자기 역할을 척척 해낸다. 부담없이 읽을만하다"
9788972757849,8,"내용도 가볍고, 분량도 가볍고, 가격도 가벼운 부담없는 소설이다. 다음권도 읽어보자."
9788972757849,8,책에 가성비를 따지기는 좀 그렇지만 이 책은 정말 가성비가 좋아요~ 내용도 적당히 재밌고 가격도 착하고.. 구매추천.
9788954640909,10,어떤 타 출판사와도 비교되지 않는 표지디자인..ㅠㅠ♡ 의역이 많다고는 하나 그리 깊은 덕후는 아닌 내가 읽기엔 전체적으로 양호한 번역
9788954640909,4,책을 사야만 구매할 수 있는 알라딘 굿즈에 정신이 팔린 나...
9788954640909,10,"삽화는 없지만 디자인, 번역 다 만족함."
9788954640909,8,표지가 상당히 예쁩니다. 굿굿
9788954640909,10,"퀄리티 심플하면서도 이뻐서 정말 좋습니다. 다만, 삽화는 전혀 없으니 구매하시는 분은 그점만 고려하신다면 만족스러운 구매가 되실 수 있을 것 같네요."
9788954640909,6,"소장판으로 깔끔한표지, 괜찮은 번역. 심플한 디자인으로 아주아주 깔끔합니다. 다만 삽화가 단 하나도 없습니다. 그점은 좀 아쉽네요"
9788954640909,10,좀 읽어보니 번역은 확실히 믿을 수 있겠다. 디자인 Good!
9788954640909,2,미리보기 살짝 보니 삽화가 아예 없네요  실망입니다.
9788954641371,8,"홈즈 시리즈중 가장 공포스러운 설정, 네편의 장편중 유일하게 구조적 완전성을 갖춘 작품, 평소와는 다른 왓슨의 대활약 등 독특한 매력이 있는 명작이니 놓치지 말자."
9791158790448,4,아무래도 <흉가>쪽이 더 재미있었다. 예상가능한 반전에 그 임팩트 역시 <흉가>만 못하다. 또한 주인공이 유령을 보는 상황 묘사가 너무 반복적이며 빌드업 과정 역시 지루한 감이 있다. 무엇보다 마을 배치도에 대한 삽화가 있었으면 더 좋았을듯싶다.
9791158790448,8,신조의 작품은소리로 표현되는 오싹함이 있다스르륵 같안 단어가 신조의 작품 안에선 공포로 다가온다
9791158790448,6,복선이 너무 눈에 빤히 보여서 긴장감이 떨어져요 ㅠㅠ 쩝 올만에 산 미쓰다신조작품인데 너무 기대가 컸나봄..
9791158790448,8,"분위기가 으스스함,, 밤에 읽는거 추천^~^!!!!"
9791158790448,10,복선과 떡밥을 완벽하게 회수하는 명품 호러 소설입니다. 미쓰다 신조 작품 중에 가장 완성도 높네요.
9791158790448,8,"좀 질질 끄는 느낌도 있긴 하지만, 그 점이 점점 긴장을 고조 시키는 장점도 있어요 생각치도 못 한 인물이라서 저는 좀 놀랐어요"
9791158790448,6,전개가 좀 늘어진다는 느낌을 받았는데 전반적 분위기는 미쓰다 신조답다.  『흉가』 과 같은 여운을 남긴 것도 그렇고. 현지 출간순을 따르면 집 시리즈 1이라는데 국내출간은 왜 두 번째인지 알 것도 같다. 시리즈 다음 권이 기대된다.
9791158790448,10,기시감과 살인사건을 소재로 한 미쓰다 신조의 <화가> 10년전 일가족 살해사건이 발생한 재앙의 집에서 어떤 끔찍한 일들이 벌어질지 정말 궁금합니다 ^^ 불길한 재앙의 집에서 느껴지는 기시감과 끊임없이 출몰하는 괴이한 현상들의 원인이 무엇일지 <화가>를 읽어보고 궁금증을 해결해보고 싶습니다
9791158790448,10,집 시리즈 두번째 작품.. 전작인 흉가가 괜찮아서 이것도 기대중
9791158790448,10,오.......읽고싶다
9791160070132,4,아니 아무리 논리만을 따진다고해도 동기 또한 추리소설의 중요한 부분인데 최소한의 개연성을 무시하면 그게 소설로 가치가있나? 차라리 논리퍼즐을 풀고말지
9791160070132,8,"언제나 이런 추리물을 볼 때마다 드는 생각인데, 범인을 알기 힘들다. 뭔가 ‘또 당했다!‘ 같은 느낌이 든달까. 그래도 그렇기에 더 재미있었다. 덴마의 본인이 말하지 않는한 속모르겠는 추리극 외에 유노가 덴마에 대해 찾아보는 것도."
9791160070132,2,정말 범인의 동기가 다소 이해가 안가는 설득력이 정말 부족한 거 같음
9791160070132,4,세번째는 완전 애니 주석을 완전 없애버림. 이중구조 아닌 사건하고 전혀 연관성 없는 이중구조 같은건 제발 쓰지 말자. 인물 대사로 범인추리 절대불가 세권의 작품으로 알것같다. 이작가는 아니야.절대 아니야. 주인공 과거 떡밥은 나중에 위키나 블로그러 보고말지
9791160070132,10,범행의 동기에 대해서는 호불호가 갈릴 것 같아요. 서브컬쳐 요소를 조금 줄이고 대중성을 취한 듯 합니다. 그래도 여전히 재미있었어요.
9791160070132,4,"오타구인 고등학생 탐정 시리즈로서 3번째 작품으로서 이전 작품보다 범인의 개연성이 많이 부족해져 보인다. 그리고, 이전 작품과 달리 일반 독자를 위해서인지는 몰라도 망가에 등장하는 대사가 많이 줄어든 것은 가독성에서는 편했으나 오타구 탐정의 독특함은 사라진 것으로 보인다."
9791160070132,10,"수사과정부터 간간히 나오는 주인공 과거이야기, 그리고 맨마지막부분까지... 정말 재밌게읽었습니다~"
9791160070132,10,발랄한 학원 미스터리로 본격물이 거의 그렇듯 범인을 찾기까지의 과정은 흥미롭다. 삼색털 고양이를 키우라는 둥 책 곳곳에 등장하는 다른 책들의  언급이 잔재미를 더했다.
9791160070132,10,범인을 밝혀내는 과정은 일품이었지만 동기면에서는 갸우뚱.. 그래도 가독성 좋고 재밌습니다.
9791187886129,10,큰 반전이 있거나 하지는 않지만 등장 인물들의 생활인으로서의 모습과 평범한 인생이 느껴져서 좋았다. 배경이 그래서인지 모르겠지만 조금 쓸쓸한 분위기도 감돌고. 이 시리즈 계속 읽어야겠다.
9791187886129,10,시리즈의 6번째인가 그렇죠? 차근차근 출간 부탁해요
9791187886129,8,전통의 미스터리 강국 영국에서 온 여형사 베라 스텐호프!!! 한권으론 부족하지.
9791187886129,6,"등장인물이 다 연결된, 작은 커뮤니티를 수사하는 형사들이 주역입니다. 역할을 분담해 정보를 모으고, 사건 배경이 드러나는 과정이 고요하게 그려집니다. 과거의 비밀을 쫓는 과정과 범인의 연결점은 글쎄다 싶은 면이 있습니다. 베라와 부하 형사들의 묘한 어울림과 잔잔함에 끌리는 시리즈입니다."
9791187886129,6,베라가 생각보다 별로 매력적이지가 않아서 실망. 전개는 나쁘지 않았는데 범인의 정체는 그닥 설득력을 느끼지 못했다. 비행기 안에서 읽은 탓도 있을지도.
9791187886129,10,오랜만에 재밌게 읽었다. 요즘은 보기 드물어진 정통추리물?
9791187886129,10,시리즈라니 계속 만나고 싶네요.
9791187886129,10,고전 추리소설과 현대 경찰물의 완벽한 조화. 어서 1편부터 차례로 출간되었으면 좋겠습니다.
9791187886129,10,"어디에서도 찾아볼 수 없었던, 지극히 평범한 여성을 주인공으로 내세운 추리소설. 시리즈가 계속 출간되길 기대해본다."
9791187886129,8,영국에서 드라마로 먼저 접했던 작품. 원작을 만날 수 있다니 반갑다. 새로운 캐릭터를 기대.
9791187886129,8,고전 추리물과 요즘 스타일의 사실적인 경찰 미스터리의 조화
9791187886129,10,"앤 클리브스의 책을 오랜만에 보네요, 아니 볼 수 있을 거란 생각을 못했던. 반갑습니다."
9791187886129,10,"드라마를 보기 시작할때, 책이 나온다는걸 알고 더 열심히 예습했어요. 기대한 책이라 기분이 좋습니다."
9791187886129,10,구픽 최고!!
9791187886129,10,오 드라마 재밌게 봤는데 원작이 나왔네요. 레이븐 블랙 이후에 앤 클리브스 책은 처음 보는 것 같아요. 표지도 맘에 들어요. 기대합니다.
9788956609041,8,특별한 사건 없지만 잔잔하게 재미있는 이야기.
9788956609041,10,｀비블리아 고서당｀ 시리즈 이후로 가장 재미있게 읽었고 좋았으며 후속이 기다려지는...
9788956609041,6,커피 이야기도 같이 나왔으면 더 좋았겠다는 생각이 들더라구요. 커피 보다는 사람들의 소소한 이야기라 진한 감동보다는 약간의 감동을 받으니 너무 기대는 하지 마세요
9788956609041,10,카페에서 자신의 소중한 물건을 통해서 얽힌 사연들을 통해서 전개가 되는 이야기라 더욱 재미있을 것 같아요.
9788956609041,10,독특한 설정과 여러사람의 사연들. 이런 계열의 소설을 좋아하는데 꼭 읽어보고 싶네요.
9788956609041,10,커피와 카페에서의 평범한 공간과 소재에서 방황하는 사람들에 대한 스토리를 상황에 맞게 재미있고 작가의 각 인물들에 대한 표현이 잘 저술되어 있어서 좋은 것 같습니다.
9788956609041,10,제가 좋아하는 서정적인 느낌이 나는 분위기라 기대 됩니다.
9788956609041,10,진한 커피향이 솔솔 날것같은 특별한 분위기도 좋고 저도 진심어린 조언을 받아보고 싶네요
9788956609041,10,잔잔한 감동과 따뜻한 사람들을 만날 수 있을 것 같은 느낌이 드는 책이네요.
9788956609041,10,이름도 독특하고 품고 있는 의미도 뭔가 느낌있는 카페 육분의 이야기 기대됩니다
9788956609041,10,커피향이 나는 책이네요
9788956609041,10,"심야식당처럼 어딘가에 정말 있을 법한 까페육분의.아니 이런까페가 정말 있었으면 좋겠어요위안과 휴식, 정감가는 사람들과의 교류까지 갖춰진 완벽한 까페!!잠시동안이나마 따스함을 느낄수 있어서 좋았어요"
9788956609041,10,별처럼 반짝이는 사람들의 이야기네요. 육뷴의 카페 저도 한번 가보고 싶어요 ^^
9788956609041,8,잠시 멈춰서 커피와 함께 쉬어갈 수 있는 그 자체로 선물인 장소
9788956609041,10,비브리아 고서당도 잘봣는데 이채도 재밌을거같아요
9788956609041,6,평범한 까페가 사람의 만남을 통해 마음의 창을 여는 곳으로 변해가는 과정을 그리고 있습니다. 각박한 경쟁사회에 이런 곳이 생기고 이런 만남을 가질 수 있는 곳이  있었으면 좋겠군요.
9788956609041,10,나라면 카페 육분의에 무엇을 놓아두고 무엇을 가져오게 될지 한 번쯤 가보고 싶군요. 방황하는 사람들에게 따뜻한 위로가 되어줄 이야기인 것 같습니다.
9788956609041,8,시리즈로 계속 출간되면 좋겠습니다.
9788956609041,8,왠지 따뜻한 미스터리를 만나게 된 것 같네요
9788956609041,10,미스터리 너무 좋아하는데 기대되는 책이예요
9788956609041,10,자마가 어떤 진심어리 조언을 제시해줄지 궁금하네요
9788956609041,10,카페 육분의를 배경으로 펼쳐지는 힐링 미스터리물이라니 독특하네요. 손님들의 소중한 물건을 통해 고민을 들어주고 조언을 해준다니 따뜻한 분위기의 책일 것 같아 기대돼요
9788956609041,10,언제든지 찾아가서 고민을 나누고 조언을 들을 수 있는 카페. 거기 가면 커피향이 가득하다. 풍미 좋은 커피 같은 좋은 작품이다.
9788956609041,8,좋은 분위기네요.
9788956609041,10,커피의 향기가 뿜어져나올거 같은 책분위기전환할수 있을듯합니다
9788956609041,10,커피를 좋아하고 카페를 좋아하는 저에게 정말 좋은 책이네요. 이런 카페가 있다면 늘 가보고 싶을 것 같습니다.
9788956609041,10,여름이라 덥고 지루한 요즘 소소한 재미를 느끼게해주는 책인것 같아요
9788956609041,10,책을 읽는 내내 커피 냄새가 날것같아요.
9788956609041,10,일상의 사연들을 담은 이야기
9788956609041,10,"책을 읽고 있으면 카페의 정경이 그려지고 마음이 따뜻해져요. 저런 카페, 어디 없을까요.."
9788956609041,10,손님들의 사연을 읽게 되면서 손님들뿐만아니라 읽고 있는 독자들도 치유받는 책인 것 같아요. 제가 읽은 힐링물 중에서 단연 힐링되는 책입니다!
9788956609041,10,희망을 담은 이야기
9788956609041,10,"｀원한다면 누구든지 진열대의 선물을 가져갈 수 있지만, 꼭 그만큼의 가치를 지닌 선물을 대신 놓아두어야 한다｀는 이카페에 찾아오는 소님들의 사연을 읽다보면 커피보다 사람, 사람과의 관계 가치에 대한 여운을 남기는 책입니다."
9788956609041,10,"진열대에 놓여지 선물이라니, 실존하는 곳이라면 꼭 찾아가보고싶네요 ㅎㅎㅎㅎ"
9788956609041,10,미스터리도 힐링이 될 수 있음을 전면에서 보여주는 책!
9788956609041,10,나카무라 하지메 님!!비블리아 고서당 사건수첩 에 이은 최고의 작품입니다!!
9788956609041,8,다양한 사람들과 사연들 그리고 물건에 얽힌 추억들을 만나는 카페
9788956609041,10,카페를 찾아오는 손님들의 소중한 물건에 대한 사연과 이야기들이 궁금해지네요. 나의 소중한 물건을 들고 카페 육분의를 방문해보고 싶은 마음이 듭니다.
9788956609041,10,일본에서 인기를 끌고 있는 힐링 미스터리 소설이라 재미와 감동을 다 기대할 수 있겠어요.
9788956609041,8,선 구매 후 감상
9788956609034,8,정말 있을것만 같은 카페 육분의에서 일어나는 사람과 사람의 인연 이야기.
9788956609034,10,"화과자점 이야기인 [변두리 화과자점 구리마루당]을 읽다가 커피전문점으로 옮겨, 도쿄 지유가오카의 카페 육분의에 있는 진열대를 직접 가서 확인해보고 싶다~"
9788956609034,10,"따스함, 재미, 감동 그리고 커피. 너무나도 내 취향을 저격하는 소설이었기에 ^^"
9788956609034,4,이게 왜 추리소설로 장르구분되어있는지 모르겠네요. 라노벨에 가까운듯.. 전 별 공감이 안가더이다.
9788956609034,6,처음에는 페이지가 잘 안 나가는데 찬찬히 읽으니 선물에 대한 나름의 사연에 동감이 되더라구요
9788956609034,10,손님들의 소중한 물건에 대한 얽힌 사연과 그 사연에 대한 고민을 해결하고 조언하는 내용이신선하고 잔잔한 감동을 줄 것 같아요
9788956609034,10,카페를 찾아오는 손님들의 소중한 ｀물건｀에 얽힌 사연을 듣고 고민을 해결하고 진심 어린 조언을 전하며 모두에게 행복한 순간을 선사하는 작품이라니 재미있을 것 같습니다.
9788956609034,10,커피향 가득한 카페에서 손님들의 소중한 보물에 얽힌 이야기가 새롭게 다가오네요. 읽어보고 싶습니다.
9788956609034,10,다양한 사람들의 이야기를 들을수 있어서 흥미로운 소설이 될것 같아요.
9788956609034,10,검사버튼 삭제버튼 카페 육분의에서 이야기가 모든 사람들에게 감동과 행복을 주고 있어서 더욱 기대되고 물건에 얽힌 사연들이 궁금해진다. 커피 한 잔과 함께하는 그 시간들이 더욱 기대된다.
9788956609034,10,커피와 카페에서의 평범한 공간과 소재에서 방황하는 사람들에 대한 스토리를 상황에 맞게 재미있고 작가의 각 인물들에 대한 표현이 잘 저술되어 있어서 좋은 것 같습니다.
9788956609034,10,길을 잃은 사람이 자신의 위치를 확인할 수 있는 곳이라는 글이 마음에 와 닿습니다.
9788956609034,10,평범한 공간에서 평범한 일들만 일어날것 같지만 예상과는 다르게 그렇지 않은것같아서 신선합니다.
9788956609034,10,각 인물들에게 얽힌 다양한 이야기들을 들을 수 있을 것 같아 기대됩니다.
9788956609034,8,방향을 잃어버리고 방황중인 내 마음의 답을 카페 육분의에서 찾아주었으면 싶어요
9788956609034,8,컨셉 매우 신선한 미스터리 힐링물~!
9788956609034,10,"흔들리는 마음과 고민들 속에서 진정한 가치를 발견하게 해주는 카페 육분의, 진한 커피향이 솔솔 날것같은 특별한 분위기도 좋고 사연들의 조언들도 치유가 되는 느낌이 들어요"
9788956609034,10,커피 향이 물씬 풍기는 듯한 표지가 마음에 드네요.그곳에 가면 어떤 사람들을 만날 수 있을까 기대 됩니다.
9788956609034,10,"상처입은 사람들을 치유하는 따뜻한 곳, 카페 육분의, 나도 한번 가보고 싶네요."
9788956609034,10,저마다의 고민을 안고 살아가는 현대인들에게 카페 육분의가 선사해주는 기분 좋은 심리 상담
9788956609034,10,"망망대해 바다에서 뱃사람들의 길잡이 역할을 해 온 육분의처럼, 카페 육분의는 저마다의 사연을 안고 방문한 손님들의 좋은 말동무이자 길잡이가 되어 주는데요. 향긋한 커피 냄새가 나는 [코코로 드립] 독자도 기분 좋게 책을 읽고 힐링의 시간을 가진 것 같아서 좋은 것 같아요."
9788956609034,10,보이지 않는 행복을 어루만지고 싶다면...
9788956609034,10,커피 프린스 1호점 느낌도 나고 뭔가 그윽한 이야기를 담고 있을 것 같은 카페 육분의 이야기 기대합니다!
9788956609034,10,"책을 읽으면서, 나에게는 어떠한 소중한 보물이 있는지 떠올려보고 싶습니다."
9788956609034,10,현실에도 이런 카페가 있다면 가보고 싶을것 같네요 잔잔하지만 위안이 되는 내용이라 좋았습니다
9788956609034,8,커피가게에서 손님의 이야기를 들려주는게 재밌네요.
9788956609034,10,커피와 함께 손님들의 소중한 물건에 담긴 사연을 들을수 있어서 기대가 되는 작품입니다.
9788956609034,10,커피 향처럼 그윽한 향과 손님들의 각자 추억이 담긴 물건에 관한 이야기들... 마음이 행복해지는 시간이었습니다.
9788956609034,10,요즘 우리에게 가장 가까운 카페에서 들려주는 이야기라 더 생생한 것 같아요.
9788956609034,8,좋아하는 커피를 소재로 마음을 위로해주는 책인거 같습니다.기대됩니다.
9788956609034,8,따뜻한 커피 한 잔 마시면서 읽기 좋은 책. 미스터리지만 우리에게 위로를 준다.
9788956609034,10,마음을 내린다는 제목처럼 육분의의 이야기들은 따뜻하게 마음에 떨어집니다. 에피소드 하나하나에 자신을 비추어 읽다보면 커피향이 느껴지는 것 같아요^^
9788956609034,10,추천받아 읽어봤는데 장르가 특이하고 힐링까지 얻을수 있어 좋았습니다
9788956609034,10,카페 이름처럼 이 책의 따뜻한 이야기를 읽다보면 내가 어디에 있는지 발견할 수 있는 기분이 들어요. 오전에 커피마시면서 조금씩 읽기에 좋을것 같아요.
9788956609034,10,캐익터가 살아았는 소설일거같아요. 재미있을거같아서 꼭 읽어보고싶네요~
9788956609034,10,힐링이 되는 공간의 잔잔하고도 따뜻한 이야기 좋아하는데 코코로드립도 그렇네요! 일본에서 인기 있다고 들었는데 재미있을 것 같아요~
9788956609034,10,"고요하고 향기로운, 오전의 카페같은 분위기를 주는 책"
