ISBN13,rating,review
9788965708001,10,미아키 스가루의 신작이며 미아키 스가루만의 매력을 여전히 잘 담아낸 작품이라고 볼수가있다 평범한 현실의 약간의 현실과는 거리가있는 판타지의 매력이 가미된 미아키 스가루만의 매력적인 소설이며 이소설은 다 읽은 후에도 여운이 남아있으며 언제라도 다시 읽어도 손색이없는 소장할 책이다.
9788965708001,10,"작가의 독특한 세계관과 개성있는 상상력, 재미있는 스토리, 가독성넘치는 문체, 감동있는 여운까지...적극추천합니다.^^"
9788965708001,10,현실과 허구의 경계를 넘나들며 진정한 사랑에 대해 묻는 소설. 아름다운 추억을 생각하게 한다.
9788965708001,10,"˝본 리뷰는 출판사 경품 이벤트 응모용으로 작성하였습니다.˝응모용이라는 가식 없이 순수한 감상을 표현하고 싶었습니다. '아사 직전의 사람은 이미 소화기능을 상실한 상태이다.'이 책을 덮을 때엔 아사 직전의 사람이 누구인지, 그 사람에게 있어 '음식'은 무엇인지 꼭 깨달았으면 좋겠습니다."
9788965708001,10,가공의 기억을 가진다는게 아직 생소하지만 미래엔 가능할 일일 것이라 생각한다. 소재가 흥미롭다.
9788965708001,10,명불허전...
9788965708001,10,미아키 스가루의 새로운 대표작 탄생! 상실의 미학을 만끽하라!
9788965708001,10,믿고 사는 미아키 스가루^^ 절대 실망시키지않네요˝본 리뷰는 출판사 경품 이벤트 응모용으로 작성하였습니다.˝
9788965708001,10,나도 갖고 싶은 기억
9788965708001,10,"역시 로맨스라 하면 미야키 스가루죠, 3일간의 행복이란 작품이 훌륭해서 항상 비교 대상이 되지만, ˝너의 이야기˝ 같은 경우는 훨씬 더 능가했다고 생각합니다, 작가가 이 책으로 통해 성장을 증명한 셈이죠.˝본 리뷰는 출판사 경품 이벤트 응모용으로 작성하였습니다.˝"
9788965708001,10,이번에도 감동적이네요! 그 감동을 설명하자면 멍하니 책을 펴기 시작해서 끝까지 쉬지 않고 읽게 되는..!
9788965708001,10,미아키 스가루 작가 책중에 잴 재밌었습니다
9788965708001,10,본 리뷰는 출판사 경품 이벤트 응모용으로 작성하였습니다.기억또는 추억에 관한이야기
9788965708001,10,사랑하는 기생충에서 느낀 씁쓸함을 다시 맛보고 싶다
9788965708001,10,기생충 이후로 또 나오네요 굿굿
9788965708001,10,믿고보는 미아키 스가루
9788965708001,10,"이 작가만큼 잿빛을 잘 표현하는 작가를 저는 모르겠습니다.완전히 새까만 것도 아닌 그렇다고 절대 밝은 색은 아닌. 다른 작가들과 다른 느낌을 줘서, 담담하게 표정을 바꾸지 않고 엄청 슬픈이야기를 하는 듯한 느낌을 줘서, 항상 제게 많은 사색을 할 수 있게 유도해주는 작가. 읽어보겠습니다!"
9788965708001,8,이번엔 다른 레이블에서 나오는군요... 개인적으로 작가가 매번 성장하는 모습이 좋습니다. 아쉬운 점이 없는 건 아니지만 필력이나 내용이나 전체적으로 꾸준히 성장하는 모습을 보면서 계속 쫓아가고 싶다고 생각한 작가는 잘 없는데 매번 기대를 지지 않음. 이번 작품도 추천.
9788965708001,10,이렇게 예상도 못한 정발 너무너무너무너무 좋아요
9788965708001,10,내년 노엔에서 정발할줄알았는데 이걸 또
9788965708001,10,2년은걸릴줄알았는데 소리지를뻔
9788965708001,10,띠용 노블엔진에서 정발할줄 알았는데 다른데서 정발했네 현정수 역자도 아니고
9791164036479,2,으...진짜..이게뭐야 전개가 너무 뜬금없다
9791164036479,8,러브코미디 무난하게  재미있다.
9791164036479,10,일부 억지스러운 전개가 좀 있긴 하지만 여주와 남주의 꽁냥거리는 전개가 모든 걸 괜찮게 만들어 버린다.
9791164036479,10,사고 싶은책에 저장
9791164036479,10,재미있있을거 같아요 기대가 무척 큽니다일러스트도 맘에 들어요
9791164036479,10,내용 기대되네요.
9791164036479,10,제목과 일러스트과 같이 어울러지는 조합 같아요!
9791164036479,10,드디어 정발!! 아주 좋소~~
9791164036479,10,카구야 생각나서 구매해봄
9791164036479,10,빨리 보고 싶다
9791164036479,10,정발전부터 기다리던 작품인데 나와서 좋아요
9791164036479,10,내용 기대됩니다
9791164036479,10,카카오센세
9791164036479,4,열 살 마도사는 그럭저럭 봤는데 이건 뒤로 갈수록 영.. 설정을 못 살렸다는 점도 그렇지만 매력적인 서브 히로인을 이야기의 도구로 밖에 사용을 안 해서 메인 히로인을 빼놓고는 뒷권으로 갈수록 찬밥 신세 & 억지 전개라서 뒷권은 괜히 샀다고 생각함. 1권만 본다면 뭐 그럭저럭 나쁘지는 않을듯.
9791164036479,10,"아하, 열 살 최강 마도사 작가분 작품이네요. 신작 구매합니다."
9791134826215,10,언제나왔지?
9791134826215,10,나데코의 성장에 감격했습니다.그리고 작가의 말이 의미심장해서...다음권을 기다리는 매일매일이 즐거울 것 같습니다.
9791134826215,10,너무 재밌었습니다!
9791134826215,10,"괴이하고, 괴이하고도, 괴이한! 이번에도 제목 그대로의 이야기입니다! 또한 이번에도 읽기 쉽고 매력적인 이야기입니다! 그리고 이번에도 푹 빠졌답니다!"
9791134826215,10,구입했습니다. 기대되네요
9791134826215,10,응?나왔네 하고 바로삽니다
9791163894612,10,재밌어요!!
9791163894612,2,흔한 양산형 판타지 소설 그이상 그이하도 아님인간 너무 약한거 아님?
9791163894612,6,다크판타지라고 해서 샀는데..이건 뭐 걍 폭식이라는 거만 빼면 양판소네..
9791163894612,10,으흠? 여러 가지로 부족한 작품인가요? 으흠...
9791163894612,10,기대했던 작품입니다!!
9791163894612,10,키리토와 아스나?!
9791163894612,2,"묘사, 설명 부족. 어이없고 개연성 말아먹는 상황의 연속에 흔한 스토리. 그냥 평범한 길로 가는데 그것조차 못함. 캐릭터가 매력적이면 보는 맛이라도 있을 텐데 그런 것도 없고 기회주의적인 상황 연발. 흔한 스토리도 제대로 못 담아낸 최악의 작품."
9791134822804,10,왠일로 엄청 빨리나왔네요 ㄷㄷ개인적으로 이 장르에서 5권이상 재밌기 힘든데 계속 재밌습니다~~
9788926366479,10,아 제발....외전도 좀ㅜㅠㅠㅠ 채운국비초
9791134814298,2,"궁 안팍에서 사건이 일어나고 해결하는 내용 보다, 인간 관계가 어떻게 굴러 갈지를 즐기게 되는 책으로,이세계니 전생이니에 지친 사람들에게는  좋은 청량제라고 생각함근데 이건 종이책 이야기고....책 볼륨이 큰것도 아닌 주제에 전자책 값이 7000원으로 나오는 건 정신이 나간 것 같다."
9791134814298,10,굿
9791134814298,8,"만화를 통해 처음 접했던 작품입니다.여주인공 물은 책벌레의 하극상 밖에 구입하지 않았는데 지 작품은 정말 오랫만에 구입하는 여주물이네요,워낙에 개성 넘치는 주인공에 나름 흥미진지한 궁중의 음모랄까 .잘짜연진 추림물 소설입니다.최소한 돈은 아깝지 않은 소설이네요..!"
9791134814298,10,정말 너무 재미있습니다! 살지 말지 고민했었던 그 시간이 아깝네요시점이 자주 바뀌고 스토리가 조금 복잡하게 얽혀있어서 이해하는데에 어려움이 있을수있으니까 집중해서 보는걸 추천드립니다! 일단 꼭 봐보세요ㅠㅠ
9791134814298,10,설정9 필력10 총9.5점 드립니다옴니버스식 추리물인데 사이사이 단서들이 모이고 결말에서 중요한 사실이 밝혀집니다보통 이런건 1권 한정이던데 2권까지 폼이 안죽더군요필력도 미려합니다. 사건만이 아닌 문장의 의미도 추리하게 될겁니다다만 복잡한 설정에 비해 삽화나 자료가 부족한건 단점
9791134814298,8,매드 사이언티스트인 주인공이 엄청난 흡인력을 발휘한다!
9791134814298,10,와..와 라노벨 답지않은 느낌이라 재밌게 읽엇습니다 그래서 3권은 언재나옴?
9791134814298,10,재미있습니다
9791134814298,10,구매하면 후회할게 1도 없는 책!!! 엄청나게 추천합니다!!!꼭꼭 구매해보세요!!
9791134814298,10,약사의 혼잣말 1 - 꼭봐라 두번봐라 세번봐라!! 올해 시작한 라이트노벨 중에서 최고의 작품!!!
9791134814298,10,정말 재미있습니다. 코믹스로 먼저 접해서 책까지 읽게 되었는데 어느정도 내용을 알고 있음에도 충분히 즐길 수 있을 정도로 만족스러웠습니다.
9791134814298,10,"라노벨, 로판 이것저것 많이 모았는데 주인공인 여자인 소설 중에서는 본진인 채운국 이야기처럼 마음에 드는 소설은 처음입니다. 재미있어요"
9791134814298,10,책 상태가 굉장히 좋아요 속지도 깔끔하고 속표지 디자인도 깔끔하고 겉표지 종이질도 좋아요 만화로 처음 접한 후 정발소식을 듣고 채운국이야기 이후로 처음 사는 라노벨인데 기대됩니다.
9791134814298,10,드디어 발매됐네요!! 한 번에 2권까지 나와서 행복합니다
9791131989647,10,72회 칸영화제(황금종려상) 기념으로 읽었다. 역시...˝사랑해요! 기생충!˝
9791131989647,8,재미있었습니다
9791131989647,10,이번작도 잘 읽었습니다. 개인적인 평으로는 스미노 요루 상위호환
9791131989647,10,기생충이라는 신선한 소재로 이야기를 애틋하게 풀어냄
9791131989647,10,바로 구매해서 읽었습니다. 뭔가 예상은 하고 있었지만 그대로의 느낌이라 조금 아쉬운 편이긴 한데...그래도 재밌게 읽었습니다. 미아키 스가루 작가 특유의 엔딩느낌은 그대로라 만족!
9791131989647,10,꼭두각시의 사랑이라... 서로 모지라지만 서로 사랑에 빠진다라... 부럽네요...
9791131989647,10,제목부터 대박인 것 같아요. 기대합니다
9791131989647,10,미야키 스가루 작가님의 작품이라 기대를 많이 하거 봤습니다. 읽으면서 역시.. 미야키 스가루님.. 하면서 읽게 되더라구요 일단 분위기도 좋고 책의 내용도 상당히 좋았습니다♡
9791131989647,10,믿고 구매하는 스가루님!
9791131989647,10,계속해서 미아키 스가루님의 작품을 만났으면 좋겠습니다.
9791131989647,10,믿고 읽는 미아키 스가루
9791131989647,10,우와아앙! 기다리고 있었습니다!! 바로 구매!
9791131989647,10,구매합니당~~
9791131989647,10,진짜 얼마나 기다린지 모르겠습니다 군대에서도 매일 확인하고 있었는데 드디어 나오는 군요 너무 기쁩니다 꼭 읽어보고싶습니다 >_<
9791131989647,10,와 작년부터 언제 번역되나 기다리고 있었는데 ~
9791131989647,10,드디어 나왔구나 ㅠㅠ
9791131989647,10,중학교 때 2ch 스레로 읽었던 수명을 팔았다가 책으로 나왔다는걸 듣자마자 바로 서점에 달려가서 책을 사고 전화 시리즈까지 나오는 족족 샀었습니다. 성인이 된 지금도 언제나 소설 추천해달라하면 제일 먼저 추천하는 작가이고 계속 신간을 기다려왔는데 드디어 나와서 굉장히 기쁘네요.기대됩니다.
9791131989647,10,사랑하는데 웬 기생충? 이라는 생각이 들었는데...누구나가 느낄 수 있는 감정이라고 하시니 도대체 이 기생충의 정체가 무엇인지 너무 궁금합니다.
9791131989647,10,3일간의 행복으로 처음 접하게 되었고 그 후로 미아키 스가루 작가님의 모든 작품을 구매해서 읽었거든요...작가님의 작품들 하나하나 감명깊게 읽었었고 마찬가지로 사랑하는 기생충도 좋은 작품일거라고 생각하고 있습니다ㅠㅠ
9791131989647,10,미아키 스가루 작가만의 특유의 스토리 전개방식과 결말을 지어내는 센스가 대단했습니다...평소 일본소설은 오타쿠소설이라는생각을 가지고 거리감을뒀는데 3일간의 행복을 읽고 생각이 달라져 군생활하는동안의 낙이 되었습니다. 한참을 기다려왔지만 주문후 도착까지의 체감시간이 더 길거같습니다.
9791131989647,10,작가님의 다른 소설들이 그렇게 인기가 많다고 알고 있는데정작 다 보지는 못했네요ㅠㅠ 이번 기회로 정말 좋은 작품 접해보고 싶습니다!!
9791131989647,10,이책을 알게된지 얼마되지 않았는데 리뷰를보니까 다들 오래 기다리신것 같네요 전 바로 읽을수 있다는게 참 행복합니다ㅠㅠ
9791131989647,10,"현실에 판타지를 섞어 넣으면서도 현실과의 괴리가 심하지 않아서, 오히려 더욱 얼마 안되는 판타지에 몰입하게 되는 것이 이 작가의 특징이다. 다크 초콜렛같은 씁쓸한 이야기에서 느껴지는 아주 희미한 달콤함이 사람을 빠져들게 만든다. 이번작도 기대가 된다."
9791131989647,8,의도적으로 이루어진 만남에 사랑이라는 감정이 마음에서 시작인가 머리에서 시작인가를 기생충을 통해서 보여주고 있군요. 이 사랑의 행방의 끝에 부디 기생충에게 먹히는 일이 없는 해피엔딩의 이야기였다면 하고 바라며 달콤하면서짜릿할 사랑 이야기 기대 합니다.
9791131989647,6,일본어로 작가 전작 다 봤지만 솔직히 이번 작품은 별로 였습니다.. 뭐 워낙에 작가가 호불호가 갈리는 편이긴 한데.. 이번 작품은 조금 많이 갈립니다. 개인적으로 장르 호불호가 심하지는 않은 편인데.. 이번 작품은 유독 갈릴 것 같다는 인상입니다. 개인적으로는 작가 다음 신작이 더 좋았네요.
9791131989647,10,3일간의 행복을 보고 나서 빠지게 되었습니다!이번 작품도 기대되요!
9791131989647,10,이 작가 작품은 스타팅 오버도 3일간의 행복도 아픈 것아 아픈것아 날아가라도 다 만족스러웠다 이번 작품도 상당히 기대가 된다 빨리 나와라
9791131989647,10,약 2년의 기다림 끝에 드디어 나왔네요ㅠㅠㅠ 바로 구매합니다
9791131989647,10,드디어.. 나오는구나 드디어!!!!!!!! 너의 이야기는 정발되기전에 일본어 배워서 내가읽어야지 진짜 기다리다 지친다  미아키스가루책만 기다리는동안 각각5번이상 다시읽었다ㅠㅠㅠㅜ
9791131989647,10,작가분 특유의 스토리 전통이랄까요?이전작에서 그러하듯. 이번 주인공은 과연 어떤 최선의 실수를 범할지..10개월 희망고문을 드디어.. 어흑
9791127846206,4,발전하는건 시즈의 일러스트 밖에 없었던 작품믿었던 내가 바보지
9791127846206,10,얼마나 기다렸던가.... 기다린 보람이 있어요.
9791127846206,2,하...옛날부터 팬이어서 차곡차곡 전권 구매해왔습니다. 이번 권으로 결말이군요. 내용은...정말 못봐주겠네요. 보다가 덮어버리고 싶을 정도였습니다. 진지해야할 장면에서 진지하지 못하고 등장인물 감정기복을 도저히 따라갈 수가 없어요. 7권부터 망할 징조가 보이긴 했는데...코믹스나 봐야겠어요
9791127846206,2,결말은 원작 음악만도못한 루프형태의 결말 이딴걸보려고 4년넘게 사본 제가 바보같아지는 경험을 했습니다 3집나온다는데 그걸 듣는게 정신건강에 이롭습니다.
9791131986400,10,한정판으로 샀습니다비쥬얼 노벨하고 책까지 읽어야 완전히 스토리가 끝났다고 생각이 되네요그만큼 깔끔한 끝맺음이었습니다
9791188962969,10,드라마도 재미있는데 책도 재미있다!다음 권 언제 정발해주시나요 ㅠ.. 일본에는 많이 나왔던데
9791188962969,10,초반 내용만 보고 벗지 않는 여주인공에다가 흥미로운 소재라서 바로 세트구매했습니다. 하지만 저한테는 좀 지루해서 만화책도 아직 다 못 읽었어요. 너무 잔잔한 사건에 내용이라서.. 세밀하게 심리 묘사나 갈등구
9791188962969,10,기다리고 기다린!!! 정발이라니!! 행복합니다!!!ㅠㅠㅠ
9791188962969,10,기대중!
9791131303917,8,역시나 블랙라군과 우로부치겐의 조합이라 내심 기대를 했는데 이제껏 만화원작으로 외전소설을 낸것중에선 가장 잘쓴 소설.  그리고 근 10년간 읽은 라노벨중 가장 읽을만 했다.
9791131982570,10,언제나 그렇듯 정말 잼있게 봤습니다
9791131982570,2,보던 작품이라 그냥 사봤더니 또 메완이네? 이번엔 샀다지만 다음엔 구매를 좀 많이 고민할듯
9791131982570,6,항상 나올때마다 곧바로 구매하는 작품입니다.코믹한 내용과 괜찮은 필력 그리고 정말 개성있는 등장인물들이 일품인 작품입니다.애니메이션도 정말 재미있었는데 안타깝게도 극장판을 국내 개봉시기에 보지 못한것이 정말 아쉽네요.강추까지는 아니더라도 구매시 돈이 결코 아까운 작품은 아닙니다..!
9791131982570,10,얼마만이냐....근데 또 김완 실화냐ㅋㅋㅋ
9791131982570,10,개인적으로 특별판하고 먼차이있는지
9791131982570,10,하 엄청 기다렸는데 이제야 나오네...
9791131982570,10,잠잠하다싶더니 또 메(갈김)완이라 별점 1점 박고싶지만 작품성을 봐서 참는다.
9791131982570,10,엌ㅋㅋㅋㅋㅋㅋ다들 특별판으로 구매하시나봐욬ㅋ 100자평이 읍네..
9791127845391,10,데어라 팬이라면 사셔도 후회없습니다
9791127845391,10,"정말 한국분들은 보기 힘든 일러스트인 아루스 인스톨, 게이머즈 등등 특전 일러스트들이 잔뜩..! 최고입니다!"
9791127845391,10,이 화집이 제 처음 화집이 되었는데 너무 마음에 들어요.데이트 어 라이브 등장인물들의 일러스트를 감상하는 부분도 좋고요.만족합니다.
9791127845391,10,일단 본작 일러들을 모두 큰 사이즈에 모아놓은 화집인거에 만족합니다. 거기다 츠나코씨 인터뷰랑 각종 일러 소감이 되게 인상적이네요. 빛에 꽤나 신경을 쓰시던데 되게 감명깊었습니다. 이제부터 빛나코입니다.
9791127845391,10,화집은 역시 소장용이지요! 그리고 마지막에 외전 비슷하게 짧은 이야기까지 구성도 좋아요!
9791127845391,10,만세 정발이다~
9791127845391,10,다들 일판이 있으신가봐요 ㅋㅋㅋㅋㅋㅋ저도 있는데 또 사야겠네요ㅋ
9791127845391,10,일판도있는데 또 사야겠네
9791127845391,10,일판 있는데 고민되네요 으아아아
9791127845391,10,일판도 있지만 사야죠..  돈이...
9791127845391,10,일판으로 샀는데 이번판도 사게생김...
9791127845391,10,토카♥♥
9791189126735,10,ㅗㅜㅑ 감사합니다
9791189126735,8,한국에 정발 안될줄 알았는데. 나왔다는게 신기하네요. 19세가 아닌건 좀... 의문스럽지만 그래도 나름 만족스럽게 봤습니다. 마지막에 나온애는.. 주인공에 능력에 맞춰 억지로 끼어넣은 느낌은 들지만 그 점만 빼면 잔인하고 좀 야하게 잘한거 같습니다.
9791189126735,10,원서도 가지고 있어서 비교해보니 그런(?) 장면들은 클로즈업으로 잘라냈네요... 결론은 원서최고
9791189126735,10,이걸 정발했네ㄷㄷ 근대 왜 19세 아니지
9791189126735,10,이거 ㅇㅑㅅㅓㄹ인가ㅋㅋㅋ?
9791189126735,10,일러 수정이라니...목욕탕 증기같은 걸 끼얹은 건가...ㅂㄷㅂㄷ 19금판을 다오...
9791189126735,10,여만돼 처럼 짜르지 않고 수정만 되있다하니 좋습니다..!!
9791189126735,10,짜릿한 복수극 기대작품!
9791189126735,10,이게 나온다고?
9791189126735,10,일러만 믿음
9791189126735,10,이게?  정발될 내용이아닐진데?
9791127844547,10,개꿀잼
9791127844547,10,설마 역자가 아라포의 뜻을 몰랐을리는 없을테고...저걸 그냥 제목에 쓴 그 깊은 뜻이 궁금하다. ㅋ 개인적으로 좋아하는 중년 치트물인데 웹연재 속도가 느린게 단점
9791127844547,10,제목을 아라포라고 그냥 써버렸네;;
9791127844547,10,웹연재는 재밌었으니 사봅니다
9791127844547,10,이거 웹에서 재밌게 봤었는데 웹연재 속도가...
9791127844547,10,"이세계물이니 일단 1권은 구매해봅니다. 그래도 중, 고등학생이 아닌게 좀 낫군요."
9791127844547,10,신작이네요~? 구매합니다.
9791127844547,6,다른 먼치킨 하렘 이고깽같은 이세계물보다는 그래도 이런쪽 이세계물은 그나마 읽을만하다 ;;근데 역시 또세계물 제발 그만ㅠㅠ
9791161904238,10,드뎌 나왔네 나오는거 계속 기다림 ㅋㅋㅋ
9791161904238,10,기다렸습니다 독고다이 먼치킨 주인공...ㅋㅋㅋ
9791161904238,10,굽굽! 기다렸습니다~
9791161904238,10,드디어!드디어 번역되었구나!!!
9791161904238,6,이거 후반갈수록 조금..전형적인 먼치킨 하렘인데 이제 이런것도 지겹다고할까.....
9791161904238,10,정말 재밌는 책임 일본서적으로 읽었는디 꿀잼 근데 초반이랑 후반의 약간의 ntr전개 있음 그래도 서적판이라 나름 없애려고 노력음 해서 별로 크게 있지는 안아요
9791161904238,10,ntr? 정말 싫은데... 으흠~ 그래도 신작이니 일단 구매해봅니다.
9791161904238,10,웹판은 ntr이라 끝까지 봤어도 되게 찝찝했는데 서적판은 어떠려나...
9791161904238,10,미출간이나 빨리 풀어주시오 예약주문하게....
9791127842741,10,첨엔 좀 루즈한데 후반부 부터 매우 재미짐
9791127842741,8,쿠루미의 외전. 볼만합니다!
9791127842741,6,"본편과 다른 문체, 완전 동떨어진 배경으로 손에 안잡히긴 했으나 스토리랑 반전이 우수해서 굉장히 몰입도 높게 보게 됬네요. 보아하니 최소 10권은 나올듯한데 후속작이 꽤나 기대됩니다."
9791127842741,10,한정판 세트는 비싸서 이쪽으로 사야할것 같네요
9791127842741,10,광삼이는 닥구
9791131955918,6,"이전에 합본으로 나온 녀석과 완-전히 동일합니다. 신간으로 나왔길래 제로피다아 하나 더나왔나 하고, 아무생각없이 확인도않고 주문했더니 있던거랑 동일.......나란히 두권 꽂아두니 뭔가 있어보이는 착각이 들어, 걍 내비두고있습니다....주의하세요.....(이게 포교용인가 뭔가하는 그거 구마잉-)"
9791131955918,10,합본에 있는거랑 같은 것???
9791131955918,10,뭐지? 무엇을 의미하는 것이지? 합본을 다 팔고 몇달이 지나 단권을 찍는 것이지??
9791127842000,10,제목길면 거르자......는 말은 하면 안됨. 전슬건이 불쌍하잖아
9791127842000,10,재밌습니다 . 사쿠라장 때부터 느꼈지만 각 인물들 캐릭터를 너무 잘 잡았고소제도 굉장히 참신합니다 진짜 강추 작품입니다 .
9791127842000,10,253p 13~14 번째 줄에 인쇄된 ‘어머니‘ 말인데요. 문맥상 ‘아버지‘ 아닐까요?
9791127842000,6,"1부의 끝인 에피소드, 적절한 결말이라고 생각하지만 사람에 따라선 너무 무난하지 않나 싶을 수도 있음"
9791127842000,10,"요새 문학이든 라노벨이든 딱히 읽을 만한게 없다. 그냥 이거 읽어라. 진짜 초강추 작품, 인생 소설. 안 읽으면 인생의 절반 손해다."
9791127842000,10,믿고 사는 카모시다 하지메 작품...
9791127842000,10,청춘돼지는 제 인생작품 입니다..
9791127842000,10,살지 말지 망설여진다하시면 일단 삽시다
9791127842000,8,1부의 마지막권이네요.요 근래에 라노벨 중에서는 정말 짜임새있고 멋진 작품인것 같습니다.1에서 7권까지 어느권하나 버릴권이 없는 작품입니다.개인적인 의견이지만구매에 후회없는 초강추 작품입니다...
9791127842000,10,빨리 읽고 싶어요
9791127842000,10,구매합니다
9791127842000,10,스포츠타올 있는 다른책사보니 그냉구석이 넣어두기만해서 일반으로삽니다
9791157108718,10,책을 사놓고 애니메이션으로 보는 배드엔딩 보소? 이놈 이거 눈물도 안흘렸다고 ! 크흡 ... !
9791157108718,10,"마지막 부분이 아쉽긴 했지만 감동 그 자체였습니다, 이 책만큼 감동받은 소설책이 없네요."
9791157108718,10,추천합니다
9791157108718,8,많이 사랑받은 작품인만큼 내용흐름은 무난하게 잘 흘러가 금방 읽었습니다.취향이냐를 따지자면 그정도는 아니지만 장면마다 단어 선택이나 화법이 독특한 분위기는 있었습니다.상업화해서 영화화하기도 좋은 스토리에 감성을 울릴 요소는 분명 있는 작품이었습니다.
9791157108718,6,신선한 줄 알았지만 가벼웠던 일본 감성의 짧은 소설
9791157108718,10,이책은 저에게는 명작입니다. 한번 읽어보시는걸 추천합니다.
9791157108718,10,달달하다. 서로에게 필요로 되어지는 과정. 상황과 대사의 묘사가 비교적 잘됨.
9791157108718,10,너무 슬프고 반전있는 이야기ㅜㅜ 오늘 애니메이션으로도 보고 왔습니다.
