ISBN13,rating,review
9788901140605,10,고통의 양면을 인식하고 인정하고 앞으로 나아가기를 바라는 이야기. 깊은 울림을 준다.
9788901140605,8,아주 소중할 것과 혜어저 본적이 없기에 공감은 제로...  몬스터는 주인공(코너)의 자기자신의 내면이 아닐었을까...
9788901140605,8,아름답고 기묘한 몬스터
9788901140605,8,매력적인 그림과 감동적인 이야기.가슴 속 응어리를 풀어내기위해서는 진실을 인정해야한다.
9788901140605,10,"짧게 나뉜 장의 구성, 매 시간 찾아오는 괴물이란 존재가 작품의 흥미를 돋우고 주제와 구성도 인상적. 종막으로 치닫으면서 진실이 밝혀졌을 때는, 마치 끝없는 바다 밑바닥으로 빠지는데 전혀 고통스럽지 않고 오히려 평온해지는 듯한 기분. 내게는 그런 식으로 깊게 울렸다."
9788901140605,10,"최악의 상황을 마주쳤을때

스스로 극복하기란 얼마나 어려운 것인가.

결국 해답은 내안에 있지만 누군가 손을 내밀어준다면...

내용, 삽화, 북디자인 모두 100점."
9788901140605,10,누구나 감춘둔 비밀 가장 감추고 싶은 비밀에 대해
9788901140605,10,오랜 만에 마지막 장면에서 뜨겁게 온도가 올라간 눈물이 쭈르륵 흘렀습니다. 예전에 가르쳤던 학생 중 아버지가 오랜 시간 암투병을 하다 돌아가신 학생이 있었습니다. 떠올랐습니다.
9788901140605,10,"누구나 살면서 한번쯤 마음속에 가질법한 비밀에 대한 이야기네요. 누구에게도 말할 수 없는 그런 생각들, 소년에게 몬스터는 정말 최고의 상담 선생님입니다. 소름끼치는 카타르시스를 경험하게 됩니다."
9788957983041,10,잔잔하게 읽히는데... 책장을 덮을땐 역시 ｀이금이｀ 라는 생각을 하게 만드네요.
9788957983041,10,한번쯤 읽어보고 싶은 책!!
9788957983041,10,"이 책은 아이들이 읽을때, 개와의 만남과 이별이 부각적으로 나타나 있어서 좋아합니다."
9788957983041,10,"아이를 위해 산 책인데,나 역시 흥미롭게 읽었습니다. 전에 읽었던 이금이 작가의 `첫사랑`에 대한 기억을 되살리며....."
9788957983041,10,가슴이 뜨끈해지는 과하지 않은 감동이 있는 다섯 편의 이야기는 우리 주변 혹은 일상에서 마주할 수 있는 모습에 더욱 가깝게 다가온다.
9788954617208,8,독특하고 재미있다. 작가의 다음 작품이 기대된다.
9788954617208,10,"대박이다, 이 소설."
9788954617208,10,재미있다. 읽어보길 강추한다. 뭐라고 해야하지.... 그냥 읽어봐야할거 같다. 재미있다.
9788954617208,10,재밌네요. 평소에 문학동네청소년문학 즐겨 읽는데 대상 작품이라 그런지 더더욱 신뢰가 갑니다.
9788954617208,8,"어, 이 책.. 읽힌다."
9788958285861,2,그림이 호러 입니다... 저는 되팔았습니다.
9788958285861,8,왠만한 철학 입문서보다 낫네요... 강추!
9788958285861,8,"그의 이야기 또한 현실이라, 더 많은 사람들의 더 아픈 사람들의 현실이라"
9788958285861,10,지금..이 시점에..가장 읽어야하는 책.몰입도 최강!분하고 슬프고 눈물나지만 읽어야 하는 책지금은 없는 이야기지만...아직도 있는 이야기들....ㅠ
9788958285861,10,"교훈을 주는 우화와는 다르다. ‘이 동물, 마을 사람들이 하는 어처구니없고 잔인한 짓거리가 지금 너 사는 세상에서 벌어지고 있단다‘라고 확인시켜주는, 해피엔딩은 꿈도 꿀 수도 없는 우화. 잔혹함을 순수한 시선으로 보면 더욱 무섭게 다가오듯, 냉혹한 사회를 우화로 표현하니 더욱 처량하다..."
9788958285861,10,"""가위바위보""를 읽을 땐 가슴이 먹먹해졌다.  법을 바꾸려면 먼저 이겨야 하는 데, 시작부터 이길 수 없는 게임이었다. ""지금은 없는 이야기""라는 제목은 바램일 뿐이라 읽는 내내 불편하다 (지금은 없어졌으면 하는 이야기)  작가의 작품을 더 찾아서 읽게 만든다. 제발 좀 바뀌자,,,,"
9788958285861,10,긴 여운을 남기는 책
9788958285861,8,송곳 작가 최규석의 삐딱한 우화. 그의 삐딱한 시각에 공감이 가는건 비단 나만은 아니겠지?! 대안에 대해 생각해보지 않을 수 없다. 현실 직시는 쓰디쓴 에스프레소 보다 더 쓰다. 몸이 아파 더 그런지도 모르겠다.
9788958285861,8,도서관에서 보고 맘에 좋아서 구매합니다
9788958285861,6,이건 우화가 아니라 호러다. 현실의 악몽을 우화로 표현하니 더 공포스럽다.
9788958285861,10,우리에게도 우화가 있다. 그리고 최규석이다.
9788958285861,10,아직 어린 저라 이해하기 힘든 내용도있었지만.. 모든내용이 가슴속에 박혀있습니다.많은생각을 하게 되는 만화인 것 같습니다. 고민 중이라면 꼭 읽으세요.
9788958285861,10,많은 이야기중 <불행한 소년> 편이 가장 마음에 남는다.죽을때 까지 달콤한 거짓 위로속에서 살고 있는 나와 당신.
9788958285861,10,짧지만 긴 여운......작가의 삐딱한 시선.....생각해 볼거리 많은 문제적 우화!
9788958285861,10,"절이 싫으면 중이 떠나야 할 때도 있지만 중이 절을 고쳐야 할 때도 있는 게 세상... 세상과 타인은 죄가 없고, 일이 잘 안풀리는 것은 내 긍정의 힘이 부족해서라는, 모든 것은 내 탓이라는 인식에 ｀정말 그런거야?｀ 라고 물음표를 찍게 만든다."
9788958285861,10,최규석이기에
9788958285861,10,초중고 교과서에 이 이야기들이 실리면 좋을 텐데요... 우리 사회에 이런 작가가 있다는 건 행운입니다. 우리 시대 최고의 동화~!
9788958285861,10,최규석 작가도 점점 장인이 되어가네요. 현실인식이 날카로운 작가 중 한명!!
9788958285861,8,"초반 몇 편의 만화들은 역시나, 작가 특유의 진하고 깊은 풍자를 담고 있어 시원~하게 잘 읽었다. 하지만 책의 나머지 3분의 2쯤은 글이 중심인 우화집처럼 되어 있어 좀 아쉬웠다. 뛰어난 그의 만화들을 좀더 챙겨보고 싶었으니까."
9788958285861,8,우화를 통해 세상을 다시 보게합니다
9788958285861,8,"우화 속에 숨겨진 기득권의 이데올로기에 고발하고, 그에 반하는, 우리에게 진정 필요한 이데올로기의 단초를 제공합니다."
9788958285861,10,"진짜 괜찮은 책이네요. 작가님이 만화가시지만 문장력도 있으신지 술술 잘 읽히구요, 저는 특히 거인 이야기랑 개와 돼지 이야기가 마음에 절실히 와닿네요.. 애들보다는 사회인들에게 강력추천합니다"
9788958285861,8,최규석작가의 책은 이책이 세번째 구매네요..만화책이지만 결코 빨리책장을 넘길수없는..생각하게만드는 그 무언가가있습니다.
9788958285861,8,생각하게 만들지만 조금은 허무한책?
9788958285861,10,"1위라 기대했으나, 조금 허무하다. 그래서 아쉽다."
9788958285861,8,몇몇 에피소드는 분명히 빛난다. 더구나 깊다. 그는 진정 이 시대의 가난을 아는 이야기꾼 중 하나이다.
9788958285861,10,책장을 닫으면서 느끼는 이 불편함은 무엇일까. 나는 최화백이 조금 나쁜 사람이었으면 좋겠다.
9788958285861,8,"이 책의 한 이야기를 어린이잡지에서 보고 아이들잡지에 실리기엔 적당하지 않다고 생각했다. 하지만 단행본으로  읽으니, 어른들을 위한 우화로...맞다는 생각. 지금은 없는 이야기,앞으로 없어으면 하는 이야기."
9788958285861,8,"예전에 어디선가, '불행한 소년'을 보고 적잖은 충격을 받았던 기억이 났다. 인간의 이기심과, 그로 파생된 모든 악의에 대해 말하고 있다. 가슴이 찌릿해지고, 움찔해지는 메시지들에 내 자신도 돌아보게 된다."
9788958285861,8,"여타의 그림책들과 달라요, 반전, 어른들의 위한 동화!"
9788958285861,4,만화 아닙니다. 그림책입니다. 작가는 이런저런 이야기 주절주절 서문에 걸어뒀는데 그냥 돈때문에 책 한 권 냈다고 터놓고 말하는 게 나을뻔했습니다. 최규석의 전작을 기대하시면 실망합니다.
9788958285861,10,오르지 못할 나무를 찍는 열 번의 도끼질 같은 이야기.
9788958285861,10,책장은 술술 넘어가지만 읽고나면 마음은 몇배나 무거워지는...세상의 부조리함과 나의 힘 없음에 울분이 느껴집니다.
9788958285861,8,젊은 작가의 놀라운 패기
9788958285861,10,특별히 어려울 것 없으면서도 촌철살인의 우화
9788958285861,8,증정받은 북마크를 볼펜 심이 나올때까지 엄마가 뜯어 버렸다 ˝이거 뭐니?˝ 하면서...열받은 나는 소리를 고래고래 질렀고 엄마는 그깟게  뭔데 나한테 그러냐고 울어버렸다. 그러게... 이제는 없어져야 할 이야기
9788958285861,8,"그림과 글, 이야기 모두 그의 것이다. 그는 '만화가'라는 틀을 넘어서고 있다. 지금도 있는 이야기."
9788958285861,10,그림도 이야기도 모두 훌륭한. 최규석 님의 만화는 읽을 때마다 느낌이 새롭다.
9788958285861,10,최규석만화는 거부할 수 없는... 다양한 그림과 담고 있는 이야기를 보면 그가 어떤 사람인지 가늠이 된다.
9788958285861,10,재미 있게 읽을수 있다. 아니 현실을 돌아 보며 읽을수 있다.
9788958285861,10,우리나라에서 시사성과 재미를 겸비한 몇 안되는 작가중 한 사람. '공룡 둘리에 대한 슬픈 오마주'를 시작으로 나날이 발전하는 모습을 보여준다. 게다가 잘 생기기까지...
9788958285861,8,닥치고 지지함!
9788958285861,10,"그는 자신이 가장 잘 싸울 수 있는 무기를 가지고 싸운다. 그의 무기가 부럽고, 그의 투쟁이 고맙다."
9788958285861,10,최규석..?? 이건 당장 사야됏!!
9788958285861,8,"아니, 이것은 지금도 여전히 존재하는 이야기, 결코 끝이 날 수 없는 우리의 이야기."
9788958285861,10,볼게 어디있고 잴게 어디있겠습니까! 1318 시리즈 두번째 많이 기다렸어요!! 무조건 구매입니다. 이것이야말로 닥구!!!! 최규석님 100도씨를 다시 보니.. 참... 많은 것이 생각나는 어제였는데..
9788958285861,10,"최규석 매니아를 위한 희소식, 새책이 나왔다! 핸드백에 들어갈만한 아담한 사이즈에 담긴 내용은 결코 아담하지 않다. 우화의 주인공을 그린 사인본을 받으려면 빨리 주문해야할 듯...^^"
9788958285861,10,최규석님 작품은 일단 구매...
9788958285861,10,표지&제목을 보자마자 꽃힌 책
9788958285861,10,최규석님 만화가 나왔다~!! 그것도 '저자 친필 사인본'까지 알라딘US 가격이 $19.26... 가격을 3% 올렸다고 한다. 그것도 적게 올린 거라고 하는데.. 참.. 비싸도 소장가치가 충분히 있는 최규석님 만화~ 예약주문~!
9788958285861,10,둘리의 오마주 재미있게 봤는데 이번 작품도 헤헤~
9788939206649,10,"어른, 아이들 모두가 읽으면 좋은 책이다.진실한 꿈에 대해, 직업적 소명에 대해, 인간애에 대해 되돌아 보게 한다."
9788939206649,10,2013년 1월 14일은 이태석 신부님 3주기였다. 쫄리 신부님과 소년병사 마뉴의 이야기를 다시 읽으며 그분을 추억한다.
9788939206649,10,"사랑의 사제 이태석 신부님과 수단 어린이 마뉴와의 아름다운 우정이야기, 감동입니다."
9788939206649,10,"진짜 이 책 강추!, 책을 통해 느끼는 이태석 신부님 이야기!"
9788939206649,10,가슴이 뜨거워 지는 책이네요. 나는 어떻게 살아야 할 것인가에 대한 고민을 해봅니다
9788939206649,10,이태석신부님 당신이 있어 축복입니다
9788996549253,10,외국 사는 중1 아이를 위해 주문한 책. 중1 수준의 소설 단편이 작가별로 골고루 수록되어 있다. 소설 뒤 생각할 거리도 적절. 딱딱한 교과서보다는 부드럽고 천편일률적 국어 문제집보다는 훨씬 낫다. 강추.
9788996549253,10,중학생 되기 전에 읽어 보고 싶어서!
9788973433421,10,수능대비를 위해 구입해 읽은 책....
9788961770415,10,"이책은 일제감정기때의 다룬 작품으로, 그 시대적 상황과 많이 닮아있는게 이책이 특징이다...."
9788961770415,10,"몇 년전에 순교자를 읽고 큰 충격을 받았었다. 김은국님의 ｀잃어버린 이름｀ 은 얼마 전에 읽은 ｀내 이름이 교코였을 때｀ 와 비슷한 시대인 일본제국 강점기때 이야기이다. 아직 읽고 있지만,"
9788957982570,10,개인적으로 마지막에 너무 설레고 좋은 것 같아요ㅠㅠ 진짜 너무 재밌습니다ㅠㅠ 영화로 나온다면 좋을 것 같고 꼭 볼 것 같네요...♡
9788957982570,4,난 진짜 청소년 문학 이딴식으로 짓는게 너무너무 싫다
9788957982570,10,소희의 마음이 잘 느껴집니다. 외로운 사람들에게 위로나 여러 가지 느낌을 주는 책인 것 같습니다. 실제로도 이런 일이 있을 수도 있다.... 라고 생각하게 만들어 주는 책인 것 같습니다. 이금이 작가님답게 청소년의 갈등을 잘 표현한 글입니다.
9788957982570,10,너도 하늘말나리야를 정말 재미있게 보았던 터라 후속작이라길래 정말 기대를 하면서 봤는데 역시 이금이 선생님이란 말이 나올 정도로 재밌게 보았다.
9788957982570,10,감사합니다 작가님. 마지막 페이지 잊지않겟습니다
9788957982570,10,역시 이금이 선생님!
9788957982570,8,할머니와 둘이 살던 소희가 할머니의 죽음으로 친엄마의 집을 찾아 엄마와의 갈등을 풀어가며 성장하는 이야기
9788957982570,10,"이금이 작가의 책!!
청소년이 무한 공감합니다."
9788957982570,10,소희의 슬픔이 와 닿는 책
9788957982570,10,｀너도 하늘말나리야｀를 읽은 사람이라면 추천 안 할 수가 없음!
9788957982570,10,말이 필요없는 이금이 작가의 책.
9788957982570,10,사촌동생이 너무 좋아하는 이금이 작가님^^
9788957982570,10,이금이 작가의 작품들은 한번도 접해 보지 못했는데 이 책은 많이 땡긴다... 잊지 말고 나중에 꼭 찾아서 봐야겠다
9788957982570,10,"9월에 있는 학교 독서퀴즈대회 지정도서인데, 도서관에서 빌려보려니..아무래도..."
9788957982570,10,너무너무 잘 읽었어요^^ 저절로 몰입하게 되네요.
9788957982570,10,이금이 작가님의 팬이 된 책입니다.
9788957982570,10,"아들과 함께 너무 재미있게 본 책이네요
아들이 이금이 작가의 팬이 되었네요"
9788957982570,10,이금이 작가님이 역시 실망시키지 않네요. 소희의 마음으로 울고 웃었네요!!
9788957982570,10,처음엔 은희경의 새의 선물이란 소설과 오버랩되었으나 더 진취적인 주인공 소희
9788957982570,10,이금이 작가님의 책이라 얼른 읽었어요. 역시 재미와 감동 두 마리 토끼를 다 잡네요.
9788957982570,10,세희네방~
9788957982570,10,바우와  미르를 더나 성큼 성장한 소희
9788957982570,10,"하늘말나리 소희를 아끼는 작가의 마음에 고스란히 감정이입, 모녀의 삶에 연민하다!"
9788958285007,8,"웃지않고는 볼수없는 소설이다.특히 시원시원한 문체가 너무 마음에 들었다. 읽다보면 소설속 장면이 머릿속에 그려지는데, 이런 소설은 오랜만이여서 좋았다."
9788958285007,4,재밌게 빨리 읽히긴 한데...조금 뻔한 결론이었다고 해야하나요? 수상작이라고 하긴 좀 아쉬웠구요. 구입하시기전에 생각해보셔야 할듯~
9788958285007,10,나름 재밋습니다.
9788958285007,10,학교추천도서입니다. 빨리 읽어보고 싶네요^^
9788958285007,8,"난장이가 키도 마음도 쑥쑥 자라는 내용,수련의 중요성을 알아요"
9788958285007,8,20대의 감성으로 쓴 이야기가 궁금했다. 내공 있어 보인다. 그치만 여운이 없네..
9788958285007,10,키작은 체가 체게바라와 이름이 같다고 영웅과 동일화하는 부분이 재미나고 찡해요!
9788958285007,10,재밌게 잘 읽었습니다 ^^
9788936456269,8,학생 필독이어서 읽었는데 재미있네요
9788936456269,10,중학교때 비슷한  일본소설을 읽고 성과 임신에 대해 기본개념을 가졌던 기억이 난다.
9788996252290,10,"가족의 죽음을 받아들이는 과정, 남은 가족을이 살아가는 과정......."
9788949120881,10,코너가 누명을 쓴 브란웰을 위해 끝까지 진실을 찾아내려고 애쓰는 모습! 인상적이다.
9788949120881,10,좋아하는 작가라서 기대됩니다
9788990220783,8,배경은 중국이지만 어째 남의 나라 이야기 같지 않아 더 정감이 가고 흥미롭게 읽었던...
9788990220783,10,루빙화라고도 하는 로빙화는 루피누스 속 식물인 Lupine를 말한다. 푸른 차밭 사이에 피어난 로빙화~ 가난한 천재 소년 화가 고아명의 이야기이다.
9788990220783,10,중국소설은 한 번도 못 읽어 본 것 같다... 이 책 은근히 기대가 되는 책~
9788971847640,10,재밌었어요! 믿고 보는 너새니얼 호손의 작품! ^~^
9788971847640,10,주홍글씨 A는 간통이냐 능력이냐
9788957981115,8,청소년은 물론이요 부모들 그리고 특히나 교육자들에게 꼭 읽히고 싶은...
9788957981115,10,어둡고 안타까운 내용이지만 청소년뿐만 아니라 어른들도 읽어봐야 할 책
9788957981115,10,"주홍이, 엄마, 담임쌤이 각자의 입장을 풀어내는 구성방식이 맘에 든다. 청소년, 학부모, 교사 모두가 함께 봐야 할 책이다."
9788957981115,10,우리 아들을 잘 키우기 위해 (?) 우리들의 아이들을 잘 키우기 위해.....
9788957981115,10,마지막의선택에 너무 슬펐어요너무안타까운이야기...
9788957981115,10,청소년 미혼모 문제는 풀지 못할 숙제인가? 가슴 아픈 우리 현실을 짚어보는 책!
9788957981115,10,사회문제에 대한 아이의 새로운 인식을...
9788957981115,10,고1 학생이 임신을 했다. 청소년의 임신과 낙태에 대해 심각하게 생각하게된 계기이
9788957981115,10,간결한 문체와 다양한 시선을 보여줌으로 문제를 인식시키고 생각하게 해준 책
9788957981115,8,슬프지만 외면하기에 너무 현실적인 이야기
9788957981115,8,"뱃속에, 냉장고에, 사물함에 쥐가 살고 있다.꼭 죽이지 말자.살려서 함께하자"
9788957981115,10,모녀의 인생유전이 너무나 가슴 아프다. 영화 '썸머타임'이 생각난다.
9788957981115,8,마지막부분엔 눈물을 글썽이게만든책.. 보는내내 두근두근
9788957981115,8,여성이라면 누구나가 겪을 수 있지만 아무도 함부로 얘기할 수 없는 상처를 들추다
9788957981115,8,너무나 안타깝고. 주위의 사람들이 꼭 읽어봤으면 하는 책.
9788937842887,10,눈길 읽는데 하.. 진짜 폭풍눈물.
9788937842993,8,자전거 도둑외에 여러편이 함께 읽을수 있게 되어 있어서 더 좋은듯 해요
9788937842993,10,'자전거 도둑'은 정말 못 읽어봤다. 이 책도 읽어보고싶다
9788937842993,10,빠른배송감사드리고책잘읽어서도전골든벨꼭울리도록노력할께요
9788937842993,10,"강추입니다,,,꼭 보세요!!!"
9788971844656,6,오페라의 유령을 수준에 맞게 읽을 수 있어서 좋아요.
9788971844281,8,"단편, 우화들. 읽기 버겁지 않다. 중1 추천."
9788957071038,10,잘 받았습니다.
9791187616955,10,술술 읽히네요.. 재밌어요. 여자아이들에게 선물하기 좋을 것 같아요
9791187616955,10,권투를 통해 자신감을 찾아가는 소녀의 모습을 정말 재미있게 그렸네요. 시간가는 줄 모르고 읽었습니다. 주변 엄마들에게 권하고 싶은책!
9791190275354,10,"글로벌 펜데믹을 유발하는 환경문제, 아이들의 몸과 영혼을 좀먹는 학교교육, 한부모가정에 대한 차별과 왕따까지 우리가 느끼는 사회문제들에 대한 통렬한 문제의식이 소설에 깔려있지만 작가의 시선은 따뜻하고 문체는 발랄하다. 쌈룡학원에서 새로이 성장하는 독고아미와 친구들의 미래가 궁금하다."
9791190581196,10,이 책을 읽고 감명받은 저는 부모님과 진지한 대화를 했고 저의 진로와 목표를 확실히 할 수 있었습니다. 지금 저같은 진로가 고민되는 중학생이나 고등학생분들은 이 책을 꼭 부모님과 함께 읽으셨으면 좋겠습니다. 절대 후회 하지 않으실겁니다.
9791190581196,10,학교 생활 중에 겪을 수 있는 다양한 심리 상황에 대해 심층적으로 이해하고 문제를 해결하는 길잡이가 될 수 있는 책입니다.중고등학생들 뿐만 아니라 성장기의 자녀를 둔 부모님들에게도 추천하고 싶습니다.
9791190581196,10,"증고등학생이 읽어보면 학교생활에 많은 힘이 될듯한데  특히 고등학생이 읽어보면 부모님이나,  선생님들의 마음을 이해하고 공부를 하는데 좀 더 힘을 낼수 있지 않을까하여 추천합니다."
9791190581196,10,아이들이 읽었으면 하는 책입니다. 경쟁 속에서 아이들이 가질 수 있는 불안감에 대해서 고민해보는 시간이 되었습니다.
9788958207061,10,한번읽기에는  여운이 남는 ..요즘같은 시대에  생각할수있는책 작가의 상상력이 대단하다.
9788958207061,8,빠르게 변하는 시대에 그리고 코로나 까지 덮친 요즘 딱 맞는 책이 아닐까 싶다. 수많은 정보로 인한 폐해 그리고 서로의 무관심 또는 그 반대로의 너무나 당연시 되어가는게 아닌가 싶은 사생활침해.뭔가 나 스스로 뜨끔하게 하는 책이 아니었나 싶다. 반성도 하게되고 한번 돌아 볼수 있는 책이었다
9788958207061,10,"유쾌한데 책을 덮고 나면 생각이 꼬리를 뭄. 한번 읽었을때 좋았던 제목은 <책복원가> ,<만남>, <소리를 찾아서> 언젠가 나왔으면 좋았겠다는 상품이 많음...언어청정기...그리고 <마지막인사>의 한줄...누가 뭐라 한사람은 없었지만 눈치는 내가 스스로 내 마음에 심은 방어의 가시..."
9791190147361,10,조선판 코로나 같은 느낌이 드네요~!!정약용과 인성이 전염병과 싸웠던것처럼 코로나도 얼른 물리쳤으면 좋겠네요~!!
9791165730772,10,"와 진짜로 재밌어요 이 책! 진짜진짜진짜 엄청 재밌어요!! 출퇴근 길에 며칠동안 천천히 나눠서 읽어야겠다 생각했는데, 하루만에 다 읽었어요. 정말 너무 재밌어서 멈출 수가 없더라고요. ㅎㅎㅎ 세상에 아주아주 묵직한 한 방을 날려 버리는 유쾌상쾌통쾌한 이야기입니다!!"
9788971993453,10,농아소녀와 블루 55라고 이름 지어진 고래의 만남.  농아면서 큰 불편없이 생활하고 사람들이 자립심을 가지고 고래를 찾아가는 모습이 놀랍다. 그런 상황에 위화감을 느끼는게 아니라 자연스럽다는 것이 이 책의 장점이다.  청소년뿐만 아니라 어른들이 읽어도 좋은 책이다.
9791188974375,10,"무겁지도 가볍지도 너무 뻔하지도 않은 미스터리 추리소설.읽는 동안 무척 즐거웠고, 순식간에 읽어버려 아쉬웠다."
9791188974375,10,짧지만 빠르게 진행되는 이야기.씁쓸하지만 다시금 생각해볼 이야기.내 주변에 있고 혹은 당신 주변에 있을 이야기.좀 더 신경써서 생각해봐야겠다.
9791188974375,10,잘 읽겠습니다!^^
9791188974375,10,좋아하는 작가님들 책이어서 하나하나 아껴 가며 읽었어요.미스터리물답게 두 번 읽어야 더 재밌네요!
9791163500254,10,인문학과 소설길찾기와 마음찾기가 함께 한 이야기다.첫째 이야기부터 빨려들었다.내가 모르거나 애써 외면했던 북한 이야기다.평양에서 온 사람. 북한에서 선생님이었던 엄마가 나오면서다.상상할 수 있는 이야기가
9788963729091,10,반가운 여름호가 나왔군요^^맑고 깨끗한 아이들!정직한 한 사람과 삶이 담겨 있는 듯해요.
9788997798889,8,안전을 최우선으로 하면서 자율권을 침해하게 둘 것인지에 대해 깊이 생각해보게 하는 소설이다. 또한 SNS를 통한 사이버폭력 문제도 다루고 있다. 뱅크시라는 예술가에게서 영감을 받아 과감하게 자기 생각을 표현하는 모습과 친구들의 우정도 멋지다.
9791185934501,10,"엄마와 아빠 대신 이모의 사랑을 먹고 자란 튤립, 호프. 경제적으로 힘들었지만 충만한 이모의 애정으로 곧고 바르게 자라나는 모습이 흐뭇했다. 사춘기의 중요한 때를 새로운 곳에서의 적응과 불의에 항거하며 정의롭게 성장한다. 기특한 녀석-!"
9791188974344,10,바이러스 공포에 직면한 우리가 어떻게 연대해 극복할 것인가를 고민해 보게 한다.
9791188974344,10,‘연대’에 대한 다섯개의 시선. 청소년들의 불완전하지만 의미있는 경험을 들여다보는 재미가 있다. 톡톡 튀는 요즘애들의 이야기에 귀기울이다보면 왠지모를 연대감을 느끼기도. 딸래미가 읽기전에 먼저 읽어보았다!
