ISBN13,rating,review
9791155250716,8,모두를 위한 동화. 결국은 우리의 이야기.
9791155250716,10,도서관에서 빌려서 봤다가 사려고 들어왔어요.아이들이 동물을 워낙 좋아하는지라 읽어줬는데 울다가 웃다가 그랬네요.  완전 강추하구요  어른 뿐아니라 초등 고학년 빠른 아이들은 저학년도 재미 있게 볼 수 있어요. 좋은 책 만들어 주신 작가님 감사합니다
9791155250716,10,김중미 작가님 책은 언제나 진리다.
9791155250716,10,반려동물과 함꼐 살면서 제일 맘아픈건 그리고 겪어도 겪어도 적응되지않는건 이별이죠.. 함꼐하는 기쁨과 슬픔을 글로 적은 책.. 꼭 읽어보세요..
9788949123400,10,내가 앤 버든처럼 혼자 남게 된다면 앤처럼 용감하게살 수 있을까? 혼자서 농사 짓고 일기 쓰고 악인으로부터 자신을 지켜내고. 앤은 혼자서 할 줄 아는 것이 많은데 요즘처럼 공부만 하다가 최후의 인류가 된다면 뭘 할 수 있을까?
9788949123400,10,방사능에 피폭되어 사람이 살 수 없는 지구가 되어버린 곳에서 유일하게 오염되지 않은 곳에 제 나이또래와 비슷한 소녀와 다른 지역에서 소녀가 사는 지역까지 오게 된 30대 남성... 읽으면서 정말 손에 땀이 날 정도로 마지막에는 굉장히 긴장하면서 읽은 책이다.
9791197120558,8,"이금이 선생님의 청소년 도서는 부모가 되어 자녀의 성장을 바라보며, 아이가 원치도 않는 조언과 잔소리를 퍼붓게될때 잠시 내 청소년기를 돌아보며 기다려줄수 있는 마음의 여유를 주는 책인듯하다."
9791197120558,10,좋은책입니다
9791197120558,10,"재밌고, 공감할 수 있습니다."
9791197120558,10,반값도서~ 보고싶다!!
9791197120558,8,학교 독서 평가 교재호 구입했네요
9791197120558,8,형편이 어려운 아이들이 미래를 위해 살아가는 이야기.
9791197120558,8,아이들의 마음을 조금 이해...아들과 딸이 읽고난 다음 다시 글올릴께요...
9791197120558,10,눈물없이볼수없는이금이작가님의책!아이들이맘껏꿈꿀수있는그날이어서오길!
9791197120558,10,"처음으로 책을구매했는데 너무 좋군요. 친절한알림써비스도 좋구요, 앞으로 여기서만"
9791197120558,10,재미있게 읽었습니다. 아이들의 입장에서 바라본 꿈과 이상을 잘 풀어낸 책같아요
9791197120558,8,11월에 독서토론용으로 구입한책입니다.
9791197120558,10,깨끗한 책 잘 받았어요^^
9791197120558,6,청소년들의 고민과 이상을 심도있게 다루었네요. 많이 생각했습니다. 감사합니다.
9791197120558,10,'유진과 유진'과 더불어 사춘기 자녀를 둔 학부모들께 강추하고픈 책
9791197120558,6,중학생이면 한번쯤 읽어보면 또래의 문제가 무엇인지 알수있는  책
9791197120558,8,재미있고 개성있는 아이들을 생생하게 나타내었음
9791197120558,10,중2인 딸아이가 많이 공감된다고 합니다 사춘기 자녀들에 생각이 궁금하신분께 강추
9788954439329,10,오늘의 청소년들에게 추천하고 싶은 이야기. 독특한 스토리 속에 가슴에 와닿는 메시지가 담겨있다.
9788954430586,10,6학년 딸에게 선물한 책인데 흥미롭게 잘 보났다네요..저도 읽으려구요~
9788954430586,10,나쁜 사람은 아무도 없는 착한 소설. 모든 게 해피하게 끝나는 순한 소설이었다. 오랜만에 편한 맘으로 읽었다. 해피엔딩을 믿었기에. 작가의 필력도 날 쑥쑥 이끌었다. 재미있었다.
9788954430586,8,"아무생각없이 빌렸다가 너무 재밌어서 놀랐다. 판타지인듯 판타지가 아닌 소설, 청소년소설이지만 누구나 재밌게 읽을 수 있는 소설"
9788954430586,8,왜 대상 수상작인지 알겠다. 아이들에게 추천해줘야지. 문제가 있다면 절도 행위에 대한 문제가 있다는 것!!??
9788954430586,10,의류수거함을 통해 우리 사회의 일부분을 볼 수 있었던 것 같다.
9788954430586,10,곳곳에 놓여있는 의류수거함으로 이렇게 재미있는 스토리가 나왔네요~ 각자의 사정을 가진 사람들이 모여 서로 치유받는 소설임과 동시에 우리 사회의 불편한 진실을 드러내어 스토리에 따뜻함과 재미를 배가시키는 듯..
9788954430586,10,"무엇보다 읽고난 뒤에 가슴에 차오르는 따뜻한 느낌이 좋다.
소설 주인공인 도로시가 너무 귀엽고 사랑스럽다."
9788954430586,8,마술적인 리얼리즘...따스하고 신비로운 작품이다.
9788936456931,8,정의 관련 학교 추천도서중 중학생이 읽기에 제일 추천할만함 다양한 관점을 구체적 사건으로 생각하게 함
9788936456931,10,중학생 추천도서라 구매했습니다. 아이가 재밌답니다.
9788936456931,10,청소년들이 꼭 읽었으면 하는 책이다!
9791185871134,8,진실이란 어느 쪽에  서 있는지에 따라 달리 보인다. 때로는 옳고 그름이 불분명할 수도 있다.
9791185871134,8,술술까진 아니지만 잘 읽히는 책숨겨진 반전이 무엇일까 계속 생각하게 되는 책나는 무엇이 소중한지 생각해 볼 수 있는 책
9788954427142,6,뚱뚱하고 날씬함외모에 대한 비판적인 글얼마나 우리나라에서 신경 쓰는지 알 수 있는 책
9788954427142,10,"김혜정 작가는 자신의 튼튼한 하체를 이야기주머니 라고 하네요. 작가에겐 미안하지만 이야기 주머니가 줄어들지 않았으면 하는 바람입니다. 공감하며 읽었습니다. 스쿨 오브 락, 뚱보 내인생, 오이대왕도 꼭 봐야겠어요~"
9788954427142,10,정말 재미있습니다...비슷한 고민을 한 아이들이라면 공감하며 읽을 수 있습니다.
9788954427142,10,"인류의 가장 큰 적은 살이 아닐까. 누군가는 살 때문에 울고 또 웃는다. ‘다이어트 학교’는 그런 고민들로부터 시작한다. 다이어트 학교에는 살이 너무 쪄서 고민하는 친구들도 있고, 말라서 고민인 친구도 있다."
9788954427142,10,"내겐 편견이 있었다. ｀에이 뭐 이미 뚱보들의 다이어트는 ˝뚱보 내 인생˝이란 책에서 다 끝난 거 아야? 식상하게...｀ 이런 편견을 가지고 읽기 시작했지만, 되레 다 읽고 나선 만족감을 느꼈다. 당신에게 추천한"
9788954427142,10,단박에 읽었어요~ 짱 잼남
9788936458812,10,선생님은 ‘인식하지않고 평가하지마라‘고 말씀하셨지만 청년은 사실을 바르게 파악한 다음 평가하는 자세를 잊어서는 안된다.
9788954445450,10,획일화 된 미의 기준 보다 타고난 나만의 개성을 살리고 자존감을 높이는 깨달음을 주는 책
9788954445450,8,"<조선가인살롱>이라는 장치는 흔하지 않은 소재라서 상당히 독특하다고 생각했다. 소설을 통해서 그 시절 여성들이 화장품을 어떻게 만들고, 사용했는지 알 수 있으니 같은 여성의 입장에서 흥미롭게 느껴졌다."
9788954445450,10,"귀여운 체리의 재능발견 과정도 좋았고, 효림대군과의 결말이 걱정과 달리 두근거리는 새로운 시작을 말하는 듯 해서 흐뭇했습니다,"
9788954445450,8,뻔한 면도 있지만 유쾌하고 재미도 있고 무난하게 교훈적이다.
9788954445450,10,"대한민국 중3 강체리가 조선시대로 소환되어 벌이는 코믹소설, 재미있어요"
9788954445450,10,극명하게 갈리는 두시대의 미에대한 기준과 두 소녀가 극복해가는 따뜻한 성장소설이에요~
9788954445450,8,있는그대로의 나를 사랑하자!
9788954445450,10,진정한 미의 가치를 간파할 수 있도록 조력자 역할을 하는 도서라서 꼭 읽어 보고 싶은 무척 기대되는 도서 입니다 ♡
9788954445450,10,이제 막 연예인과 아이돌에 관심이 생긴 딸아이가 엄청 좋아할 이야기네요. 자신을 사랑하는 법을 배우기에 좋을것 같습니다.
9788954445450,10,http://blog.naver.com/jamo97/222155414424 겨울 방학을 맞아 아이와 함께 읽을 수 있지 않을까 기대가 된다. 재미있으면서 시사적이고 교훈적이고 여러 모로 유익한 책일 것 같아 기대가 크다.
9788997798582,8,마음을 쓸어내리게하는 작품들이어서 좋았어요.
9788997798582,10,‘야만의 거리‘ 다음 편들 언제 나오나욤? ㅠㅠ
9788997798582,10,별숲 출판사에서 나온 청소년 책들은 모두 좋아요. 이 신간도 무척 기대가 되네요.
9791156333135,10,"지나고보면 사소한 일도 너무나 큰일이고, 세상의 전부인 것 같은 청소년기를 무사히 지나가길 바라는 작가의 따뜻한 시선♡"
9791156333135,10,"굉장히 재미있게 읽었어요!! 공감되는 부분이 많았고, 몰입하면서 읽다보니까 오랜만에 진짜 집중해서읽었어요ㅎ"
9791156333135,10,책을 읽는내내 위로받는 느낌이었습니다. ‘나만 이런 생각을 했던게 아니었구나‘하는 안도감도 받았어요. 책도 술술 읽히고 위로가 되는 책이었습니다!
9788958075912,6,수학에 관한 책이라고 해서 기대는 안했는데 읽어보니 재미있어서 계속 읽게 되었다. 아직 읽어보지 않은 중학생들에게 추천하고 싶은 책이다.
9788958075912,8,이 책은 처음 봤을떄 부터 끌리는 책 이였다 책 표지의 그림이 아주 마음에 들었기 때문이다. 역시 내가 예상한 대로 책은 정말로 재미있었다. 수학소설이 이렇게 재밌을거라고는 생각을 못했어서 더욱 놀랐다. 수학소설이라고 해서 수학만 잔뜩 나와 있을 줄 알았는데 주인공들의 이야기도 같이 나와
9788958075912,2,처음에 이 책  표지를 봤을 때 읽어 보고 싶다는 생각이 들었다. 초등학생과 중학생이 좋아할 법한 표지로 독자의 마음을 끄는  것 같다.이 책을 읽고 나니 2권과 3권이 읽고 싶어졌다.            수학 중학교가 실제로 있다면 어떤 식으로 수업을 할까 궁금해졌다. 2권과 3권도 한 번 읽을거다독토모
9788958075912,10,애들이 책을 읽고나더니 재미는 기본이고 도움되는 내용이 많다며 또래친구들에게 추천하고픈 책이라고 하네요.
9788958075912,10,정말 재미있다. 수학중학교라는 말에 거부감이 있을 수 있지만 책을 읽어보면 느낌이 확 달라진다. 초콜릿레볼루션이라는 책처럼 집준해서 계속 읽고 싶어진다.
9788958625131,8,요즘 아이들이 단편 소설을 읽기 힘들어 하는데 아이들의 독서를 도와 줄 멘토 같은 책입니다.
9788983946553,8,"독재와 민주주의를 아주 쉽게 풀어 설명한, 읽을 가치가 있는 책! 하지만 결말은 좀.. 너무 동화스럽지 않나?"
9788971847763,10,열혈수탉 분투기는  지배층과 피지배층을 잘나타낸책이다. 주인내외가  지배하는 닭들의 세계를 수탉의 시점으로 잘 나타낸  책이다.
9788971847763,8,YG:하얀 깃털이 계속 자기가 우두머리가 될 것 이라고 했는데 결국엔 ‘나‘ 와 하얀깃털만 남아서 아주 흥미진진 했어요.‘나‘ 는 떠나겠다고 결심하지만 길 위에서 죽음을 맞고 사망합니다.수탉 아빠를 향한 토종닭의 사랑은 죽지 않았어요.
9788971847763,10,"이책은 사회의 문제와 사람들의 이기심과 탐욕, 허영심을비판하는책이다. 주인공은 하얀깃털과 우두머리가 되기위한 라이벌이지만 걱정해준다는게 감동적이었다.  재미있고 감동적인 책이다."
9788971847763,8,열혈 수탉 분투기를 읽으면서 정말 감동적이였습니다.제가 토종닭에 대해서 잘 모르고 관심없었던 종중 하나인데알게되서 기쁩니다. 하얀깃털이 ‘나‘에게 뭐라고 하는게 마음에 안들었는데 ...... 뒤쪽에서 하얀깃털이 사라진게 마음에 걸리고 아쉽다.
9788971847763,8,주인공 토종닭은 아빠수탉처럼 멋진 수탉이 되기위해 노력하는 이야기다. 나도 아빠가 장교였어서 장교를 꿈꾸는데 아빠처럼 되기위해 노력하는게 감동적이였다.나도 토종닭처럼 메사에 열심히 노력해야 겠다.그리고 개그캐릭터 하얀깃털도 그립다
9788971847763,10,조카 책좀읽게 하려고 구입해서 먼저 읽어봤는데 자신감 자존심 자존감 암튼 힘이됨 좋겠다싶군요.
9788971847763,8,밝고 경쾌하다. 그러면서도 가볍지 않은 생존 투쟁이 있다.
9788971847763,10,리더가 되기 위해 하얀깃털은 온갖 꼼수를 쓰지만 리더는 토종닭이 된다.청소년기 아이들에게 리더의 자질이 무엇일까? 곰곰이 생각케 하는 책이다.
9788971847763,10,양질의 고기닭이 될 것이냐 좋은 수탉이 될 것이냐....
9788971847763,10,다이나믹하면서 재치가 넘치는 재미난 소설입니다. 아이나 어른이나 이야기에 쏙 빠지게 되요^^
9788971847763,10,"저희 동생때문에 샀는데
재미있네여
추천합니다~~~!"
9788971847763,10,심성 고운 남자아이들에게 꼭 권하고 싶은 책. 아주 재미있게 잘 읽었어요.
9788971847763,10,정말읽으면서시간가는줄몰랐던작품!!!!추천합니다!!!!
9788971847763,10,재미있을것 같아요
9788971847763,10,기대하고 구매합니다
9788971847763,10,처음 읽을 때부터 생생한 주인공 병아리[처음엔]의 이야기에 배꼽잡고 웃었네요. 최고
9788971847763,8,멋진 수탉이 될 것인가 양질의 고기닭이 될 것인가?멋진 수탉의 길을 택한 자의 모험
9788971847763,10,"풍자,재미,감동 다있다. 정말재밋다 !"
9788971847763,6,우화를 통한 우리 삶을풍자한글읽기부담 없음
9788936456986,10,얇은 두께의 책이 아니었음에도 술술 읽혔다. 전혀 늘어지는 부분이 없었고 페이지를 넘길 때마다 소설의 배경이 흥미로워 기대하며 읽었다. 영어덜트를 많이 접하지 못했던 나에게는 새로운 계기가 되기도 하였고 영어덜트 장르문학에 관심을 갖게 해준 소설인 것 같다.
9788954671989,4,잘 읽었습니다. 항상 비슷한 수준을 유지
9788954671989,10,좋아요! 술술 읽혀요
9788954671989,6,"소설의 미흡함이, 캐릭터의 이상함이 나의 미흡하고 이상했던 사춘기 시절을 떠오르게 한다."
9788954671989,8,내가 지나온 초록의 시간을 아무리 떠올려보려해도 쉽지않은 현재의 내 자신에 대한 쓸쓸함에 대해 위로를 건네는..
9788954671989,10,"정말 흥미진진하게 읽었어요. 10대 소녀들의 미묘한 심리와 그들이 가진 개인적 상처, 그 또래 아이들이 가진 고민들이 잘 드러나 있었어요. 분명 그 시절을 지나 왔음에도, 그 시기가 지나버리면 그들의 내면을 제대로 들여다보기 힘들잖아요. 읽으면서 제 10대 시절로 돌아간 듯한 기분이었어요."
9788954671989,10,어릴 적 제 마음을 대변해주는 듯한 소설이었어요. 따뜻한 위로를 받았습니다. 결말도 너무 좋았어요!
9788954671989,10,단 한숨에 읽었습니다!!!
9788954671989,2,재밌게 봤어요!
9788954671989,10,언제나 좋은 작가님. 시대에 길이 남을 의미 있는 글들 잘 보고 있습니다. 감사합니다.
9791130627519,10,내 한몸 누이고 있는 집의 소중함을 새삼 느끼게 되고 집을 사고 싶어집니다
9788936456290,10,재미있게 잘읽어습니다
9788936456290,10,청소년끼리 모험하고 연대하며 생존하는 이야기가 정말 매력적이고 재미있어요. 원래 장편소설 잘 못 읽는데 두근두근하면서 한번에 다 읽었네요.
9788936456290,10,"정말 재미있다. 왜 이렇게 늦게 읽었지, 하는 생각이 계속 들었다."
9788936456290,10,이 책을 읽으면 읽을수록 충격이엿다. 재미외의 다양한 요소를 지니고 있으면서 더욱 더 책에 빠지게한다. 용감한 소녀와 그녀의 친구들이 만들어나가는 거대한 모험이 굉장히 재미있었다.
9788936456290,10,발달된 과학이 주는 무서운 모습을 보여준다. 그리고 그것을 더나은 삶을 위해 바꾸어가는 인간의 모습을 보여주며 인간답게 사는게 무엇인지를 알게 해주는 책이다. 무거운 주제를 재미있고 흥미진진하게 그려내고 있다.
9788936456290,8,책을 읽는 내내 [아바타] 와 [설국열차]가 ....두 작품이 혼합된 책 읽을 만 합니다
9788936456290,8,SF라고는 하지만 너무 말이 안돼는 부분이 있다. 하지만 수면연장에 대해 다시 생각해볼 수 있는 계기가 되었고 아무리 과학이 발전한다 한들 그 혜택이 모든 사람에게 가지 않는 다는 것도 변하지 않는 사실인것같다
9788936456290,10,섬세한 문장들이 어느새 어둡고도 신비한 미래의 지구로 데려다 놓습니다.
9788936456290,6,영화 '아바타'보다 먼저 나왔으면 더 좋았을 책.
9788936456290,6,"다소 덜그덕거리는 부분이 있긴 햇지만, 뜨거운... 지금, 여기를 말하는 미래 소설."
9788936456276,10,"아이가 저학년 때 <아홉살 마음사전>을 읽고읽고 또 읽었을 정도로 좋아했는데, 이제 박성우 시인의 시집을 읽으며 더 깊고 현실적인 감정을 느낍니다. 다 읽고 나면 아침밥 먹은 거처럼 마음이 든든해지네요."
9788936456276,10,사춘기를 지나는 동생과 함께 읽고싶은 책.
9788936456276,8,"시대가 흘러도 1318은 변함이 없다. 느끼는 아픔도, 방황도 모두 같구나~"
9788936456276,8,아직은 풋풋하고 설익은 연두. 그러나 그 어디로든 뛰쳐나갈 수 있을 것 같은 빨강! 그게 바로 너희들이야.
9788936456276,8,아들이 아주 좋아했고 새로운 시를 읽은 것 같다고 하였습니다.
9788936456276,10,공감 200%
9788936456276,10,청소년 친구들이 읽고감명을 느낄만한 책인것같아서 너무 좋습니다.
9788936456276,10,"공부 기계, 요즘 청소년들의 손 안에 가득 담을 만한 사연, 난 빨강이라오."
9788936456276,10,사춘기가 된 사촌 동생이 보면 좋을것 같아 선물로 보냄.
9788936456276,10,"청소년들 마음을 오롯이 담아낸 시들~ 내 마음이 바로 이 마음이야, 청소년 완전공감!"
9788936456276,10,공부하다 읽으면  스트레스 풀릴 것 같아서 고1 승락이에게 선물.
9788971847312,10,청소년대상 세계문학작품 중에서 비교적 접근하기 쉬운 편이라니..재미있게 읽어보
9791190337403,10,이 이야기는 소설이라기보다는 현재의 실재하는 이야기라고 생각될 만틈 생생하다. 그리고 마음이 먹먹하다. 주변을 돌아보게 된다.......
9791190337403,8,코로나로 우울감에 휩싸여 어쩔줄 모를때 이 작가들은 코로나에 대한 소설을 쓰다니 놀랍다
9791160512939,10,자폐증을 가진 아이를 키우는 입장에서 굉장히 공감이 되고 도움이 되는 이야기들이 많습니다.소중한 아이들을 어떻게 대해야 할지 다시한번 생각하고 반성하게 해 주는 책이네요..
9791189503727,10,"드라마처럼 쉽고, 재밌게 작품을 알아갈 수 있도록 곳곳에 수능 만점 선생님 캐릭터가 감상 꿀팁들을 전수해주는 게 너무 재밌고 알찹니다. 수능, 내신, 논술 뿐만 아니라 우리나라 현대 문학을 통한 현대사 이해하는 데도 도움이 돼 문학 교양서로도 좋을 것 같습니다. 여러모로 유용한 책인 것 같아"
9791189503727,10,이렇게 세세한 해설이 나온 한국문학 책은 처음. 게다가 수능/내신 기출문제까지 들어가 있어요!
9791189503727,10,"세상 똑똑한 참고서로 추천!이 책은 인물 관계도를 작품 맨 앞장에 캐릭터로 그려 놓아 인물 관계 파악이 쉽고, 작품에 중요한 부분이나 숨겨진 의미 등이 있는 문장은 표기해 놓고 밑에 만점 수능 쌤 캐릭터가 설명해줘서 핵심 정리가 쉬운 게 장점인 것 같아요!"
9791189503727,10,"참고서 고르는 데 있어 누구보다 까다로운 고등학생 딸아이가 좋아해요. 내용도 충실하고, 삽화도 예쁘다고 책상 위에 올려두고 읽네요. 참고서의 제 역할을 하는 것 같아 뿌듯하고 좋습니다!"
9791186531969,10,너무나 현실적이면서 생각해볼만한 거리를 던져주는 소설이네요. 꼭 읽어봐야겠습니다
9791186531969,10,"빈부 격차에 따라 암묵적인 계급이 형성되어 있는 h고등학교 대기업 상무와 유명 화가를 부모로 둔 잉걸은 H고학생 중 계급 피라미드 최상위에 포식하며 온갖 수혜를 누리고 부정을 저지른다. 알코올중독자 아버지를 둔 동욱은 잉걸의 봉사활동을 대신하는 대가로 돈을 받으며 나름대로 괜찮은 거래라고 생각하지만, 어느 순간부터 최상위계급아이들의 들러리신분이 되어버린다 보이지 않는 계급 사슬을 끊어버리기 위해 동욱은 자신이 최상위계급 아이들의 들러리였다는것을 폭로하는 피켓을 들고 교문 앞에 선다. 단 한 명 즉 잉걸을 위해 모두가 들러리를 서야 하는 h고등학교 겉으로는 모든 아이들 평등하게 대우한다는 원칙으로 꼽는 학교에서 집안배경 부모의 사회적지위 성적이 좋은 학생은 갑 혹은 귀족, 가난하거나 공부를 못하는 학생은 을 혹은 노예. 교장을 비롯한 교사들은 자신의 편의를 위해 계급을 옹호하거나 외면하는 현실을 적나라게 보여준다"
9788936458775,8,"현덕의 ‘하늘은 맑건만‘ 책제목은 오늘따라 유난히 와닿는다.양심에 관한 주인공의 내밀한 심리묘사가 압건이며,‘고구마‘란 제목의 짧은 소설은, 다수의 의심이 묘하게 사실로 굳어져 주인공을 도둑으로 몰아가는 정황이, 왠지 오늘의 결과와 비슷하게 느껴져 아프다.가을이라 하늘은 유난히 맑건만."
9788936458775,10,소설의 첫만남이라는 컨텐츠를 굉장히 좋아한다. 가독성 있는 문장과 현대 아닌 배경을 보는 일이 오랜만이다. 제목이 마음에 들어 자꾸만 들여다보았다.
9788936458775,10,예전에 교과서에서 읽었던 기억이 나네요. 일러스트가 정감 있고 예뻐서 기대해 봅니다. 중학교에 막 올라간 조카가 소설의 첫 만남 시리즈를 넘 좋아해서요- 이번에도 조카들과 같이 읽어야겠어요. :)
9788936458690,10,논술 대비로도 부족함이 없다고 생각해요. 천천히 읽어나가며 생각하는 연습을 할 수 있어요.
9788936458690,10,"교과서는 최상의 선택이라 할수있다.클래식에 매력을 느낀다면 굳이 여기저기 기웃거릴 필요가 없다,김유정의 봄,봄만으로도 매력이 있는 바이블, 논술을 준비하는데 전혀 부족함이 없는 소설의 향연이라 할수있다"
9788936458690,10,도움 많이 될것 같네요
9788936458690,10,"학교에서 배웠던 교과서속 소설 작품을 찾다가 발견한 책인데, 수업때 이론적으로만 접근해서 배웠던 소설들을 작품 그 자체로 읽어볼 수 있어서 정말 좋고, 여러 소설작품을 이리저리 찾아보지 않아도 한 책에서 읽을 수 있어서 편리하다."
9788936458690,8,학교부교재로 쓰고있어요 좋아요
9788936458690,8,알찬구성 좋아요
9788936458690,10,고등학교에 입학하는 아들이 읽는다고 사 달라고 해서 구매했어요. 읽어주면 좋을내용이라 만족합니다!
9788936458690,10,개정 국어교과서 작품이 한눈에
9788936458690,10,학교추천(?!)으로 샀는데 책이 좋네요^^
9788936458690,10,방학동안 정말 읽어야 할 좋은 책이 아닐까요
9788936458690,10,중3학생인데 문학작품을 국어실력과연계해보려고 노력하다가 신문광고를보고 구매함.
9791156752769,10,"책의 제목은 [가까이 다가오지 마], 표지에는 예쁜 여자 아이가 마스크를 끼고 있는 모습만 보더라도 어떠한 내용인지 미루어 짐작 할 수 있었다.지금의 우리 아이들의 모습이 투영되어 왠지 안타까운 마음으로 첫"
9791197126734,10,아이 주려고 산 책인데 제가 궁금해서 먼저 읽다 너무 잘 읽어서 리뷰 남겨요.사실 어릴때부터 말 조심하라는 말을 많이 했지만 아이 스스로가 잘못 된 경험을 하기 전에는 그것이 얼마나 위험한지 알수가 없자나요.. 그래서 꼭 읽어보라고 하려고요. 네명의 작가님들 다 특색 있게 경고해주시네요.
9788936456122,10,웃다 울다가 어울리는 이야기 입니다.  학창시절도 그리워지고 부모로서 부족함도 느껴집니다. 어른도 성숙되지 못했음을 알아야하는 것.  청소년은 자신의 삶에 주인이 되어야 함을 서로 그 것을 볼 수 있어야만 서로에게 함께할 수 있음을 알게해 주었습니다.
9788936456122,8,이 시대에 필요한 소설
9788936456122,10,소장해 두고 나중에 우리 아이들이 청소년기에 접어들 때쯤 읽히고 싶네요..자기 꿈을 키울 수 있는 힘이 되어주길 바라며...
9788936456122,8,친구에게 생일선물로 받아 재미있게 읽었던 책입니다!
9788936456122,10,청소년들이 읽기에 좋은 책입니다 ..........
9788936456122,10,문학책은 어떤책이든 좋다.
9788936456122,10,스프링벅 : 우리사회에서 청소년이 읽어보면 좋은 책
9788936456122,6,좋은 책
