ISBN13,rating,review
9788971968499,10,중학생 아들 학교에서 필독서라 구입했는데 자기또래 이야기라고 좋아하네요^^
9788971968499,10,심심할떄읽으면딱좋은것같아요.사춘기소년이야기!!!!
9788971968499,10,학교 숙제로 샀어요. 재미있음
9788971968499,10,또래보다 조금쯤 웃 자랐다고 믿는 우리들을 위한 동화.
9788971968499,10,어린시절을 생가나게 하는 상큼한 소설
9788963012292,10,울다가 웃다가 단숨에 읽었다. 부족함을 서로 채워가며 가족이 되는 모습이 감동적이었다. 나는 누군가에게 예원아줌마같은 사람이 될 수 있을까? 반문하게되었다.
9788963012292,10,아침 출근 준비로 바쁠 때뉴스에서 이런 이야기가 나오면 좋겠다. 얼마나 따뜻하고 훈훈한 이야기인가?물론 이 세상은 보이지 않는 착한 사람들이 오른손이 하는 일을 왼손이 모르게 하고 있어서 멸망하지 않고 굴러가고 있는 건지도 모른다. 작가님의 다음 책도 기대된다.
9791190893428,10,고된 시련과 역경을 이겨내려는 모습이 안타까운 마음이 들면서 감동적입니다.라온의 아이들 화이팅!
9791190893428,10,느낌있어 선물하려고 재구매합니다.영화가 그려지는 그런책이였습니다.
9788983898593,10,읽는 내내 긴장되어 끝까지 손에서 놓을 수 없었다. 예전에도 있었고 현재진행중이기도 한 학교폭력 문제는 가정과 사회 모두가 나서야만 완화될 수 있지 않을까 생각해 본다. 섬세하고 사실적인 문체에 단박에 빠져들 수 밖에 없는 수작이다.
9788983898593,10,현실에서 볼 수 있을 법한 이야기가 작가 특유의 실력있는 문체로 표현되어 있다. 사건들이 다양하고 촘촘해서 시간가는 줄 모르고 읽었던 작품. 수많은 비행 사건 속에서 곤란한 성장통을 겪고 있는 청소년들이 읽고 중심을 잡을 수 있었으면 하는 책이다.
9788983898593,6,힘없는 병아리와 같던 아이의 성장기.내 주변에서 충분히 일어날 법한 이야기이자 실제로 일어나고 있는 이야기.주인공 아이가 가정폭력과 학교폭력을 겪으며 고통받음에도 방관자가 되어가는 듯 하여 안타까움.
9791188758210,10,여학생들의 사이버폭력이 실제처럼 생생함. 여학생들과 읽을 때 이야기할 거리도 있어 함께 읽어보면 좋겠음. 읽기도 수월하고 흥미진진함. 최근 책들 중 아주 재밌게 읽음.
9791189228750,10,"기대한 것과 다르게 현실적인 이야기라 청소년들이 공감할 듯... 질투와 누명, 관계가 잘 그려졌다!"
9788964461723,10,자연스럽게 접할수 있어서 좋아요책 읽어야한다는 부담없이 읽을 수있네여
9788958205562,10,인터뷰 글을 보고 흥미로워서 ‘파이미로‘와 ‘오일러 패러독스‘를 구매해서 읽었음.오일러 패러독스는 ‘라플라스의 마녀‘보다 훨씬 재미있으므로 강추.파이 미로 는 그냥 재미없음. 기승으로 가다가 절정이 없이 그냥 결론.그러나 세계관을 이해하기위해서는 두 책 다 읽어야 함. 그럴 가치 있음.
9788936458782,10,"#소설의첫만남 책을 처음 받고는 너무 짧아서 놀랐다 음... 처음 받고는 초등학생을 위한 동화책같은 느낌이었는데, 책을 읽고 마냥 초등학생을 위한 동화는 아닌 어른이를 위한 동화라는걸 인지했다. 너무 짧기에 내용에 대해서 언급하기는 그렇고, 작가인 #스콧니컬슨 이 꿈을 꾸고 꿈내용을 이야기한 책이라니 너무 기발하고 나도 꿈을 가벼이 생각치말아야겠구나하는 생각을... 책과 함께 하는 삽화도 책내용과 의미를 같이 해서 책을 읽는데 많은 도움이 되었다 짧지만 가슴에 울림이 컸고 다름이 틀리지 않다는 걸 다시 되새기게 되었다. #뱀파이어유격수 #창비"
9788936458782,10,취지처럼 동화에서 소설로 접근하려는 청소년들을 독려해 주기 위한 책으로 아주 적당해요. 우선 책이 얇아서 집중력이 다소 부족한 친구들도 금방 읽을 수 있어요. 생각할 만한 문제제기도 어렵지 않게 드러나 있어서 평소 책을 멀리하던 친구들에게 추천합니다.
9788936458782,10,"일단 이 책은 접근하기 쉽다. 우선 얇고, 글자도 큼직큼직 시원하게 읽히고 또 그림도 많다! 뭘 더 고민하랴, 내용은 읽어봐야 아는 거고 일단 손에 잡힐 수 있으면 첫발은 뗀 셈이다. 뱀파이어도 흥미롭고 이야기는 간결하다. 끝에 다다르면 묵직한 감동까지."
9788936458782,10,뱀파이어라는 흥미로운 소재로 평등과 공정을 알려주는 좋은책이에요. 본인과 다르다고 무조건 배척하고 차별해서는 안된다는것을 야구 경기와 관중객들의 집단행동으로 보여준다. 아이들이 자연스럽게 제리를 통해 차별을 해서는 안된다는 것을 배울수있다. 부모님과 함께보고 토론할수있는 책이다.
9788936458782,10,"뱀파이어가 속한 야구팀이라니, 어떤 이야기일지 너무 기대돼요. 판타지일지 호러일지..! 책소개만 보면 ‘차별‘에 대한 이야기일 것 같은데, 어떻게 풀어질지 기대합니다. 믿고 사는 소설의 첫 만남..! 공감력 세트도 예약합니다♥"
9791196149949,10,이 작가의 청소년 소설들을 꾸준히 읽고 있는데 이 작품이 가장 좋았다. 연두는 내가 이제껏 읽었던 어떤 청소년 소설의 주인공보다 마음이 쓰였다. 뭔가를 해주고 싶은 마음 쓰임이 아니라 그냥 따뜻하게 지켜만 봐주고 싶은 마음. 잘 해 낼 거라는 믿음을 말없이 무한정 불어넣어주고 싶은 마음.
9791196149949,10,"읽는 내내 마음이 불편하다 결국 절정에 다다랐을 때, 김선영 작가는 또 한 번 나를 울게 했다. 자꾸 신경 쓰이고, 찌릿 찌릿 하며 계속 생각하게 되는 게 김선영 작가의 힘이다. 나를 실망시키는 법이 없다."
9791155401064,10,인간의 욕심과 오만함으로 인해 멸종된 많은 동물들역시 인간이 제일 쓸모없는 생물같다
9788961705899,6,마지막두세장빼고는 주고자하는 메시지가 뭔지도 딱히 모르겠고 별로인 책이였다
9791156330882,10,"속도감 있게 읽히면서 감동도 있었다. 목판과 금속 활자는 동시대에 있었다. 그걸 만드는 사람들이 어떤 생각을 가지고 있었는지, 불경을 어떤 마음으로 새겼는지 생각해 본 적이 없는데, 이 책을 읽으면서 피상적인 역사적 사실이 아니라, 그 시대가 구체적으로 와닿는 것 같았다."
9788984142343,10,보통 미래사회에서는 종이책이 사라질꺼라고 많이 나오는데 오히려 종이책만 읽을수 있게 하는 사회라는것에서 다른책과 다른거 같으면서 결국 종이책이 사라지는 위기가 온다는것에서는 같다고 볼수도 있을거 같기도한 어쨌든 흥미진진한 재밌는 책입니다.
9788984142343,10,종이책은 절대 사라져선 안됩니다 활자가 가진 매력은 무시할수없으니까요
9788984142343,10,이런재미있는책이있는지 처음알았습니다. 다른두권도 돈이생기면 바로 구매해야죠
9788984142343,10,책광인 저는 이렇게 흥미진진 했는지가 몰랐습니다.
9788984142343,10,읽는내내 많은 생각을 하게 되는 책이었습니다
9788984142343,10,읽고나서 마음의 여운이 오래남는 값진 책이었습니다.
9788984142343,10,읽는 내내 다음장을 궁금해하면서 정말 행복하게 잘 읽었습니다. 주위 사람들에게 적극 추천드리고 싶네요.
9788984142343,10,생각도 하게되고 수준있는 책이에요
9788984142343,10,제목부터 신선하네요..우리에게 너무 소중한 책을 다른 관점에서 잘 표현해 준 거 같아요..아직은 종이 넘기는 소리가 좋고 소장의 기쁨이 있어서..종이책을 선호하는데..미래에는 어떤 상황으로 될지 한 번쯤 생각하게 되네요~~
9788984142343,10,구성도 좋고 신선하며 기발한 책이라 흥미진진합니다
9788984142343,10,신매체들이 빠르게 새로운 기술들을 쏟아내는 이 시점에서 느리지만 낭만있고 가치있는 책을 읽어보는 것도 좋을 것 같다. 이 책도 물론 추천이다
9788984142343,10,재미있는 소재의 스토리라 상상력을 자극하고 어떤 이야기가 이어질까 흥미진진하네요 정말 현실에서 책이 사라지면 어떻게 될지 상상하게 됩니다
9788984142343,10,어릴때부터 책을 좋아해서 대학도 국문학과로 갔을정도인 나도 요즘 컴퓨터와 스마트폰이 없으면 버티질 못한다. 아직까지는 종이책이 보기도 익숙해서 편하고 느낌도 좋아서 고르라면 종이책을 고르겠지만 태어나면서부터 컴퓨터와 스마트폰을 먼저 접하는 아이들은 어떨지 모르겠다.
9788984142343,10,디지털과 아날로그를 소설로 표현! 매우 참신한 소재입니다!!
9788984142343,10,"재미있고, 그냥 책 내용이 너무 궁금해져요. 여러 문학작품들이 인용되어 견문을 넓히기도 좋네요"
9788984142343,10,의외로 수준있고 깊게 생각해볼 만한 책이네
9788984142343,10,텍스트 안에 텍스트가 담긴 소설~ 주인공은 연애소설인 <불같은 열정> 덕에 구출된다!
9788984142343,10,"요즘 어른 아이 할것 없이 점차 책을 읽는 이가 줄어들고 있죠. 독서를 주제로 쓰여진 이책이 책보다는 텔레비젼, 컴퓨터, 스마트폰을 보는 아이들이 읽으면 독서의 중요성을 다시한번 느낄 수 있게 해주는 재밌는 책같네요."
9788984142343,10,기발한 상상이라 호기심이 생기네요 어떤 내용이 전개될지 흥미진진합니다
9788984142343,10,독서는 사람의 감성과 인격을 키우는데 참으로 중요한데 요즘 청소년들은 학교 공부에 치여 독서의 기회가 오히려 줄어드는게 안타깝죠
9788984142343,10,책의 소중함과 몰입감이 좋았던 소설이였어요
9788984142343,10,"흥미로운 소재, 미래를 배경으로하는 독서와 인터넷, TV의 공생"
9788984142343,10,책읽기는 싫어하는 아이들에게 읽어주면 좋을 것 같아요. 책 읽는 것의 중요함에 대해서 고민해보는 계기가 되는 책일 것 같아요. 독특한 판타지 세계로 흥미를 이끌어내고 탄탄한 이야기로 스토리에 몰입하게 하니까 앉은 자리에서 곧바로 읽어지는 책이네요. 흥미로운 책입니다.
9788984142343,10,책이 소홀히되고 인터넷이나 게임등이 요새는 더 많이 지배되는 세상에서 무엇인가 생각하게 만드는 중요한 책 같아요 책에 대한 중요성이 많이 사라지는 것 같아서 안타깝습니다. 책은 그 무엇보다 중요한데 아이들이 책에 대한 중요성을 더 많이 알았으면 해요
9788984142343,10,이상한 나라의 앨리스가 생각이 나면서 친근하기도 하고 또 전혀다르기도 한책이네요. 아이들의 상상의 나라를 맘 껏 펼칠수 있게 해주는 책같아요.
9788984142343,10,너무 잘 빠져드는 소설!
9788984142343,10,책바이러스로 인해 책들이 영원이 사라진다?획기적인 주제로 아이들의 시선을 사라잡을 것같아요.기대돼요.
9788984142343,10,책바이러스의 내용이 정말 궁금해지는 책이에요
9788984142343,10,종이 책의 미래를 보여주는 책이였습니다.
9788984142343,10,아직은 e북보다 종이책이 좋은데 과연 미래에는 어떨지 궁금해지네요
9788984142343,10,"우리가 겪지 않고 있는 미래를 배경으로 한다는 점에서 흥미를 갖게 합니다. 독제체세 속에서 인터넷과 텔리비전, 컴퓨터와 인터넷 사용을 금지하게 되자 대부분 독서와 글쓰기를 즐기게 되지만 비밀리에 소통하는"
9788984142343,10,"컴족과 문자족의 대립이라니, 흥미로운 소재네요. 작가의 상상력이 돋보입니다."
9788984142343,10,상상력 넘치는 흥미로운 소재네요. 종이책이 점점 줄어가고 있는 요즘 정말로 종이책이 사라져버리는 게 아닐까 걱정했는데 이 책을 통해 그러한 문제들에 대해 다시금 생각해보게 됩니다.
9788984142343,8,흥미로운 책이네요. 저도 전자책이 나오면서 나중에 종이책이 없어지는건 아닌지 생각해본적도 있는데.ㅋ
9788984142343,10,정말 기발한 발상입니다.모든것이 미디어에 집중되어있는 요즘 세상에 사람냄새나는 종이책을 응원하고 싶네요
9788984142343,10,종이 책이 언젠간 사라지지 않을까 생각이 들었는데..이 책을 통해 간접적으로 느낄수 있네요
9788984142343,10,기발한 내용의 이야기네요. 개인적으로 e북보다 종이냄새가 나는 종이책을 더 좋아합니다. e북과 종이책의 대결에서 누가 살아남을 수 있을지 궁금해지네요.
9788984142343,10,영상매체에 현혹되는 요즘시대에 왜 활자를 읽어야 하는지에 대해 생각해 볼 수 있는 책입니다.
9788984142343,10,종이책은 죽었어 하지만 이 북이 내 마음 속에서 요동을 치고 있어!
9788984142343,10,종이책들의 죽음과 미래라는 독특한 소재를 통한 소설! 당신도 한 번 느껴보세요!
9791186639085,8,사춘기 절정을 달리는 아들이 꼭 읽고 싶다고해서 구입한 책. 쉬운 대화체로 되어 있어 술술 읽힌다고.. 내용은 아이들의 마음을 잘 달래기에 충분한 듯 ..
9791186639085,10,"소문듣고 저도 읽었는데 정말 재미있더라구요. 곧 청소년이 될 저희 딸에대한 마음의 준비도 하고, 공감도 할 수 있는 책이었어요 ^^"
9791186639085,10,"까칠한 재석이도 좋았는데, 까칠한 재석이가 달라졌다니 어떻게 변했을지 기대되네요~^^"
9791186639085,10,재석이가 사라졌다 돌아왔다 열받았다 다일어본 독자로써 이번의 청소년 문제를 외모지상주의로 잡으신 이책도 굉장히 기대가 됩니다!
9788958287575,10,"좋은 청소년 작품은 어른에게도 유효하다. 공연을 전제로 각색한 것이라, 번역 희곡의 어딘지 모를 낯간지러움이 없어 좋았다. 아이가 순식간에 어른으로 분한다는 설정이 좋았다."
9788958287575,8,청소년 10대들에게 추천할 만한 희곡입니다. 연기까지 하기엔 무리겠지만 ^^; 그래도 연극반에서 도전해볼만해요.
9788958287575,8,"청소년 연극. 희곡으로 볼 수 있어 더더욱 즐겁다. 두껍지 않은 책이지만, 메시지는 가볍지 않다."
9788936452117,8,"친구 관계에 대해 여러 가지 예시를 들어 이야기하는 책입니다. 옛 성인들의 우정이라던지, 유명한 영화나 책의 우정에 대해 이야기하는데 약간은 산만한 느낌이 있어요. 아이들 주려고 샀는데 아이들의 평은 어떨 지 모르겠네요."
9788936452117,8,친구관계에 서툰 사춘기아들에게 선물할 생각으로 구입한책이였는데 제가 읽어보니 딱딱하지 않고 우정이라는것에 대해 생각해보는계기가 되었고 아들이나 나나 표현이 많이 서툼에 공감을 가는 책이였어요. 이 한권으로 아들이 친구관계를 잘 맺어나가진 못하겠지만 적어도 생각의 시간을 갖었으면해
9788965881711,10,제 습작의 롤 모델인 분이라 내용에 상관없이 구매했어요역시나 잔잔한 물결 같은 감동이....
9788965881711,10,한번쯤 읽어보고 싶은 책~ 제목 때문에 더욱 궁금해진 책~
9788964808726,10,제목 보고 오? 내용 읽으며 읭? 다 읽으면 오~ 하게 되는 아동 문학.
9788964808726,10,"영화로 먼저 보았었는데, 판타지 요소가 들어간 영화와 달리 현실감 있는 것이 책이었습니다. 단짝 친구와의 추억이 담긴 놀이를 동생과 이어가는 마지막 부분을 통해 소년은 한뼘 성장했겠지요."
9788992632669,10,십자가에서 내려지는 예수를 찬란한 황금빛에 휘감긴 채 무릎 꿇고 바라보는 넬로와 파트라슈 그림을 우연히 발견하고 그 그림 때문에 이 책을 샀는데 그 안에 담긴 글도 너무 아름답고 슬퍼서 가슴이 무척 시렸네요.
9788992632669,10,아름다운 고전시리즈...정말 아름다운 그림 그리고 아름다운 이야기..오랜만에 다시 읽어보는 이야기지만 새로운 기분입니다
9788992632669,10,일러스트가 참 예뻐요
9788992632669,4,번역이 너무 딱딱해요 비문학지문 읽는 느낌...인디고 디자인 모두 맘에 들지만 번역이 많이 아쉬워요  읽다보면 짜증나요 원어에 단어만 끼워넣은 느낌... 감동이 별로없어요
9788992632669,10,"소장중인 인디고 고전시리즈 중에서 가장 얇지만, 감동의 두께는 어찌할수 없게 가슴 깊게 파고들어 자리하는 글."
9788992632669,10,아이들 동화책으로만 접하던 플랜더스의 개를 어른용?으로 접해보니 더 큰 감동이..어른으로서의 반성과 앞으로 제대로 살아야겠다는 다소 무거운 책임감까지 안겨주는 책.일러스트도 아름답다.
9788992632669,8,어릴 적 텔레비젼으로 띄엄띄엄 보며 감동을 나누어 느꼈는데 모처럼 쭉 읽으며 재미를 느낍니다. 기분 좋은 책이에요. ^^ 한권씩 모으는 재미가 쏠쏠하네요. ^^
9788992632669,10,"플랜더스의 개를 읽으면 항상 개를 키우고 싶은 생각이 든다...
동물 이야기에 취약한 나...ㅠㅠ"
9788992632669,10,오직 그림이 좋아서 구매했습니다^^;; 김지혁 일러스트 넘 좋아요 호호
9788992632669,10,어느덧 추억의 도서가 되어버린 플랜더스의 개. 파트라슈와 네로의 우정이 참으로 부러웠었죠. 좋아하는 책도 읽고 달력도 함께 받으니 기쁨이 두배입니다!
9788958625360,10,좋아요
9788996100188,10,제목부터 아이들에게 충격적이다. 작가의 실제 상황을 떠올리면 가슴이 아파온다.
9788996100188,10,5학년 우리 딸이 사달라고 해서 샀는데... 괜찮네요. ^^
9788971848043,10,"<사람은 무엇으로 사는가>라는 문장은 매우 단순하고 간결, 깨끗하다. 이 단순하고 소박함 속에서 톨스토이 는 우리에게 진지하게 질문을 던진다. 당신의 삶의 의미는 무엇입니까? 당신은 무엇에 기대어 이 고단한 삶을 살아가고 있습니까? “인간이 이 세상에 존재하는 것은 행복해지기 위해서이다."
9788971848043,4,책선택을 잘못한거같네요 중학생이 읽기좋은책!
9788990220547,10,고등생 아들이 학교에서 수행평가용으로 사용한다고 해서 사줬는데 읽더니 좋은 책이라며 엄지를 치켜드네요. 고등학교 간 후로 아들이 독서를 별로 안했었는데 다시 독서에 빠지는 계기가 될것 같아 기뻐요. 감사해요^^
9788990220547,10,전쟁에 관한 소설은 싫어하지만 한번쯤 읽어보고 싶은 책~
9788990220547,8,세상엔 얼마나 많은 전쟁이 존재하는걸까. 도대체 언제까지 울고 다치고 죽어야할까.
9788990220547,10,과테말라 소녀가 학살을 겪으면서 평화에 대해 생각케 한다
9788990220547,8,전쟁이 파괴하는 건 궁극적으로 사람이다. 그런 사람을 치유하는 건 역시 사랑이다.
9788958280842,10,사랑을 어떻게 표현하고 살아야하는지 알 려주는 책.떠나보낸 가족을 품는 법도 알 수 있는 책.
9788958280842,8,메이 아줌마의 죽음으로 방황하는 아저씨와 서머. 다른 사람의 좋은 점만을 보기 때문에 약간의 상처를 갖은 사람들끼리 모여 사는 가족. 하지만 그 중심인 아줌마의 죽음으로 또 다시 내쳐질 것에 대한 두려움에 정작 본인의 아픔에 대해서는 표현하지 못하는 12살의 서머.
9788958280842,8,"큰 사건이나 격한 감정의 동요는 없지만 작은 이야기 하나하나, 따듯하지 않은 구석이 없는 말 그대로 ‘동화’같은 이야기였다."
9788958280842,8,'빨간머리앤'의 느낌이 났다. 가슴 따뜻한 이야기~
9788958280842,10,"전부터 사고 싶었던 책인데 사게 되어 기쁩니다. 
영원한 이별에 대해 따뜻하게 마음을 다스리게 해주길 바랍니다."
9788958280842,10,직접적인 그리움을 표현하진 않지만 그리움이 묻어나는 그래서 더 감동적인 책입니다.
9788958280842,10,아이의 감성을 자극하게 하는 책이네요. 제가 읽어도 뭉클합니다.
9788958280842,10,진심으로 누군가를 떠나보낸 사람에게는 이 책이 위로가 된다.
9788958280842,10,별표를10개줬음하는책..사랑이이런거라면기분이너무좋을책^^이거야말로권장도서^^
9788958280842,8,"가슴 따듯해지는 책, 마지막 서머가 울때 같이 나도 모르게 같이 울게 되더라구요."
9788958280842,10,죽음을 받아들이는 어른아이과 아이어른이 함께 하는 가슴 따뜻한 성장기.
9788958280842,10,학습지에 나오는 내용을 읽고 주문했는데  우리아이들이 참좋아하네요
9788958280842,10,"공지영 책 속에 나와 구입, 뉴베리상 수상작이라 기대도 충만한 사계절1318시리"
9788990878120,8,개인적으로 수지모건스톤의 책을 좋아합니다 무척 섬세하지요
9788990878120,10,예비 중학생 딸아이를 위해서 샀는데 단숨에 읽었다.
9791160947069,10,"스토리 전개에 흡입력이 있다, 좀비소설이지만, 우리사회의 모습을 잘 담아내어 단순한 SF가 아닌 생각할 거리가 많은 작품이다! 영화화 되면 좋겠다는 생각을 읽는 내내 해봤다!"
9791165700416,10,청소년 시집입니다. 추천도서!
9788954442619,10,"문 열었습니다, 갈 곳 없는 사람들 모두 들려주세요!우리 동네엔 작은 카페가 무척... 없습니다. 그나마 있는 카페는 이디야, 편의점은 모두 소주 까시는 할아버지들 차지라 갈곳이 없어요! 그래서 차렸습니다. ‘카페, 공장‘ 누구든지 대환영! 가격도 저렴저렴 맛도 킹왕짱! 이러면 놀러올 수 밖에!"
9788954442619,10,"아직 꿈이 없어 방황하는 청소년들에게 추천해주고 싶은 책입니다. 그리고 자신이 가진 꿈을 이루려, 나아갈 힘을 얻고 싶은 사람에게도 추천하고 싶은 책입니다. 이 책은 복잡한 표현이 없고 객관적으로 사건을 전개하고 있어서 누구나 쉽게 읽을 수 있을 것 같습니다."
9788954442619,10,"기타부기셔플, 재밌게 읽어서 바로 구입했어요. 기대됩니다용"
9791190147149,10,청소년 문제를 잘 나타내 주는 책인거 같다꿈을 향해 달려가는 재석이를 보면 가끔 부럽다
9788936459147,8,"레즈비언 작가의 자전적 성장기. 피겨 스케이트와 첼로, 미술까지 그래도 폭넓게 여러가지 예술을 배우며 성장한 환경이 부럽기만 하다."
9788936459147,10,이미 누군가를 한참 좋아하면서도 더 좋아하고 싶어서 끙끙 앓곤 했던 나의 청소년기를 떠올리게 됐다. 소수자 정체성으로 인해 배척당하는 성장기를 지나온 이들이라면 이 만화를 읽을 뿐만 아니라 한 컷 한 컷 만지며 읽게 될 것이다. 촘촘하게 분절된 장면마다 내 이야기가 아닌 것이 없었다.
9791170440154,10,"보호받아야할 가정, 그 안에서  본인들이 겪고있는 일들이 폭력과 학대라는 사실 조 차도 모르는 어린아이들, 부모의 잘못임을 알면서도  신고할 수 없는 청소년들의 이야기를 현실성있는 열린 결말로 잘 풀어낸 책이네요. 청소년 소설이지만 모든 어른들에게 필요한책입니다."
9791189228767,10,안녕은 갈 때도 안녕 다시 만나도 안녕!
9791189228767,10,"유익하다. 예비중학생 조카에게 선물허려고 샀는데, 앉은 자리에서 다 읽을 정도로 재밌고 신선하다! 청소년들에게 추천!"
9791189228767,10,"교과서에 나오는 시도 읽고, 자연스럽게 풀어가는 이야기도  읽을 수 있어서 1석 2조!"
9791186979969,10,"내 삶속으로 난민이 들어오면 어떤 일이 일어날까? 사실 우리는 난민이든 성소수자이든 내 삶속으로 그들이 들어오기 전까지 고민하지도, 심지어 관심을 갖지도 않는다. 청소년 독자가 자연스럽게 난민이 내 친구가 된다면 어떤 일이 일어날까 생각해보도록 하는 책이다."
9791189228576,10,"청소년을 위한 시 모음집이지만 청소년 뿐만 아니라 사회 초년생, 공시생 등 각자의 앞으로 미래를 위한 새로운 도전을 준비하는 모든 이들에게 위로가 되는 글인것 같습니다. 하루의 시작을 활기차게 응원의 기운을 받고, 하루의 마지막을 포근히 위로해주는 이책을 세상에 탄생시켜주셔서 감사합니다"
9791189034122,10,"비단 ‘사춘기 문예반‘ 에 있는 아이들 뿐만이 아니라, 글을 쓰는 우리 모든 인간에게 전하는 위로와 격려, 희망의 글."
9791189034122,10,사막 같은 세상을 헤쳐나가는 소녀의 눈부신 삶의 투쟁을 바라보면서 응원의 박수를 치지 않을 수 없다. 상처 입은 영혼을 치유하는 글쓰기의 힘을 선우는 우리들에게 온몸으로 보여준다. 이 소설은 지독한 희망을 노래한다. 절망적인 환경일지라도 천일야화의 세에라자드라는 이야기꾼을 꿈꾸며!
