ISBN13,rating,review
9788954625241,8,"미디어 계통에서 막내로 일해온지도 1년이 넘었다. 일을 하면 할 수록 진짜 중요한 뉴스는 무엇인지 잘 모르겠다. 오늘도 포털에는 기사들이 쏟아지고 있고 지금도 우리는 지하철 안에서 멍하니! 기사를 (읽지는 않고) 훑는다. 이것이 진짜 뉴스일까. 나만의 기준, 유연한 생각들이 필요한 때이다."
9788954625241,10,"기본적으로 뉴스 소비자들을 위해 쓰여진 책으로 훌륭하나, 저자가 주장하는 몇몇 내용은 오히려 미디어 종사자들에게 권하고 싶다."
9788954625241,10,알랭 드 보통을 좋아하진 않지만 그 전 <불안>을 좋게 봤다. 아침에 눈 뜨면 뉴스 기사부터 확인하고 하루 종일 뉴스를 신경쓰는지라 이 책도 구입하게 됐다. 기대되는 책.
9788954625241,8,"사건.사고,연예,오락,문화,날씨,스포츠 등이 매일 뉴스거리로 대중들을 사로 잡습니다.특히 정치,군사,외교와 같은 뉴스는 과연 진실을 담고 있는 것인가에 대해 회의를 느낍니다.국가이익을 위한 것은 수긍이 가지만 정파논리로 일관한다면 시대착오요, 수구적인 발상이기에 옥과 티는 잘 가려야겠죠."
9788954625241,6,현대인에게 필요한 조언을 해준다. 하지만 그 뿐인듯
9788954625241,10,뉴스의 홍수 속에 살고 있는 현실에서뉴스 사용설명서라는 단어를 보는 순간...이거다~라고 외쳤던...거리를두고 검토할 줄 아는 지성이라니.....
9788954625241,10,무차별적정보의 홍수속 휘들리지않는 직감이필요할듯
9788954625241,10,알방적으로 전달되는 뉴스의 홍수 속에서 그 뉴스를 바라보는 혜안과 분석.판단하는 예리한 통찰력의 필요성을 일깨워주고 있어서 좋아요.
9788954625241,8,기사 범람 시대에 무차별적 정보에 매몰되지 않는 방법을 쉽고 재미있게 풀어 놓은 책입니다. 한 번에  읽을 수 있을 정도로 가볍고 흥미롭습니다. 책 표지 그림은 내용을 압축해 놓은 것으로 압권입니다.
9788954625241,8,우리가 매일 보는 뉴스를 보고 그것들을 당연하게 받아들이는 우리들에 대해 날카로운 통찰력을 가짐에 대해 이야기하고 있는책~~
9788954625241,10,"그동안 우리가 무비판적으로, 무의식적으로 받아들였던 뉴스에 대한 알랭 드 보통의 날카로운 통찰이 빛난다. 스마트폰으로 뉴스를 보며 하루를 시작하는, 습관적으로 뉴스를 확인하는, 모든 현대인을 위한 뉴스 매뉴얼."
9788954625241,10,"이제는 지쳐서 뉴스를 열심히 보기보다는 흘리면서 듣게 되는 요즘.‘사실’보다 더욱 중요하고 배워야 하는 건, 그러한 일련의 사건들이 ‘의미하는 바’이다!라는 책 서문에 깊은 공감을 표한다!"
9788954625241,10,"어디에서나 스마트폰으로 뉴스를 검색하고, 뉴스에 의해 실시간 검색어가 여론을 조장하는 이때,좋은 책이 나온거 같아 기쁩니다.무엇보다 통찰력과 냉소적인 유머가 있는 알랭 드 보통이 쓴 책이라 두말 할 거 없이 주문했습니다.제가 보통 아닌 보통의 호독자(호구 독자)라는 건 함정..."
9788954625241,10,우와!! 요즘 시대에 꼭 읽어야할 책인 것 같아요!!! 정독하겠습니다!
9788994103471,10,"우리 사회에 존경할만 한 분이 많이 계시다는 데 아직은 살만한 세상이 아닌가 여깁니다. 판사님 말씀처럼 아이들의 잘못이 아닌, 우리 사회가 아이들에게 정말 잘못하는 게 많다는 생각이네요. 눈물을 한 바가지나 흘리면서 읽었습니다. 가슴 따뜻하면서 마음 아픈 책이었습니다."
9788994103471,10,"˝세상에 나쁜 개는 없다˝의 인간 청소년판. 애들이 문제가 아니라 사회가 문제다... 그동안 청소년 문제에 전혀 관심이 없었는데, 이 책을 읽고서는 한국 사회의 미래를 위해서라도 더 많은 이들이 조금이라도 더 방황하는 아이들을 달래고 안아줬으면 싶다. 천종호 판사님, 감사합니다."
9788994103471,10,티비에서 재판을 받던 청소년들에게 단호하게 호통을 치던 천종호 판사. 그러나 그의 책을 보면 그가 얼마나 따뜻하고 아이들을 사랑하는 사람인지 금방 깨닫게 된다.
9788994103471,10,천종호 판사님을 닮고자.
9788994103471,10,최고십니다진정한 사랑을 실천하시는판사님을 존경합니다
9788994103471,10,숨어 있는 대한민국의 영웅 이야기.
9788994103471,10,보면서 몇번을 울었어요 아이들을생각하는 판사님의 진심어린마음이 책에 고스란히 담겨있는것같습니다 답답한부모님사연 가슴아픈사연도 정말많아 더욱 안타까웠고 저같은 사람은 생각치도못한 아이들의 깊은내면을 보듬어주시는 판사님이 정말 존경스러웠습니다
9788994103471,8,"정말, 진실로, 우리가 미안하다. 선의의 개인에 대해 존중하고 지지하는건 맞다."
9788994103471,10,아이들의 이야기에 가슴이 먹먹해지고 판사님의 명석한 판결에 가슴뭉클해지는 눈물없이 읽을수 없는 책입니다. 부모와 아이가 함께 보기를 희망합니다.
9788994103471,10,책을 보면 정말 다양한 느낌을 받을 수 있어요
9788994103471,10,"학교폭력이 꼭 아이들만의 문제인줄알았는데 이책을 읽고나서 아이들이 아닌 우리 어른들이
더욱더 문제였다는걸 느끼면서 한편으로는 반성을 하게뎐다"
9788994103471,8,SBS 학교의 눈물을 비롯해서 청소년을 다룬 다큐멘터리를 보면 등장하는 분이다. 청소년에 대한 애정어린 모습이 글에서도 보여진다. 청소년에 대한 관심이 있다면 일독을 권한다.
9788994103471,10,청소년기의 아이를 둔 부모나 청소년들은 꼭 한번 읽어봐야 할 책.아니 어른이나 아이들이나 모두가 읽어보야할 책이다. 소년범을 만드는 것은 사회나 가정 어쩌면 우리 어른들의 문제다.그들을 다시 뛰게 하는 따사로운 시선을 느껴보라.
9788994103471,10,우리 모두 학교에서 일어나는 폭력의 피해자였다. 폭력의 직접적인 피해자가 아니어도 그것을 어쩌지 못했던 무기력과 비겁의 기억 역시 상처다. 이 따뜻한 책으로 인해 벌어진 상처가 아무는 기적이 일어날 것이다.
9788994103471,8,"책을 읽는 내내 마음이 아리고 눈시울이 젖어들었다. 판사님의 엄격함과 따스함에 박수를 보낸다. 누구도 돌아보지 않는 곳, 누구도 돌보지 않는 아이들을 향한 진심어린 열정과 헌신이 깊은 감동을 안겨주었다."
9788994445328,8,"배경지식이 없는 사람도 읽을 수 있도록 조금 더 쉽게 쓰여졌으면 좋을 듯하다. 개인적으로 교육과정의 지역화, 분권화, 자율화 개념이 헷갈렸었는데 명확해져서 좋았고 자율형 사립고의 문제점도 더 분명하게 알 수 있었다. 국립대학통합네트워크는 구현되면 참 좋겠지만 갈 길이 멀게 느껴진다."
9788959065851,6,"내가 접하는 권력자는 직장 내 상급자인데 그들은 왜 한결같이 공감능력이 떨어지는 지가 의문이었다. 공감 능력이 결여된 사람들만 위로 올라갈수 있는가 라는 의문을 풀기 위해 이 책을 읽었는데, 답은 권력을 갖게 되면 주위에 공감을 할 필요가 없어져 공감 능력이 퇴화되는 것이라 한다.."
9788959065851,6,한 사람의 인격을 시험해보려면 그에게 권력을 줘라
9788959065851,10,"이랗게 방대한 사설, 기사, 인용문을 끌어와 글을 쓰는 저자는 강준만밖에 없을 것이다. 개혁은 개혁으로만 끝나야 한다."
9788959065851,6,별로입니다. 지루하고 내용없음.
9788959065851,10,과연 좌파와 사회주의자들은 깨끗한가? 맹목적 지지자들은 좀 읽어보셔야 할 듯
9788959065851,8,개혁의 주체는 왜 비판받아서는 안 되는가?
9788959065851,2,개혁을 원하면 개혁할 대상을 찾길.개혁하려는 대상을 밟아대지 말고.
9788959065851,6,"개혁에 동조하는 듯하지만 언제나 개혁의 객체보다 개혁의 주체를 비판하기 바쁜 그, 강준만. /권력만이 사람의 뇌를 바꾸는 게 아니다. ‘나이 듦’도  사람의 뇌를 바꾼다. 강준만 당신이 그 좋은 예가 아니겠는가./부디 홍세화와 앞다퉈 ‘이 시대 최고의 변절자’ 칭호를 쟁취하기 바란다."
9788959065851,10,이거 정말 딱 어느 정부만 말하는거 같지 않을거같아서 꼭 읽어보고 싶네요 . 주변에도 완장하나 차면 자기가 엄청 대단한?사람인듯 한 분들이 많아서 생각나면서 비교하면서 읽어보면 될 것 같아요
9788959065851,10,읽어보고 싶다
9788959065851,10,"권력=돈=지위=인종주변에서 어려운 시험에 합격하거나, 돈을 많이 벌거나 할때 갑자기 바뀌는 사람들을 많이 봤다. 아마도 감당할 그릇이 안되는 사람이 지위가 바뀌여서 그런듯 하다."
9788959065851,6,목차만 봐도 .재밌어보인다.
9791196585983,10,"<자본> 읽을 때처럼 머리보다는 마음이 많이 움직였다. 플랫폼기업 역시 노동자들의 피와 살을 갈아넣은 신기루라 생각하니 서글펐다. 자본은 기상천외한 방법을 발명하고, 이를 막을 법 한줄 제정되기는 쉽지 않다. 배달라이더들을 다른 시선으로 볼 수 있게 되었다. 노동자인 내 정체성도 되새기고."
9791196585983,10,"플랫폼이 창조하는 극악한 자본주의적 현실을 노동자가 직접 부딪히며 기록했다. 4~6장의 현실감 넘치는 이야기들이 특히 중요하다. 시시각각의 변화 속에서 기관, 언론, (심지어 자본조차도) 정확히 모르는 진짜 노동의 현실이 잘 포착되었다. 플랫폼 노동 팩트 체크 교재로 유용하다."
9791196585983,10,"지금 여기의 플랫폼노동에 대한 가장 생생한 보고서. 다양한 배달 노동의 유형과 플랫폼산업의 구조, 그 문제점에 대한 이야기가 대안까지 제시돼있다. 대안 부분이 좀 어렵긴 하지만, 플랫폼노동과 플랫폼산업이 궁금하다면 반드시 읽어야 할 책."
9791196585983,10,플랫폼 노동자들의 열악한 상황을 알 수 있었다
9791196585983,2,딱히.. 별로네요
9791157831753,10,불편한 이슈를 불편하지 않게 담담한 어조로 서술할 수있는 그 혹은 그녀. 그 사람이 진정 단단한 개인이지 않을까?
9791157831753,8,"‘생각대로 살지 않으면 사는 대로 생각하게 된다’는 말과 같이, 나 자신 오롯한 개인으로 사유하지 않으면 그저 감정과 여론에 휩쓸리는 나약하고 불편한 존재로 남게 된다는 걸 뼈저리게 느끼게 해준다."
9791157831753,10,가장 공정한 위치에서 양쪽을 바라보고 싶다면 읽어봐도 좋을 책. 세상을 바라보는 시각을 개인에게 맞추게 되고 법치의 중요성을 일깨운다.
9791157831753,10,나도 그저 단단한 개인이 되고 싶다.
9791157831753,10,너무나 정상적이고 당연한 말들. 그래서 반가운 말들
9791157831753,8,"좋은 책이다. 정갈하고 논증적인 글쓰기.자신들만의 공동체에서 공감만을 주고받으며 어떤 정책적 대안도 제시하지 못하는 사람(비겁하고, 혐오스럽다.)들이 꼭 읽었으면 하지만, 안타깝게도 그런일은 없을 것 같다는 생각이 든다."
9791157831753,10,꼭 한 번 읽어보길 추천. 왜곡된 공론장에서 이런 의견은 사장되고 감성과 모순으로 뒤덮인 목소리만 가득한데 이 책은 그 와중에 중심을 잡고 헌법적 가치에 눈 뜨게 만든다.
9791157831753,2,‘피해자 서사‘ 혹은 ‘정체성 정치‘는 페미니즘 담론 안에서도 비판되어왔고 지속된 것. 페미니즘의 스펙트럼을 하나로 뭉뚱그려서 페미니스트를 ‘이념에 사고를 의탁한 존재‘로 재현하는 것은 문제적이지 않은가? 작금의 랟펨이 비판받을 지점이 많다는 걸 전제로 해도 이 책은 문제적임.
9791157831753,10,"또 하나 첨부하자면, 성평등과 페미니즘이 같은 말인 줄 아는 착각이나, 둘은 같다는 강압적 주장이 현재의 많은 문제를 야기하는 것 같음."
9791157831753,8,이념에 사고를 의탁하는 사람이 너무 많은 세상에서 한숨 돌리기 위한 서적
9791157831753,10,“결과를 책임지지 않는 극단주의자들이 우리를 대표하게 해서는 안 된다.”(54쪽) 이선옥의 작가의 이말이 내 머리에 각인이 되었었다. 지금 우리 사회는 극단주의자들이 대중을 감정적으로 선동하는 주장을 공론으로 부상시키기 유리한 플렛폼이 형성되어 있다.
9791157831753,10,"혐오와 가짜뉴스가 난무하는 세계에서 살아남는 법을 말하고 있다. 주목할 점은 스스로만 살아남으려는 이기적인 모습이 아니라, 함께 살아남으려는 고심이 담겨있다."
9791157831753,10,"“우리는 좀 더 공정한 방식으로도 약자의 편에 설 수 있다”- 이선옥, <단단한 개인>, p22.작가가 선택한 ‘우리’라는 단어와 ‘~으로도‘로 이어지는 문장은 당신과 내가 놓치고 있었던, 어쩌면 모르는 척 넘기려 했던 가능성 한 가지를 더 일깨워 준다."
9791187289555,10,"독서토론을 핑계로 읽게 되었지만, 그동안 내가 얼마나 무관심하게 넘긴 일 들이 많은지 일깨워 준 책!"
9791187289555,8,보호되어야 하지만 한국사회에서 좀처럼 보호되지 않는 ‘인권‘과 일어나서는 안 되지만 너무나도 흔하게 일어나는 ‘차별‘이라는 두 단어가 제목에 포함되어 있어 눈길을 끌었습니다. 인권에 대해 좀 더 알고싶은 사람은 누구나 읽을 수 있도록 잘 디자인된 것 같아요~
9791187289555,10,"혹시 딱딱하고 어렵지 않을까 걱정했는데, 작가님이 사례를 중심으로 쉽게 쓰셔서 금방 다 읽었어요.  고등학생 정도면 충분히 즐길 수 있는 책인 것 같습니다. 추천합니다!"
9791187289555,10,받자마자 바로 읽기시작했어요~ 시사적인 주제를 담고있어서 상식을 쌓을겸 구입했어요. 잘 읽히게 작가님이 쓰셨어요
9788932916200,10,무엇보다 번역이 좋다. 읽기 편한 번역이다. 역자 소개가 없는데 일부러라도 소개할 필요가 있어 보인다.
9788932916200,10,좀 더 일찍 만났어야 하는 책이었다. 그러나 오히려 지금 읽는 편이 편하다. 이제 우리는 가능하니까. 우리나라의 불평등을 조금이나마 개선할 수 있는 사람이 대통령이 되었으니까. 쉬운 말로 미국의 경제 불평등과 정치 불평등을 써 내려간 석학의 문장의 노련함이 돋보인다.
9788932916200,10,우리가 알아야만고 알아야 대가를 치르지 않을 수 있게 해주는 책.
9788932916200,10,"미국사례가 많은것이 조금 아쉽긴 하지만, 노벨경제학상 수상자다운 석학의 반성적 통찰을 엿볼수 있는 책이다."
9788932916200,8,“1%의 나라 미국”의 민낯을 통계와 사례를 통해 여과없이 보여주는 책이다. 그렇기때문에 너무나 미국과 닮아가는 대한민국의 국민들이 경각심을 가지고 봐야 하는 책이다.
9788932916200,4,미국에 대한 예기를 많이 썻는데 우리나라 현실과 안맞는 부분이 많다!
9788932916200,10,"재벌과 상위 1%를 위해 활동하는 각종 기관, 정치인, 저널리스트들에 의해 사상적으로 길들여진 일반인들이 반드시 읽어야 할 경제학 서적입니다. 다양한 경제 현상에 대한 올바른 이해가 선행되어야 합리적인 선택을 할 수 있으며, 이 책이 그 길잡이가 될 것입니다."
9788932916200,8,불평등의 근원과 현상을 활자를 통해서 여실히 드러내 주는 책.. 현실사회를 고찰하고 나 자신을 다시 한번 통찰하게 하는 책입니다.
9788932916200,10,현실에서 일어나는 복잡한 일들은 그의 머리속에서 쉽게 해석이 되고 또 해석된 그 일들 속에서 무엇이 옳고 틀렸는지 예리하게 짚어내는 그의 학자로서의 재주는 나로하여금 지구와 그 안에 살아가는 지구인이 처해있는 현실을 직시하게 만들었다.
9788932916200,8,"사회과학 서적은 항상 최신의 것을 읽되, 인문학은 고전으로 돌아가라는 말이 있지요. 트레일러에서 생활하는 인구가 폭증한 미국의 현실과 불평등의 참담함을 생생히 느낄 수 있었습니다. 흔히들 미국은 저희 보다 수십년 앞섰다고 하지요. 머지 않은 미래 한국에 관해 생각해 볼 수 있었습니다."
9788932916200,10,ebook으로 보고 있는데.... 보다 보니 책 내용의 모든 부분이 두 번씩 반복해서 나오네요... 보고 있다보면 읽은 부분이 다시 나오고...종이책이 이러지는 않을 것인데..제대로 수정해주세요.
9788932916200,10,갑과 을의 관계가 요새 매우 문제가 되고있죠. 그리고 대기업의 독주나 독재정치를 옹호하는 사람들도 많이 늘어나고있어요. 그러한 불평등을 옹호하는 사회현상에 관심이 깊은 분이라면 한번쯤 읽어볼만한 책인거 같습니다.
9788932916200,10,"열심히 일해도 항상 제자리인 기분, 무언가 잘못되었다는 피상적인 느낌에 이론적인 배경을 제공하는 책이다. 저자의 말대로 정치권과 경제계가 합심하여 만든 불평등한 구조를 개선하는데 이 책이 하나의 돌파구가 되지않을까 싶다."
9788932916200,10,"스티글리츠 교수의 생각이 집대성된 책. 뭉쳐있는 부는 죽음이고, 흩어져있는 부는 생명이라는 오랜 격언을 체계적으로 풀어냈다~! 강력추천 받아 마땅한 책."
9788932916200,10,"부유층은 기득권을 유지하기 위해 끊임없이 새로운 방식의 눈속임과 회유책을 내놓고, 중산층과 빈민층 거기에 말려들고 만다. 시장논리를 앞세워 구축한 비정상적인 평등구조를  돌려놓을 수 있는 방법. 스티글리츠는 이러한 현실을 우리 앞에 적나라하게 펼쳐놓고 그 대안을 함께 고민하자고 말한다."
9788932916200,10,"노벨경제학상을 받은 조지프 스티글리츠 교수가 말하는 경제적 불평등의 문제를 고발하며,(물론 완벽한 해결책은 아니지만) 이러한 문제점들을 극복하고자 대안을 제시한다.(이 책을 읽고 나면 우리가 왜 삼포세대, 기러기 아빠, 일그러진 노인으로 살고 있는가에 대해 알 수 있지 않을까?)"
9788932916200,10,"정치에 의해 시장이 규정되는 전쟁터. 우리 시대. 우리나라에 꼭 맞는.
묘한. 실패의 사례들. 그에 대한 응당한 댓가."
9788932916200,10,"큰 그림으로 보면 상위 1%에게도 하위 99%에게도 기울어진 사회 구조는 치명적일 수밖에 없다. 내가 속한 곳이 몇 %인지를 논할 것이 아니라, 내가 속한 집단이 기형적이고 불안한 양태를 보이고 있다는 위험성을 논한다는 측면에서 이 책은 매우 발전적이다. 스티글리츠만이 내놓을 수 있는 담론이다."
9788932916200,10,값 비싼 대가를 벌써 치루고 있을지도......그렇지만 그 기간을 줄이기 위해서라도 반드시 읽어야 할 책!
9788991799677,8,"헌법이란, 헌법적 사고란 무엇인가... 헌법이 지향하는 민주주의와 인권을 위한 사고방식이란 무엇인가... 많이 배웠다."
9788991799677,6,헌법을 다룬 많은 책들 사이에서 경쟁력을 가지기에는 너무 알멩이가 없다. 외려 청소년 입문서로는 훌륭할 듯. 저자의 분투라는 표지문구에 의문이 생긴다.
9788991799677,10,"헌법을 모두 커버하는 건 아니고, 기본권을 위주로 본인 이야기와 법조계 문화(?) 이야기도 곁들인 헌법에 관한 교양서. 어렵지 않아요."
9788991799677,10,헌법에 관한 책을 이렇게 술술 읽히게 쓰다니
9788991799677,10,쉽게 읽히는 데다 내용이 알찬 책. 처음 읽었을 때 머리를 얻어맞은 듯 멍했던 기억이 난다. 큰 감동을 주는 것을 넘어 내 삶의 태도를 달리하게 만든 책.
9788991799677,10,"사회와 시민의식의 향상에 따른 입법, 사법의 변화에 대해 썼다. 저자는 시민의식의 고양을 통해 법이 더욱 민주적으로 변화되어야 한다고 주장한다."
9788991799677,8,"이제는 고전이라고 불리는, 대한민국 국민이라면 필독서."
9788991799677,10,읽어보아야 할 책
9788991799677,10,솔직하고 과장없는 글로 언제나 삶의 용기를 주는 진짜 교수이다~!
9788991799677,10,학교 독서지정책인데 열심히 읽어봐야겠네요
9788991799677,10,개정증보판이 나왔네요. 교수님께서 이전 판을 가지고 있으면 굳이 안 사도 된다고 하셨지만 사지 않을 수 없게 만드는 ｀마성의 김두식｀교수님의 글. 후회 없습니다.헌법을 쉽게 와닿게 해주는 교수님의 글 강추!
9788991799677,8,법 관련 책은 처음 읽었는데 현실적으로 와닿는 내용이 많아서 유익했습니다. 우리가 당연히 누려야 할 헌법상 보장된 기본권에 대해서 많은 것을 알게 됐습니다.
9788991799677,10,개정증보판이 웬 말인가! 차라리 새 책을 한 권 더 쓰시지! 비슷한 걸 또 사야 돼?
9788991799677,10,"괜찮은 책이 갑자기 반값행사를 오래 하면 이어 개정판이 나오더래요... 이 책도 역시...^^; 증보된 부분 때문에 이 책을 다시 사야 하나, 도서관에서 빌려서 그 부분만 복사해서 소장(?)해야 하나 아주 고민됩니다"
9788984315099,10,내가 걸은 만큼만 내 인생이다...공감가는 제목이다.
9788984315099,8,이제서야 읽게 되어 시대에 안 맞는 부분은 있었다. 그럼에도 시대를 초월해서 여전히 존재하는 문제점들도 있었다. 각 인터뷰이의 개성이 돋보이는 내용이었다. 요즘 청춘이란 단어는 단순히 20대를 뜻하진 않는다. 그만큼 개념은 확장되었고 고민은 더 깊어진 듯 하다. 그래도 한걸음씩 걸어나가자.
9788984315099,8,난 이 시대 청춘들에게 어떤 말로 용기를 줄 수 있을까??고등 필독서인 이유를 알 듯하다.
9788984315099,10,제목이 와닿아서...
9788984315099,10,힘들고 어려울 때 크게 힘을 얻게된 책이다.
9788984315099,10,"즐겁게 읽고, 좋은 깨달음을 얻을 수 있는~ 지혜를 보는 시간!"
9788984315099,8,"가끔 가슴이 답답할때 읽으면 좋은책이다.
먼저 태어나서, 먼저 고통을 겪어본 선배들의 실패담은 언제나 위안이 되고, 
나의 방향이 옳은지 다시금 판단해보는 나침반과 같은것 같다."
9788984315099,8,"일부를 빼면, 전체적으로 좋은 강연들이었습니다. 해가 바뀔 때마다 강연자들도 조금 다양하게 모시면 좋을 텐데요.. 잘 읽었습니다~."
9788984315099,10,딸아이 학교 선생님께서 추천 해 주신  책입니다.
9788984315099,8,젊은이나 청소년에게 삶의 방향을 제시해주는 책.이시대의 멘토들에게 듣는 올바른 삶의 자세와 지혜.
9788984315099,10,"지난 봄 공원에 갈 적마다 꼭 들고 가서 햇빛받으며 읽던 책. 표지가 정말 잘 어울리고요, 또한 생각이 젊어진다는 느낌이 들어서 좋았습니다~두고두고 읽어도 좋을 책이네요"
9788984315099,10,할인해서 e북으로 읽어봤어요요. 언제나 그렇듯 통찰력있는 조언을 명쾌하게 해주셔서 감사해요. 세상을 보고 제 자신을 탐색하는데 김어준님의 시각이 도움이 많이 되네요.
9788984315099,10,"김어준의 조언에는 진심이 있다. 듣기 좋게 포장된 다른 이들의 감언과는 다른 그것이 있다. 그것을 느껴보자,"
9788984315099,10,뇌과학자에게 듣는 조언들. 추천한다. 저자 정재승은 과학콘서트를 통해 알게 되었다. 이 책도 재밌다.
9788984315099,8,"내심 기대했지만, 그 이상의 수확이 있었던 책. 아마도 강연자의 진실된 삶과 마음이 그대로 전해져서가 아니었을까?"
9788984315099,10,나는 걷겠다
9788984315099,10,모든 것이 정치적이다.
9788984315099,10,남은인생 조금은 새롭게살아보고싶다는 생각이드는책...
9788984315099,10,한겨레 특강 시리즈는 나올 때마다 상당한 만족을 준다. 특히 김어준 총수의 강의는 폭소 그 자체이면서도 알맹이는 가볍지 않다. 청춘의 시대를 경험한 이들의 다양한 이야기에는 언제나 배울 점이 있다는 것..
9788984315099,10,강의를 그대로 옮겨 적어 귀에 쏙쏙 들어오네요. 사회자까지 포함하면 8명이 펼쳐놓는 입담이 보통이 아니군요^^ 일단 재밌습니다.
9788984315099,6,"조지오웰이 얘기했듯이, 좋고 나쁜 느낌은 주관적이고 그 이유 대기는 대개 합리화이다. 정재승 강연은 볼 만 하고, 김어준은 매일 비슷한 얘기, 나머지는 그닥 와닿지 않는다"
9788984315099,8,재밌네요
9788984315099,10,정말 좋았습니다. 많은 청춘들이 꼭 읽었으면 합니다.
