ISBN13,rating,review
9791163940166,10,"[지도로 읽는다 한눈에 꿰뚫는 세계지도 상식도감] 학교에서 가르쳐주지 않는 의외의 지형과 국경선 땅의 놀라운 현상과 기후의 비밀 오랜 세월이 흘러도 되풀이 되고있는 민족과 종교 분쟁의 지정학적 원인 세계지도를 펼쳐놓고 찬찬히 들여다보면 우리가 살고 있는 지구에 대해 우리가 알고 있는 것들이 생각보다 많지 않다는 사실을 깨닫게 될것입니다 이책을 통해 키리바시, 나우루, 투발루 발트해 연안에 러시아 본토와 뚝 떨어져 있는 칼리니그라드 날짜 변경선은 왜 직선이 아닌지, 터키는 유럽인지 아시아인지, 미국의 ‘데스밸리’는 어떻게 해서 ‘죽음의 계곡’이 되었는지 찬찬히 살펴보다보면 머릿속에 세계지도 지형을 단단히 새기게 될것입니다"
9788967356040,10,"훌륭한 책으로 알려져 있는건 확실함. 그러나 1장부터 읽어보면 도대체 뭔소리를 하는지, 뭘 얘기하고자 하는지 감이 안오는건 나의 이해력을 탓해야하겠지..ㅠㅠ"
9788962914412,10,"도서관에서 보고 너무 유익한 책인 것 같아 아예 구입합니다. 공부하려고 스프링분철 주문했습니다. 저자분들께서 비교적 최근의 모습으로, 우리나라 곳곳을 답사하시고 쓴 내용으로 되어있어서 고리타분한 한국지리가 아니라 현실적으로 접할 수 있었습니다. 내용은 어렵지만 사진이 많아서 좋았어요."
9788962914412,10,"지리학 전공자가 아닌데도 저자의 꼼꼼함에, 저자가 우리 국토를 바라보는 시선에 얽혀있는 다양한 이야기에 나도 모르게 빠져들게 됩니다. 사진이 다양한 것도 정말 좋고요! ‘국토‘에서 시작해서 이렇게 생각해볼 거리를 많이 던져주는 책이 또 있을까 싶네요."
9788962914412,10,지리학을 통해서 토론해 볼 가치가 있는 사회적 쟁점들까지 돌아본 책이네요.
9788962914412,10,이해가 쉽고 그림이 간간이 있어서 좋네요 ㅋㅋㅋ
9788962914412,10,교재로 구입했는데 딱딱한 교과서만 보다가 도시의 숨은 이야기를 함께 공부하니지리가 입체적으로 다가옵니다.이번학기의 큰 수확은 이 책일 것 같아요.
9788962914412,10,내용이 어렵지 않고 쉽게 이해되네요. 벌써 저도 지리학자 된 것 같아요^^ 저자가 신경 많이 쓴 게 느껴집니다. 다른 사람한테도 추천합니다!
9788994597690,8,"영적이기보다 속세적인 -정치, 경제적인-시각으로 보는 종교입니다. 단순명료하고 이해하기 쉽게 써서, 이미 깊은 지식이 있으신 분에겐 단락적으로 보인 듯 합니다. 하지만 여러 종류의 종교를 다루고 있으니 담고있는 지식량은 적지 않다고 생각합니다."
9788994597690,8,가짜를 가려낼 눈을 키워주네요. 젊은이들이 많이 봤으면 합니다.
9788994597690,10,사진자료가 많고 서술이 명료해 기대됩니다
9788994597690,8,"대표적인 종교들에 대해 모르고 있던 내용들이 읽기 쉽게, 보기 편하게 정리되어 있다."
9788994597690,8,역사라면 무작정 끌립니다.그래서 이책은 기대도 컸구요. 읽는내내 종교에 대한 관심이 달라졌고 이런쪽 책에 흥미도 느꼈습니다. 재미있게 읽었습니다. 참 고맙습니다.
9788994597690,10,지도가 참 인상깊어요.나는 잡지 말고 책에서는 이런 지도를 처음보았는데 책을 읽는 재미가 쏠쏠합니다.
9788994597690,10,세계 5대 종교 흥미롭게 잘 읽었습니다. 전혀 종교에 관심이 없던 이들이라도 쉽고 편하게 읽어 나갈 수 있는 책이라 생각합니다.
9788994597690,10,<미스터리 세계사>를 재미있게 읽고 반해서 또샀습니다. 세계 5대 종교를 잘 정리해서 요점만 알려주고있습니다. 좋은 책이라고 생각합니다.
9788994597690,10,대표적인 5개 종교에 대해 전체적인 그림을 그릴수있는 책으로 참 재미있게 읽었다. 쉽고 간략하게 각 종교의 특징을 다루고있고 그림과 지도가 있어서 흥미롭다.
9788994597690,4,뭘 말하고자 하는지 모르겠다 부처가 비쉬누신의 현신으로 만들어지면서 불교가 약해진 인도 . 유대교 기독교 이슬람의 차이도 정확히 다루지 못 했다. 이밖에도 답답한 내용 으로 책을 읽는 동안 내가 이 책을 왜 샀지라는 생각을 많이했다
9791159090332,10,일본은 독도에 한국이라는 주인이 있음을 1904년 이미 확인했다. 독도라는 명칭을 가진 한국이라는 주인이 존재해 있었던 것이다. 그러나 일본은 태평양전쟁 이후에도 독도영유권을 결정하는 과정에서 연합국 측에 그 사실을 숨겼다. 이러한 새로운 사실로 독도는 결국 한국 땅이라는 사실을 증명한다.
9791159090332,10,이 책을 통해 2차 대전 후 독도문제에 미국이 많이 개입한 것을 처음으로 알게 되었다. 일본이 미국의 일부 문서만 인용하여 독도가 일본영토가 되었다고 우기는 것도 이해되었다. 그러나 이 책에서 일본이 숨기는 미국 측 문서가 공개되었다. 독도가 한국영토라는 사실은 결코 변하지 않는다
9791159090332,10,"이 책은 대한민국 국민이라면 누구나 읽어야 할 책이다. 이 책으로 독도문제를 쉽게 이해할 수 있게 되었다. 그리고 독도가 단순한 역사나 영토의 문제뿐만이 아니라 한국의 지리적 위치, 미국과 일본의 해양 전략 등으로도 이해해야 하는 중요한 문제라는 점도 쉽게 알 수 있었다."
9788958626725,10,요즘에 역사에 관심을 가지게 됐는데 세계를 읽는 핵심 키워드를 알려준다고 하니 키워드가 뭔지 굉장히 궁금합니다. 구매해서 읽어봐야겠습니다.
9788958626725,10,세계정세를 한눈에 볼수 있어 매우 유용한 책입니다
9788958626725,10,"분단의 아픔은 어디까지 배태되어 있는가. 생각하건데 '남한'이라는 섬에 갇혀, 변하는 세계의 흐름을 놓쳐버린 것이 아닐까 싶다."
9788958626725,10,"르몽드세계사 1.2 를 읽으셨다면 기다리고 있던 책이 나왔다. 세상이 어떻게 흘러왔고, 현재는 어떤 상황이며 미래에는 어떤 모습일까? 궁금하다면 르롱드세계사 3을 추천합니다."
9788975993404,10,좋아요~!! 대학 교재인데 그냥 심심할떄 읽을만하기도 하고
9788988791479,10,임용준비하면서 구매했습니다. 도움이 많이 돼요.
9788988791479,8,이희연 경제지리학 책에 없는 내용이 많이 나옵니다. 신산업지구 부분이 괜찮습니다.
9788962918328,10,"진짜 재밌고 훌륭한 책이에요. 한 챕터가 짧아서 겉핥기 식이 아닐까 했는데, 전혀 아니에요. 간결하고 이해가 쉽게 되는 설명!! 초보자부터 매니아까지 다 만족시킬 수 있는 책이에요."
9791187147411,8,공부를 하고 여행을 떠나면 의미있는 여행을 할 수 있다
9791187147411,10,"‘나‘ 중심의 여행 패턴에서 벗어나 그곳의 사람과 문화를 있는 그대로, 오감으로 느껴야 한다는 작가님의 말씀에 공감이 되네요! 불편한 것은 불편한 대로, 낯선 것은 낯선 것 그대로 경험하고 받아들이려는 태도가 중요한 것 같습니다. 나는 어떤 여행자인가를 되돌아보게 하는 좋은 책입니다."
9791187147411,10,대부분의 여행도서들과 달리 저자는 독자들에게 저자의 경험이 아닌 방법을 전달하고자 한다. 여행을 떠나게 될 혹은 여행 중인 당신들에게 새롭고 또 새로운 여행을 경험하고 겪게 만들어 줄 ‘지리학자의 인문여행‘
9791187147411,8,"내가 읽은 책은 그림이나 사진이 없는 58쪽의 더미북이라서 전체적인 평을 하기엔 부족한 감이지만, 지리학자인 저자가 여행지를 결정할 때 지리학적 지식을 활용하고 또 이를 바탕으로 장소의 구성요소들을 발견하고 확인해가는 재미와 여행이라는 경험을 통해서 앎의 경계를 더 넓혀가는 과정을 담고"
9791189159184,10,"우선 서문에 지정학이란 무엇인가에 대해 여러 학자들의 설명과 과정이 나온다. ‘지리학 정치학‘을 더한 이 학문에 관심이 많다면 읽어볼만하다. 그리고 본문에서는 전세계 문명의 유형, 이주민의 증가, 분쟁지역(카슈미르 등), 자치권이나 독립을 주장하는 지역, 중국의 일대일로, 내정간섭 등이 나"
9791187373797,8,"거제 조선소의 생산관계 변화에 주목합니다. 제조업이 약화하니 ‘4차 산업‘에 치중하자는 담론도 있지만, 펀더멘탈로서 제조업은 여전히 중요합니다. 그래서 어떻게 변모해야 할지 나름의 의견을 제시합니다. 산업-경제적인 부분도 흥미롭지만, 거제의 지역성을 다룬 부분도 흥미롭네요."
9791187373797,10,중공업 가족의 유토피아 - 산업의 발전과 흥망 그리고 그 산업이 엮여 있는 도시의 이야기.
9791160944099,10,"꽤 재밌어요~~남한을 넘어 북한, 한반도의 행정구역과 지역특징을 알 수 있어서 좋아요~~색칠도 해 볼 수 있어서 만족스러워요~"
9791160944099,4,"개인적으로 북한의 지형과 행정구역까지 색을 칠하며 위치를 알 수 있다는 것도 좋습니다. 다만 굳이 현정부의 정상회담 사진을 컬러링으로 하게끔 했어야하나 싶으며, 북한에 대한 정보를 아는 것도 중요하지만 북한이 핵무기를 포기했다라는 정보가 담겨있어 당황스러웠습니다."
9788965134770,2,한국이 쌀 이모작에 특히 유명하다질 않나 콜럼버스 얘기에 갑자기 아무말 하면서 어차피 누군간 그랬을거라지 않나ㅋㅋ 글쓴이 진짜 세계지리나 역사을 아는 사람 맞나? 그냥 관심 좀 있는 프랑스사람(것도 꽉 막힌 1세계 백인 중노년 남자)가 쓴 냄새가 팍팍 난다
9788965134770,10,지리책인가?역사책인가?요리책인가?든든하게 먹고읽어야하는책인듯
9788958623472,10,요즘에 역사에 관심을 가지게 됐는데 아프리카에 대해서 알아보고 싶은데 좋은 책이 있어서 기대가 됩니다.
9788958623472,10,"두번째 시리즈 구매입니다방대한 양인만큼 전세계의 대한 경제, 격변하는 흐름 등 여러 분야에 걸친 내용이라 이 책으로만으로도 충분히 세계 정세를 충분히 파악할수 있습니다"
9788958623472,10,르몽드 디플로마티크에서 국제분야를 간추리며 더욱 살을 붙여 만들어 졌다. 좋은 책
9788958623472,10,"현대사의 전반을 볼 수 있는 책이며, 특히 아프리카에 대해서 잘 알수 있었다."
9788958623472,8,21세기 현재 세계적으로 발생하고 있는 문제와 자원을 둘러싼 세계 각국의 이해관계를 한 눈에 파악할 수 있는 좋은 책이다.
9788958623472,10,르몽드 시리즈는 전 권을 구매하고픈 책입니다. 그중 가장 읽고 싶었던 2권을 구입했습니다. 정치지리학적인 프랑스의 사고를 읽을 수있는좋은책입니다. 그림으로 설명이 나와 아프리카와 세계의현실을알수있습니다
9788958623472,10,1권보고 좋아서 2권도...
9788958623472,10,어른을 위한 사회과부도 그 2판! 재미있게 잘 봤습니다. ^^
9788958623472,10,새로운 국제 역학관계를 한 눈에 들여다 볼 수 있게 한 책. 좋다
9788958623472,10,아프리카를 다시 보다.
9788957337103,10,역사와 사회에 대해서지정학적 사고를 가지고 세계 여행을 떠나자!한반도에 도착한 우리의 시선은 전략적인 판단으로 오늘과 내일을 바라본다.
9788957337103,8,"당연한 이야기지만, 한반도 지정학이 한반도에 국한 되지 않는 것이라는 점에 주목한다. 세계의 지정학 내에 한반도 지정학을 점검해보는 시간이 된다."
9788957337103,8,"지정학 공부를 위해 읽기 시작한 책. ‘한반도 실존 세계사‘라는 리뷰글에 꽂혀 구입했는데, 역시나 좋았다."
9788989566793,10,홍지수라면 언제든
9788946066946,10,도시의 건설을 중심으로 풀어나간 흥미진진한 한국 근대사다외국과 고대사만 알고 정작 근대사는 아는 것이 없었다는 귀중한 깨달음을 주는 책.
9788997454303,10,"Geography : 지리학, Geopolitics : 지정학  책제목을 ˝정치지리˝ 라고 하면 좋으련만."
9788962914658,10,우리 주변에서 쉽게 접할 수 있는 공간과 건축들이 가지고 있는 의미들을 지리학자의 시선으로 쉽게 읽을 수 있는 책
9788962914658,10,받자마자 바로 읽었습니다. 정독했더니 하루가 갔네요. 그럴 정도로 집중력있게 보도록 만드는 책입니다. 공간을 바라보는 데에 새로운 시각이 생기는 듯합니다. 그리고 건축이라는 분야에 대해 너무 어렵지 않게 일상을 편히 바라보게 해 주는 책인 것 같습니다. 도움이 많이 되네요.
9791196412104,10,"세계지리,경제,사회 관계에 대한 흥미로운 영상을 본 느낌. 가장 기억 남는 에피소드는 아일랜드의 감자기근으로 많은 아일랜드인이 식량난으로 인구이동이 일어났고 그 중 미국으로 건너간 아일랜드인의 후손 중 4명이 미국대통령이 되었다는. 오바마 포함."
9791196412104,10,주제 하나하나가 흥미롭고 내용이 짧아서 금방 읽을 수 있었다. 지도나 도표 같은 그림이 많아서 보는 재미도 있다. 책을 다 읽고 나니 세계경제와 지리에 대해서 아는 척할 수 있을 거 같은 자신감이 생긴다.
9791196412104,10,"TPP를 트럼프가 왜 탈퇴했을까? 라는 소제목에 이끌려 산 책. 자원 및 입지가 국가 경제에 알마나 중요한 것인가 깨닫게 해주는 책. 최근 우리나라 위치는 기획부동산에 단군이  사기 당한심이라는 드립을 본 적이 있는데, 그럼에도 이정도 일군 것을 보면 대단한 국민들이라는 국뽕이 차올랐다. ㅎㅎ"
9788962914597,10,"세계화 시대 변화하는 국경의 의미와 과연 경계란 것이 우리에게 어떤것인지 이해할 수 있도록 도와주는 책입니다. 번역서이지만 번역자분들이 노력을 많이 하셨는지, 파트별 번역 수준의 차이도 없고 글도 수월하게 읽을 수 있습니다.이런 질 좋은 번역서들이 많이 나오면 좋겠네요."
9788989566724,4,헝가리 출신이라 그런지 유독 한국에 호의적인 인상...
9788972219903,10,"대동여지도가 책으로 나온 것을 인터넷으로 우연히 접한 날, 난 주저할것 없이 당장 주문했다. 더욱 신기한것은 그날 저녁에 배송되어 책을 만날수 있었다는것이다. 설레는 마음으로 한장한장 넘겨가며 탐색했다.실제 목판으로 인쇄한 크기대로 실려 있었고 옛지도의 우리 땅은 정교했다."
9788972219903,10,대동여지도를 직접 만들어 볼 수 있어서 흥미롭네요. 아이들과 함께 만들어 보면 좋겠어요.
9788972219903,10,"인문지리 정보가 모두 담겨있는 책 ‘한글 대동여지도‘ 는 흙속 진주같은 시간속 책으로, 자신만의 채색본으로 나만의 대동여지도 전도를 만들며, 아이들 가슴엔 꿈과 희망의 파란싹이, 성인들 에게는 흥미로운 자극제가 되는 멋진 책 한권이 되는 뜻 깊은 시간이 될것 같아 기대감을 더해 줍니다."
9788972219903,10,위대한 결실인 우리의 고지도 대동여지도! 한자와 익숙치 않은 기호로 어려운데 한글과 설명으로 친근히 접하고 직접 채색하는 정말 유익한 경험 될 것 같네요.
9788972219903,10,고산자 김정호의 노력과 정신이 담긴 우수한 대동여지도를 한글로 쉽게 접하고 직접 만들어 볼 수 있는 좋은 기회네요.
9788972219903,10,한국인이 전국 방방곡곡을 돌펴 이렇게 상세하고 비교적 정확한 지리정보를 통해서 지도를 만들어낸것은 지금도 대단하다는 생각이 듦니다. 사후에 그에 대한 기록이 적은 것이 아쉽지만 이 책의 존재는 큰 의미일 것 같습니다.
9788972219903,10,채색을 통한 입체적인 이해가 가능할 것으로 생각합니다.
9788972219903,10,직접 만들어볼 수 있다니 정말 신선한 충격이네요. 책에서만 보다가 직접 그려보고 만들어보면 느낌이 또 다를것 같아요 아이들과 함께 공부하기도 좋겠네요
9788972219903,10,한자의 벽에 가로막혀 쉽게 접근할 수 없었던 대동여지도를 일반인의 시각에서 충분히 이해할 수 있을 것.
9788972219903,10,대동여지도의 이해를 위해 여러 시도를 통한 독자를 배려한 책
9788972219903,10,"한자로 표기되어 있어 쉽게 보기 힘들었던 <대동여지도>를 보다 쉽고 재미나게 채색도 할수 있도록한글로 변환 시켰다는 점에서, 세계에 자랑할만한 우리 지도에 대해서 보다 큰 자부심을 갖게 되는계기가 되지 않을까 합니다. 더불어, 아이와 함께 색칠하며 재미있는 놀이로 접해도 좋을 것 같아요"
9788972219903,10,대동여지도 역사 속에서 한줄로만 듣던 존재였는데 이렇게 보니 정말 대단하네요
9788972219903,10,대도여지도를 어릴 때 재밌게 봤었는데 한글로 나왔다고 하니 아이들이 좋아할 거 같아서 구매해서 아이들에게 선물해줘야겠습니다.
9788972219903,10,대동여지도를 한글로 만나는 날도 오네요. 일단 보기 쉽다는 점이 너무 마음에 들고 한자에 약해도 누구나 볼 수 있다는 점이 좋은 것 같아요. 의미있는 소장본이 될 것 같아 꼭 구매해 보고 싶습니다. 너무 기대되요!
9788972219903,10,"한글 대동여지도는 지명의오류도 수정,원본 대동여지도에는 없던 독도와 거문도까지 표기,한자옆에 한글로 표기함으로써 드디어 한자에 약한 이들도 대동여지도를 읽고 나만의 대동여지도를 만들어보는 재미와 현장체험학습의 효과까지있는 소장가치 충분한 훌륭한 역사지리교재라는 생각에 추천합니다"
9788972219903,10,대동여지도의 이야기를 우리는 많이 들어봤습니다. 하지만 대동여지도 속의 이야기랑 대동여지도의 내용은 살펴볼 기회가 거의 없었죠. 한글 대동여지도속의 내용으로 많은 부분을 알고 갑니다.
9788972219903,10,과거 한반도의 자화상! 정확하다고 소문난 대동여지도를 만나보게 되어 반갑네요
9788972219903,10,우리 나라 전통 지도인 대동여지도의 우수성을 직접 체험해볼수 있는 좋은 구성인듯 합니다.
9788972219903,10,"고산자 김정호의 대동여지도를 직접 만들어보다니,, 참 좋은 기회같아요 ㅎㅎ직접 우리나라의 전도를 만들어보면 국토에 대한 관심도가 더욱 높아질 것 같네요~!!!"
9788972219903,8,인문지리의 보고인 대동여지도를 좀더 편하게 쉽게 알수있게 하는 책이라서 기대됩니다~~
9788972219903,10,대동여지도를 접하기에 좋은 책 같아요.
9788972219903,10,"우리나라 최고의 지도인 대동여지도를 한글로 토를 달고 땅에 대한 개관을 담긴 지도로 새롭게 만나볼 수 있는 책이에요.땅,바다,도로,역참 등을 채색도 하고 이어붙어 대형 전도로 만들면서 당시의 대동여지도를 체험해볼 수 있는 좋은 기회가 되는 것 같아요."
9788972219903,10,김정호의 진짜 대동여지도랑 완전 똑같이 그것도 한글로 만들어진 대동여지도네요. 내가 직접 채색해서 만드는 대동여지도 내 방에 붙여 놓고 싶네요. 우리나라 곳곳의 지형과 지명을 면밀히 보고 재미있게 공부할수도 있고 여러 활용도가 굉장히 높을거 같습니다. 기대합니다.
9788972219903,10,와!! 김정호의 대동여지도를 내가 직접 채색해 보고 층별로 이어 붙여 대형 전도로 만들수가 있다니 더군다나 모두 한글로 표기된 대동여지도라니 이건 정말 갖고싶은 책이네요! 내가 채색하는 나만의 대동여지도로 꼭 보관하고 싶어요. 완전 기대하고 구매해봐야겠습니다 :)
9788972219903,10,대동여지도의 대한 이야기를 역사 속에서 많이 배웠지만 직접적으로 대동여지도를 살펴본적이 없었는데 좋은 기회가 된것 같습니다. 대동여지도를 해설해 준 이 책 좋네요.
9788972219903,10,한글이라 쉽게 읽고 채색해보면서 지리를 제대로 이해할 수 있어서정말 좋네요!가족 모두 함께 하고 싶어요.
9788972219903,10,직접 만들고 채색도 하면서 대동여지도를 자세하게 알아볼 수 있는 의미 있는 기회가 생겨서 꼭 해봤으면 좋겠습니다.
9788972219903,10,직접 채색해 보는 것으로 대동여지도를 더욱 생생하고 가깝게 만나보고 지역의 지리를 바로 읽고 이해할 수 있는 좋은 기회가 될것 같아요
9788972219903,10,대동여지도를 소장할 수 있다니. 평소 지도 보는 것을 좋아하는데 우리나라의 대동여지도는 알면 알 수록 놀라운 문화유산인 것 같습니다. 한층 보기 쉽게 현대판으로 편집되어 가독성이 기대되고 흑백 지도에 나만의 채색을 해보며 더 자세하고 생생하게 관찰해볼 수 있을것 같아 소장욕구가 솟습니다
9788972219903,10,김정호의 대동여지도를 한글로 이렇게나 쉽게 만날수 있다니 이건 무조건 소장해야할거 같습니다. 다음달 책들 지를때 꼭 같이 가지고와야할 책이군요! 우리나라 구석구석을 한글로 편히 만나고 다시한번 국토의 아름다움을 되새기는 계기가 될거 같아 기대됩니다.이건 정말 갖고싶은 책이네요!
9788972219903,10,"한글을 같이 표기하고 색을 입혀서 알아보기 쉬운 지도로 다가오고, 대동여지도를 새로운 모습으로 만날 수 있어서 자세히 들여다보고 싶어요."
9788972219903,10,말로만 듣던 대동여지도를 자세하게 알아보고 쉽게 이해할 수 있도록 알려주는 책이라 기대됩니다.
9788972219903,10,한글판 대동여지도를 실제 사이즈로 만날수 있다니 소장가치가 끝내줍니다.
9788972219903,10,"작년에 극장에서 관람한 ˝고산자, 대동여지도˝ 를 본 김정호에 대한 관심도 커지고 대동여지도에 대한 궁금함도 많았는데 이 책이라면 충분히 그에 대한 궁금증과 기대감을 해소시켜 줄 것 같습니다. 소장본으로서의 가치도 큰 의미있는 책입니다."
9788972219903,10,한자로 된 지명에 한글로 토를 달고 지도마다 땅에 대한 개관을 담은 한글로 된 대동여지도라 정말 쉽게 알아볼 수 있고 이해할 수 있어 너무 만족스러웠습니다. 아이들에게 보여주고 이해시키기도 더 쉬워서 정말 좋았어요.
9788972219903,10,완전 대박~~~너무 유용한 책이네요^^
9788972219903,10,이 책을 통해 조선 시대를 조금이나마 이해할 수 있겠네요.
9788972219903,10,대동여지도가 예뻐서 소장가치가 있으면서 역사와 지리공부에도 도움이되어 좋습니다.
9788972219903,10,직접채색하고 만들어갈수있도록 되어있어 지리공부와 역사공부에 도움이 될것같습니다.
9788972219903,10,대동여지도를 그래도 나타내고 있고 거기다가 한글로 설명까지 되어 있어 좀더 살펴보기가 편하네요. 아이와 함께 설명하면서 재미있게 우리나라를 자세히 살펴볼 기회인거 같아요
9788972219903,10,역사속의 대동여지도를 그대로 표현하여 한글로 누구나 쉽게 이해하고 색칠까지하니까 더욱 생생하게 만날수 있어서 특별합니다 오래전에 이런 지도를 만들어낼 수 있다는 사실이 자긍심과 함께 정말 대단하게 느껴져요
9788972219903,10,아이디어 좋네요! 꼭 만들어봐야겠어요~
9788972219903,10,"대동여지도의 의미는 한반도가 온전히 하나일 때의 모습을 만날 수 있다는 점이었는데, 여기에 더해 한글로 쉽게 지도를 들여다볼 수 있어 현 시대를 살아가는 이들에게도 더없이 와닿을 것 같다. 아마도 누구나 쉽게 보고 읽을 수 있는 지도. 바로 156년 전 김정호가 진정으로 꿈꿨던 일이 아닐까."
9788972219903,10,우리 산천을 돌아다니며 더 나은 지도를 만들기 위해 헌신한 한 선각자의 꿈과 혼이 담긴 지도를 채색과 제책도 하면서 오늘날에 다시 한 번 의미를 되새겨보게 하는 뜻깊은 책입니다.
9788972219903,10,제작 당시에 대동여지도를 어떻게 활용했는지 직접 이어 붙이고 채색하면서 체험해볼 수 있겠네요
9788972219903,10,"대동여지도를 한번 가지고싶었는데, 이번에 직접 채색하는 체험북으로 나왔다기에 구매합니다.아이랑 같이 채색하며 우리말로 된 옛길의 아름다움을 느끼고 기회되는데로 직접 우리길을 걸어보고싶습니다."
