ISBN13,rating,review
9788934977193,10,저자의 삶 속에서 세상을 대하는 태도와 소신을 느낄 수 있습니다.
9788934977193,10,이재명시장이 유명해지기 전부터 이미 알고있었는데 예나 지금이나 ‘말‘이나 생각이 바뀌지않고 한결같아요. 그런데 불안요소가 많은 분같아요 태종형 리더쉽을 말씀하시는데 포용력을 더 가지셨으면합니다. 그러나 흥미로운 인물인것만은 사실이에요
9788934977193,10,어린 노동자의 척박한 환경속에서도 이를 극복하였던 이재명의 인생은다른 어려운 환경에서도 우리가 극복할 수 있다는 희망을 갖게 한다.<이재명의 굽은 팔>은 그가 어떻게 굽은 세상을 펴는 인물이 될 수 있었는지와 세상에 대한 시선을 보여주어 올바른 정의의 대한민국을 만드는 지침서이다.
9788934977193,10,최순실에 의한 국정농단에 의해 병든 사회를좌절과 낙담을 할 수 밖에 없는 현실을 극복하였던 이재명을 통해 극복해보는 것은 어떨까?[이재명의 굽은 팔]은 그가 어떻게 해서 현재 촉망받는 정치인으로 평가되고 있으며우리사회가 나아갈 방향에 대해 제시하고 있어 누구에게나 추천할만하다.
9788934977193,10,우리에게 사이다같은 존재인 이재명시장이꿈을 꾸는 법을 알지 못했던 소년공에서 현재까지 발전하기까지의 이야기를 담고 있는<이재명의 굽은 팔>을 통해 그를 다시보게 되었다.그러면서 그가 대한민국에 보인 생각은 권력에 대한 욕심이 아니라희망찬 공정사회를 위한 도전이라는 것
9788934977193,10,정부의 복지정책보다 앞선 정책 추진 등으로 소신있는 행정가로 불리는 이재명 시장이 세상을 바꾸고자 한 시선속에는 단순히 높은 위치에 있고자 한것이 아니다.<이재명의 굽은 팔>을 통해 그의 인생과 철학을 읽게 된다면내가 어제까지 생각했던 그가 달리 보일것이다.
9788934977193,10,바닥부터 시작해 지금의 자리에 이르기 까지 그의 삶이 무척 존경스러운 사람 이재명의 책이 나온다기에 무척 관심이 갔습니다. 앞으로도 지금과 같은 모습이었으면 하는 바람으로 이 책을 읽어 보고 싶습니다.
9788934977193,10,어떤 인물인지 알고싶네요.....기대됩니다.
9788934977193,10,이재명 시장의 지나온 과정을 통해 그가 어떤 사람인지를 알게 되는 시간이 되네요. 응원합니다.
9788934977193,8,굽은 세상을 펴고자 하는 이재명의 삶에 대해 제대로 알 수 있을 것 같아 기대가 됩니다.
9788934977193,10,대선 후보들의 책 중 일단 제목에서 정치적 철학을 가장 잘 드러낸 것 같네요. 힘든 삶을 통해 어떤 정치적 소신을 가지게 됐는지 확인해볼 필요가 있겠군요.
9788934977193,10,굽은 세상을 곧게 펼 수 있는 세상이 오면 좋겠네요~
9788934977193,10,이재명 시장의 삶을 살펴보고 나를 돌아보게 만드는 시간. 기대됩니다.
9788934977193,10,때로는 너무 공격적이라 적도 많지만~ 사람들이 외면하고 아픈곳을 긁어주는 점이 매우 좋다고 생각합니다~ 더구나 현역시장으로서 단순히 머리속의 공상이 아니라 실제로 실천이 가능한 점을 말하고 있는 것이 참 좋죠
9788934977193,8,이재명 시장님 책이 나왔네요! 응원합니다~~
9788934977193,10,인간 이재명의 이야기 궁금합니다~ 꼭 읽고 싶어요.
9788934977193,10,궁금하네요. 여러가지 이야기가 많은데 직접 적은 이야기를 볼 수 있다니.
9788934977193,10,정치인 이재명의 생각을 알 수 있는 책이에요 항상 좋은 정치인이 될 수 있길 응원합니다
9788934977193,10,많은 사람들이 살기 좋은 사회를 만들기 위해 시장으로써 계속해서 힘써온 이재명 시장님의 숨겨진 이야기와 그가 가진 삶에 대한 생각들을 엿볼 수 있다는 생각에 이책을 추천하고 싶고 많은 분들이 이책에 관심을 가질 것이라는 생각에 저도 꼭 보고싶어요 추천합니다
9788934977193,10,과감하고 솔직한 발언의 이재명시장님! 그 열정에 응원을 보냅니다
9788934977193,10,인간 이재명의 이야기네요..궁금합니다!!
9788934977193,10,갑자기 떠오른 이재명은 어떤 사람인지 궁금합니다
9788934977193,10,이재명 자서전입니다
9788934977193,10,시원시원한 그의 언행들이 좋습니다 앞으로도 소신있는 행보를 보여주셨으면 좋겠습니다 응원합니다
9788934977193,10,"저는 솔직히 이번 이재명 시장의 대선출마선언은 반갑지 않습니다. 열심히 발전하고 살아온 모습이 고 노무현 대통령님과 비슷해보일지 모르지만, 너무 그와 비슷한 점을 내세우는 듯도하고, 이재명시장 만을 바라보며 시장까지 그 삶이 대단하다고 생각하고, 책을 통해 소신을 알 수 있는 책 같아요."
9788934977193,8,성남시장이자 대통령 후보로써의 이재명은 누구인지 그의 삶과 앞으로의 포부에 대해서 알아볼 수 있어 흥미롭네요.
9788934977193,10,"일 잘하는 성남시장, 떠오르는 후보라는것만 알지 정작 어떤사람인지 잘 몰랐는데 읽어보면 좋을것 같아요."
9788934977193,10,소신 발언을 하신 대선 후보 이재명의 개인적인 생각을 알 수 있어 기대됩니다.
9788934977193,8,"다음 대선에는 정직하고 신실한, 국민의 편에 설 사람을  원합니다.이분이야말로 소시민의 편에 설 적임자입니다."
9788934977193,8,촛불시위 참여하러 5시간을 차타고 올라가는 직장동료가 당신을 대통령으로 뽑겠다고 하더군요. 이유가 있겠죠.
9788934977193,10,"사실 이재명시장에 대해 잘 몰랐었다. 요새 대선 주자들을 소개하는 방송을 보면서 이 분에게 대해 알게 되었는데, 흥미있는 것은 굴곡진 삶을 이겨내고 남들이 말하는 성공인의 반열에 올랐다는 점이 인상 깊었다. 무언가 새로운 자극을 받고 싶은 때에 이 사람의 인생스토리가 도움이 될 것 같다."
9788934977193,10,늘 올바른 목소리를 응원합니다
9788934977193,10,이재명 시장을 응원합니다. 책 한번 봐야겠어요
9788934977193,8,이재명 시장의 출사표. 올바른 정치를 기대한다
9788934977193,8,응원합니다 그가 살아온세상이 우리와 다르지 않음을 그 같음에서 조금더 전진했음을 우리는 알아야합니다 꾸준히 위에있는 사람들은 모르는 아래에 있는사람들을 더 기대하게 하네요
9788934977193,10,"눈물을 훔치며 읽다. 이런 사람,정치고 아니고를 떠나매력적이고 멋있다."
9788934977193,10,이재명 시장에 대한 글 기대됩니다
9788934977193,8,소년공으로 일할 당시 강도높은 노동으로 팔이 굽었다고 하지요. 꼭 대선이 아니더라고 알아보고 싶은 인물이아 관심이 갑니다!
9788934977193,10,이재명 시장님. 응원합니다. 나라를 위해서 국민들을 위해서 힘써주시길.. 책 찾아봐야겠군요..
9788934977193,10,이재명 시장이 가지고 있는 생각과 앞으로 어떻게 할것인가에 대해서 알수 있을거 같아요
9788934977193,8,거침없는 행보에 끌렸고 열린 생각이 멋지다고 생각했었는데 이재명시장님의 가치관을 좀 더 자세히 알 수 있는 기회라서 집중해서 읽었어요
9788934977193,10,어떤 생각을 가지고 계신지 이책을 통해 조금이나마알수 있겠지요. 기대됩니다.
9788934977193,10,한번 읽어보고 싶네요~기대됩니다~^^
9788934977193,10,개인적으로 이재명 시장의 정책이나 행보에 많이 동의합니다. 다만 패기롭게 앞으로 나아가는 것도 좋지만 적과 동료를 한번씩 살피고 전진하는 신중함을 조금 더 높이면 어떨까 해요. 이재명 시장님의 행동이 궁극적인 대의를 위한 것으로 귀결될 수 있었으면 합니다.
9788934977193,10,정치인이 썼거나 관여한 책을 사는 건 심상정의 자서전 이후로 상당히 오랜만이다.한국 정치를 ‘그놈이 그놈이다‘와 같은 정치 혐오를 뛰어넘어 다른 차원으로 끌고 갈 한국 정치사에서 여지껏 보지 못했던 캐릭터이다. 목숨걸고 싸워주겠다는 그 약속만 지킨다면 역대급 정치인은 따놓은 당상이다.
9788934977193,10,꿈과 희망에 대해 생각해봅니다. 용기와 의지에 박수를 보내며 끝까지 최선을 다하시기를 바랍니다.
9788934977193,10,어린시절을 힘들게 보내시고 많은 좌절을 하셨지만 계속해서 다시 일어서서 노력하셔서 인권변호사까지 됬다는게 정말 노력했다는 사실을 알 수 있고요. 가난하고 소외된 힘없는 사람들을 위해서 일해주셔서 감사해요.
9788934977193,10,이재명씨의 인권 변호사로서의 삶은 매우 나쁘지 않았습니다. 다만 정치적인 행위에 아쉬운 점은 조급하게 드러내기 보다 긴 시간을 계획으로 하여 조금씩 노출을 하는 부분이 매우 좋은 전략이 될것 같습니다.
9788934977193,10,할말이 많지만 하지않겟습니다
9788934977193,10,또 한명의 대선후보 이재명 님의 생각을 보고 싶습니다.
9788934977193,8,그분이 어려운 시절 지나고 지금의 성과를 이룬줄 몰랐네요. 그의 이야기를 들을수 있는책
9788934977193,10,추진능력은 뛰어나신거 같네요^^
9788934977193,10,정치에 관심이 있지만 쉽게 접근하지 못하는 분들께 추천할 도서입니다.
9788934977193,10,읽어보고 싶어요
9788934977193,10,문재인말고 이재명 시장님이 야당대표가 되야합니다! 적극 지지해요!
9788934977193,10,성남시장으로 재직하며 정책을 시행하고 빠른 결정을 내리는것을 보고 들으며 감탄하며 작은 시의 수장으로 끝내기에는 아까운 분이라는 생각이 많았는데 출마선언에 응원을 보냅니다.
9788934977193,8,"팔은 굽었지만, 마음과 신념은 바르기를 기대합니다. 그의 생각을 읽고 싶네요."
9788934977193,10,이재명 시장의 삶에 대해 알아보고 싶습니다.
9788934977193,10,대선후보로서의 이재명이 아닌 한 사람으로서의 이재명을 바로 알아볼 수 있을 거 같아 기대됩니다.
9788934977193,8,저자의 신념과 살아온 삶에대해서 알아보고 싶어요
9788934977193,10,민주주의의 가치를 지키기 위해 투쟁해 왔던 그의 삶을 만나볼 수 있는 작품이네요. 그리고 대선주자로서 그가 지향하는 대한민국의 미래에 공감할 수 있는 부분들이 많아서 아주 좋아요. 시대가 요구하는 리더의 자질이 무엇인지 깨달을 수 있는 좋은 작품이네요. 적극 추천합니다.
9788934977193,10,"어려운 시절을 극복하고 세상을 바꾸기 위해 노력하시는 이재명 성남시장님의 행보가 기대되며, 앞으로도 어려움이 많으시겠지만 당당히 극복하시리라 믿어 의심치 않습니다. 언제나 화이팅 해드리겠습니다."
9788934977193,10,성남 시장 이재명 저자님의 철학이 무엇인지 궁금해집니다. 인권변호사를 하셨다는데요.
9788934977193,10,"세상을 바꿀수 있는 대한민국에 썪어버린 물을 정화 시킬수 있는 지도자가 될수 있나요?  법, 정의, 정책,외교,경제,사회 그리고 의원들의 어마어마한 특권에 관한 변화가 절실합니다"
9788934977193,10,어린 나이에 공장을 다녔다는 책 소개 글을 보았어요. 왜 정치를 하는지 호기심이 생깁니다.
9788934977193,10,지금까지 뉴스나 인터넷 신문기사 등에서 이재명 시낭님의 활약을 많이 봐왔는데요. 공약이행도 잘 해주시고 시민들에게 관심이 많으시고 대우를 잘 해주셔서 많은 사람들이 존경할만한 분이라고 생각해요.
9788934977193,10,이재명 시장님의 생각과 같은 누구나 공정한 세상을 만들어나가기 위해 우리 모두 마음을 모았으면 합니다. 신념을 굽히지 않는 멋진 정치하시기를 바라며 응원합니다.
9788934977193,10,"믿음직하고 개혁적인 이재명 성남시장의 성장과정과 소년공으로서의 남다른 경험, 정치가로서의 소신 등이 궁금했었는데 책을 쓰셨네요. 삶의 본보기가 될 만한 책이라 기대됩니다."
9791187056058,8,"<시티즌포>도 보고 <감시국가>도 봤지만, 이 책 역시 읽어봐야. 책의 앞부분은 스릴러 영화 대본이라고 해도 믿겠고, 뒷부분은 이 사건이 왜 우리가 (NSA에서 신경끄고 있는 한국땅에서도) 이 사건에 주목해야하는지 잘 보여준다. 그런데 책값은 어떻게 결정이 되는거지?"
9791156756774,10,"한때 한겨레21을 정기구독했던 이유는 국제면, 특히 정문태의 글 때문이었다. 2004년판을 갖고 있는데 이 책은 그 후의 사연을 찾아간다. 쓰나미의 소녀들을 다시 만나는 장면 감동이다. 사진들 보는것만으로 소장 가치가 있는 책이다."
9791156756774,6,기승전 미국이네요.....나름 심혈을 기울였을텐데 아직도 냉전적 사고에 빠져있는 듯......
9791160940282,10,"최근 읽었던 소중한 책이 있다. 『청춘의 가격』이라는 책이다. 이 책은 여러 명의 공동 저자가 직접 청춘들을 만나 인터뷰하고, 그 이야기를 토대로 만든 책이다. 이 책은 단순히 청춘을 위로하는 책도, 비판하는 책도 아니다. 그래서 인상깊었다."
9788959064212,2,시류에 영합해서 이런 책도 냈는데 요즘 진상이 밝혀지는 것을 보면 민망하겠지. 좀더 지나면 얼굴을 들 수가 없어질거다..워낙 가볍게 다작을 생산하는 작가라서 소장이나 구입의 필요성은 못느끼고 그냥 도서관에서 가볍게 훑어보는 것으로 끝.
9788959064212,8,ㄹ혜순실게이트 초입에 나온 책. 강교수의 편집증적인 ‘평소자료수집해두기‘의 힘을 유감없이 선보였다. 생각없는 꼭두각시인 박ㄹ혜도 의전과 권력욕에선 누구보다 쎘다는 걸 보여주고 박ㄹ혜를 대통령 만든 한국사회의 약점을 꼼꼼히 살핀다. 뛰어나다.
9788959064212,10,명쾌하고 탁월한 논리로 상황을 잘설명해주는 책
9788959064212,8,"미네르바의 부엉이는 황혼녘에 날개를 편다지만,지식인이라면 뜨거운 태양을 이겨내며 활공하는 독수리 같아야 한다."
9788959064212,10,강준만 교수가 어떤 화두를 던질지 궁금하네요 ㅎㅎ
9788957693780,8,"집단적 물아일체의 최면. 나는 아닐꺼야라고 하겠지만, 정말 아닐까? 누구도 장담하기 힘들다."
9788957693780,10,"잘살아보겠다 발버둥쳐도 내 자리 하나없는 이 사회를 원망하기 시작하였고, 이 책을 꺼내들었다. 우리가 사는 삶은 어떻게 생겨먹었길래 힘들게 하는가?라는 물음에 이책은 해답을 줄것같았다. 하지만, ‘남보다‘잘 살아보겠다는 제 마음이 우리 사회를 병들게 하는 시작점이라는 사실을 깨닫게 해준다"
9788957693780,10,처음부터 끝까지 ‘지위경쟁‘이라는 하나의 키워드로 우리 사회의 본질을 파고드는 책. 우리가 왜 자꾸 불행해질 수 밖에 없는지 이 책을 읽고나서 좀 더 명료하게 알게 되었다.
9788957693780,10,경쟁과 행복감의 관계에 대한 본질을 꿰뚫는 훌륭한 책. 지위경쟁이 사회 곳곳에 있다는 사실도 놀랍고. 왜 이러고 사는 지도 놀랍고.
9791127403331,10,"번역이 매우 훌륭했다고 생각함. 읽기에 편해서, 이해하기 수월했음. 책내용 또한 훌륭하다고 생각함.다만 인쇄부분은 다른 이와나미책들과 비교해 안습이었다는 ..."
9788988613634,8,"사회수선론자 우치다 선생의 글.이번에는 내 차례구나 하면서 내 앞에 놓인 유리조각을 줍는다고 말하는 선생. 너무 많은 의무감에 괴로워하지 않게 하도록, 현대 어른이 짊어질 적당한 양의 의무감을 어깨에 올려주는구나 하는 느낌을 받는다."
9788988613634,10,좋은 본이 돼는 어른이 나와야햔다. 좋은 권위가 서야한다 이겁니다. 왜들그리 모르시는지... 그리고 5년동안 혼자 자취해봐서 알지만 공동체의 소중함을 이제 조금씩 느낍니다.
9788988613634,10,보통은하지 않는 것을 굳이한다.... 소통에 대한 신선한 의견이었던...
9788988613634,4,일본 사회가 지닌 문제점들을 제법 예리하게 보는 듯하더니 기껏 주장하는 게 세대에서 세대로 연결하는 일이 중요하다... 결국 '어른'이 '아이'를 가르쳐야 한다는 말?
9788988613634,6,"뻔한 말들의 나열. 100권이 넘는 책을 썼다고 하는데, 좀 더 묵혀야 하지 않을까요."
9788988613634,6,"글빨이야 워낙 유명하고, 모녀관계에 대한 색다른 해석이 돋보여요. 근데 공동체주의로의 회귀가 맘에 걸리네요."
9788988613634,10,일본을 보면 한국이 보인다 아직도..
9788964361191,8,쓰레기 강제 징병제부터 모병제로 전환해야 뭐가 될텐데...
9788964361191,8,개정판? 가격 인상판이겠지.
9791187552000,10,통치자 담론에서 피통치자 담론으로... 정말 시대를 정확히 파악한 시선이다.. 무엇보다 그간 비상식의 야만의 시절을 거치면서 위로는 커녕 이해 되지 않았던 현상을 정확히 읽어내느... 위로는 저절로 따라왔던 책이다!
9791187552000,2,대충 볼 만한 책...교양이 깊지 않은 사람들에겐 괜찮은 책
9791187552000,2,"2년전에 강남역에서 푸코 강의를 이 강사의 강의를 들었다. 말투에서 꽉 차보이는내공이 있어 보였는데 이 책을 보고나니 난센스였다.말투뿐이었다. 푸코강의였으니, 자연스레 푸코의 앵무새정도의 내공이었겠다. 시대가 이렇게 흘러간것뿐이지, 그때도 맞지는 않았을게다. 시대착오적이기에 읽을가치X"
9791187552000,10,얇지만 가볍지 않은 내용이라 좋습니다. 헬조선에 대해서 이런 관점으로 생각해볼 수도 있겠구나.. 하는 통찰을 준 책입니다.
9791187552000,4,한 때 다이어트 방법론들이 유행하고 사라졌는데요.. 이 책에 담긴 파플로프의 개처럼 철학자의 복.붙되어진 말들도 순식간에 사라질 것만 같아요. . 도서관에서 읽어서 다행.. 그래도 저자가 심각히 진지하게 쓴듯해서 웃기면서 시간은 잘갔음ㅎ 그래서 별 한개추가!
9791187552000,2,우웩 2016년형 꼰대... 유감스럽지만 이런 사람과 시간 보내면 정말 피곤해질거같다. 앞으로 믿고 거르는 인문학자로 기억해야겠다
9791187552000,10,간결하고 날카로운 시선으로 현재의 한국사회를 분석해주신 글 잘 읽었습니다. 읽는 동안이라도 답답했던 속이 조금 시원해졌어요.
9791187552000,4,비추. 머리에 조악한 생각들만 가득만 책. 잘 읽히는 것 외에는 영화 제목에 편승한 조잡한 책
9791187552000,10,"""함부로 재단하거나 심판하지 않기""위한 인식의 틀을 제공하는 좋은 책입니다. 아마도 독단적인 인식의 틀을 고집한다면 읽기 어렵겠지만, 그 때 맞았던 자기의 과거가 지금 ""틀리다""는 것을 인식할 용기가 있는 사람이라면 일독을 권하고 싶습니다."
9791187552000,2,"너무 별로에요.. 필력도 별로고요;; 랑시에르 번역자와 동일한가요, 되려 후퇴했네요. 너무 수준이하에요."
9791195585298,10,요즘 들어 이 책이 생각난다. 다시 읽어 봐야겠다. 날카롭고 매력적인 글. 찾아 읽고 싶어지는 작가이다.
9791195585298,10,장의준 박사님의 두 번째 연구서 입니다.
9791157031900,10,구매하자마자 새벽 내내 욕하고 깔깔거리며 완독했네요
9791157031900,2,긴 말 필요없다 숨어들어 침묵하는것만이 답이다 확실히 느꼈다
9791157031900,8,"남자의 시선에서 바라본 페미니즘이 꽤 흥미롭다알수록 더 알아야겠다는 생각이 든다나를 위해서도, 현재와 미래의 사회를 위해서도더 관심갖고 공부해야겠다"
9791157031900,10,남자가 읽어도 거부감 없으면서도 설득력 있을 페미니즘책. 하지만 남자가 읽도록 만들 재주가 나에겐 없네.
9791157031900,10,이 책이 불편한 한국남자들이 많다는건 그만큼 이 책이 옳다는 뜻이다.
9791157031900,8,어렵지 않게 쓰여있어 술술 읽히네요. 여성분들이 읽기에도 좋지만 솔직히 그보다는 대다수의 남자분들에게 한번씩 읽어보라고 권하고 싶네요. 특히나 여자가 하는 말은 귓등으로도 안 들으려는 사람들에게 같은 남성의 눈으로 비판한 실태를 보여주면 어떤 반응을 보일지 참 궁금합니다.
9791157031900,6,"한국사회의 남성과 페미니즘을 주제로 쓴 칼럼을 모아놓았는데, 꽤 날카롭습니다. 사회학적 관점과 페미니즘적 관점에서 ‘표준적인 한국의 남성성‘에 대해 비판적으로 분석하고요. 한편으론 왜 한국사회는 이런 ‘표준적 한국남성‘을 길러내는지 문제삼고 비판합니다. 흥미롭게 읽었어요."
9791157031900,10,이제야 명쾌하게 그남자에 대해 알 수 있게 되었다. 훠우~
9791157031900,8,"분석이나 논의의 면에서는 부족하다고 느꼈지만, 예비군과 민방위 등 군대관련해서는 몰랐던 내용이 들어있어서 흥미로웠습니다. 다만 설현 어쩌구 하는 부분은 별로 좋은 내용은 아니라고 생각했습니다. 그럼에도 불구하고 가볍게 읽기에, 또는 페미니즘에 관심없던 분들이 읽기에 좋을 것 같습니다"
9791157031900,10,"저자의 논의에는 일부 한계점도 있지만, 저자 스스로 이상했던 과거 자신의 언행을 돌아보고 성찰하는 점을 높이 산다. 진보는 이러한 성찰로부터 느리게 온다. 이상함의 사회화가 이미 이루어진, 보편의 기준에 비추어 보았을 때 자신이 이상한 줄도 모르는 대부분의 한국 남자들이 이 책을 읽었으면."
9791157031900,10,한국남자들이 이상하다는 건 알고 있었지만 왜 이상해졌는지에 대해서는 생각해본 적이 없었다. 천상 한국남자였으나 그것의 이상함을 깨닫고 사회학자로서 좋은 책을 써준 저자에게 감사하고 싶다. 또한 한국남자도 변할 가능성이 있다는 걸 보여줘서 더더욱 감사하다.
9791157031900,8,"전작에 이어 위트 있는 문장과 통찰이 즐거웠습니다. 다만 논개 파트는 다소 아쉬웠는데, 논개의 실제 신분이 기생이었든 아니든 간에 중점은 여성의 업적을 깎아내리려는 시도뿐만 아니라 순결을 중시하는 남성 중심적 사고에도 두어야 한다고 생각합니다. 앞으로도 쭉 목소리 내주세요. 응원합니다."
9791157031900,6,딱히 시간들여 읽을 만한 책은 아닌듯.  페미니즘에 관심있는 여성들은 이미 생각해왔고 말해왔던 부분들에 대한몇몇남자들의 뒤늦은 깨달음 또는 반성문.
9791157031900,10,시간 가는줄 모르고 읽었습니다. 쉽고 재밌고 많이 알아가네요
9791157031900,10,개개인이 바뀌어야 세상이 바뀐다. 잘 못 된 것은 인정하고 바뀌는 것을 겁내지 말아라. 그게 이 책의 포인트인 것 같다. 쉽고 재밌게 읽히는 책이었다.
9791157031900,10,"이 시대를 사는 나와 당신의 이야기, 우리는 모두 여자이면서 동시에 남자이니까."
9791157031900,10,별 한 개 주는 사람들은 이 책의 ｀내용｀이 아니라 이 책 ｀존재 자체｀에 대해 기분 나빠하며 악플을 단다. 책이 이야기하는 것과 정확히 일치하는 게 개소름
9791157031900,10,여자들도 기분은 나쁜데 이유는 잘 모르겠는 것들을 뭐가 왜 문젠지 명쾌하게 설명해주네요. 남녀 모두에게 추천해요~
9791157031900,10,이 책의 이유를 남자들의 빻은 댓글들이 증명해주고 있다. 작가님 최소 예언자.
9791157031900,10,읽어보지도 않고 유사메갈이니 독재자 사진 붙인 병신들이 알아서 기어나오는 걸 보니 이 책의 순기능은 참 다양하다 ㅎ
9791157031900,2,이딴게 책이라니 ㅋㅋ 한국여자들 인권은 이슬람보다 못해서 그렇게도 밤낮 할거없이 활캐치고 다니시지요?
9791157031900,8,이 책에 언급되는 남자들의 멍청한 레퍼토리가 100자평에도 앵무새처럼 반복되고 있다. 남자로서 쪽팔린다. 뭔가 반박을 하고 싶어도 댓글들이 그대로 증명하고 있으니.
9791157031900,2,뭐야 이 유사메갈 같은 소리만 가득한 이 책은...... ㅉㅉ 읽어봤는데 역시나였음. 한심하다. 이런 게 한국 진보의 수준이란 거겠지.
9791157031900,6,요즘 우리나라 도서의 질이 ...
9791157031900,6,이 책 대로라면 한국 남자는 너무 불쌍하다. 부디 남녀평등 사회가 와서 남자들이 지긋지긋한 무게에서 해방되었으면 한다.
