ISBN13,rating,review
9791195419579,6,"페미니즘보다는 휴머니즘, 기본적으로 맞는 이야기지만, 저자의 정치적 이력을 생각하면 의아함. 강단페미니스트들과 무슨 일이라도 있었나."
9791195419579,2,응~ 오빠가 허락한 페미니즘 ㅋㅋㅋㅋㅋㅋㅋㅋㅋㅋㅋㅋㅋㅋㅋㅋㅋㅋㅋㅋ
9791195419579,10,일부라고 물타기 하지 마라. 이게 대한민국 페미니즘의 민낯이고 본질이다.
9791195419579,10,일부 페미들의 사례라고 페미들이 억지 프레임을 짜면서 논점을 흐리지만 일부가 아니라 모든 페미들의 만행과 궤변을 잘 정리한 책 앰져들의 한계가 어디인지 알 수 있음
9791195419579,10,맨날 일부 페미니스트 일부 페미니스트라고 하지만 사실 아니다.. 일부가 아니라 전체에서 나온 일부다..ㅋㅋ 그건 일부가 아니고 곧 전체를 대표하는 일부다. 맨날 일부의 과격한 페미라는 말은 삼가하도록 하자~
9791195419579,10,비디오머그 아찔한 인터뷰보고 사려고 합니다
9791195419579,10,진짜 이게 책이다
9791195419579,10,"페미니스트가 읽으면 속 터질만 하다. 자라오며 수많은 자신 아래의 유리바닥을 밟아오며 눈가리고 여성혐오를 찾아오던 영페미들로써는 도저히 반박할 수 없는 내용이기 때문. 자신을 한남, 그남들도 매도하며 혐오를 자행하는 트페미들의 실체를 알고싶다면 구매하는 것을 진심으로 추천한다."
9791195419579,10,지금 필요한 담론
9791195419579,10,"페미니즘에 대해 다양한 시각을 접해보기 위해 구입했다. 이 책은 우리나라 안에서 통용되는 페미니즘에 대한 고찰이 돋보이는 책이다. 어느 하나의 성 우월이 아닌 성 평등으로 가기 위해 우린 아직 멀고, 공부를 많이 하고, 또 경청할 줄 알아야한다."
9791195419579,8,"구구절절 맞다. 오세라비작가의 맞는말에 쳐맞고 이 책에 원색적 비난을 하는 자들의 서평 목록을 보라.. 그 페미니즘을 신봉하는 자들은 여전히 반대의견, 합리적 비판을 용납하지 않는다. 페미니즘이 헌법이고 도덕인 자들은 아직도 자신들이 무엇에 휘둘리는지 모른다. 스스로 철학을 가져라."
9791195419579,2,남자들을 위한 이퀄리즘을 표현한 책. 남자들을 잘 대변해줄듯. 페미니스트들이 읽으면 속터져버릴 책이다.
9791195419579,2,여성혐오를 좋아하는 남성분들이 보면 좋아할 책이다. 자신이 뱉은 혐오를 정당화하기에 이 책은 가히 명서라 할 수 있겠다.
9791195419579,10,현대 페미니즘 레즈비언화가 숨겨져있음의 문제점을 잘꼬집어준책이다.
9791195419579,2,"노동운동이나 여성운동 진영에서는 아무도 모르는데 이상한 경로로 운동계의 원로라고 지칭되는 근본 없는 사람이 남초 사이트 이용자를 위한 글을 엮어 책으로 냈는데, 그걸 사서 읽고 좋다고 ˝이런 게 진정한 페미니즘˝ 이러고 있는 걸 보니 이 나라의 미래가 걱정되긴 하지만 한편으론 재밌음"
9791195419579,10,래디컬 페미니즘이 가지고 있는 에고이즘을 샅샅히 까발리고 파헤치고 냉철한 비난을 하고 이를 통해 페미니즘이 여성에 국한된 한계성을 탈피하여 휴머니즘으로서의 주도적 도약 주장하는 책으로서 훌륭함.
9791195419579,10,열심히 휴머니즘 마저 비하하는 페미니즘들이 보인다. 페미니스트들의 반성이 없다면 아무도 이제 공감 안해줄 것이다.
9791195419579,2,"...논의는 고사하고 사실관계가 맞는게 없슴.보봐르부터 정희진까지, 대가를 까면 본인이 대가가 되는 줄 아는 착각 속에 사는 사람의 망상이 책으로 출판되다니. 별 하나도 아까움"
9791195419579,10,흥미로운건 여성단체가 이 책에 대해 ‘펙트가 아니다‘라고 한게 아니라 ‘여성혐오적인 책이다‘라고 했단 것이다. 그 자체만으로 가치가 있는 책.
9791195419579,10,"약간 관점이 미묘한 내용도 있기는 하지만, 현재의 영 페미가 메갈리아/워마드가 남성혐오를 정당화 하기 위하여 도용하고 있는 레디컬 페미니즘이 거의 다인 것과, 워마드/메갈리아를 페미니즘으로 인정해버린 현실 등등. 혐오와 휴머니즘, 그리고 피해망상에 대하여 비판을 제대로 한 책이다."
9791195419579,10,"원로 페미니스트의 분노가 읽혀지는책..책 내용에서 알 수 있듯이 페미니즘 분파들, 발전의 역사, 페미 사상의 발전사, 외국 페미니즘 역사 등 탄탄한 지식을 갖고있는게 읽힌다.그것을 바탕으로 한국페미와 세계 역사속 페미를 비교한다. 페미니즘을 더럽히지 마라는 분노도 느껴진다."
9791195419579,10,현 페미의 한계를 명확하게 서술한듯. 일명 자칭 페미들의 억지주장을 확실하게 지적하는 듯
9791195419579,10,급진이 일부가 아닌 한국대표페미니즘이 되서 방송가까지 장악한 현실에서 꼭 봐야 할 책. 그러고보니 미투한 사람들 중 허위사실로 들어간 사람들 꽤 된다.
9791195419579,2,"일부 급진 페미니스트의 과격한 행위를 전체 페미니스트의 행위로 치환한 후 페미니즘의 이론, 역사, 실천을 교묘하게 왜곡하는 책... 뭔가 참신한 얘기라도 있나해서 돈 주고 구입했는데.. 페미니즘에 대한 막연한 불만을 가진 사람들에게 왜곡된 페미니즘을 선동질하는 책... 사회운동가?그저 웃지요"
9791195419579,10,"50대 아재들은 부채의식이 있어 조금 의식있다고 자처하면 페미니즘이 전투적이라도 그러려니 한다. 그러나 요즘 20대 남자청년들에게는 그런 부채의식이 없다.페미니즘보다는 여성운동을, 남녀분리보다는 연대를 그리고 휴머니즘에 근거한 사회운동으로 나아가자는 저자의 주장에 소심하게 동조한다."
9791195419579,10,"오세라비, 알고보니 사회노동포럼연대 이영희님이다. 오랫동안 사회운동과 노동운동을 하신 분이고, 그동안 한국사회 전반적인 문제점을 지적하였다. 메갈리아 사태부터 계속 비판했고, 이번에도 비판했다. 저분의 명언은 어떤 사상이든 휴머니즘이 우선시 되어야 한다. 성난 승냥이떼를 보면 걱정이다"
9791195419579,10,"딱 필요한 시기에 딱 맞춰서 나온책. 요즘 페미니즘, 페미니스트라고 방송이나 여타 매체에 나오는거 보고, 과격 하기까지한 그들의 행동들이 불편했는데 이 책에서 답을 찾았네요.다른 사람들을밟고, 이용하고, 제물삼아서 내가 올라가지말고 나 스스로 올라가라. 그렇게 나를 빛내라."
9791195419579,10,"혐오와 증오를 무기로 한  전투적 페미니즘,피해자 논리에 빠져 토론을 거부하고 일방적 주장을 통해 피아를 구분하려는 이분법적 행태는 공감을 얻기 어렵다.역사를 보라,혐오와 증오의 언어를 독점한 자들이 잠시 득세할 지언정 변화를 얻어낸 기록이 있는가. ‘성연대‘ 없는 페미니즘은 허구다."
9791195419579,10,사람이 있다는 증거임!
9791195419579,2,혹시라도 이 책 구매하려는 분이 계시다면 페이스북의 안티페미와 이퀄리스트(ㅋㅋㅋ) 페이지 운영진중 한사람이 출간한 책입니다. 알아서 잘 판단하고 구매하셔요.
9788997780273,10,학년을 마치며 후배에게 선물 받은 책.많은 반성을 하며 읽었다.
9788963192604,10,누구도 독재자로 태어나지 않지만 누구도 민주주의자로 태어나지도 않는다는 말은 민주시민교육의 중요성을 일깨운다. 이책은 민주시민교육의 기본원칙을 보이텔스바흐합의를 통해 제시해준다. 학교현장의 교사들에게 민주시민교육 방법론에 대한 의미있는 실천적 지침을 제시해주리라 생각한다
9788996697145,10,"원제는 <교육개혁의 새로운 의미>이고, 5판입니다. 혁신학교 뿐만 아니라 학교변화를 추구하는 모든 교육자에게 추천하고 싶은 책입니다. 교육개혁에서 교사의 주체성 그리고 학습활동의 중요성을 역설하고 있습니다."
9791185992396,10,"최근 읽었던 교육 관련 책 중에 가장 인상적이었던 책. 교육청 장학사가 이렇게 지속적으로 지역사회와 함께, 공급자의 관점에서가 아닌 하나의 파트너쉽으로 교육공동체를 만들어가다니, 발상의 전환이며 새로운 지방교육자치 모델을 생각해보게 한다"
9791185992396,10,"최근 방송에서 **시의 초등교사 임용시험 합격자 중 11-13%의 비율을 차지하는 사람이 교사라는 소식을 들었다. **시는 대도시이다. ‘지역에서 아이들이 자라고, 다시 지역에서 살아갈 수 있도록 교육생태계를 만들어야 한다‘는 저자의 말이 떠올랐다. 떠나시기 전에 읽어보시라고 권하고 싶어졌다."
9791185992396,10,"학부모, 교사 등 교육에 관련된 사람이라면 누구나 읽어야 하는 책입니다"
9791187064091,8,남성중심 사고관으로 세상을 바라보고 산것같아 부끄러운 생각이 들었습니다. 민주주의는 곧 약자의 시각을 존중해 줌으로써 이루어 지는 건 아닐는지
9791187064091,10,5년간의 샘의 글들. ‘메타 젠더’라는 말이 어렵지만 머리말을 잘 읽어보면 이해할 수 있다. 세상에 당연한 것은 없고 낯설게 보아야지 다른 해석이 가능하다. 낯선 시선이 다른 세상을 만든다. 널리 읽히길.
9791187064091,8,예리하고 날카로운 작가의 시선들.
9791187064091,10,정희진 선생처럼 세상을 보고 싶고 읽고 싶다. 불가능한 꿈이겠지.
9791187064091,10,날카로운 사회 비판이 오히려 나에게 위로와 안도감을 줌..지금 사회현실에 가장 필요한 책 같다. 정답을 내리려는게 아니라 모두에게 질문을 던지는 글들. 하지만 비판은 명쾌함. 근래 읽은 것중 최고인듯.
9791187064091,10,이제서야 읽기 시작했네요. 머리말만으로도 읽을 가치가 충분한 책.
9791187064091,8,"이렇게 예민한 감각이라니. 어떤 이들은 ‘프로불편러‘라 생각할 수도 있겠다. 주의 깊게 생각해보지 못한 평등과 권력의 문제에 대해 예리한 관찰력과 통찰력을 보여준다. 모든 글에 다 동의할 수는 없었지만, 내가 얼마나 무비판적으로 편안하게 세상을 바라봤는지 알게 되었다. 불편하지만 유익한 책"
9791187064091,8,"언제나 다름을 사유할 수 있기를, 약자의 시선으로 이 세상 모든 관념을 뒤집어 볼 수 있기를 깨우치게 해주는 그녀의 글들. 이 책을 통해 또 한번 각인해본다. ""모든 인식의 시작은 '다름'이다. 인간은 타인과의 차이를 통해서만 자신이 누구인지 알 수 있으며, 앎은 그 과정 자체다."" (35쪽)"
9791187064091,8,다양한 전복적 주제는 차치하고 정갈한 문장과 논리구조만으로도 이 책의 가치는 별 네개에 충분하다. 다만 별 다섯개가 아닌 것은 여러 매체에 실린 칼럼 글들을 모은 책이다 보니 한 권으로써 완결성이 태생적으로 미진한 부분을 반영한 것일 뿐.
9791187064091,10,"생각이 깊어진다는건 다른 차원으로도 사건을 해석할 수 있다는 뜻이다. 일반적인 시선이 아니라 페미니즘 시선으로 세상 읽기, 믿고 보는 정희진. 강력 추천."
9791187064091,10,한국사회에서 이슈가 됐던 주제들에 관해 어떤 시선을 갖고 계신지 알 수 있는 책이었어요. 잘 읽히는 글로 생각하지 못했던 부분에 대해 설득력 있는 글을 써주신 작가님께 감사합니다.
9791187064091,10,믿고보는 정희진
9788972977711,10,"정의, 비판적, 저항, 인문학, 성찰. 일상의 고됨속에서 뒤로 미뤄놓기 쉬운것들. 당장에 쓸모 없어 보이는 관념적 단어들이 무슨 의미가 있을까. 하지만 아주 중요한 것. 내가 남은 생을 살아내야하는데 필수적인 삶의 태도를 배웠다. 쉽게 쓰였다. 일련의 사건들에 대한 작가의 칼럼을 모은 책이다."
9791155714157,2,책 내용을 떠나 청년들에게 나쁜 뉴스를 쏟아내는 중앙일보에서 나온거라서 별로 믿음이 가지 않습니다. 또한 사주고 싶지도 않구요. 기사나 좀 제대로 쓰지......
9791185035345,2,한국은 역사관전쟁 이전에 팩트전쟁이 먼저다. 종북좌파들의 역사는 거의 거짓이고 날조된 것에 기반하며 새로운 자료가 발굴돼도 그냥 묵살해버린다.국정교과서를 그렇게도 반대하던 자들이 집권하더니 아예 교육부가 직접 집필진몰래 교과서를 날조수정했다가 발각돼 기소당하는 개차반세상이 됐다.
9791185035345,10,재미있습니다. 읽고 나면 웬만한 역사논쟁에서 우위를 차지할 수 있습니다.
9791185035345,10,차근차근 이야기를 풀어나간다는 느낌을 주는 책이다. 처음에는 권력과 역사학의 관계를 해외사례를 통해서 설명해주고 그 뒤에 우리나라의 이야기가 나온다. 쉽게 잘 설명해줘서단숨에 읽을 수 있었다.
9791185035345,8,"전에 보았던 ˝두 개의 한국 현대사˝와 궤를 같이하는 책이다. 이 책이 좀 더 심도 있는 이야기를 펼치고 있다. 후반부에 가서는 불쏘시개를 철저히 비판하고, 분석한다."
9791185035345,10,숙제를 던져주는 책. 우리가 배웠던 역사에 대해 의문을 갖게하고 배워야 할 역사에 대해 질문을 던지게 하는 책.
9791185035345,6,"첫번째 심용환.많은 공부가 됐지만 여전히 아쉽다.큰 그림은 배웠지만 디테일이 아쉽고마무리가 성급하다.이 전쟁은 집안일같다.이기면 티가 안 날지 모르지만,지면 끝장이다."
9791185035345,10,"세계사 지식이 없어서 지루한 부분도 있었지만, 뒷부분에 문장하나가 미치는 영향력이 소름이 돋아요. 사실 제가 잘 모르면서도 국정교과서 반대한 이유는 찬성파가 자신의 이익을 위해서만 움직이는 분들이라 저분들이 찬성하면 좋은게 절대 아니어서 반대했거든요. 이제 알고 반대할 수 있어요."
9791185035345,10,뉴라이트가 무엇인지 제대로 알았습니다.
9791185035345,10,역사해설이 역사를 바꾸면 안된다라는 말이 와닿네요.지나치게 주관적이면 문제가있을것 같습니다. 이책을 통해 올바르게 역사를 배울수있을것 같네요.
9791185035345,10,잘받았습니다~
9791185035345,10,정말 속이 시원해지는 내용이에요
9791185035345,10,한국의 역사 교육과 사관이 안고 있는 문제점들을 고루 지적하고 있으며 자세히 알지 못했던(알고 싶지 않았던...) 뉴라이트 사관과 교학사 한국사 교과서의 문제점도 잘 알 수 있어서 좋았다.
9791185035345,10,역사쿠데타에 대한 가장 명쾌한 저격
9791185035345,10,자신들의 입맛에 따라 사실관계조차도 왜곡하는 자들이 나머지 99.9%의 생각은 잘못됐고 편향적이라 주장하는 코미디를 펼치면서 교과서라는 이름으로 왜곡된 역사를 주입하려는 한심한 작태라니..뉴라이트의제자인 일베들이 싫어하는 책이라면 보나마나 매우 의미있고 올바른 책이지 않을까 싶군요
9788974837525,4,무엇보다 글쓴이의 겸손한 마음이 에너지를 주었다.
9788974837525,10,"처음엔 제가 편견이 없는 사람이라고 생각했습니다. 근데 이 책을 읽고 난 후 편견은 제 속에 살아 숨쉰다는 걸 느꼈죠. 인식하지 못하고 있는 것도 차별이었으니깐요. 조금 더 낯설고, 때로는 불편할 필요가 있습니다. 가슴 아픈 이들을 따뜻한 카메라로 따라가며 담은 이야기. 저는 좋았어요."
9788974837525,10,나와는 전혀 상관없던 무심히 지나쳤던 그들이...책을 읽고 나니 바로 내옆에서 숨쉬고 있네요.분명 나의 편견에도 금이 가고 있다는 것 바로 그것이 이 책이 주고 있는 힘이 아닐까요 또한번 알에서 깨고 나온 나의 사고를 느낍니다.대단한 힘이 실려있는 책입니다.
9788974837525,10,｀프레임(틀)｀이란 말을 아세요? 카메라 사진도 프레임에 갖힙니다. 정치도 특정 단어로 프레임을 상대쪽 진영에 씌우려 합니다. 이 틀 자체가 어떤 결과를 받아들이라고 강요하는 것 같습니다. 저는 이렇게 생각하는데 이 책을 쓴 기자 생활을 해온 저자님은 무슨 이야기를 하고 싶으실까 궁금해집니다
9788974837525,10,"편견의 벽 너머 16개의 삶들을 만났다. 소외된 자, 소수자, 비주류 라는 꼬리표를 달고 사는 그들에게이 세상의 가운데 자리를 내드리고 싶다.함께사는 아름다운 세상으로 한발짝 이끌어 주는 책"
9788950961893,2,강원택 교수에서 거릅니다..
9788950961893,10,타산지석. 무작정 외국의 사례를 들어 자기집단의 이익을 대변할 근거마련에 급급한 정치인들의 논리가 아닌 서울대사회학과 5명의 교수의 진지한 검토와 해결방안이 제대로 된 타산지석을 말하고있다. 복지라는 아젠다에 몽매한 개념만을 지니고있던 나에게 올바른 이해의 단초를 제공해준 책.
9788936472634,8,"글 내용은 좋으나 번역이 문제인 것 같음. 가독성이 굉장히 떨어지는 문체에 약 50년 전에 번역된 고서같음. 이딸리아, 아르헨띠나가 굉장히 거슬림. 문장이 너무 안읽혀서 여러번 곱씹으며 읽어야 함."
9788936472634,10,페미니즘 필독서 중 하나가 아닐까 싶습니다. 구절구절 놓치기 힘든 책입니다.
9788936472634,10,내가 남자를 보는 기본 태도가 왜 깔보는 외양인지 그 이유가 여기 다 써 있다. 그렇게 하지 않으면 당해버리거든. 쓰잘데기 없는 궤변에.
9788936472634,8,천 마일을 걷게 될지도 모를 길이다. 이 길을 가는 여성은 채 일 마일도 걷지 않았다.그녀는 온갖 어려움에도 되돌아오지는 않을 것이다.
9788936472634,10,"나는 책을 오프라인에서 구매를 하고, 그만큼 책을 고를 때 신중히 하는 편이다. 그래서 서점에 가면 2~3권밖에 고르지 않는데 그 중 하나가 이 책이었다. 페미니즘 서적은 많지만 이렇게 쑥쑥 읽히는 책은... 정말 최고였다. 앞으로 두고두고 볼 예정"
9788936472634,6,희망을 얘기하는 책. 아자아자. 버지니아 울프 전권 읽어봐야겠다.
9788936472634,10,"이어받은, 솔닛의 어둠"
9788936472634,10,내가 읽고 있는 이 책을 본 전 직장 남자 상사가 ˝뭘 그런 책을 읽어? 하여튼 요즘 책들은 돈벌려고 제목만 자극적으로 짓고 말이야~ 옛날에 나오던 책들은~ 내가 읽은 책들은~˝ 하며 나를 가르치려 들었다. 나는 그 생명체가 책이라는 걸 읽기는커녕 책에 대해 이야기하는 꼴도 3년 만에 처음 봤다.
9788936472634,6,앞부분은 좋았다. 그러나 뒤로 갈수록 산만해지는 느낌이다.
9788936472634,6,올해 들어서 본 네번째..? 다섯번째? 헷갈리지민여튼 네다섯번째 페미니즘 책.올해본 페미니즘책 중엔 제일별로였다
9788936472634,10,겁나 속시원함ㅋㅋㅋㅋㅋㅋㅋㅋㅋ
9788936472634,6,2천년 전 맹자가 사람의 화는 남을 가르치기 좋아하는 데 있다고 했다. 고금을 막론하고 가르치려 든다는 것(여러 의미에서)이 과연 성별의 문제인지 의문.
9788936472634,10,글을 잘 쓰고 생각해볼 거리가 많음
9788936472634,6,대다수의 남자는 그렇지 않다고 말하는 이들에게 일독을 권한다.
9788936472634,10,매사에 여자를 가르치려 들고 설명충을 자처하려는 사람이 읽으면 정신이 번쩍 드는 책(제...제 얘기는 아닙니다;;)
9788936472634,6,이 책 읽을 바에 다른 페미니즘 책을 읽는게 나을듯... 그냥 가볍게 읽을만한 정도.
9788936472634,8,솔닛!
9788936472634,8,'지성은 가랑이 사이에 있는 게 아니다' 그러나 폭력은 그 가랑이 사이의 차이에서 크게 일어나는 것 같다. 페미니즘은 남성의 힘과 권리를 침해하거나 빼앗으려는 운동이 아니다. '우리는 함께 자유인이 되거나 함께 노예가 될 수 있을 뿐이다' 여성의 인간으로서의 평등한 권리를 명민하게 말하는 책
9788936472634,6,"페미니즘 칼럼모음 책, 한국에 사는 우리도 고개가 끄덕여지는 대목이 많습니다."
9788936472634,2,내용도 없고 난잡하고...
9788936472634,10,"주말 잘 보냈다. 두 딸아이를 생각하며, 내 자신을 돌아볼 수 있었다. 아이들은 벚꽃 아래에서 맘껏 놀고 나는 남자로서의 40년을 성찰해보았다. 문화유전자의 힘은 세다. 그래서 공부가 필요한가보다."
9788936472634,10,페미니즘 뿐 아니라 일상화된 폭력을 다루는 글. 젠더에 국한되지 않은 전반적인 폭력을 얘기하지만 젠더 내에서 해결책을 고민하게 함.
9788936472634,10,"미래는 어둡고, 나는 그것이 미래로서는 최선의 모습이라고 생각한다. - 버지니아 울프"
9788936472634,10,내용도 그저그렇고 저자가 외국인이라서 그런지 사례가 익숙하지 않아서 공감이 잘 되지 않습니다 번역도 매끄럽지 않아서 저자가 무슨말을 하고있는건지 매우 신경써서 읽지 않으면 이해하기 힘드네요 비추입니다 다른 더 좋은 페미니즘책 읽으세요
9788936472634,10,생각보다 참 재미있는 책그림과 함께 설명하는 내용이 인상적이다거미에 관한 이야기가 아주 기억에 남는다
9788936472634,8,단지 성별 하나만으로 상대가 무지할 거라고 단정짓고 자신이 지적으로 우위에 있다고 생각하는 사람들의 단순함과 폭력성. 이 책을 읽고 뭔가 불편함을 느꼈다면 당신 또한 그런 폭력에 익숙해져 있었던 것은 아닌지 한번쯤은 생각해보자.
9788936472634,8,Csi라는 미드에서 자주 성폭력으로 살해되는 이야기가 나오고 여성피해자가 유독 많다. 그때마다 통쾌하게 해결되는 과정이 부러웠다. 이 책을 읽고 그래도 선진국이라 여겼는데 미국도 아직 먼 지점이 있구나 싶어 그리 부러워하지 않게 되었다.
9788936472634,8,"큭큭거리다, 반성했다, 나중엔 고마웠다. 제발 다른 책도 어서 내주길!"
9788936472634,6,처음에는 흥미롭게 읽었는데 무슨 말을 하고싶은건지 이해하기 힘든 부분이 조금 있었어요.
9788936472634,10,제목 글자 하나하나에 공감하여 출근길에 구입한 책입니다. 운전 중 신호등 걸릴 때마다 1~2페이지씩 읽고 있습니다. 토요일 아침에 읽다가 화가 나서 다시 잤습니다 ㅋㅋㅋ갈수록 어려워지는 내용에 속도는 더뎌질 거 같아요~~
9788936472634,10,"˝남자가 여자를 모른다. 그러나, 남자가 그것을 인정하지 않는다. 이게 여성에 대한 폭력이다.˝ 나는 이책을 이렇게 받아들였다. 나와 같은 모든 남자(--꼰대)들이 이 책을 꼭 읽어야한다."
9788936472634,10,기대하고 있어요
9788936472634,10,기대된다
9788936472634,10,"내가 어떤 위치에서 어떻게 살고 있는지 알고 싶어서 구매하는데, 많은 이들에게 보여주고 싶은 책이다"
9788936472634,10,"강간, 살해 등을 말하는 저자의 어조가 강하다는 의견도 있지만, 그게 여성들이 두려워하는 문제라는 걸 이해하지 못해서 나오는 말이 아닌가 싶다. 미디어에 의해 잘못 알려진 여혐의 단어를 다시 재정립하고, 여혐과 강간, 여성살해 등의 범죄는 결코 다른 얘기가 아니라는 걸 알려준 책."
9788936472634,8,읽는 내내 한쪽으로만 치우친 것 같아 불편했지만 꼭 생각해 봐야 할 것들이 들어 있다. 세상의 반은 여자고 세상의 남은 반은 남자지만 서로를 잘 모르고 있는 것 같다. 성범죄는 남녀 사이에 일어난 일이지만 불평등과 폭력에 의해 만들어진 문제이다.
9788936472634,10,여기저기서 페미니즘 추천도서로 많이 거론되어 이번에 구매해보려구요 ㅠㅁㅠ재밌을 것 같아요!!
9788936472634,10,꼭 선물해주고 싶은 사람이 있다. 읽지 않더라도 제목만 보고 자신에게 무슨 말을 하려는지 알아채면 그나마 나을듯.
9788936472634,10,남자는 여자를 가르치려 한다. 나도 그러고 있다는 걸 소스라치게 놀라고 말았다. 무의식적으로 차별과 억압에 동참하고 있는 걸 경계하게 만든다.
9788936472634,10,"단순히 남성우월주의에 대해 비판하는 것이 아닌 대담하고 날카롭게 여서이라는 존재에 대해 파헤쳐주는 책이었습니다. 문학서부터 그림까지 다양한 분야에서 실제로 일어나고 있는 맨스플레인을 찾아내 정신적 폭력성을 이야기 하고 있어, 깊은 공감이 갔습니다!"
9788936472634,10,여성에 대해 가해지는 구조적인 폭력에 대한 깊이있는 통찰이 있어 많은 생각을 하게 해주네요.
