ISBN13,rating,review
9788994597591,10,거대한 중국을 지도를 통하여 알아간다는 것이 재미있을 것 같아요.
9788994597591,10,신흥강대국 중국! 지역별로 알 수 있어서 좋네요.
9788994597591,10,하나의 나라가 아니라 문명으로 이해해야 한다는 말이 인상깊네요~
9788994597591,10,지도도 자세히 수록되어 있고 그래서 중국을 이해하는 데 좋을 것 같네요.
9788994597591,10,요즘 저희 아버지도 중국어를 모르셔도 중국 방송을 가끔씩 보고 하면서 중국문화에 대해서 관심을 가지고 계시던데 이렇게 중국에 대해서 자세히 알려줄수 있는 책이 있어서 무척이나 도움이 될거 같네요
9788994597591,10,중국에 대해 더 자세히 알 수 있을 것 같아요
9788994597591,10,지도로 보면 더욱 쉽게 중국을 알수있겠네요!즐거워보이는 책입니다!기대되네요~~
9788994597591,10,급속도로 성장해가는 중국을 각 성마다 세분화해서 이해할수 있는 책인거 같아 기대됩니다. 중국에 대해 조금 더 알수 있는 기회가 될거 같아 좋네요
9788994597591,10,"점차 커저가고 있는 중국에 중국사까지 중요해졌습니다. 지도를 이용해 34개의 행정단위를 퍼즐처럼 나눠 각각의 역사, 정치, 문화, 산업을 상세하게 접할 수 있고 좀더 멀리나가 34개의 행정단위가 뭉친 커다란 하나의 중국을 꼼꼼하고 재미있게 배울 수 있어 좋네요"
9788994597591,10,"성장하고 있는 중국에 대해 알수있는 책이네요,"
9788994597591,10,굉장히 독특한 구성이라 좋네요! 중국에대해 잘 알 수 있겠어요
9788994597591,10,중국의 위상이 날이 갈수록 달라지는데 중국에대해 이해 하는데 도움이 되는 책이네요
9788994597591,10,한국인들은 중국에 대해 너무 무지합니다. 이 책의 중국지도를 통해 중국에 대해 많은 것을 알 수 있습니다.
9788994597591,10,중국여행시 큰 도움을 줄 수 있는 좋은 도서
9788994597591,10,넓은 중국을 이 한 권으로 알아갈 수 있어 좋다.
9788994597591,10,넓디 넓은 중국을 지도를 보며 자세하게 알아갈 수 있는 좋은 책이네요정말 좋습니다~!
9788994597591,10,중국에 관련된것들을 34개의 퍼즐로 완성한다는 점이 흥미롭고 중국 전체 지도를 이해하는데 많은 도움을 주는것 같습니다!중국에 대해 관심있는 사람들에게 특히 좋은 책같고 매우 기대됩니다!
9788994597591,10,지도로 보고 사진도 볼수있어서 참 좋은책이라고 생각합니다. 유용한 정보가 될것같아요.
9791187750284,10,"인류학 수업이 열리지 않는 학교에서 현장연구로 연구를 지속하는 사람으로서, 그리고 여성 연구자로서, 이 책에 쓰인 내용이 아주 유익했습니다. 매번 고비가 닥칠 때마다 이렇게 하는 게 맞나, 나만 이러는 것은 아닐까 고민했는데 제가 꼭 틀리지만은 않았다는 생각도 듭니다. 감사합니다."
9791187750284,10,인류학은 막연히 멋진 학문이라 생각해왔었는데 책을 읽고 나니 생각보다 훨씬 더 매력적인 학문이라는 생각이 듭니다. 현장 연구의 생생한 모습이 담겨 있어서 흥미로웠고 연구자별 다양한 지역과 문화에 관한 내용이 실려있어 지루할 새가 없네요^^
9791187750284,10,기대했던만큼  흥미롭고 다채로운 이야기들!
9791187750284,10,"여성연구자들의 도전과 경계넘기에 박수를 보냅니다. 주류에 매몰되지 않고, 그것도 지역의 현장에서 길어올린 소중한 결과들을 많은 분들이 함께 보면 좋을 거 같습니다."
9791187750284,10,지구촌 곳곳의 생생한 현장연구 기록으로 읽기에 쉽고 재미있게 쓰여진 느낌입니다. 특히 해당 국가에 여행을 계획하고 있는 분들이 이 책을 읽는다면 여행의 깊이를 더해줄 듯 합니다.
9788962912364,10,문화지리에 대해서 주제별로 깊이있게 알 수 있네요
9788962632088,10,"인간의 삶과 국가의 미래, 사회의 운명까지 규율한 차가운 전쟁. 그리고 그 얼음장 같은 세상을 철저히 해부하는 시선."
9788962632088,10,옮긴이입니다. 2쇄를 찍기 전에 정오표를 만들었습니다. 독서에 참고가 되시면 좋겠습니다. https://sites.google.com/view/theglobalcoldwar
9788962632088,10,소위 ˝공산주의 국가˝라고 자처하던 중화인민공화국과 소비에트 사회주의 공화국 연방 간의 냉전에 대한 책이라서 기대가 된다.
9788962632088,10,"˝한반도는 지구에 마지막으로 남은 냉전 지역이다˝라는 표현이 진부하게 들리지만, 막상 ˝냉전이 무엇인지˝ 고민한 적 있던가? 내가 생각했던 것보다, ˝냉전˝은 훨씬 더 다채롭고 역동적이었다는 점을 알려준 책."
9788926898567,10,구성이 세련되고 내용이 좋습니다
9788926898567,6,기후 다시 공부하는 건 재밌다
9788926898567,8,어렵게만 느껴졌던 세계지리는 여행자의 시선으로 쉽게 풀어써서 재밌게 보았다.해외여행을 자주 가는 사람들에게는 좋은 정보가 될 거 같다.
9788926898567,10,세계지리가 궁금할 때 후루룩 읽기 좋은 책. 어렵지 않으면서두 어지간한 내용은 다 담긴 것 같다. 특히 세계 기후를 알려주는 곳이 유용했다.
9788926898567,10,세계지도를 읽어본다는 색다르고 흥미로운 책이였어요~
9788968665288,10,도시지리 분야는 언제 읽어도 참 재미있는 장르입니다. 대부분의 인간이 거주하는 도시에 대해 깊이있는 지식을 전달해주는 책입니다.
9788962911725,8,번역이 다소 이해하기 어렵게 되어있네요.
9788962911725,10,틀에 박힌 지루한 강의 대신 호기심을 가질 만한 현실 세계의 사례를 중심으로 구성된 흥미로운 교과서
9788962911725,10,신경제지리 이론이 잘 반영되어 있는 책.
9788965640813,10,"‘제3세계’라는, 여전히 저발전과 빈곤을 대표하고 남북한 또한 그 자장에서 멀지 않은, 하지만 끊임없이 외면하고 떨쳐내려 했던 바로 그 이름을 복권하려는 시도. “1968년은 제3세계의 시대였다”는 규정을 따라 비동맹운동과 국제주의를, 보편성을 다시 생각해볼 시간."
9788989566731,10,책 내용이 좋네요~ ㅎㅎ지정학 책이 몇개 없어서 단비같은책이라고하는..
9788989566731,10,과거 냉전시대에는 미국이 세계경찰을 자처했지만 냉전이 끝난 이 시대에는 미국이 자국 우선주의를 택하고 있다. 이는 당연한 것이다. 우리나라를 지키는 것은 미국이 아니라 우리의 한미동맹 강화 와 자체 국방력 강화 등 외교적 노력과 자주안보가 우선되어야 하는 이유를 알게 해준다
9788989566731,8,"홍지수 작가님 저서도 읽었고, 이 번역서도 읽는 중입니다. 훌륭한 번역문은 틀림없으나 몇 가지 말씀드리겠습니다. 49쪽 상단 “식료품점”은 food stores의 번역어 같은데 “비축 식량”이 아닌지요?"
9788989566731,10,이런 책을 뒤늦게나마 출간해줘서 출판사에 고맙다.뒤늦은만큼 후속작을 반년만에 내준 것도 고맙고내 돈 써서 소비하면서 고맙다고 할 만큼 이쪽시장에 국가경제력에 비해 너무나도 처참한게 그렇지만..제목을 그냥 우발적 패권 우연한 패권으로 하는게 더 낫지 않나 싶지만 덜 팔렸겠지..
9788989566731,8,단숨에 다 읽었다. 미국은 일반상식을 가진 사람들이 생각하는 그런 강대국이 아니었다. 태평양 대서양건너 미국을 침공할 나라가 지구상에 어디있겠는가...그것만으로도 축복받은 나라인데 세계1위 산유국에 노령화 근처도 안간 인구구조...그냥 쩐다.
9788989566731,8,자기 밥그릇 걷어찬 한국의 미래가 보여서 별 하나 뺀다.
9788989566731,10,이런 학문이 있는지는 처음 알았다. 뭐 세계가 갑자기 한눈에 보이는 느낌이다.
9788964357774,8,이 책을 읽고 지리학에 급 흥미가 생겨서 지리의 힘 까지 구매..
9788964357774,8,이제야 다 읽었네
9788964357774,10,"｀지도｀하면 으레 다양한 지리학적 지식을 반영한 지리지도, 즉 기후, 지형, 인구, 생태(생리) 등 일반적 지도 외에 특정 주제도(문명, 어족, 종족 등)가 연상된 바람에 ｀지리학｀하면 으레 복잡하다고 생각하기도 쉽다. 이런 고정관념과 거부감을 불식시키고 세계정세를 한 거풀 벗겨내게 하는 책."
9788964357774,10,일단 쉽고 흥미롭게 서술한 점을 높게 산다
9788964357774,10,지리학적 관점을 대입한 새로운 시선
9788964357774,10,현대 지리학은 정말 다양하게 나타나고 있다.그 필요성과 이유를 잘 명시해주고 있음
9788964357774,10,간학문적 접근의 필요성을 끊임없이 느낄 수 있었다.
9788964357774,10,"이슬람 테러리즘이 심심찮게 티비를 장식하는 요즘 아랍 뿐 아니라 세계 정치, 사회적 이슈에 대한 사고의 기반을 선사해주는 책이다."
9788964357774,10,지리학의 대중서. 왜 지리학이 중요한지... 지리적 시각이 주는 통찰력을 말해주는 책이라서..
9788964357774,10,지리학이 왜 우리 시대에 교양이 되어야 하는지 저자는 설득력 있는 어조로 일러준다. 이런 방식으로 지리 과목을 배웠다면 내 시야가 지금보다 더 넓어졌을 거라는 생각을 떨칠 수가 없다.
9788964357774,10,보아도 알지 못했던 사실을 알게해준다.
9788964357774,10,지리학이라는 학문을 알기 쉽게 서술했다. 지리학의 광대한 범위와 그 중요성도 강조해놨다. 가지를 뻗어 나가는 도서를 하기에도 좋은책이다.
9788964357774,8,지리학적 개념으로 세계사를 통찰할 수 있는 좋은 시간이 되었다.
9788964357774,6,요즘 중동관계에 대해 책에서 시사하는 바가 크네요.
9788964357774,10,"총균쇠를 읽은 당신이라면 반드시 봐야 할 책~!!학창시절 고루한 지리 시간은 잊어도 된다~!! 단, 인내심이 필요하다 ㅋㅋ"
9788964357774,10,지리학에 대한 관심을 확실히 다시 불러일으킨다.한국전때 우리 조상에게 총을 쏜 미군 역시 지리학과 그 민족에 대해 무지맸기 때문에한국민을 일본인 취급했었던 것이다.이슬람과 아프리카의 경계들 과거 식민주의등복잡해보이는 일련의 문제에 대해 지리학적 배경을 잘 밝힌다.
9788964357774,8,한 번도 중요성을 느끼지 못했고 그래서 관심도 없었던 지리학에 대해 관심을 가지게 된 계기가 되었다.
9788964357774,10,"지리에 약한 나로서는 세계가 하나로 연결되는 요즘, 다시 지리에 관심을 가지게 된다."
9788964357774,10,"중동부분은 솔직히 복잡하여 읽어도 이해가 안갔으나, 다른 지역 이야기는 흥미로웠음."
9788964357774,10,"평소 생소했던 지리학이 어떻게 중요한지, 현대적 맥락에서 지리학의 중요성을 간파할 수 있었던 책. 쉽게 쓰여지고 술술 읽혀서 두껍지만 재밌게 읽었다. 특히, 저자의 지리학에 대한 애정이 듬뿍 묻어나와서 존경스러웠다."
9788964357774,10,"지리학이 왜 필요한지를 알려주는 책이다. 지리는 환경, 기후, 전쟁등 모든것에 관련되어 우리 옆에 있다. 그것을 소흘이 하는게 우리가 아닌가 싶다."
9788964357774,10,역사의 중대전환기들을 환경변화로 설명한 관점! 이슬람에 대한 간략한 정리와 지정학적 위치! 집에 지도가 펼쳐져 있다면 꼭 읽어볼 책'!
9788964357774,10,"책읽는 내내 밑줄을 치고 메모를 하고, 따로 지도검색까지 해가며 읽었다. 한동안은 공 모양의 지구본 대신 세계전도의 이미지가 머릿속에서 맴돌았을 정도로 푹 빠져서 읽었던 책이다. 지리학이라는 도구를 통해 인류역사와 지구의 미래에 관한 거의 모든 것을 통찰하는 책이 술술 읽힌다는 장점까지!"
9788964357774,10,세계를 보는 눈을 지식에서 지혜로 확장시킬 수 있는 책이었다. 인간과 자연을 함께 관찰하고 공부하는 학문이 지리학의 전통이라는 저자의 입장에 맞추어 불안이 지배하는 지금 세계를 새로운 눈으로 보게 만들어 주었다. 번역도 막힘이 없고 부드러워 좋았다.
9788964357774,10,이제까지 몰랐던 지리학의 중요성을 알 수 있게 도와주는 유익한 책입니다.
9788964357774,10,국제적 흐름을 해석하고 조망하는데 큰 도움을 받을 수 있을 듯 하네요
9788964357774,10,지리가 이렇게 중요하다니...
9788964357774,10,지리학적 통찰이 필요한 시대에 살고 있다는 것을 다시한번 느끼네요
9788964357774,10,국제질서의 본질을 꾀뚤어 보는 도서인것 같아요. 지리학을 이용하여 세계정세를 해석해보는 점이 신선했습니다. 또한 지리학이랑 세계정세가 긴밀한 관계로 연관되어 있어 읽어보면 매우 재미 있을것 같습니다.
9788964357774,6,더 이상 남의 이야기는 없다...
9788964357774,10,지리학과 연관지어 다른것들도 배울수 있어 좋아보입니다.
9788964357774,10,국제관계학에 있어서 지리성의 중요성을 강조한 책지리학이 이리 중요한 학문일지 몰랐네요
9788964357774,10,지리학을 공부하는 데에 효율적으로 잘 익힐 수 있을 것 같아요.
9788964357774,10,읽어보고싶어서 구매했습니다.
9788964357774,10,"전통적으로 국제관계는 지정학적 조건에 가장 큰 영향을 받았지만 기술의 발달로 그 영향력이 서서히 줄어든다는 것이 통념이었다. 이 책은 이러한 통념에 반대하여 지정학적  조건은 여전히 유효하며 ,그 외의 다른 정치, 경제, 문화 현상들도 지리학적 시각으로 해석될 수 있음을 보여준다."
9788964357774,10,"세계의 역사와 문화, 경제와 정치 모두 지리학적으로 매우 연관이 크다는 것을 이 책을 통해서 알게 되었네요."
9788964357774,10,지리학으로 여러 문제들을 보니 신기합니다. 추천도 어마어마하고 궁금합니다.
9788964357774,10,긴밀히 연결되는 세계에 대한 문제를 지리학적 관점으로 본 책이네요..시선이 독특하면서 그럴수도 있겠다라는 호기심이 생깁니다.얼마전 우리나라에게 일어나썬 메르스도 이런 관점에서 볼수있다는 학설도 흥미롭구요..얼른 읽어봐야곘어요..기대됩니다~
9788964357774,10,"세상을공간적으로바라보면고립주의의해독에서벗어나새로운지식을얻을수있다.지리학의본질부터지도,인구,기후변화,환경,테러/전쟁,주요지역의각론까지간략하나깊이있게다룬다.특히러시아,아프리카편은다른책에서접하기힘든내용이다.저자가일본보다한국에서더인기있는이유는?˝동해(일본해)˝표기때문"
9788964357774,10,지리학이 급변하는 세계를 이해하고 예측할 수 있는 방법 중 하나군요.
9788964357774,10,지리학을 통해 세계를 읽는다. 기대됩니다.
9788964357774,10,요즘 시대의 지리학의 중요성을 알려주는 책
9788964357774,10,서점에 가면 꼭 보이는 책입니다. 세계의 흐름을 읽는데 가장 탁월한 책이라고 하니 기대가 큽니다.
9788964357774,10,인터넷이 쫙 깔린 지금. 지리학이 중요하다고 말하는 이유가 과연 무엇일까요? 정말 궁금해지는 책 같습니다. 지정학적 위치는 중요한 것은 두말할 것 없을텐데 저자는 무엇을 말하고자 하는 것 일까요
9788964357774,10,국제 정세 안에서 지리학이 차지하는 위치에 대해서 알 수 있습니다.
9788964357774,10,지리학이 생각보다 우리 삶에 많ㅇ느 영향을 미친다는 걸 알 수 있게 하네요.
9788964357774,10,국제 관계를 움직이는 사건들이 공간적 개연성을 가지고 있다는 시각이 독특하네요.
9788964357774,10,지리학에 대한 새로운 시각을 볼 수 있네요.
9788964357774,10,"지리학을 가지고 사회적인 문제, 환경의 문제등을 잘 분석하는책이네요"
9788964357774,8,역시 세상은 횡으로 종으로 연결되어있다는것을 느낄수 있는 책이네요.
9788964357774,10,지리가 떠오르는 주제가 될 줄은 몰랐네...
9788964357774,10,지리학적인 관점에서 세계 정세를 설명하는 방식이 흥미롭습니다.
9788964357774,10,"지리적 통찰을 통해 변화하는 세계를 읽을 수 있고, 대비해 나갈 수 있겠네요."
9788964357774,10,21세기의 국제적 흐름속에서 지리학의 중요성에 대해 예리하게 해석했네요.
9788964357774,10,"지리학을 여러 현상들과 같이 보니 책을 진지하게 바라볼 수 있었다. 인구증가, 기후변화, 환경문제 등등 그 중 제일 쉽게 읽히고, 많이 공부한 부분은 ｀기후 변화에 대한 진실｀이다. 재미있었다. 재미있게 공부한 것 같다."
9788964357774,10,지리 과목을 개별적으로 암기해야 했던 세대 입장에서는 국제정세의 흐름이라는 큰그림에 초점을 맞추니 지리학의 필요성이 달라 보이네요.
9788964357774,10,"지리학은 재미없다고 생각했는데, 사회현상과 엮으니 재미있게 다가오네요."
9788964357774,6,새로운 안목을 갖게 해주는 책.
9788964357774,10,지리학적 관점에서 해석하는 세계문제에 관심이 간다
9788964357774,10,지리학이 이렇게 재미있다는 것을 알려준다
9788964357774,10,지리학으로 세계를 알 수 있게 해준다
9788964357774,8,지리학 도서를 좋아하시는 분들이라면 아주 재미있게 읽을만한 책이네요.
9788964357774,10,지리학을 앎으로써 한반도의 지정학적 운명을 극복해 나가는데 든든한 밑거름이 될 듯 합니다.
9788964357774,8,흥미진진한 지리학적 통찰!
9788964357774,10,지리학에 대해 알려주는 좋은 책입니다
9788964357774,10,"지리가 없다면 세계지리, 한국지리, 경제지리생도들의 원성은 하늘을 찌를것입니다. 경제지리는 사라졌지만 이 책이라면 문제없습니다!"
9788964357774,10,"분노의 지리학, 공간의 힘에 이은 하름 데 블레이의 세번째 지리학 서적입니다.일반인도 재미있게 읽을 수 있어서 좋네요"
9788964357774,10,공간의 정치학!! 세계화 시대에 지리학의 중요성~~
9788964357774,10,국제정세와 지리학이 과연 무슨 연관이 있는지 궁금합니다.
9788964357774,8,국내 주요 일간지에도 비중있게 소개된 책으로 국제정세에 관심있는 분에게 추천합니다.
9788964357774,10,국제 정세의 흐름을 파악하는 책이라니 궁금하네요.
9788964357774,10,평소에 지리학에 대해서 궁금했었는데..기대되네요
9788964357774,8,서울이야기에 또 흥미를 느끼다보니 꼬리에 꼬리를 물듯 궁금해진 책.
9788964357774,8,"지리학이 필요한 시점인것 같은데,  어떤 책인지 많이 궁금하네요."
9788964357774,10,지리학에 대한 고정관념을 깨뜨리는 책이네요
9788964357774,10,개인적으로 이과쪽이라서 지리학은 배울필요없다고들하는데 저는 개인적으로 지리학은 의외로 흥미있는 소재라고 생각합니다. 이 책한번 여유있을때 사서 읽어봐야겠어욯ㅎㅎㅎ
9788964357774,10,자연 지리에서 인문 지리를 아우르는 풍부한 지리학적 지식을 배울수 있어서 좋습니다
9788964357774,10,지리학이란 생소하지만 세계의 흐름을 배울수 있어 좋을듯 하네요
9788964357774,10,"세계의 핫 이슈가 되고있는 지역들에 대한 진지한 통찰력이 돋보이는 책입니다.현재진행중인 복잡, 다양한 세계의 흐름을 정확히 짚어내어 향후 대한민국이 나아가야 할 방향을 제시해주고 있습니다."
9788964357774,10,"전 세계적으로 벌어지고 있는 일들에 대해 ｀지리적 시각으로 보지 않고서는 그 본질을 이해하는 것이 불가능하다｀는 견해에 동감합니다. 기후문제나 경제, 정치 등의 문제까지 세세히 살펴 볼 수록 더욱 그렇다는 생각이 들어요. 지금의 우리가 꼭 읽어보아야 할 책이 아닌가 합니다."
9788964357774,8,최근 뜨는 학문으로 여겨지만 지리학에 대해 세계적인 시각에서 다룬 책
9788964357774,8,지리학에 관심이 많거나 지리를 전공하고 싶어하는 고등학생들이 읽어보면 더 좋을 책이에요
9788964357774,10,"지리학에 관심은 많지만 어떻게 좀 더 알아야 할 지 궁금했는데, 도움이 될 것 같아요."
9788964357774,8,지리학이라는 틀을 통해 이해하기 어려운 국제관계를 알 수 있는 계기가 됐으면 좋겠네요
9788964357774,8,"지정학적 위치에서 특수성을 가진 우리나라 입장에서도 지리학은 무척 중요한데,관심가네요"
9788964357774,10,일반적인 지리뿐만 아니라 그를 통해 지금의 문제를 함께 하는 시간을 주길 바란다.
9788964357774,10,진짜 필요한 지리는 바로 이런것
9788964357774,8,지리학으로 보는 세계. 왠지 딱딱한 내용일 듯 하지만 호기심이..
9788964357774,8,지리학과 세계경제를 하나로 묶을수 있다니 신기하네요.
9788964357774,10,고등학생때 지리수업 이후로 지리에 통 관심이 없었습니다. 이 책이 그동안 무관심했던 지리와 환경 기후 등에 다시 관심을 갖게 만들어줄 것 같네요ㅎㅎ
9788964357774,10,지리학은 쉽게 접하지 못하는 분야인데 이 책은 딱딱한 내용을 쉽고 재미를 줄 것 같아요.
9788964357774,8,지리에 대한 생각이 달라졌습니다
9788964357774,10,자연지리부터 인문지리까지 이 세상의 변화와 흐름은 밀접한 관련이 있다는 저자의 의견에 절로 고개를 끄덕이게 되네요.
9788964357774,10,전 세계적으로 발생하고 있는 사건 사고들이 지리학적으로 어떤 관련이 있는지 궁금하네요. 또 앞으로의 일도 예측가능하다니...! 지리학적 관점으로 논한다는것이 흥미롭네요.
9788964357774,10,빠르게 변모하는 21세기 지구촌의 모습은 확실히 지리학과 밀접한 연관이 있는 것 같네요.
9788964357774,10,국제적으로 일어나는 모든 사건들에 대해서 지리학은 그 흐름을 알 수 있을 것 같습니다.
9788964357774,10,지리학을 통해 지금 일어나고 있는 일은 물론 앞으로 세계에 일어날 일을 미리 엿볼 수 있을 것 같아 기대됩니다
9788964357774,10,자연지리에서 인문지리까지 지리에 대해 잘 모르는 우리들에게 많은 도움을 줄 것 같다.
9788964357774,10,이번 메르스 사건을 겪으면서 지리학적 지식이 얼마나 중요한지 알게되서 이책이 새삼 기대가 되네요.
9788964357774,10,지리학에 대한 전반적인 내용을 다루고 있어 지리를 쉽게 이해할 수 있게 해주리라는 기대감을.......
9788968666636,6,"책을 어떻게 쓰든 저자의 마음이지만, 책 초반부에 세계 주요지역과 아닌 지역으로 나누는 부분이 너무 불편했다. 인간의 삶은 주요한 것과 아닌 것으로 나눌 수 없다. 서양 특유의 제국주의적 시각이 느껴진다. 서양 저자의 책에서 피할 수 없는 부분이긴 하지만..."
9788962911718,10,임용고시생들에게 필요한 책인 것 같네요. 한 번은 꼭 봐야 할 듯..
9788960517318,10,정말 잘 읽었습니다. 오랜만에 완독이라는 걸 했네요. 이 저자분 후속작도 계속 써주시면 좋겠어요 내용의 충실도나 풀어가는 방식이 정말 집중하며 읽기 좋았습니다. 좋은 책 만들어주셔서 출판 관계자분께도 감사합니다
9788960517318,10,"재밌고, 쉽고, 유익하기까지...독자들에게 친절한 책..."
9788960517318,10,개명저
9788960517318,10,"미국, 사우디, 이란 그리고 국제정치와 경제를 아주 간결하고 재미있게 서술해서 잘 읽었습니다. 정말 좋은 책입니다."
9788960517318,10,"술술 페이지가 넘어간다.  다 읽고나면 석유, 미국, 중동을 잇는 하나의 그림이 그려진다."
9788968660795,8,지리학을 시작하기에 참 좋은 책입니다. 맥나이트 자연지리학처럼 시각자료가 풍부해 내용 이해가 잘되는 것 같네요
9788958322061,6,지리학에서 필요한 기본적인 개념들을 다루는 개론서. 흥미로웠던것은 미국인 학자가 쓴 책이라서 내용이 상당히 ｀미국적｀이라는 인상을 받게 된다는 것이다.
9791160945089,10,아주 쉽고 깔끔하게 정리된 책이네요~~^^
