ISBN13,rating,review
9791158462802,8,"개의 문제 행동 원인이 산책 부족인 경우가 많다. 고양이 문제 행동 원인은 의외로 사냥 놀이였다. 개만 키워봐서 미처 몰랐다. 야생냥은 ‘사냥하고 먹고 싸고 자고‘ 본능을 스스로 충족할텐데, 집냥은 사냥을 못하니까 집사가 같이 해줘야(해드려야) 했다. 개와 고양이는 다르다는 걸 다시금 느꼈다."
9791158462802,6,"초보 집사들이 보기 좋은 책. 분량은 적지만, 영역동물인 고양이를 알아가기 위한 사례들과 꼭 알아야할 이야기들이 나와 있다. 저자가 문제 고양이 집사들을 컨설팅하는 프로그램을 했고, ‘세상에 나쁜 고양이는 없다‘ 인간이 문제를 만들거나, 방치한다.는 것을 좀 알라고 조곤조곤 좋은 말로 함."
9791158462802,10,기존에 고부해 애청자였고 고양이 관련 서적을 많이 소유하고 있어서 그렇게까지 새로운 느낌의 책은 아니었던 것 같아요. 그래도 읽으면서 제가 좋은 집사였는지 나쁜 집사였는지 책 내용에 비추어보면서 다시 한 번 반성할 수 있었습니다ㅠㅠ 더 노력해서 냥님을 모셔야겠어요..
9791158462802,8,사람이나 고양이나 양육자는 피양육자의 입장에서 양육해야하는 것이 진리. 중복되는 서술이 아쉽지만 고양이를 이해하게 해줘서 고마운 책.
9791158462802,10,"집사가 되었습니다, 두둥!집사가 되기전에 구매한 책을 열심히 읽어보려 했으나 잘 들어오지 않더니만집사되고 하루만에 통독했습니다. 실감이 팍팍나는 책, 동영상도 찾아보고. 도움 많이 받았어요.감사합니다."
9791188726257,10,앵무새를 키운 적도 키울 예정도 없으나 사진과 설명만으로도 충분히 즐겁고 좋은 책. 이 책 보고 나니 키워보고 싶어질 정도랄까~
9791188726257,10,앵무새 품종별로 사진 자료도 제공하고 앵무새의 대한 주의점과 방안을 해결해 주어서 좋았습니다.
9791188726257,10,"글이 간결하고 사진이 많아서 초보자 분들이보면좋을 거 같아요.장난감 종류(나무에도 종류 여러가지 설명, 장난감만들기 등)훈련 방법도 사진으로 다 나와있어요 저는 만족합니다"
9791162334133,10,캣맘 캣대디  들에게 필수 지침서!문제가 발생하거나 어려울때마다 읽게 되는 고마운 책이예요
9791162334133,10,전부터읽고싶던책이었는데드디어읽어요좋습니다★
9791162334133,10,적극추천합니다
9791162334133,10,길고양이를 돌보는 나같은 캣맘들에겐 필수^^
9791162334133,8,조금 내용이 이해하기 어려운 병이나 이름등이 나와서 약간 이해가 안되었지만 꽤 유익한 정보들이 많았고 재미있네요!!
9791162334133,10,공조을 위한 이 책을 구입하여 읽어볼수 있게 되어 진심으로 출간을 축하드립니다. 앞으로 모든 고양이들이 행복할수 있기를 바라며...
9788974796648,10,10살 노견을 키우며 언젠가 다가올 이별을 생각하며 이별이 끝이 아님을 우리는 영적으로 연결되어있고항상 함께함을 깨닫게 해주는 소중한 책. 동물은 영혼이 없다고 하는 기독교 등 대부분의 종교와 다른 고차원적인 불교의 관점이 참 맘에 와닿는다
9791195500901,4,"번역을 엉망으로 해서 초반에는 그나마 내용이 이해가 가는데 뒤로 갈수록 문장이 가관입니다. 이걸로 스터디를 하는데 내용 이해는 둘째치고 문장 해석이어려울정도의 발번역이많습니다. 엉망진창입니다.수면부족의 대학원생에게 시킨듯한 번역입니다. 스터디 8주차, 저혈압이 나았습니다."
9788934992998,10,고양이 마음을 알려줘요.
9788934992998,10,강아지도 그렇지만 고양이도 사람보다 빠른 속도의 시간대를 산다.하지만 고양이는 태어나서 고양이별로 돌아갈 때까지 세살의 마음을 가지고 살아간다.눈높이를 조금만 낮추고 단순하게 바라본다면 생각보다 쉽게
9788934992998,10,"주니어김영사라 아이들이 읽는 책이라고만 생각할수도 있지만 남녀노소, 고양이를 알고 있기만 해도 재미있게 볼 수 있어요! 그림도 너무 매력있는건 더할나위 없고요! 랜선집사 친구와 육아중인 친구에게 선물했어요! 4살 아이도 즐겁게 보고 있습니다^^"
9791187194729,10,"읽는분들의 관점에 따라 다르겠지만, 저는 공감되는 부분들이 많고, 아~ 이렇게 하는게 좋은거구나 하고 공부도 되서 아주 순식간에 읽었습니다"
9791187194729,10,아기 시츄 아찌와의 즐거운 소통을 위해 구입했는데 참 사길 잘했단 생각이 드네요. “개는 개다. 개는 개니까 막 대해야 된다는 것이 아니라 개는 사람이 아니니 개 그 자체로 이해하고 존중해야한다.” 무지개다리를 건넌 저자의 반려견에게 부치는 편지에서 참 많이 울었네요..
9788959759514,10,책이 두껍지도 않으면서 내용도 알찬거 같습니다. 가격도 부담되는 가격이 아니라서 부담없이 구입해서 읽어보고 활용해볼만하네요.
9788959759514,10,방 안에 보틀리움이 하나 정도 있다면 관상용으로도 인테리어에도 도움이 되지만 마음에도 안정감을 주어 일석 삼조의 효과가 있을 것 같아 보틀리움에 대한 관심이 갖게 되었는데 이 책이 도움이 될 것 같아 기대됩니다^^
9788997137138,6,햄스터를 처음 키워보는 사람들에게 유용한 책입니다. 다만 내용이 대부분 햄스터 인터넷카페에서도 볼 수 있는 것들이라 아쉽네요..
9788997137138,10,햄스터 기르기의 모든 것을 수많은 사진들과 함께 엄청 상세하게 알려주고 있네요~ 햄스터 키울 분들은 반드시 먼저 읽어야 할 필독서 같습니다~
9788997137138,10,햄스터 이미 키우는 상태에서 이 책을 알게되서 구입하게 됬어요 교보문고 가서 구매하려다 이 사이트 알게되어 다양한혜택으로 조금더 저렴하게 구매했네요 ~~
9788997137138,10,햄스터에 대한 기본 상식과 필요한 내용들이 알차게 담겨있는 책.햄스터를 키운다면 또는 키울 예정이라면 공부해야할듯
9788997137138,10,"몇년동안 햄스터 키우며 햄덕후가 됐어요.이런 책을 한번 써보고 싶었는데, 이미나와있었네요^^ 사람들이  햄스터들에게 좀더 관심을 가져주길 바라는 마음으로 구매하려 합니다. 누군가 햄스터에게 관심을 갖고 이런책을 출판한 것만으로도 기쁘고 고맙네요~"
9788997137138,10,와우~햄스터를 기르는데 필요한 책이네요~작은 동물이지만 소중하게 다루는 법을 다루는 책이 나와서 좋습니다~
9788997137138,8,구여운 햄스터를 키울때 알아야할것
9788997137138,8,이책읽고 예전에 햄스터를 키울때가 많이 생각났어요. 더불어 햄스터에 대해서 많이 알게 된것 같아 좋았어요.
9788997137138,10,책 오늘 받아보고 다 읽었는데요. 햄스터에 대해 알아야 할 기본적인 정보가 다 들어가있어요. 햄스터에 무지하면서 키우는 사람들이 제가 본 것만 해도 꽤 됩니다. 정말 많은 사람들이 봤으면 하는 책이네요.
9788997137138,10,"단순히 햄스터를 검색해서 얻는 몇 줄 안되는 단편적인 정보가 아닌생활 습관과 다루는 법, 행동의 의미, 사육법, 용품 등을 커다란 사진, 그림자료를 통해 알 수 있어서 유익합니다.나이든 햄스터를 돌보는 법까지 실려있어요.햄스터를 기르기 전 구입해 읽으면 도움이 됩니다!"
9788997137138,10,햄스터에 대해 잘모르고 키웠던 아이와 그의 부모를위한 지침서작고 가격이싸다는 이유로 버림받았던 아이들이 줄어들도록 할 수있는 따뜻한책
9788997137138,8,햄스터를 키우시거나 키우고싶은 사람들은 한번씩 읽어보길 권장합니다. 햄스터에 대해 상세하게 내용이 잘 구상되어 있습니다. 햄스터에 관심이 있는사람은 이 책을 구매해서 한번 보세요.
9788997137138,10,햄스터를 처음 키울때 길잡이로 추천합니다. 저도 햄스터를 키운지 햇수로 3년여 되어가지만 초반에 햄스터를 키우면서 했던 많은 시행착오들이 생각나는데 이렇게 확실한 레퍼런스가 있었다면 참 좋았을텐데요.. 사진도 귀엽고 내용도 충실합니다.
9788997242016,10,수초어항은 볼수록 신비한 별세계 같아요.  내용이 알찬 책이라 이대로  꾸며놓으면 집밖에 나가기도 싫을듯 해요.
9788997242016,10,원서로 가지고 있었던 책인데 번역서로 나와서 더 없이 반가웠습니다. 내용도 사진도 충실한 좋은 책이예요.
9788996176428,8,아버지께서 구피키우기를 시작하셔서 참조하시라고 책을 구매해 드렸습니다.제일 알고 싶어 하시던 구피산란과정을 알고 싶어 했으나 책에는 자세히 안나와 있어서 좀 아쉬운 감이 있다고 하셔서 아쉬웠습니다. 하지만 구피의 종류나 먹이 키우는데 필요한 환경같은 내용은잘 나와있습니다.
9788996176428,10,내용이 알차서 좋습니다~
9788996176428,10,물생활 시작하면서 좀더 잘 알고 싶어서 구매하게 되었어요~ 어떤 내용이 수록되어 있
9788996176428,8,열대어 구피를 기르는 사람들을 위한 유익한 정보가 실려있다.
9788996176428,10,구피를 더욱 이쁘게 품종개량을 하고 싶으신 분들의 필독서
9788997137428,10,추석 전에 책공장더불어의 신간 소식을 들었다. 책 한 권을 사면 유기동물 보호소에 6일치 사료가 후원된다고 했다. ‘곧 추석인데 너희도 잘 먹어야지‘ 하는 마음에 이 책을 샀다. 동물 책을 꾸준히 내주고 후원까지 하는 책공장더불어에게 늘 감사한 마음이다.
9788934991816,8,"모든것의 끝은 거의 “간식으로 보상해주세요.”로 끝나지만 자세히 들여다보면 간식 주는 타이밍이 각각 달라서 어찌보면 나는 가만히 앉아 글로만 읽으니 쉬워보이는게 아닌가 싶음을 느꼈다. 또한, 고양이에게 간식은 인간이 언제나 먹을 수 있는 간식과는 다름을 느꼈다."
9788934991816,10,"인스타그램 [catsia0705] 고양이를 키우는 집사라면, 고양이를 오래키워 더 심화과정케어를 원하는 만렙집사라면, 고양이를 사랑하는 애묘인이라면, 고양이에게 관심 생기기 시작하는 입문자라면, 고양이에게 관심을 받고싶다면~!! 꼭 읽어보시고 고양이를 봐보세요~ 그 시선과 의식이 달라질것입니다"
9788934991816,10,https://m.blog.naver.com/phka2002/222030641383대집사고양이상담소  책을 읽으면서 도움이 많이되었어요 궁금한것도 많이 알게되었고  화장실 긁어서 그부분에 대해 더알고 싶었는데 그부분이없어서 아쉬웠지만 둘사이 성향이 다른아이 더 가까워지는 방법도 궁금했어요 없어서 아쉬웠지만 합사방법을 좀더 해서 해보려구요^^
9788934991816,10,냥님을 3년째 모시고 살고 있지만 종종 아이가 이유없이 울거나 식탐을 보이면 어떻게 해야할지 왜 그러는지 이해하지 못하고 그냥 넘겨버리곤했는데 이책 읽고 어떻게하면 되는지 왜그러는지 알 수 있어서 이해가 쏙쏙됐어요ㅎㅎ 냥이를 키우시는 집사님이라면 갖고계시면 정말 유용할 책이에요 !
9791190101295,10,너무도 쉽게 생각하고 책을 펼쳤다가 당황스러워지는 전문용어들과 수치상의 기록들...  가볍게 생육을 야채랑 어떤 비율로 주면 되나 생각했다면 큰 오산이다.읽어도 읽어도 적응이 안되는 어색한  영양학 용어들과 생식하기위해 필요한 준비과정과  재료손질 보관등  자세히 이야기해둔 도서
9791190101295,10,"반려인이라면 필독서로 권해드리고 싶어요.그동안 알고싶었던 모든것들이 거의 쉽게 써 내려간 책이에요. 필수 영양소, 레시피 , 사료에 대한 궁금증 등.. 집에 한권씩 갖고 계심 유용할듯해요"
9788997242139,10,크레스티드게코 키우고 있어요.많은 도움이 될 것 같습니다!감사합니다!사진들도 너무 생생하고 예뻐요!!!!!
9788920992407,10,반려동물 책들이 엄청 많아졌는데 그중에 단연 돋보이는 DK 개 백과사전! 믿고 보는 DK에서 나온 댕댕이 백과사전이라니... 정말 소장가치 충분합니다.
9788938112736,10,보내주신 상품은 너무 깨끗하고 상품 배송시깔끔하게  도착했습니다. 구매처  추천합니다.
9788964943427,2,"별점 한개도 아까운 책이에요 ,, 내강아지 자연식 시작해볼까 하고 산 책인데 어떻게 이런 책을 쓸수 있죠 ?,, 포도는 정말 위험하다는걸 수의학박사가 모르는건가요 ? 이런책을 어떻게 팔수가 있는지 진짜 놀랍네요 강아지를 키워보기나 한건지 콩이 심장병을 유발할수있어서 위험하다는것도 모르나요"
9788964943427,2,"수의사가 쓴게 맞는지 의심될만큼 민간요법 이하의 내용. 개한테 아몬드, 자몽씨앗을 먹이라질 않나 피부염에 뜨거운 생강찜질? 자일리톨을 먹었다면 하루 정도 지켜보라고?? 자연식을 처음 시작하는 보호자가 순진하게 따라 하기엔 내 개한테 너무나 치명적으로 위험한 내용이 가득하다."
9788970758695,10,"우리는 고양이에게 선입견이 있고, 차별하는 것 같아요. 하지만 고양잏를 마주하면 그 사랑을 느낄 수 있지요. 이 책은 고양이를 좋아하는 사람들에게 유익한 책이네요..궁금하고 기대가 됩니다."
9788970758695,10,고양이와 친해질 수 있는 놀이 기대되네요
9788970758695,10,"냥이 관련 책을 몇년간 사 보지만 늘 2프로 부족한 느낌이었죠 왜 이렇게 집사 마음을 딱딱 못 맞추는 거야, 불만었죠 ㅎㅎ 특별히 골라 선물받은 이 책은 들자마자 마음이 충만해지는, 그야말로 집사와 냥이 모두 행복해지는 레시피, 만들어주신 분께 감사를~ 꾸벅~^^*"
9788970758695,10,이 책을 통해 고양이와 친해질 수 있게 되면 좋겠습니다.
9788997137268,10,이 책은 제목이나 키워드를 잘못 정한 것 같아요. 이 책을 사려고 맘먹고 검색해도 검색이 잘 안돼요. 토끼 키우기 <<이런 제목으로 토끼 키우기 시작한 사람들이 꼭 읽어봐야 하는 책인데... 보통 그렇게 검색할텐데... 너무 아쉬워서 남겨봅니다. 토끼 키우면서 꼭 필요한 책이에요~
9788997137268,10,토끼를 키우고 있는데 아플때 증상보고 빨리 판단해서 병원 데려갔어요~ 정말도움이 많이 되는 책입니다!
9788997137268,10,한국은 개/고양이 제외하면 정보 구하기가 힘든데 애완동물로서의 토끼에 대해 자세하게 다루어서 토끼집사라면 반드시 갖추어야 하는 책. 토끼 데려오기 전부터 미리 공부하시면 더 책임있는 집사가 될 수 있을 것임.
9788997137268,10,토끼를 키우고 있거나 키우실 분들은 꼭 읽어보셨으면 하는 좋은 책입니다!
9791186877487,10,"여러권의 컬리링북을 갖고 있었는데 솔직히 너무 복잡하거나, 빈틈없이 빼곡한 비밀의 정원같은 책은 보기만 해도 좀 질리는 면이 있습니다. 하지만 이 책은 왠지 아기자기한 분위기에 뭔가 이야기 하는 듯한 그림들이 보기만 해도 좋습니다~!"
9791186877487,10,"너무너무예뻐서 한권만 샀다가 다시 사서 친구들에게 선물하고 있어요, 정말이지 글자가 없다뿐이지 한편의 동화책같은 그런 예쁨이 있네요~"
9791186877487,10,색칠하기 좋아하진 않는데 엽서가 탐나서 샀음. 이쁨!!
9788985840170,8,애가 싫어해서 책에 나온 순서대로는 못했으나 ㅠ 틈날때마다 조금조금씩 마사지해주고 있어요. 익숙해져서 좋아해줬으면 좋겠네요 =) 그런데 보기에 귀엽긴하나 앞에 고양이사진으로 페이지를 잡아먹은 느낌. 마사지 팁에대해 더 나왔으면 좋았을 것 같아요. 한권쯤은 집에 두면 좋을 것 같습니다
9788985840170,8,"다섯냥이 모두에게 마사지는 실패입니다. 당췌 가만있지를 않아요.크흡 ㅜ..ㅜ지금 당장은 안되겠지만, 냥이들이 거부감이 덜 할수있게 시간을 두고 시도해봐야 할것 같네요."
9788985840170,10,"그전엔 대중없이 문질문질해주기만 했는데, 이제는 포인트를 짚어서 마사지를 해주니 고양이도 좋아하는 것 같아요. 야옹이의 건강에도 도움이 되길 바라며 읽어봅니다."
9788997137084,10,먼저 떠났어도 나를 기다려주는 강아지꼭 다시 만나자!
9788997137084,10,"강아지와의 시간이 행복했다면.. 그리고 혹시라도 반려동물이 아프다면, 혹은 나이가 10살이 넘었다면. 꼭 이책을 만나게 되기를이책을 만나게 되는건 운명과도 같다."
9788997137084,10,"사랑하는 반려동물을 무지개다리 건너로 먼저 보내야 했던 사람들이라면.. 책장을 넘기면서 하염없이 눈물을 흘림과 동시에, 천국에서 행복해할 아이의 모습을 떠올리며 큰 위로를 받을 수 있을 거예요. 저에게는 너무 고마운 책이네요."
9788997137039,10,"반려동물을 키우면서 항상 저 애는 무슨 생각을 할까, 왜 이런 행동을 할까, 하고 궁금해하곤 했는데 이 책이 그 대답이 되어줄 책이네요. 직접적으로 말할 수 없는 반려동물을 키울 때, 그리고 근처에 도와줄 전문가가 없을 때 두고 읽으면 좋을 것 같습니다."
9788997137039,10,반려동물과 인간과의 관계를 다루는 책
9788997137039,4,"제목은 인간과 개, 고양이의 관계 심리학이지만 내용은 심리실험 결과모음이다. 여러가지 주제로 심리학적 실험을 하여 통계를 내고 인간과 개,고양이의 관계에 대한 결론을 정리해 준다. 심리학적인 깊이 보다는 통계학적인 사실관계의 나열로 내용은 제목만큼 크게 흥미롭지는 않다"
9788996603504,8,꼼꼼하게 기술한 내용 +  두고 두고 찾아보기 쉬운 내용 정리도 장점..
9788996603504,6,"11년도 출판당시나 초보집사가 읽었다면 굉장히 유익했을 책이고,가독성이 좋고 내용도 풍부하고 글쓴이가 앞에서 얘기한 정말 초등학생도 이해하기 쉬운책이다.하지만 요즘 내가 관심가지고있는 반려묘의 행복과 자신감 키우기에는 도움이 되지않는 책이었다."
9788996603504,10,정말 유용하게 잘 쓰고있습니다모르는 부분도 알게되고 좋네요 :) 초보집사님들에게 추천합니다
9788996603504,10,고양이 10년째 키우면서 고양이 관련 책 많이 사봤는데 이 책이 젤 유용하고 정보도 많고 국내 실정에도 잘 맞게 나와 있습니다. 이거저거 많은 양을 담다보니 좀 어수선한 것도 있는데 찬찬히 훑어보면 도움이 많이 돼요. 냥이 초보 때 이런 책이 있었으면 좋았을걸 생각이 듬
9788996603504,10,고양이 책은 다들 <고양이 공부> 추천하더라고요. 고양이 입양 전 책 보면서 열심히 공부하고 있습니다- 재밌고 도움도 많이 되는 책이에요-
9788996603504,10,"전문적인 지식은 물론이고, 반려묘를 키우는 저자의 개인적인 노하우나 이용하는 사이트,먹이는 것,용품 등도 함께 소개되어 더욱더 유익하고 좋았다. 계속 읽으면서 이런 반려견책도 나왔으면 좋겠다..했는데, 쓰고계시다니 너무너무 기대된다..기다리고 있으니, 강아지 공부도 어서 출간해 주세요^^"
9788996603504,10,초급자용 책이지만 언제나 필요할 때 꺼내볼 수 있는 유용한 책입니다^^
9788996603504,8,하루만에 읽을정도로 쉽게 쓰여 있어요. 아래 댓글에서처럼 초보들에게는 어느정도 유용한 내용이지만 이미 키우고 계신 분들에겐 적합하지 않습니다. 저에게는 도움이 많이 되었어요 ^^
9788996603504,10,손그림과 손글씨로 아기자기하게 꾸며져있어서 쉽고 재밌게 볼 수 있다. 처음으로 고양이를 키우는 초보집사는 물론 고양이에 관심이 많은 어린 조카들에게도 권해줄 수 있을 것 같다.
9788996603504,10,지루하지 않고 금방 읽히는 책이예요. 하루만에 읽었네요. 처음 접하는 사람에게 추천할만한 내용이구요. 이미 키우고 계시는 분들에게는 적합하지 않아요~ 처음 고양이를 키우게 될 제 친구에게 선물하려구요~
9788996603504,4,"다른 외국작가들의 고양이 서적을 마니 읽어서인지...
기대치에 못미친게 사실이다....
다른 작가와 특별한건 엄었기에.......
고양이들의 집사들이라면 다 아는 정도의 내용이며...
그림과 사진이 미흡하다...."
9788996603504,10,재밌게 잘 풀어놨네요~ 고양이 키우시려는 분이나 키우고 계신분 ~ 추천합니다~ㅎㅎ
9788996603504,10,난독증이 있는데 글이 짧고 그림과 사진이 많아 너무 읽기 쉬워요. 레알 짜응!
9788985989855,10,"제 꿈이 수의사라서 찾다가 샀는데 정말재미있네요ㅎㅎ
수의사에 대한 정보가 자세히 나와있어서 만족했어요"
9788985989855,8,수의사의 꿈을 가진 동생을 위한 좋은 책!
9788985989855,10,10살아이에게 선물했습니다. 장래희망이 수의사거든요 ^^
9788997137404,10,"개, 고양이 반려인으로서 꼭 읽어야할 책. 구판도 잘 읽었는데 반가운 마음으로 개정판 구매합니다."
9788926898833,10,반려동물과 헤어짐을 준비해야한다면 꼭 읽어보세요. 반려동물과 이별한 경험이 있는 분들이라면 공감할만한 내용입니다.
9788926898833,8,반려동물을 떠나 보낸 경험이 있는 사람이 꼭 읽어야 할 책....펫로스 사랑한다 사랑한다 사랑한다 우연히 인터넷검색을 하다가 펫로스에 나도 모르게 멈추고 본 책이다.열두살 내 아이를 보내고 이상한 증상들이 여럿 있었던 나에게 내 증상을 설명해 줄 수 있지 않을까 해서
9788926898833,10,책을 받고서도 눈물이 나서 못 읽다 겨우겨우 눈물콧물 닦아내며 읽은 책...우리보다 시간이 금방금방 흘러가는 반려동물과의 시간을 소중히 ♡https://www.instagram.com/p/B_pGuQclR0Z/?igshid=bsyq59wcya3p
9791190427661,10,미쳤다리 미쳤다 ㄷㄷㄷ 보면서 소오름 돋는 책 오랜만이네요. #애묘인들이보면난리나는책 #인생은고양이처럼
9791196756840,10,많은 분들이 동물법에 관심을 가져서 그런지 이렇게 좋은 책이 나왔네요~ 이 책으로 인해 동물들이 더 살기 좋은 사회가 되길 바랍니다
9791196756840,10,좋아하는 단체인데 꼭 사서 읽어볼게요
9791196270292,10,책을 읽는데 왜 눈물이 왜 자꾸나지.
9791196270292,10,아직 멀었고 영원히 안 올 거라고 믿고 싶지만 언젠가 올 것을 아는... 떠남을 미리 준비하는 데 도움이 되는 책. 일러스트도 매우 정감이 갑니다.
9791196270292,10,반려동물을 키우는 사람들의 필독서! 이 책을 읽으면서 어릴 적 키우던 강아지가 떠올렸고 그 친구 떠나보내며 얼마나 큰 상처와 아픔을 겪었는지 기억해냈다. 그때 미리 이 책을 읽을 수 있었다면 얼마나 좋았을까... 지은이의 감동적인 울림은 많은 공감을 불러일으킨다.
8809254942867,10,컵이 가지고 싶어서 샀어요. 컵이 튼튼해보여서 마음에 들어요♡다이어리는 안펼쳐봤지만 내부구성이 이쁜거같아요 아마도..
8809254942867,10,"작가님 사랑해요... 출간 된 순간부터 갖고싶었지만 반려동물이 없었던 터라 장바구니에만 담겨있던 다이어리, 이제 저도 구매 할 명분이 생겼습니다! 우리 이쁜 레오 만난 순간부터 소중히 차곡차곡 잘 기록해나갈께요ㅠㅠ! 첫 장부터 마지막 장까지 너무 귀여워서 다이어리이지만 정독했습니다:‘)"
8809254942867,10,한가족이고 행복을 주는 반려동물의 애정을 담은 수첩이군요 이벤트로 머그컵 무릎담요 너무 고급지고 이뻐요 사용 잘하고 있답니다
9788925567952,6,삐뽀삐뽀 소아과에 비교하자면 내용이 소박하기만 합니다.  도서관에 가면 있는  큰활자책 같아요. 가격을 올려받으려고 책크기를 키운기 아닌가 합니다.
9788925567952,10,"저자 세분이 다 수의사이시고 펫닥, 한국동물병원협회장 등 경험이 많으신 분들이라서 무엇이 궁금할지 알고 있는 것 같이 잘 써주셨어요.ㅎㅎ 집에 비치해두면 응급처치시 유용할 것 같습니다.ㅎㅎ"
9788920992414,10,품종 카탈로그에 코리안 쇼트헤어는 없네...
9788920992414,10,고양이를 키우진 않지만 워낙 좋아해서 정말 흥미롭게 보고 있어요. 품종을 자세하게 소개하는 ‘품종 카탈로그‘랑 ‘고양이와 문화‘ 챕터가 특히 마음에 들어요. 그리고 너무나 아름다운 고양이 사진들... 정말 힐링됩니다.
