ISBN13,rating,review
9791160022360,10,반려인의 필독도서!!중간중간 강아지 사진들도 있고 강아지들의 대화도 있어서 재미있고 귀여워요무엇보다 우리 반려견의 마음을 좀 더 알 수있어 좋은것같아요
9791189930134,10,왕왕왕왕 너무 귀여움사랑스러운 책!!!
9788996603511,10,강아지 공부 목차를 보니 약 500페이지가 되네요. 마지막에 필요하실 분들위한 페이지가 적혀있네요. 내용이 더 알차고재미있습니다강아지 키우시는분들 한테 아주 유용할것같습니다
9788996603511,10,고양이공부도 재미있게 읽어서이번 강아지 공부도 바로 구매했습니다저번 고양이공부보다 내용이 더 알차고재미있습니다강아지 키우시는분들 한테 아주 유용할것같습니다
9791189385040,10,그림은 무지 귀여워요ㅎㅎ 다만 원래 고양이 관련 서적을 많이 가지고 있는 분들에게는 그다지 신선한 정보가 담긴 책은 아닌 듯 합니다. 처음 고양이 데려오시는 분들은 한권 쯤 갖춰두면 좋을 것 같아요.
9791188406043,10,고양이와 같이 살다 보니 고양이 관련 책들 좋아해서 구매했는데일러스트들이 하나같이 엽서 같고 너무 예쁘네요. >_<머리맡에 두고 아침에 일어나면 오늘 날짜의 귀여운 글귀와 그림으로하루를 시작하고 싶은 책이에요.
9788959895649,10,"이 책은 단순히 고양이를 알고 싶어하는 사람들을 위한 책이 아닌 고양이의 행동, 습성을 더 자세히 이해하고 개선하기를 원하는 사람들에게도 도움을 주는, 고양이 사전이라는 단어에 걸맞는 솔루션. 최소한 고양이와 함께 지내는 집사라면 꼭 한번은 정독해야 하는 책이다."
9788959895649,10,"저자의 ‘모조‘라는 개념을 따라 읽다보면 내 고양이와 공존하는 방법을 자연스럽게 터득하게 된다. 내용도 술술 읽히고 궁금하던 지점을 해결하기에 좋다. 초보집사부터 다묘집사, 문제묘 집사까지 모두에게 추천할 만한 책. 바이블. 고양이의 심리를 이해하고, 고양이의 자신감을 키워보자."
9788959895649,10,고양이를 이해하기 위한 책이에요항상 어려운 고양이의 행동에대해 또는 고양이와 행복한 삶을 위해읽고 또 읽어야하는 책입니다̊̈ :)
9788959895649,10,내 고양이를 좀 더 ‘고양이스럽게‘ 이해하고 싶다면 읽어볼만한 책. 집사력을 한층 업그레이드 시키고 싶다면 이 책을 통해 모조란 무엇인가를 정확히 이해해보자
9788959895649,10,고양이가 ‘고양이이기에‘ 가질 수밖에 없는 본능부터 시작해 행동 교정 솔루션까지 말 그대로 고양이에 대한 모든 정보를 담고 있는 고양이 기본서. ‘모조‘라는 개념 역시 흥미롭다
9788997137343,10,최고의 고양이 책
9788997137343,10,"전작보다 더 아기자기하고 촘촘해진 그림체가 새로운 캐릭터들(임시보호하고 있는 아기 고양이들, 베리)의 사랑스러움을 잘 살린다. 다섯 마리 아기 고양이를 키우는 고충과 보람을 담담하게 이야기하는데도 그 감정이 그대로 전해진다. 길고양이들이 직면하고 있는 현실도 잊지 않는다."
9788997137343,10,"어느 한 학생의 한 순간의 잘못된 선택으로 인해 엄마를 잃게 된 5마리의 새끼 고양이들을 작가가 맡게 되고, 그 하루하루의 일상을 일기형식으로 기록한 책입니다. 작가가 고양이의 특징을 잘 잡아내서 그림으로 녹여내는 것에서 애정이 느껴졌고, 마지막에는 독자를 위한 비밀선물이 한 가득있습니다"
9788997137343,10,3개월 아기 강아지 금동이를 키우던 때가 떠올랐다. 불린 사료를 먹고 색색 자던 모습이 너~어어무 예뻐서 세상에서 가장 사랑스러운 것은 아기 강아지라고 생각했다. 임보일기를 읽고 이제 아기 고양이도 내 사랑에 추가했다^^
9788972773245,2,"강아지 탐구생활이라는 책을 읽고 바로 이 책을 연이어서 읽었는데 잘 읽다가 중간에  책을 문장까지 통으로 베낀게 들어있어 진짜 확 깼네요,,, 이렇게 베껴써도 저자라 할 수 있는걸까요,,,,"
9788972773245,6,"본가에 주워 키운 암컷이 강아지 여섯을 낳아 그 중 다섯을 토실토실하게 잘 키웠는데, 여기저기 분양하고 한두 마리 데려와 지내려다 보니 찾아보았다. 3개월 동안 어미 형제와 함께 해야 사회성도 좋아진단다. 마당에서 막 키우는 것이 아니라면 이런 개정보 책은 한두 권 읽어봐야 좋을 듯하다."
9788972773245,8,반려견을 처음 키우는 이들을 위한 좋은 입문서입니다.저는 작년부터 시바견을 키우고 있는 견주입니다. 이 책을 조금 더 빨리 알게 되었다면 저희 강아지를 좀 더 잘 보살필 수 있었을텐데 라는 아쉬움이 들었습니다.예비반려인들과 초보반려인들에게 이 책을 추천합니다. ^^
9788972773245,10,반려견을 키우거나 반려견을 키우려는 분은 반드시 읽어봐야 될 책!
9788972773245,10,어서와 반려견은 처음이지...  맞아요.  그래서 잘 맞추고 싶네요
9788972773245,10,러브펫동물병원 원장님이 말해주는 반려견의 모든 궁금증을 책에 담았네요
9788972773245,10,러브펫동물병원 팬인데 책으로 정리되어 나오니 티비방송도 생각나면서 참좋아요
9788972773245,10,원장님을 책으로 만나니 반갑습니다.
9788972773245,10,반려견이라는 존재만으로도 사랑과 힘을 주는 내 순둥이에 대해 책으로 만나니 더욱 좋습니다.
9788972773245,10,소중한 만남. 소중한 시간으로 간직할수 있도록 서로를 이해하는데 공부가 필요합니다.
9788972773245,10,"모든 행동에 이유를 알면 서로 큰 이해에 도움이 될텐데 서로 원하는 것을 모를때가 제일 답답했었는데, 이 책을 통해 큰 도움이 된다."
9788972773245,10,집에가면 제일먼저 반갑게 맞이해 주는 우리 사랑둥이에 대해 깊게 다갈수 있도록 도와주네요
9788972773245,10,반려견과 행복하게 살아가기 위해 알아야 할 것들 총정리
9788972773245,10,사랑하는 강아지와 더 행복한 삶을 생각하게 됩니다.
9788972773245,10,저도 개를 키우고 있는데... 이 책을 읽고 다시 생각해봐야겠어요.
9788972773245,10,이 책을 읽으면 반려견이 어떤 생각을 하는지 조금 더 알 수 있을 거란 생각이 드네요. 기대해봅니다~~~
9788972773245,10,평상시 궁금했던 반려견의 문제행동에 대해 Q&Q로 정리해줘서 참 좋아요.사랑둥이 내 강아지와 더 좋은시간 갖을수 있을것 같아요. 땡큐
9788972773245,10,반려견을 처음 입양하려고 하는데 최인영 원장님 책 기대됩니다^^
9788997137329,10,인간과 다른 종에 대한 이해와 사랑. 사람이 사람답게 살기 위헤서 할 수 있는 것들에 대해 생각해 보게 된디.
9788997137329,10,"삼겹살, 족발 가게 앞을 지나칠 때마다 슬플거다. 삼겹살, 족발 접시(뱃살, 다리ㅜㅜ)를 들고 엄지척하는 간판 속 돼지 캐릭터가 에스더 친구들이니까. 과도한 감정 이입일 수도 있다. 하지만 작은 눈으로 눈 웃음짓는 에스더가 자꾸 생각나는데 어쩌냐."
9788997137329,10,"[정말 영리한 돼지. 소중한 생명체]반려견 반려묘를 키울때는 베이컨을 먹는 것이 이상하게 다가오지 않았던 주인공.어느 날 우연히 미니돼지를 입양하게 된다. 하지만 알고보니 에스더는 사육용 돼지였던 것.에스더를 키우며 베이컨을 굽다가 이상함을 느끼며, 어느 날 갑자기 비건이 된다."
9788997137329,10,"크게 죄책감을 불러 일으키지도 않고, 이러니 채식을 해야한다고 강요하지 않는다.  책을 읽는 동안 에스더가 되지 못한, 그래서 그냥 고기가 될 동물들(?)과 육식의 습관을 돌아보게 된다."
9788997137329,10,아기돼지의 입양을 통해 채식과 동물권에 대해 인식이 확장되는 저자들의 이야기가 솔직하고 흥미롭다. 불가능해 보이던 변화를 보며 긍정적인 자극을 받을 수 있는 좋은 책이라고 생각한다.
9791160072983,10,상세한 설명 완전 도움 됩니다
9791160854787,10,"고양이를 기르는 집 인테리어에서  조심해야 하는 것들고양이에게 꼭 필요한 것들을 알려주는 이책은 애묘인들이 원하는 인테리어들의 가장 이상적인 사례를 보여주는 책입니다 주인이 좋아하는 부분과 고양이가 좋아하는 부분이 합쳐져서 보다 아늑한 환경 사람과 고양이가 공존하는 삶의 공간이’란 어떤 모습일지 이런 질문에 해답을 알려주는 이책 일본의 아티스트, 골동품상, 인테리어 스타일리스트, 유명 인스타그래머/블로거 등 다방면의 뛰어난 센스를 지닌 이들이 고안해낸 고양이와 함께 살아가는 생활공간의 모습이 담겨 있습니다"
9791157683819,10,"좋아요~^^ 필요한 내용, 알고싶은 내용을 알게 되었습니다."
9791186389126,10,오늘 받았는데 옆구리 찢어진 책이 와서 교환중이라 표지와 안에 잠시 봤는데 인스타로 보다가 인쇄된 책을 받아들으니 성덕이 된 기분입니다. 고양이를 향한 작가님의 따스한 시선이 느껴지고 고양이를 반려하는 사람이 보면 좋을 거 같아요.일상의 평화로운 순간을 빛나게 하는 마법같은 책!!
9791186389126,10,웃다가 울다가 웃다가 울다가.
9791186389126,10,"사진도 그림도 글도 너무 따뜻한 책입니다추운 한겨울에 딱 어울리는 책!고양이와 함께 살고 있는 분이면 더더욱, 함께 살지않는 분에게도 더욱!! 추천 드립니다"
9791186389126,10,"냥이 셋 반려하는 집사로서 충분히 공감하며 따뜻하게 읽고 있어요^_^ 조끔조끔씩 아껴가며, 따뜻한 방바닥에서 엎드려서 귤까먹으면서 읽기에 딱좋아요 👍🏻🐾🐾🐾"
9791186389126,10,"애교냥 순둥이 맏형 째즈가 넘 사랑스러워 인스타에서 팔로우하고 폴이랑 보름이, 그리고 세영이랑 마당냥까지!! 집사님 두 분의 맘으로 아끼고 사랑하고 보듬고 한 가족처럼 지내는 모습이 늘 감동이고 웃음이 절로 나용! 이쁘고 사랑스러운 냥이들과 집사님 두 분 늘 응원합니당! 사랑합니다❤️"
9791186389126,10,많은 집사들이 인생은 고양이를 키우기전과 그 후로 나뉜다고 하죠! 인간에게 참 많은 것을 주는 동물들과 함께 교감하고 살아가는 우리들의 이야기입니다. 힐링 그 자체인 째폴보세 언제나 지켜볼께요!  째즈야 사랑해! :)
9791186389126,10,인스타로 처음알게 된 두집사님과 야옹이 형제들... 그 일상을 담은 책이 나왔다고 해서 정말 기뻤어요 좋은소식과 동시에 맏형 째즈의 부재로 마음이 아팠지만 책을 통해서 째즈를 더 오래 기억할수 있으니 그나마 다행이라 생각합니다. 째즈야 고맙고 사랑해.
9791186389126,10,"오래전부터 사랑스럽게 지켜본 고양이들~! 째즈는 고양이별에 있지만, 그 기억과 추억 간직하려 책 사보려고 들어왔어요. 스티커 욕심도 나구요^.^ 고양이를 사랑하게 된 중요한 존재의 책! 사람! 공간! 감사드려요~!"
9791186389126,10,째즈야 사랑하고 고마웠어 고양이별에서 친구들하고 잘지내고있어~세상 모든 고양이가 행복하길 바라며~
9791186389126,10,고양이가 있는 일상을 잘 담아준 책입니다 오랜 기간 함께 생활하며 고양이들의 엉뚱한 귀여운 모습을 포착해서 인스타그램 통해 자주 보다가 출간 소식 듣고 구매하게 됐어요 마당고양이들의 이야기까지 고양이를 키우진 않지만 덕분에 즐거웠던 순간들 함께 느낄 수 있어 감사했어요
9791186389126,10,"읽기가 아까운 소중한 선물같은 책이에요. 마음속 깊이 새겨두고 싶은 한구절 한구절 따뜻하고 감사한 마음으로 읽고 있어요! 책 내주셔서 진심으로 감사드립니다.  우리 모두에게 오래토록 기억될 그리고 앞으로도 더 많이 사랑받을 째즈야, 고마워!"
9791186389126,10,집사의 일상이 얼마나 행복한지 고양이가 주는 삶의 플러스요소가 얼마나 많은지더욱 더 실감나게 해주는 도서에요 제가 집사라서 너무 자랑스럽고 행복하게 만들어주셨어요^^
9791186389126,10,째즈냥께서 남긴 이 책을 소중히...한장씩 넘겨보며 오래도록 기억할게...째즈야 그곳에서도 매일 지켜봐주길...
9791186389126,10,째즈 행복하고 건강히 잘있다가 집사님 가실때 꼭 마중나와서 예쁜짓 보여줘 랜선집사이모도 덕분에 많이 울고 웃었어 많이 고마워
9791186389126,10,째즈야 고양이별에서 행복해야해!
9791186389126,10,째즈야 사랑해!
9788995784587,10,내용이 초보자가 이해하기 쉽게 되어 있어서 좋아요
9791196174415,10,진짜 고양이는 완벽한 룸메이트가 아닐까 생각해봅니다 홍조😍
9791196174415,10,"한 사람에게 콩깍지가 씌였다 벗겨지면 권태기가 오기 마련이다. 근데 반려동물에 콩깍지가 씌이면 벗겨지지 않는다. 우리 강아지, 수의학적으로 노령견이라지만 내 눈엔 항상 애기같고 매일 더 애틋하다. 홍조를 향한 작가님 마음도 비슷한 것 같다. 작가님도 홍조에게 콩깍지가 단단히 씌이신 듯^^"
9791196174415,8,"개냥이라는 게 진짜 있구나. 귀여운 홍조를 보고있자니 이런 고양이라면 나도 키우고 싶다 생각하다가도, 그런 홍조를 반려묘로써 충실하게 돌보고 모든 생활을 홍조 위주로 바꿔나가는 작가님의 모습을 보면 가벼운 마음으로는 입양할 수 없겠구나 싶어짐. 홍조와 작가님 언제까지고 행복하시길."
9791196174415,10,이잉 보고싶어요ㅠ 야옹서가는 냥이들 관련책만 나오는 건가요? 고양이는 정말 대단해 어째서 출판사 이름까지도 귀여운거지? 흑 ㅠ
9791188406111,6,글과만화가한페이지씩!참고하시라고~
9791188406111,10,올칼라판 부탁드립니다 ㅠㅠ
9791188406111,10,너무 귀여워서 웃게 됩니다. 이동 중에 보게 이북 좀 내주세요. 올칼라판으로요.
9791156623113,10,함께 하던 반려동물이 곁을 떠났을 때 꼭 읽어보세요
9788997137244,8,"아이가 고양이를 좋아해서 대리만족이라도, 싶은 마음에빌려왔는데들추다가 수루룩 훑어 버렸다. 히마리 없는 삽화가 잔잔한 일상 이야기와 어울려평온한 기분을 선사한다.동믈 좋아하면:-)"
9788997137244,10,너무 힐링되는 그림책. 2편을 원해요!! 기다릴게요 !
9788997137244,10,"고양이의 작은 몸짓도, 식물의 작은 새싹 하나도 무심히 지나치지 않는 섬세한 작가의 성정이 느껴진다. 일상 속의 기쁨도 슬픔도 행복도 쓸쓸함도 모두 담담하게 그려져서 더 깊이 공감하게 낸다. 글도 그림도 담백하다. 책의 만듦새도 깔끔하고 유기동물 보호소를 도우려는 취지도 좋다."
9788997137244,10,고양이책이 아니라 그냥 에세이로서도.. 너무 훌륭한 책입니다. 담담하고 깊이가 있는.. 추억이 슬프기만 한건 아니라는듯한.. 의연하게 견디는 작가님 모습도 아름답네요. 오랜만에 마음이 촉촉해지는 느낌이에요. 감사합니다.
9788997137244,10,"고양이 책 많고 많아 우리집엔 ‘고양이책 존‘이 따로 있을 정도인데, 그중 단연 최고는 이 책. 식물과 섬세한 일러스트와 고양이라니. 많이 웃고 펑펑 울었다."
9788997137244,10,책공장더불어 출판사 책이라 믿고 봅니다. 그림도 예쁘고 고양이 좋아하는 분들께 선물하기 좋은 책이에요. ^^ 2권도 기다릴게요
9788997137244,10,소소하게 재밌고 마지막에 ㅠㅠ 담담해서 슬프다..
9788997137244,10,"나라면 무심코 지나쳤을 별 것 아닌 일들을 청각, 시각, 후각, 그리고 마음을 다해 느낀다. 이를 글과 그림으로 담백하고 미지근하게 표현한다. 작가님의 섬세한 관찰력과 따뜻한 마음씨를 닮고 싶다."
9788997137244,8,고양이와 살아본 적이 있다면 공감 100%
9788997137244,10,"선물 받아서 봤어요. 아, 울고 웃고 짠하고 감동적이에요."
9788997137244,8,고양이가 귀여워서 계속 책을 넘기다가 끝에서 너무 슬퍼졌다.
9788997137244,10,고양이와 함께하는 삶은 언제나 행복하죠 설령 털이 폴폴 날리고 어느날 내 가방에서 고양이 쉬 냄새가 나더라도.. 뒹굴대며 고양이 머리를 만지는 오후는 항상 행복해요. 제 아이에게도 그 기분을 나눠주고 싶네요
9788997137244,10,지금까지 본 고양이 그림책 중 최고였다(이토 쥰지의 ‘욘 & 무‘를 생각하며 잠깐 망설였음). 그림도 글도 섬세하고 아름답다. 낄낄거리다 역시 울고 만다. 다음호가 있다니 완전 기대된다!노땡한테도 보여줘야지. 그리고 조카3호한테도.
9788997137244,10,요즘 고양이 책에 푹 빠져있다.너무 재밌게 본 책~
9788997137244,10,그림체가 마음에 든다.나도 고양이 책을 하나 써볼까 하는 마음.
9788997137244,10,"자연과 그림과 고양이를 사랑하는 사람들은 (나포함) 안사고는 못배길책 ㅎㅎ 익살스런 고양이그림도 귀엽고,소소한 일상이야기가 넘 따듯하고 무엇보다 이책을 구매하면 보호소 냥이들에개 3일치 밥이 기부 된다니 꼭 사세요 두번사세요 ^^"
9788952235602,6,고양이에게 사랑받는 집사가 되고 싶다. 초보 집사들이 읽으면 좋을 것 같다.
9788952235602,8,그림이 귀엽지만 내용은 평범함 다만 고양이를 정말 처음 들이시는 분들에겐 추천
9788952235602,8,"한 장 한 장 명쾌하게 필요한 내용을 설명한 듯. 아직 기분을 이해하기는 멀었지만, 여튼 가끔 보면 편해 하는 건 맞는 거 같다."
9788952235602,8,동물 병원마다 꽂혀있길래 읽은 책. 책장에 두고 그때그때 찾아가며 읽기 좋다. 그림이 많아서 읽기 쉽고 책 자체가 귀엽다
9788952235602,10,"얇고 간단한 고양이 행동학 입문서. 귀엽고 구체적인 일러스트가 고양이 몸짓언어 이해를 높여준다. 아무리 마음 내키는 대로 귀여워해주고 싶더라도, 먼저 고양이의 시선과 매너 기준으로 고양이에게 접근할 수 있도록 가이드하고 있다. 주변에 고양이를 처음 기르는 사람에게 선물하기 딱 좋다."
9788952235602,10,친구가 고양이를 굉장히 좋아하고 사랑한다. 그래서 생일 선물로 고양이에 관련된 책을 선물해 주면 어떨까 해서 선물해 줬는데 굉장히 마음에 들어했다.
9788952235602,6,몇년을 같이 살아도 내 고양이의 기분은 알지 못할것같다.하지만 숨만쉬어도 고양이는 완벽하다
9788952235602,8,유용한 실용서.
9788952235602,10,고양이 키우시는 분이라면 추천할게요!책 정말 재미있고 내용도 이해하기 쉬워요!저희 고양이가 방어적인 공격모드인걸 알게되었습니다 ㅋㅋ고양이 기분 이해할때 쉽고 재미있어요 ;)_
9788952235602,10,집사 16년차인데  결혼하고 아이들이 고양이를 좋아하지만 애완이 아닌 또하나의 존재로서 인식하게 하고 싶어 공부용으로 사려합니다
9788952235602,10,행복하게 살려면 소통부터 잘되어야 한다. 그 소통의 기본이 되어주는 책. ㅎㅎ 고양이를 키우면 어떤 일이 벌어질지 궁금한 사람 초보집사들에게 재밌게 읽힐듯! 집사 경력 8년차인데 <고양이와 함께 나이 드는 법>이 좀 더 뭉클하고 현실적이고 도움도 많이 됐다.
9788952235602,6,고양이라는 동물을 처음 접하는 사람들을 위한 아주 기초적이고 상식적인 내용이네요. 좀 더 자세한 고양이의 습성을 알고 싶은 사람에게는 부적절.
9788952235619,6,마지막 날까지 함께 할 내 삶의 소중한 존재들. 부디 건강하고 행복하길 바란다. 기본적으로 알아두면 좋은 내용들이다.
9788952235619,8,고양이를 키우는 집사라면 읽어보세요. 다른 고양이 관련 책들보다 쉽고 그림이 많아서 읽기 편해요
9788952235619,10,책 내용 정말 좋아요 ㅜㅜ 설명도 쉽고 그림은 귀여워서 금방읽어요!! 책에 문제가 있었지만 알라딘에서 좋게 해결해 주었습니다 :)
9788952235619,10,두 마리 반려묘가 슬슬 나이들어가고 있어서 주문했어요 간단하고 알기 쉽게 설명되어 있어서 좋아요
9788952235619,10,12세 8세 냥이 두마리 키우고 있어요. 이제 노묘나 다름 없기때문에 아플때 못알아챌까봐 걱정되어서 샀습니다. 고양이에 대해서 많이 안다고 자만했는데 이 책으로 재밌게 고양이 공부 새로 하고 있어요. ㅎ
9788959130207,8,열심히 샀던 고양이 책들 중에 이게 제일 좋았다. 수의사가 직접 사례를 들어 하나하나 친절하게 잘 알려준다. 읽기도 편하고. 요새 보는 고양이를 부탁해의 책 버전 같은 느낌이랄까. 도움을 많이 받았다.
9788959130207,10,"고양이판 ˝우리 아이가 달라졌어요˝ 느낌의 책이다. 오랜 시간 고양이들과 함께 살면서도 잘 모르고, 답답한 부분이 많았는데 이 책을 읽고 궁금증이 많이 해결되었다. 가장 좋았던 점은 고양이들의 문제 행동 별로 원인에 대한 설명과 대처법이 자세히 설명되어 있어서 언제든지 찾아볼수 있다는 것!!"
9788959794386,10,강아지랑 어떻게 놀아줘야 할지 몰랐었는데 이 책으로 많은 놀이 방법을 알 수 있을 것 같아요. 티비에서 나오는 것들은 너무 기초적인 것들이라서 아쉬웠는데 좀더 체계화 된 놀이 방법들이 가득합니다. 정말 좋아요 강추!
9788965181521,10,강아지 자연식 궁금해서 구매합니다.
9788965181521,10,강아지를 키우는 입장으로써 이것저것 해주고픈 마음에 한번 구입해봤습니다 요즘은 인터넷에 많이 들 나와있지만 그래도 좀더 좋은 정보 유익하게 책장에담아둘 수있다는 만족감으로 정독중인데 참 좋습니다~!
9788965181538,2,"최악.고양이별 케이스가 많고 인간에 맞춰진 영양식이라 해도 과언이 아닐 정도로 고양이가 먹지 말아야 할 것 주의해야 할 음식들 모두 넣어서 그냥 음식자체에 영양이 많으면 좋은거라고 해논 거 같은 느낌.고양이에게 렌틸콩,아보카도는 왠만해선 급여 말라고 하는데 아보카드 40g을 넣으래 미친"
9788965181538,4,요리 레시피 책을 보고싶은게 아니었고어떤 재료를 써도 되고 안되는지영양배합을 어떻게 해야하는지 알고싶어 구입했는데 레시피책에 가깝고 너무 내용이 간결하다. 서점에서 봤으면 구입 안했을 것..
9788997242061,8,레오파드 게코를 처음 기르는 사람 혹은 오랫도안 기르고 있는 사람들이 레오파드 게코를 기르는데 도움이 될만한 정보가 많이 담겨 있는 책입니다. 책에 나와있는 부분들 중에 자신에게 맞는 사육방식을 찾아 참고용으로 활용하기에 좋은 책입니다.
9788964941539,10,이번에 강아지를 키우게 되어서 개에 대한 책을 몇권 사봤는데 이책이 가장 읽기 쉽고 효과적이었습니다 좋은 주인보다는 좋은 리더가 되어야겠다고 생각하고 강아지를 대했더니 오히려 화장실도 잘가리고 저를 더 따릅니다 개 키우시는 분은 꼭 읽어보세요
9788997137114,6,생각보다 책이 너무 얇아서 놀랐습니다ㅠㅠ
9788997242054,10,좋아요 책이 알차네요 비싸지만 잘샀어요!!
9788997242054,10,아이가 행복하길 바라기에~
9788991958753,10,타란툴라를 가지고 온날 아이가 어떻게 할지 몰라  이 책을 구매해 달라고 해 사주었습니다 도착하자 읽고 자신감이 생겼는지 혼자서 밤에 먹이도 주고 다 먹었는지 확인하는 모습에 미소가 지어지네요
9788997137022,10,가슴을 뭉클하게 만드는 책인 것 같습니다. 개 역시도 하나의 생물로서 그들도 그들만의 감정을 가지고 있고 그 감정을 표현하지 않아도 사람들과 같이 나눌 수 있을 것입니다. 그런 점때문에 사람들을 반려견을 키우면서 행복함과 웃음을 얻을 수 있는 것 같습니다. 여기 치료견 치로리처럼 말입니다.
9788971903414,10,개를 훈련시키는 것이 이렇게 재미있는 줄 몰랐다. !! 내용이 재밌다
9788996176473,10,기니피그 사육사들에겐 너무나도 중요한 책
9788972214816,8,사전류라 가격이 만만치않지만 올컬러에 선명한 사진이 마음에 듭니다. 다만 저자가 유전학에 관한 얘기를 상당부분 넣어두어서 그쪽에 문외한인 저로써는 아쉽네요.
9788972214816,10,너무 마음에 듭니다. 유전에 대해 상세히 나오는데 정말 잘 샀다 싶더라구요. 다만 아쉬운건 각 품종에 대해 더욱 자세한 설명이 있었더라면 더 좋았을 것 같아요. 쉽게 접히기에 아주 좋습니다.
