ISBN13,rating,review
9791185330587,10,이 책은 자연식을 해주고 싶은데뭐부터 해야할지 모르는 집사님들 다양한 자연식을 해주고 싶은집사님들에게 정말 도움이 많이 되는 책인건 확실하네요간이 필요없으니 똥손 요알못인 저에게도 좋은 책..!!
9791188700127,10,고양이 좋아하는 막내를 위해서 한권 사봐야 겠어요알차게 보이네요^^
9788970273006,10,정말 오랜만에 전 분야를 통틀어 가장 실용적인 책을 만났네요. 원래 후기를 잘 쓰지 않지만 작가님께 감사의 인사를 드리고파 글을 남깁니다.
9788970273006,10,만들기 쉽고 강아지가 너무 좋아해요요기에 조금씩 응용해도 넘 좋았어요
9788970273006,10,반려견 수제간식 처음 접하시는 분들도 어려움없이 따라할 수 있도록 가이드해주고 강아지 특성에 맞는 간식들 해줄 수 있는 레시피들이 많아서 좋은거 같아요
9788970273006,10,손쉽게 따라할 수 있을것같고 무엇보다 영양정보까지 나와있어서여러 식재료들에 대해 공부하기도 좋은 것 같아요!
9788970273006,10,"간식을 줄때마다 배탈나지 않을까, 피부에 안좋지는 않을까하는 걱정을 덜게 될 것 같아요! 쉬운레시피부터 있으니까 차근차근 따라하다보면 반려견에 대한 마음도 더 커지고 유대감도 더 생길 것 같아요:)"
9788970273006,10,넘 읽고싶은책이에요! 두마리 강아지들을 키우는데 요즘 사먹이는 간식들도 걱정이고 ㅠㅠ 손수 만들어 먹이고는 싶지만 방법을 잘 몰랐거든요~~!! 꼭 읽어서 아이들간식 만들어주고싶어요☺️☺️☺️
9788970273006,10,반려동물을 키우다보면 이것저것 해먹이고 싶게 되더라구요.레시피가 있다면 좀 수월하겠다 생각했는데 이런 책이 나오다니 짱 좋네요~~기대만땅입니다.
9788970273006,10,블로그를 통해서 봐왔는데 책으로 더 다양한 레시피를 보충해서 책을 출간하셨는데 보통 책들보면 쉬운부분이나 이런건 기록을 꼼꼼하게 하지않고 넘어가는데 이책은 다 되어있고 부록도 잘되어있어서 넘나 좋아서 초보자들도 따라하기 쉬울꺼같아요!!
9788970273006,10,평소에 블로그이웃으로 기웃거리며 강아지 간식만들기에 도움받았었는데 드뎌 책 출간으로 더많은 종류와 방법을 알려주셨네요.분명 애견인에게는 많은 도움이 될것이고 구입하셔도 후회없으실거예요^^
9788997242085,10,기다렸던책이라 바로구입!
9788985840231,10,내가 의사가 아닌 이상 이보다 더 전문적인 지식은 오히려 독이 될 것 같다. 딱 이정도의 지식이 좋은 듯..다양한 질병의 가능성을 염두하고 병원에 가서 검사를 해달라고 할 수 있게 되었으니 만족함
9788985840231,10,"고양이 질병사전을 가지고 있는데, 그것 만으로는 병원 가야할지 판단이 안 설때가 많아서 한권 더 구매했습니다. 갖고 있던 책보다 병명에 관한 지식은 적게 담겨있지만, 병원에 가야할지 말아야할지 증세 판단을 하는데 훨씬 요긴하네요."
9788985840231,8,상황별로 대처법이 잘 나와있고 알고리즘으로 나누어져있어서 좋다. 하지만 아무래도 응급처치이다보니 얕은 지식이 주를 이룬다. 책이 좀 두꺼워지더라도 좀더 깊이있게 서술되어있더라면 하는 아쉬움이 큰 책.
9788985840231,8,고양이는 아파도 티를 많이 안내는 녀석들이라 잘 살펴보지 않으면 초기에 못잡고 심해지는 경우가 많은데 이런 책 한권 읽어두면 미리미리 내 고양이 건강을 챙길수 있을거 같다. 상황별로 대처법이 잘 나와있고 병원에가야할지 집에서 케어해도 괜찮은지 안내해줘서 좋은책! 앞으로 도움이 될거같다.
9788985840231,8,전문적인 정보들이 아니라 아쉽지만 덕분에 아이들이 병원 가는 횟수가 줄 수도 있을 거 같다.사실 동물의료비가 지나치게 비싸다.지역에 따라 치료비가 들쑥날쑥인건 물론이고 부르는 게 값인 병원도 적지 않다.전문가들이 적극적으로 나서서 건강보험 못지 않은 좋은 제도를 찾았으면 한다.
9788997242078,10,모란앵무를 기르고 있어서 출간되자마자 샀어요! 이번주에 온다는데 정말 기대되네요. 읽고 좀 더 우리 모란앵무를 잘 키우고 싶어요.
9788959524273,10,완전 초급이나 입문하시는 분들께는 책이 조금 어려울 것 같아요. 어느 정도 도안 볼 줄 아시고 기초가 있으신 분들께 추천드립니다. 아이템도 다양하고 모델견 사이즈까지 구체적으로 나와있어서 정말 편리해요.
9788959524273,8,책에 나와있는 옷이 이뻐서 우리집 강아지에게 손뜨개 옷을 만들어주고 싶다.
9788996476658,8,동물을 안 좋아하는 사람은 콧웃음 치겠지만 동물을 좋아하는 사람이면 공감하고 이해하며 좋아할 이야기.
9788996476658,10,"하늘은 스스로 돕는 자를 돕는다지만, 그 역시도 무언가 계기가 있어야 시작할 수 있는 것 아닐까. 완전히 구제불능 상태에 있던 한 인간이 고양이 한마리를 만남으로써 스스로 돕게 되고 이윽고 세상 앞에 당당한 인간으로 서게 되는 드라마틱한 실화. 왜 영화로 만들어졌는지도 알만하다."
9788996476658,6,동명 영화를 봐서 책도 보게 됐는데 밥 진짜ㅠㅠㅠㅠ 죽기 전에 만나보고 싶다. 씹덕이!🐈 제임스 보웬이 ‘밥은 제 인생에 이루 말할 수 없을 만큼 긍정적이고 중대한 영향을 미쳤습니다‘라고 한 말이 백번천번 이해되는 반려인1.
9788996476658,10,한 사람과 한 고양이의 교감과 우정이 너무나 대단하게 느껴진 이야기.
9788996476658,8,재미있네요. 누군가를 보살피면서 자신의 자아를 찾는다는.. 누군가를 지켜야 하기 때문에 내 삶을 더 치열하게 살아야 하는.. 몰입감도 있는 좋은 책인거 같습니다. 밥 같은 고양이를 키우고 싶네요..
9788996476658,10,놓을래야 놓을 수 없는 책입니다. 제임스가 잃어버린 밥을 되찾아 안아올릴 때 저도 모르게 울어버렸어요; 그냥그런 얘기겠지 했는데 전혀! 강력추천!
9788996476658,10,감동 그 자체입니다. 고양이 밥은 그의 삶을 바꾸기 위해 나타난 천사가 아닐런지.. 유튜브로 고양이 밥의 모습을 보니 더 사랑스럽네요.
9788996476658,10,anapolis님. 책을 읽어보시면 아시겠지만 밥은 제임스의 곁을 떠나지 않습니다. 탈출전문가라고 하면 제임스의 곁을 떠나고 싶어 안달이 난 뉘앙스이기에 내용상 적합하지 않는 것 같습니다. 오히려 책을 제대로 이해하고 번역 혹은 편집했다는 것에서 더 신뢰가 갑니다.
9788996476658,6,"아직 책 사지는 않았는데 번역이 걱정되는군요.
목차 중에서 ｀달아난 아티스트 (The Escape Artist)｀는 ｀탈출 전문가｀정도의 늬앙스인데, 혹시 읽어보신 분들 번역 어떤가요?"
9788996476658,8,배구경기에서 늘 강조하는 것은 기본기다. 기본이 잘 되어있어야 한다고들 한다. 삶의 기본은 무엇일까? 더 가지려는 경쟁에서 혹시 기본이 무엇인지 잊은건 아닌지... 고양이 밥이 다시 주인공에게 알려준다... 삶의 기본을...
9788997242047,10,가격이 좀 부담되지만 괜찮은 책입니다.
9791160870633,10,우리가 별 생각없이 먹던 돼지고기가 이 책을 읽고나니 돼지에 대한 고마움과 미안함을 느끼며 먹게 되었다. 원저자의 해박한 지식과 정성어린 번역이 돼지에 대한 유익한 정보와 돼지를 다시 보게 되는 계기를 만들어 주었다. 이 출판사의 다른 동물 책들도 사보겠다는 마음이 든다.
9791190427227,8,알라딘에서 우연히 책을 빼들었는데 그자리에서 다 읽어?버렸다. 인생은 짧고 고양이는 귀엽지. 인정.
9791190427227,10,작가님 사진과 글은 따라올자없지길에 태어난 우리의 이웃 길고양이
9791190427227,10,제목부터 절 이끌리게했네요. 사진과 함께 글이 다정하고 따스웠습니다. 이용한작가님 책은 언제나 구매하게 되네요. 이세상 모든 길냥이들이 행복하고 건강했으면 하고 바랍니다:)
9791190427227,10,그저 귀여운 사진집인줄로만 알았다. 중간중간 길지않게 길위에서 태어난고양이들의 이야기가 써져있는데 나는 고양이를 사랑하고 반려하는 집사로써그 짧은 글에 씌여진 아기고양이와 어미고양이에게감정이입되며 무던히도 슬퍼지던지
9791190427227,8,"고양이는 귀엽고 작가의 글은 빛나지. 지구에서 가장 아름다운 생명체 고양이, 그 고양이의 빛나는 한때인 아깽이 시절을 담은 사진을 보고 있으면 저절로 힐링이 된다. 사은품으로 주는 탁상달력과 함께 선물용으로 구입했는데, 앉은자리에서 다 읽음."
9791190427227,10,힘든 삶을 견뎌내야 할 길아가들이지만 마냥 슬프지많은 않은 것은 작가의 따뜻한 시선이 반영된 때문일 것이다. 훌륭한 고양이는 끝까지 살아남는 고양이라는 말이 와닿는다. 끝까지 버텨라 귀요미들아.
9791190427227,10,너무 너무 귀엽다아깽이 달력도 너무 귀엽다정말 인생은 짧고 고양이는 귀엽다!
9791190427227,8,페이지가 프레임이 있는 구조라 사진이 조금 답답해보여요. 그래도 사진에 글씨나 낙서가 없어서 좋네요. 고양이는 무척 귀엽습니다.
9791190427227,6,"책 내용은 좋아요. 사진은 두말 할 것 없구요.문제는 인쇄. 인쇄가... 별 3개를 빼고 싶을 정도입니다책 완성본 받고 저자가 속상하지 않았을까, 라는 생각이 들 정도네요.   사진이 중심인 책인데 값을 올리더라도 사진을 즐길 수 있게 해줘야 하는 건 아닌가요"
9791188077311,10,"반려견도 가족이니 먹는 것 하나도 꼼꼼히 따져서 만들어 주면 좋겠죠. 간단히 10분이면 된다니 도전해 볼 만 합니다.수제 건강식, 우리 댕댕이들을 위해 준비하면 좋을 것 같아요. 이런 교과서 하나면 이제 강아지 밥 걱정 끝~"
9791189584214,10,"이제 3살이 되어가는 반려견(비숑)을 키우면서 사람보다 더 짧은수명을 가진 반려견들이 어떻게하면 더건강하고, 더 안전하고, 더 행복하게 우리와 살다가~생을 마감한 그들을 떠나보낼지를... 걱정하고,고민 하였었"
9791189584214,10,"짜임새 있는 순서와 예쁜 구성, 그리고 사진으로 보여주니까 더 쉽게 우리 강아지에게 마사지 해줄 수 있겠어요. 어쩌면 소홀했는지도 모르겠어요. ""이렇게 잘 챙기는데 설마 아프겠어? 뭐가 불편할까? 얘는 행복한 편이야."" 하면서요. 이 책을 보면서 내심 미안해져서 이제 더 잘 케어해줄거랍니다^^"
9788998697600,10,다른 강아지 자연식 책들이랑 차별되는 장점은강아지 체중별로 각 재료의 그램수가 적혀있어요얇지만 정말 알차요. 추천추천!!!
9788997137336,10,7살 딸아이와 함께 읽었어요  아름답고 귀여운 그림이 아이의 시선을 사로잡았고요.  따스한 글귀가.. 부드럽게 제 마음을 모두 표현해줘서 위로 받은 기분이 들었어요.  오래오래 소장하면서 마음이 힘들때마다 함께 하고 싶어요.
9788997137336,10,사람이 죽으면 먼저 간 반려동물이 마중나온다는 얘기를 들은적이 있다. 하지만 그 이야기는 내게 너무 막연했다. ‘우주식당에서 만나‘ 이 말은 어찌나 위안이 되는지 모른다. 우리 희동이가 마중나와 기다릴 곳이 우주식당이구나. 진짜로 만날 수 있겠다. 참 다행이야.
9788997137336,10,"우주식당에서 만나,짧지만 긴 여운이 남는 그런 그림책이이예요. 우리가 고양이를 만나서 얼마나 소중한 시간들을 보내고 있는 지 살다보니 잊고 있었던 부분을 생각나게 만들어 줬어요.삽화를 그리신 일러스트 작가님도 고양이집사 이셔서 공감되는 그림, 귀여운 그림 감사합니다."
9788997137336,10,눈물이 또르륵 흐르다가 결국은 굵은 눈물 쏟아내게 만드네요. 우리 모두 “우주식당”에서 만나요.
9788997137336,10,나도 꼭 우주식당에서 만나고 싶은 고양이가 있어요.  이 세상에서 나를 제일 사랑해주었던 나의 고양이. 너무 서툴고 잘 몰라서 잘 해주지 못해서 미안해.
9788997137336,10,"7년차 집사입니다. 고양이와 살면서 변한 내 모습, 동물들을 보며 애정을 보낼 수 있는 사람이 된 것을 책을 보며 다시 깨닫고 공감할 수 있었습니다. 반려인이거나 반려인이었던 분들은 10번 읽으면 10번 다 울 수 있을 그런 따뜻한 책."
9788997137336,10,"반려동물을 가족으로 맞아들이고, 같이 살고, 떠나보낸 사람들이 읽으며 엄청 공감할 책. 그림 안에 따뜻한 마음이 느껴져요. 압축적이고 정제된 글은 한 편의 시같아요. 반려동물과 함께 살지 않는 친구들에게도 선물했어요."
9788997137336,10,작은친구들이 주는 기쁨과 슬픔에 대한 이야기. 그 아이들을 알기전과 알고난 후의 내 삶의 변화를 돌이켜보게 된다. 먼 훗날 나의 소중한 아이들을 우주식당에서 꼭 만나기를 열심히 바래본다.
9791186877937,10,냥이들에 호찌삼촌에 여러가지 배경들로 더더더더 풍성하게 돌아온 ˝또 색칠해보라냥˝ 도안 너무 귀여워요. 호찌삼촌의 등장으로 더 따듯한 분위기의 도안이 많은 것 같아요! 대만족입니다
9791186877937,10,색칠해 보라냥에 이어 이번에 또 색칠해 보라냥~ 정말 소장각 일러스트 넘 귀여워요^^:) 고양이 마을에 호랑이 삼촌 정말 그림속 스토리가 연결되는 느낌이고 힐링용으로 정말 쵝오~ <또 색칠해 보라냥> 정말 동물컬러링북 완전 강추 합니다.~ 넘넘 좋아요~~~ 짱짱~!!
9791186877937,10,"저기요...ㅜ.ㅜ 전 아직도 색칠해 보라냥을 반도 못했다구요... 근데... 이렇게 또 새로운 보라냥이 나와버리면.... 또 사고 싶어지고, 그러면 쟁여놓고... 크흑... 그러면 오늘도 일단 열심히 성실하게 색칠해 보라냥 부터 색칠하렵니다... 기다려~~~~ 또 색칠해 보라냥~!!!"
9791188850280,8,내용도좋고배송도빠르고매우굿입니다
9788997137282,10,흑백사진이 좋았다. 윤기도 숱도 적어진 털보다 눈에 더 집중할 수 있어서. 눈을 바라볼 수 있어서. 평소 우리 개한테 '눈이 호수인 우리 금동아'라고 부르는데. 정말이지 개들의 눈망울은 맑은 호수 같다. 나이가 들어도 그렇다.
9791161652344,10,고양이 다루는 법에 대한 A to Z가 사진과 함께 충실하게 설명되어 있다. 저자가 수의사라 신뢰도 면에서도 믿음직하다. 개인적으로는 고양이 약먹이는 법이 사진까지 더해 설명되어 있어서 이 부분이 가장 유용했다.
9791161652344,10,"고양이 키우는 법에 대한 여러가지 책을 읽어보았는데, 담고 있는 내용도 충실하고 저자의 솔직하고도 진지한 태도가 정말 좋았습니다. 주변에서 딱 한 권만 보겠다면 이 책을 추천하고 싶네요."
9791161652344,10,초판을 가지고 있어요. 잘 읽고 있습니다. 새 판 나온 거 축하합니다~ 꼭 읽어 봐야 할 책이에요!
9791196174408,10,읽고싶어요~^^
9791196174408,8,히끄도 귀엽고 글도 잘쓰시네요 :) 책에서 따듯함이 느껴집니다. 잘봤습니다.
9791196174408,10,고양이를 사랑합니다.  언제고는 고양이와 함께 살고 싶은 꿈을 가지고 있어요. 지금은 히끄의 매력에만 빠져있지만요. 알레르기가 갑자기 사라졌음 좋겠어요.
9791196174408,10,히끄야 고마워!!
9791196174408,10,고양이로 인해 새로운 인생을 살고 있습니다
9791196174408,10,정말 사랑스러운 책입니다 동물과 인간의 바람직한 공존을 보여주는 반가운 책이예요^^
9791196174408,8,길 위의 생명들이 사람과 함께 어우러져 살아갈 수 있는 세상이 오기를...
9791196174408,10,"어떤 존재를 알게 되고, 가까워지고, 사랑하게 되고, 정들고, 그러다가 그 존재가 거의 모든 것이 되는 과정을 히끄를 통해 담담히 보여준다. 히끄 때문에 내내 미소지으면서 읽다가 어느 순간 눈물이 나는 신기한 책. 우리 냥이들과의 첫 만남도 떠오르고 그만큼 책임감도 더 커진다. 히끄야 건강해!"
9791196174408,10,얼마나 많은 고양이들이 얼마나 많은 저마다의 영혼을 구원하고 있는지를 생각하면 이유없이 코끝이 시큰해진다. 이건 한 사람을 구원한 고양이와 그 고양이에게 구원받은 인간의 사랑스러운 이야기이다.
9791196174408,10,최근 들어 읽은 고양이 에세이 중 가장 좋았습니다. 몰입도 최고!
9791196174408,6,아들과 도란도란 함께 읽은 책이란 것만으로 아름답게 기억될테다.
9791196174408,6,"한 권의 책이 사람을 변화시키긴 어렵지만, 한 마리의 고양이가 인생을 바꿀 수는 있습니다. ^^"
9791196174408,10,히끄한테서도 힐링을 받지만 히끄아부지가 쓰신 글도 뭔가 위로를 받는 느낌이에요. 담담하게 써내려가신 글이 뭔가 좋았어요. 등신대도 너무 귀엽고^^
9791196174408,10,역시 소문대로 재밌다. 히끄의 얼굴형이 귀엽고 히끄 자체로도 매력있지만 저자와 히끄가 함께 성장하는 드라마가 있어서 좋다.
9791196174408,10,하루에 조금씩 읽고있습니다. 힐링되어 좋습니다.
9791196174408,10,책을 보면서 계속 미소가 지어진 건 오랜만이네요.읽기만해도 마음이 따뜻해지는 책이었어요 잘 읽었습니다.
9791196174408,10,사진도 이야기도 히끄도 너무 좋아요
9791196174408,10,무한한 매력을 가진 고양이 히끄와 제주도 시골마을의 소박한 풍경이 보기만 해도 마음에 위로와 평안을 주네요
9791196174408,10,고양이를 너무 좋아하지만 사정상 직접 기르지 못해 다양한 고양이 서적으로 대리만족 하고 있는 제게 있어 새로운 보물 같은 책입니다. 고양이 히끄만의 매력도 넘쳐나지만 집사와의 케미도 읽는 사람을 행복하게 만드는 느낌이 넘쳐납니다.
9791196174408,10,범상하지 않은 매력의 소유자 히끄와 그 아부지의 엄마 미소를 부르는 이야기들이 넘쳐납니다. 히끄의 귀엽고 시크한 사진만 봐도 시간 가는줄 모르겠네요.
9791196174408,10,소리없이 소복이 내려앉은 흰눈처럼 히끄도 히끄아부지도 서로에게 그런 존재가 된거 같아요..히끄와 히끄아부지 덕분에 주위를 더 돌아보게 됩니다
9791196174408,10,한장한장 히끄를 사랑하는 사람들의 마음이 절절히 느껴지고 와닿았다 묘연은 정말 존재하는구나 생각했고 히끄로 아부지를 포함한 많은사람들이 행복할수있구나 싶어 나도 더없이 행복해졌다.
9791196174408,10,길냥이 두마리를 기르는 집사로 산뜻한 책을 만났네요
9791196174408,10,히끄와 히끄아부지 이야기. 너무 사랑스러운 책이예요~
9791196174408,10,등신대 받으려고 지금 주문합니다 ㅠㅠㅠㅠㅠㅠㅠ히끄야 ㅠㅠㅠㅠㅠ
9791196174408,10,아이를 키우면서 내가 자라고 내가 더 많이 사랑받음에 가끔 놀라울 때가 있다. 히끄아부지에게 히끄는 그저 지켜주고 싶은 존재가 아니라 서로 얼마나 의지하고 서로에게 좋은 영향을 주고 있는지 그 잔잔한 따뜻함이 이 책의 글과 사진에는 묻어 있다. 마음이 힘들 때 다시 열어보게 될 책이다.
9791196174408,10,사랑둥이 히끄~!~~ 얼른 읽어보고 싶어요
9791196174408,8,히끄에 대한 아부지의 애정이 느껴지는 책
9791196174408,10,히끄는 사랑입니다~~~♥
9788934978329,6,이분 책은 올컬러로 나와야.
9788997137213,10,"길를 떠도는 개에게 해를 가하지 않았으면 좋겠다. 개들이 무슨 죄가 있나? 사람이 길에 개를 버렸고, 개는 그 길에서 살려고 노력할 뿐."
9788997137213,10,"생각보다 가슴아픈 대목이 많아 읽기가 쉽지 않았다. 역자의 바람대로 101번지 골목길 개들에 대한 위로를 넘어, 인간과 동물들의 더 나은 삶에 대해 생각하는 기회가 될 수 있는 좋은 책이라고 본다."
9788997137213,10,읽는 내내 슬플 것 같지만 현실을 직시하기 위해서 읽고 싶네요. 애완동물을 키운다는것 쉬운 일이 아니라는 것을 사람들이 심각하게 생각했으면 좋겠어요. 입양이나 결혼처럼 애완동물과 가족이 된다는것도 그만큼의 책임감이 필요해요
9788997137213,10,버려진 개들이 함께 모여 도로 위를 걷다 뛰다 하는 모습을 본 적이 있다. 그 개들은 언젠가 누군가의 집에 사람들과 함께 있었던 존재들이었을 것이다.
9788997137213,10,"어머니께서 유기견과 유기묘에게 밥을 가져다 주는 일을 하고 계신데, 어머니께서 꼭 추천하신 책"
9788997137213,10,15년 동안 키워온 강아지를 떠나 보낸 뒤에 정말 많은 것을 느꼈습니다. 누구 하나 함부로 할 수 없는 존재들입니다. 버려질 수 없습니다.
9788997137213,10,책의 마지막 장을 닫는 순간 12마리 아이들이 내 마음속에 오롯이 새겨졌습니다. 읽는내내 부끄러움과 죄스럽움에 마음은 힘들었지만 꼭 권해주고 싶은 책이네요.
9788997137213,10,소중한 책 모두 읽어보세요
9788998798055,10,애완동물과의 동행에 트러블이 생겨 좋지않게 끝나는 경우를 많이 봤는데요.  이 책은 동행을 위한 꼭 필요한 책이라 생각되네요. 강추 합니다.
9788998798055,10,조이독에서 예전에 나온 책(이안 던바)과 겹치는 내용이 많다. 처음 멍멍이 키울때 필요한 웬만한 내용은 다 들어있다. 이 책 하나면 굳이 온라인 강의를 수강하지 않아도 됨. 그림 꼼꼼
9788998798055,10,"저희 개는 집을 비우면 전선도 다 끊어놓고 휴지 신발 등 전부 다 물어 뜯고 먹어놔서 정말 걱정이였는데 이책을 읽고 콩 훈련을 시켜서 지금 많이 좋아졌어요, 이런 고민있으신분들 추천합니다~"
9788998798055,8,배변훈련 이렇게까지 설명해준 책 처음인듯우리강아지 해봐야지
9791195761135,4,이런 종류의 책들이 다 그렇다고는 하지만 한장에 패턴들이 너무 정신없이 그려져있어서 보기힘듭니다
9788964942284,10,강아지 처음 키우시는분이거나 얼마 안키워서 잘모르시는분들에게는 정말 많은 도움이 되겠네요 저도 20여년 키웠는데도 모르는게 간간히 있더라구요ㅎㅎ 금방 읽게되네요 2시간도 안걸린듯
9788964942284,10,강아지를 키우려면 꼭 알아야 할 훈련법들이 있기에 추천합니다.
9788964942284,10,강아지를 기르면서 일어날 일을 대비하는데 좋겠네요.
9788964942284,10,강아지를 키우는 사람으로서 갖고 싶은 책이네요! 저자가 반려동물가로 강아지와 행복하게 살 수 있는 여러 비법을 자세히 친절하게 알려주어 좋고 실제 노하우가 가득 담겨있어 많은 도움이 될것 같습니다. 꼭 한번 읽고 싶고 매우 기대됩니다!
9788964942284,10,우리 강아지가 벌써 11살이다. 그러나 먹을 것 줄 때만 열렬히 반긴다. 나와 우리 강아지의 의사소통에 어떤 문제가 있는지 이제 제대로 진단할 수 있겠다.
9788964942284,10,사랑하는 내 가족 반려동물과 함께 오랫동안 살 수 있는 방법등을 얻을 수 있는 좋은 기회가 된 것 같아 너무 좋습니다.
9788964942284,10,개도 생각하고 말도 합니다. 말이 우리말이 아니라서 그렇치 즉 표현이지요. 초보자나 초보자가 아니라도 이책 한권을 정독 한다면 누구보다도 개를 더 아끼고 사랑하는법을 알게되죠. 반려견을 어떻게 다루냐에 따라 모두가 더 즐거운 반려견과의 삶을 누릴수 있을것 같네요. 적극추천합니다.
9788964942284,10,강아지와 함께 생활하는 데 있어서 도움이 되는 정보가 많은 것 같아요~ 기대됩니다!!
9788964942284,8,아이와 반려견에 대한 오해를 벗게 해줄 수 있을거 같네요
9788964942284,10,진정한 반려동물과의 삶을 위한 지침서라고 생각한다~~많은이들이 이책을 보기를 기대해본다~~
9788964942284,10,강아지가 좋아하는걸 알고싶어요
9788964942284,10,나는 우리강아지에게 몇점짜리 주인일까?나만생각했었던 주인이였던것 같아서 다시한번생각해보게 되네요.
9788964942284,8,강아지와 함께 하기 전에는 아무 것도 몰랐는데 알아야 할 것들도 많고 해서는 안 되는 것들도 많고 아무튼 강아지의 생각을 아는 것이 참 중요하더군요. 책으로 모든 것을 배울 수는 없겠지만 좀 더 알아가는 것 같아요.
