ISBN13,rating,review
9788934990659,10,무지개다리건넌 반려견이 유독생각나요!아이들도 함께 따뜻하게 지내고 그렇게 이별까지 모두지켜본 때라 아직도매일같이 그림도그리고 그리워해요. 이땐어땠을까? 지금이라면 우리강아지는 어떤마음일까? 그렇게 이야기도하는데 책을 읽어보면 정말 그때우리강아지 마음까지 알수있고 웃음짓게만들책 같아요
9788934990659,10,아이들이 반려견과 소통하는데 큰 도움이 될 것 같은 책일 것 같아요!~
9788934990659,10,요즘 부쩍 아이들이 강아지 키우고싶어해서 관심을 많이 가지고 있어요.아이들에게도 저에게도 미래 가족이될 강아지에게도 큰 도움이 될거같아요. 기대되네요^^
9788934990659,10,방금 딸아이가 무슨 책에서 봤다면서 강아지가 꼬리 흔드는 게 무슨 뜻인줄 알아? 하품하면 무슨 뜻일까? 물어봤는데.. 이책 너무 좋아할 것 같아요.
9791196719425,10,"컵이예뻐서 구매했는데, 어느덧 책을 펼치고 읽고있네요"
9791196719425,8,내용은 유투브 영상 그대로 옮겨적은건데 두께도 있고 전 책이 더 좋아서 맘에들어요
9791196719425,10,노견 키우는 친구에게 선물하려고 구매했어요.
9791191393002,10,반려동물과의 이별은 상상하고 싶지도 않은 두려운 순간이지만 마냥 외면하고 피할 수만은 없다는 것을 느꼈다. 내가 준비가 되어있을 때 반려동물도 더 편안할 것이라는 생각이 든다.
9791191393002,10,저희 강아지가 나이가 나이인지라 펫로스에 대해 생각해보게 되더라구요... 미리 대비하고 싶어서 이 책을 읽어보게 되었습니다. 반려동물을 키우면서도 펫로스에 대해 잘 알지 못했는데 책을 통해 펫로스를 더 잘 이해할 수 있게 되어서 좋았습니다.
9791191393002,10,"스트릿 출신 고양이 두 마리가 벌써 5년, 3년이 되다 보니 그 이후의 시간들이 걱정이 되어서 구매한 책. 가만히 바라만 보고 있어도 행복한 존재가 어느 날 내 곁에서 사라진다고 상상만 해도 눈물이 날 것만 같다. 그렇지만 언젠가 사랑하는 반려동물과 건강하게 이별하려면 읽어야 할 책."
9791170431114,10,강아지 키우면서 올바른 교육을 제대로 못해 분리불안이 너무 심해졌어요그러다 알게된 훈련이 잘못됐습니다 책을 통해 정말 많은거 배워가네요~~~ 읽으면서 공감할수 있고 쉽게 이해할수 있어서 따라해보려고요~~~ 넘재밌게 읽어 강아지 키우는 친구들에게 추천하고 있어요! 도움이 많이 되었습니다
9791170431114,10,"처음 반려동물을 반려하시는 분들이라면 꼭 읽어보셔도 좋을 책입니다.초보도 트레이닝하는 법, 커밍시그널, QR코드로 영상도 볼수 있고 중간중간 꿀팁도 있어서 정말 좋아요.꼭 읽어보셨음 좋겠어요."
9791196219321,2,책 겉모습만 이쁘지 정작 내용은 부실하다. 반려견에 관해 알찬 내용을 기대했지만 실망스러웠다.
9791196219321,6,"어떤 시그널이 있는지 대강 파악하기에는 좋지만, 다른 사람들이 지적한 대로 너무 간단해서 시그널들 간에 어떤 차이점이 있는지 배우기는 어렵네요. 그림이나 사진이 풍부한 건 좋았습니다."
9791196219321,10,강아지의 몸짓언어와 더불어 강아지를 반려한다는 것에 대해 깊이 생각해 보게 된다. 강아지를 반려하고 있다면 강력추천
9791196219321,10,"한국어로 번역 출간되기만을 몇년을 기다려왔던 도서  "" 카밍 시그널 ""이 책을 두손에 드는 순간 참 설레이고도.반갑고. 기뻤습니다.책을 너무 기대하면 실망한다. 책의 내용이 가볍다고 하시는 분들도ㄷ 계시지만. 과연 그럴까요.저의 대답은No ! No ! 입니다.책의 내용의 깊이를 떠나서. 반려견키우는 반려견인들 과 반려견을 키우지 않으시는 분들이라도 알고 있어야 하는 것들입니다.특히 반려견을 키우시는 반려견인들라면 더욱더 반려견과 소통하기 위해서라도요.이 책은 책의 내용을 평기하고 하는  그런 후기를 남기기 보단 . 이 책을 추천하고.읽어야 하는 이유를 소개하는것이 더 좋을것 같네요...카밍 시그널의 저자인 투리드 루가스 여사님의 프로필을 단 몇줄로 소개되어 있어 ,간략히 이야기 해드리겠습니다.투리드 여사분은승마 인스트럭터（instructor） 1년,저널리스트（journalist） 3년 , 말 조련사 11년 기타... 으로 일해오셨던분입니다.그러다   무슨 인스트럭터（instructor로 교육을 받고 다시 무슨 독 아카데미에서 인스트럭터로 졸업하신 분입니다.(제가 번역이 안되서리 ^^;) 1970년도에 노르웨이 켄넬 클럽의 인스트럭터가 되어오비디엔스(복종경연대회) 와 아질리티의 심사위원 이 되었고,1970년 ,1973년는 재난 구조견 트레이닝도 다루었습니다.  1969년도 부터는 , 최고의 오비디엔스 독 켄넬의 칼럼 담당으로 일했고 , 1992년부터는 주말의 클래스나 캠프 , 지도등으로 전세계에서 강의를 시작했습니다. 카밍 시그널은 , 여사분께서 그의 동료들과 1980년대에 많은 개들을 연구한 결과 였으며, 1996년 도에  On Talking Terms With Dogs: Calming Signals 라는 책을 집필 했습니다. 카밍 시그널의 책은 , 미국의 세계적인 독 트레이너 테리 라이안에 의해 미국 소개되어 지면서  베스트 셀러를 기록한 책이기도 합니다. 또 여사분은 , 그의 노하우를 살리고서 개와 주인을 트레이닝한 Norwegian  Hagan Hundeskole 창설 했으며 , Pet Dog Trainers of Europe  창설 멤버이며 대표자이기도 합니다. 여사분의 웹사이트Calming Signals Community http://www.canis.no/rugaas/또 이책이 출간되까지 도움주고.추천글까지 남겨주신  미국의 독 트레이너 테리 라이안 여사분에 대해서 소개가 너무 미흡하더군요. 이 분도 세계적으로 저명한 독 트레이너 입니다. "" 반려견을 칭찬으로 가르친다는 훈련을 ""확립하신분으로 많은부분에서 기여를하며 활동해오신 분입니다.테리 라이안 여사분 특집이 아니니 이분에관해서는 여기까지...카밍 시그널에 대해서 잘모르시는 분들은왜 이 책을 읽어야 하는지를 모르시기에,카밍 시그널란 무엇인지를 소개 부터할께요. 영어로 표기한다면 Calming Signal． ""Calm""란  안정되게 한다, 달랜다 고 말한 의미에서 그러니까 불필요한 다툼(트러블)을 피하기 위해서. 개 자신의 입장을 상대에게 전달하거나. 상대를 안정되게 하거나달래거나 하기위해서 보이는 시그널로모든 개들이 선천적(유전적)으로 갖추고있는 비음성적 언어입니다. 그럼 우린 왜 이 카밍 시그널을 알아야하는 것일까요?카밍 시그널은 개들이  공격이나 스트레스,공포, 등 자신이 바라지는 않는것에 대한 차단과 예방, 신뢰의 안전 확보 그리고 무엇보다 자신을 이해 받는 것이기  때문입니다.그리고인간과 반려견 사이의 이해의 상위가생기는 많은 이유가 바로 이 언어에문제가 있기 때문인데요.  우리가 반러견을 이해해. 그들이 내보내는시그널을 읽어 내는 것으써, 반려견들에게서 보이는 행동의 사전해결이 가능하기때문입니다.우리가 그들의 언어인 카밍 시그널을이용하는 것으로써  자신의 반려견이나다른 타인의 반려견 까지 , 스트레스나공격성을 사전에 피할 수가 있습니다.이 카밍시그널이라는 책을 통해서,개들의 언어를 배우고 , 관찰을 시작해그들의 시그널을 이해 할수 있다면자신의 반려견이,다른 타인의 반려견이무엇을 전달하려고 하는지를 이해할 수있는것 으로 보다 정확 대처를 할 수가있습니다.반려견의 입장에서 반려견을 이해할 수가있게 되는 것이죠. 또. 불안, 지친상태. 집중력이 떨어진 상태,명령어를 이해 힐 수 없는 등의 시그널을나타내기 때문에 반려견의 교육이 더욱쉬워집니다. 반려견이 자신을 지키기 위한 행동으로공격의 해동을 보일때도. 우리는 그들의언어인 카밍 시그널로 반려견을 진정.억제시킬수가 있어집니다. 또한 공포심을 가진 반려견에 자신을신뢰할수 있는 인간으로 생각하게 하거나반려견의 스트레스를 경감 시켜 줄 수있습니다. 개들이  보이는 시그널의 각각의 의미를이해하고,스스로 사용할 수가 있을 정도가되면 개라는 동물을 공부하는데 있어최고의 학습이 되어집니다. 지금까지 우리인간이 확인할 수 있는 카밍시그널은 30여가지가 되고, 개들이간진  카밍 시그널은 훨씬 더 많다고합니다.이 책에서는 우리가 쉽게 확인가능한14 가지의  카밍 시그널의 종류와 사용법을 소개하고 있습니다. 그리고 반려견의 스트레스와 경감법.실제 훈련에서의 카밍 시그널  사용법.반려견이 카밍 시그널을 잊어버렸을때에 대처 요령들이 잘 소개되어 있구요.그리고  우리인간이 그들의 언어인 카밍시그널로 반려견과  소통하는 방법을조언 해주고 있습니다.그리고 개인적으로 정말 마음에 와닿었던파트 7과 , 파트 8의"" 반려견들의 특권 퍼피 라이센스""공감 × 10000000000000000000000진짜 중요한 부분...책의 내용을 몽땅 그대로 옴겨 놓고싶은마음이 굴뚝같았습니다.우리는 이 책을 통해서 반려견이 전달하려고하는 메세지를 실제로 이해하는것으로 반려견과의 최고의 친구가될 수 있습니다.그리고 중요한것 개의 최대의 특성은 ，먼저 다툼(트러블)을 (피하기 위해)해결하려고 확실하게 째빠르게 시그널을 내 보낸다는 겁니다.개라는 동물은 매우 민첩한 움직임을 가진 동물로써 그 움직임을 우리인간이따라기 힘들 정도 입니다. 짧은 시간내에 여러가지의 시그널을보이기도 하구요.시그널을 관찰하는  능력을키우고, 재빠르게 상황을 관찰파악하고 해결해줄수 있는 능력을 키우셔야 하는데요.책을통해서 배운다면. 지금보다는 좀더빨리 상황을 파악하고 대처 하실수가있을것입니다."
9791196219321,2,내용이 너무 빈약해요. 강아지 키우는 사람이라면 인터넷에서 한번은 읽었을 것 같은 누구나 거의 다 알고 있는 내용... 솔직히 14000넘 아까워요. 두번은 안 읽을거 같아요
9791196219321,8,전체적으로 설명들이 간략하고 길지않은 점에서는 긴 글에 집중 못하는 사람들이 빠르게 읽을 수 있어서 좋지만 세부적인 부연설명이 많이 생략된 편이라 너무 아쉽습니다....ㅠ 카밍시그널에 대해 초보일때 입문용으로는 좋을거 같지만 더 배우고자 하는 사람들에게는 설명이 부족합니다.
9791196219321,10,"나의 소중한 반려견을 이해하고 내가 잘못하고 있는 점이 있는지 알기 위해 구매했습니다. 보기도 편하고, 나를 다시한번 돌아볼수 있게 하는 책 입니다. 한번쯤 읽어보셨으면 좋겠습니다."
9791196219321,10,개이득
9791196219321,10,사람이 먼저라고 얘기하는 사람들도 보았으면 좋겠습니다 개를 좋아하지 않을수 있지만 세상은 인간만의 것이 이니라 같이 시는곳이라고 말하고 싶습니다
9791196219321,10,반려견 주인들이 꼭 읽어봤으면 좋겠네요. 그래서 반려견에게 스트레스도 덜 주고 다른사람에게 피해도 안줬으면 좋겠습니다.
9791196219321,10,광고문자에 바로 주문하긴 처음이네요 기대됩니다
9791125429852,6,이런 지침서들은 두고두고 보는 책이라읽었다 강아지가 증상을 보일때나 다시 찾아봐야지
9791125429852,10,"개를 키우면서도 한 번도 이런 책은 생각을 안 했는데, 있네요.맨날 키우면서 이뻐할 줄만 알았지, 행동특성을 파악하게 되고 어디가 아파서 한 행동인지를 알게 해주는 점이 좋네요."
9791191308259,10,10분 놀아주고서 아이고 피곤해 하며 건성으로 오뎅꼬치만 휘적였던 불성실한 집사는 웁니다ㅠㅠ 우리 집 고양이를 위한 최선의 솔루션을 찾을 수 있을 것 같아요!
9788954672009,10,고양이 육묘 관련 책을 여러 권 사보았지만 너무 부실하지도 너무 전문적이지도 않아 집사 눈높이에 딱 맞는 이상적인 책이라고 생각합니다. 특히 아기고양이를 입양한 초보집사에게는 월령에 따른 케어 요령 부분이 큰 도움이 될 것 같습니다.
9788954672009,10,고양이 육아에 대해 A부터 Z까지 알려 줍니다.
9788954672009,10,"마치 친절한 수의사 쌤에게 상담을 받고 있는 것처럼 느껴집니다. 궁금한 내용을 찾아 읽으면 갈증이 쫘악 해소되는 느낌이 너무 좋습니다. 정확히 필요한 내용만, 깊이 있게 잘 담겨있습니다. 나이에 따라 어떻게 케어하면 좋은지, 밥먹이기, 질병 관리까지 자세히 설명되어 있습니다!"
9788954672009,10,고양이를 막 기르기 시작했는데 큰 도움이 될 듯하네요. 고양이에게 관심 갖고 다른 책을 한 권 샀는데 도움이 별로 안됐어요. 다른 책은 내용이 산만하고 필요한 내용 찾기가 쉽지 않았는데 이 책은 글이 너무 단정하고 핵심을 잘 설명해주는 느낌이에요. 일러스트도 너무 예뻐서 마음에 쏙 듭니다~
9791196256401,8,동물 좋아하는 고1아이가 읽고 싶다고해서 구입했어요
9791196256401,6,처음 개 키우시는분들에게는 좋을것 같아요 고양이는 기대에 못미치네요
9791187749301,10,사람옷 전문가인 제가 여러 관련책들을 봤지만 이렇게 디테일하고 친절한 설명과 쉽게 기초부터 알려주는 책은 처음이예요. 정말 전공자가 아니신데도 기초적인 재봉법과 강아지옷 만드는 법에 대해 정말 애정을 갖고 잘 만들어진 책입니다!
9791187749301,10,중고지만 최상급품질답게 새거랑 다를게없어요. 10000원정도의가격으로 이렇게 다양한 제품을 만들수있어서 좋아요. 설명도 친절하고 옷 소품 하나하나 패턴이 들어있을줄은몰랐는데 깜짝놀랐네요. 정말추천합니다~
9791187749301,10,"멍멍이옷도 소품종류도 다양하고 너무 기대됩니다. 동영상까지 들을수 있는 해택도 있고,모르는부분은 작가님이 바로 피드백 해주실수있을 것 같아서 정말 좋은책 같아요."
9791187749301,10,기초적인 부분까지자세히설명해주고깨알 팁까지 적어놓으신 부분이 맘에 들어요또 패턴지가 옷 마다 한장씩  그려져있어 패턴옮기기 정말 수월해요
9791187749301,10,우리아이에게 꼭 만들어주고싶어요. 정말기대가되네요.
9791187749301,10,소잉도그 지금까지 넘나 잘보고 있어서 이번편도 기대되요^^! 우리애는 사이즈가 특이해서 시중에 맞는 옷이 없어서ㅠㅠ집에서 만들어입히고 있는데 소잉도그 무료패턴으로 공부했었어요~특이한 패턴도 많고 꼼꼼하게 설명해주셔서 좋았어요~이번책엔 어떤 패턴이 들어있을지 넘나 기대되네요
9791187749301,10,오오오오!!!!!! 기다리고 있었습니다!!!!! 무료패턴 때 부터 정말 감사하게 봐왔었는데 책 출간이라니!!!!! 정말 기대됩니다^^ 열심히 우리강아지 옷을 만들어보고 싶습니다!!!! 블로그만 봐도 얼마나 상세히 가르쳐 주시는지 알고있습니다~~~ 감사합니다!!!!!
9791187749301,10,"알찬 내용들이 한가득 담겨있는 보물같은 책! 저한테 꼭 필요한 책이라고 생각했는데 드디어 출판되었다니, 너무 기쁩니다~"
9791187749301,10,너무너무 기다렸어요~~~ 얼마나 알찬 내용이 있을까 너무 기대되네요~~
9791187749301,10,집에 있는 헌옷을 버리려고 모으다가 문득 아깝다는 생각이 들더라구요. 그러다가 블로그를 통해 무료도 도안도 나눠주시고 헌옷을 이용한 옷 만드는 법도 친절하게 설명되어 있어서 정말 좋더라구요. 근데 이렇게 책으로 나오다니 너무 좋네요!ㅎ
9791187749301,10,강아지키운지얼마안되는 초보다보니이것저것만들어주고팠는데  요 책이 출간된다해서완전기대하고있어요설명과 실물패턴이 있으니 얼마나 좋은지ㅋ
9791187749301,10,이책 나올때까지 엄청기다렸는데 출간한단소식듣고 바로달려왔어요 ~알찬내용에 얼른보고싶은 기대감이크네요 !
9791195500925,10,"한번 고양이를 떠나 보내고 두 번째 반려묘 들이면서 제대로 배워보자 싶어서 산 책 이미 고양이를 오래 길러보았음에도 불구하고 이제서야 이해되는 거라든가, 새로이 이해된 것들이 너무 많고 이전 고양이들에게 미안함을 느꼈음"
9791195500925,8,제목을 보면 무슨 가벼운 에세이 같지만 책을 받아보면 논문 수준입니다. 사전처럼 두고 챕터별로 읽고 있어요. 한번에 읽기는 어렵고 두고두고 찾아읽는 용으로 읽게될거같아요. 두께 만큼 세세한 내용이 많아서 좋습니다
9791195500925,10,"고양이를 키우는 사람들에게 필독서라 생각합니다. 읽으면서 내가 공부한게 맞다는 확신을 얻기도, 내가 부족했다는 사실에 미안함을 가지기도 했네요. 정말 모든 내용이 다 들어있어서 좋습니다. 잘 접하기 힘든 모든 질병들과 행동교정, 혼자 노는 방법 등등... 반드시 읽어야 합니다."
9791195500925,10,"외국의 사례를 기본으로 들어서 좀 다를 수 있지만, 고양이에 대해 전혀 모르는 저같은 사람에게는 괜찮았다고 생각듭니다. 반려동물은 많은 준비를 하시는 걸 기본으로 생각하고 있습니다 : )"
9791195500925,10,"십오년차 반려인이라 어지간한 고양이 관련 책은 시큰둥한데, 이 책은 제대로다 싶다. 세상에, 역자후기를 베로 왕자님이 썼다니. 너무나 반갑네. 그 옛날 다음 모 카페의 루이 왕자를 기억하시는지?"
9791195500925,10,"시중에 나온 고양이 관련 책을 전부 다 쏟아부운 것 같은 한 권이네요ㅎㅎ 고양이를 키운지 몇 년 넘어서 알만한 거 다 아시는 분들이 읽으면서 새롭다!싶은건 많지 않을지 모르겠지만, 그래도 관련서적 하나 구매하고 싶다 싶을 때 여러 권 사는 것 보다 이거 한권 사서 정독하는게 더 좋을 것 같아요"
9791196174484,10,"무겁지도 가볍지도 않은 가슴찡한 알찬내용!고양이말기 간호와 임종케어에 대한여러가지 조언,몰랐던 상식,생각할 부분에 대해 알려준, 반려묘를 키운다면 꼭 읽어보세요."
9791190473323,6,따스운 수의사님세상은 이런 사람들 덕분에 살만하다고 느끼겄ㅈ ㅣ동물 학대하는 스레기들 다 디졌으면 ㅜ
9791190473323,10,"응봉동 봉순이, 아니 오드리 엄마입니다. 출장가 있는 동안 기습적으로 아이들이 입양해온 오드리를 처음 만난 날이 생각나네요.  김야옹 선생님과 김부장님, 드러나지 않지만 정말 고양이, 강아지들을 사랑하고, 자기 계산 없이 거두고 돌보는 분들입니다. 이혼은 안 하실거에요~~ ㅎ 응원합니다."
9791190473323,10,김야옹 선생님의 빛나는 유머가 있는 에세이 재미있게 잘 읽었어요~~배경이 병원이라 에피소드마다 아픈 감동이 있어서 울다 웃다 했어요.또 남다르게 열심히 사는 김야옹 선생님과 김부장님~응원합니다~~^^
9788996476610,10,"나는 한 동물이 우리의 삶과 책임감 속으로 들어왔다면, 그들에게 최대한 좋은 삶을 제공해 주기 위해 우리가 가진 자원과 지성을 총동원해야 한다고 믿는다. 그 해답은(...) ‘개에 대해 충분히 배우는 것‘에 있다. (p. 384)"
9788996476610,8,"저자의 경험을 통해 반려견뿐만 아니라 사람의 행동의 원인과 그로 인해 발생할 수 있는 상황을 제시하며, 반려견을 부조건적인 애정과 사랑으로 감싸는 것에 경고를 보내기도 한다.또한, 구체적으로 행동 개선(반려견과 사람 모두에게)을 위한 방안을 제시하여 반려견과 지내고자 하면 읽어볼만 하다"
9788996476610,10,"개는 사람과 다르면서도 닮아 있다. 개를 사랑하는 사람들은 함께, 더 행복하게 살아갈 수 있도록 이것저것을 알아본다. 인터넷에 산재한 정보와 온갖 오류들을 접하기 전, 강아지를 데려오기 전, 꼭 한 번 읽길 바라는 책."
9788996476610,10,"반려동물인 강아지를 잘 이해하고, 함께하는  이상적인 삶을 살아가는데 많은 것을 알려주는 마음이 따뜻해지는 책이다."
9788996476610,8,동물과 인간의 같고 다름에 대해 배울 수 있었던 책. 나의 행동언어와 동물의 행동언어가 다름을 이 책을 통해 배웠다. 이 책을 좀 더 빨리 읽었다면 좋았을텐데.
9788996476610,10,"개와 살아볼까 고민 중인 사람, 처음 개를 맞이할 사람, 오랫동안 함께 살고 있는 사람까지 두루두루 읽으면 좋을 책. 다른 건 몰라도 양육에 있어서는 사람이나 개나 아는 게 힘이다. 무식한 게 자랑 아니다. 게으른 것도 자랑 아니다. 자신 없으면 아예 키우지 말자."
9788996476610,10,동물에 관심을 갔게 됀지 얼마 안됐지만 반려동물인 개에 대해 조금더 알아갈수있는 책인거 같다. 자신의 옆에 있는 우리집 강아지에 대해서 조금더 배려하고 알고 싶다면 이책을 읽어 보는것을 추천합니다.^^
9788996476610,10,"개를 좋아하는 사람으로써 참으로 도움이 많이 되는책, 개를 좋아하지 않더라도 읽으면 주의할수 있을듯하다. 개의 장점만이아닌 단점도 보여준다."
9788996476610,10,"개들의 언어를 이해하기위해 읽어야 할 책, 당신이 강아지를 좀더 제대로 진정으로 사랑하도록 도와주는 책, 울 강쥐와 나에게 꼭 필요한 책."
9788996476610,10,"강아지 두마리를 처음키운 초보자인내게 사랑하는 애견이  무엇을 전달하는가를 깨닫게 해주는 책이다.
난 울 아가들을 너무 모르고 있었던듯..."
9788934995456,10,"난 얼마나 우리 냥이에 대해 일고 있는가 했을 때그래도 좀 알지 않을까 했던 것은 나의 커다란 착각이다. 한 끝 발치도 모른다.건강관리법이라든가 시기별 무엇을 해야 하는지 등은 안다.근데 그 분의 꼬리와 애옹거림, 소통이라는걸 깨닫게 된다. 그리고 집사의 심리와 따스함이 전달 된다는 걸"
9788934995456,10,"#(랜선)집사 필독서 #냐옹신의 존재이유를 입증한 처녀작 #냥님의 마음을 깨알분석나샘의 첫 책에선 냥님의 다양한 몸짓언어와 소리언어를 정리하고, 수의 행동학자로서 겪은 임상사례로 문제행동에 대한 해결책을 제시하는 냥집사용 Bible이다. 전지적 냥님 시점에서 진정한 의사소통을 도와준다."
9788934995456,10,"‘잠시 고양이면 좋겠다’고 생각할 정도로 고양이 마음이 궁금하다면 꼭 읽어보세요! 자세하고 다양한 상황들(+ 귀여운 일러스트)을 통해 더 쉽고 자세하게 고양이의 마음을 해석하는 법을 배울 수 있습니다. (+ 고양이 목욕법, 화장실 관리법 등 냥이들을 만족시킬 집사 스킬도 잔뜩 얻어가세요! )"
9788934995456,10,"고양이를 키우는 사람들, 고양이를 키울 사람들, 고양이를 사랑하는 사람들은 모두 읽어봤으면 하는 책이었습니다. 따분한 설명문일거란 제 예상이 완전히 빗겨나갔어요."
9788934995456,10,냥신티비 구독자이며  윤파랑작가님의   팬입니다.  좋아하는   두분이  함께   책을   만들어내셨으니  엄청  기대되고  설렘가득합니다.  좋아하는  알라딘에서  꼭  사볼께요  ^^
9791158462802,10,"고양이와 함께하면 함께할수록 계속 공부해야겠다는 생각이 들어요. 김명철 선생님 유튜브 정말 열심히 보고 있는데, 책도 머리맡에 두고 열심히 공부하겠습니다! 냥이도 집사도 모두 행복한 삶을 위해!!"
