ISBN13,rating,review
9791136004246,10,최신기출문제를 잘반영한 에듀윌 한국사능력검정시험 기본서!! 이거하나면 시험적중률 기대해볼수있을것 같아요♡ 한국사에 기초도 안잡혀있지만 이책을 받자마자 마음이 든든해졌어요. 에듀윌 공식계정에서 시험에 대해 이것저것 알려주기도 해서 즐겨찾고 있답니다.
9791136004246,10,"이론정리도 아주 깔끔하게 잘 되어 있고 오류나, 오타도 거의 없으며,  동형모의고사도 3회분이나, 무료인강도 줘서 독학으로 공부하기 아주 적합!"
9791136004246,10,이론편과 문제편으로 구분되어 차근차근 공부하기에 좋은 책이에요! 함께 온 동형모의고사 문제지가 실제 시험 유형과 난이도를 반영해서 시험 전 대비하기 유용합니다. 에듀윌 특유의 깔끔하고 가독성 좋은 디자인과 탄탄한 퀄리티로 공부하는 데 정말 도움이 많이 되는 책입니다!
9791136004246,10,이 책은 중요한 내용들에 줄이 쳐져 있어서 읽어보기 쉽고 맨 앞장에 한국사에 관한 간단한 정리를 합친 표가 있더라고요 공부를 하기전 이 표를 읽으면 좋을 것 같습니다! 또한 모의고사 용지도 있어서 시험 공부하는데 있어 수월합니다!
9791136004246,10,평상시 한국사에 흥미가 없고 못하는 편인데다가 시험 개편으로 인하여 걱정이 많았습니다ㅠㅠ 지인 추천으로 에듀월 교재를 구매하였습니다! 책이 아주 깔끔하고 중요부분은 형광펜칠 되어있어서 너무 좋았습니다. 게다가 최신 기출 유형이 잘 반영되어있어서 한능검 따기 최적화된 책인 것 같습니다!
9791136004246,10,시험까지 시간이 얼마 남지 않으신 분들께 추천하고 싶어요. 정말 알차고 탄탄한 구성을 자랑합니다!
9791136004246,10,고득점에 최적화된 교재로 고득점 합격할 수 있을것 같아요:) 모의고사와 다양한 기출문제가 수록되어있어서 꼼꼼히 준비하고 시험칠 수 있겠어요!! 문제집만 사도 동영상강의를 들을 수 있어서 좋아요.
9791136004246,10,급수 바뀌기 전에도 시험에 한번 응시했었는데 난이도가 높아지고 생소한 선지들때문에시험에 한번 떨어지고 어떡하나 했는데 이책이 개편된 한국사 내용이 잘 반영되어있구오타도 적고 좋다고해서 구매했어용 최신기출도 많이 실려있어서 아주 좋습니당!!
9791136004246,10,"최신 기출 유형이 반영되어있어서 실제 시험을 대비하기에 좋은퀄리티를 가지고 있는 것 같아요 한국사 자격증을 준비하기에 이론, 기출, 그리고 모의고사까지 한권이면 가능할 정도로 많은 것을 담고 있어 공부하는데 유용합니다"
9791136004246,10,이번에 한국사 시험이 개편되었다고해서 80점 이상 고득점에 대한 걱정이 많아서 에듀윌 책으로 구입했습니다. 실제 시험과 유사한 유형과 난이도로 구성되어서 이번 시험을 준비하기에 제격이라고 생각합니다!
9791136004246,10,한국사능력검정시험이 개편되었다는 소식을 듣고 어떤 문제집을 사야할까 고민이 많았는데요! 에듀윌이 최신 기출유형은 물론이고 올라간 커트라인 까지 충족할 수 있도록 좋은 구성으로 문제집을 만든 것 같아서 구매하였습니다. 이 한권이면 충분히 합격할 수 있을 것 같아서 추천드립니다
9791136004246,10,새로 개편된 급수 체계에 맞는 교재에요. 이론편 학습과 동시에 문제편 학습을 통해 이전 기출들에도 익숙해지고 바로바로 해설 확인을 통해 개념정리가 용이합니다. 개념과 기출의 밸런스를 잘 잡아주는 문제집이에요!
9791136004246,10,"2020년도 5월 부터 한국사 시험이 개편되었다는 소식에 걱정이 되었는데, 에듀윌 기본서 하나로 충분하게 공부 할 수 있을 것 같습니다! 최신 기출유형이 반영되어 있어서 실제 시험과 비슷한 느낌을 받을 수 있고, 이론편, 문제편으로 나뉘어서 이론을 공부하고 빠르게 문제로 습득할 수 있습니다."
9791136004246,10,"한국사 급수가 개편되고 에듀윌 책을 접하게 되었는데, 구성자체가 알차고 좋네요 ! 최신기출문제까지 첨부되어 있어서, 걱정없이 미리 풀어보고 접해볼 수 있겠더라구요 ! 실제시험과 유사한 유형과 난이도를 알려줘서 더 안심되면서 풀게 되구, 퀄리티도 대단한것 같아요 ㅎㅎ 정말 강추 강추입니다!"
9791136004246,10,개념이 깔끔하게 정리 되어 있고 최신 기출 바로 복습이 되니까 실력향상에 도움이 됩니다! 잘 쓰고 있는 책이에요
9791136004246,10,이번 한국사 시험이 새로 개편되어서 어느 문제집으로 공부해야 할지 망설여졌었는데 에듀윌이 최신 기출 유형도 반영되어 있고 시험과 가장 가까운 유형이라고 해서 선택했습니다!
9791136004246,10,이번에 신 급수 체계 개편 되었는데 시험 대비 가장 믿을만한 책인 것 같습니다.에듀윌은 타사 책 대비 오타율도 적다는 얘기를 들어서 더욱 신뢰감에 구매했습니다.최신 기출유형으로 만들어져서 더욱 전략적으로 공부하기 좋을 것 같습니다 !!!
9791136004246,10,최신 기출 유형 반영과 함께 좋은 퀄리티의 책입니다. 한국사 자격증을 준비할 때 이 한 권만으로도 충분한 책입니다.
9791136004246,10,최신 기출유형과 개편 내용이 반영된 고득점 한국사 교과서네요 >< !! 실제 시험과 유사한 유형의 동형 모의고사 문제지도 함께 포함되어 있어 에듀윌과 함께라면 이번 한국사 시험 합격할 수 있을거 같아요 :)흐름 잡는 한국사 연표 까지 간단하게 나와 있어 쉽게 암기할 수 있을거 같아요 ><
9791136004499,10,한국사 독학교재 선택에 있어 고민하시는 분들! 에듀윌교재 선택하세요:) 무료인강까지 제공해줘서 독학으로 하기에도 큰 무리가 없어요!
9791136004499,10,"깔끔하고 좋아요. 엔드노트 포함으로 보기에도 좋고, 책도 딱 꽉꽉 실속채워놓은 듯한 느낌이 들어요. 마지막 실속모의고사 등으로 현재 트렌드도 알 수 있을 것 같아요. 실제 시험이랑 비슷한 유형 분석, 난이도 분석을 한 것 같은? 값을 하는 느낌. 실속있는 구성이라 후회 없을 것 같아요."
9791136004499,10,한국사 초보분들이 한능검 준비하기에 딱 맞는 책!
9791136004499,10,우리 아이 한능검 준비를 최신기출유형을 반영하고 부록으로 엔드노트도 있는 ‘에듀윌 2주끝장 기본‘으로 결정했습니다. 알찬구성이라 후회하지 않을 선택이 될 것 같아요^^
9791136004499,10,"한능검 어떻게 준비해야될지 모르겠고, 이 책을 살지말지 고민하시는 여러분들! 이 책은 정말 후회안할 정도로 한능검 준비하기 좋은 책입니다ㅠㅠ"
9791136004499,10,개편되는 한국사능력검정시험을 어떻게 공부하면 좋을까 고민이 많았는데 최신 기출 유형문제를 반영하고 핵심 포인트를 알려주니 믿고 학습할 수 있어요.
9791136004499,10,"어떤 수험서를 택하여야할지, 어떤 방식으로 공부해야할지. 최신 기출 유형의 반영과 실제 시험과 유사한 유형 및 난이도로 구성된 에듀윌 한국사검정시험 2주 끝장! 만족합니다!"
9788954725125,6,흑백이라 놀랬어요...다른분들 말씀대로 믿고 강의랑 같이 봐야겠어요..분철 좋아요 ㅎㅎㅎ
9788954725125,10,역사 공부하기 좋은 교재 입니다. 강의 들으며 하기 좋아요 강추합니다.
9788954725125,8,내용을 한페이지라도 미리 보여줬으면 좋겠습니다. 설마 책이 가로로 출력돼서 세로로 넘기는 책일거라곤 생각도 못했네요... 그랬으면 스프링분철 신청했을텐데 말이죠...
9788954725125,10,분철해서 배송받았음 그래서 책 넘기는데 불편함은 없었다여긴 문제가 없다. 그러니까... 기출 문제집처럼 문제 나오고 번호 고르는 그런게 없음 빈칸 채워넣고 개념 정의 영향 이런거 적혀있는 책이다. 난 이거랑 다른 문제집 같이 사서 공부함!
9788954725125,10,역시 역사는 너무 어렵네요. 시험결과는 불합격이지만 다음에는 할수있을거 같아요 ㅅㄱ
9788954725125,10,공부를 하는데 무난한 교재입니다.
9788954725125,10,이렇게 좋은 책이 만원밖에 안하다니..믿을 수가 없어요! 스프링 제본도 같이 신청했는데 책 읽기 너무 편하고 좋습니다^-^
9788954725125,10,매우 만족
9788954725125,10,아침에 주문해서 오후에 받으니 너무 좋아요 출근해서 주문해서 퇴근후 책도착너무 너무 좋네요
9788954725125,10,분철했으면 참 좋았을 거 같은 책.처음 받기 전 평범한 책 생각했는데 '강의노트'라고 적힌 걸 다시 한번 봤어야 했다... ㅋㅋ 가로로 보아야 하는 그냥 필기용 책. 개인적으로 알라딘 쪽에서 분철 지원해줬으면 정말 좋았을 거 같다... 뭔가 책 보기가 불편하다 ㅠㅠ
9788954725125,10,"개념도 보기 좋게 정리되어 있고, 자신이 스스로 정리할 수 있는 부분도 있어서 공부하기가 편리하다."
9788954725125,10,강의가 너무 좋아 책까지 구입하게 됐어요
9788954725125,10,"한국사능령검정시험을 위해서 구매함 교재인데, EBS중학에서 최태성쌤 강의를 무료를 들으면서 열심히 공부하고 있습니다. 한국사를 처음접하시더라도 이 교재와 강의 하나면 완전 정복할듯 싶습니다. 감사합니다."
9788954725125,10,큰별쌤의 완벽 노트 정리! 덕분에 한국사 검정시험 잘봤습니다. 중급에서 고급까지 선생님만 믿고 달리겠습니다!!!!
9788954725125,10,최태성샘 강의들으면서  올해 첫 시험을 보고 결과 또한 좋아서  기분이 좋아요...5월에는 고급1급을 향해 고고고~~~고급도 최샘의 강의를 들으며 준비하려합니다^^
9788954725125,8,보통 교재는 설명만 씌여있는 게 많은데 이 교재는 자기가 스스로 내용을 정리하게끔 되어있어서 복습효과가 좋은 것 같아요.
9788954725125,10,추천받아서 친구것까지 2권구입
9788954725125,10,강의도 좋고 다 좋네요!한국사 준비하는데 도움 많이될것같네요
9788954725125,6,"페이지 방향이 넓게 설정돼 있어서 필기하는 데 좀 어렵고,사료 정리하는 부분이 좀 더 깔금하고 보기 좋게 정리되었으면 좋았을 듯."
9788954725125,10,내가 쓴 강의 판서로는 못 보겠다는 분께 추천합니다!!
9788954725125,10,한국사 능력시험을 준비하는 사람에게 필수!! 최태성 선생님의 강의와 이 책과 함께라면 단번에 붙을 거라는 자신감이 들어요 ㅎㅎ
9788954725125,10,시험 준비하시는 분들 모두 좋은 결과 있으시길 바라요~!
9788954725125,10,3급 합격을 기원하며 100자 평을 남깁니다.임용고사 준비하는 분들 화이팅입니다!
9788954725125,10,정리기법이 정말 효과적이라고 생각합니다. 인강 판서 그래도 옮겨놓으셔서 솔직히 별로일거라고 생각했는데 정말 머릿속에 잘 들어와서 시험도 가뿐히 통과했습니다:) 인강들으면서 복습 꾸준히 하시면 시험은 문제 없을거라고 생각합니다
9788954725125,10,역시 최태성선생님이십니다. 아들이 EBS 강의를 들으며 독학했는데 빨리 3급 따기 좋다고 합니다. 강의를 듣고 기록할 공간이 있어 정말 좋았습니다.
9788954725125,10,"ebs동영상강의와 더불어 기출문제까지,,, 한국사능력검정시험대비에 아주 좋은 교재입니다.........."
9788954725125,10,괜찮네요 ㅋㅋㅋㅋㅋ
9788954725125,10,EBS 강의 판서를 그대로 옮겨 놓은 책입니다. 강의들으면서 공부하는데 딱입니다. 다만 강의를 듣지 않고 책으로만 자격시험 준비하기에는 다소 무리가 있습니다. 꼭 강의를 들으며 공부하셔야합니다. 다른 구매자분들이 말씀하셨 듯 사진이 흑백이란 점이 아쉽지만 가격으로 본다면 만족합니다.
9788954725125,10,강의들으며 필기하려고 샀는데 내용도 너무 깨끗하고 좋은거 같아요 강추 @.@
9788954725125,8,"요점정리에는 딱입니다.
필기싫어하시는 분들에겐 안성마춤 ㅎ"
9788954725125,8,"한국사 검정능력 자격증 따기 위해 책 주문합니다.하자 없는 놈으로 빠른 배송 부탁합니다^^
사진 선명하게 잘 보이는 걸로 검수해서 보내주셔요!!!!!!!!!!!"
9788954725125,10,합격으로 이 책을 보증합니다. 전 3급 합격!^^
9788954725125,8,"ㅋㅋ 정말 판서내용 그래로 적혀있고, 사진이 잘 보이는게 있다는게 흠이긴 하지만, 강의 완강하고 중급합격했어요."
9788954725125,6,도움이 많이 되고 있습니다.
9788954725125,10,최태성 선생님 덕분에 한국사에 대한 즐거움을 느끼게 되네요.
9788954725125,6,사진이 흑백으로 크게 되어 있으며 최태성선생님 강의 들으며 이용하기에 편리하게 되어 있다.
9788954725125,8,책 사실 분은 이 책이 강의노트라는 점에 유의하셔야. 그냥 내용 쭉 정리된 일반학습서 생각하면 열어 보고 당황하심. TV채널 돌리다 우연히 강의 보고 반해서 책 샀는데 선생님 판서하신 게 그대로 있어서 좋았음.
9788954725125,10,최태성 선생님의 수업을 위해 필요한 강의노트
9788954725125,10,"한국사 3급 따려고 샀는데 인강과 같이 듣기에는 좋아요
근데 혼자 공부하기에는 내용이 부족한 것 같아요"
9788954725125,10,우연히 알게된 최태성 선생님 강의! 사막에서 찾은 보석 같습니다. 큰별샘과 함께 열심히 공부하고 싶어요.
9788954725125,10,임용고사 필수! 이 강의로 올인!
9788954725125,10,ebs강의 판서내용을 그대로 책으로 엮어서 요점 중심으로 공부하기 좋습니다. 단... 강의와 함께 공부하심 가장 효과적일 듯 싶습니다.
9788954725125,6,"중급은 중학생용 고급은 고등학생용이라고 써있어서 한권은 반품신청했어요. ㅠ.ㅠ 
한명은 이제중1이 되고요. 한명은 고2가 되는데 잘몰라서 중급 두개주문했다가 낭패를 봤네요 문제는 없고 설명만 듣는 거에요"
9788954725125,10,학교에서 권장하는 자격증 중 하나여서 구매합니다.
9788954725125,10,임용에 필수^^ 한권 추가요
9788954725125,10,책 구성이 이상해 보였지만 일단 강의가 너무 좋구요 책구성은 강의내용에 맞게 만들어진거네요^^
9788954725125,10,판서내용 외에도 다양한 자료나 표가 수록되어 있어서 좋아요
9788954725125,10,최태성 선생님 믿고 구매했는데 책 좋네요 ㅎㅎ
9791165760380,10,정리가 깔끔하게 잘되어있어요~
9791165210939,10,설명도 풍부하고 편집도 보기 편하고 좋다 단점은 책이 무거움 재질이... 이 가격에 이 책이 옳은가 싶을 정도
9791165210939,10,중요한 핵심 점들에는 형광펜과 빨간 굵은 글씨가 있어서 제가 따로 표기할 필요가 없었다는 점이 너무 좋았습니다.
9791165210939,10,"이해하기 쉽도록 교과서식으로 서술되어 있고, 형광펜과 빨간펜으로 중요한 내용을 볼 수 있어서 좋아요! 특히 부록도 있어서 들고 다니면서 보기도 정말 좋아서 독학으로 시작하는 분들께 강추합니다. 한국사 책이 많아서 고민되시는 분들은 시나공 찰떡이해 추천이요!"
9791165210939,10,"구성이 정말 탄탄해요! 흐름 공부에 용이한 도표, 전문가의 정리, 빈출 키워드 까지!중요한 부분에는 형광페 ㄴ밑줄표시와 ㅏ빨간펜으로 키워드 강조까지 되어 있어서 좋아요!그 무엇보다 한국사 개념 채우기에는 딱인 책으로 추천합니다!"
9791165210939,10,"중요한 부분마다 형광펜으로 칠해져있고, 빨간 글자로 되어있어서 어느 부분이 중요한지 한번에 들어와요! 개인적으로 독학하기 좋은 최고의 교재라고 생각합니다:) 찰떡이해와 함께 합격 기대해보려구요!!"
9791165210939,10,"한 달 앞으로 다가온 한능검 시험 시나공 찰떡이해로 준비하고 있는데요~!저같은 프로 벼락치기러가 미루지 않고 공부할 수 있도록계획표가 있어 그에 따라 차근차근 공부가 가능합니다ㅎ이해하기 쉽게 설명도 되어있고, 기출도 같이 풀어볼 수 있어서 개념정리에 도움이 될 것 같아요"
9791165210939,10,"한국사 언제 공부하지 고민하다가 친구한테 추천받아서 공부중이에요.술술 읽기 쉽고 표, 그림으로 자료가 잘 정리되어 있어서 좋았어요. 요즘 자격증책이 이렇게 잘 나오는구나 라고 감탄하게 될 정도 ㅋㅋ 꼼꼼하게 빈출 키워드, 요약본 부록도 같이 있어서 활용도 높구요!! 역시 시나공!!"
9791165210939,10,한국사시험을 준비하기에 가장 적합한 책입니다!! 중요한 부분들은 밑줄과 색으로 구분되어 있어서 공부하기 편해요! 부록도 알차서 한 번에 책 세개를 받은 것 같아요! 부록으로 들어있는 그림연표가 빨리 연도를 알기도 편하고 평상시에 보기에도 좋아요!
9791165210939,10,중요한 부분을 빨간색과 형광펜으로 표시를 해둬서 한 눈에 보기도 좋았고 개념 공부 하자마자 기출 문제도 풀어볼 수 잇는 점이 좋습니다!  한 권으로 기본기 다지면서 공부하기 딱 좋은 책이라고 생각합니다.
9791165210939,10,"1. 따로 필기할 필요없이 깔끔한 정리 & 형광펜, 빨간펜으로 중요한것 딱딱 집어줌2. 책 맨 앞에 연도표가 한눈에 정리되어있어서 너무 좋음3. 출제자 한방정리 부록책으로 솔직히 이거만 봐도 고급1급 합격 가능할것같음4. 시험장에 가져갈 빈출키워드, 선택지 부록책이 있어서 너무 좋음"
9791165210939,10,"교재가 일단 커서 맘에 들었고, 분철이 되어서 필요한 내용만 학습이 가능해서 더욱 좋았습니다.한방에 훅~ 합격 기대합니다.https://blog.naver.com/jungminleee/221977767547"
9791165210939,10,"중요한 부분에 하이라이트 표시를 해둬서 가독성이 좋았고, 개념 외 관련된 기출문제까지 풀어볼 수 있었어요! 표와 그림으로 핵심 부분을 다루고 있는 부록도 있어 이동하며 공부하기도 적합했던 것 같습니다. 한 권으로 기본기를 다지면서 부담감 없이 공부하기에 더할 나위 없는 책인 것 같습니다:)"
9791189001414,10,깔끔하고 읽기 편해서 좋네요
9791165210946,10,셤이 4일 남았네요 마지막 정리용으로 풀어 봤는데 그닥 어려운 문제는 없는듯요~실전도 이정도 수준에서 나오믄 좋으련만~~^^
9791197055393,10,좋아요!
9791189001377,10,"모의고사 3회 37번에는 오류가 없습니다. 대한매일신보와 황성신문에는 모두 시일야방성대곡이 게재되었습니다. 2017년 수능 한국사 시험에서 복수 정답으로 인정된, 따끈한 함정이 포함된 문제입니다. 전 이거 풀고 47회 시험에서 1급 땄는데 큰 도움 되었습니다."
9791189001377,2,기출문제만 있는 것이 아니라 문제를 만든것 같다는 느낌이 드는데 정답해설이 없어서 불편하네요~3회 모의고사 37번 문제 설명은 대한매일신보인데 답은 황성신문이네요~너무 황당!!! 이거 아무리봐도 답이 없는 문제 같아요
9791125487067,4,시대사로 구성한 취지는 좋지만 분량이 부족하고 코팅지라 펜이나 샤프를 놀리기 불편하다.
9791165211936,10,그동안 유명하다는 한국사 책은 다 사봤는데 정말로 시나공만큼 완벽한 책은 없어요..공무원 한국사에도 최적화 되어 있다고 생각해용갓갓 시나공!!!꼭 사세요!!!!! 내용도 알차고 문제풀이 유형도 정확합니당이걸로 모두 1급 따용~~~다들 합격기원!!!! 시나공으로 합격 가즈아~~~
9791165211936,10,"2주 단기로 심화1급을 목표로 하고 있는데 학습일정표도 15일별로 맞추어져 있어 단기공부에 적합한 책인 것 같아요. 특히나 별책 부록이 4개라 문화사, 주제사, 사료,키워드 관계북을 반복적으로 학습할 수 있어 좋네요. 무엇보다 미니백에 쏙 들어가서 만족합니다!"
9791165211936,10,핵심 내용으로만 구성된 올킬암기! 진짜 추천해요 단기적으로 준비하시는 분들께 최적화 됐다고 생각합니다 빠른 키워드 학습으로 시험에 나오는 것들로만 구성돼있어서 공부하기에 더 수월했던 것 같아요! 또 인물사 문화사 주제사 등 사료모음집이 많은 도움이 됐습니다!
9791129706058,10,"﻿이 책은 분석과 해설, 그리고 실력폭발 정답 선지 zip 등이 함께 부록이 실려 있어 실제 기출 위주로 공부할 수 있는 점이 장점이었습니다. ﻿책 구성은 목차, 제목, 그리고 핵심 포인트, 그리고 각 단원별 기출문제 2개로 되어 있는 등 훌륭한 책입니다."
9791163711667,10,전한길 한능검 필기노트 기대되네요 2주안에 끝낼수 있도록 압축정리된 교재 기대됩니다 ^^
9788994874975,10,자세하고 친절한 기출문제해설&강의 총 1만5천원??! ^^***
9788994874975,10,기출해설강의를 무료로 볼수있네요. 감사!
9788994874975,10,최신 기출문제와 알찬요약해설이 감동입니다. 황의방 기출문제집 한권이면 끝!
9788994874975,10,최신기출로 구성되어있고 무료강의까지 제공되고 있네요. 교재비 1만7천원이면 고급 합격이라니.. 고맙습니다. ^^
9791159703461,10,"제가 인터넷강의도 책없이 봐서 걱정했는데 책에 주제별로 순서대로 문제들이 있고 마지막에 기출1,2회강을 풀면서 정리할 수 있어 좋았어요 특히 문화파트가 잘 정리가 안되는데 마지막에 부록도 있어서 도움이 되었습니다. 이번 시험봤었는데 매겨보니 89점이라 기뻐요"
9788950964276,10,고종훈 선생님 특유의 간략하면서도 쏙쏙 들어오는 정리가 참으로 좋습니다. 확실히 오래 해먹은 사람은 뭔가 다른게 있긴 한가봅니다.
9788954736138,10,"제 사촌동생이 이 시험 준비 중이라고 해서, 뭔가 도움을 줄 게 없을까 하는 마음으로 교재 찾아보고 있었는데, 이 책이 눈에 띄네요. 부디 동생에게 도움이 되었으면 그리고 좀 더 욕심부리면 좋은 결과 나왔으면 하는 바람으로 선택해봅니다. ㅎ"
9788954736138,10,ebs교재는 여느 교재와는 차별화된 정가로 수요자들의 앎에 대한 욕구를 충족해줍니다. 고대에서부터 현대에 이르는 방대한 분량의 역사적 사건을 인과적 구성에 담아 주제별 학습을 돕는 한국사 검증 시험 대비서입니다. 한국사 시험 필수로 한국사 공부에 대한 열의에 부합하는 핵심서로 반복해요.
9788954736138,10,역시 ebs입니다.
9788954736138,10,기출 문제들이 단원별로 정리되어 각 단원에서 어떤 형태의 문제가 나오는지 파악하기 쉬워요. 더구나 EBS에서 만든 거니까 다른 교재보다 더 믿음이 가네요.
9788954736138,10,"깔끔하게 정리돼 있고, 우선 신뢰가 가니깐 참 좋네요~"
9788954736138,10,구성이 참보기 좋게 잘되어있네요.  중간중간 정리도 잘되어있어서 공부할때 도움 많이 되네요.  효과적으로 공부하기 좋은 책같아요.  추천합니다.
9791186385036,8,요약 정리가 깔끔하게 되어 있고사료가 많아서 눈에 잘 들어와요한달동안 준비하도록 짜여져 있고동영상 강의도 볼 수 있어서전 정말 좋았어요
9791186385036,10,"책 정리가 깔끔하고, 온라인 상세결과표랑 대기업 역사 기출문제 분석 좋네요 ㅋㅋ 만족합니다!!"
9788965820666,6,연도가 틀린게 있고 p.299쪽 문제 4번 답이 4번으로 되어 있으나 문제 해설로는 2번이 정답이다. 또한 p.304쪽 15번문제의 답과 해설도 이상하다. 오류가 눈에 보여 다음 출간시에는 수정했으면 좋겠네요
9788965820666,6,연도가 틀린 것도 있고 고쳐야 할게 몇가지 있긴하지만 다른 책에서 공부하다가 제도가 언제 때인지 기억이 안난다면 보기에 정말 좋다
9788965820666,10,큰아이가 고등학교에 들어가서 첫시험을 본후...역사의 중요성을 새삼알게되었답니다생전처음맞아보는 점수를 받고 허탈함과함께...나라의 역사를 이렇게 모를수가있나 싶은 마음에 속이 많이 상했었는데...읽힌다고
9788965820666,10,하반기 취업 시작이네요.. 이번엔 역사 정치 등 인문학 문제 비율이 높다고 하는데.. 얼른 준비해서 봐야겠어요^^ 이책 하나로 만사 오케이네요!! 최근 기출 문제까지!!!! 역사어려워하는 저에게 딱입니다 !
